videoid,contentUrl,duration,page_dir,name
1006850083,https://ak.picdn.net/shutterstock/videos/1006850083/preview/stock-footage-abstract-car-trails-k-time-lapse-footage.mp4,PT00H00M10S,064151_064200,Abstract car trails 4k time lapse footage
1031169287,https://ak.picdn.net/shutterstock/videos/1031169287/preview/stock-footage-river-gard-in-collias-france-the-gorges-du-gardon-are-very-popular-with-tourists-who.mp4,PT00H00M27S,068251_068300,River gard in collias.france. 06/16/2015. the gorges du gardon are very popular with tourists who canoe and swim.
1028475674,https://ak.picdn.net/shutterstock/videos/1028475674/preview/stock-footage-beach-as-a-background-from-top-view-turquoise-water-background-from-top-view-summer-seascape-from.mp4,PT00H00M25S,007601_007650,"Beach as a background from top view. turquoise water background from top view. summer seascape from air. bali island, indonesia. travel - image"
1021236487,https://ak.picdn.net/shutterstock/videos/1021236487/preview/stock-footage-commercial-plane-arrives-to-cincinnati-united-states-d-animation.mp4,PT00H00M05S,094051_094100,"Commercial plane arrives to cincinnati, united states, 3d animation"
1039601621,https://ak.picdn.net/shutterstock/videos/1039601621/preview/stock-footage-new-york-city-circa-october-a-wide-evening-personal-perspective-profile-view-walking.mp4,PT00H00M13S,033251_033300,"New york city - circa october, 2019 - a wide evening personal perspective profile view walking across the street at times square in midtown manhattan.  	"
1039453391,https://ak.picdn.net/shutterstock/videos/1039453391/preview/stock-footage-aerial-shot-of-kuugaarmiut-glacier-national-park-in-south-east-greenland-august.mp4,PT00H00M14S,063201_063250,"Aerial shot of kuugaarmiut glacier, national park in south east greenland. august, 2019."
6085874,https://ak.picdn.net/shutterstock/videos/6085874/preview/stock-footage--american-dollar-bills-currency-money-background.mp4,PT00H00M10S,043401_043450, american dollar bills currency money background
1022868628,https://ak.picdn.net/shutterstock/videos/1022868628/preview/stock-footage-ekaterinburg-russia-june-the-ekaterinburg-arena-stadium-match-of-the-fifa-world-cup.mp4,PT00H00M05S,091751_091800,"Ekaterinburg, russia / june 27, 2018: the ekaterinburg arena stadium, match of the fifa world cup 2018 mexico - sweden. mexican supporters cheers his national team inside of the stadium."
1008638674,https://ak.picdn.net/shutterstock/videos/1008638674/preview/stock-footage-kelantan-malaysia-february-a-vessel-standing-by-in-position-to-tow-the-jack-up.mp4,PT00H00M51S,195201_195250,"Kelantan, malaysia - february 15, 2018: a vessel standing by in position to tow the jack-up drilling rig as preparation for a move to new location."
17099695,https://ak.picdn.net/shutterstock/videos/17099695/preview/stock-footage--k-work-or-relationship-problems-serious-casual-man-at-home-grows-irritated-by-a-conversation-he.mp4,PT00H00M11S,069501_069550,"4k work or relationship problems - serious casual man at home, grows irritated by a conversation he's having on his mobile phone"
1010964842,https://ak.picdn.net/shutterstock/videos/1010964842/preview/stock-footage-tropical-sunset-the-sun-sets-over-the-ocean-the-sea-waves-in-the-evening-light-sandy-beach-in.mp4,PT00H00M29S,176351_176400,"Tropical sunset. the sun sets over the ocean, the sea waves in the evening light, sandy beach in evening"
1056030734,https://ak.picdn.net/shutterstock/videos/1056030734/preview/stock-footage-aerial-view-flying-over-stunning-icebergs-floating-in-jokulsarlon-lagoon-romantic-natural.mp4,PT00H00M13S,054901_054950,"Aerial view flying over stunning icebergs floating in jokulsarlon lagoon, romantic natural landscape and powerful message of climate change, iceland top down view of glacier icebergs floating in water"
15455302,https://ak.picdn.net/shutterstock/videos/15455302/preview/stock-footage-helicopter-flying-over-night-city-graded.mp4,PT00H00M07S,001851_001900,"Helicopter flying over night city (graded)
"
182407,https://ak.picdn.net/shutterstock/videos/182407/preview/stock-footage-footage-of-a-spot-light-in-a-path.mp4,PT00H00M11S,175001_175050,Footage of  a spot light in a path
1030681388,https://ak.picdn.net/shutterstock/videos/1030681388/preview/stock-footage-chilean-vulture-sitting-on-a-rock-drying-itself-this-clip-is-available-in-different-gradings.mp4,PT00H00M30S,022801_022850,"Chilean vulture sitting on a rock, drying itself. this clip is available in different gradings - this is the cine grade."
1045473235,https://ak.picdn.net/shutterstock/videos/1045473235/preview/stock-footage-animation-of-the-words-be-mine-written-in-white-with-pink-floral-decoration-on-black-background.mp4,PT00H00M10S,021601_021650,Animation of the words be mine written in white with pink floral decoration on black background
1010531315,https://ak.picdn.net/shutterstock/videos/1010531315/preview/stock-footage-red-cat-plays-hunting-with-mouse-in-nature-and-hits-her-by-paw-wildlife-outdoors.mp4,PT00H00M16S,086751_086800,"Red cat plays (hunting) with mouse in nature and hits her by paw, wildlife outdoors"
1039706090,https://ak.picdn.net/shutterstock/videos/1039706090/preview/stock-footage--copy-space-guide-a-woman-suit-ponytail.mp4,PT00H00M21S,120601_120650,[copy space guide a] woman suit ponytail
29383447,https://ak.picdn.net/shutterstock/videos/29383447/preview/stock-footage-modern-city-skyscrapers-of-nanjing-with-rippling-water-of-xuanwu-lake-in-the-foreground-nanjing.mp4,PT00H00M29S,033551_033600,"Modern city skyscrapers of nanjing with rippling water of xuanwu lake in the foreground. nanjing, china.
"
13090214,https://ak.picdn.net/shutterstock/videos/13090214/preview/stock-footage-footage-flashing-lights-glare-colorful-spots.mp4,PT00H00M15S,076951_077000,"Footage, flashing lights, glare, colorful spots"
1027412780,https://ak.picdn.net/shutterstock/videos/1027412780/preview/stock-footage-dreamy-colorful-background-vintage-mood-shining-bokeh-stylish-light-particles-different-colors.mp4,PT00H00M11S,075801_075850,"Dreamy colorful background, vintage mood, shining bokeh, stylish light particles. different colors and shapes."
2377598,https://ak.picdn.net/shutterstock/videos/2377598/preview/stock-footage-homeless-cat.mp4,PT00H00M17S,012801_012850,Homeless cat
1054028285,https://ak.picdn.net/shutterstock/videos/1054028285/preview/stock-footage-evergreen-high-trees-on-cloudy-sky-background-stock-footage-natural-landscape-of-coniferous-trees.mp4,PT00H00M06S,144401_144450,Evergreen high trees on cloudy sky background. stock footage. natural landscape of coniferous trees at the edge of a spring forest in a summertime.
10383848,https://ak.picdn.net/shutterstock/videos/10383848/preview/stock-footage-medical-prescriptions-pharmacist-on-background.mp4,PT00H00M07S,010951_011000,"Medical prescriptions, pharmacist on background."
1044475327,https://ak.picdn.net/shutterstock/videos/1044475327/preview/stock-footage-view-from-below-as-the-hand-throws-small-multi-colored-colored-plastic-balls-white-background.mp4,PT00H00M06S,119051_119100,View from below as the hand throws small multi-colored colored plastic balls. white background. indoors.
21683884,https://ak.picdn.net/shutterstock/videos/21683884/preview/stock-footage--k-video-a-stunning-niagara-falls-and-a-rainbow-bottom-view-falling-water-weight-raises-a-lot-of.mp4,PT00H00M21S,039851_039900,4k video: a stunning niagara falls and a rainbow. bottom view. falling water weight raises a lot of spray and mist
34103905,https://ak.picdn.net/shutterstock/videos/34103905/preview/stock-footage-going-the-extra-mile-hurdles-further-jumping-more-distance-d-animation.mp4,PT00H00M10S,119001_119050,Going the extra mile hurdles further jumping more distance 3d animation
1046952652,https://ak.picdn.net/shutterstock/videos/1046952652/preview/stock-footage-el-capitan-in-the-morning-yosemite-valley-california-usa-time-lapse.mp4,PT00H00M11S,000901_000950,"El capitan in the morning. yosemite valley. california, usa. time lapse"
27769015,https://ak.picdn.net/shutterstock/videos/27769015/preview/stock-footage-japanese-rice-sticks-on-a-grill.mp4,PT00H00M07S,062751_062800,Japanese rice sticks on a grill
24950753,https://ak.picdn.net/shutterstock/videos/24950753/preview/stock-footage-attractive-thoughtful-young-woman-doing-poses-of-aerial-yoga-using-hammock.mp4,PT00H00M15S,036151_036200,Attractive thoughtful young woman doing poses of aerial yoga using hammock
1044276754,https://ak.picdn.net/shutterstock/videos/1044276754/preview/stock-footage-young-farmer-sits-among-vegetable-beds-and-inspects-freshly-harvested-beet-crop-farmer-harvest-bio.mp4,PT00H00M23S,177151_177200,Young farmer sits among vegetable beds and inspects freshly harvested beet crop. farmer harvest bio veggie in local organic garden. sustainable food.
1044387487,https://ak.picdn.net/shutterstock/videos/1044387487/preview/stock-footage-kelingking-beach-on-nusa-penida-island-bali-indonesia.mp4,PT00H00M09S,023001_023050,"Kelingking beach on nusa penida island, bali, indonesia"
1009238723,https://ak.picdn.net/shutterstock/videos/1009238723/preview/stock-footage--s-cattle-run-and-graze-in-hilly-terrain-girl-leans-from-car-and-points-at-street-sign-girl.mp4,PT00H00M28S,032401_032450,1930s: cattle run and graze in hilly terrain. girl leans from car and points at street sign. girl waves and speaks.
24040042,https://ak.picdn.net/shutterstock/videos/24040042/preview/stock-footage-girl-having-fiasco-and-showing-thumbs-down-to-the-camera-steadycam-shot.mp4,PT00H00M14S,114451_114500,"Girl having fiasco and showing thumbs down to the camera, steadycam shot
"
1049152996,https://ak.picdn.net/shutterstock/videos/1049152996/preview/stock-footage-young-woman-at-home-works-on-computer-with-girl-in-cozy-clothes-sitting-in-living-room-side-view.mp4,PT00H00M13S,171101_171150,Young woman at home works on computer with. girl in cozy clothes sitting in living room. side view camera shot. 4k video footage slow motion
1029540404,https://ak.picdn.net/shutterstock/videos/1029540404/preview/stock-footage-flying-up-above-riverbed-and-mountain-valley-in-summer-day-aerial-drone-view-to-the-altai.mp4,PT00H00M09S,109301_109350,Flying up above riverbed and mountain valley in summer day. aerial drone view to the altai mountains wild landscape.
1034919275,https://ak.picdn.net/shutterstock/videos/1034919275/preview/stock-footage-water-dumbbells-for-water-aerobics-in-the-pool.mp4,PT00H00M05S,171751_171800,Water dumbbells for water aerobics in the pool
25316540,https://ak.picdn.net/shutterstock/videos/25316540/preview/stock-footage-close-up-of-running-water-from-tap.mp4,PT00H00M08S,172451_172500,Close-up of running water from tap
13748000,https://ak.picdn.net/shutterstock/videos/13748000/preview/stock-footage-blue-digital-the-boiling-broth-digital-flow-seamless-loop.mp4,PT00H00M12S,053901_053950,"Blue digital the boiling broth, digital flow - seamless loop"
26044445,https://ak.picdn.net/shutterstock/videos/26044445/preview/stock-footage-abstract-technologic-background-with-stripes-and-particles-animation-of-circuit-electric-signal.mp4,PT00H00M20S,030551_030600,Abstract technologic background with stripes and particles. animation of circuit electric signal with light shine. animation of seamless loop.
1024638341,https://ak.picdn.net/shutterstock/videos/1024638341/preview/stock-footage-vilkove-ukraine-old-woman-praying-in-front-of-a-wall-of-golden-icons-in-church.mp4,PT00H00M32S,015401_015450,Vilkove / ukraine - 05/06/2018: old woman praying in front of a wall of golden icons in church 
1037618069,https://ak.picdn.net/shutterstock/videos/1037618069/preview/stock-footage-smiling-asian-woman-using-smart-phone-in-the-garden.mp4,PT00H00M20S,197201_197250,Smiling asian woman using smart phone in the garden
1040716580,https://ak.picdn.net/shutterstock/videos/1040716580/preview/stock-footage-a-boy-with-a-gun-plays-in-the-field-children-s-games-military-training-of-the-child-fantasy.mp4,PT00H00M13S,137251_137300,A boy with a gun plays in the field. children's games. military training of the child. fantasy child. child development concept
2826859,https://ak.picdn.net/shutterstock/videos/2826859/preview/stock-footage-growing-up-cartoon-tree-animated-with-alpha-mask.mp4,PT00H00M30S,142151_142200,Growing up cartoon tree animated with alpha mask
1033740770,https://ak.picdn.net/shutterstock/videos/1033740770/preview/stock-footage-an-athletic-man-doing-difficult-capoeira-elements-somersault-over-his-head-without-hands-in-the.mp4,PT00H00M11S,192601_192650,An athletic man doing difficult capoeira elements - somersault over his head without hands - in the room with concrete floor and brick walls
3679829,https://ak.picdn.net/shutterstock/videos/3679829/preview/stock-footage-chinese-doctor-examining-x-ray.mp4,PT00H00M14S,078851_078900,Chinese doctor examining x-ray
1031724731,https://ak.picdn.net/shutterstock/videos/1031724731/preview/stock-footage-wooden-table-with-details-and-tools-from-outer-diameter-grinder.mp4,PT00H00M11S,140001_140050,Wooden table with details and tools from outer diameter grinder
1057408090,https://ak.picdn.net/shutterstock/videos/1057408090/preview/stock-footage-top-down-aerial-view-of-kelingking-beach-in-nusa-penida-island-beautiful-ocean-with-azure-blue.mp4,PT00H00M56S,197201_197250,"Top down aerial view of kelingking beach in nusa penida island, beautiful ocean with azure blue water and mountains. bali, indonesia"
10317893,https://ak.picdn.net/shutterstock/videos/10317893/preview/stock-footage-doctor-takes-senior-female-patient-s-blood-pressure-in-surgery-shot-on-sony-fs-at-frame-rate-of.mp4,PT00H00M30S,145451_145500,Doctor takes senior female patient's blood pressure in surgery.shot on sony fs700 at frame rate of 25fps
1053782138,https://ak.picdn.net/shutterstock/videos/1053782138/preview/stock-footage-tokyo-japan-march-crowd-of-people-walking-at-shinagawa-station-in-morning-rush-hour.mp4,PT00H00M35S,018251_018300,"Tokyo, japan - march 2020 : crowd of people walking at shinagawa station in morning rush hour. commuters going to work. people wearing mask to protect from coronavirus (covid-19). blurred slow motion."
1036329848,https://ak.picdn.net/shutterstock/videos/1036329848/preview/stock-footage-confident-businessman-looking-at-camera-and-smiling-outdoors.mp4,PT00H00M07S,045001_045050,"Confident businessman looking at camera and smiling, outdoors"
1054018682,https://ak.picdn.net/shutterstock/videos/1054018682/preview/stock-footage-caucasian-male-astronaunt-checking-hud-on-her-suit-while-exploring-planet-surface-mars.mp4,PT00H00M06S,055151_055200,"Caucasian male astronaunt checking hud on her suit while exploring planet surface, mars colonization concept"
1036616747,https://ak.picdn.net/shutterstock/videos/1036616747/preview/stock-footage-rear-back-view-confident-businessman-talking-the-phone-and-walking-the-street-at-the-office-center.mp4,PT00H00M07S,137901_137950,Rear back view confident businessman talking the phone and walking the street at the office center. successful business man goes to work in the office
1491049,https://ak.picdn.net/shutterstock/videos/1491049/preview/stock-footage-fire-sparks.mp4,PT00H00M15S,088851_088900,Fire sparks. 
1047220825,https://ak.picdn.net/shutterstock/videos/1047220825/preview/stock-footage-super-slow-motion-shot-of-pouring-water-on-fresh-pomegranate-at-fps.mp4,PT00H00M28S,139851_139900,Super slow motion shot of pouring water on fresh pomegranate at 1000fps.
1025012069,https://ak.picdn.net/shutterstock/videos/1025012069/preview/stock-footage-happy-couple-jumping-and-having-fun-in-the-bed-at-luxury-bedroom-slow-motion-hd.mp4,PT00H00M29S,059501_059550,Happy couple jumping and having fun in the bed at luxury bedroom. slow motion. hd
15687271,https://ak.picdn.net/shutterstock/videos/15687271/preview/stock-footage-mountain-stream-with-clear-water-more-options.mp4,PT00H00M17S,175801_175850,Mountain stream with clear water - more options 
1046977147,https://ak.picdn.net/shutterstock/videos/1046977147/preview/stock-footage-young-asian-woman-sitting-on-sofa-or-couch-and-listening-to-music-in-headphone-shaking-head.mp4,PT00H00M14S,063651_063700,"Young asian woman sitting on sofa or couch and listening to music in headphone shaking head, dancing, singing,enjoy positive song with smile and happy expression in living room.happy lifestyle concpet"
1038007658,https://ak.picdn.net/shutterstock/videos/1038007658/preview/stock-footage-close-up-of-traditional-buildings-in-perugia-umbria-italy-the-city-has-built-a-reputation-for.mp4,PT00H00M08S,196751_196800,"Close-up of traditional buildings in perugia, umbria, italy. the city has built a reputation for its universities and chocolates"
30481726,https://ak.picdn.net/shutterstock/videos/30481726/preview/stock-footage-concept-of-parental-pride-and-support-beautiful-young-woman-hugs-her-daughter-after-a-speech-and.mp4,PT00H00M09S,044051_044100,"Concept of parental pride and support. beautiful young woman hugs her daughter after a speech and is proud of the successes of her child. strong maternal embrace, love the child, pride and support."
19217212,https://ak.picdn.net/shutterstock/videos/19217212/preview/stock-footage-bavarian-girl-takes-on-the-table-two-glasses-of-beer-green-screen.mp4,PT00H00M08S,071151_071200,Bavarian girl takes on the table two glasses of beer. green screen
13200365,https://ak.picdn.net/shutterstock/videos/13200365/preview/stock-footage-circa-s-a-physiology-lesson-on-the-sense-of-balance-illustrated-by-a-falling-cat-in.mp4,PT00H02M40S,082651_082700,Circa 1950s - a physiology lesson on the sense of balance illustrated by a falling cat in 1958.
1018664005,https://ak.picdn.net/shutterstock/videos/1018664005/preview/stock-footage-spray-from-a-jet-of-water-under-the-bright-sun.mp4,PT00H00M31S,087801_087850,Spray from a jet of water under the bright sun.
1051991320,https://ak.picdn.net/shutterstock/videos/1051991320/preview/stock-footage-iraq-flag-video-loop-background.mp4,PT00H00M20S,057851_057900,Iraq flag video loop background
1036341494,https://ak.picdn.net/shutterstock/videos/1036341494/preview/stock-footage-hairdresser-washes-hair-of-asian-woman-by-finger-and-scratch-from-back-side-of-head-with-shampoo-at.mp4,PT00H00M15S,178701_178750,Hairdresser washes hair of asian woman by finger and scratch from back side of head with shampoo at a beauty salon
9378812,https://ak.picdn.net/shutterstock/videos/9378812/preview/stock-footage-machine-for-dough-preparation-round-shape.mp4,PT00H00M08S,068851_068900,Machine for dough preparation round shape
26264909,https://ak.picdn.net/shutterstock/videos/26264909/preview/stock-footage-tense-executive-sitting-on-sofa-in-office.mp4,PT00H00M07S,011001_011050,Tense executive sitting on sofa in office
1014127919,https://ak.picdn.net/shutterstock/videos/1014127919/preview/stock-footage-young-african-woman-having-neck-pain.mp4,PT00H00M13S,129801_129850,Young african woman having neck pain
1064538322,https://ak.picdn.net/shutterstock/videos/1064538322/preview/stock-footage-anti-aging-procedure-facial-massage-close-up-woman-is-lying-on-couch-and-getting-facial-massage.mp4,PT00H00M12S,070851_070900,"Anti-aging procedure, facial massage. close-up. woman is lying on couch and getting facial massage for toning up muscles and facial skin lymphatic drainage, at beauty clinic. skin care, cosmetology"
20460619,https://ak.picdn.net/shutterstock/videos/20460619/preview/stock-footage-harvester-in-sunflowers-field-k-aerial-top-view-video-harvest-agriculture-farm-rural-landscape.mp4,PT00H00M28S,071401_071450,Harvester in sunflowers field 4k aerial top view video. harvest agriculture farm rural landscape. combine cropping background with copy space
1031089994,https://ak.picdn.net/shutterstock/videos/1031089994/preview/stock-footage--k-blockchain-word-tag-cloud-cripto-currency-bitcoin-the-matrix-style-binary-computer-code-changing.mp4,PT00H00M16S,008101_008150,"4k blockchain word tag cloud.cripto currency bitcoin.the matrix style binary computer code,changing from zero to one digits,global internet worldwide.abstract future tech background. "
20495065,https://ak.picdn.net/shutterstock/videos/20495065/preview/stock-footage-freaky-blond-lady-posing.mp4,PT00H00M09S,036001_036050,Freaky blond lady posing
13832303,https://ak.picdn.net/shutterstock/videos/13832303/preview/stock-footage-man-riding-a-motor-cross-bike-in-slow-motion.mp4,PT00H00M15S,148101_148150,Man riding a motor cross bike in slow motion
1014627341,https://ak.picdn.net/shutterstock/videos/1014627341/preview/stock-footage-beauty-shop-eyelash-extension-women-s-eyes-close-up-eyelashes-close-up-macro-female-beauty.mp4,PT00H00M09S,032601_032650,"Beauty shop. eyelash extension. women's eyes close-up. eyelashes, close-up, macro, female beauty."
1007784445,https://ak.picdn.net/shutterstock/videos/1007784445/preview/stock-footage-two-young-women-practice-yoga-in-the-park-on-summer-day.mp4,PT00H00M28S,033801_033850,Two young women practice yoga in the park on summer day.
1016291272,https://ak.picdn.net/shutterstock/videos/1016291272/preview/stock-footage-new-year-text-text-rise-snow-falls-christmas-mood-looped-video-alpha-channel-premultiplied.mp4,PT00H00M05S,005201_005250,"New year text text rise. snow falls. christmas mood, looped video. alpha channel premultiplied - matted with deep blue rgb(04:00:5b)"
20331310,https://ak.picdn.net/shutterstock/videos/20331310/preview/stock-footage-workers-washing-ship-and-anchor-chain-in-dry-dock.mp4,PT00H00M13S,015951_016000,Workers washing ship and anchor chain in dry dock
32029162,https://ak.picdn.net/shutterstock/videos/32029162/preview/stock-footage-business-woman-writing-down-to-notebook-plan-for-near-future-freelancer.mp4,PT00H00M24S,048001_048050,"Business woman writing down to notebook plan for near future, freelancer"
1023269869,https://ak.picdn.net/shutterstock/videos/1023269869/preview/stock-footage-male-female-multi-ethnic-teenagers-sitting-around-table-with-female-college-lecturer.mp4,PT00H00M25S,073751_073800,Male female multi ethnic teenagers sitting around table with female college lecturer
1016800621,https://ak.picdn.net/shutterstock/videos/1016800621/preview/stock-footage-sexy-amazon-pose-with-a-battle-disk-slow-motion.mp4,PT00H00M13S,079201_079250,"Sexy amazon pose with a battle disk, slow motion"
1019421025,https://ak.picdn.net/shutterstock/videos/1019421025/preview/stock-footage-european-city-aerial-landscape-infrastructure-transportation-cityscape-from-top-colorful-ref-and.mp4,PT00H00M20S,098051_098100,"European city aerial landscape. infrastructure transportation, cityscape from top. colorful ref and orange rooftops, cars moving on city  roads, people walking. "
1054399457,https://ak.picdn.net/shutterstock/videos/1054399457/preview/stock-footage-various-types-of-fresh-sushi.mp4,PT00H00M10S,039401_039450,Various types of fresh sushi
24451577,https://ak.picdn.net/shutterstock/videos/24451577/preview/stock-footage-top-view-hands-of-videographer-gently-put-rechargeable-battery-near-set-of-small-rotors-next-to.mp4,PT00H00M06S,138551_138600,"Top view, hands of videographer gently put rechargeable battery near set of small rotors next to dji phantom body on rural textured wooden table. 10 february 2017 in spain"
1037778710,https://ak.picdn.net/shutterstock/videos/1037778710/preview/stock-footage--may-fethiye-xantos-antique-tombs-antique-city-near-antique-theatre.mp4,PT00H00M23S,102051_102100,15 may 2019 fethiye xantos antique tombs: antique city near antique theatre
5925344,https://ak.picdn.net/shutterstock/videos/5925344/preview/stock-footage-tourists-swimming-tropical-beach-st-thomas-usvi-resorts-along-coast-beach-where-thousands-of.mp4,PT00H00M27S,131451_131500,"Tourists swimming tropical beach st thomas usvi. resorts along coast beach where thousands of people come to enjoy the sun, surf, wave and warm tropical weather. families and honeymoon couples. "
1023022714,https://ak.picdn.net/shutterstock/videos/1023022714/preview/stock-footage-mediterranean-sea-january-large-cargo-ship-loaded-with-metal-rods-anchored-at-sea.mp4,PT00H00M14S,088401_088450,"Mediterranean sea - january 18, 2019: large cargo ship loaded with metal rods anchored at sea - aerial footage."
1035215699,https://ak.picdn.net/shutterstock/videos/1035215699/preview/stock-footage-calgary-ab-canada-stars-medical-helicopter-loads-a-patient-for-transport.mp4,PT00H00M27S,086151_086200,"Calgary , ab / canada - 05 30 2019: stars medical helicopter loads a patient for transport"
1019786797,https://ak.picdn.net/shutterstock/videos/1019786797/preview/stock-footage-autumn-holiday-halloween-scary-glowing-pumpkin.mp4,PT00H00M31S,039451_039500,Autumn holiday halloween. scary glowing pumpkin.
1034293406,https://ak.picdn.net/shutterstock/videos/1034293406/preview/stock-footage-young-sportsman-playing-basketball-outdoors-with-friends-dribbling-and-missing-the-basket.mp4,PT00H00M12S,181001_181050,"Young sportsman playing basketball outdoors with friends, dribbling and missing the basket"
8606386,https://ak.picdn.net/shutterstock/videos/8606386/preview/stock-footage-hai-duong-vietnam-november-drying-rice-at-home-packing-on-november-in-hai-duong.mp4,PT00H00M08S,176151_176200,"Hai duong, vietnam, november, 16: drying rice at home, packing on november 16, 2014 in hai duong, vietnam"
9494621,https://ak.picdn.net/shutterstock/videos/9494621/preview/stock-footage-sunflowers-and-bees-backlighting.mp4,PT00H00M30S,128451_128500,Sunflowers and bees backlighting
1057656298,https://ak.picdn.net/shutterstock/videos/1057656298/preview/stock-footage-aerial-view-of-roaninnish-in-county-donegal-ireland.mp4,PT00H00M36S,193651_193700,Aerial view of roaninnish in county donegal - ireland.
1014071525,https://ak.picdn.net/shutterstock/videos/1014071525/preview/stock-footage-vhs-tv-noise-footage-black-and-white-real-analog-vintage-signal-with-bad-interference-static.mp4,PT00H00M30S,149151_149200,"Vhs tv noise footage, black and white, real analog vintage signal with bad interference, static noise background, overlay ready"
