videoid,contentUrl,duration,page_dir,name
1040572772,https://ak.picdn.net/shutterstock/videos/1040572772/preview/stock-footage-circa-generals-bierwirth-and-wornhan-give-speeches-at-a-burial-service-for-un-servicemen.mp4,PT00H01M04S,175301_175350,Circa 1956 - generals bierwirth and wornhan give speeches at a burial service for un servicemen killed in korea.
1011430358,https://ak.picdn.net/shutterstock/videos/1011430358/preview/stock-footage-moscow-dec-wing-covers-bright-spotlight-during-aircraft-moves-near-terminal-of.mp4,PT00H00M12S,051351_051400,"Moscow - dec 07, 2017: wing covers bright spotlight during aircraft moves near terminal of domodedovo airport at winter evening. slow motion"
34665604,https://ak.picdn.net/shutterstock/videos/34665604/preview/stock-footage-moscow-russia-november-international-exhibition-of-robotics-and-advanced-technology-in.mp4,PT00H00M16S,050751_050800,"Moscow, russia, november 26, 2017: international exhibition of robotics and advanced technology in moscow. children kid school girl boy in vr virtual reality 360"
1025963153,https://ak.picdn.net/shutterstock/videos/1025963153/preview/stock-footage-full-moon-footage-the-moon-is-an-astronomical-body-that-orbits-planet-earth-and-is-earth-s-only.mp4,PT00H00M31S,083301_083350,Full moon footage / the moon is an astronomical body that orbits planet earth and is earth's only permanent natural satellite. 
1016706295,https://ak.picdn.net/shutterstock/videos/1016706295/preview/stock-footage-mstislavl-republic-of-belarus-august-festival-of-medieval-culture-knights-fest.mp4,PT00H01M00S,090951_091000,"Mstislavl, republic of belarus - august 04-05, 2018: festival of medieval culture ""knights fest. mstislavl 2018"". demonstration performances and imitation of the battle scottish infantry."
8959633,https://ak.picdn.net/shutterstock/videos/8959633/preview/stock-footage--loopable-flag-of-laos-laotian-official-flag-gently-waving-in-the-wind-highly-detailed-fabric.mp4,PT00H00M15S,138801_138850,[loopable] flag of laos. laotian official flag gently waving in the wind. highly detailed fabric texture for 4k resolution. 15 seconds loop. source: cgi rendering. clip id: ax691c
29938300,https://ak.picdn.net/shutterstock/videos/29938300/preview/stock-footage-man-reading-newspaper-and-smiling-in-slow-motion-muslim-dressed-in-blue-shirt-and-black-jacket.mp4,PT00H00M07S,139101_139150,"Man reading newspaper and smiling in slow motion.muslim dressed in blue shirt and black jacket. freelancer has dark short hair, beard and dimples on cheeks. concept of modern vacancies for young"
1009707137,https://ak.picdn.net/shutterstock/videos/1009707137/preview/stock-footage-pretty-oung-woman-lying-in-the-bed-at-the-white-pillow-smiling-and-looking-at-camera.mp4,PT00H00M11S,045051_045100,Pretty oung woman lying in the bed at the white pillow. smiling and looking at camera.
1010706446,https://ak.picdn.net/shutterstock/videos/1010706446/preview/stock-footage-time-measurement-pressure-gauge.mp4,PT00H00M10S,067851_067900,Time measurement pressure gauge
18714638,https://ak.picdn.net/shutterstock/videos/18714638/preview/stock-footage-santa-cruz-chile-tractor-in-field.mp4,PT00H00M06S,176301_176350,"Santa cruz, chile: 3/1/13: tractor in field"
1056471299,https://ak.picdn.net/shutterstock/videos/1056471299/preview/stock-footage-phuket-thailand-november-vacationers-people-tourists-on-the-nai-harn-beach.mp4,PT00H00M17S,131051_131100,"Phuket, thailand - november 20, 2018: vacationers people, tourists on the nai harn beach"
1028044613,https://ak.picdn.net/shutterstock/videos/1028044613/preview/stock-footage-huraa-maldives-march-surfer-dives-under-the-broken-wave-and-glides-in-the-underwater.mp4,PT00H00M06S,019601_019650,"Huraa / maldives - march 23, 2019: surfer dives under the broken wave and glides in the underwater clouds"
1007414428,https://ak.picdn.net/shutterstock/videos/1007414428/preview/stock-footage-bokeh-sun-glare-reflected-from-the-water-surface-abstract-blurry-background-from-water.mp4,PT00H00M09S,025851_025900,"Bokeh sun glare reflected from the water surface , abstract blurry background from water."
5903198,https://ak.picdn.net/shutterstock/videos/5903198/preview/stock-footage-sewage-well-with-rising-steam-in-summer-public-park.mp4,PT00H00M29S,046201_046250,Sewage well with rising steam in summer public park
2823262,https://ak.picdn.net/shutterstock/videos/2823262/preview/stock-footage-redwood-fern-canyon.mp4,PT00H00M30S,053351_053400,Redwood 89 fern canyon
5154251,https://ak.picdn.net/shutterstock/videos/5154251/preview/stock-footage-istanbul-november-famous-galata-bridge-at-istanbul-turkey.mp4,PT00H00M13S,030701_030750,"Istanbul - 09 november 2013 famous galata bridge at istanbul turkey, "
1021825318,https://ak.picdn.net/shutterstock/videos/1021825318/preview/stock-footage-extreme-sport-base-jumper-paraglider-lauterbrunnen-switzerland.mp4,PT00H01M06S,026601_026650,"Extreme sport base jumper paraglider, lauterbrunnen, switzerland"
1059414185,https://ak.picdn.net/shutterstock/videos/1059414185/preview/stock-footage-young-girl-sick-at-home-using-smartphone-to-talk-to-her-doctor-via-video-conference-medical-app.mp4,PT00H00M14S,175151_175200,"Young girl sick at home using smartphone to talk to her doctor via video conference medical app. woman has conversation with professional physician, using online video chat application."
1042128289,https://ak.picdn.net/shutterstock/videos/1042128289/preview/stock-footage-new-york-flag-falling-snow-new-year-and-christmas-background-loop.mp4,PT00H00M14S,083251_083300,"New york flag falling snow, new year and christmas background, loop"
22423453,https://ak.picdn.net/shutterstock/videos/22423453/preview/stock-footage-traveler-young-woman-standing-on-hill-and-looking-to-the-island.mp4,PT00H00M23S,011851_011900,Traveler young woman standing on hill and looking to the island
1052255617,https://ak.picdn.net/shutterstock/videos/1052255617/preview/stock-footage-fun-cartoon-chef-with-a-mask-walking.mp4,PT00H00M11S,012201_012250,Fun cartoon chef with a mask walking
3741641,https://ak.picdn.net/shutterstock/videos/3741641/preview/stock-footage-in-the-frame-bubbles-shimmer-with-light.mp4,PT00H00M22S,057401_057450,In the frame bubbles shimmer with light.
14976421,https://ak.picdn.net/shutterstock/videos/14976421/preview/stock-footage-biathlon-target-sports-shooting-opening-targets.mp4,PT00H00M09S,079851_079900,Biathlon. target sports shooting. opening targets 2
1032933080,https://ak.picdn.net/shutterstock/videos/1032933080/preview/stock-footage-the-blue-lake-lago-di-carezza-karersee-in-front-of-mountains-in-south-tyrol-italy-on-a-sunny-day.mp4,PT00H00M05S,097851_097900,"The blue lake lago di carezza (karersee) in front of mountains in south tyrol, italy on a sunny day in the summer"
10093205,https://ak.picdn.net/shutterstock/videos/10093205/preview/stock-footage-unhappy-businessman-with-smartphone-and-tablet-computer-reading-bad-news-in-cafe.mp4,PT00H00M27S,039051_039100,"Unhappy businessman with smartphone and tablet computer reading bad news in cafe
"
1046631106,https://ak.picdn.net/shutterstock/videos/1046631106/preview/stock-footage-beautiful-girl-run-orbitrek-gym-body-fitness-concept-fitness-and-healthy-lifestyle-concept.mp4,PT00H00M07S,027701_027750,Beautiful girl run orbitrek gym body fitness concept. fitness and healthy lifestyle concept. sportswoman using run machine in fitness center.
14260280,https://ak.picdn.net/shutterstock/videos/14260280/preview/stock-footage-professor-teaching-about-anatomy.mp4,PT00H00M16S,095101_095150,Professor teaching about anatomy.
1012260224,https://ak.picdn.net/shutterstock/videos/1012260224/preview/stock-footage-a-blonde-boy-peeks-out-from-behind-a-tree-playing-hide-and-seek-on-a-sunny-summer-day.mp4,PT00H00M07S,029551_029600,"A blonde boy peeks out from behind a tree, playing hide and seek on a sunny summer day"
32021815,https://ak.picdn.net/shutterstock/videos/32021815/preview/stock-footage-maldives-october-scuba-diver-swimming-deep-underwater-world-of-colorful-beautiful.mp4,PT00H00M09S,060401_060450,Maldives -16 october 2010: scuba diver swimming deep underwater. world of colorful beautiful wildlife of reefs and algae. relax and privacy. abyssal diving.
1007506951,https://ak.picdn.net/shutterstock/videos/1007506951/preview/stock-footage-yellow-algae-branches-swaying-at-a-reef-in-mediterranean-sea-with-small-fish-in-the-background.mp4,PT00H00M26S,126551_126600,Yellow algae branches swaying at a reef in mediterranean sea with small fish in the background. slow motion underwater shot.
1020942940,https://ak.picdn.net/shutterstock/videos/1020942940/preview/stock-footage-three-red-bone-dice-board-game-choice-casino-winner.mp4,PT00H00M10S,121201_121250,Three 3 red bone dice board game. choice casino winner
1947712,https://ak.picdn.net/shutterstock/videos/1947712/preview/stock-footage-vietnamese-buddhist-temple-the-one-pillar-pagoda-in-hanoi-vietnam-religious.mp4,PT00H00M25S,122951_123000,"Vietnamese buddhist temple, the one pillar pagoda in hanoi, vietnam, religious"
1036665098,https://ak.picdn.net/shutterstock/videos/1036665098/preview/stock-footage-asian-man-sitting-on-the-workspace-shaking-the-feet-because-of-stress.mp4,PT00H00M13S,184401_184450,Asian man sitting on the workspace shaking the feet because of stress.
25636448,https://ak.picdn.net/shutterstock/videos/25636448/preview/stock-footage-lonely-boy-sitting-against-the-background-of-the-sea-and-mountains-montenegro.mp4,PT00H00M18S,102601_102650,"Lonely boy sitting against the background of the sea and mountains, montenegro"
1018094680,https://ak.picdn.net/shutterstock/videos/1018094680/preview/stock-footage-forest-background-out-of-focus-from-abel-tasman-national-park-new-zealand-forest-river-creek-red.mp4,PT00H00M15S,026701_026750,Forest background out of focus. from abel tasman national park new zealand forest river creek. red epic slow motion
1023016282,https://ak.picdn.net/shutterstock/videos/1023016282/preview/stock-footage-pink-geometric-triangle-wall-waving-background-seamless-loop-k-uhd.mp4,PT00H00M05S,031501_031550,Pink geometric triangle wall waving background. seamless loop 4k uhd
9843947,https://ak.picdn.net/shutterstock/videos/9843947/preview/stock-footage-the-eyes-of-the-boudhanath-stupa-in-kathmandu-nepal-boudhanath-is-a-unesco-world-heritage-site.mp4,PT00H00M30S,198551_198600,"The eyes of the boudhanath stupa in kathmandu, nepal. boudhanath is a unesco world heritage site and one of the largest stupas in the world. tilt shot."
34704406,https://ak.picdn.net/shutterstock/videos/34704406/preview/stock-footage-rainy-winter-time-lapse-jezersko-slovenia.mp4,PT00H00M09S,022401_022450,"Rainy winter time lapse - jezersko, slovenia"
1012065323,https://ak.picdn.net/shutterstock/videos/1012065323/preview/stock-footage-haiti-hand-drawn-tourism.mp4,PT00H00M08S,131201_131250,Haiti hand drawn tourism
16353619,https://ak.picdn.net/shutterstock/videos/16353619/preview/stock-footage-aerial-fort-william-scotland-reveal-from-behind-a-mountain-in-the-evening-sun.mp4,PT00H00M23S,057451_057500,"Aerial: fort william, scotland - reveal from behind a mountain in the evening sun"
1017449638,https://ak.picdn.net/shutterstock/videos/1017449638/preview/stock-footage-businessman-walking-towards-camera-with-friend-country-flags-pin-italy-israel.mp4,PT00H00M10S,006201_006250,Businessman walking towards camera with friend country flags pin italy - israel
1048702789,https://ak.picdn.net/shutterstock/videos/1048702789/preview/stock-footage-wild-waterfall-view-in-nature.mp4,PT00H00M37S,196451_196500,Wild waterfall view in nature
1051325512,https://ak.picdn.net/shutterstock/videos/1051325512/preview/stock-footage-girl-making-a-cake-in-a-bakery-baker-squeezes-cream-onto-a-cake-layer.mp4,PT00H00M51S,122251_122300,Girl making a cake in a bakery. baker squeezes cream onto a cake layer.
14848231,https://ak.picdn.net/shutterstock/videos/14848231/preview/stock-footage-dandelion-flowers-at-sunset.mp4,PT00H00M29S,118201_118250,Dandelion flowers at sunset.
1059950309,https://ak.picdn.net/shutterstock/videos/1059950309/preview/stock-footage--walking-trail-over-a-river-and-swamps-in-an-alaska-nature-reserve-mountain-landscape-spring.mp4,PT00H00M05S,064451_064500, walking trail over a river and swamps in an alaska nature reserve. mountain landscape. spring sunny day in alaska. ice and snow melted. everything came to life
20208592,https://ak.picdn.net/shutterstock/videos/20208592/preview/stock-footage-colorful-red-orange-yellow-blue-and-green-spheres-in-the-shape-of-nine-percent-over-isolated.mp4,PT00H00M10S,127451_127500,"Colorful red, orange, yellow, blue and green spheres in the shape of nine percent over isolated white background"
1013213102,https://ak.picdn.net/shutterstock/videos/1013213102/preview/stock-footage-waterfalls-of-hawaii.mp4,PT00H00M14S,014201_014250,Waterfalls of hawaii
2789710,https://ak.picdn.net/shutterstock/videos/2789710/preview/stock-footage-tagetes-under-the-wind.mp4,PT00H00M16S,058451_058500,Tagetes under the wind
1018643143,https://ak.picdn.net/shutterstock/videos/1018643143/preview/stock-footage-himmafushi-maldives-december-local-surfer-rides-the-wave-in-the-ocean.mp4,PT00H00M12S,006051_006100,"Himmafushi - maldives, 8 december 2017: local surfer rides the wave in the ocean"
1016783176,https://ak.picdn.net/shutterstock/videos/1016783176/preview/stock-footage-croatian-flag-on-a-boat.mp4,PT00H00M49S,084801_084850,Croatian flag on a boat
1030521947,https://ak.picdn.net/shutterstock/videos/1030521947/preview/stock-footage-orange-spotted-trevally-carangoides-bajad-in-coral-of-raja-ampat-indonesia.mp4,PT00H00M05S,175451_175500,Orange-spotted trevally (carangoides bajad) in coral of raja ampat indonesia
20404780,https://ak.picdn.net/shutterstock/videos/20404780/preview/stock-footage-tentacled-flathead-papilloculiceps-longiceps-in-the-red-sea-egypt.mp4,PT00H00M11S,191051_191100,"Tentacled flathead (papilloculiceps longiceps) in the red sea, egypt"
6386093,https://ak.picdn.net/shutterstock/videos/6386093/preview/stock-footage-children-drawing-cartoon-on-night-time.mp4,PT00H00M23S,005001_005050,Children drawing cartoon on night time
1035674441,https://ak.picdn.net/shutterstock/videos/1035674441/preview/stock-footage-pink-triangle-and-smoke-surreal-motion-design.mp4,PT00H00M20S,010351_010400,Pink triangle and smoke. surreal motion design.	
1022383057,https://ak.picdn.net/shutterstock/videos/1022383057/preview/stock-footage-streets-near-palais-garnier-paris.mp4,PT00H00M15S,128451_128500,"Streets near palais garnier, paris"
23179147,https://ak.picdn.net/shutterstock/videos/23179147/preview/stock-footage-beautiful-green-palm-slow-motion-detail-footage-pan-from-the-segment-of-the-palm-leaf-through-the.mp4,PT00H00M06S,068201_068250,"Beautiful green palm slow-motion detail footage - pan from the segment of the palm leaf through the sinus then to the costa, rachis and petiole of a green costapalmate leaf"
20186284,https://ak.picdn.net/shutterstock/videos/20186284/preview/stock-footage-close-up-of-putting-on-punching-wraps-on-hands-in-the-gym.mp4,PT00H00M23S,107151_107200,Close up of putting on punching wraps on hands in the gym
23735146,https://ak.picdn.net/shutterstock/videos/23735146/preview/stock-footage-beautiful-girl-freezing-in-winter-park-cold-winter-portrait-girl-in-a-red-cap-and-jacket-warms.mp4,PT00H00M10S,172201_172250,Beautiful girl freezing in winter park. cold winter. portrait girl in a red cap and jacket warms her hands. closeup portrait of beautiful young girl in winter day
15714223,https://ak.picdn.net/shutterstock/videos/15714223/preview/stock-footage-vintage-wood-background-grunge-wooden-weathered-oak-or-pine-textured-planks-brown-rustic-fence.mp4,PT00H00M16S,114601_114650,Vintage wood background. grunge wooden weathered oak or pine textured planks. brown rustic fence.
1008955139,https://ak.picdn.net/shutterstock/videos/1008955139/preview/stock-footage-the-boy-looks-at-the-model-airplane-in-the-sun-against-the-backdrop-of-the-hills.mp4,PT00H00M07S,177851_177900,The boy looks at the model airplane in the sun against the backdrop of the hills
19195699,https://ak.picdn.net/shutterstock/videos/19195699/preview/stock-footage-vienna-austria-august-pair-of-brown-horses-draws-carriage-with-tourists-on-empty-road.mp4,PT00H00M14S,084801_084850,"Vienna, austria - august 2016: pair of brown horses draws carriage with tourists on empty road"
4145896,https://ak.picdn.net/shutterstock/videos/4145896/preview/stock-footage-giraffe-couple-south-africa-kruger-s-national-park.mp4,PT00H00M39S,197801_197850,"Giraffe couple. south africa, kruger's national park."
31385677,https://ak.picdn.net/shutterstock/videos/31385677/preview/stock-footage-portrait-of-young-woman-in-elegant-outfit-sitting-and-taking-smartphone-while-looking-away-with.mp4,PT00H00M25S,058051_058100,Portrait of young woman in elegant outfit sitting and taking smartphone while looking away with confidence on background of summer city.
15396229,https://ak.picdn.net/shutterstock/videos/15396229/preview/stock-footage-aerial-k-construction-crane-at-a-construction-site-in-a-city.mp4,PT00H00M16S,133251_133300,Aerial 4k: construction crane at a construction site in a city
13312742,https://ak.picdn.net/shutterstock/videos/13312742/preview/stock-footage-handsome-man-kissing-to-young-beautiful-woman-while-watching-electronic-tablet-love-and-leisure.mp4,PT00H00M13S,010351_010400,Handsome man kissing to young beautiful woman while watching electronic tablet. love and leisure time concept.
1039828322,https://ak.picdn.net/shutterstock/videos/1039828322/preview/stock-footage-clear-lagoon-ocean-in-thailand.mp4,PT00H00M08S,144301_144350,Clear lagoon ocean in thailand
1059365861,https://ak.picdn.net/shutterstock/videos/1059365861/preview/stock-footage-wibbly-wobbly-waves-of-rgb-cmyk-colours-for-various-masks-highlights.mp4,PT00H00M12S,110901_110950,Wibbly wobbly waves of rgb cmyk colours for various masks highlights
3975880,https://ak.picdn.net/shutterstock/videos/3975880/preview/stock-footage-st-croix-us-virgin-islands-march-cu-bow-of-boat-enters-frame-of-turquoise-water-rest.mp4,PT00H00M16S,101651_101700,"St. croix, us virgin islands - march 08, 1983: cu bow of boat enters frame of turquoise water, rest of boat named miss bertha follows with one fisherman on board."
732649,https://ak.picdn.net/shutterstock/videos/732649/preview/stock-footage-sliding-with-inline-skate.mp4,PT00H00M12S,188451_188500,Sliding with inline skate
30907243,https://ak.picdn.net/shutterstock/videos/30907243/preview/stock-footage-selfish-young-woman-talking-on-hone-and-ignoring-sick-husband.mp4,PT00H00M24S,122851_122900,Selfish young woman talking on hone and ignoring sick husband
1054193651,https://ak.picdn.net/shutterstock/videos/1054193651/preview/stock-footage-chemistry-lab-compound-mixing-slow-motion-video.mp4,PT00H00M10S,187901_187950,Chemistry lab compound mixing. slow motion video. 
1014586760,https://ak.picdn.net/shutterstock/videos/1014586760/preview/stock-footage-condemned-foreclosed-buildings-as-seen-from-an-alley.mp4,PT00H00M10S,003101_003150,Condemned foreclosed buildings as seen from an alley
1040917514,https://ak.picdn.net/shutterstock/videos/1040917514/preview/stock-footage-young-woman-is-whirling-and-dancing-on-rocks-in-summer-day-smiling.mp4,PT00H00M10S,149051_149100,"Young woman is whirling and dancing on rocks in summer day, smiling"
34490656,https://ak.picdn.net/shutterstock/videos/34490656/preview/stock-footage-vancouver-bc-canada-january-vancouver-polar-bear-swimming-at-english-bay-beach.mp4,PT00H00M20S,121301_121350,"Vancouver bc canada january 1,2018. vancouver polar bear swimming 2018 at english bay beach vancouver"
1009981979,https://ak.picdn.net/shutterstock/videos/1009981979/preview/stock-footage--k-slow-motion-the-freshly-roasted-coffee-beans-from-a-large-coffee-roaster.mp4,PT00H00M18S,170901_170950,"4k, slow motion,the freshly roasted coffee beans from a large coffee roaster"
1012232939,https://ak.picdn.net/shutterstock/videos/1012232939/preview/stock-footage-london-uk-circa-september-picadilly-circus-in-london-in-the-evening-with-traffic-and.mp4,PT00H00M20S,046951_047000,"London, uk - circa september, 2017:picadilly circus in london in the evening with traffic and street artist, slow motion.the concept of slowing rhythm of urban life."
1021666744,https://ak.picdn.net/shutterstock/videos/1021666744/preview/stock-footage-stressed-bearded-man-having-neck-pain.mp4,PT00H00M25S,145051_145100,Stressed bearded man having neck pain
1023060958,https://ak.picdn.net/shutterstock/videos/1023060958/preview/stock-footage-mountain-beautiful-pure-water-in-thailand-footage-background-design-element.mp4,PT00H00M14S,108901_108950,"Mountain beautiful pure water in thailand, footage background,design element  "
32064250,https://ak.picdn.net/shutterstock/videos/32064250/preview/stock-footage-a-young-girl-resting-in-the-alpine-mountains-standing-on-the-haystack-raising-and-lowering-arms-on.mp4,PT00H00M12S,185951_186000,A young girl resting in the alpine mountains. standing on the haystack raising and lowering arms on a background of blue sky with clouds. in the background panorama of mountains and wood fence
4876895,https://ak.picdn.net/shutterstock/videos/4876895/preview/stock-footage-pasta.mp4,PT00H00M12S,069401_069450,Pasta
30739972,https://ak.picdn.net/shutterstock/videos/30739972/preview/stock-footage-istanbul.mp4,PT00H00M32S,062351_062400,Istanbul
1011505436,https://ak.picdn.net/shutterstock/videos/1011505436/preview/stock-footage-retro-videogame-tagged-word-text-computer-tv-glitch-interference-noise-screen-animation-seamless.mp4,PT00H00M10S,106501_106550,Retro videogame tagged word text computer tv glitch interference noise screen animation seamless loop new quality universal vintage motion dynamic animated background colorful joyful video m
17556235,https://ak.picdn.net/shutterstock/videos/17556235/preview/stock-footage-abstract-loop-motion-background-variegated-kaleidoscope.mp4,PT00H00M15S,023701_023750,"Abstract loop motion background, variegated kaleidoscope"
1021425175,https://ak.picdn.net/shutterstock/videos/1021425175/preview/stock-footage-people-with-their-pets-are-waiting-for-a-medical-examination-at-the-veterinary-clinic-animal-health.mp4,PT00H00M16S,087451_087500,People with their pets are waiting for a medical examination at the veterinary clinic. animal health
24948119,https://ak.picdn.net/shutterstock/videos/24948119/preview/stock-footage-solar-farm-panels-green-energy-concept.mp4,PT00H00M12S,134901_134950,Solar farm panels green energy concept
33944920,https://ak.picdn.net/shutterstock/videos/33944920/preview/stock-footage-wurzburg-bavaria-germany-september-people-visit-city-centre-on-domstrasse-much-of-the.mp4,PT00H00M19S,076251_076300,"Wurzburg, bavaria/germany - september 13, 2017: people visit city centre on domstrasse. much of the altstadt has been a unesco world heritage site since 1993."
2485553,https://ak.picdn.net/shutterstock/videos/2485553/preview/stock-footage-a-sailboat-crosses-the-horizon-during-a-sunset-in-hawaii.mp4,PT00H00M22S,076001_076050,A sailboat crosses the horizon during a sunset in hawaii.
15790921,https://ak.picdn.net/shutterstock/videos/15790921/preview/stock-footage-boy-and-girl-talk.mp4,PT00H00M16S,040701_040750,Boy and girl talk
1007119513,https://ak.picdn.net/shutterstock/videos/1007119513/preview/stock-footage-portrait-girl-writing-in-notebook-on-windowsill-in-the-evening.mp4,PT00H00M12S,175551_175600,"Portrait girl writing in notebook, on windowsill in the evening"
7611229,https://ak.picdn.net/shutterstock/videos/7611229/preview/stock-footage-dj-uses-professional-mixing-controller-close-up.mp4,PT00H00M15S,098451_098500,Dj uses professional mixing controller. close up
5962571,https://ak.picdn.net/shutterstock/videos/5962571/preview/stock-footage-beautiful-bride-in-her-wedding-dress-in-front-of-a-temple.mp4,PT00H00M56S,181451_181500,Beautiful bride in her wedding dress in front of a temple
1017342160,https://ak.picdn.net/shutterstock/videos/1017342160/preview/stock-footage-aerial-view-of-medellin-colombia-the-city-of-eternal-spring-footage-shot-on-the-dji-mavic-pro.mp4,PT00H00M10S,177801_177850,Aerial view of medellin colombia. the city of eternal spring. footage shot on the dji mavic pro flying over medellin colombia’s jungle city. footage flying over the cable car system in arvi parque.
1045668037,https://ak.picdn.net/shutterstock/videos/1045668037/preview/stock-footage-close-up-portrait-of-a-funny-baby-girl-in-costum-unicorn-cute-child-in-unicorn-s-pajamas-smiles.mp4,PT00H00M08S,047701_047750,Close up portrait of a funny baby girl in costum unicorn. cute child in unicorn's pajamas  smiles and plays
1035631574,https://ak.picdn.net/shutterstock/videos/1035631574/preview/stock-footage-abstract-particle-award-with-glitter-effect-on-dark-background.mp4,PT00H00M17S,029301_029350,Abstract particle award with glitter effect on dark background
12971570,https://ak.picdn.net/shutterstock/videos/12971570/preview/stock-footage-man-tying-patent-leather-shoes-in-formal-and-festive-dress.mp4,PT00H00M21S,144401_144450,Man tying patent leather shoes in formal and festive dress
33665365,https://ak.picdn.net/shutterstock/videos/33665365/preview/stock-footage--s-three-women-sit-on-edge-of-pool-kicking-and-splashing-water-women-roughhouse-in-shallow-end.mp4,PT00H00M20S,062251_062300,1950s: three women sit on edge of pool kicking and splashing water. women roughhouse in shallow end of pool. boats at harbor on lake.
8476666,https://ak.picdn.net/shutterstock/videos/8476666/preview/stock-footage-modern-processor-and-motherboard-for-a-home-computer.mp4,PT00H00M08S,083751_083800,Modern processor and motherboard for a home computer
