videoid,contentUrl,duration,page_dir,name
17671384,https://ak.picdn.net/shutterstock/videos/17671384/preview/stock-footage-female-character-talking-to-camera-and-making-faces.mp4,PT00H00M30S,180301_180350,Female character talking to camera and making faces.
24559934,https://ak.picdn.net/shutterstock/videos/24559934/preview/stock-footage-tablet-with-screen-charging-battery.mp4,PT00H00M08S,194601_194650,Tablet with screen charging battery
1027655531,https://ak.picdn.net/shutterstock/videos/1027655531/preview/stock-footage-big-white-black-yellow-spider-wasp-argiope-bruennichi-on-red-currant-leaf.mp4,PT00H00M26S,041251_041300,Big white black & yellow spider wasp argiope bruennichi on red currant leaf 3
1011337244,https://ak.picdn.net/shutterstock/videos/1011337244/preview/stock-footage-plexus-of-abstract-multicolored-geometrical-lines-with-moving-triangles-and-dots-on-a-black.mp4,PT00H00M15S,126201_126250,Plexus of abstract multicolored geometrical lines with moving triangles and dots on a black background. loop animations.
1021205509,https://ak.picdn.net/shutterstock/videos/1021205509/preview/stock-footage-aerial-drone-of-santa-maddalena-in-the-val-di-funes-dolomites-italy.mp4,PT00H00M26S,120201_120250,"Aerial/ drone of santa maddalena in the val di funes, dolomites, italy."
1039320002,https://ak.picdn.net/shutterstock/videos/1039320002/preview/stock-footage-off-shore-coastal-wind-farm-near-aberdeen-during-a-calm-sunny-october-autumn-day-with-waves-people.mp4,PT00H00M14S,044851_044900,Off shore coastal wind farm near aberdeen during a calm sunny october/autumn day with waves/people and sand in scotland.
589102,https://ak.picdn.net/shutterstock/videos/589102/preview/stock-footage-golden-gate-bridge-view-from-the-shoreline-long-shot-with-beach.mp4,PT00H00M25S,189051_189100,Golden gate bridge view from the shoreline long shot with beach
15821686,https://ak.picdn.net/shutterstock/videos/15821686/preview/stock-footage-flying-through-wormholes-in-space-abstract-background.mp4,PT00H00M21S,143251_143300,Flying through wormholes in space. abstract background.
1018982548,https://ak.picdn.net/shutterstock/videos/1018982548/preview/stock-footage-russian-metal-rubles-in-a-plastic-easter-egg.mp4,PT00H00M08S,192551_192600,Russian metal rubles in a plastic easter egg
1041775393,https://ak.picdn.net/shutterstock/videos/1041775393/preview/stock-footage-areal-shots-of-tatra-mountains-in-slovakia-during-summer.mp4,PT00H00M08S,066201_066250,Areal shots of tatra mountains in slovakia during summer
1039759985,https://ak.picdn.net/shutterstock/videos/1039759985/preview/stock-footage-colorful-jungle-waterfall-creating-natural-pools-water-splashing-with-strong-winds-some-rocks-and.mp4,PT00H00M08S,170751_170800,"Colorful jungle waterfall creating natural pools, water splashing with strong winds, some rocks and leaves in the middle of the vegetation."
32823496,https://ak.picdn.net/shutterstock/videos/32823496/preview/stock-footage-zrenjanin-serbia-nd-august-forensic-examines-a-pistol-with-a-magnifying-glass-k-video.mp4,PT00H00M09S,095001_095050,"Zrenjanin, serbia 2nd august 2017: forensic examines a pistol with a magnifying glass, 4 k video clip"
23640547,https://ak.picdn.net/shutterstock/videos/23640547/preview/stock-footage-ride-from-a-boat-and-hill-in-philippines-wave-of-pacific-ocean-near-the-sandy-beach-concept-of.mp4,PT00H00M13S,182851_182900,"Ride  from a boat and hill in  philippines   wave of pacific ocean near the sandy beach concept of relax
"
1065126253,https://ak.picdn.net/shutterstock/videos/1065126253/preview/stock-footage-a-man-cleaning-his-hands.mp4,PT00H00M23S,042751_042800,A man cleaning his hands
21148987,https://ak.picdn.net/shutterstock/videos/21148987/preview/stock-footage-portrait-of-sexy-caucasian-woman-with-long-curl-brown-hair-girl-flirts-woman-with-beautiful.mp4,PT00H00M14S,058901_058950,"Portrait of sexy caucasian woman with long curl brown hair, girl flirts, woman with beautiful piercings"
1033259528,https://ak.picdn.net/shutterstock/videos/1033259528/preview/stock-footage-waves-and-rocks-at-algar-seco-in-the-algarve.mp4,PT00H00M30S,099201_099250,Waves and rocks at algar seco in the algarve
1016493484,https://ak.picdn.net/shutterstock/videos/1016493484/preview/stock-footage-video-showing-a-boat-anchored-near-the-coast-and-a-house-with-abundant-vegetation.mp4,PT00H00M26S,036401_036450,Video showing a boat anchored near the coast and a house with abundant vegetation
1007273515,https://ak.picdn.net/shutterstock/videos/1007273515/preview/stock-footage--year-boy-drink-hot-tea-in-the-winter-forest.mp4,PT00H00M20S,178251_178300,5 year boy drink hot tea in the winter forest
1024467980,https://ak.picdn.net/shutterstock/videos/1024467980/preview/stock-footage-young-woman-having-video-chat-using-smartphone-at-home-chatting-to-friend-showing-off-hairstyle.mp4,PT00H00M24S,195201_195250,Young woman having video chat using smartphone at home chatting to friend showing off hairstyle sharing lifestyle enjoying online communication
14348005,https://ak.picdn.net/shutterstock/videos/14348005/preview/stock-footage-autumnal-maple-leaves.mp4,PT00H00M18S,140501_140550,Autumnal maple leaves
1036202933,https://ak.picdn.net/shutterstock/videos/1036202933/preview/stock-footage-day-pov-driving-on-bqe-with-manhattan-skyline-in-bg.mp4,PT00H00M54S,004851_004900,Day pov driving on bqe with manhattan skyline in bg
1051174903,https://ak.picdn.net/shutterstock/videos/1051174903/preview/stock-footage-car-headlight-flashing-close-up.mp4,PT00H00M17S,058501_058550,Car headlight flashing close up
1030756370,https://ak.picdn.net/shutterstock/videos/1030756370/preview/stock-footage-aerial-shot-of-a-tropical-beach-at-sunset.mp4,PT00H00M21S,101201_101250,Aerial shot of a tropical beach at sunset
2348612,https://ak.picdn.net/shutterstock/videos/2348612/preview/stock-footage-a-camera-placed-underwater-in-a-swimming-pool-filming-the-sky-and-palm-trees-the-water-makes-an.mp4,PT00H00M32S,046651_046700,"A camera placed underwater in a swimming pool, filming the sky and palm trees. the water makes an unusual effect"
1029098183,https://ak.picdn.net/shutterstock/videos/1029098183/preview/stock-footage--swinging-reed-grass-in-the-wind-with-blue-sky-k.mp4,PT00H00M15S,008201_008250,    swinging reed grass in the wind with blue sky 4k 
1047438988,https://ak.picdn.net/shutterstock/videos/1047438988/preview/stock-footage-asian-woman-exercise-practicing-yoga-in-home-meditation-flexible-balance-ardha-matsyendrasana-pose.mp4,PT00H00M19S,035251_035300,"Asian woman exercise practicing yoga in home meditation flexible balance,ardha matsyendrasana pose with namaste,healthy active lifestyle concept"
8396407,https://ak.picdn.net/shutterstock/videos/8396407/preview/stock-footage-defocused-christmas-led-light-flashing.mp4,PT00H00M19S,172751_172800,Defocused christmas led light flashing
1014628508,https://ak.picdn.net/shutterstock/videos/1014628508/preview/stock-footage-rolled-oats-grains-close-up-rotation-oat-flakes-background-macro-top-view.mp4,PT00H00M20S,085351_085400,"Rolled oats grains close up. rotation oat flakes background, macro, top view"
1029287564,https://ak.picdn.net/shutterstock/videos/1029287564/preview/stock-footage-a-musician-playing-a-bass-guitar-by-a-fireplace.mp4,PT00H00M14S,004501_004550,A musician playing a bass guitar by a fireplace
19478884,https://ak.picdn.net/shutterstock/videos/19478884/preview/stock-footage--k-closeup-of-cervantes-institute-building-facade-in-madrid-by-day.mp4,PT00H00M14S,086701_086750,4k closeup of cervantes institute building facade in madrid by day
1033315619,https://ak.picdn.net/shutterstock/videos/1033315619/preview/stock-footage-female-robot-holding-a-globe-in-her-hands.mp4,PT00H00M08S,192301_192350,Female robot holding a globe in her hands 
1006841530,https://ak.picdn.net/shutterstock/videos/1006841530/preview/stock-footage-hipster-girl-giving-rock-and-roll-sign-in-green-studio-shot-on-red-cameras.mp4,PT00H00M22S,046301_046350,Hipster girl giving rock and roll sign in green studio. shot on red cameras
10864781,https://ak.picdn.net/shutterstock/videos/10864781/preview/stock-footage-a-woman-sits-on-a-sun-lounger-on-a-pier-on-the-sea-shore.mp4,PT00H00M07S,003701_003750,A woman sits on a sun lounger on a pier on the sea shore
1029168707,https://ak.picdn.net/shutterstock/videos/1029168707/preview/stock-footage-cute-little-baby-play-ball-at-playground.mp4,PT00H00M17S,104801_104850,Cute little baby play ball at playground
1041843781,https://ak.picdn.net/shutterstock/videos/1041843781/preview/stock-footage-world-aids-day-december-awareness-red-ribbon-symbol-animation-k-video-translation-aralik.mp4,PT00H00M06S,092251_092300,"World aids day, december 1. awareness red ribbon symbol. animation 4k video. translation: 1 aralik aids günü, kirmizi kurdele."
19864150,https://ak.picdn.net/shutterstock/videos/19864150/preview/stock-footage-florida-a-kid-is-seen-diving-in-water-in-a-outdoor-pool.mp4,PT00H00M05S,188801_188850,Florida 1966: a kid is seen diving in water in a outdoor pool
1034337185,https://ak.picdn.net/shutterstock/videos/1034337185/preview/stock-footage-chicago-illinois-united-states-july-night-view-of-chicago-riverwalk.mp4,PT00H00M10S,174651_174700,"Chicago, illinois, united states - july 01, 2019: night view of chicago riverwalk "
9846680,https://ak.picdn.net/shutterstock/videos/9846680/preview/stock-footage-dog-running-from-owner.mp4,PT00H00M08S,144201_144250,Dog running from owner
28873366,https://ak.picdn.net/shutterstock/videos/28873366/preview/stock-footage-pretty-brunette-relaxing-under-sunlights-near-the-window.mp4,PT00H00M10S,193501_193550,Pretty brunette relaxing under sunlights near the window
1041665413,https://ak.picdn.net/shutterstock/videos/1041665413/preview/stock-footage-timelapse-modern-large-soochow-buildings-with-gardens-on-roof-surrounded-by-roads-and-green-trees.mp4,PT00H00M07S,016851_016900,Timelapse modern large soochow buildings with gardens on roof surrounded by roads and green trees in southeastern jiangsu province of east china on sunny day
1039245053,https://ak.picdn.net/shutterstock/videos/1039245053/preview/stock-footage-the-gathering-of-heavenly-soldiers-scenic-rock-formations-avatar-mountains-nature-park.mp4,PT00H00M15S,023251_023300,"The gathering of heavenly soldiers scenic rock formations, avatar mountains nature park, zhangjiajie, hunan province, china
"
15395815,https://ak.picdn.net/shutterstock/videos/15395815/preview/stock-footage-human-hands-with-the-phone-on-hromakey-and-green-screen.mp4,PT00H00M13S,193451_193500,Human hands with the phone on hromakey and green screen
1045139476,https://ak.picdn.net/shutterstock/videos/1045139476/preview/stock-footage-bologna-italy-october-picture-of-woman-holding-lion-s-jaw-on-tarot-card-fortune-tells.mp4,PT00H00M11S,170601_170650,"Bologna, italy - october 31, 2019: picture of woman holding lion's jaw on tarot card, fortune tells to be strong and friendly with animals"
28784353,https://ak.picdn.net/shutterstock/videos/28784353/preview/stock-footage-tonga-flag-waving-and-fluttering-on-wind-loopable-animation-green-blue-screen-alpha-matte-channel.mp4,PT00H00M30S,062751_062800,Tonga flag waving and fluttering on wind loopable animation green blue screen alpha matte channel
29971831,https://ak.picdn.net/shutterstock/videos/29971831/preview/stock-footage-hot-food-videos-suki-s-name-is-family.mp4,PT00H00M34S,192651_192700,"Hot food videos suki's name is family.
"
1043396506,https://ak.picdn.net/shutterstock/videos/1043396506/preview/stock-footage-garnish-leaves-in-cold-drinks-backwards.mp4,PT00H00M08S,132551_132600,Garnish leaves in cold drinks - backwards
1014927550,https://ak.picdn.net/shutterstock/videos/1014927550/preview/stock-footage-group-of-fans-are-watching-a-soccer-moment-on-the-tv-and-celebrating-a-goal-sitting-on-the-couch.mp4,PT00H00M21S,036101_036150,"Group of fans are watching a soccer moment on the tv and celebrating a goal, sitting on the couch in the living room. the living room is made in 3d."
1028659604,https://ak.picdn.net/shutterstock/videos/1028659604/preview/stock-footage-cute-babies-cartoon-sleeping-on-leaves-cradle-best-loop-video-background-for-lullabies-to-put-a.mp4,PT00H00M20S,115051_115100,"Cute babies cartoon sleeping on leaves cradle ,best loop video background for lullabies to put a baby go to sleep and calming , relaxing"
1056192581,https://ak.picdn.net/shutterstock/videos/1056192581/preview/stock-footage--fisherman-on-the-river-at-sunrise-time-lapse-k.mp4,PT00H00M06S,077601_077650,"
fisherman on the river at sunrise. time lapse. 4k"
31489078,https://ak.picdn.net/shutterstock/videos/31489078/preview/stock-footage-man-slices-red-pepper-with-a-knife.mp4,PT00H00M46S,128001_128050,Man slices red pepper with a knife
1027671029,https://ak.picdn.net/shutterstock/videos/1027671029/preview/stock-footage-a-group-of-white-candles-some-on-a-candelabra-lit-up-and-running-for-a-while-great-background-shot.mp4,PT00H00M17S,111851_111900,A group of white candles some on a candelabra lit up and running for a while. great background shot.
1039712240,https://ak.picdn.net/shutterstock/videos/1039712240/preview/stock-footage-reddish-empty-barbecue-grill-with-hot-and-flaming-coals-handheld-high-angle.mp4,PT00H00M10S,009251_009300,Reddish empty barbecue grill with hot and flaming coals. handheld. high angle
1016334592,https://ak.picdn.net/shutterstock/videos/1016334592/preview/stock-footage-wakeboarder-and-ski-boat-on-lake-in-the-summer-time.mp4,PT00H00M13S,075001_075050,Wakeboarder and ski boat on lake in the summer time.
1011427163,https://ak.picdn.net/shutterstock/videos/1011427163/preview/stock-footage-retro-videogame-management-text-with-computer-tv-glitch-effect.mp4,PT00H00M10S,017751_017800,Retro videogame management text with computer/tv glitch effect
11261624,https://ak.picdn.net/shutterstock/videos/11261624/preview/stock-footage-sketch-seamless-loop-landscape.mp4,PT00H00M05S,123951_124000,Sketch seamless loop - landscape
1017374266,https://ak.picdn.net/shutterstock/videos/1017374266/preview/stock-footage-woman-running-close-up-of-legs-from-rear.mp4,PT00H00M13S,136701_136750,"Woman running, close-up of legs from rear"
1057649803,https://ak.picdn.net/shutterstock/videos/1057649803/preview/stock-footage-shibuya-tokyo-japan-aug-crowd-of-people-wearing-surgical-masks-to-protect-from.mp4,PT00H00M25S,183001_183050,"Shibuya, tokyo, japan - aug 2020: crowd of people wearing surgical masks to protect from coronavirus (covid-19) at shibuya crossing. shot in day time, hot summer season. blurred slow motion."
13712381,https://ak.picdn.net/shutterstock/videos/13712381/preview/stock-footage-girl-dreaming-about-christmas-gifts.mp4,PT00H00M23S,056601_056650,Girl dreaming about christmas gifts
467299,https://ak.picdn.net/shutterstock/videos/467299/preview/stock-footage-water-sea.mp4,PT00H00M10S,051051_051100,Water & sea.
1034617523,https://ak.picdn.net/shutterstock/videos/1034617523/preview/stock-footage-ghana-west-africa-august-farmer-prunes-a-palm-tree-on-a-farmer.mp4,PT00H00M31S,146151_146200,"Ghana, west africa - august 10, 2019: farmer prunes a palm tree on a farmer. "
1058658976,https://ak.picdn.net/shutterstock/videos/1058658976/preview/stock-footage-a-cute-baby-tries-to-roll-over-on-a-gray-sofa-his-mother-s-hands-catch-him-and-insure-him.mp4,PT00H00M09S,083801_083850,"A cute baby tries to roll over on a gray sofa, his mother's hands catch him and insure him. attractive little boy 2 months old with blue eyes and dark hair in the bedroom."
7203886,https://ak.picdn.net/shutterstock/videos/7203886/preview/stock-footage-ultra-hd-k-happy-smiling-little-girl-picking-olives-in-orchard-view-child-in-nature-at.mp4,PT00H00M27S,033351_033400,"Ultra hd 4k happy smiling little girl picking olives in orchard, view child in nature at countryside, caucasian blond kid harvesting, rustic, rural background in greece"
1053192497,https://ak.picdn.net/shutterstock/videos/1053192497/preview/stock-footage-realistic-padlock-rotation-spinning-metal-in-center-on-white-backgroun-footage-lock-isolated-for.mp4,PT00H00M06S,023901_023950,"Realistic padlock rotation spinning metal in center on white backgroun. footage lock isolated for your video editing. copyspace for your text. mock up, safe personal online privacy security, render 3d"
1034740259,https://ak.picdn.net/shutterstock/videos/1034740259/preview/stock-footage-woman-in-dress-with-led-lights-in-k-slow-motion-fps.mp4,PT00H00M24S,117851_117900,"Woman in dress with led lights in 4k slow motion 60fps
"
1008718193,https://ak.picdn.net/shutterstock/videos/1008718193/preview/stock-footage-rocky-seashore-stone-desert-on-the-seashore-erosion-of-the-coastline-and-drying-up-of-the-sea.mp4,PT00H00M09S,122251_122300,"Rocky seashore, stone desert on the seashore, erosion of the coastline and drying up of the sea, abstract landscape"
17774695,https://ak.picdn.net/shutterstock/videos/17774695/preview/stock-footage-a-hand-of-a-chef-prepares-the-croissants-with-chocolate-stuffing-and-then-they-can-be-place-in-oven.mp4,PT00H00M17S,194601_194650,A hand of a chef prepares the croissants with chocolate stuffing and then they can be place in oven and serve to...
1008324283,https://ak.picdn.net/shutterstock/videos/1008324283/preview/stock-footage-great-egret-casmerodius-albus-in-the-tropics-thailand.mp4,PT00H00M30S,126501_126550,"Great egret; casmerodius albus in the tropics, thailand"
24908222,https://ak.picdn.net/shutterstock/videos/24908222/preview/stock-footage-tourist-woman-sitting-on-rooftop-lifting-arms-up-celebrating-summer-vacation-looking-out-at-view.mp4,PT00H00M08S,133101_133150,Tourist woman sitting on rooftop lifting arms up celebrating summer vacation looking out at view italian village authentic travel experience lifestyle on summer vacation in amalfi italy
1037588633,https://ak.picdn.net/shutterstock/videos/1037588633/preview/stock-footage-tired-woman-lying-in-bed-yawning-and-feeling-sleepy-meteosensitivity-migraine.mp4,PT00H00M06S,072151_072200,"Tired woman lying in bed, yawning and feeling sleepy, meteosensitivity, migraine"
18493258,https://ak.picdn.net/shutterstock/videos/18493258/preview/stock-footage-budapest-hungary-autumn-vajdahunyad-castle-in-budapest-hungary.mp4,PT00H00M11S,126951_127000,"Budapest, hungary - autumn 2015: vajdahunyad castle in budapest, hungary."
29484499,https://ak.picdn.net/shutterstock/videos/29484499/preview/stock-footage-bokeh-or-blur-candle-lighting-abstract-background-color-footage-of-some-defocused-yellow-candle.mp4,PT00H00M20S,044451_044500,Bokeh or blur candle lighting abstract background. color footage of some defocused yellow candle lighting.
7237474,https://ak.picdn.net/shutterstock/videos/7237474/preview/stock-footage-montevideo-uruguay-july-timelapse-of-nightly-traffic-passes-by-at-the-plaza-independencia-on.mp4,PT00H00M12S,137651_137700,"Montevideo, uruguay - july 28: timelapse of nightly traffic passes by at the plaza independencia on july 28, 2014 in the center of montevideo, uruguay."
19345891,https://ak.picdn.net/shutterstock/videos/19345891/preview/stock-footage-slow-motion-shot-of-ball-balancing-on-rim-before-falling-through-the-basketball-net-at-night.mp4,PT00H00M22S,141001_141050,Slow motion shot of ball balancing on rim before falling through the basketball net at night
26243579,https://ak.picdn.net/shutterstock/videos/26243579/preview/stock-footage-in-jordan-the-national-flag-in-the-wind-and-wall.mp4,PT00H00M15S,040451_040500,"In jordan the national flag in the wind and wall
"
24785936,https://ak.picdn.net/shutterstock/videos/24785936/preview/stock-footage-blooming-canola-field-rape-on-the-field-in-summer-bright-yellow-rapeseed-oil-flowering-rapeseed.mp4,PT00H00M21S,124551_124600,"Blooming canola field. rape on the field in summer. bright yellow rapeseed oil. flowering rapeseed
"
1039192187,https://ak.picdn.net/shutterstock/videos/1039192187/preview/stock-footage-a-large-number-of-high-voltage-power-lines-in-the-mountains-between-the-hills-there-is-a-high.mp4,PT00H00M15S,173701_173750,A large number of high voltage power lines in the mountains. between the hills there is a high-speed freeway with heavy traffic. the tops of the mountains in the clouds.
2053805,https://ak.picdn.net/shutterstock/videos/2053805/preview/stock-footage-timelapse-heavenly-sky-clouds.mp4,PT00H00M15S,138001_138050,Timelapse heavenly sky clouds 101
1052350837,https://ak.picdn.net/shutterstock/videos/1052350837/preview/stock-footage-meadow-full-of-daisies-closeup.mp4,PT00H00M17S,137151_137200,"Meadow full of daisies, closeup"
1057948423,https://ak.picdn.net/shutterstock/videos/1057948423/preview/stock-footage-chiken-grilled-with-fire-slow-motion-k.mp4,PT00H01M10S,023801_023850,Chiken grilled with fire slow motion 2k
1026716600,https://ak.picdn.net/shutterstock/videos/1026716600/preview/stock-footage-casual-redhead-man-celebrating-success-of-project.mp4,PT00H00M09S,142951_143000,Casual redhead man celebrating success of project
28315255,https://ak.picdn.net/shutterstock/videos/28315255/preview/stock-footage-a-young-boss-is-describing-something-to-his-employee-on-a-computer-screen.mp4,PT00H00M27S,127851_127900,A young boss is describing something to his employee on a computer screen.
24471551,https://ak.picdn.net/shutterstock/videos/24471551/preview/stock-footage-female-and-cat-lying-on-bed.mp4,PT00H00M24S,059851_059900,Female and cat lying on bed
1031238578,https://ak.picdn.net/shutterstock/videos/1031238578/preview/stock-footage--s-barcelona-spain-poble-espanyol.mp4,PT00H00M19S,030701_030750,"1960s, barcelona, spain: poble espanyol"
1011460211,https://ak.picdn.net/shutterstock/videos/1011460211/preview/stock-footage-green-leaves-along-the-fence-was-blown-away-by-the-wind.mp4,PT00H00M15S,184701_184750,Green leaves along the fence was blown away by the wind
1029371696,https://ak.picdn.net/shutterstock/videos/1029371696/preview/stock-footage-tea-bowl-candle-tea-ceremony.mp4,PT00H00M08S,054301_054350,"Tea bowl, candle, tea ceremony."
11974739,https://ak.picdn.net/shutterstock/videos/11974739/preview/stock-footage-close-up-detail-of-grass-on-a-blue-sky-summers-day.mp4,PT00H00M06S,049051_049100,Close up detail of grass on a blue sky summers day
1054400096,https://ak.picdn.net/shutterstock/videos/1054400096/preview/stock-footage-green-leaves-with-dew-drops-in-summer-on-nature.mp4,PT00H00M42S,170401_170450,Green leaves with dew drops in summer on nature
1051996564,https://ak.picdn.net/shutterstock/videos/1051996564/preview/stock-footage-world-map-hud-black-and-white-style.mp4,PT00H00M20S,024201_024250,World map hud. black and white style
20210644,https://ak.picdn.net/shutterstock/videos/20210644/preview/stock-footage-time-lapse-of-toadstool-hoodoos-in-utah-long-shot.mp4,PT00H00M19S,069601_069650,Time lapse of toadstool hoodoos in utah -long shot-
9109712,https://ak.picdn.net/shutterstock/videos/9109712/preview/stock-footage-aquarium-fish-swim-underwater-comet-goldfish-carassius-auratus.mp4,PT00H00M17S,084501_084550,"Aquarium fish swim underwater, comet goldfish carassius auratus"
1021339555,https://ak.picdn.net/shutterstock/videos/1021339555/preview/stock-footage-melbourne-australia-december-vehicles-cross-swan-street-bridge-with-aami-park-and-the.mp4,PT00H00M15S,138201_138250,"Melbourne, australia - december 2018: vehicles cross swan street bridge with aami park and the holden centre visible in the distance. a path runs alongside the yarra river."
2666243,https://ak.picdn.net/shutterstock/videos/2666243/preview/stock-footage-child-choosing-shoes-in-shoe-store-edited-sequence.mp4,PT00H00M24S,187601_187650,"Child choosing shoes in shoe store , edited sequence "
12780404,https://ak.picdn.net/shutterstock/videos/12780404/preview/stock-footage-port-dover-ontario-july-canada-day-boat-parade-in-port-dover.mp4,PT00H00M11S,060801_060850,Port dover ontario july 2013 canada day boat parade in port dover
7983880,https://ak.picdn.net/shutterstock/videos/7983880/preview/stock-footage-burma-february-temple-wat-jong-kham-from-the-lake-kyaing-tong-town-golden-triangle-burma.mp4,PT00H00M21S,142101_142150,"Burma - february 2013: temple wat jong kham from the lake, kyaing tong town golden triangle, burma, asia"
28643620,https://ak.picdn.net/shutterstock/videos/28643620/preview/stock-footage-the-sun-over-a-beautiful-beach-sea-waves-washing-the-sand-and-stones.mp4,PT00H00M31S,175851_175900,"The sun over a beautiful beach, sea waves washing the sand and stones."
11972531,https://ak.picdn.net/shutterstock/videos/11972531/preview/stock-footage-cute-young-couple-holding-kissing-in-front-of-waterfall-with-pov-selfie-stick-happy-cheerful-young.mp4,PT00H00M08S,182451_182500,Cute young couple holding kissing in front of waterfall with pov selfie stick. happy cheerful young multicultural couple on travel. lush green waterfall in hawaii. slow motion
1029829742,https://ak.picdn.net/shutterstock/videos/1029829742/preview/stock-footage-little-goat-baby-eats-the-leaves-from-the-raspberry-bushes-outdoors-in-agricultural-areas.mp4,PT00H00M10S,101251_101300,Little goat baby eats the leaves from the raspberry bushes outdoors in agricultural areas
10638695,https://ak.picdn.net/shutterstock/videos/10638695/preview/stock-footage-close-up-of-male-hand-typing-on-mobile-smart-phone-hd-x.mp4,PT00H00M16S,109451_109500,"Close up of male hand typing on mobile smart phone. hd, 1920x1080."
19506715,https://ak.picdn.net/shutterstock/videos/19506715/preview/stock-footage-empty-ski-lift-chairs-coming-up-the-side-of-a-mountain.mp4,PT00H00M19S,139901_139950,Empty ski lift chairs coming up the side of a mountain.
23844847,https://ak.picdn.net/shutterstock/videos/23844847/preview/stock-footage-preparing-fresh-vegetable-salad-slow-motion.mp4,PT00H00M23S,174401_174450,Preparing fresh vegetable salad. slow motion
