videoid,contentUrl,duration,page_dir,name
1042851121,https://ak.picdn.net/shutterstock/videos/1042851121/preview/stock-footage--s-woman-crosses-street-water-roars-in-river-men-play-tennis-kids-at-playground-water-roars.mp4,PT00H00M21S,138851_138900,1970s: woman crosses street. water roars in river. men play tennis. kids at playground. water roars in river. man mows lawn. child pulls wagon. water bursts through teton dam.
24359510,https://ak.picdn.net/shutterstock/videos/24359510/preview/stock-footage-boy-awkwardly-dives-into-the-pool.mp4,PT00H00M07S,122351_122400,Boy awkwardly dives into the pool
1060434502,https://ak.picdn.net/shutterstock/videos/1060434502/preview/stock-footage-driving-on-road-with-falling-snow-scenic-view-of-snowy-icy-mountain-road-with-pine-trees-danger.mp4,PT00H00M12S,176151_176200,"Driving on road with falling snow. scenic view of snowy icy mountain road with pine trees. danger travel conditions in winter, 4k dci"
8657947,https://ak.picdn.net/shutterstock/videos/8657947/preview/stock-footage-icebergs-global-warming-melting-ice-natural-environment-ecotourism-travel-no-people-disko-bay.mp4,PT00H00M23S,052851_052900,Icebergs global warming melting ice natural environment ecotourism travel no people disko bay greenland denmark red epic
1060703308,https://ak.picdn.net/shutterstock/videos/1060703308/preview/stock-footage--d-rendering-of-modern-living-room-and-dining-room-with-television-set-and-parquet-floor.mp4,PT00H00M10S,006851_006900,3d rendering of modern living room and dining room with  television set and parquet floor
1022182294,https://ak.picdn.net/shutterstock/videos/1022182294/preview/stock-footage-aerial-shot-of-flying-above-paracas-town-at-day-time.mp4,PT00H00M17S,066151_066200,Aerial shot of flying above paracas town at day time
1059707090,https://ak.picdn.net/shutterstock/videos/1059707090/preview/stock-footage-the-old-gray-haired-grandfather-combs-his-hair-and-looks-sadly-at-the-camera.mp4,PT00H00M15S,173751_173800,The old gray-haired grandfather combs his hair and looks sadly at the camera
2109353,https://ak.picdn.net/shutterstock/videos/2109353/preview/stock-footage-outdoor-transformers-at-an-electropower-station.mp4,PT00H00M25S,029451_029500,Outdoor transformers at an electropower station
1008349150,https://ak.picdn.net/shutterstock/videos/1008349150/preview/stock-footage-birds-of-ukraine-swans-gulls-and-ducks-wintering-waterfowl-in-the-black-sea.mp4,PT00H00M24S,119101_119150,"Birds of ukraine. swans, gulls and ducks - wintering waterfowl in the black sea"
1052569745,https://ak.picdn.net/shutterstock/videos/1052569745/preview/stock-footage-a-young-woman-wearing-a-protective-mask-at-a-home-goods-store-the-girl-chooses-a-carpet-in-her.mp4,PT00H00M13S,100101_100150,A young woman wearing a protective mask at a home goods store. the girl chooses a carpet in her house.
1062065215,https://ak.picdn.net/shutterstock/videos/1062065215/preview/stock-footage-circa-s-an-electric-company-installs-power-lines-to-an-outpost-rural-farm-in-america.mp4,PT00H00M45S,079351_079400,"Circa 1950s - an electric company installs power lines to an outpost rural farm in 1951, america."
1012955363,https://ak.picdn.net/shutterstock/videos/1012955363/preview/stock-footage-two-people-walking-on-a-huge-sand-dune-at-sunset-smooth-panning-down-and-forward-motion-shot.mp4,PT00H00M07S,011051_011100,Two people walking on a huge sand dune at sunset. smooth panning down and forward motion shot.
8277520,https://ak.picdn.net/shutterstock/videos/8277520/preview/stock-footage-townhall-building-in-the-bosnian-capital-city.mp4,PT00H00M08S,064801_064850,Townhall building in the bosnian capital city.
1018207978,https://ak.picdn.net/shutterstock/videos/1018207978/preview/stock-footage-two-fresh-fried-eggs-with-crunchy-crisp-bacon-served-on-rustic-plate-fork-and-knife-on-sides-top.mp4,PT00H00M28S,119801_119850,Two fresh fried eggs with crunchy crisp bacon served on rustic plate. fork and knife on sides. top view.
100162,https://ak.picdn.net/shutterstock/videos/100162/preview/stock-footage-video-of-water-tower-and-us-flag-randolph-afb-san-antonio-texas-taj-mahal-due-to-it-s-design.mp4,PT00H00M20S,137451_137500,"Video of water tower and us flag randolph afb, san antonio, texas. taj mahal due to it's design. cloudy and windy day with flag waving and clouds moving.  grass level."
1012192988,https://ak.picdn.net/shutterstock/videos/1012192988/preview/stock-footage-outdoor-swimming-pool.mp4,PT00H00M15S,112251_112300,"Outdoor swimming pool
"
1014314078,https://ak.picdn.net/shutterstock/videos/1014314078/preview/stock-footage-algarve-seashore-south-of-portugal.mp4,PT00H00M25S,107151_107200,"Algarve seashore, south of portugal"
22566670,https://ak.picdn.net/shutterstock/videos/22566670/preview/stock-footage-close-up-shot-of-nepal-singing-bowl-in-woman-s-hand-meditation-and-relax-concept.mp4,PT00H00M27S,060951_061000,Close up shot of nepal singing bowl in woman's hand. meditation and relax concept
9410138,https://ak.picdn.net/shutterstock/videos/9410138/preview/stock-footage-boy-seating-on-the-lawn-and-playing-bongos-slow-motion-raw-footage-of-a-boy-seating-on-the-small.mp4,PT00H00M12S,112301_112350,Boy seating on the lawn and playing bongos . slow motion raw footage of a boy seating on the small wooden bench and playing bongos on a lawn near the lake on a sunny day.
1015820623,https://ak.picdn.net/shutterstock/videos/1015820623/preview/stock-footage-close-up-flowing-bubble-beer-drink-in-glass-background.mp4,PT00H00M13S,183901_183950,Close up flowing bubble beer drink in glass background
1013636402,https://ak.picdn.net/shutterstock/videos/1013636402/preview/stock-footage-man-on-the-ground-crawling-away-from-the-camera-trying-to-escape-horror-style-shot.mp4,PT00H00M10S,182901_182950,Man on the ground crawling away from the camera trying to escape. horror style shot.
15487813,https://ak.picdn.net/shutterstock/videos/15487813/preview/stock-footage-pass-through-cherry-blossoms.mp4,PT00H00M10S,083001_083050,Pass through cherry blossoms
1011063857,https://ak.picdn.net/shutterstock/videos/1011063857/preview/stock-footage-a-view-of-the-tops-of-the-norwegian-mountains-covered-with-white-snow-the-tops-of-mountains.mp4,PT00H00M07S,125951_126000,A view of the tops of the norwegian mountains covered with white snow. .the tops of mountains covered with snow.
8491288,https://ak.picdn.net/shutterstock/videos/8491288/preview/stock-footage-nazi-holding-an-mp-gun.mp4,PT00H00M09S,187901_187950,Nazi holding an mp40 gun
1052389015,https://ak.picdn.net/shutterstock/videos/1052389015/preview/stock-footage-animation-of-words-be-safe-stay-at-home-flashing-over-caucasian-boy-wearing-cape-looking-at-the.mp4,PT00H00M11S,125101_125150,"Animation of words be safe stay at home flashing over caucasian boy wearing cape, looking at the camera. social distancing self isolation in quarantine lockdown digital composite"
1035241559,https://ak.picdn.net/shutterstock/videos/1035241559/preview/stock-footage-an-extremely-bright-handheld-shot-of-curtains-in-a-room-partially-blocking-the-sunlight.mp4,PT00H00M14S,019001_019050,"An extremely bright handheld shot of curtains in a room, partially blocking the sunlight."
10243721,https://ak.picdn.net/shutterstock/videos/10243721/preview/stock-footage-the-movement-of-elevators-in-the-building-of-a-moscow-city.mp4,PT00H00M30S,051951_052000,"The movement of elevators in the building of a moscow city
"
19637587,https://ak.picdn.net/shutterstock/videos/19637587/preview/stock-footage-attractive-young-hipster-girl-take-a-picture-of-barcelona-landmarks-on-retro-film-camera-urban.mp4,PT00H00M18S,023551_023600,"Attractive young hipster girl take a picture of barcelona landmarks on retro film camera, urban scene, lifestyle, slow motion, tourism concept, flare light"
23769181,https://ak.picdn.net/shutterstock/videos/23769181/preview/stock-footage-aerial-shot-from-rocks-on-shore-coastline-over-wast-seawaters-in-summertime-on-sunny-day.mp4,PT00H00M18S,177551_177600,Aerial shot from rocks on shore coastline over wast seawaters in summertime on sunny day
1022533477,https://ak.picdn.net/shutterstock/videos/1022533477/preview/stock-footage-ice-skating-teenagers-legs-on-a-lake-against-setting-sun-slow-motion.mp4,PT00H00M18S,012451_012500,Ice skating teenagers legs on a lake against setting sun - slow motion
1027193813,https://ak.picdn.net/shutterstock/videos/1027193813/preview/stock-footage--asian-cute-boy-read-books-while-waiting-for-their-mothers-to-buy-drinks-in-the-cafe.mp4,PT00H00M14S,109851_109900,"
asian cute boy read books while waiting for their mothers to buy drinks in the cafe."
1058572471,https://ak.picdn.net/shutterstock/videos/1058572471/preview/stock-footage-yogyakarta-indonesia-september-time-lapse-of-km-jogja-one-of-the-favorite-spots-in.mp4,PT00H00M09S,047301_047350,"Yogyakarta, indonesia - september 5, 2020: time lapse of 0km jogja, one of the favorite spots in yogyakarta."
1062001024,https://ak.picdn.net/shutterstock/videos/1062001024/preview/stock-footage-kids-papercraft-making-paper-bugs-out-of-the-empty-toilet-paper-rolls-and-construction-paper.mp4,PT00H00M37S,133751_133800,Kids papercraft. making paper bugs out of the empty toilet paper rolls and construction paper.
22947556,https://ak.picdn.net/shutterstock/videos/22947556/preview/stock-footage-long-shot-of-an-amused-handsome-man-looking-around-all-shot-on-a-green-screen-background-shot-on.mp4,PT00H00M10S,048301_048350,Long shot of an amused handsome man looking around. all shot on a green screen background. shot on red cinema camera 4k (uhd).
1029017003,https://ak.picdn.net/shutterstock/videos/1029017003/preview/stock-footage-brazier-with-blown-coals-in-slow-motion.mp4,PT00H00M20S,180951_181000,Brazier with blown coals in slow motion
1300633,https://ak.picdn.net/shutterstock/videos/1300633/preview/stock-footage-hot-air-balloons-flying-at-sunset.mp4,PT00H00M20S,051701_051750,Hot air balloons flying at sunset
10766255,https://ak.picdn.net/shutterstock/videos/10766255/preview/stock-footage-afghanistan-kabul-american-soldier-shows-how-to-use-a-rifle-gun.mp4,PT00H00M09S,003001_003050,Afghanistan - kabul 2011 - american soldier shows how to use a rifle gun
1062686725,https://ak.picdn.net/shutterstock/videos/1062686725/preview/stock-footage-aerial-panorama-above-houses-rooftops-in-a-paris-timelapse-evening-view-with-les-invalides-bebore.mp4,PT00H00M08S,062901_062950,Aerial panorama above houses rooftops in a paris timelapse. evening view with les invalides bebore sunset
1012595543,https://ak.picdn.net/shutterstock/videos/1012595543/preview/stock-footage-arctic-stream-at-sunset.mp4,PT00H00M31S,024951_025000,Arctic stream at sunset
1013078186,https://ak.picdn.net/shutterstock/videos/1013078186/preview/stock-footage-wild-flowers-against-the-blue-sea-rack-focus.mp4,PT00H00M17S,129201_129250,Wild flowers against the blue sea. rack focus.
1036729478,https://ak.picdn.net/shutterstock/videos/1036729478/preview/stock-footage-aerial-view-of-the-city-forbach-in-germany-on-a-sunny-day-in-summer-ascending-beside-the-city.mp4,PT00H00M12S,057751_057800,"Aerial view of the city forbach in germany, on a sunny day in summer. ascending beside the city."
1038753062,https://ak.picdn.net/shutterstock/videos/1038753062/preview/stock-footage-the-famous-model-village-in-bourton-on-the-water-cotswolds-gloucestershire-england-th-of.mp4,PT00H00M27S,099251_099300,"The famous model village in bourton on the water, cotswolds gloucestershire, england. 26th of august 2019"
23763658,https://ak.picdn.net/shutterstock/videos/23763658/preview/stock-footage-handsome-bearded-florist-with-tablet-computer-at-workplace-in-refrigerator-in-flower-shop.mp4,PT00H00M18S,036151_036200,Handsome bearded florist with tablet computer at workplace in refrigerator in flower shop
21251398,https://ak.picdn.net/shutterstock/videos/21251398/preview/stock-footage-hawksbill-turtle-feeding-on-algeas-from-the-rock-komodo-indonesia.mp4,PT00H00M31S,087601_087650,"Hawksbill turtle feeding on algeas from the rock. komodo indonesia
"
1017342181,https://ak.picdn.net/shutterstock/videos/1017342181/preview/stock-footage-aerial-footage-taken-in-the-apalachicola-bay-area-in-florida.mp4,PT00H00M11S,123751_123800,Aerial footage taken in the apalachicola bay area in florida.
1036454078,https://ak.picdn.net/shutterstock/videos/1036454078/preview/stock-footage-sunset-seen-from-lake-des-cheserys-chamonix-mont-blanc-catching-light-at-sunset-with-perfect.mp4,PT00H00M16S,175551_175600,"Sunset seen from lake des cheserys, chamonix. mont blanc catching light at sunset with perfect reflection"
29989390,https://ak.picdn.net/shutterstock/videos/29989390/preview/stock-footage-warehouse-of-cheese-at-milk-products-factory.mp4,PT00H00M15S,096301_096350,Warehouse of cheese at milk products factory.
1033403003,https://ak.picdn.net/shutterstock/videos/1033403003/preview/stock-footage-fantastic-boundless-sea-waves-roll-on-coastline-reflecting-bright-setting-sun-light-from-behind.mp4,PT00H00M10S,064501_064550,Fantastic boundless sea waves roll on coastline reflecting bright setting sun light from behind dark clouds slow motion
1023561730,https://ak.picdn.net/shutterstock/videos/1023561730/preview/stock-footage-samara-russia-january-cars-drive-on-the-night-winter-road.mp4,PT00H00M18S,170751_170800,"Samara, russia - january 29, 2019: cars drive on the night winter road"
1031689268,https://ak.picdn.net/shutterstock/videos/1031689268/preview/stock-footage--big-sur-aerial-flying-over-the-water-reveling-cliffs-and-mountains-and-clouds.mp4,PT00H00M10S,042701_042750,310 big sur aerial flying over the water reveling cliffs and mountains and clouds
16350868,https://ak.picdn.net/shutterstock/videos/16350868/preview/stock-footage-high-quality-motion-animation-representing-swirling-dark-liquids-and-shadows.mp4,PT00H00M15S,062401_062450,High quality motion animation representing swirling dark liquids and shadows.
1015335007,https://ak.picdn.net/shutterstock/videos/1015335007/preview/stock-footage-fast-glitch-interference-screen-background-for-logo-animation-new-quality-digital-twitch-technology.mp4,PT00H00M10S,007051_007100,Fast glitch interference screen background for logo animation new quality digital twitch technology colorful video footage
26415530,https://ak.picdn.net/shutterstock/videos/26415530/preview/stock-footage-seamless-loop-pattern-with-violet-circle-swirl-ornament-elements-every-sheet-of-this-clip-is-a.mp4,PT00H00M15S,060601_060650,Seamless loop pattern with violet circle swirl ornament elements. every sheet of this clip is a seamless pattern
1009680218,https://ak.picdn.net/shutterstock/videos/1009680218/preview/stock-footage-aerial-view-of-calabria-coast-with-cliff-near-the-deep-blue-mediterranean-sea-at-sunset-waves.mp4,PT00H00M36S,138451_138500,Aerial view of calabria coast with cliff near the deep blue mediterranean sea at sunset. waves crashing on the rocks and the mountain.
11525756,https://ak.picdn.net/shutterstock/videos/11525756/preview/stock-footage-payson-utah-mar-aerial-temple-construction-payson-utah-lds-mormon-aerial-airborne-view-of.mp4,PT00H00M26S,111151_111200,"Payson, utah - mar 2014: aerial temple construction payson utah lds mormon. aerial airborne view of the mormon temple in payson utah. the church of jesus christ of latter-day saints or lds religion."
20612914,https://ak.picdn.net/shutterstock/videos/20612914/preview/stock-footage-yellow-and-green-leaves-of-wild-grapes-growing-in-the-cracks-between-the-stones-colorful-leaves-of.mp4,PT00H00M11S,142601_142650,Yellow and green leaves of wild grapes growing in the cracks between the stones. colorful leaves of wild grape as fall season background 
27427774,https://ak.picdn.net/shutterstock/videos/27427774/preview/stock-footage-young-man-kite-surfing-extreme-kite-boarding-in-slow-motion-summer-fun-action-sports-happiness.mp4,PT00H00M10S,181001_181050,Young man kite surfing. extreme kite boarding in slow motion. summer fun action sports. happiness in nature. shot on red
1008120445,https://ak.picdn.net/shutterstock/videos/1008120445/preview/stock-footage-pile-of-sugar-on-black-background-ideal-for-cooking-projects-or-health-and-addiction-issues.mp4,PT00H00M30S,021601_021650,Pile of sugar on black background. ideal for cooking projects or health and addiction issues.
1317151,https://ak.picdn.net/shutterstock/videos/1317151/preview/stock-footage-pears-hanging-on-a-branch.mp4,PT00H00M15S,073101_073150,Pears hanging on a branch
34618066,https://ak.picdn.net/shutterstock/videos/34618066/preview/stock-footage-casual-young-male-pedestrian-s-feet-crossing-city-street-traffic-rules-pov.mp4,PT00H00M07S,140001_140050,"Casual young male pedestrian's feet crossing city street, traffic rules, pov"
3457151,https://ak.picdn.net/shutterstock/videos/3457151/preview/stock-footage-aerial-of-whale-surfacing.mp4,PT00H00M45S,107351_107400,Aerial of whale surfacing
1014936307,https://ak.picdn.net/shutterstock/videos/1014936307/preview/stock-footage-albano-laziale-italy-circa-august-museo-di-villa-ferrajoli-in-beautiful-town-of-albano.mp4,PT00H00M07S,037151_037200,"Albano laziale, italy - circa august 2018: museo di villa ferrajoli in beautiful town of albano laziale timelapse hyperlapse, italy. historical museum inside with many exhibits"
1009373471,https://ak.picdn.net/shutterstock/videos/1009373471/preview/stock-footage-a-young-woman-in-a-winter-jacket-plays-with-a-german-shepherd-in-the-snow-a-cute-girl-is-having.mp4,PT00H00M26S,179701_179750,A young woman in a winter jacket plays with a german shepherd in the snow. a cute girl is having fun with a dog outdoors.
1041325393,https://ak.picdn.net/shutterstock/videos/1041325393/preview/stock-footage-new-delhi-ncr-india-th-february-shot-of-a-indian-groom-and-bride-smiling-and-looking-at-each.mp4,PT00H00M07S,142901_142950,"New delhi,ncr,india-9th february,2019: shot of a indian groom and bride smiling and looking at each other for posing in camera at their indian wedding in new delhi,india"
1051808905,https://ak.picdn.net/shutterstock/videos/1051808905/preview/stock-footage-black-oil-drums-crude-oil-barrels-isolated-on-white-background-petroleum-energy-price-oil-down.mp4,PT00H00M20S,184651_184700,"Black oil drums, crude oil barrels isolated on white background, petroleum energy price oil down. crisis concept rendering oil tank"
13488005,https://ak.picdn.net/shutterstock/videos/13488005/preview/stock-footage-movement-of-clouds-over-the-beloyarsk-reservoir-beloyarsk-sverdlovsk-region-russia-full-hd.mp4,PT00H00M13S,134351_134400,"Movement of clouds over the beloyarsk reservoir. beloyarsk, sverdlovsk region, russia, full hd
"
1052782130,https://ak.picdn.net/shutterstock/videos/1052782130/preview/stock-footage-flight-over-farmlands-on-a-sunny-day-aerial-photography-by-drone.mp4,PT00H00M13S,038051_038100,Flight over farmlands on a sunny day - aerial photography by drone
1023467776,https://ak.picdn.net/shutterstock/videos/1023467776/preview/stock-footage-polar-vortex-severe-cold-creates-beautiful-ice-formations-in-canada.mp4,PT00H00M30S,034851_034900,Polar vortex severe cold creates beautiful ice formations in canada
1830545,https://ak.picdn.net/shutterstock/videos/1830545/preview/stock-footage-onions-are-fried-with-fat-a-close-up.mp4,PT00H00M16S,176701_176750,Onions are fried with fat a close up.
486442,https://ak.picdn.net/shutterstock/videos/486442/preview/stock-footage-heart-simple-cgi-image-background.mp4,PT00H00M10S,092401_092450,Heart simple cgi image background
1032285770,https://ak.picdn.net/shutterstock/videos/1032285770/preview/stock-footage-slow-mo-hd-video-of-beautiful-glendalough-fall-wicklow-mountains-ireland-among-mysterious-forest.mp4,PT00H00M30S,139501_139550,"Slow mo hd video of  beautiful glendalough fall, wicklow mountains, ireland among mysterious forest and emerald greens"
1034920547,https://ak.picdn.net/shutterstock/videos/1034920547/preview/stock-footage-construction-workers-on-top-of-building-with-crane-aerial-drone-footage-over-construction-site-with.mp4,PT00H00M06S,110851_110900,"Construction workers on top of building with crane aerial
drone footage over construction site with crane in the city
"
31361839,https://ak.picdn.net/shutterstock/videos/31361839/preview/stock-footage-senior-woman-on-a-shopping-day-looking-at-shop-windows.mp4,PT00H00M17S,066851_066900,Senior woman on a shopping day looking at shop windows
1046723833,https://ak.picdn.net/shutterstock/videos/1046723833/preview/stock-footage-vancouver-bc-canada-a-close-up-view-of-a-body-of-water-buildings-and-a-bridge.mp4,PT00H00M05S,117001_117050,"Vancouver bc canada-1968: a close up view of a body of water, buildings, and a bridge"
1030940699,https://ak.picdn.net/shutterstock/videos/1030940699/preview/stock-footage-paris-france-june-basilica-of-the-sacre-coeur-also-known-as-the-sacred-heart-the-famous.mp4,PT00H00M12S,147701_147750,"Paris, france - june 2019 : basilica of the sacre coeur, also known as the sacred heart, the famous church in montmartre in paris france, time lapse with tourists climbing the stairs of the hill"
1063494787,https://ak.picdn.net/shutterstock/videos/1063494787/preview/stock-footage-young-loving-couple-doing-live-stream-for-social-media-under-snowfall-in-forest-talking-on-video.mp4,PT00H00M32S,005901_005950,Young loving couple doing live stream for social media under snowfall in forest. talking on video chat. christmas vacation. portrait. close up. slow motion
1057010471,https://ak.picdn.net/shutterstock/videos/1057010471/preview/stock-footage-close-up-of-kid-s-hands-taking-a-delicious-bun-from-a-basket-during-a-picnic-summer-and-weekend.mp4,PT00H00M27S,081051_081100,Close-up of kid's hands taking a delicious bun from a basket during a picnic. summer and weekend concept.
1036095920,https://ak.picdn.net/shutterstock/videos/1036095920/preview/stock-footage-crucifix-with-jesus-catholic-religion-concept.mp4,PT00H00M08S,179301_179350,Crucifix with jesus catholic religion concept
1024342604,https://ak.picdn.net/shutterstock/videos/1024342604/preview/stock-footage-man-spraying-liquid-and-wiping-leather-sofa.mp4,PT00H00M44S,041451_041500,Man spraying liquid and wiping leather sofa
1032890294,https://ak.picdn.net/shutterstock/videos/1032890294/preview/stock-footage-a-lot-of-black-silhouettes-of-caterpillars-crawling-around-the-edge-of-the-screen-seamless-loop-d.mp4,PT00H00M11S,109301_109350,A lot of black silhouettes of caterpillars crawling around the edge of the screen. seamless loop 3d animation on white background.
1062287488,https://ak.picdn.net/shutterstock/videos/1062287488/preview/stock-footage-flight-over-mexico-city-downtown-with-very-high-pollution-levels.mp4,PT00H00M15S,108151_108200,Flight over mexico city downtown with very high pollution levels.
28170385,https://ak.picdn.net/shutterstock/videos/28170385/preview/stock-footage-hematoma-animated-word-cloud-text-design-animation.mp4,PT00H00M15S,003851_003900,"Hematoma animated word cloud, text design animation."
1027308803,https://ak.picdn.net/shutterstock/videos/1027308803/preview/stock-footage-night-hyperlapse-of-london-dlr.mp4,PT00H00M59S,052901_052950,Night hyperlapse of london dlr 
29222749,https://ak.picdn.net/shutterstock/videos/29222749/preview/stock-footage-cosmic-crystal-glass-audio-bars-glowing-version-vj-loop-animated-motion-background-seamless.mp4,PT00H00M10S,019351_019400,Cosmic crystal glass audio bars glowing version 02 vj loop animated motion background seamless looping video backdrop pink magenta purple violet
1033106432,https://ak.picdn.net/shutterstock/videos/1033106432/preview/stock-footage-aerial-drone-footage-view-morning-clouds-over-village-carpathian-mountains-ukraine-europe.mp4,PT00H00M05S,030501_030550,"Aerial drone footage view: morning clouds over village. carpathian mountains, ukraine, europe. majestic landscape. beauty."
1018881598,https://ak.picdn.net/shutterstock/videos/1018881598/preview/stock-footage-closeup-of-young-female-hands-making-red-ribbon-bow-on-green-paper-gift-box.mp4,PT00H00M21S,092851_092900,Closeup of young female hands making red ribbon bow on green paper gift box
1041764737,https://ak.picdn.net/shutterstock/videos/1041764737/preview/stock-footage-ocean-waves-bringing-large-jellyfish-onto-the-rocky-beach-in-slow-motion.mp4,PT00H00M18S,020751_020800,Ocean waves bringing large jellyfish onto the rocky beach in slow motion
1033272428,https://ak.picdn.net/shutterstock/videos/1033272428/preview/stock-footage-close-view-of-a-moving-bridge-crane.mp4,PT00H00M12S,199751_199800,Close view of a moving bridge crane
3138457,https://ak.picdn.net/shutterstock/videos/3138457/preview/stock-footage-network-server-machine.mp4,PT00H00M22S,036401_036450,Network server machine.
8198086,https://ak.picdn.net/shutterstock/videos/8198086/preview/stock-footage-dolly-shot-of-woman-drinking-glass-of-orange-juice.mp4,PT00H00M12S,136351_136400,Dolly shot of woman drinking glass of orange juice.
1050829537,https://ak.picdn.net/shutterstock/videos/1050829537/preview/stock-footage-spring-tree-with-pink-flowers-almond-blossom-on-branch-with-movement-at-wind-on-blue-sky-with.mp4,PT00H00M15S,189451_189500,"Spring tree with pink flowers almond blossom on branch with movement at wind, on blue sky with daily light with"
5923733,https://ak.picdn.net/shutterstock/videos/5923733/preview/stock-footage-beautiful-blue-wild-cornflowers-bluebottle-bluet-flowers-blooming-on-summer-meadow-move-in-wind.mp4,PT00H00M10S,184401_184450,Beautiful blue wild cornflowers bluebottle bluet flowers blooming on summer meadow move in wind.
18758000,https://ak.picdn.net/shutterstock/videos/18758000/preview/stock-footage-sad-and-depressed-home-buyers.mp4,PT00H00M19S,108751_108800,Sad and depressed home buyers
21012592,https://ak.picdn.net/shutterstock/videos/21012592/preview/stock-footage-businessman-takes-the-money-from-the-safe-k.mp4,PT00H00M15S,136551_136600,Businessman takes the money from the safe 4k
