videoid,contentUrl,duration,page_dir,name
1010542508,https://ak.picdn.net/shutterstock/videos/1010542508/preview/stock-footage-girl-doing-adho-mukha-svanasana-in-front-of-the-pool-in-the-morning.mp4,PT00H00M11S,050201_050250,Girl doing adho mukha svanasana in front of the pool in the morning
18439870,https://ak.picdn.net/shutterstock/videos/18439870/preview/stock-footage-switzerland-mountain-village-scenic.mp4,PT00H00M15S,064601_064650,Switzerland mountain village scenic
13056689,https://ak.picdn.net/shutterstock/videos/13056689/preview/stock-footage-pan-temple-pagan-myanmar.mp4,PT00H00M29S,192151_192200,"Pan temple pagan,myanmar"
12131765,https://ak.picdn.net/shutterstock/videos/12131765/preview/stock-footage-flag-of-bosnia-and-herzegovina-flapping-in-the-wind-in-a-sunny-day-loopable-k-video-of-x.mp4,PT00H00M36S,113201_113250,Flag of bosnia and herzegovina flapping in the wind in a sunny day. loopable 4k video of 4096 x 2160 resolution.
32177887,https://ak.picdn.net/shutterstock/videos/32177887/preview/stock-footage-an-amazing-bird-s-eye-view-of-a-white-beacon-and-a-black-border-tower-on-dzharylhach-island-with.mp4,PT00H00M15S,096551_096600,An amazing bird`s eye view of a white beacon and a black border tower on dzharylhach island with wonderful seacoast covered with green wetland and sand in summer. the skyscape is fine
20916964,https://ak.picdn.net/shutterstock/videos/20916964/preview/stock-footage--aug-moscow-all-union-exhibition-center-moskvarium-a-diverse-exhibition-of-marine-flora.mp4,PT00H00M13S,013001_013050,"15 aug 2016. moscow. all-union exhibition center, moskvarium. a diverse exhibition of marine flora and fauna."
1012445267,https://ak.picdn.net/shutterstock/videos/1012445267/preview/stock-footage-hinduism-temple-in-mountain-village-wide-shot-gold-gate-decorated-bells-on-chain-ornamen-on-wall.mp4,PT00H00M08S,145601_145650,"Hinduism temple in mountain village, wide shot gold gate decorated bells on chain, ornamen on wall and carved figure"
446419,https://ak.picdn.net/shutterstock/videos/446419/preview/stock-footage-into-the-sun.mp4,PT00H00M15S,083151_083200,Into the sun
1064278810,https://ak.picdn.net/shutterstock/videos/1064278810/preview/stock-footage-animation-of-landscape-with-winter-scenery-and-ski-chair-lift-fir-tree-forest-covered-in-snow.mp4,PT00H00M30S,042501_042550,"Animation of landscape with winter scenery and ski chair lift, fir tree forest covered in snow. christmas winter seasons celebration concept digitally generated image"
1052800154,https://ak.picdn.net/shutterstock/videos/1052800154/preview/stock-footage-bharuch-gujarat-india-may-migrant-workers-train-in-queue-to-home-due-to-covid-corona.mp4,PT00H00M30S,170401_170450,"Bharuch,gujarat/ india- may 20,2020: migrant workers train in queue to home. due to covid 19 corona virus  lock down people travel. policemen take prevention and social distancing. railway. "
1031053883,https://ak.picdn.net/shutterstock/videos/1031053883/preview/stock-footage-model-skull-on-the-black-background-archaeology-concept-k-macro-wide-engle.mp4,PT00H00M54S,145251_145300,"Model skull on the black background, archaeology concept. 4k. macro. wide engle."
1017320248,https://ak.picdn.net/shutterstock/videos/1017320248/preview/stock-footage-drone-views-flying-backwards-from-city-of-la-jolla-towards-ocean-during-dusk-california-coastline.mp4,PT00H00M16S,051051_051100,"Drone views flying backwards from city of la jolla towards ocean during dusk, california coastline and cove, buildings by the sea, "
28388239,https://ak.picdn.net/shutterstock/videos/28388239/preview/stock-footage-eruption-in-the-lava-lake-of-the-volcano-erta-ale-ethiopia.mp4,PT00H00M34S,071551_071600,"Eruption in the lava lake of the volcano erta ale, ethiopia"
1023804385,https://ak.picdn.net/shutterstock/videos/1023804385/preview/stock-footage-nesvizh-castle-video-from-drone-belarus.mp4,PT00H00M12S,045101_045150,Nesvizh castle video from drone. belarus
1044920686,https://ak.picdn.net/shutterstock/videos/1044920686/preview/stock-footage-tired-unhealthy-young-woman-sitting-on-comfortable-sofa-suffering-from-throbbing-head-ache-or-high.mp4,PT00H00M10S,070851_070900,"Tired unhealthy young woman sitting on comfortable sofa, suffering from throbbing head ache or high blood pressure. unhappy stressed sick millennial girl massaging temples, feeling exhausted at home."
9498374,https://ak.picdn.net/shutterstock/videos/9498374/preview/stock-footage--k-young-sports-woman-with-personal-trainer-talking-in-the-park-slow-motion.mp4,PT00H00M14S,046901_046950,4k young sports woman with personal trainer talking in the park. slow motion
24068125,https://ak.picdn.net/shutterstock/videos/24068125/preview/stock-footage-excellent-video-to-the-us-independence-day-july.mp4,PT00H00M10S,137401_137450,"Excellent video to the us independence day, 4 july"
3815069,https://ak.picdn.net/shutterstock/videos/3815069/preview/stock-footage-close-up-female-multi-ethnic-medical-staff-during-planning-meeting-modern-hospital-shot-on-red-epic.mp4,PT00H00M19S,129351_129400,Close up female multi ethnic medical staff during planning meeting modern hospital shot on red epic
1023721519,https://ak.picdn.net/shutterstock/videos/1023721519/preview/stock-footage-time-lapse-busy-traffic-with-many-car-light-trail-at-the-intersection-with-mordern-buiding-in-the.mp4,PT00H00M11S,042151_042200,"Time lapse busy traffic with many car light trail at the intersection with mordern buiding in the evening at xinyi road in taipei, taiwan in the raining day"
1054411907,https://ak.picdn.net/shutterstock/videos/1054411907/preview/stock-footage-young-girl-opens-a-plastic-bottle-with-orange-juice-caucasian-woman-holding-a-bottle-of-juice-in.mp4,PT00H00M07S,009551_009600,Young girl opens a plastic bottle with orange juice. caucasian woman holding a bottle of juice in the room.
1027705514,https://ak.picdn.net/shutterstock/videos/1027705514/preview/stock-footage-modern-paved-highway-cuts-throught-he-densely-forested-slopes-of-the-carpathian-mountains-from-an.mp4,PT00H00M29S,072001_072050,Modern. paved highway cuts throught he densely forested slopes of the carpathian mountains. from an aerial perspective. video 4k
1014062390,https://ak.picdn.net/shutterstock/videos/1014062390/preview/stock-footage-kaleidoscope-colorful-background-abstract-celebration-shimmer.mp4,PT00H00M20S,045101_045150,Kaleidoscope colorful background abstract celebration shimmer
1020785215,https://ak.picdn.net/shutterstock/videos/1020785215/preview/stock-footage-young-female-freelancer-using-laptop-while-sitting-on-grass-in-park-close-up.mp4,PT00H00M11S,191551_191600,"Young female freelancer using laptop while sitting on grass in park, close up"
1037725442,https://ak.picdn.net/shutterstock/videos/1037725442/preview/stock-footage-fresh-autumn-mushroom-after-rain-green-grass-in-the-forest-at-dawn.mp4,PT00H00M07S,048401_048450,Fresh autumn mushroom after rain. green grass in the forest at dawn.
1039996130,https://ak.picdn.net/shutterstock/videos/1039996130/preview/stock-footage-summer-sun-shining-above-agricultural-landscape-of-young-green-wheat-field-time-lapse-timelapse.mp4,PT00H00M10S,076201_076250,"Summer sun shining above agricultural landscape of young green wheat field. time lapse, timelapse, time-lapse"
26544197,https://ak.picdn.net/shutterstock/videos/26544197/preview/stock-footage-jerusalem-israel-april-the-western-wall-or-wailing-wall-is-the-holiest-place-to.mp4,PT00H00M10S,115651_115700,"Jerusalem, israel - april 22, 2017: the western wall or wailing wall is the holiest place to judaism in the old city of jerusalem, israel."
33194635,https://ak.picdn.net/shutterstock/videos/33194635/preview/stock-footage-abstract-background-with-flying-into-digital-tunnel-from-flickering-particles-digits-and-as.mp4,PT00H00M20S,115751_115800,"Abstract background with flying into digital tunnel from flickering particles, digits 0 and 1 as binary code and plexus of network. animation of seamless loop."
1033695026,https://ak.picdn.net/shutterstock/videos/1033695026/preview/stock-footage-tel-aviv-ramat-gan-bursa-israel-aerial-drone-skyline-view-k-ungraded-raw-flat.mp4,PT00H00M16S,146851_146900,"Tel-aviv - ramat gan (bursa) israel, 10.02.2019 - aerial drone skyline view 4k ungraded raw flat"
1043217295,https://ak.picdn.net/shutterstock/videos/1043217295/preview/stock-footage-fake-d-d-white-phone-animation-app-icons-in-screen-animated-background-with-textures-and-warm.mp4,PT00H00M30S,193601_193650,Fake 2d - 3d white phone animation. app icons in screen. animated background with textures and warm colors.
27159454,https://ak.picdn.net/shutterstock/videos/27159454/preview/stock-footage-eggs-mixing-brown-eggs-in-white-bowl-top-angle.mp4,PT00H00M21S,029151_029200,Eggs - mixing 2 brown eggs in white bowl - top angle
1051733113,https://ak.picdn.net/shutterstock/videos/1051733113/preview/stock-footage-a-male-factory-worker-uses-a-tablet-near-the-machine-tools-in-the-workshop.mp4,PT00H00M07S,172351_172400,A male factory worker uses a tablet near the machine tools in the workshop.
17966206,https://ak.picdn.net/shutterstock/videos/17966206/preview/stock-footage-closeup-portrait-of-happy-customer-service-representative-wearing-headset.mp4,PT00H00M07S,059501_059550,Closeup portrait of happy customer service representative wearing headset
1027745153,https://ak.picdn.net/shutterstock/videos/1027745153/preview/stock-footage-cirrocumulus-cloudy-sky-time-lapse.mp4,PT00H00M30S,182601_182650,Cirrocumulus cloudy sky time-lapse
32381557,https://ak.picdn.net/shutterstock/videos/32381557/preview/stock-footage-woman-use-of-mobile-phone-at-night.mp4,PT00H00M17S,050401_050450,Woman use of mobile phone at night 
31757737,https://ak.picdn.net/shutterstock/videos/31757737/preview/stock-footage-waterfall-djur-djur-in-the-autumn-forest-crimea.mp4,PT00H00M21S,005701_005750,"Waterfall djur-djur in the autumn forest, crimea
"
1007531278,https://ak.picdn.net/shutterstock/videos/1007531278/preview/stock-footage-squirrel-on-a-fir-tree-feeding-on-acorns-enchanted-forest-of-sylvenoire-cogne-aosta-valley-italy.mp4,PT00H00M05S,056901_056950,"Squirrel on a fir tree feeding on acorns. enchanted forest of sylvenoire, cogne, aosta valley, italy"
11516648,https://ak.picdn.net/shutterstock/videos/11516648/preview/stock-footage-new-york-city-may-people-inside-eataly-shop-in-manhattan-eataly-is-a-high-end-italian.mp4,PT00H00M06S,032151_032200,"New york city - may 13, 2015: people inside eataly shop in manhattan. eataly is a high-end italian food market/mall chain founded by oscar farinetti in 2004."
1058002231,https://ak.picdn.net/shutterstock/videos/1058002231/preview/stock-footage-beautiful-sunset-sky-with-river.mp4,PT00H00M13S,064851_064900,Beautiful sunset sky with river.
17329411,https://ak.picdn.net/shutterstock/videos/17329411/preview/stock-footage-insect-beetle-spanish-fly-lytta-vesicatoria-sitting-on-leaf-macro.mp4,PT00H00M21S,117251_117300,"Insect beetle, spanish fly, lytta vesicatoria sitting on leaf, macro"
17658151,https://ak.picdn.net/shutterstock/videos/17658151/preview/stock-footage-flying-herat-with-flag-of-ghana-looping-alpha-channel-included-you-can-use-this-footage-for.mp4,PT00H00M24S,187951_188000,Flying herat with flag of ghana. looping. alpha channel included. you can use this footage for shifting of broadcasting for example. duration of every part is 4s ( 120 frames ).
33849172,https://ak.picdn.net/shutterstock/videos/33849172/preview/stock-footage-beautiful-small-girl-looking-in-the-mirror-and-paints-her-lips-with-brush-happy-liitle-girl.mp4,PT00H00M13S,149251_149300,"Beautiful small girl looking in the mirror and paints her lips with brush.
happy liitle girl, admiring myself in the mirror, she painted lipstick lips ."
3282365,https://ak.picdn.net/shutterstock/videos/3282365/preview/stock-footage-man-approaches-large-shiny-propeller-on-beautiful-airplane-spins-it-once-and-watches-it-in-awe-as.mp4,PT00H00M20S,127651_127700,"Man approaches large shiny propeller on beautiful airplane, spins it once, and watches it in awe as he walks away."
8560153,https://ak.picdn.net/shutterstock/videos/8560153/preview/stock-footage-southampton-england-people-waiting-for-embarking-in-the-ship-to-france-in-in.mp4,PT00H00M16S,028451_028500,"Southampton, england - 1965: people waiting for embarking in the ship to france in 1965 in southampton, england"
1039741055,https://ak.picdn.net/shutterstock/videos/1039741055/preview/stock-footage-animation-of-snowflakes-falling-and-green-wooden-sign-board-on-green-background.mp4,PT00H00M10S,183751_183800,Animation of snowflakes falling and green wooden sign board on green background
1032588134,https://ak.picdn.net/shutterstock/videos/1032588134/preview/stock-footage-fired-flame-burn-glowing-slow-motion-on-dark-background.mp4,PT00H00M37S,198801_198850,Fired flame burn glowing slow motion on dark background 
1021362052,https://ak.picdn.net/shutterstock/videos/1021362052/preview/stock-footage-aerial-view-industrial-of-opencast-mining-quarry-with-lots-of-machinery-at-work-view-from-above.mp4,PT00H00M15S,174651_174700,"Aerial view industrial of opencast mining quarry with lots of machinery at work - view from above. extraction of gold, copper"
1055769698,https://ak.picdn.net/shutterstock/videos/1055769698/preview/stock-footage-travel-video-of-chennai-roads-chennai-bridge-south-indian-road.mp4,PT00H00M16S,190651_190700,"Travel video of chennai roads, chennai bridge, south indian road"
1032447359,https://ak.picdn.net/shutterstock/videos/1032447359/preview/stock-footage-abstract-background-with-beautiful-color.mp4,PT00H00M07S,033001_033050,Abstract background with beautiful color
4903415,https://ak.picdn.net/shutterstock/videos/4903415/preview/stock-footage-kiev-ukraine-may-people-at-a-ceremonial-parade-dedicated-to-the-th-anniversary-of.mp4,PT00H00M16S,187201_187250,"Kiev, ukraine, may 9, 2011: people at a ceremonial parade dedicated to the 66th anniversary of victory in great patriotic war (world war ii). childrens on the tank. kiev, ukraine, may 9, 2011
"
34659754,https://ak.picdn.net/shutterstock/videos/34659754/preview/stock-footage-red-abstract-background-moving-gold-light-loop.mp4,PT00H00M20S,140751_140800,"Red abstract background, moving gold light, loop"
1047537019,https://ak.picdn.net/shutterstock/videos/1047537019/preview/stock-footage-people-bathing-in-the-sun-swimming-on-the-beach-aerial-view-of-tourists-on-the-sand-beach.mp4,PT00H00M14S,140101_140150,"People bathing in the sun, swimming on the beach. aerial view of tourists on the sand beach."
32028415,https://ak.picdn.net/shutterstock/videos/32028415/preview/stock-footage-virginia-may-large-scale-epic-civil-war-anniversary-reenactment-in-the-middle-of.mp4,PT00H00M06S,095101_095150,"Virginia - may 2017 - large-scale, epic civil war anniversary reenactment -- in the middle of battle. union cavalryman with flag rides and fights across tall grass field with swords, pistols & smoke."
1012785587,https://ak.picdn.net/shutterstock/videos/1012785587/preview/stock-footage-havana-cuba-vehicular-traffic-along-the-seafront-called-the-malec-n.mp4,PT00H00M14S,172151_172200,"Havana, cuba, 02.23.2017: vehicular traffic along the seafront called the ""malecòn""."
33455794,https://ak.picdn.net/shutterstock/videos/33455794/preview/stock-footage-preparation-of-atlantic-herring-fillets-the-cook-removes-bones-using-special-forceps-quality.mp4,PT00H00M15S,079551_079600,Preparation of atlantic herring fillets. the cook removes bones using special forceps. quality checking.
8317963,https://ak.picdn.net/shutterstock/videos/8317963/preview/stock-footage--k-cocoa-beach-sunrise.mp4,PT00H00M11S,192301_192350,4k cocoa beach sunrise 12-20-2014
33647401,https://ak.picdn.net/shutterstock/videos/33647401/preview/stock-footage-cannonvale-australia-the-wreck-aerial-view.mp4,PT00H00M35S,140051_140100,Cannonvale australia the wreck aerial view
1024899155,https://ak.picdn.net/shutterstock/videos/1024899155/preview/stock-footage-multicolored-natural-landscape-with-bird-s-eye-view-lanzarote.mp4,PT00H00M23S,026251_026300,"Multicolored natural landscape with bird's eye view, lanzarote"
1034829974,https://ak.picdn.net/shutterstock/videos/1034829974/preview/stock-footage-pretty-caucasian-woman-meditation-with-jack-russell-terrier-at-home.mp4,PT00H00M10S,124251_124300,Pretty caucasian woman meditation with jack russell terrier at home
161392,https://ak.picdn.net/shutterstock/videos/161392/preview/stock-footage-beautiful-sounding-group-performing-in-mallorca-spain.mp4,PT00H00M20S,069651_069700,Beautiful sounding group performing in mallorca spain
18731426,https://ak.picdn.net/shutterstock/videos/18731426/preview/stock-footage-doctor-during-laparoscopic-surgery.mp4,PT00H00M16S,019051_019100,Doctor during laparoscopic surgery
1039225754,https://ak.picdn.net/shutterstock/videos/1039225754/preview/stock-footage-close-up-of-slender-female-legs-covered-with-healing-mud-girl-takes-step-forward-stops-in-layer.mp4,PT00H00M14S,080851_080900,"Close-up of slender female legs covered with healing mud, girl takes step forward, stops in layer of wet earth with salt, leaves traces, goes on, salt resort, outdoor recreation, hot summer weather"
2142701,https://ak.picdn.net/shutterstock/videos/2142701/preview/stock-footage-timelapse-of-verona-in-twilight-italy.mp4,PT00H00M10S,059751_059800,"Timelapse of  verona in twilight, italy"
1344301,https://ak.picdn.net/shutterstock/videos/1344301/preview/stock-footage-water-sunlight-reflections-and-leaves-loop-slow-motion-fps.mp4,PT00H00M30S,100751_100800,Water sunlight reflections and leaves 3 loop slow motion 210fps
14400283,https://ak.picdn.net/shutterstock/videos/14400283/preview/stock-footage-beautiful-branches-and-stems-in-the-winter-in-nature-frozen-branch-in-the-snow-in-winter-the-stem.mp4,PT00H00M17S,140851_140900,Beautiful branches and stems in the winter in nature. frozen branch in the snow in winter. the stem of grass in inei in the background. 
1059048245,https://ak.picdn.net/shutterstock/videos/1059048245/preview/stock-footage-beautiful-children-perform-at-the-pantomime-theater.mp4,PT00H00M11S,070151_070200,Beautiful children perform at the pantomime theater.
3981052,https://ak.picdn.net/shutterstock/videos/3981052/preview/stock-footage-auto-service.mp4,PT00H00M15S,186101_186150,Auto service
14319703,https://ak.picdn.net/shutterstock/videos/14319703/preview/stock-footage-business-woman-loves-money.mp4,PT00H00M18S,013251_013300,Business woman loves money.
1040854712,https://ak.picdn.net/shutterstock/videos/1040854712/preview/stock-footage-walking-past-hut-made-of-corrugated-sheet-and-straw-in-remote-desert-location-in-south-ethiopia.mp4,PT00H00M18S,027051_027100,"Walking past hut made of corrugated sheet and straw in remote desert location in south ethiopia, tribal community in africa"
1008765206,https://ak.picdn.net/shutterstock/videos/1008765206/preview/stock-footage-woman-talking-on-cellphone-standing-near-window-at-home.mp4,PT00H00M17S,018251_018300,"Woman talking on cellphone standing near window at home
"
1023648622,https://ak.picdn.net/shutterstock/videos/1023648622/preview/stock-footage-the-girl-sits-on-a-bike-and-drinks-water.mp4,PT00H00M23S,143951_144000,The girl sits on a bike and drinks water.
1062150496,https://ak.picdn.net/shutterstock/videos/1062150496/preview/stock-footage-page-speed-animated-icon-k-animated-icon-to-improve-project-and-explainer-video.mp4,PT00H00M09S,068901_068950,Page speed animated icon. 4k animated icon to improve project and explainer video
1013583578,https://ak.picdn.net/shutterstock/videos/1013583578/preview/stock-footage-plate-with-chocolate-sprinkle-tomatoes-on-it.mp4,PT00H00M29S,104901_104950,Plate with chocolate sprinkle tomatoes on it.
2472872,https://ak.picdn.net/shutterstock/videos/2472872/preview/stock-footage-a-woman-driving-a-car.mp4,PT00H00M16S,149451_149500,A woman driving a car
2678048,https://ak.picdn.net/shutterstock/videos/2678048/preview/stock-footage-playground-two-seater-swing-cum-roundabout-in-a-park-in-england-rotating-with-nobody-on-it-close.mp4,PT00H00M14S,044001_044050,"Playground two-seater swing cum roundabout in a park in england, rotating with nobody on it. close up tracking shot of one of the empty seats. the seat is slightly wet after rain"
1026729911,https://ak.picdn.net/shutterstock/videos/1026729911/preview/stock-footage-view-of-the-airplanes-wing-and-the-clouds-out-of-airplanes-window.mp4,PT00H00M12S,058501_058550,View of the airplanes wing and the clouds out of airplanes window
1023176296,https://ak.picdn.net/shutterstock/videos/1023176296/preview/stock-footage-a-hollywood-movie-clapboard-moves-from-left-to-right-on-the-screen-clapping-once-overlay-this.mp4,PT00H00M06S,075351_075400,"A hollywood movie clapboard moves from left to right on the screen, clapping once. overlay this onto a linear right wipe transition between two of your video clips. sample effect provided."
7459690,https://ak.picdn.net/shutterstock/videos/7459690/preview/stock-footage-saint-petersburg-russia-march-the-operator-of-the-camera.mp4,PT00H00M14S,000501_000550,"Saint-petersburg, russia - march 30, 2014: the operator of the camera"
1006655110,https://ak.picdn.net/shutterstock/videos/1006655110/preview/stock-footage-circa-s-a-husband-wife-and-their-two-teenage-sons-enjoy-dinner-at-home.mp4,PT00H00M54S,056201_056250,"Circa - 1960s - a husband, wife, and their two teenage sons enjoy dinner at home."
1035186143,https://ak.picdn.net/shutterstock/videos/1035186143/preview/stock-footage-drone-shot-of-belle-isle-miami.mp4,PT00H00M31S,140551_140600,"Drone shot of belle isle, miami"
10350293,https://ak.picdn.net/shutterstock/videos/10350293/preview/stock-footage-adorable-little-blond-child-sitting-near-window-and-looking-on-raindrops-indoors.mp4,PT00H00M12S,171751_171800,"Adorable little blond child sitting near window and looking on raindrops, indoors."
1055454731,https://ak.picdn.net/shutterstock/videos/1055454731/preview/stock-footage-caucasian-conceptual-man-farmer-agronomist-in-a-hat-goes-and-looking-to-a-wheat-field-portrait.mp4,PT00H00M50S,050751_050800,Caucasian conceptual man farmer agronomist in a hat goes and looking to a wheat field. portrait. agriculture business. view from the back. wide angle shot
28390771,https://ak.picdn.net/shutterstock/videos/28390771/preview/stock-footage-the-child-in-the-supermarket-is-sitting-in-a-cart-for-food.mp4,PT00H00M06S,115451_115500,The child in the supermarket is sitting in a cart for food
1055999864,https://ak.picdn.net/shutterstock/videos/1055999864/preview/stock-footage--k-dirty-hits-detonate-dust-on-a-wall-with-chunks-of-debris-flying-out-from-bottom-powder.mp4,PT00H00M05S,076151_076200,"4k dirty hits, detonate dust on a wall with chunks of debris flying out from bottom . powder explosion on black background. impact dust particles. dust explosion on black background, slow-motion close up. vfx"
1030032242,https://ak.picdn.net/shutterstock/videos/1030032242/preview/stock-footage-graph-of-rising-to-the-right.mp4,PT00H00M07S,074751_074800,Graph of rising to the right
2465465,https://ak.picdn.net/shutterstock/videos/2465465/preview/stock-footage-oslo-norway-july-steam-locomotive-railway-line-the-urskog-h-land-line-on-july-in.mp4,PT00H00M30S,129651_129700,"Oslo, norway - july 1: steam locomotive railway line the urskog-høland line on july 1, 2012 in oslo, norway. a tourist attraction. open for sightseing tours june - september"
19654561,https://ak.picdn.net/shutterstock/videos/19654561/preview/stock-footage-father-and-small-son-sitting-on-a-bench-and-talking-they-were-caps-and-warm-coats-it-is-a-cloudy.mp4,PT00H00M10S,065601_065650,Father and small son sitting on a bench and talking. they were caps and warm coats. it is a cloudy spring day.
1029576155,https://ak.picdn.net/shutterstock/videos/1029576155/preview/stock-footage-close-up-portrait-of-happy-professional-female-boss-with-blond-hair-in-formal-clothes-posing-at.mp4,PT00H00M14S,110101_110150,Close-up portrait of happy professional female boss with blond hair in formal clothes posing at trendy modern office.
1014261230,https://ak.picdn.net/shutterstock/videos/1014261230/preview/stock-footage-small-waves-splashing-on-the-rocks.mp4,PT00H00M08S,177701_177750,Small waves splashing on the rocks
1044700126,https://ak.picdn.net/shutterstock/videos/1044700126/preview/stock-footage-aerial-view-of-hohenwerfen-castle-austria-medieval-rock-fortress-in-alpine-mountains-with-spruces.mp4,PT00H00M10S,196301_196350,"Aerial view of hohenwerfen castle, austria. medieval rock fortress in alpine mountains with spruces. overlooking the werfen town in salzach valley. summer."
1013375042,https://ak.picdn.net/shutterstock/videos/1013375042/preview/stock-footage-kelburn-wellington-new-zealand-june-panorama-of-the-city-of-wellington-and-oriental.mp4,PT00H00M16S,047151_047200,"Kelburn, wellington, new zealand, june 16, 2015: panorama of the city of wellington and oriental bay, new zealand from the hills of the suburb of kelburn showing the city centre"
1026956267,https://ak.picdn.net/shutterstock/videos/1026956267/preview/stock-footage-the-wind-swings-the-branches-of-a-coniferous-tree-pine-spring-landscape.mp4,PT00H00M17S,170101_170150,"The wind swings the branches of a coniferous tree pine, spring landscape"
21701740,https://ak.picdn.net/shutterstock/videos/21701740/preview/stock-footage-patterns-of-another-universe.mp4,PT00H00M17S,045401_045450,Patterns of another universe
1060476382,https://ak.picdn.net/shutterstock/videos/1060476382/preview/stock-footage-hands-of-young-woman-touch-the-leaves-of-the-vineyard-at-sunset-slow-motion-video-k.mp4,PT00H00M08S,054451_054500,Hands of young woman touch the leaves of the vineyard at sunset. slow motion video 4k
1005624583,https://ak.picdn.net/shutterstock/videos/1005624583/preview/stock-footage-colorful-helium-balloons-at-the-festival-inside-the-building.mp4,PT00H00M14S,045101_045150,Colorful helium balloons at the festival inside the building
