videoid,contentUrl,duration,page_dir,name
1012675445,https://ak.picdn.net/shutterstock/videos/1012675445/preview/stock-footage-punta-union-view-on-the-taulliraju-mountain-santa-cruz-trekking-peru.mp4,PT00H00M17S,056651_056700,Punta union view on the taulliraju mountain santa cruz trekking peru
1030316663,https://ak.picdn.net/shutterstock/videos/1030316663/preview/stock-footage-the-concept-of-morning-beautiful-curtains-with-a-floral-print-are-waving-in-the-wind-from-a-half.mp4,PT00H00M21S,037251_037300,The concept of morning. beautiful curtains with a floral print are waving in the wind from a half-open window. sun glare on the windows
1018871827,https://ak.picdn.net/shutterstock/videos/1018871827/preview/stock-footage-people-are-walking-and-running-for-their-good-health-in-the-public-park.mp4,PT00H00M22S,033051_033100,People are walking and running for their good health in the public park. 
1016472937,https://ak.picdn.net/shutterstock/videos/1016472937/preview/stock-footage-young-woman-sitting-on-grass-drinking-tea-and-admiring-nature.mp4,PT00H00M06S,068701_068750,Young woman sitting on grass drinking tea and admiring nature.
3574607,https://ak.picdn.net/shutterstock/videos/3574607/preview/stock-footage-a-bunch-of-colourful-helium-filled-balloons-tied-together-flying-against-a-sunny-blue-sky.mp4,PT00H00M12S,080601_080650,A bunch of colourful helium filled balloons tied together flying against a sunny blue sky
1054866077,https://ak.picdn.net/shutterstock/videos/1054866077/preview/stock-footage--k-footage-video-of-blue-sky-with-cloudy-in-motion-with-panning-shot-the-could-on-the-sky-has-high.mp4,PT00H00M38S,065151_065200,"4k footage video of blue sky with cloudy in motion with panning shot. the could on the sky has high shadow contrast affect from sun light in the evening, sunset period."
14886475,https://ak.picdn.net/shutterstock/videos/14886475/preview/stock-footage-fresh-apples-on-table-female-doctor-working-in-office-diet-healthy-lifestyle.mp4,PT00H00M23S,113501_113550,"Fresh apples on table, female doctor working in office. diet, healthy lifestyle"
1010345438,https://ak.picdn.net/shutterstock/videos/1010345438/preview/stock-footage-ants-running-filmed-close-up-in-k-p.mp4,PT00H00M10S,008801_008850,Ants running. filmed close up in 4k 50p
1022068954,https://ak.picdn.net/shutterstock/videos/1022068954/preview/stock-footage-beautiful-aerial-footage-of-canyons-full-of-red-rocks-in-utah.mp4,PT00H00M16S,068751_068800,Beautiful aerial footage of canyons full of red rocks in utah
1030812917,https://ak.picdn.net/shutterstock/videos/1030812917/preview/stock-footage-close-tilt-up-flower-bouquet-colorful.mp4,PT00H00M12S,090251_090300,Close tilt up flower bouquet colorful
1019228230,https://ak.picdn.net/shutterstock/videos/1019228230/preview/stock-footage-a-young-girl-rides-in-the-car-and-happily-writes-a-sms-message.mp4,PT00H00M15S,135051_135100,A young girl rides in the car and happily writes a sms message
1022291653,https://ak.picdn.net/shutterstock/videos/1022291653/preview/stock-footage-london-circa-rack-focus-shot-of-a-pro-eu-remainer-campaigners-and-a-poster-showing-the.mp4,PT00H00M20S,113701_113750,"London, circa 2019 - rack focus shot of a pro-eu remainer campaigners and a poster showing the dangers of the uk leaving the eu, in westminster, london, england, uk"
5449754,https://ak.picdn.net/shutterstock/videos/5449754/preview/stock-footage-people-walk-near-christ-the-saviour-cathedral-against-kremlin-complex-at-cloudy-autumn-day-in-moscow.mp4,PT00H00M06S,184001_184050,People walk near christ the saviour cathedral against kremlin complex at cloudy autumn day in moscow
17383276,https://ak.picdn.net/shutterstock/videos/17383276/preview/stock-footage-student-tells-the-story-or-interviewed-white-close-up.mp4,PT00H00M28S,195951_196000,Student tells the story or interviewed. white. close up
17635294,https://ak.picdn.net/shutterstock/videos/17635294/preview/stock-footage-footage-of-flower-shaped-candle-burning-in-the-spirit-pool-of-chinese-temple-full-hd-p-video.mp4,PT00H00M17S,086651_086700,Footage of flower-shaped candle burning in the spirit pool of chinese temple. full hd 1080p video. 
11902163,https://ak.picdn.net/shutterstock/videos/11902163/preview/stock-footage-hyper-lapse-brick-cloister-corridor.mp4,PT00H00M06S,187451_187500,Hyper lapse brick cloister corridor
11381561,https://ak.picdn.net/shutterstock/videos/11381561/preview/stock-footage-cleaning-for-antiques-of-the-stages-of-excavation-archaeological-under-ground-concept-slow-motion.mp4,PT00H00M16S,195051_195100,Cleaning for antiques of the stages of excavation archaeological under ground. concept slow motion. 
25969913,https://ak.picdn.net/shutterstock/videos/25969913/preview/stock-footage-sporty-woman-trains-squats-with-heavy-weights-in-fitness-gym.mp4,PT00H00M11S,031601_031650,Sporty woman trains squats with heavy weights in fitness gym
25730333,https://ak.picdn.net/shutterstock/videos/25730333/preview/stock-footage-stylish-girl-looks-unhappy-while-walking-with-shopping-bags-on-parking-area.mp4,PT00H00M13S,181301_181350,"Stylish girl looks unhappy while walking with shopping bags on parking area
"
1031997725,https://ak.picdn.net/shutterstock/videos/1031997725/preview/stock-footage-night-time-illuminated-sanya-city-dadonghai-beach-restaurant-bay-panorama-k-hainan-china.mp4,PT00H00M13S,114851_114900,Night time illuminated sanya city dadonghai beach restaurant bay panorama 4k hainan china
19437520,https://ak.picdn.net/shutterstock/videos/19437520/preview/stock-footage-an-eskimo-tests-the-wind-in-preparation-for-a-hunt-in-s.mp4,PT00H00M54S,082951_083000,An eskimo tests the wind in preparation for a hunt in 1922. (1920s)
34923367,https://ak.picdn.net/shutterstock/videos/34923367/preview/stock-footage-traditional-vietnamese-tourist-boats-in-a-bay-of-vietnam-tourists-swim-by-the-boat-in-a-bay-of.mp4,PT00H00M27S,072851_072900,Traditional vietnamese tourist boats in a bay of vietnam. tourists swim by the boat in a bay of vietnam. traditional vietnamese tourist boats. vietnam..
1025939123,https://ak.picdn.net/shutterstock/videos/1025939123/preview/stock-footage-stockholm-sweden-march-metro-bridge-gamla-stan-tunnelbanabron-in-the-stockholm-gloomy.mp4,PT00H00M15S,065901_065950,"Stockholm, sweden - march 09, 2019: metro bridge gamla stan tunnelbanabron in the stockholm, gloomy march day (time lapse) "
1020452464,https://ak.picdn.net/shutterstock/videos/1020452464/preview/stock-footage-amsterdam-netherlands-november-passing-through-the-ticket-control-during-the-boarding-of.mp4,PT00H00M17S,073501_073550,"Amsterdam, netherlands - november 2018 :passing through the ticket control during the boarding of an airplane. pov point of view."
18496402,https://ak.picdn.net/shutterstock/videos/18496402/preview/stock-footage-close-up-view-of-a-young-kissing-couple-with-a-bouquet-of-flowers-in-the-park-on-a-background-of.mp4,PT00H00M20S,177501_177550,Close-up view of a young kissing couple with a bouquet of flowers in the park on a background of trees
1023199534,https://ak.picdn.net/shutterstock/videos/1023199534/preview/stock-footage--k-abstract-motion-background-animation-shining-particles-sparks-and-magic-dust-forming-in-space.mp4,PT00H00M20S,071551_071600,4k abstract motion background animation shining particles  sparks and magic dust forming in space mesmerizing rotating and swirling forms and flows with light rays and projections seamless loop
1045922038,https://ak.picdn.net/shutterstock/videos/1045922038/preview/stock-footage-science-and-technology-business-concept-modern-instrument-measures-a-complex-part-with-a-laser-beam.mp4,PT00H00M12S,009351_009400,Science and technology.business concept.modern instrument measures a complex part with a laser beam.close-up
1022805310,https://ak.picdn.net/shutterstock/videos/1022805310/preview/stock-footage-woman-s-hands-put-mushrooms-in-a-bag-on-kitchen-table.mp4,PT00H00M22S,089401_089450,Woman's hands put mushrooms in a bag on kitchen table.
9068756,https://ak.picdn.net/shutterstock/videos/9068756/preview/stock-footage-swaying-branches-of-an-overhanging-pine-tree-over-the-sea.mp4,PT00H00M09S,002001_002050,Swaying branches of an overhanging pine tree over the sea
10393562,https://ak.picdn.net/shutterstock/videos/10393562/preview/stock-footage-healthy-lunch-whole-fried-sea-sunfish-on-wooden-table-with-lemons-peppers-and-tomatoes-and.mp4,PT00H00M20S,067201_067250,Healthy lunch : whole fried sea sunfish on wooden table with lemons peppers and tomatoes and rosemary twig 1920x1080 intro motion slow hidef hd
21739825,https://ak.picdn.net/shutterstock/videos/21739825/preview/stock-footage-first-snow-descends-on-the-night-city-street.mp4,PT00H00M15S,198501_198550,First snow descends on the night city street
1027857893,https://ak.picdn.net/shutterstock/videos/1027857893/preview/stock-footage-a-great-shots-for-um-qais-at-the-north-of-jordan-it-lies-in-the-bani-kinanah-department-and-irbid.mp4,PT00H00M10S,134851_134900,"A great shots for um qais at the north of jordan,it lies in the bani kinanah department and irbid governorate in the extreme northwest of the country, near jordan's borders with palestine and syria."
1006740991,https://ak.picdn.net/shutterstock/videos/1006740991/preview/stock-footage-night-starry-skies-time-lapse-rotating-stars-in-clear-good-weather-star-time-lapse-milky-way.mp4,PT00H00M12S,137051_137100,"Night starry skies time lapse, rotating stars in clear good weather. star time lapse, milky way galaxy moving across the night sky, astrophotography time lapse footage of milky way galaxy rising. uhd."
9388025,https://ak.picdn.net/shutterstock/videos/9388025/preview/stock-footage-young-smartly-dressed-male-african-scholar-walking-briskly-to-school-along-rural-winding-dirt-road.mp4,PT00H00M18S,138801_138850,Young smartly dressed male african scholar walking briskly to school along rural winding dirt road on sunny morning in rural kwazulu-natal in south africa
29351434,https://ak.picdn.net/shutterstock/videos/29351434/preview/stock-footage-rotating-acai-berry-bowl-with-fruits-close.mp4,PT00H00M14S,177401_177450,"Rotating acai berry bowl with fruits, close"
1026490397,https://ak.picdn.net/shutterstock/videos/1026490397/preview/stock-footage-compass-in-man-s-hand-close-up.mp4,PT00H00M25S,075201_075250,Compass in man's hand. close up
1028595482,https://ak.picdn.net/shutterstock/videos/1028595482/preview/stock-footage-excited-bearded-indian-man-in-shirt-playing-on-smartphone-over-white-background.mp4,PT00H00M07S,091151_091200,Excited bearded indian man in shirt playing on smartphone over white background
1023660616,https://ak.picdn.net/shutterstock/videos/1023660616/preview/stock-footage-young-stressed-multi-ethnic-man-having-neck-pain.mp4,PT00H00M14S,138101_138150,Young stressed multi-ethnic man having neck pain
1042601014,https://ak.picdn.net/shutterstock/videos/1042601014/preview/stock-footage-cute-dog-pug-breed-lying-and-sleep-on-ground-with-funny-face-feeling-so-relax-and-comfortable.mp4,PT00H00M05S,122951_123000,Cute dog pug breed lying and sleep on ground with funny face feeling so relax and comfortable
1042586512,https://ak.picdn.net/shutterstock/videos/1042586512/preview/stock-footage-the-hikers-are-walking-down-the-mountain-slope.mp4,PT00H00M29S,077501_077550,The hikers are walking down the mountain slope
1007497390,https://ak.picdn.net/shutterstock/videos/1007497390/preview/stock-footage-portrait-of-a-mongoose-as-it-scavenges-the-forest-floor.mp4,PT00H00M11S,082101_082150,Portrait of a mongoose as it scavenges the forest floor.
18694430,https://ak.picdn.net/shutterstock/videos/18694430/preview/stock-footage-unrecognizable-people-in-summer-clothes-walking-on-small-bridge-k-bokeh-shot-back-light-warm.mp4,PT00H00M38S,020001_020050,"Unrecognizable people in summer clothes walking on small bridge. 4k bokeh shot. back light, warm colors"
1020454831,https://ak.picdn.net/shutterstock/videos/1020454831/preview/stock-footage-aerial-view-of-the-gran-canaria-island-spain.mp4,PT00H00M36S,032101_032150,"Aerial view of the gran canaria island, spain."
15790531,https://ak.picdn.net/shutterstock/videos/15790531/preview/stock-footage-istanbul-turkey-april-the-blue-mosque-in-istanbul-a-cultural-monument-and-place-of.mp4,PT00H00M14S,127851_127900,"Istanbul, turkey - 6 april, 2016:the blue mosque in istanbul, a cultural monument and place of worship for muslims"
1013855441,https://ak.picdn.net/shutterstock/videos/1013855441/preview/stock-footage-aerial-view-of-tropical-beach-on-the-island-philippines-beautiful-tropical-island-with-sand-beach.mp4,PT00H00M19S,173601_173650,"Aerial view of tropical beach on the island, philippines. beautiful tropical island with sand beach, palm trees. tropical landscape: beach with palm trees. seascape: ocean, sky, sea. 4k video. travel"
1009708913,https://ak.picdn.net/shutterstock/videos/1009708913/preview/stock-footage-investigator-spy-searching-confidential-files-in-the-filing-cabinet-at-night-retro-noir-film.mp4,PT00H00M22S,127301_127350,"Investigator spy searching confidential files in the filing cabinet at night, retro noir film character"
1048122067,https://ak.picdn.net/shutterstock/videos/1048122067/preview/stock-footage-two-street-lights-in-green-crown-of-pines-on-bright-blue-sky-background-bottom-view-spring-or.mp4,PT00H00M11S,020401_020450,"Two street lights in green crown of pines on bright blue sky background, bottom view. spring or summer sun day, outdoors"
836419,https://ak.picdn.net/shutterstock/videos/836419/preview/stock-footage-cooking-meat-on-grill.mp4,PT00H00M15S,193851_193900,Cooking meat on grill.
1064761777,https://ak.picdn.net/shutterstock/videos/1064761777/preview/stock-footage-champignons-falling-and-fried-in-a-pan-slow-motion-video.mp4,PT00H00M05S,173051_173100,"Champignons falling and fried in a pan, slow motion video"
1023638554,https://ak.picdn.net/shutterstock/videos/1023638554/preview/stock-footage-the-asian-high-school-students-in-white-uniform-are-walking-through-the-lawn.mp4,PT00H00M18S,060751_060800,"The asian high school students in white uniform are walking through the lawn, "
1015274725,https://ak.picdn.net/shutterstock/videos/1015274725/preview/stock-footage-young-woman-with-a-slender-figure-in-gymnastics-clothes-running-in-the-park-female-makes-a-run.mp4,PT00H00M25S,120901_120950,Young woman with a slender figure in gymnastics clothes running in the park.female makes a run along the forest. slow motion. back view
1010898191,https://ak.picdn.net/shutterstock/videos/1010898191/preview/stock-footage-lonely-boy-thinks-alone-about-the-problem-regrets-the-incident.mp4,PT00H00M12S,174001_174050,"Lonely boy thinks alone about the problem, regrets the incident"
4607882,https://ak.picdn.net/shutterstock/videos/4607882/preview/stock-footage-chef-with-pumpkin.mp4,PT00H00M16S,026751_026800,Chef with pumpkin 
12020696,https://ak.picdn.net/shutterstock/videos/12020696/preview/stock-footage-the-guy-looks-for-suitable-clothes-suit-in-a-clothes-store-handsome-male-shopping-in-clothes-shop.mp4,PT00H00M16S,174801_174850,The guy looks for suitable clothes suit in a clothes  store. handsome male shopping in clothes shop
1028892107,https://ak.picdn.net/shutterstock/videos/1028892107/preview/stock-footage-abstract-orange-bokeh-beautiful-light-glittering-particles-sparkle-holiday-concept-animation-of.mp4,PT00H00M20S,010001_010050,Abstract orange bokeh beautiful light glittering particles sparkle. holiday concept. animation of seamless loop. full hd 1920x1080.
31861807,https://ak.picdn.net/shutterstock/videos/31861807/preview/stock-footage-hard-rain-in-the-night-with-lightning-in-the-suburbs.mp4,PT00H00M25S,140601_140650,Hard rain in the night with lightning in the suburbs
14084270,https://ak.picdn.net/shutterstock/videos/14084270/preview/stock-footage-west-lafayette-indiana-purdue-college-football-quarterback-completes-a-long-pass.mp4,PT00H00M12S,172051_172100,"West lafayette, indiana 1969: purdue college football quarterback completes a long pass."
1041784504,https://ak.picdn.net/shutterstock/videos/1041784504/preview/stock-footage-the-boy-sleeps-in-a-hotel-on-the-couch-lies-across-the-couch.mp4,PT00H00M17S,190751_190800,The boy sleeps in a hotel on the couch. lies across the couch. 
12379100,https://ak.picdn.net/shutterstock/videos/12379100/preview/stock-footage-guangzhou-china-september-city-night-tourist-famous-crowded-street-k-time-lapse-circa.mp4,PT00H00M06S,083701_083750,"Guangzhou, china - september 2015: city night tourist famous crowded street 4k time lapse circa september 2015 guangzhou, china."
1017422452,https://ak.picdn.net/shutterstock/videos/1017422452/preview/stock-footage-varna-bulgaria-sep-scrap-metal-recycling-plant-and-crane.mp4,PT00H00M07S,114901_114950,"Varna, bulgaria - sep 01, 2018 :  scrap metal recycling plant and crane"
1042932502,https://ak.picdn.net/shutterstock/videos/1042932502/preview/stock-footage--close-up-model-with-long-legs.mp4,PT00H00M52S,198501_198550,"
close up model with long legs"
3714158,https://ak.picdn.net/shutterstock/videos/3714158/preview/stock-footage-time-lapse-of-a-dam.mp4,PT00H00M07S,114801_114850,Time lapse of a dam
1017822439,https://ak.picdn.net/shutterstock/videos/1017822439/preview/stock-footage-camera-flight-over-a-svihov-village-with-ancient-castle-gothic-architecture-on-river-island.mp4,PT00H00M26S,074651_074700,"Camera flight over a svihov village with ancient castle. gothic architecture on river island. beautiful landmark in national park sumava, czech republic, europe. "
1023191182,https://ak.picdn.net/shutterstock/videos/1023191182/preview/stock-footage-no-smoking-sign-with-blurry-color-abstract-background.mp4,PT00H00M13S,056901_056950,"No smoking sign ,with blurry color abstract background"
1007665603,https://ak.picdn.net/shutterstock/videos/1007665603/preview/stock-footage-flying-over-fertile-lands-in-mpumalanga-south-africa-k-aerial-panoramic-view.mp4,PT00H00M20S,144751_144800,Flying over fertile lands in mpumalanga south africa 4k aerial panoramic view
5088977,https://ak.picdn.net/shutterstock/videos/5088977/preview/stock-footage-animation-of-the-korean-flag-in-the-background-with-a-blue-sky.mp4,PT00H00M15S,068401_068450,Animation of the korean flag in the background with a blue sky
6723739,https://ak.picdn.net/shutterstock/videos/6723739/preview/stock-footage-view-of-arch-in-museum-of-asiatic-art-in-old-town-of-corfu-greece.mp4,PT00H00M06S,088801_088850,"View of arch in museum of asiatic art in old town of corfu, greece"
1056424214,https://ak.picdn.net/shutterstock/videos/1056424214/preview/stock-footage-upset-little-boy-sitting-hugging-his-knees-cute-blond-boy-with-sad-expression.mp4,PT00H00M06S,130751_130800,Upset little boy sitting hugging his knees. cute blond boy with sad expression.
1029952949,https://ak.picdn.net/shutterstock/videos/1029952949/preview/stock-footage-railroad-crossing-sign-with-sun-shining-from-behind-slide-right.mp4,PT00H00M08S,032351_032400,Railroad crossing sign with sun shining from behind slide right
1008318472,https://ak.picdn.net/shutterstock/videos/1008318472/preview/stock-footage-canadian-flag-on-the-moon-alternate-history.mp4,PT00H00M20S,088551_088600,"Canadian flag on the moon, alternate history"
740461,https://ak.picdn.net/shutterstock/videos/740461/preview/stock-footage-zoom-out-onweathered-rock-reveals-mysterious-ancient-figures-carved-by-people-hundreds-of.mp4,PT00H00M20S,020901_020950,"Zoom out onweathered rock reveals mysterious, ancient figures carved by peopleã€€hundreds of years ago. 1920x1080"
1007458123,https://ak.picdn.net/shutterstock/videos/1007458123/preview/stock-footage-slow-motion-storm-on-the-sea-the-wave-breaks-about-the-pier-yacht-in-the-background.mp4,PT00H00M10S,028451_028500,Slow motion storm on the sea. the wave breaks about the pier. yacht in the background.
1043810320,https://ak.picdn.net/shutterstock/videos/1043810320/preview/stock-footage-video-of-shooting-particles-with-alpha.mp4,PT00H00M16S,140051_140100,Video of shooting particles with alpha
11411060,https://ak.picdn.net/shutterstock/videos/11411060/preview/stock-footage-delhi-india-march-aerial-view-of-delhi-with-rooftops-and-street-with-people-passing.mp4,PT00H00M09S,067951_068000,"Delhi, india - 4 march 2015: aerial view of delhi, with rooftops and street with people passing."
34796761,https://ak.picdn.net/shutterstock/videos/34796761/preview/stock-footage-woman-in-kitchen-preparing-a-fresh-vegetable-vegetarian-salad.mp4,PT00H00M14S,136401_136450,Woman in kitchen preparing a fresh vegetable vegetarian salad
18758585,https://ak.picdn.net/shutterstock/videos/18758585/preview/stock-footage-scene.mp4,PT00H00M13S,183751_183800,Scene.
14862109,https://ak.picdn.net/shutterstock/videos/14862109/preview/stock-footage-motivated-beautiful-woman-doing-skipping-rope-exercises-in-gym-healthy-life.mp4,PT00H00M13S,027401_027450,"Motivated beautiful woman doing skipping rope exercises in gym, healthy life"
1056741098,https://ak.picdn.net/shutterstock/videos/1056741098/preview/stock-footage-self-drawing-animation-of-blue-umbrella-blue-color-white-background-copy-space.mp4,PT00H00M22S,058051_058100,Self drawing animation of blue umbrella. blue color. white background. copy space.
2983312,https://ak.picdn.net/shutterstock/videos/2983312/preview/stock-footage-pattaya-beach.mp4,PT00H00M16S,030401_030450,Pattaya beach
1065696571,https://ak.picdn.net/shutterstock/videos/1065696571/preview/stock-footage-real-estate-consisting-of-terraced-houses-semi-detached-houses-and-single-family-houses-in-a.mp4,PT00H00M35S,106301_106350,"Real estate consisting of terraced houses, semi-detached houses and single-family houses in a german new housing estate of a suburb on the outskirts of the city, aerial view"
1025115122,https://ak.picdn.net/shutterstock/videos/1025115122/preview/stock-footage-pink-flamingo-on-lake-phoenicopterus-beautiful-white-pinkish-bird-in-pond-aquatic-bird-in-its.mp4,PT00H00M14S,035951_036000,"Pink flamingo on lake,phoenicopterus, beautiful white pinkish bird in pond, aquatic bird in its environment,africa,wildlife scene,bird grooming and cleaning itself in water,animal behaviour,exotic "
1038725339,https://ak.picdn.net/shutterstock/videos/1038725339/preview/stock-footage-drone-pan-shot-left-to-right-of-coastline-sea-and-mountains-under-sunny-cloudy-sky-with-boat.mp4,PT00H00M17S,124301_124350,"Drone pan shot left to right of coastline, sea and mountains under sunny cloudy sky with boat drifting on background. pan shot of island under sunny cloudy sky and mountains"
1010460998,https://ak.picdn.net/shutterstock/videos/1010460998/preview/stock-footage-portrait-of-the-young-unhealthy-man-in-the-warm-gray-scarf-having-a-hard-caugh-during-a-cold-or.mp4,PT00H00M18S,197551_197600,"Portrait of the young unhealthy man in the warm gray scarf having a hard caugh during a cold or influenza, sitting on the sofa in the living room. at home. inside virus"
1057136420,https://ak.picdn.net/shutterstock/videos/1057136420/preview/stock-footage-close-up-shot-of-male-hands-pushing-buttons-and-moving-controller-when-playing-arcade-machine.mp4,PT00H00M21S,012951_013000,Close-up shot of male hands pushing buttons and moving controller when playing arcade machine
1043518918,https://ak.picdn.net/shutterstock/videos/1043518918/preview/stock-footage-falling-spaghetti-pasta-into-water-high-angle-view-overhead-shot.mp4,PT00H00M10S,123851_123900,Falling spaghetti pasta into water. high angle view overhead shot
1012290575,https://ak.picdn.net/shutterstock/videos/1012290575/preview/stock-footage-far-away-in-the-sea-a-man.mp4,PT00H00M09S,097101_097150,Far away in the sea a man
1010230409,https://ak.picdn.net/shutterstock/videos/1010230409/preview/stock-footage-a-young-mother-holding-her-baby-son-on-her-shoulder-close-up-shot.mp4,PT00H00M21S,055851_055900,A young mother holding her baby son on her shoulder. close-up shot
1018095175,https://ak.picdn.net/shutterstock/videos/1018095175/preview/stock-footage-handheld-panning-looking-through-scottish-forest-woodland-in-morning-sunrise.mp4,PT00H00M04S,185201_185250,Handheld panning looking through scottish forest woodland in morning sunrise
18251266,https://ak.picdn.net/shutterstock/videos/18251266/preview/stock-footage-black-butterfly-on-pink-flower-in-green-forest-nine-spotted-moth-amata-phegea.mp4,PT00H00M33S,009451_009500,"Black butterfly on pink flower in green forest , nine-spotted moth (amata phegea)"
2327234,https://ak.picdn.net/shutterstock/videos/2327234/preview/stock-footage-buddha-meditating-on-a-lotus-blossom.mp4,PT00H00M15S,125901_125950,Buddha meditating on a lotus blossom
9825644,https://ak.picdn.net/shutterstock/videos/9825644/preview/stock-footage-oil-water-and-ink-mixing-for-a-beautiful-abstract.mp4,PT00H00M27S,144001_144050,"Oil, water and ink mixing for a beautiful abstract "
1064410792,https://ak.picdn.net/shutterstock/videos/1064410792/preview/stock-footage-young-woman-in-her-home-kitchen-looking-at-recipe-on-digital-tablet.mp4,PT00H00M13S,101501_101550,Young woman in her home kitchen looking at recipe on digital tablet 
17134849,https://ak.picdn.net/shutterstock/videos/17134849/preview/stock-footage-flight-over-forest-aerial-view-of-czech-forest.mp4,PT00H00M24S,027451_027500,"Flight over forest, aerial view of czech forest."
1019358154,https://ak.picdn.net/shutterstock/videos/1019358154/preview/stock-footage-varnish-female-nail.mp4,PT00H00M09S,125001_125050,Varnish female nail
1030673564,https://ak.picdn.net/shutterstock/videos/1030673564/preview/stock-footage-rice-terrace-seedlings-time-lapse-wide-angle-view-in-the-field-with-water-from-nature-around.mp4,PT00H00M08S,020801_020850,"Rice terrace seedlings time-lapse wide angle view in the field with water from nature around mountain ,at ban pa bong piang hill tribe village, chiangmai, thailand. zo, zoom out."
