videoid,contentUrl,duration,page_dir,name
1027698080,https://ak.picdn.net/shutterstock/videos/1027698080/preview/stock-footage-colorful-linear-abstraction-in-the-space-background-with-bright-semicircular-lines-d-rendering.mp4,PT00H00M20S,145601_145650,"Colorful linear abstraction in the space, background with bright semicircular lines, 3d rendering backdrop"
27535042,https://ak.picdn.net/shutterstock/videos/27535042/preview/stock-footage-sakura-spring-flowers-beautiful-nature-scene-with-blooming-sakura-tree-japanese-garden-sunny-day.mp4,PT00H00M12S,131351_131400,Sakura spring flowers. beautiful nature scene with blooming sakura tree. japanese garden. sunny day. abstract blurred background. selective focus.
1032226019,https://ak.picdn.net/shutterstock/videos/1032226019/preview/stock-footage-many-glitched-shiny-dna-spiral-molecule-rotating-in-space-seamless-loop-animation-background-new.mp4,PT00H00M06S,001051_001100,Many glitched shiny dna spiral molecule rotating in space seamless loop animation background new quality beautiful natural health cool nice stock 4k video footage
21911383,https://ak.picdn.net/shutterstock/videos/21911383/preview/stock-footage--k-traffic-city-lights-time-lapse-for-different-projects-and-events.mp4,PT00H00M24S,108251_108300,4k traffic city lights time lapse for different projects and events!!!
1048152007,https://ak.picdn.net/shutterstock/videos/1048152007/preview/stock-footage-aerial-view-of-barren-land-drone-travelling-footage.mp4,PT00H00M16S,116201_116250,Aerial view of barren land. drone travelling footage.
1016826355,https://ak.picdn.net/shutterstock/videos/1016826355/preview/stock-footage-animation-of-continuous-line-drawing-of-standing-woman-pointing-at-herself.mp4,PT00H00M10S,180401_180450,Animation of continuous line drawing of standing woman pointing at herself
12811508,https://ak.picdn.net/shutterstock/videos/12811508/preview/stock-footage-slow-motion-of-people-walking-in-the-street-at-the-sunset-in-a-blurred-and-out-of-focus-context-in.mp4,PT00H00M07S,130751_130800,Slow motion of people walking in the street at the sunset in a blurred and out of focus context in a big busy city with lights and colors
1024079798,https://ak.picdn.net/shutterstock/videos/1024079798/preview/stock-footage-bright-animated-paper-curve-lines-modern-d-rendering-background-computer-generated.mp4,PT00H00M10S,023051_023100,"Bright animated paper - curve lines, modern 3d rendering background, computer generated"
1035418415,https://ak.picdn.net/shutterstock/videos/1035418415/preview/stock-footage-close-up-of-toy-soldiers-on-white-background.mp4,PT00H00M15S,143951_144000,Close-up of toy soldiers on white background
3794372,https://ak.picdn.net/shutterstock/videos/3794372/preview/stock-footage-technology-background-with-metal-gears-and-cogwheels.mp4,PT00H00M10S,028551_028600,Technology background with metal gears and cogwheels
1011943865,https://ak.picdn.net/shutterstock/videos/1011943865/preview/stock-footage-helicopter-toy-falling-during-an-explosion-ultra-slow-motion.mp4,PT00H00M16S,076101_076150,"Helicopter toy falling during an explosion, ultra slow motion"
1020161953,https://ak.picdn.net/shutterstock/videos/1020161953/preview/stock-footage-mountain-river-in-winter-hordaland-norway.mp4,PT00H00M28S,135201_135250,"Mountain river in winter. hordaland, norway."
1664734,https://ak.picdn.net/shutterstock/videos/1664734/preview/stock-footage-autumn-foliage.mp4,PT00H00M20S,042251_042300,Autumn foliage
30074671,https://ak.picdn.net/shutterstock/videos/30074671/preview/stock-footage-close-up-of-female-hand-on-black-mouse-woman-s-hand-using-cordless-mouse-on-white-table-close-up.mp4,PT00H00M07S,192751_192800,Close-up of female hand on black mouse. woman's hand using cordless mouse on white table. close up portrait of the hands of a young woman using a computer
1266193,https://ak.picdn.net/shutterstock/videos/1266193/preview/stock-footage-wind-turbines.mp4,PT00H00M16S,068751_068800,Wind turbines
8055208,https://ak.picdn.net/shutterstock/videos/8055208/preview/stock-footage-slow-motion-snowboarder-jumping-and-crashing-in-powder.mp4,PT00H00M28S,098451_098500,Slow motion: snowboarder jumping and crashing in powder
20435905,https://ak.picdn.net/shutterstock/videos/20435905/preview/stock-footage-airplane-wing-flying-plane.mp4,PT00H00M08S,115251_115300,Airplane wing flying plane
1032273338,https://ak.picdn.net/shutterstock/videos/1032273338/preview/stock-footage-water-is-poured-from-hose-in-slow-motion-water-pattern-with-waves-and-splash.mp4,PT00H00M23S,074751_074800,Water is poured from hose in slow motion. water pattern with waves and splash
17968726,https://ak.picdn.net/shutterstock/videos/17968726/preview/stock-footage-bottle-with-pouring-water.mp4,PT00H00M06S,190101_190150,Bottle with pouring water
1364455,https://ak.picdn.net/shutterstock/videos/1364455/preview/stock-footage-nurse-driving-disabled-senior-woman-in-wheelchair.mp4,PT00H00M10S,012601_012650,Nurse driving disabled senior woman in wheelchair
1031300372,https://ak.picdn.net/shutterstock/videos/1031300372/preview/stock-footage-happy-father-s-day-greeting-text-with-colorful-glitch-effect-isolated-on-black-background-happy.mp4,PT00H00M05S,119151_119200,"Happy father's day greeting text with colorful glitch effect isolated on black background, happy father's day beautiful typography  design."
2041331,https://ak.picdn.net/shutterstock/videos/2041331/preview/stock-footage-medical-doctor-checking-x-ray.mp4,PT00H00M16S,014651_014700,Medical doctor checking x ray
14635906,https://ak.picdn.net/shutterstock/videos/14635906/preview/stock-footage-the-train-travels-at-speeds-near-the-picturesque-fields-on-the-railroad-lombardini-italy.mp4,PT00H00M08S,027651_027700,"The train travels at speeds near the picturesque fields on the railroad, lombardini, italy."
25911104,https://ak.picdn.net/shutterstock/videos/25911104/preview/stock-footage-two-friends-woman-holding-girl-who-sit-on-longboard-on-the-beach-at-sunset.mp4,PT00H00M17S,080151_080200,Two friends woman holding girl who sit on longboard on the beach at sunset.
3379949,https://ak.picdn.net/shutterstock/videos/3379949/preview/stock-footage-group-of-butterfly-on-sand-spot-swordtail-kaeng-krachan-national-park-thailand.mp4,PT00H00M13S,145501_145550,"Group of butterfly on sand (spot swordtail) , kaeng krachan national park, thailand"
25475996,https://ak.picdn.net/shutterstock/videos/25475996/preview/stock-footage-aerial-view-of-a-synagogue-in-romania.mp4,PT00H00M10S,043351_043400,Aerial view of a synagogue in romania
33418993,https://ak.picdn.net/shutterstock/videos/33418993/preview/stock-footage-close-up-face-young-black-man-and-woman-cook-and-use-phone.mp4,PT00H00M18S,022951_023000,Close up face young black man and woman cook and use phone  
1026971921,https://ak.picdn.net/shutterstock/videos/1026971921/preview/stock-footage-design-of-mall-in-green-environmentally-friendly-concept-open-air-hanging-garden-on-terraces.mp4,PT00H00M06S,024901_024950,Design of mall in green environmentally friendly concept. open air hanging garden on terraces. futuristic eco architecture. modern city.
16919281,https://ak.picdn.net/shutterstock/videos/16919281/preview/stock-footage-beautiful-girl-wearing-ballet-leotard.mp4,PT00H00M34S,181151_181200,Beautiful girl wearing ballet leotard
1017635338,https://ak.picdn.net/shutterstock/videos/1017635338/preview/stock-footage-woman-removes-old-makeup-with-a-nail-file.mp4,PT00H00M09S,057201_057250,Woman removes old makeup with a nail file.
1028791046,https://ak.picdn.net/shutterstock/videos/1028791046/preview/stock-footage-gomel-belarus-may-traffic-on-kommunarov-street.mp4,PT00H00M16S,064301_064350,"Gomel, belarus - may 2, 2019: traffic on kommunarov street."
1042798816,https://ak.picdn.net/shutterstock/videos/1042798816/preview/stock-footage--young-man-with-laptop-working-under-palm-trees-freedom-remote-work-freelancer-technology.mp4,PT00H00M32S,113301_113350,"
young man with laptop working under palm trees. freedom, remote work, freelancer, technology, internet, travel and  freelance concept"
24870119,https://ak.picdn.net/shutterstock/videos/24870119/preview/stock-footage-kayak-early-mourning-in-south-brazil.mp4,PT00H00M22S,004151_004200,Kayak early mourning in south brazil.
28419838,https://ak.picdn.net/shutterstock/videos/28419838/preview/stock-footage-great-scene-of-the-countryside-with-white-fluffy-clouds-a-wonderful-day-in-summertime-location.mp4,PT00H00M11S,057651_057700,"Great scene of the countryside with white fluffy clouds. a wonderful day in summertime. location place of ukraine, europe. ecological production of organic products. beauty world. shot in 4k (uhd)."
1046479825,https://ak.picdn.net/shutterstock/videos/1046479825/preview/stock-footage-foams-over-the-sea-which-a-boat-caused-while-cruise.mp4,PT00H00M28S,178651_178700,Foams over the sea which a boat caused while cruise.
1023901459,https://ak.picdn.net/shutterstock/videos/1023901459/preview/stock-footage-cute-woman-enjoy-walking-among-young-spruces-trees-in-snow-winter-nature-forest-park.mp4,PT00H00M14S,014851_014900,Cute woman enjoy walking among young spruces trees in snow winter nature forest park
1010852435,https://ak.picdn.net/shutterstock/videos/1010852435/preview/stock-footage-guarantee-perfect-animated-text-loop-write-on-write-off.mp4,PT00H00M05S,041301_041350,"Guarantee, perfect animated text loop write on write off"
18210661,https://ak.picdn.net/shutterstock/videos/18210661/preview/stock-footage-the-deep-fried-pork-in-japanese-style.mp4,PT00H00M09S,107951_108000,The deep fried pork in japanese style.
1019570314,https://ak.picdn.net/shutterstock/videos/1019570314/preview/stock-footage-candles-burning-in-a-dark-room-and-then-blown-out.mp4,PT00H00M15S,109851_109900,Candles burning in a dark room and then blown out
1064697550,https://ak.picdn.net/shutterstock/videos/1064697550/preview/stock-footage-landscapes-of-guatavita-in-cundinamarca-colombia-drone-view.mp4,PT00H00M34S,002951_003000,Landscapes of guatavita in cundinamarca (colombia) - drone view
23699713,https://ak.picdn.net/shutterstock/videos/23699713/preview/stock-footage-technology-blue-background-with-animated-strokes-of-binary-code-on-digital-screen-seamless-loop.mp4,PT00H00M10S,033251_033300,"Technology blue background with animated strokes of binary code on digital screen. seamless loop. more color options, camera angles and different types of animation available in my portfolio."
1007539045,https://ak.picdn.net/shutterstock/videos/1007539045/preview/stock-footage-sparks-coming-from-steel-grinder-male-worker-cutting-rusty-car-parts-in-his-work-place.mp4,PT00H00M15S,054101_054150,Sparks coming from steel grinder. male worker cutting rusty car parts in his work place.
1052711441,https://ak.picdn.net/shutterstock/videos/1052711441/preview/stock-footage-attractive-young-woman-smiles-poses-takes-selfies-and-streams-video-to-social-media-from-her.mp4,PT00H00M06S,015501_015550,"Attractive young woman smiles, poses, takes selfies and streams video to social media from her smartphone. closeup portrait of happy woman with coktail in swimwear making photo in home office. dream"
27796543,https://ak.picdn.net/shutterstock/videos/27796543/preview/stock-footage-boardroom-meeting-with-creative-modern-business-team-diverse-happy-executives-male-and-female.mp4,PT00H00M20S,004701_004750,"Boardroom meeting with creative, modern business team. diverse happy executives, male and female directors discuss innovative ideas. multi-ethnic, white caucasian and black. natural, young and mature."
1048884754,https://ak.picdn.net/shutterstock/videos/1048884754/preview/stock-footage-pasta-with-meat-tomato-and-green-onion-italian-cuisine.mp4,PT00H00M06S,060701_060750,"Pasta with meat, tomato and green onion, italian cuisine"
32251393,https://ak.picdn.net/shutterstock/videos/32251393/preview/stock-footage-cheerful-girl-holding-in-the-hands-of-sparklers-and-laughing-the-young-woman-at-the-party-the.mp4,PT00H00M13S,172151_172200,Cheerful girl holding in the hands of sparklers and laughing. the young woman at the party. the festive mood. slow motion
8169904,https://ak.picdn.net/shutterstock/videos/8169904/preview/stock-footage-fireworks-and-lights-up-the-stage-series-version-from-to.mp4,PT00H00M12S,141951_142000,Fireworks and lights up the stage ( series 2 + version from 1 to 9 ) 
9076733,https://ak.picdn.net/shutterstock/videos/9076733/preview/stock-footage-white-crane-on-foliage-a-white-crane-climbs-around-on-a-bush-before-it-takes-off-in-flight.mp4,PT00H00M09S,104001_104050,"White crane on foliage
a white crane climbs around on a bush before it takes off in flight."
12985742,https://ak.picdn.net/shutterstock/videos/12985742/preview/stock-footage-drone-footage-of-golden-fields-and-agricultural-machinery-in-high-quality-format.mp4,PT00H00M10S,066251_066300,Drone footage of golden fields and agricultural machinery in high quality format
326326,https://ak.picdn.net/shutterstock/videos/326326/preview/stock-footage-palm-leaves-transition-alpha-included.mp4,PT00H00M07S,085201_085250,Palm leaves transition (alpha included)
1039855277,https://ak.picdn.net/shutterstock/videos/1039855277/preview/stock-footage-late-afternoon-sunshine-hits-buildings-and-architecture-in-morgantown-wv.mp4,PT00H00M26S,056901_056950,Late afternoon sunshine hits buildings and architecture in morgantown wv
1022281,https://ak.picdn.net/shutterstock/videos/1022281/preview/stock-footage-serious-businessman-boxing-towards-the-camera.mp4,PT00H00M14S,135401_135450,Serious businessman boxing towards the camera
1037943848,https://ak.picdn.net/shutterstock/videos/1037943848/preview/stock-footage-complex-road-intersection-in-shanghai-china.mp4,PT00H00M10S,127251_127300,Complex road intersection in shanghai china 
1057295431,https://ak.picdn.net/shutterstock/videos/1057295431/preview/stock-footage-video-animation-of-a-monitor-screen-with-noise-and-the-message-ransomware-attack-generated-with.mp4,PT00H00M15S,186851_186900,Video animation of a monitor screen with noise and the message ransomware attack. generated with glitch effect. abstract background.
1027214486,https://ak.picdn.net/shutterstock/videos/1027214486/preview/stock-footage-closeup-shoot-of-plump-sexy-pretty-caucasian-female-with-big-breasts-jumping-happily-on-the-bed.mp4,PT00H00M11S,089551_089600,Closeup shoot of plump sexy pretty caucasian female with big breasts jumping happily on the bed with playing with soft fur cover indoors in a cozy apartment
11350748,https://ak.picdn.net/shutterstock/videos/11350748/preview/stock-footage-waves-breaking-the-rocks-close-up-clean-water.mp4,PT00H00M23S,031251_031300,Waves breaking the rocks. close up. clean water.
5932067,https://ak.picdn.net/shutterstock/videos/5932067/preview/stock-footage-side-view-of-caucasian-lecturer-handing-out-assignments-to-his-students-in-classroom-at-the.mp4,PT00H00M14S,190951_191000,Side view of caucasian lecturer handing out assignments to his students in classroom at the university
2560748,https://ak.picdn.net/shutterstock/videos/2560748/preview/stock-footage-stockholm-sweden-december-people-walking-in-a-revolving-door-sweden.mp4,PT00H00M10S,173201_173250,"Stockholm, sweden - december 2007: people walking in a revolving door, sweden."
1030563014,https://ak.picdn.net/shutterstock/videos/1030563014/preview/stock-footage-error-system-error-glitch-no-signal-critical-error-message-computer-virus-hacker-attack.mp4,PT00H00M15S,051951_052000,Error. system error. glitch. no signal. critical error message. 404. computer virus. hacker attack. system damage. page not found. information technology. it. bad signal.
31271191,https://ak.picdn.net/shutterstock/videos/31271191/preview/stock-footage-japan-kyoto-nov-crowds-of-people-in-the-streets-of-under-kiyomizu-dera-temple-kyoto.mp4,PT00H00M10S,008651_008700,"Japan, kyoto, nov 20 2016, crowds of people in the streets of under kiyomizu-dera temple, kyoto, japan"
1060870348,https://ak.picdn.net/shutterstock/videos/1060870348/preview/stock-footage-outdoor-activity-man-climbs-on-the-atv-with-his-son-riding-atvs-in-the-forest.mp4,PT00H00M11S,024751_024800,Outdoor activity - man climbs on the atv with his son riding atvs in the forest
19215373,https://ak.picdn.net/shutterstock/videos/19215373/preview/stock-footage-aerial-view-ribeirao-preto-city-park-dr-luis-carlos-raya-park-august.mp4,PT00H00M24S,078651_078700,"Aerial view ribeirao preto city park, dr. luis carlos raya park. august, 2016"
1014872344,https://ak.picdn.net/shutterstock/videos/1014872344/preview/stock-footage-jack-fruit-on-tree-in-nature.mp4,PT00H00M10S,119951_120000,Jack fruit on tree in nature
1010902598,https://ak.picdn.net/shutterstock/videos/1010902598/preview/stock-footage-banded-sea-krait-laticauda-colubrina-sea-snake-in-the-corals-in-zulu-sea-apo-island-philippines.mp4,PT00H00M20S,110751_110800,Banded sea krait (laticauda colubrina) - sea snake in the corals in zulu sea apo island philippines.
1063505206,https://ak.picdn.net/shutterstock/videos/1063505206/preview/stock-footage-aerial-view-of-forest-during-cold-winter-morning.mp4,PT00H00M10S,112851_112900,Aerial view of forest during cold winter morning
25324076,https://ak.picdn.net/shutterstock/videos/25324076/preview/stock-footage-funny-kitten-climbed-up-on-a-snag.mp4,PT00H00M20S,181251_181300,Funny kitten climbed up on a snag
1032997163,https://ak.picdn.net/shutterstock/videos/1032997163/preview/stock-footage-cityscape-skyline-view-of-madrid-from-the-helicopter.mp4,PT00H00M23S,030551_030600,Cityscape skyline view of madrid from the helicopter
34312804,https://ak.picdn.net/shutterstock/videos/34312804/preview/stock-footage-pan-view-businessman-use-cell-connecting-stock-exchange-electronic-data-base.mp4,PT00H00M22S,069901_069950,Pan view businessman use cell connecting stock exchange electronic data base
1021961104,https://ak.picdn.net/shutterstock/videos/1021961104/preview/stock-footage-laptop-with-green-screen-dark-home-office-dolly-shot-of-perfect-to-put-your-own-image-or-video.mp4,PT00H00M08S,087651_087700,Laptop with green screen. dark home office . dolly shot of perfect to put your own image or video. 
11135786,https://ak.picdn.net/shutterstock/videos/11135786/preview/stock-footage-portrait-of-sad-unhappy-woman-sitting-on-sofa-at-home.mp4,PT00H00M16S,080601_080650,"Portrait of sad, unhappy woman sitting on sofa at home
"
6216983,https://ak.picdn.net/shutterstock/videos/6216983/preview/stock-footage-a-boy-and-a-girl-on-a-bench-on-the-first-date-love.mp4,PT00H00M21S,078901_078950,A boy and a girl on a bench on the first date - love
1020258457,https://ak.picdn.net/shutterstock/videos/1020258457/preview/stock-footage-woman-kneading-dough-in-flour-on-table.mp4,PT00H00M29S,050951_051000,Woman kneading dough in flour on table
1034159990,https://ak.picdn.net/shutterstock/videos/1034159990/preview/stock-footage-aerial-view-of-a-large-modern-high-tech-port-accepting-goods-and-fuels.mp4,PT00H00M17S,090501_090550,Aerial view of a large modern high-tech port accepting goods and fuels
1007653459,https://ak.picdn.net/shutterstock/videos/1007653459/preview/stock-footage-aerial-view-at-the-country-highway-passing-near-forest-in-evergreen-northern-forests-clip-top.mp4,PT00H00M11S,054551_054600,Aerial view at the country highway passing near forest in evergreen northern forests. clip. top view of the motorway near the forest
1016100979,https://ak.picdn.net/shutterstock/videos/1016100979/preview/stock-footage-fiber-optic-clutch.mp4,PT00H00M09S,002501_002550,Fiber optic clutch
1019817580,https://ak.picdn.net/shutterstock/videos/1019817580/preview/stock-footage-a-ray-of-sun-breaks-through-the-leaves.mp4,PT00H00M18S,070851_070900,A ray of sun breaks through the leaves
33798577,https://ak.picdn.net/shutterstock/videos/33798577/preview/stock-footage-young-girl-in-a-swimming-suit-in-blue-water-pool-aerial-view-girl-swims-in-the-pool-of-the-resort.mp4,PT00H00M14S,053101_053150,"Young girl in a swimming suit in blue water pool. aerial view girl swims in the pool of the resort, 4k video travel concept, aerial footage."
10802264,https://ak.picdn.net/shutterstock/videos/10802264/preview/stock-footage-vibrant-sun-rises-over-the-sonoran-desert-illuminating-the-silhouette-of-a-saguaro-cactus-hd.mp4,PT00H00M15S,083151_083200,"Vibrant sun rises over the sonoran desert, illuminating the silhouette of a saguaro cactus. hd 1080p time-lapse."
1033931114,https://ak.picdn.net/shutterstock/videos/1033931114/preview/stock-footage-lhasa-tibet-january-colorful-buddha-thangka-paintings-on-massive-rocks-above-drepung.mp4,PT00H00M10S,121951_122000,"Lhasa, tibet – january 2019: colorful buddha thangka paintings on massive rocks above drepung monastery in lhasa, religion art culture in tibet"
1029399218,https://ak.picdn.net/shutterstock/videos/1029399218/preview/stock-footage-christmas-ornament-santa-claus-sleigh-with-deer-icon-symbol-abstract-blinking-sparkle-glitter.mp4,PT00H00M13S,014451_014500,Christmas ornament santa claus sleigh with deer icon symbol abstract blinking sparkle glitter particle looped background.
1028654471,https://ak.picdn.net/shutterstock/videos/1028654471/preview/stock-footage-particles-dust-bokeh-abstract-light-motion-titles-cinematic-background-loop.mp4,PT00H00M12S,022051_022100,Particles dust bokeh abstract light motion titles cinematic background loop
12993269,https://ak.picdn.net/shutterstock/videos/12993269/preview/stock-footage-seal-icon-design-video-animation-hd.mp4,PT00H00M23S,144301_144350,"Seal icon design, video animation hd1080"
1021308097,https://ak.picdn.net/shutterstock/videos/1021308097/preview/stock-footage-a-farmer-uses-a-digital-tablet-while-monitoring-his-plantation-a-farmer-with-an-apron-and-a-hat-on.mp4,PT00H00M15S,048551_048600,A farmer uses a digital tablet while monitoring his plantation. a farmer with an apron and a hat on his head.  irrigation system of vegetable crops. modern use of technology in agricultural activities
1024834265,https://ak.picdn.net/shutterstock/videos/1024834265/preview/stock-footage-airplane-take-off-procida-during-a-wonderful-sunset.mp4,PT00H00M08S,104951_105000,Airplane take off procida during a wonderful sunset
1013996750,https://ak.picdn.net/shutterstock/videos/1013996750/preview/stock-footage-preparation-of-dough-for-a-biscuit-cake-for-the-celebration-with-the-help-of-special-kitchen.mp4,PT00H00M50S,197201_197250,Preparation of dough for a biscuit cake for the celebration with the help of special kitchen utensils
1026198659,https://ak.picdn.net/shutterstock/videos/1026198659/preview/stock-footage-closeup-negroni-cocktail-design-and-creative-from-the-bartender-barman-has-made-cocktail-at-night.mp4,PT00H00M22S,081701_081750,Closeup negroni cocktail design and creative from the bartender. barman has made cocktail at night club. italian gin and vermouth cocktail recipe
34088974,https://ak.picdn.net/shutterstock/videos/34088974/preview/stock-footage-fountain-the-struggle-borba-or-the-man-with-the-snake-or-fisherman-fountain-on-belgrade.mp4,PT00H00M13S,127101_127150,Fountain the struggle (borba) or the man with the snake or fisherman fountain on belgrade kalemegdan fortress. the bronze sculpture made by sculptor simeon roksandic. belgrade 21 october 2017
11446346,https://ak.picdn.net/shutterstock/videos/11446346/preview/stock-footage-common-sparrows-eating-sunflowers-on-a-bird-feeder-filimed-in-k-uhd-with-nice-audio-track-of-birds.mp4,PT00H00M15S,036651_036700,Common sparrows eating sunflowers on a bird feeder filimed in 4k uhd with nice audio track of birds chirping.
1051824397,https://ak.picdn.net/shutterstock/videos/1051824397/preview/stock-footage-hong-kong-china-april-star-ferry-dock-at-pier-in-hong-kong-china.mp4,PT00H01M00S,170101_170150,"Hong kong, china - april 23, 2017: star ferry dock at pier in hong kong, china."
1008689422,https://ak.picdn.net/shutterstock/videos/1008689422/preview/stock-footage-antigua-guatemala-march-guatemala-antigua-fair-market-crowd-of-people-walking-on-busy-street.mp4,PT00H00M27S,020051_020100,"Antigua guatemala, march 2017:guatemala antigua fair market. crowd of people walking on busy street "
9875444,https://ak.picdn.net/shutterstock/videos/9875444/preview/stock-footage-timelapse-of-iceland-waterfall.mp4,PT00H00M18S,195901_195950,Timelapse of iceland waterfall
1054175714,https://ak.picdn.net/shutterstock/videos/1054175714/preview/stock-footage-medical-stethoscope-on-modern-digital-tablet-on-white-background.mp4,PT00H00M07S,004051_004100,Medical stethoscope on modern digital tablet on white background 
19879804,https://ak.picdn.net/shutterstock/videos/19879804/preview/stock-footage-moscow-russia-september-twenty-fourth-two-thousand-sixteen-year-parade-of-bicyclists-bike-riders.mp4,PT00H00M18S,098701_098750,"Moscow;russia,september -twenty fourth-two thousand sixteen year;parade of bicyclists,bike riders
"
2988085,https://ak.picdn.net/shutterstock/videos/2988085/preview/stock-footage-zion-national-park-utah-usa.mp4,PT00H00M10S,017051_017100,"Zion national park, utah, usa"
1009134368,https://ak.picdn.net/shutterstock/videos/1009134368/preview/stock-footage-criminal-trying-to-escape-from-prison-unlocking-handcuffs-with-stolen-key.mp4,PT00H00M19S,114851_114900,"Criminal trying to escape from prison, unlocking handcuffs with stolen key"
1030646633,https://ak.picdn.net/shutterstock/videos/1030646633/preview/stock-footage-sligo-ireland-box-of-hand-crafted-marine-pulleys.mp4,PT00H00M13S,056201_056250,"Sligo, ireland - 11 06 2018: box of hand crafted marine pulleys"
22465912,https://ak.picdn.net/shutterstock/videos/22465912/preview/stock-footage-twinkling-horizontal-small-squared-hi-tech-bars-blue-magenta-cyan-abstract-loopable-k.mp4,PT00H00M06S,003801_003850,"Twinkling horizontal small squared hi-tech bars, blue magenta cyan, abstract, loopable, 4k"
69130,https://ak.picdn.net/shutterstock/videos/69130/preview/stock-footage-agriculture-stacking-bales-of-hay.mp4,PT00H00M15S,109301_109350,Agriculture - stacking bales of hay
