videoid,contentUrl,duration,page_dir,name
1039003370,https://ak.picdn.net/shutterstock/videos/1039003370/preview/stock-footage-park-in-lujiazui-financial-centre-shanghai-china.mp4,PT00H00M05S,032701_032750,"Park in lujiazui financial centre, shanghai, china"
1024644038,https://ak.picdn.net/shutterstock/videos/1024644038/preview/stock-footage-set-of-green-words-for-st-patrick-s-day-sec-alpha-channel-with-shadow-duration-sec-ale.mp4,PT00H00M10S,043401_043450,Set of green words for st. patrick's day. 5 sec. alpha channel with shadow. duration 5 sec. ale
33611329,https://ak.picdn.net/shutterstock/videos/33611329/preview/stock-footage-aerial-photography-of-a-house-in-the-forest-a-house-with-red-tiles-summer.mp4,PT00H00M54S,175301_175350,"Aerial photography of a house in the forest, a house with red tiles, summer"
1034745452,https://ak.picdn.net/shutterstock/videos/1034745452/preview/stock-footage-antenna-sending-radio-waves-animation-video-animation-of-antenna-transmitting-radio-waves-in-the.mp4,PT00H00M38S,071401_071450,"Antenna sending radio waves animation
video animation of antenna transmitting radio waves in the air as signals 
"
26721178,https://ak.picdn.net/shutterstock/videos/26721178/preview/stock-footage-london-uk-may-piccadilly-circus-at-night-famous-place-in-london.mp4,PT00H00M18S,003101_003150,"London, uk - may 11, 2017: piccadilly circus at night. famous place in london."
79255,https://ak.picdn.net/shutterstock/videos/79255/preview/stock-footage-a-uh-huey-does-a-flyby-at-an-airshow.mp4,PT00H00M09S,122751_122800,"A uh1 ""huey"" does a flyby at an airshow."
14518858,https://ak.picdn.net/shutterstock/videos/14518858/preview/stock-footage-hippos-ishasha-river-queen-elizabeth-national-park-uganda-africa.mp4,PT00H00M30S,195251_195300,"Hippos, ishasha river, queen elizabeth national park, uganda, africa"
7779787,https://ak.picdn.net/shutterstock/videos/7779787/preview/stock-footage-fountain.mp4,PT00H00M45S,143951_144000,Fountain
15006079,https://ak.picdn.net/shutterstock/videos/15006079/preview/stock-footage-close-up-of-pen-and-open-notebook-slow-sliding-motion-concept-of-writing-office-work-and.mp4,PT00H00M22S,065151_065200,"Close up of pen and open notebook. slow sliding motion. concept of writing, office work and education."
17760670,https://ak.picdn.net/shutterstock/videos/17760670/preview/stock-footage-smiling-man-in-sunglasses-texting-message-on-smartphone-at-stone-wall.mp4,PT00H00M11S,040101_040150,Smiling man in sunglasses texting message on smartphone at stone wall
1018613647,https://ak.picdn.net/shutterstock/videos/1018613647/preview/stock-footage-child-with-a-big-lollipop-portrait-of-a-child-with-candy.mp4,PT00H00M25S,001701_001750,Child with a big lollipop. portrait of a child with candy.
14746234,https://ak.picdn.net/shutterstock/videos/14746234/preview/stock-footage-freeride-skier-in-slow-motion.mp4,PT00H00M16S,057751_057800,Freeride skier in slow motion
1049343421,https://ak.picdn.net/shutterstock/videos/1049343421/preview/stock-footage-aerial-photograph-an-aerial-shot-of-trains-leaving-a-station-in-berlin-germany.mp4,PT00H00M15S,065101_065150,"Aerial photograph, an aerial shot of trains leaving a station in berlin, germany"
1021377397,https://ak.picdn.net/shutterstock/videos/1021377397/preview/stock-footage-sunset-and-airliner-at-kix-kansai-international-airport-japan-may.mp4,PT00H00M31S,118501_118550,"Sunset and airliner at kix kansai international airport japan - may 11, 2017"
1013643227,https://ak.picdn.net/shutterstock/videos/1013643227/preview/stock-footage-useful-green-lentils.mp4,PT00H00M53S,125051_125100,Useful green lentils.
1023645109,https://ak.picdn.net/shutterstock/videos/1023645109/preview/stock-footage-singapore-flag-waving-and-fluttering-in-front-of-green-screen.mp4,PT00H00M29S,058501_058550,Singapore flag waving and fluttering in front of green screen
1022744170,https://ak.picdn.net/shutterstock/videos/1022744170/preview/stock-footage-gold-labrador-is-lying-and-fooling-around-in-the-sand-on-the-beach-of-the-ocean.mp4,PT00H00M08S,009301_009350,Gold labrador is lying and fooling around in the sand on the beach of the ocean
1010682110,https://ak.picdn.net/shutterstock/videos/1010682110/preview/stock-footage-yoga-woman-sit-in-meditation-pose-on-mountain-cliff-in-sapa-vietnam.mp4,PT00H00M16S,175601_175650,"Yoga woman sit in meditation pose on mountain cliff in sapa, vietnam"
184483,https://ak.picdn.net/shutterstock/videos/184483/preview/stock-footage-tree-flowers-under-a-blue-sky.mp4,PT00H00M20S,048301_048350,Tree flowers under a blue sky
1038391541,https://ak.picdn.net/shutterstock/videos/1038391541/preview/stock-footage-family-decorate-the-christmas-tree.mp4,PT00H00M41S,082101_082150,Family decorate the christmas tree
1060673533,https://ak.picdn.net/shutterstock/videos/1060673533/preview/stock-footage-walking-the-trail-in-the-fog.mp4,PT00H00M31S,006151_006200,Walking the trail in the fog
1026415217,https://ak.picdn.net/shutterstock/videos/1026415217/preview/stock-footage-digitally-animated-of-white-scrambled-tv-against-colorful-background.mp4,PT00H00M20S,083651_083700,Digitally animated of white scrambled tv against colorful background
15055930,https://ak.picdn.net/shutterstock/videos/15055930/preview/stock-footage-vojvodina-serbia-february-mps-in-parliament-councilors-in-the-assembly.mp4,PT00H00M16S,023451_023500,"Vojvodina, serbia february 26 2015: mps in parliament , councilors in the assembly "
1017862606,https://ak.picdn.net/shutterstock/videos/1017862606/preview/stock-footage-osaka-japan-october-expocity-is-a-large-theme-park-in-the-expo-memorial-park-in-suita.mp4,PT00H00M15S,147851_147900,"Osaka,japan - 13 october 2018 - expocity is a large theme park in the expo memorial park in suita city, osaka prefecture."
14654203,https://ak.picdn.net/shutterstock/videos/14654203/preview/stock-footage-huge-conrainer-crane-hamburg-germany-december.mp4,PT00H00M15S,082751_082800,"Huge conrainer crane - hamburg, germany december 21, 2015"
24222370,https://ak.picdn.net/shutterstock/videos/24222370/preview/stock-footage-filter-control-system-on-a-monitor-industrial-water-filtration-and-ionizer-system.mp4,PT00H00M12S,039301_039350,Filter control system on a monitor. industrial water filtration and ionizer system
1028967689,https://ak.picdn.net/shutterstock/videos/1028967689/preview/stock-footage-aerial-riga-view-over-old-town-central-park-and-statue-of-liberty-milda-sunset-time.mp4,PT00H00M24S,055151_055200,"Aerial riga view over old town, central park and statue of liberty milda. sunset time."
23872996,https://ak.picdn.net/shutterstock/videos/23872996/preview/stock-footage-snowy-owl-turns-head-and-squints.mp4,PT00H00M15S,144251_144300,Snowy owl turns head and squints
1056022526,https://ak.picdn.net/shutterstock/videos/1056022526/preview/stock-footage-businesswoman-lifting-book-and-speech-bubble-animated-k-video-animation.mp4,PT00H00M11S,066701_066750,"Businesswoman lifting book and speech bubble animated ,4k video animation"
1055030795,https://ak.picdn.net/shutterstock/videos/1055030795/preview/stock-footage-tilt-timelapse-ot-sunflower-field-italy.mp4,PT00H00M10S,178201_178250,"Tilt timelapse ot sunflower field, italy"
1055475083,https://ak.picdn.net/shutterstock/videos/1055475083/preview/stock-footage-a-construction-engineer-in-a-checked-shirt-orange-vest-and-white-hard-hat-on-a-yellow.mp4,PT00H00M33S,099151_099200,"A construction engineer in a checked shirt, orange vest, and white hard hat on a yellow construction crane with a walkie-talkie in his hands. foreman, supervisor, worker"
18610238,https://ak.picdn.net/shutterstock/videos/18610238/preview/stock-footage-raindrops-are-falling-from-awning-slow-motion.mp4,PT00H00M16S,147151_147200,"Raindrops are falling from awning, slow motion
"
1019815318,https://ak.picdn.net/shutterstock/videos/1019815318/preview/stock-footage-pensive-dog-sit-and-watch-out-through-apartment-window-autumn-time-thoughtful-beagle-wait-for.mp4,PT00H00M20S,196201_196250,"Pensive dog sit and watch out through apartment window, autumn time. thoughtful beagle wait for missed owner or friend, sitting alone at home, high floor"
13915661,https://ak.picdn.net/shutterstock/videos/13915661/preview/stock-footage--k-timelapse-sun-rise-of-wugu-wetland-taiwan.mp4,PT00H00M20S,149401_149450,"4k timelapse sun rise of wugu wetland, taiwan"
1046490106,https://ak.picdn.net/shutterstock/videos/1046490106/preview/stock-footage-young-brunette-girl-blue-green-in-checked-shirt-on-grey-background-a-happy-woman-in-glasses-holds-a.mp4,PT00H00M05S,000801_000850,"Young brunette girl blue green in checked shirt on grey background a happy woman in glasses holds a piece of paper with red heart, shows her index finger"
1026958286,https://ak.picdn.net/shutterstock/videos/1026958286/preview/stock-footage-woman-looking-through-binoculars-at-the-trees-enjoying-the-view-at-asian-jungle-trekking-through.mp4,PT00H00M27S,081551_081600,"Woman looking through binoculars at the trees, enjoying the view at asian jungle. trekking through the jungle."
12682586,https://ak.picdn.net/shutterstock/videos/12682586/preview/stock-footage-a-bee-flying-downwards-to-pink-flowers-looking-for-nectar.mp4,PT00H00M24S,004301_004350,A bee flying downwards to pink flowers looking for nectar
1010911715,https://ak.picdn.net/shutterstock/videos/1010911715/preview/stock-footage-friends-are-celebrating-reunion-in-cafe-over-drinks-and-pizza-clanging-cups-drinking-and-sharing.mp4,PT00H00M11S,070701_070750,"Friends are celebrating reunion in cafe over drinks and pizza, clanging cups, drinking and sharing news. friendship, modern lifestyle, communication and celebration concept."
13876949,https://ak.picdn.net/shutterstock/videos/13876949/preview/stock-footage-burning-candle-with-incenses-for-praying-in-pagoda.mp4,PT00H00M11S,018951_019000,Burning candle with incenses for praying in pagoda
1039279403,https://ak.picdn.net/shutterstock/videos/1039279403/preview/stock-footage-happy-businesswoman-running-over-white.mp4,PT00H00M10S,008201_008250,Happy businesswoman running over white
33049471,https://ak.picdn.net/shutterstock/videos/33049471/preview/stock-footage-metal-welding-in-factory-industria-manufacture-of-refrigeration-and-ventilation-industrial.mp4,PT00H00M13S,133951_134000,Metal welding in factory. industria. manufacture of refrigeration and ventilation industrial equipment and air conditioners. metalworking in factory.
1059459800,https://ak.picdn.net/shutterstock/videos/1059459800/preview/stock-footage-aerial-video-of-cherry-blossoms-with-mountains-in-the-valle-del-jerte.mp4,PT00H00M27S,115151_115200,Aerial video of cherry blossoms with mountains in the valle del jerte
1016981344,https://ak.picdn.net/shutterstock/videos/1016981344/preview/stock-footage-blooming-jacaranda-mimosifolia-also-known-as-jacaranda-blue-jacaranda-black-poui-or-as-the-fern.mp4,PT00H00M06S,068601_068650,"Blooming jacaranda mimosifolia, also known as jacaranda, blue jacaranda, black poui, or as the fern tree. turkey."
1030418945,https://ak.picdn.net/shutterstock/videos/1030418945/preview/stock-footage-hand-takes-out-small-coins-of-israeli-cents-from-wallet.mp4,PT00H00M08S,042301_042350,Hand takes out small coins of israeli cents from wallet
5817236,https://ak.picdn.net/shutterstock/videos/5817236/preview/stock-footage-rockstar-on-phone.mp4,PT00H00M16S,012551_012600,Rockstar on phone 
1037296763,https://ak.picdn.net/shutterstock/videos/1037296763/preview/stock-footage-fit-sporty-girl-in-sportswear-doing-sports-with-fitness-ball-in-studio-with-big-windows-with.mp4,PT00H00M20S,034701_034750,Fit sporty girl in sportswear doing sports with fitness ball in studio with big windows with cityscape on background. arc shot of athletic brunette practicing pilates indoors. concept of sports
1736950,https://ak.picdn.net/shutterstock/videos/1736950/preview/stock-footage-high-tech-data-background-hd-loop.mp4,PT00H00M10S,004301_004350,High tech data background hd loop
16525363,https://ak.picdn.net/shutterstock/videos/16525363/preview/stock-footage-seamless-looping-d-animation-of-the-map-of-slovakia-including-versions-and-alpha-matte.mp4,PT00H01M00S,092851_092900,Seamless looping 3d animation of the map of slovakia including 2 versions and alpha matte
15140374,https://ak.picdn.net/shutterstock/videos/15140374/preview/stock-footage-tropical-palm-trees-against-the-sky.mp4,PT00H00M30S,076351_076400,Tropical palm trees against the sky
1062085156,https://ak.picdn.net/shutterstock/videos/1062085156/preview/stock-footage-animation-of-christmas-winter-scenery-with-snow-falling-and-green-fir-trees-on-blue-background.mp4,PT00H00M12S,119751_119800,Animation of christmas winter scenery with snow falling and green fir trees on blue background. christmas festivity celebration concept digitally generated image.
32452150,https://ak.picdn.net/shutterstock/videos/32452150/preview/stock-footage-taiping-malaysia-september-malaysia-malay-man-cutting-grass-in-a-garden.mp4,PT00H00M32S,192801_192850,"Taiping, malaysia - 21 september 2017: malaysia malay man cutting grass in a garden"
1833719,https://ak.picdn.net/shutterstock/videos/1833719/preview/stock-footage-zoom-out-celebration-of-royalty-arriving-in-palanquin.mp4,PT00H00M10S,033801_033850,Zoom out celebration of royalty arriving in palanquin
22836019,https://ak.picdn.net/shutterstock/videos/22836019/preview/stock-footage-colorful-fireworks-at-night-spectacular-firecracker-d-render-green-version.mp4,PT00H00M42S,009901_009950,Colorful fireworks at night. spectacular firecracker 3d render. green version 31
1061826910,https://ak.picdn.net/shutterstock/videos/1061826910/preview/stock-footage-close-up-of-a-father-hand-lovingly-taking-his-cute-baby-out-of-the-stroller.mp4,PT00H00M07S,029301_029350,Close-up of a father hand lovingly taking his cute baby out of the stroller.
1010792078,https://ak.picdn.net/shutterstock/videos/1010792078/preview/stock-footage-little-girl-playing-on-outdoor-children-playground-in-suburban-neighborhood.mp4,PT00H00M25S,050701_050750,Little girl playing on outdoor children playground in suburban neighborhood.
6974407,https://ak.picdn.net/shutterstock/videos/6974407/preview/stock-footage-nyaungshwe-myanmar-circa-jan-temple-under-construction-on-the-shore-and-fishing-boats.mp4,PT00H00M30S,199701_199750,Nyaungshwe. myanmar - circa jan 2014: temple under construction on the shore and fishing boats
1037172635,https://ak.picdn.net/shutterstock/videos/1037172635/preview/stock-footage-macaroons-or-macaron-on-pastel-blue-surface-with-coffee-in-red-cup.mp4,PT00H00M13S,136301_136350,Macaroons or macaron on pastel blue surface with coffee in red cup.
1026810431,https://ak.picdn.net/shutterstock/videos/1026810431/preview/stock-footage-four-young-people-go-hiking-in-the-snowy-desert.mp4,PT00H00M16S,016051_016100,Four young people go hiking in the snowy desert.
8691343,https://ak.picdn.net/shutterstock/videos/8691343/preview/stock-footage-rainy-day-rain-drops-on-the-window-bokeh-light-x-full-hd-footage.mp4,PT00H00M11S,012501_012550,"Rainy day ,rain drops on the window ,bokeh light 1920x1080 full hd footage"
30144754,https://ak.picdn.net/shutterstock/videos/30144754/preview/stock-footage-dobongsan-mountain-at-the-bukhansan-national-park-in-seoul-south-korea.mp4,PT00H00M16S,037651_037700,"Dobongsan mountain at the bukhansan national park in seoul, south korea."
1027562342,https://ak.picdn.net/shutterstock/videos/1027562342/preview/stock-footage-human-respiratory-system-lungs-anatomy-d.mp4,PT00H00M13S,067551_067600,Human respiratory system lungs anatomy. 3d
32791825,https://ak.picdn.net/shutterstock/videos/32791825/preview/stock-footage-rome-italy-st-ivo-church.mp4,PT00H00M12S,060401_060450,"Rome, italy. st. ivo church"
7342681,https://ak.picdn.net/shutterstock/videos/7342681/preview/stock-footage-white-wine-in-the-vineyard.mp4,PT00H00M11S,129801_129850,White wine in the vineyard
1044214945,https://ak.picdn.net/shutterstock/videos/1044214945/preview/stock-footage-time-lapse-shot-of-running-retro-alarm-clock-with-analysis-number-big-data.mp4,PT00H00M19S,127201_127250,"Time lapse shot of running retro alarm clock, with analysis number big data"
1014263015,https://ak.picdn.net/shutterstock/videos/1014263015/preview/stock-footage-defocused-shimmering-multicolored-glitter-confetti-black-background-party-magic-imagination.mp4,PT00H00M17S,176051_176100,"Defocused shimmering multicolored glitter confetti, black background. party, magic, imagination. rainbow colors, sparkle circles. holiday abstract festive texture of shiny blurred bokeh light spots."
16308028,https://ak.picdn.net/shutterstock/videos/16308028/preview/stock-footage-white-cat-in-their-activities.mp4,PT00H00M12S,196101_196150,White cat in their activities 3
1046970967,https://ak.picdn.net/shutterstock/videos/1046970967/preview/stock-footage-kaleidoscopic-video-background-colorful-symmetric-patterns.mp4,PT00H00M08S,085201_085250,Kaleidoscopic video background. colorful symmetric patterns.
31898176,https://ak.picdn.net/shutterstock/videos/31898176/preview/stock-footage-woman-taking-a-shower-in-slow-motion-beautiful-girl-washing-and-enjoy-herself-under-a-shower.mp4,PT00H00M59S,179451_179500,"Woman taking a shower in slow motion, beautiful girl washing and enjoy herself under a shower, close up of the hands, shoulder and back"
1034700770,https://ak.picdn.net/shutterstock/videos/1034700770/preview/stock-footage-close-up-working-with-a-soldering-iron-at-workshop-concept-of-the-profession-accurate-work.mp4,PT00H00M11S,036851_036900,"Close-up working with a soldering iron at workshop. concept of the profession, accurate work, engineer position."
24090703,https://ak.picdn.net/shutterstock/videos/24090703/preview/stock-footage-sevastopol-crimea-russia-september-crimean-military-historical-festival-on-september.mp4,PT00H00M17S,110951_111000,"Sevastopol, crimea/russia september 13, 2016: crimean military historical festival on september, 13 in sevastopol"
442702,https://ak.picdn.net/shutterstock/videos/442702/preview/stock-footage-seamless-looping-high-definition-video-closeup-of-the-flag-of-the-us-state-of-pennsylvania-with.mp4,PT00H00M10S,029151_029200,Seamless looping high definition video closeup of the flag of the us state of pennsylvania with accurate design and colors and a detailed fabric texture. 
1012392167,https://ak.picdn.net/shutterstock/videos/1012392167/preview/stock-footage-protesters-at-the-march-for-ecology-protest-strike-campaign-for-climate-change-protesters-with.mp4,PT00H00M18S,182501_182550,"Protesters at the march for ecology protest . strike , campaign for climate change protesters with posters . shot on arri alexa icinema camera ."
32299711,https://ak.picdn.net/shutterstock/videos/32299711/preview/stock-footage-camera-slides-past-red-roses-in-volksgarten-vienna-the-dome-of-the-natural-history-museum-is-in.mp4,PT00H00M08S,004701_004750,Camera slides past red roses in volksgarten vienna. the dome of the natural history museum is in the background
1033609634,https://ak.picdn.net/shutterstock/videos/1033609634/preview/stock-footage-aerial-panorama-view-of-the-medieval-bran-castle-dracula-castle-in-brasov-transylvania-romania.mp4,PT00H00M22S,176851_176900,"Aerial panorama view of the medieval bran castle , dracula castle in brasov, transylvania. romania."
34057894,https://ak.picdn.net/shutterstock/videos/34057894/preview/stock-footage-desert-mountains-surreal-tunnel-vision-in-a-dream.mp4,PT00H00M25S,140651_140700,Desert mountains surreal tunnel vision in a dream
1012828739,https://ak.picdn.net/shutterstock/videos/1012828739/preview/stock-footage-cosmos-flowers-in-garden-footage.mp4,PT00H00M12S,035901_035950,Cosmos flowers in garden footage
1045608913,https://ak.picdn.net/shutterstock/videos/1045608913/preview/stock-footage-yala-thailand-february-thai-boy-scout-day-happy-smiley-boy-scouts-in-uniform-on.mp4,PT00H00M10S,031001_031050,"Yala, thailand - february 18-20, 2018. thai boy scout day. happy smiley boy scouts in uniform on parade holding walking stick and looking at camera. boy scout camping activities"
34518028,https://ak.picdn.net/shutterstock/videos/34518028/preview/stock-footage-camera-flight-over-a-biogas-plant-from-pig-farm-in-ripe-wheat-fields-renewable-energy-from-biomass.mp4,PT00H00M19S,022851_022900,Camera flight over a biogas plant from pig farm in ripe wheat fields. renewable energy from biomass. summer on countryside. modern agriculture in european union. 
1021842229,https://ak.picdn.net/shutterstock/videos/1021842229/preview/stock-footage-coex-mall-in-seoul-south-korea-october-starfield-library-as-the-latest-attraction.mp4,PT00H00M12S,057451_057500,"Coex mall in seoul, south korea - october 26, 2018 : starfield library as the latest attraction within seoul and library is open to the public free."
1040543714,https://ak.picdn.net/shutterstock/videos/1040543714/preview/stock-footage-beautufl-green-lake-in-summer-the-yapod-islands-in-bosnia-and-herzegovina-bihac-una-k.mp4,PT00H00M15S,172851_172900,"Beautufl green lake in summer. the yapod islands in bosnia and herzegovina, bihac-una. 4k"
29515588,https://ak.picdn.net/shutterstock/videos/29515588/preview/stock-footage-aerial-shot-over-tea-fields.mp4,PT00H00M07S,039801_039850,Aerial shot over tea fields
15079768,https://ak.picdn.net/shutterstock/videos/15079768/preview/stock-footage-electric-line-workers.mp4,PT00H00M09S,126551_126600,Electric line workers 5
31389346,https://ak.picdn.net/shutterstock/videos/31389346/preview/stock-footage-singburi-september-group-of-biker-riding-a-bicycle-at-wat-pikul-thong-temple-on-september.mp4,PT00H00M25S,014701_014750,"Singburi - september 10 : group of biker riding a bicycle at wat pikul thong temple on september 10, 2017 in singburi, thailand."
1037200043,https://ak.picdn.net/shutterstock/videos/1037200043/preview/stock-footage-mountain-and-forest-with-cloudy-sky-in-phetchabun-thailand.mp4,PT00H00M15S,195651_195700,"Mountain and forest with cloudy sky in phetchabun, thailand."
3949871,https://ak.picdn.net/shutterstock/videos/3949871/preview/stock-footage-second-gate-of-the-topkapi-palace-historical-ramparts.mp4,PT00H00M10S,129501_129550,Second gate of the topkapi palace. historical ramparts
33181435,https://ak.picdn.net/shutterstock/videos/33181435/preview/stock-footage-beautiful-violet-fireworks-through-the-text-happy-new-year-composition-for-the-new-year.mp4,PT00H00M30S,149001_149050,"Beautiful violet fireworks through the text happy new year. composition for the new year celebration. bright fireworks, amazing light show. v3"
8491870,https://ak.picdn.net/shutterstock/videos/8491870/preview/stock-footage-sea-beach-near-territory-of-hotels-with-sports-playgrounds-at-summer-sunny-day-aerial-view.mp4,PT00H00M15S,102001_102050,Sea beach near territory of hotels with sports playgrounds at summer sunny day. aerial view
15638845,https://ak.picdn.net/shutterstock/videos/15638845/preview/stock-footage-close-up-slightly-defocused-shot-of-lit-candle-in-colored-glass-and-people-walking-in-the-street-in.mp4,PT00H00M18S,029701_029750,Close-up slightly defocused shot of lit candle in colored glass and people walking in the street in background. 
4652045,https://ak.picdn.net/shutterstock/videos/4652045/preview/stock-footage-abstract-motion-background-shining-lights-rays-stars-energy-waves-and-particles-seamless.mp4,PT00H00M29S,009901_009950,"Abstract motion background, shining lights, rays, stars, energy waves and particles. seamless looping."
1020913942,https://ak.picdn.net/shutterstock/videos/1020913942/preview/stock-footage-united-kingdom-flag-fluttering-in-the-wind-slow-motion.mp4,PT00H00M24S,115701_115750,"United kingdom flag fluttering in the wind, slow motion."
9547775,https://ak.picdn.net/shutterstock/videos/9547775/preview/stock-footage-arches-national-park-moab-utah-dawn-or-dusk-in-the-high-desert-with-nice-clouds-camera-pans.mp4,PT00H00M20S,007101_007150,"Arches national park, moab, utah. dawn or dusk in the high desert with nice clouds.  camera pans left to right."
1029096062,https://ak.picdn.net/shutterstock/videos/1029096062/preview/stock-footage-gathering-leaves-with-green-wire-rakes-video-footage-of-garden-work.mp4,PT00H00M31S,122651_122700,"Gathering leaves with green wire rakes.
video footage of garden work."
5602508,https://ak.picdn.net/shutterstock/videos/5602508/preview/stock-footage-melting-ice-sheet-top-down-of-melting-ice-sheet.mp4,PT00H00M06S,192251_192300,Melting ice sheet - top down of melting ice sheet
1062862765,https://ak.picdn.net/shutterstock/videos/1062862765/preview/stock-footage-close-up-of-a-sunflower-with-a-bee-sitting-on-it-the-sun-is-shining-in-the-background-k.mp4,PT00H00M11S,060951_061000,Close-up of a sunflower with a bee sitting on it. the sun is shining in the background. 4k
1018030456,https://ak.picdn.net/shutterstock/videos/1018030456/preview/stock-footage-cute-pug-dog-green-screen-portrait-lying-tilting-head.mp4,PT00H00M34S,033201_033250,Cute pug dog. green screen. portrait. lying. tilting head
1059307784,https://ak.picdn.net/shutterstock/videos/1059307784/preview/stock-footage-countdown-timer-with-rain-effect-from-to.mp4,PT00H00M11S,124051_124100,Countdown timer with rain effect from 10 to 0
26615630,https://ak.picdn.net/shutterstock/videos/26615630/preview/stock-footage-swan-sitting-on-nesting-place.mp4,PT00H00M20S,088051_088100,Swan sitting on nesting place 
1045187845,https://ak.picdn.net/shutterstock/videos/1045187845/preview/stock-footage-aerial-view-green-forest-woods-and-river-landscape-in-sunny-summer-day-top-view-of-beautiful.mp4,PT00H00M27S,089451_089500,Aerial view green forest woods and river landscape in sunny summer day. top view of beautiful european nature from high attitude in autumn season. drone view. bird's eye view
1038647414,https://ak.picdn.net/shutterstock/videos/1038647414/preview/stock-footage-the-blogger-communicates-with-his-audience.mp4,PT00H00M06S,115651_115700,The blogger communicates with his audience
