videoid,contentUrl,duration,page_dir,name
30438946,https://ak.picdn.net/shutterstock/videos/30438946/preview/stock-footage-moscow-russia-july-worker-and-kolkhoz-woman-rabochiy-i-kolkhoznitsa.mp4,PT00H00M14S,077651_077700,"Moscow, russia - july 13, 2017: worker and kolkhoz woman ( rabochiy i kolkhoznitsa )"
1026967160,https://ak.picdn.net/shutterstock/videos/1026967160/preview/stock-footage-time-lapse-of-busy-people-walking-through-a-terminal-silhouetted-against-a-bright-window-in-an.mp4,PT00H00M11S,134951_135000,Time lapse of busy people walking through a terminal silhouetted against a bright window in an airport
16736326,https://ak.picdn.net/shutterstock/videos/16736326/preview/stock-footage-bright-colorful-flowers-swaying-in-the-wind.mp4,PT00H00M33S,034851_034900,Bright colorful flowers swaying in the wind
1023637618,https://ak.picdn.net/shutterstock/videos/1023637618/preview/stock-footage-happy-girl-opening-postal-package-excited-young-woman-holding-cardboard-box-and-looking-inside.mp4,PT00H00M20S,040801_040850,"Happy girl opening postal package. excited young woman holding cardboard box and looking inside. gift, present, delivery, shipment, sale concept."
1036575557,https://ak.picdn.net/shutterstock/videos/1036575557/preview/stock-footage-attractive-young-bearded-business-man-with-wireless-earphones-having-a-video-call-on-smartphone.mp4,PT00H00M13S,139351_139400,Attractive young bearded business man with wireless earphones having a video call on smartphone over gray background isolated
1019382910,https://ak.picdn.net/shutterstock/videos/1019382910/preview/stock-footage-stockolm-sweden-november-excavator-preparing-for-renovation-of-buildings-in-the.mp4,PT00H00M14S,185051_185100,"Stockolm, sweden - november 13, 2018: excavator preparing for renovation of buildings in the stockholm suburb husby"
1046606782,https://ak.picdn.net/shutterstock/videos/1046606782/preview/stock-footage-fast-color-changing-loopable-abstract-dynamic-fractal-video-made-out-of-intricate-pattern-of.mp4,PT00H00M07S,199601_199650,"Fast color changing loopable abstract dynamic fractal video made out of intricate pattern of interconnected rings, arches and geometric patterns, in pastel colors, 4k, 4096, 25 fps"
9935330,https://ak.picdn.net/shutterstock/videos/9935330/preview/stock-footage-happy-valentine-and-rose-heart-exploding.mp4,PT00H00M10S,194301_194350,Happy valentine and rose heart exploding
21617677,https://ak.picdn.net/shutterstock/videos/21617677/preview/stock-footage-hawaii-historic-video-clip-of-cityscape-in-distance.mp4,PT00H00M06S,093901_093950,Hawaii 1961: historic video clip of cityscape in distance
26294999,https://ak.picdn.net/shutterstock/videos/26294999/preview/stock-footage-businessman-touched-screen-numerous-dots-gather-to-create-a-dollar-currency-sign-low-polygon-web.mp4,PT00H00M18S,045101_045150,"Businessman touched screen, numerous dots gather to create a dollar currency sign, low-polygon web."
1060046279,https://ak.picdn.net/shutterstock/videos/1060046279/preview/stock-footage-lanius-senator-ku-moving-in-the-tree.mp4,PT00H00M30S,070401_070450,Lanius senator kuş moving in the tree
1045419751,https://ak.picdn.net/shutterstock/videos/1045419751/preview/stock-footage-milwaukee-wisconsin-hair-braiding-tutorial-s-addition.mp4,PT00H00M05S,003501_003550,Milwaukee wisconsin-1953: hair braiding tutorial 60's addition
25469525,https://ak.picdn.net/shutterstock/videos/25469525/preview/stock-footage-fire-background-image.mp4,PT00H00M10S,030701_030750,Fire background image
1039689314,https://ak.picdn.net/shutterstock/videos/1039689314/preview/stock-footage-blue-bolt-dwarf-shrimp-clean-its-legs-and-stay-on-aquatic-soil-then-go-to-the-back-of-aquarium-tank.mp4,PT00H00M09S,174951_175000,Blue bolt dwarf shrimp clean its legs and stay on aquatic soil then go to the back of aquarium tank.
1066662169,https://ak.picdn.net/shutterstock/videos/1066662169/preview/stock-footage-caucasian-office-manager-welcoming-futuristic-cyborg-employee-showing-modern-workspace-walking.mp4,PT00H00M17S,000051_000100,Caucasian office manager welcoming futuristic cyborg employee showing modern workspace walking together in business center. corporate. artificial intelligence.
26725030,https://ak.picdn.net/shutterstock/videos/26725030/preview/stock-footage-flickering-video-signal-interference-and-digital-glitch.mp4,PT00H00M10S,088701_088750,Flickering video signal interference and digital glitch.
1059836075,https://ak.picdn.net/shutterstock/videos/1059836075/preview/stock-footage-wide-arc-drone-flight-over-cultivated-field-with-combine-harvesting-crops.mp4,PT00H00M27S,104201_104250,Wide arc drone flight over cultivated field with combine harvesting crops
1037568440,https://ak.picdn.net/shutterstock/videos/1037568440/preview/stock-footage-landscape-dramatic-fields-and-moving-storm-clouds-in-blue-sky-timelapse-amazing-rural-valley.mp4,PT00H00M09S,031001_031050,Landscape dramatic fields and moving storm clouds in blue sky. timelapse. amazing rural valley. ukraine. saturated colors. cloud space over a small village in sunny summer day. time lapse.
31150348,https://ak.picdn.net/shutterstock/videos/31150348/preview/stock-footage-grains-drying-on-agricultural-factory.mp4,PT00H00M19S,186101_186150,Grains drying on agricultural factory
1047014548,https://ak.picdn.net/shutterstock/videos/1047014548/preview/stock-footage-prague-czech-republic-march-a-rugby-game-for-disabled-people-men-ride-around-in.mp4,PT00H00M26S,079501_079550,"Prague, czech republic - march 20, 2019: a rugby game for disabled people. men ride around in wheelchairs, one man catches a ball and gives it to the instructor who then gives it to a man"
11864480,https://ak.picdn.net/shutterstock/videos/11864480/preview/stock-footage-geneva-city-skyline-day-to-night-timelapse-with-the-rhone-river-and-the-seujet-dam-in-the.mp4,PT00H00M17S,137601_137650,"Geneva city skyline day to night timelapse, with the rhone river and the seujet dam in the foreground"
1014494513,https://ak.picdn.net/shutterstock/videos/1014494513/preview/stock-footage-abstract-background-with-animation-of-flying-gender-symbols-animation-of-seamless-loop.mp4,PT00H00M20S,091751_091800,Abstract background with animation of flying gender symbols. animation of seamless loop.
1027544171,https://ak.picdn.net/shutterstock/videos/1027544171/preview/stock-footage-beautiful-yellow-wildflowers-sway-in-the-thick-grass.mp4,PT00H00M14S,063801_063850,Beautiful yellow wildflowers sway in the thick grass.
24554969,https://ak.picdn.net/shutterstock/videos/24554969/preview/stock-footage-meadow-landscape-in-the-netherlands-with-sheep-swans-lapwings-and-people-walking-and-on-bicycle.mp4,PT00H00M41S,126701_126750,Meadow landscape in the netherlands with sheep swans lapwings and people walking and on bicycle
1011633422,https://ak.picdn.net/shutterstock/videos/1011633422/preview/stock-footage-tree-woody-plant-galapagos-islands-in-fall-star-leaf-in-ecuador.mp4,PT00H00M23S,199201_199250,Tree woody plant galapagos islands in fall star leaf in ecuador
1012702484,https://ak.picdn.net/shutterstock/videos/1012702484/preview/stock-footage-hair-care-hairstyle-and-people-concept-young-woman-or-teenage-girl-confused.mp4,PT00H00M12S,180651_180700,"Hair care, hairstyle and people concept - young woman or teenage girl confused."
14438236,https://ak.picdn.net/shutterstock/videos/14438236/preview/stock-footage-bokeh-background.mp4,PT00H00M16S,136151_136200,Bokeh background 11
13771979,https://ak.picdn.net/shutterstock/videos/13771979/preview/stock-footage-beautiful-beach-sky-and-waves.mp4,PT00H00M08S,127351_127400,"Beautiful beach, sky and waves."
6769237,https://ak.picdn.net/shutterstock/videos/6769237/preview/stock-footage-hong-kong-china-circa-june-dior-outlet-founded-in-by-christian-dior-it-s-one-of.mp4,PT00H00M11S,192501_192550,"Hong kong, china - circa june 2014: dior outlet. founded in 1947 by christian dior, it's one of world's top fashion brands which includes women's clothing, menswear, jewelry and perfume."
19895977,https://ak.picdn.net/shutterstock/videos/19895977/preview/stock-footage-new-army-recruits-are-trained-in-parachuting-at-a-military-camp-in-germany-in-the-s-s.mp4,PT00H01M36S,084101_084150,New army recruits are trained in parachuting at a military camp in germany in the 1950s. (1950s)
1010015528,https://ak.picdn.net/shutterstock/videos/1010015528/preview/stock-footage-young-attractive-afro-american-woman-with-closed-eyes-in-home-sloth-is-practising-yoga-on-the-sofa.mp4,PT00H00M16S,172701_172750,Young attractive afro-american woman with closed eyes in home sloth is practising yoga on the sofa in white livving room. meditation and relax concept. 4k footage.
1027961381,https://ak.picdn.net/shutterstock/videos/1027961381/preview/stock-footage-chicago-illinois-april-view-from-a-guy-riding-through-the-city-on-a-bike.mp4,PT00H00M24S,115951_116000,"Chicago, illinois: april 17, 2019 view from a guy riding through the city on a bike"
1056988574,https://ak.picdn.net/shutterstock/videos/1056988574/preview/stock-footage-sun-is-shining-in-sunglasses-dark-cloud-appears-and-it-raining-video-cartoon-animation-alpha.mp4,PT00H00M10S,085901_085950,Sun is shining in sunglasses. dark cloud appears and it raining. video cartoon animation. alpha channel
1009857191,https://ak.picdn.net/shutterstock/videos/1009857191/preview/stock-footage-vung-tau-city-and-coast-vietnam-vung-tau-is-a-famous-coastal-city-in-the-south-of-vietnam.mp4,PT00H00M12S,129751_129800,"Vung tau city and coast, vietnam. vung tau is a famous coastal city in the south of vietnam
"
21980926,https://ak.picdn.net/shutterstock/videos/21980926/preview/stock-footage-tired-black-young-man-neck-pain-portrait.mp4,PT00H00M10S,069601_069650,"Tired black young man, neck pain, portrait"
32052103,https://ak.picdn.net/shutterstock/videos/32052103/preview/stock-footage-tokyo-japan-october-k-crowd-of-asian-people-in-famous-ancient-buddhist-temple-senso-ji.mp4,PT00H00M17S,087701_087750,"Tokyo, japan-01 october, 2017: 4k crowd of asian people in famous ancient buddhist temple senso-ji at asakusa. tourists visit the japanese shinto shrine sensoji in tokyo city, japan kinryu-zan-dan"
1042411102,https://ak.picdn.net/shutterstock/videos/1042411102/preview/stock-footage-in-front-of-a-pink-studio-backdrop-a-young-woman-holds-up-a-hand-written-sign-with-the-word-help.mp4,PT00H00M11S,054351_054400,"In front of a pink studio backdrop, a young woman holds up a hand-written sign with the word ""help"" on torn white paper"
1026460460,https://ak.picdn.net/shutterstock/videos/1026460460/preview/stock-footage-abstract-fractal-forms-morph-and-oscillate-loop.mp4,PT00H00M13S,002101_002150,Abstract fractal forms morph and oscillate (loop)
19390711,https://ak.picdn.net/shutterstock/videos/19390711/preview/stock-footage-bark-on-tree-close-up-dolly-out-shallow-depth-of-field-k.mp4,PT00H00M08S,138151_138200,"Bark on tree close up dolly out shallow depth of field, 4k"
1027963226,https://ak.picdn.net/shutterstock/videos/1027963226/preview/stock-footage-modern-city-and-communication-network-concept.mp4,PT00H00M20S,009201_009250,Modern city and communication network concept.
1057618795,https://ak.picdn.net/shutterstock/videos/1057618795/preview/stock-footage-young-asian-woman-backpacker-traveling-in-urban-city-she-wearing-face-mask-for-protect-virus-air.mp4,PT00H00M15S,133751_133800,"Young asian woman backpacker traveling in urban city, she wearing face mask for protect virus air pollution on safety travel. she hitchhiking car to travel. slow motion shot."
1020026539,https://ak.picdn.net/shutterstock/videos/1020026539/preview/stock-footage-timelapse-with-tilt-down-motion-of-gloomy-sky-over-abandoned-gold-rush-ruin-in-joshua-tree-national.mp4,PT00H00M31S,138701_138750,"Timelapse with tilt down motion of gloomy sky over abandoned gold rush ruin in joshua tree national park, california"
6332126,https://ak.picdn.net/shutterstock/videos/6332126/preview/stock-footage-young-caucasian-father-holding-son-high-up-arms-happy-young-caucasian-child-being-held-high.mp4,PT00H00M17S,062401_062450,Young caucasian father holding son high up arms - happy young caucasian child being held high loving fathers arms fun outing park sun lens flare
5346518,https://ak.picdn.net/shutterstock/videos/5346518/preview/stock-footage-black-stray-dog-sitting-on-the-sidewalk-backyards.mp4,PT00H00M17S,026301_026350,Black stray dog sitting on the sidewalk backyards
1053672404,https://ak.picdn.net/shutterstock/videos/1053672404/preview/stock-footage--s-buffalo-ny-girl-in-cowboy-boots-with-cowboy-hat-around-her-neck-stands-waves-walks.mp4,PT00H00M26S,059351_059400,"1930s buffalo ny: girl in cowboy boots with cowboy hat around her neck stands, waves, walks"
1024061843,https://ak.picdn.net/shutterstock/videos/1024061843/preview/stock-footage-fire-and-electrical-explosion-in-ice-wind-snow-and-freezing-rain-storm.mp4,PT00H00M28S,173351_173400,Fire and electrical explosion in ice wind snow and freezing rain storm
23803381,https://ak.picdn.net/shutterstock/videos/23803381/preview/stock-footage-new-delhi-delhi-india-jan-fps-slow-motion-shot-of-young-boy-playing-with-kites-near.mp4,PT00H00M23S,128801_128850,"New delhi, delhi/india - jan 15, 2013: 200fps slow motion shot of young boy playing with kites near jama masjid in new delhi, india."
1046151097,https://ak.picdn.net/shutterstock/videos/1046151097/preview/stock-footage-valentine-love-heart-characters-looped-seamless-background-animation-with-alpha-channel.mp4,PT00H00M05S,107751_107800,Valentine love heart characters - looped seamless background. animation with alpha channel.
1027894643,https://ak.picdn.net/shutterstock/videos/1027894643/preview/stock-footage-taiwan-new-taipei-city-april-general-live-style-and-general-city-view.mp4,PT00H00M29S,009301_009350,Taiwan new taipei city 4 april 2019: general live style and general city view
1027025402,https://ak.picdn.net/shutterstock/videos/1027025402/preview/stock-footage-kids-drawing-pop-art-seamless-background-with-theme-of-shopping-cart.mp4,PT00H00M06S,145751_145800,Kids drawing pop art seamless background with theme of shopping cart
1061620189,https://ak.picdn.net/shutterstock/videos/1061620189/preview/stock-footage-tallinn-estonia-city-hall.mp4,PT00H00M12S,030551_030600,Tallinn / estonia - 10 02 2019: city hall
23863114,https://ak.picdn.net/shutterstock/videos/23863114/preview/stock-footage-commercial-airplane-landing-at-sao-paulo-guarulhos-international-airport-d-conceptual-k-animation.mp4,PT00H00M08S,083451_083500,Commercial airplane landing at sao paulo-guarulhos international airport 3d conceptual 4k animation
11669321,https://ak.picdn.net/shutterstock/videos/11669321/preview/stock-footage--k-abstract-lights-lens-flare-motion-background.mp4,PT00H00M30S,141301_141350,4k abstract lights lens flare motion background 
1061763841,https://ak.picdn.net/shutterstock/videos/1061763841/preview/stock-footage-byron-bay-hinterlands-new-south-wales-australia-woman-with-face-paint-at-dance.mp4,PT00H00M09S,027951_028000,"Byron bay hinterlands , new south wales / australia - 04 12 2019: woman with face paint at dance party - celebrate life gathering in australia"
9915527,https://ak.picdn.net/shutterstock/videos/9915527/preview/stock-footage-extreme-closeup-portrait-girl-and-bread.mp4,PT00H00M10S,067301_067350,Extreme closeup portrait girl and bread
11175371,https://ak.picdn.net/shutterstock/videos/11175371/preview/stock-footage-doves-walk-outdoors.mp4,PT00H00M30S,073051_073100,Doves walk outdoors
1030053422,https://ak.picdn.net/shutterstock/videos/1030053422/preview/stock-footage-aerial-drone-flight-of-summer-sunset-reflecting-on-the-lake-water-scenic-footage-of-countryside.mp4,PT00H00M16S,188951_189000,Aerial; drone flight of summer sunset reflecting on the lake water; scenic footage of countryside nature; reflection of picturesque clouds on the water surface; birds taking off in the foreground
9392597,https://ak.picdn.net/shutterstock/videos/9392597/preview/stock-footage-video-blooming-aspen-trees-swaying-in-the-wind-sounds-of-the-forest.mp4,PT00H00M07S,081851_081900,Video blooming aspen trees swaying in the wind sounds of the forest
1047729211,https://ak.picdn.net/shutterstock/videos/1047729211/preview/stock-footage-middlesex-county-ontario-canada-december-lake-effect-snow-squalls-and-blizzard-conditions.mp4,PT00H00M15S,195251_195300,"Middlesex county, ontario, canada december 2019 lake effect snow squalls and blizzard conditions with life threatening travel risks"
1042780747,https://ak.picdn.net/shutterstock/videos/1042780747/preview/stock-footage-hong-kong-china-july-aerial-view-over-big-container-freight-cargo-ship-transporting-and.mp4,PT00H00M23S,003351_003400,"Hong kong china, 8 july 2019: aerial view over big container freight cargo ship transporting and leaving sea port in hong kong china logistic, transportation concept. shot by 4k resolution drone."
1010453774,https://ak.picdn.net/shutterstock/videos/1010453774/preview/stock-footage-close-up-shot-of-a-young-boy-and-girl-traveling-by-bus-through-city-watching-movie-on-computer.mp4,PT00H00M41S,148901_148950,"Close-up shot of a young boy and girl traveling by bus through city, watching movie on computer tablet"
26576201,https://ak.picdn.net/shutterstock/videos/26576201/preview/stock-footage-hop-pellets.mp4,PT00H00M05S,000901_000950,Hop pellets
1028641196,https://ak.picdn.net/shutterstock/videos/1028641196/preview/stock-footage-close-up-of-a-beautiful-grey-white-horse.mp4,PT00H00M13S,078051_078100,Close up of a beautiful grey/white horse
23182183,https://ak.picdn.net/shutterstock/videos/23182183/preview/stock-footage-rubber-tapper-tapping-rubber-tree-to-collect-latex-in-southern-of-thailand.mp4,PT00H00M38S,193351_193400,Rubber tapper tapping rubber tree to collect latex in southern of thailand
1797491,https://ak.picdn.net/shutterstock/videos/1797491/preview/stock-footage-milk-splashes-collide-in-slow-motion-full-hd.mp4,PT00H00M06S,042251_042300,Milk splashes collide in slow motion (full hd)
1052468869,https://ak.picdn.net/shutterstock/videos/1052468869/preview/stock-footage-movement-of-the-second-hand-of-an-old-pocket-watch-that-is-lying-on-a-pile-of-metal-russian-rubles.mp4,PT00H00M08S,102351_102400,Movement of the second hand of an old pocket watch that is lying on a pile of metal russian rubles
34016497,https://ak.picdn.net/shutterstock/videos/34016497/preview/stock-footage-pond-in-the-wilderness.mp4,PT00H00M16S,146101_146150,Pond in the wilderness
6683333,https://ak.picdn.net/shutterstock/videos/6683333/preview/stock-footage-closeup-of-fireplace-full-of-wood-and-fire.mp4,PT00H00M25S,141501_141550,Closeup of fireplace full of wood and fire
1030481852,https://ak.picdn.net/shutterstock/videos/1030481852/preview/stock-footage-a-brown-haired-woman-in-a-cafe-at-a-table-works-with-a-laptop-and-drinks-coffee.mp4,PT00H00M05S,064751_064800,A brown-haired woman in a cafe at a table works with a laptop and drinks coffee
1043047417,https://ak.picdn.net/shutterstock/videos/1043047417/preview/stock-footage-abstract-holographic-gradient-rainbow-animation-k-motion-graphic-trendy-vibrant-texture-fashion.mp4,PT00H00M10S,078601_078650,"Abstract holographic gradient rainbow animation. 4k motion graphic. trendy vibrant texture, fashion textile, neon colour, ambient graphic design, screen saver."
26292251,https://ak.picdn.net/shutterstock/videos/26292251/preview/stock-footage-fat-lady-sharpening-fork-against-knife-looking-at-roast-chicken-unhealthy-food.mp4,PT00H00M06S,122801_122850,"Fat lady sharpening fork against knife, looking at roast chicken, unhealthy food"
1012708415,https://ak.picdn.net/shutterstock/videos/1012708415/preview/stock-footage-toy-train-rolled-on-floor-then-picked-up.mp4,PT00H00M10S,057501_057550,Toy train rolled on floor then picked up
11166764,https://ak.picdn.net/shutterstock/videos/11166764/preview/stock-footage-many-working-escalators-in-the-mall-toned-video.mp4,PT00H00M07S,186351_186400,Many working escalators in the mall. toned video
1059071672,https://ak.picdn.net/shutterstock/videos/1059071672/preview/stock-footage-close-up-on-buttered-toast-being-cut-and-loaded-with-eggs-to-be-eaten.mp4,PT00H00M35S,040701_040750,Close up on buttered toast being cut and loaded with eggs to be eaten.
1006662523,https://ak.picdn.net/shutterstock/videos/1006662523/preview/stock-footage-cute-blond-baby-with-his-father-reading-pink-baby-big-book-man-tickles-and-kisses-his-daughter.mp4,PT00H00M16S,104501_104550,"Cute blond baby with his father reading pink baby big book. man tickles and kisses his daughter, laughing girl sitting on lap of pope in gray big chair on background of fireplace with candles"
1059230912,https://ak.picdn.net/shutterstock/videos/1059230912/preview/stock-footage-wrinkled-elderly-woman-closeup-of-face-portrait-outdoors-aging-and-retirement.mp4,PT00H00M30S,054801_054850,"Wrinkled elderly woman, closeup of face, portrait outdoors, aging and retirement"
1016339344,https://ak.picdn.net/shutterstock/videos/1016339344/preview/stock-footage-full-moon-over-the-alps.mp4,PT00H00M07S,056601_056650,Full moon over the alps
29354755,https://ak.picdn.net/shutterstock/videos/29354755/preview/stock-footage-woman-walking-under-umbrella-in-city-alley-at-overcast-summer-or-autumn-day-steadicam-shot.mp4,PT00H00M14S,148701_148750,"Woman walking under umbrella in city alley at overcast summer or autumn day, steadicam shot"
1015654657,https://ak.picdn.net/shutterstock/videos/1015654657/preview/stock-footage-group-of-mountain-bikers-en-route-through-the-mountains-of-catalonia-spain-europe.mp4,PT00H00M15S,032951_033000,Group of mountain bikers en route through the mountains of catalonia. spain. europe.
28560184,https://ak.picdn.net/shutterstock/videos/28560184/preview/stock-footage-aerial-view-from-a-drone-bridge-over-a-lake-in-south-italy-k-footage.mp4,PT00H00M46S,076401_076450,Aerial view from a drone. bridge over a lake in south italy. 4k footage
15175867,https://ak.picdn.net/shutterstock/videos/15175867/preview/stock-footage-an-ancient-castle-is-majestically-rising-on-the-mountain-like-a-dark-giant-grimly-peering-into.mp4,PT00H00M20S,102101_102150,"An ancient castle is majestically rising on the mountain, like a dark giant, grimly peering into carefree tourists on their small boats. above the building clouds are serenely floating on a blue sky."
1021538752,https://ak.picdn.net/shutterstock/videos/1021538752/preview/stock-footage-magical-footage-of-jungle-through-the-sunshine-aerial-footage-of-the-indonesian-nature.mp4,PT00H00M25S,104451_104500,Magical footage of jungle through the sunshine aerial footage of the indonesian nature
613267,https://ak.picdn.net/shutterstock/videos/613267/preview/stock-footage-sea.mp4,PT00H00M12S,122851_122900,Sea
1053884420,https://ak.picdn.net/shutterstock/videos/1053884420/preview/stock-footage--june-reengus-india-drone-footage-aerial-view-of-a-landscape-empty-village-road-empty.mp4,PT00H00M09S,102751_102800,"03 june 2020 : reengus, india / drone footage, aerial view of a landscape empty village road. empty streets on day 70 of the nationwide lockdown due to the corona virus pandemic at rajasthan, india. "
1029574286,https://ak.picdn.net/shutterstock/videos/1029574286/preview/stock-footage-picturesque-scene-of-large-homemade-chicken-eggs-with-a-hand-made-wicker-nest-on-green-grass-in-the.mp4,PT00H00M10S,179251_179300,Picturesque scene of large homemade chicken eggs with a hand-made wicker nest on green grass in the rays of the sun in spring or summer close up top view.
10312667,https://ak.picdn.net/shutterstock/videos/10312667/preview/stock-footage-voyage-on-a-yacht-on-the-river.mp4,PT00H00M28S,128351_128400,Voyage on a yacht on the river
1049888842,https://ak.picdn.net/shutterstock/videos/1049888842/preview/stock-footage-woman-wipes-and-disinfects-sterilizes-door-handle-staying-home-self-isolating-in-quarantine.mp4,PT00H00M10S,114351_114400,Woman wipes and disinfects sterilizes door handle staying home self isolating in quarantine coronavirus pandemic outbreak covid 19
1021651948,https://ak.picdn.net/shutterstock/videos/1021651948/preview/stock-footage-beautiful-sea-at-evening-sunrise-over-calm-sea-scenic-sunrise-over-ocean-sunrise-over-calm-sea.mp4,PT00H00M33S,123951_124000,Beautiful sea at evening.sunrise over calm sea.scenic sunrise over ocean.sunrise over calm sea. orange beach sunrise.amazing sunset on the beach with beautiful sky in purple colors.
1063219492,https://ak.picdn.net/shutterstock/videos/1063219492/preview/stock-footage-a-woman-shows-a-puzzle-while-holding-a-magnifying-glass.mp4,PT00H00M13S,189751_189800,A woman shows a puzzle while holding a magnifying glass.
1064123362,https://ak.picdn.net/shutterstock/videos/1064123362/preview/stock-footage-the-soldier-takes-aim-at-night-a-special-operations-participant-uses-a-flashlight-in-a-night.mp4,PT00H00M16S,148801_148850,The soldier takes aim at night. a special operations participant uses a flashlight in a night attack. special forces soldier concept.
1025425760,https://ak.picdn.net/shutterstock/videos/1025425760/preview/stock-footage-florist-s-work-desk-with-tools-and-bouquets-close-up.mp4,PT00H00M11S,192951_193000,"Florist's work desk with tools and bouquets, close-up"
1030702523,https://ak.picdn.net/shutterstock/videos/1030702523/preview/stock-footage-aerial-shot-of-a-two-buildings-loacted-along-a-river-flowing-down-among-the-green-rainforest.mp4,PT00H00M16S,010451_010500,"Aerial shot of a two buildings loacted along a river flowing down among the green rainforest mountains of vietnam,"
1049630182,https://ak.picdn.net/shutterstock/videos/1049630182/preview/stock-footage-portrait-shot-of-beautiful-blond-woman-smelling-bouquet-of-carnations-and-smiling-for-camera-in.mp4,PT00H00M10S,088601_088650,Portrait shot of beautiful blond woman smelling bouquet of carnations and smiling for camera in flower shop
