videoid,contentUrl,duration,page_dir,name
24588803,https://ak.picdn.net/shutterstock/videos/24588803/preview/stock-footage-background-with-animation-of-play-on-piano-synthesizer-or-electronic-piano-animation-pushing-of.mp4,PT00H00M10S,007651_007700,"Background with animation of play on piano, synthesizer or electronic piano. animation pushing of piano keys player. animation of seamless loop."
33887272,https://ak.picdn.net/shutterstock/videos/33887272/preview/stock-footage-elephants-herd-in-kruger-national-park.mp4,PT00H00M30S,148851_148900,Elephants herd in kruger national park
1039342700,https://ak.picdn.net/shutterstock/videos/1039342700/preview/stock-footage-man-is-taking-an-apple-and-biting-it.mp4,PT00H00M19S,100701_100750,Man is taking an apple and biting it
34003663,https://ak.picdn.net/shutterstock/videos/34003663/preview/stock-footage-small-fishes-eating-dead-skin-and-cleaning-foot-in-aquarium-popular-thai-spa-and-pedicure.mp4,PT00H00M08S,178701_178750,"Small fishes eating dead skin and cleaning foot in aquarium. popular thai spa and pedicure procedure. 4k. phuket, thailand."
1026180413,https://ak.picdn.net/shutterstock/videos/1026180413/preview/stock-footage-panoramic-sight-of-the-beach-of-caxias-in-oeiras-portugal.mp4,PT00H00M23S,053451_053500,Panoramic sight of the beach of caxias in oeiras portugal
1006913323,https://ak.picdn.net/shutterstock/videos/1006913323/preview/stock-footage-wood-board-sliding-out-carpenter-refiner-machine-at-sawmill-factory-lots-of-sawdust.mp4,PT00H00M12S,187101_187150,"Wood board sliding out carpenter refiner machine at sawmill factory, lots of sawdust"
5889683,https://ak.picdn.net/shutterstock/videos/5889683/preview/stock-footage-aerial-view-of-an-abandoned-mountain-cottage-shot-from-a-drone-near-covasna-romania.mp4,PT00H00M30S,054301_054350,"Aerial view of an abandoned mountain cottage shot from a drone near covasna, romania"
1047348031,https://ak.picdn.net/shutterstock/videos/1047348031/preview/stock-footage-circa-footage-is-shot-from-a-car-as-it-approaches-the-grand-coulee-dam.mp4,PT00H01M31S,078551_078600,Circa 1938 - footage is shot from a car as it approaches the grand coulee dam.
1033730111,https://ak.picdn.net/shutterstock/videos/1033730111/preview/stock-footage-fast-motion-energy-explosion-big-explosion-graphic-animation-blast-wave-k.mp4,PT00H00M08S,071051_071100,Fast motion energy explosion. big explosion graphic animation. blast wave. 4k
1019059063,https://ak.picdn.net/shutterstock/videos/1019059063/preview/stock-footage-father-and-baby-son-with-pilot-helmet-in-plane-cabin-man-explain-to-child-board-buttons-airplane.mp4,PT00H00M19S,184451_184500,"Father and baby son with pilot helmet in plane cabin, man explain to child board buttons, airplane commands"
6484406,https://ak.picdn.net/shutterstock/videos/6484406/preview/stock-footage-time-lapse-hd-video-of-storm-clouds-over-farm-land-pasture.mp4,PT00H00M05S,099101_099150,Time-lapse hd video of storm clouds over farm land  / pasture
1015361728,https://ak.picdn.net/shutterstock/videos/1015361728/preview/stock-footage-white-throated-hummingbird-perched-on-a-branch-wind-moves-the-branches-and-leaves-bird-shakes-its.mp4,PT00H00M07S,073201_073250,White throated hummingbird perched on a branch. wind moves the branches and leaves. bird shakes its head and looks around. 
1028622074,https://ak.picdn.net/shutterstock/videos/1028622074/preview/stock-footage-tasbih-or-rosary-beads-on-rotating-display-islamic-concept.mp4,PT00H00M19S,062001_062050,"Tasbih or rosary beads on rotating display, islamic concept"
321763,https://ak.picdn.net/shutterstock/videos/321763/preview/stock-footage-waving-racing-flag.mp4,PT00H00M16S,148401_148450,Waving racing flag
1041337762,https://ak.picdn.net/shutterstock/videos/1041337762/preview/stock-footage-little-girl-on-a-swing-in-the-autumn-park.mp4,PT00H00M07S,190101_190150,Little girl on a swing in the autumn park
27153412,https://ak.picdn.net/shutterstock/videos/27153412/preview/stock-footage-medical-student-studying-male-medic-in-white-coat-with-stethoscope-sitting-at-the-desk-and-using.mp4,PT00H00M20S,019001_019050,Medical student studying. male medic in white coat with stethoscope sitting at the desk and using smart watch.
22774390,https://ak.picdn.net/shutterstock/videos/22774390/preview/stock-footage-on-the-table-at-cafe-blurred-background.mp4,PT00H00M12S,069251_069300,On the table at cafe blurred background
22320859,https://ak.picdn.net/shutterstock/videos/22320859/preview/stock-footage-slow-motion-people-make-cleaning-coffee-beans-in-water-before-drying-to-the-sun.mp4,PT00H00M29S,141751_141800,Slow motion : people make cleaning coffee beans in water before drying to the sun
20109964,https://ak.picdn.net/shutterstock/videos/20109964/preview/stock-footage-close-up-of-splashing-water-in-slow-motion.mp4,PT00H00M26S,199501_199550,Close up of splashing water in slow motion
1018311595,https://ak.picdn.net/shutterstock/videos/1018311595/preview/stock-footage--verona-italy-verona-time-lapse-the-balcony-of-juliet.mp4,PT00H00M07S,113201_113250,14.10.2018 verona (italy) - verona time lapse - the balcony of juliet
34900822,https://ak.picdn.net/shutterstock/videos/34900822/preview/stock-footage-cute-little-girl-is-blowing-soap-bubbles-on-the-beach-gopro-rapid.mp4,PT00H00M15S,070151_070200,Cute little girl is blowing soap bubbles on the beach gopro rapid
1025691068,https://ak.picdn.net/shutterstock/videos/1025691068/preview/stock-footage-london-uk-march-old-analog-cameras.mp4,PT00H00M18S,130451_130500,"London, uk, march 9 2019: old analog cameras"
28044379,https://ak.picdn.net/shutterstock/videos/28044379/preview/stock-footage--k-of-young-woman-in-her-bed-using-a-smartphone-and-smiling-at-midnight.mp4,PT00H00M14S,138201_138250,4k of young woman in her bed using a smartphone and smiling at midnight
332383,https://ak.picdn.net/shutterstock/videos/332383/preview/stock-footage-vervet-monkey-drinking-from-a-river.mp4,PT00H00M07S,180701_180750,Vervet monkey drinking from a river
1021989334,https://ak.picdn.net/shutterstock/videos/1021989334/preview/stock-footage-the-work-of-the-investigator-in-the-study-paperwork-deeds-and-accounts-department.mp4,PT00H00M26S,026601_026650,"The work of the investigator in the study. paperwork, deeds and accounts department."
1022973145,https://ak.picdn.net/shutterstock/videos/1022973145/preview/stock-footage-ho-chi-minh-vietnam-circa-november-grab-motorbike-bike-taxi-at-the-street-it.mp4,PT00H00M12S,096451_096500,"Ho chi minh,  vietnam - circa november 2018 : “grab” motorbike bike taxi at the street.   it offers ride-hailing service through its app."
3581204,https://ak.picdn.net/shutterstock/videos/3581204/preview/stock-footage-portrait-of-snowboarder-girl-on-the-top-of-the-mountain.mp4,PT00H00M11S,019801_019850,Portrait of snowboarder girl on the top of the mountain
1014950002,https://ak.picdn.net/shutterstock/videos/1014950002/preview/stock-footage-living-room-with-lcd-tv-records-plants-nobody.mp4,PT00H00M19S,105401_105450,"Living room with lcd tv, records, plants. nobody"
26275634,https://ak.picdn.net/shutterstock/videos/26275634/preview/stock-footage-amsterdam-traffic-in-front-of-the-central-train-station-in-in-amsterdam.mp4,PT00H00M05S,035101_035150,Amsterdam - 1965: traffic in front of the central train station in 1965 in amsterdam
12912422,https://ak.picdn.net/shutterstock/videos/12912422/preview/stock-footage-blurred-cove-with-small-boats.mp4,PT00H00M23S,037901_037950,Blurred cove with small boats
6255563,https://ak.picdn.net/shutterstock/videos/6255563/preview/stock-footage-dirt-path-down-to-the-beach.mp4,PT00H00M23S,037151_037200,Dirt path down to the beach
1015796419,https://ak.picdn.net/shutterstock/videos/1015796419/preview/stock-footage-slow-motion-of-beef-hamburger-on-a-grill-in-close-up-with-flames-and-smoke.mp4,PT00H00M25S,123851_123900,Slow motion of beef hamburger on a grill in close up with flames and smoke
1439755,https://ak.picdn.net/shutterstock/videos/1439755/preview/stock-footage-diver-entering-into-the-blue-sea.mp4,PT00H00M14S,113901_113950,Diver entering into the blue sea
1018237891,https://ak.picdn.net/shutterstock/videos/1018237891/preview/stock-footage-aerial-video-in-amazing-asian-landscape-flying-over-the-clouds-in-a-tipical-asian-landscape.mp4,PT00H00M37S,056651_056700,"Aerial video in amazing asian landscape.
flying over the clouds in a tipical asian landscape. 360 landscape video"
16655956,https://ak.picdn.net/shutterstock/videos/16655956/preview/stock-footage-rainbow-over-lake-te-anau-new-zealand.mp4,PT00H00M15S,019451_019500,"Rainbow over lake te anau, new zealand"
1030710806,https://ak.picdn.net/shutterstock/videos/1030710806/preview/stock-footage-aerial-shot-of-the-panorama-of-bonn-kennedybucke-kennedy-bridge.mp4,PT00H00M49S,066001_066050,Aerial shot of the panorama of bonn kennedybucke kennedy bridge 
1033685249,https://ak.picdn.net/shutterstock/videos/1033685249/preview/stock-footage-nice-landscape-with-a-concrete-bridge-over-the-green-hilly-valley-in-basilicata-region-in-italy.mp4,PT00H00M05S,024201_024250,Nice landscape with a concrete bridge over the green hilly valley in basilicata region in italy. there are moving cars on it and a railway under. top view aerial video recording.
1053317183,https://ak.picdn.net/shutterstock/videos/1053317183/preview/stock-footage-rain-falling-past-mountain-village-buildingsgs-with-turkey-flags-in-shot.mp4,PT00H00M18S,082851_082900,Rain falling past mountain village buildingsgs with turkey flags in shot.
1061452993,https://ak.picdn.net/shutterstock/videos/1061452993/preview/stock-footage-video-call-interface-of-afro-american-male-teacher-explaining-geometry-lesson-to-little-asian-boy.mp4,PT00H00M22S,111101_111150,Video call interface of afro-american male teacher explaining geometry lesson to little asian boy during online lesson while working with students remotely from home in isolation
5144147,https://ak.picdn.net/shutterstock/videos/5144147/preview/stock-footage-los-angeles-cityscape-sunset-to-night-transition-timelapse.mp4,PT00H00M16S,003251_003300,Los angeles cityscape sunset to night transition . timelapse.
6489839,https://ak.picdn.net/shutterstock/videos/6489839/preview/stock-footage-cows-feet-and-equipment-for-milking-in-working-process.mp4,PT00H00M07S,120901_120950,Cows feet and equipment for milking in working process
1011683534,https://ak.picdn.net/shutterstock/videos/1011683534/preview/stock-footage-epic-angled-rock-formation-vasquez.mp4,PT00H00M23S,129001_129050,Epic angled rock formation vasquez
28934881,https://ak.picdn.net/shutterstock/videos/28934881/preview/stock-footage--loopable-shot-of-slot-machines-in-a-row.mp4,PT00H00M15S,144351_144400,02855 loopable shot of slot machines in a row
27102295,https://ak.picdn.net/shutterstock/videos/27102295/preview/stock-footage-u-s-government-private-property-sign-indicating-do-not-enter-as-a-pan-from-the-sky-downwards.mp4,PT00H00M09S,146401_146450,U.s. government private property sign indicating do not enter as a pan from the sky downwards.
3241990,https://ak.picdn.net/shutterstock/videos/3241990/preview/stock-footage-alert-cheetahs-acinonyx-jubatus-drinking-water-kalahari-desert-south-africa.mp4,PT00H00M14S,192751_192800,"Alert cheetahs (acinonyx jubatus) drinking water, kalahari desert, south africa"
1061267962,https://ak.picdn.net/shutterstock/videos/1061267962/preview/stock-footage-aerial-view-of-people-riding-bycicles-and-scooters-on-walkways-surrounded-by-green-grass.mp4,PT00H00M09S,006201_006250,Aerial view of people riding bycicles and scooters on walkways surrounded by green grass.
1053019751,https://ak.picdn.net/shutterstock/videos/1053019751/preview/stock-footage-unemployment-and-mental-health-problem-post-traumatic-stress-disorder-ptsd-resignation-and.mp4,PT00H00M13S,028701_028750,Unemployment and mental health problem. post-traumatic stress disorder (ptsd). resignation and stressful. corona virus job losses in asia. economic problems for workers.
1012405571,https://ak.picdn.net/shutterstock/videos/1012405571/preview/stock-footage-soccer-competition-national-teams-poland-vs-colombia.mp4,PT00H00M20S,183701_183750,"Soccer competition, national teams poland vs colombia"
23826121,https://ak.picdn.net/shutterstock/videos/23826121/preview/stock-footage-stork-head-close-up-closeup-in-nature-beak-bird-portrait-in-nature-summer-spring-animal.mp4,PT00H00M11S,000851_000900,"Stork head close up, closeup in nature, beak bird portrait in nature, summer, spring, animal wildlife"
1018909378,https://ak.picdn.net/shutterstock/videos/1018909378/preview/stock-footage-aerial-view-of-madrid-from-the-outskirts.mp4,PT00H00M23S,138101_138150,Aerial view of madrid from the outskirts
18830924,https://ak.picdn.net/shutterstock/videos/18830924/preview/stock-footage-bielsko-biala-poland-july-world-youth-days-with-papa-francesco-girl-near-fire-takes.mp4,PT00H00M06S,023601_023650,"Bielsko-biala, poland - july 25, 2016: world youth days with papa francesco - girl near fire takes photo with mobile sell phone selfie stick on green nature"
26427755,https://ak.picdn.net/shutterstock/videos/26427755/preview/stock-footage-turkey-istanbul-bosphorus-city.mp4,PT00H00M37S,079201_079250,"Turkey, istanbul, bosphorus city"
6432878,https://ak.picdn.net/shutterstock/videos/6432878/preview/stock-footage-snowy-mountaintop-aerial-shot-of-a-snowy-mountaintop.mp4,PT00H00M21S,051951_052000,Snowy mountaintop. aerial shot of a snowy mountaintop.
1021092301,https://ak.picdn.net/shutterstock/videos/1021092301/preview/stock-footage-fantasy-forest-background-animation.mp4,PT00H00M09S,141001_141050,Fantasy forest background animation
30320116,https://ak.picdn.net/shutterstock/videos/30320116/preview/stock-footage-kazan-tatarstan-russia-december-macro-camera-removes-from-plant-picture-at-initial.mp4,PT00H00M11S,122001_122050,"Kazan, tatarstan/russia - december 20 2016: macro camera removes from plant picture at initial stage drawn with black ink on beige canvas fixed to wall on december 20 in kazan"
23831077,https://ak.picdn.net/shutterstock/videos/23831077/preview/stock-footage-saint-petersburg-russia-winter-builders-poured-concrete-floors-and-fittings.mp4,PT00H00M23S,119351_119400,"Saint-petersburg, russia - winter 2017: builders poured concrete floors and fittings."
34699450,https://ak.picdn.net/shutterstock/videos/34699450/preview/stock-footage-malaysia-kuala-lumpur-january-waze-application-on-the-smartphone-shows-the-road.mp4,PT00H00M08S,032301_032350,"Malaysia, kuala lumpur, january 3, 2018: waze application on the smartphone shows the road direction on the car dashboard when the rains are visible in the windscreen  while the wiper works."
17014423,https://ak.picdn.net/shutterstock/videos/17014423/preview/stock-footage-high-tech-circular-waveform-seamless-loop-with-special-effect-for-music-radio-dance-design.mp4,PT00H00M10S,024051_024100,"High-tech circular waveform (seamless loop) with special effect for music, radio, dance, design, graphic, recording, science industry"
9329426,https://ak.picdn.net/shutterstock/videos/9329426/preview/stock-footage--k-mountain-muddy-river-in-flood-after-torrential-rain-flooding-by-rain-storm-stormy-flooded.mp4,PT00H00M19S,020201_020250,"4k mountain muddy river in flood after torrential rain, flooding by rain, storm, stormy, flooded stream, flowing water calamity, disaster close up"
1009984337,https://ak.picdn.net/shutterstock/videos/1009984337/preview/stock-footage-tokai-close-up-flag-aichi-prefecture-realistic-animation-seamless-loop-seconds-long.mp4,PT00H00M10S,102701_102750,"Tokai close up flag, aichi prefecture, realistic animation seamless loop - 10 seconds long"
1066656562,https://ak.picdn.net/shutterstock/videos/1066656562/preview/stock-footage-kyiv-ukraine-august-cute-young-woman-hotel-guest-wearing-protective-mask-to-protect-from.mp4,PT00H00M23S,000051_000100,"Kyiv, ukraine - august 2020: cute young woman hotel guest wearing protective mask to protect from coronavirus. girl enters a hotel in white shirt."
1039935890,https://ak.picdn.net/shutterstock/videos/1039935890/preview/stock-footage-commercial-airplane-parking-at-the-airport-kyiv-ukraine.mp4,PT00H00M05S,030351_030400,"Commercial airplane parking at the airport. kyiv, ukraine 16.09.2019"
1013167337,https://ak.picdn.net/shutterstock/videos/1013167337/preview/stock-footage-young-african-american-man-in-headphones-typing-on-the-laptop-computer-and-sitting-on-the-stairs-of.mp4,PT00H00M06S,026351_026400,Young african american man in headphones typing on the laptop computer and sitting on the stairs of the big building in the center of the town while people walking in front of the camera. inside.
1063596169,https://ak.picdn.net/shutterstock/videos/1063596169/preview/stock-footage-laughing-kookaburra-fledgling-in-nest-peeks-his-head-out-while-parents-call-him-out-wide-side.mp4,PT00H00M25S,071501_071550,"Laughing kookaburra, fledgling in nest peeks his head out while parents call him out, wide, side
"
18301849,https://ak.picdn.net/shutterstock/videos/18301849/preview/stock-footage-sunset-reddish-by-the-sun-above-a-glacial-winter-leafless-forests.mp4,PT00H00M27S,064151_064200,"Sunset reddish by the sun above a glacial winter leafless forests 13
"
1012623197,https://ak.picdn.net/shutterstock/videos/1012623197/preview/stock-footage-napier-port-napier-new-zealand-june-the-singapore-registered-container-ship-kota.mp4,PT00H00M15S,125801_125850,"Napier port, napier, new zealand - june 18, 2016:  the singapore registered container ship kota lihat leaves the port of napier after unloading cargo"
1982329,https://ak.picdn.net/shutterstock/videos/1982329/preview/stock-footage-dip-out-sticky-rice.mp4,PT00H00M31S,074151_074200,Dip out sticky rice
13579844,https://ak.picdn.net/shutterstock/videos/13579844/preview/stock-footage--year-old-girl-coloring-the-floor-with-chalk.mp4,PT00H00M13S,128601_128650,9 year old girl coloring the floor with chalk
1024957370,https://ak.picdn.net/shutterstock/videos/1024957370/preview/stock-footage-aerial-view-autumn-of-nami-island-in-seoul-south-korea.mp4,PT00H00M20S,057601_057650,"Aerial view autumn of nami island in seoul ,south korea."
16448782,https://ak.picdn.net/shutterstock/videos/16448782/preview/stock-footage-moving-on-country-road.mp4,PT00H00M16S,073851_073900,Moving on country road
9010192,https://ak.picdn.net/shutterstock/videos/9010192/preview/stock-footage-close-up-time-lapse-of-amazing-sand-pyramids-in-hdr-k.mp4,PT00H00M12S,018501_018550,"Close up time lapse of amazing sand pyramids in hdr, 4k. "
1052621603,https://ak.picdn.net/shutterstock/videos/1052621603/preview/stock-footage-the-krzy-girl-points-to-the-viewer-then-on-the-left-the-concept-of-calling-for-rules.mp4,PT00H00M07S,182451_182500,The krzy girl points to the viewer then on the left. the concept of calling for rules.
2885170,https://ak.picdn.net/shutterstock/videos/2885170/preview/stock-footage-cuba-an-elegant-animation-of-the-worlds-flags-using-a-bpc-pipeline-these-are-high-quality.mp4,PT00H00M20S,135751_135800,"Cuba
an elegant animation of the worlds flags, using a 32bpc pipeline these are high quality animations. ideal as backgrounds or as icon overlays on tv and the web. "
1029182282,https://ak.picdn.net/shutterstock/videos/1029182282/preview/stock-footage-aerial-scenic-reveal-shot-of-rural-country-side-in-lithuania-during-dry-cloudy-summer-day.mp4,PT00H00M07S,058701_058750,"Aerial scenic reveal shot of rural country side in lithuania, during dry cloudy summer day."
1054819412,https://ak.picdn.net/shutterstock/videos/1054819412/preview/stock-footage-different-pills-and-bottles-macro-shot-from-above-rotation-of-the-pharmacy-table-modern-drug-and.mp4,PT00H00M31S,125851_125900,Different pills and bottles macro shot from above. rotation of the pharmacy table. modern drug and pharmacy industry concept. research and development medicines to prevent or treat coronavirus covid.
34902712,https://ak.picdn.net/shutterstock/videos/34902712/preview/stock-footage-somebody-presses-the-buttons-of-rear-mirror-in-the-car.mp4,PT00H00M11S,054601_054650,Somebody presses the buttons of rear mirror in the car
1030813559,https://ak.picdn.net/shutterstock/videos/1030813559/preview/stock-footage-flight-over-chattahoochee-river-to-farmers-field-near-omaha-georgia.mp4,PT00H00M33S,194151_194200,"Flight over chattahoochee river to farmers field near omaha, georgia"
1009184171,https://ak.picdn.net/shutterstock/videos/1009184171/preview/stock-footage-marseille-france-march-vallon-des-auffes-a-little-bay-with-boats-and-buildings-and-a-main.mp4,PT00H00M10S,078601_078650,"Marseille, france_ march 2018: vallon des auffes - a little bay with boats and buildings and a main attraction in marseille"
1062926404,https://ak.picdn.net/shutterstock/videos/1062926404/preview/stock-footage-japanese-fireworks-pyrotechnics-black-footage-firework-rockets-and-explosion-finale-big-bang.mp4,PT00H00M33S,050151_050200,"Japanese fireworks   pyrotechnics, black footage, firework  rockets and  explosion, finale big bang, multi effect  fireworks show, real film, no cgi"
1036241261,https://ak.picdn.net/shutterstock/videos/1036241261/preview/stock-footage-singapore-march-hyper-time-lapse-view-of-singapore-city-landmark-merlion-the-merlion.mp4,PT00H00M06S,115651_115700,"Singapore - march 01, 2018: hyper time lapse view of singapore city landmark merlion, the merlion statue with the city skyline in the background, marina bay"
8843563,https://ak.picdn.net/shutterstock/videos/8843563/preview/stock-footage-sugar-loaf-covered-with-clouds-with-cable-cars-moving-into-two-directions.mp4,PT00H01M12S,186101_186150,Sugar loaf covered with clouds with cable cars moving into two directions
8009083,https://ak.picdn.net/shutterstock/videos/8009083/preview/stock-footage-young-gardener-going-back-home-from-the-garden-in-slow-motion.mp4,PT00H00M18S,174001_174050,Young gardener going back home from the garden in slow motion
1035661259,https://ak.picdn.net/shutterstock/videos/1035661259/preview/stock-footage-aerial-view-of-the-city-wertheim-am-main-in-germany-tilt-up-from-the-old-town-to-the-castle.mp4,PT00H00M27S,085951_086000,Aerial view of the city wertheim am main in germany. tilt up from the old town to the castle.
1010480372,https://ak.picdn.net/shutterstock/videos/1010480372/preview/stock-footage-seremban-negeri-sembilan-april-happy-kids-having-fun-and-play-at-local-kindergarden.mp4,PT00H00M12S,072151_072200,"Seremban, negeri sembilan - april 13, 2018 : happy kids having fun and play at local kindergarden indoor preschool education. some visible noise due high iso and soft focus"
32827324,https://ak.picdn.net/shutterstock/videos/32827324/preview/stock-footage-yoga-attractive-girl-in-sportswear-pose-against-lake-yogi-training-outdoor-meditation-on-river.mp4,PT00H00M29S,103201_103250,"Yoga attractive girl in sportswear pose against lake. yogi training, outdoor meditation on river shore, healthy lifestyle"
12753143,https://ak.picdn.net/shutterstock/videos/12753143/preview/stock-footage-anemones-zoo-madrid-spain-filmed-in-november.mp4,PT00H00M12S,199051_199100,"Anemones. zoo madrid, spain. filmed in november 2015."
19610632,https://ak.picdn.net/shutterstock/videos/19610632/preview/stock-footage-un-army-engineers-blow-up-a-smoke-stack-in-hungnam-port-to-keep-the-communist-armies-from-using-it.mp4,PT00H00M33S,176651_176700,Un army engineers blow up a smoke stack in hungnam port to keep the communist armies from using it as a landmark in 1950. (1950s)
1028828930,https://ak.picdn.net/shutterstock/videos/1028828930/preview/stock-footage-malacca-malaysia-may-scenic-view-of-the-malacca-city-people-can-seen-exploring-around-it.mp4,PT00H00M16S,058401_058450,"Malacca,malaysia - may 3,2019: scenic view of the malacca city,people can seen exploring around it. it has been listed as unesco world heritage site since 7/7/2008. "
25679879,https://ak.picdn.net/shutterstock/videos/25679879/preview/stock-footage-clean-transparent-raindrops-drain-off-the-metal-mechanical-installation.mp4,PT00H00M09S,176201_176250,Clean transparent raindrops drain off the metal mechanical installation
1024893872,https://ak.picdn.net/shutterstock/videos/1024893872/preview/stock-footage-happy-woman-dancing-on-the-park-with-headphones-and-smartphone-listening-to-music-with-joy-woman.mp4,PT00H00M08S,082701_082750,"Happy woman  dancing on the park, with headphones and smartphone listening to music with joy. woman enjoying the sun and feeling the freedom. 4k"
9535946,https://ak.picdn.net/shutterstock/videos/9535946/preview/stock-footage-fan-blades-spinning-counterclockwise.mp4,PT00H00M28S,032801_032850,Fan blades spinning counterclockwise
1032500258,https://ak.picdn.net/shutterstock/videos/1032500258/preview/stock-footage-two-girls-traveler-girlfriend-walk-along-the-path-and-climb-up-the-mountain-plateau-they-are.mp4,PT00H00M13S,027201_027250,"Two girls traveler girlfriend walk along the path and climb up the mountain plateau. they are surrounded by grass, shrubs and blue sky."
20989117,https://ak.picdn.net/shutterstock/videos/20989117/preview/stock-footage-elephant-herd-crossing-african-road-following-one-another-with-cars-waiting-inside-kruger-national.mp4,PT00H00M28S,107551_107600,Elephant herd crossing african road following one another with cars waiting inside kruger national park south africa
1020043369,https://ak.picdn.net/shutterstock/videos/1020043369/preview/stock-footage-timelapse-with-pan-right-motion-of-sunshine-illuminating-waterfront-cityscape-in-the-evening-in.mp4,PT00H00M20S,070051_070100,"Timelapse with pan right motion of sunshine illuminating waterfront cityscape in the evening in tokyo, japan"
1025450771,https://ak.picdn.net/shutterstock/videos/1025450771/preview/stock-footage-bartender-pouring-beer-to-glass-from-beer-tap-in-bar-pub-close-up-bartender-hands-pouring-stout-to.mp4,PT00H00M13S,033401_033450,Bartender pouring beer to glass from beer tap in bar pub. close up bartender hands pouring stout to glass from handle tap in bar
