videoid,contentUrl,duration,page_dir,name
6032192,https://ak.picdn.net/shutterstock/videos/6032192/preview/stock-footage-night-to-day-timelapse-on-a-country-side-city-night-with-stars.mp4,PT00H00M08S,059451_059500,Night to day timelapse on a country side city. night with stars
27100156,https://ak.picdn.net/shutterstock/videos/27100156/preview/stock-footage-landfill-for-household-waste.mp4,PT00H00M24S,177701_177750,Landfill for household waste 
1010059577,https://ak.picdn.net/shutterstock/videos/1010059577/preview/stock-footage-woman-doctor-in-a-white-coat-talking-on-the-phone.mp4,PT00H00M15S,055901_055950,Woman doctor in a white coat talking on the phone
1031931737,https://ak.picdn.net/shutterstock/videos/1031931737/preview/stock-footage-man-plays-drum-musical-percussion-instrument-with-hand-closeup-musical-concept-slow-motion-shot.mp4,PT00H00M15S,173301_173350,"Man plays drum musical percussion instrument with hand closeup musical concept, slow motion shot"
1047683398,https://ak.picdn.net/shutterstock/videos/1047683398/preview/stock-footage-rotating-vietnamese-mango-on-black-background.mp4,PT00H00M18S,129901_129950,Rotating vietnamese mango on black background
1017409021,https://ak.picdn.net/shutterstock/videos/1017409021/preview/stock-footage-work-on-notebook-computer.mp4,PT00H00M40S,182001_182050,Work on notebook computer
1025692211,https://ak.picdn.net/shutterstock/videos/1025692211/preview/stock-footage-beautiful-weding-shoes.mp4,PT00H00M07S,187601_187650,Beautiful weding shoes
1045806928,https://ak.picdn.net/shutterstock/videos/1045806928/preview/stock-footage-subscribe-to-youtube-channel-animation-of-mouse-arrow-clicking-suscribe-button.mp4,PT00H00M06S,188401_188450,Subscribe to youtube channel animation of mouse arrow clicking suscribe button
9532778,https://ak.picdn.net/shutterstock/videos/9532778/preview/stock-footage-pecans-in-a-bowl-loop-rotation-front-of-the-camera-rotates-plate-with-large-chocolate-pecan.mp4,PT00H00M41S,124051_124100,"Pecans in a bowl   ( loop rotation. front of the camera rotates plate with large chocolate pecan
"
27557272,https://ak.picdn.net/shutterstock/videos/27557272/preview/stock-footage-jan-abu-dhabi-formula-yas-marina-circuit-yas-island-abu-dhabi-united-arab-emirates-uae.mp4,PT00H00M25S,057551_057600,"Jan 2017, abu dhabi. formula 1 yas marina circuit, yas island, abu dhabi, united arab emirates, uae"
1047570142,https://ak.picdn.net/shutterstock/videos/1047570142/preview/stock-footage-beautiful-girl-lifts-dumbbells-in-a-fitness-center.mp4,PT00H00M29S,023751_023800,Beautiful girl lifts dumbbells in a fitness center
23435071,https://ak.picdn.net/shutterstock/videos/23435071/preview/stock-footage-slow-motion-shot-from-underwater-with-sun-rays-reflection-on-the-sand-sea-floor-glittering.mp4,PT00H00M17S,077701_077750,"Slow motion shot from underwater with sun rays reflection on the sand sea floor. glittering seascape scene with natural light. action camera. full hd 1920x1080
"
14078660,https://ak.picdn.net/shutterstock/videos/14078660/preview/stock-footage-cyber-security-design-video-animation.mp4,PT00H00M09S,148551_148600,"Cyber security design, video animation"
24151600,https://ak.picdn.net/shutterstock/videos/24151600/preview/stock-footage--d-illustration-of-rain-of-lots-of-tiny-green-clovers-with-a-defocus-effect.mp4,PT00H00M12S,107351_107400,3d illustration of rain of lots of tiny green clovers with a defocus effect
18195331,https://ak.picdn.net/shutterstock/videos/18195331/preview/stock-footage-usa-woman-with-her-horses-in-in-usa.mp4,PT00H00M10S,101651_101700,Usa - 1939: woman with her horses in 1939 in usa
9109526,https://ak.picdn.net/shutterstock/videos/9109526/preview/stock-footage-vertical-pan-of-tiny-roll-pasta-on-white-background-this-video-was-shoot-using-custom-light-set.mp4,PT00H00M07S,027751_027800,Vertical pan of tiny roll pasta on white background 2. this video was shoot using custom light set up with additional custom build underneath light system to eliminate shadows.
3904148,https://ak.picdn.net/shutterstock/videos/3904148/preview/stock-footage-moscow-jan-rotating-camera-parents-and-kids-moving-in-main-hall-at-forum-hall-moscow.mp4,PT00H00M07S,126551_126600,"Moscow - jan 04: ( rotating camera) parents and kids moving in main hall at forum hall moscow masquerade of moscow families, on jan 04, 2012 in moscow, russia."
26295521,https://ak.picdn.net/shutterstock/videos/26295521/preview/stock-footage-rome-lazio-italy-april-zoom-out-from-statues-at-vittorio-emanuele-ii-monument-and.mp4,PT00H00M10S,048651_048700,"Rome, lazio/italy - april 05, 2017: zoom out from statues at vittorio emanuele ii monument and churches. the monument was built in honor of victor emmanuel who was the first king of a unified italy."
19530841,https://ak.picdn.net/shutterstock/videos/19530841/preview/stock-footage-toraja-traditional-way-weaving-clothes-by-women-in-sa-dan-to-barana-village-rantepao-north-toraja.mp4,PT00H00M17S,046251_046300,"Toraja traditional way weaving clothes by women in sa'dan to'barana village rantepao, north toraja,sulawesi, indonesia. weave clothes become an important heritage for toraja people."
3144652,https://ak.picdn.net/shutterstock/videos/3144652/preview/stock-footage-winter-day-with-snow-falling-over-logs.mp4,PT00H00M29S,130601_130650,"Winter day with snow falling over logs
"
28601185,https://ak.picdn.net/shutterstock/videos/28601185/preview/stock-footage-virginia-spring-re-enactment-recreation-of-historical-th-or-th-century-printing-press.mp4,PT00H00M34S,057551_057600,"Virginia - spring 2016 - re-enactment recreation of historical, 18th or 19th century printing press at work with male printer working the levers, wheels and print type / ink. printing newspapers."
822937,https://ak.picdn.net/shutterstock/videos/822937/preview/stock-footage-water-surface-reflections.mp4,PT00H00M29S,083151_083200,"Water surface, reflections "
2777021,https://ak.picdn.net/shutterstock/videos/2777021/preview/stock-footage-field-of-camomiles-and-blue-cloudy-sky.mp4,PT00H00M12S,035201_035250,Field of camomiles and blue cloudy sky 
1055788772,https://ak.picdn.net/shutterstock/videos/1055788772/preview/stock-footage-blue-sky-and-white-cloud-background-time-lapse-beautiful-and-good-weather.mp4,PT00H00M08S,050251_050300,Blue sky and white cloud background time lapse. beautiful and good weather.
1061059243,https://ak.picdn.net/shutterstock/videos/1061059243/preview/stock-footage-happy-girl-on-swing-in-sunset-fall-kid-having-fun-on-a-swing-outdoor.mp4,PT00H00M29S,028501_028550,Happy girl on swing in sunset fall. kid having fun on a swing outdoor.
1007962165,https://ak.picdn.net/shutterstock/videos/1007962165/preview/stock-footage-businessman-with-customer-journey.mp4,PT00H00M35S,189451_189500,Businessman with customer journey
1049574922,https://ak.picdn.net/shutterstock/videos/1049574922/preview/stock-footage-beautiful-blurry-green-and-blue-nature-background-sunlight-shining-through-the-leaves-of-trees.mp4,PT00H00M08S,148251_148300,"Beautiful blurry green and blue nature background, sunlight shining through the leaves of trees, natural blurred background, abstract nature background, nature green bokeh."
3862493,https://ak.picdn.net/shutterstock/videos/3862493/preview/stock-footage-geese-entering-water.mp4,PT00H00M20S,027801_027850,Geese entering water
27802759,https://ak.picdn.net/shutterstock/videos/27802759/preview/stock-footage-woman-writing-job-on-transparent-screen-businesswoman-write-on-board.mp4,PT00H00M08S,184151_184200,Woman writing job on transparent screen. businesswoman write on board.
1038423581,https://ak.picdn.net/shutterstock/videos/1038423581/preview/stock-footage-aerial-view-panorama-of-village-with-houses-and-gardens-on-a-river-surrounded-by-dense-green-forest.mp4,PT00H00M55S,013301_013350,Aerial view panorama of village with houses and gardens on a river surrounded by dense green forest with stunning landscape cinematic views. concept climate outdoor nature.
1020886135,https://ak.picdn.net/shutterstock/videos/1020886135/preview/stock-footage-consecutive-fireworks-volleys-isolated-on-black-background-d-animation-d-render-close-up-view.mp4,PT00H01M00S,189101_189150,Consecutive fireworks volleys isolated on black background. 3d animation 3d render close up view. multicolored 8
3523004,https://ak.picdn.net/shutterstock/videos/3523004/preview/stock-footage-ramshorn-snails-planorbarius-corneus.mp4,PT00H00M12S,139251_139300,Ramshorn snails (planorbarius corneus)
11566223,https://ak.picdn.net/shutterstock/videos/11566223/preview/stock-footage-raw-meat-beefsteak-fillet-with-knife-on-wood-x-intro-motion-slow-hidef-hd.mp4,PT00H00M20S,128001_128050,Raw meat beefsteak fillet with knife on wood 1920x1080 intro motion slow hidef hd
12731159,https://ak.picdn.net/shutterstock/videos/12731159/preview/stock-footage-moscow-russia-november-musicians-play-classical-music-during-all-russian-night-of-the.mp4,PT00H00M21S,057451_057500,"Moscow, russia - november 03, 2015: musicians play classical music during all-russian ""night of the arts"" action. tsaritsyno grand palace, catherine's hall."
7661503,https://ak.picdn.net/shutterstock/videos/7661503/preview/stock-footage-candles.mp4,PT00H00M10S,193451_193500,Candles
6981721,https://ak.picdn.net/shutterstock/videos/6981721/preview/stock-footage-troll-figure-in-mountain-scenery-norway.mp4,PT00H00M16S,033151_033200,Troll figure in mountain scenery norway
15926080,https://ak.picdn.net/shutterstock/videos/15926080/preview/stock-footage-high-speed-camera-shot-of-an-smoke-video-element-isolated-on-a-black-background-can-be-pre-matted.mp4,PT00H00M15S,035001_035050,"High speed camera shot of an smoke video element, isolated on a black background. can be pre-matted for your video footage by using the command frame blending - multiply.
"
1031506742,https://ak.picdn.net/shutterstock/videos/1031506742/preview/stock-footage-india-picturesque-beautiful-agricultural-fields-at-sunset-k-aerial-drone-footage.mp4,PT00H00M16S,106501_106550,"India picturesque beautiful agricultural fields at sunset, 4k aerial drone footage"
22069669,https://ak.picdn.net/shutterstock/videos/22069669/preview/stock-footage-beautiful-background-animation.mp4,PT00H00M05S,113651_113700,"Beautiful background,animation"
19850656,https://ak.picdn.net/shutterstock/videos/19850656/preview/stock-footage-unrecognizable-people-walking-in-the-the-park-in-european-city.mp4,PT00H00M20S,197001_197050,Unrecognizable people walking in the the park in european city.
1009634612,https://ak.picdn.net/shutterstock/videos/1009634612/preview/stock-footage-aerial-view-of-countryside-gauja-lake-field-drone-top-view-k-uhd-video.mp4,PT00H00M37S,068901_068950,Aerial view of countryside gauja lake field drone top view 4k uhd video
1017895633,https://ak.picdn.net/shutterstock/videos/1017895633/preview/stock-footage-water-sprinkler-rotating-at-grass-in-park.mp4,PT00H00M12S,117251_117300,Water sprinkler rotating at grass in park
1060014626,https://ak.picdn.net/shutterstock/videos/1060014626/preview/stock-footage-fall-or-autumn-in-sweden-red-cabin-and-house-in-park-with-large-colorful-tree-orange-yellow.mp4,PT00H00M11S,018901_018950,Fall or autumn in sweden. red cabin and house in park with large colorful tree. orange yellow leaves falling after foliage. stockholm swedish capital city royal garden. smooth walking gimbal steadicam
11362979,https://ak.picdn.net/shutterstock/videos/11362979/preview/stock-footage-tired-businessman-with-a-concerned-look-working-at-a-large-warehouse-in-slow-motion.mp4,PT00H00M30S,078551_078600,Tired businessman with a concerned look working at a large warehouse. in slow motion.
1907320,https://ak.picdn.net/shutterstock/videos/1907320/preview/stock-footage-the-natural-setting-of-lord-kitchner-island.mp4,PT00H00M13S,129751_129800,The natural setting of lord kitchner island
6192998,https://ak.picdn.net/shutterstock/videos/6192998/preview/stock-footage-man-with-a-cellphone-sitting-on-the-sofa.mp4,PT00H00M16S,131451_131500,"Man with a cellphone sitting on the sofa
"
1015478548,https://ak.picdn.net/shutterstock/videos/1015478548/preview/stock-footage-silhouette-of-people-in-the-home-th-jan-hyderabad-india.mp4,PT00H00M10S,193601_193650,Silhouette of people in the home 29th jan 2018 hyderabad india
1012663943,https://ak.picdn.net/shutterstock/videos/1012663943/preview/stock-footage-master-is-using-industrial-machine-for-processing-edges-of-particle-board-in-workshop-of-furniture.mp4,PT00H00M17S,175701_175750,Master is using industrial machine for processing edges of particle board in workshop of furniture plant
1044090196,https://ak.picdn.net/shutterstock/videos/1044090196/preview/stock-footage-self-drawing-cut-of-red-pink-grapefruit-sketch-animation-copy-space-white-background-foggy.mp4,PT00H00M35S,183251_183300,Self drawing cut of red pink grapefruit. sketch animation. copy space.  white background. foggy
13439999,https://ak.picdn.net/shutterstock/videos/13439999/preview/stock-footage-lod-israel-december-israeli-antiquities-authority-unveiled-to-journalists-and.mp4,PT00H00M10S,145801_145850,"Lod, israel - december 16, 2015: israeli antiquities authority unveiled to journalists and photographers a 1700 year old roman byzantine era mosaic floor of a villa that was found a year ago"
3639944,https://ak.picdn.net/shutterstock/videos/3639944/preview/stock-footage-girl-is-standing-near-haystack-with-closed-eyes-and-posing-for-the-camera.mp4,PT00H00M25S,038701_038750,Girl is standing near haystack with closed eyes and posing for the camera.
1063339012,https://ak.picdn.net/shutterstock/videos/1063339012/preview/stock-footage-aerial-traveling-desert-sea-mexico.mp4,PT00H00M23S,039401_039450,Aerial traveling desert sea mexico
1030515635,https://ak.picdn.net/shutterstock/videos/1030515635/preview/stock-footage-pretty-young-afro-american-woman-with-curly-hair-and-in-jeans-sleeveless-dress-sitting-outside.mp4,PT00H00M16S,029651_029700,"Pretty young afro-american woman with curly hair and in jeans sleeveless dress sitting outside, talking on phone, looking disappointed, finishing call. lifestyle, communication concept"
15766747,https://ak.picdn.net/shutterstock/videos/15766747/preview/stock-footage-panning-seascape-sunet-ko-samui-thailand.mp4,PT00H00M09S,186851_186900,"Panning seascape sunet, ko samui, thailand."
1028260085,https://ak.picdn.net/shutterstock/videos/1028260085/preview/stock-footage-old-rural-village-houses-high-in-the-mountain-from-above-in-k.mp4,PT00H00M37S,142501_142550,Old rural village houses high in the mountain from above in 4k
1012922525,https://ak.picdn.net/shutterstock/videos/1012922525/preview/stock-footage-extraction-of-sand-from-the-river-with-the-help-of-heavy-machinery-in-the-open-area.mp4,PT00H00M22S,179051_179100,Extraction of sand from the river with the help of heavy machinery in the open area
1055355329,https://ak.picdn.net/shutterstock/videos/1055355329/preview/stock-footage-funny-blond-boy-in-plaid-shirt-riding-bicycle-with-his-beloved-grandmother-child-teaches-an.mp4,PT00H00M16S,001801_001850,Funny blond boy in plaid shirt riding bicycle with his beloved grandmother. child teaches an elderly granny to ride. pensioner is smartly dressed and rolls on a large stretched scooter
19105204,https://ak.picdn.net/shutterstock/videos/19105204/preview/stock-footage-bulgarian-air-force-mig-fighter-aircraft-air-to-air-video-k-high-resolution-ultrahd-mikoyan.mp4,PT00H00M08S,050551_050600,"Bulgarian air force mig 21 fighter aircraft air to air video 4k high resolution ultrahd. mikoyan-gurevich mig-21 fishbed is a soviet union jet fighter aircraft. october 7th, 2015. this is a bulgarian air force mig-21."
20988484,https://ak.picdn.net/shutterstock/videos/20988484/preview/stock-footage-typing-word-on-a-black-background-gymnastic.mp4,PT00H00M10S,025251_025300,"Typing word on a black background, gymnastic"
2595500,https://ak.picdn.net/shutterstock/videos/2595500/preview/stock-footage-couple-taking-a-picture-of-themselves.mp4,PT00H00M10S,148651_148700,Couple taking a picture of themselves
31538698,https://ak.picdn.net/shutterstock/videos/31538698/preview/stock-footage-chichen-itza-mexico-may-monument-of-maya-warriors-with-rocks-buildings-ruins-on.mp4,PT00H00M13S,058201_058250,"Chichen itza, mexico - may 25, 2017: monument of maya warriors with rocks buildings ruins on yucatane peninsula in summer sunny day"
3690935,https://ak.picdn.net/shutterstock/videos/3690935/preview/stock-footage-whooper-swan.mp4,PT00H00M17S,056401_056450,Whooper swan
1034997686,https://ak.picdn.net/shutterstock/videos/1034997686/preview/stock-footage-the-camera-moves-around-the-girl-on-the-tennis-court-in-the-background-a-guy-kicks-the-ball-with-a.mp4,PT00H00M09S,027601_027650,The camera moves around the girl on the tennis court. in the background a guy kicks the ball with a squeeze racket
15366274,https://ak.picdn.net/shutterstock/videos/15366274/preview/stock-footage-look-of-an-owls-with-closing-of-eyes.mp4,PT00H00M11S,111301_111350,Look of an owls with closing of eyes
1052497849,https://ak.picdn.net/shutterstock/videos/1052497849/preview/stock-footage-cooking-meat-skewers-and-vegetables-on-barbecue-grill-ebab-from-meat-and-vegetables-on-grill.mp4,PT00H00M19S,064551_064600,Cooking meat skewers and vegetables on barbecue grill. кebab from meat and vegetables on grill.
12125333,https://ak.picdn.net/shutterstock/videos/12125333/preview/stock-footage-budapest-hungary-summer-a-cozy-cafe-with-a-fountain-shot-in-k-ultra-high-definition.mp4,PT00H00M15S,029901_029950,"Budapest, hungary - summer, 2015: a cozy cafe with a fountain. shot in 4k (ultra-high definition (uhd))."
1034000804,https://ak.picdn.net/shutterstock/videos/1034000804/preview/stock-footage-animation-of-red-highlighter-marks-the-writing-on-a-squared-notebook-sheet.mp4,PT00H00M10S,083801_083850,Animation of red highlighter marks the writing on a squared notebook sheet
1038780056,https://ak.picdn.net/shutterstock/videos/1038780056/preview/stock-footage-armenian-flag-on-top-of-building-fluttering-against-blue-sky-static-low-angle-slowmo.mp4,PT00H00M10S,072651_072700,Armenian flag on top of building fluttering against blue sky. static. low angle. slowmo
33836347,https://ak.picdn.net/shutterstock/videos/33836347/preview/stock-footage-italy-milan-dicember-city-life-complex-hadid-and-isozaki-tower-the-new-commercial.mp4,PT00H00M11S,043851_043900,"Italy - milan dicember 13,2017 - city life complex ,hadid and isozaki tower - the new commercial and residential area , shopping district and skyscepers"
2917750,https://ak.picdn.net/shutterstock/videos/2917750/preview/stock-footage-closeup-of-a-green-fern-leaf.mp4,PT00H00M18S,139351_139400,Closeup of a green fern leaf
25594673,https://ak.picdn.net/shutterstock/videos/25594673/preview/stock-footage-water-turbine-hydraulic-turbine.mp4,PT00H00M10S,176401_176450,Water turbine (hydraulic turbine)
1023036529,https://ak.picdn.net/shutterstock/videos/1023036529/preview/stock-footage-coquette-woman-flirting-posing-on-a-camera-blowing-air-kiss-slow-motion-yellow-lights-bokeh.mp4,PT00H00M13S,075451_075500,"Coquette woman flirting posing on a camera blowing air kiss, slow motion, yellow lights bokeh background"
1063930468,https://ak.picdn.net/shutterstock/videos/1063930468/preview/stock-footage--k-aerial-view-lavender-field-purple-flowers-beautiful-landscape-top-view-lavender-field-near.mp4,PT00H00M23S,119401_119450,"4k aerial view lavender field purple flowers beautiful landscape. top view lavender field near sliven, bulgaria"
1032101072,https://ak.picdn.net/shutterstock/videos/1032101072/preview/stock-footage-closeup-shot-of-a-funeral-casket-in-a-hearse-or-chapel-or-burial-at-cemetery.mp4,PT00H00M11S,021801_021850,"Closeup shot of a funeral casket in a hearse or chapel or burial at cemetery
"
1019273950,https://ak.picdn.net/shutterstock/videos/1019273950/preview/stock-footage-flying-above-the-newly-constructed-roundabout-in-forssa-finland-with-some-traffic-driving-in-it.mp4,PT00H00M31S,179701_179750,Flying above the newly constructed roundabout in forssa finland with some traffic driving in it
14416879,https://ak.picdn.net/shutterstock/videos/14416879/preview/stock-footage-placing-pants-on-a-hanger-into-a-wooden-wardrobe-and-closing-the-door.mp4,PT00H00M11S,117251_117300,Placing pants on a hanger into a wooden wardrobe and closing the door
5075153,https://ak.picdn.net/shutterstock/videos/5075153/preview/stock-footage-male-caucasian-tourist-trekking-walking-along-narrow-footpath-at-himalayan-mountains-nepal.mp4,PT00H00M18S,191801_191850,"Male caucasian tourist trekking walking along narrow footpath at himalayan mountains, nepal"
17728243,https://ak.picdn.net/shutterstock/videos/17728243/preview/stock-footage-editorial-gurgaon-delhi-india-july-delhi-transport-corporation-dtc-low-floor-green-bus.mp4,PT00H00M12S,001451_001500,"Editorial: gurgaon,delhi india: july 02 2016: delhi transport corporation (dtc) low floor green bus. dtc is one of the largest cng-powered bus service operator in the world."
20180941,https://ak.picdn.net/shutterstock/videos/20180941/preview/stock-footage-cat-cat-on-a-stone-wall.mp4,PT00H00M12S,078201_078250,Cat.  cat on a stone wall 
14820241,https://ak.picdn.net/shutterstock/videos/14820241/preview/stock-footage-dubai-uae-december-kidzania-kids-section-at-dubai-mall-kidzania-dubai-provides-children.mp4,PT00H00M30S,073201_073250,"Dubai, uae - december 5: kidzania - kids section at dubai mall. kidzania dubai provides children and their parents a safe and very realistic educational environment on december 5, 2015 in dubai"
1044352402,https://ak.picdn.net/shutterstock/videos/1044352402/preview/stock-footage-young-man-cleaning-snow-winter-with-shovel-after-snowstorm-yard-city-service-workers-sweeping-snow.mp4,PT00H00M08S,120301_120350,Young man cleaning snow winter with shovel after snowstorm yard. city service workers sweeping snow from the road. russian snowy winter daily routine. time lapse video.
21384283,https://ak.picdn.net/shutterstock/videos/21384283/preview/stock-footage-camden-new-jersey-flashback-old-classic-cars-driving-in-town-with-people-walking-on-a-sunny.mp4,PT00H00M08S,126351_126400,"Camden, new jersey 1952: flashback old classic cars driving in town with people walking on a sunny day"
1037011055,https://ak.picdn.net/shutterstock/videos/1037011055/preview/stock-footage-smiling-construction-worker-in-yellow-helmet-looking-at-perfect-well-built-object-hands-on-hips.mp4,PT00H00M17S,115451_115500,"Smiling construction worker in yellow helmet looking at perfect well built object hands on hips, alpha channel"
1049762800,https://ak.picdn.net/shutterstock/videos/1049762800/preview/stock-footage-walk-in-the-fresh-air-adaptation-of-social-distance-a-couple-takes-steps-in-the-trees-in-the.mp4,PT00H00M37S,139901_139950,"Walk in the fresh air, adaptation of social distance. a couple takes steps in the trees in the forest. social distance in the fresh air. quarantine covid 19."
26629555,https://ak.picdn.net/shutterstock/videos/26629555/preview/stock-footage-kyiv-ukraine-apr-festival-oldcarland-in-state-aviation-museum-in-kiev-ukraine.mp4,PT00H00M17S,149601_149650,"Kyiv/ukraine - apr 26 2016: festival oldcarland 2016 in state aviation museum in kiev, ukraine"
1039200125,https://ak.picdn.net/shutterstock/videos/1039200125/preview/stock-footage-aerial-shots-of-rice-paddies-jati-luwih.mp4,PT00H00M37S,180501_180550,Aerial shots of rice paddies. jati luwih
1007038276,https://ak.picdn.net/shutterstock/videos/1007038276/preview/stock-footage-rocks-the-hump-of-a-camel-against-the-background-of-water-tiligul-estuary-ukraine.mp4,PT00H00M17S,017351_017400,"Rocks ""the hump of a camel"" against the background of water. tiligul estuary, ukraine"
16797529,https://ak.picdn.net/shutterstock/videos/16797529/preview/stock-footage-the-sparks-fly-out-of-fire-isolated-on-black-background.mp4,PT00H00M12S,183901_183950,The sparks fly out of fire. isolated on black background.
8701156,https://ak.picdn.net/shutterstock/videos/8701156/preview/stock-footage-young-asian-woman-smile-happy-face-portrait.mp4,PT00H00M11S,039401_039450,"Young asian woman smile happy face portrait
"
19115353,https://ak.picdn.net/shutterstock/videos/19115353/preview/stock-footage-scene-with-attraction-of-venice-city-italy-san-marco-and-canal-grande-from-san-giorgio-maggiore.mp4,PT00H00M21S,005501_005550,"Scene with attraction of venice city, italy, san marco and canal grande from san giorgio maggiore tower, ultra hd 4k, real time
"
1020385042,https://ak.picdn.net/shutterstock/videos/1020385042/preview/stock-footage-fire-agni-havan-kund-indian-havan-kund-rituals-of-hindus-yagya.mp4,PT00H00M11S,105251_105300,"Fire,agni havan kund,indian havan kund, rituals of hindus yagya"
1037475923,https://ak.picdn.net/shutterstock/videos/1037475923/preview/stock-footage-strange-fashion-woman-dance-like-hippie-in-warm-summer-park.mp4,PT00H00M10S,020551_020600,Strange fashion woman dance like hippie in warm summer park
1032810653,https://ak.picdn.net/shutterstock/videos/1032810653/preview/stock-footage-people-are-boating-on-the-lake-at-the-resort.mp4,PT00H00M16S,088251_088300,People are boating on the lake at the resort
31434808,https://ak.picdn.net/shutterstock/videos/31434808/preview/stock-footage-bandar-seri-begawan-brunei-darussalam-march-view-on-the-village-on-water-in-the-capital.mp4,PT00H00M17S,012301_012350,"Bandar seri begawan,brunei darussalam-march 31,2017: view on the village on water in the capital"
897040,https://ak.picdn.net/shutterstock/videos/897040/preview/stock-footage-ice-cube-sways-during-melting.mp4,PT00H00M17S,001951_002000,Ice cube sways during melting
1036480250,https://ak.picdn.net/shutterstock/videos/1036480250/preview/stock-footage-young-black-male-tenderly-hugging-red-haired-girlfriend-couple-enjoying-date.mp4,PT00H00M10S,188251_188300,"Young black male tenderly hugging red-haired girlfriend, couple enjoying date"
