videoid,contentUrl,duration,page_dir,name
262192,https://ak.picdn.net/shutterstock/videos/262192/preview/stock-footage-female-eye-shows-emotion-reaction-from-happy-to-sad.mp4,PT00H00M20S,099301_099350,Female eye shows emotion reaction from happy to sad.
1012729268,https://ak.picdn.net/shutterstock/videos/1012729268/preview/stock-footage-san-martino-della-battaglia-bs-italy-june-commemoration-of-the-battle-of-solferino-and.mp4,PT00H00M08S,065951_066000,"San martino della battaglia bs,italy 24 june,2018. commemoration of the battle of  solferino and san martino on 1859"
879295,https://ak.picdn.net/shutterstock/videos/879295/preview/stock-footage-red-flare-flower-pattern-bright-glow-light.mp4,PT00H00M21S,126001_126050,"Red flare flower pattern,bright glow light"
7766947,https://ak.picdn.net/shutterstock/videos/7766947/preview/stock-footage-koh-samui-thailand-october-fashion-casual-style-and-attractive-girl-with-curly-hair-in-check.mp4,PT00H00M12S,145551_145600,"Koh samui, thailand, october 2014.fashion casual style and attractive girl with curly hair in check shirt with backpack goes to the store - shopping and vacation concept."
4867295,https://ak.picdn.net/shutterstock/videos/4867295/preview/stock-footage-fit-and-healthy-young-couple-hiking-through-park.mp4,PT00H00M19S,181701_181750,Fit and healthy young couple hiking through park
1015927657,https://ak.picdn.net/shutterstock/videos/1015927657/preview/stock-footage-beautiful-african-female-model-in-gold-goddess-costume-perfect-for-stylish-club-disco-and-fashion.mp4,PT00H00M22S,193901_193950,"Beautiful african female model in gold goddess costume. perfect for stylish club, disco and fashion events"
3146323,https://ak.picdn.net/shutterstock/videos/3146323/preview/stock-footage-blooming-cornflowers-at-field-edge-waving-rye-field-medium-shot-beautiful-wild-flowers-return-in.mp4,PT00H00M13S,008501_008550,Blooming cornflowers at field edge waving rye field - medium shot. beautiful wild flowers return in crop fields if farmers use less fertilizer.
29058709,https://ak.picdn.net/shutterstock/videos/29058709/preview/stock-footage-the-beautiful-seascape-at-okinawa-in-japan.mp4,PT00H00M22S,009751_009800,The beautiful seascape at okinawa in japan
1040396624,https://ak.picdn.net/shutterstock/videos/1040396624/preview/stock-footage-unhappy-couple-solving-problems-in-relations-visiting-family-counselor-wife-speaking-about.mp4,PT00H00M20S,127401_127450,"Unhappy couple solving problems in relations visiting family counselor, wife speaking about resentful husband. marriage counseling."
27626794,https://ak.picdn.net/shutterstock/videos/27626794/preview/stock-footage-caucasian-s-s-train-on-simulator-indoors-slow-mo-wellness-build-vitality-beauty-brunette.mp4,PT00H00M16S,188351_188400,"Caucasian 20s 30s train on simulator indoors slow mo. wellness build vitality beauty. brunette working out closeup slo mo. technology for speed moving, walking track. effort of health care slow motion"
1036264307,https://ak.picdn.net/shutterstock/videos/1036264307/preview/stock-footage-cooling-fans-illuminated-by-leds-inside-personal-computer-desktop-gaming-pc-with-multicolored-rgb.mp4,PT00H00M07S,119151_119200,Cooling fans illuminated by leds inside personal computer. desktop gaming pc with multicolored rgb lights
25032071,https://ak.picdn.net/shutterstock/videos/25032071/preview/stock-footage-sunset-over-the-sea-at-ngapaly-beach-in-myanmar.mp4,PT00H00M16S,186001_186050,Sunset over the sea at ngapaly beach in myanmar. 
1019855173,https://ak.picdn.net/shutterstock/videos/1019855173/preview/stock-footage-men-stand-near-working-oil-tower-talking-close-up.mp4,PT00H00M15S,125651_125700,"Men stand near working oil tower, talking, close up."
1058959034,https://ak.picdn.net/shutterstock/videos/1058959034/preview/stock-footage-endless-movement-to-the-center-of-the-tunnel-consisting-of-color-changing-rings.mp4,PT00H00M10S,084301_084350,"Endless movement to the center of the tunnel, consisting of color changing rings"
23343826,https://ak.picdn.net/shutterstock/videos/23343826/preview/stock-footage-united-states-s-man-speaks-at-desk-man-holds-model-airplane-plane-lands-on-runway-crane.mp4,PT00H00M27S,006251_006300,United states: 1950s: man speaks at desk. man holds model airplane. plane lands on runway. crane carries wing of plane.
1029068969,https://ak.picdn.net/shutterstock/videos/1029068969/preview/stock-footage-abstract-symmetry-kaleidoscope-like-mandala-ornament-d-rendering-backdrop-computer-generating.mp4,PT00H00M18S,007601_007650,"Abstract symmetry kaleidoscope like mandala ornament, 3d rendering backdrop, computer generating background"
1020760507,https://ak.picdn.net/shutterstock/videos/1020760507/preview/stock-footage-family-selfie-excited-young-mother-and-child-playing-lying-on-the-bed-and-taking-a-selfie-mother.mp4,PT00H00M13S,098451_098500,Family selfie. excited young mother and child playing lying on the bed and taking a selfie. mother and daughter monkeying around on camera and kissing. portrait of mom and baby closeup. slow motion.
1007832460,https://ak.picdn.net/shutterstock/videos/1007832460/preview/stock-footage-stylish-business-woman-in-a-strict-suit-signs-documents-in-the-office-attractive-brunette-with.mp4,PT00H00M20S,143251_143300,Stylish business woman in a strict suit signs documents in the office. attractive brunette with glasses is sitting at the table.
24898484,https://ak.picdn.net/shutterstock/videos/24898484/preview/stock-footage-young-happy-asian-woman-in-front-of-view-from-santa-maria-boat-osaka-sea-port-touring-on-osaka.mp4,PT00H00M10S,076451_076500,"Young happy asian woman in front of view from santa maria boat osaka sea port . touring on osaka bay, osaka, japan."
6182216,https://ak.picdn.net/shutterstock/videos/6182216/preview/stock-footage-abstract-colored-gears.mp4,PT00H00M20S,118551_118600,Abstract colored gears
24636590,https://ak.picdn.net/shutterstock/videos/24636590/preview/stock-footage-tomato-plants-in-african-field-fps-x.mp4,PT00H00M06S,024051_024100,Tomato plants in african field_59.94fps_1920x1080
1019148433,https://ak.picdn.net/shutterstock/videos/1019148433/preview/stock-footage-traveler-climbs-to-the-observation-deck-in-the-mountains-he-meets-beautiful-landscapes-and.mp4,PT00H00M21S,121001_121050,Traveler climbs to the observation deck in the mountains. he meets beautiful landscapes and photographs them on a smartphone. leads an active and healthy lifestyle.
16307017,https://ak.picdn.net/shutterstock/videos/16307017/preview/stock-footage-novosibirsk-russia-april-unidentified-people-ride-in-a-shaking-tram-in-novosibirsk-from.mp4,PT00H00M06S,098451_098500,"Novosibirsk, russia-april 28, 2016: unidentified people ride in a shaking tram in novosibirsk from 28 april 2016."
1040516867,https://ak.picdn.net/shutterstock/videos/1040516867/preview/stock-footage-george-town-penang-malaysia-apr-aerial-view-reclamation-ship-near-coastal-gurney-wharf.mp4,PT00H00M17S,118451_118500,"George town, penang/malaysia - apr 05 2019: aerial view reclamation ship near coastal gurney wharf."
22377031,https://ak.picdn.net/shutterstock/videos/22377031/preview/stock-footage-usa-florida-miami-beach-december-art-basel-week-biggest-art-exhibition-in-the-world.mp4,PT00H00M31S,066751_066800,"Usa, florida, miami beach, december 4, 2016. art basel week. biggest art exhibition in the world. editorial use only
"
24654659,https://ak.picdn.net/shutterstock/videos/24654659/preview/stock-footage-scorpionfish-in-red-corals-on-sandy-bottom-deep-underwater-in-sea-of-egypt-world-of-colorful.mp4,PT00H00M15S,067101_067150,Scorpionfish in red corals on sandy bottom deep underwater in sea of egypt. world of colorful beautiful wildlife of reefs and algae. inhabitants in search of food. abyssal diving.
33083743,https://ak.picdn.net/shutterstock/videos/33083743/preview/stock-footage-plant-engineering-production.mp4,PT00H00M20S,173251_173300,Plant. engineering production.
1033796543,https://ak.picdn.net/shutterstock/videos/1033796543/preview/stock-footage-man-taking-shower-young-handsome-man-washes-hair-and-body-in-white-shower-cabin-at-bathroom-skin.mp4,PT00H00M22S,027901_027950,"Man taking shower. young handsome man washes hair and body in white shower cabin at bathroom - skin care at home. guy, caucasian ethnicity, massaging head to wash hair with shampoo."
5513489,https://ak.picdn.net/shutterstock/videos/5513489/preview/stock-footage-rolling-dough-with-rolling-pin-slow-motion.mp4,PT00H00M20S,107201_107250,Rolling dough with rolling pin slow motion 
6511640,https://ak.picdn.net/shutterstock/videos/6511640/preview/stock-footage-horse-going-to-another-one-on-the-pasture.mp4,PT00H00M11S,077101_077150,Horse going to another one on the pasture
15322750,https://ak.picdn.net/shutterstock/videos/15322750/preview/stock-footage-rippled-potato-chips-macro-dolly-shot.mp4,PT00H00M27S,052101_052150,Rippled potato chips. macro dolly shot.
1038173405,https://ak.picdn.net/shutterstock/videos/1038173405/preview/stock-footage--k-locked-shot-with-young-pretty-businesswoman-standing-and-using-tablet-and-she-looking-with.mp4,PT00H00M19S,179101_179150,"4k locked shot with young pretty businesswoman standing and using tablet, and she looking with smiling to camera on white background"
25861844,https://ak.picdn.net/shutterstock/videos/25861844/preview/stock-footage-mouse-at-a-laptop-computer-zoomed-in-detail-of-a-man-clicking-and-scrolling-office-male-worker.mp4,PT00H00M16S,112451_112500,"Mouse at a laptop computer, zoomed in detail of a man clicking and scrolling. office male worker hand and fingers of business professional. technology communication online internet closeup."
6655601,https://ak.picdn.net/shutterstock/videos/6655601/preview/stock-footage-strong-winds-and-rain-on-tree.mp4,PT00H00M20S,093651_093700,Strong winds and rain on tree
1043837617,https://ak.picdn.net/shutterstock/videos/1043837617/preview/stock-footage-aerial-view-of-the-wishing-bridge-located-in-the-gap-of-dunloe-co-kerry-ireland.mp4,PT00H00M29S,173651_173700,"Aerial view of the wishing bridge, located in the gap of dunloe, co kerry, ireland."
1055401076,https://ak.picdn.net/shutterstock/videos/1055401076/preview/stock-footage-golden-tall-grass-landscape-moved-by-a-breath-of-wind-wild-nature-real-time-k.mp4,PT00H00M05S,072601_072650,"Golden tall grass landscape moved by a breath of wind, wild nature real time 4k"
20355640,https://ak.picdn.net/shutterstock/videos/20355640/preview/stock-footage-toronto-canada-october-boat-being-taken-out-of-the-water-in-port-credit-established.mp4,PT00H00M13S,135751_135800,"Toronto, canada - october 10, 2016: boat being taken out of the water in port credit. established as a trading post in 1720, port credit is now a hub for entertainment and recreation in the west end."
20495536,https://ak.picdn.net/shutterstock/videos/20495536/preview/stock-footage-back-view-of-small-boy-watching-in-window-from-his-place-in-rail-train-and-saying-goodbye-his.mp4,PT00H00M12S,124751_124800,"Back view of small boy watching in window from his place in rail train and saying goodbye his grandparents, swinging arms"
3448433,https://ak.picdn.net/shutterstock/videos/3448433/preview/stock-footage-floating-clouds-in-the-mountains-at-sunset.mp4,PT00H00M13S,136901_136950,"Floating clouds in the mountains at sunset
"
1019417926,https://ak.picdn.net/shutterstock/videos/1019417926/preview/stock-footage-big-rain-of-acute-silver-five-branchs-stars-with-alpha-channel.mp4,PT00H00M17S,060101_060150,Big rain of acute silver five branchs stars with alpha channel
26311316,https://ak.picdn.net/shutterstock/videos/26311316/preview/stock-footage-birds-of-prey-nature-and-wildlife-concept-griffon-vultures-eating-carrion-in-maasai-mara.mp4,PT00H00M23S,116301_116350,"Birds of prey, nature and wildlife concept - griffon vultures eating carrion in maasai mara national reserve savannah at africa"
35592,https://ak.picdn.net/shutterstock/videos/35592/preview/stock-footage-mirror-square-shapes-growing-in-large-square-sequence-shape.mp4,PT00H00M12S,073151_073200,Mirror square shapes growing in large square sequence shape
4693820,https://ak.picdn.net/shutterstock/videos/4693820/preview/stock-footage-pouring-chocolate-milk-slow-motion.mp4,PT00H00M25S,139051_139100,"Pouring chocolate milk, slow motion"
1033246256,https://ak.picdn.net/shutterstock/videos/1033246256/preview/stock-footage-panning-drone-shot-of-a-seven-mile-beach-on-the-caribbean-island-of-trinidad.mp4,PT00H00M30S,026101_026150,Panning drone shot of a seven mile beach on the caribbean island of trinidad
34688338,https://ak.picdn.net/shutterstock/videos/34688338/preview/stock-footage-spectators-dance-greek-dances-around-the-trendy-city-cafe-on-saturday-blurred-view.mp4,PT00H00M20S,142851_142900,Spectators dance greek dances around the trendy city cafe on saturday. blurred view
23374747,https://ak.picdn.net/shutterstock/videos/23374747/preview/stock-footage-attractive-businessman-working-with-tablet-in-office-home.mp4,PT00H00M17S,019851_019900,"Attractive businessman working with tablet in office home
"
72370,https://ak.picdn.net/shutterstock/videos/72370/preview/stock-footage-field-of-hot-air-balloons-pan.mp4,PT00H00M11S,081251_081300,Field of hot air balloons - pan
1037082773,https://ak.picdn.net/shutterstock/videos/1037082773/preview/stock-footage-man-cuts-and-saws-tree-branch-with-knife.mp4,PT00H00M24S,186451_186500,Man cuts and saws tree branch with knife
1020940768,https://ak.picdn.net/shutterstock/videos/1020940768/preview/stock-footage-blooming-nature-with-bee-picking-pollen-macro-shot-hd-close-up-static-shot-of-bees-in-focus-on.mp4,PT00H00M13S,196251_196300,Blooming nature with bee picking pollen macro shot hd. close up static shot of bees in focus on blossoming flower with shallow depth of field. bright flower.
1038775949,https://ak.picdn.net/shutterstock/videos/1038775949/preview/stock-footage-young-man-with-knee-pain-injury-health-problems-health-insurance-massaging-injured-kneecap-health.mp4,PT00H00M21S,197551_197600,"Young man with knee pain injury, health problems health insurance massaging injured kneecap, health care concept"
21429592,https://ak.picdn.net/shutterstock/videos/21429592/preview/stock-footage-landscape-with-grazing-horse-on-pasture.mp4,PT00H00M41S,148151_148200,Landscape with grazing horse on pasture.
1023802093,https://ak.picdn.net/shutterstock/videos/1023802093/preview/stock-footage-woman-with-clay-carbo-detox-black-mask-on-her-face-closeup-on-white-girl-taking-care-of-oily-skin.mp4,PT00H00M11S,105601_105650,"Woman with clay carbo detox black mask on her face, closeup on white. girl taking care of oily skin complexion. beauty treatment. skincare"
1021166872,https://ak.picdn.net/shutterstock/videos/1021166872/preview/stock-footage-chicago-beach-skyline.mp4,PT00H00M12S,048151_048200,Chicago beach & skyline
1021768693,https://ak.picdn.net/shutterstock/videos/1021768693/preview/stock-footage-cubes-swap-to-title-matte.mp4,PT00H00M04S,082851_082900,Cubes swap to title matte
1057793710,https://ak.picdn.net/shutterstock/videos/1057793710/preview/stock-footage-tandem-paramotor-gliding-two-men-flying-and-gliding-in-the-air-high-quality-photo.mp4,PT00H00M05S,041901_041950,Tandem paramotor gliding - two men flying and gliding in the air. high quality photo
23316340,https://ak.picdn.net/shutterstock/videos/23316340/preview/stock-footage-viruses-in-blue.mp4,PT00H00M22S,017751_017800,Viruses in blue
1048912291,https://ak.picdn.net/shutterstock/videos/1048912291/preview/stock-footage-miami-usa-march-empty-shelves-at-grocery-store-sold-out-toilet-paper-section-due-to.mp4,PT00H00M11S,125251_125300,"Miami, usa - march 22, 2020: empty shelves at grocery store. sold out toilet paper section due to covid-19 coronavirus disease after customer make panic purchase"
1022453755,https://ak.picdn.net/shutterstock/videos/1022453755/preview/stock-footage-nassfeld-austria-january-a-snow-board-with-snow-flakes-on-it-at-the-cabin-of-gondola-in.mp4,PT00H00M11S,079801_079850,"Nassfeld, austria, january 09 2019: a snow board with snow flakes on it at the cabin of gondola in ski resort nasffeld, austria."
1020545236,https://ak.picdn.net/shutterstock/videos/1020545236/preview/stock-footage-young-woman-feel-carefree-and-take-a-deep-breath-at-nature-outdoor.mp4,PT00H00M13S,109651_109700,Young woman feel carefree and take a deep breath at nature outdoor
24727352,https://ak.picdn.net/shutterstock/videos/24727352/preview/stock-footage-french-mastiff-running-slow-motion-on-the-snow-k.mp4,PT00H00M09S,193201_193250,French mastiff running slow motion on the snow 4k
1029104132,https://ak.picdn.net/shutterstock/videos/1029104132/preview/stock-footage-circa-s-newspapers-investigate-the-housing-situation-and-city-officials-try-to-build-support.mp4,PT00H00M57S,056901_056950,Circa 1950s - newspapers investigate the housing situation and city officials try to build support in the business community to help.
21521263,https://ak.picdn.net/shutterstock/videos/21521263/preview/stock-footage-saltpans-of-trapani-with-windmills-in-sicily-italy.mp4,PT00H00M14S,077501_077550,Saltpans of trapani with windmills in sicily (italy)
1039531430,https://ak.picdn.net/shutterstock/videos/1039531430/preview/stock-footage-the-dust-rain-particle-water-drop-falling-in-rainy-season-with-dark-blue-color-as-abstract.mp4,PT00H00M30S,077101_077150,"The dust rain particle water drop falling in rainy season with dark blue color as abstract background.
"
1036657088,https://ak.picdn.net/shutterstock/videos/1036657088/preview/stock-footage-panorama-of-a-park-in-rome-with-roman-aqueducts.mp4,PT00H00M12S,019601_019650,Panorama of a park in rome with roman aqueducts
27200299,https://ak.picdn.net/shutterstock/videos/27200299/preview/stock-footage-aerial-shot-over-the-peninsula-of-howth-dublin.mp4,PT00H00M30S,011801_011850,Aerial shot over the peninsula of howth dublin
32875327,https://ak.picdn.net/shutterstock/videos/32875327/preview/stock-footage-stop-motion-drawn-marker-heart-shape-yes-word-text-cartoon-animation-seamless-loop-background-new.mp4,PT00H00M09S,030801_030850,Stop motion drawn marker heart shape yes word text cartoon animation seamless loop background. new quality universal grunge vintage motion dynamic animated background colorful joyful cool video 
9835718,https://ak.picdn.net/shutterstock/videos/9835718/preview/stock-footage-growing-of-green-grass.mp4,PT00H00M27S,181101_181150,Growing of green grass.
1048528810,https://ak.picdn.net/shutterstock/videos/1048528810/preview/stock-footage-delicate-and-bright-spring-flowers-on-apple-tree-branches.mp4,PT00H00M08S,059851_059900,Delicate and bright spring flowers on apple tree branches
1026881564,https://ak.picdn.net/shutterstock/videos/1026881564/preview/stock-footage-close-up-of-legs-young-ballerinas-in-pointe-shoeses-is-behind-the-metal-bars-ballet-practice.mp4,PT00H00M17S,061601_061650,Close up of legs young ballerinas in pointe shoeses is behind the metal bars. ballet practice. beautiful slim graceful legs of ballet dancers in the dark with light and smoke on the background.
1061762572,https://ak.picdn.net/shutterstock/videos/1061762572/preview/stock-footage-mountain-river-fast-stream-water-russia-altai.mp4,PT00H00M21S,097951_098000,Mountain river. fast stream water. russia altai
25339436,https://ak.picdn.net/shutterstock/videos/25339436/preview/stock-footage-smooth-stones-for-massage-on-the-back-of-the-girl.mp4,PT00H00M09S,188701_188750,Smooth stones for massage on the back of the girl
1011911468,https://ak.picdn.net/shutterstock/videos/1011911468/preview/stock-footage-purple-star-field-abstract-particle-background.mp4,PT00H00M15S,181401_181450,Purple star field abstract particle background
1006806130,https://ak.picdn.net/shutterstock/videos/1006806130/preview/stock-footage-pork-carcasses-lying-on-pallet-in-cold-room-at-butchers-shop.mp4,PT00H00M10S,009801_009850,Pork carcasses lying on pallet in cold room at butchers shop
26373416,https://ak.picdn.net/shutterstock/videos/26373416/preview/stock-footage-irritated-girl-looking-on-her-unhappy-father-and-they-are-both-sitting-in-silence.mp4,PT00H00M22S,147751_147800,"Irritated girl looking on her unhappy father and they are both sitting in silence
"
1045425031,https://ak.picdn.net/shutterstock/videos/1045425031/preview/stock-footage-dade-county-florida-impressive-sprawling-oceanfront-estates-with-private-docks-as-seen-from.mp4,PT00H00M05S,008001_008050,Dade county florida-1955: impressive sprawling oceanfront estates with private docks as seen from the water
1047052558,https://ak.picdn.net/shutterstock/videos/1047052558/preview/stock-footage-california-beach-town-on-the-pacific-ocean-coast-aerial.mp4,PT00H00M59S,050401_050450,California beach town on the pacific ocean coast aerial
1035775811,https://ak.picdn.net/shutterstock/videos/1035775811/preview/stock-footage-ants-attack-a-fly-and-try-to-put-it-in-the-anthill-the-fly-resists-dying.mp4,PT00H00M36S,083601_083650,Ants attack a fly and try to put it in the anthill. the fly resists dying
1036861994,https://ak.picdn.net/shutterstock/videos/1036861994/preview/stock-footage-business-asian-woman-using-laptop-working-typing-on-laptop-keyboard-and-sitting-in-the-park-on.mp4,PT00H00M15S,059851_059900,Business asian woman using laptop working typing on laptop keyboard and sitting in the park on green grass in outdoor. is not in focus or focus is too soft.
10498073,https://ak.picdn.net/shutterstock/videos/10498073/preview/stock-footage-beautiful-black-woman-smiling-with-mug-by-window.mp4,PT00H00M19S,148251_148300,Beautiful black woman smiling with mug by window
20422105,https://ak.picdn.net/shutterstock/videos/20422105/preview/stock-footage-spooky-castle-with-moon-at-night-timelapse.mp4,PT00H00M12S,025351_025400,Spooky castle with moon at night timelapse
1043594782,https://ak.picdn.net/shutterstock/videos/1043594782/preview/stock-footage-real-estate-for-a-nice-house.mp4,PT00H00M06S,043301_043350,Real estate for a nice house
1026077861,https://ak.picdn.net/shutterstock/videos/1026077861/preview/stock-footage-solar-panels-green-renewable-energy-future-green-technology.mp4,PT00H00M06S,132451_132500,"Solar panels, green renewable energy future, green technology"
1056438941,https://ak.picdn.net/shutterstock/videos/1056438941/preview/stock-footage-close-up-of-cactus-lanzarote-spain.mp4,PT00H00M10S,098751_098800,Close up of cactus lanzarote spain
15245599,https://ak.picdn.net/shutterstock/videos/15245599/preview/stock-footage-a-close-up-shot-of-a-beautiful-bug-with-flyaway.mp4,PT00H00M22S,050001_050050,A close up shot of a beautiful bug with flyaway
23191774,https://ak.picdn.net/shutterstock/videos/23191774/preview/stock-footage-pretty-girl-drinking-orange-juice-and-smiling-to-the-camera-steadycam-shot.mp4,PT00H00M17S,111351_111400,"Pretty girl drinking orange juice and smiling to the camera, steadycam shot
"
1050546073,https://ak.picdn.net/shutterstock/videos/1050546073/preview/stock-footage-stay-at-home-concept-young-asian-couple-is-staying-at-home-and-relaxing-by-play-guitar-and-sing.mp4,PT00H00M10S,120951_121000,Stay at home concept. young asian couple is staying at home and relaxing by play guitar and sing.
1037220095,https://ak.picdn.net/shutterstock/videos/1037220095/preview/stock-footage-raindropsing-down-on-the-window-while-outside-is-a-rainy-and-windy-day.mp4,PT00H00M10S,106251_106300,Raindropsing down on the window while outside is a rainy and windy day
1022822503,https://ak.picdn.net/shutterstock/videos/1022822503/preview/stock-footage-ct-scan-orbit-finding-multiple-displaced-fracture-of-right-zygoma-extending-to-anterior-wall-of.mp4,PT00H00M05S,112651_112700,"Ct scan orbit finding multiple displaced fracture of right zygoma, extending to anterior wall of right temporomandibular joint.medical concept."
22023553,https://ak.picdn.net/shutterstock/videos/22023553/preview/stock-footage-curtain-closing-in-theater-scene-or-cinema-screen.mp4,PT00H00M08S,193751_193800,Curtain closing in theater scene or cinema screen
17490028,https://ak.picdn.net/shutterstock/videos/17490028/preview/stock-footage-barcelona-spain-may-people-protest-regarding-the-pensions-in-placa-de-catalunya.mp4,PT00H00M19S,096101_096150,"Barcelona, spain - may 10, 2016: people protest regarding the pensions in placa de catalunya"
26613974,https://ak.picdn.net/shutterstock/videos/26613974/preview/stock-footage-fishermen-in-the-seaside.mp4,PT00H00M25S,094701_094750,Fishermen in the seaside
1012143857,https://ak.picdn.net/shutterstock/videos/1012143857/preview/stock-footage-view-of-the-museum-of-the-walls-in-rome-italy-video-by-gopro-camera.mp4,PT00H00M17S,183101_183150,"View of the museum of the walls in rome, italy. video by gopro camera"
1062361918,https://ak.picdn.net/shutterstock/videos/1062361918/preview/stock-footage-congo-republic-flag-on-a-white-chalkboard-with-luma-matte.mp4,PT00H00M26S,024351_024400,Congo republic flag on a white chalkboard with luma matte
1030483034,https://ak.picdn.net/shutterstock/videos/1030483034/preview/stock-footage-slow-motion-close-up-shot-of-five-months-baby-girl-sitting-outdoors-in-a-stroller-looking-at-the.mp4,PT00H00M14S,005751_005800,"Slow motion close-up shot of five months baby girl sitting outdoors in a stroller looking at the camera. look of the baby in the camera close up shot. concept of childhood, baby, children."
1865347,https://ak.picdn.net/shutterstock/videos/1865347/preview/stock-footage-orangutan-chewing-on-garbage-at-the-zoo.mp4,PT00H00M41S,134651_134700,Orangutan chewing on garbage at the zoo
17916487,https://ak.picdn.net/shutterstock/videos/17916487/preview/stock-footage-fit-mans-exercising-with-kettlebells-close-up.mp4,PT00H00M24S,112651_112700,"Fit mans exercising with kettlebells. close up.
"
1018036711,https://ak.picdn.net/shutterstock/videos/1018036711/preview/stock-footage-suburban-town-aerial.mp4,PT00H00M21S,037401_037450,Suburban town aerial 
