videoid,contentUrl,duration,page_dir,name
34482559,https://ak.picdn.net/shutterstock/videos/34482559/preview/stock-footage-bokeh-background-blinking-garland-multicolored-abstract-blurred-background.mp4,PT00H00M18S,024501_024550,Bokeh background. blinking garland multicolored abstract blurred background
1045544929,https://ak.picdn.net/shutterstock/videos/1045544929/preview/stock-footage-close-up-man-playing-bass-guitar-with-his-finger-in-the-club-with-neon-lights.mp4,PT00H00M10S,146301_146350,Close up man playing bass guitar with his finger in the club with neon lights.
1024914980,https://ak.picdn.net/shutterstock/videos/1024914980/preview/stock-footage-palmyra-syria-november-a-street-near-the-old-town-by-the-day-after-the-civil-war-in.mp4,PT00H00M41S,188051_188100,"Palmyra, syria - november, 2018: a street near the old town, by the day, after the civil war in syria."
1033879538,https://ak.picdn.net/shutterstock/videos/1033879538/preview/stock-footage--x-fps-very-nice-ink-abstract-psychedelic-paint-liquid-motion-background-texture-video.mp4,PT00H00M20S,074951_075000,1920x1080 25 fps. very nice ink abstract psychedelic paint liquid motion background texture video.
1047357256,https://ak.picdn.net/shutterstock/videos/1047357256/preview/stock-footage-kaleidoscopic-video-background-colorful-symmetric-patterns.mp4,PT00H00M14S,081151_081200,Kaleidoscopic video background. colorful symmetric patterns.
1033111007,https://ak.picdn.net/shutterstock/videos/1033111007/preview/stock-footage-attractive-young-girl-in-hipster-outfit-using-retro-camera-on-the-rooftop-in-the-old-part-of-the.mp4,PT00H00M37S,106501_106550,"Attractive young girl in hipster outfit using retro camera on the rooftop in the old part of the city of barcelona looking with friendly smile admiring the city, people lifestyle hobby, slow motion"
24971669,https://ak.picdn.net/shutterstock/videos/24971669/preview/stock-footage-yellow-twisted-sunburst-rotating-over-red-background-with-white-dots-pattern-seamless-loop-for-logo.mp4,PT00H00M15S,042201_042250,"Yellow twisted sunburst rotating over red background with white dots pattern seamless loop for logo or text. colorful cartoon retro pinwheel hypnotic swirl, yellow and red sunburst abstract background"
1023805384,https://ak.picdn.net/shutterstock/videos/1023805384/preview/stock-footage-artificial-intelligence-head-shape-on-digital-background-cybernetic-brain-and-deep-learning.mp4,PT00H00M15S,061751_061800,Artificial intelligence head shape on digital background. cybernetic brain and deep learning concept looping and seamless animation.
1044012541,https://ak.picdn.net/shutterstock/videos/1044012541/preview/stock-footage-dancing-waves-in-bahamas-with-overlooking-of-their-beautiful-white-sand-aerial-shot.mp4,PT00H00M08S,040201_040250,Dancing waves in bahamas with overlooking of their beautiful white sand - aerial shot
5903909,https://ak.picdn.net/shutterstock/videos/5903909/preview/stock-footage-brown-eyed-young-boy-with-freckles.mp4,PT00H00M18S,149501_149550,Brown eyed young boy with freckles
16133362,https://ak.picdn.net/shutterstock/videos/16133362/preview/stock-footage-pretty-girl-in-skirt-laughs-in-sunny-autumn-forest.mp4,PT00H00M12S,088901_088950,Pretty girl in skirt laughs in sunny autumn forest
1042162810,https://ak.picdn.net/shutterstock/videos/1042162810/preview/stock-footage-sunset-time-lapse-burn-clouds-after-rain-weather-beautiful-dark-evening-clean-skies-fast-moving.mp4,PT00H00M07S,171901_171950,"Sunset time lapse burn clouds after rain weather, beautiful dark evening clean skies, fast moving big mass, formating, building."
1029123143,https://ak.picdn.net/shutterstock/videos/1029123143/preview/stock-footage-fastener-word-cloud-animated-isolated.mp4,PT00H00M10S,125601_125650,Fastener word cloud animated isolated
31261816,https://ak.picdn.net/shutterstock/videos/31261816/preview/stock-footage-khao-kao-seng-next-to-samila-beach-songkhla-thailand-not-very-far-from-bangkok-and-phuket.mp4,PT00H00M13S,023101_023150,"Khao kao seng, next to samila beach, songkhla, thailand (not very far from bangkok and phuket )"
14150414,https://ak.picdn.net/shutterstock/videos/14150414/preview/stock-footage--k-ultra-hd-version-usa-aerial-view-of-central-park-new-york-city-shot-on-red-epic.mp4,PT00H00M20S,034501_034550,4k / ultra hd version usa aerial view of central park new york city shot on red epic
30202201,https://ak.picdn.net/shutterstock/videos/30202201/preview/stock-footage-artificial-waterfall-falls-into-the-lake.mp4,PT00H00M08S,087601_087650,Artificial waterfall falls into the lake
14596009,https://ak.picdn.net/shutterstock/videos/14596009/preview/stock-footage-abstract-background-with-animation-of-futuristic-shape-from-circles-with-light-flare-animation-of.mp4,PT00H00M20S,094051_094100,Abstract background with animation of futuristic shape from circles with light flare. animation of seamless loop.
1064388145,https://ak.picdn.net/shutterstock/videos/1064388145/preview/stock-footage-circa-in-this-musical-people-dance-to-a-live-hippie-band-at-a-grungy-club.mp4,PT00H01M28S,123801_123850,"Circa 1970 - in this musical, people dance to a live hippie band at a grungy club."
1046937112,https://ak.picdn.net/shutterstock/videos/1046937112/preview/stock-footage-mother-and-baby-on-the-summer-vacation.mp4,PT00H00M22S,027001_027050,Mother and baby on the summer vacation
13326377,https://ak.picdn.net/shutterstock/videos/13326377/preview/stock-footage-mimosa.mp4,PT00H00M20S,123101_123150,Mimosa 
1047811489,https://ak.picdn.net/shutterstock/videos/1047811489/preview/stock-footage-a-relaxed-young-brunette-woman-with-long-wavy-hair-in-a-black-bikini-sitting-in-a-round-hammock-in.mp4,PT00H00M17S,172551_172600,A relaxed young brunette woman with long wavy hair in a black bikini sitting in a round hammock in slow motion. 
1597114,https://ak.picdn.net/shutterstock/videos/1597114/preview/stock-footage-china-circa-wood-workers-craft-handmade-furniture.mp4,PT00H00M10S,048801_048850,China - circa 2010: wood workers craft handmade furniture.
1049639020,https://ak.picdn.net/shutterstock/videos/1049639020/preview/stock-footage-an-upwardly-mobile-asian-muslim-man-using-a-mobile-phone-to-pay-for-a-product-at-a-sale-terminal.mp4,PT00H00M12S,174251_174300,An upwardly mobile asian muslim man using a mobile phone to pay for a product at a sale terminal with nfc identification payment for verification and authentication
1056423275,https://ak.picdn.net/shutterstock/videos/1056423275/preview/stock-footage-circle-counting-down-clock-animation-video-footage-hours-clock-footage.mp4,PT00H00M15S,189201_189250,"Circle counting down clock animation video footage,12 hours clock footage"
16628263,https://ak.picdn.net/shutterstock/videos/16628263/preview/stock-footage-lincoln-england-mar-lincoln-england-cathedral-beautiful-inside-architecture-roman.mp4,PT00H00M29S,110201_110250,"Lincoln, england - mar 2016: lincoln england cathedral beautiful inside architecture. roman settlement in 48 ad. cathedral built in 1092. destination for tourists and visitors. historic buildings."
1028724092,https://ak.picdn.net/shutterstock/videos/1028724092/preview/stock-footage-red-sour-cherry-tree-branch.mp4,PT00H00M12S,027451_027500,Red sour cherry tree branch.
1042385407,https://ak.picdn.net/shutterstock/videos/1042385407/preview/stock-footage-sea-and-sandy-beach-in-dense-fog-autumn-day-foggy-and-windy-weather-at-nazare-portugal-wind-at.mp4,PT00H00M15S,149801_149850,"Sea and sandy beach in dense fog, autumn day. foggy and windy weather at nazare portugal. wind at atlantic ocean top view from observation deck"
5421167,https://ak.picdn.net/shutterstock/videos/5421167/preview/stock-footage-grasslands-plain-prairie-deer-aerial-view-of-grasslands-zooms-into-herd-of-deer-running-across.mp4,PT00H00M21S,118301_118350,Grasslands plain prairie deer. aerial view of grasslands zooms into herd of deer running across grassland.
1042435546,https://ak.picdn.net/shutterstock/videos/1042435546/preview/stock-footage-hawaii-usa-mountains-rising-from-a-body-of-water.mp4,PT00H00M05S,128601_128650,Hawaii usa-1959: mountains rising from a body of water
1019813281,https://ak.picdn.net/shutterstock/videos/1019813281/preview/stock-footage-close-up-of-beautiful-girl-face-in-glasses-outdoor.mp4,PT00H00M09S,094801_094850,"Close up of beautiful girl face in glasses, outdoor"
1059604904,https://ak.picdn.net/shutterstock/videos/1059604904/preview/stock-footage-circa-mq-reaper-aerial-drones-perform-touch-and-go-procedures-on-the-flight-line-at-creech.mp4,PT00H00M38S,107751_107800,"Circa 2020 - mq-9 reaper aerial drones perform touch and go procedures on the flight line at creech afb, nevada."
9349871,https://ak.picdn.net/shutterstock/videos/9349871/preview/stock-footage-animation-of-the-golden-earth-with-blue-sea-on-green-screen-background.mp4,PT00H00M10S,041001_041050,Animation of the golden earth with blue sea on green screen background
1041834505,https://ak.picdn.net/shutterstock/videos/1041834505/preview/stock-footage-graduation-cap-books-and-diploma-on-the-flag-higher-education-in-the-united-arab-emirates-uae.mp4,PT00H00M05S,035201_035250,"Graduation cap, books and diploma on the flag. higher education in the united arab emirates uae related conceptual 3d animation"
1012508417,https://ak.picdn.net/shutterstock/videos/1012508417/preview/stock-footage-traveler-walks-through-the-bilberry-glade-ukrainian-carpathians-air-video.mp4,PT00H00M14S,027901_027950,"Traveler walks through the bilberry glade, ukrainian carpathians, air video"
1035867272,https://ak.picdn.net/shutterstock/videos/1035867272/preview/stock-footage-slender-and-athletic-middle-aged-red-haired-woman-is-engaged-in-running-outdoors-slow-motion.mp4,PT00H00M20S,077101_077150,"Slender and athletic middle-aged red-haired woman is engaged in running outdoors ,slow motion"
17944333,https://ak.picdn.net/shutterstock/videos/17944333/preview/stock-footage-summer-vacation-woman-having-fun-on-beach-walking-relaxing-in-the-sun-wearing-bikini-and-aviator.mp4,PT00H00M44S,107401_107450,Summer vacation woman having fun on beach walking relaxing in the sun wearing bikini and aviator sunglasses
1037113082,https://ak.picdn.net/shutterstock/videos/1037113082/preview/stock-footage--beautiful-green-leaves-blowing-in-the-wind-green-environment-concept.mp4,PT00H00M15S,147851_147900, beautiful green leaves blowing in the wind.green environment concept.
1013508602,https://ak.picdn.net/shutterstock/videos/1013508602/preview/stock-footage-warsaw-poland-july-low-altitude-aerial-shot-of-aleje-jerozolimskie-majot-city-street.mp4,PT00H00M20S,119701_119750,"Warsaw, poland - july 5, 2018. low altitude aerial shot of aleje jerozolimskie, majot city street"
16905679,https://ak.picdn.net/shutterstock/videos/16905679/preview/stock-footage-looks-at-a-mirror-in-city-in-beauty-salon.mp4,PT00H00M06S,144801_144850,Looks at a mirror in city in beauty salon
29450266,https://ak.picdn.net/shutterstock/videos/29450266/preview/stock-footage-dev-rage-man-s-anger-in-front-of-a-code-programming-screen-fist-hitting-keyboard-html-php-css.mp4,PT00H00M09S,071301_071350,"Dev rage. man's anger in front of a code programming screen. fist hitting keyboard. html, php, css, c+ code tags."
1042983202,https://ak.picdn.net/shutterstock/videos/1042983202/preview/stock-footage-shenzhen-china-december-marathon-runners-running-on-the-race.mp4,PT00H00M11S,012351_012400,Shenzhen / china - december 15 2019: marathon runners running on the race.
16348633,https://ak.picdn.net/shutterstock/videos/16348633/preview/stock-footage-landscape-of-a-green-field-with-rice-stalks-swaying-in-the-wind-located-in-tai-dong-southwestern.mp4,PT00H00M12S,020701_020750,"Landscape of a green field with rice stalks swaying in the wind, located in tai dong, southwestern taiwan. 4k"
1008245542,https://ak.picdn.net/shutterstock/videos/1008245542/preview/stock-footage-flood-waters-under-stilt-house-in-a-street-village-close-up.mp4,PT00H00M23S,137101_137150,Flood waters under stilt house in a street village ( close up )
1059800174,https://ak.picdn.net/shutterstock/videos/1059800174/preview/stock-footage-double-exposure-of-abstract-human-face-in-medical-mask-and-molecule-atom-virus-or-bacteria.mp4,PT00H00M20S,104651_104700,"Double exposure of abstract human face in medical mask and molecule, atom, virus or bacteria. science research concept. animation loop."
1014957940,https://ak.picdn.net/shutterstock/videos/1014957940/preview/stock-footage-hands-of-lovers-close-up-caress-each-other.mp4,PT00H00M12S,081801_081850,Hands of lovers close-up caress each other.
18063472,https://ak.picdn.net/shutterstock/videos/18063472/preview/stock-footage-open-the-shells-for-cultured-pearl.mp4,PT00H01M00S,035051_035100,Open the shells for cultured pearl
1032943085,https://ak.picdn.net/shutterstock/videos/1032943085/preview/stock-footage-the-sea-waves-in-the-morning.mp4,PT00H00M20S,005301_005350,The sea waves in the morning
1033831457,https://ak.picdn.net/shutterstock/videos/1033831457/preview/stock-footage-mystical-aerial-lake-okareka-new-zealand-nature.mp4,PT00H00M16S,144301_144350,Mystical aerial lake okareka new zealand nature 06
1009300172,https://ak.picdn.net/shutterstock/videos/1009300172/preview/stock-footage-creative-group-discusses-ideas-in-a-stylish-bright-office-there-are-many-books-a-man-with-a-beard.mp4,PT00H00M08S,044051_044100,"Creative group discusses ideas in a stylish bright office, there are many books. a man with a beard is the head of a working creative group. male leader offers ideas. brainstorming in marketing agency"
11585147,https://ak.picdn.net/shutterstock/videos/11585147/preview/stock-footage-karlovy-vary-carlsbad-czech-republic-reflection-in-river-water-timelapse-k.mp4,PT00H00M12S,148251_148300,Karlovy vary (carlsbad ) czech republic. reflection in river water. timelapse. 4k.
1033570178,https://ak.picdn.net/shutterstock/videos/1033570178/preview/stock-footage-staghorn-coral-and-shoal-of-fish.mp4,PT00H00M13S,017551_017600,Staghorn coral and shoal of fish
1040590265,https://ak.picdn.net/shutterstock/videos/1040590265/preview/stock-footage-budapest-hungary-may-zoom-in-on-the-front-exterior-of-the-great-synagogue-in-budapest.mp4,PT00H00M06S,001901_001950,"Budapest, hungary- may, 26, 2019: zoom in on the front exterior of the great synagogue in budapest,
translation inscription reads: “and let them make me a sanctuary that i may dwell among them"""
1012770671,https://ak.picdn.net/shutterstock/videos/1012770671/preview/stock-footage-aerial-view-of-long-stretched-lake-in-germany.mp4,PT00H00M17S,180001_180050,Aerial view of long stretched lake in germany
1059197456,https://ak.picdn.net/shutterstock/videos/1059197456/preview/stock-footage-bidens-pilosa-flower-or-white-spanish-needle-macro-blooming-in-garden-nature-outdoor-background.mp4,PT00H00M20S,040551_040600,"Bidens pilosa flower or white spanish needle macro blooming in garden nature outdoor background	
"
23186626,https://ak.picdn.net/shutterstock/videos/23186626/preview/stock-footage-fine-ribbing-or-stockinette-stitch-knitting-work-close-up-k-p-fps-ultrahd-tilting-footage.mp4,PT00H00M06S,139651_139700,Fine ribbing or stockinette stitch knitting work close-up 4k 2160p 30fps ultrahd tilting footage - wool gray sweater details and knitwork slow tilt 3840x2160 uhd video
1062460426,https://ak.picdn.net/shutterstock/videos/1062460426/preview/stock-footage-the-sautadet-waterfalls-river-ceze-la-roque-sur-ceze-gard-department-occitanie-france.mp4,PT00H00M21S,138251_138300,"The sautadet waterfalls, river ceze, la roque sur ceze, gard department,occitanie, france"
1047609592,https://ak.picdn.net/shutterstock/videos/1047609592/preview/stock-footage-portrait-of-caucasian-handsome-happy-man-smiling-to-camera-and-posing-with-plastic-bag-full-of.mp4,PT00H00M08S,007701_007750,Portrait of caucasian handsome happy man smiling to camera and posing with plastic bag full of rubbish outdoor on summer day. male volunteer cleaning nature from trash. clean planet concept.
1056158984,https://ak.picdn.net/shutterstock/videos/1056158984/preview/stock-footage-coronavirus-or-covid-pandemic-in-infographic-design-of-algeria-algeria-map-with-flag-chart-and.mp4,PT00H00M10S,170751_170800,"Coronavirus or covid-19 pandemic in infographic design of algeria, algeria map with flag, chart and indicators shows the location of virus spreading, infographic design, 4k resolution"
1047561217,https://ak.picdn.net/shutterstock/videos/1047561217/preview/stock-footage-new-york-family-spinning-in-circles.mp4,PT00H00M05S,094551_094600,New york-1949: family spinning in circles
1059937730,https://ak.picdn.net/shutterstock/videos/1059937730/preview/stock-footage-man-hand-streached-in-the-air-towards-beautiful-beach-lifestyle-travel-and-harmony-nature-concept.mp4,PT00H00M15S,087701_087750,Man hand streached in the air towards beautiful beach. lifestyle travel and harmony nature concept
1018253680,https://ak.picdn.net/shutterstock/videos/1018253680/preview/stock-footage-milky-way-setting-over-lake-jindabyne-with-a-near-full-moon-illuminating-the-night.mp4,PT00H00M09S,019701_019750,Milky way setting over lake jindabyne with a near full moon illuminating the night
8987167,https://ak.picdn.net/shutterstock/videos/8987167/preview/stock-footage-rowan-berries-rowan-berries-covered-in-snow-at-wintertime.mp4,PT00H00M23S,045551_045600,"Rowan berries
rowan berries covered in snow at wintertime."
1015898761,https://ak.picdn.net/shutterstock/videos/1015898761/preview/stock-footage-blueprints-rolls-of-architectural-drawings-roulette-yardstick-folding-ruler-and-house-symbol.mp4,PT00H00M23S,185001_185050,"Blueprints - rolls of architectural drawings, roulette, yardstick - folding ruler and house symbol from a pack of yellow stickers smoothly rotate on the surface of the architectural drawings"
1019292955,https://ak.picdn.net/shutterstock/videos/1019292955/preview/stock-footage-autumn-morning.mp4,PT00H00M16S,000151_000200,Autumn morning 
3447164,https://ak.picdn.net/shutterstock/videos/3447164/preview/stock-footage-laysan-finch.mp4,PT00H00M09S,072501_072550,Laysan finch
23068120,https://ak.picdn.net/shutterstock/videos/23068120/preview/stock-footage-man-cleared-snow-from-the-sidewalk.mp4,PT00H00M25S,171051_171100,Man cleared snow from the sidewalk.
1031982242,https://ak.picdn.net/shutterstock/videos/1031982242/preview/stock-footage-field-of-green-and-organic-carrots-k.mp4,PT00H00M10S,172451_172500,Field of green and organic carrots. 4k
7598737,https://ak.picdn.net/shutterstock/videos/7598737/preview/stock-footage-brunette-girl-in-autumn-park-throws-in-the-upper-yellow-leaves.mp4,PT00H00M26S,043601_043650,Brunette girl in autumn park throws in the upper yellow leaves
22613962,https://ak.picdn.net/shutterstock/videos/22613962/preview/stock-footage-business-partners-enjoying-at-teamwork-in-the-rush-hour-outside.mp4,PT00H00M22S,171551_171600,Business partners enjoying at teamwork in the rush hour outside
34221073,https://ak.picdn.net/shutterstock/videos/34221073/preview/stock-footage-woman-is-stroking-by-hands-a-muzzle-of-red-dog-standing-outdoors-in-a-winter-day-on-a-snowy-ground.mp4,PT00H00M24S,190701_190750,"Woman is stroking by hands a muzzle of red dog standing outdoors in a winter day on a snowy ground, close-up"
1049604913,https://ak.picdn.net/shutterstock/videos/1049604913/preview/stock-footage-small-fire-into-some-wood-with-a-different-color.mp4,PT00H00M35S,077351_077400,Small fire into some wood with a different color
1021468798,https://ak.picdn.net/shutterstock/videos/1021468798/preview/stock-footage-emperor-penguin-chicks-on-the-ice.mp4,PT00H00M25S,095951_096000,Emperor penguin chicks on the ice
1006587463,https://ak.picdn.net/shutterstock/videos/1006587463/preview/stock-footage-beautiful-star-trails-time-lapse-over-the-hills-polar-north-star-at-the-center-of-rotation.mp4,PT00H00M11S,123151_123200,Beautiful star trails time-lapse over the hills. polar north star at the center of rotation. lateral light from the full moon on the chalk hills. 4k resolution.
26275481,https://ak.picdn.net/shutterstock/videos/26275481/preview/stock-footage-waves-in-lake-nemi.mp4,PT00H00M10S,083201_083250,Waves in lake nemi
1049336560,https://ak.picdn.net/shutterstock/videos/1049336560/preview/stock-footage-bandung-west-java-indonesia-may-th-established-shot-scenic-view-of-lembang-fault.mp4,PT00H00M08S,007651_007700,"Bandung, west java / indonesia - may 15th, 2019: established shot. scenic view of lembang fault from tebing keraton, bandung, west java, indonesia, asia"
1044663379,https://ak.picdn.net/shutterstock/videos/1044663379/preview/stock-footage-bucharest-romania-january-cars-at-triumphal-arch-in-city-center.mp4,PT00H00M05S,081201_081250,"Bucharest, romania - january 07, 2020: cars at triumphal arch in city center"
1057332040,https://ak.picdn.net/shutterstock/videos/1057332040/preview/stock-footage-girl-watches-movie-from-tablet-while-puppy-sleeps.mp4,PT00H00M15S,133401_133450,Girl watches movie from tablet while puppy sleeps.
1062436465,https://ak.picdn.net/shutterstock/videos/1062436465/preview/stock-footage-people-ski-touring-in-mountains-on-sunny-day-surrounded-by-snow.mp4,PT00H00M09S,078551_078600,People ski touring in mountains on sunny day surrounded by snow. 
1058837221,https://ak.picdn.net/shutterstock/videos/1058837221/preview/stock-footage-milan-italy-modern-architecture-in-the-new-business-center-of-milan-on-the-promenade.mp4,PT00H00M33S,076301_076350,"Milan, italy, 09.09.2020: modern architecture in the new business center of milan on the promenade of porta nova varezine. office buildings. piazza alvar aalto. milan italy cityscape. aerial footage"
7910260,https://ak.picdn.net/shutterstock/videos/7910260/preview/stock-footage-man-eating-big-delicious-hamburger-in-the-office-a-short-lunch-break-fast-food-static.mp4,PT00H00M14S,182201_182250,"Man eating big delicious hamburger in the office, a short lunch break, fast food, static"
1035713798,https://ak.picdn.net/shutterstock/videos/1035713798/preview/stock-footage-aerial-view-of-waterfall-in-green-rainforest.mp4,PT00H00M13S,056351_056400,Aerial view of waterfall in green rainforest
21722767,https://ak.picdn.net/shutterstock/videos/21722767/preview/stock-footage-german-bundesrat-government-flag-with-eagle-berlin-germany.mp4,PT00H00M18S,051301_051350,"German bundesrat government flag with eagle, berlin, germany"
1008357223,https://ak.picdn.net/shutterstock/videos/1008357223/preview/stock-footage-attractive-man-with-a-beard-sitting-on-the-floor-near-couch-at-home-and-working-on-the-laptop.mp4,PT00H00M19S,120551_120600,Attractive man with a beard sitting on the floor near couch at home and working on the laptop computer. inside
245032,https://ak.picdn.net/shutterstock/videos/245032/preview/stock-footage-art-sculpture-in-the-city.mp4,PT00H00M05S,012451_012500,Art sculpture in the city 2
1019434375,https://ak.picdn.net/shutterstock/videos/1019434375/preview/stock-footage-snow-flickers-is-turned-on-wind-large-snowflakes-against-the-background-of-the-black-sky.mp4,PT00H00M55S,127851_127900,"Snow flickers, is turned on wind. large snowflakes against the background of the black sky."
1032206759,https://ak.picdn.net/shutterstock/videos/1032206759/preview/stock-footage-beautiful-colorful-dianthus-flower-dianthus-chinensis-blooming-in-garden.mp4,PT00H00M10S,044601_044650,"Beautiful colorful dianthus flower (dianthus chinensis) blooming in garden
"
1045417804,https://ak.picdn.net/shutterstock/videos/1045417804/preview/stock-footage-san-francisco-california-view-of-sunset-in-snowy-mountain-on-typical-winter-day-amid-lush.mp4,PT00H00M05S,136651_136700,San francisco california-1953: view of sunset in snowy mountain on typical winter day amid lush nature
1009323653,https://ak.picdn.net/shutterstock/videos/1009323653/preview/stock-footage-circa-s-the-united-states-army-divers-school-trains-elite-specialist-divers.mp4,PT00H00M52S,186101_186150,Circa 1950s - the united states army divers school trains elite specialist divers
33426487,https://ak.picdn.net/shutterstock/videos/33426487/preview/stock-footage-furious-hairy-dog-biting-furious-hairy-dog-biting-a-sleeve-slow-motion.mp4,PT00H00M15S,122601_122650,"Furious hairy dog biting. furious hairy dog biting a sleeve, slow motion."
1029053969,https://ak.picdn.net/shutterstock/videos/1029053969/preview/stock-footage-boat-on-lake-teletskoye-altai.mp4,PT00H00M11S,122401_122450,"Boat on lake teletskoye, altai"
10348448,https://ak.picdn.net/shutterstock/videos/10348448/preview/stock-footage-blonde-girl-in-pink-swimsuit-sits-in-sea-basks-in-sun-then-feels-cold-against-playing-guitarist-at.mp4,PT00H00M27S,116551_116600,Blonde girl in pink swimsuit sits in sea basks in sun then feels cold against playing guitarist at low tide
31811707,https://ak.picdn.net/shutterstock/videos/31811707/preview/stock-footage-flight-over-forest-in-mountains.mp4,PT00H00M22S,105501_105550,Flight over forest in mountains
11193707,https://ak.picdn.net/shutterstock/videos/11193707/preview/stock-footage-door-to-elevator-opens-and-closes-k.mp4,PT00H00M13S,030451_030500,Door to elevator opens and closes 4k
1049369092,https://ak.picdn.net/shutterstock/videos/1049369092/preview/stock-footage-beautiful-sunlight-on-the-wavy-fields-near-kunkovice-village-with-idyllic-rural-landscape-with-an.mp4,PT00H00M12S,030301_030350,"Beautiful sunlight on the wavy fields near kunkovice village with idyllic rural landscape with an old mill. south moravia, czech republic."
8410087,https://ak.picdn.net/shutterstock/videos/8410087/preview/stock-footage-teenager-harvesting-chili-peppers-from-a-home-garden.mp4,PT00H00M21S,120651_120700,Teenager harvesting chili peppers from a home garden
15235384,https://ak.picdn.net/shutterstock/videos/15235384/preview/stock-footage-financial-business-or-scientific-figures-loop-k-ultra-hd.mp4,PT00H00M20S,021801_021850,"Financial, business or scientific figures, loop, 4k - ultra hd."
