videoid,contentUrl,duration,page_dir,name
1027153001,https://ak.picdn.net/shutterstock/videos/1027153001/preview/stock-footage-pumpkin-on-the-farm-black-chickens-eat-grass.mp4,PT00H00M05S,146601_146650,Pumpkin on the farm. black chickens eat grass.
29960518,https://ak.picdn.net/shutterstock/videos/29960518/preview/stock-footage-low-angle-fast-flying-forward-over-salt-lake-at-colorful-sunset.mp4,PT00H00M08S,116351_116400,Low angle fast flying forward over salt lake at colorful sunset.
23889244,https://ak.picdn.net/shutterstock/videos/23889244/preview/stock-footage-decor-picture-frame-and-pen-colors-handmade-design-studio-slow-motion.mp4,PT00H00M21S,075601_075650,Decor picture frame and pen colors. handmade. design studio. slow motion.
34143625,https://ak.picdn.net/shutterstock/videos/34143625/preview/stock-footage-happy-birthday-cake-with-sparklers.mp4,PT00H00M20S,107451_107500,Happy birthday cake with sparklers
22156369,https://ak.picdn.net/shutterstock/videos/22156369/preview/stock-footage-aerial-ruins-of-old-mill-or-small-hydroelectric-power-stations.mp4,PT00H00M26S,035401_035450,Aerial. ruins of  old mill or small hydroelectric power stations. 
11367359,https://ak.picdn.net/shutterstock/videos/11367359/preview/stock-footage-vj-abstract-neon-bright-mosaic-animated-background-animation-background-with-lines-and-sparkles.mp4,PT00H00M12S,012351_012400,Vj abstract neon bright mosaic. animated background. animation background with lines and sparkles. seamless loop. seamless loop. more videos in my portfolio.
33387304,https://ak.picdn.net/shutterstock/videos/33387304/preview/stock-footage-beautiful-female-city-worker-takes-a-phone-call-at-her-desk-in-a-busy-office.mp4,PT00H00M14S,026651_026700,Beautiful female city worker takes a phone call at her desk in a busy office
1009577270,https://ak.picdn.net/shutterstock/videos/1009577270/preview/stock-footage-dad-stroking-sleeping-daughter-head-with-love-family-connection-love-to-child.mp4,PT00H00M18S,003351_003400,"Dad stroking sleeping daughter head with love, family connection, love to child"
21548509,https://ak.picdn.net/shutterstock/videos/21548509/preview/stock-footage-filigree-jeweler-s-working-hands.mp4,PT00H00M13S,182451_182500,Filigree jeweler's working hands
1012860845,https://ak.picdn.net/shutterstock/videos/1012860845/preview/stock-footage-aerial-shot-of-fields-full-of-weeds-just-before-harvesting.mp4,PT00H00M26S,073151_073200,Aerial shot of fields full of weeds just before harvesting.
1055292743,https://ak.picdn.net/shutterstock/videos/1055292743/preview/stock-footage-junior-students-in-casual-clothes-with-schoolbags-run-to-school-building-on-summer-day-backside.mp4,PT00H00M10S,035001_035050,Junior students in casual clothes with schoolbags run to school building on summer day backside close view slow motion
10504529,https://ak.picdn.net/shutterstock/videos/10504529/preview/stock-footage-mandalay-myanmar-may-ritual-commences-every-morning-at-am-when-monks-wash-the-face-and.mp4,PT00H00M11S,023051_023100,"Mandalay, myanmar - may 19 : ritual commences every morning at 4 am when monks wash the face and brush the teeth of the buddha image at maha myat muni paya on may 19. 2015 in mandalay, myanmar"
1054213124,https://ak.picdn.net/shutterstock/videos/1054213124/preview/stock-footage-mumbai-india-mar-interior-view-inside-international-terminal-in-daytime-without.mp4,PT00H00M15S,149351_149400,"Mumbai, india - mar 04, 2020 : interior view inside international terminal in daytime without people due to coronavirus outbreak cove-19 crisis.phuket airport closed"
33035308,https://ak.picdn.net/shutterstock/videos/33035308/preview/stock-footage-green-cactus-with-sharp-needles-and-pink-purple-flower-spins-on-green-background-concept-of-cactus.mp4,PT00H00M17S,194301_194350,Green cactus with sharp needles and pink purple flower spins on green background. concept of cactus protection from electro-radiation in office on workplace with pc or laptop
1009576757,https://ak.picdn.net/shutterstock/videos/1009576757/preview/stock-footage-a-business-team-of-mixed-gender-and-ethnicity-taking-an-important-and-critical-financial-decision.mp4,PT00H00M15S,042101_042150,A business team of mixed gender and ethnicity taking an important and critical financial decision in a conference meeting. a serious and focused creative office workers interacting on upcoming project
1021571959,https://ak.picdn.net/shutterstock/videos/1021571959/preview/stock-footage-bees-on-flowers.mp4,PT00H00M08S,000901_000950,Bees on flowers
26460668,https://ak.picdn.net/shutterstock/videos/26460668/preview/stock-footage-production-line-in-the-print-shop.mp4,PT00H00M20S,060501_060550,"Production line in the print shop
"
1038542051,https://ak.picdn.net/shutterstock/videos/1038542051/preview/stock-footage-istanbul-june-fooatage-of-people-walking-to-passport-control-on-moving-walkways-at.mp4,PT00H00M17S,144301_144350,"Istanbul - june 6, 2019: fooatage of people walking to passport control on moving walkways at istanbul new airport. camera moves forward."
1021850887,https://ak.picdn.net/shutterstock/videos/1021850887/preview/stock-footage-circle-of-white-flowers-of-a-blossom-sweet-cherry-tree-and-sky-close-up.mp4,PT00H00M17S,012201_012250,Circle of white flowers of a blossom sweet cherry tree and sky - close up
15309250,https://ak.picdn.net/shutterstock/videos/15309250/preview/stock-footage-flames-burning-in-the-bonfire.mp4,PT00H00M22S,016551_016600,Flames burning in the bonfire
1032991337,https://ak.picdn.net/shutterstock/videos/1032991337/preview/stock-footage-portrait-of-bride-in-a-wreath-of-lavender-in-the-rays-of-the-sunset-sun.mp4,PT00H00M20S,195451_195500,Portrait of bride in a wreath of lavender in the rays of the sunset sun
1012962233,https://ak.picdn.net/shutterstock/videos/1012962233/preview/stock-footage-common-tern-sterna-hirundo.mp4,PT00H00M24S,087701_087750,Common tern (sterna hirundo)
27622417,https://ak.picdn.net/shutterstock/videos/27622417/preview/stock-footage-on-the-old-road-in-slow-mo-p-fullhd-footage-outdoor-walking-pov-scene-x-hd-video.mp4,PT00H00M09S,070051_070100,On  the old road in slow-mo 1080p fullhd footage - outdoor walking pov scene 1920x1080 hd video
11587730,https://ak.picdn.net/shutterstock/videos/11587730/preview/stock-footage-aerial-shot-across-beach-and-play-ground.mp4,PT00H00M05S,018701_018750,Aerial shot across beach and play ground
1026723935,https://ak.picdn.net/shutterstock/videos/1026723935/preview/stock-footage-different-form-details-on-high-speed-conveyor-belt-under-automatic-test-set-with-lens-scanning.mp4,PT00H00M12S,035051_035100,Different form details on high speed conveyor belt under automatic test set with lens scanning. computer-aided quality system with scanner controlling properties of items on transporter. scanning unit
11382098,https://ak.picdn.net/shutterstock/videos/11382098/preview/stock-footage-zrmanja-is-a-river-in-southern-lika-and-northern-dalmatia-croatia-it-is-km-long-and-its-basin.mp4,PT00H00M30S,006251_006300,"Zrmanja is a river in southern lika and northern dalmatia, croatia. it is 69 km long and its basin covers an area of 907 km2."
16738579,https://ak.picdn.net/shutterstock/videos/16738579/preview/stock-footage-empty-plastic-bottles-for-water-are-moving-on-the-conveyor.mp4,PT00H00M23S,101451_101500,Empty plastic bottles for water are moving on the conveyor
1063425307,https://ak.picdn.net/shutterstock/videos/1063425307/preview/stock-footage-aerial-drone-video-of-beautiful-sandy-beach-of-agia-eleni-next-to-famous-banana-beach-skiathos.mp4,PT00H00M06S,083401_083450,"Aerial drone video of beautiful sandy beach of agia eleni next to famous banana beach, skiathos island, sporades, greece"
32511628,https://ak.picdn.net/shutterstock/videos/32511628/preview/stock-footage-fire-flame-close-up-loopable-closeup-of-fire-burning-on-black-background-in-slow-motion.mp4,PT00H00M14S,146601_146650,Fire flame close up loopable. closeup of fire burning on black background in slow motion. 
1025816408,https://ak.picdn.net/shutterstock/videos/1025816408/preview/stock-footage-ancient-city-nemi-near-a-rome-aerial-footage-of-old-city-in-europe-village-in-the-mountains-of.mp4,PT00H00M06S,039701_039750,Ancient city nemi near a rome. aerial footage of old city in europe. village in the mountains of italy.
1041133684,https://ak.picdn.net/shutterstock/videos/1041133684/preview/stock-footage-brilliant-copper-and-emerald-green-abstract-paint-movement-macro-motion-of-fluids.mp4,PT00H00M20S,195001_195050,Brilliant copper and emerald green. abstract paint movement. macro motion of fluids
1017434923,https://ak.picdn.net/shutterstock/videos/1017434923/preview/stock-footage-businessman-walking-towards-camera-with-friend-country-flags-pin-romania-saint-vincent-and-the.mp4,PT00H00M10S,183051_183100,Businessman walking towards camera with friend country flags pin romania - saint vincent and the grenadines
21975334,https://ak.picdn.net/shutterstock/videos/21975334/preview/stock-footage-black-drops-black-ink-dropped-on-white-plane-isolated-black-ink-droplets-fall-on-white-paper-close.mp4,PT00H00M26S,027701_027750,"Black drops black ink dropped on white plane, isolated black ink droplets fall on white paper close up. abstract creative background shoot. dripping black drops on white background."
29149312,https://ak.picdn.net/shutterstock/videos/29149312/preview/stock-footage-alligator.mp4,PT00H00M26S,105701_105750,Alligator
3535679,https://ak.picdn.net/shutterstock/videos/3535679/preview/stock-footage-young-businesswoman-working-with-documents-on-terrace.mp4,PT00H00M17S,068901_068950,"Young businesswoman working with documents on terrace
"
1040259755,https://ak.picdn.net/shutterstock/videos/1040259755/preview/stock-footage-slow-motion-bottom-shot-of-a-big-fish-swimming-underwater-against-the-light.mp4,PT00H00M09S,129451_129500,Slow motion bottom shot of a big fish swimming underwater against the light
1053563015,https://ak.picdn.net/shutterstock/videos/1053563015/preview/stock-footage-aerial-tilt-fresh-organic-barley-field-during-sunset-selective-focus.mp4,PT00H00M05S,109801_109850,Aerial tilt fresh organic barley field during sunset. selective focus.
27714268,https://ak.picdn.net/shutterstock/videos/27714268/preview/stock-footage-launching-of-a-merchant-ship-in-honor-of-hollywood-film-actress-carole-lombard-also-seen-clark.mp4,PT00H00M50S,107801_107850,"Launching of a merchant ship in honor of hollywood film actress carole lombard, also seen clark gable, her husband, robert montgomery, and irene dunne, honoring carole who was killed in a plane crash"
1024875314,https://ak.picdn.net/shutterstock/videos/1024875314/preview/stock-footage-road-to-kissamou-crete-greek-islands-greece-europe.mp4,PT00H00M25S,075651_075700,"Road to kissamou, crete, greek islands, greece, europe"
1028888828,https://ak.picdn.net/shutterstock/videos/1028888828/preview/stock-footage-dushanbe-tajikistan-august-rudaki-park-and-national-library-dushanbe-tajikistan.mp4,PT00H00M14S,043001_043050,"Dushanbe, tajikistan - august, 12, 2018: rudaki park and national library, dushanbe, tajikistan, central asia."
3239011,https://ak.picdn.net/shutterstock/videos/3239011/preview/stock-footage-led-video-light.mp4,PT00H00M13S,086101_086150,Led video light
1051398694,https://ak.picdn.net/shutterstock/videos/1051398694/preview/stock-footage-the-driver-is-honing-the-car-horn-coming-out-with-a-steering-wheel-a-lot-of-cars-are-invaded-on-a.mp4,PT00H00M08S,053901_053950,The driver is honing the car horn coming out with a steering wheel. a lot of cars are invaded on a traffic jam.
21771256,https://ak.picdn.net/shutterstock/videos/21771256/preview/stock-footage--k-business-people-talking-as-they-walk-through-lobby-of-office-building-uk-oct.mp4,PT00H00M29S,149951_150000,4k business people talking as they walk through lobby of office building (uk-oct 2016)
1038840722,https://ak.picdn.net/shutterstock/videos/1038840722/preview/stock-footage-seascape-by-the-sea-tide-of-waves.mp4,PT00H00M57S,199001_199050,Seascape by the sea tide of waves
799600,https://ak.picdn.net/shutterstock/videos/799600/preview/stock-footage-green-field-two-trees-and-white-clouds-flying-on-blue-sky-time-lapse-background.mp4,PT00H00M21S,019201_019250,"Green field, two trees and white clouds flying on blue sky - time-lapse background"
1010606963,https://ak.picdn.net/shutterstock/videos/1010606963/preview/stock-footage-man-stretching-legs-jogging-along-riverbank.mp4,PT00H00M17S,091601_091650,"Man stretching legs, jogging along riverbank."
4749446,https://ak.picdn.net/shutterstock/videos/4749446/preview/stock-footage-attractive-asian-woman-shot-in-studio-and-isolated-on-a-white-background.mp4,PT00H00M17S,126951_127000,Attractive asian woman shot in studio and isolated on a white background
1027832651,https://ak.picdn.net/shutterstock/videos/1027832651/preview/stock-footage-close-up-shot-of-a-man-cutting-bitter-gourd-from-mid-and-slicing-the-pieces-on-a-wooden-chopping.mp4,PT00H00M25S,191651_191700,Close up shot of a man cutting bitter gourd from mid and slicing the pieces on a wooden chopping board
1008727637,https://ak.picdn.net/shutterstock/videos/1008727637/preview/stock-footage-snow-falling-in-a-british-garden-with-furniture-and-wheelie-bins.mp4,PT00H00M14S,129651_129700,Snow falling in a british garden with furniture and wheelie bins
1029414728,https://ak.picdn.net/shutterstock/videos/1029414728/preview/stock-footage-black-and-white-video-with-wrist-watch-time-lapse-close-up.mp4,PT00H00M33S,073301_073350,Black and white video with wrist watch time lapse close up.
1030593977,https://ak.picdn.net/shutterstock/videos/1030593977/preview/stock-footage-cesky-krumlov-city-time-lapse-during-rainy-day-late-time-who-the-city-is-visible-show-open-public.mp4,PT00H00M55S,113551_113600,Cesky krumlov city time lapse during rainy day late time who the city is visible show open public lights.
5922200,https://ak.picdn.net/shutterstock/videos/5922200/preview/stock-footage-a-man-with-an-anonymous-v-for-vendetta-mask-with-intentional-broken-tv-and-video-static-vintage.mp4,PT00H00M31S,099851_099900,"A man with an anonymous v for vendetta mask with intentional broken tv and video static
vintage style."
1499132,https://ak.picdn.net/shutterstock/videos/1499132/preview/stock-footage-wildebeest-are-gathered-on-an-open-plain.mp4,PT00H00M35S,117401_117450,Wildebeest are gathered on an open plain.
1053848642,https://ak.picdn.net/shutterstock/videos/1053848642/preview/stock-footage-modern-apartment-building-with-green-landscape-in-vancouver-british-columbia-canada.mp4,PT00H00M21S,116901_116950,"Modern apartment building with green landscape in vancouver, british columbia, canada."
5305382,https://ak.picdn.net/shutterstock/videos/5305382/preview/stock-footage--udaipur-rajasthan-india-an-indian-woman-wearing-a-red-sari-with-a-bunch-of-grass-on.mp4,PT00H00M18S,092051_092100,"25/11/13- udaipur, rajasthan, india- an indian woman wearing a red sari with a bunch of grass on her head walking through a gate and past the camera on a footbridge over lake pichola"
9907010,https://ak.picdn.net/shutterstock/videos/9907010/preview/stock-footage-lady-whipping-hair-back-girl-pulling-hair-into-ponytail-in-mirror-woman-in-dark-bedroom-in-k.mp4,PT00H00M15S,090251_090300,Lady whipping hair back - girl pulling hair into ponytail in mirror - woman in dark bedroom in 4k
1012620521,https://ak.picdn.net/shutterstock/videos/1012620521/preview/stock-footage-the-clear-sky-with-a-cloud.mp4,PT00H00M15S,089151_089200,The clear sky with a cloud
1009745456,https://ak.picdn.net/shutterstock/videos/1009745456/preview/stock-footage-aerial-view-sunrise-over-london-skyline-from-houses-of-parliament-river-thames-to-hyde-park-england.mp4,PT00H00M19S,110601_110650,Aerial view sunrise over london skyline from houses of parliament river thames to hyde park england united kingdom red weapon
1034101205,https://ak.picdn.net/shutterstock/videos/1034101205/preview/stock-footage-slow-motion-macro-close-up-of-a-child-s-bright-blue-eyes.mp4,PT00H00M07S,027751_027800,"Slow motion macro close up of a child's bright, blue eyes"
1035616079,https://ak.picdn.net/shutterstock/videos/1035616079/preview/stock-footage-animation-word-sale-marketing-concept.mp4,PT00H00M15S,116701_116750,"Animation word sale,  marketing concept"
1011992846,https://ak.picdn.net/shutterstock/videos/1011992846/preview/stock-footage-the-ancient-lighthouse-in-sevastopol-crimea.mp4,PT00H00M24S,186251_186300,"The ancient lighthouse in sevastopol, crimea."
1052487106,https://ak.picdn.net/shutterstock/videos/1052487106/preview/stock-footage-dramatic-cloudy-sky-dark-rainstorm-clouds-moving-with-sun-rays-shining-throw-scenic-cloudscape.mp4,PT00H00M10S,053651_053700,"Dramatic cloudy sky, dark rainstorm clouds moving with sun rays shining throw , scenic cloudscape, natural background"
28279354,https://ak.picdn.net/shutterstock/videos/28279354/preview/stock-footage-baby-not-on-bad-mood-on-the-bed-japanese-baby-months-old.mp4,PT00H00M55S,061151_061200,Baby not on bad mood on the bed / japanese baby 7 months old
1036245515,https://ak.picdn.net/shutterstock/videos/1036245515/preview/stock-footage-woman-tourist-take-photo-on-cellphone-and-visit-old-landmark-in-hong-kong.mp4,PT00H00M11S,095601_095650,Woman tourist take photo on cellphone and visit old landmark in hong kong
1051026583,https://ak.picdn.net/shutterstock/videos/1051026583/preview/stock-footage-young-man-is-sitting-on-stairs-with-loudspeaker-man-is-holding-sign-you-need-job-unemployment.mp4,PT00H00M13S,022301_022350,"Young man is sitting on stairs with loudspeaker,man is holding sign ,you need job, unemployment.banner for job search.concept of global financial crisis and inflation. poverty,4k"
31314718,https://ak.picdn.net/shutterstock/videos/31314718/preview/stock-footage-mobile-payment-animated-word-cloud-text-design-animation.mp4,PT00H00M26S,028651_028700,"Mobile payment animated word cloud, text design animation."
17583967,https://ak.picdn.net/shutterstock/videos/17583967/preview/stock-footage-close-up-shot-of-nephew-and-uncle-playing-games-on-a-cell-phone.mp4,PT00H00M29S,025351_025400,Close up shot of nephew and uncle playing games on a cell phone
1060048736,https://ak.picdn.net/shutterstock/videos/1060048736/preview/stock-footage-amazing-visual-show-view-experience-flight-hot-air-balloons-in-cappadocia-k.mp4,PT00H00M11S,147851_147900,"Amazing visual show, view, experience. flight hot air balloons in cappadocia 4k"
1038797318,https://ak.picdn.net/shutterstock/videos/1038797318/preview/stock-footage-a-bird-s-eye-view-of-beautiful-portuguese-beaches-and-coastline-with-clear-water-algarve.mp4,PT00H00M15S,122501_122550,A bird's eye view of beautiful portuguese beaches and coastline with clear water. algarve.
1030223462,https://ak.picdn.net/shutterstock/videos/1030223462/preview/stock-footage-young-handsome-hipster-male-riding-modern-custom-motorcycle-racer-on-the-black-sand-beach-near-the.mp4,PT00H00M11S,099101_099150,Young handsome hipster male riding modern custom motorcycle racer on the black sand beach near the water. adventure travel concept. surfing spot with ocean waves. aerial drone shot
3024721,https://ak.picdn.net/shutterstock/videos/3024721/preview/stock-footage-asian-small-clawed-otter-aonyx-cinerea-eating-oriental-small-clawed-otters-are-the-smallest-of.mp4,PT00H00M09S,149851_149900,Asian small-clawed otter (aonyx cinerea) eating.  oriental small-clawed otters are the smallest of all otters in the world.
1052294695,https://ak.picdn.net/shutterstock/videos/1052294695/preview/stock-footage-lusaka-zambia-africa-african-children-cheering-in-village.mp4,PT00H00M08S,050751_050800,"Lusaka, zambia, africa, 04.21.2018, african children cheering in village"
1051650796,https://ak.picdn.net/shutterstock/videos/1051650796/preview/stock-footage-baby-birds-are-playing-in-the-rain-the-plumage-feather-is-wet-soaked-with-water-droplets.mp4,PT00H00M23S,106501_106550,Baby birds are playing in the rain. the plumage feather is wet soaked with water droplets.
1056214469,https://ak.picdn.net/shutterstock/videos/1056214469/preview/stock-footage-sweet-sorbet-with-peanuts-on-a-dark-background-close-up.mp4,PT00H00M19S,133301_133350,Sweet sorbet with peanuts on a dark background close up
1042467304,https://ak.picdn.net/shutterstock/videos/1042467304/preview/stock-footage-symbol-tint-is-knitted-from-a-woolen-thread-knit-like-a-sweater.mp4,PT00H00M15S,039451_039500,Symbol tint is knitted from a woolen thread. knit like a sweater
1054575728,https://ak.picdn.net/shutterstock/videos/1054575728/preview/stock-footage-group-of-lovely-bunny-easter-fluffy-rabbits-eating-food-vegetables-carrots-on-light-blue.mp4,PT00H00M17S,195451_195500,"Group of lovely bunny easter fluffy rabbits eating food, vegetables, carrots on light blue background, 1 month old rabbits. selective focus. animal concept."
32014240,https://ak.picdn.net/shutterstock/videos/32014240/preview/stock-footage-french-fries-are-deep-fried-at-fast-food-restaurant.mp4,PT00H00M15S,037901_037950,French fries are deep fried at fast food restaurant
1066656304,https://ak.picdn.net/shutterstock/videos/1066656304/preview/stock-footage-putting-cardboard-house-icon-with-national-flag-of-norway-real-estate-market-concept.mp4,PT00H00M05S,000051_000100,Putting cardboard house icon with national flag of norway. real estate market concept
31447537,https://ak.picdn.net/shutterstock/videos/31447537/preview/stock-footage-movie-playing-inside-virtual-reality-device.mp4,PT00H00M16S,048851_048900,Movie playing inside virtual reality device
25716773,https://ak.picdn.net/shutterstock/videos/25716773/preview/stock-footage-sailing-vessel-is-leaving-port-during-a-beautiful-sunset-the-ship-is-heading-to-sea-high-quality.mp4,PT00H00M20S,032401_032450,Sailing vessel is leaving port during a beautiful sunset. the ship is heading to sea. high quality 4k footage.
1016203249,https://ak.picdn.net/shutterstock/videos/1016203249/preview/stock-footage-glasses-and-lavender-focus.mp4,PT00H00M07S,021851_021900,Glasses and lavender focus
1018157854,https://ak.picdn.net/shutterstock/videos/1018157854/preview/stock-footage-little-blind-newborn-puppy-in-the-hands-of-a-man-near-runs-mom-of-puppy.mp4,PT00H00M08S,064951_065000,Little blind newborn puppy in the hands of a man. near runs mom of puppy
13749752,https://ak.picdn.net/shutterstock/videos/13749752/preview/stock-footage-aerial-view-of-a-solitary-rock-formation-in-the-namib-desert-namibia.mp4,PT00H01M00S,134501_134550,"Aerial view of a solitary rock formation in the namib desert, namibia"
1013447273,https://ak.picdn.net/shutterstock/videos/1013447273/preview/stock-footage-kyiv-ukraine-february-fashion-catwalk-at-fashion-show-in-which-models-are-showing.mp4,PT00H00M42S,197601_197650,"Kyiv, ukraine – february 5, 2017. fashion: catwalk at fashion show in which models are showing off new clothes. model.  model business. slow motion"
1035498824,https://ak.picdn.net/shutterstock/videos/1035498824/preview/stock-footage-vietnamese-flag-fly-over-imperial-city-building-hue-vietnam-national-flag-night-time-with-lights.mp4,PT00H00M23S,110851_110900,"Vietnamese flag fly over imperial city building, hue, vietnam. national flag night time with lights color changing illumination, low angle from citadel square. "
1017083176,https://ak.picdn.net/shutterstock/videos/1017083176/preview/stock-footage-donau-eschingen-baden-w-rttemberg-germany-august-camera-tilts-down-from-the-st.mp4,PT00H00M14S,042301_042350,"Donau eschingen, baden-württemberg, germany, august 18. 2018, camera tilts down from the st. johann church to the statue ""mother baar"" and then the donauquelle (danube source)."
1014285446,https://ak.picdn.net/shutterstock/videos/1014285446/preview/stock-footage-electronics-and-personal-gadgets-concept-young-woman-reading-information-on-her-tablet-computer-in.mp4,PT00H00M10S,170101_170150,Electronics and personal gadgets concept. young woman reading information on her tablet computer in white interior
5152064,https://ak.picdn.net/shutterstock/videos/5152064/preview/stock-footage-tower-cranes-on-the-construction-of-high-rise-buildings-time-lapse.mp4,PT00H00M10S,126101_126150,Tower cranes on the construction of high-rise buildings time lapse
1012003409,https://ak.picdn.net/shutterstock/videos/1012003409/preview/stock-footage-rotation-of-a-light-source-in-a-frame.mp4,PT00H00M21S,120801_120850,Rotation of a light source in a frame
15897577,https://ak.picdn.net/shutterstock/videos/15897577/preview/stock-footage-abstract-background-with-animation-moving-of-lines-for-fiber-optic-network-magic-flickering-dots.mp4,PT00H00M20S,111901_111950,Abstract background with animation moving of lines for fiber optic network. magic flickering dots or glowing flying lines. animation of seamless loop.
1050088675,https://ak.picdn.net/shutterstock/videos/1050088675/preview/stock-footage-men-s-hands-are-using-water-to-wash-their-hands-for-cleanliness.mp4,PT00H00M19S,138301_138350,Men's hands are using water to wash their hands for cleanliness.
1037887034,https://ak.picdn.net/shutterstock/videos/1037887034/preview/stock-footage-chess-game-against-flags-of-france-and-italy-political-competition-related-d-animation.mp4,PT00H00M05S,138701_138750,Chess game against flags of france and italy. political competition related 3d animation
1028673425,https://ak.picdn.net/shutterstock/videos/1028673425/preview/stock-footage-house-reveal-from-tree-day-time.mp4,PT00H00M08S,118501_118550,House reveal from tree day time
35005636,https://ak.picdn.net/shutterstock/videos/35005636/preview/stock-footage-famous-sheikh-zayed-grand-mosque-at-night-in-abu-dhabi-as-travel-destination.mp4,PT00H00M22S,032351_032400,Famous sheikh zayed grand mosque at night in abu dhabi as travel destination
1042178872,https://ak.picdn.net/shutterstock/videos/1042178872/preview/stock-footage-water-treatment-plant-close-to-riotinto-river-aerial-shot.mp4,PT00H00M16S,002751_002800,Water treatment plant close to riotinto river aerial shot
