videoid,contentUrl,duration,page_dir,name
1021625944,https://ak.picdn.net/shutterstock/videos/1021625944/preview/stock-footage-sad-woman-looking-at-camera-autumn-depression-life-difficulties-problems.mp4,PT00H00M10S,190151_190200,"Sad woman looking at camera, autumn depression, life difficulties, problems"
17010094,https://ak.picdn.net/shutterstock/videos/17010094/preview/stock-footage-young-girl-makes-selfie-in-store.mp4,PT00H00M15S,015601_015650,Young girl makes selfie in store
1016192275,https://ak.picdn.net/shutterstock/videos/1016192275/preview/stock-footage-derelict-building-interior-ground-floor-panning-shot-lisbon-portugal-august-the.mp4,PT00H00M14S,020701_020750,"Derelict building interior ground floor panning shot. lisbon, portugal - 20 august 2018; the panoramic restaurant of monsanto has now been abandoned for more than 10 years. "
1009433255,https://ak.picdn.net/shutterstock/videos/1009433255/preview/stock-footage-a-girl-ghost-like-in-japanese-horror-movies-halloween-witch-render-d.mp4,PT00H00M07S,054501_054550,"A girl ghost like in japanese horror movies, halloween witch , render 3d"
20224249,https://ak.picdn.net/shutterstock/videos/20224249/preview/stock-footage-throwing-colorful-chocolate-rice-balls-on-dish-with-biscuits-desserts.mp4,PT00H00M06S,190151_190200,Throwing colorful chocolate rice balls on dish with biscuits desserts
13169477,https://ak.picdn.net/shutterstock/videos/13169477/preview/stock-footage-fenghuang-china-september-kentucky-fried-chicken-kfc-fast-food-restaurant-on-september.mp4,PT00H00M09S,051201_051250,"Fenghuang, china - september,2014: kentucky fried chicken (kfc) fast food restaurant on september, 2014 in fenghuang, china. kfc is the world's largest fried chicken chain with 17,000 stores globally."
4715639,https://ak.picdn.net/shutterstock/videos/4715639/preview/stock-footage-meat-savory-grilled-beef-fillet-mignon-served-on-red-plate-with-chili-pepper-and-tomatoes.mp4,PT00H00M15S,079201_079250,Meat savory : grilled beef fillet mignon served on red plate with chili pepper and tomatoes 1920x1080 intro motion slow hidef hd
1037134610,https://ak.picdn.net/shutterstock/videos/1037134610/preview/stock-footage-fluffy-buttermilk-pancakes-and-maple-syrup-pouring-sweet-syrup-on-stack-of-pancakes.mp4,PT00H00M20S,071051_071100,Fluffy buttermilk pancakes and maple syrup. pouring sweet syrup on stack of pancakes
22738309,https://ak.picdn.net/shutterstock/videos/22738309/preview/stock-footage-a-lot-of-brushes-of-the-artist-in-the-rays-of-light-many-brushes-close-up.mp4,PT00H00M17S,031601_031650,A lot of brushes of the artist in the rays of light. many brushes. close-up
1046221768,https://ak.picdn.net/shutterstock/videos/1046221768/preview/stock-footage-cropped-shot-of-barber-cutting-hair-to-male-client-close-up-partial-view-of-hairdresser-holding.mp4,PT00H00M14S,136551_136600,Cropped shot of barber cutting hair to male client. close-up partial view of hairdresser holding electric clipper and grooming handsome bearded man in barbershop. track out dolly shot
1020741442,https://ak.picdn.net/shutterstock/videos/1020741442/preview/stock-footage-bright-and-colorful-sprinkled-donut-close-up-shot-spinning-on-a-white-background-top-view.mp4,PT00H00M23S,107801_107850,Bright and colorful sprinkled donut close-up shot spinning on a white background. top view. seamless looping.
1009310084,https://ak.picdn.net/shutterstock/videos/1009310084/preview/stock-footage-close-up-fly-mating-on-green-leaf.mp4,PT00H00M20S,066051_066100,Close-up fly mating on green leaf.
24688916,https://ak.picdn.net/shutterstock/videos/24688916/preview/stock-footage-background-of-shiny-multicolored-coin-like-disks.mp4,PT00H00M24S,135451_135500,Background of shiny multicolored coin-like disks
31025329,https://ak.picdn.net/shutterstock/videos/31025329/preview/stock-footage-boats-in-the-water-on-the-river-bank.mp4,PT00H00M14S,050451_050500,Boats in the water on the river bank
32426638,https://ak.picdn.net/shutterstock/videos/32426638/preview/stock-footage-a-wooden-fence-on-either-side-a-young-boy-running-down-the-middle-as-fast-as-his-little-legs-can-go.mp4,PT00H00M12S,008251_008300,A wooden fence on either side a young boy running down the middle as fast as his little legs can go.
18755822,https://ak.picdn.net/shutterstock/videos/18755822/preview/stock-footage-gold-buddha-in-a-temple-of-thailand-close-up-and-perspective-view.mp4,PT00H00M05S,073651_073700,Gold buddha in a temple of thailand. close up and perspective view.
32663320,https://ak.picdn.net/shutterstock/videos/32663320/preview/stock-footage-white-blue-small-flower-panning-from-left-to-right.mp4,PT00H00M25S,031601_031650,White blue small flower panning from left to right
1016354848,https://ak.picdn.net/shutterstock/videos/1016354848/preview/stock-footage-gdansk-poland-september-playing-on-old-school-retro-game-console-gameboy.mp4,PT00H00M13S,121251_121300,"Gdansk, poland - september 2018: playing on old school, retro game console, gameboy"
1023370375,https://ak.picdn.net/shutterstock/videos/1023370375/preview/stock-footage-kaleidoscope-pattern-background-animation.mp4,PT00H00M10S,079351_079400,Kaleidoscope pattern background animation
1063304527,https://ak.picdn.net/shutterstock/videos/1063304527/preview/stock-footage-fall-foliage-reflected-on-the-surface-of-a-pond-in-a-public-park-fall-foliage-against-a-bright-and.mp4,PT00H00M12S,069551_069600,Fall foliage reflected on the surface of a pond in a public park. fall foliage against a bright and clear sunny day in a public park. 
1028000897,https://ak.picdn.net/shutterstock/videos/1028000897/preview/stock-footage-the-tropical-shore.mp4,PT00H00M17S,141351_141400,The tropical shore.
5127098,https://ak.picdn.net/shutterstock/videos/5127098/preview/stock-footage-glowing-l-yellow-lm-loop-animation-background.mp4,PT00H00M30S,033351_033400,Glowing l yellow lm01 loop animation background
1010344304,https://ak.picdn.net/shutterstock/videos/1010344304/preview/stock-footage-background-of-bubbles-or-soap-bubbles-over-black-background-d-illustration.mp4,PT00H00M15S,116151_116200,Background of bubbles or soap bubbles over black background.3d illustration
1066693444,https://ak.picdn.net/shutterstock/videos/1066693444/preview/stock-footage-happy-married-couple-with-young-children-walking-with-sledges-in-a-snowy-park-in-winter-young.mp4,PT00H00M24S,000001_000050,Happy married couple with young children walking with sledges in a snowy park in winter. young family husband and wife with young sons spend leisure time together on the weekend
24811958,https://ak.picdn.net/shutterstock/videos/24811958/preview/stock-footage-skyscrapers-of-the-business-center-moscow-city-in-moscow.mp4,PT00H00M16S,101001_101050,"Skyscrapers of the business center ""moscow city"" in moscow"
1041566416,https://ak.picdn.net/shutterstock/videos/1041566416/preview/stock-footage-yellow-lens-flare-animation-video-effect.mp4,PT00H00M10S,030551_030600,Yellow lens flare animation video effect
1044135679,https://ak.picdn.net/shutterstock/videos/1044135679/preview/stock-footage--k-caryatid-statue-looped-alpha-channel-included.mp4,PT00H00M06S,060951_061000,4k caryatid statue. looped. alpha channel included.
5805677,https://ak.picdn.net/shutterstock/videos/5805677/preview/stock-footage-red-ants-nest.mp4,PT00H00M21S,124901_124950,Red ants nest
1026701462,https://ak.picdn.net/shutterstock/videos/1026701462/preview/stock-footage-red-and-green-macaw-in-tree.mp4,PT00H00M06S,120251_120300,Red-and-green macaw in tree
29158945,https://ak.picdn.net/shutterstock/videos/29158945/preview/stock-footage-young-man-walking-along-the-river-the-sun-is-shining.mp4,PT00H00M11S,000551_000600,Young man walking along the river. the sun is shining
31654996,https://ak.picdn.net/shutterstock/videos/31654996/preview/stock-footage-beautiful-waterfall-in-chyamche-village-surrounded-by-green-himalayan-hills-annapurna-circuit.mp4,PT00H00M23S,132501_132550,"Beautiful waterfall in chyamche village, surrounded by green himalayan hills - annapurna circuit trek in nepal	
"
1050061351,https://ak.picdn.net/shutterstock/videos/1050061351/preview/stock-footage-cheyenne-county-kansas-little-cute-girl-gets-outside-the-house-with-her-doll.mp4,PT00H00M05S,058051_058100,Cheyenne county kansas-1958: little cute girl gets outside the house with her doll
1065287713,https://ak.picdn.net/shutterstock/videos/1065287713/preview/stock-footage-aerial-beautiful-hengifoss-waterfall-red-cliff-canyon-and-mountain-river-in-iceland.mp4,PT00H00M17S,066501_066550,"Aerial beautiful hengifoss waterfall, red cliff canyon and mountain river in iceland"
1019343802,https://ak.picdn.net/shutterstock/videos/1019343802/preview/stock-footage-people-rest-on-square-in-arequipa-peru-nov.mp4,PT00H00M21S,174051_174100,"People rest on square in arequipa (peru), 23 nov 2017 "
2152271,https://ak.picdn.net/shutterstock/videos/2152271/preview/stock-footage-city-timelapse-at-night-traffic-light-flashing-busy-traffic-across-the-main-road-at-rush-hour.mp4,PT00H00M13S,106151_106200,City timelapse at night. traffic light flashing. busy traffic across the main road at rush hour.
24983360,https://ak.picdn.net/shutterstock/videos/24983360/preview/stock-footage-video-animation-the-heart-icon-for-valentine-s-day.mp4,PT00H00M08S,064851_064900,Video animation: the heart icon for valentine's day
5812859,https://ak.picdn.net/shutterstock/videos/5812859/preview/stock-footage-elk-doe-walking-see-spots-on-her-back.mp4,PT00H00M15S,057801_057850,"Elk doe walking, see spots on her back."
29973742,https://ak.picdn.net/shutterstock/videos/29973742/preview/stock-footage-close-up-of-businesswoman-folds-a-stack-of-hundred-dollar-bills-on-a-black-mirrored-background.mp4,PT00H00M13S,108551_108600,Close-up of businesswoman folds a stack of hundred dollar bills on a black mirrored background.
3149938,https://ak.picdn.net/shutterstock/videos/3149938/preview/stock-footage-tired-woman-catching-breath-during-jogging-crane-shot.mp4,PT00H00M09S,129151_129200,"Tired woman catching breath during jogging, crane shot
"
1053406430,https://ak.picdn.net/shutterstock/videos/1053406430/preview/stock-footage-male-hands-are-drawn-to-the-pile-of-coins-on-the-table-the-theme-of-financial-crisis-and-poverty.mp4,PT00H00M07S,080251_080300,Male hands are drawn to the pile of coins on the table. the theme of financial crisis and poverty.
1021002061,https://ak.picdn.net/shutterstock/videos/1021002061/preview/stock-footage-a-perfect-neighbourhood-houses-in-suburb-at-summer-in-the-north-america-luxury-houses-with-nice.mp4,PT00H00M10S,194951_195000,A perfect neighbourhood. houses in suburb at summer in the north america. luxury houses with nice landscape. aerial drone view.
1014316670,https://ak.picdn.net/shutterstock/videos/1014316670/preview/stock-footage-monument-of-partisan-on-piazzale-della-pace-is-public-green-area-in-center-of-parma-italy-located.mp4,PT00H00M07S,095901_095950,"Monument of partisan on piazzale della pace is public green area in center of parma, italy, located along road garibaldi next to palazzo della pilotta."
1017643489,https://ak.picdn.net/shutterstock/videos/1017643489/preview/stock-footage-woman-take-photo-on-cellphone-in-hong-kong.mp4,PT00H00M19S,046051_046100,Woman take photo on cellphone in hong kong
15686590,https://ak.picdn.net/shutterstock/videos/15686590/preview/stock-footage-lady-farmer-cutting-wood-in-the-yard-bramletye-fruit-farm-forest-row-sussex-uk-july.mp4,PT00H00M12S,140951_141000,"Lady farmer cutting wood in the yard bramletye fruit farm, forest row,sussex, uk july, 2015"
1030848194,https://ak.picdn.net/shutterstock/videos/1030848194/preview/stock-footage-close-up-footage-of-homemade-chocolate-cookies-selective-focus-panning-to-the-left.mp4,PT00H00M12S,060851_060900,Close up footage of homemade chocolate cookies. selective focus. panning to the left.
23750692,https://ak.picdn.net/shutterstock/videos/23750692/preview/stock-footage-old-carpathian-mountains-summer-cloudless-sky-morning-mist-in-the-valley-dawn-time-lapse.mp4,PT00H00M22S,127901_127950,Old carpathian mountains. summer. cloudless sky. morning mist in the valley. dawn. time lapse
1012494767,https://ak.picdn.net/shutterstock/videos/1012494767/preview/stock-footage-mom-and-father-tickling-her-child-people-family-fun-and-morning-concept-happy-child-with.mp4,PT00H00M18S,034051_034100,"Mom and father tickling her child. people, family, fun and morning concept - happy child with parents tickling in bed at home. happy family spending time together in bedtime playing and hugging"
1013241833,https://ak.picdn.net/shutterstock/videos/1013241833/preview/stock-footage-toronto-ontario-canad-a-july-police-officers-at-crime-scene-with-body-found-in-toronto-park.mp4,PT00H00M24S,019501_019550,"Toronto, ontario, canad a july 2018 police officers at crime scene with body found in toronto park"
1033993823,https://ak.picdn.net/shutterstock/videos/1033993823/preview/stock-footage-aerial-drone-shot-blue-lagoon-island-k-travel-video-eye-view-on-the-sea-coastline-with-pier-and.mp4,PT00H00M29S,082501_082550,"Aerial drone shot, blue lagoon island 4k travel video. eye view on the sea coastline with pier and yacht at sunny day. travel, journey, islands, seascape, freedom, holidays concept"
1045502299,https://ak.picdn.net/shutterstock/videos/1045502299/preview/stock-footage-stage-light-iridescent-gradient-in-the-form-of-flowers.mp4,PT00H00M27S,183701_183750,Stage light iridescent gradient in the form of flowers
18407698,https://ak.picdn.net/shutterstock/videos/18407698/preview/stock-footage-five-children-running-towards-camera-in-park.mp4,PT00H00M09S,137651_137700,Five children running towards camera in park
9071834,https://ak.picdn.net/shutterstock/videos/9071834/preview/stock-footage--k-passing-under-yakutsk-jakutsk-russia-interstate-highway-sign-with-matte-photorealistic-d.mp4,PT00H00M18S,038951_039000,"4k passing under yakutsk jakutsk russia interstate highway sign with matte photorealistic 3d animation
4k 4096x2304 ultra high definition"
1027838081,https://ak.picdn.net/shutterstock/videos/1027838081/preview/stock-footage-from-the-glitch-effect-arises-currency-name-rial-then-the-tv-turns-off-alpha-channel.mp4,PT00H00M20S,043151_043200,From the glitch effect arises currency name rial. then the tv turns off. alpha channel premultiplied - matted with color black
1045049479,https://ak.picdn.net/shutterstock/videos/1045049479/preview/stock-footage-poly-art-kaleidoscope-geometric-grey-black-and-white-fractal-background.mp4,PT00H00M15S,130651_130700,Poly art kaleidoscope  geometric grey black and white  fractal background
12240851,https://ak.picdn.net/shutterstock/videos/12240851/preview/stock-footage-christmas-retail-sale-sign-with-wrapped-gift-boxes-and-burning-candles.mp4,PT00H00M15S,037251_037300,Christmas retail sale sign with wrapped gift boxes and burning candles
1015250872,https://ak.picdn.net/shutterstock/videos/1015250872/preview/stock-footage-hand-blueprint-print-project.mp4,PT00H00M07S,126251_126300,Hand blueprint print project
5175425,https://ak.picdn.net/shutterstock/videos/5175425/preview/stock-footage-deep-forest-waterfall-in-thailand-erawan-waterfall.mp4,PT00H00M16S,022151_022200,"Deep forest waterfall in thailand (erawan waterfall)
"
1051320793,https://ak.picdn.net/shutterstock/videos/1051320793/preview/stock-footage-drone-shot-of-galle-town-and-lighthouse-in-sri-lanka-galle-is-a-colonial-town-closed-in-the.mp4,PT00H00M20S,121701_121750,Drone shot of galle town and lighthouse in sri lanka. galle is a colonial town closed in the fortress walls on the south coast of the country. aerial view highway angle 
16296859,https://ak.picdn.net/shutterstock/videos/16296859/preview/stock-footage-singapore-singapore-march-time-lapse-filmed-from-the-cabin-of-the-singapore-flyer.mp4,PT00H00M15S,084651_084700,"Singapore, singapore - march 25, 2014: time lapse filmed from the cabin of the singapore flyer ferris wheel in singapore, singapore. "
1051192405,https://ak.picdn.net/shutterstock/videos/1051192405/preview/stock-footage-old-man-puts-aside-glasses-in-metal-frame-on-table-drinks-from-cup-and-continue-reading-interesting.mp4,PT00H00M32S,066301_066350,Old man puts aside glasses in metal frame on table drinks from cup and continue reading interesting book close slow motion
23599525,https://ak.picdn.net/shutterstock/videos/23599525/preview/stock-footage-close-up-of-frying-steak.mp4,PT00H00M19S,183401_183450,Close up of frying steak
31628041,https://ak.picdn.net/shutterstock/videos/31628041/preview/stock-footage-aerial-north-carolina-raleigh-july-sunset-k-inspire.mp4,PT00H00M30S,173251_173300,Aerial north carolina raleigh july 2017 sunset 4k inspire 2
1014689273,https://ak.picdn.net/shutterstock/videos/1014689273/preview/stock-footage-man-sitting-on-bench-watching-his-team-win-and-celebrates-ungraded.mp4,PT00H00M12S,184151_184200,Man sitting on bench watching his team win and celebrates - ungraded
1041265360,https://ak.picdn.net/shutterstock/videos/1041265360/preview/stock-footage--k-footage-of-long-hall-in-vintage-retro-train-car-with-wooden-doors-and-carpet-on-floor.mp4,PT00H00M18S,147101_147150,4k footage of long hall in vintage retro train car with wooden doors and carpet on floor
29225608,https://ak.picdn.net/shutterstock/videos/29225608/preview/stock-footage-aerial-shot-over-danube-river-sunset-and-island.mp4,PT00H00M28S,197451_197500,"Aerial shot over danube river, sunset and island"
6941566,https://ak.picdn.net/shutterstock/videos/6941566/preview/stock-footage-obscure-cloud.mp4,PT00H00M10S,057401_057450,Obscure cloud. 
1039637006,https://ak.picdn.net/shutterstock/videos/1039637006/preview/stock-footage-lush-rainforest-valley-reveal-shot-with-dramatic-waterfalls-hawaii.mp4,PT00H00M15S,015551_015600,"Lush rainforest valley reveal shot with dramatic waterfalls, hawaii"
21503014,https://ak.picdn.net/shutterstock/videos/21503014/preview/stock-footage-chocolate-cake-with-fresh-strawberry.mp4,PT00H00M13S,095401_095450,Chocolate cake with fresh strawberry
166270,https://ak.picdn.net/shutterstock/videos/166270/preview/stock-footage-haleakala-national-park-seven-pools-near-hana-in-maui-hawaii-river-running-to-pacific-ocean.mp4,PT00H00M11S,127951_128000,"Haleakala national park, seven pools near hana in maui, hawaii.  river running to pacific ocean through a set of waterfalls and seven pools before hitting ocean."
1011591974,https://ak.picdn.net/shutterstock/videos/1011591974/preview/stock-footage-medium-shot-of-female-college-student-helping-her-friend-with-difficult-assignment-african.mp4,PT00H00M12S,137701_137750,Medium shot of female college student helping her friend with difficult assignment. african american boy and caucasian girl sitting at desk and discussing task
393763,https://ak.picdn.net/shutterstock/videos/393763/preview/stock-footage-people-walking-through-a-spring-scene.mp4,PT00H00M16S,148601_148650,People walking through a spring scene
1034950967,https://ak.picdn.net/shutterstock/videos/1034950967/preview/stock-footage-crows-flock-on-rocky-land.mp4,PT00H00M27S,147601_147650,Crows flock on rocky land
31025218,https://ak.picdn.net/shutterstock/videos/31025218/preview/stock-footage-beautiful-aerial-view-of-the-seaside-and-the-mediterranean-sea-in-saint-jean-cap-ferrat-k-video.mp4,PT00H00M12S,041951_042000,"Beautiful aerial view of the seaside and the mediterranean sea in saint jean cap ferrat - 4k video
"
1148689,https://ak.picdn.net/shutterstock/videos/1148689/preview/stock-footage-tractor-with-workers-in-a-field.mp4,PT00H00M10S,177001_177050,Tractor with workers in a field
14260133,https://ak.picdn.net/shutterstock/videos/14260133/preview/stock-footage-donald-duck-shrimp-leander-plumosus.mp4,PT00H00M06S,005601_005650,Donald duck shrimp (leander plumosus)
1017368497,https://ak.picdn.net/shutterstock/videos/1017368497/preview/stock-footage-a-close-up-of-a-forstner-bit-starting-to-drill-a-hole-into-a-wooden-plank.mp4,PT00H00M31S,195751_195800,"A close-up of a forstner bit, starting to drill a hole into a wooden plank."
1009632503,https://ak.picdn.net/shutterstock/videos/1009632503/preview/stock-footage-side-view-of-confident-man-in-suit-sitting-at-table-in-hotel-room-working-on-laptop-and-having.mp4,PT00H00M16S,083951_084000,Side view of confident man in suit sitting at table in hotel room working on laptop and having business call.
1016572876,https://ak.picdn.net/shutterstock/videos/1016572876/preview/stock-footage-blueprints-rolls-of-architectural-drawings-smoothly-rotate-on-the-surface-of-the-architectural.mp4,PT00H00M17S,193751_193800,Blueprints - rolls of architectural drawings smoothly rotate on the surface of the architectural plan of a modern house / seamless looping	
1008599911,https://ak.picdn.net/shutterstock/videos/1008599911/preview/stock-footage-teammates-working-together-in-office-business-assignment.mp4,PT00H00M14S,007101_007150,"Teammates working together in office, business assignment"
1053539261,https://ak.picdn.net/shutterstock/videos/1053539261/preview/stock-footage-crete-island-greece-october-sandy-shallow-water-beach-people-in-bathing-suits-walk.mp4,PT00H00M20S,078401_078450,"Crete island, greece - october, 17, 2019. sandy shallow water, beach. people in bathing suits walk on the water and splash their feet. balos bay."
14614813,https://ak.picdn.net/shutterstock/videos/14614813/preview/stock-footage-romantic-senior-caucasian-couple-dancing-on-a-beach.mp4,PT00H00M19S,020901_020950,Romantic senior caucasian couple dancing on a beach
1008364213,https://ak.picdn.net/shutterstock/videos/1008364213/preview/stock-footage-close-up-shot-of-female-musician-hand-playing-the-haegeum-korean-traditional-string-instrument.mp4,PT00H00M40S,032301_032350,"Close up shot of female musician hand playing the haegeum, korean traditional string instrument"
1012540688,https://ak.picdn.net/shutterstock/videos/1012540688/preview/stock-footage-aerial-view-of-sparkling-fireworks-display-in-night-sky.mp4,PT00H00M15S,111151_111200,Aerial view of sparkling fireworks display in night sky.
31119247,https://ak.picdn.net/shutterstock/videos/31119247/preview/stock-footage-roadway-moving-forward-perspective-view.mp4,PT00H00M13S,126151_126200,Roadway moving forward perspective view
934057,https://ak.picdn.net/shutterstock/videos/934057/preview/stock-footage-asian-businesswoman-on-the-phone.mp4,PT00H00M22S,007951_008000,Asian businesswoman on the phone
1016599495,https://ak.picdn.net/shutterstock/videos/1016599495/preview/stock-footage-rolls-of-blueprints-drawings-of-antique-decorative-elements-of-architectural-orders-seamless.mp4,PT00H00M29S,012701_012750,Rolls of blueprints - drawings of antique decorative elements of architectural orders / seamless looping	
19056739,https://ak.picdn.net/shutterstock/videos/19056739/preview/stock-footage-chicago-neighborhood-homes-driving.mp4,PT00H00M23S,191451_191500,"Chicago-neighborhood homes2, driving"
2309321,https://ak.picdn.net/shutterstock/videos/2309321/preview/stock-footage-serious-businesswoman-speaking-against-white-background.mp4,PT00H00M16S,068801_068850,Serious businesswoman speaking against white background
15571918,https://ak.picdn.net/shutterstock/videos/15571918/preview/stock-footage-miami-beach-march-stock-video-of-mount-sinai-medical-center-located-at-alton-road-and-is.mp4,PT00H00M28S,134051_134100,"Miami beach - march 24: stock video of mount sinai medical center located at 4300 alton road and is south florida's largest non-profit march 24, 2016 in miami beach fl, usa"
1008322489,https://ak.picdn.net/shutterstock/videos/1008322489/preview/stock-footage-aerial-view-of-cancun-caribbean-sea-the-drone-is-flying-upward.mp4,PT00H00M17S,050151_050200,"Aerial view of cancun caribbean sea, the drone is flying upward"
2752496,https://ak.picdn.net/shutterstock/videos/2752496/preview/stock-footage-aracaju-brazil-march-a-shot-of-the-xingo-power-plant-in-aracaju-brazil.mp4,PT00H00M12S,186101_186150,"Aracaju, brazil - march 2008: a shot of the xingo power plant in aracaju, brazil."
1051725031,https://ak.picdn.net/shutterstock/videos/1051725031/preview/stock-footage-the-older-brother-shows-the-children-protective-glasses-and-a-respirator-social-distancing-and.mp4,PT00H00M33S,122001_122050,The older brother shows the children protective glasses and a respirator . social distancing and self-isolation in quarantine during the covid-19 pandemic.
21466147,https://ak.picdn.net/shutterstock/videos/21466147/preview/stock-footage-this-is-a-time-lapse-of-a-residential-neighborhood-in-albuquerque-nm-shot-on-a-bmcc.mp4,PT00H00M09S,134151_134200,This is a time lapse of a residential neighborhood in albuquerque nm. shot on a bmcc
1026847724,https://ak.picdn.net/shutterstock/videos/1026847724/preview/stock-footage-afro-stylist-washing-hairs-of-attractive-lady-near-sink-in-hairdressing-salon.mp4,PT00H00M24S,182251_182300,Afro stylist washing hairs of attractive lady near sink in hairdressing salon
19544770,https://ak.picdn.net/shutterstock/videos/19544770/preview/stock-footage-woman-smiling-to-the-camera-and-holding-scarf-which-is-moving-on-the-wind-steadycam-shot.mp4,PT00H00M19S,011701_011750,"Woman smiling to the camera and holding scarf which is moving on the wind, steadycam shot
"
1025682773,https://ak.picdn.net/shutterstock/videos/1025682773/preview/stock-footage-young-athletic-woman-makes-a-delicious-breakfast-from-the-fruit-of-the-kitchen-health-food-a.mp4,PT00H00M15S,192501_192550,Young athletic woman makes a delicious breakfast from the fruit of the kitchen. health food - a pledge of a beautiful and healthy body.
30339169,https://ak.picdn.net/shutterstock/videos/30339169/preview/stock-footage-bees-close-honey-for-long-term-storage.mp4,PT00H00M30S,020351_020400,Bees close honey for long-term storage.
1036255943,https://ak.picdn.net/shutterstock/videos/1036255943/preview/stock-footage-sea-sunrise-on-the-beach-tropical-vacation-on-island.mp4,PT00H00M21S,188401_188450,Sea sunrise on the beach. tropical vacation on island.
