videoid,contentUrl,duration,page_dir,name
14731339,https://ak.picdn.net/shutterstock/videos/14731339/preview/stock-footage-girl-bring-rag-scarecrow-hanging-on-wooden-ladder-on-cherry-tree-from-birds-k-uhd-video-clip.mp4,PT00H00M21S,071851_071900,Girl bring rag scarecrow hanging on wooden ladder on cherry tree from birds. 4k uhd video clip.
1050773044,https://ak.picdn.net/shutterstock/videos/1050773044/preview/stock-footage-prickly-pear-heart-shape-nature-love.mp4,PT00H00M04S,134401_134450,"Prickly pear,  heart shape , nature love"
5183444,https://ak.picdn.net/shutterstock/videos/5183444/preview/stock-footage-moorea-sacred-place-and-sid.mp4,PT00H00M08S,056651_056700,Moorea sacred place and sid
1048211515,https://ak.picdn.net/shutterstock/videos/1048211515/preview/stock-footage-energetic-athletic-woman-exercising-on-stairs-in-urban-area-handheld-closeup-shot-of-feet-side.mp4,PT00H00M10S,184801_184850,Energetic athletic woman exercising on stairs in urban area. handheld closeup shot of feet side running on the stairs.
3519881,https://ak.picdn.net/shutterstock/videos/3519881/preview/stock-footage-sevastopol-ukraine-july-day-of-russian-navy-warships-in-sevastopol-bay-demonstrating.mp4,PT00H00M25S,108301_108350,"Sevastopol, ukraine - july 29, 2012: day of russian navy. warships in sevastopol bay, demonstrating the power of the fleet."
15574567,https://ak.picdn.net/shutterstock/videos/15574567/preview/stock-footage-barista-making-coffee-in-coffeeshop-close-up.mp4,PT00H00M35S,004001_004050,Barista making coffee in coffeeshop. close up
31874296,https://ak.picdn.net/shutterstock/videos/31874296/preview/stock-footage-time-lapse-video-of-stars-sky-space-astrophotography-mountain-valley.mp4,PT00H00M10S,182501_182550,Time lapse video of stars sky space astrophotography. mountain valley
1031215370,https://ak.picdn.net/shutterstock/videos/1031215370/preview/stock-footage-aerial-footage-of-logistics-and-transportation-of-container-cargo-ship-and-cargo-plane-with-working.mp4,PT00H00M16S,185151_185200,"Aerial footage of logistics and transportation of container cargo ship and cargo plane with working crane bridge in shipyard in sabah port, sabah, malaysia"
1024199813,https://ak.picdn.net/shutterstock/videos/1024199813/preview/stock-footage-scene-of-mississippi-river-and-memphis-downtown-k.mp4,PT00H00M08S,171851_171900,Scene of mississippi river and memphis downtown 4k
5954519,https://ak.picdn.net/shutterstock/videos/5954519/preview/stock-footage-usa-june-cyclists-at-raam-longest-bicycle-competition-over-united-states-of-america.mp4,PT00H00M23S,001151_001200,Usa - june 2009: cyclists at raam . longest bicycle competition over united states of america - raam in 2009.
1051264291,https://ak.picdn.net/shutterstock/videos/1051264291/preview/stock-footage-los-angeles-california-gritty-footage-of-an-elevated-pan-view-of-sidewalk-and-street-with-a.mp4,PT00H00M05S,122451_122500,Los angeles california-1969: gritty footage of an elevated pan view of sidewalk and street with a cut to poorly lit room
1021592290,https://ak.picdn.net/shutterstock/videos/1021592290/preview/stock-footage-aerial-view-winter-forest-snowy-tree-branch-in-a-view-of-the-winter-forest-winter-landscape.mp4,PT00H00M12S,140701_140750,"Aerial view: winter forest. snowy tree branch in a view of the winter forest. winter landscape, forest, trees covered with frost, snow."
1006681330,https://ak.picdn.net/shutterstock/videos/1006681330/preview/stock-footage-close-up-sack-full-of-organic-potatoes-on-oak-wooden-table.mp4,PT00H00M15S,023651_023700,Close up sack full of organic potatoes on oak wooden table
19685341,https://ak.picdn.net/shutterstock/videos/19685341/preview/stock-footage-two-cows-near-fence-cattle-with-tags-rural-economy-gathers-momentum-farm-is-constantly-expanding.mp4,PT00H00M09S,120951_121000,Two cows near fence. cattle with tags. rural economy gathers momentum. farm is constantly expanding.
10427405,https://ak.picdn.net/shutterstock/videos/10427405/preview/stock-footage-barcelona-sunset-light-joan-miro-park-roof-top-view-k-spain.mp4,PT00H00M25S,199301_199350,Barcelona sunset light joan miro park roof top view 4k spain
23184658,https://ak.picdn.net/shutterstock/videos/23184658/preview/stock-footage-pan-of-cheerful-businesswoman-showing-draft-for-new-project-to-her-colleagues-then-discussing-it.mp4,PT00H00M24S,113651_113700,"Pan of cheerful businesswoman showing draft for new project to her colleagues, then discussing it together and sharing ideas"
1029252497,https://ak.picdn.net/shutterstock/videos/1029252497/preview/stock-footage-italy-rome-september-bridge-in-adriano-park-rome.mp4,PT00H00M19S,127301_127350,"Italy, rome - september, 2016: bridge in adriano park, rome"
29921104,https://ak.picdn.net/shutterstock/videos/29921104/preview/stock-footage-piracy-animated-word-cloud-text-design-animation-kinetic-typography.mp4,PT00H00M20S,049551_049600,"Piracy animated word cloud, text design animation. kinetic typography."
1018045498,https://ak.picdn.net/shutterstock/videos/1018045498/preview/stock-footage-new-year-text-cities-of-russia-saransk-snow-falls-christmas-mood-looped-video-alpha-channel.mp4,PT00H00M10S,118151_118200,"New year text cities of russia saransk. snow falls. christmas mood, looped video. alpha channel premultiplied - matted with deep blue rgb(04:00:5b)"
11733257,https://ak.picdn.net/shutterstock/videos/11733257/preview/stock-footage-people-walking-in-the-big-city-streets-abstract-motion-background-rainy-day.mp4,PT00H00M32S,121851_121900,"People walking in the big city streets ,abstract motion background,rainy day"
35055349,https://ak.picdn.net/shutterstock/videos/35055349/preview/stock-footage-phuket-thailand-november-speedboat-departure-from-rawai-pier-to-coral-island.mp4,PT00H00M16S,104751_104800,"Phuket, thailand - november 15, 2017: speedboat departure from rawai pier to coral island"
1019594536,https://ak.picdn.net/shutterstock/videos/1019594536/preview/stock-footage--d-loop-abstract-seamless-background-with-glow-particles-depth-of-field-bokeh-glow-particles.mp4,PT00H00M10S,057551_057600,"3d loop abstract seamless background with glow particles, depth of field, bokeh. glow particles like christmas or new year garland flying in air or sparks that form wiggle structures. golden"
31977571,https://ak.picdn.net/shutterstock/videos/31977571/preview/stock-footage--rome-italy-saint-peter-basilica-people-old-cathedral-and-fountain.mp4,PT00H00M12S,120201_120250,"22.06.2016 - rome, italy. saint peter basilica, people. old cathedral and fountain."
1060377059,https://ak.picdn.net/shutterstock/videos/1060377059/preview/stock-footage-man-holds-in-front-of-him-a-poster-from-a-cardboard-box-with-the-words-all-lives-matter-concept-of.mp4,PT00H00M41S,066451_066500,"Man holds in front of him a poster from a cardboard box with the words all lives matter. concept of strike and anti racism. isolated a green screen, chroma key. close up. slow motion."
15117928,https://ak.picdn.net/shutterstock/videos/15117928/preview/stock-footage-aerial-view-of-construction-site-with-worker-man-and-crane-machine.mp4,PT00H00M17S,176701_176750,Aerial view of construction site with worker man and crane machine 
1007476414,https://ak.picdn.net/shutterstock/videos/1007476414/preview/stock-footage-hall-of-business-center-during-daytime.mp4,PT00H00M26S,103901_103950,Hall of business center during daytime
29993371,https://ak.picdn.net/shutterstock/videos/29993371/preview/stock-footage-young-woman-wearing-a-s-retro-clothes-striking-a-pose-in-studio-disco-diva.mp4,PT00H00M06S,124351_124400,Young woman wearing a 70s retro clothes striking a pose in studio. disco diva
10912709,https://ak.picdn.net/shutterstock/videos/10912709/preview/stock-footage-close-up-shot-of-beautiful-wedding-bouquet-and-glasses-with-campaign.mp4,PT00H00M07S,003751_003800,Close-up shot of beautiful wedding bouquet and glasses with campaign.
12976082,https://ak.picdn.net/shutterstock/videos/12976082/preview/stock-footage-assortment-various-fresh-fish-in-market-seafood-background-in-motion.mp4,PT00H00M11S,135401_135450,Assortment various fresh fish in market. seafood background in motion
8355724,https://ak.picdn.net/shutterstock/videos/8355724/preview/stock-footage-cool-abstract-digital-computer-light-pattern.mp4,PT00H00M14S,194301_194350,"Cool abstract digital computer light pattern

"
1066527256,https://ak.picdn.net/shutterstock/videos/1066527256/preview/stock-footage-vintage-alarm-clock-and-cup-of-coffee-on-wooden-table-in-snowfall-near-pine-tree.mp4,PT00H00M09S,130151_130200,Vintage alarm clock and cup of coffee on wooden table in snowfall near pine tree
1037165714,https://ak.picdn.net/shutterstock/videos/1037165714/preview/stock-footage-an-attractive-woman-in-a-tea-room-is-typing-on-a-computer-and-drinking-a-tea.mp4,PT00H00M16S,180001_180050,An attractive woman in a tea room is typing on a computer and drinking a tea
1006818502,https://ak.picdn.net/shutterstock/videos/1006818502/preview/stock-footage-close-portrait-of-little-cute-smiling-baby-boy-at-home-lying-in-bed.mp4,PT00H00M17S,090301_090350,"Close portrait of little cute smiling baby boy at home, lying in bed"
14429926,https://ak.picdn.net/shutterstock/videos/14429926/preview/stock-footage-snow-geese-walk-and-eat-while-dark-phase-tucks-beak-in-wing-and-sleeps-tight-p.mp4,PT00H00M20S,072151_072200,Snow geese walk and eat while dark phase tucks beak in wing and sleeps - tight - p1090067
32510812,https://ak.picdn.net/shutterstock/videos/32510812/preview/stock-footage-basel-march-vintage-watches-exhibited-at-wyler-vetta-booth-at-the-watches-and-jewelry-show.mp4,PT00H00M05S,087151_087200,"Basel – march 22: vintage watches exhibited at wyler vetta booth at the watches and jewelry show baselworld in basel, switzerland, on march 22, 2017
"
1030951373,https://ak.picdn.net/shutterstock/videos/1030951373/preview/stock-footage-hungary-flag-flies-around-a-soccer-ball-revolving-around-its-axis.mp4,PT00H00M10S,192401_192450,Hungary flag flies around a soccer ball revolving around its axis
1048294309,https://ak.picdn.net/shutterstock/videos/1048294309/preview/stock-footage-healthy-businessman-wears-suit-holding-glass-drinking-fresh-mineral-filtered-water-happy-thirsty.mp4,PT00H00M06S,081201_081250,Healthy businessman wears suit holding glass drinking fresh mineral filtered water. happy thirsty worker hydrating thirst at work keeps healthcare balance. office water delivery concept. close up view
1043436907,https://ak.picdn.net/shutterstock/videos/1043436907/preview/stock-footage-singapore-february-city-sunset-night-illuminated-marina-gardens-buildings-downtown-aerial.mp4,PT00H00M17S,130201_130250,Singapore - february 3 2019: city sunset night illuminated marina gardens buildings downtown aerial panorama 4k circa february 3 2019 singapore.
24058888,https://ak.picdn.net/shutterstock/videos/24058888/preview/stock-footage-hot-air-balloons-in-the-sky-over-a-field-in-the-countryside-aerial-view-hot-air-balloons-in-the-sky.mp4,PT00H00M17S,051001_051050,"Hot air balloons in the sky over a field in the countryside.aerial view:hot air balloons in the sky over a field in the countryside. 4k video,ultra hd."
21281821,https://ak.picdn.net/shutterstock/videos/21281821/preview/stock-footage-couple-of-indigenous-wearing-typical-palm-hats-south-america.mp4,PT00H00M14S,175551_175600,"Couple of indigenous wearing typical palm hats, south america."
1052365315,https://ak.picdn.net/shutterstock/videos/1052365315/preview/stock-footage-young-beautiful-brunette-caucasian-girl-in-a-white-tank-top-does-gymnastics-at-home-performs.mp4,PT00H00M14S,196901_196950,"Young beautiful brunette caucasian girl in a white tank top does gymnastics at home. performs circular motion exercises for the neck, background, long hair"
12589904,https://ak.picdn.net/shutterstock/videos/12589904/preview/stock-footage-paris-september-street-life-in-paris-people-walking-near-eiffel-tower-france.mp4,PT00H00M20S,052551_052600,"Paris - september 28 2015: street life in paris, people walking near eiffel tower, france"
12564203,https://ak.picdn.net/shutterstock/videos/12564203/preview/stock-footage-unrecognizable-young-woman-applauding.mp4,PT00H00M06S,053351_053400,Unrecognizable young woman applauding
20108383,https://ak.picdn.net/shutterstock/videos/20108383/preview/stock-footage-girl-using-a-laptop-computer-at-school-schoolgirl-after-lessons-in-library.mp4,PT00H00M23S,062851_062900,Girl using a laptop computer at school. schoolgirl after lessons in library
5821739,https://ak.picdn.net/shutterstock/videos/5821739/preview/stock-footage-flood-water-rescue-aid-helicopter-hurricane-barricade-large-helicopter-preparing-to-take-of-from.mp4,PT00H00M21S,003151_003200,Flood water rescue aid helicopter hurricane barricade. large helicopter preparing to take of from grass field beside damaged harbor.
17789419,https://ak.picdn.net/shutterstock/videos/17789419/preview/stock-footage-slow-motion-of-young-woman-holding-sunglasses-k.mp4,PT00H00M15S,187601_187650,Slow motion of young woman holding sunglasses 4k
1059887150,https://ak.picdn.net/shutterstock/videos/1059887150/preview/stock-footage-thick-grey-clouds-drift-behind-silhouette-joshua-tree-low-angle-time-lapse.mp4,PT00H00M37S,145201_145250,"Thick grey clouds drift behind silhouette joshua tree, low angle time lapse"
1045823632,https://ak.picdn.net/shutterstock/videos/1045823632/preview/stock-footage-doctor-is-doing-a-check-for-coronavirus-ncov-fever-symptoms-with-his-laser-thermometer-mask.mp4,PT00H00M13S,084601_084650,"Doctor is doing a check for coronavirus 2019 ncov fever symptoms with his laser thermometer. mask, gloves and visor. white background."
1037140475,https://ak.picdn.net/shutterstock/videos/1037140475/preview/stock-footage-repair-depot-for-trains-general-plan.mp4,PT00H00M16S,137401_137450,Repair depot for trains. general plan
12726488,https://ak.picdn.net/shutterstock/videos/12726488/preview/stock-footage-close-up-of-hands-woman-using-her-cell-phone-in-restaurant-cafe.mp4,PT00H00M09S,179701_179750,"Close up of hands woman using her cell phone in restaurant, cafe."
1008746768,https://ak.picdn.net/shutterstock/videos/1008746768/preview/stock-footage-meat-grinder-tail-fat-and-meat-processing.mp4,PT00H00M13S,145251_145300,Meat grinder. tail fat and meat processing.
1020181042,https://ak.picdn.net/shutterstock/videos/1020181042/preview/stock-footage--k-decorated-christmas-tree-sparkling-and-fairy-tilt-up-shot.mp4,PT00H00M09S,051601_051650,"4k decorated christmas tree ,sparkling and fairy, tilt up shot"
7608814,https://ak.picdn.net/shutterstock/videos/7608814/preview/stock-footage-le-bec-hellouin-monastery-and-abbey.mp4,PT00H00M10S,025251_025300,Le bec hellouin monastery and abbey
1020165646,https://ak.picdn.net/shutterstock/videos/1020165646/preview/stock-footage-baltimore-maryland-united-states-november-aerial-of-downtown-baltimore-maryland-and.mp4,PT00H00M28S,138151_138200,"Baltimore, maryland / united states - november 1, 2018 : aerial of downtown baltimore maryland and landmarks near the harbor."
1059242555,https://ak.picdn.net/shutterstock/videos/1059242555/preview/stock-footage-dairy-cow-grazing-near-altai-farm-in-the-morning-farming-ecology-and-animal-life-concept.mp4,PT00H00M13S,186251_186300,"Dairy cow grazing near altai farm in the morning. farming, ecology and animal life concept"
30514912,https://ak.picdn.net/shutterstock/videos/30514912/preview/stock-footage-cairo-egypt-circa-low-angle-cu-view-of-the-statuette-of-th-dynasty-pharaoh-senusret-i.mp4,PT00H00M12S,123501_123550,"Cairo, egypt - circa 2002: low-angle cu view of the statuette of 12th dynasty pharaoh senusret i wearing the white crown of upper egypt. museum of cairo."
22433671,https://ak.picdn.net/shutterstock/videos/22433671/preview/stock-footage-high-altitude-overflight-aerial-of-kizimen-volcano-russia-x-s-kamchatka-peninsula-clip-loops-and.mp4,PT00H00M31S,074851_074900,"High-altitude overflight aerial of kizimen volcano, russia\x92s kamchatka peninsula. clip loops and is reversible. elements of this image furnished by nasa"
1037111564,https://ak.picdn.net/shutterstock/videos/1037111564/preview/stock-footage-a-train-departs-crianlarich-railway-station-bound-for-glasgow-queen-street.mp4,PT00H00M56S,098151_098200,A train departs crianlarich railway station bound for glasgow queen street
1016119225,https://ak.picdn.net/shutterstock/videos/1016119225/preview/stock-footage--d-planet-earth-with-some-clouds-different-continents-computer-generated-rendering-background.mp4,PT00H00M40S,069301_069350,"3d planet earth with some clouds, different continents, computer generated rendering background"
28092511,https://ak.picdn.net/shutterstock/videos/28092511/preview/stock-footage-parker-az-usa-may-shot-of-buckskin-mountain-state-park-clip-reveals-a-green-grassy-area.mp4,PT00H00M11S,196651_196700,"Parker az/usa: may 10, 2017- shot of buckskin mountain state park. clip reveals a green grassy area with trees in a recreational section of park."
1034352422,https://ak.picdn.net/shutterstock/videos/1034352422/preview/stock-footage-putting-spoonful-of-dough-in-flour-cheese-pancakes-preparation.mp4,PT00H00M05S,110451_110500,Putting spoonful of dough in flour. cheese pancakes preparation.
1029316205,https://ak.picdn.net/shutterstock/videos/1029316205/preview/stock-footage-italy-rome-september-lion-sculpture-on-the-fountain-of-the-four-rivers-in-rome.mp4,PT00H00M14S,088301_088350,"Italy, rome - september, 2016: lion sculpture on the fountain of the four rivers in rome"
1043791843,https://ak.picdn.net/shutterstock/videos/1043791843/preview/stock-footage-san-diego-california-september-a-sailboat-floats-on-the-calm-water-with-a-cloudy-day.mp4,PT00H00M21S,051701_051750,"San diego, california - september 27 ,2019: a sailboat floats on the calm water with a cloudy day"
31244332,https://ak.picdn.net/shutterstock/videos/31244332/preview/stock-footage-colorful-flag.mp4,PT00H00M09S,183701_183750,Colorful flag
1026983489,https://ak.picdn.net/shutterstock/videos/1026983489/preview/stock-footage-fall-clip-of-changing-colors-and-seasons-in-nature.mp4,PT00H00M12S,186701_186750,Fall clip of changing colors and seasons in nature
1019364505,https://ak.picdn.net/shutterstock/videos/1019364505/preview/stock-footage-krasnodar-russia-november-rostov-highway-and-railway-at-the-entrance-to-krasnodar.mp4,PT00H00M06S,019701_019750,"Krasnodar, russia-november 6, 2018: rostov highway and railway at the entrance to krasnodar"
26565026,https://ak.picdn.net/shutterstock/videos/26565026/preview/stock-footage-aerial-view-close-motion-around-white-marble-buddha-statue-top-body-against-forestry-mountain-peak.mp4,PT00H00M13S,191051_191100,Aerial view close motion around white marble buddha statue top body against forestry mountain peak
1034196263,https://ak.picdn.net/shutterstock/videos/1034196263/preview/stock-footage-beginning-forest-fire-burning-and-smoking-plants-and-trees.mp4,PT00H00M20S,045951_046000,Beginning forest fire - burning and smoking plants and trees.  
1038829814,https://ak.picdn.net/shutterstock/videos/1038829814/preview/stock-footage-happy-couple-is-talking-while-sitting-on-the-floor-and-holding-glasses-of-white-wine-action-k.mp4,PT00H00M15S,021851_021900,Happy couple is talking while sitting on the floor and holding glasses of white wine. action. 4k.
23728843,https://ak.picdn.net/shutterstock/videos/23728843/preview/stock-footage-typical-coast-on-one-of-penghu-s-many-islands-taiwan-islas-pescadores-is-one-of-the-best.mp4,PT00H00M29S,104801_104850,"Typical coast on one of penghu’s many islands, taiwan. islas pescadores is one of the best protected ecological areas in the world."
33897880,https://ak.picdn.net/shutterstock/videos/33897880/preview/stock-footage-serious-pretty-curly-brunette-woman-in-dress-showing-silence-gesture-and-looking-at-the-camera-over.mp4,PT00H00M08S,066401_066450,Serious pretty curly brunette woman in dress showing silence gesture and looking at the camera over white background
1040310443,https://ak.picdn.net/shutterstock/videos/1040310443/preview/stock-footage-enjoy-woman-walking-at-swimming-pool-with-long-dress-resting-on-summer-at-resort-travel-women.mp4,PT00H00M06S,059951_060000,"Enjoy woman walking at swimming pool with long dress resting on summer at resort, travel women relaxation people lifestyle uhd 4k cinematic footage"
1017571633,https://ak.picdn.net/shutterstock/videos/1017571633/preview/stock-footage-horses-woman-grooms-before-trail-ride-in-mountain-ranch-wife-and-woman-grooms-and-prepares-a-horse.mp4,PT00H00M30S,032501_032550,Horses woman grooms before trail ride in mountain. ranch wife and woman grooms and prepares a horse for a mountain trail ride. tackle and saddle to afternoon adventure. cowboy sport.
1010889038,https://ak.picdn.net/shutterstock/videos/1010889038/preview/stock-footage-view-of-flowerpots-in-the-greenhouse-k.mp4,PT00H00M11S,122651_122700,View of flowerpots in the greenhouse. 4k.
1019460610,https://ak.picdn.net/shutterstock/videos/1019460610/preview/stock-footage-edinburgh-scotland-sep-edinburgh-scotland-alley-stairs-woman-climbing-old-edinburgh.mp4,PT00H00M16S,025301_025350,"Edinburgh, scotland - 11 sep 2018: edinburgh scotland alley stairs woman climbing. old edinburgh scotland urban city. historic buildings, schools, business and residence. vacation and business."
13049480,https://ak.picdn.net/shutterstock/videos/13049480/preview/stock-footage-aerial-view-lake-and-forest.mp4,PT00H00M30S,074601_074650,Aerial view lake and forest
1037580593,https://ak.picdn.net/shutterstock/videos/1037580593/preview/stock-footage-woman-lateral-shot-yelling-tough-in-a-deep-state-of-frenzy-in-ecuador.mp4,PT00H00M08S,020351_020400,Woman lateral shot yelling tough in a deep state of frenzy in ecuador
1015049545,https://ak.picdn.net/shutterstock/videos/1015049545/preview/stock-footage-mountain-bluebird-adult-young-family-in-summer-in-south-dakota.mp4,PT00H00M29S,087351_087400,Mountain bluebird adult young family in summer in south dakota
1047391363,https://ak.picdn.net/shutterstock/videos/1047391363/preview/stock-footage-beautiful-cloudscape-moon-light-breaking-through-cloud-beautiful-cloudscape-timelapse-of-clouds.mp4,PT00H00M21S,061751_061800,"Beautiful cloudscape, moon light breaking through cloud. beautiful cloudscape. timelapse of clouds moving in sky and the moon shining through the clouds with rays. 4k loop"
7235929,https://ak.picdn.net/shutterstock/videos/7235929/preview/stock-footage-sunset-over-auckland-silhouetted-time-lapse.mp4,PT00H00M12S,143201_143250,Sunset over auckland silhouetted time lapse
5053280,https://ak.picdn.net/shutterstock/videos/5053280/preview/stock-footage-walk-through-the-green-forest-early-summer-on-a-meandering-path.mp4,PT00H00M17S,091151_091200,"Walk through the green forest, early summer, on a meandering path."
1024120904,https://ak.picdn.net/shutterstock/videos/1024120904/preview/stock-footage-moving-over-a-hand-rail-of-a-footbridge-in-the-temperate-rain-forest-on-vancouver-island-canada.mp4,PT00H00M19S,019601_019650,"Moving over a hand rail of a footbridge in the temperate rain forest on vancouver island, canada (slow motion)"
30928045,https://ak.picdn.net/shutterstock/videos/30928045/preview/stock-footage-delivery-drones-drone-quadrocopter-delivers-a-package-fast-autonomous-drone-delivery.mp4,PT00H00M09S,134101_134150,Delivery drones - drone quadrocopter delivers a package - fast autonomous drone delivery 
7218562,https://ak.picdn.net/shutterstock/videos/7218562/preview/stock-footage-field-of-cells-field-of-cells-with-receptors-human-immune-system-attack-the-virus.mp4,PT00H00M16S,187551_187600,"Field of cells, field of cells with receptors, human immune system attack the virus "
1028868407,https://ak.picdn.net/shutterstock/videos/1028868407/preview/stock-footage-close-up-of-moving-giant-bird-worms-or-super-worms-or-giant-mealworm-of-zophobasmorio.mp4,PT00H00M16S,006401_006450,Close up of moving giant bird worms or super worms or giant mealworm of zophobasmorio 
17505559,https://ak.picdn.net/shutterstock/videos/17505559/preview/stock-footage-around-the-tower-aerial-view-of-torre-mozza.mp4,PT00H00M40S,082451_082500,"Around the tower, aerial view of torre mozza."
1046156092,https://ak.picdn.net/shutterstock/videos/1046156092/preview/stock-footage-looping-kaleidoscopic-line-mandala-psychedelic-visual-background-k.mp4,PT00H00M11S,016801_016850,"Looping kaleidoscopic line mandala. psychedelic visual background. 4k
"
1010485235,https://ak.picdn.net/shutterstock/videos/1010485235/preview/stock-footage-the-man-at-dinner-takes-a-glass-of-aromatic-wine-from-the-table-slow-motion-x-full-hd.mp4,PT00H00M20S,187701_187750,The man at dinner takes a glass of aromatic wine from the table. slow motion. 1920x1080. full hd
31110367,https://ak.picdn.net/shutterstock/videos/31110367/preview/stock-footage-man-looking-at-mirror-adjusting-hair-and-touching-his-face.mp4,PT00H00M18S,188651_188700,"Man looking at mirror, adjusting hair and touching his face."
18777938,https://ak.picdn.net/shutterstock/videos/18777938/preview/stock-footage-young-girl-eating-a-sandwich-fast-food-concept-sandwich-bites-phone-message.mp4,PT00H00M15S,064051_064100,Young girl eating a sandwich. fast food concept. sandwich bites. phone message
14715277,https://ak.picdn.net/shutterstock/videos/14715277/preview/stock-footage-man-in-glasses-makes-selfie-during-swim-at-pool-of-aquapark-action-camera-shot.mp4,PT00H00M19S,133651_133700,Man in glasses makes selfie during swim at pool of aquapark. action camera shot
1015864000,https://ak.picdn.net/shutterstock/videos/1015864000/preview/stock-footage-weather-forecast-in-vector-animation.mp4,PT00H00M07S,033251_033300,Weather forecast in vector animation
