videoid,contentUrl,duration,page_dir,name
1064214691,https://ak.picdn.net/shutterstock/videos/1064214691/preview/stock-footage-time-lapse-of-the-sun-rising-from-behind-downtown-los-angeles.mp4,PT00H00M16S,124851_124900,Time lapse of the sun rising from behind downtown los angeles
8111839,https://ak.picdn.net/shutterstock/videos/8111839/preview/stock-footage-hiker-walking-outdoors-at-sunset-close-up-of-feet-walking-in-slow-motion.mp4,PT00H00M14S,097301_097350,Hiker walking outdoors at sunset. close up of feet walking in slow motion
1024255295,https://ak.picdn.net/shutterstock/videos/1024255295/preview/stock-footage-view-of-a-field-with-growing-green-rape-harvest-k.mp4,PT00H00M10S,132801_132850,View of a field with growing green rape harvest. 4k.
1019773876,https://ak.picdn.net/shutterstock/videos/1019773876/preview/stock-footage-formating-clouds-clear-blue-sky-in-summer-day-time-lapse-cloudscape-in-horizon-beautiful.mp4,PT00H00M25S,015151_015200,"Formating clouds, clear blue sky in summer day, time lapse cloudscape in horizon, beautiful colourful panoramic view, nice sunny light. fast moving cloudy weather."
3372401,https://ak.picdn.net/shutterstock/videos/3372401/preview/stock-footage-underwater-world.mp4,PT00H00M30S,008001_008050,Underwater world
6154844,https://ak.picdn.net/shutterstock/videos/6154844/preview/stock-footage-three-gorgeous-sexy-young-women-posing-arm-in-arm-in-jeans-and-white-bras-showing-off-their.mp4,PT00H00M30S,190801_190850,"Three gorgeous sexy young women posing arm in arm in jeans and white bras showing off their beautiful figures,  studio background"
5841050,https://ak.picdn.net/shutterstock/videos/5841050/preview/stock-footage-sunrise-at-eiffel-tower-paris-france-panoramic-view.mp4,PT00H00M11S,101651_101700,"Sunrise at eiffel tower, paris, france - panoramic view"
1014120113,https://ak.picdn.net/shutterstock/videos/1014120113/preview/stock-footage-cityscape-of-riga-the-capital-of-latvia-aerial-view.mp4,PT00H00M11S,146751_146800,"Cityscape of riga, the capital of latvia. aerial view"
1043465536,https://ak.picdn.net/shutterstock/videos/1043465536/preview/stock-footage-cappadocia-turkey-november-young-female-taking-pictures-of-air-balloons-by-iphone.mp4,PT00H00M12S,112851_112900,"Cappadocia, turkey - november 2019: young female taking pictures of air balloons by iphone"
1053998045,https://ak.picdn.net/shutterstock/videos/1053998045/preview/stock-footage-apply-natural-toothpaste-to-a-red-toothbrush.mp4,PT00H00M04S,131051_131100,Apply natural toothpaste to a red toothbrush.
18200866,https://ak.picdn.net/shutterstock/videos/18200866/preview/stock-footage-young-successful-businessman-speaking-on-phone-on-bench-in-morning-park-slow-motion.mp4,PT00H00M09S,039951_040000,Young successful businessman speaking on phone on bench in morning park. slow motion.
4523408,https://ak.picdn.net/shutterstock/videos/4523408/preview/stock-footage-bristlecone-pine-circular-dolly-left-and-right-ancient-forest-white-mountain-california.mp4,PT00H00M48S,130501_130550,Bristlecone pine circular dolly 06 left and right ancient forest white mountain california
9266408,https://ak.picdn.net/shutterstock/videos/9266408/preview/stock-footage-driving-on-road-in-forest-footpath-pine-spruce-birch.mp4,PT00H00M15S,012401_012450,"Driving on road in forest, footpath, pine, spruce, birch"
1055700890,https://ak.picdn.net/shutterstock/videos/1055700890/preview/stock-footage-calender-animated-transparent-background-hd.mp4,PT00H00M15S,017801_017850,Calender animated transparent background hd
23140264,https://ak.picdn.net/shutterstock/videos/23140264/preview/stock-footage-hand-of-the-man-holding-smartphone-and-typing-and-scrolling-on-the-smartphone.mp4,PT00H00M16S,147201_147250,Hand of the man holding smartphone and typing and scrolling on the smartphone.
1055801078,https://ak.picdn.net/shutterstock/videos/1055801078/preview/stock-footage-blockchain-keywords-animation-background-loop-k.mp4,PT00H00M59S,042851_042900,"Blockchain keywords animation, background, loop, 4k
"
5249507,https://ak.picdn.net/shutterstock/videos/5249507/preview/stock-footage-the-towers-of-oracle-on-the-gold-coast-queensland.mp4,PT00H00M06S,172451_172500,The towers of oracle on the gold coast queensland.
7655764,https://ak.picdn.net/shutterstock/videos/7655764/preview/stock-footage-moving-lights-on-black-background-copy-space.mp4,PT00H00M20S,045951_046000,"Moving lights on black background, copy space"
15623482,https://ak.picdn.net/shutterstock/videos/15623482/preview/stock-footage-time-lapse-of-mont-blanc-the-highest-peak-of-the-apls-blue-sky-with-some-clouds-moving.mp4,PT00H00M11S,075851_075900,"Time lapse of mont blanc the highest peak of the apls, blue sky with some clouds moving. "
1060905832,https://ak.picdn.net/shutterstock/videos/1060905832/preview/stock-footage-vancouver-british-columbia-canada-pov-from-tour-bus-rooftop-while-driving-in.mp4,PT00H00M19S,178601_178650,"Vancouver , british columbia / canada - 08 15 2019: pov from tour bus rooftop while driving in vancouver 's city center"
1027554461,https://ak.picdn.net/shutterstock/videos/1027554461/preview/stock-footage-grey-resume-line-icon-on-white-background-cv-application-searching-professional-staff-analyzing.mp4,PT00H00M10S,113851_113900,Grey resume line icon on white background. cv application. searching professional staff. analyzing personnel resume. 4k video motion graphic animation
33513157,https://ak.picdn.net/shutterstock/videos/33513157/preview/stock-footage-wuhan-yellow-crane-temple-rooftop-square-park-panorama-k-timelapse-china.mp4,PT00H00M08S,124751_124800,Wuhan yellow crane temple rooftop square park panorama 4k timelapse china
1028942645,https://ak.picdn.net/shutterstock/videos/1028942645/preview/stock-footage-kelantan-malaysia-may-rd-unidentified-korean-and-malaysian-offshore-workers-with-work.mp4,PT00H00M10S,084301_084350,"Kelantan, malaysia - may 03rd, 2019 : unidentified korean and malaysian offshore workers with work vest transferring from work barge to oil and gas platform using personnel transfer basket."
1024111628,https://ak.picdn.net/shutterstock/videos/1024111628/preview/stock-footage-food-industry-production-of-sausages-at-meat-processing-plant-hands-of-operators-filling-and.mp4,PT00H00M10S,143751_143800,Food industry. production of sausages at meat processing plant. hands of operators filling and forming sausages at food production factory. meat processing. sausage production line. 4k
12068060,https://ak.picdn.net/shutterstock/videos/12068060/preview/stock-footage--k-time-lapse-footage-china-mountains-in-prairie-cloudscape.mp4,PT00H00M12S,144851_144900,4k time lapse footage china mountains in prairie cloudscape
1021845313,https://ak.picdn.net/shutterstock/videos/1021845313/preview/stock-footage-display-stock-market-numbers-in-a-street.mp4,PT00H00M18S,094451_094500,Display stock market numbers in a street
1031034176,https://ak.picdn.net/shutterstock/videos/1031034176/preview/stock-footage-aerial-view-of-suburban-area-with-residential-houses.mp4,PT00H00M20S,119701_119750,Aerial view of suburban area with residential houses.
1010173208,https://ak.picdn.net/shutterstock/videos/1010173208/preview/stock-footage-odessa-ukraine-february-garbage-dump-after-the-end-of-the-holiday-season.mp4,PT00H00M11S,138951_139000,"Odessa, ukraine - february, 2018: garbage dump after the end of the holiday season."
1045136230,https://ak.picdn.net/shutterstock/videos/1045136230/preview/stock-footage-kokomo-resort-in-gili-gede-indonesia-silhouette-two-boats-slowly-sailing-across-the-sea-during.mp4,PT00H00M10S,069251_069300,"Kokomo resort in gili gede, indonesia - silhouette two boats slowly sailing across the sea during golden hours - wide shot"
1046881330,https://ak.picdn.net/shutterstock/videos/1046881330/preview/stock-footage-happy-pregnant-woman-meditating-pregnancy-motherhood-and-expectation-concept.mp4,PT00H00M16S,018301_018350,"Happy pregnant woman meditating. pregnancy, motherhood, and expectation concept"
1065052381,https://ak.picdn.net/shutterstock/videos/1065052381/preview/stock-footage-happy-asian-girl-giving-her-grandmother-orange-for-chinese-new-year-blessing-gift-foreign-texts.mp4,PT00H00M08S,121301_121350,"Happy asian girl giving her grandmother orange for chinese new year blessing gift. (foreign texts mean congratulations, wealth, good luck, good fortune, spring)"
5200415,https://ak.picdn.net/shutterstock/videos/5200415/preview/stock-footage-young-woman-knitting.mp4,PT00H00M43S,133151_133200,Young woman knitting
1059103847,https://ak.picdn.net/shutterstock/videos/1059103847/preview/stock-footage-back-view-portrait-of-half-naked-caucasian-man-bathing-under-the-rain-outdoor.mp4,PT00H00M13S,051351_051400,Back view portrait of half naked caucasian man bathing under the rain outdoor.
1034949611,https://ak.picdn.net/shutterstock/videos/1034949611/preview/stock-footage-beautiful-young-woman-in-knitted-hat-looks-at-boyfriend-against-blurred-lights-at-winter-fair.mp4,PT00H00M13S,067651_067700,Beautiful young woman in knitted hat looks at boyfriend against blurred lights at winter fair closeup slow motion
1033737428,https://ak.picdn.net/shutterstock/videos/1033737428/preview/stock-footage-close-view-at-glowing-charcoal-and-flame-in-barbecue-grill.mp4,PT00H00M09S,025601_025650,Close view at glowing charcoal and flame in barbecue grill
1018284994,https://ak.picdn.net/shutterstock/videos/1018284994/preview/stock-footage-scaring-halloween-atmosphere-closeup.mp4,PT00H00M29S,175901_175950,Scaring halloween atmosphere. closeup
1044792955,https://ak.picdn.net/shutterstock/videos/1044792955/preview/stock-footage-wave-breaking-rocky-the-seashore.mp4,PT00H00M15S,072101_072150,Wave breaking rocky the seashore
19717135,https://ak.picdn.net/shutterstock/videos/19717135/preview/stock-footage-high-quality-motion-animation-representing-various-abstract-and-fluid-metallic-liquid-elements.mp4,PT00H00M08S,059301_059350,"High quality motion animation representing various abstract and fluid metallic liquid elements, animated on a black background."
1007808640,https://ak.picdn.net/shutterstock/videos/1007808640/preview/stock-footage-modern-senior-man-at-home-using-cellphone-professor-talking-on-phone-in-library-bookcase.mp4,PT00H00M12S,092301_092350,Modern senior man at home using cellphone. professor talking on phone in library. bookcase bookshelves in background. active modern life after retirement.
1034996765,https://ak.picdn.net/shutterstock/videos/1034996765/preview/stock-footage-australian-cows-on-a-farm-in-queensland-during-the-day.mp4,PT00H00M11S,069051_069100,Australian cows on a farm in queensland during the day.
1039910486,https://ak.picdn.net/shutterstock/videos/1039910486/preview/stock-footage-running-water-at-a-waterfall-at-scott-s-run-a-nature-area-near-great-falls-on-the-maryland.mp4,PT00H00M06S,183201_183250,"Running water at a waterfall at scott's run, a nature area near great falls on the maryland virginia border in the wintertime."
1058806072,https://ak.picdn.net/shutterstock/videos/1058806072/preview/stock-footage-back-view-of-a-woman-admiring-a-spectacular-sunset-with-cloudy-dramatic-sky-and-colourful.mp4,PT00H00M11S,103401_103450,Back view of a woman admiring a spectacular sunset with cloudy dramatic sky and colourful reflection on the ocean.
27103738,https://ak.picdn.net/shutterstock/videos/27103738/preview/stock-footage--s-the-library-has-a-wide-variety-of-resources-and-learning-materials-such-as-audiovisual.mp4,PT00H01M55S,052451_052500,"1960s: the library has a wide variety of resources and learning materials, such as audiovisual material and newspaper records."
1030056710,https://ak.picdn.net/shutterstock/videos/1030056710/preview/stock-footage-blonde-woman-texting-and-speaking-on-mobile-phone-in-a-restaurant.mp4,PT00H00M17S,190001_190050,Blonde woman texting and speaking on mobile phone in a restaurant
1026757346,https://ak.picdn.net/shutterstock/videos/1026757346/preview/stock-footage-night-a-rotating-ferris-wheel.mp4,PT00H00M08S,126351_126400,"Night, a rotating ferris wheel.  "
32468449,https://ak.picdn.net/shutterstock/videos/32468449/preview/stock-footage-kyiv-ukraine-september-a-man-and-woman-dancers-dance-tango-monga-slow-motion.mp4,PT00H00M58S,181701_181750,"Kyiv, ukraine - september 22, 2017. a man and woman dancers dance tango (monga). slow motion."
1019480584,https://ak.picdn.net/shutterstock/videos/1019480584/preview/stock-footage--th-october-bangkok-thailand-hyperlapse-at-the-grand-palace-temple-in-bangkok-thailand.mp4,PT00H00M30S,185851_185900,"26th october 2018. bangkok, thailand. hyperlapse at the grand palace temple in bangkok, thailand. "
1029881315,https://ak.picdn.net/shutterstock/videos/1029881315/preview/stock-footage-beautiful-time-lapse-taipei-city-sunrise-view-cityscape-of-taiwan-at-dawn-with-reflection-of-the.mp4,PT00H00M28S,037151_037200,Beautiful time lapse taipei city sunrise view cityscape of taiwan at dawn with reflection of the city skyline with the taipei 101 by a lake in a city park. pan up motion timelapse.
1026618530,https://ak.picdn.net/shutterstock/videos/1026618530/preview/stock-footage--boy-use-a-mobile-phone-internet-gaming-disorder-boy-looking-at-a-smart-phone-while-lying-on-the.mp4,PT00H00M10S,188651_188700, boy use a mobile phone. internet gaming disorder. boy looking at a smart phone while lying on the bed.
1006666972,https://ak.picdn.net/shutterstock/videos/1006666972/preview/stock-footage-traveler-explores-a-mountain-river-it-moves-up-the-river-he-has-in-his-hands-an-action-camera.mp4,PT00H00M42S,181901_181950,Traveler explores a mountain river. it moves up the river. he has in his hands an action camera with a stabilizer.
1028271935,https://ak.picdn.net/shutterstock/videos/1028271935/preview/stock-footage-paris-france-january-k-view-of-eiffel-tower-from-a-street-with-old-houses-and-traffic.mp4,PT00H00M16S,149051_149100,"Paris, france-13 january, 2018: 4k, view of eiffel tower from a street with old houses and traffic in a winter day at paris, france. cloudy sky in famous touristic places of europe. rainy day-dan"
1066218316,https://ak.picdn.net/shutterstock/videos/1066218316/preview/stock-footage-a-palo-santo-stick-is-light-up-with-a-lighter-a-big-flame-starts-to-grow-on-the-sitck-and-is-then.mp4,PT00H00M44S,183951_184000,A palo santo stick is light up with a lighter. a big flame starts to grow on the sitck and is then turned off by shaking the stick. the smoke which is used as air freshner starts to spread around.
1020177211,https://ak.picdn.net/shutterstock/videos/1020177211/preview/stock-footage-drone-take-off.mp4,PT00H00M08S,171751_171800,Drone take off
1033015823,https://ak.picdn.net/shutterstock/videos/1033015823/preview/stock-footage-automated-wood-polishing-machine-in-a-furniture-manufacturing-facility.mp4,PT00H00M17S,047551_047600,Automated wood polishing machine in a furniture manufacturing facility
1032416591,https://ak.picdn.net/shutterstock/videos/1032416591/preview/stock-footage-circa-s-soldiers-assist-south-vietnamese-children-and-wives-and-their-american-husbands-as.mp4,PT00H01M07S,007001_007050,Circa 1970s - soldiers assist south vietnamese children and wives and their american husbands as they board a warship.
1060316885,https://ak.picdn.net/shutterstock/videos/1060316885/preview/stock-footage-the-little-bee-is-eating-honey-on-a-water-apple-flower-this-water-apple-scientific-name-is.mp4,PT00H00M18S,065301_065350,The little bee is eating honey on a water apple flower. this water apple scientific name is syzygium aqueum. the tree is cultivated for its wood and edible fruit.
1054302902,https://ak.picdn.net/shutterstock/videos/1054302902/preview/stock-footage-aerial-view-of-the-city-kronach-in-germany-on-a-sunny-day-in-spring-during-the-coronavirus.mp4,PT00H00M16S,024701_024750,Aerial view of the city kronach in germany on a sunny day in spring. during the coronavirus lockdown.
1064620015,https://ak.picdn.net/shutterstock/videos/1064620015/preview/stock-footage-white-line-alien-icon-isolated-on-black-background-extraterrestrial-alien-face-or-head-symbol-k.mp4,PT00H00M10S,122751_122800,White line alien icon isolated on black background. extraterrestrial alien face or head symbol. 4k video motion graphic animation
14097326,https://ak.picdn.net/shutterstock/videos/14097326/preview/stock-footage-night-view-of-the-earth-from-space-with-lights-glowing-in-urban-areas.mp4,PT00H00M15S,145301_145350,Night view of the earth from space with lights glowing in urban areas
1029075533,https://ak.picdn.net/shutterstock/videos/1029075533/preview/stock-footage-closeup-portrait-of-beautiful-smiling-blond-model-dressed-in-summer-hipster-white-t-shirt-trendy.mp4,PT00H00M06S,134451_134500,Closeup portrait of beautiful smiling blond model dressed in summer hipster white t-shirt.trendy girl posing in the street background.funny and positive woman having fun in sunglasses. slow motion
1022224483,https://ak.picdn.net/shutterstock/videos/1022224483/preview/stock-footage-circa-s-a-group-of-young-boys-play-with-fireworks-in-the-s.mp4,PT00H00M48S,190751_190800,Circa 1960s - a group of young boys play with fireworks in the 1960s
1057339534,https://ak.picdn.net/shutterstock/videos/1057339534/preview/stock-footage-cloudy-sunset-in-utah-at-the-bonneville-salt-flats.mp4,PT00H00M10S,181501_181550,Cloudy sunset in utah at the bonneville salt flats 
1042431646,https://ak.picdn.net/shutterstock/videos/1042431646/preview/stock-footage-a-little-blond-boy-lies-in-bed-and-smiles-the-boy-rubs-his-eyes-with-his-hands-in-the-early.mp4,PT00H00M06S,072801_072850,"A little blond boy lies in bed and smiles, the boy rubs his eyes with his hands in the early morning. time to wake up."
1033402184,https://ak.picdn.net/shutterstock/videos/1033402184/preview/stock-footage-oil-refinery-with-sunflower-field-aerial-view-drone-footage-over-oil-refinery-with-sunflower-field.mp4,PT00H00M10S,009051_009100,"Oil refinery with sunflower field aerial view
drone footage over oil refinery with sunflower field in haifa israel
"
1035512393,https://ak.picdn.net/shutterstock/videos/1035512393/preview/stock-footage-a-big-white-hen-is-resting-on-the-straw-in-the-hen-coop-it-looks-rather-thoughtful.mp4,PT00H00M08S,092801_092850,A big white hen is resting on the straw in the hen-coop. it looks rather thoughtful.
1031136809,https://ak.picdn.net/shutterstock/videos/1031136809/preview/stock-footage-victoria-texas-june-victoria-county-courthouse-designed-by-j-riely-gordon-on-a.mp4,PT00H00M10S,117301_117350,"Victoria, texas - june 9, 2019 - 1892 victoria county courthouse, designed by j. riely gordon  on a sunny summer day - establishing zoom out shot"
1019518,https://ak.picdn.net/shutterstock/videos/1019518/preview/stock-footage-happy-woman-with-shopping-bags.mp4,PT00H00M16S,175951_176000,Happy woman with shopping bags
1009978118,https://ak.picdn.net/shutterstock/videos/1009978118/preview/stock-footage-workers-shovel-snow-in-ushuaia-the-world-s-southernmost-city-in-tierra-del-fuego-province.mp4,PT00H00M09S,011901_011950,"Workers shovel snow in ushuaia,  the world's southernmost city, in tierra del fuego province, argentina. "
17326699,https://ak.picdn.net/shutterstock/videos/17326699/preview/stock-footage-milan-circa-may-a-large-view-of-the-front-of-central-station-a-sunday-morning-in-the-city.mp4,PT00H00M24S,042501_042550,"Milan, circa may 2016:a large view of the front of central station. a sunday morning in the city, with traffic and people walking around.ultra hd 4k, real time"
24551051,https://ak.picdn.net/shutterstock/videos/24551051/preview/stock-footage-slow-motion-of-mixing-prepared-pilaf-with-spoon-fps-prores-footage.mp4,PT00H00M30S,117551_117600,"Slow motion of mixing prepared pilaf with spoon, 180fps prores footage"
1055087081,https://ak.picdn.net/shutterstock/videos/1055087081/preview/stock-footage-inscription-on-video-gothenburg-sweden-panorama-of-the-city-and-the-river-goeta-elv-with-ships.mp4,PT00H00M15S,073201_073250,"Inscription on video. gothenburg, sweden. panorama of the city and the river goeta elv with ships. sunset. glitch effect text, aerial view"
1047061552,https://ak.picdn.net/shutterstock/videos/1047061552/preview/stock-footage-a-little-girl-in-a-wool-dress-lies-on-the-carpet-and-plays-with-a-tablet-computer-in-christmas.mp4,PT00H00M31S,130001_130050,A little girl in a wool dress lies on the carpet and plays with a tablet computer in christmas decoration. new year family holiday.
1021708132,https://ak.picdn.net/shutterstock/videos/1021708132/preview/stock-footage-mother-and-son-in-a-bird-park-feed-a-group-of-green-and-red-parrots-with-a-milk.mp4,PT00H00M08S,116151_116200,Mother and son in a bird park feed a group of green and red parrots with a milk
31720123,https://ak.picdn.net/shutterstock/videos/31720123/preview/stock-footage-island-of-birds-at-cape-horn.mp4,PT00H00M17S,197151_197200,Island of birds at cape horn
1013612402,https://ak.picdn.net/shutterstock/videos/1013612402/preview/stock-footage-purple-octopus-over-the-city-violet-octopus-with-long-tentacles-slowly-hovers-in-the-sky-filmed.mp4,PT00H00M14S,140901_140950,Purple octopus over the city. violet octopus with long tentacles slowly hovers in the sky. filmed at a speed of 120fps
1047763894,https://ak.picdn.net/shutterstock/videos/1047763894/preview/stock-footage-a-man-scratches-his-hair-under-the-mouse.mp4,PT00H00M06S,032301_032350,"A man scratches his hair under the mouse
"
1016804452,https://ak.picdn.net/shutterstock/videos/1016804452/preview/stock-footage-bunches-of-heavy-ripe-dark-purple-vine-grape.mp4,PT00H00M10S,069801_069850,Bunches of heavy ripe dark purple vine grape
1023021739,https://ak.picdn.net/shutterstock/videos/1023021739/preview/stock-footage-a-female-hand-touches-a-branch-with-its-blossoming-buds-gently-touches-a-tree-close-up.mp4,PT00H00M13S,179951_180000,"A female hand touches a branch with its blossoming buds, gently touches a tree close up"
1025870048,https://ak.picdn.net/shutterstock/videos/1025870048/preview/stock-footage-handheld-portrait-shot-of-beautiful-young-black-woman-with-bare-chest-posing-isolated-on-dark.mp4,PT00H00M16S,138901_138950,Handheld portrait shot of beautiful young black woman with bare chest posing isolated on dark background and smiling for camera
7314220,https://ak.picdn.net/shutterstock/videos/7314220/preview/stock-footage-rapid-hyper-lapse-of-tokyo-s-picturesque-twilight-hour-transition.mp4,PT00H00M16S,184301_184350,Rapid hyper lapse of tokyo's picturesque twilight hour transition.
1045326700,https://ak.picdn.net/shutterstock/videos/1045326700/preview/stock-footage-gold-glitter-number-loop-a-figure-of-sparkling-particles-d-animation.mp4,PT00H00M10S,179851_179900,Gold glitter number 6 loop. a figure of sparkling particles. 3d animation
1958041,https://ak.picdn.net/shutterstock/videos/1958041/preview/stock-footage-popping-gold-sparks.mp4,PT00H00M03S,004851_004900,Popping gold sparks
1050063916,https://ak.picdn.net/shutterstock/videos/1050063916/preview/stock-footage-yokohama-japan-band-instruments-kids-flag-dancing-music.mp4,PT00H00M05S,196951_197000,Yokohama japan-1954: band instruments kids flag dancing music
16374580,https://ak.picdn.net/shutterstock/videos/16374580/preview/stock-footage-containers-with-white-liquid-on-table.mp4,PT00H00M30S,086951_087000,Containers with white liquid on table.
1024164137,https://ak.picdn.net/shutterstock/videos/1024164137/preview/stock-footage-circa-army-s-new-pursuit-plane-flown-in-stunts-by-james-doolittle-in.mp4,PT00H01M24S,045351_045400,Circa 1920 - army's new pursuit plane flown in stunts by james doolittle in 1925.
1052112088,https://ak.picdn.net/shutterstock/videos/1052112088/preview/stock-footage-surprised-emotionally-shocked-stylish-handsome-young-arab-man-with-dreadlocks-looking-with-puzzled.mp4,PT00H00M08S,090201_090250,"Surprised emotionally shocked stylish handsome young arab man with dreadlocks looking with puzzled expression, waving his head , showing disbelief and doubts indoors."
1013300357,https://ak.picdn.net/shutterstock/videos/1013300357/preview/stock-footage-a-young-woman-hiker-climbs-mountains-with-photo-camera-transfagarasan-carpathian-mountains-in.mp4,PT00H00M11S,140151_140200,"A young woman hiker climbs mountains with photo camera. transfagarasan, carpathian mountains in romania"
22241629,https://ak.picdn.net/shutterstock/videos/22241629/preview/stock-footage-aerial-view-of-sausalito-floating-homes-in-california.mp4,PT00H00M09S,178351_178400,Aerial view of sausalito floating homes in california 6
1033899335,https://ak.picdn.net/shutterstock/videos/1033899335/preview/stock-footage-fukuoka-japan-july-public-viewers-are-seen-taking-photo-on-oiyama-which-is-the-main.mp4,PT00H00M07S,147901_147950,"Fukuoka, japan - july 15, 2019: public viewers are seen taking photo on oiyama which is the main festival for hakata gion yamakasa"
1037811566,https://ak.picdn.net/shutterstock/videos/1037811566/preview/stock-footage-yacht-in-the-sea-over-the-island.mp4,PT00H00M13S,125751_125800,Yacht in the sea over the island
1007202247,https://ak.picdn.net/shutterstock/videos/1007202247/preview/stock-footage-low-aerial-fly-over-of-historic-route-pavement-sign-in-the-scenic-california-mojave-desert.mp4,PT00H00M11S,067151_067200,Low aerial fly over of historic route 66 pavement sign in the scenic california mojave desert.
5426255,https://ak.picdn.net/shutterstock/videos/5426255/preview/stock-footage-man-in-a-expensive-suit-opens-the-door-decorated-cars-and-closes-it.mp4,PT00H00M09S,000501_000550,Man in a expensive suit opens the door decorated cars and closes it
1027393295,https://ak.picdn.net/shutterstock/videos/1027393295/preview/stock-footage-skeleton-coast-namibia-circa-view-across-the-amazing-sand-dunes-of-the-namib-desert-along.mp4,PT00H00M18S,094351_094400,"Skeleton coast, namibia - circa 2018 - view across the amazing sand dunes of the namib desert along the skeleton coast of namibia."
