videoid,contentUrl,duration,page_dir,name
31983889,https://ak.picdn.net/shutterstock/videos/31983889/preview/stock-footage-aerial-drone-video-of-speed-boats-cruising-in-deep-blue-sea.mp4,PT00H00M08S,034101_034150,Aerial drone video of speed boats cruising in deep blue sea
1032249920,https://ak.picdn.net/shutterstock/videos/1032249920/preview/stock-footage-aerial-view-of-party-on-boat-drone-flying-around-boat-on-beach-skyline-coastline-on-background.mp4,PT00H00M13S,190751_190800,"Aerial view of party on boat. drone flying around boat on beach. skyline, coastline on background. circle shoot from drone. koh rong island, cambodia. "
1013398439,https://ak.picdn.net/shutterstock/videos/1013398439/preview/stock-footage-ella-at-dusk-sri-lanka.mp4,PT00H00M11S,066851_066900,"Ella at dusk, sri lanka"
25877309,https://ak.picdn.net/shutterstock/videos/25877309/preview/stock-footage-barcelona-spain-summer-royal-square-with-a-fountain-of-the-three-graces-in-barcelona.mp4,PT00H00M20S,197851_197900,"Barcelona, spain - summer 2016: royal square with a fountain of the three graces in barcelona. attractions in the city center. spain."
1014525158,https://ak.picdn.net/shutterstock/videos/1014525158/preview/stock-footage-happy-blonde-business-woman-in-eyeglasses-and-earphone-sitting-by-the-table-while-talking-by-video.mp4,PT00H00M18S,051901_051950,Happy blonde business woman in eyeglasses and earphone sitting by the table while talking by video call on laptop computer in cafe
10310765,https://ak.picdn.net/shutterstock/videos/10310765/preview/stock-footage-woman-s-hand-cleaning-the-wooden-floor-with-a-blue-cloth-closeup.mp4,PT00H00M14S,196901_196950,Woman's hand cleaning the wooden floor with a blue cloth closeup
16965133,https://ak.picdn.net/shutterstock/videos/16965133/preview/stock-footage-the-woman-in-the-garden-watering-the-plants-from-a-watering-can.mp4,PT00H00M11S,061751_061800,The woman in the garden watering the plants from a watering can
1024018889,https://ak.picdn.net/shutterstock/videos/1024018889/preview/stock-footage-empathy-feelings-mind-head-line-icon-motion-graphic-animation.mp4,PT00H00M06S,039501_039550,"Empathy, feelings, mind, head line icon motion graphic animation"
1044491476,https://ak.picdn.net/shutterstock/videos/1044491476/preview/stock-footage-a-long-eared-owl-asio-otus-is-a-typical-european-nocturnal-predator-in-winter-during-the.mp4,PT00H00M17S,123451_123500,"A long-eared owl (asio otus) is a typical european nocturnal predator. in winter, during the daytime, they rest on trees in the settlements. and at night they fly away to hunt."
1028693024,https://ak.picdn.net/shutterstock/videos/1028693024/preview/stock-footage-belgium-brussels-october-the-stadhuis-van-brussel-city-hall-in-brussels.mp4,PT00H00M14S,172801_172850,"Belgium, brussels - october, 2016: the stadhuis van brussel (city hall) in brussels"
1012447397,https://ak.picdn.net/shutterstock/videos/1012447397/preview/stock-footage-slow-motion-of-young-woman-putting-objects-into-her-bag-from-the-floor-mess-in-women-s-bad-concept.mp4,PT00H00M29S,170801_170850,Slow motion of young woman putting objects into her bag from the floor. mess in women's bad concept.
15676483,https://ak.picdn.net/shutterstock/videos/15676483/preview/stock-footage-waterloo-ontario-canada-september-rainy-night-in-the-city.mp4,PT00H00M10S,075251_075300,"Waterloo, ontario, canada september 2015 rainy night in the city"
8503207,https://ak.picdn.net/shutterstock/videos/8503207/preview/stock-footage-pigeon-on-a-window-ledge.mp4,PT00H00M18S,068701_068750,Pigeon on a window ledge
1009009289,https://ak.picdn.net/shutterstock/videos/1009009289/preview/stock-footage-spices-fresh-cinnamon-sticks-and-a-cup-of-hot-strong-black-tea.mp4,PT00H00M09S,048451_048500,Spices fresh cinnamon sticks and a cup of hot strong black tea
1043640247,https://ak.picdn.net/shutterstock/videos/1043640247/preview/stock-footage-mandarin-on-the-tree-in-a-garden-harvesting-colorful-citrus.mp4,PT00H00M11S,065551_065600,Mandarin on the tree in a garden. harvesting colorful citrus.
20270026,https://ak.picdn.net/shutterstock/videos/20270026/preview/stock-footage-live-yellow-wall-of-reed-abstract-background-loop-ready-file.mp4,PT00H00M09S,030351_030400,Live yellow wall of reed abstract background loop ready file
10185749,https://ak.picdn.net/shutterstock/videos/10185749/preview/stock-footage-amazing-venice-gondola-parking-and-view-to-san-giorgio-maggiore-italy-steadycam-uhd-stock-video.mp4,PT00H00M12S,146751_146800,"Amazing venice gondola parking and view to san giorgio maggiore, italy. steadycam uhd stock video"
1022390233,https://ak.picdn.net/shutterstock/videos/1022390233/preview/stock-footage-pastry-local-noodle-full-hd.mp4,PT00H00M10S,135301_135350,Pastry- local noodle full hd – 1920×1080
1033138106,https://ak.picdn.net/shutterstock/videos/1033138106/preview/stock-footage-chicago-il-usa-chicago-river-congestion-with-large-and-small-vessels-ranging-from.mp4,PT00H00M11S,149351_149400,"Chicago, il / usa - 7/11/19: chicago river congestion with large and small vessels ranging from kayaks to large motorboats. summer leisure and recreation near the merchandise mart in chicago."
1044305248,https://ak.picdn.net/shutterstock/videos/1044305248/preview/stock-footage-zurich-switzerland-december-tram-running-along-the-limmatquai-in-zurich-city-centre-from.mp4,PT00H00M12S,076951_077000,"Zurich, switzerland - december 2019. tram running along the limmatquai in zurich city centre from lindenhof on lindenhof hill in schipfe, zurich, switzerland"
1053674909,https://ak.picdn.net/shutterstock/videos/1053674909/preview/stock-footage-decorative-pond-with-artificial-waterfall-during-the-rain.mp4,PT00H00M17S,125251_125300,Decorative pond with artificial waterfall during the rain.
1058987561,https://ak.picdn.net/shutterstock/videos/1058987561/preview/stock-footage-young-mother-with-little-daughter-feed-pigeons-in-the-park.mp4,PT00H00M06S,026401_026450,Young mother with little daughter feed pigeons in the park.
123697,https://ak.picdn.net/shutterstock/videos/123697/preview/stock-footage-animated-chain-looped.mp4,PT00H00M10S,140051_140100,Animated chain looped
1060334558,https://ak.picdn.net/shutterstock/videos/1060334558/preview/stock-footage-handheld-camera-back-view-of-brunette-holding-chroma-key-green-screen-smartphone-watching-content.mp4,PT00H00M15S,183301_183350,Handheld camera: back view of brunette holding chroma key green screen smartphone watching content. gadgets and contemporary people concept.
1062387673,https://ak.picdn.net/shutterstock/videos/1062387673/preview/stock-footage--k-christmas-ornaments-appear-on-wooden-theme-and-gifts-enter-in-christmas-socks-stop-motion.mp4,PT00H00M07S,050551_050600,6k christmas ornaments appear on wooden theme and gifts enter in christmas socks. stop motion
1058834212,https://ak.picdn.net/shutterstock/videos/1058834212/preview/stock-footage-drone-view-of-lake-iseo-at-sunrise-on-the-left-the-city-of-lovere-which-runs-along-the-lake.mp4,PT00H00M07S,063701_063750,"Drone view of lake iseo at sunrise, on the left the city of lovere which runs along the lake,bergamo italy."
3467795,https://ak.picdn.net/shutterstock/videos/3467795/preview/stock-footage-a-sea-cat-swimming-in-watertank-timelapse.mp4,PT00H00M05S,016801_016850,A sea cat swimming in watertank. timelapse
32490568,https://ak.picdn.net/shutterstock/videos/32490568/preview/stock-footage-aerial-footage-of-kauai-hawaii.mp4,PT00H00M15S,191501_191550,Aerial footage of kauai hawaii
1024174004,https://ak.picdn.net/shutterstock/videos/1024174004/preview/stock-footage-los-angeles-ca-united-states-january-women-s-march-in-los-angeles-california.mp4,PT00H00M17S,127351_127400,"Los angeles, ca / united states - january 19 2019: women's march in los angeles, california."
1025872322,https://ak.picdn.net/shutterstock/videos/1025872322/preview/stock-footage-mobile-technology-and-digital-device-addiction-smiling-man-holding-phone.mp4,PT00H00M12S,127001_127050,Mobile technology and digital device addiction. smiling man holding phone.
1029504185,https://ak.picdn.net/shutterstock/videos/1029504185/preview/stock-footage-beautiful-russian-blonde-girl-walking-in-a-park-looking-at-camera-in-slow-motion-k-blurred.mp4,PT00H00M16S,096651_096700,Beautiful russian blonde girl walking in a park looking at camera in slow motion 4k. blurred blackground.
1022527456,https://ak.picdn.net/shutterstock/videos/1022527456/preview/stock-footage-roasted-chickens-and-ducks-roasted-on-a-charcoal-stove-in-the-open-air-roasted-chickens-and-ducks.mp4,PT00H00M18S,075251_075300,"Roasted chickens and ducks, roasted on a charcoal stove in the open air, roasted chickens and ducks turned whole in coal, with charcoal and flame at outdoor."
28402978,https://ak.picdn.net/shutterstock/videos/28402978/preview/stock-footage-lanterns-floating-on-the-river-waters-with-people-on-background.mp4,PT00H00M28S,076551_076600,Lanterns floating on the river waters with people on background.
15554074,https://ak.picdn.net/shutterstock/videos/15554074/preview/stock-footage-sunflower-field-during-sunset-pan-camera.mp4,PT00H00M07S,130751_130800,"Sunflower field during sunset, pan camera"
1045091131,https://ak.picdn.net/shutterstock/videos/1045091131/preview/stock-footage-happy-boy-rejoices-victory-of-his-favorite-team-of-moldova-a-child-with-a-face-painted-in-national.mp4,PT00H00M06S,121601_121650,Happy boy rejoices victory of his favorite team of moldova. a child with a face painted in national colors. portrait of a happy young fan. joyful emotions and gestures. victory. triumph.
6237761,https://ak.picdn.net/shutterstock/videos/6237761/preview/stock-footage-common-grackle-quiscalus-quiscula-closeup-view-bathing.mp4,PT00H00M11S,062151_062200,"Common grackle, quiscalus quiscula, closeup view bathing"
1045597780,https://ak.picdn.net/shutterstock/videos/1045597780/preview/stock-footage-spinning-shot-of-healthy-medical-marijuana-from-top-down-angle.mp4,PT00H00M17S,145001_145050,Spinning shot of healthy medical marijuana from top down angle
1028779910,https://ak.picdn.net/shutterstock/videos/1028779910/preview/stock-footage-pripyat-aerial-panorama-cityview-over-the-sign-of-ussr-on-the-roof-of-building-drone-flies-over.mp4,PT00H00M10S,113751_113800,"Pripyat aerial panorama cityview over the sign of ussr on the roof of building. drone flies over the deserted abandoned city of pripyat, ukraine. exclusion zone near the chernobyl nuclear power plant."
1023925696,https://ak.picdn.net/shutterstock/videos/1023925696/preview/stock-footage-fly-over-a-misty-forest.mp4,PT00H00M12S,080851_080900,Fly over a misty forest
1045813381,https://ak.picdn.net/shutterstock/videos/1045813381/preview/stock-footage-young-african-man-showing-ok-sign.mp4,PT00H00M05S,060701_060750,Young african man showing ok sign 
8689102,https://ak.picdn.net/shutterstock/videos/8689102/preview/stock-footage-las-vegas-nevada-january-people-gambling-in-casinos-during-the-consumer-electronics-show.mp4,PT00H00M06S,068651_068700,"Las vegas, nevada - january 2015 - people gambling in casinos during the consumer electronics show"
1054442129,https://ak.picdn.net/shutterstock/videos/1054442129/preview/stock-footage-ws-cruise-ship-passing-old-bridge-over-neckar-river-heidelberg-baden-wurttenberg-germany.mp4,PT00H00M10S,008801_008850,"Ws cruise ship passing old bridge over neckar river, heidelberg, baden-wurttenberg, germany"
1015185205,https://ak.picdn.net/shutterstock/videos/1015185205/preview/stock-footage-swimming-pool-with-clear-blue-water-surrounded-with-green-trees-night-view-lantern-reflecting-on.mp4,PT00H00M14S,129301_129350,"Swimming pool with clear blue water surrounded with green trees. night view, lantern reflecting on water surface"
1021738090,https://ak.picdn.net/shutterstock/videos/1021738090/preview/stock-footage-women-s-march-in-los-angeles-california-jan.mp4,PT00H00M16S,107301_107350,"Women's march in los angeles, california. jan 2018"
25450238,https://ak.picdn.net/shutterstock/videos/25450238/preview/stock-footage-sewing-thread-rotating.mp4,PT00H00M24S,020151_020200,"Sewing thread, rotating"
1022017942,https://ak.picdn.net/shutterstock/videos/1022017942/preview/stock-footage-funny-kids-lay-on-sofa-to-play-computer-games-on-smartphone-parents-gave-the-children-a-new-phone.mp4,PT00H00M12S,070551_070600,Funny kids lay on sofa to play computer games on smartphone. parents gave the children a new phone for christmas. modern children are well aware of latest technology. brothers are happy together
30374080,https://ak.picdn.net/shutterstock/videos/30374080/preview/stock-footage-common-seahorse-hippocampus-kuda-in-indonesia.mp4,PT00H00M09S,000151_000200,Common seahorse (hippocampus kuda) in indonesia
1027108853,https://ak.picdn.net/shutterstock/videos/1027108853/preview/stock-footage-slow-motion-of-fire-flames-of-burning-paper-on-black-background.mp4,PT00H00M15S,194151_194200,Slow motion of fire flames of burning paper on black background
6420794,https://ak.picdn.net/shutterstock/videos/6420794/preview/stock-footage-new-hope-pa-may-trains-arrive-and-depart-with-passengers-at-the-new-hope-ivyland-railroad.mp4,PT00H00M20S,141901_141950,"New hope, pa - may 10: trains arrive and depart with passengers at the new hope ivyland railroad station, on may 10, 2014 in new hope, pennsylvania. "
1029496988,https://ak.picdn.net/shutterstock/videos/1029496988/preview/stock-footage-young-woman-in-a-flower-garden-among-beautiful-roses-beautiful-flavour-of-roses.mp4,PT00H00M10S,060501_060550,Young woman in a flower garden among beautiful roses. beautiful flavour of roses
1011577526,https://ak.picdn.net/shutterstock/videos/1011577526/preview/stock-footage-the-propeller-of-the-aircraft-flies-over-the-green-fields-and-houses-the-view-from-the-cockpit.mp4,PT00H00M17S,001201_001250,"The propeller of the aircraft flies over the green fields and houses, the view from the cockpit, the plane pollinates the fields in agriculture, the young pilot"
1030121210,https://ak.picdn.net/shutterstock/videos/1030121210/preview/stock-footage-red-poppy-flowers-rapeseed-plant-staxton-north-yorkshire-england.mp4,PT00H00M15S,072251_072300,Red poppy flowers & rapeseed plant; staxton north yorkshire england
1032690188,https://ak.picdn.net/shutterstock/videos/1032690188/preview/stock-footage-new-york-ny-usa-july-thousands-of-beach-goers-try-to-beat-the-heat-and-humidity-at-coney.mp4,PT00H00M23S,126601_126650,"New york ny/usa-july 4, 2019 thousands of beach goers try to beat the heat and humidity at coney island in brooklyn in new york"
1037044553,https://ak.picdn.net/shutterstock/videos/1037044553/preview/stock-footage-panoramic-view-of-madagascar-landscape.mp4,PT00H00M09S,119201_119250,Panoramic view of madagascar landscape
1023014095,https://ak.picdn.net/shutterstock/videos/1023014095/preview/stock-footage-raw-macaroni-in-rotation-elbow-macaroni-macaroni-rigati-close-up-raw-pasta-grey-background.mp4,PT00H00M18S,055201_055250,"Raw macaroni in rotation.
elbow macaroni.
macaroni rigati close up. 
raw pasta  grey background.
italian cuisine concept."
1063135723,https://ak.picdn.net/shutterstock/videos/1063135723/preview/stock-footage-agriculture-machinery-tomato-harvester-loading-a-trailer-with-fresh-ripe-red-tomatoes.mp4,PT00H00M22S,042701_042750,Agriculture machinery. tomato harvester loading a trailer with fresh ripe red tomatoes.
3422540,https://ak.picdn.net/shutterstock/videos/3422540/preview/stock-footage-inscriptions-love-and-passion-on-a-abstract-background-in-red.mp4,PT00H00M30S,034301_034350,Inscriptions love and passion on a abstract background in red
1041516466,https://ak.picdn.net/shutterstock/videos/1041516466/preview/stock-footage-beautiful-helium-balloons-fly-through-the-air-many-colorful-balloons-flying-in-air-holiday-concept.mp4,PT00H00M13S,127551_127600,Beautiful helium balloons fly through the air. many colorful balloons flying in air. holiday concept
1050198088,https://ak.picdn.net/shutterstock/videos/1050198088/preview/stock-footage-the-child-s-hands-draw-watercolor-on-a-white-sheet-of-paper-sitting-at-the-table.mp4,PT00H00M07S,027051_027100,The child's hands draw watercolor on a white sheet of paper sitting at the table.
24162559,https://ak.picdn.net/shutterstock/videos/24162559/preview/stock-footage-metalworking-cnc-milling-machine-cutting-metal-modern-processing-technology.mp4,PT00H00M21S,189551_189600,Metalworking cnc milling machine. cutting metal modern processing technology.
1030360943,https://ak.picdn.net/shutterstock/videos/1030360943/preview/stock-footage-railway-car-window-a-highway-running-parallel-to-the-evening-sky.mp4,PT00H00M21S,052401_052450,Railway car window. a highway running parallel to the evening sky
1066085119,https://ak.picdn.net/shutterstock/videos/1066085119/preview/stock-footage-front-and-side-view-of-a-white-box-truck-moving-inside-an-illuminated-tunnel-d-rendering.mp4,PT00H00M10S,194001_194050,Front and side view of a white box truck moving inside an illuminated tunnel 3d rendering
32179846,https://ak.picdn.net/shutterstock/videos/32179846/preview/stock-footage-cat-near-the-christmas-tree-and-gifts.mp4,PT00H00M18S,052801_052850,Cat near the christmas tree and gifts
20488444,https://ak.picdn.net/shutterstock/videos/20488444/preview/stock-footage-abstract-background-with-binary-code-and-symbol-of-computer-technologies-on-display-screen.mp4,PT00H00M10S,088551_088600,Abstract background with binary code and symbol of computer technologies on display screen. animation of seamless loop.
1009546187,https://ak.picdn.net/shutterstock/videos/1009546187/preview/stock-footage-easter-cake-and-painted-eggs-in-a-basket.mp4,PT00H00M13S,040301_040350,Easter cake and painted eggs in a basket
1043661841,https://ak.picdn.net/shutterstock/videos/1043661841/preview/stock-footage-quadrocopter-shooting-a-mountain-river-flows-among-the-slopes-and-hills-where-large-trees-grow.mp4,PT00H00M54S,035951_036000,Quadrocopter shooting. a mountain river flows among the slopes and hills where large trees grow. water washes stones and sparkles in the sun.
1037546165,https://ak.picdn.net/shutterstock/videos/1037546165/preview/stock-footage-sham-shui-po-hong-kong-september-aerial-view-of-hong-kong-city.mp4,PT00H00M25S,011851_011900,"Sham shui po, hong kong 14 september 2019: aerial view of hong kong city"
7944337,https://ak.picdn.net/shutterstock/videos/7944337/preview/stock-footage-morning-concept-with-two-cups-of-hot-coffee-outdoors-on-the-porch-of-summer-house-hd-x.mp4,PT00H00M17S,070301_070350,"Morning concept with two cups of hot coffee outdoors on the porch of summer house. hd, 1920x1080."
1022824342,https://ak.picdn.net/shutterstock/videos/1022824342/preview/stock-footage-orange-rotating-organic-fruit.mp4,PT00H00M30S,021701_021750,Orange rotating. organic fruit   
1016630866,https://ak.picdn.net/shutterstock/videos/1016630866/preview/stock-footage-online-shopping-related.mp4,PT00H00M06S,028751_028800,Online shopping related
1039917896,https://ak.picdn.net/shutterstock/videos/1039917896/preview/stock-footage--k-professional-swag-freestyle-dancer-stylish-young-girl-dancing-with-real-strobe-lights.mp4,PT00H00M42S,013901_013950,4k professional swag freestyle dancer . stylish young girl dancing with real strobe lights . against blue background with triangle shape of led lights . showing heart by fingers during dance . 
1018565494,https://ak.picdn.net/shutterstock/videos/1018565494/preview/stock-footage-attractive-woman-scents-and-hugs-tree-feeling-its-energy-female-nature-lover.mp4,PT00H00M12S,079101_079150,"Attractive woman scents and hugs tree, feeling its energy, female nature lover"
13942751,https://ak.picdn.net/shutterstock/videos/13942751/preview/stock-footage-saint-petersburg-russia-october-laparoscopic-surgery-on-the-monitor-in-operation-room-full.mp4,PT00H00M22S,090951_091000,"Saint-petersburg, russia, october 2015: laparoscopic surgery on the monitor in operation room, full hd"
1007381371,https://ak.picdn.net/shutterstock/videos/1007381371/preview/stock-footage-counting-on-calculator-finger-presses-the-button-calculator-closeup.mp4,PT00H00M12S,050401_050450,Counting on calculator. finger presses the button calculator. closeup.
12605123,https://ak.picdn.net/shutterstock/videos/12605123/preview/stock-footage-closeup-of-fun-gay-couple-posing-for-silly-selifes-in-front-of-gay-pride-rainbow-wall.mp4,PT00H00M21S,080101_080150,Closeup of fun gay couple posing for silly selifes in front of gay pride rainbow wall
1034526857,https://ak.picdn.net/shutterstock/videos/1034526857/preview/stock-footage-pushkar-india-november-indian-young-boy-in-the-desert-thar-on-time-pushkar-camel-mela.mp4,PT00H00M10S,035351_035400,"Pushkar, india - november 15, 2018 : indian young boy in the desert thar on time pushkar camel mela near holy city pushkar, rajasthan, india, close up portrait"
27837343,https://ak.picdn.net/shutterstock/videos/27837343/preview/stock-footage-glenbeg-ardnamurchan-scotland-may-ardnamurchan-distillery-is-producing-whisky-since.mp4,PT00H00M25S,123251_123300,"Glenbeg, ardnamurchan / scotland - may 26 2017 : ardnamurchan distillery is producing whisky since 2014 and actually expanding their warehouses in glenbeg, aerial"
1034353013,https://ak.picdn.net/shutterstock/videos/1034353013/preview/stock-footage-little-girl-working-at-laboratory-alone-assembling-and-testing-to-equipment-in-workshop.mp4,PT00H00M10S,115551_115600,"Little girl working at laboratory alone, assembling and testing to equipment in workshop. technology and innovation concept."
1042910440,https://ak.picdn.net/shutterstock/videos/1042910440/preview/stock-footage-the-dance-of-a-cheerful-santa-claus-the-concept-of-christmas-looped-animation-in-front-of-green.mp4,PT00H00M05S,126651_126700,The dance of a cheerful santa claus. the concept of christmas. looped animation in front of green screen.
1018628479,https://ak.picdn.net/shutterstock/videos/1018628479/preview/stock-footage-slowmotion-detail-of-golden-retriever-sniffing-around.mp4,PT00H00M11S,127251_127300,Slowmotion detail of golden retriever sniffing around
14342161,https://ak.picdn.net/shutterstock/videos/14342161/preview/stock-footage-sunset-from-the-sea.mp4,PT00H00M27S,075451_075500,Sunset from the sea
1044529882,https://ak.picdn.net/shutterstock/videos/1044529882/preview/stock-footage-april-landscape-month-zoom-text-animation-labour-calendar-april-zoom-month-landscape-text-landscape.mp4,PT00H00M05S,143401_143450,April landscape month zoom text animation labour calendar april zoom month landscape text landscape labour animation april animation month animation text zoom labour zoom april calendar month calendar
1036270394,https://ak.picdn.net/shutterstock/videos/1036270394/preview/stock-footage-galilee-of-israel-village-and-nature.mp4,PT00H00M09S,036151_036200,Galilee of israel village and nature
1026523277,https://ak.picdn.net/shutterstock/videos/1026523277/preview/stock-footage-vitruvian-man-animation.mp4,PT00H00M12S,055651_055700,Vitruvian man animation
3640298,https://ak.picdn.net/shutterstock/videos/3640298/preview/stock-footage-ma-walks-into-shot-and-cleans-salad-then-exits-shot.mp4,PT00H00M32S,021201_021250,"Ma walks into shot and cleans salad, then exits shot"
4783808,https://ak.picdn.net/shutterstock/videos/4783808/preview/stock-footage-black-man-holding-his-partner.mp4,PT00H00M11S,076851_076900,Black man holding his partner
11271623,https://ak.picdn.net/shutterstock/videos/11271623/preview/stock-footage-colorful-fireworks-explode-in-the-night-sky.mp4,PT00H00M08S,096701_096750,Colorful fireworks explode in the night sky.
34668937,https://ak.picdn.net/shutterstock/videos/34668937/preview/stock-footage-worm-caterpillar-grub-larva-maggot-of-food-moth.mp4,PT00H00M10S,124451_124500,"Worm, caterpillar, grub, larva, maggot of food moth"
11854361,https://ak.picdn.net/shutterstock/videos/11854361/preview/stock-footage-aerial-united-kingdom-henley-on-thames-and-river-henley-on-thames.mp4,PT00H00M07S,092551_092600,Aerial united kingdom-henley-on-thames and river 2005: henley-on-thames
1012277006,https://ak.picdn.net/shutterstock/videos/1012277006/preview/stock-footage-young-man-cutting-grass-on-a-lawn-mowing-on-a-sunny-day-young-man-with-mower-on-lawn-trimming-grass.mp4,PT00H00M26S,049751_049800,Young man cutting grass on a lawn mowing on a sunny day young man with mower on lawn trimming grass
24621674,https://ak.picdn.net/shutterstock/videos/24621674/preview/stock-footage-we-can-see-a-big-tractor-driving-on-the-grass-field-and-it-is-turning-hay-around-with-a-big.mp4,PT00H00M17S,001801_001850,We can see a big tractor driving on the grass field and it is turning hay around with a big agricultural machinery.  
5620100,https://ak.picdn.net/shutterstock/videos/5620100/preview/stock-footage-vertical-fishing-net-to-pick-zooplankton.mp4,PT00H00M07S,033651_033700,Vertical fishing net to pick zooplankton
1059338141,https://ak.picdn.net/shutterstock/videos/1059338141/preview/stock-footage-close-up-woman-s-hair-blowing-in-the-wind-with-old-dutch-windmill-background-real-time-k.mp4,PT00H00M12S,083251_083300,Close up woman's hair blowing in the wind with old dutch windmill background. real time 4k
18985054,https://ak.picdn.net/shutterstock/videos/18985054/preview/stock-footage-a-attractive-gril-doing-burpee-in-slow-motion-during-workout-in-park.mp4,PT00H00M16S,017301_017350,A attractive gril doing burpee in slow motion during workout in park
1034370248,https://ak.picdn.net/shutterstock/videos/1034370248/preview/stock-footage-two-scientists-are-pumping-vegetables-with-chemicals.mp4,PT00H00M16S,060101_060150,Two scientists are pumping vegetables with chemicals
1008696838,https://ak.picdn.net/shutterstock/videos/1008696838/preview/stock-footage-road-to-blizzards.mp4,PT00H00M33S,058801_058850,Road to blizzards
14817907,https://ak.picdn.net/shutterstock/videos/14817907/preview/stock-footage-ski-road-in-a-snowy-forest.mp4,PT00H00M05S,085201_085250,Ski road in a snowy forest.
