videoid,contentUrl,duration,page_dir,name
1016056270,https://ak.picdn.net/shutterstock/videos/1016056270/preview/stock-footage-beautiful-brunette-woman-taking-a-photo-of-the-seashore-on-her-smartphone-at-the-beach-cheerful.mp4,PT00H00M12S,021851_021900,"Beautiful brunette woman taking a photo of the seashore on her smartphone at the beach. cheerful mood, vlogger, instagram. modern gadgets, devices. female portrait"
1063594534,https://ak.picdn.net/shutterstock/videos/1063594534/preview/stock-footage-displeased-and-disappointed-young-caucasian-man-is-shaking-his-head-negatively-with-something.mp4,PT00H00M06S,090101_090150,Displeased and disappointed young caucasian man is shaking his head negatively with something standing isolated over red wall background in studio.
1050653056,https://ak.picdn.net/shutterstock/videos/1050653056/preview/stock-footage-thoughtful-woman-face-on-blue-background-portrait-of-serious-woman-looking-at-camera-in-studio.mp4,PT00H00M19S,127151_127200,Thoughtful woman face on blue background. portrait of serious woman looking at camera in studio. close up pensive model posing indoors in slow motion. thinking girl face
1035010550,https://ak.picdn.net/shutterstock/videos/1035010550/preview/stock-footage-freelance-asian-women-working-on-laptop-at-office-young-asia-business-girl-using-the-computer-for.mp4,PT00H00M17S,130401_130450,"Freelance asian women working on laptop at office. young asia business girl using the computer for trade, send email, digital work on the internet on table at workplace concept. slow motion."
1030060370,https://ak.picdn.net/shutterstock/videos/1030060370/preview/stock-footage-toronto-ontario-canada-may-driving-plate-pov-reverse-angle-highway-driving-with-tractor.mp4,PT00H00M29S,066501_066550,"Toronto, ontario, canada may 2019 driving plate pov reverse angle highway driving with tractor trailer trucks and cars"
1013233154,https://ak.picdn.net/shutterstock/videos/1013233154/preview/stock-footage-woman-takes-a-smart-city-night.mp4,PT00H00M12S,149151_149200,Woman takes a smart city night
21977353,https://ak.picdn.net/shutterstock/videos/21977353/preview/stock-footage-las-herrerias-spain-august-horse-farrier-working-on-white-horse-on-august.mp4,PT00H00M11S,194801_194850,"Las herrerias, spain - august, 05: horse farrier working on white horse on august 05, 2016"
1027393949,https://ak.picdn.net/shutterstock/videos/1027393949/preview/stock-footage-man-washing-his-hands-in-bathroom-of-a-hotel-room-bathroom-counter-with-sink-and-mirror-and-free.mp4,PT00H00M16S,124401_124450,Man washing his hands in bathroom of a hotel room. bathroom counter with sink and mirror and free toiletries.
515371,https://ak.picdn.net/shutterstock/videos/515371/preview/stock-footage-black-woman-with-short-hair-talking-animation-on-green-screen-no-sound-track.mp4,PT00H00M09S,146201_146250,Black woman with short hair talking. animation on green screen. no sound track
1027595846,https://ak.picdn.net/shutterstock/videos/1027595846/preview/stock-footage-a-hand-in-front-of-a-wooden-backdrop-counts-to-five-with-fingers.mp4,PT00H00M18S,026101_026150,A hand in front of a wooden backdrop counts to five with fingers.
22354954,https://ak.picdn.net/shutterstock/videos/22354954/preview/stock-footage-clouds-moving-fast-over-castle-time-lapse.mp4,PT00H00M12S,072051_072100,Clouds moving fast over castle time lapse
6789298,https://ak.picdn.net/shutterstock/videos/6789298/preview/stock-footage-street-food-in-mumbai.mp4,PT00H00M18S,021101_021150,Street food in mumbai
34375867,https://ak.picdn.net/shutterstock/videos/34375867/preview/stock-footage-lovely-young-woman-with-clean-skin-looking-at-camera-and-charmingly-smiling-while-standing-on-gray.mp4,PT00H00M28S,177051_177100,Lovely young woman with clean skin looking at camera and charmingly smiling while standing on gray background. 
1044275380,https://ak.picdn.net/shutterstock/videos/1044275380/preview/stock-footage-heart-background-for-valentine-falling-and-rotating-hearts-looped.mp4,PT00H00M20S,180001_180050,"Heart background for valentine, falling and rotating hearts looped"
1020958099,https://ak.picdn.net/shutterstock/videos/1020958099/preview/stock-footage-scottish-pony-grazing.mp4,PT00H00M11S,065551_065600,Scottish pony grazing 
5459600,https://ak.picdn.net/shutterstock/videos/5459600/preview/stock-footage-flag-of-sudan-beautiful-d-animation-of-sudan-flag-in-loop-mode.mp4,PT00H00M16S,128501_128550,"Flag of sudan
beautiful 3d animation of sudan flag in loop mode
"
30498970,https://ak.picdn.net/shutterstock/videos/30498970/preview/stock-footage-aerial-view-fisherman-netted-fish-bali-beach-indonesia.mp4,PT00H01M01S,110101_110150,"Aerial view fisherman netted fish , bali beach, indonesia "
29860669,https://ak.picdn.net/shutterstock/videos/29860669/preview/stock-footage-violet-abstract-low-poly-waving-surface-as-origami-landscape-violet-abstract-geometric-vibrating.mp4,PT00H00M53S,040551_040600,Violet abstract low poly waving surface as origami landscape. violet abstract geometric vibrating environment or pulsating background in cartoon low poly popular modern stylish 3d design..
1026889820,https://ak.picdn.net/shutterstock/videos/1026889820/preview/stock-footage-venice-italy-view-from-the-water-of-boats-passing-the-warehouses-lining-the-giudecca.mp4,PT00H00M15S,063851_063900,"Venice, italy - 07 23 2018: view from the water of boats passing the warehouses lining the giudecca canal, venice, italy"
7474489,https://ak.picdn.net/shutterstock/videos/7474489/preview/stock-footage-close-up-of-a-domestic-clock.mp4,PT00H00M15S,172551_172600,Close-up of a domestic clock
7592908,https://ak.picdn.net/shutterstock/videos/7592908/preview/stock-footage-attractive-couple-sightseeing-and-having-fun-in-city.mp4,PT00H00M14S,170351_170400,Attractive couple sightseeing and having fun in city
385252,https://ak.picdn.net/shutterstock/videos/385252/preview/stock-footage-red-background.mp4,PT00H00M40S,057151_057200,Red background
27918751,https://ak.picdn.net/shutterstock/videos/27918751/preview/stock-footage-close-up-zoom-out-iconic-mount-rushmore-monument-surrounded-pine-trees-in-black-hills-south.mp4,PT00H00M14S,063851_063900,"Close up zoom out: iconic mount rushmore monument surrounded pine trees in black hills, south dakota, united states. famous us presidents washington, roosevelt, jefferson and lincoln rocky sculpture"
1060207043,https://ak.picdn.net/shutterstock/videos/1060207043/preview/stock-footage-durmitor-area-montenegro-drone-flying-over-the-amazing-turquoise-water-of-the-black-lake-crno.mp4,PT00H00M08S,124751_124800,"Durmitor area,montenegro. drone flying over the amazing turquoise water of the black lake(crno jezero) "
29408584,https://ak.picdn.net/shutterstock/videos/29408584/preview/stock-footage-mesquite-flat-sand-dunes-in-death-valley-national-park-in-the-morning.mp4,PT00H00M28S,089651_089700,Mesquite flat sand dunes in death valley national park in the morning
1034374421,https://ak.picdn.net/shutterstock/videos/1034374421/preview/stock-footage-close-up-of-walks-away-young-bride-in-white-wedding-dress-fashion-model-posing-in-nature-stylish.mp4,PT00H00M05S,108051_108100,"Close-up of walks away. young bride in white wedding dress. fashion model posing in nature. stylish woman with suitcase in hands, glamour dress, happy romantic holiday, positive life, freedom concept"
1025100077,https://ak.picdn.net/shutterstock/videos/1025100077/preview/stock-footage-flight-over-the-pinapple-plantation-located-on-oahu-hawaii.mp4,PT00H00M20S,101751_101800,"Flight over the pinapple plantation located on oahu, hawaii"
14483572,https://ak.picdn.net/shutterstock/videos/14483572/preview/stock-footage-underwater-luxury-empty-infinity-swimming-pool-in-high-class-hotel-resort-with-overwater-villas-in.mp4,PT00H00M19S,051251_051300,Underwater: luxury empty infinity swimming pool in high class hotel resort with overwater villas in the background on a beautiful sunny day in summer
1064356051,https://ak.picdn.net/shutterstock/videos/1064356051/preview/stock-footage-glitching-footage-of-young-man-dancing-and-listening-to-music-on-headphones.mp4,PT00H00M15S,137001_137050,Glitching footage of young man dancing and listening to music on headphones
1393903,https://ak.picdn.net/shutterstock/videos/1393903/preview/stock-footage-pythons-hatching.mp4,PT00H00M12S,084201_084250,Pythons hatching
1022024164,https://ak.picdn.net/shutterstock/videos/1022024164/preview/stock-footage-the-man-on-the-fitness-ball.mp4,PT00H00M12S,053951_054000,The man on the fitness ball.
13505036,https://ak.picdn.net/shutterstock/videos/13505036/preview/stock-footage-vegetable-casserole-with-cheese.mp4,PT00H00M30S,195651_195700,Vegetable casserole with cheese
13361318,https://ak.picdn.net/shutterstock/videos/13361318/preview/stock-footage-circa-s-doors-of-a-hangar-open-to-reveal-a-rq-surveillance-drone.mp4,PT00H00M53S,108851_108900,Circa 2010s - doors of a hangar open to reveal a rq-4 surveillance drone.
1020042661,https://ak.picdn.net/shutterstock/videos/1020042661/preview/stock-footage-timelapse-of-vibrant-cloudscape-over-rush-forest-in-hakone-japan-vertical-shot.mp4,PT00H00M20S,050801_050850,"Timelapse of vibrant cloudscape over rush forest in hakone, japan -vertical shot-"
1014040013,https://ak.picdn.net/shutterstock/videos/1014040013/preview/stock-footage-young-happy-couple-showing-something-together.mp4,PT00H00M06S,135801_135850,Young happy couple showing something together
17852626,https://ak.picdn.net/shutterstock/videos/17852626/preview/stock-footage--k-radar-gps-signal-tech-screen-display-future-science-sci-fi-data-computer-game-navigation.mp4,PT00H00M23S,179201_179250,"4k radar gps signal tech screen display,future science sci-fi data computer game navigation dashboard technology interface background. 4572_4k"
1047815566,https://ak.picdn.net/shutterstock/videos/1047815566/preview/stock-footage-festival-decorative-flags-lines-of-flags-the-flags-are-made-of-brightly-colored-yarns-in-many.mp4,PT00H00M11S,009001_009050,"Festival decorative flags, lines of flags, the flags are made of brightly colored yarns in many sizes and colors. the flags are decorated in local festivals of thailand."
1020527248,https://ak.picdn.net/shutterstock/videos/1020527248/preview/stock-footage-lviv-ukraine-july-close-up-old-and-exprienced-artist-talk-with-young-girl-on-workshop.mp4,PT00H00M09S,019001_019050,"Lviv \ ukraine - july 7 2018: close up old and exprienced artist talk with young girl on workshop artist, board canvas hobby inspiration man conversation color creative draw eldery indoor"
960430,https://ak.picdn.net/shutterstock/videos/960430/preview/stock-footage-mountain-river-in-forest.mp4,PT00H00M10S,103101_103150,Mountain river in forest
1007158369,https://ak.picdn.net/shutterstock/videos/1007158369/preview/stock-footage-view-from-whangamata-beach-new-zealand.mp4,PT00H00M10S,149851_149900,"View from whangamata beach, new zealand"
1028269487,https://ak.picdn.net/shutterstock/videos/1028269487/preview/stock-footage-intense-cloud-time-lapse-dynamic-changing-shapes-fast-speed.mp4,PT00H00M12S,128601_128650,Intense cloud time lapse dynamic changing shapes fast speed
1041319681,https://ak.picdn.net/shutterstock/videos/1041319681/preview/stock-footage-aerial-drone-shot-of-the-tropical-and-beautiful-anse-source-d-argent-beach-in-the.mp4,PT00H00M11S,195851_195900,Aerial drone shot of the tropical and beautiful anse source d'argent beach in the
30626797,https://ak.picdn.net/shutterstock/videos/30626797/preview/stock-footage-people-placing-bets-for-roulette-in-casino-close-up-shot-on-red-epic-dragon-cinema-camera-in.mp4,PT00H00M25S,091451_091500,People placing bets for roulette in casino. close up.  shot on red epic dragon cinema camera in slow motion. 4k
1032306680,https://ak.picdn.net/shutterstock/videos/1032306680/preview/stock-footage-tokyo-japan-june-tokyo-city-bunkyo-district.mp4,PT00H00M40S,188901_188950,"Tokyo, japan 26 june 2019: tokyo city, bunkyo district"
1028167067,https://ak.picdn.net/shutterstock/videos/1028167067/preview/stock-footage-fly-paper-hanging-from-a-ceiling-isolated-with-a-blurred-background.mp4,PT00H00M38S,070801_070850,Fly paper hanging from a ceiling isolated with a blurred background
31780075,https://ak.picdn.net/shutterstock/videos/31780075/preview/stock-footage-autumn-fall-scene-beauty-nature-scene-trees-and-leaves-nature-background-selective-focus.mp4,PT00H00M52S,128051_128100,Autumn. fall scene. beauty nature scene trees and leaves. nature background. selective focus.
30325408,https://ak.picdn.net/shutterstock/videos/30325408/preview/stock-footage-group-of-horses-eating-hay-in-an-arid-field-on-sunny-summer-day-horses-eating-hay-on-the-farm-sun.mp4,PT00H00M12S,143801_143850,"Group of horses eating hay in an arid field on sunny summer day. horses eating hay on the farm,sun glare.
"
26815042,https://ak.picdn.net/shutterstock/videos/26815042/preview/stock-footage-concept-of-rem-man-eyes-during-sleep-interrupted-by-a-nightmare.mp4,PT00H00M30S,190751_190800,Concept of rem man eyes during sleep interrupted by a nightmare
24661526,https://ak.picdn.net/shutterstock/videos/24661526/preview/stock-footage-male-caucasian-barista-making-coffee-in-disposable-cup-in-slowmotion.mp4,PT00H00M30S,012851_012900,Male caucasian barista making coffee in disposable cup in slowmotion
15515695,https://ak.picdn.net/shutterstock/videos/15515695/preview/stock-footage-small-waterfall-river-flowing-naturally-over-rocks-close-up.mp4,PT00H00M10S,071901_071950,Small waterfall river flowing naturally over rocks close up
1050479266,https://ak.picdn.net/shutterstock/videos/1050479266/preview/stock-footage-vacaville-california-the-woman-feeding-her-dog-in-a-ranch.mp4,PT00H00M05S,020151_020200,Vacaville california-1937: the woman feeding her dog in a ranch
6292037,https://ak.picdn.net/shutterstock/videos/6292037/preview/stock-footage-winter-landscape-with-dolomites-mountains-full-of-snow.mp4,PT00H00M07S,142651_142700,"Winter landscape, with dolomites mountains full of snow
"
1056076364,https://ak.picdn.net/shutterstock/videos/1056076364/preview/stock-footage-zoom-out-k-time-lapse-daytime-at-seojangdae-and-moving-clouds-in-hwaseong-fortress-at-suwon-city.mp4,PT00H00M08S,072151_072200,"Zoom out 4k,time lapse daytime at seojangdae.and moving clouds in hwaseong fortress at suwon city south korea"
1057489876,https://ak.picdn.net/shutterstock/videos/1057489876/preview/stock-footage-stick-figure-color-pictogram-woman-girl-character-walks-with-selfie-stick-for-smartphone-cartoon.mp4,PT00H00M20S,173301_173350,Stick figure color pictogram woman girl character walks with selfie stick for smartphone cartoon animation. luma matte
6983002,https://ak.picdn.net/shutterstock/videos/6983002/preview/stock-footage-pendants-glittering-spinning-zoom-out.mp4,PT00H00M30S,096851_096900,"Pendants glittering spinning, zoom out"
4838171,https://ak.picdn.net/shutterstock/videos/4838171/preview/stock-footage-people-walking-on-the-galata-bridge-at-istanbul-turkey.mp4,PT00H00M15S,183201_183250,People walking on the galata bridge at istanbul turkey
1035012584,https://ak.picdn.net/shutterstock/videos/1035012584/preview/stock-footage-elderly-man-with-grey-beard-and-grey-hair-is-walking-his-husky-dog-along-rural-road-in-field-at.mp4,PT00H00M25S,119051_119100,Elderly man with grey beard and grey hair is walking his husky dog along rural road in field at sunset
1006672708,https://ak.picdn.net/shutterstock/videos/1006672708/preview/stock-footage-ethiopia-danakil-circa-january-unidentified-worker-and-camels-carovan-in-the-village-afar.mp4,PT00H00M10S,036201_036250,"Ethiopia,danakil-circa  january 2018--unidentified   worker and camels carovan in the village afar
"
26917939,https://ak.picdn.net/shutterstock/videos/26917939/preview/stock-footage-young-woman-on-the-beach-in-yoga-position.mp4,PT00H00M10S,186001_186050,Young woman on the beach in yoga position
22655719,https://ak.picdn.net/shutterstock/videos/22655719/preview/stock-footage-valletta-malta-child-girl-eat-pastry-and-play-with-cat-lying-on-street-table.mp4,PT00H00M12S,082151_082200,"Valletta, malta - child girl eat pastry and play with cat lying on street table"
1017509704,https://ak.picdn.net/shutterstock/videos/1017509704/preview/stock-footage-festival-of-lanterns-on-the-water-water-lantern-in-the-shape-of-a-lotus-with-a-candle-flame.mp4,PT00H00M28S,083001_083050,Festival of lanterns on the water. water lantern in the shape of a lotus with a candle flame floating at night on the water.
17668531,https://ak.picdn.net/shutterstock/videos/17668531/preview/stock-footage-istanbul-turkey-march-pedestrians-pass-by-the-busy-narrow-streets-on-march-in.mp4,PT00H00M24S,069551_069600,"Istanbul, turkey - march 15, 2016: pedestrians pass by the busy narrow streets on march 15, 2016 in istanbul, turkey. 
"
25310072,https://ak.picdn.net/shutterstock/videos/25310072/preview/stock-footage--k-smiling-happy-beautiful-asian-woman-waiting-on-train-using-a-mobile-touch-screen-cell-phone-with.mp4,PT00H00M15S,058251_058300,"4k smiling happy beautiful asian woman waiting on train using a mobile touch screen cell phone with people sit down background. surfing internet, checks social network and write text on smartphone-dan"
10211192,https://ak.picdn.net/shutterstock/videos/10211192/preview/stock-footage-moscow-jun-girl-in-inflatable-costume-catches-kids-in-elk-island-new-residential.mp4,PT00H00M05S,178451_178500,"Moscow - jun 24, 2014: girl in inflatable costume catches kids in elk island. new residential complex elk island was built in greenest district of capital next to national park"
14222531,https://ak.picdn.net/shutterstock/videos/14222531/preview/stock-footage-bagan-myanmar-january-hot-air-balloon-over-the-temple-of-bagan-at-dawn-ballooning-to.mp4,PT00H00M16S,084851_084900,"Bagan, myanmar - january 15, 2016 : hot air balloon over the temple of bagan at dawn. ballooning to see sunrise is one of the most popular outdoor activities in bagan."
1030040597,https://ak.picdn.net/shutterstock/videos/1030040597/preview/stock-footage-children-with-an-umbrella-are-walking-along-the-sidewalk-in-the-rain-on-a-summer-day-top-view.mp4,PT00H00M20S,178751_178800,Children with an umbrella are walking along the sidewalk in the rain on a summer day. top view through the green branches of trees.
1007305894,https://ak.picdn.net/shutterstock/videos/1007305894/preview/stock-footage-office-teamwork-business-people-discussing-financial-reports.mp4,PT00H00M19S,067801_067850,Office teamwork - business people discussing financial reports
8438026,https://ak.picdn.net/shutterstock/videos/8438026/preview/stock-footage-butterfly-flying-off-a-branch.mp4,PT00H00M10S,125701_125750,Butterfly flying off a branch
1011519443,https://ak.picdn.net/shutterstock/videos/1011519443/preview/stock-footage-blood-cells-traveling-through-a-vein-in-human-body.mp4,PT00H00M10S,087851_087900,Blood cells traveling through a vein in human body
1056249194,https://ak.picdn.net/shutterstock/videos/1056249194/preview/stock-footage-slow-motion-two-engineers-men-in-uniform-discuss-use-laptop-stand-near-wind-turbines-ecological.mp4,PT00H00M14S,031851_031900,Slow motion two engineers men in uniform discuss use laptop stand near wind turbines ecological energy industry power windmill field worker renewable close up
1055052482,https://ak.picdn.net/shutterstock/videos/1055052482/preview/stock-footage-beautiful-green-dill-and-parsley-grows-in-the-beds.mp4,PT00H00M22S,032001_032050,Beautiful green dill and parsley grows in the beds
9027919,https://ak.picdn.net/shutterstock/videos/9027919/preview/stock-footage-snow-on-rocks-beside-blue-river-aerial-shot-k-flying-over-blue-clear-river-sava-in-slovenia.mp4,PT00H00M27S,115001_115050,"Snow on rocks beside blue river aerial shot 4k. flying over blue clear river sava in slovenia, winter time with snow on ground and sunny weather with blue sky. electric towers over river."
11135843,https://ak.picdn.net/shutterstock/videos/11135843/preview/stock-footage-tractor-plowing-the-field-and-prepare-it-for-planting.mp4,PT00H00M28S,172151_172200,Tractor plowing the field and prepare it for planting
24779642,https://ak.picdn.net/shutterstock/videos/24779642/preview/stock-footage-a-cinemagraph-of-seagull-going-back-and-forth-on-a-sandy-beach-with-big-waves.mp4,PT00H00M04S,114451_114500,A cinemagraph of seagull going back and forth on a sandy beach with big waves
1015967074,https://ak.picdn.net/shutterstock/videos/1015967074/preview/stock-footage-slow-motion-k-happy-asian-farmer-harvest-fresh-vegetables-in-organic-farm.mp4,PT00H00M13S,067151_067200,Slow motion 4k happy asian farmer harvest fresh vegetables in organic farm
1051575382,https://ak.picdn.net/shutterstock/videos/1051575382/preview/stock-footage-doctors-in-hazamat-suits-stacking-hands-team-work-on-white-background.mp4,PT00H00M11S,035101_035150,Doctors in hazamat suits stacking hands team work on white background.
1008686668,https://ak.picdn.net/shutterstock/videos/1008686668/preview/stock-footage-kathmandu-nepal-may-people-of-nepal-cityscape-market-street-durbar-square-kathmandu.mp4,PT00H00M10S,031951_032000,"Kathmandu, nepal - 29 may 2017: people of nepal cityscape market street durbar square kathmandu boudhanath stupa. crowd of people walking on busy street in tibet"
1033547954,https://ak.picdn.net/shutterstock/videos/1033547954/preview/stock-footage-phong-nha-cave-in-the-zone-of-world-heritage-site-phong-nha-ke-bang.mp4,PT00H00M06S,173651_173700,Phong nha cave in the zone of world heritage site phong nha ke bang
1032311783,https://ak.picdn.net/shutterstock/videos/1032311783/preview/stock-footage-aerial-view-of-river-and-green-forests-on-a-sunny-summer-day-in-kiev-ukraine-k-drone-in-raw.mp4,PT00H00M10S,129001_129050,"Aerial view of river and green forests on a sunny summer day in kiev, ukraine. 4k drone in raw."
1012692164,https://ak.picdn.net/shutterstock/videos/1012692164/preview/stock-footage-huge-field-of-blossoming-poppies-background.mp4,PT00H00M10S,090651_090700,Huge field of blossoming poppies. background
1013722580,https://ak.picdn.net/shutterstock/videos/1013722580/preview/stock-footage-aerial-shots-of-a-park-in-cerritos-cypress-ca-i-flew-a-dji-drone-over-the-park-to-capture-the.mp4,PT00H00M09S,126101_126150,Aerial shots of a park in cerritos/cypress ca. i flew a dji drone over the park to capture the green trees and traffic
1051017139,https://ak.picdn.net/shutterstock/videos/1051017139/preview/stock-footage-asian-women-are-working-online-using-a-laptop-computer-she-is-tired-and-has-a-pain-in-the-neck.mp4,PT00H00M15S,132901_132950,"Asian women are working online using a laptop computer, she is tired and has a pain in the neck."
1032148898,https://ak.picdn.net/shutterstock/videos/1032148898/preview/stock-footage-hand-drawn-animation-the-word-is-happy-intercept-advertising.mp4,PT00H00M07S,005201_005250,Hand-drawn animation. the word is happy. intercept advertising
6973777,https://ak.picdn.net/shutterstock/videos/6973777/preview/stock-footage-dusseldorf-germany-july-several-tower-cranes-are-working-on-the-construction-of-residential.mp4,PT00H00M12S,187051_187100,"Dusseldorf, germany - july 30: several tower cranes are working on the construction of residential building  on summer blue cloudy sky background on july 30, 2014 in dusseldorf, germany "
14379550,https://ak.picdn.net/shutterstock/videos/14379550/preview/stock-footage-italian-landmark-boat-passes-on-the-grand-channel-and-under-the-rialto-bridge-k.mp4,PT00H00M13S,002801_002850,Italian landmark  boat passes on the grand channel and under the rialto bridge. 4k
1057284160,https://ak.picdn.net/shutterstock/videos/1057284160/preview/stock-footage-kurushima-strait-bridge-imabari-city-ehime-prefecture-japan-august.mp4,PT00H00M30S,134651_134700,"Kurushima strait bridge. imabari city, ehime prefecture, japan. august 2020."
1015782790,https://ak.picdn.net/shutterstock/videos/1015782790/preview/stock-footage-beautiful-girl-blonde-takes-photos-in-a-swimsuit-on-the-shore-of-a-magnificent-forest-lake.mp4,PT00H00M23S,087001_087050,"Beautiful girl, blonde, takes photos in a swimsuit on the shore of a magnificent forest lake"
1056905942,https://ak.picdn.net/shutterstock/videos/1056905942/preview/stock-footage-funnel-of-water-is-spinning-in-the-glass-slow-motion-in-blue-light-on-black-background-close-up.mp4,PT00H00M20S,180751_180800,"Funnel of water is spinning in the glass. slow motion in blue light on black background, close-up"
1056765623,https://ak.picdn.net/shutterstock/videos/1056765623/preview/stock-footage-circles-gather-in-symbol-bullseye-arrow-after-it-crumbles-in-a-line-and-moves-to-the-camera-alpha.mp4,PT00H00M20S,196451_196500,Circles gather in symbol bullseye arrow. after it crumbles in a line and moves to the camera. alpha channel black
1028070989,https://ak.picdn.net/shutterstock/videos/1028070989/preview/stock-footage-realistic-fire-smoke-explosion-smoke-floor-fog-smoke-floor-fog-from-various-directions.mp4,PT00H00M47S,135501_135550,Realistic fire smoke. explosion smoke. floor fog smoke floor fog from various directions
31537240,https://ak.picdn.net/shutterstock/videos/31537240/preview/stock-footage-floodlight-lights-up-the-falling-of-a-wet-sponge-in-slow-motion-at-fps.mp4,PT00H00M13S,134851_134900,Floodlight lights up the falling of a wet sponge in slow motion at 240 fps
1042535587,https://ak.picdn.net/shutterstock/videos/1042535587/preview/stock-footage-man-in-the-gloves-hammering-steel-frame.mp4,PT00H00M05S,178751_178800,Man in the gloves hammering steel frame
28444135,https://ak.picdn.net/shutterstock/videos/28444135/preview/stock-footage-manager-goes-to-meetings-and-holds-the-documentation-green-screen.mp4,PT00H00M16S,025051_025100,Manager goes to meetings and holds the documentation. green screen
1063415515,https://ak.picdn.net/shutterstock/videos/1063415515/preview/stock-footage-gears-icon-with-arrows-animation-k-video.mp4,PT00H00M08S,026501_026550,Gears icon with arrows animation. 4k video
