videoid,contentUrl,duration,page_dir,name
14943616,https://ak.picdn.net/shutterstock/videos/14943616/preview/stock-footage-farmer-peasant-man-hand-check-oat-ear-growing-in-agricultural-field-static-closeup-shot.mp4,PT00H00M12S,050551_050600,Farmer peasant man hand check oat ear growing in agricultural field. static closeup shot.
31309330,https://ak.picdn.net/shutterstock/videos/31309330/preview/stock-footage--d-animation-rotation-of-symbol-of-religion-creed-faith-god-and-confessions-from-glass.mp4,PT00H00M20S,113251_113300,"3d animation rotation of symbol of religion, creed, faith, god and confessions from glass. animation of seamless loop."
1051901218,https://ak.picdn.net/shutterstock/videos/1051901218/preview/stock-footage-portrait-of-man-fashion-tourist-photographer-laughs-very-loudly-handsome-man-on-vacation-in-blue.mp4,PT00H00M10S,198201_198250,Portrait of man fashion tourist photographer laughs very loudly. handsome man on vacation in blue shirt and hat with retro camera. place for your logo or text. chroma key. green screen
3838682,https://ak.picdn.net/shutterstock/videos/3838682/preview/stock-footage-raw-meat-on-plate-over-wooden-table-x-intro-motion-slow-hidef-hd.mp4,PT00H00M15S,026901_026950,Raw meat on plate over wooden table 1920x1080 intro motion slow hidef hd
17916277,https://ak.picdn.net/shutterstock/videos/17916277/preview/stock-footage-white-flowers-of-spring-wild-garlic-in-the-trees.mp4,PT00H00M22S,129401_129450,White flowers of spring wild garlic in the trees
26472665,https://ak.picdn.net/shutterstock/videos/26472665/preview/stock-footage-senior-couple-standing-outdoors-at-night-trying-to-get-a-taxi-elderly-couple-waiting-for-a-ride-k.mp4,PT00H00M20S,017801_017850,Senior couple standing outdoors at night trying to get a taxi. elderly couple waiting for a ride. 4k
1016684461,https://ak.picdn.net/shutterstock/videos/1016684461/preview/stock-footage-close-up-of-attractive-surfer-girl-walking-with-skateboard-down-street-at-sunset-with-lens-flare.mp4,PT00H00M26S,001401_001450,Close up of attractive surfer girl walking with skateboard down street at sunset with lens flare
1016982556,https://ak.picdn.net/shutterstock/videos/1016982556/preview/stock-footage-mustasaari-ostrobothnia-finland-farming-in-europe-harvesting-season.mp4,PT00H00M10S,011551_011600,"Mustasaari, ostrobothnia / finland - 08 18 2018: farming in europe, harvesting season"
1042070347,https://ak.picdn.net/shutterstock/videos/1042070347/preview/stock-footage-girl-in-a-brown-dress-is-lying-on-the-bed-at-home.mp4,PT00H00M06S,108251_108300,Girl in a brown dress is lying on the bed at home
1018847140,https://ak.picdn.net/shutterstock/videos/1018847140/preview/stock-footage-red-tailed-monogamous-african-congo-grey-parrot-psittacus-erithacus-companion-jaco-is-popular.mp4,PT00H00M22S,072351_072400,"Red-tailed monogamous african congo grey parrot, psittacus erithacus. companion jaco is popular avian pet native to equatorial region. exotic bird in tropical forest."
23991865,https://ak.picdn.net/shutterstock/videos/23991865/preview/stock-footage-dark-high-quality-jeans-texture-moving-waves-seamless-loop.mp4,PT00H00M08S,036451_036500,"Dark high quality jeans texture,moving waves.seamless loop"
1032519653,https://ak.picdn.net/shutterstock/videos/1032519653/preview/stock-footage-aerial-establishing-shot-of-boats-docked-in-el-nido-bay-palawan-philippines.mp4,PT00H00M12S,111501_111550,"Aerial establishing shot of boats docked in el nido bay, palawan, philippines"
30136141,https://ak.picdn.net/shutterstock/videos/30136141/preview/stock-footage-young-beautiful-woman-with-bare-shoulders-against-background-of-green-summer-city-park.mp4,PT00H00M16S,052001_052050,Young beautiful woman with bare shoulders against background of green summer city park.
8564797,https://ak.picdn.net/shutterstock/videos/8564797/preview/stock-footage-time-lapse-of-sunset-at-sea-with-si-chang-island-background-sriracha-choburi-thailand.mp4,PT00H00M05S,050451_050500,"Time lapse of sunset at sea with si chang island background, sriracha, choburi, thailand"
15152134,https://ak.picdn.net/shutterstock/videos/15152134/preview/stock-footage-little-daughter-hand-holds-daddy-big-finger.mp4,PT00H00M15S,142951_143000,Little daughter hand holds daddy big finger
1039384151,https://ak.picdn.net/shutterstock/videos/1039384151/preview/stock-footage-aster-flowers-autumn-pink-and-orange.mp4,PT00H00M04S,019601_019650,Aster flowers autumn pink and orange
8473780,https://ak.picdn.net/shutterstock/videos/8473780/preview/stock-footage-clouds-moving-over-blue-sky-background-k-uhd-timelapse.mp4,PT00H00M31S,043151_043200,Clouds moving over blue sky background. 4k uhd timelapse.
1062420262,https://ak.picdn.net/shutterstock/videos/1062420262/preview/stock-footage-national-flag-country-world-symbol-waving-cg-background.mp4,PT00H00M10S,178651_178700,National flag country world symbol waving cg background.
1009356401,https://ak.picdn.net/shutterstock/videos/1009356401/preview/stock-footage-old-abandon-cemetery-reflected-in-water.mp4,PT00H00M10S,087151_087200,Old abandon cemetery reflected in water
1009371326,https://ak.picdn.net/shutterstock/videos/1009371326/preview/stock-footage-child-s-attentive-look-close-up.mp4,PT00H00M05S,135101_135150,Child's attentive look. close-up
1035658967,https://ak.picdn.net/shutterstock/videos/1035658967/preview/stock-footage-smart-farming-slow-motion-video-concept-man-agronomist-holds-tablet-touch-pad-computer-in-corn.mp4,PT00H00M20S,112401_112450,Smart farming slow motion video concept. man agronomist holds tablet touch pad computer in corn field is studying and examining lifestyle crops before harvesting. agribusiness concept. male farmer
1010603267,https://ak.picdn.net/shutterstock/videos/1010603267/preview/stock-footage-paris-france-apr-new-apple-watch-series-smartwatch-change-strap-band-to-the-new-mm.mp4,PT00H00M10S,176601_176650,"Paris, france - apr 24, 2018: new apple watch series 3 smartwatch change strap band to the new 42mm marine green sport loop"
10746671,https://ak.picdn.net/shutterstock/videos/10746671/preview/stock-footage-camera-following-attacking-football-team-ready-to-shoot-the-ball-against-the-defensive-wall.mp4,PT00H00M14S,061551_061600,Camera following attacking football team ready to shoot the ball against the defensive wall
26033513,https://ak.picdn.net/shutterstock/videos/26033513/preview/stock-footage-smiling-friends-making-selfie-outdoors.mp4,PT00H00M24S,059601_059650,Smiling friends making selfie outdoors
6179480,https://ak.picdn.net/shutterstock/videos/6179480/preview/stock-footage-berlin-april-passengers-disembark-from-the-tram-the-centerpiece-of-berlin-s-modern-public.mp4,PT00H00M18S,099601_099650,"Berlin - april 2014: passengers disembark from the tram, the centerpiece of berlin´s modern public transportation system"
1046191984,https://ak.picdn.net/shutterstock/videos/1046191984/preview/stock-footage-calcutta-india-adults-and-children-outside-in-a-crowd-children-walking-through-the-crowd-in-a.mp4,PT00H00M05S,107701_107750,Calcutta india-1962: adults and children outside in a crowd children walking through the crowd in a line
10077461,https://ak.picdn.net/shutterstock/videos/10077461/preview/stock-footage-providence-ri-may-subway-fast-food-restaurant-open-for-business-on-may-subway-is.mp4,PT00H00M21S,026151_026200,"Providence, ri - may 20: subway fast food restaurant open for business on may 20, 2015. subway is the largest single-brand restaurant chain and the largest restaurant operator in the world."
217189,https://ak.picdn.net/shutterstock/videos/217189/preview/stock-footage-oil-well-drilling-oil.mp4,PT00H00M12S,019751_019800,Oil well drilling oil
1048470748,https://ak.picdn.net/shutterstock/videos/1048470748/preview/stock-footage-the-syringe-piercing-to-human-body-part-in-black-quilted-jacket-and-filling-up-with-red-liquid-like.mp4,PT00H00M09S,023751_023800,The syringe piercing to human body part in black quilted jacket and filling up with red liquid like blood. coronavirus or other disease and cure concept
1026286193,https://ak.picdn.net/shutterstock/videos/1026286193/preview/stock-footage-golden-background-of-thin-metal-bronze-or-copper-decorative-chips-defocused-blurred-view-k.mp4,PT00H00M24S,004551_004600,"Golden background of thin metal bronze or copper decorative chips. defocused, blurred view, 4k"
689590,https://ak.picdn.net/shutterstock/videos/689590/preview/stock-footage-flying-through-geometric-space-loop.mp4,PT00H00M11S,191551_191600,Flying through geometric space loop.
1039466432,https://ak.picdn.net/shutterstock/videos/1039466432/preview/stock-footage-woman-in-sunglasses-wears-a-hat-at-sunset-on-the-beach-travel-concept.mp4,PT00H00M23S,052801_052850,"Woman in sunglasses wears a hat at sunset on the beach, travel concept"
6708052,https://ak.picdn.net/shutterstock/videos/6708052/preview/stock-footage-asian-woman-relaxing-at-home-sitting-on-sofa-drinking-tea.mp4,PT00H00M13S,067201_067250,Asian woman relaxing at home sitting on sofa drinking tea
1009852181,https://ak.picdn.net/shutterstock/videos/1009852181/preview/stock-footage--k-movie-close-up-of-asian-child-playing-smart-phone.mp4,PT00H00M16S,054851_054900,4k movie close up of asian child playing smart phone
1051067614,https://ak.picdn.net/shutterstock/videos/1051067614/preview/stock-footage-barcelona-spain-circa-june-la-rambla-parked-motor-cycles-mirrors-saddles-street.mp4,PT00H00M08S,031901_031950,"Barcelona, spain, circa june 2009, la rambla parked motor cycles mirrors, saddles,  street  perspective, people on side walk, apartment fronts, distant trees, summer"
1017786754,https://ak.picdn.net/shutterstock/videos/1017786754/preview/stock-footage-man-looking-at-mobile-phone-and-smoking-electronic-cigarette-in-a-cafe-pan-shoot-from-right-to-left.mp4,PT00H00M13S,179151_179200,Man looking at mobile phone and smoking electronic cigarette in a cafe. pan shoot from right to left
34472602,https://ak.picdn.net/shutterstock/videos/34472602/preview/stock-footage-pretty-smiling-woman-petting-cute-colored-cat-using-laptop-modern-technology-decorated-christmas.mp4,PT00H00M15S,102301_102350,Pretty smiling woman petting cute colored cat using laptop modern technology decorated christmas tree background colorful lights website video call chat internet shopping wireless digital gadget
20492062,https://ak.picdn.net/shutterstock/videos/20492062/preview/stock-footage-terrible-skeleton-on-the-gallows-halloween-spirit.mp4,PT00H00M17S,018851_018900,Terrible skeleton on the gallows. halloween spirit.
15965305,https://ak.picdn.net/shutterstock/videos/15965305/preview/stock-footage-agriculture-in-focus.mp4,PT00H00M09S,148151_148200,Agriculture in focus
1020889105,https://ak.picdn.net/shutterstock/videos/1020889105/preview/stock-footage-middle-aged-woman-with-dark-long-curly-hair-dressed-in-christmas-sweater-sitting-on-a-cozy-sofa-by.mp4,PT00H00M24S,115801_115850,"Middle aged woman with dark long curly hair dressed in christmas sweater sitting on a cozy sofa by the fireplace drinking red wine, looking at the camera, talking, smiling and laughing"
1010270741,https://ak.picdn.net/shutterstock/videos/1010270741/preview/stock-footage-female-stands-and-waits-for-light-to-go-from-red-to-green.mp4,PT00H00M09S,118151_118200,"Female stands and waits for light to go from red to green.
"
1025248241,https://ak.picdn.net/shutterstock/videos/1025248241/preview/stock-footage-sunrise-timelapse-of-the-beautiful-mather-point-in-south-rim-of-grand-canyon-national-park-at.mp4,PT00H00M12S,197801_197850,"Sunrise timelapse of the beautiful mather point in south rim of grand canyon national park at arizona, united states"
27994387,https://ak.picdn.net/shutterstock/videos/27994387/preview/stock-footage-beautiful-pink-blossoming-pink-apple-tree-on-wind-spring-in-the-garden-static-camera.mp4,PT00H00M21S,076551_076600,Beautiful pink blossoming pink apple tree on wind spring in the garden. static camera.
1025325458,https://ak.picdn.net/shutterstock/videos/1025325458/preview/stock-footage-stop-motion-scribble-grunge-background-infinite-loop.mp4,PT00H00M09S,085601_085650,Stop motion scribble grunge background - infinite loop
1033038083,https://ak.picdn.net/shutterstock/videos/1033038083/preview/stock-footage-cinematic-k-blurred-to-clear-shot-on-fruit-platter-with-focus-on-glasses-containing-colorful.mp4,PT00H00M11S,176401_176450,"Cinematic 4k ""blurred to clear"" shot on fruit platter with focus on glasses containing colorful assortment of fresh fruits : orange, lemon, watermelon and grapefruit."
1024485005,https://ak.picdn.net/shutterstock/videos/1024485005/preview/stock-footage-santa-marta-colombia-november-wide-angle-slow-motion-walk-through-bahia-concha-beach-in.mp4,PT00H00M21S,185201_185250,"Santa marta, colombia - november 2018: wide angle slow motion walk-through bahia concha beach in parque tayrona"
5535461,https://ak.picdn.net/shutterstock/videos/5535461/preview/stock-footage-wood-in-fireplace.mp4,PT00H00M18S,097451_097500,Wood in fireplace
15770836,https://ak.picdn.net/shutterstock/videos/15770836/preview/stock-footage-vienna-austria-august-schonbrunn-palace-vienna-austria-timelapse-k.mp4,PT00H00M11S,006751_006800,"Vienna - austria, august 2015: schonbrunn palace, vienna, austria, timelapse, 4k"
1034913527,https://ak.picdn.net/shutterstock/videos/1034913527/preview/stock-footage-grass-lawn-watering-with-sprinkling-machine-grass-care.mp4,PT00H00M30S,095301_095350,Grass lawn. watering with sprinkling machine. grass care
1040046137,https://ak.picdn.net/shutterstock/videos/1040046137/preview/stock-footage-behind-the-reeds-is-a-tree-that-stands-on-the-birches-of-a-misty-lake.mp4,PT00H00M37S,003501_003550,Behind the reeds is a tree that stands on the birches of a misty lake.
4529342,https://ak.picdn.net/shutterstock/videos/4529342/preview/stock-footage-maria-church-in-ephesus-efes-ancient-greek-city-in-present-day-izmir-turkey.mp4,PT00H00M08S,079651_079700,"Maria church in ephesus (efes) - ancient greek city in present day izmir, turkey"
1017490444,https://ak.picdn.net/shutterstock/videos/1017490444/preview/stock-footage-gimbal-shot-marsh-in-the-wood-swamp-in-the-forest-reflection-trees-in-water-evenig-sunset-dusk.mp4,PT00H00M14S,171051_171100,Gimbal shot. marsh in the wood. swamp in the forest. reflection trees in water. evenig sunset dusk
29277163,https://ak.picdn.net/shutterstock/videos/29277163/preview/stock-footage-hairy-moth-caterpillar-on-leaf.mp4,PT00H00M05S,055151_055200,Hairy moth caterpillar on leaf
1032937931,https://ak.picdn.net/shutterstock/videos/1032937931/preview/stock-footage-fast-motion-over-picturesque-half-frozen-river-to-grey-bridge-against-city-building-silhouettes-in.mp4,PT00H00M07S,116701_116750,Fast motion over picturesque half frozen river to grey bridge against city building silhouettes in winter upper view
1029157550,https://ak.picdn.net/shutterstock/videos/1029157550/preview/stock-footage-man-in-downhill-trail-running-action-to-the-pointed-end-of-the-sea.mp4,PT00H00M25S,106001_106050,Man in downhill trail running action to the pointed end of the sea
24434609,https://ak.picdn.net/shutterstock/videos/24434609/preview/stock-footage-sopot-waterfall-view-from-top.mp4,PT00H00M22S,147051_147100,"Sopot waterfall, view from top"
1017937363,https://ak.picdn.net/shutterstock/videos/1017937363/preview/stock-footage-coral-sea-mount-in-the-waters-near-cancun.mp4,PT00H00M09S,191601_191650,Coral sea mount in the waters near cancun.
32613892,https://ak.picdn.net/shutterstock/videos/32613892/preview/stock-footage-construction-zone-detail-showing-the-soldier-course-under-construction-along-a-rock-wall-as-part-of.mp4,PT00H00M15S,000401_000450,Construction zone detail showing the soldier course under construction along a rock wall as part of a brick paver
1035034679,https://ak.picdn.net/shutterstock/videos/1035034679/preview/stock-footage-beekeeper-putting-on-protective-mask.mp4,PT00H00M15S,048151_048200,Beekeeper putting on protective mask
311122,https://ak.picdn.net/shutterstock/videos/311122/preview/stock-footage-santa-claus-vs-chinese-new-year-hd-version.mp4,PT00H00M14S,138451_138500,"Santa claus vs  chinese new year 02. hd version 
2008-12-20"
1026370916,https://ak.picdn.net/shutterstock/videos/1026370916/preview/stock-footage-business-man-and-woman-in-black-dress-stroking-hands-relations-with-mistress.mp4,PT00H00M17S,067351_067400,"Business man and woman in black dress stroking hands, relations with mistress"
1023057235,https://ak.picdn.net/shutterstock/videos/1023057235/preview/stock-footage-successes-in-business-economic-growth-of-an-enterprise-to-be-successful-in-everything-growth.mp4,PT00H00M17S,007351_007400,"Successes in business, economic growth of an enterprise, to be successful in everything. growth chart. 28"
16323454,https://ak.picdn.net/shutterstock/videos/16323454/preview/stock-footage-quartz-crystal-close-up-view.mp4,PT00H00M20S,056351_056400,Quartz crystal close up view 
34881904,https://ak.picdn.net/shutterstock/videos/34881904/preview/stock-footage-small-town-near-snowy-tatra-mountains-slovakia.mp4,PT00H00M08S,011151_011200,"Small town near snowy tatra mountains, slovakia"
500797,https://ak.picdn.net/shutterstock/videos/500797/preview/stock-footage-dirty-water-surf.mp4,PT00H00M26S,105551_105600,Dirty water surf
1012631468,https://ak.picdn.net/shutterstock/videos/1012631468/preview/stock-footage-victoria-harbor-hong-kong-may-hong-kong-urban-city.mp4,PT00H00M13S,078101_078150,"Victoria harbor, hong kong 31 may 2018:- hong kong urban city"
1042938118,https://ak.picdn.net/shutterstock/videos/1042938118/preview/stock-footage-seaside-beach-with-nine-e-axles-and-canvas-dancers.mp4,PT00H00M13S,139401_139450,Seaside beach with nine e-axles and canvas dancers.
1018252912,https://ak.picdn.net/shutterstock/videos/1018252912/preview/stock-footage-aerial-view-on-beautiful-mountain-and-forest-trees-covered-with-snow.mp4,PT00H00M18S,063051_063100,"Aerial view on beautiful mountain and forest trees covered with snow.
"
26242856,https://ak.picdn.net/shutterstock/videos/26242856/preview/stock-footage-beautiful-yellow-mustard-crop-field-in-rural-village-salunkwadi-ambajogai-beed-maharashtra.mp4,PT00H00M18S,122601_122650,"Beautiful yellow mustard crop field in rural village salunkwadi, ambajogai, beed, maharashtra, india, south east asia."
1027852484,https://ak.picdn.net/shutterstock/videos/1027852484/preview/stock-footage-street-ginger-red-cat-without-one-leg-three-leg-disabled-pet-yard.mp4,PT00H00M08S,071451_071500,"Street ginger, red cat without one leg. three leg. disabled pet. yard"
16411813,https://ak.picdn.net/shutterstock/videos/16411813/preview/stock-footage-house-sparrow-passer-domesticus-portrait-perching-on-tree-clip.mp4,PT00H00M23S,108801_108850,"House sparrow (passer domesticus) portrait, perching on tree (clip 1)"
1029064337,https://ak.picdn.net/shutterstock/videos/1029064337/preview/stock-footage-academic-word-cloud-animated-on-white-background.mp4,PT00H00M10S,192801_192850,Academic word cloud animated on white background
11180015,https://ak.picdn.net/shutterstock/videos/11180015/preview/stock-footage-bike-route-in-tel-aviv-port.mp4,PT00H00M05S,117851_117900,Bike route in tel aviv port
34372801,https://ak.picdn.net/shutterstock/videos/34372801/preview/stock-footage-carp-fish-in-water-colorful-fancy-carp-fish.mp4,PT00H00M16S,123001_123050,"Carp fish in water,colorful fancy carp fish."
1010985449,https://ak.picdn.net/shutterstock/videos/1010985449/preview/stock-footage-beautiful-business-woman-blond-in-glasses-walks-the-streets-of-the-city-among-modern-buildings-with.mp4,PT00H00M16S,146551_146600,Beautiful business woman blond in glasses walks the streets of the city among modern buildings with a smartphone
6047330,https://ak.picdn.net/shutterstock/videos/6047330/preview/stock-footage-el-nido-philippines-january-boats-waiting-for-tourists-to-travel-between-the-islands.mp4,PT00H00M19S,028751_028800,"El nido, philippines - january 31, 2014 : boats waiting for tourists to travel between the islands. el nido is one of the top tourist destinations in the world."
29049238,https://ak.picdn.net/shutterstock/videos/29049238/preview/stock-footage-rain-makes-the-trees-green.mp4,PT00H00M23S,187101_187150,Rain makes the trees green
28514728,https://ak.picdn.net/shutterstock/videos/28514728/preview/stock-footage-happy-girlfriends-are-talking-in-the-autumn-park-the-side-close-up-portrait.mp4,PT00H00M20S,086501_086550,Happy girlfriends are talking in the autumn park. the side close-up portrait.
1014558101,https://ak.picdn.net/shutterstock/videos/1014558101/preview/stock-footage-tired-young-woman-working-on-a-computer-at-office.mp4,PT00H00M20S,144751_144800,Tired young woman working on a computer at office
1027144613,https://ak.picdn.net/shutterstock/videos/1027144613/preview/stock-footage-riviera-maya-mexico-greenery-blowing-in-the-wind.mp4,PT00H00M08S,126851_126900,"Riviera maya, mexico greenery blowing in the wind."
1021673803,https://ak.picdn.net/shutterstock/videos/1021673803/preview/stock-footage-lake-superior-winter-with-snow-and-steps-leading-to-shoreline-conifers-gentle-fresh-water-waves.mp4,PT00H00M16S,009151_009200,"Lake superior winter with snow and steps leading to shoreline. conifers, gentle fresh-water waves and lighthouse in background, upper peninsula, michigan. 4k uhd"
1028596448,https://ak.picdn.net/shutterstock/videos/1028596448/preview/stock-footage-happy-four-women-in-bright-short-dresses-keeping-gifts.mp4,PT00H00M08S,194151_194200,Happy four women in bright short dresses keeping gifts
7167223,https://ak.picdn.net/shutterstock/videos/7167223/preview/stock-footage-farmer-hoeing-in-the-organic-corn-field-traditional-agriculture-cereal-plants.mp4,PT00H00M25S,033801_033850,"Farmer hoeing in the organic corn field, traditional agriculture, cereal plants"
1034493896,https://ak.picdn.net/shutterstock/videos/1034493896/preview/stock-footage-montreal-canada-june-old-tamagotchi-advert-on-a-vintage-old-tv-set-from-the-s-s-retro.mp4,PT00H00M23S,094101_094150,"Montreal, canada - june 2019 old tamagotchi advert on a vintage old tv set from the 80s 90s. retro concept"
20996164,https://ak.picdn.net/shutterstock/videos/20996164/preview/stock-footage-hacker-hands-at-night-typing-on-a-computer-keyboard-hacking-secret-information.mp4,PT00H00M11S,069101_069150,Hacker hands at night typing on a computer keyboard hacking secret information.
21075760,https://ak.picdn.net/shutterstock/videos/21075760/preview/stock-footage-handsome-young-smiling-man-wearing-expensive-casual-clothes-posing-on-camera-on-the-beach.mp4,PT00H00M09S,109101_109150,"Handsome young smiling man, wearing expensive casual clothes , posing on camera on the beach."
22537780,https://ak.picdn.net/shutterstock/videos/22537780/preview/stock-footage-cute-little-boy-calling-santa-while-sitting-on-a-big-armchair-at-home-over-chirstmas-tree-background.mp4,PT00H00M18S,022451_022500,Cute little boy calling santa while sitting on a big armchair at home over chirstmas tree background
1020322420,https://ak.picdn.net/shutterstock/videos/1020322420/preview/stock-footage-los-angeles-ca-october-sun-rays-reflecting-in-modern-skyscrapers-in-downtown-los.mp4,PT00H00M08S,084701_084750,"Los angeles, ca - october 18, 2018: sun rays reflecting in modern skyscrapers in downtown los angeles moving up dolly shot . la is a big financial business city and a tourist destination in usa."
1040424077,https://ak.picdn.net/shutterstock/videos/1040424077/preview/stock-footage-the-futuristic-neon-night-city-train-traffic-on-the-railway-bridge-d-animation.mp4,PT00H00M13S,057051_057100,"The futuristic neon night city, train traffic on the railway bridge. 3d animation"
1010137073,https://ak.picdn.net/shutterstock/videos/1010137073/preview/stock-footage-portugal-circa-november-yachtsmen-look-at-coastline-of-madeira-island-stading-on-yacht.mp4,PT00H00M17S,134851_134900,Portugal - circa november 2017: yachtsmen look at coastline of madeira island stading on yacht board. view from sailing yacht
12598937,https://ak.picdn.net/shutterstock/videos/12598937/preview/stock-footage-samutsakorn-thailand-november-construction-site-buildings.mp4,PT00H00M30S,000651_000700,"Samutsakorn,thailand november 4,2015: construction site buildings"
1029818366,https://ak.picdn.net/shutterstock/videos/1029818366/preview/stock-footage-beautiful-green-pine-needles-background-texture.mp4,PT00H00M10S,133401_133450,"Beautiful green pine needles. background, texture
"
1024111106,https://ak.picdn.net/shutterstock/videos/1024111106/preview/stock-footage-walking-underwater-in-a-sandy-sea.mp4,PT00H00M29S,199651_199700,Walking underwater in a sandy sea.
1034233022,https://ak.picdn.net/shutterstock/videos/1034233022/preview/stock-footage-serious-man-working-at-laptop-computer-at-home-smiling-couple-drinking-tea-at-modern-kitchen.mp4,PT00H00M29S,041651_041700,Serious man working at laptop computer at home. smiling couple drinking tea at modern kitchen together. happy couple working together
1034800286,https://ak.picdn.net/shutterstock/videos/1034800286/preview/stock-footage-waves-flowing-through-a-coral-reef-serf-with-underwater-air-bubble.mp4,PT00H00M10S,089601_089650,"Waves flowing through a coral reef ,serf with underwater air bubble"
6787066,https://ak.picdn.net/shutterstock/videos/6787066/preview/stock-footage-close-up-laughing-young-caucasian-girl-wearing-sweater-colorful-sunglasses-summer-beach-vacation.mp4,PT00H00M17S,045251_045300,Close up laughing young caucasian girl wearing sweater colorful sunglasses summer beach vacation waving travel destination welcome to camera shot on red epic
18892112,https://ak.picdn.net/shutterstock/videos/18892112/preview/stock-footage-incense-burning-candle-in-the-russian-church-orthodox-slow-motion-video.mp4,PT00H00M22S,114651_114700,Incense burning candle in the russian church orthodox slow motion video
