videoid,contentUrl,duration,page_dir,name
1033501505,https://ak.picdn.net/shutterstock/videos/1033501505/preview/stock-footage-on-the-bank-of-the-river-gloomy-mood.mp4,PT00H00M19S,023351_023400,On the bank of the river -  gloomy mood
1029177725,https://ak.picdn.net/shutterstock/videos/1029177725/preview/stock-footage-corte-corsica-france-europe-april-monument-to-the-national-hero-jean-pierre-gaffori.mp4,PT00H00M16S,115201_115250,"Corte, corsica, france, europe - april 22 2019:  monument to the national hero jean-pierre gaffori on place gaffori, house with shotholes in the back, corte, corsica, france, europe"
1011829421,https://ak.picdn.net/shutterstock/videos/1011829421/preview/stock-footage-kyiv-ukraine-february-culture-of-ukraine-history-of-ukraine-ethnic-clothes-style.mp4,PT00H00M21S,043151_043200,"Kyiv, ukraine – february  7, 2017.  culture of ukraine. history of ukraine. ethnic clothes. style and fashion. catwalk. fashion show. model. models. ukrainian national clothes."
19564342,https://ak.picdn.net/shutterstock/videos/19564342/preview/stock-footage-cool-motion-loop-animation-background-video-wild-movement-green.mp4,PT00H00M29S,107451_107500,Cool motion loop animation background video - wild movement green
1022010244,https://ak.picdn.net/shutterstock/videos/1022010244/preview/stock-footage-astana-kazakhstan-july-people-walk-on-the-new-pedestrian-bridge.mp4,PT00H00M08S,068151_068200,"Astana, kazakhstan - july 28, 2018: people walk on the new pedestrian bridge"
1058306335,https://ak.picdn.net/shutterstock/videos/1058306335/preview/stock-footage-menton-france-july-grocery-with-local-products-and-specialities-of-the-region-and.mp4,PT00H00M15S,067101_067150,"Menton, france - july 2, 2020: grocery with local products and specialities of the region and people looking at the products"
1007845828,https://ak.picdn.net/shutterstock/videos/1007845828/preview/stock-footage-timelapse-footage-of-a-vintage-green-clock-against-a-white-faded-background-whilst-time-ticks-on.mp4,PT00H00M30S,022851_022900,Timelapse footage of a vintage green clock against a white faded background whilst time ticks on
1026819518,https://ak.picdn.net/shutterstock/videos/1026819518/preview/stock-footage-destroying-wall-with-painted-logo-of-honda-crisis-conceptual-editorial-d-animation.mp4,PT00H00M06S,081851_081900,Destroying wall with painted logo of honda. crisis conceptual editorial 3d animation
28727224,https://ak.picdn.net/shutterstock/videos/28727224/preview/stock-footage-high-quality-video-of-opening-the-grill-and-flipping-over-steaks-in-real-p-slow-motion-fps.mp4,PT00H00M17S,087901_087950,High quality video of opening the grill and flipping over steaks in real 1080p slow motion 120fps
1065904081,https://ak.picdn.net/shutterstock/videos/1065904081/preview/stock-footage-spanish-mediterranean-costa-brava-coastline-gulf-of-roses-province-girona-north-of-catalonia.mp4,PT00H00M10S,110001_110050,"Spanish mediterranean costa brava coastline. gulf of roses, province girona, north of catalonia, spain. mountain range pyrenees with snowy peaks in the distance."
1037142611,https://ak.picdn.net/shutterstock/videos/1037142611/preview/stock-footage-cute-girl-in-green-jacket-jeans-and-boots-walking-along-the-green-hedge-in-germany-suburb.mp4,PT00H00M09S,027201_027250,"Cute girl in green jacket, jeans and boots walking along the green hedge in germany suburb"
1028554415,https://ak.picdn.net/shutterstock/videos/1028554415/preview/stock-footage-beautiful-girl-is-playing-with-a-little-cat-on-a-wooden-table-long-haired-woman-wearing-a-white.mp4,PT00H00M18S,069451_069500,Beautiful girl is playing with a little cat on a wooden table. long haired woman wearing a white shirt. tame cats with girls.
1047167089,https://ak.picdn.net/shutterstock/videos/1047167089/preview/stock-footage-close-up-face-of-tired-caucasian-boy-taking-off-eyeglasses-and-rubbing-nose-smart-serious-college.mp4,PT00H00M08S,032001_032050,"Close-up face of tired caucasian boy taking off eyeglasses and rubbing nose. smart serious college student working hard at home. overload, education, brilliance, intellect."
1007534275,https://ak.picdn.net/shutterstock/videos/1007534275/preview/stock-footage-animation-flying-of-buddha-statue-with-waving-flower-of-lotus-animation-of-seamless-loop.mp4,PT00H00M20S,029901_029950,Animation flying of buddha statue with waving flower of lotus. animation of seamless loop.
1042784689,https://ak.picdn.net/shutterstock/videos/1042784689/preview/stock-footage-young-woman-dancing-before-a-large-mirror-good-mood-anticipation-of-a-holiday-and-fun-girl.mp4,PT00H00M13S,143051_143100,"Young woman dancing before a large mirror. good mood, anticipation of a holiday and fun. girl admiring the outfit, smiling and laughing."
1015792333,https://ak.picdn.net/shutterstock/videos/1015792333/preview/stock-footage-abstract-isometric-background-yellow-spheres-diagonal-waves-motion.mp4,PT00H00M14S,143801_143850,Abstract isometric background yellow spheres diagonal waves motion
1049886220,https://ak.picdn.net/shutterstock/videos/1049886220/preview/stock-footage-happy-young-woman-in-green-rubber-gloves-washes-a-dirty-window-with-a-fur-coat-using-a-detergent.mp4,PT00H00M26S,017151_017200,"Happy young woman in green rubber gloves washes a dirty window with a fur coat using a detergent outside on a cold sunny day, quarantine self-isolation, cleaning the house"
1016949445,https://ak.picdn.net/shutterstock/videos/1016949445/preview/stock-footage-boxer-puppy-putting-on-santa-hat.mp4,PT00H00M09S,106951_107000,Boxer puppy putting on santa hat.
1007301937,https://ak.picdn.net/shutterstock/videos/1007301937/preview/stock-footage-barber-places-a-blade-in-a-razor-video-with-a-brown-tint.mp4,PT00H00M10S,067601_067650,Barber places a blade in a razor. video with a brown tint.
1032597332,https://ak.picdn.net/shutterstock/videos/1032597332/preview/stock-footage-row-of-colorful-shots-at-a-bar-counter-neon-lights.mp4,PT00H00M09S,106551_106600,Row of colorful shots at a bar counter. neon lights
1062813988,https://ak.picdn.net/shutterstock/videos/1062813988/preview/stock-footage-siem-reap-cambodia-close-shot-of-a-red-moped-being-cleaned-with-a-hose-by-an-asian.mp4,PT00H00M20S,117201_117250,Siem reap / cambodia - 01 28 2020: close shot of a red moped being cleaned with a hose by an asian man
1020768532,https://ak.picdn.net/shutterstock/videos/1020768532/preview/stock-footage-man-doing-exercises-for-the-fingers-in-the-hall-male-businessman-with-a-group-of-middle-aged.mp4,PT00H00M42S,190801_190850,"Man doing exercises for the fingers in the hall. male businessman with a group of middle-aged people doing fitness. in the mirror reflected trainees.
"
24999242,https://ak.picdn.net/shutterstock/videos/24999242/preview/stock-footage-asian-thai-farmer-using-laptop-computer-in-the-rice-field.mp4,PT00H00M18S,001501_001550,Asian thai farmer using laptop computer in the rice field
5766569,https://ak.picdn.net/shutterstock/videos/5766569/preview/stock-footage-bubble-shell-on-the-ocean-floor.mp4,PT00H00M26S,141201_141250,Bubble shell on the ocean floor
1032865265,https://ak.picdn.net/shutterstock/videos/1032865265/preview/stock-footage-street-chiness-food-grilled-squid-whit-sichuan-pepper.mp4,PT00H00M05S,125701_125750,"Street chiness food, grilled squid whit sichuan pepper"
1009702199,https://ak.picdn.net/shutterstock/videos/1009702199/preview/stock-footage-unique-design-abstract-digital-animation-pixel-noise-glitch-error-video-damage.mp4,PT00H00M15S,045201_045250,Unique design. abstract digital animation. pixel noise glitch error video damage
20176675,https://ak.picdn.net/shutterstock/videos/20176675/preview/stock-footage-tropes-italy-august-wonderful-crowded-beach-with-crystal-clear-waters-in-summer-time.mp4,PT00H00M13S,056951_057000,"Tropes, italy, august 2016- wonderful crowded beach with crystal clear waters in summer time"
4681268,https://ak.picdn.net/shutterstock/videos/4681268/preview/stock-footage-a-highway-cuts-through-a-scenic-alpine-valley-between-rocky-peaks-of-the-italian-dolomite-mountains.mp4,PT00H00M16S,080801_080850,A highway cuts through a scenic alpine valley between rocky peaks of the italian dolomite mountains 
1030217357,https://ak.picdn.net/shutterstock/videos/1030217357/preview/stock-footage-fresh-milk-caramel-take-home-cup-beverage-for-summer-isolated-on-white-background-food-concept.mp4,PT00H00M18S,104201_104250,"Fresh milk caramel take home cup beverage for summer isolated on white background, food concept front view."
4982387,https://ak.picdn.net/shutterstock/videos/4982387/preview/stock-footage-the-river-from-height-aerial.mp4,PT00H00M25S,071751_071800,The river from height. aerial.
1042104379,https://ak.picdn.net/shutterstock/videos/1042104379/preview/stock-footage-an-middle-aged-chinese-woman-s-hands-hold-an-orange-at-her-home-in-beijing-china.mp4,PT00H00M11S,104251_104300,"An middle-aged chinese woman's hands hold an orange at her home in beijing, china."
1055127389,https://ak.picdn.net/shutterstock/videos/1055127389/preview/stock-footage-coffee-syphon-alternative-method-of-making-in-coffee-shop-and-cafe-scandinavian-coffee-brewing.mp4,PT00H00M51S,107201_107250,Coffee syphon alternative method of making in coffee shop and cafe. scandinavian coffee brewing method. brewing process in syphon. coffee pours down to special glass teapot
1040766410,https://ak.picdn.net/shutterstock/videos/1040766410/preview/stock-footage-camera-follow-hipster-young-woman-in-white-t-shirt-short-jeans-fluttering-long-hair-one-girl.mp4,PT00H00M30S,072051_072100,"Camera follow hipster young woman in white t-shirt short jeans fluttering long hair. one girl dancing on field of grass portable music speaker smartphone. happy drunk from life, youth and happiness."
1024065722,https://ak.picdn.net/shutterstock/videos/1024065722/preview/stock-footage-futuristic-technology-particle-cloud-abstract-background.mp4,PT00H00M20S,030551_030600,Futuristic technology particle cloud abstract background
1041334186,https://ak.picdn.net/shutterstock/videos/1041334186/preview/stock-footage-christmas-decoration-and-red-candles.mp4,PT00H00M19S,099051_099100,Christmas decoration and red candles
10705121,https://ak.picdn.net/shutterstock/videos/10705121/preview/stock-footage-silhouette-of-travelers-and-people-walking-on-the-bridge-in-center-of-old-town-gamla-stan.mp4,PT00H00M16S,110451_110500,"Silhouette of travelers and people walking on the bridge in center of  old town (gamla stan), stockholm, sweden"
1051966441,https://ak.picdn.net/shutterstock/videos/1051966441/preview/stock-footage-periodic-table-of-chemical-elements-planetary-model-of-helium.mp4,PT00H00M26S,179251_179300,"Periodic table of chemical elements.
planetary model of helium"
1021378516,https://ak.picdn.net/shutterstock/videos/1021378516/preview/stock-footage-torrox-malaga-spain-spanish-flamenco-dancers-dancing-and-stomping-on-a-tablao-or.mp4,PT00H00M31S,045201_045250,"Torrox, malaga, spain; 12 16 2018: spanish flamenco dancers dancing and stomping on a tablao or stage a sunny day"
6670175,https://ak.picdn.net/shutterstock/videos/6670175/preview/stock-footage-asian-chinese-health-consultants-hospital-chairman-discussing-new-treatments-boardroom-modern.mp4,PT00H00M19S,100651_100700,Asian chinese health consultants hospital chairman discussing new treatments boardroom modern hospital male doctor smiling camera foreground
1056857126,https://ak.picdn.net/shutterstock/videos/1056857126/preview/stock-footage-aerial-view-video-happy-little-girl-in-dress-and-wreath-runs-and-has-fun-in-the-rye-field-with.mp4,PT00H00M14S,065801_065850,Aerial view video happy little girl in dress and wreath runs and has fun in the rye field with blooming cornflowers. enjoying nature concept. happy childhood
1044365743,https://ak.picdn.net/shutterstock/videos/1044365743/preview/stock-footage-three-funny-kids-are-cleaning-front-window-of-car-from-snow-outside-children-have-fun-playing-with.mp4,PT00H00M14S,089201_089250,Three funny kids are cleaning front window of car from snow outside. children have fun playing with snow. boys climb onto car and clear auto with shovels and hands. family fun in village
1034121419,https://ak.picdn.net/shutterstock/videos/1034121419/preview/stock-footage-kyiv-ukraine-june-lgbt-parade-of-pride-procession-for-equal-rights-of-gay-lesbian.mp4,PT00H00M13S,032351_032400,"Kyiv, ukraine-june 23, 2019: lgbt. parade of pride. procession for equal rights of gay, lesbian, bisexual, transgender people. coming out. rainbow flag, symbolism of sexual minorities. "
4658327,https://ak.picdn.net/shutterstock/videos/4658327/preview/stock-footage-two-hikers-with-big-backpacks-in-forest.mp4,PT00H00M16S,064051_064100,Two hikers with big backpacks in forest
1061838844,https://ak.picdn.net/shutterstock/videos/1061838844/preview/stock-footage-portrait-of-upset-and-sad-man-sitting-alone-at-table-after-party-on-new-year-christmas-eve-xmas.mp4,PT00H00M07S,108501_108550,"Portrait of upset and sad man sitting alone at table after party on new year, christmas eve, xmas or birthday. unhappy guy feeling lonely on holiday in front of decorated house. concept of depression."
1009827461,https://ak.picdn.net/shutterstock/videos/1009827461/preview/stock-footage-decorative-flowers-or-plants-in-pots-inside-modern-greenhouse-commercial-plant-nursery-macro-shot.mp4,PT00H00M09S,109801_109850,"Decorative flowers or plants in pots inside modern greenhouse, commercial plant nursery, macro shot"
1006625014,https://ak.picdn.net/shutterstock/videos/1006625014/preview/stock-footage-fun-gorilla-d-animation.mp4,PT00H00M12S,143601_143650,Fun gorilla - 3d animation
1043004922,https://ak.picdn.net/shutterstock/videos/1043004922/preview/stock-footage-grandmother-with-baby-boy-ion-blue-wall-background-having-fun-smiling-playing-grandson-is-happy.mp4,PT00H00M12S,066851_066900,"Grandmother with baby boy ion blue wall background having fun, smiling, playing. grandson is happy to communicate with elderly great-grandmother"
1031253062,https://ak.picdn.net/shutterstock/videos/1031253062/preview/stock-footage-male-police-officer-using-radio-to-run-license-plate-number.mp4,PT00H00M08S,149051_149100,"Male police officer using radio to run license plate number.
"
1040576432,https://ak.picdn.net/shutterstock/videos/1040576432/preview/stock-footage-circa-s-sailors-are-shown-tracking-and-monitoring-and-a-map-is-marked-aboard-the-uss-biddle.mp4,PT00H01M18S,013351_013400,Circa 1960s - sailors are shown tracking and monitoring and a map is marked aboard the uss biddle.
10105064,https://ak.picdn.net/shutterstock/videos/10105064/preview/stock-footage-jerusalem-israel-september-girl-dancing-in-rain-with-umbrella.mp4,PT00H00M16S,144751_144800,"Jerusalem, israel - september 8 2014: girl dancing in rain with umbrella"
1017364777,https://ak.picdn.net/shutterstock/videos/1017364777/preview/stock-footage-beautiful-roses-gently-moving-in-the-wind-close-up-with-shallow-depth-of-field.mp4,PT00H00M10S,138701_138750,Beautiful roses gently moving in the wind. close up with shallow depth of field.
1057230526,https://ak.picdn.net/shutterstock/videos/1057230526/preview/stock-footage-episcope-vintage-tin-plate-episcope-projector-philosophical-toy-for-projecting-cigarette-card.mp4,PT00H00M57S,066051_066100,Episcope vintage tin plate episcope projector philosophical toy for projecting cigarette card images onto walls screens: plymouth devon uk august 9th 2020: projecting cigarette cards. edwardian toys
22788961,https://ak.picdn.net/shutterstock/videos/22788961/preview/stock-footage-marsaxlokk-malta-dec-woman-freelancer-work-type-laptop-computer-sit-at-seafront-bench.mp4,PT00H00M12S,175351_175400,"Marsaxlokk, malta - dec 13, 2016: woman freelancer work type laptop computer sit at seafront bench of malta"
23022088,https://ak.picdn.net/shutterstock/videos/23022088/preview/stock-footage-dubai-uae-december-aerial-view-of-dubai-marina-canal-and-buildings-dubai-attracts.mp4,PT00H00M08S,178501_178550,"Dubai, uae - december 2016: aerial view of dubai marina canal and buildings. dubai attracts 15 million people annually."
1012884206,https://ak.picdn.net/shutterstock/videos/1012884206/preview/stock-footage-self-drawn-animation-of-continuous-multi-straight-line-drawing-of-isolated-vector-object-couple.mp4,PT00H00M15S,097451_097500,Self drawn animation of continuous multi straight line drawing of isolated vector object - couple passionate kiss in bed
1014106115,https://ak.picdn.net/shutterstock/videos/1014106115/preview/stock-footage-close-up-playing-guitar-bass-close-up-hand-right-and-left.mp4,PT00H00M17S,074351_074400,Close up playing guitar bass.close up hand right and left
8958502,https://ak.picdn.net/shutterstock/videos/8958502/preview/stock-footage-asian-man-takes-a-photo-of-the-city-skyline-from-rooftop-he-shows-his-partner-they-drink.mp4,PT00H00M22S,090401_090450,"Asian man takes a photo of the city skyline from rooftop, he shows his partner, they drink "
1028775584,https://ak.picdn.net/shutterstock/videos/1028775584/preview/stock-footage-blue-transparent-d-animated-earth-showing-the-borders-of-the-country-bosnia-and-herzegovina-and.mp4,PT00H00M30S,171201_171250,Blue transparent 3d animated earth showing the borders of the country bosnia and herzegovina and the capital sarajevo in 4k resolution at daytime
1015638529,https://ak.picdn.net/shutterstock/videos/1015638529/preview/stock-footage--d-animation-of-a-cube-with-rotating-segments.mp4,PT00H00M08S,130101_130150,3d animation of a cube with rotating segments
1020758818,https://ak.picdn.net/shutterstock/videos/1020758818/preview/stock-footage-radial-digital-light-patterns-ripple-and-shine-loop.mp4,PT00H00M25S,062851_062900,Radial digital light patterns ripple and shine (loop).
12662885,https://ak.picdn.net/shutterstock/videos/12662885/preview/stock-footage-young-woman-is-paying-with-her-smartphone-application-at-the-cash-desk-in-a-department-store-shot.mp4,PT00H00M12S,130251_130300,Young woman is paying with her smartphone application at the cash desk in a department store. shot on red cinema camera in 4k (uhd).
26467892,https://ak.picdn.net/shutterstock/videos/26467892/preview/stock-footage-cooking-rice-porridge-in-boiling-water.mp4,PT00H00M27S,124201_124250,Cooking rice porridge in boiling water
1018540174,https://ak.picdn.net/shutterstock/videos/1018540174/preview/stock-footage-abstract-stains-of-ink-in-the-water-envelop-the-flower-dull-clouds-colored-ink-is-injected-into.mp4,PT00H01M00S,187101_187150,Abstract stains of ink in the water envelop the flower dull clouds. colored ink is injected into clear water an artificial flower stands in the water paints are mixed to form muddy beautiful stains
1027434209,https://ak.picdn.net/shutterstock/videos/1027434209/preview/stock-footage-top-view-happy-team-of-colleagues-working-together-at-modern-office-joining-hands-and-clapping.mp4,PT00H00M10S,179701_179750,"Top view happy team of colleagues working together at modern office, joining hands and clapping, celebrating success."
12312113,https://ak.picdn.net/shutterstock/videos/12312113/preview/stock-footage-aerial-view-of-golf-course-in-fall-scenery-on-sunny-day.mp4,PT00H00M31S,006601_006650,Aerial view of golf course in fall scenery on sunny day
1063871707,https://ak.picdn.net/shutterstock/videos/1063871707/preview/stock-footage-phuket-south-of-thailand-andaman-sea-travel-trip-after-covid-phuket-thailand-aerial-view-of.mp4,PT00H00M16S,094401_094450,Phuket south of thailand andaman sea travel trip. after covid-19. phuket thailand. aerial view of tropical aerial landscape ocean sea. cora under water landscape. new normal after covid-19.
1008137209,https://ak.picdn.net/shutterstock/videos/1008137209/preview/stock-footage-spider-s-web-on-the-background-of-a-green-field-with-oaks-and-red-poppies-in-the-setting-sun.mp4,PT00H00M14S,031601_031650,Spider's web on the background of a green field with oaks and red poppies in the setting sun. 
4623884,https://ak.picdn.net/shutterstock/videos/4623884/preview/stock-footage-dusseldorf-airport-germany-july-air-berlin-airplane-takeoff.mp4,PT00H00M12S,072251_072300,"Dusseldorf airport, germany - july 12 2013: air berlin airplane takeoff"
31302982,https://ak.picdn.net/shutterstock/videos/31302982/preview/stock-footage-bitcoin-located-on-computer-circuit-boards.mp4,PT00H00M13S,052751_052800,Bitcoin located on computer circuit boards
1025351780,https://ak.picdn.net/shutterstock/videos/1025351780/preview/stock-footage-beautiful-view-along-the-south-downs-way-in-west-sussex-england-during-a-cold-windy-day.mp4,PT00H00M21S,199151_199200,"Beautiful view along the south downs way in west sussex england, during a cold windy day "
1065290185,https://ak.picdn.net/shutterstock/videos/1065290185/preview/stock-footage-white-scrambled-eggs-icon-isolated-on-green-background-home-cooked-food-fried-egg-healthy.mp4,PT00H00M10S,114951_115000,"White scrambled eggs icon isolated on green background. home cooked food, fried egg, healthy breakfast, omelet icon. 4k video motion graphic animation"
18589430,https://ak.picdn.net/shutterstock/videos/18589430/preview/stock-footage-close-up-of-a-girl-ties-shoelaces.mp4,PT00H00M16S,002251_002300,Close-up of a girl ties shoelaces
1014641588,https://ak.picdn.net/shutterstock/videos/1014641588/preview/stock-footage-sanbon-waterfall-in-summer-season-norikura-nagano-prefecture-japan.mp4,PT00H00M15S,123001_123050,"Sanbon waterfall in summer season, norikura, nagano prefecture, japan."
1051452112,https://ak.picdn.net/shutterstock/videos/1051452112/preview/stock-footage-paris-france-march-senior-english-man-reading-british-press-the-times-newspaper-with.mp4,PT00H00M08S,132901_132950,"Paris, france - march 29, 2019: senior english man reading british press, the times newspaper with sport and politics cover page"
11794250,https://ak.picdn.net/shutterstock/videos/11794250/preview/stock-footage-chao-phraya-river-bangkok-thailand-footage.mp4,PT00H00M20S,133501_133550,"Chao phraya river bangkok, thailand. footage"
13817750,https://ak.picdn.net/shutterstock/videos/13817750/preview/stock-footage-hand-holding-spoon-with-green-screen.mp4,PT00H00M08S,099651_099700,Hand holding spoon with green screen.
1046887234,https://ak.picdn.net/shutterstock/videos/1046887234/preview/stock-footage-aerial-drone-shot-of-a-safari-vehicle-moving-through-beautiful-landscape-in-africa.mp4,PT00H00M30S,130351_130400,Aerial drone shot of a safari vehicle moving through beautiful landscape in africa
1023565798,https://ak.picdn.net/shutterstock/videos/1023565798/preview/stock-footage-stove-top-burner-igniting-into-a-blue-cooking-flame.mp4,PT00H00M21S,039501_039550,Stove top burner igniting into a blue cooking flame
1349416,https://ak.picdn.net/shutterstock/videos/1349416/preview/stock-footage-people-playing-in-waves-on-sandy-beach.mp4,PT00H00M30S,140751_140800,People playing in waves on sandy beach  
1044207778,https://ak.picdn.net/shutterstock/videos/1044207778/preview/stock-footage-portrait-of-a-thoroughbred-cow-with-large-horns.mp4,PT00H00M17S,195251_195300,Portrait of a thoroughbred cow with large horns
12096203,https://ak.picdn.net/shutterstock/videos/12096203/preview/stock-footage-the-top-manager-instructs-young-diligent-creative-collective-he-uses-the-tablet-and-draws-charts.mp4,PT00H00M36S,115351_115400,"The top manager instructs young, diligent, creative collective. he uses the tablet and draws charts on a white board"
1053940688,https://ak.picdn.net/shutterstock/videos/1053940688/preview/stock-footage-nature-green-trees-flowing-rivers-mountains.mp4,PT00H00M06S,110001_110050,Nature green trees flowing rivers mountains
24757034,https://ak.picdn.net/shutterstock/videos/24757034/preview/stock-footage-woman-shopping-in-a-clothing-store-for-children-children-s-clothes-on-hangers.mp4,PT00H00M07S,138951_139000,Woman shopping in a clothing store for children. children's clothes on hangers
1030599329,https://ak.picdn.net/shutterstock/videos/1030599329/preview/stock-footage-kuala-lumpur-malaysia-june-people-seen-exploring-and-buying-foods-around-the-ramadan.mp4,PT00H00M15S,127901_127950,"Kuala lumpur,malaysia - june 2, 2019 : people seen exploring and buying foods around the ramadan bazaar.it is established for muslim to break fast during the holy month of ramadan."
14646016,https://ak.picdn.net/shutterstock/videos/14646016/preview/stock-footage-the-bride-holds-a-wedding-bouquet.mp4,PT00H00M05S,052801_052850,The bride holds a wedding bouquet
23845255,https://ak.picdn.net/shutterstock/videos/23845255/preview/stock-footage--k-drone-footage-of-young-free-climber-and-hiker-climbing-mountain-cliff-and-drinking-water-from.mp4,PT00H00M18S,103351_103400,"4k drone footage of young free climber and hiker, climbing mountain cliff and drinking water from bottle at sunset, south africa. "
24282161,https://ak.picdn.net/shutterstock/videos/24282161/preview/stock-footage-close-up-lined-ripe-rice-ears-in-front-of-red-flowers.mp4,PT00H00M21S,064751_064800,Close up lined ripe rice ears in front of red flowers
1023212929,https://ak.picdn.net/shutterstock/videos/1023212929/preview/stock-footage-slow-motion-shot-of-beautiful-duck-playing-in-water.mp4,PT00H00M19S,198151_198200,Slow motion shot of beautiful duck playing in water
28239646,https://ak.picdn.net/shutterstock/videos/28239646/preview/stock-footage-abstract-motion-defocused-background-colorful-bokeh.mp4,PT00H00M13S,007401_007450,Abstract motion defocused background - colorful bokeh
1031159525,https://ak.picdn.net/shutterstock/videos/1031159525/preview/stock-footage-sao-pedro-chapel-in-the-island-of-fernando-de-noronha-in-brazil.mp4,PT00H00M13S,029501_029550,"Sao pedro chapel, in the island of fernando de noronha, in brazil"
1030123370,https://ak.picdn.net/shutterstock/videos/1030123370/preview/stock-footage-background-top-view-k-video-of-strawberries-rotating.mp4,PT00H00M20S,067151_067200,Background top view 4k video of strawberries rotating
