videoid,contentUrl,duration,page_dir,name
1013298554,https://ak.picdn.net/shutterstock/videos/1013298554/preview/stock-footage-man-using-screw-driver-attaching-wood-home-construction.mp4,PT00H00M10S,070501_070550,Man using screw driver attaching wood - home construction
1055147639,https://ak.picdn.net/shutterstock/videos/1055147639/preview/stock-footage-hud-animation-of-screen-elements.mp4,PT00H00M15S,048901_048950,Hud animation of screen elements
5265515,https://ak.picdn.net/shutterstock/videos/5265515/preview/stock-footage-a-river-flowing-under-a-stone-bridge.mp4,PT00H00M04S,034351_034400,A river flowing under a stone bridge.
1020524059,https://ak.picdn.net/shutterstock/videos/1020524059/preview/stock-footage-barranquilla-colombia-day-to-night-skyline-evening-time-lapse.mp4,PT00H00M08S,143151_143200,"Barranquilla, colombia day to night skyline evening time-lapse"
5758148,https://ak.picdn.net/shutterstock/videos/5758148/preview/stock-footage-bear-at-edge-of-waterfall-misty.mp4,PT00H00M08S,118801_118850,"Bear at edge of waterfall, misty"
8327791,https://ak.picdn.net/shutterstock/videos/8327791/preview/stock-footage-woman-works-on-tablet-green-screen-in-cafe-coffee-and-cake.mp4,PT00H00M21S,141401_141450,Woman works on tablet green screen in cafe - coffee and cake
24637712,https://ak.picdn.net/shutterstock/videos/24637712/preview/stock-footage-flying-near-sea-waves-against-rocks-aerial-hd-slowmotion-similan-islands-thailand.mp4,PT00H00M19S,108101_108150,"Flying near sea waves against rocks. aerial hd slowmotion. similan islands, thailand."
16315660,https://ak.picdn.net/shutterstock/videos/16315660/preview/stock-footage-beautiful-view-of-fast-rolling-clouds-drifting-over-crocker-range-timelapse-sabah-malaysia.mp4,PT00H00M10S,113351_113400,"Beautiful view of fast rolling clouds drifting over crocker range. timelapse. sabah, malaysia"
1022018098,https://ak.picdn.net/shutterstock/videos/1022018098/preview/stock-footage-white-wild-storks.mp4,PT00H00M11S,021351_021400,White wild storks 
1022783770,https://ak.picdn.net/shutterstock/videos/1022783770/preview/stock-footage-young-happy-bearded-indian-man-opening-gift-box.mp4,PT00H00M10S,128701_128750,Young happy bearded indian man opening gift box
1022273041,https://ak.picdn.net/shutterstock/videos/1022273041/preview/stock-footage-venice-italy-sailing-in-the-grand-canal-of-venice.mp4,PT00H00M14S,024601_024650,Venice (italy) - 02/10/2015 - sailing in the grand canal of venice
4060543,https://ak.picdn.net/shutterstock/videos/4060543/preview/stock-footage-snowy-carpathians-mountain-with-passing-clouds.mp4,PT00H00M08S,082951_083000,Snowy carpathians mountain with passing clouds
25789964,https://ak.picdn.net/shutterstock/videos/25789964/preview/stock-footage-clouds-rolls-over-tropical-island-time-lapse.mp4,PT00H00M14S,107801_107850,"Clouds rolls over tropical island, time lapse"
1135684,https://ak.picdn.net/shutterstock/videos/1135684/preview/stock-footage-woman-lying-on-the-grass-with-a-laptop.mp4,PT00H00M20S,196151_196200,Woman lying on the grass with a laptop
15788509,https://ak.picdn.net/shutterstock/videos/15788509/preview/stock-footage-biotechnology-plantation-tissue-bottles-on-shelves-in-laboratory.mp4,PT00H00M11S,171701_171750,Biotechnology plantation tissue bottles on shelves in laboratory
19221013,https://ak.picdn.net/shutterstock/videos/19221013/preview/stock-footage-sofia-bulgaria-aug-free-open-day-for-kids-and-parents-in-cognitive-museum-for-children.mp4,PT00H00M20S,075551_075600,"Sofia, bulgaria - aug 27, 2016: free open day for kids and parents in cognitive museum for children. girl typing sliding an educational geographical multimedia table museum display"
1010223932,https://ak.picdn.net/shutterstock/videos/1010223932/preview/stock-footage-attractive-dark-haired-woman-is-shaking-her-head-in-rhythm-of-songs-she-is-listening-music-from.mp4,PT00H00M25S,181951_182000,"Attractive dark haired woman is shaking her head in rhythm of songs. she is listening music from earphones in loft room alone, close-up of cheerful face"
1027228493,https://ak.picdn.net/shutterstock/videos/1027228493/preview/stock-footage--unrecognizable-girl-dances-on-a-motorcycle-a-play-of-light-and-shadow.mp4,PT00H00M09S,102401_102450,"
unrecognizable girl dances on a motorcycle, a play of light and shadow"
1033759721,https://ak.picdn.net/shutterstock/videos/1033759721/preview/stock-footage-young-man-dancing-classical-music-in-the-city-slow-motion.mp4,PT00H01M00S,095451_095500,Young man dancing classical music in the city-slow motion
2004020,https://ak.picdn.net/shutterstock/videos/2004020/preview/stock-footage-waterfall-detail-location-plitvice-national-park-plitvicka-jezera-croatia-europe.mp4,PT00H00M16S,131001_131050,"Waterfall detail. location: plitvice, national park plitvicka jezera, croatia, europe."
1029392588,https://ak.picdn.net/shutterstock/videos/1029392588/preview/stock-footage-seville-spain-may-point-of-view-walking-through-the-feria-de-abril-in-seville-in-soft.mp4,PT00H00M40S,015651_015700,"Seville, spain - may 5, 2019: point of view walking through the feria de abril in seville in soft slow motion. first person view. on may 5, 2019 in seville, spain"
1060627600,https://ak.picdn.net/shutterstock/videos/1060627600/preview/stock-footage-focused-coworkers-watching-presentation-on-tablet-writing-notes-talking-medium-shot.mp4,PT00H00M13S,133651_133700,"Focused coworkers watching presentation on tablet, writing notes, talking. medium shot. collaboration and teamwork concept"
34320799,https://ak.picdn.net/shutterstock/videos/34320799/preview/stock-footage-young-woman-relaxing-smoking-a-cigarette-sitting-on-the-sidewalk.mp4,PT00H00M20S,087551_087600,Young woman relaxing smoking a cigarette sitting on the sidewalk
28780675,https://ak.picdn.net/shutterstock/videos/28780675/preview/stock-footage-la-paz-bolivia-january-people-in-the-market-buying-lucky-frogs-during-feria-de-la.mp4,PT00H00M09S,062151_062200,"La paz, bolivia - 24 january 2017: people in the market buying lucky frogs during  feria de la alasita is a handicraft fair in the city of la paz, bolivia"
15491377,https://ak.picdn.net/shutterstock/videos/15491377/preview/stock-footage-girl-mixing-coffee-in-the-cafe-and-wearing-striped-shirt.mp4,PT00H00M18S,001151_001200,"Girl mixing coffee in the cafe and wearing striped shirt
"
18007516,https://ak.picdn.net/shutterstock/videos/18007516/preview/stock-footage-kuala-lumpur-june-a-pan-shot-of-the-city-center-in-the-chinatown-area-known-as-petaling.mp4,PT00H00M08S,023551_023600,"Kuala lumpur - june 15, 2016: a pan shot of the city center in the chinatown area known as petaling street. "
22870681,https://ak.picdn.net/shutterstock/videos/22870681/preview/stock-footage-mother-with-daughter-on-couch-using-tablet-computer-happy-smiling-young-family-near-decorated-new.mp4,PT00H00M16S,038901_038950,Mother with daughter on couch using tablet computer happy smiling young family near decorated new year christmas tree small girl and woman
1009011731,https://ak.picdn.net/shutterstock/videos/1009011731/preview/stock-footage--k-laomei-green-reef-new-taipei-city-sea-waves-breaking-on-coast-stretch-of-beautifully.mp4,PT00H00M20S,098051_098100,4k laomei green reef new taipei city. sea waves breaking on coast. stretch of beautifully structured volcanic rocks along coastal shoreline. gorgeous algae covered the rock forming reefs structure-dan
1040772809,https://ak.picdn.net/shutterstock/videos/1040772809/preview/stock-footage-beautiful-young-hairless-woman-with-fashion-eye-makeup-smells-the-scent-of-a-flower-of-white-lily.mp4,PT00H00M09S,139801_139850,Beautiful young hairless woman with fashion eye makeup smells the scent of a flower of white lily bud while looking to the camera isolated over gray wall
1023771976,https://ak.picdn.net/shutterstock/videos/1023771976/preview/stock-footage-circa-s-st-augustine-florida-and-castillo-de-san-marcos-in.mp4,PT00H01M21S,186201_186250,Circa 1910s - st. augustine florida and castillo de san marcos in 1924.
8310964,https://ak.picdn.net/shutterstock/videos/8310964/preview/stock-footage--k-spa-thermal-relaxing-in-outdoor-pool-woman-relaxing-outdoor-hot-bath-with-fog-background-uhd.mp4,PT00H00M12S,199151_199200,4k spa thermal relaxing in outdoor pool. woman relaxing outdoor hot bath with fog background. uhd shot
1023111808,https://ak.picdn.net/shutterstock/videos/1023111808/preview/stock-footage--k-footage-blue-light-leaks-over-back-background-high-quality-creative-background.mp4,PT00H00M10S,193101_193150,"4k footage, blue light leaks over back background. high quality creative background."
1035203405,https://ak.picdn.net/shutterstock/videos/1035203405/preview/stock-footage-aerial-flight-over-cloughmore-stone-area-kilbroney-park-countryside-northern-ireland-hiking-and.mp4,PT00H00M25S,033801_033850,"Aerial flight over cloughmore stone area, kilbroney park,countryside northern ireland. hiking and tourism concept"
1058824555,https://ak.picdn.net/shutterstock/videos/1058824555/preview/stock-footage-heartbeat-or-pulse-tracker-on-smart-watch-health-application-and-green-screen.mp4,PT00H00M21S,127951_128000,Heartbeat or pulse tracker on smart watch. health application and green screen
1008469489,https://ak.picdn.net/shutterstock/videos/1008469489/preview/stock-footage-abstract-background-wall-with-hole-and-bright-light-behind-glowing-bright-light-beams-and-rays.mp4,PT00H00M10S,021351_021400,Abstract background wall with hole and bright light behind. glowing bright light beams and rays. projector of light rays. animation of seamless loop.
21856717,https://ak.picdn.net/shutterstock/videos/21856717/preview/stock-footage-close-up-of-woman-s-rear-buttocks-profile-of-sporty-black-woman-standing-in-bathroom.mp4,PT00H00M16S,075401_075450,Close-up of woman's rear buttocks. profile of sporty black woman standing in bathroom.
1710700,https://ak.picdn.net/shutterstock/videos/1710700/preview/stock-footage-dolly-along-a-branch-with-pink-and-pearl-blossoms-in-an-orchard-in-israel-the-shot-is-from-under.mp4,PT00H00M26S,069551_069600,Dolly along a branch with pink and pearl blossoms in an orchard in israel.  the shot is from under the branch looking up with the overcast white sky in the background.  02/25/2011
1033110758,https://ak.picdn.net/shutterstock/videos/1033110758/preview/stock-footage-portrait-of-a-cute-blue-eyed-blonde-seven-year-old-girl-with-a-dirty-face-laughing-while-talking-on.mp4,PT00H00M07S,101051_101100,Portrait of a cute blue-eyed blonde seven-year-old girl with a dirty face laughing while talking on a mobile phone
8487079,https://ak.picdn.net/shutterstock/videos/8487079/preview/stock-footage-monte-altuzzo-italy-september-a-patrol-of-german-soldiers-during-a-wwii-reenactment-on.mp4,PT00H00M12S,146701_146750,"Monte altuzzo, italy - september 2014 a patrol of german soldiers during a wwii reenactment on 20 september 2014 at monte altuzzo, italy"
1007375560,https://ak.picdn.net/shutterstock/videos/1007375560/preview/stock-footage-berlin-germany-february-time-lapse-pedestrians-and-traffic-at-europa-center-shopping.mp4,PT00H00M21S,133451_133500,"Berlin, germany - february 9, 2018: time lapse: pedestrians and traffic at europa-center shopping mall at breitscheidplatz in berlin"
19170448,https://ak.picdn.net/shutterstock/videos/19170448/preview/stock-footage-woman-in-red-coat-standing-near-barrier-and-watching-to-city-river-in-seoul.mp4,PT00H00M07S,100401_100450,Woman in red coat standing near barrier and watching to city river in seoul.
1006809046,https://ak.picdn.net/shutterstock/videos/1006809046/preview/stock-footage-the-cook-turns-the-vegetables-over-fire.mp4,PT00H00M29S,014651_014700,The cook turns the vegetables over fire
1055649209,https://ak.picdn.net/shutterstock/videos/1055649209/preview/stock-footage-aerial-view-of-american-countryside-in-the-summertime-drone-flying-low-over-water-lilies-north.mp4,PT00H00M17S,199751_199800,"Aerial view of american countryside in the summertime. drone flying low over water lilies. north american rural landscape, nature, common  floating leaf plants of midwest. sunrise, dawn, early morning"
10719617,https://ak.picdn.net/shutterstock/videos/10719617/preview/stock-footage-quality-honey-honey-pouring-from-the-spoon-quality-honey-pouring-a-continuous-stream-and.mp4,PT00H00M21S,001501_001550,"Quality honey.
honey pouring from the spoon.
quality honey pouring a continuous stream and creates the «hill».
"
1016451841,https://ak.picdn.net/shutterstock/videos/1016451841/preview/stock-footage-chef-in-the-restaurant-prepares-a-pizza-and-decorates-it-with-tomato-mozzarella-and-basil.mp4,PT00H00M19S,072201_072250,Chef in the restaurant prepares a pizza and decorates it with tomato mozzarella and basil
1060357976,https://ak.picdn.net/shutterstock/videos/1060357976/preview/stock-footage-medium-shot-of-modern-santa-claus-in-red-traditional-christmas-suit-and-black-eyeglasses-holding.mp4,PT00H00M06S,127251_127300,"Medium shot of modern santa claus in red traditional christmas suit and black eyeglasses holding glass of alcoholic beverage and showing on camera. rest time of drunk santa at the party, christmas"
23075359,https://ak.picdn.net/shutterstock/videos/23075359/preview/stock-footage-flying-above-a-white-beach-flying-over-a-reef-and-white-beaches-with-people-and-house-beach.mp4,PT00H00M13S,001251_001300,"Flying above a white beach, flying over a reef and white beaches with people and house beach. aerial seascape view."
23871979,https://ak.picdn.net/shutterstock/videos/23871979/preview/stock-footage-cow-ferret-garbage-find-waste-food-for-eat-because-city-grow-up-area-for-grass-have-a-little-bit.mp4,PT00H00M12S,029401_029450,Cow ferret garbage find waste food for eat because city grow up area for grass have a little bit 
25666535,https://ak.picdn.net/shutterstock/videos/25666535/preview/stock-footage-mooring-post-that-limit-the-entrance-to-a-canal-in-northern-italy.mp4,PT00H00M10S,112651_112700,"Mooring post that limit the entrance to a canal in northern italy
"
14612326,https://ak.picdn.net/shutterstock/videos/14612326/preview/stock-footage-saint-petersburg-russia-november-quadrocopter-shoot-men-in-rescue-uniform-lift-dummy.mp4,PT00H00M27S,002101_002150,"Saint petersburg, russia - november 28, 2015: quadrocopter shoot men in rescue uniform lift dummy. training wall. slow motion"
1009579772,https://ak.picdn.net/shutterstock/videos/1009579772/preview/stock-footage-sport-fitness-technology-and-people-concept-close-up-of-male-legs-running-on-treadmill-in-gym.mp4,PT00H00M17S,009751_009800,"Sport, fitness, technology and people concept - close up of male legs running on treadmill in gym"
1050523372,https://ak.picdn.net/shutterstock/videos/1050523372/preview/stock-footage-vladivostok-russia-march-traffic-on-the-golden-bridge.mp4,PT00H00M18S,048651_048700,"Vladivostok, russia-march 28, 2020: traffic on the golden bridge."
8474371,https://ak.picdn.net/shutterstock/videos/8474371/preview/stock-footage-brick-wall-background-abstract-kaleidoscope-x.mp4,PT00H00M11S,175151_175200,Brick wall background  abstract   kaleidoscope 1920x1080
26754682,https://ak.picdn.net/shutterstock/videos/26754682/preview/stock-footage-murree-is-a-popular-tourist-city-for-national-and-international-tourists-in-pakistan-about.mp4,PT00H00M25S,126151_126200,"Murree is a popular tourist city for national and international tourists in pakistan, about 50 kilometres from islamabad, pakistan."
35052325,https://ak.picdn.net/shutterstock/videos/35052325/preview/stock-footage-the-girl-draws-paints.mp4,PT00H00M11S,061551_061600,The girl draws paints
26125736,https://ak.picdn.net/shutterstock/videos/26125736/preview/stock-footage-slow-motion-of-dust-particles-explosive-flow-over-black-background-fps-prores-footage.mp4,PT00H00M28S,116301_116350,"Slow motion of dust particles explosive flow over black background, 180fps prores footage"
1019657920,https://ak.picdn.net/shutterstock/videos/1019657920/preview/stock-footage-flag-of-european-union-waving-closeup.mp4,PT00H00M06S,034251_034300,Flag of european union waving closeup
1064376640,https://ak.picdn.net/shutterstock/videos/1064376640/preview/stock-footage-cup-of-coffee-with-fresh-roasted-coffee-beans-background-seamless-looping.mp4,PT00H00M37S,124501_124550,Cup of coffee with fresh roasted coffee beans background (seamless looping)
1019407210,https://ak.picdn.net/shutterstock/videos/1019407210/preview/stock-footage-cosmos-flower-and-namsan-mountain-in-south-korea.mp4,PT00H00M09S,004301_004350,"Cosmos flower and namsan mountain in south korea

"
1059774671,https://ak.picdn.net/shutterstock/videos/1059774671/preview/stock-footage-mother-with-child-do-homework-a-happy-smiling-mother-with-her-little-girl-together-makes-the.mp4,PT00H00M18S,078301_078350,Mother with child do homework. a happy smiling mother with her little girl together makes the school lessons at home.
31953466,https://ak.picdn.net/shutterstock/videos/31953466/preview/stock-footage-winter-in-the-park-a-little-boy-goes-on-a-wooden-table-and-looking-into-the-distance-video-starts.mp4,PT00H00M21S,039701_039750,"Winter in the park a little boy goes on a wooden table and looking into the distance, video starts with showing the feet of the boy and rising up showing the boy's face"
1459378,https://ak.picdn.net/shutterstock/videos/1459378/preview/stock-footage-reflection-of-a-mountain-in-the-gently-rippling-water-of-a-pond.mp4,PT00H00M15S,110701_110750,Reflection of a mountain in the gently rippling water of a pond
1020136237,https://ak.picdn.net/shutterstock/videos/1020136237/preview/stock-footage-a-spinning-dna-strand-d-rendered-animation.mp4,PT00H00M17S,060801_060850,"A spinning dna strand. 3d rendered animation.
"
1037155589,https://ak.picdn.net/shutterstock/videos/1037155589/preview/stock-footage-detail-shot-of-a-hanging-wedding-dress.mp4,PT00H00M08S,033901_033950,Detail shot of a hanging wedding dress
1039788044,https://ak.picdn.net/shutterstock/videos/1039788044/preview/stock-footage-saint-petersburg-russia-circa-september-road-traffic-on-the-streets-of-saint-petersburg.mp4,PT00H00M14S,130801_130850,"Saint-petersburg, russia - circa september 2019. road traffic on the streets of saint-petersburg."
2679992,https://ak.picdn.net/shutterstock/videos/2679992/preview/stock-footage-a-sunset-timelapse-of-the-beautiful-pedra-forca-mountain-landscape-catalunya-spain.mp4,PT00H00M15S,123001_123050,"A sunset timelapse of the beautiful pedra forca mountain landscape, catalunya, spain"
5210189,https://ak.picdn.net/shutterstock/videos/5210189/preview/stock-footage-snowflakes-animation-with-copy-space-dark-blue-background.mp4,PT00H00M10S,012851_012900,Snowflakes animation with copy-space. dark blue background.
1049019121,https://ak.picdn.net/shutterstock/videos/1049019121/preview/stock-footage-paragliding-from-the-peak-of-love-in-the-mountains-of-the-east-sayan.mp4,PT00H00M29S,174101_174150,Paragliding from the peak of love in the mountains of the east sayan.
1051923472,https://ak.picdn.net/shutterstock/videos/1051923472/preview/stock-footage-colorful-gold-dust-and-acrylic-paint-spreading-on-blue-watercolor-surface-mix-in-fantastic-design.mp4,PT00H00M16S,133851_133900,"Colorful gold dust and acrylic paint spreading on blue watercolor surface mix in fantastic design and patterns. sparkling golden particles, ink drops and mixing. multicolored background in motion"
1018379146,https://ak.picdn.net/shutterstock/videos/1018379146/preview/stock-footage-moving-among-skyscrapers-modern-office-building-glass-and-reflections-steadicam-shot.mp4,PT00H00M15S,075101_075150,Moving among skyscrapers. modern office building. glass and reflections. steadicam shot
1022181355,https://ak.picdn.net/shutterstock/videos/1022181355/preview/stock-footage-chicken-in-the-factory-hens-in-cages-industrial-farm-in-thailand-animal-and-agribusiness-food.mp4,PT00H00M17S,190951_191000,"Chicken in the factory, hens in cages industrial farm in thailand, animal and agribusiness, food production and industry concept"
4011742,https://ak.picdn.net/shutterstock/videos/4011742/preview/stock-footage-seattle-downtown-city-skyline-buildings-from-bay-boat.mp4,PT00H00M36S,035701_035750,Seattle downtown city skyline buildings from bay boat
1008356674,https://ak.picdn.net/shutterstock/videos/1008356674/preview/stock-footage-the-fisher-bastion-in-budapest.mp4,PT00H00M20S,037401_037450,The fisher bastion in budapest
18923855,https://ak.picdn.net/shutterstock/videos/18923855/preview/stock-footage-melbourne-australia-may-moving-shot-of-people-visiting-chinatown-in-melbourne.mp4,PT00H00M10S,049401_049450,"Melbourne, australia - may 15, 2016: moving shot of people visiting chinatown in melbourne, australia"
31973539,https://ak.picdn.net/shutterstock/videos/31973539/preview/stock-footage-a-girl-at-sunrise-with-an-inflatable-circle-looks-at-the-dawn-and-the-sea.mp4,PT00H00M23S,059751_059800,A girl at sunrise with an inflatable circle looks at the dawn and the sea.
4518905,https://ak.picdn.net/shutterstock/videos/4518905/preview/stock-footage-concert-crowd-slow-motion-also-normal-speed-version-of-this-video-available-in-my-portfolio.mp4,PT00H00M15S,087551_087600,"Concert crowd, slow motion, also normal speed version of this video available in my portfolio"
3491603,https://ak.picdn.net/shutterstock/videos/3491603/preview/stock-footage-bunch-of-wild-ducks-many-wild-ducks-in-the-pond-are-fighting-for-food.mp4,PT00H00M09S,136951_137000,Bunch of wild ducks. many wild ducks in the pond are fighting for food
1051850104,https://ak.picdn.net/shutterstock/videos/1051850104/preview/stock-footage-gas-mask-animation-protection-mask-on-green-screen-k-animation-vector-style-virus-prevention.mp4,PT00H00M20S,132701_132750,Gas mask animation - protection mask on green screen 4k animation - vector style - virus prevention 
34737262,https://ak.picdn.net/shutterstock/videos/34737262/preview/stock-footage-japanese-macaque-sitting-around-near-the-hot-springs-of-nagano.mp4,PT00H00M11S,124801_124850,Japanese macaque sitting around near the hot springs of nagano
1028888831,https://ak.picdn.net/shutterstock/videos/1028888831/preview/stock-footage-mountain-lake-surrounded-by-peaks-and-donkeys-grazing-on-its-shores-fann-mountains-tajikistan.mp4,PT00H00M47S,029901_029950,"Mountain lake surrounded by peaks and donkeys grazing on its shores, fann mountains, tajikistan."
1057657252,https://ak.picdn.net/shutterstock/videos/1057657252/preview/stock-footage-medium-shot-of-two-young-businesswomen-sitting-at-desks-in-coworking-space-and-working-using-gadgets.mp4,PT00H00M18S,003001_003050,Medium shot of two young businesswomen sitting at desks in coworking space and working using gadgets
22149238,https://ak.picdn.net/shutterstock/videos/22149238/preview/stock-footage-panning-aerial-shot-of-bridgnorth-uk.mp4,PT00H00M17S,096851_096900,"Panning aerial shot of bridgnorth, uk."
18074590,https://ak.picdn.net/shutterstock/videos/18074590/preview/stock-footage-pursuit-pomeranian-dog-in-a-flat.mp4,PT00H00M06S,190701_190750,Pursuit pomeranian dog in a flat
1031484212,https://ak.picdn.net/shutterstock/videos/1031484212/preview/stock-footage-a-pear-tree-with-small-fruit-swaying-in-the-wind-against-the-sky.mp4,PT00H00M15S,020101_020150,A pear tree with small fruit swaying in the wind against the sky.
1051949122,https://ak.picdn.net/shutterstock/videos/1051949122/preview/stock-footage--k-aerial-treehouse-in-the-panama-jungle-child-hood-dreams-rainforest-canopy.mp4,PT00H00M14S,117901_117950,"4k aerial, treehouse in the panama jungle, child hood dreams. rainforest canopy."
1057341172,https://ak.picdn.net/shutterstock/videos/1057341172/preview/stock-footage-woman-making-lavender-wreath-slow-motion-unrecognizable-female-florist-hands-creating-decoration.mp4,PT00H00M08S,063001_063050,Woman making lavender wreath. slow motion. unrecognizable female florist hands creating decoration with purpule lavender flowers. girl enjoying peaceful evening in provence french garden.
1033641989,https://ak.picdn.net/shutterstock/videos/1033641989/preview/stock-footage-medium-shot-of-a-young-female-gamer-playing-at-a-gaming-tournament.mp4,PT00H00M23S,032701_032750,Medium shot of a young female gamer playing at a gaming tournament
1044840937,https://ak.picdn.net/shutterstock/videos/1044840937/preview/stock-footage-blue-dance-floor-with-several-background.mp4,PT00H00M13S,041001_041050,Blue dance floor with several background
1023427441,https://ak.picdn.net/shutterstock/videos/1023427441/preview/stock-footage-vj-d-dark-pattern-star.mp4,PT00H00M08S,117801_117850,Vj 3d dark pattern star
1033757876,https://ak.picdn.net/shutterstock/videos/1033757876/preview/stock-footage-text-autumn-handwritten-on-sheet-of-notebook-and-animated.mp4,PT00H00M08S,035851_035900,Text autumn handwritten on sheet of notebook and animated.
1021767862,https://ak.picdn.net/shutterstock/videos/1021767862/preview/stock-footage-japanese-fireworks-and-night-view-of-tokyo.mp4,PT00H00M30S,187201_187250,Japanese fireworks and night view of tokyo
1020433879,https://ak.picdn.net/shutterstock/videos/1020433879/preview/stock-footage-reversal-drone-shot-from-farmhouse-and-over-a-crop-of-of-wheat-during-sunset.mp4,PT00H00M13S,039251_039300,Reversal drone shot from farmhouse and over a crop of of wheat during sunset
1017750034,https://ak.picdn.net/shutterstock/videos/1017750034/preview/stock-footage-young-woman-swinging-on-teeter-totter-by-the-beach-slow-motion-shot-of-woman-on-swing-having-fun.mp4,PT00H00M13S,041201_041250,Young woman swinging on teeter totter by the beach. slow motion shot of woman on swing having fun. vitality and freedom concept 
23785039,https://ak.picdn.net/shutterstock/videos/23785039/preview/stock-footage-bahawalpur-pakistan-february-view-of-a-castle-in-ss-world-park-in-bahawalpur.mp4,PT00H00M15S,061601_061650,"Bahawalpur, pakistan - february 06, 2017: view of a castle in ss world park in bahawalpur"
