videoid,contentUrl,duration,page_dir,name
1047581011,https://ak.picdn.net/shutterstock/videos/1047581011/preview/stock-footage-three-goats-graze-on-a-hillside-and-eat-grass.mp4,PT00H00M13S,059901_059950,Three goats graze on a hillside and eat grass
23593390,https://ak.picdn.net/shutterstock/videos/23593390/preview/stock-footage-budapest-hungary-feb-k-footage-of-the-historical-statue-complex-at-heroes-square.mp4,PT00H00M26S,088251_088300,"Budapest, hungary, feb 26, 2016: 4k footage of the historical statue complex at heroes square (hosok tere), one of the great squares in budapest."
1039064474,https://ak.picdn.net/shutterstock/videos/1039064474/preview/stock-footage-sassolungo-dolomites-time-lapse-of-clouds-just-after-the-storm-and-cable-car-gondolas-going-up.mp4,PT00H00M10S,110851_110900,"Sassolungo, dolomites - time lapse of clouds just after the storm and cable car gondolas going up and down. zoom in."
1015114927,https://ak.picdn.net/shutterstock/videos/1015114927/preview/stock-footage-slider-footage-of-the-sun-shining-through-pine-branches-with-some-lens-flare.mp4,PT00H00M15S,010001_010050,Slider footage of the sun shining through pine branches with some lens flare.
23878378,https://ak.picdn.net/shutterstock/videos/23878378/preview/stock-footage-aerial-view-amazing-seascape-with-small-waves-on-sandy-beach-portugal.mp4,PT00H00M22S,145451_145500,"Aerial view amazing seascape with small waves on sandy beach, portugal"
12714791,https://ak.picdn.net/shutterstock/videos/12714791/preview/stock-footage-abandoned-rural-church-aerial-view.mp4,PT00H00M14S,193601_193650,Abandoned rural church. aerial view
1052933126,https://ak.picdn.net/shutterstock/videos/1052933126/preview/stock-footage-a-man-is-sanding-the-wooden-door.mp4,PT00H00M07S,120101_120150,A man is sanding the wooden door
1034099627,https://ak.picdn.net/shutterstock/videos/1034099627/preview/stock-footage-aerial-rising-drone-shot-over-the-coast-and-forest-of-tornionjoki-river-on-a-cloudy-evening-in.mp4,PT00H00M18S,055551_055600,"Aerial, rising, drone shot, over the coast and forest of tornionjoki river, on a cloudy evening, in pello, lapland, finland"
30414721,https://ak.picdn.net/shutterstock/videos/30414721/preview/stock-footage-modern-filter-system-at-large-beer-company.mp4,PT00H00M09S,039151_039200,Modern filter system at large beer company
3444884,https://ak.picdn.net/shutterstock/videos/3444884/preview/stock-footage-volcanic-landscape.mp4,PT00H00M10S,065501_065550,Volcanic landscape
4094113,https://ak.picdn.net/shutterstock/videos/4094113/preview/stock-footage-young-western-jackdaw-perched-on-a-branch.mp4,PT00H00M18S,193501_193550,Young western jackdaw perched on a branch
1052511316,https://ak.picdn.net/shutterstock/videos/1052511316/preview/stock-footage-white-off-road-vehicle-drives-down-a-dirt-road-at-sunset-through-a-beautiful-flat-land-with-a-river.mp4,PT00H00M09S,138301_138350,White off road vehicle drives down a dirt road at sunset through a beautiful flat land with a river in the distance 
1040003024,https://ak.picdn.net/shutterstock/videos/1040003024/preview/stock-footage--k-d-christmas-ornament-background-d-christmas-balls-glossy-colors-falling-green-screen-and.mp4,PT00H00M36S,057301_057350,"4k 3d christmas ornament background, 3d christmas balls glossy colors falling  green screen and alpha channel background, 3d christmas ornament falling green screen and alpha channel  background."
28146913,https://ak.picdn.net/shutterstock/videos/28146913/preview/stock-footage-aerial-shot-of-russian-city-voronezh-the-urban-landscape-june-russia-k.mp4,PT00H00M20S,046251_046300,"Aerial shot of russian city - voronezh. the urban landscape. june 1, 2017 russia. 4k"
1015938241,https://ak.picdn.net/shutterstock/videos/1015938241/preview/stock-footage-computer-screen-showing-business-charts-graphics-background.mp4,PT00H00M29S,018201_018250,Computer screen showing business charts graphics background
1062007801,https://ak.picdn.net/shutterstock/videos/1062007801/preview/stock-footage-little-girl-in-pajamas-together-with-mother-dress-up-christmas-tree-give-gifts.mp4,PT00H00M22S,137051_137100,Little girl in pajamas together with mother dress up christmas tree give gifts
13767383,https://ak.picdn.net/shutterstock/videos/13767383/preview/stock-footage-beautiful-aerial-shot-taganga-town-and-bay-at-sunset-colombia-k.mp4,PT00H00M22S,088201_088250,"Beautiful aerial shot taganga town and bay at sunset, colombia. 4k"
1006711978,https://ak.picdn.net/shutterstock/videos/1006711978/preview/stock-footage-ventura-california-circa-s-a-large-home-is-badly-damaged-by-fire-following-the-thomas.mp4,PT00H00M13S,027351_027400,"Ventura, california - circa 2010s - a large home is badly damaged by fire following the 2017 thomas fire in ventura county, california."
7585273,https://ak.picdn.net/shutterstock/videos/7585273/preview/stock-footage--us-dollar-money-in-counting-machine.mp4,PT00H00M11S,184351_184400,100 us dollar money in counting machine
1018414969,https://ak.picdn.net/shutterstock/videos/1018414969/preview/stock-footage-santa-cesarea-terme-italy-the-girl-in-the-red-dress-walks-through-the-tropical-garden.mp4,PT00H00M11S,173251_173300,"Santa cesarea terme, italy. the girl in the red dress walks through the tropical garden"
25776494,https://ak.picdn.net/shutterstock/videos/25776494/preview/stock-footage-a-security-video-wall-of-an-airport-terminal.mp4,PT00H00M27S,149051_149100,A security video wall of an airport terminal.
20293729,https://ak.picdn.net/shutterstock/videos/20293729/preview/stock-footage-fried-spring-roll-chinese-food-style.mp4,PT00H00M10S,102351_102400,"Fried spring roll - chinese food style
"
1028584985,https://ak.picdn.net/shutterstock/videos/1028584985/preview/stock-footage-cheerful-good-looking-caucasian-female-girl-woman-student-happy-smile-being-happy-laughing-happy.mp4,PT00H00M08S,073001_073050,Cheerful good-looking caucasian female girl woman student happy smile being happy laughing. happy woman enjoying her life. positive emotions and feelings.
1011998423,https://ak.picdn.net/shutterstock/videos/1011998423/preview/stock-footage-strasbourg-france-jun-lgbt-gay-people-being-playful-in-water-fountain-dancing-having.mp4,PT00H00M11S,094551_094600,"Strasbourg, france - jun 10, 2017: lgbt gay people being playful in water fountain dancing having fun in slow motion at lesbian gay bisexual transgender glbt visibility march pride festigays"
26347898,https://ak.picdn.net/shutterstock/videos/26347898/preview/stock-footage-hairdresser-dry-hair-hair-dryer.mp4,PT00H00M22S,114351_114400,Hairdresser dry hair (hair dryer)
1008837131,https://ak.picdn.net/shutterstock/videos/1008837131/preview/stock-footage-close-up-shot-of-factory-worker-pushing-a-plant-machinery-button-industrial.mp4,PT00H00M04S,021601_021650,Close up shot of factory worker pushing a plant machinery button. industrial 
1029667241,https://ak.picdn.net/shutterstock/videos/1029667241/preview/stock-footage-miami-fl-usa-may-aerial-drone-stock-videos-of-a-luxury-yacht-in-biscayne-bay.mp4,PT00H00M20S,109001_109050,"Miami, fl, usa - may 15, 2019: aerial drone stock videos of a luxury yacht in biscayne bay"
1034586206,https://ak.picdn.net/shutterstock/videos/1034586206/preview/stock-footage-happy-family-mom-dad-and-little-cute-children-siblings-talking-laughing-embracing-sit-on-kitchen.mp4,PT00H00M07S,134651_134700,"Happy family mom dad and little cute children siblings talking laughing embracing sit on kitchen floor, smiling young parents having fun playing with funny small kids bonding together at home"
1063665856,https://ak.picdn.net/shutterstock/videos/1063665856/preview/stock-footage-medium-shot-of-two-middle-aged-caucasian-men-with-shovels-on-their-shoulders-are-standing-in-golden.mp4,PT00H00M20S,194351_194400,Medium shot of two middle-aged caucasian men with shovels on their shoulders are standing in golden wheat field at sunset and looking ahead
27807637,https://ak.picdn.net/shutterstock/videos/27807637/preview/stock-footage-big-red-cat-sitting-on-the-outdoor.mp4,PT00H00M25S,040701_040750,Big red cat sitting on the outdoor
1024640198,https://ak.picdn.net/shutterstock/videos/1024640198/preview/stock-footage-kind-nurse-giving-birthday-cake-to-aged-lonely-woman-taking-care-in-old-age.mp4,PT00H00M12S,176401_176450,"Kind nurse giving birthday cake to aged lonely woman, taking care in old age"
1040276474,https://ak.picdn.net/shutterstock/videos/1040276474/preview/stock-footage-bees-collecting-nectar-from-yellow-flowers-on-violet-blue-sky-background-on-a-sunny-autumn-day.mp4,PT00H00M21S,107401_107450,Bees collecting nectar from yellow flowers on violet blue sky background on a sunny autumn day
1022230831,https://ak.picdn.net/shutterstock/videos/1022230831/preview/stock-footage-tit-eats-from-the-feeder-in-winter.mp4,PT00H00M14S,056351_056400,Tit eats from the feeder in winter
1054181201,https://ak.picdn.net/shutterstock/videos/1054181201/preview/stock-footage-aerial-top-down-shot-of-the-city-of-passau-germany.mp4,PT00H00M59S,065101_065150,"Aerial top down shot of the city of passau, germany"
1023653617,https://ak.picdn.net/shutterstock/videos/1023653617/preview/stock-footage-german-flag-on-a-yacht.mp4,PT00H00M14S,041251_041300,German flag on a yacht
5166359,https://ak.picdn.net/shutterstock/videos/5166359/preview/stock-footage-medical-team-in-modern-glass-building-discussing-the-x-ray-of-a-patient.mp4,PT00H00M30S,010201_010250,Medical team in modern glass building discussing the x ray of a patient
1027966376,https://ak.picdn.net/shutterstock/videos/1027966376/preview/stock-footage-high-angle-view-of-happy-man-lying-on-snow-and-creating-snow-angel-figure.mp4,PT00H00M13S,124601_124650,High angle view of happy man lying on snow and creating snow angel figure
1031174678,https://ak.picdn.net/shutterstock/videos/1031174678/preview/stock-footage-cattle-relaxing-in-the-sun.mp4,PT00H00M12S,097901_097950,Cattle relaxing in the sun
25145753,https://ak.picdn.net/shutterstock/videos/25145753/preview/stock-footage-waterfall-with-the-stone.mp4,PT00H00M11S,011101_011150,Waterfall with the stone
12441500,https://ak.picdn.net/shutterstock/videos/12441500/preview/stock-footage-cinemagraph-loop-waves-rolling-in-as-person-walks-along-beach-pink-sky-motion-photo.mp4,PT00H00M10S,130001_130050,Cinemagraph loop - waves rolling in as person walks along beach - pink sky - motion photo
33383638,https://ak.picdn.net/shutterstock/videos/33383638/preview/stock-footage-aerial-bird-s-eye-view-video-taken-by-drone-of-incredible-view-from-chora-of-patmos-island.mp4,PT00H00M05S,023651_023700,"Aerial bird's eye view video taken by drone of incredible view from chora of patmos island, dodecanese, greece"
1025032199,https://ak.picdn.net/shutterstock/videos/1025032199/preview/stock-footage--k-timelapse-of-lonely-coconut-tree-at-the-beach-with-dramatic-blue-sky-zoom-in-effect.mp4,PT00H00M11S,038001_038050,4k timelapse of lonely coconut tree at the beach with dramatic blue sky. zoom in effect
1027111067,https://ak.picdn.net/shutterstock/videos/1027111067/preview/stock-footage-christmas-carousel-close-up-on-the-central-element.mp4,PT00H00M08S,129551_129600,Christmas carousel. close-up on the central element.
30994285,https://ak.picdn.net/shutterstock/videos/30994285/preview/stock-footage-podolsk-russia-september-o-shilin-save-the-gate-on-hockey-game-vityaz-vs-avangard.mp4,PT00H00M49S,118301_118350,"Podolsk, russia - september 3, 2017: o. shilin (74) save the gate on hockey game vityaz vs avangard on 10th russia khl championship in podolsk, russia. vityaz won 6:2"
21191704,https://ak.picdn.net/shutterstock/videos/21191704/preview/stock-footage-german-autumn-forest.mp4,PT00H00M11S,186451_186500,German autumn forest 
1010379557,https://ak.picdn.net/shutterstock/videos/1010379557/preview/stock-footage-aerial-view-pink-flower-blossom-festival-at-surisan-south-korea.mp4,PT00H00M17S,052401_052450,Aerial view pink flower blossom festival at surisan  south korea
1024790168,https://ak.picdn.net/shutterstock/videos/1024790168/preview/stock-footage-exclamation-triangle-symbol-inflames-then-disappears-in-out-loop-alpha-channel-premultiplied.mp4,PT00H00M09S,108901_108950,Exclamation triangle symbol inflames. then disappears. in - out loop. alpha channel premultiplied - matted with color black
20561587,https://ak.picdn.net/shutterstock/videos/20561587/preview/stock-footage-caviar-in-a-transparent-container.mp4,PT00H00M14S,199751_199800,Caviar in a transparent container
4699163,https://ak.picdn.net/shutterstock/videos/4699163/preview/stock-footage-charming-little-girl-playing-with-a-magnifying-glass.mp4,PT00H00M06S,035851_035900,Charming little girl playing with a magnifying glass
1013775983,https://ak.picdn.net/shutterstock/videos/1013775983/preview/stock-footage-jetty-beach-busselton-western-australia.mp4,PT00H00M27S,073351_073400,Jetty & beach - busselton - western australia
1026526943,https://ak.picdn.net/shutterstock/videos/1026526943/preview/stock-footage-athletic-female-working-out-using-battle-ropes-crossfit-slow-motion-k.mp4,PT00H00M19S,105951_106000,Athletic female working out using battle ropes. crossfit. slow motion. 4k
33824377,https://ak.picdn.net/shutterstock/videos/33824377/preview/stock-footage-monsoon-cloouds-time-lapse-storm-clouds-time-lapse-nature-rain-weather-dark-bad-weather.mp4,PT00H00M09S,071151_071200,"Monsoon cloouds time lapse. storm clouds time lapse, nature rain weather. dark bad weather. thunderstorm dark clouds rolling. an hd time lapse of clouds against a dark blue sky.  full hd video. 1080p."
15537154,https://ak.picdn.net/shutterstock/videos/15537154/preview/stock-footage-hands-take-away-from-the-table-a-plate-with-a-easter-cake-with-white-icing.mp4,PT00H00M06S,090051_090100,Hands take away from the table a plate with a easter cake with white icing.
1024221788,https://ak.picdn.net/shutterstock/videos/1024221788/preview/stock-footage-the-architecture-of-the-medieval-buildings-of-the-fuessen-mountains-in-the-background.mp4,PT00H00M10S,090151_090200,The architecture of the medieval buildings of the fuessen mountains in the background.
31894393,https://ak.picdn.net/shutterstock/videos/31894393/preview/stock-footage-green-grass-and-drops-of-morning-dew.mp4,PT00H00M08S,040001_040050,Green grass and drops of morning dew
34085023,https://ak.picdn.net/shutterstock/videos/34085023/preview/stock-footage-forester-is-measuring-the-width-of-the-mossy-tree-trunk-with-an-old-wooden-metre-ruler.mp4,PT00H00M19S,088151_088200,Forester is measuring the width of the mossy tree trunk with an old wooden metre ruler.
1047144856,https://ak.picdn.net/shutterstock/videos/1047144856/preview/stock-footage-saint-petersburg-russia-older-boy-and-younger-boy-at-camp-on-riverbank-prepare-stove-to-cook.mp4,PT00H00M05S,134651_134700,Saint petersburg russia-1967: older boy and younger boy at camp on riverbank prepare stove to cook
1010767088,https://ak.picdn.net/shutterstock/videos/1010767088/preview/stock-footage-aerial-tour-very-close-to-the-famous-el-cerrito-archaeological-zone-just-outside-the-center-of-quer.mp4,PT00H00M25S,183151_183200,Aerial tour very close to the famous el cerrito archaeological zone just outside the center of querétaro on a beautiful day
1011450164,https://ak.picdn.net/shutterstock/videos/1011450164/preview/stock-footage-soldier-holding-gun-weapon-and-waring-armor-uniform-the-military-is-responsible-for-maintaining.mp4,PT00H00M05S,015051_015100,Soldier holding gun weapon and waring armor uniform. the military is responsible for maintaining the territory.
1012342169,https://ak.picdn.net/shutterstock/videos/1012342169/preview/stock-footage-refreshing-cold-soft-drink-in-sand-on-beach.mp4,PT00H00M07S,006551_006600,Refreshing cold soft drink in sand on beach
10310891,https://ak.picdn.net/shutterstock/videos/10310891/preview/stock-footage-female-hand-shaving-leg-in-the-bathroom-closeup.mp4,PT00H00M15S,109401_109450,Female hand shaving leg in the bathroom closeup
31431655,https://ak.picdn.net/shutterstock/videos/31431655/preview/stock-footage-sunset-aerial-cityscape-in-olhao-algarve-fishing-village-view-of-ancient-neighbourhood-of-barreta.mp4,PT00H00M48S,051451_051500,"Sunset aerial cityscape in olhao, algarve fishing village view of ancient neighbourhood of barreta, and its traditional cubist architecture. portugal."
1056857147,https://ak.picdn.net/shutterstock/videos/1056857147/preview/stock-footage-close-up-portrait-of-a-happy-little-girl-in-a-dress-in-a-summer-park-cute-child-smiling-and-having.mp4,PT00H00M16S,053601_053650,Close-up portrait of a happy little girl in a dress in a summer park. cute child smiling and having fun outdoors. positive child. happy childhood concept.
1055015360,https://ak.picdn.net/shutterstock/videos/1055015360/preview/stock-footage-castle-of-sarospatak-hungary-another-name-is-rakoczi-castle-this-is-a-rennesiance-fort-what-built.mp4,PT00H00M25S,088501_088550,Castle of sarospatak hungary another name is rakoczi castle. this is a rennesiance fort what built in after 1250. the castle of sárospatak can be seen on the back of the hungarian huf 500 paper money.
1033714205,https://ak.picdn.net/shutterstock/videos/1033714205/preview/stock-footage-abstract-digital-glitch-art-animation-effect-retro-futurism-wave-style-video-signal-damage-with.mp4,PT00H00M13S,137401_137450,Abstract digital glitch art animation effect. retro futurism wave style. video signal damage with pixel noise and error interference
1056973895,https://ak.picdn.net/shutterstock/videos/1056973895/preview/stock-footage-portrait-young-blonde-woman-in-protective-medical-mask-stand-on-street-speak-on-phone-texts.mp4,PT00H00M10S,106951_107000,Portrait young blonde woman in protective medical mask stand on street speak on phone texts coronavirus covid-19 pandemic infection quarantine smartphone slow motion
1039502786,https://ak.picdn.net/shutterstock/videos/1039502786/preview/stock-footage-this-stock-motion-graphics-video-shows-rainbow-glitch.mp4,PT00H00M20S,094901_094950,This stock motion graphics video  shows rainbow glitch.
1035120266,https://ak.picdn.net/shutterstock/videos/1035120266/preview/stock-footage-panorama-view-of-the-mountainous-area-with-blue-water-houses-in-the-valley-surrounded-trees.mp4,PT00H00M14S,041251_041300,Panorama view of the mountainous area with blue water houses in the valley surrounded trees
19893871,https://ak.picdn.net/shutterstock/videos/19893871/preview/stock-footage-an-expanding-column-of-radioactive-spray-envelopes-the-target-array-of-navy-vessels-for-test-baker.mp4,PT00H02M15S,183501_183550,"An expanding column of radioactive spray envelopes the target array of navy vessels for test baker, during operation crossroads in 1946 (1940s)"
1052493121,https://ak.picdn.net/shutterstock/videos/1052493121/preview/stock-footage-wild-forest-and-lake-in-a-beautiful-day.mp4,PT00H00M15S,111401_111450,Wild forest and lake in a beautiful day
1052528711,https://ak.picdn.net/shutterstock/videos/1052528711/preview/stock-footage-colorful-stars-fall-down-and-move-in-pass-camera-on-black-space-background-stars-motion-background.mp4,PT00H00M09S,133651_133700,Colorful stars fall down and move in pass camera on black space background. stars motion background
13135184,https://ak.picdn.net/shutterstock/videos/13135184/preview/stock-footage-shot-of-a-man-rolling-a-wheelbarrow-toward-the-camera-a-landscape-worker-rolls-his-equipment.mp4,PT00H00M19S,175501_175550,Shot of a man rolling a wheelbarrow toward the camera. a landscape worker rolls his equipment across a field from a grove of trees.
1046875360,https://ak.picdn.net/shutterstock/videos/1046875360/preview/stock-footage-conceptual-d-blockchain-motion-on-digital-dark-computer-cyberspace-network-background.mp4,PT00H00M25S,193651_193700,Conceptual 3d blockchain motion on digital dark computer cyberspace network background.
1061500075,https://ak.picdn.net/shutterstock/videos/1061500075/preview/stock-footage-soft-texture-food-cream-gradient-colors-background.mp4,PT00H00M06S,051651_051700,Soft texture food cream gradient colors background
20130787,https://ak.picdn.net/shutterstock/videos/20130787/preview/stock-footage-colorful-day-at-the-inn-river-with-the-sun-shinning-at-the-autumn-colored-trees-and-the-green-river.mp4,PT00H00M10S,194551_194600,Colorful day at the inn river with the sun shinning at the autumn colored trees and the green river water
1062019279,https://ak.picdn.net/shutterstock/videos/1062019279/preview/stock-footage-flyover-of-new-apartment-building-complex-in-china-drone-shot-of-asian-newly-constructed.mp4,PT00H00M59S,198051_198100,Flyover of new apartment building complex in china. drone shot of asian newly constructed residential towers in xichang. real estate development in dense populous city.
1039955807,https://ak.picdn.net/shutterstock/videos/1039955807/preview/stock-footage-aerial-view-of-vineyards-in-the-pfalz-in-germany-on-a-sunny-day-in-autumn-fall-pan-to-the-left.mp4,PT00H00M14S,120151_120200,"Aerial view of vineyards in the pfalz in germany. on a sunny day in autumn, fall. pan to the left ebside grape fields with a village in the back."
3857603,https://ak.picdn.net/shutterstock/videos/3857603/preview/stock-footage-a-big-bird-flying-away.mp4,PT00H00M05S,120401_120450,A big bird flying away.
1063751989,https://ak.picdn.net/shutterstock/videos/1063751989/preview/stock-footage-plettenberg-bay-south-africa-witsand-beach-of-the-robberg-reserve-reveals-a-white.mp4,PT00H00M09S,146051_146100,"Plettenberg bay , south africa - 02 21 2020: witsand beach of the robberg reserve reveals a white sand beach bar "
7713898,https://ak.picdn.net/shutterstock/videos/7713898/preview/stock-footage-mountain-landscape-global-warming-x-nature.mp4,PT00H00M08S,069351_069400,Mountain landscape. global warming. 1920x1080. nature
1047369643,https://ak.picdn.net/shutterstock/videos/1047369643/preview/stock-footage-pov-journey-on-forest-pathway-exploring-lush-garden-with-trees-and-greenery-on-beautiful-morning.mp4,PT00H00M30S,030151_030200,Pov journey on forest pathway exploring lush garden with trees and greenery on beautiful morning
28947403,https://ak.picdn.net/shutterstock/videos/28947403/preview/stock-footage-waves-on-lake-in-beautiful-landscape-background.mp4,PT00H00M25S,102201_102250,Waves on lake in beautiful landscape background
1027853423,https://ak.picdn.net/shutterstock/videos/1027853423/preview/stock-footage-top-view-of-green-fields-and-rock-wall-shot-panoramic-view-of-natural-stone-wall-with-trees-on.mp4,PT00H00M11S,184851_184900,Top view of green fields and rock wall. shot. panoramic view of natural stone wall with trees on background of houses and mountain horizons on sunny summer day
8209933,https://ak.picdn.net/shutterstock/videos/8209933/preview/stock-footage-paradise-island-aerial-view-thailand.mp4,PT00H00M14S,188351_188400,Paradise island. aerial view.thailand.
31797772,https://ak.picdn.net/shutterstock/videos/31797772/preview/stock-footage-geometric-multicolor-tunnel-glowing-lights-loop-computer-generated-abstract-motion-background.mp4,PT00H00M10S,008801_008850,"Geometric multicolor tunnel glowing lights loop. computer generated abstract motion background. perfect to use with music, backgrounds, transition and titles."
1011290132,https://ak.picdn.net/shutterstock/videos/1011290132/preview/stock-footage-aerial-view-of-typical-irish-countryside-with-lands-and-houses.mp4,PT00H00M26S,084251_084300,Aerial view of typical irish countryside with lands and houses
1023739204,https://ak.picdn.net/shutterstock/videos/1023739204/preview/stock-footage-behind-the-squares-appears-the-symbol-kiss-wink-heart-in-out-alpha-channel-premultiplied.mp4,PT00H00M12S,146801_146850,"Behind the squares appears the symbol kiss wink heart. in - out. alpha channel premultiplied - matted with color rgb (8,132,164)"
1026390032,https://ak.picdn.net/shutterstock/videos/1026390032/preview/stock-footage-santa-claus-working-with-laptop-in-a-office-santa-claus-using-a-smartphone.mp4,PT00H00M12S,126051_126100,Santa claus working with laptop in a office. santa claus using a smartphone
1033001231,https://ak.picdn.net/shutterstock/videos/1033001231/preview/stock-footage-to-be-always-aware-of-the-task-she-has-to-do-and-not-to-forget-it-a-woman-writes-a-reminder-she.mp4,PT00H00M16S,017351_017400,"To be always aware of the task she has to do and not to forget it, a woman writes a reminder. she glues a small pink piece of paper on her laptop."
1016103943,https://ak.picdn.net/shutterstock/videos/1016103943/preview/stock-footage-three-dimensional-pattern-of-star-figures-slowly-moving-abstract-kaleidoscope-background-d.mp4,PT00H00M20S,072051_072100,Three-dimensional pattern of star figures slowly moving. abstract kaleidoscope background. 3d rendering
21832774,https://ak.picdn.net/shutterstock/videos/21832774/preview/stock-footage-blurred-natural-mineral.mp4,PT00H00M09S,041951_042000,Blurred  natural mineral
1035125270,https://ak.picdn.net/shutterstock/videos/1035125270/preview/stock-footage-portrait-mature-middle-aged-single-woman-using-digital-tablet-while-sitting-in-the-park-smile.mp4,PT00H00M20S,089351_089400,"Portrait mature middle aged single woman using digital tablet while sitting in the park, smile, relaxing, beautiful garden."
464302,https://ak.picdn.net/shutterstock/videos/464302/preview/stock-footage-fishing-boat-passes-wind-farm-in-the-north-sea.mp4,PT00H00M17S,047601_047650,Fishing boat passes wind farm in the north sea
4822328,https://ak.picdn.net/shutterstock/videos/4822328/preview/stock-footage--s-a-fish-processing-plant-in-alaska-in.mp4,PT00H01M07S,023751_023800,1930s - a fish processing plant in alaska in 1932.
1038715148,https://ak.picdn.net/shutterstock/videos/1038715148/preview/stock-footage-man-picking-apples-in-his-orchard.mp4,PT00H00M17S,015751_015800,Man picking apples in his orchard
