videoid,contentUrl,duration,page_dir,name
12893120,https://ak.picdn.net/shutterstock/videos/12893120/preview/stock-footage-little-pigs-at-farm-sniffing-camera-shallow-depth-of-field.mp4,PT00H00M26S,194301_194350,Little pigs at farm. sniffing camera. shallow depth of field.
1038436280,https://ak.picdn.net/shutterstock/videos/1038436280/preview/stock-footage-boats-docked-in-sea-port-at-sunset-mediterranean-fishermen-village-of-cambrils-in-spain.mp4,PT00H00M14S,145151_145200,"Boats docked in sea port at sunset. mediterranean fishermen village of cambrils in spain. tranquility, relaxation and fashionable vacation. panning mode"
4065928,https://ak.picdn.net/shutterstock/videos/4065928/preview/stock-footage-lake-in-the-morning-fog.mp4,PT00H00M28S,020301_020350,Lake in the morning fog
1924405,https://ak.picdn.net/shutterstock/videos/1924405/preview/stock-footage-church-in-arequipa.mp4,PT00H00M16S,018451_018500,Church in arequipa
27271942,https://ak.picdn.net/shutterstock/videos/27271942/preview/stock-footage-people-going-up-and-down-stairs-in-house-static-camera-medium-shot.mp4,PT00H00M19S,085901_085950,People going up and down stairs in house. static camera medium shot
22962970,https://ak.picdn.net/shutterstock/videos/22962970/preview/stock-footage--k-female-tennis-player-practicing-her-serve-on-outdoor-court-in-the-summer-dec-uk.mp4,PT00H00M24S,019301_019350,4k female tennis player practicing her serve on outdoor court in the summer. dec 2016-uk
21591832,https://ak.picdn.net/shutterstock/videos/21591832/preview/stock-footage-breeding-chickens-in-cages.mp4,PT00H00M13S,115101_115150,Breeding chickens in cages
1052334241,https://ak.picdn.net/shutterstock/videos/1052334241/preview/stock-footage-close-up-view-of-serious-bussinessman-in-hat-and-suit-typing-message-and-looking-at-phone-screen.mp4,PT00H00M14S,017201_017250,Close up view of serious bussinessman in hat and suit typing message and looking at phone screen. serious guy in stylish clothes using smartphone for communicating at street
1038349478,https://ak.picdn.net/shutterstock/videos/1038349478/preview/stock-footage-happy-family-mom-and-son-concept-mom-tender-childhood-video-slow-motion-video-mom-a-brunette.mp4,PT00H00M22S,188301_188350,Happy family mom and son concept . mom tender childhood video . slow motion video . mom a brunette lifestyle girl gently hugs takes care of the boy son blonde outdoors
19838014,https://ak.picdn.net/shutterstock/videos/19838014/preview/stock-footage-video-of-sardinian-beach-porto-giunco-selective-focus.mp4,PT00H00M15S,135051_135100,"Video of sardinian beach porto giunco, selective focus"
31146217,https://ak.picdn.net/shutterstock/videos/31146217/preview/stock-footage-man-driving-the-car-under-sunset-sky-at-outdoor-x.mp4,PT00H00M12S,180601_180650,Man driving the car under sunset sky at outdoor. 3840x2160
1041262789,https://ak.picdn.net/shutterstock/videos/1041262789/preview/stock-footage-a-rich-young-man-wants-to-buy-a-house-and-calls-a-professional-real-estate-agent-for-this-d-flat.mp4,PT00H00M09S,037751_037800,A rich young man wants to buy a house and calls a professional real estate agent for this. 2d flat animation isolated on white background 4k.
1054773647,https://ak.picdn.net/shutterstock/videos/1054773647/preview/stock-footage-time-lapse-of-bangkok-business-district-city-center-with-cloud-pass-over-buildings-in-morning.mp4,PT00H00M08S,132501_132550,Time lapse of bangkok business district city center with cloud pass over buildings in morning
1056818447,https://ak.picdn.net/shutterstock/videos/1056818447/preview/stock-footage-aerial-view-of-a-row-of-construction-or-cargo-cranes-on-the-river-bank-with-a-ship-standing-nearby.mp4,PT00H00M32S,058301_058350,Aerial view of a row of construction or cargo cranes on the river bank with a ship standing nearby. ship docks off kanonersky island. industrial port with water barges and transport tugs.
9640115,https://ak.picdn.net/shutterstock/videos/9640115/preview/stock-footage-freelance-working-with-laptop-at-espresso-shop-stock-footage.mp4,PT00H00M18S,133751_133800,"Freelance working with laptop at espresso shop, stock footage"
4634105,https://ak.picdn.net/shutterstock/videos/4634105/preview/stock-footage-beautiful-happy-surprised-woman-with-positive-emotions-over-white-background.mp4,PT00H00M11S,033551_033600,Beautiful happy surprised woman with positive emotions over white background
28956289,https://ak.picdn.net/shutterstock/videos/28956289/preview/stock-footage-filling-a-pot-with-dirt.mp4,PT00H00M18S,067951_068000,Filling a pot with dirt
23825305,https://ak.picdn.net/shutterstock/videos/23825305/preview/stock-footage-young-rider-girl-clean-out-dirt-from-hoof-with-hook.mp4,PT00H00M08S,145851_145900,Young rider girl clean out dirt from hoof with hook
20190256,https://ak.picdn.net/shutterstock/videos/20190256/preview/stock-footage-athletic-man-working-out.mp4,PT00H00M15S,021801_021850,Athletic man working out.
11094008,https://ak.picdn.net/shutterstock/videos/11094008/preview/stock-footage-cute-squirell-in-summer.mp4,PT00H00M12S,005401_005450,"Cute squirell in summer
"
1052304070,https://ak.picdn.net/shutterstock/videos/1052304070/preview/stock-footage-reveal-shot-of-sunlit-beach.mp4,PT00H00M24S,006451_006500,Reveal shot of sunlit beach
5197487,https://ak.picdn.net/shutterstock/videos/5197487/preview/stock-footage-handsome-man-taking-a-picture-of-himself-with-his-smartphone-in-park.mp4,PT00H00M16S,182001_182050,"Handsome man taking a picture of himself with his smartphone in park
"
5926517,https://ak.picdn.net/shutterstock/videos/5926517/preview/stock-footage-las-vegas-nv-april-front-of-fitzgeralds-casino-now-known-as-the-d-on-fremont-street-on.mp4,PT00H00M19S,077601_077650,"Las vegas, nv - april 10: front of fitzgeralds casino, now known as the d, on fremont street on april 10, 2013 in las vegas, nevada."
14029814,https://ak.picdn.net/shutterstock/videos/14029814/preview/stock-footage-white-storks-and-common-crane-common-crane-and-white-storks-in-the-lake-of-hula-valey.mp4,PT00H00M25S,195001_195050,"White storks and common crane 
common crane and white storks in the lake of hula valey
"
1029354569,https://ak.picdn.net/shutterstock/videos/1029354569/preview/stock-footage-man-works-as-a-hand-tool-hatchet-processes-a-board-of-pine-tree-by-clearing-it-from-the-bark.mp4,PT00H00M24S,074601_074650,"Man works as a hand tool hatchet, processes a board of pine tree by clearing it from the bark. construction worker planing a piece of wood for a building project."
1056885551,https://ak.picdn.net/shutterstock/videos/1056885551/preview/stock-footage-vj-disco-abstract-background-colorful-background-k-ultra-hd-abstract-backgrounds-club.mp4,PT00H00M09S,055951_056000,"Vj disco abstract  background, colorful background, 4k ultra hd, abstract  backgrounds,   club concert dance disco dj matrix beam dmx fashion "
17220121,https://ak.picdn.net/shutterstock/videos/17220121/preview/stock-footage-panning-shot-of-a-green-field-of-wheat.mp4,PT00H00M09S,011151_011200,Panning shot of a green field of wheat.
1032554432,https://ak.picdn.net/shutterstock/videos/1032554432/preview/stock-footage-caucasian-male-performs-a-deadlift-with-very-heavy-weights-on-a-barbell.mp4,PT00H00M13S,118001_118050,Caucasian male performs a deadlift with very heavy weights on a barbell.
1025188787,https://ak.picdn.net/shutterstock/videos/1025188787/preview/stock-footage-aerial-ascending-view-of-a-small-crater-revealing-mount-etna-in-sicily-italy.mp4,PT00H00M19S,119601_119650,Aerial ascending view of a small crater revealing mount etna in sicily (italy)
15391807,https://ak.picdn.net/shutterstock/videos/15391807/preview/stock-footage-modern-tractor-planting-potatoes-in-the-spring.mp4,PT00H00M07S,005001_005050,Modern tractor planting potatoes in the spring
7709809,https://ak.picdn.net/shutterstock/videos/7709809/preview/stock-footage-midsection-of-workers.mp4,PT00H00M17S,087551_087600,Midsection of workers
1039126379,https://ak.picdn.net/shutterstock/videos/1039126379/preview/stock-footage-young-long-legged-girl-in-short-shorts-is-walking-along-shallows-on-lake-under-clear-water-you-can.mp4,PT00H00M21S,079751_079800,"Young long-legged girl in short shorts is walking along shallows on lake, under clear water you can see rails, flooded railway track, water waves, girl slowly goes to distant horizon, beautiful clouds"
1040128739,https://ak.picdn.net/shutterstock/videos/1040128739/preview/stock-footage-point-of-view-shot-of-woman-running-with-athletic-caucasian-man-in-sportswear-on-forest-trail-while.mp4,PT00H00M16S,183451_183500,Point of view shot of woman running with athletic caucasian man in sportswear on forest trail while exercising together outdoors on summer day
1023714496,https://ak.picdn.net/shutterstock/videos/1023714496/preview/stock-footage-canary-islands-realistic-closeup-flag-animation-perfect-for-background-seamless-looping.mp4,PT00H00M10S,108301_108350,Canary islands realistic closeup flag animation. perfect for background. seamless looping.
12369449,https://ak.picdn.net/shutterstock/videos/12369449/preview/stock-footage-johannesburg-gauteng-south-africa-a-colourful-display-of-nighttime-traffic-driving.mp4,PT00H00M23S,110601_110650,"Johannesburg, gauteng, south africa - 09/06/2015 a colourful display of nighttime traffic driving along the streets at night fall of the city centre of johannesburg at nelson mandela bridge"
9020161,https://ak.picdn.net/shutterstock/videos/9020161/preview/stock-footage-aerial-frozen-forest-in-winter.mp4,PT00H00M29S,177551_177600,Aerial: frozen forest in winter
1011892241,https://ak.picdn.net/shutterstock/videos/1011892241/preview/stock-footage-house-wren-perched-on-a-flower-plant-singing.mp4,PT00H00M37S,035901_035950,House wren perched on a flower plant singing
8387347,https://ak.picdn.net/shutterstock/videos/8387347/preview/stock-footage-montenegro-podgorica-boy-playing-street-basketball-at-playground.mp4,PT00H00M08S,030501_030550,Montenegro - podgorica 2014 - boy playing street basketball at playground
1047051472,https://ak.picdn.net/shutterstock/videos/1047051472/preview/stock-footage-dominican-republic-april-speedboats-floating-in-blue-lagoon-on-the-way-to-island-saona.mp4,PT00H00M40S,195701_195750,Dominican republic - 28 april 2019: speedboats floating in blue lagoon on the way to island saona. people having fun and looking on starfishes. summer vacations. famous travel destination
1013365265,https://ak.picdn.net/shutterstock/videos/1013365265/preview/stock-footage-ventura-california-circa-aerial-over-suburban-southern-california-sprawl-and-condos-near.mp4,PT00H00M29S,096201_096250,"Ventura, california - circa 2017 - aerial over suburban southern california sprawl and condos near ventura, california."
1818539,https://ak.picdn.net/shutterstock/videos/1818539/preview/stock-footage-mule-deer-in-wyoming-laying-in-the-shadows-eating-grass-and-brush-during-the-autumn-large-antler.mp4,PT00H00M20S,147701_147750,Mule deer in wyoming. laying in the shadows eating grass and brush during the autumn. large antler horns showing a mature set of horns. wildlife in nature.
1040127119,https://ak.picdn.net/shutterstock/videos/1040127119/preview/stock-footage-aerial-beauty-of-nature-with-waterfalls-and-golden-autumn.mp4,PT00H00M26S,184401_184450,Aerial beauty of nature with waterfalls and golden autumn
1042733602,https://ak.picdn.net/shutterstock/videos/1042733602/preview/stock-footage-oahu-hawaii-usa-town-next-to-river.mp4,PT00H00M05S,184701_184750,Oahu hawaii usa-1959: town next to river
1018174315,https://ak.picdn.net/shutterstock/videos/1018174315/preview/stock-footage-aerial-of-lagoa-verde-at-the-sete-cidades-crater-sao-miguel-azores.mp4,PT00H00M44S,184351_184400,"Aerial of lagoa verde at the sete cidades crater, sao miguel azores"
1009076864,https://ak.picdn.net/shutterstock/videos/1009076864/preview/stock-footage--pretty-happy-young-asian-woman-using-mobile-phone-video-chatting-in-the-city-at-afternoon.mp4,PT00H00M09S,183301_183350,  pretty happy young asian woman using mobile phone video chatting  in the city at afternoon
6828043,https://ak.picdn.net/shutterstock/videos/6828043/preview/stock-footage-beautiful-orange-background-with-waves.mp4,PT00H00M17S,123751_123800,Beautiful orange background with waves
1061201215,https://ak.picdn.net/shutterstock/videos/1061201215/preview/stock-footage-animated-skeleton-dancing-in-the-graveyard-with-full-moon-d-illustration-moon-image-courtesy-of.mp4,PT00H00M17S,097101_097150,Animated skeleton dancing in the graveyard with full moon. 3d illustration.  moon image courtesy of nasa.
1029784763,https://ak.picdn.net/shutterstock/videos/1029784763/preview/stock-footage-bergheim-germany-may-black-and-white-infrared-timelapse-view-of-lignite-fired-power.mp4,PT00H00M21S,142901_142950,"Bergheim, germany, may 14, 2019 - black and white infrared timelapse view of lignite fired power plant niederaussem operated by rwe powerack and white "
14786917,https://ak.picdn.net/shutterstock/videos/14786917/preview/stock-footage-animation-colorful-confetti-paper-twisted-ribbon-and-element-particle-falling-for-holiday-party.mp4,PT00H00M22S,000801_000850,"Animation colorful confetti paper, twisted ribbon, and element particle falling for holiday party advertisement and celebration decoration concept in black isolated background in 4k ultra hd"
30593335,https://ak.picdn.net/shutterstock/videos/30593335/preview/stock-footage-young-beautiful-woman-on-a-trip-to-london.mp4,PT00H00M06S,044751_044800,Young beautiful woman on a trip to london
33962068,https://ak.picdn.net/shutterstock/videos/33962068/preview/stock-footage-ducks-tufted-duck-and-teal.mp4,PT00H00M44S,106801_106850,Ducks - tufted duck and teal
16318726,https://ak.picdn.net/shutterstock/videos/16318726/preview/stock-footage-hawaiian-lava-flow.mp4,PT00H00M15S,089601_089650,Hawaiian lava flow
1036388006,https://ak.picdn.net/shutterstock/videos/1036388006/preview/stock-footage-middle-distance-of-three-red-ripe-raspberries-are-turning-around-on-a-mirror-surface-fresh-juicy.mp4,PT00H00M17S,177851_177900,"Middle distance of three red ripe raspberries are turning around on a mirror surface. fresh juicy berries isolated on a black background,seamless loops."
27759715,https://ak.picdn.net/shutterstock/videos/27759715/preview/stock-footage-garden-background-purple-round-flowers-waving-by-wind.mp4,PT00H00M17S,171201_171250,Garden background purple round flowers waving by wind
1037509445,https://ak.picdn.net/shutterstock/videos/1037509445/preview/stock-footage-hanukkah-menorah-with-candles-twilight-sunset-sky-background.mp4,PT00H00M29S,004801_004850,"Hanukkah menorah with candles, twilight sunset sky background"
21584773,https://ak.picdn.net/shutterstock/videos/21584773/preview/stock-footage-epic-kaleidoscopic-background-for-title-credits-intro-sequences-music-videos-meditations-event.mp4,PT00H00M26S,120851_120900,"Epic kaleidoscopic background for title credits, intro sequences, music videos, meditations, event projections & over-all amazing video effects! (octagon symmetrical kaleidoscope: optical illusions)"
1039028864,https://ak.picdn.net/shutterstock/videos/1039028864/preview/stock-footage-young-woman-doing-exercise-on-bridge-outdoors-in-city-stretching.mp4,PT00H00M07S,184351_184400,"Young woman doing exercise on bridge outdoors in city, stretching."
1014010604,https://ak.picdn.net/shutterstock/videos/1014010604/preview/stock-footage-carbonated-water-in-a-transparent-glass-lime-bubbles-black-background.mp4,PT00H00M17S,087201_087250,"Carbonated water in a transparent glass, lime, bubbles, black background."
26450948,https://ak.picdn.net/shutterstock/videos/26450948/preview/stock-footage-laser-printer.mp4,PT00H00M12S,149251_149300,Laser printer
1021009378,https://ak.picdn.net/shutterstock/videos/1021009378/preview/stock-footage-white-long-grain-and-round-grain-rice-in-wooden-spoons-on-a-wooden-background-rotate.mp4,PT00H00M27S,002751_002800,White long-grain and round-grain rice in wooden spoons on a wooden background rotate counterclockwise top view
30672496,https://ak.picdn.net/shutterstock/videos/30672496/preview/stock-footage-singapore-august-k-video-of-marina-bay-sands-at-night-on-august-in-singapore.mp4,PT00H00M12S,145651_145700,Singapore - 19 august 2017: 4k video of marina bay sands at night on 19 august 2017 in singapore.
1673095,https://ak.picdn.net/shutterstock/videos/1673095/preview/stock-footage-wind-turbine-timelapse-realistic-d-render-composited-with-real-clouds-timelapse.mp4,PT00H00M18S,017901_017950,Wind turbine timelapse  realistic 3d render composited with real clouds timelapse
2299070,https://ak.picdn.net/shutterstock/videos/2299070/preview/stock-footage-overflowing-a-river-during-the-spring-flood-in-evergreen-woods-in-karelia-russia.mp4,PT00H00M20S,073401_073450,"Overflowing a river during the spring flood in evergreen woods in karelia, russia"
1063856983,https://ak.picdn.net/shutterstock/videos/1063856983/preview/stock-footage-quarantine-cafe-concept-on-terrace-attractive-young-woman-sitting-in-cafe-on-alone-woman-eating.mp4,PT00H00M20S,100051_100100,Quarantine cafe concept on terrace. attractive young woman sitting in cafe on alone. woman eating during break. woman in black face mask and gloves eating vegan salad
1023030331,https://ak.picdn.net/shutterstock/videos/1023030331/preview/stock-footage-various-spices-in-glass-jars-on-wooden-table-tilt-down-footage-selective-focus.mp4,PT00H00M10S,036801_036850,Various spices in glass jars on wooden table. tilt down footage. selective focus.
917542,https://ak.picdn.net/shutterstock/videos/917542/preview/stock-footage-running-cubes.mp4,PT00H00M14S,063101_063150,Running cubes
1039134563,https://ak.picdn.net/shutterstock/videos/1039134563/preview/stock-footage-crying-little-baby-infant-upset.mp4,PT00H00M13S,022301_022350,Crying little baby infant upset
16487521,https://ak.picdn.net/shutterstock/videos/16487521/preview/stock-footage-clouds-in-the-blue-sky-above-the-city-timelapse.mp4,PT00H00M25S,143101_143150,Clouds in the blue sky above the city. timelapse.
1205656,https://ak.picdn.net/shutterstock/videos/1205656/preview/stock-footage-the-background-of-an-illusory.mp4,PT00H00M10S,090601_090650,The background of an illusory 
1041561475,https://ak.picdn.net/shutterstock/videos/1041561475/preview/stock-footage-woman-engineer-talking-on-the-phone-with-the-pliers-studio-isolated-shot-against-green-screen.mp4,PT00H00M29S,190551_190600,Woman engineer talking on the phone with the pliers studio isolated shot against green screen background
1009896896,https://ak.picdn.net/shutterstock/videos/1009896896/preview/stock-footage-magnolias-beautifully-blossom-in-the-botanical-garden-in-the-spring-windy-day-video-clip-shot.mp4,PT00H00M41S,182301_182350,Magnolias beautifully blossom in the botanical garden in the spring windy day video clip shot closeup
33172042,https://ak.picdn.net/shutterstock/videos/33172042/preview/stock-footage-rundle-mountain-in-two-jack-lake-banff-national-park-at-sunset.mp4,PT00H00M20S,128801_128850,"Rundle mountain in two jack lake ,banff national park at sunset."
1023272176,https://ak.picdn.net/shutterstock/videos/1023272176/preview/stock-footage-multi-ethnic-male-female-young-friends-enjoying-freedom-college-break-dancing-sunset-coastal-beach.mp4,PT00H00M21S,192001_192050,Multi ethnic male female young friends enjoying freedom college break dancing sunset coastal beach shot on red epic
1013931371,https://ak.picdn.net/shutterstock/videos/1013931371/preview/stock-footage-a-young-boy-sits-in-a-park-after-falling-from-a-bike-calms-the-pain-in-his-knee-is-a-dangerous.mp4,PT00H00M15S,173201_173250,"A young boy sits in a park after falling from a bike, calms the pain in his knee, is a dangerous bike ride 4k"
1040706938,https://ak.picdn.net/shutterstock/videos/1040706938/preview/stock-footage-happy-beauty-morning-woman-eating-muesli-oatmeal-from-bowl-using-spoon-at-kitchen-close-up.mp4,PT00H00M15S,076601_076650,Happy beauty morning woman eating muesli oatmeal from bowl using spoon at kitchen close-up
1046383639,https://ak.picdn.net/shutterstock/videos/1046383639/preview/stock-footage-sticky-rice-fried-in-bamboo-seams-with-coconut-milk-and-beans-brown-glutinous-rice-a-national.mp4,PT00H00M11S,051551_051600,"Sticky rice fried in bamboo seams with coconut milk and beans. brown glutinous rice, a national dish. the thai name is khao lam."
16124524,https://ak.picdn.net/shutterstock/videos/16124524/preview/stock-footage-playful-kitten-playing-with-a-toy-on-a-white-background.mp4,PT00H00M07S,056151_056200,Playful kitten playing with a toy on a white background
1049918761,https://ak.picdn.net/shutterstock/videos/1049918761/preview/stock-footage-a-man-in-a-mask-and-gloves-is-preparing-to-fight-the-pandemic-shows-a-fig-for-covid.mp4,PT00H00M14S,133001_133050,"A man in a mask and gloves is preparing to fight the pandemic. shows a fig for covid-19 (coronavirus). black background, black t-shirt
"
1040605238,https://ak.picdn.net/shutterstock/videos/1040605238/preview/stock-footage-crane-shot-man-walking-alone-on-snowy-forest-path-reveals-into-shot-of-woods.mp4,PT00H00M29S,083351_083400,Crane shot man walking alone on snowy forest path reveals into shot of woods
15608929,https://ak.picdn.net/shutterstock/videos/15608929/preview/stock-footage-group-of-asian-openbill-storks-standing-at-the-farmland-in-cambodia.mp4,PT00H00M12S,184001_184050,Group of asian openbill storks standing at the farmland in cambodia
4760300,https://ak.picdn.net/shutterstock/videos/4760300/preview/stock-footage-muskox.mp4,PT00H00M25S,023551_023600,Muskox
29994391,https://ak.picdn.net/shutterstock/videos/29994391/preview/stock-footage-out-of-focus-of-the-night-scape-in-hong-kong.mp4,PT00H00M15S,145751_145800,Out of focus of the night scape in hong kong 
32502289,https://ak.picdn.net/shutterstock/videos/32502289/preview/stock-footage-toronto-ontario-canada-november-pov-driving-into-toronto-condominiums-and-office-towers.mp4,PT00H00M32S,105101_105150,"Toronto, ontario, canada november 2017 pov driving into toronto condominiums and office towers downtown"
18389512,https://ak.picdn.net/shutterstock/videos/18389512/preview/stock-footage-dj-needle-on-spinning-turntable-listening-the-music.mp4,PT00H00M22S,019201_019250,"Dj needle on spinning turntable. listening the music
"
23392834,https://ak.picdn.net/shutterstock/videos/23392834/preview/stock-footage-bali-indonesia-january-presentation-of-traditional-balinese-women-kecak-fire-dance-on.mp4,PT00H00M41S,028501_028550,"Bali, indonesia - january 24: presentation of traditional balinese women kecak fire dance on january 24, 2017 on bali. kecak (also known as ramayana monkey chant) is very popular cultural show."
1013818505,https://ak.picdn.net/shutterstock/videos/1013818505/preview/stock-footage-circa-replacement-troops-march-down-a-road-in-france-in-world-war.mp4,PT00H01M42S,009801_009850,Circa 1918 - replacement troops march down a road in france in world war 1.
1018240690,https://ak.picdn.net/shutterstock/videos/1018240690/preview/stock-footage-macro-closeup-of-cleaning-camera-s-sensor-with-cotton-pad-video-in-slow-motion.mp4,PT00H00M07S,055751_055800,Macro closeup of cleaning camera's sensor with cotton pad - video in slow motion
12950468,https://ak.picdn.net/shutterstock/videos/12950468/preview/stock-footage-inserting-and-removing-a-sd-card-from-a-laptop-flat-picture-profile.mp4,PT00H00M13S,142651_142700,Inserting and removing a sd card from a laptop. flat picture profile
1007069113,https://ak.picdn.net/shutterstock/videos/1007069113/preview/stock-footage-istanbul-atakoy-marina.mp4,PT00H00M15S,176401_176450,Istanbul atakoy marina 3
1022812003,https://ak.picdn.net/shutterstock/videos/1022812003/preview/stock-footage-guangzhou-china-may-time-lapse-of-guangzhou-city-skyline-cars-traffic-jam-on-liede.mp4,PT00H00M29S,199301_199350,"Guangzhou, china - may 12, 2012 time lapse of guangzhou city skyline cars traffic jam on liede bridge cloudy day"
1026232076,https://ak.picdn.net/shutterstock/videos/1026232076/preview/stock-footage-baltic-sea-shore-deserted-beach-waves-blue-sky-mossy-stones-pine-trees-wind-horizon-nature.mp4,PT00H00M27S,198801_198850,"Baltic sea shore, deserted beach: waves, blue sky, mossy stones, pine trees, wind, horizon. nature background."
1059079190,https://ak.picdn.net/shutterstock/videos/1059079190/preview/stock-footage-coffee-cup-with-smoke-and-coffee-beans.mp4,PT00H00M15S,052801_052850,"Coffee cup with smoke and coffee beans
"
1056632462,https://ak.picdn.net/shutterstock/videos/1056632462/preview/stock-footage-victoria-peak-hong-kong-july-hong-kong-sunset.mp4,PT00H00M25S,070901_070950,"Victoria peak, hong kong 20 july 2020: hong kong sunset"
1026020630,https://ak.picdn.net/shutterstock/videos/1026020630/preview/stock-footage--k-drone-shot-of-a-farm-field.mp4,PT00H00M15S,097251_097300,4k drone shot of a farm field 
14857804,https://ak.picdn.net/shutterstock/videos/14857804/preview/stock-footage-filling-flutes-of-champagne-with-golden-bubbles-against-gold-bokeh-background-holiday-concept.mp4,PT00H00M04S,038301_038350,"Filling flutes of champagne with golden bubbles against gold bokeh background, holiday concept"
1007187832,https://ak.picdn.net/shutterstock/videos/1007187832/preview/stock-footage-smoke-silhouette-fps-super-slowdown-rotation-d-animation.mp4,PT00H00M10S,177351_177400,Smoke silhouette 1000fps super slowdown rotation 3d animation
29198380,https://ak.picdn.net/shutterstock/videos/29198380/preview/stock-footage-focused-black-businessman-typing-on-laptop-in-empty-office-at-night.mp4,PT00H00M14S,096401_096450,Focused black businessman typing on laptop in empty office at night
1028916080,https://ak.picdn.net/shutterstock/videos/1028916080/preview/stock-footage-new-york-new-york-united-states-april-the-port-authority-bus-terminal-is-the-largest-and.mp4,PT00H00M12S,000101_000150,New york new york united states april 29 2019. the port authority bus  terminal is the largest and busiest in the world.
