videoid,contentUrl,duration,page_dir,name
1034796896,https://ak.picdn.net/shutterstock/videos/1034796896/preview/stock-footage-the-waves-running-on-the-sandy-beach.mp4,PT00H00M20S,094051_094100,The waves running on the sandy beach
16565164,https://ak.picdn.net/shutterstock/videos/16565164/preview/stock-footage-kuala-lumpur-malaysia-may-something-exciting-sign-on-covered-store-window.mp4,PT00H00M10S,188701_188750,"Kuala lumpur, malaysia - may 2016 : something exciting sign on covered store window "
1018043839,https://ak.picdn.net/shutterstock/videos/1018043839/preview/stock-footage-abstract-white-interior-multilevel-public-space-with-window-d-animation-and-rendering.mp4,PT00H00M12S,124401_124450,Abstract white interior multilevel public space with window. 3d animation and rendering.
1020222172,https://ak.picdn.net/shutterstock/videos/1020222172/preview/stock-footage-abstract-background-colorful-blurred-bokeh-of-light-moving-around-from-a-light-led-footage.mp4,PT00H00M08S,128151_128200,Abstract background colorful blurred bokeh of light moving around from a light led footage background in night party garden tunnel.
12519650,https://ak.picdn.net/shutterstock/videos/12519650/preview/stock-footage-amazing-sunset-view-look-from-the-airplane-window.mp4,PT00H00M26S,187951_188000,"Amazing sunset view,look from the airplane window"
30252490,https://ak.picdn.net/shutterstock/videos/30252490/preview/stock-footage-man-with-little-girl-spend-their-time-in-rope-park.mp4,PT00H00M12S,103751_103800,Man with little girl spend their time in rope park
1040972663,https://ak.picdn.net/shutterstock/videos/1040972663/preview/stock-footage-over-the-shoulder-shot-of-two-female-friends-talking-in-coffee-shop.mp4,PT00H00M12S,057301_057350,Over the shoulder shot of two female friends talking in coffee shop.
1037431469,https://ak.picdn.net/shutterstock/videos/1037431469/preview/stock-footage-abstract-watercolor-texture-as-background.mp4,PT00H00M10S,199101_199150,Abstract watercolor texture as background
1029353030,https://ak.picdn.net/shutterstock/videos/1029353030/preview/stock-footage-planet-earth-seen-from-the-international-space-station-with-aurora-borealis-australis-time-lapse.mp4,PT00H00M08S,039501_039550,Planet earth seen from the international space station with aurora borealis australis time lapse
1030459481,https://ak.picdn.net/shutterstock/videos/1030459481/preview/stock-footage-flowing-honey-over-strawberries-with-background.mp4,PT00H00M08S,049501_049550,Flowing honey over strawberries with background
6211070,https://ak.picdn.net/shutterstock/videos/6211070/preview/stock-footage-the-main-road-and-the-railway-intersecting-to-make-through-for-cars-and-trains.mp4,PT00H00M04S,094351_094400,The main road and the railway intersecting to make through for cars and trains
33783421,https://ak.picdn.net/shutterstock/videos/33783421/preview/stock-footage-a-confectioner-finishes-spreading-cream-over-a-cake-standing-on-a-cake-stand.mp4,PT00H00M21S,180701_180750,A confectioner finishes spreading cream over a cake standing on a cake stand...
1064072203,https://ak.picdn.net/shutterstock/videos/1064072203/preview/stock-footage-young-man-in-santa-hat-and-warm-sweater-is-carrying-out-the-countdown-rejoicing-about-new-years.mp4,PT00H00M12S,080151_080200,"Young man in santa hat and warm sweater is carrying out the countdown, rejoicing about new years coming, congratulating you and smiling while posing against blue background. close up, copy space"
34303294,https://ak.picdn.net/shutterstock/videos/34303294/preview/stock-footage-young-man-admire-view-from-window-at-home-super-slow-motion-fps.mp4,PT00H00M30S,118251_118300,"Young man admire view from window at home, super slow motion 240fps
"
14584231,https://ak.picdn.net/shutterstock/videos/14584231/preview/stock-footage-innovation-data-tunnel.mp4,PT00H00M15S,023651_023700,Innovation data tunnel.
1015316008,https://ak.picdn.net/shutterstock/videos/1015316008/preview/stock-footage-paris-may-woman-taking-selfie-with-man-in-background-tourist-couple-on-champ-de-mars.mp4,PT00H00M39S,129501_129550,"Paris - may 3, 2018: woman taking selfie with man in background, tourist couple on champ de mars with eiffel tower in paris france europe. the iconic landmark is a wrought iron lattice tower."
1054204649,https://ak.picdn.net/shutterstock/videos/1054204649/preview/stock-footage-wood-texture-wooden-wall-with-herringbone-pattern-replacing-old-weathered-boards-with-new-ones.mp4,PT00H00M08S,175401_175450,Wood texture. wooden wall with herringbone pattern. replacing old weathered boards with new ones.
1011900101,https://ak.picdn.net/shutterstock/videos/1011900101/preview/stock-footage-time-lapse-of-cloud-floating-above-sulfur-lake-with-its-reflection-among-volcano-mountain.mp4,PT00H00M06S,103101_103150,Time lapse of cloud floating above sulfur lake with its reflection among volcano mountain
34780933,https://ak.picdn.net/shutterstock/videos/34780933/preview/stock-footage-led-constant-light-for-video-and-photography-shooting.mp4,PT00H00M30S,065601_065650,Led constant light for video and photography shooting
1021679137,https://ak.picdn.net/shutterstock/videos/1021679137/preview/stock-footage-strumica-macedonia-circa-july-tourists-and-hikers-resting-on-the-terrace-in-front-of-the.mp4,PT00H00M23S,018901_018950,"Strumica, macedonia - circa july 2018: tourists and hikers resting on the terrace in front of the smolare waterfall"
30622744,https://ak.picdn.net/shutterstock/videos/30622744/preview/stock-footage-fresh-citrus-fruits-rotate-video-footage-of-the-concept-of-a-healthy-food-and-diet-swirling-wet.mp4,PT00H00M15S,117401_117450,Fresh citrus fruits. rotate video footage of the concept of a healthy food and diet. swirling wet oranges covered with drops on a white marble coating
1064459932,https://ak.picdn.net/shutterstock/videos/1064459932/preview/stock-footage-woman-winemaker-and-vineyard-owner-locally-grown-grapes-rural-lifestyle-adult-woman-harvesting.mp4,PT00H00M15S,118601_118650,Woman winemaker and vineyard owner. locally grown grapes. rural lifestyle. adult woman harvesting grapes in vineyard. family small business. farm winery. grape picking. organic produce
1013286263,https://ak.picdn.net/shutterstock/videos/1013286263/preview/stock-footage-portrait-of-a-beautiful-young-girl-in-the-city-with-a-smile.mp4,PT00H00M08S,036001_036050,Portrait of a beautiful young girl in the city with a smile
1014383540,https://ak.picdn.net/shutterstock/videos/1014383540/preview/stock-footage-one-pretty-young-asian-woman-talking-on-the-phone-outdoor-in-the-city-k.mp4,PT00H00M16S,132851_132900,"One pretty young asian woman talking on the phone outdoor in the city, 4k"
1020673591,https://ak.picdn.net/shutterstock/videos/1020673591/preview/stock-footage-olomouc-czech-republic-october-waste-water-and-wastewater-treatment-plant-newly-and-new.mp4,PT00H00M10S,140451_140500,"Olomouc, czech republic, october 24, 2018: waste water and wastewater treatment plant newly and new built processes sedimentation, filtration, oxidation, biochemical, healthy environment"
23802355,https://ak.picdn.net/shutterstock/videos/23802355/preview/stock-footage-slow-motion-fish-roll-in-flour-the-pieces-of-fish-for-frying.mp4,PT00H00M16S,175201_175250,Slow motion. fish roll in flour. the pieces of fish for frying
13833773,https://ak.picdn.net/shutterstock/videos/13833773/preview/stock-footage-fish.mp4,PT00H00M08S,171451_171500,Fish 
1026614957,https://ak.picdn.net/shutterstock/videos/1026614957/preview/stock-footage-ducks-on-the-pond-ducks-swimming-in-the-water.mp4,PT00H00M11S,119101_119150,"Ducks on the pond, ducks swimming in the water."
34165864,https://ak.picdn.net/shutterstock/videos/34165864/preview/stock-footage-abstract-background-with-animation-of-mosaic-pattern-from-lines-triangles-and-squares-on-glass.mp4,PT00H00M10S,029501_029550,"Abstract background with animation of mosaic pattern from lines, triangles and squares on glass surface. animation of seamless loop."
33707395,https://ak.picdn.net/shutterstock/videos/33707395/preview/stock-footage--k-aerial-photography-heavenly-landscape-of-the-landscape-with-a-mountain-lake-in-siberia-near.mp4,PT00H00M22S,081251_081300,4k. aerial photography. heavenly landscape of the landscape with a mountain lake in siberia near lake baikal. warm lake of the snezhnaya river. vydrino
18311161,https://ak.picdn.net/shutterstock/videos/18311161/preview/stock-footage-airborne-officers-visit-bolivia-to-train-nurses-in-classroom-and-practical-help-in-the-hospital-in.mp4,PT00H01M09S,081901_081950,Airborne officers visit bolivia to train nurses in classroom and practical help in the hospital in 1966. (1960s)
10612298,https://ak.picdn.net/shutterstock/videos/10612298/preview/stock-footage-juvenile-many-spotted-sweetlips-swimming-irratically-whilst-feeding.mp4,PT00H00M47S,189301_189350,Juvenile many spotted sweetlips swimming irratically whilst feeding
1028765855,https://ak.picdn.net/shutterstock/videos/1028765855/preview/stock-footage-animated-deer-with-dancing-polygon-on-blurred-background.mp4,PT00H00M15S,186401_186450,Animated deer with dancing polygon on blurred background
9736235,https://ak.picdn.net/shutterstock/videos/9736235/preview/stock-footage-russia-moscow-april-woman-having-botox-treatment-in-beauty-salon-on-april-in.mp4,PT00H00M22S,078651_078700,"Russia, moscow - april 20, 2015: woman having botox treatment in beauty salon on april 20, 2015 in moscow, russia. "
1010128472,https://ak.picdn.net/shutterstock/videos/1010128472/preview/stock-footage-fit-pretty-woman-making-stretching-exercising-on-mat-in-nature-slow-motion.mp4,PT00H00M08S,121101_121150,"Fit pretty woman making stretching, exercising on mat in nature. slow motion"
1012556000,https://ak.picdn.net/shutterstock/videos/1012556000/preview/stock-footage-a-beautiful-woman-in-a-black-swimsuit-lies-on-a-lounger-with-canopies-smiling-and-looking-at-the.mp4,PT00H00M08S,044901_044950,"A beautiful woman in a black swimsuit lies on a lounger with canopies. smiling and looking at the frame, close-up"
13504436,https://ak.picdn.net/shutterstock/videos/13504436/preview/stock-footage-beijing-china-august-chinese-man-taking-photos-of-huge-lcd-screen-at-the-place-shopping.mp4,PT00H00M19S,087651_087700,"Beijing, china - august 2008: chinese man taking photos of huge lcd screen at the place shopping mall in beijing, china."
1043895463,https://ak.picdn.net/shutterstock/videos/1043895463/preview/stock-footage--d-rendered-medically-accurate-animation-of-heart-and-blood-vessels.mp4,PT00H00M10S,196851_196900,3d rendered medically accurate animation of heart and blood vessels
1052307118,https://ak.picdn.net/shutterstock/videos/1052307118/preview/stock-footage-boy-looking-the-car-window-trip-with-family-baby-boy-looking-out-of-window-car-driving-road-trips.mp4,PT00H00M19S,074251_074300,Boy looking the car window. trip with family. baby boy looking out of window car driving road trips travel. medium shot of adorable toddler boy sitting in car seat of moving car and looking out window
32346517,https://ak.picdn.net/shutterstock/videos/32346517/preview/stock-footage-circa-s-a-patient-leaves-the-office-of-a-doctor-and-a-man-on-the-street-deciding-to-get-a.mp4,PT00H00M45S,027151_027200,"Circa 1940s - a patient leaves the office of a doctor and a man on the street, deciding to get a tuberculosis test, turns and walks to the clinic, in new york city, in 1946."
1228249,https://ak.picdn.net/shutterstock/videos/1228249/preview/stock-footage-cranes-operate-above-apartment-building-construction-site-at-night-time-lapse.mp4,PT00H00M07S,035201_035250,"Cranes operate above apartment building construction site at night, time lapse"
14624566,https://ak.picdn.net/shutterstock/videos/14624566/preview/stock-footage-a-large-school-of-fish-indo-pacific-sergeant-abudefduf-vaigiensis-and-school-of-fish-silver-moony.mp4,PT00H00M19S,175851_175900,"A large school of fish indo-pacific sergeant (abudefduf vaigiensis) and school of fish silver moony (monodactylus argenteus) bustles beneath the surface, indian ocean, hikkaduwa, sri lanka, asia
"
1045278667,https://ak.picdn.net/shutterstock/videos/1045278667/preview/stock-footage-lovely-young-caucasian-bride-and-groom-in-the-park-wedding-couple-happy-family-newlyweds-man.mp4,PT00H00M06S,108251_108300,Lovely young caucasian bride and groom in the park. wedding couple. happy family. newlyweds. man and woman in love. slow motion
853327,https://ak.picdn.net/shutterstock/videos/853327/preview/stock-footage-watusi-cattle-grazing.mp4,PT00H00M13S,195601_195650,Watusi cattle grazing
29534821,https://ak.picdn.net/shutterstock/videos/29534821/preview/stock-footage--d-animation-rotation-of-symbol-of-industrial-work-industrial-technology-hard-work-oil-and.mp4,PT00H00M10S,011351_011400,"3d animation rotation of symbol of industrial work, industrial technology, hard work, oil and fossil production, building, repair, factories, nuclear industry from glass. animation of seamless loop."
25190264,https://ak.picdn.net/shutterstock/videos/25190264/preview/stock-footage-ocean-waves-and-the-rugged-shore-of-hawaii.mp4,PT00H00M15S,183901_183950,Ocean waves and the rugged shore of hawaii
1053634646,https://ak.picdn.net/shutterstock/videos/1053634646/preview/stock-footage--calligraphic-th-of-july-typography-on-the-white-background-animation-vdo.mp4,PT00H00M05S,022501_022550, calligraphic 4th of july typography on the white background animation vdo
1042215958,https://ak.picdn.net/shutterstock/videos/1042215958/preview/stock-footage-the-final-stage-of-laying-paving-slabs-is-the-filling-of-gaps-with-dry-sand-female-hand-sweeps.mp4,PT00H00M20S,067851_067900,The final stage of laying paving slabs is the filling of gaps with dry sand. female hand sweeps sand with a broom on a gray surface of concrete slabs
1012728575,https://ak.picdn.net/shutterstock/videos/1012728575/preview/stock-footage-russian-velikiy-novgorod-zoom-in-from-space.mp4,PT00H00M11S,121751_121800,Russian velikiy novgorod zoom in from space
23064991,https://ak.picdn.net/shutterstock/videos/23064991/preview/stock-footage-prague-czech-republic-december-winter-scenes-of-vltava-river-in-czechia-capital-with-boat.mp4,PT00H00M17S,189401_189450,"Prague, czech republic - december 2016: winter scenes of vltava river in czechia capital with boat transport lines"
28825780,https://ak.picdn.net/shutterstock/videos/28825780/preview/stock-footage-shellfish-eggs-are-a-source-of-pests.mp4,PT00H00M09S,060501_060550,Shellfish eggs are a source of pests.
16612126,https://ak.picdn.net/shutterstock/videos/16612126/preview/stock-footage-the-pacific-ocean-at-the-point-lobos-state-natural-reserve-california-united-states-the-point.mp4,PT00H00M23S,060601_060650,"The pacific ocean at the point lobos state natural reserve, california, united states. the point lobos protected areas provide shelter to a wide range of fish, invertebrates, birds, and marine mammals"
26424017,https://ak.picdn.net/shutterstock/videos/26424017/preview/stock-footage-young-slender-woman-tourist-leaving-the-elevator-and-then-the-building-out-to-the-street-with-a.mp4,PT00H00M16S,190701_190750,"Young slender woman tourist leaving the elevator and then the building out to the street with a great suitcase, camera and bag"
11913140,https://ak.picdn.net/shutterstock/videos/11913140/preview/stock-footage--k-wide-steadicam-shot-of-father-and-son-fixing-flat-tire-of-bike-on-home-driveway.mp4,PT00H00M10S,101451_101500,4k wide steadicam shot of father and son fixing flat tire of bike on home driveway. 
1019775223,https://ak.picdn.net/shutterstock/videos/1019775223/preview/stock-footage-young-black-woman-wearing-sunglasses-looking-to-camera-laughing-on-a-london-street-at-the-golden.mp4,PT00H00M22S,023751_023800,"Young black woman wearing sunglasses looking to camera laughing on a london street at the golden hour, close up"
30997285,https://ak.picdn.net/shutterstock/videos/30997285/preview/stock-footage-animation-of-a-long-shadow-israel-map-with-its-flag-and-a-comic-balloon-with-a-umbrella.mp4,PT00H00M15S,126951_127000,Animation of a long shadow israel map with its flag and a comic balloon with a umbrella
8226856,https://ak.picdn.net/shutterstock/videos/8226856/preview/stock-footage-rome-italy-may-main-street-in-rome-italy-that-leads-to-st-peter-s-basilica-standing-on.mp4,PT00H00M09S,070701_070750,"Rome, italy - may 2014: main street in rome, italy that leads to st. peter's basilica. standing on the main street that is turned towards st. peter's basilica in vatican city"
1029341510,https://ak.picdn.net/shutterstock/videos/1029341510/preview/stock-footage-closeup-of-stirring-onions-in-chilli-prawns-cooking.mp4,PT00H00M25S,066951_067000,Closeup of stirring onions in chilli prawns cooking
1035070559,https://ak.picdn.net/shutterstock/videos/1035070559/preview/stock-footage-schwedagon-pagoda-yangon-aerial-drone-view.mp4,PT00H00M08S,109501_109550,Schwedagon pagoda yangon aerial drone view
1049286226,https://ak.picdn.net/shutterstock/videos/1049286226/preview/stock-footage-attractive-girl-in-a-medical-gown-and-mask-wears-rubber-gloves-for-safety-coronavirus-covid.mp4,PT00H00M07S,055151_055200,"Attractive girl in a medical gown and mask wears rubber gloves for safety, coronavirus 2020 covid-19
"
1045102351,https://ak.picdn.net/shutterstock/videos/1045102351/preview/stock-footage-young-pretty-woman-lays-in-forest-during-sunset-when-camera-flying-by-capturing-top-view.mp4,PT00H00M24S,109001_109050,Young pretty woman lays in forest during sunset when camera flying by capturing top view
26617990,https://ak.picdn.net/shutterstock/videos/26617990/preview/stock-footage-training-on-the-tennis-court-aerial-move-up.mp4,PT00H00M12S,052051_052100,Training on the tennis court aerial move up
11857907,https://ak.picdn.net/shutterstock/videos/11857907/preview/stock-footage-the-young-man-and-the-siberian-husky.mp4,PT00H00M10S,141401_141450,The young man and the siberian husky
18138067,https://ak.picdn.net/shutterstock/videos/18138067/preview/stock-footage-close-up-view-of-blue-splashes-in-slow-motion.mp4,PT00H00M31S,003151_003200,Close-up view of blue splashes in slow motion
5492012,https://ak.picdn.net/shutterstock/videos/5492012/preview/stock-footage-different-equalizer-flash-background-series-version-from-to.mp4,PT00H00M10S,084101_084150,Different equalizer flash background ( series 9 - version from 1 to 14 ) 
8912632,https://ak.picdn.net/shutterstock/videos/8912632/preview/stock-footage-exploration-tower-near-cocoa-beach-florida-port-canaveral-editorial-content-non.mp4,PT00H00M15S,118251_118300,Exploration tower near cocoa beach florida. port canaveral. 02-15-2015. editorial content. non-commercial use only 
1030804916,https://ak.picdn.net/shutterstock/videos/1030804916/preview/stock-footage-woman-weeding-young-dill-on-a-bed-in-a-home-garden.mp4,PT00H00M21S,146251_146300,Woman weeding young dill on a bed in a home garden
1053108545,https://ak.picdn.net/shutterstock/videos/1053108545/preview/stock-footage-yellow-cement-wall-background-or-texture-the-camera-zoom-out.mp4,PT00H00M10S,122901_122950,Yellow cement wall background or texture. the camera zoom out
1053904319,https://ak.picdn.net/shutterstock/videos/1053904319/preview/stock-footage-close-up-of-orange-squirrel-eating-a-hazelnut.mp4,PT00H00M19S,053551_053600,"Close up of orange squirrel eating a hazelnut
"
33034030,https://ak.picdn.net/shutterstock/videos/33034030/preview/stock-footage-pouring-water-on-a-strawberry.mp4,PT00H00M30S,109251_109300,Pouring water on a strawberry
1023351583,https://ak.picdn.net/shutterstock/videos/1023351583/preview/stock-footage-copenhagen-denmark-january-snowy-quay-with-moored-yachts-and-pleasure-boat-sailing-on.mp4,PT00H00M13S,179051_179100,"Copenhagen, denmark - january 26 2019: snowy quay with moored yachts and pleasure boat sailing on water with tourists onboard "
27907450,https://ak.picdn.net/shutterstock/videos/27907450/preview/stock-footage-aerial-flight-with-drone-over-the-beautiful-sunflower-field-in-summer-sunflowers.mp4,PT00H00M11S,182451_182500,Aerial flight with drone over the beautiful sunflower field in summer (sunflowers)
1029661916,https://ak.picdn.net/shutterstock/videos/1029661916/preview/stock-footage-businessman-in-black-shirt-adjusts-wrist-watch-young-successful-man-looks-at-the-time-on-the-clock.mp4,PT00H00M08S,064151_064200,Businessman in black shirt adjusts wrist watch. young successful man looks at the time on the clock. aged man puts on a wrist watch and corrects a strap. dark ton
4132258,https://ak.picdn.net/shutterstock/videos/4132258/preview/stock-footage--s-united-states-marines-march-through-vietnam-and-search-for-enemy-combatants.mp4,PT00H01M26S,128101_128150,1960s - united states marines march through vietnam and search for enemy combatants
1033728458,https://ak.picdn.net/shutterstock/videos/1033728458/preview/stock-footage-black-labrador-retriever-puppies-playing-in-a-flowerpot-normandy-slow-motion-k.mp4,PT00H00M07S,109301_109350,"Black labrador retriever, puppies playing in a flowerpot, normandy, slow motion 4k"
1045322686,https://ak.picdn.net/shutterstock/videos/1045322686/preview/stock-footage--pink-cream-pouring-out-on-a-yellow-background-a-macro-shot-on-red-epic.mp4,PT00H00M10S,144901_144950,"
pink cream pouring out on a yellow background a macro shot on red epic"
1018807810,https://ak.picdn.net/shutterstock/videos/1018807810/preview/stock-footage-fast-moving-clouds-rising-over-a-hilly-landscape-after-heavy-rain.mp4,PT00H00M14S,055101_055150,Fast moving clouds rising over a hilly landscape after heavy rain
30300022,https://ak.picdn.net/shutterstock/videos/30300022/preview/stock-footage-portrait-happy-loving-family-happy-family-on-beach-mother-holds-arms-of-her-son-and-daughter.mp4,PT00H00M22S,095101_095150,Portrait happy loving family. happy family on beach. mother holds arms of her son and daughter walking along seashore beach on summer vacation. slow motion. holiday and travel concept.
26893516,https://ak.picdn.net/shutterstock/videos/26893516/preview/stock-footage-dolly-shot-of-bearded-homeless-man-walking-down-the-street-with-shooping-card-at-cold-autumn-day.mp4,PT00H00M26S,185051_185100,Dolly shot of bearded homeless man walking down the street with shooping card at cold autumn day
1020225673,https://ak.picdn.net/shutterstock/videos/1020225673/preview/stock-footage-colorful-scenic-view-of-majestic-dolomites-mountains-in-italian-alps-majestic-rocky-mountains.mp4,PT00H00M26S,062401_062450,Colorful scenic view of majestic dolomites mountains in italian alps. majestic rocky mountains surrounded with yellow trees in autumn time.
1021346539,https://ak.picdn.net/shutterstock/videos/1021346539/preview/stock-footage-paris-france-august-shot-of-the-egyptian-obelisk-of-the-place-de-la-concorde-square-in.mp4,PT00H00M08S,084351_084400,"Paris, france - august 2015 : shot of the egyptian obelisk of the place de la concorde square in paris france, with its inscriptions and symbols of egypt in golden hieroglyph, a beautiful summer day "
1027492070,https://ak.picdn.net/shutterstock/videos/1027492070/preview/stock-footage-bangkok-by-drone.mp4,PT00H00M28S,007901_007950,Bangkok by drone.
1028675195,https://ak.picdn.net/shutterstock/videos/1028675195/preview/stock-footage-happy-university-student-couple-with-laptop-sitting-outside.mp4,PT00H00M45S,061351_061400,Happy university student couple with laptop sitting outside.
21136330,https://ak.picdn.net/shutterstock/videos/21136330/preview/stock-footage-chiangmai-thailand-november-new-buliding-and-plaza-area-of-meechok-plaza-location-on.mp4,PT00H00M11S,026651_026700,"Chiangmai, thailand- november 9 2016: new buliding and plaza area of meechok plaza. location on road no.1101 about 3 km from chiangmai city. chiangmai, thailand."
1021309855,https://ak.picdn.net/shutterstock/videos/1021309855/preview/stock-footage-baker-piping-pastel-color-buttercream-rosettes-on-a-white-cake-to-make-a-unicorn-cake.mp4,PT00H00M59S,072751_072800,Baker piping pastel color buttercream rosettes on a white cake to make a unicorn cake.
1047793000,https://ak.picdn.net/shutterstock/videos/1047793000/preview/stock-footage-bubble-confident-icon-animation-on-black-background.mp4,PT00H00M10S,028401_028450,Bubble confident icon animation on black background
1036815908,https://ak.picdn.net/shutterstock/videos/1036815908/preview/stock-footage-night-highlights-of-light-strong-bokeh.mp4,PT00H00M09S,099301_099350,"Night highlights of light, strong bokeh"
1249393,https://ak.picdn.net/shutterstock/videos/1249393/preview/stock-footage-splashing-natural-apricots.mp4,PT00H00M30S,070951_071000,Splashing natural apricots
1007566435,https://ak.picdn.net/shutterstock/videos/1007566435/preview/stock-footage-little-boy-and-his-family-are-sitting-together-with-tablet-pc-at-night.mp4,PT00H00M30S,039901_039950,Little boy and his family are sitting together with tablet pc at night.
17556565,https://ak.picdn.net/shutterstock/videos/17556565/preview/stock-footage-steam-from-a-hot-spring-in-yellowstone-national-park-in-winter.mp4,PT00H00M20S,107951_108000,Steam from a hot spring in yellowstone national park in winter
25880918,https://ak.picdn.net/shutterstock/videos/25880918/preview/stock-footage-view-from-the-window-of-the-car.mp4,PT00H00M14S,102801_102850,View from the window of the car.
1012568627,https://ak.picdn.net/shutterstock/videos/1012568627/preview/stock-footage-new-york-new-york-usa-april-protestors-hold-multi-themed-signs-at-the-nyc-march.mp4,PT00H00M10S,116901_116950,"New york, new york / usa - april 22, 2017: protestors hold multi-themed signs at the 2017 nyc march for science"
1026854540,https://ak.picdn.net/shutterstock/videos/1026854540/preview/stock-footage-charismatic-worker-washing-solar-batteries-with-emotions-k.mp4,PT00H00M18S,060501_060550,Charismatic worker washing solar batteries with emotions. 4k
