videoid,contentUrl,duration,page_dir,name
1014199478,https://ak.picdn.net/shutterstock/videos/1014199478/preview/stock-footage-background-with-animated-color-lines.mp4,PT00H00M05S,057451_057500,Background with animated color lines.
4449629,https://ak.picdn.net/shutterstock/videos/4449629/preview/stock-footage-lima-barranco-district-park.mp4,PT00H00M13S,054651_054700,Lima barranco district park
1054938026,https://ak.picdn.net/shutterstock/videos/1054938026/preview/stock-footage-adorable-toddler-going-on-green-field-barefoot-cute-boy-holding-ball-in-hands-cheerful-kid.mp4,PT00H00M29S,180351_180400,Adorable toddler going on green field barefoot. cute boy holding ball in hands. cheerful kid playing in park. small boy throwing ball in sandbox. blonde toddler walking in meadow
14592292,https://ak.picdn.net/shutterstock/videos/14592292/preview/stock-footage-organic-garlic-on-wood-chopping-board-macro-shot.mp4,PT00H00M25S,041651_041700,Organic garlic on wood chopping board. macro shot.
1050845524,https://ak.picdn.net/shutterstock/videos/1050845524/preview/stock-footage-gold-glittering-ball-magic-golden-confetti-in-glowing-sphere-emitting-gold-dust-particles.mp4,PT00H00M15S,120701_120750,Gold glittering ball. magic golden confetti in glowing sphere emitting gold dust particles
1012613066,https://ak.picdn.net/shutterstock/videos/1012613066/preview/stock-footage-bucharest-romania-march-european-city-historical-place-imperial-cities-post-soviet-union.mp4,PT00H00M10S,094301_094350,"Bucharest, romania - march 9, 2018: european city historical place imperial cities post soviet union"
27818905,https://ak.picdn.net/shutterstock/videos/27818905/preview/stock-footage-festive-decorated-banquet-hall-for-weddings-beautiful-elegant-wedding-reception-table-arrangement.mp4,PT00H00M08S,053301_053350,"Festive, decorated banquet hall for weddings. beautiful elegant wedding reception table arrangement. tables setting at a luxury wedding hall."
1021261084,https://ak.picdn.net/shutterstock/videos/1021261084/preview/stock-footage-shrimp-farm-prawn-farming-with-with-aerator-pump-oxygenation-water-near-ocean-aerial-view-fish.mp4,PT00H00M10S,111551_111600,"Shrimp farm, prawn farming with with aerator pump oxygenation water near ocean. aerial view fish farm with ponds growing fish and shrimp and other seafood. fish hatchery pond aerial view aquaculture"
17963,https://ak.picdn.net/shutterstock/videos/17963/preview/stock-footage-water-feature-or-fountain.mp4,PT00H00M30S,027601_027650,Water feature or fountain
1007894473,https://ak.picdn.net/shutterstock/videos/1007894473/preview/stock-footage-kuala-lumpur-january-hyperlapse-on-malaysia-national-monument-also-known-as-tugu-negara.mp4,PT00H00M08S,079001_079050,"Kuala lumpur - january 26, 2018: hyperlapse on malaysia national monument also known as tugu negara in kuala lumpur, malaysia. zoom out motion."
1030444310,https://ak.picdn.net/shutterstock/videos/1030444310/preview/stock-footage-time-lapse-shot-of-blooming-dandelion-in-early-morning-on-spring-field.mp4,PT00H00M11S,194201_194250,"Time lapse shot of blooming dandelion in early morning on spring field
"
13980059,https://ak.picdn.net/shutterstock/videos/13980059/preview/stock-footage-jewish-cemetery-chisinau-moldova-winter-snow.mp4,PT00H00M21S,135251_135300,"Jewish cemetery.chisinau, moldova. winter. snow."
1028748728,https://ak.picdn.net/shutterstock/videos/1028748728/preview/stock-footage-bulldozer-on-the-construction-site.mp4,PT00H00M07S,136201_136250,Bulldozer on the construction site
1038833090,https://ak.picdn.net/shutterstock/videos/1038833090/preview/stock-footage-clear-water-of-the-sea-surf-and-pebble-beach.mp4,PT00H00M08S,050451_050500,Clear water of the sea surf and pebble beach
1580251,https://ak.picdn.net/shutterstock/videos/1580251/preview/stock-footage-beetle-walks-across-a-solid-blue-surface.mp4,PT00H00M23S,112051_112100,Beetle walks across a solid blue surface.
15706201,https://ak.picdn.net/shutterstock/videos/15706201/preview/stock-footage-richmond-virginia-fall-old-ruins-of-civil-war-th-century-train-bridge-across-river.mp4,PT00H00M10S,039001_039050,"Richmond, virginia - fall 2015 - old ruins of civil war, 19th century train bridge across river - burned during the civil war - james river bridge, stone ruins in river rapids.  crumbling old stone."
4933604,https://ak.picdn.net/shutterstock/videos/4933604/preview/stock-footage-spotted-deer.mp4,PT00H00M19S,194501_194550,Spotted deer 
21640687,https://ak.picdn.net/shutterstock/videos/21640687/preview/stock-footage-animated-background-with-musical-notes-green-tint-seamless-loop-other-colors-available-view-my.mp4,PT00H00M20S,075051_075100,Animated background with musical notes. green tint. seamless loop. other colors available - view my portfolio.
1018519930,https://ak.picdn.net/shutterstock/videos/1018519930/preview/stock-footage-portrait-attractive-young-caucasian-woman-playfully-flirting-natural-feminine-beauty-hiding-between.mp4,PT00H00M08S,073551_073600,Portrait attractive young caucasian woman playfully flirting natural feminine beauty hiding between sheets enjoying youth in white background
6856534,https://ak.picdn.net/shutterstock/videos/6856534/preview/stock-footage-texting-on-old-mobile-phone.mp4,PT00H00M07S,111401_111450,Texting on old mobile phone
22588918,https://ak.picdn.net/shutterstock/videos/22588918/preview/stock-footage-paris-france-pedestrians-carefully-cross-a-busy-intersection-as-cars-drive-by.mp4,PT00H00M10S,176701_176750,Paris france 1947: pedestrians carefully cross a busy intersection as cars drive by
1013266610,https://ak.picdn.net/shutterstock/videos/1013266610/preview/stock-footage-male-athlete-jogging-in-the-morning-runner-man-running-on-park-path-exercising-on-beautiful-summer.mp4,PT00H00M14S,048251_048300,Male athlete jogging in the morning. runner man running on park path exercising on beautiful summer day. sports and recreation activity. young active man training doing recreational jogging workout. 
15639370,https://ak.picdn.net/shutterstock/videos/15639370/preview/stock-footage-woman-holding-a-tray-with-exotic-cocktails-decorated-with-sparklers-evening.mp4,PT00H00M30S,037901_037950,Woman holding a tray with exotic cocktails decorated with sparklers. evening.
1018761577,https://ak.picdn.net/shutterstock/videos/1018761577/preview/stock-footage-aerial-view-of-marina-d-or-in-oropesa-de-mar-castellon-spain-k-drone-video.mp4,PT00H00M25S,050301_050350,"Aerial view of marina d´or in oropesa de mar, castellon. spain. 4k drone video"
14210147,https://ak.picdn.net/shutterstock/videos/14210147/preview/stock-footage-teacher-educating-children-about-anatomy.mp4,PT00H00M16S,025451_025500,Teacher educating children about anatomy.
1034129318,https://ak.picdn.net/shutterstock/videos/1034129318/preview/stock-footage-businessman-talking-on-mobile-phone-happily-on-a-green-screen-chroma-key.mp4,PT00H00M27S,024751_024800,"Businessman talking on mobile phone happily on a green screen, chroma key."
7818325,https://ak.picdn.net/shutterstock/videos/7818325/preview/stock-footage-time-lapse-of-tokyo-s-landmarks-and-transportation.mp4,PT00H00M23S,185451_185500,Time lapse of tokyo's landmarks and transportation.
7442872,https://ak.picdn.net/shutterstock/videos/7442872/preview/stock-footage-aerial-of-a-kite-surfer-sailing-on-a-beautiful-lake.mp4,PT00H00M14S,194701_194750,Aerial of a kite surfer sailing on a beautiful lake
1025062670,https://ak.picdn.net/shutterstock/videos/1025062670/preview/stock-footage-aerial-drone-panoramic-video-of-picturesque-main-village-or-chora-of-serifos-island-with.mp4,PT00H00M19S,129901_129950,"Aerial drone panoramic video of picturesque main village or chora of serifos island with breathtaking views to the aegean sea in spring, cyclades islands, greece"
1049445448,https://ak.picdn.net/shutterstock/videos/1049445448/preview/stock-footage-group-of-greater-rheas-walking-in-grassland-under-sunset-light-aerial-view-and-circular-and-smooth.mp4,PT00H00M25S,126551_126600,Group of greater rheas walking in grassland under sunset light. aerial view and circular and smooth flight with drone in fields of south america of great walking birds like ostriches. 
1044391756,https://ak.picdn.net/shutterstock/videos/1044391756/preview/stock-footage-two-brothers-is-decorating-a-christmas-cookies-with-pastry-bag-at-home-kitchen-older-brother-is.mp4,PT00H00M23S,020101_020150,Two brothers is decorating a christmas cookies with pastry bag at home kitchen. older brother is using piping bag while younger brother eating a ready gingerbread cookie
20595649,https://ak.picdn.net/shutterstock/videos/20595649/preview/stock-footage-pretty-girl-goes-with-bicycle-on-path-near-forest-at-summer-evening-back-view.mp4,PT00H00M11S,059051_059100,"Pretty girl goes with bicycle on path near forest at summer evening, back view
"
30014122,https://ak.picdn.net/shutterstock/videos/30014122/preview/stock-footage-team-of-executives-discussing-over-digital-tablet-in-the-office-k.mp4,PT00H00M11S,100151_100200,Team of executives discussing over digital tablet in the office 4k
1016657197,https://ak.picdn.net/shutterstock/videos/1016657197/preview/stock-footage-bali-nusa-penida-coastline-indonesia-angel-s-billabong-broken-beach.mp4,PT00H00M21S,098001_098050,"Bali - nusa penida coastline, indonesia - angel's billabong / broken beach"
18744491,https://ak.picdn.net/shutterstock/videos/18744491/preview/stock-footage-abu-dhabi-uae-high-angle-on-emirati-women-and-children-descending-in-a-glass-elevator-in-the.mp4,PT00H00M16S,080951_081000,"Abu dhabi, uae - high-angle on emirati women and children descending in a glass elevator in the world trade center mall. (abu dhabi, uae-2013)"
12973757,https://ak.picdn.net/shutterstock/videos/12973757/preview/stock-footage-united-states-s-pair-of-shoes-on-floor-women-talk-in-classroom.mp4,PT00H00M30S,054351_054400,United states 1950s: pair of shoes on floor / women talk in classroom.
1050692428,https://ak.picdn.net/shutterstock/videos/1050692428/preview/stock-footage-yamaga-japan-august-the-yamaga-lantern-festival-omiya-shrine-dance-is-a-very-popular.mp4,PT00H00M24S,136351_136400,"Yamaga, japan - august, 2019: the yamaga lantern festival omiya shrine dance is a very popular festival held near the city of kumamato in yamaga town."
9707597,https://ak.picdn.net/shutterstock/videos/9707597/preview/stock-footage-real-oranges-and-blue-summer-sky-this-shot-is-taken-in-south-country-with-real-oranges-growing.mp4,PT00H00M26S,087401_087450,"Real oranges and blue summer sky.
this shot is taken in south country with real oranges growing just outside in nature. "
14179682,https://ak.picdn.net/shutterstock/videos/14179682/preview/stock-footage-time-lapse-amsterdam-sign-people-rijksmuseum-amsterdam-netherlands-circa-november.mp4,PT00H00M15S,195201_195250,Time lapse - amsterdam sign & people - rijksmuseum - amsterdam netherlands  - circa november 2015
32065384,https://ak.picdn.net/shutterstock/videos/32065384/preview/stock-footage-the-boat-in-the-sea-aerial-shoot.mp4,PT00H00M28S,098151_098200,The boat in the sea. aerial shoot.
1013433560,https://ak.picdn.net/shutterstock/videos/1013433560/preview/stock-footage-vibrant-watercolor-loop-colorful-animation-ink-with-luma-matte-as-alpha-channel-for-effects-or.mp4,PT00H00M20S,007001_007050,Vibrant watercolor loop. colorful animation ink with luma matte as alpha channel for effects or background. a lot of flows form ring
31180402,https://ak.picdn.net/shutterstock/videos/31180402/preview/stock-footage-making-kiwi-coconut-chia-popsicles-in-frozen-ice-pop-maker.mp4,PT00H00M58S,138051_138100,Making kiwi coconut chia popsicles in frozen ice pop maker.
1007342689,https://ak.picdn.net/shutterstock/videos/1007342689/preview/stock-footage-text-connection-from-letters-of-different-colors-appears-behind-small-squares-then-disappears.mp4,PT00H00M30S,141201_141250,Text connection from letters of different colors appears behind small squares. then disappears. alpha channel premultiplied - matted with color white
16870570,https://ak.picdn.net/shutterstock/videos/16870570/preview/stock-footage-two-attractive-women-in-trendy-sunhats.mp4,PT00H00M30S,076951_077000,Two attractive women in trendy sunhats
18278437,https://ak.picdn.net/shutterstock/videos/18278437/preview/stock-footage-person-draws-with-pencil-bottles-and-flowers-on-sheet-of-paper.mp4,PT00H00M12S,026651_026700,Person draws with pencil bottles and flowers on sheet of paper
1013072717,https://ak.picdn.net/shutterstock/videos/1013072717/preview/stock-footage-surfer-wipes-out-and-does-front-flip-in-bali-indonesia.mp4,PT00H00M10S,103451_103500,Surfer wipes out and does front flip in bali indonesia
1065110326,https://ak.picdn.net/shutterstock/videos/1065110326/preview/stock-footage-radioactive-signage-animation-on-white-background.mp4,PT00H00M10S,179901_179950,Radioactive signage animation on white background
1006683052,https://ak.picdn.net/shutterstock/videos/1006683052/preview/stock-footage-black-man-doing-pulling-up-in-slow-motion.mp4,PT00H00M38S,019151_019200,Black man doing pulling up in slow motion
14385172,https://ak.picdn.net/shutterstock/videos/14385172/preview/stock-footage-view-on-a-young-handsome-man-who-looks-serious-looks-into-camera-and-stands-in-the-woods-detail.mp4,PT00H00M19S,078651_078700,"View on a young handsome man who looks serious, looks into camera and stands in the woods - detail of face expression"
1027294082,https://ak.picdn.net/shutterstock/videos/1027294082/preview/stock-footage-snowboader-throw-snow-ball-al-camera.mp4,PT00H00M06S,065601_065650,Snowboader throw snow ball al camera
28492453,https://ak.picdn.net/shutterstock/videos/28492453/preview/stock-footage-attentive-female-driver-leaving-gas-station-and-looking-in-rearview-mirrors.mp4,PT00H00M09S,179151_179200,Attentive female driver leaving gas station and looking in rearview mirrors
14555224,https://ak.picdn.net/shutterstock/videos/14555224/preview/stock-footage--k-aerial-close-up-flying-above-high-rocky-mountain-ridge-on-tropical-island-with-exotic-beaches.mp4,PT00H00M40S,115801_115850,"4k aerial close up: flying above high rocky mountain ridge on tropical island with exotic beaches, big deep ocean bay and lush jungle with palm trees and acacia trees"
20169742,https://ak.picdn.net/shutterstock/videos/20169742/preview/stock-footage-tad-tone-waterfall-in-thailand-ubon-ratchathani-province.mp4,PT00H00M18S,064151_064200,"Tad tone waterfall in thailand , ubon ratchathani province"
1026843323,https://ak.picdn.net/shutterstock/videos/1026843323/preview/stock-footage-trees-and-rocks-over-sea-in-cavtat-port.mp4,PT00H00M20S,101951_102000,Trees and rocks over sea in cavtat port
9928739,https://ak.picdn.net/shutterstock/videos/9928739/preview/stock-footage-water-tap-in-kitchen-checking-water-temperature-with-finger.mp4,PT00H00M12S,058801_058850,Water tap in kitchen. checking water temperature with finger.
1364968,https://ak.picdn.net/shutterstock/videos/1364968/preview/stock-footage-led-kaleidoscope-light.mp4,PT00H00M10S,072751_072800,Led kaleidoscope light
1031436839,https://ak.picdn.net/shutterstock/videos/1031436839/preview/stock-footage-view-from-boat-on-cliffs-and-waves-on-coast-of-atlantic-ocean-praia-benagil-algarve-portugal.mp4,PT00H00M08S,136851_136900,View from boat on cliffs and waves on coast of atlantic ocean. praia benagil algarve portugal. 
1032613535,https://ak.picdn.net/shutterstock/videos/1032613535/preview/stock-footage-saw-a-cat-eating-wide-under-the-chair.mp4,PT00H00M12S,051051_051100,"Saw a cat eating wide under the chair
"
30722596,https://ak.picdn.net/shutterstock/videos/30722596/preview/stock-footage-sportive-pair-do-morning-fitness-training-at-outdoor-gym-train-hands-at-symmetric-machine-top.mp4,PT00H00M14S,107701_107750,"Sportive pair do morning fitness training at outdoor gym, train hands at symmetric machine. top-down spinning perspective, physically fit people keep train at vacation. healthy lifestyle concept"
1007746411,https://ak.picdn.net/shutterstock/videos/1007746411/preview/stock-footage-a-professional-woman-figure-skater-to-a-black-suit-at-the-competitions-in-figure-skating-performs.mp4,PT00H00M19S,076351_076400,"A professional woman, figure skater to a black suit at the competitions in figure skating, performs a triple revolution around her axis in the jump. and ends the program with a bow."
1032614063,https://ak.picdn.net/shutterstock/videos/1032614063/preview/stock-footage-lesbian-lgbt-women-couple-using-tablet-at-home-asian-female-happy-using-technology-check-social.mp4,PT00H00M15S,023151_023200,"Lesbian lgbt women couple using tablet at home, asian female happy using technology check social media in internet together while lying sofa in living room in night. lover celebrate holiday concept."
12377432,https://ak.picdn.net/shutterstock/videos/12377432/preview/stock-footage-young-pretty-woman-working-out-lifting-weights-in-gym.mp4,PT00H00M10S,079201_079250,Young pretty woman working out lifting weights in gym
30456715,https://ak.picdn.net/shutterstock/videos/30456715/preview/stock-footage-aerial-view-hoover-dam-lake-mead-producing-hydroelectricity-above-colorado-river-bridge-on-us.mp4,PT00H00M23S,008201_008250,Aerial view hoover dam lake mead producing hydroelectricity above colorado river bridge on us 93 las vegas nevada arizona usa red weapon
176899,https://ak.picdn.net/shutterstock/videos/176899/preview/stock-footage-a-solitary-felucca-sailing-serenely-down-the-tranquil-water-of-the-nile.mp4,PT00H00M13S,056401_056450,A solitary felucca sailing serenely down the tranquil water of the nile
1010472299,https://ak.picdn.net/shutterstock/videos/1010472299/preview/stock-footage-woman-use-of-tablet-computer-at-home.mp4,PT00H00M28S,086251_086300,Woman use of tablet computer at home
1027276949,https://ak.picdn.net/shutterstock/videos/1027276949/preview/stock-footage-toronto-ontario-canada-june-diverse-people-on-bikes-cars-and-transit-traffic-in-downtown.mp4,PT00H00M26S,046001_046050,"Toronto, ontario, canada june 2018 diverse people on bikes cars and transit traffic in downtown urban toronto"
1026875687,https://ak.picdn.net/shutterstock/videos/1026875687/preview/stock-footage-chronotherapy-with-medical-digital-technology-concept.mp4,PT00H00M39S,110101_110150,Chronotherapy with medical digital technology concept
1525697,https://ak.picdn.net/shutterstock/videos/1525697/preview/stock-footage-boiling-water-in-a-glass-teapot.mp4,PT00H00M59S,073651_073700,Boiling water in a glass teapot
11211212,https://ak.picdn.net/shutterstock/videos/11211212/preview/stock-footage-vatican-city-italy-sept-rome-italy-vatican-st-peters-cathedral-k-controlled-by-the-pope.mp4,PT00H00M23S,171451_171500,"Vatican city, italy - sept 2014: rome italy vatican st peters cathedral 4k. controlled by the pope of the catholic church. the smallest internationally recognized independent state in the world."
23240431,https://ak.picdn.net/shutterstock/videos/23240431/preview/stock-footage-someone-pours-white-liquid-close-up.mp4,PT00H00M12S,055351_055400,Someone pours white liquid close-up
25882925,https://ak.picdn.net/shutterstock/videos/25882925/preview/stock-footage-happy-father-play-with-his-little-boy-in-the-park-dad-and-son-play-on-the-grass.mp4,PT00H00M05S,127951_128000,Happy father play with his little boy in the park. dad and son play on the grass
24560873,https://ak.picdn.net/shutterstock/videos/24560873/preview/stock-footage-brightly-colored-wild-flowers-waving-in-the-wind-namaqualand-northern-cape-south-africa.mp4,PT00H00M18S,194901_194950,"Brightly colored wild flowers waving in the wind, namaqualand, northern cape, south africa"
1006700890,https://ak.picdn.net/shutterstock/videos/1006700890/preview/stock-footage-paris-ile-de-france-france-paris-on-flooding-alert-with-raising-seine.mp4,PT00H00M10S,015601_015650,"Paris, ile de france / france - 01 24 2018: paris on flooding alert with raising seine"
1013132783,https://ak.picdn.net/shutterstock/videos/1013132783/preview/stock-footage-man-boxer-warming-up-in-urban-place-city-parking-back-view.mp4,PT00H00M35S,108801_108850,"Man boxer warming up in urban place city parking, back view"
18754385,https://ak.picdn.net/shutterstock/videos/18754385/preview/stock-footage-crystal-salts-form-under-the-microscope-in-time-lapse.mp4,PT00H00M05S,120501_120550,Crystal salts form under the microscope in time lapse. 
1055910506,https://ak.picdn.net/shutterstock/videos/1055910506/preview/stock-footage-a-small-gray-bird-quickly-walks-through-the-grass-and-collects-insects-white-breast-and-head-wild.mp4,PT00H00M16S,036451_036500,A small gray bird quickly walks through the grass and collects insects. white breast and head. wild nature. summer time of the year. warm weather without rain. 4k.
1019417677,https://ak.picdn.net/shutterstock/videos/1019417677/preview/stock-footage-soldier-in-green-uniform-and-black-mask-with-assault-rifle-walking-in-the-autumn-forest.mp4,PT00H00M23S,184301_184350,Soldier in green uniform and black mask  with assault rifle walking in the autumn forest 
1026371285,https://ak.picdn.net/shutterstock/videos/1026371285/preview/stock-footage-stabbed-man-suffering-pain-from-bloody-wound-tortures-victim-murder-attempt.mp4,PT00H00M07S,075401_075450,"Stabbed man suffering pain from bloody wound, tortures victim, murder attempt"
1020935794,https://ak.picdn.net/shutterstock/videos/1020935794/preview/stock-footage-sprouts-of-young-wheat-at-sunset.mp4,PT00H00M23S,080051_080100,Sprouts of young wheat at sunset
10886891,https://ak.picdn.net/shutterstock/videos/10886891/preview/stock-footage-driving-through-nature.mp4,PT00H00M19S,071451_071500,Driving through nature
1050486502,https://ak.picdn.net/shutterstock/videos/1050486502/preview/stock-footage-cleansing-car-interior-and-spraying-with-disinfection-liquid-hands-in-rubber-protective-glove.mp4,PT00H00M14S,127851_127900,Cleansing car interior and spraying with disinfection liquid. hands in rubber protective glove disinfecting automobile vehicle inside for protection from virus corona disease
15203335,https://ak.picdn.net/shutterstock/videos/15203335/preview/stock-footage-moulds-for-metal-pipe-which-joins-metal-sparks-are-seen.mp4,PT00H00M16S,030101_030150,"Moulds for metal pipe which joins metal, sparks are seen"
18921584,https://ak.picdn.net/shutterstock/videos/18921584/preview/stock-footage-man-jogging-down-stairs-in-slow-motion-male-runner-workout-outdoor-running-man-in-park-athlete.mp4,PT00H00M36S,076001_076050,Man jogging down stairs in slow motion. male runner workout outdoor. running man in park. athlete running down on staircase. athletic man run outside
15953569,https://ak.picdn.net/shutterstock/videos/15953569/preview/stock-footage-clouds-move-rapidly-above-forest-road-dark-clouds-quickly-moving-across-the-sky-over-the-forest.mp4,PT00H00M14S,187201_187250,"Clouds move rapidly above forest road. dark clouds quickly moving across the sky over the forest and the road in the spring 
"
32032510,https://ak.picdn.net/shutterstock/videos/32032510/preview/stock-footage-hand-picking-ripe-apricots-in-the-orchard.mp4,PT00H00M13S,050401_050450,Hand picking ripe apricots in the orchard
1023724027,https://ak.picdn.net/shutterstock/videos/1023724027/preview/stock-footage-las-vegas-nv-april-i-traffic-going-through-las-vegas-nevada-on-april.mp4,PT00H00M17S,018001_018050,"Las vegas, nv - april 20:  i-15 traffic going through las vegas, nevada on april 20, 2018."
1020121606,https://ak.picdn.net/shutterstock/videos/1020121606/preview/stock-footage-grandpa-and-child-watching-old-photos-in-album.mp4,PT00H00M12S,183101_183150,Grandpa and child watching old photos in album
1048241326,https://ak.picdn.net/shutterstock/videos/1048241326/preview/stock-footage-girl-drinks-tasty-fresh-aromatic-espresso-in-an-italian-cafe-on-the-street-on-the-table-is-a-cup.mp4,PT00H00M08S,125801_125850,Girl drinks tasty fresh aromatic espresso in an italian cafe on the street. on the table is a cup and a bouquet of yellow tulips. a romantic meeting.	
1059803678,https://ak.picdn.net/shutterstock/videos/1059803678/preview/stock-footage-paraglider-pilot-masterful-smooth-approach-green-field-landing-extreme-sport.mp4,PT00H00M11S,060751_060800,Paraglider pilot masterful smooth approach green field landing. extreme sport
1030686878,https://ak.picdn.net/shutterstock/videos/1030686878/preview/stock-footage-las-vegas-united-states-april-drone-shot-of-tourists-and-cars-gathered-at-lake-mead.mp4,PT00H00M18S,027901_027950,"Las vegas, united states - april 19, 2019: drone shot of tourists and cars gathered at lake mead scenic view point near las vegas nevada"
1015334965,https://ak.picdn.net/shutterstock/videos/1015334965/preview/stock-footage-a-country-road-between-fields-at-sunset.mp4,PT00H00M44S,197951_198000,A country road between fields at sunset
1023669871,https://ak.picdn.net/shutterstock/videos/1023669871/preview/stock-footage-an-elderly-woman-with-a-child-are-photographed-grandmother-and-granddaughter-make-selfie.mp4,PT00H00M09S,173201_173250,An elderly woman with a child are photographed. grandmother and granddaughter make selfie.
1019220421,https://ak.picdn.net/shutterstock/videos/1019220421/preview/stock-footage-colorful-autumn-mountain-forest-trail-pov-hd-riding-by-motorcycle.mp4,PT00H00M07S,018101_018150,Colorful autumn mountain forest trail pov hd riding by motorcycle
1015188763,https://ak.picdn.net/shutterstock/videos/1015188763/preview/stock-footage-germany-circa-may-enjoy-kebap-d-ner-kebab-turkish-middle-eastern-street-food-restaurant.mp4,PT00H00M12S,142801_142850,"Germany - circa may 2017 - enjoy kebap döner kebab, turkish middle eastern street food restaurant, berlin"
12735311,https://ak.picdn.net/shutterstock/videos/12735311/preview/stock-footage-northern-pike-esox-lucius-swims-away-from-the-frame-medium-shot-ukraine.mp4,PT00H00M09S,170501_170550,"Northern pike (esox lucius) swims away from the frame, medium shot. ukraine.
"
