videoid,contentUrl,duration,page_dir,name
3942377,https://ak.picdn.net/shutterstock/videos/3942377/preview/stock-footage-ilfracombe-uk-september-the-promenade-area-of-the-seaside-resort-in-ilfracombe.mp4,PT00H00M11S,132851_132900,"Ilfracombe, uk - september 2012 : the promenade area of the seaside resort in ilfracombe."
1031561780,https://ak.picdn.net/shutterstock/videos/1031561780/preview/stock-footage-lovely-couple-bride-and-groom-holding-hands-and-hugging-in-park.mp4,PT00H00M12S,115451_115500,Lovely couple bride and groom holding hands and hugging in park
1017166303,https://ak.picdn.net/shutterstock/videos/1017166303/preview/stock-footage-piglet-of-vietnamese-black-pig-walking-around-in-cage.mp4,PT00H00M13S,175201_175250,Piglet of vietnamese black pig walking around in cage
31697866,https://ak.picdn.net/shutterstock/videos/31697866/preview/stock-footage-view-of-the-lake-at-the-foot-of-the-mountains.mp4,PT00H00M16S,176401_176450,View of the lake at the foot of the mountains.
21514735,https://ak.picdn.net/shutterstock/videos/21514735/preview/stock-footage-las-vegas-quiet-summer-day-poolside-at-a-hotel.mp4,PT00H00M23S,104051_104100,Las vegas 1958: quiet summer day poolside at a hotel.
1043181064,https://ak.picdn.net/shutterstock/videos/1043181064/preview/stock-footage-a-lagoon-with-a-coral-reef-and-a-white-sandy-beach-a-view-from-above-the-coast-of-a-tropical.mp4,PT00H00M10S,198501_198550,"A lagoon with a coral reef and a white sandy beach, a view from above. the coast of a tropical island. summer and travel vacation concept. caramoan islands, philippines."
1026566765,https://ak.picdn.net/shutterstock/videos/1026566765/preview/stock-footage-kyiv-ukraine-september-woman-actress-on-film-set.mp4,PT00H00M57S,195601_195650,"Kyiv, ukraine - september 23, 2017. woman actress on film set"
13576310,https://ak.picdn.net/shutterstock/videos/13576310/preview/stock-footage-pre-teen-girl-climbing-a-tree.mp4,PT00H00M19S,114051_114100,Pre-teen girl climbing a tree
1027559822,https://ak.picdn.net/shutterstock/videos/1027559822/preview/stock-footage-beautiful-red-flower-of-the-garnet-flower-pomegranate.mp4,PT00H00M07S,199501_199550,Beautiful red flower of the garnet flower pomegranate
1007187694,https://ak.picdn.net/shutterstock/videos/1007187694/preview/stock-footage-swiss-alps-snowy-mountain-peaks-aerial-footage-riprese-aeree-k-amazing-drone-flight.mp4,PT00H00M19S,119501_119550,"Swiss alps // snowy mountain peaks // aerial footage - riprese aeree // 4k
amazing drone flight over the snowy swiss alps, beautiful mountain peaks and ski resorts."
1047594016,https://ak.picdn.net/shutterstock/videos/1047594016/preview/stock-footage-portrait-of-upset-young-woman-crying-at-the-camera.mp4,PT00H00M09S,145601_145650,Portrait of upset young woman crying at the camera 
1057765837,https://ak.picdn.net/shutterstock/videos/1057765837/preview/stock-footage-lac-de-pont-lake-surrounded-by-green-trees-and-blue-sky-in-burgundy-in-france.mp4,PT00H00M14S,076051_076100,Lac de pont lake surrounded by green trees and blue sky in burgundy in france
1007747197,https://ak.picdn.net/shutterstock/videos/1007747197/preview/stock-footage-people-walking-along-seashore-in-batumi-georgia-relaxing-vacation-atmosphere.mp4,PT00H00M12S,075101_075150,"People walking along seashore in batumi, georgia, relaxing vacation atmosphere"
1023517912,https://ak.picdn.net/shutterstock/videos/1023517912/preview/stock-footage-portrait-of-senior-asian-woman-using-tablet-searching-online-shopping-sharing-social-media.mp4,PT00H00M15S,136201_136250,Portrait of senior asian woman using tablet searching online shopping. sharing social media communication while lying on sofa at home.
13574855,https://ak.picdn.net/shutterstock/videos/13574855/preview/stock-footage-putting-tomato-sauce-over-pasta.mp4,PT00H00M24S,023601_023650,Putting tomato sauce over pasta 
1034289287,https://ak.picdn.net/shutterstock/videos/1034289287/preview/stock-footage-the-seagull-sunbathing-by-the-sea-at-laem-phak-bia-gulf-of-thailand-phetchaburi-thailand.mp4,PT00H00M27S,066201_066250,"The seagull sunbathing by the sea. at laem phak bia, gulf of thailand, phetchaburi, thailand. "
1011123650,https://ak.picdn.net/shutterstock/videos/1011123650/preview/stock-footage-set-beekeeper-check-bees-colony-frames-from-hive-stand-bee-keeper-put-in-a-honeycomb-to-the-hive.mp4,PT00H00M16S,057951_058000,"Set, beekeeper check bees colony frames from hive stand
bee keeper put in a honeycomb to the hive "
9147050,https://ak.picdn.net/shutterstock/videos/9147050/preview/stock-footage-mother-and-her-baby-playing-with-pink-balloon.mp4,PT00H00M19S,020901_020950,Mother and her baby playing with pink balloon
1035777812,https://ak.picdn.net/shutterstock/videos/1035777812/preview/stock-footage-brooklyn-new-york-usa-july-aerial-of-downtown-brooklyn-near-barclays-center-and.mp4,PT00H00M37S,110001_110050,"Brooklyn, new york / usa - july 1 2019 : aerial of downtown brooklyn near barclays center and surrounding neighborhoods (2019)"
10753781,https://ak.picdn.net/shutterstock/videos/10753781/preview/stock-footage-boy-at-park-with-a-sad-look-on-his-face.mp4,PT00H00M15S,018101_018150,Boy at park with a sad look on his face.
1053678269,https://ak.picdn.net/shutterstock/videos/1053678269/preview/stock-footage-stylish-handsome-man-in-black-hat-waiting-and-looking-around-on-green-screen-background-chroma-key.mp4,PT00H00M18S,085801_085850,"Stylish handsome man in black hat waiting and looking around on green screen background, chroma key 4k pre-keyed footage"
2987437,https://ak.picdn.net/shutterstock/videos/2987437/preview/stock-footage-wind-generators-on-the-top-of-the-mountain.mp4,PT00H00M28S,046801_046850,Wind generators on the top of the mountain
26815927,https://ak.picdn.net/shutterstock/videos/26815927/preview/stock-footage-baby-girl-in-the-park.mp4,PT00H00M12S,145601_145650,Baby girl in the park
15583387,https://ak.picdn.net/shutterstock/videos/15583387/preview/stock-footage-persepolis-iran-may-people-walking-by-the-ruins-of-old-stone-gates-a-capital-of-the.mp4,PT00H00M16S,018601_018650,"Persepolis, iran - may 3, 2015: people walking by the ruins of old stone gates, a capital of the achaemenid empire 550 - 330 bc."
4134217,https://ak.picdn.net/shutterstock/videos/4134217/preview/stock-footage-animated-abstract-futuristic-lines-digital-background-hd-p-loop.mp4,PT00H00M10S,066101_066150,"Animated abstract, futuristic lines digital background, hd 1080p, loop."
12630146,https://ak.picdn.net/shutterstock/videos/12630146/preview/stock-footage--k-attractive-mixed-ethnicity-business-team-in-conversation-as-they-walk-outside-modern-glass.mp4,PT00H00M22S,032001_032050,4k attractive mixed ethnicity business team in conversation as they walk outside modern glass office building. shot on red epic.
1039443797,https://ak.picdn.net/shutterstock/videos/1039443797/preview/stock-footage-digital-number-technology-k-motion-computing-running-developer-program-code-motion-background-d.mp4,PT00H00M10S,069551_069600,Digital number technology 4k motion computing running developer program code motion background. 3d graphic binary encoding decimal statistics algorithm row matrix concept display.
25222766,https://ak.picdn.net/shutterstock/videos/25222766/preview/stock-footage-the-waves-crash-on-the-rocks-of-the-shore.mp4,PT00H00M19S,047801_047850,The waves crash on the rocks of the shore 
27270067,https://ak.picdn.net/shutterstock/videos/27270067/preview/stock-footage-walk-on-yellow-field-full-of-flowers-summer-landscape.mp4,PT00H00M13S,121901_121950,"Walk on yellow field full of flowers, summer landscape"
1051183048,https://ak.picdn.net/shutterstock/videos/1051183048/preview/stock-footage-teamwork-business-happy-family-stack-of-hands-lifestyle-unity-and-teamwork-concept-group-of.mp4,PT00H00M32S,070951_071000,Teamwork business happy family . stack of hands. lifestyle unity and teamwork concept. group of people raise their hands up a common goal
20830471,https://ak.picdn.net/shutterstock/videos/20830471/preview/stock-footage-on-the-table-at-mall-blurred-background.mp4,PT00H00M11S,012401_012450,On the table at mall blurred background
1025151743,https://ak.picdn.net/shutterstock/videos/1025151743/preview/stock-footage-a-man-puts-wooden-cubes-on-top-of-each-other.mp4,PT00H00M07S,145101_145150,A man puts wooden cubes on top of each other.
7265977,https://ak.picdn.net/shutterstock/videos/7265977/preview/stock-footage-shot-of-a-dentist-fixing-staples-in-girl-s-mouth-close-up.mp4,PT00H00M30S,044001_044050,Shot of a dentist fixing staples in girl’s mouth. close-up.
1061006977,https://ak.picdn.net/shutterstock/videos/1061006977/preview/stock-footage-space-background-earth-planet-with-milky-way-colorful-nebula-elements-furnished-by-nasa-d.mp4,PT00H00M10S,123101_123150,Space background. earth planet with milky way colorful nebula. elements furnished by nasa. 3d rendering
1024733450,https://ak.picdn.net/shutterstock/videos/1024733450/preview/stock-footage-high-angle-view-of-sparklers-on-sand-at-beach-sparkler-sparkling-on-a-sand-k.mp4,PT00H00M13S,083801_083850,High angle view of sparklers on sand at beach. sparkler sparkling on a sand 4k
1063447612,https://ak.picdn.net/shutterstock/videos/1063447612/preview/stock-footage-close-up-of-professional-doctor-in-sterile-protective-equipment-uniform-making-injection-to-senior.mp4,PT00H00M09S,125601_125650,Close up of professional doctor in sterile protective equipment uniform making injection to senior female caucasian patient in mask in hospital cabinet. coronavirus concept
1018894597,https://ak.picdn.net/shutterstock/videos/1018894597/preview/stock-footage-morning-autumn-spring.mp4,PT00H00M23S,014401_014450,"Morning autumn, spring"
1038689519,https://ak.picdn.net/shutterstock/videos/1038689519/preview/stock-footage-december-date-digital-calendar-change-to-december-animation.mp4,PT00H00M15S,028901_028950,December 22 date. digital calendar change to december 22 animation
1061016460,https://ak.picdn.net/shutterstock/videos/1061016460/preview/stock-footage-glendale-ca-usa-october-car-decorated-with-american-flags-waving-at-a-patriotic-maga.mp4,PT00H00M06S,025301_025350,"Glendale, ca/usa - october 8, 2020: car decorated with american flags waving at a patriotic maga rally
"
1007106331,https://ak.picdn.net/shutterstock/videos/1007106331/preview/stock-footage-the-mechanism-of-a-wristwatch-antique-style-the-camera-moves-around-closeup.mp4,PT00H00M32S,013901_013950,The mechanism of a wristwatch antique style. the camera moves around. closeup
1044529366,https://ak.picdn.net/shutterstock/videos/1044529366/preview/stock-footage-the-waiter-lays-napkins-on-the-festive-table.mp4,PT00H00M08S,093151_093200,The waiter lays napkins on the festive table.
1039397573,https://ak.picdn.net/shutterstock/videos/1039397573/preview/stock-footage-lisbon-portugal-may-tourists-on-a-cycling-tour-enjoy-the-grandeur-of-the-main-square.mp4,PT00H00M07S,057601_057650,Lisbon / portugal - may 23 2019: tourists on a cycling tour enjoy the grandeur of the main square in central lisbon with a huge statue and gateway arch on a sunny day.
1020248290,https://ak.picdn.net/shutterstock/videos/1020248290/preview/stock-footage--name-in-the-page-negative-image-looping-footage-has-k-resolution-prores-d-illustration.mp4,PT00H00M10S,195101_195150,"""name"" in the page. negative image. looping footage has 4k resolution. prores 4444. 3d illustration."
1030377623,https://ak.picdn.net/shutterstock/videos/1030377623/preview/stock-footage-bee-in-purple-mt-cornflower-blossom-sec-fps-version.mp4,PT00H00M20S,176351_176400,Bee in purple mt. cornflower blossom. 20sec/24fps version 1
1012231589,https://ak.picdn.net/shutterstock/videos/1012231589/preview/stock-footage-drone-footage-of-snowy-trees-in-the-mountains.mp4,PT00H00M09S,079801_079850,Drone footage of snowy trees in the mountains
18204673,https://ak.picdn.net/shutterstock/videos/18204673/preview/stock-footage-outdoor-swimming-pool-in-hotel-resort.mp4,PT00H00M21S,074601_074650,Outdoor swimming pool in hotel resort
750871,https://ak.picdn.net/shutterstock/videos/750871/preview/stock-footage-black-and-white-with-violet-lower-stalk-close-up-from-top-to-down.mp4,PT00H00M07S,020451_020500,"Black-and-white with violet ã�â°lower stalk close up, from top to down "
1011155660,https://ak.picdn.net/shutterstock/videos/1011155660/preview/stock-footage-kuta-indonesia-march-a-hindu-ogoh-ogoh-statue-in-front-of-trees-at-kuta-beach-on-the.mp4,PT00H00M11S,121651_121700,"Kuta, indonesia - march, 18, 2018: a hindu ogoh-ogoh statue in front of trees at kuta beach on the island of bali, indonesia"
1043840107,https://ak.picdn.net/shutterstock/videos/1043840107/preview/stock-footage-beautiful-abstract-tunnel-with-light-lines-moving-fast-different-colors-background.mp4,PT00H00M12S,117801_117850,Beautiful abstract tunnel with light lines moving fast. different colors background.
16197100,https://ak.picdn.net/shutterstock/videos/16197100/preview/stock-footage-factory-seamstress-at-work-and-industrial-sewing-machine-k-video.mp4,PT00H00M11S,179251_179300,Factory seamstress at work and industrial sewing machine 4k video
8738,https://ak.picdn.net/shutterstock/videos/8738/preview/stock-footage-psychedelic-sunset.mp4,PT00H00M06S,116801_116850,Psychedelic sunset
1008945131,https://ak.picdn.net/shutterstock/videos/1008945131/preview/stock-footage-barman-stirring-cocktail-in-a-glass-video.mp4,PT00H00M11S,133601_133650,Barman stirring cocktail in a glass video
18614195,https://ak.picdn.net/shutterstock/videos/18614195/preview/stock-footage-aerial-drone-of-a-convoy-of-camels-with-owners-across-desert-sand.mp4,PT00H00M21S,142051_142100,Aerial drone of a convoy of camels with owners across desert sand
144643,https://ak.picdn.net/shutterstock/videos/144643/preview/stock-footage-a-medium-close-up-of-a-woman-fastening-two-bolts-with-a-torque-gun.mp4,PT00H00M16S,023451_023500,A medium close-up of a woman fastening two bolts with a torque gun.
1047597718,https://ak.picdn.net/shutterstock/videos/1047597718/preview/stock-footage-arranging-pieces-of-wood-into-something.mp4,PT00H00M26S,058051_058100,Arranging pieces of wood into something
15594418,https://ak.picdn.net/shutterstock/videos/15594418/preview/stock-footage-a-bus-drives-through-griffith-park-in-los-angeles-california.mp4,PT00H00M31S,074251_074300,"A bus drives through griffith park in los angeles, california."
1046135101,https://ak.picdn.net/shutterstock/videos/1046135101/preview/stock-footage-spring-river-with-ice-close-up.mp4,PT00H00M13S,014151_014200,Spring river with ice close up
1051052443,https://ak.picdn.net/shutterstock/videos/1051052443/preview/stock-footage-praia-do-malhao-beach-view-at-sunrise-in-portugal.mp4,PT00H00M25S,085701_085750,"Praia do malhao beach view at sunrise, in portugal"
1044282088,https://ak.picdn.net/shutterstock/videos/1044282088/preview/stock-footage-abstract-expressionism-on-blue-loop.mp4,PT00H01M00S,130101_130150,Abstract expressionism on blue. loop.
20700907,https://ak.picdn.net/shutterstock/videos/20700907/preview/stock-footage-cork-tree-flower-with-rain.mp4,PT00H00M12S,121201_121250,Cork tree flower with rain
1006739899,https://ak.picdn.net/shutterstock/videos/1006739899/preview/stock-footage-herd-of-pony-in-aerial-view.mp4,PT00H00M13S,119001_119050,Herd of pony in aerial view
4792682,https://ak.picdn.net/shutterstock/videos/4792682/preview/stock-footage-baby-at-the-doctor.mp4,PT00H00M23S,081751_081800,Baby at the doctor
26937547,https://ak.picdn.net/shutterstock/videos/26937547/preview/stock-footage-waves-in-gulf-of-livonia-in-baltic-sea.mp4,PT00H00M15S,131051_131100,Waves in gulf of livonia in baltic sea.
28345831,https://ak.picdn.net/shutterstock/videos/28345831/preview/stock-footage-little-miniature-horse-reaches-for-a-grass-through-the-barrier.mp4,PT00H00M30S,088201_088250,Little miniature horse reaches for a grass through the barrier
1031939039,https://ak.picdn.net/shutterstock/videos/1031939039/preview/stock-footage-snow-in-summer-cerastium-tomentosum-in-bloom-colorful-ink-in-water.mp4,PT00H00M41S,086201_086250,"Snow-in-summer, cerastium tomentosum in bloom. colorful ink in water."
23469028,https://ak.picdn.net/shutterstock/videos/23469028/preview/stock-footage-hardy-species-of-lichen-in-extreme-closeup-clinging-to-and-thriving-on-the-surface-of-a-large-rock.mp4,PT00H00M05S,137501_137550,Hardy species of lichen in extreme closeup. clinging to and thriving on the surface of a large rock in the wilderness.
1014753935,https://ak.picdn.net/shutterstock/videos/1014753935/preview/stock-footage-damaged-area-aerial-view-of-deforestated-mountain-slopes-with-a-path-along-it.mp4,PT00H00M16S,143451_143500,Damaged area. aerial view of deforestated mountain slopes with a path along it
1023801010,https://ak.picdn.net/shutterstock/videos/1023801010/preview/stock-footage-floating-market-on-the-river-in-vinh-thuan-district-kieng-giang-province-vietnam-february.mp4,PT00H00M16S,194701_194750,"Floating market on the river in vinh thuan district, kieng giang province / vietnam - february 2, 2019, mekong delta, view from above, 4k"
1019730430,https://ak.picdn.net/shutterstock/videos/1019730430/preview/stock-footage-a-woman-in-a-hat-and-a-down-jacket-walks-through-the-supermarket-she-looks-at-the-goods-on-the.mp4,PT00H00M09S,059351_059400,"A woman in a hat and a down jacket walks through the supermarket. she looks at the goods on the shelves, chooses a purchase."
1044682444,https://ak.picdn.net/shutterstock/videos/1044682444/preview/stock-footage-manhattan-new-york-september-people-walk-along-the-fashion-stores-and-trendy.mp4,PT00H00M18S,110351_110400,"Manhattan, new york - september 19, 2019: people walk along the fashion stores and trendy restaurants along broome street in the downtown soho district of midtown manhattan new york city usa."
25737440,https://ak.picdn.net/shutterstock/videos/25737440/preview/stock-footage-ice-cube-falling-into-a-glass-of-water.mp4,PT00H00M08S,031601_031650,Ice cube falling into a glass of water
1014551141,https://ak.picdn.net/shutterstock/videos/1014551141/preview/stock-footage-view-of-palm-trees-sky-and-aircraft-flying.mp4,PT00H00M21S,062601_062650,"View of palm trees, sky and aircraft flying"
30961633,https://ak.picdn.net/shutterstock/videos/30961633/preview/stock-footage-boat-trip-on-the-river-the-kamchatka-peninsula-russia.mp4,PT00H00M13S,140151_140200,Boat trip on the river. the kamchatka peninsula. russia.
18363364,https://ak.picdn.net/shutterstock/videos/18363364/preview/stock-footage-young-man-smiling-at-camera.mp4,PT00H00M30S,040001_040050,Young man smiling at camera
1013982902,https://ak.picdn.net/shutterstock/videos/1013982902/preview/stock-footage-kazan-tatarstan-russia-may-time-lapse-heavy-traffic-with-cars-busses-and-passerby-on.mp4,PT00H00M14S,112201_112250,"Kazan, tatarstan/russia - may 29 2018: time lapse heavy traffic with cars busses and passerby on cross road in illuminated city street at night on may 29 in kazan"
1019047912,https://ak.picdn.net/shutterstock/videos/1019047912/preview/stock-footage-super-slow-motion-of-vibrant-siamese-fighting-fish-betta-splendens-well-known-name-is-plakat.mp4,PT00H00M35S,021301_021350,"Super slow motion of vibrant siamese fighting fish (betta splendens), well known name is plakat thai, betta is a species in the gourami family, which is a popular fish in the aquarium trade"
1030633796,https://ak.picdn.net/shutterstock/videos/1030633796/preview/stock-footage-asian-young-women-friends-travel-in-bangkok-thailand-beautiful-female-feeling-happy-walking-and.mp4,PT00H00M16S,082651_082700,"Asian young women friends travel in bangkok, thailand, beautiful female feeling happy walking and eating pad thai at the khao san road. women travel eat street food concept. slow motion shot."
1032526772,https://ak.picdn.net/shutterstock/videos/1032526772/preview/stock-footage-smiling-woman-in-front-of-her-home.mp4,PT00H00M15S,183101_183150,Smiling woman in front of her home
1006564393,https://ak.picdn.net/shutterstock/videos/1006564393/preview/stock-footage-time-concept-silhouette-of-hourglass-clock-rotating-in-smoke-on-dark-toned-background-or-symbols.mp4,PT00H00M09S,050201_050250,"Time concept. silhouette of hourglass clock rotating in smoke on dark toned background, or symbols of time under smoke, the end"
1006754167,https://ak.picdn.net/shutterstock/videos/1006754167/preview/stock-footage-happy-beautiful-woman-standing-in-the-city-k.mp4,PT00H00M13S,055551_055600,"Happy, beautiful woman standing in the city 4k
"
1036881251,https://ak.picdn.net/shutterstock/videos/1036881251/preview/stock-footage-medium-and-close-up-portraits-of-kangaroos-on-the-beach-in-australia.mp4,PT00H00M15S,016901_016950,Medium and close up portraits of kangaroos on the beach in australia.
972373,https://ak.picdn.net/shutterstock/videos/972373/preview/stock-footage-abstract-ring-of-fire-hd-seamless-loop.mp4,PT00H00M10S,115751_115800,Abstract ring of fire hd 1080 - seamless loop
17460634,https://ak.picdn.net/shutterstock/videos/17460634/preview/stock-footage-autumn-rural-scene-with-wooden-barn-haystacks-in-transylvania-region-romania-cca.mp4,PT00H00M30S,147001_147050,"Autumn rural scene with wooden barn, haystacks in transylvania region, romania, cca. 2010."
23609860,https://ak.picdn.net/shutterstock/videos/23609860/preview/stock-footage-aerial-drone-flight-over-a-frozen-river-with-ice-melting-aerial-fpv-drone-k-video.mp4,PT00H00M22S,176751_176800,"Aerial drone flight over a frozen river with ice melting, aerial fpv, drone 4k video."
1028035007,https://ak.picdn.net/shutterstock/videos/1028035007/preview/stock-footage-historic-lighthouse-on-california-coastal-cliffs-aerial-close-orbit.mp4,PT00H00M15S,058551_058600,"Historic lighthouse on california coastal cliffs, aerial close orbit."
1034312495,https://ak.picdn.net/shutterstock/videos/1034312495/preview/stock-footage-training-a-fighting-dog-dog-breed-american-pit-bull-terrier-high-jumps-for-a-dog-toy.mp4,PT00H00M16S,066601_066650,Training a fighting dog. dog breed american pit bull terrier high jumps for a dog toy.
1038073739,https://ak.picdn.net/shutterstock/videos/1038073739/preview/stock-footage-malaga-andalusia-spain-september-global-strike-for-planet-people-protesting-during.mp4,PT00H00M23S,175601_175650,"Malaga, andalusia / spain - september 27 2019. global strike for planet, people protesting during fridays for future. hands and posters up to the sky with the problem is the monetary system"
14380753,https://ak.picdn.net/shutterstock/videos/14380753/preview/stock-footage--k-cute-child-in-kindergarten-playing-with-toy-cars.mp4,PT00H00M15S,114701_114750,4k cute child in kindergarten playing with toy cars
21736882,https://ak.picdn.net/shutterstock/videos/21736882/preview/stock-footage-lake-tahoe-california-a-tranquil-mountain-and-cliff-behind-a-wall-of-trees.mp4,PT00H00M06S,019851_019900,Lake tahoe california 1939: a tranquil mountain and cliff behind a wall of trees
17179102,https://ak.picdn.net/shutterstock/videos/17179102/preview/stock-footage-green-field-of-wheat-swaying-in-the-wind.mp4,PT00H00M08S,079951_080000,Green field of wheat swaying in the wind
1045079410,https://ak.picdn.net/shutterstock/videos/1045079410/preview/stock-footage-lauterbrunnen-circa-heavy-snow-at-kleine-scheidegg-station-on-the-way-to-jungfraujoch-the.mp4,PT00H00M13S,128651_128700,"Lauterbrunnen, circa 2019 - heavy snow at kleine scheidegg station, on the way to jungfraujoch. the kleine scheidegg is a mountain pass at an elevation of 2,061m. 1080p pro res. handheld."
1043068825,https://ak.picdn.net/shutterstock/videos/1043068825/preview/stock-footage-flags-of-sweden-and-denmark-behind-pawns-on-the-chessboard-chess-game-or-political-rivalry-related.mp4,PT00H00M05S,037251_037300,Flags of sweden and denmark behind pawns on the chessboard. chess game or political rivalry related 3d animation
1028877437,https://ak.picdn.net/shutterstock/videos/1028877437/preview/stock-footage-slow-motion-shot-of-decorative-dark-concrete-surface-shot-handheld.mp4,PT00H00M24S,184551_184600,"Slow motion shot of decorative dark concrete surface, shot handheld"
9399371,https://ak.picdn.net/shutterstock/videos/9399371/preview/stock-footage-meat-savory-grilled-beef-fillet-mignon-plate-with-tomatoes-apples-and-pepper-over-black-wooden.mp4,PT00H00M15S,012451_012500,Meat savory : grilled beef fillet mignon plate with tomatoes apples and pepper over black wooden table 1920x1080 intro motion slow hidef hd
1021600996,https://ak.picdn.net/shutterstock/videos/1021600996/preview/stock-footage-close-up-of-professional-groomer-combing-little-yorkshire-terrier-close-up-of-a-veterinarian.mp4,PT00H00M25S,014151_014200,Close-up of professional groomer combing little yorkshire terrier. close-up of a veterinarian combing hair on the face of a yorkshire terrier. hairdresser for animals.
1034683388,https://ak.picdn.net/shutterstock/videos/1034683388/preview/stock-footage-personal-perspective-of-walking-on-a-path-through-the-forest-pov-of-a-person-in-an-undergrowth-in.mp4,PT00H00M12S,040451_040500,Personal perspective of walking on a path through the forest - pov of a person in an undergrowth in summer
1019775895,https://ak.picdn.net/shutterstock/videos/1019775895/preview/stock-footage-digital-composite-of-video-composition-with-falling-snow-over-santa-at-desk-with-gifts.mp4,PT00H00M11S,001001_001050,Digital composite of video composition with falling snow over santa  at desk with gifts
1051346617,https://ak.picdn.net/shutterstock/videos/1051346617/preview/stock-footage-top-view-of-a-winter-ice-rink-and-people-skating-in-slow-motion-winter-rink-in-the-fresh-air.mp4,PT00H00M13S,069651_069700,"Top view of a winter ice rink and people skating in slow motion. winter rink in the fresh air. useful and interesting sport for health. new year and christmas days in kharkiv, ukraine 2020."
