videoid,contentUrl,duration,page_dir,name
28641073,https://ak.picdn.net/shutterstock/videos/28641073/preview/stock-footage-pretty-girl-looking-trough-the-wardrobe-girl-chooses-clothes-in-the-wardrobe.mp4,PT00H00M09S,083901_083950,Pretty girl looking trough the wardrobe. girl chooses clothes in the wardrobe
16983409,https://ak.picdn.net/shutterstock/videos/16983409/preview/stock-footage-moscow-jun-woman-tumbles-on-trampoline-center-just-jump-in-park-sokolniki.mp4,PT00H00M20S,018101_018150,"Moscow - jun 17, 2014: woman tumbles on trampoline center just jump in park sokolniki"
1044946510,https://ak.picdn.net/shutterstock/videos/1044946510/preview/stock-footage-beautiful-girl-doing-mri-of-the-jaw-at-the-dentist-s-appointment.mp4,PT00H00M08S,059351_059400,Beautiful girl doing mri of the jaw at the dentist's appointment
1024791293,https://ak.picdn.net/shutterstock/videos/1024791293/preview/stock-footage-ottawa-canada-february-the-united-we-roll-protest-from-canadian-oil-and-gas-workers-ends.mp4,PT00H00M06S,123501_123550,"Ottawa, canada - february 2019 - the united we roll protest from canadian oil and gas workers ends in front of parliament hill"
1021188328,https://ak.picdn.net/shutterstock/videos/1021188328/preview/stock-footage--december-at-samut-sakhon-thailand-people-are-using-a-forklift-raise-a-large-wooden-box-in.mp4,PT00H00M13S,140101_140150,19 december 2018 at samut sakhon thailand people are using a forklift. raise a large wooden box in the container.
1041103465,https://ak.picdn.net/shutterstock/videos/1041103465/preview/stock-footage-various-oriental-spices-and-seasonings-on-the-street-market-in-the-georgian-city-of-batumi-plastic.mp4,PT00H00M06S,050151_050200,"Various oriental spices and seasonings on the street market in the georgian city of batumi. plastic boxes with labels written in georgian. turmeric, paprika, curry, pepper, thyme, marjoram, rosemary"
1015431172,https://ak.picdn.net/shutterstock/videos/1015431172/preview/stock-footage-sunrise-aerial-shot-of-jakarta-city-financial-district.mp4,PT00H00M25S,141401_141450,Sunrise aerial shot of jakarta city financial district.
20294935,https://ak.picdn.net/shutterstock/videos/20294935/preview/stock-footage-close-up-of-handsome-young-business-man-using-perfume.mp4,PT00H00M05S,147401_147450,Close up of handsome young business man using perfume
1031542292,https://ak.picdn.net/shutterstock/videos/1031542292/preview/stock-footage-vienna-austria-june-panoramic-view-of-the-bridge-over-the-donau-river-with-cars-and.mp4,PT00H00M38S,022451_022500,"Vienna, austria – june, 2019: panoramic view of the bridge over the donau river with cars and boats on the river."
898492,https://ak.picdn.net/shutterstock/videos/898492/preview/stock-footage-professionally-grown-grapes-a-bunch-of-black-grapes-growing-on-vine-branch.mp4,PT00H00M23S,188751_188800,Professionally grown grapes. a bunch of black grapes growing on vine branch.
1039817246,https://ak.picdn.net/shutterstock/videos/1039817246/preview/stock-footage-a-woman-sitting-in-a-hanging-chair-in-the-middle-of-the-ocean.mp4,PT00H00M10S,041101_041150,A woman sitting in a hanging chair in the middle of the ocean
12176966,https://ak.picdn.net/shutterstock/videos/12176966/preview/stock-footage-embers-in-a-cup-of-hookah-at-the-asian-cafe.mp4,PT00H00M07S,171901_171950,Embers in a cup of hookah at the asian cafe.
1029885017,https://ak.picdn.net/shutterstock/videos/1029885017/preview/stock-footage-car-mechanic-or-serviceman-checking-a-car-engine-valve-adjustment-for-fix-and-repair-problem-at.mp4,PT00H00M25S,196401_196450,Car mechanic or serviceman checking a car engine (valve adjustment) for fix and repair problem at car garage or repair shop
12165506,https://ak.picdn.net/shutterstock/videos/12165506/preview/stock-footage-slider-shot-of-honey-bee-hives-in-autumnal-apple-garden.mp4,PT00H00M27S,190451_190500,"Slider shot of honey bee hives in autumnal apple garden
"
1008603580,https://ak.picdn.net/shutterstock/videos/1008603580/preview/stock-footage-couple-celebrate-valentine-s-day-with-romantic-dinner-in-restaurant.mp4,PT00H00M10S,085001_085050,Couple celebrate valentine's day with romantic dinner in restaurant
1008319216,https://ak.picdn.net/shutterstock/videos/1008319216/preview/stock-footage-generic-email-new-inbox-message-sexual-health-and-wellness-email-test-results-positive.mp4,PT00H00M09S,117201_117250,Generic email new inbox message - sexual health and wellness email test results - positive
14032877,https://ak.picdn.net/shutterstock/videos/14032877/preview/stock-footage-pure-silver-shape-of-granules-of-pure-silver-each-one-is-unique.mp4,PT00H00M09S,008301_008350,"Pure silver, shape of granules of pure silver each one is unique 21 (2)"
1036794179,https://ak.picdn.net/shutterstock/videos/1036794179/preview/stock-footage-man-sawing-old-wood-with-hand-saws-to-make-the-chair-backrest.mp4,PT00H00M30S,134001_134050,Man sawing  old wood with hand saws to make the chair backrest
1058822995,https://ak.picdn.net/shutterstock/videos/1058822995/preview/stock-footage-partial-view-of-ballerina-dancing-on-pointe-on-white-background.mp4,PT00H00M29S,111401_111450,Partial view of ballerina dancing on pointe on white background
1476,https://ak.picdn.net/shutterstock/videos/1476/preview/stock-footage-people-exit-chicago-el-train.mp4,PT00H00M10S,007451_007500,People exit chicago el train 2
1021648183,https://ak.picdn.net/shutterstock/videos/1021648183/preview/stock-footage-haifa-haifa-aerial-view-k.mp4,PT00H00M10S,196851_196900,Haifa 10.01.2017: haifa aerial view 4k 
8743627,https://ak.picdn.net/shutterstock/videos/8743627/preview/stock-footage--cassette-tapes-animation.mp4,PT00H00M18S,026151_026200,"4 cassette tapes, animation"
1033033433,https://ak.picdn.net/shutterstock/videos/1033033433/preview/stock-footage-group-of-cows-feed-on-grass-on-a-free-range-pasture-with-another-cow-passing-the-camera.mp4,PT00H00M15S,006851_006900,"Group of cows feed on grass on a free range pasture, with another cow passing the camera."
30096610,https://ak.picdn.net/shutterstock/videos/30096610/preview/stock-footage-komodo-dragon-resting.mp4,PT00H00M25S,181851_181900,Komodo dragon resting
4642919,https://ak.picdn.net/shutterstock/videos/4642919/preview/stock-footage-zion-and-mountain-of-sun-dramatic.mp4,PT00H00M11S,118201_118250,Zion and mountain of sun dramatic
1060731508,https://ak.picdn.net/shutterstock/videos/1060731508/preview/stock-footage-exhausted-man-finished-his-workout.mp4,PT00H00M19S,178851_178900,Exhausted man finished his workout
21267880,https://ak.picdn.net/shutterstock/videos/21267880/preview/stock-footage-child-sitting-with-mom-at-the-beach-bar.mp4,PT00H00M17S,052351_052400,Child sitting with mom at the beach bar
15948106,https://ak.picdn.net/shutterstock/videos/15948106/preview/stock-footage-san-pablo-city-laguna-philippines-april-beautiful-water-fountain-baroque-architecture.mp4,PT00H00M07S,191751_191800,"San pablo city, laguna, philippines - april 15, 2016: beautiful water fountain baroque architecture built in st. peter's seminary square"
9471116,https://ak.picdn.net/shutterstock/videos/9471116/preview/stock-footage-green-tea-garden-in-the-north-of-thailand.mp4,PT00H00M15S,050401_050450,Green tea garden in the north of thailand
25442564,https://ak.picdn.net/shutterstock/videos/25442564/preview/stock-footage-hair-stylist-making-a-haircut-for-a-young-man-closeup.mp4,PT00H00M32S,144951_145000,Hair stylist making a haircut for a young man closeup
15452323,https://ak.picdn.net/shutterstock/videos/15452323/preview/stock-footage-winter-snowfall-snow-timelapse-on-natural-street-background-gloomy-sky-bare-trees.mp4,PT00H00M16S,190801_190850,"Winter snowfall. snow timelapse on natural street background, gloomy sky, bare trees."
1029920765,https://ak.picdn.net/shutterstock/videos/1029920765/preview/stock-footage-in-a-blue-and-orange-cup-of-tea-brewed-from-the-package.mp4,PT00H00M13S,135201_135250,In a blue and orange cup of tea brewed from the package
1032727523,https://ak.picdn.net/shutterstock/videos/1032727523/preview/stock-footage-teluk-batik-beach-perak-malaysia-july-tourist-enjoying-island-hopping-trip-on-a-boat.mp4,PT00H00M12S,006851_006900,"Teluk batik beach, perak, malaysia - july 6, 2019 : tourist enjoying island hopping trip on a boat from teluk batik beach. teluk batik beach is among beautiful beaches in malaysia."
1028289071,https://ak.picdn.net/shutterstock/videos/1028289071/preview/stock-footage-a-young-man-says-hello-to-a-sportsman-who-is-working-out-and-he-says-hello-back-then-he-continues.mp4,PT00H00M07S,000101_000150,A young man says hello to a sportsman who is working out and he says hello back. then he continues walking.
1043424784,https://ak.picdn.net/shutterstock/videos/1043424784/preview/stock-footage-a-super-slow-motion-shot-of-merino-sheep-herding-in-western-australia-k.mp4,PT00H00M19S,036301_036350,"A super slow motion shot of merino sheep herding in western australia, 4k"
14995315,https://ak.picdn.net/shutterstock/videos/14995315/preview/stock-footage--k-underwater-young-woman-on-summer-vacation-on-tropical-exotic-island-swimming-with-wild-stingray.mp4,PT00H00M18S,176101_176150,4k underwater: young woman on summer vacation on tropical exotic island swimming with wild stingray rays in crystal clear blue lagoon ocean
1022046091,https://ak.picdn.net/shutterstock/videos/1022046091/preview/stock-footage-spectacular-lake-ducks-nature-fog-park-sunrise-spain-river-magic-sunset.mp4,PT00H00M08S,025201_025250,Spectacular lake ducks nature fog park sunrise spain river magic sunset 
1053383762,https://ak.picdn.net/shutterstock/videos/1053383762/preview/stock-footage-mature-man-in-plastic-gloves-puts-food-in-a-cart-in-a-supermarket-post-quarantine-life-rules-for.mp4,PT00H00M20S,108151_108200,"Mature man in plastic gloves puts food in a cart in a supermarket. post-quarantine life, rules for visiting shopping centers, social distance"
1026387218,https://ak.picdn.net/shutterstock/videos/1026387218/preview/stock-footage-glass-blowers-making-a-beautiful-piece-of-glass-art-together.mp4,PT00H00M08S,038001_038050,Glass blowers making a beautiful piece of glass art together
5434250,https://ak.picdn.net/shutterstock/videos/5434250/preview/stock-footage-liverpool-merseyside-england-january-the-oil-tanker-ship-furenas-sails-out-of-the.mp4,PT00H00M12S,130151_130200,"Liverpool, merseyside/england - january 16: the oil tanker ship, furenas sails out of the manchester ship canal and down the river mersey to antwerp on january 16, 2014 in liverpool."
1050514402,https://ak.picdn.net/shutterstock/videos/1050514402/preview/stock-footage-beautiful-mossy-sunny-forest-in-movement-woodland-with-some-old-and-young-trees-on-a-bright-spring.mp4,PT00H00M19S,085101_085150,Beautiful mossy sunny forest in movement. woodland with some old and young trees on a bright spring day. 
1020996610,https://ak.picdn.net/shutterstock/videos/1020996610/preview/stock-footage-the-windows-of-a-dwelling-house-during-snowing-the-lantern-burns-during-a-blizzard-tree-branches.mp4,PT00H00M18S,041201_041250,The windows of a dwelling house during snowing. the lantern burns during a blizzard. tree branches in the snow at night. snowfall in europe
1042251892,https://ak.picdn.net/shutterstock/videos/1042251892/preview/stock-footage--d-element-abstract-background-blue.mp4,PT00H00M10S,112601_112650,3d element abstract background -blue
24395165,https://ak.picdn.net/shutterstock/videos/24395165/preview/stock-footage-aerial-view-of-busy-city-traffic-at-an-intersection-on-a-major-freeway-in-the-suburbs-of-the-city.mp4,PT00H00M30S,023501_023550,Aerial view of busy city traffic at an intersection on a major freeway in the suburbs of the city. airplane view of two intersecting highways.
1028487200,https://ak.picdn.net/shutterstock/videos/1028487200/preview/stock-footage-statue-guardian-dog-at-the-traditional-shrine-copyspace-chiyoda-district-tokyo-japan.mp4,PT00H00M13S,113451_113500,Statue guardian dog at the traditional shrine copyspace. chiyoda district tokyo japan - 02.07.2019 : it is an old statue at the traditional shrine. camera : canon eos 5d mark4
1052332567,https://ak.picdn.net/shutterstock/videos/1052332567/preview/stock-footage-asian-elephant-also-called-asiatic-elephant-is-distributed-throughout-the-indian-subcontinent-and.mp4,PT00H02M02S,179951_180000,"Asian elephant also called asiatic elephant, is  distributed throughout the indian subcontinent and southeast asia"
1020205762,https://ak.picdn.net/shutterstock/videos/1020205762/preview/stock-footage-aerial-view-beautiful-landscape-view-on-castle-in-field-on-the-mountains-background-in-summer-sunny.mp4,PT00H00M29S,047551_047600,"Aerial view beautiful landscape view on castle in field on the mountains background in summer sunny day with blue sky, drone 4k video
"
32207032,https://ak.picdn.net/shutterstock/videos/32207032/preview/stock-footage-leaves-trees-autumn-forest-dolly-video-autumn-landscape.mp4,PT00H00M23S,188801_188850,Leaves trees autumn forest. dolly video. autumn landscape
1342774,https://ak.picdn.net/shutterstock/videos/1342774/preview/stock-footage--d-grids-animation.mp4,PT00H00M43S,008551_008600,3d grids animation 07
9664016,https://ak.picdn.net/shutterstock/videos/9664016/preview/stock-footage-ben-boy-teacher-pupil-student-funny-comic-illustration.mp4,PT00H00M10S,194651_194700,Ben boy teacher pupil student funny comic illustration
24472133,https://ak.picdn.net/shutterstock/videos/24472133/preview/stock-footage-view-from-the-rear-of-moving-speedboat-slow-motion.mp4,PT00H00M28S,038201_038250,"View from the rear of moving speedboat, slow motion"
1038375062,https://ak.picdn.net/shutterstock/videos/1038375062/preview/stock-footage-grandpa-angry-whiteboard-animation-k-footage.mp4,PT00H00M06S,079001_079050,Grandpa angry whiteboard animation 4k footage
16523305,https://ak.picdn.net/shutterstock/videos/16523305/preview/stock-footage-cape-town-city-k-uhd-aerial-footage-of-table-mountain-kloof-corner-part-of.mp4,PT00H00M11S,067051_067100,Cape town city 4k uhd aerial footage of table mountain kloof corner. part 1 of 3
1037080484,https://ak.picdn.net/shutterstock/videos/1037080484/preview/stock-footage-blue-luminous-particles-in-a-liquid-go-around-a-sphere-use-luma-matte-as-alpha-channel.mp4,PT00H00M28S,018601_018650,Blue luminous particles in a liquid go around a sphere. use luma matte as alpha channel
1021762237,https://ak.picdn.net/shutterstock/videos/1021762237/preview/stock-footage-young-teen-and-joystick-man-cybersport-hooded-sweater-absorbed-in-online-video-game-boy-teenager.mp4,PT00H00M21S,067601_067650,Young teen and joystick man cybersport hooded sweater absorbed in online video game. boy teenager in the hood playing video games on the console on the gamepad. controller console gamepad. gaming man
1065505078,https://ak.picdn.net/shutterstock/videos/1065505078/preview/stock-footage-a-view-of-pigeon-tower-in-katara-village-doha-qatar-th-jan.mp4,PT00H00M11S,061751_061800,"A view of pigeon tower in katara village - doha, qatar - 08th jan 2021"
2085173,https://ak.picdn.net/shutterstock/videos/2085173/preview/stock-footage-strawberry-cream-filling-being-spread-on-a-layer-of-sponge-cake.mp4,PT00H00M16S,039701_039750,Strawberry cream filling being spread on a layer of sponge cake
783742,https://ak.picdn.net/shutterstock/videos/783742/preview/stock-footage-three-recycling-bins-and-trash-cans-in-a-park-dolly-shot.mp4,PT00H00M09S,086801_086850,"Three recycling bins and trash cans in a park, dolly shot"
1059163370,https://ak.picdn.net/shutterstock/videos/1059163370/preview/stock-footage-dissatisfied-young-woman-holding-rolling-pin-and-calling-someone-portrait-of-irritated-angry.mp4,PT00H00M09S,033901_033950,Dissatisfied young woman holding rolling pin and calling someone. portrait of irritated angry caucasian lady standing in kitchen with cooking utensil. beautiful mother or wife waiting for conflict.
1046288662,https://ak.picdn.net/shutterstock/videos/1046288662/preview/stock-footage-young-adult-woman-in-white-clothes-sits-on-a-rock-against-the-background-of-a-waterfall-and.mp4,PT00H00M15S,120701_120750,Young adult woman in white clothes sits on a rock against the background of a waterfall and practices yoga
67462,https://ak.picdn.net/shutterstock/videos/67462/preview/stock-footage-ants-closeup-part-one-of-long-sequence.mp4,PT00H00M30S,001801_001850,Ants closeup part one of long sequence
1020587095,https://ak.picdn.net/shutterstock/videos/1020587095/preview/stock-footage-kyiv-ukraine-february-fashion-catwalk-at-fashion-show-in-which-models-are-showing.mp4,PT00H00M20S,040351_040400,"Kyiv, ukraine – february 5, 2017. fashion: catwalk at fashion show in which models are showing off new clothes. model.  model business. woman, girl, female"
1035285380,https://ak.picdn.net/shutterstock/videos/1035285380/preview/stock-footage-flies-feasting-on-a-blackberry-macro-footage-up-close.mp4,PT00H00M23S,066051_066100,"Flies feasting on a blackberry, macro footage up close"
1059477725,https://ak.picdn.net/shutterstock/videos/1059477725/preview/stock-footage-female-person-having-video-conversation-and-using-laptop-camera-cheerful-woman-smiling-and-saying.mp4,PT00H00M13S,142701_142750,"Female person having video conversation and using laptop camera. cheerful woman smiling and saying with sign language hello, how are you while sitting on sofa. concept of hearing loss"
3796913,https://ak.picdn.net/shutterstock/videos/3796913/preview/stock-footage-flock-of-buzzards-eating-a-dead-cow.mp4,PT00H00M22S,053601_053650,Flock of buzzards eating a dead cow
23622787,https://ak.picdn.net/shutterstock/videos/23622787/preview/stock-footage-animation-background-water-bubbles-multicolor.mp4,PT00H00M11S,146851_146900,"Animation, background, water bubbles, multicolor."
1167781,https://ak.picdn.net/shutterstock/videos/1167781/preview/stock-footage-falling-and-exploding-dust-cloud-with-alpha-matte.mp4,PT00H00M41S,082551_082600,Falling and exploding dust cloud (with alpha matte)
1021136293,https://ak.picdn.net/shutterstock/videos/1021136293/preview/stock-footage-abstract-colorful-tribal-designs-kaleidoscopic-patterns-k.mp4,PT00H00M10S,176151_176200,Abstract colorful tribal designs. kaleidoscopic patterns. 4k
1019693311,https://ak.picdn.net/shutterstock/videos/1019693311/preview/stock-footage-woman-working-on-a-laptop-while-sitting-at-a-desk.mp4,PT00H00M11S,053851_053900,Woman working on a laptop while sitting at a desk.
1030924871,https://ak.picdn.net/shutterstock/videos/1030924871/preview/stock-footage-minsk-minsk-belarus-june-competition-and-rewarding-of-participants-of-belferm-at-the.mp4,PT00H00M11S,138301_138350,"Minsk, minsk, belarus 6 june 2019, competition and rewarding of participants of belferm, at the exhibition belagro 2019. visible sandy arena, participants, spectators and media representatives."
1066951078,https://ak.picdn.net/shutterstock/videos/1066951078/preview/stock-footage-hands-of-a-businesswoman-put-hundred-dollar-bills-in-an-envelope-the-macro-filmed-a-woman-s-hands.mp4,PT00H00M13S,127101_127150,"Hands of a businesswoman put hundred-dollar bills in an envelope. the macro filmed a woman's hands holding an illegal salary in a tax-free envelope. close-up of salary in an envelope, corruption conce"
1033287260,https://ak.picdn.net/shutterstock/videos/1033287260/preview/stock-footage-pesticide-being-applied-in-a-coffee-plantation-drops-of-fertilizer-or-pesticide-in-the-coffins-of.mp4,PT00H00M08S,067101_067150,Pesticide being applied in a coffee plantation. drops of fertilizer or pesticide in the coffins of mature coffees. 4k. premium cinematic video.
1042159153,https://ak.picdn.net/shutterstock/videos/1042159153/preview/stock-footage-multicolored-graphic-pattern-with-triangles-which-quickly-changes-color-as-it-rotates-clockwise.mp4,PT00H00M15S,081851_081900,"Multicolored graphic pattern with triangles, which quickly changes color as it rotates clockwise and then anticlockwise, creating a hypnotic and stroboscopic effect"
1023822016,https://ak.picdn.net/shutterstock/videos/1023822016/preview/stock-footage-glitter-abstract-background-for-celebration-with-light-and-shine-in-center-blue-glowing-sparks.mp4,PT00H00M12S,004351_004400,Glitter abstract background for celebration with light and shine in center. blue glowing sparks
1053307586,https://ak.picdn.net/shutterstock/videos/1053307586/preview/stock-footage-top-view-of-playful-young-mom-tickling-small-preschooler-girl-laughing-bonding-relaxing-mother.mp4,PT00H00M10S,129651_129700,"Top view of playful young mom tickling small preschooler girl laughing bonding relaxing, mother playing with cute little child daughter lying on cozy bed at home,  talking joking having fun together"
1045493146,https://ak.picdn.net/shutterstock/videos/1045493146/preview/stock-footage-catskill-new-york-green-and-red-three-little-pigs-sign-on-a-clear-day.mp4,PT00H00M05S,107001_107050,Catskill new york-1957: green and red three little pigs sign on a clear day
31130389,https://ak.picdn.net/shutterstock/videos/31130389/preview/stock-footage-sea-waves-comes-on-shore-fps-slowmotion.mp4,PT00H01M00S,080801_080850,Sea waves comes on shore 60 fps slowmotion
15261952,https://ak.picdn.net/shutterstock/videos/15261952/preview/stock-footage-happy-attractive-mature-couple-shopping-in-the-city.mp4,PT00H00M20S,087401_087450,Happy attractive mature couple shopping in the city
30011044,https://ak.picdn.net/shutterstock/videos/30011044/preview/stock-footage--d-animation-rotation-of-symbol-of-nature-wild-life-forest-tree-plants-flowers-animals-and.mp4,PT00H00M10S,011651_011700,"3d animation rotation of symbol of nature, wild life, forest, tree, plants, flowers,  animals and insect from glass. animation of seamless loop."
24070249,https://ak.picdn.net/shutterstock/videos/24070249/preview/stock-footage-ultramarine-flycatcher-male-birds-of-doi-sun-juh-chiang-mai-thailand.mp4,PT00H00M27S,016051_016100,"Ultramarine flycatcher (male)  - birds of  doi sun juh, chiang mai,thailand."
1025966441,https://ak.picdn.net/shutterstock/videos/1025966441/preview/stock-footage-vertical-video-reed-against-the-background-of-the-winter-sky-against-backlight-slider.mp4,PT00H00M34S,147051_147100,Vertical video. reed against the background of the winter sky against backlight. slider
1009573718,https://ak.picdn.net/shutterstock/videos/1009573718/preview/stock-footage-moorea-maiao-flag-city-of-french-polynesia-realistic-animation-isolated-on-white-seamless-loop.mp4,PT00H00M20S,055151_055200,"Moorea maiao flag, city of french polynesia, realistic animation isolated on white seamless loop - 10 seconds long (alpha channel is included)"
1051690831,https://ak.picdn.net/shutterstock/videos/1051690831/preview/stock-footage-closeup-of-dried-ganxet-beans-in-wicker-baskets-for-sale-on-market.mp4,PT00H00M11S,185001_185050,Closeup of dried ganxet beans in wicker baskets for sale on market 
1027994819,https://ak.picdn.net/shutterstock/videos/1027994819/preview/stock-footage-chinese-woman-is-making-a-picture-of-tsaritsyno-museum-reserve-moscow-russia.mp4,PT00H00M12S,088301_088350,"Chinese woman is making a picture of tsaritsyno museum-reserve, moscow, russia"
1036868132,https://ak.picdn.net/shutterstock/videos/1036868132/preview/stock-footage-praying-mantis-moves-on-stone.mp4,PT00H00M07S,107551_107600,Praying mantis moves on stone.
1042979170,https://ak.picdn.net/shutterstock/videos/1042979170/preview/stock-footage-graphic-drawings-that-rotate-in-the-center-changing-color-composed-of-colorful-shapes-and-textures.mp4,PT00H00M15S,181951_182000,"Graphic drawings that rotate in the center changing color, composed of colorful shapes and textures."
23025805,https://ak.picdn.net/shutterstock/videos/23025805/preview/stock-footage--k-group-of-students-using-computer-tablet-relaxing-in-shared-accommodation-dec-uk.mp4,PT00H00M29S,127151_127200,4k group of students using computer tablet & relaxing in shared accommodation dec 2016-uk
1024221794,https://ak.picdn.net/shutterstock/videos/1024221794/preview/stock-footage-the-beauty-and-purity-of-the-streets-of-fussen.mp4,PT00H00M28S,001551_001600,The beauty and purity of the streets of fussen.
22548706,https://ak.picdn.net/shutterstock/videos/22548706/preview/stock-footage-vienna-austria-april-slow-motion-view-of-small-boy-hitting-with-toy-hammer-game-in.mp4,PT00H00M31S,121751_121800,"Vienna, austria - april 26, 2016: slow motion view of small boy hitting with toy hammer game in amusement park, other gaming machines and rainy sky on the background"
1034406908,https://ak.picdn.net/shutterstock/videos/1034406908/preview/stock-footage-blue-sea-horizon-in-italy.mp4,PT00H00M13S,142751_142800,Blue sea horizon in italy
20617984,https://ak.picdn.net/shutterstock/videos/20617984/preview/stock-footage-study-inscription-on-pencil.mp4,PT00H00M10S,014701_014750,Study inscription on pencil
21549784,https://ak.picdn.net/shutterstock/videos/21549784/preview/stock-footage-pura-uluwatu-temple-stone-cliffs-ocean-waves-and-oceanscape-aerial-top-view-bali-indonesia.mp4,PT00H00M08S,195701_195750,"Pura uluwatu temple. stone cliffs, ocean waves and oceanscape. aerial top view. bali, indonesia."
1065773107,https://ak.picdn.net/shutterstock/videos/1065773107/preview/stock-footage-lighting-equipment-lighting-effects-dynamic-strobe-light-stage-ray-of-light-in-concert-hall.mp4,PT00H00M16S,144801_144850,"Lighting equipment, lighting effects. dynamic strobe light stage ray of light in concert hall. professional show effects. lights from above soft optical lens flares shiny. rays shiny dynamic"
1064612839,https://ak.picdn.net/shutterstock/videos/1064612839/preview/stock-footage-rio-de-janeiro-brazil-aerial-view-of-brazilian-landscape-with-rocks-and-ocean-wonderful-panorama.mp4,PT00H00M15S,195551_195600,"Rio de janeiro, brazil. aerial view of brazilian landscape with rocks and ocean. wonderful panorama of tropical landmarks. high quality 4k footage"
