videoid,contentUrl,duration,page_dir,name
28273978,https://ak.picdn.net/shutterstock/videos/28273978/preview/stock-footage-woman-watching-tv-and-playing-with-a-furry-cat-on-her-hands.mp4,PT00H00M18S,198651_198700,Woman watching tv and playing with a furry cat on her hands
1015316623,https://ak.picdn.net/shutterstock/videos/1015316623/preview/stock-footage-asian-woman-keeps-turning-her-waist-and-keeps-her-hands-up.mp4,PT00H00M24S,137401_137450,Asian woman keeps turning her waist and keeps her hands up.
1058930135,https://ak.picdn.net/shutterstock/videos/1058930135/preview/stock-footage-sand-beach-with-big-tropic-palm-tree-and-yellow-and-red-pedal-boats-for-renting.mp4,PT00H00M07S,104251_104300,Sand beach with big tropic palm tree and yellow and red pedal boats for renting
8748181,https://ak.picdn.net/shutterstock/videos/8748181/preview/stock-footage-los-angeles-circa-driving-plates-multi-angle-la-downtown-cam-l-warehouses-bridge.mp4,PT00H01M00S,009801_009850,Los angeles - circa 2015: driving plates multi angle la downtown 10 cam3 3/4 l warehouses bridge 60fps
34902784,https://ak.picdn.net/shutterstock/videos/34902784/preview/stock-footage-south-korea-january-aerial-view-of-deogyusan-muju-ski-resort-south-korea-many-people.mp4,PT00H00M10S,125501_125550,"South korea - january 2018 : aerial view of deogyusan (muju) ski resort, south korea. many people playing ski and snowboard on slope in winter season."
20551033,https://ak.picdn.net/shutterstock/videos/20551033/preview/stock-footage-ballerina-practicing-a-ballet-dance-in-ballet-studio-k.mp4,PT00H00M15S,009951_010000,Ballerina practicing a ballet dance in ballet studio 4k
26031167,https://ak.picdn.net/shutterstock/videos/26031167/preview/stock-footage-digital-dots-motion-background-loop-modern-technological-style.mp4,PT00H00M20S,172401_172450,"Digital dots motion background loop, modern technological style "
24140701,https://ak.picdn.net/shutterstock/videos/24140701/preview/stock-footage-reef-with-hard-corals-negros-philippines.mp4,PT00H00M16S,094951_095000,Reef with hard corals negros philippines
1066648516,https://ak.picdn.net/shutterstock/videos/1066648516/preview/stock-footage-misty-forest-view-of-flying-over-pine-forest-in-the-morning-magical-fog-in-mountain-aerial-shot.mp4,PT00H00M26S,000051_000100,"Misty forest. view of flying over pine forest in the morning, magical fog in mountain, aerial shot, 4k"
22986589,https://ak.picdn.net/shutterstock/videos/22986589/preview/stock-footage-double-dipping-chicken-crossie-into-sweet-chili-sauce-closeup-low-focus.mp4,PT00H00M10S,070051_070100,"Double dipping chicken crossie into sweet chili sauce, closeup, low focus"
1016525599,https://ak.picdn.net/shutterstock/videos/1016525599/preview/stock-footage-raindrops-on-green-leaves-rain-in-the-forest.mp4,PT00H00M17S,070551_070600,"Raindrops on green leaves, rain in the forest."
1063369864,https://ak.picdn.net/shutterstock/videos/1063369864/preview/stock-footage-phoenix-arizona-december-active-senior-woman-works-out-in-a-gym.mp4,PT00H00M09S,116051_116100,"Phoenix, arizona, december 1, 2020: active senior woman works out in a gym "
1024876760,https://ak.picdn.net/shutterstock/videos/1024876760/preview/stock-footage-elegant-woman-legs-on-high-heels-walk-into-building-with-nice-furniture-shot-on-arri-alexa-k.mp4,PT00H00M22S,089451_089500,Elegant woman legs on high heels walk into building with nice furniture - shot on arri alexa 4k
1034766029,https://ak.picdn.net/shutterstock/videos/1034766029/preview/stock-footage-closeup-of-geranium-flowers-on-a-balcony-on-a-rainy-day-in-summer.mp4,PT00H00M34S,108351_108400,Closeup of geranium flowers on a balcony on a rainy day in summer 
1007709799,https://ak.picdn.net/shutterstock/videos/1007709799/preview/stock-footage-chicken-carries-an-gold-egg-on-a-green-screen.mp4,PT00H00M11S,065951_066000,Chicken carries an gold egg on a green screen
24199159,https://ak.picdn.net/shutterstock/videos/24199159/preview/stock-footage-concept-pet-care-and-accessorieses-on-white-background-top-view.mp4,PT00H00M14S,101101_101150,Concept pet care and accessorieses on white background top view
27360238,https://ak.picdn.net/shutterstock/videos/27360238/preview/stock-footage-awe-inspiring-space-flight-d-animation-over-hawaii.mp4,PT00H00M08S,031151_031200,Awe-inspiring space flight 3d animation over hawaii
1011144698,https://ak.picdn.net/shutterstock/videos/1011144698/preview/stock-footage-kyiv-ukraine-february-model-on-the-catwalk-models-trend-style-fashion-industry.mp4,PT00H00M15S,172401_172450,"Kyiv, ukraine - february 5, 2017. model on the catwalk. models. trend, style. fashion industry. catwalk. fashion show. model. models. "
3948518,https://ak.picdn.net/shutterstock/videos/3948518/preview/stock-footage-a-hand-draws-a-yes-word-on-a-sheet-of-paper-using-a-red-felt-tip-pen-marker-macro-shot.mp4,PT00H00M10S,178701_178750,A hand draws a yes (word) on a sheet of paper using a red felt tip pen - marker. macro shot.
18829937,https://ak.picdn.net/shutterstock/videos/18829937/preview/stock-footage-marine-fish-in-the-aquarium.mp4,PT00H00M12S,194801_194850,Marine fish in the aquarium
713161,https://ak.picdn.net/shutterstock/videos/713161/preview/stock-footage-hotel-with-lake.mp4,PT00H00M16S,007751_007800,Hotel with lake
3078331,https://ak.picdn.net/shutterstock/videos/3078331/preview/stock-footage-a-mother-and-her-daughter-are-working-on-a-laptop-while-father-and-son-are-browsing-the-internet-on.mp4,PT00H00M15S,185001_185050,A mother and her daughter are working on a laptop while father and son are browsing the internet on a digital tablet
1047779755,https://ak.picdn.net/shutterstock/videos/1047779755/preview/stock-footage-people-shopping-in-grocery-store-side-view-of-focused-men-and-woman-holding-shopping-baskets-and.mp4,PT00H00M27S,175851_175900,People shopping in grocery store. side view of focused men and woman holding shopping baskets and choosing fresh fruits and vegetables in supermarket. shopping concept
1019546278,https://ak.picdn.net/shutterstock/videos/1019546278/preview/stock-footage-a-waterfall-of-water-in-iceland.mp4,PT00H00M24S,092951_093000,A waterfall of water in iceland.
23735173,https://ak.picdn.net/shutterstock/videos/23735173/preview/stock-footage-dentist-s-hands-closeup-clean-oral-cavity-of-the-patient.mp4,PT00H00M12S,109001_109050,Dentist's hands closeup clean oral cavity of the patient
1011678179,https://ak.picdn.net/shutterstock/videos/1011678179/preview/stock-footage-slow-motion-close-shot-of-a-woman-s-hand-placing-a-small-oregano-herb-plant-into-a-hole-in-the.mp4,PT00H00M12S,177901_177950,Slow motion close shot of a woman’s hand placing a small oregano herb plant into a hole in the soil.
43231,https://ak.picdn.net/shutterstock/videos/43231/preview/stock-footage-mullet-mullus-surmuletus-triglia-shot-captured-in-the-wild-in.mp4,PT00H00M14S,127501_127550,Mullet -  â€œmullus surmuletusâ€� (â€œtrigliaâ€�). shot captured in the wild in the mediterranean sea (italy) by 3ccd camcorder - pal system.
1035911138,https://ak.picdn.net/shutterstock/videos/1035911138/preview/stock-footage-long-dense-streak-of-dynamic-wispy-smoke-flying-from-bottom-frame-on-black-background.mp4,PT00H00M18S,102601_102650,Long dense streak of dynamic wispy smoke flying from bottom frame on black background
1022110834,https://ak.picdn.net/shutterstock/videos/1022110834/preview/stock-footage-animation-growth-of-abstract-charts-with-changing-values-of-check-points-on-dark-background.mp4,PT00H00M20S,073951_074000,Animation growth of abstract charts with changing values of check points on dark background. animation of seamless loop.
1029004565,https://ak.picdn.net/shutterstock/videos/1029004565/preview/stock-footage-plaosan-temple-in-plaosan-complex-temple-one-of-the-javanese-buddhist-temples-located-in-bugisan.mp4,PT00H00M09S,041251_041300,"Plaosan temple in plaosan complex temple. one of the javanese buddhist temples located in bugisan village, prambanan, klaten regency near yogyakarta, central java, indonesia."
1050773152,https://ak.picdn.net/shutterstock/videos/1050773152/preview/stock-footage-wooden-boat-near-the-shore-in-a-quiet-river.mp4,PT00H00M13S,190501_190550,Wooden boat near the shore in a quiet river
20782624,https://ak.picdn.net/shutterstock/videos/20782624/preview/stock-footage-events-in-ljubljana-julij-avgust-a-young-girl-is-trying-to-shoot-and-she-misses-the-target-a.mp4,PT00H00M08S,120651_120700,Events in ljubljana julij-avgust 2016 a young girl is trying to shoot and she misses the target. a man tries to help her a bit. close-up shot.
1033130606,https://ak.picdn.net/shutterstock/videos/1033130606/preview/stock-footage-purple-fire-flashes-of-festive-fireworks-in-the-night-sky.mp4,PT00H00M07S,080201_080250,Purple fire flashes of festive fireworks in the night sky
1050130444,https://ak.picdn.net/shutterstock/videos/1050130444/preview/stock-footage-girl-laying-on-the-grass-with-her-feet-and-enjoying-on-a-beautiful-sunny-day.mp4,PT00H00M13S,117751_117800,Girl laying on the grass with her feet and enjoying on a beautiful sunny day
1036599707,https://ak.picdn.net/shutterstock/videos/1036599707/preview/stock-footage-aerial-view-of-the-castle-burg-alt-eberstein-and-the-village-eberstein-in-summer-on-an-sunny-day-in.mp4,PT00H00M26S,018301_018350,Aerial view of the castle burg alt-eberstein and the village eberstein in summer on an sunny day in the morning. pan to the right behind the castle.
25542686,https://ak.picdn.net/shutterstock/videos/25542686/preview/stock-footage-wedding-cake-with-flowers-wedding-at-the-sea-in-montenegro.mp4,PT00H00M05S,031051_031100,Wedding cake with flowers. wedding at the sea in montenegro.
1047920794,https://ak.picdn.net/shutterstock/videos/1047920794/preview/stock-footage-girl-stands-background-construction-site-skyscrapers-cranes-grimaces-waves-hand.mp4,PT00H00M26S,002151_002200,"Girl stands background construction site skyscrapers cranes, grimaces waves hand"
22309504,https://ak.picdn.net/shutterstock/videos/22309504/preview/stock-footage-stunning-hillside-sweep.mp4,PT00H00M22S,019351_019400,Stunning hillside sweep
1016957476,https://ak.picdn.net/shutterstock/videos/1016957476/preview/stock-footage-antelope-in-south-dakota.mp4,PT00H00M08S,133401_133450,Antelope in south dakota
1015416805,https://ak.picdn.net/shutterstock/videos/1015416805/preview/stock-footage-little-girl-feeds-a-goat-on-a-farm.mp4,PT00H00M14S,116301_116350,Little girl feeds a goat on a farm
9491573,https://ak.picdn.net/shutterstock/videos/9491573/preview/stock-footage-chef-gives-dry-pasta-on-stand-after-production.mp4,PT00H00M16S,054201_054250,Chef gives dry pasta on stand  - after production 
12011420,https://ak.picdn.net/shutterstock/videos/12011420/preview/stock-footage-passing-close-to-stromboli-volcano-shot-from-cruise-ship.mp4,PT00H00M19S,043501_043550,"Passing close to stromboli volcano, shot from cruise ship
"
1008049777,https://ak.picdn.net/shutterstock/videos/1008049777/preview/stock-footage-young-woman-in-black-bikini-in-a-sea-at-the-beach.mp4,PT00H00M07S,088551_088600,Young woman in black bikini in a sea at the beach
21234247,https://ak.picdn.net/shutterstock/videos/21234247/preview/stock-footage-fly-over-pine-forest.mp4,PT00H00M18S,172051_172100,Fly-over pine forest
31526506,https://ak.picdn.net/shutterstock/videos/31526506/preview/stock-footage-herd-of-forest-buffaloes-in-congo.mp4,PT00H00M12S,041151_041200,Herd of forest buffaloes in congo
10381994,https://ak.picdn.net/shutterstock/videos/10381994/preview/stock-footage-sunlight-through-clouds-time-lapse.mp4,PT00H00M30S,080451_080500,Sunlight through clouds 04 time lapse
15539116,https://ak.picdn.net/shutterstock/videos/15539116/preview/stock-footage-a-young-guy-is-talking-on-the-phone-and-he-is-having-his-feet-on-the-table-he-is-very-relaxed-and.mp4,PT00H00M26S,124301_124350,A young guy is talking on the phone and he is having his feet on the table. he is very relaxed and he is also opening his shirt. wide-angle shot.
30187042,https://ak.picdn.net/shutterstock/videos/30187042/preview/stock-footage-aerial-tracking-shot-of-cars-passing-on-a-large-arched-bridge.mp4,PT00H00M14S,001751_001800,Aerial tracking shot of cars passing on a large arched bridge
1042228492,https://ak.picdn.net/shutterstock/videos/1042228492/preview/stock-footage-the-brandenburg-gate-pariser-platz-berlin-germany-february-people-tourists-and.mp4,PT00H00M13S,026551_026600,"The brandenburg gate, pariser platz, berlin, germany – 18 february 2019, people, tourists and students during the day by the brandenburg gate, berlin, germany"
9022708,https://ak.picdn.net/shutterstock/videos/9022708/preview/stock-footage-east-river-nw-views-ice-aerial-after-the-record-cold-winter.mp4,PT00H00M19S,076801_076850,"East river nw views ice aerial, after the record 2015 cold winter."
1035861158,https://ak.picdn.net/shutterstock/videos/1035861158/preview/stock-footage-lot-of-doves-eat-food-on-the-street-feeding-pigeons-on-the-sidewalk-in-the-park-flock-of-pigeons.mp4,PT00H00M16S,121401_121450,Lot of doves eat food on the street. feeding pigeons on the sidewalk in the park. flock of pigeons eating corn grain and bread on the square in town. group of wild birds are eating and flying
14350750,https://ak.picdn.net/shutterstock/videos/14350750/preview/stock-footage-blue-eye-opening-and-looking-at-futuristic-interface.mp4,PT00H00M15S,139751_139800,Blue eye opening and looking at futuristic interface
23211064,https://ak.picdn.net/shutterstock/videos/23211064/preview/stock-footage-painting-of-hair-brunette-closeup.mp4,PT00H00M07S,077351_077400,Painting of hair brunette closeup
15446329,https://ak.picdn.net/shutterstock/videos/15446329/preview/stock-footage-close-up-of-female-hands-opening-kitchen-cabinet-door-and-taking-the-biggest-knife-from-their.mp4,PT00H00M09S,020251_020300,Close up of female hands opening kitchen cabinet door and taking the biggest knife from their.
10348853,https://ak.picdn.net/shutterstock/videos/10348853/preview/stock-footage-businessman-comparing-results-on-cellphone-and-papers-on-the-sofa.mp4,PT00H00M28S,059951_060000,"Businessman comparing results on cellphone and papers on the sofa
"
4660901,https://ak.picdn.net/shutterstock/videos/4660901/preview/stock-footage-beautiful-heart-shape-fireworks.mp4,PT00H00M24S,183001_183050,Beautiful heart shape fireworks
1046604127,https://ak.picdn.net/shutterstock/videos/1046604127/preview/stock-footage-a-group-of-common-gallinule-feeding-on-a-big-lagoon.mp4,PT00H00M31S,071001_071050,A group of common gallinule feeding on a big lagoon.
1009674116,https://ak.picdn.net/shutterstock/videos/1009674116/preview/stock-footage-ocean-wave-hit-on-the-beach.mp4,PT00H00M14S,181551_181600,Ocean wave hit on the beach
1062522079,https://ak.picdn.net/shutterstock/videos/1062522079/preview/stock-footage-electronics-construction-electricity-accident-safety-household-concept-close-up-of-male.mp4,PT00H00M59S,105251_105300,"Electronics, construction, electricity, accident, safety, household concept - close-up of male hands with a chipper screwdriver destroys the plaster. repair of electrical wiring after a short circuit"
1053480776,https://ak.picdn.net/shutterstock/videos/1053480776/preview/stock-footage-view-of-burnsall-and-its-well-known-bridge-in-wharfedale-yorkshire-dales-national-park-north.mp4,PT00H00M34S,060451_060500,"View of burnsall, and its well known bridge in wharfedale, yorkshire dales national park, north yorkshire, england, britain,"
19182544,https://ak.picdn.net/shutterstock/videos/19182544/preview/stock-footage-brasilia-brazil-circa-february-view-of-buildings-planalto-palace-presidential-office-and.mp4,PT00H00M22S,138051_138100,"Brasilia, brazil. circa february, 2016. view of buildings planalto palace (presidential office) and federal senate, in brasilia, brazil."
1007176732,https://ak.picdn.net/shutterstock/videos/1007176732/preview/stock-footage-man-in-coat-and-gloves-uses-a-mobile-phone-on-a-winter-day-in-the-forest.mp4,PT00H00M08S,014801_014850,Man in coat and gloves uses a mobile phone on a winter day in the forest
16781635,https://ak.picdn.net/shutterstock/videos/16781635/preview/stock-footage-green-abstract-background-gold-light-and-ray-and-particles-loop.mp4,PT00H00M20S,033751_033800,"Green abstract background, gold light and ray and particles, loop"
15170230,https://ak.picdn.net/shutterstock/videos/15170230/preview/stock-footage-hue-vietnam-february-pan-across-the-inside-of-the-citadel-in-hue-vietnam.mp4,PT00H00M07S,075551_075600,"Hue/vietnam - february 2010: pan across the inside of the citadel in hue, vietnam"
1018572433,https://ak.picdn.net/shutterstock/videos/1018572433/preview/stock-footage-a-blue-and-white-light-line-moves-horizontally-from-left-to-right-loop-in-the-center-of-the-screen.mp4,PT00H00M07S,105901_105950,A blue and white light line moves horizontally from left to right. loop. in the center of the screen
1028406515,https://ak.picdn.net/shutterstock/videos/1028406515/preview/stock-footage-songkhla-thailand-february-red-supply-boat-transfer-cargo-to-oil-and-gas-industry-and.mp4,PT00H00M37S,144051_144100,"Songkhla, thailand-february 19, 2019 : red supply boat transfer cargo to oil and gas industry and moving cargo from the boat to the platform. boat is waiting transfer cargo and crews to platform."
1058877946,https://ak.picdn.net/shutterstock/videos/1058877946/preview/stock-footage-tracking-shot-of-a-microscope-on-neutral-background.mp4,PT00H00M10S,187501_187550,Tracking shot of a microscope on neutral background
10341401,https://ak.picdn.net/shutterstock/videos/10341401/preview/stock-footage-group-of-three-female-friends-meeting-at-caf-x-e-for-a-chat-in-slow-motion-shot-on-sony-fs-at.mp4,PT00H00M26S,073851_073900,Group of three female friends meeting at caf\x8e for a chat in slow motion.shot on sony fs700 at frame rate of 50fps
17356078,https://ak.picdn.net/shutterstock/videos/17356078/preview/stock-footage-cute-red-maine-coon-kitten-eating-at-home.mp4,PT00H00M18S,066851_066900,Cute red maine coon kitten eating at home
29116999,https://ak.picdn.net/shutterstock/videos/29116999/preview/stock-footage-man-prepares-grill-for-the-barbecue-outdoors.mp4,PT00H00M15S,018151_018200,Man prepares grill for the barbecue outdoors
21126265,https://ak.picdn.net/shutterstock/videos/21126265/preview/stock-footage-neon-glowing-figures.mp4,PT00H00M20S,041651_041700,Neon glowing figures
15491755,https://ak.picdn.net/shutterstock/videos/15491755/preview/stock-footage-fried-chestnut-heap-closeup-on-frying-pan-in-sunny-day-street-fast-food-diversity.mp4,PT00H00M05S,013151_013200,"Fried chestnut heap closeup on frying pan in sunny day, street fast-food diversity"
32412040,https://ak.picdn.net/shutterstock/videos/32412040/preview/stock-footage-close-up-of-soap-bubbles-at-party-hands-put-the-rings-into-soapy-liquid-for-blowing-bubbles.mp4,PT00H00M14S,171451_171500,Close-up of soap bubbles at party. hands put the rings into soapy liquid for blowing bubbles
1023841090,https://ak.picdn.net/shutterstock/videos/1023841090/preview/stock-footage-steadicam-shot-of-a-doctor-in-safety-glasses-conducting-laser-hair-removal-under-the-armpit-of-a.mp4,PT00H00M20S,038501_038550,Steadicam shot of a doctor in safety glasses conducting laser hair removal under the armpit of a sexy young woman lying on a table in a beauty salon
1027927250,https://ak.picdn.net/shutterstock/videos/1027927250/preview/stock-footage-an-elderly-woman-of-european-appearance-in-the-home-interior-female-portrait-senior-woman-smiling.mp4,PT00H00M12S,075251_075300,An elderly woman of european appearance in the home interior. female portrait. senior woman smiling. close up
20904112,https://ak.picdn.net/shutterstock/videos/20904112/preview/stock-footage-potomac-river-rushing-by-harpers-ferry-sun-flare-tilting-down-k.mp4,PT00H00M20S,077451_077500,"Potomac river rushing by harpers ferry sun flare tilting down, 4k"
1041547462,https://ak.picdn.net/shutterstock/videos/1041547462/preview/stock-footage-provocative-woman-lying-on-belly-in-lace-lingerie-sensual-girl-moving-hips-in-erotic-underwear-in.mp4,PT00H00M13S,008001_008050,Provocative woman lying on belly in lace lingerie. sensual girl moving hips in erotic underwear in slow motion. sexy girl buttocks in lingerie. sexy woman posing on bed
1014929338,https://ak.picdn.net/shutterstock/videos/1014929338/preview/stock-footage-amazing-sango-sands-beach-at-durness-in-the-scottish-highlands.mp4,PT00H00M11S,069251_069300,Amazing sango sands beach at durness in the scottish highlands
1062208723,https://ak.picdn.net/shutterstock/videos/1062208723/preview/stock-footage-young-man-animation-wearing-warm-clothes-while-riding-sled-dog-at-the-snowy-park-shot-in-k.mp4,PT00H00M08S,198601_198650,Young man animation wearing warm clothes while riding sled dog at the snowy park. shot in 4k resolution
18563702,https://ak.picdn.net/shutterstock/videos/18563702/preview/stock-footage-a-british-leader-gives-a-political-speech-a-choir-sings-in-the-church-and-soldiers-fight-in-the.mp4,PT00H01M16S,137301_137350,"A british leader gives a political speech, a choir sings in the church and soldiers fight in the 1940s. (1940s)"
1053071477,https://ak.picdn.net/shutterstock/videos/1053071477/preview/stock-footage-a-lot-of-beautiful-saguaro-cactus-at-a-rocky-mountain-saguaro-national-park-tucson-usa-panorama.mp4,PT00H00M12S,005401_005450,"A lot of beautiful saguaro cactus at a rocky mountain. saguaro national park, tucson, usa. panorama right to left."
1028205269,https://ak.picdn.net/shutterstock/videos/1028205269/preview/stock-footage-portrait-successful-blond-man-in-glasses-sitting-in-a-light-comfortable-office-with-netbook-at-the.mp4,PT00H00M23S,170751_170800,Portrait successful blond man in glasses sitting in a light comfortable office with netbook at the table signing documents which colleagues brought to him. two girls in formal wear standing on either
1025780759,https://ak.picdn.net/shutterstock/videos/1025780759/preview/stock-footage-scientist-conducting-meat-quality-test-dripping-liquid-on-glass-asf-outbreak.mp4,PT00H00M09S,014451_014500,"Scientist conducting meat quality test, dripping liquid on glass, asf outbreak"
1018275820,https://ak.picdn.net/shutterstock/videos/1018275820/preview/stock-footage-two-young-funny-girls-are-walking-on-city-streets-throwing-small-stones-and-dancing.mp4,PT00H00M21S,033401_033450,"Two young funny girls are walking on city streets, throwing small stones and dancing"
9657377,https://ak.picdn.net/shutterstock/videos/9657377/preview/stock-footage-spring-time-cherry-blossoms.mp4,PT00H00M09S,019001_019050,Spring time cherry blossoms
5802938,https://ak.picdn.net/shutterstock/videos/5802938/preview/stock-footage-tarakan-indonesia-dec-the-iluk-pegelungan-colossal-dance-at-the-event-iraw-tengkayu.mp4,PT00H00M25S,108151_108200,"Tarakan, indonesia - dec 22 : the iluk pegelungan colossal dance  at the event iraw tengkayu festival on dec 22, 2013 at amal beach tarakan, indonesia "
24816506,https://ak.picdn.net/shutterstock/videos/24816506/preview/stock-footage-a-young-man-falls-asleep-sitting-on-the-sofa.mp4,PT00H00M21S,072001_072050,A young man falls asleep sitting on the sofa
11235977,https://ak.picdn.net/shutterstock/videos/11235977/preview/stock-footage-fireworks-display-in-festival-and-event.mp4,PT00H00M59S,021851_021900,Fireworks display in festival and event
1024306205,https://ak.picdn.net/shutterstock/videos/1024306205/preview/stock-footage-pomeranian-dog-sit-on-the-vacuum-cleaner-cross-at-home.mp4,PT00H00M47S,099051_099100,Pomeranian dog sit on the vacuum cleaner cross at home
20955553,https://ak.picdn.net/shutterstock/videos/20955553/preview/stock-footage-young-happy-woman-taking-selfie-on-mobile-phone.mp4,PT00H00M19S,005851_005900,"Young happy woman taking selfie on mobile phone

"
5519621,https://ak.picdn.net/shutterstock/videos/5519621/preview/stock-footage--k-aerial-shot-of-central-london-with-view-of-the-river-thames-london-eye-shard-waterloo-station.mp4,PT00H00M10S,014051_014100,"4k aerial shot of central london with view of the river thames, london eye, shard, waterloo station, canary wharf, southbank centre"
1020202,https://ak.picdn.net/shutterstock/videos/1020202/preview/stock-footage-dna-strand.mp4,PT00H00M10S,171751_171800,Dna strand.
1042650205,https://ak.picdn.net/shutterstock/videos/1042650205/preview/stock-footage-beautiful-young-female-working-on-laptop-in-home-office-young-freelancer-working-from-home.mp4,PT00H00M17S,005851_005900,Beautiful young female working on laptop in home office. young freelancer working from home.
1010006090,https://ak.picdn.net/shutterstock/videos/1010006090/preview/stock-footage-shakir-bahrain-circa-december-bahrain-international-circuit-world-endurance-championship.mp4,PT00H00M11S,113451_113500,"Shakir, bahrain. circa december 2015: bahrain international circuit - world endurance championship 2015. this is where it takes place every year the formula one race."
1022724655,https://ak.picdn.net/shutterstock/videos/1022724655/preview/stock-footage-girl-doing-yoga-on-a-white-background-healthy-lifestyle-workout-at-home.mp4,PT00H00M14S,078401_078450,"Girl doing yoga on a white background, healthy lifestyle, workout at home"
1014810911,https://ak.picdn.net/shutterstock/videos/1014810911/preview/stock-footage-granada-spain-april-torre-de-la-vela-seen-from-alcazaba-s-ruins-alhambra.mp4,PT00H00M15S,081301_081350,"Granada, spain - april, 2017: torre de la vela seen from alcazaba's ruins, alhambra."
25968674,https://ak.picdn.net/shutterstock/videos/25968674/preview/stock-footage-aerial-footage-of-oil-palm-plantation.mp4,PT00H00M12S,076501_076550,Aerial footage of oil palm plantation.
1056617954,https://ak.picdn.net/shutterstock/videos/1056617954/preview/stock-footage-close-up-of-woman-spraying-houseplant-with-water-sprayer-at-home.mp4,PT00H00M08S,122851_122900,Close up of woman spraying houseplant with water sprayer at home
