videoid,contentUrl,duration,page_dir,name
1025180798,https://ak.picdn.net/shutterstock/videos/1025180798/preview/stock-footage-young-scientists-girls-talk-about-plans-for-conducting-experiments-view-through-the-transparent.mp4,PT00H00M15S,171551_171600,Young scientists girls talk about plans for conducting experiments. view through the transparent walls of the science lab.
2902366,https://ak.picdn.net/shutterstock/videos/2902366/preview/stock-footage-montreal-skyline-taken-from-atop-mount-royal.mp4,PT00H00M18S,129451_129500,Montreal skyline taken from atop mount royal
28776943,https://ak.picdn.net/shutterstock/videos/28776943/preview/stock-footage-thai-student-girl-blowing-bubbles-at-park.mp4,PT00H00M29S,119251_119300,Thai student girl blowing bubbles at park
23838286,https://ak.picdn.net/shutterstock/videos/23838286/preview/stock-footage-the-shadow-of-a-balloon-of-hot-air-projected-on-the-ground-filmed-from-the-balloon-itself.mp4,PT00H00M10S,172901_172950,"The shadow of a balloon of hot air projected on the ground, filmed from the balloon itself"
1051130452,https://ak.picdn.net/shutterstock/videos/1051130452/preview/stock-footage-woman-hiking-backpacker-traveler-camper-walking-on-the-top-of-mountain-in-sunny-day-under-sun-light.mp4,PT00H00M21S,013601_013650,"Woman hiking backpacker traveler camper walking on the top of mountain in sunny day under sun light. beautiful mountain landscape view. 4k slow motion video
"
1058470126,https://ak.picdn.net/shutterstock/videos/1058470126/preview/stock-footage-blumenau-city-santa-catarina-aerial-video-brazil.mp4,PT00H00M12S,036651_036700,Blumenau city santa catarina aerial video brazil
1018598089,https://ak.picdn.net/shutterstock/videos/1018598089/preview/stock-footage-diverse-business-people-meeting-brainstorming-woman-leader-discussing-ideas-for-finance.mp4,PT00H00M19S,143351_143400,Diverse business people meeting brainstorming woman leader discussing ideas for finance presentation project professional team collaborating together in office boardroom planning startup strategy
1020233023,https://ak.picdn.net/shutterstock/videos/1020233023/preview/stock-footage-close-up-pan-shot-africa-mercy-surgeon-assistant-lying-patient-in-light-blue-protective.mp4,PT00H00M14S,066151_066200,"Close up, pan shot, africa mercy. surgeon, assistant, lying patient,  in light blue  protective wear, white hand gloves, bright light focused on patient's face, holding and clamping, tube,  instrume"
1032643862,https://ak.picdn.net/shutterstock/videos/1032643862/preview/stock-footage-a-big-bird-in-the-stork-family-common-in-southern-asia-and-now-endangered-due-to-habitat-loss-food.mp4,PT00H00M15S,176401_176450,"A big bird in the stork family common in southern asia and now endangered due to habitat loss. food source is carrion, offal, fish, an opportunistic bird in which it can eat anything available."
23839714,https://ak.picdn.net/shutterstock/videos/23839714/preview/stock-footage-professional-hairdresser-stylist-doing-hairstyle-for-young-pretty-woman-and-using-hair-spray-in.mp4,PT00H00M09S,187451_187500,"Professional hairdresser, stylist doing hairstyle for young pretty woman and using hair spray in white make up room. beauty and haircare concept"
1066667746,https://ak.picdn.net/shutterstock/videos/1066667746/preview/stock-footage-troubled-senior-man-looking-at-bathroom-mirror-suffering-mental-illness.mp4,PT00H00M26S,000051_000100,Troubled senior man looking at bathroom mirror suffering mental illness
1056840980,https://ak.picdn.net/shutterstock/videos/1056840980/preview/stock-footage-india-independence-day-celebration-with-couple-silhouette-d-animation.mp4,PT00H00M12S,195001_195050,India independence day celebration with couple silhouette- 2d animation
1013701229,https://ak.picdn.net/shutterstock/videos/1013701229/preview/stock-footage--hawksbill-turtle-eretmochelys-imbricata-face-close-up-divers-in-background-philippines.mp4,PT00H00M17S,120201_120250,"
hawksbill turtle (eretmochelys imbricata) face close up - divers in background - philippines"
1033397993,https://ak.picdn.net/shutterstock/videos/1033397993/preview/stock-footage-bearded-young-happy-man-is-splashing-on-swimming-pool-on-vacation-in-tropical-island.mp4,PT00H00M18S,081751_081800,Bearded young happy man is splashing on swimming pool on vacation in tropical island.
6786865,https://ak.picdn.net/shutterstock/videos/6786865/preview/stock-footage-overhead-shot-of-landscaping-in-progress.mp4,PT00H00M08S,034351_034400,Overhead shot of landscaping in progress
12832172,https://ak.picdn.net/shutterstock/videos/12832172/preview/stock-footage-money.mp4,PT00H00M06S,100601_100650,Money
1049503054,https://ak.picdn.net/shutterstock/videos/1049503054/preview/stock-footage-confectioner-woman-decorates-cupcakes-on-the-kitchen.mp4,PT00H00M26S,052201_052250,Confectioner woman decorates cupcakes. on the kitchen
426562,https://ak.picdn.net/shutterstock/videos/426562/preview/stock-footage-mother-and-son-make-a-snowball.mp4,PT00H00M14S,149451_149500,Mother and son make a snowball 
1041200809,https://ak.picdn.net/shutterstock/videos/1041200809/preview/stock-footage-close-up-vagrant-man-collect-money-for-shelter-food-life-depends-on-money-homeless-person-on.mp4,PT00H00M18S,024801_024850,"Close up vagrant man collect money for shelter, food. life depends on money. homeless person on street"
1013247383,https://ak.picdn.net/shutterstock/videos/1013247383/preview/stock-footage-uneven-cracked-british-roads-in-the-northwest-of-england.mp4,PT00H00M08S,067701_067750,Uneven cracked british roads in the northwest of england.
14502487,https://ak.picdn.net/shutterstock/videos/14502487/preview/stock-footage-disability-a-disabled-child-being-cared-for-by-a-special-needs-carer-using-specialist-equipment.mp4,PT00H00M17S,186351_186400,Disability a disabled child being cared for by a special needs carer using specialist equipment / working together with disability care
6265460,https://ak.picdn.net/shutterstock/videos/6265460/preview/stock-footage-hd-p-young-woman-talking-on-cellphone-on-train-station-part.mp4,PT00H00M42S,059301_059350,Hd1080p50 young woman talking on cellphone on train station. part 2.
1007821336,https://ak.picdn.net/shutterstock/videos/1007821336/preview/stock-footage-the-man-is-eating-chinese-instant-noodles-with-a-fork-k.mp4,PT00H00M15S,197001_197050,The man is eating chinese instant noodles with a fork 4k
1052036863,https://ak.picdn.net/shutterstock/videos/1052036863/preview/stock-footage-distinct-imprint-of-snowmobile-endless-track-path-into-the-distance-on-clean-snow-field-on-small.mp4,PT00H00M39S,103351_103400,Distinct imprint of snowmobile / endless track path into the distance on clean snow field on small mount at winter sunny frozen day - aerial drone view
1042892851,https://ak.picdn.net/shutterstock/videos/1042892851/preview/stock-footage-hands-holding-bunch-of-dollar-money-in-white-background-studio.mp4,PT00H00M09S,027401_027450,Hands holding bunch of dollar money in white background studio
23751664,https://ak.picdn.net/shutterstock/videos/23751664/preview/stock-footage-working-d-printer-isolated-on-white-background-k-video-process-of-printing-three-dimensional.mp4,PT00H00M16S,130751_130800,Working 3d printer isolated on white background 4k video. process of printing three dimensional model: extruder creates object. additive manufacturing device machine technology concept
1039464686,https://ak.picdn.net/shutterstock/videos/1039464686/preview/stock-footage-happy-diverse-newly-wed-couple-walking-and-kissing-together-on-a-sunny-country-road-in-slow-motion.mp4,PT00H00M12S,023051_023100,"Happy diverse newly wed couple walking and kissing together on a sunny country road in slow motion, dream wedding moments, multi ethnic marriage scene"
30532240,https://ak.picdn.net/shutterstock/videos/30532240/preview/stock-footage-woman-typing-in-slow-motion.mp4,PT00H00M34S,070901_070950,Woman typing in slow motion
1026160835,https://ak.picdn.net/shutterstock/videos/1026160835/preview/stock-footage-sunset-over-the-mountains-in-golden-hour.mp4,PT00H00M10S,132401_132450,Sunset over the mountains in golden hour
1055893076,https://ak.picdn.net/shutterstock/videos/1055893076/preview/stock-footage-geneva-switzerland-june-sunny-day-geneva-city-lakeside-walking-bay-yacht-dock-panorama.mp4,PT00H00M05S,186901_186950,"Geneva, switzerland - june 30 2019: sunny day geneva city lakeside walking bay yacht dock panorama 4k timelapse circa june 30 2019 geneva, switzerland."
1019794267,https://ak.picdn.net/shutterstock/videos/1019794267/preview/stock-footage-lovely-middle-aged-woman-in-the-summer-park-or-farm-laughing-mature-woman-an-women-smiling-k.mp4,PT00H00M19S,102451_102500,Lovely middle aged woman in the summer park or farm. laughing mature woman. an women smiling. 4k. cinematic premium video.
1065616444,https://ak.picdn.net/shutterstock/videos/1065616444/preview/stock-footage-black-gamer-in-white-hoodie-and-with-headphones-playing-games-on-computer-in-the-evening-he-is.mp4,PT00H00M11S,042001_042050,Black gamer in white hoodie and with headphones playing games on computer in the evening. he is passionate and smiled.
1031982104,https://ak.picdn.net/shutterstock/videos/1031982104/preview/stock-footage-panning-shot-of-a-woman-walking-and-shooting-with-an-action-cam-in-the-autumn-forest-slow-motion.mp4,PT00H00M18S,081651_081700,Panning shot of a woman walking and shooting with an action cam in the autumn forest. slow-motion
1014420113,https://ak.picdn.net/shutterstock/videos/1014420113/preview/stock-footage-beautiful-indian-lady-under-a-tree-waits-for-lover-contemplating-worried-thinks-broods-with-fern-in.mp4,PT00H00M21S,145301_145350,Beautiful indian lady under a tree waits for lover contemplating worried thinks broods with fern in hand fidgety nervous clandestine meeting point date outdoor summer hot sun sunlight nature handheld 
21633595,https://ak.picdn.net/shutterstock/videos/21633595/preview/stock-footage-sexy-woman-dressed-in-fetish-latex-top-this-video-has-been-distorted-with-video-effects.mp4,PT00H00M23S,055501_055550,Sexy woman dressed in fetish latex top. this video has been distorted with video effects
31957120,https://ak.picdn.net/shutterstock/videos/31957120/preview/stock-footage--s-united-states-crab-scavenges-for-food-on-sea-floor-scavenger-title-octopus-catches-crab.mp4,PT00H00M21S,084051_084100,1940s: united states: crab scavenges for food on sea floor. scavenger title. octopus catches crab.
10823003,https://ak.picdn.net/shutterstock/videos/10823003/preview/stock-footage-moscow-city-business-centre-russia.mp4,PT00H00M45S,087101_087150,"Moscow city business centre, russia"
13354982,https://ak.picdn.net/shutterstock/videos/13354982/preview/stock-footage-blurry-lights-changing-color-abstract-background.mp4,PT00H00M11S,071701_071750,Blurry lights changing color - abstract background
24279173,https://ak.picdn.net/shutterstock/videos/24279173/preview/stock-footage-aerial-panorama-of-beautiful-tropical-sea-with-many-boats-resort-beach-and-town-from-birds-eye.mp4,PT00H00M46S,074551_074600,"Aerial panorama of beautiful tropical sea with many boats, resort beach and town from birds eye view, patong beach, phuket island, thailand"
4529888,https://ak.picdn.net/shutterstock/videos/4529888/preview/stock-footage-handsome-man-giving-thumbs-up-on-white-screen-in-slow-motion.mp4,PT00H00M10S,176451_176500,Handsome man giving thumbs up on white screen in slow motion
1021201645,https://ak.picdn.net/shutterstock/videos/1021201645/preview/stock-footage-bao-loc-lam-dong-vietnam-november-crowd-of-tea-farmer-picking-tea-leaf-on-plantation.mp4,PT00H00M13S,174701_174750,"Bao loc, lam dong, vietnam - november 2018:crowd of tea farmer picking tea leaf on plantation, vietnamese farmer working on sunny day, green scene of farm, row of tree, top view with tea hills."
1052985287,https://ak.picdn.net/shutterstock/videos/1052985287/preview/stock-footage-dutch-belgian-border-may-belgian-police-officer-wearing-gloves-checks-documents-and.mp4,PT00H00M09S,025251_025300,"Dutch belgian border – 6 may 2020: belgian police officer wearing gloves checks documents and identity card of driver passing border with the netherlands, temporary travel restrictions europe"
1044935443,https://ak.picdn.net/shutterstock/videos/1044935443/preview/stock-footage-close-up-male-great-hornbill-buceros-bicornis-perching-on-the-tree-in-the-forest-in-daytime-and.mp4,PT00H00M33S,011551_011600,Close up male great hornbill (buceros bicornis) perching on the tree in the forest in daytime and sunshine rest  at khao yai national park thailand asia.
23353405,https://ak.picdn.net/shutterstock/videos/23353405/preview/stock-footage-girl-in-a-pink-coat-with-phone-walks-on-a-modern-city-background-of-skyscrapers.mp4,PT00H00M06S,029051_029100,Girl in a pink coat with phone walks on a modern city. background of skyscrapers
1025143061,https://ak.picdn.net/shutterstock/videos/1025143061/preview/stock-footage-aerial-view-of-surfers-paradise-beach-waterfront-city-skyscraper-resort-hotels-and-condominiums.mp4,PT00H00M29S,144401_144450,Aerial view of surfers paradise beach waterfront city skyscraper resort hotels and condominiums gold coast esplanade shoreline queensland australia
6917779,https://ak.picdn.net/shutterstock/videos/6917779/preview/stock-footage-leak-water-from-pipeline.mp4,PT00H00M12S,037251_037300,Leak water from pipeline
1057808389,https://ak.picdn.net/shutterstock/videos/1057808389/preview/stock-footage-chania-view-of-the-promenade-coast-and-old-town-of-chania-crete-greece.mp4,PT00H00M23S,197851_197900,"Chania, 08.2020 - view of the promenade, coast and old town of chania, crete, greece"
15375301,https://ak.picdn.net/shutterstock/videos/15375301/preview/stock-footage-exercise-woman-stretching-on-beach-fitness-sport-model-smiling-happy-stretching-legs-during.mp4,PT00H00M25S,088151_088200,Exercise woman stretching on beach. fitness sport model smiling happy stretching legs during outdoor work out on sunny summer day. beautiful mixed race asian chinese / caucasian girl training outside
1008594589,https://ak.picdn.net/shutterstock/videos/1008594589/preview/stock-footage-ho-chi-minh-city-viet-nam-feb-ben-binh-dong-binh-dong-harbour-in-lunar-new-year-with.mp4,PT00H00M12S,078201_078250,"Ho chi minh city, viet nam - 13 feb, 2018: ben binh dong (binh dong harbour) in lunar new year with flower boats along side the river, sai gon, viet nam"
1028544728,https://ak.picdn.net/shutterstock/videos/1028544728/preview/stock-footage-triangles-geometric-abstract-animation-d-render-art-concept.mp4,PT00H00M10S,033351_033400,Triangles. geometric abstract animation. 3d render. art concept.
1048973962,https://ak.picdn.net/shutterstock/videos/1048973962/preview/stock-footage-view-mountain-range-in-rainy-day-clouds-covered-peaks-and-green-slope-with-alpine-meadow.mp4,PT00H00M14S,008051_008100,View mountain range in rainy day. clouds covered peaks and green slope with alpine meadow. beautiful highland nature landscape without people full of calm and tranquility
33117238,https://ak.picdn.net/shutterstock/videos/33117238/preview/stock-footage-epic-aerial-flight-over-sand-rock-formations-beautiful-summer-green-trees-golden-hour-sunset-colors.mp4,PT00H00M27S,085951_086000,Epic aerial flight over sand rock formations beautiful summer green trees golden hour sunset colors spirituality inspiration travel concept
1054731386,https://ak.picdn.net/shutterstock/videos/1054731386/preview/stock-footage-staccato-backward-ceiling-animated-checker-motion-background-seamless-loop.mp4,PT00H00M05S,064301_064350,Staccato backward ceiling animated checker motion background seamless loop
18886334,https://ak.picdn.net/shutterstock/videos/18886334/preview/stock-footage-young-girl-with-laptop-working-outdoor.mp4,PT00H00M13S,182501_182550,Young girl with laptop working outdoor
1007892301,https://ak.picdn.net/shutterstock/videos/1007892301/preview/stock-footage-slow-motion-shot-of-a-beautiful-stone-beach-and-sunset-waves-in-the-ocean.mp4,PT00H01M00S,063001_063050,Slow motion shot of a beautiful stone beach and sunset waves in the ocean
1031387906,https://ak.picdn.net/shutterstock/videos/1031387906/preview/stock-footage-stork-feeds-the-chicks-in-the-nest-against-the-sky-spring-season-in-the-countryside.mp4,PT00H00M46S,111501_111550,Stork feeds the chicks in the nest against the sky. spring season in the countryside.
21815980,https://ak.picdn.net/shutterstock/videos/21815980/preview/stock-footage-rome-italy-june-th-view-of-column-of-trajan-it-was-erected-in-ad-in-honor-of-emperor.mp4,PT00H00M20S,062251_062300,"Rome-italy, june 29th, 2016: view of column of trajan. it was erected in 113 ad in honor of emperor trajan. rome. italy."
1017587992,https://ak.picdn.net/shutterstock/videos/1017587992/preview/stock-footage-drone-flying-over-massive-white-rock-formation-with-big-hole-tourist-walking-over-in-arizona.mp4,PT00H00M10S,187551_187600,"Drone flying over massive white rock formation with big hole, tourist walking over in arizona mountain desert landscape."
1024619429,https://ak.picdn.net/shutterstock/videos/1024619429/preview/stock-footage-neon-red-sign-love-hanging-on-a-brick-wall-with-bulbs.mp4,PT00H00M07S,066851_066900,Neon red sign love hanging on a brick wall with bulbs
4851137,https://ak.picdn.net/shutterstock/videos/4851137/preview/stock-footage-sri-lankan-wild-elephant-is-grazing-in-the-lake.mp4,PT00H00M12S,091851_091900,Sri lankan wild elephant is grazing in the lake.
1025415104,https://ak.picdn.net/shutterstock/videos/1025415104/preview/stock-footage-saint-petersburg-russia-march-crowd-of-people-visiting-the-gardens-of-peterhof-palace-with.mp4,PT00H00M18S,196251_196300,"Saint petersburg, russia, march 2019: crowd of people visiting the gardens of peterhof palace with golden fountains"
4655135,https://ak.picdn.net/shutterstock/videos/4655135/preview/stock-footage-couple-in-fall-sit-on-porch-with-coffee.mp4,PT00H00M29S,115251_115300,Couple in fall sit on porch with coffee
2635796,https://ak.picdn.net/shutterstock/videos/2635796/preview/stock-footage-people-snorkeling-in-aruba.mp4,PT00H00M06S,048951_049000,People snorkeling in aruba
1019576848,https://ak.picdn.net/shutterstock/videos/1019576848/preview/stock-footage-beautiful-woman-in-bikini-sunbathing-in-swimming-pool-summer-resort-vacation.mp4,PT00H00M07S,012801_012850,"Beautiful woman in bikini sunbathing in swimming pool, summer resort, vacation"
33564727,https://ak.picdn.net/shutterstock/videos/33564727/preview/stock-footage-portrait-of-little-baby-child-businessman-in-home-office-successful-confident-business-kid-smiling.mp4,PT00H00M20S,036751_036800,Portrait of little baby child businessman in home office. successful confident business kid smiling and working on laptop
27059140,https://ak.picdn.net/shutterstock/videos/27059140/preview/stock-footage-dhaka-bangladesh-may-young-boy-is-working-in-construction-by-carrying-a-big-pile-of.mp4,PT00H00M24S,027751_027800,"Dhaka, bangladesh - may 20, 2017: young boy is working in construction by carrying a big pile of bricks on his head"
1056385058,https://ak.picdn.net/shutterstock/videos/1056385058/preview/stock-footage-close-up-table-set-for-breakfast-fork-and-knife-on-a-napkin-a-bottle-of-olive-oil-and-herbs-in-a.mp4,PT00H00M39S,067551_067600,"Close up table set for breakfast. fork and knife on a napkin, a bottle of olive oil and herbs in a bowl"
1015219963,https://ak.picdn.net/shutterstock/videos/1015219963/preview/stock-footage-close-up-shot-of-a-person-preparing-patties-on-a-grilling-grid.mp4,PT00H00M24S,089101_089150,Close-up shot of a person preparing patties on a grilling grid
1008921872,https://ak.picdn.net/shutterstock/videos/1008921872/preview/stock-footage--d-moon-loopable.mp4,PT00H00M17S,110901_110950,"3d moon, loopable"
11077988,https://ak.picdn.net/shutterstock/videos/11077988/preview/stock-footage-healthy-lunch-whole-fried-sea-sunfish-on-wooden-table-with-lemons-peppers-and-tomatoes-and.mp4,PT00H00M20S,063901_063950,Healthy lunch : whole fried sea sunfish on wooden table with lemons peppers and tomatoes and rosemary twig 1920x1080 intro motion slow hidef hd
1030504121,https://ak.picdn.net/shutterstock/videos/1030504121/preview/stock-footage-smiling-young-couple-making-heart-shape-with-hands-happy-african-american-woman-and-caucasian-man.mp4,PT00H00M13S,182551_182600,Smiling young couple making heart shape with hands. happy african american woman and caucasian man gesturing outdoor. relationship and dating concept
10806290,https://ak.picdn.net/shutterstock/videos/10806290/preview/stock-footage-cook-beans-steamed-with-chilli-and-onion-and-pepper.mp4,PT00H00M29S,194601_194650,Cook beans steamed with chilli and onion and pepper
1024969841,https://ak.picdn.net/shutterstock/videos/1024969841/preview/stock-footage-pregnant-woman-looking-and-pats-her-belly-on-the-bed.mp4,PT00H00M15S,191701_191750,Pregnant woman looking and pats her belly on the bed
1051855360,https://ak.picdn.net/shutterstock/videos/1051855360/preview/stock-footage-aerial-drone-view-urban-slums-in-the-capital-of-tunisia-tunis-neighbourhood-close-to-the-city.mp4,PT00H00M16S,109801_109850,"Aerial drone view: urban slums in the capital of tunisia - tunis . neighbourhood close to the city center - lake side, tunisia from the sky"
32162572,https://ak.picdn.net/shutterstock/videos/32162572/preview/stock-footage-close-up-of-male-massagist-s-hands-massaging-attractive-lady-s-back-beautiful-young-woman-is-lying.mp4,PT00H00M07S,069751_069800,Close-up of male massagist's hands massaging attractive lady's back. beautiful young woman is lying on the couch at luxury spa salon and getting a massage.
1063004140,https://ak.picdn.net/shutterstock/videos/1063004140/preview/stock-footage-traditional-village-cakov-in-autumn-day-czech-republic.mp4,PT00H00M27S,185451_185500,Traditional village cakov in autumn day. czech republic
20882839,https://ak.picdn.net/shutterstock/videos/20882839/preview/stock-footage-small-creek-with-waterfalls-in-the-autumn.mp4,PT00H00M33S,110501_110550,Small creek with waterfalls in the autumn.
264793,https://ak.picdn.net/shutterstock/videos/264793/preview/stock-footage-three-dice-fall-on-the-ground-they-show-one-two-and-three-points-lost-pal.mp4,PT00H00M09S,189901_189950,"Three dice fall on the ground. they show one, two and three points - lost - pal "
16567486,https://ak.picdn.net/shutterstock/videos/16567486/preview/stock-footage-rome-italy-apr-asian-korean-girl-tourists-typing-sliding-smart-phones-at-night-in-rome.mp4,PT00H00M10S,057001_057050,"Rome, italy - apr 27, 2016: asian korean girl tourists typing sliding smart phones at night in rome italy"
1022058709,https://ak.picdn.net/shutterstock/videos/1022058709/preview/stock-footage-hong-kong-may-aerial-view-of-causeway-bay-district-city-downtown-with-residential-and.mp4,PT00H00M12S,199851_199900,"Hong kong - may 2018: aerial view of causeway bay district, city downtown with residential and business buildings and skyscrapers, hight-density development, drone shot in 4k"
1040168552,https://ak.picdn.net/shutterstock/videos/1040168552/preview/stock-footage-animation-of-snowflakes-falling-and-santa-claus-on-green-background.mp4,PT00H00M10S,103151_103200,Animation of snowflakes falling and santa claus on green background
26205647,https://ak.picdn.net/shutterstock/videos/26205647/preview/stock-footage-hand-of-woman-pointing-against-green-screen.mp4,PT00H00M14S,045701_045750,Hand of woman pointing against green screen
1054477610,https://ak.picdn.net/shutterstock/videos/1054477610/preview/stock-footage-fisherman-enjoying-fishing-with-a-gorgeous-landscape-in-the-background.mp4,PT00H00M13S,141501_141550,Fisherman enjoying fishing with a gorgeous landscape in the background
1014683843,https://ak.picdn.net/shutterstock/videos/1014683843/preview/stock-footage-happy-girl-dancing-and-jumping-against-blue-sky-in-sunny-day.mp4,PT00H00M12S,115601_115650,Happy girl dancing and jumping against blue sky in sunny day.
27724000,https://ak.picdn.net/shutterstock/videos/27724000/preview/stock-footage-portrait-of-a-cute-smiling-teen-girl-on-a-night-city-street-blowing-soap-bubbles.mp4,PT00H00M38S,043451_043500,Portrait of a cute smiling teen girl on a night city street blowing soap bubbles
1047421330,https://ak.picdn.net/shutterstock/videos/1047421330/preview/stock-footage-universal-countdown-film-leader-bright-colors-countdown-clock-from-to-effect-of-old-film.mp4,PT00H00M15S,185501_185550,"Universal countdown film leader. bright colors. countdown clock from 8 to 2. effect of old film rolling with details, scratches, markers and grain. vintage, retro strip. intro. film burn 4k fx effect"
1040563544,https://ak.picdn.net/shutterstock/videos/1040563544/preview/stock-footage-young-girl-rolling-dough-for-italian-pizza-on-culinary-class-in-cooking-school-happy-girl.mp4,PT00H00M11S,088251_088300,Young girl rolling dough for italian pizza on culinary class in cooking school. happy girl preparing round circle for pie on cooking class in bakery school. cooking education in school
1022133325,https://ak.picdn.net/shutterstock/videos/1022133325/preview/stock-footage-reveal-drone-footage-from-burleigh-heads-looking-to-surfers-paradise-and-broadbeach-gold-coast.mp4,PT00H00M38S,099101_099150,"Reveal drone footage from burleigh heads looking to surfers paradise and broadbeach, gold coast, australia"
15336442,https://ak.picdn.net/shutterstock/videos/15336442/preview/stock-footage-sandblasting-metal-parts.mp4,PT00H00M05S,024751_024800,Sandblasting metal parts
1033592822,https://ak.picdn.net/shutterstock/videos/1033592822/preview/stock-footage-butterfly-flies-slow-motion-adult-butterflies-orange-black-wings-and-fly-on-a-lavender-flower-in.mp4,PT00H00M10S,195901_195950,Butterfly flies slow motion. adult butterflies orange black wings and fly on a lavender flower in the morning. this is the beautiful nature of the summer season.
