videoid,contentUrl,duration,page_dir,name
1018941880,https://ak.picdn.net/shutterstock/videos/1018941880/preview/stock-footage--slow-motion-close-up-horizontal-pan-of-a-birch-blowing-in-the-wind.mp4,PT00H00M16S,058201_058250,[slow motion] [close up] horizontal pan of a birch blowing in the wind
1056097445,https://ak.picdn.net/shutterstock/videos/1056097445/preview/stock-footage-close-up-of-african-american-business-woman-explaining-something-with-tablet-sitting-in-a-modern.mp4,PT00H00M26S,147701_147750,Close up of african american business woman explaining something with tablet sitting in a modern office
9261290,https://ak.picdn.net/shutterstock/videos/9261290/preview/stock-footage-sentjur-slovenia-october-bee-keeper-smokes-the-bees-to-continue-his-work-slow-motion.mp4,PT00H00M17S,187651_187700,"Sentjur, slovenia - october 2014: bee keeper smokes the bees to continue his work. slow motion footage of a bee keeper smoking up the bees sow he can continue his work in to the beehive."
1016633197,https://ak.picdn.net/shutterstock/videos/1016633197/preview/stock-footage-unrecognizable-feet-of-baby-girl-walking-in-autumn-park-covered-with-yellow-leaves-close-up-of.mp4,PT00H00M14S,034601_034650,"Unrecognizable feet of baby girl walking in autumn park covered with yellow leaves. close-up of feet in shoes, walking outdoors in nature. girl enjoying autumn weather, wearing stylish shoes."
1044382078,https://ak.picdn.net/shutterstock/videos/1044382078/preview/stock-footage-tokyo-tower-sky-tree-evening.mp4,PT00H00M08S,149401_149450,Tokyo tower sky tree evening
17986582,https://ak.picdn.net/shutterstock/videos/17986582/preview/stock-footage-beautiful-young-woman-blowing-glitter-confetti-in-slow-motion-on-the-beach-at-sunset.mp4,PT00H00M15S,003551_003600,Beautiful young woman blowing glitter confetti in slow motion on the beach at sunset
2581832,https://ak.picdn.net/shutterstock/videos/2581832/preview/stock-footage-happy-family-hug-mother-and-daughter-pointing-finger-to-landscape-view-in-mountain-over-the-sea.mp4,PT00H00M23S,079701_079750,Happy family hug mother and daughter pointing finger to landscape view in mountain over the sea talking and smiling to each other
22780381,https://ak.picdn.net/shutterstock/videos/22780381/preview/stock-footage-abbey-st-hildegard-in-the-vineyard-benedictine-nuns-diocese-of-limburg-eibingen-near-r-desheim.mp4,PT00H00M27S,177351_177400,"Abbey st. hildegard in the vineyard, benedictine nuns, diocese of limburg, eibingen near rüdesheim, hesse, germany. jul 2016"
32020549,https://ak.picdn.net/shutterstock/videos/32020549/preview/stock-footage-bangkok-thailand-february-a-lot-of-tourist-at-erawan-shrine-at-bangkok-fisheye-view-on.mp4,PT00H00M17S,187151_187200,"Bangkok thailand - 26 february 2015: a lot of tourist at erawan shrine at bangkok (fisheye view) on 26 february, 2015. erawan shrine is one of the most popular traveling places in thailand
"
32807827,https://ak.picdn.net/shutterstock/videos/32807827/preview/stock-footage-eureka-springs-arkansas-usa-november-pov-point-view-of-city-driving-on-the-streets.mp4,PT00H00M17S,003701_003750,"Eureka springs, arkansas, usa - november 10, 2017. pov. point view of city. driving on the streets. scenic view from car."
1009130444,https://ak.picdn.net/shutterstock/videos/1009130444/preview/stock-footage-time-lapse-of-setting-sun-through-thick-storm-clouds-over-the-ocean.mp4,PT00H00M08S,036451_036500,Time lapse of setting sun through thick storm clouds over the ocean
1010172989,https://ak.picdn.net/shutterstock/videos/1010172989/preview/stock-footage-green-northern-lights-dancing-over-the-sea-aurora-borealis-over-fjord-northern-lights-on-the.mp4,PT00H00M06S,193951_194000,"Green northern lights dancing over the sea, aurora borealis over fjord. northern lights on the arctic sky, aurora borealis, nive clear weather, colour skies in horizon."
1015608598,https://ak.picdn.net/shutterstock/videos/1015608598/preview/stock-footage-burrowing-owl-lands-on-prairie-dog-town-on-summer-day-near-burrows.mp4,PT00H00M08S,022851_022900,Burrowing owl lands on prairie dog town on summer day near burrows
19344844,https://ak.picdn.net/shutterstock/videos/19344844/preview/stock-footage-white-clouds-and-blue-sky-timelaspe.mp4,PT00H00M11S,114601_114650,"White clouds and blue sky (timelaspe)
"
16269184,https://ak.picdn.net/shutterstock/videos/16269184/preview/stock-footage-florence-cathedral-on-christmas-panorama-from-right-to-left.mp4,PT00H00M21S,145801_145850,Florence cathedral on christmas panorama from right to left
1037175065,https://ak.picdn.net/shutterstock/videos/1037175065/preview/stock-footage-crypto-currency-bitcoin-btc-golden-bit-coin-against-british-united-kingdom-union-jack-flag.mp4,PT00H00M10S,062501_062550,"Crypto currency bitcoin btc golden bit coin against british united kingdom union jack flag background. virtual money, blockchain business, internet finances concept"
1017030442,https://ak.picdn.net/shutterstock/videos/1017030442/preview/stock-footage-angry-mature-bald-businessman-complaining-to-someone-against-wooden-table.mp4,PT00H00M13S,128801_128850,Angry mature bald businessman complaining to someone against wooden table
1034858744,https://ak.picdn.net/shutterstock/videos/1034858744/preview/stock-footage-dozen-eggs-in-egg-carton-slides-from-left-to-right-from-above.mp4,PT00H00M05S,115601_115650,Dozen eggs in egg carton slides from left to right from above.
1045154263,https://ak.picdn.net/shutterstock/videos/1045154263/preview/stock-footage-basketball-changing-room-locker-room-all-the-kit-or-uniform-is-laid-out-ready-for-the-players.mp4,PT00H00M29S,140151_140200,Basketball changing room / locker room. all the kit or uniform is laid out ready for the players. camera dolly motion.
6535358,https://ak.picdn.net/shutterstock/videos/6535358/preview/stock-footage-sunrise-mist-richmond-cranberry-field-cranberry-field-workers-arrive-at-dawn-to-start-work.mp4,PT00H00M29S,045051_045100,"Sunrise mist, richmond cranberry field. cranberry field workers arrive at dawn to start work. richmond, british columbia, canada."
1040096936,https://ak.picdn.net/shutterstock/videos/1040096936/preview/stock-footage-epic-aerial-flight-over-mist-forres.mp4,PT00H00M10S,020701_020750,Epic aerial flight over mist forres
27191455,https://ak.picdn.net/shutterstock/videos/27191455/preview/stock-footage-time-lapse-of-opening-pink-chinese-rose-hibiscus-a-in-png-format-with-alpha-transparency.mp4,PT00H00M30S,107201_107250,"Time-lapse of opening pink chinese rose (hibiscus) 2a1 in png+ format with alpha transparency channel isolated on black background
"
1052732417,https://ak.picdn.net/shutterstock/videos/1052732417/preview/stock-footage-time-lapse-traffic-lights-at-phaya-thai-during-the-night-time-landmark-of-bangkok-thailand.mp4,PT00H00M06S,189101_189150,"Time lapse traffic lights at phaya thai during the night time. 
landmark of bangkok, thailand"
1008614602,https://ak.picdn.net/shutterstock/videos/1008614602/preview/stock-footage-businessman-uses-a-modern-smartphone-gadget-in-the-office-business-woman-enjoys-a-tablet-and-a.mp4,PT00H00M20S,077901_077950,Businessman uses a modern smartphone gadget in the office. business woman enjoys a tablet and a smartphone. printing on a modern laptop at an exhibition of advanced technologies and innovations. 
1052506201,https://ak.picdn.net/shutterstock/videos/1052506201/preview/stock-footage-young-man-texting-on-smartphone-sitting-in-cafe.mp4,PT00H00M14S,051151_051200,Young man texting on smartphone sitting in cafe
1031688392,https://ak.picdn.net/shutterstock/videos/1031688392/preview/stock-footage-girona-city-of-catalonia-spain-k-video.mp4,PT00H00M12S,040001_040050,"Girona, city of catalonia.spain. 4k video"
12782384,https://ak.picdn.net/shutterstock/videos/12782384/preview/stock-footage-toronto-ontario-canada-november-rush-hour-traffic-jam-and-gridlock-in-the-city-of-toronto-in.mp4,PT00H00M20S,010551_010600,"Toronto, ontario, canada november 2015 rush hour traffic jam and gridlock in the city of toronto in the rain
"
17597734,https://ak.picdn.net/shutterstock/videos/17597734/preview/stock-footage-moscow-may-juggler-performs-on-grass-in-park-luzhniki-during-yota-company-event-at.mp4,PT00H00M29S,014251_014300,"Moscow - may 26, 2016: juggler performs on grass in park luzhniki during yota company event at spring sunny day. aerial view"
1034026361,https://ak.picdn.net/shutterstock/videos/1034026361/preview/stock-footage-man-asleep-on-beach-towel-during-sunset-on-a-sandy-beach-in-the-caribbean.mp4,PT00H00M16S,180601_180650,Man asleep on beach towel during sunset on a sandy beach in the caribbean
33976702,https://ak.picdn.net/shutterstock/videos/33976702/preview/stock-footage-street-performer-play-instrument-at-harbor.mp4,PT00H00M10S,051751_051800,Street performer play instrument at harbor
27539845,https://ak.picdn.net/shutterstock/videos/27539845/preview/stock-footage-arabic-dessert-zalabya-with-honey-pouring-over-it.mp4,PT00H00M12S,191251_191300,Arabic dessert zalabya with honey pouring over it 
1017480328,https://ak.picdn.net/shutterstock/videos/1017480328/preview/stock-footage-young-man-thinking-then-having-an-idea-and-pointing-finger-up-at-copyspace-idea-concept-full-body.mp4,PT00H00M10S,037101_037150,Young man thinking then having an idea and pointing finger up at copyspace. idea concept. full body isolated on green screen background.
1060278197,https://ak.picdn.net/shutterstock/videos/1060278197/preview/stock-footage-super-sale-special-up-to-off-banner-sale-promo-banner-special-offer-sticker-hot-sale-campaign.mp4,PT00H00M07S,184451_184500,Super sale special up to 55% off banner. sale promo banner special offer sticker. hot sale campaign price tag for discount clearance. big sale online shopping. motion 4k footage
29020567,https://ak.picdn.net/shutterstock/videos/29020567/preview/stock-footage-portrait-of-happy-african-american-parents-and-son-wearing-colorful-clothing-holding-surfboard-on.mp4,PT00H00M15S,005401_005450,Portrait of happy african american parents and son wearing colorful clothing holding surfboard on beach vacation
11715029,https://ak.picdn.net/shutterstock/videos/11715029/preview/stock-footage-pan-of-traffic-on-manhattan-bridge-over-the-east-river.mp4,PT00H00M08S,016801_016850,Pan of traffic on manhattan bridge over the east river
1013589896,https://ak.picdn.net/shutterstock/videos/1013589896/preview/stock-footage-aerial-view-of-red-and-green-lighthouses-in-dun-laoghaire-dublin.mp4,PT00H00M30S,112601_112650,"Aerial view of red and green lighthouses in dun laoghaire, dublin"
28406431,https://ak.picdn.net/shutterstock/videos/28406431/preview/stock-footage--d-animation-rotation-of-symbol-of-animals-and-pets-from-glass-animation-of-seamless-loop.mp4,PT00H00M10S,122151_122200,3d animation rotation of symbol of animals and pets from glass. animation of seamless loop.
1017273637,https://ak.picdn.net/shutterstock/videos/1017273637/preview/stock-footage-attractive-young-woman-curls-her-hair-in-bathroom-mirror-behind-shot-rack-focus.mp4,PT00H00M11S,144201_144250,Attractive young woman curls her hair in bathroom mirror - behind shot - rack focus
1028461028,https://ak.picdn.net/shutterstock/videos/1028461028/preview/stock-footage-colony-of-pelicans-in-the-danube-delta-romania-aerial-photography.mp4,PT00H00M13S,080751_080800,"Colony of pelicans in the danube delta, romania (aerial photography)"
1066534690,https://ak.picdn.net/shutterstock/videos/1066534690/preview/stock-footage-dark-matter-fantasy-mandala-complex-strange-world-geometry-fractal-seamless-loop.mp4,PT00H00M20S,173951_174000,Dark matter fantasy mandala - complex strange world geometry fractal - seamless loop.
1011553193,https://ak.picdn.net/shutterstock/videos/1011553193/preview/stock-footage-close-up-of-the-caucasian-woman-in-the-plaid-shirt-and-vr-glasses-having-vr-headset-and-waving.mp4,PT00H00M19S,050351_050400,Close up of the caucasian woman in the plaid shirt and vr glasses having vr headset and waving hands while sitting on the sofa in the living room. indoor
1025185661,https://ak.picdn.net/shutterstock/videos/1025185661/preview/stock-footage-aerial-drone-view-of-boats-anchored-in-the-bay-with-clear-and-turquoise-water-on-the-sunset-boat.mp4,PT00H00M26S,136401_136450,"Aerial drone view of boats anchored in the bay with clear and turquoise water on the sunset. boat and yacht in the tropical lagoon. tropical landscape. el nido, palawan island, philippines."
1057159162,https://ak.picdn.net/shutterstock/videos/1057159162/preview/stock-footage-a-young-girl-is-engaged-in-a-scandinavian-walk-in-nature.mp4,PT00H00M09S,138801_138850,A young girl is engaged in a scandinavian walk in nature.
23108728,https://ak.picdn.net/shutterstock/videos/23108728/preview/stock-footage-egg-nog-cocktail-in-tall-glasses-on-the-tray-at-the-minibar.mp4,PT00H00M10S,013301_013350,Egg nog cocktail in tall glasses on the tray at the minibar.
1021674136,https://ak.picdn.net/shutterstock/videos/1021674136/preview/stock-footage-horse-spin-like-crazy-in-slow-motion-long-shot-hd-long-shot-of-horse-legs-in-focus-spinning-while.mp4,PT00H00M16S,124001_124050,Horse spin like crazy in slow motion long shot hd. long shot of horse legs in focus spinning while sand flying all around. riders sitting on the horse.
1042463839,https://ak.picdn.net/shutterstock/videos/1042463839/preview/stock-footage-beautiful-blooming-yellow-tulips-and-daffodils-in-the-spring-garden.mp4,PT00H00M08S,050551_050600,Beautiful blooming yellow tulips and daffodils in the spring garden
18051229,https://ak.picdn.net/shutterstock/videos/18051229/preview/stock-footage-mesh-fence-close-up.mp4,PT00H00M32S,059251_059300,Mesh fence close up
17017039,https://ak.picdn.net/shutterstock/videos/17017039/preview/stock-footage-aerial-footage-from-a-drone-shows-the-heroes-square-in-budapest-the-statue-complex-features-the.mp4,PT00H00M29S,149451_149500,"Aerial footage from a drone shows the heroes square in budapest. the statue complex features the most important hungarian kings and national leaders, as well as the tomb of the unknown soldier."
1040852477,https://ak.picdn.net/shutterstock/videos/1040852477/preview/stock-footage-jakarta-indonesia-sept-established-shot-of-driving-a-car-at-h-benyamin-sueb-street.mp4,PT00H00M32S,172351_172400,"Jakarta / indonesia - sept 30, 2019: established shot of driving a car at h. benyamin sueb street"
1051428517,https://ak.picdn.net/shutterstock/videos/1051428517/preview/stock-footage-fried-eating-asian-sushi-barbecue.mp4,PT00H00M10S,060801_060850,"Fried, eating, asian, sushi, barbecue"
12989990,https://ak.picdn.net/shutterstock/videos/12989990/preview/stock-footage-pan-of-shwedagon-pagoda-daytime-myanmar-burma-circa-august.mp4,PT00H00M15S,145201_145250,Pan of shwedagon pagoda daytime myanmar burma - circa august 2015
1046080681,https://ak.picdn.net/shutterstock/videos/1046080681/preview/stock-footage-brunette-woman-in-pullover-holding-cell-phone-and-coffee-listening-to-music-in-earplugs-dancing.mp4,PT00H00M12S,070001_070050,"Brunette woman in pullover holding cell phone and coffee, listening to music in earplugs, dancing enjoying favorite song, getting energy from caffeine. indoor studio shot isolated on gray background"
1029299693,https://ak.picdn.net/shutterstock/videos/1029299693/preview/stock-footage-view-from-a-flying-drone-line-of-white-sandy-beach-next-to-green-forest-and-blue-transparent-sea.mp4,PT00H00M12S,136801_136850,View from a flying drone. line of white sandy beach next to  green forest and blue transparent sea with many wooden piers. bright sunny day
1012036259,https://ak.picdn.net/shutterstock/videos/1012036259/preview/stock-footage-professional-chef-jumbles-food-via-spatula-close-up-of-the-wok-pan-with-mixed-colorful-vegetables.mp4,PT00H00M25S,145101_145150,Professional chef jumbles food via spatula. close-up of the wok pan with mixed colorful vegetables and chicken meat at the restaurant kitchen. 
1012724012,https://ak.picdn.net/shutterstock/videos/1012724012/preview/stock-footage-hand-touching-purple-flowers-in-beautiful-lavender-field-at-golden-sunset.mp4,PT00H00M11S,135601_135650,Hand touching purple flowers in beautiful lavender field at golden sunset
1020894664,https://ak.picdn.net/shutterstock/videos/1020894664/preview/stock-footage-businessman-hologram-concept-tech-poll.mp4,PT00H00M20S,013401_013450,Businessman hologram concept tech - poll
16112221,https://ak.picdn.net/shutterstock/videos/16112221/preview/stock-footage-the-process-of-slaughtering-and-butchering-sheep-in-kiev-ukraine.mp4,PT00H00M15S,069151_069200,"The process of slaughtering and butchering sheep in kiev, ukraine"
1008122926,https://ak.picdn.net/shutterstock/videos/1008122926/preview/stock-footage-aerial-view-of-old-settlement-beach-location-on-lord-howe-island-world-heritage-listed-paradise.mp4,PT00H00M26S,038651_038700,"Aerial view of old settlement beach location on lord howe island (world heritage-listed paradise) - new south wales - tasman sea - australia from above, 4k uhd"
5083793,https://ak.picdn.net/shutterstock/videos/5083793/preview/stock-footage-green-windows-and-white-walls-are-the-color-of-the-house-found-in-the-area-where-not-much-people-go.mp4,PT00H00M04S,188751_188800,Green windows and white walls are the color of the house found in the area where not much people go.
29388499,https://ak.picdn.net/shutterstock/videos/29388499/preview/stock-footage--d-animation-rotation-of-symbol-of-food-drink-cafe-restaurant-foodstuff-and-eating-from-glass.mp4,PT00H00M10S,133351_133400,"3d animation rotation of symbol of food, drink, cafe, restaurant, foodstuff and eating from glass. animation of seamless loop."
18569123,https://ak.picdn.net/shutterstock/videos/18569123/preview/stock-footage-white-glitter-background-winter-theme.mp4,PT00H00M20S,101901_101950,White glitter background winter theme
1022312416,https://ak.picdn.net/shutterstock/videos/1022312416/preview/stock-footage-new-year-and-yeepeng-festival-in-thailand-yee-peng-is-very-famus-in-china-taiwan-and-thailand.mp4,PT00H00M12S,112451_112500,"New year and yeepeng festival in thailand, yee peng is very famus in china, taiwan and thailand , loi krathong yee peng festival chiang mai lantern floating in the sky"
1006880017,https://ak.picdn.net/shutterstock/videos/1006880017/preview/stock-footage-the-second-book-of-the-kings.mp4,PT00H00M10S,114351_114400,The second book of the kings
6268898,https://ak.picdn.net/shutterstock/videos/6268898/preview/stock-footage-moscow-russia-dec-corridor-in-metropol-hotel-was-built-in-years.mp4,PT00H00M11S,035601_035650,"Moscow, russia - dec 4, 2012: corridor in metropol hotel was built in years 1899-1905."
27922495,https://ak.picdn.net/shutterstock/videos/27922495/preview/stock-footage-aerial-uhd-view-mid-air-flight-over-young-man-tourist-staying-on-a-suspension-bridge-and-watching.mp4,PT00H00M11S,182101_182150,Aerial uhd view. mid-air flight over young man tourist staying on a suspension bridge and watching. fresh mountain river at sunny summer day. vertical movement
1038223712,https://ak.picdn.net/shutterstock/videos/1038223712/preview/stock-footage-syntepon-production-yellow-rotating-pulley.mp4,PT00H00M10S,103851_103900,"Syntepon production, yellow rotating pulley"
1012459451,https://ak.picdn.net/shutterstock/videos/1012459451/preview/stock-footage-flag-of-sweden-is-moving-at-wide-jalousie-window-wide-angle-shot.mp4,PT00H00M47S,073551_073600,Flag of sweden is moving at wide jalousie window. wide angle shot
1017630448,https://ak.picdn.net/shutterstock/videos/1017630448/preview/stock-footage-panama-oct-pov-of-a-street-and-buildings-in-casco-viejo-in-panama-city-panama-casco.mp4,PT00H00M28S,126601_126650,"Panama - oct 7 2018: pov of a street and buildings in casco viejo in panama city panama. casco viejo is the historic district of panama city on oct 7, 2018."
26650378,https://ak.picdn.net/shutterstock/videos/26650378/preview/stock-footage-flowering-meadow-and-road-nature-and-civilization.mp4,PT00H00M21S,091751_091800,Flowering meadow and road. nature and civilization
1041710017,https://ak.picdn.net/shutterstock/videos/1041710017/preview/stock-footage-closeup-chopped-hard-cheese-toss-up-slow-motion-video.mp4,PT00H00M05S,027901_027950,Closeup chopped hard cheese toss up. slow motion video
8705071,https://ak.picdn.net/shutterstock/videos/8705071/preview/stock-footage-slim-girl-in-sundress-with-a-bouquet-of-lavender-is-walking-on-the-blossoming-field-of-lavender.mp4,PT00H00M19S,051001_051050,Slim girl in sundress with a bouquet of lavender is walking on the blossoming field of lavender
29835772,https://ak.picdn.net/shutterstock/videos/29835772/preview/stock-footage-aerial-view-of-bozcaada.mp4,PT00H00M10S,125351_125400,Aerial view of bozcaada
1012420163,https://ak.picdn.net/shutterstock/videos/1012420163/preview/stock-footage-hands-close-up-girl-chef-cuts-with-a-knife-ripe-juicy-tomato-around-the-table-are-vegetables.mp4,PT00H00M18S,189351_189400,"Hands close-up: girl chef cuts with a knife ripe juicy tomato. around the table are vegetables, herbs, spices. the girl is preparing a healthy lunch. cutting fresh vegetables, slow motion."
70807,https://ak.picdn.net/shutterstock/videos/70807/preview/stock-footage-lake-tahoe.mp4,PT00H00M10S,062201_062250,Lake tahoe
1044493966,https://ak.picdn.net/shutterstock/videos/1044493966/preview/stock-footage-kuching-sarawak-malaysia-january-the-bako-national-park-of-sarawak-borneo-island.mp4,PT00H00M21S,182701_182750,"Kuching, sarawak / malaysia - january 12, 2020: the bako national park of sarawak, borneo island, malaysia"
4702025,https://ak.picdn.net/shutterstock/videos/4702025/preview/stock-footage-galicia-sun-finially-time-lapse.mp4,PT00H00M10S,120651_120700,Galicia sun finially time lapse
18925772,https://ak.picdn.net/shutterstock/videos/18925772/preview/stock-footage-bokeh-background-night-bokeh-background-video-texture.mp4,PT00H00M18S,195201_195250,Bokeh background. night bokeh background video texture. 
19135435,https://ak.picdn.net/shutterstock/videos/19135435/preview/stock-footage-students-at-the-environmental-simulation-laboratory-on-the-berkley-university-campus-in-california.mp4,PT00H01M31S,186001_186050,Students at the environmental simulation laboratory on the berkley university campus in california during the 1980s simulate the feeling of moving through a city (1980s)
11627693,https://ak.picdn.net/shutterstock/videos/11627693/preview/stock-footage-aerial-flying-over-the-lake-mountains.mp4,PT00H00M20S,027051_027100,"Aerial: flying over the lake, mountains."
6412169,https://ak.picdn.net/shutterstock/videos/6412169/preview/stock-footage-blood-splatter.mp4,PT00H00M30S,081351_081400,Blood splatter 08
1027344977,https://ak.picdn.net/shutterstock/videos/1027344977/preview/stock-footage-the-traditional-japan-castle-building-bridge-and-lake-in-tokyo.mp4,PT00H00M16S,123701_123750,"The traditional japan castle building, bridge and lake in tokyo "
1015408114,https://ak.picdn.net/shutterstock/videos/1015408114/preview/stock-footage-abstract-animated-stained-background-seamless-loop-video-watercolor-effect-rainbow-full-colored.mp4,PT00H00M20S,103551_103600,Abstract animated stained background seamless loop video - watercolor effect - rainbow full colored spectrum - vivid 
31806541,https://ak.picdn.net/shutterstock/videos/31806541/preview/stock-footage-global-economy-animated-word-cloud-text-design-animation.mp4,PT00H00M20S,051301_051350,"Global economy animated word cloud, text design animation."
11793929,https://ak.picdn.net/shutterstock/videos/11793929/preview/stock-footage-asian-woman-upset-and-crying-in-her-bedroom-at-home.mp4,PT00H00M40S,072901_072950,Asian woman upset and crying in her bedroom at home
4899308,https://ak.picdn.net/shutterstock/videos/4899308/preview/stock-footage-a-man-jogs-by-the-miami-skyline.mp4,PT00H00M07S,069601_069650,A man jogs by the miami skyline.
1049065126,https://ak.picdn.net/shutterstock/videos/1049065126/preview/stock-footage-cars-driving-through-community-during-sunset.mp4,PT00H00M30S,074551_074600,Cars driving through community during sunset
1013462867,https://ak.picdn.net/shutterstock/videos/1013462867/preview/stock-footage-teen-girl-with-binocular-at-green-grass.mp4,PT00H00M15S,003451_003500,Teen girl with binocular at green grass
1022770309,https://ak.picdn.net/shutterstock/videos/1022770309/preview/stock-footage-sheep-grazing-at-sunset.mp4,PT00H00M06S,030651_030700,Sheep grazing at sunset.
1013751023,https://ak.picdn.net/shutterstock/videos/1013751023/preview/stock-footage-footage-of-a-living-room-led-tv-on-white-wall-with-wooden-table-and-plant-in-pot-showing-volleyball.mp4,PT00H00M10S,012951_013000,Footage of a living room led tv on white wall with wooden table and plant in pot showing volleyball game moment on 3d rendered sports stadium.
1026865691,https://ak.picdn.net/shutterstock/videos/1026865691/preview/stock-footage-istanbul-maltepe-bosphorus-aerial-view-marina-and-yachts.mp4,PT00H00M19S,069251_069300,Istanbul maltepe bosphorus aerial view marina and yachts
1010968496,https://ak.picdn.net/shutterstock/videos/1010968496/preview/stock-footage-traffic-light-red-change-green-scene-with-orange-dusk-sky-background.mp4,PT00H00M07S,081901_081950,"Traffic light red change green, scene with orange dusk sky background"
31696414,https://ak.picdn.net/shutterstock/videos/31696414/preview/stock-footage-circa-s-the-thermal-wave-and-the-blast-wave-from-an-atomic-bombing-burns-fences-at-the-nevada.mp4,PT00H00M39S,196051_196100,"Circa 1950s - the thermal wave and the blast wave from an atomic bombing burns fences at the nevada proving grounds, in 1954."
1016476639,https://ak.picdn.net/shutterstock/videos/1016476639/preview/stock-footage-armenia-azerbaijan-border-haut-karabakh-conflict-ruins-drone-aerial-view.mp4,PT00H00M55S,103251_103300,"Armenia azerbaijan border, haut karabakh conflict, ruins, drone aerial view"
