videoid,contentUrl,duration,page_dir,name
15298936,https://ak.picdn.net/shutterstock/videos/15298936/preview/stock-footage-japan-airlines-boeing-b-at-narita-airport-japan-january.mp4,PT00H00M30S,109851_109900,"Japan airlines boeing b777 at narita airport japan - january 5, 2015"
2006402,https://ak.picdn.net/shutterstock/videos/2006402/preview/stock-footage-tv-screen-static-with-blood.mp4,PT00H00M15S,177701_177750,Tv screen static with blood
1014575048,https://ak.picdn.net/shutterstock/videos/1014575048/preview/stock-footage-portrait-of-a-beautiful-sexy-smiling-happy-girl-with-big-full-lips-with-blond-hair.mp4,PT00H00M14S,000551_000600,Portrait of a beautiful sexy smiling happy girl with big full lips with blond hair
1008449173,https://ak.picdn.net/shutterstock/videos/1008449173/preview/stock-footage-birds-sitting-on-power-lines.mp4,PT00H00M10S,009801_009850,Birds sitting on power lines
1010056196,https://ak.picdn.net/shutterstock/videos/1010056196/preview/stock-footage-crypto-currency-gold-bitcoin-btc-bit-coins-lies-on-the-mirror-and-rotates-bitcoin-mining-concept.mp4,PT00H00M10S,128851_128900,"Crypto currency gold bitcoin, btc, bit coins lies on the mirror and rotates. bitcoin mining concept, block chain technology, monitor with financial diagram at background"
1044828121,https://ak.picdn.net/shutterstock/videos/1044828121/preview/stock-footage-dead-crows-are-eaten-by-turtles-and-fish-in-the-lake-film-grain-noise-motion-blur.mp4,PT00H00M15S,107401_107450,Dead crows are eaten by turtles and fish in the lake. film grain. noise. motion blur. 
1033469357,https://ak.picdn.net/shutterstock/videos/1033469357/preview/stock-footage-mother-breastfeeds-the-newborn-baby-close-up-shot.mp4,PT00H00M10S,020601_020650,Mother breastfeeds the newborn baby. close up shot.
1057143926,https://ak.picdn.net/shutterstock/videos/1057143926/preview/stock-footage-over-the-shoulder-shot-of-little-fisherman-spooling-a-fishing-reel-kid-catching-fish-summer.mp4,PT00H00M07S,198101_198150,"Over the shoulder shot of little fisherman spooling a fishing reel.  kid catching fish, summer outdoor activities "
8159890,https://ak.picdn.net/shutterstock/videos/8159890/preview/stock-footage-underwater-loop-able-d-animation-background.mp4,PT00H00M15S,064001_064050,Underwater loop-able 3d animation background
1023951977,https://ak.picdn.net/shutterstock/videos/1023951977/preview/stock-footage-flag-of-the-russian-federal-subject-of-perm-krai-russia-loop.mp4,PT00H00M20S,008401_008450,"Flag of the russian federal subject of perm krai, russia. loop"
1031286095,https://ak.picdn.net/shutterstock/videos/1031286095/preview/stock-footage-colorful-tulip-flowers-images-turkey.mp4,PT00H00M09S,030201_030250,"Colorful tulip flowers images, turkey"
1059516566,https://ak.picdn.net/shutterstock/videos/1059516566/preview/stock-footage-old-abandoned-car-in-the-middle-of-the-forest.mp4,PT00H00M11S,195301_195350,Old abandoned car in the middle of the forest
8629807,https://ak.picdn.net/shutterstock/videos/8629807/preview/stock-footage-stock-video-footage-x-abandoned-boat-retro-thai-longtail-long-tailed-boat-sea-vacation.mp4,PT00H00M22S,148651_148700,Stock video footage 1920x1080 abandoned boat retro thai longtail long-tailed boat sea vacation holiday travel asia sick old single piece of plate-boat sea vacation. wooden boats moored
1023981380,https://ak.picdn.net/shutterstock/videos/1023981380/preview/stock-footage-hands-of-bride-and-groom-close-up.mp4,PT00H00M09S,073801_073850,Hands of bride and groom close up
1055712638,https://ak.picdn.net/shutterstock/videos/1055712638/preview/stock-footage-slow-motion-footage-of-a-month-old-cattle-dog-pup-running.mp4,PT00H00M12S,065851_065900,Slow motion footage of a 4 month old cattle dog pup running.
1028254082,https://ak.picdn.net/shutterstock/videos/1028254082/preview/stock-footage-a-young-businessman-walking-down-the-street-and-happily-communicates-on-the-phone-call-a-cheerful.mp4,PT00H00M14S,029901_029950,A young businessman walking down the street and happily communicates on the phone call. a cheerful guy in a suit with a glass of coffee in his hand is smiling while talking on smartphone. 4k footage.
120577,https://ak.picdn.net/shutterstock/videos/120577/preview/stock-footage-black-ink.mp4,PT00H00M15S,089801_089850,Black ink 
1008323230,https://ak.picdn.net/shutterstock/videos/1008323230/preview/stock-footage-high-speed-train-leaving-railway-station-platform.mp4,PT00H00M20S,055151_055200,High speed train leaving railway station platform
5880518,https://ak.picdn.net/shutterstock/videos/5880518/preview/stock-footage-twinkling-led-lights-panel-loopable-clip.mp4,PT00H00M30S,023101_023150,Twinkling led lights panel - loopable clip
29045809,https://ak.picdn.net/shutterstock/videos/29045809/preview/stock-footage-arrows-stick-to-the-stela.mp4,PT00H00M08S,004101_004150,Arrows stick to the stela
1030330505,https://ak.picdn.net/shutterstock/videos/1030330505/preview/stock-footage-close-up-people-working-with-drying-tobacco.mp4,PT00H00M18S,007551_007600,Close up people working with drying tobacco
1025056256,https://ak.picdn.net/shutterstock/videos/1025056256/preview/stock-footage-pedicure-dead-skin-remover-foot-rasp-woman-the-process-of-creating-a-pedicure-beauty-and-pedicure.mp4,PT00H00M10S,112601_112650,Pedicure dead skin remover foot rasp woman. the process of creating a pedicure. beauty and pedicure salon. hardware pedicure.
1007623570,https://ak.picdn.net/shutterstock/videos/1007623570/preview/stock-footage-butterfly-on-a-flower-in-a-garden-in-a-natural-environment.mp4,PT00H00M15S,070101_070150,Butterfly on a flower in a garden in a natural environment.
34656550,https://ak.picdn.net/shutterstock/videos/34656550/preview/stock-footage-fireplace-in-the-house-firewood-burns-in-a-fireplace-a-fireplace-in-a-country-house.mp4,PT00H00M12S,032351_032400,Fireplace in the house. firewood burns in a fireplace. a fireplace in a country house
1016871475,https://ak.picdn.net/shutterstock/videos/1016871475/preview/stock-footage-in-the-kitchen-concept-the-family-decorates-the-pie-and-muffins-with-a-berry.mp4,PT00H00M10S,193051_193100,In the kitchen concept. the family decorates the pie and muffins with a berry.
1008399154,https://ak.picdn.net/shutterstock/videos/1008399154/preview/stock-footage-sparkling-stars-animation-loop-purple.mp4,PT00H00M10S,030751_030800,Sparkling stars animation - loop purple
11608091,https://ak.picdn.net/shutterstock/videos/11608091/preview/stock-footage-woman-lying-in-bed-on-the-phone.mp4,PT00H00M15S,137901_137950,Woman lying in bed on the phone
1015714255,https://ak.picdn.net/shutterstock/videos/1015714255/preview/stock-footage-colorful-vertical-motion-lines-on-wallpaper-or-curtain-background-digital-perfectly-loop-of.mp4,PT00H00M20S,052351_052400,Colorful vertical motion lines on wallpaper or curtain background. digital perfectly loop of abstract colorful vertical lines moving background
1026093605,https://ak.picdn.net/shutterstock/videos/1026093605/preview/stock-footage-a-windmill-grinder-in-zaanse-schans-netherlands.mp4,PT00H00M10S,049351_049400,"A windmill grinder in zaanse schans, netherlands."
2128034,https://ak.picdn.net/shutterstock/videos/2128034/preview/stock-footage-african-american-doctor-on-a-tablet.mp4,PT00H00M06S,184501_184550,African american doctor on a tablet
18802988,https://ak.picdn.net/shutterstock/videos/18802988/preview/stock-footage-mirdif-highway-dubai-medium-shot-of-traffic-stopped-at-a-junction-on-a-highway-in-dubai-dubai.mp4,PT00H00M06S,125601_125650,"Mirdif highway, dubai. medium shot of traffic stopped at a junction on a highway in dubai. (dubai, uae-2013)"
1038102524,https://ak.picdn.net/shutterstock/videos/1038102524/preview/stock-footage-young-woman-doing-meditation-while-wearing-vr-glasses-in-the-fitness-center-shot-in-k-resolution.mp4,PT00H00M12S,067601_067650,Young woman doing meditation while wearing vr glasses in the fitness center. shot in 4k resolution
18935210,https://ak.picdn.net/shutterstock/videos/18935210/preview/stock-footage-tottori-japan-skyline-at-night.mp4,PT00H00M12S,048901_048950,"Tottori, japan skyline at night."
1007459128,https://ak.picdn.net/shutterstock/videos/1007459128/preview/stock-footage-aerial-view-of-balneario-camboriu-city-cabras-island-sea-brazil.mp4,PT00H00M25S,139401_139450,"Aerial view of balneario camboriu city, cabras island, sea, brazil"
1035470069,https://ak.picdn.net/shutterstock/videos/1035470069/preview/stock-footage-america-circa-establishing-of-a-generic-small-local-restaurant-diner-or-cafe-in-a-small.mp4,PT00H00M10S,079351_079400,"America - circa 2018 - establishing of a generic small local restaurant, diner or cafe in a small american town."
10314470,https://ak.picdn.net/shutterstock/videos/10314470/preview/stock-footage-pouring-beer-in-big-glass.mp4,PT00H00M19S,134251_134300,Pouring beer in big glass 
1018080631,https://ak.picdn.net/shutterstock/videos/1018080631/preview/stock-footage-fitness-athletes-training-intense-workout-strong-men-exercise-together-using-weights-enjoying.mp4,PT00H00M16S,070301_070350,Fitness athletes training intense workout strong men exercise together using weights enjoying strength challenge in gym friends bodybuilding practice healthy lifestyle slow motion
482389,https://ak.picdn.net/shutterstock/videos/482389/preview/stock-footage-forgotten-teddy-bear-on-a-swing-under-rain-deep-depression-theme-black-and-white.mp4,PT00H00M26S,085601_085650,Forgotten teddy bear on a swing under rain. deep depression theme. black and white.
34566676,https://ak.picdn.net/shutterstock/videos/34566676/preview/stock-footage-sea-cliff-bridge-motorway-on-grand-pacific-drive-along-nsw-coast-on-a-sunny-summer-day-in-aerial.mp4,PT00H00M24S,062901_062950,"Sea cliff bridge motorway on grand pacific drive along nsw coast on a sunny summer day in aerial flying forward.
"
29899831,https://ak.picdn.net/shutterstock/videos/29899831/preview/stock-footage--d-animation-rotation-of-symbol-of-new-born-pregnancy-pregnant-woman-baby-children-family.mp4,PT00H00M20S,056051_056100,"3d animation rotation of symbol of new born, pregnancy, pregnant woman, baby, children, family, parents, childhood and mothers from glass. animation of seamless loop."
1016470774,https://ak.picdn.net/shutterstock/videos/1016470774/preview/stock-footage-alaska-cruise-galley-of-ship-man-decorates-cake.mp4,PT00H00M12S,133851_133900,"Alaska cruise, 1989, galley of ship, man decorates cake"
1017275674,https://ak.picdn.net/shutterstock/videos/1017275674/preview/stock-footage-young-man-chat-in-social-network-with-friends-using-phone-and-laptop-late-in-the-night.mp4,PT00H00M14S,080101_080150,Young man chat in social network with friends using phone and laptop late in the night
1041677632,https://ak.picdn.net/shutterstock/videos/1041677632/preview/stock-footage-aerial-view-the-beautiful-voringsfossen-waterfall-mabodalen-valley-norway-national-tourist.mp4,PT00H00M14S,001851_001900,"Aerial view the beautiful voringsfossen waterfall, mabodalen valley norway. national tourist hardangervidda route, eidfjord, hardangerfjord, norway."
1055330339,https://ak.picdn.net/shutterstock/videos/1055330339/preview/stock-footage-two-sisters-have-fun-before-going-on-vacation-and-ride-a-big-yellow-suitcase.mp4,PT00H00M20S,172751_172800,Two sisters have fun before going on vacation and ride a big yellow suitcase.
26536361,https://ak.picdn.net/shutterstock/videos/26536361/preview/stock-footage-father-turns-son-upside-down-holding-hands-against-the-window.mp4,PT00H00M09S,015401_015450,"Father turns son upside down, holding hands against the window"
1033953317,https://ak.picdn.net/shutterstock/videos/1033953317/preview/stock-footage-rotating-dollar-symbol-gold-d-looped-animation-golden-dollar-sign-isolated-on-white-background.mp4,PT00H00M12S,188001_188050,"Rotating dollar symbol gold, 3d looped animation, golden dollar sign isolated on white background - dci 4k "
1052158954,https://ak.picdn.net/shutterstock/videos/1052158954/preview/stock-footage-hamburg-germany-beauty-timelapse-hamburg-central-stasion-hauptbahnhof-hamburg-hbf.mp4,PT00H00M08S,009801_009850,"Hamburg, germany - 10.05.2020: beauty timelapse hamburg central stasion (hauptbahnhof, hamburg hbf.) very quiet in rush hour while corona pandemie"
719635,https://ak.picdn.net/shutterstock/videos/719635/preview/stock-footage-aerial-of-paradise-island-bridge.mp4,PT00H00M14S,113601_113650,Aerial of paradise island bridge
9559868,https://ak.picdn.net/shutterstock/videos/9559868/preview/stock-footage-old-red-court-house-and-dallas-skyline.mp4,PT00H00M30S,084051_084100,Old red court house and dallas skyline.
13710116,https://ak.picdn.net/shutterstock/videos/13710116/preview/stock-footage-sunset-at-mary-s-stones-in-dobrogea.mp4,PT00H00M13S,138151_138200,Sunset at mary's stones in dobrogea
1024224848,https://ak.picdn.net/shutterstock/videos/1024224848/preview/stock-footage-behind-the-squares-appears-the-symbol-star-of-david-in-out-alpha-channel-premultiplied-matted.mp4,PT00H00M23S,070451_070500,"Behind the squares appears the symbol star of david. in - out. alpha channel premultiplied - matted with color rgb (8,132,164)"
27866866,https://ak.picdn.net/shutterstock/videos/27866866/preview/stock-footage-the-doctor-in-white-robe-massages-the-client-in-hydrobath.mp4,PT00H00M06S,183201_183250,The doctor in white robe massages the client in hydrobath
30483361,https://ak.picdn.net/shutterstock/videos/30483361/preview/stock-footage-medium-panning-shot-of-fitness-instructor-leading-exercise-class-orem-utah-united-states.mp4,PT00H00M21S,112151_112200,"Medium panning shot of fitness instructor leading exercise class / orem, utah, united states"
9490502,https://ak.picdn.net/shutterstock/videos/9490502/preview/stock-footage-pretty-young-woman-with-blue-roses-in-her-hair-in-three-poses-with-a-beaming-smile-and-hands.mp4,PT00H00M27S,037801_037850,"Pretty young woman with blue roses in her hair in three poses - with a beaming smile and hands raised, smiling with her hands to her chin and looking aside"
1038128933,https://ak.picdn.net/shutterstock/videos/1038128933/preview/stock-footage-basel-switzerland-coloring-the-map-and-flag-motion-design.mp4,PT00H00M17S,106801_106850,Basel switzerland coloring the map and flag. motion design.
1030673159,https://ak.picdn.net/shutterstock/videos/1030673159/preview/stock-footage-adapt-digital-wave-background-abstract-computer-generated-motion-graphic-background-animation.mp4,PT00H00M27S,042551_042600,Adapt digital wave background abstract computer generated motion graphic background animation
1045635601,https://ak.picdn.net/shutterstock/videos/1045635601/preview/stock-footage-circa-general-pershing-and-other-officers-inspect-crashed-planes-at-the-second-aviation.mp4,PT00H00M58S,008801_008850,"Circa 1918 - general pershing and other officers inspect crashed planes at the second aviation instruction center in tours, france."
4751000,https://ak.picdn.net/shutterstock/videos/4751000/preview/stock-footage-havelberg-germany-september-people-walking-over-a-flea-marketplace-looking-for-old-things.mp4,PT00H00M20S,093201_093250,"Havelberg, germany – september 05: people walking over a flea marketplace looking for old things. located at havelberg on september 05, 2013"
1014454481,https://ak.picdn.net/shutterstock/videos/1014454481/preview/stock-footage-animated-background-of-particles-loop-animation.mp4,PT00H00M10S,194351_194400,Animated background of particles. loop animation.
1015165189,https://ak.picdn.net/shutterstock/videos/1015165189/preview/stock-footage-aerial-shot-of-a-car-driving-through-an-icy-spruce-forest-at-night.mp4,PT00H00M19S,113301_113350,Aerial shot of a car driving through an icy spruce forest at night.
1031985350,https://ak.picdn.net/shutterstock/videos/1031985350/preview/stock-footage-wedding-decorations-at-the-ceremony-and-at-the-banquet.mp4,PT00H00M05S,051351_051400,Wedding decorations at the ceremony and at the banquet
22427353,https://ak.picdn.net/shutterstock/videos/22427353/preview/stock-footage-shooting-through-a-crystal-sphere.mp4,PT00H00M28S,147801_147850,Shooting through a crystal sphere.
1036403642,https://ak.picdn.net/shutterstock/videos/1036403642/preview/stock-footage-colored-sports-balls-on-racks-in-the-gym.mp4,PT00H00M05S,010051_010100,Colored sports balls on racks in the gym
8428228,https://ak.picdn.net/shutterstock/videos/8428228/preview/stock-footage-beach-of-p-voa-de-varzim.mp4,PT00H00M17S,142751_142800,Beach of póvoa de varzim
9111488,https://ak.picdn.net/shutterstock/videos/9111488/preview/stock-footage-close-up-detail-of-steam-pipes-of-an-old-train-puffing.mp4,PT00H00M20S,191701_191750,Close up detail of steam pipes of an old train puffing
1036238771,https://ak.picdn.net/shutterstock/videos/1036238771/preview/stock-footage-pan-shot-ripe-grapes-vineyard-autumn-tuscany-italy-italian-wineyard-ripe-grapes-on-the-vine-for.mp4,PT00H00M17S,072051_072100,"Pan shot ripe grapes vineyard autumn. tuscany, italy. italian wineyard: ripe grapes on the vine for making red wine. wine grapes harvest in italy. italian countryside beautiful vineyards"
1013998787,https://ak.picdn.net/shutterstock/videos/1013998787/preview/stock-footage-aerial-top-view-waves-break-on-dark-rocks-near-beach-sea-waves-on-the-dangerous-stones-aerial-view.mp4,PT00H00M08S,138501_138550,Aerial top view waves break on dark rocks near beach. sea waves on the dangerous stones aerial view drone 4k shot. bird's eye view of ocean waves crashing against an empty beach from above.
1055273789,https://ak.picdn.net/shutterstock/videos/1055273789/preview/stock-footage-lupine-wildflowers-sway-in-the-breeze-meadow-of-wildflowers-blooming-grass-swaying-in-the-wind-in.mp4,PT00H00M15S,145301_145350,Lupine wildflowers sway in the breeze. meadow of wildflowers. blooming grass swaying in the wind in summer. 
1014770807,https://ak.picdn.net/shutterstock/videos/1014770807/preview/stock-footage-ants-carrying-food-and-working.mp4,PT00H00M31S,019551_019600,Ants carrying food and working
1010654471,https://ak.picdn.net/shutterstock/videos/1010654471/preview/stock-footage-russia-novosibirsk-may-rally-organized-by-navalny-in-may-in-novosibirsk-russian.mp4,PT00H00M05S,018151_018200,"Russia, novosibirsk - may 5, 2018: rally organized by navalny in may 2018 in novosibirsk russian federation. digital resistance. down with the king."
1025062151,https://ak.picdn.net/shutterstock/videos/1025062151/preview/stock-footage-a-young-boy-running-along-a-beach-with-a-great-running-style.mp4,PT00H00M18S,132451_132500,A young boy running along a beach with a great running style.
19409482,https://ak.picdn.net/shutterstock/videos/19409482/preview/stock-footage-young-woman-smiling-at-the-camera.mp4,PT00H00M22S,080301_080350,Young woman smiling at the camera
2935681,https://ak.picdn.net/shutterstock/videos/2935681/preview/stock-footage-young-man-reading-book-in-preah-khan-temple-angkor.mp4,PT00H00M24S,131451_131500,"Young man reading book in preah khan temple, angkor"
1034834264,https://ak.picdn.net/shutterstock/videos/1034834264/preview/stock-footage-aventura-fl-usa-july-aerial-drone-footage-of-tidal-cove-water-park-and-resort-at-the.mp4,PT00H00M29S,079101_079150,"Aventura, fl, usa - july 26, 2019: aerial drone footage of tidal cove water park and resort at the turnberry club aventura"
1034689112,https://ak.picdn.net/shutterstock/videos/1034689112/preview/stock-footage-atomic-bomb-in-neon-effect-mp-video.mp4,PT00H00M15S,046751_046800,Atomic bomb in neon effect mp4 video
1047865237,https://ak.picdn.net/shutterstock/videos/1047865237/preview/stock-footage-flash-light-animation-on-black-background.mp4,PT00H00M12S,044951_045000,Flash light animation on black background
1043206921,https://ak.picdn.net/shutterstock/videos/1043206921/preview/stock-footage-four-mixed-race-teen-girlfriends-walking-near-bicycle-lane-in-the-centre-of-an-old-german-city-in.mp4,PT00H00M10S,027601_027650,Four mixed race teen girlfriends walking near bicycle lane in the centre of an old german city in autumn day. the road sign defining a bicycle lane is on the foreground.
25636886,https://ak.picdn.net/shutterstock/videos/25636886/preview/stock-footage-active-man-gardener-prunes-and-trims-bushes.mp4,PT00H00M27S,117601_117650,Active man gardener prunes and trims bushes .
19675069,https://ak.picdn.net/shutterstock/videos/19675069/preview/stock-footage-istanbul-turkey-february-panoramic-view-of-istanbul-at-night-on-february-in.mp4,PT00H00M15S,104001_104050,"Istanbul, turkey - february 21: panoramic view of istanbul at night on february 21, 2016 in istanbul, turkey. 
"
1007988898,https://ak.picdn.net/shutterstock/videos/1007988898/preview/stock-footage-crab-on-the-rock-at-the-beach-rolling-waves-close-up.mp4,PT00H00M28S,018551_018600,"Crab on the rock at the beach, rolling waves, close-up"
1064183017,https://ak.picdn.net/shutterstock/videos/1064183017/preview/stock-footage-beautiful-decorations-on-a-wooden-table-new-year-s-golden-toys-and-a-natural-green-christmas-tree.mp4,PT00H00M16S,094201_094250,"Beautiful decorations on a wooden table, new year's, golden toys and a natural green christmas tree."
1050701905,https://ak.picdn.net/shutterstock/videos/1050701905/preview/stock-footage-student-girl-distance-learning-science-or-lessons-listening-on-the-internet-on-a-computer-or.mp4,PT00H00M11S,019051_019100,Student girl. distance learning. science or lessons listening on the internet on a computer or laptop notes in a notebook. staying at home. drinking coffee or tea. quarantined during a pandemic.
9573866,https://ak.picdn.net/shutterstock/videos/9573866/preview/stock-footage-wind-turbine.mp4,PT00H00M09S,103501_103550,Wind turbine
1040304113,https://ak.picdn.net/shutterstock/videos/1040304113/preview/stock-footage-close-up-portrait-of-handsome-cheerful-man-in-green-shirt-and-gloves-collecting-plastic-garbage.mp4,PT00H00M18S,008151_008200,Close-up portrait of handsome cheerful man in green shirt and gloves collecting plastic garbage outdoors. responsible male activist fighting forest pollution smiling while looking at camera
1017423442,https://ak.picdn.net/shutterstock/videos/1017423442/preview/stock-footage-fitness-instructor-helps-to-beautiful-girls-twins-to-do-stretching-exercise-workout-with-personal.mp4,PT00H00M08S,135301_135350,Fitness instructor helps to beautiful girls twins to do stretching exercise. workout with personal trainer outdoors. fitness instructor and girls doing lunge exercise opposite each other
1051074169,https://ak.picdn.net/shutterstock/videos/1051074169/preview/stock-footage-ukraine-kiev-people-in-protective-masks-on-their-faces-make-purchases-of-food-in-a.mp4,PT00H00M09S,050101_050150,Ukraine.kiev.28.03.2020.  people in protective masks on their faces make purchases of food in a food supermarket. seller in a protective mask on his face. weighs the goods on the scales.gives products
1015399789,https://ak.picdn.net/shutterstock/videos/1015399789/preview/stock-footage-cloudscape-time-lapse-manhattan-new-york.mp4,PT00H00M10S,192151_192200,"Cloudscape, time lapse manhattan - new york"
1014810215,https://ak.picdn.net/shutterstock/videos/1014810215/preview/stock-footage-cordoba-spain-april-the-old-roman-pillars-in-cordoba.mp4,PT00H00M17S,108001_108050,"Cordoba, spain - april, 2017: the old roman pillars in cordoba."
1025668325,https://ak.picdn.net/shutterstock/videos/1025668325/preview/stock-footage-closeup-on-various-slices-of-cakes-on-display-in-a-store.mp4,PT00H00M16S,089551_089600,Closeup on various slices of cakes on display in a store
18747260,https://ak.picdn.net/shutterstock/videos/18747260/preview/stock-footage-beautiful-meadow-grass-fanned-from-the-wild-wind.mp4,PT00H00M11S,175551_175600,"Beautiful meadow grass, fanned from the wild wind."
6145574,https://ak.picdn.net/shutterstock/videos/6145574/preview/stock-footage-tall-brown-reeds-near-the-sea-and-lots-of-trees-on-the-other-side.mp4,PT00H00M06S,021751_021800,Tall brown reeds near the sea and lots of trees on the other side
32504002,https://ak.picdn.net/shutterstock/videos/32504002/preview/stock-footage-clear-concise-complete-correct-communication-arrow-signs-d-animation.mp4,PT00H00M10S,170501_170550,Clear concise complete correct communication 4 arrow signs 3d animation
12490709,https://ak.picdn.net/shutterstock/videos/12490709/preview/stock-footage-fruits-on-green-background.mp4,PT00H00M25S,077901_077950,Fruits on green background
1063772968,https://ak.picdn.net/shutterstock/videos/1063772968/preview/stock-footage-red-caviar-sandwiches-with-soft-cheese-close-up-delicacy-food.mp4,PT00H00M20S,120951_121000,Red caviar sandwiches with soft cheese close up. delicacy food
13685450,https://ak.picdn.net/shutterstock/videos/13685450/preview/stock-footage-close-up-of-woman-hand-harvesting-of-tomatoes-in-farm.mp4,PT00H00M17S,045901_045950,Close up of woman hand harvesting of tomatoes in farm
34249309,https://ak.picdn.net/shutterstock/videos/34249309/preview/stock-footage-cute-preteen-girl-sitting-alone-hugging-her-knees-daydreaming-outdoors-lonely-young-blonde-teen.mp4,PT00H00M13S,116301_116350,Cute preteen girl sitting alone hugging her knees daydreaming outdoors. lonely young blonde teen girl thinking looking up.
1019014657,https://ak.picdn.net/shutterstock/videos/1019014657/preview/stock-footage-wild-ducks-frolic-on-the-pier-slow-motion.mp4,PT00H00M20S,182051_182100,"Wild ducks frolic on the pier, slow motion"
18630068,https://ak.picdn.net/shutterstock/videos/18630068/preview/stock-footage-japanese-and-american-sportsmen-compete-in-american-football-and-in-swimming-in-bolstering.mp4,PT00H01M20S,058201_058250,"Japanese and american sportsmen compete in american football and in swimming in 1957, bolstering respect and friendship for each other. (1950s)"
12126947,https://ak.picdn.net/shutterstock/videos/12126947/preview/stock-footage-woman-being-served-drink-at-the-bar-in-high-quality-k-format.mp4,PT00H00M15S,003401_003450,Woman being served drink at the bar in high quality 4k format
