videoid,contentUrl,duration,page_dir,name
1056389579,https://ak.picdn.net/shutterstock/videos/1056389579/preview/stock-footage-angry-political-elephant-republican-vs-donkey-democrat-k-animation-video-motion-graphics-without.mp4,PT00H00M11S,117651_117700,Angry political elephant republican vs donkey democrat. 4k animation video motion graphics without background
24271886,https://ak.picdn.net/shutterstock/videos/24271886/preview/stock-footage-port-coquitlam-bc-canada-february-motion-of-people-shopping-item-inside-walmart.mp4,PT00H00M07S,048651_048700,"Port coquitlam, bc, canada - february 09, 2017 : motion of people shopping item inside walmart store with 4k resolution"
1005598468,https://ak.picdn.net/shutterstock/videos/1005598468/preview/stock-footage-winter-landscape-frozen-buildings-on-sunset.mp4,PT00H00M08S,074201_074250,Winter landscape. frozen buildings on sunset
29650321,https://ak.picdn.net/shutterstock/videos/29650321/preview/stock-footage-putting-sugar-on-the-churros-close-up.mp4,PT00H00M14S,129801_129850,Putting sugar on the churros- close up
30404497,https://ak.picdn.net/shutterstock/videos/30404497/preview/stock-footage-union-jack-flapping-in-the-wind.mp4,PT00H00M21S,045051_045100,Union jack flapping in the wind
886825,https://ak.picdn.net/shutterstock/videos/886825/preview/stock-footage-design-transition.mp4,PT00H00M08S,143251_143300,Design transition
23096683,https://ak.picdn.net/shutterstock/videos/23096683/preview/stock-footage-titmouse-flies-from-a-branch-on-a-blurred-background-slow-motion.mp4,PT00H00M11S,177351_177400,Titmouse flies from a branch on a blurred background. slow motion.
3605657,https://ak.picdn.net/shutterstock/videos/3605657/preview/stock-footage-bread-maker-for-baking-being-opened-pot-is-taken-out-and-back-in.mp4,PT00H00M25S,141501_141550,"Bread maker for baking being opened, pot is taken out and back in"
32735896,https://ak.picdn.net/shutterstock/videos/32735896/preview/stock-footage-smoke-billowing-over-a-black-background.mp4,PT00H00M16S,175851_175900,Smoke billowing over a black background.
9597335,https://ak.picdn.net/shutterstock/videos/9597335/preview/stock-footage-chefs-hands-making-flapjack-smears-cream-sauce-and-sprinkle-with-sesame-seeds-in-kitchen.mp4,PT00H00M13S,060951_061000,Chefs hands making flapjack smears cream sauce and sprinkle with sesame seeds in kitchen
1011329717,https://ak.picdn.net/shutterstock/videos/1011329717/preview/stock-footage-toronto-ontario-canada-may-police-ambulance-fire-emergency-vehicles-with-flashing-lights.mp4,PT00H00M29S,004701_004750,"Toronto, ontario, canada may 2018 police ambulance fire emergency vehicles with flashing lights"
1026748925,https://ak.picdn.net/shutterstock/videos/1026748925/preview/stock-footage-starlapse-windy-afternoon-into-calm-and-peaceful-starry-evening.mp4,PT00H00M17S,024901_024950,Starlapse windy afternoon into calm and peaceful starry evening
1014356339,https://ak.picdn.net/shutterstock/videos/1014356339/preview/stock-footage-morning-jog-on-the-pier-when-the-sun-rises-over-the-sea-in-the-frame-only-the-legs-are-visible.mp4,PT00H00M22S,146951_147000,Morning jog on the pier when the sun rises over the sea. in the frame only the legs are visible. slow motion hd video
1038588080,https://ak.picdn.net/shutterstock/videos/1038588080/preview/stock-footage-sunlight-through-branches-blowing-in-the-wind.mp4,PT00H00M08S,145401_145450,Sunlight through branches blowing in the wind
1039383353,https://ak.picdn.net/shutterstock/videos/1039383353/preview/stock-footage-creative-man-with-computer-working-at-open-space-room-in-sunset-man-working-in-office-and-typing-on.mp4,PT00H00M13S,141401_141450,Creative man with computer working at open space room in sunset.man working in office and typing on keyboard.overtime work in office.exhausted businessman working in modern office on early morning.
4583975,https://ak.picdn.net/shutterstock/videos/4583975/preview/stock-footage-an-animated-view-of-a-set-of-nine-blank-white-picket-placards-attached-to-wooden-stakes-moving-up.mp4,PT00H00M10S,133901_133950,"An animated view of a set of nine blank, white picket placards attached to wooden stakes moving up and down randomly on an isolated background"
11691257,https://ak.picdn.net/shutterstock/videos/11691257/preview/stock-footage-young-woman-in-hat-looking-at-the-sea-view.mp4,PT00H00M11S,083201_083250,Young woman in hat looking at the sea view
22832506,https://ak.picdn.net/shutterstock/videos/22832506/preview/stock-footage--k-female-business-team-in-informal-meeting-in-office-breakout-area-dec-uk.mp4,PT00H00M28S,193101_193150,4k female business team in informal meeting in office breakout area dec 2016-uk
9913829,https://ak.picdn.net/shutterstock/videos/9913829/preview/stock-footage-trillium-grandiflorum-or-white-trillium-on-forest-ground-in-woodlands-white-trillium-is-the.mp4,PT00H00M15S,059401_059450,"Trillium grandiflorum, or white trillium, on forest ground in woodlands. white trillium is the provincial flower of ontario, canada"
1007954482,https://ak.picdn.net/shutterstock/videos/1007954482/preview/stock-footage-red-giftbox-money.mp4,PT00H00M20S,051601_051650,Red giftbox money
11037788,https://ak.picdn.net/shutterstock/videos/11037788/preview/stock-footage-dusseldorf-germany-may-frank-o-gehry-s-distorted-buildings-and-rhinetower-in-the.mp4,PT00H00M22S,015751_015800,"Dusseldorf, germany - may 28, 2015: frank o. gehry's distorted buildings and rhinetower in the media harbor district on may 28, 2015 in dusseldorf. ultra hd 4k,real time, zooming"
16373122,https://ak.picdn.net/shutterstock/videos/16373122/preview/stock-footage-sexy-sensual-woman-with-blowing-hair.mp4,PT00H00M09S,181251_181300,Sexy sensual woman with blowing hair
9930620,https://ak.picdn.net/shutterstock/videos/9930620/preview/stock-footage-brompton-cemetery-london-united-kingdom-april-white-cross-with-clouds-and-blue-sky.mp4,PT00H00M10S,046551_046600,"Brompton cemetery, london, united kingdom. april 2015. white cross with clouds and blue sky"
1014152183,https://ak.picdn.net/shutterstock/videos/1014152183/preview/stock-footage-toronto-ontario-canada-july-news-cameras-and-media-at-scene-of-mass-shooting-in-toronto-on.mp4,PT00H00M15S,140101_140150,"Toronto, ontario, canada july 2018 news cameras and media at scene of mass shooting in toronto on danforth ave"
1061260996,https://ak.picdn.net/shutterstock/videos/1061260996/preview/stock-footage-washing-the-cucumber-close-up-hands-foam.mp4,PT00H00M22S,030901_030950,"Washing the cucumber. close-up hands, foam."
7171459,https://ak.picdn.net/shutterstock/videos/7171459/preview/stock-footage-sunset-and-palms-at-ocean.mp4,PT00H00M20S,103001_103050,Sunset and palms at ocean
1045734967,https://ak.picdn.net/shutterstock/videos/1045734967/preview/stock-footage--aerial-shot-of-el-portillo-beach.mp4,PT00H00M32S,011051_011100,"
aerial shot of el portillo beach"
20221954,https://ak.picdn.net/shutterstock/videos/20221954/preview/stock-footage-beautiful-sunset-on-a-yacht-sailing-in-the-sea.mp4,PT00H00M21S,147401_147450,Beautiful sunset on a yacht sailing in the sea.
21277825,https://ak.picdn.net/shutterstock/videos/21277825/preview/stock-footage--k-portrait-of-happy-affectionate-mother-daughter-spending-time-together-outdoors-shot-on-red.mp4,PT00H00M20S,017301_017350,4k portrait of happy affectionate mother & daughter spending time together outdoors. shot on red epic.
1017729850,https://ak.picdn.net/shutterstock/videos/1017729850/preview/stock-footage-nicosia-cyprus-september-the-city-center-of-the-southern-side-of-nicosia-cyprus.mp4,PT00H00M08S,095401_095450,"Nicosia, cyprus - september 24, 2018: the city center of the southern side of nicosia, cyprus"
1020711136,https://ak.picdn.net/shutterstock/videos/1020711136/preview/stock-footage-time-lapse-bahnhof-friedrichstra-e.mp4,PT00H00M11S,140801_140850,Time lapse bahnhof friedrichstraße
9321881,https://ak.picdn.net/shutterstock/videos/9321881/preview/stock-footage-aerial-view-of-the-beach-flying-through-driftwood-in-the-bahamas.mp4,PT00H00M30S,021101_021150,Aerial view of the beach flying through driftwood in the bahamas
11666165,https://ak.picdn.net/shutterstock/videos/11666165/preview/stock-footage-time-lapse-shooting-from-beside-of-phetburi-road-bangkok-on-june.mp4,PT00H00M05S,006901_006950,"Time lapse shooting from beside of phetburi road, bangkok. on 15 june 2015."
6160841,https://ak.picdn.net/shutterstock/videos/6160841/preview/stock-footage-falling-snowflake-snow-cover-house-roof-gh.mp4,PT00H00M12S,129901_129950,"Falling snowflake,snow cover house roof. gh2_06028"
1037549636,https://ak.picdn.net/shutterstock/videos/1037549636/preview/stock-footage--snowflake-starry-moray-echidna-nebulosa-hunting-philippines.mp4,PT00H00M30S,079951_080000,"
snowflake/starry moray (echidna nebulosa) hunting - philippines"
25503959,https://ak.picdn.net/shutterstock/videos/25503959/preview/stock-footage-concord-united-states-middlesex-county.mp4,PT00H00M12S,178001_178050,"Concord united states, middlesex county-2008"
31231729,https://ak.picdn.net/shutterstock/videos/31231729/preview/stock-footage-slicing-eating-a-tasty-healthy-salad-with-camembert-cheese-and-grilled-vegetables.mp4,PT00H00M13S,195101_195150,Slicing eating a tasty healthy salad with camembert cheese and grilled vegetables
8928130,https://ak.picdn.net/shutterstock/videos/8928130/preview/stock-footage-close-up-of-a-glamorous-girl-dancing-go-go.mp4,PT00H00M29S,087901_087950,Close-up of a glamorous girl dancing go-go
1058543821,https://ak.picdn.net/shutterstock/videos/1058543821/preview/stock-footage-old-and-vintage-bobbin-tape-recorder-rewinding-tape-close-up-top-view.mp4,PT00H00M23S,055151_055200,"Old and vintage bobbin tape recorder rewinding tape close up, top view"
1048265392,https://ak.picdn.net/shutterstock/videos/1048265392/preview/stock-footage-cloudy-mountains-and-fly-over-the-lake-towards-the-beach-with-the-forest-around.mp4,PT00H00M12S,176351_176400,Cloudy mountains and fly over the lake towards the beach with the forest around
11542631,https://ak.picdn.net/shutterstock/videos/11542631/preview/stock-footage-wild-waves-breaking-on-rocky-coastline-cinque-terre-italy-suitable-as-background.mp4,PT00H00M26S,052601_052650,"Wild waves breaking on rocky coastline - cinque terre, italy. suitable as background."
1812584,https://ak.picdn.net/shutterstock/videos/1812584/preview/stock-footage-beautiful-view-of-old-colonial-town-of-taxco-in-central-mexico.mp4,PT00H00M07S,102251_102300,Beautiful view of old colonial town of taxco in central mexico
19951588,https://ak.picdn.net/shutterstock/videos/19951588/preview/stock-footage-firence-italy-river-bridges-and-houses.mp4,PT00H00M16S,103551_103600,Firence italy river bridges and houses
1032966434,https://ak.picdn.net/shutterstock/videos/1032966434/preview/stock-footage-paris-france-july-close-up-shot-of-red-christian-cathedral-candles-offered-in-worship.mp4,PT00H00M11S,070501_070550,"Paris, france - july 06, 2019: close up shot of red christian cathedral candles offered in worship and celebration during mass and pray"
1042756987,https://ak.picdn.net/shutterstock/videos/1042756987/preview/stock-footage-putting-money-into-piggy-bank-with-flag-of-paraguay-tax-system-system-or-savings-related.mp4,PT00H00M05S,021351_021400,Putting money into piggy bank with flag of paraguay. tax system system or savings related conceptual 3d animation
30464683,https://ak.picdn.net/shutterstock/videos/30464683/preview/stock-footage-blonde-woman-reading-the-book-in-the-park-sitting-on-the-grass-under-a-tree-k-slow-motion.mp4,PT00H00M15S,120001_120050,"Blonde woman reading the book in the park, sitting on the grass, under a tree. 4k, slow-motion"
1061427673,https://ak.picdn.net/shutterstock/videos/1061427673/preview/stock-footage-the-plums-with-rainwater-are-swaying-in-the-sun-and-wind.mp4,PT00H00M31S,011451_011500,The plums with rainwater are swaying in the sun and wind.
1060418500,https://ak.picdn.net/shutterstock/videos/1060418500/preview/stock-footage-blue-warm-light-ribbons-on-a-white-background-wavey.mp4,PT00H00M12S,182051_182100,Blue warm light ribbons on a white background wavey
1029673355,https://ak.picdn.net/shutterstock/videos/1029673355/preview/stock-footage-save-planet-save-planet-from-trash-hazmat-researcher-into-protective-uniform-and-mask-collects.mp4,PT00H00M24S,081851_081900,"Save planet save planet from trash, hazmat researcher into protective uniform and mask collects refuse in garbage bag for testing on landfill with pointer sign biological hazard"
18905426,https://ak.picdn.net/shutterstock/videos/18905426/preview/stock-footage-the-storm-caused-flash-flood.mp4,PT00H00M09S,174801_174850,The storm caused flash flood
8968711,https://ak.picdn.net/shutterstock/videos/8968711/preview/stock-footage-new-york-feb-woman-walking-dog-in-snow-cold-winter-washington-square-park-in-slow.mp4,PT00H00M15S,148401_148450,"New york - feb 11, 2015: woman walking dog in snow, cold winter, washington square park in slow motion 4k in manhattan ny. washington square park is a public park in nyc."
6592121,https://ak.picdn.net/shutterstock/videos/6592121/preview/stock-footage-tateyama-kurobe-alpine-route-japan-destination-travel.mp4,PT00H00M11S,091751_091800,"Tateyama kurobe alpine route, japan destination travel"
34166680,https://ak.picdn.net/shutterstock/videos/34166680/preview/stock-footage-male-hand-showing-a-gold-coin-bitcoin-on-a-brown-background.mp4,PT00H00M08S,027701_027750,Male hand showing a gold coin bitcoin on a brown background
2095997,https://ak.picdn.net/shutterstock/videos/2095997/preview/stock-footage-a-beautiful-peacock.mp4,PT00H00M15S,006901_006950,A beautiful peacock
13380806,https://ak.picdn.net/shutterstock/videos/13380806/preview/stock-footage-view-of-the-large-golden-field-in-the-countryside-haystacks-lie-on-the-ground.mp4,PT00H00M30S,193651_193700,View of the large golden field in the countryside - haystacks lie on the ground
32712916,https://ak.picdn.net/shutterstock/videos/32712916/preview/stock-footage-woman-roll-out-the-dough-with-a-wooden-rolling-pen-making-christmas-gingerbread-cookies.mp4,PT00H00M20S,039501_039550,Woman roll out the dough with a wooden rolling pen. making christmas gingerbread cookies
1019080612,https://ak.picdn.net/shutterstock/videos/1019080612/preview/stock-footage-colorful-light-flashing-and-white-rays-on-an-empty-stage-in-the-dark-stage-lighting-light-show.mp4,PT00H00M16S,140501_140550,Colorful light flashing and white rays on an empty stage in the dark. stage lighting. light show.
12386513,https://ak.picdn.net/shutterstock/videos/12386513/preview/stock-footage-an-underwater-shot-of-bubbles-passing-by-the-hull-of-a-fishing-boat-as-it-travels-through-the-ocean.mp4,PT00H00M11S,113351_113400,An underwater shot of bubbles passing by the hull of a fishing boat as it travels through the ocean
1026986693,https://ak.picdn.net/shutterstock/videos/1026986693/preview/stock-footage-close-up-sakura-flower-or-japanese-cherry-blossoms-prunus-serrulata-shaking-by-the-wind-in-japan.mp4,PT00H00M21S,099151_099200,Close-up sakura flower or japanese cherry blossoms (prunus serrulata) shaking by the wind in japan springtime. (selective focus)
1012320770,https://ak.picdn.net/shutterstock/videos/1012320770/preview/stock-footage-pov-driving-through-dunkery-beacon-hill-on-exmoor-national-park-in-somerset-england.mp4,PT00H00M29S,185751_185800,Pov driving through dunkery beacon hill on exmoor national park in somerset england
4231117,https://ak.picdn.net/shutterstock/videos/4231117/preview/stock-footage-barbecue-sauce-being-boiled.mp4,PT00H00M05S,186451_186500,Barbecue sauce being boiled
22838383,https://ak.picdn.net/shutterstock/videos/22838383/preview/stock-footage-crowd-partying-at-a-disco-party-dancing-people-at-floor-mirror.mp4,PT00H00M11S,002701_002750,Crowd partying at a disco party - dancing people at floor mirror
17158873,https://ak.picdn.net/shutterstock/videos/17158873/preview/stock-footage-young-woman-using-smartphone-at-her-new-home-male-worker-in-the-background.mp4,PT00H00M28S,176901_176950,"Young woman using smartphone at her new home, male worker in the background
"
18008971,https://ak.picdn.net/shutterstock/videos/18008971/preview/stock-footage--d-rendering-abstract-background-with-techlines-with-glowing-dots-background-for-text.mp4,PT00H00M15S,041251_041300,3d rendering abstract background with techlines with glowing dots. background for text.
31253590,https://ak.picdn.net/shutterstock/videos/31253590/preview/stock-footage-moscow-russia-july-aerial-view-of-queen-ekaterina-residence-palace-in-tsaritsino-park.mp4,PT00H00M23S,006901_006950,"Moscow, russia - july 2017: aerial view of queen ekaterina residence palace in tsaritsino park, moscow, russia"
1058875621,https://ak.picdn.net/shutterstock/videos/1058875621/preview/stock-footage-a-group-of-three-young-women-are-actively-playing-basketball-on-a-basketball-court.mp4,PT00H00M12S,085751_085800,A group of three young women are actively playing basketball on a basketball court.
1026939800,https://ak.picdn.net/shutterstock/videos/1026939800/preview/stock-footage-beautiful-eyes-of-a-model-photo-close-up.mp4,PT00H00M08S,183651_183700,Beautiful eyes of a model photo close up.
5514842,https://ak.picdn.net/shutterstock/videos/5514842/preview/stock-footage-italy-bologna-aerial-view-from-asinelli-tower.mp4,PT00H00M10S,018551_018600,"Italy, bologna. aerial view from asinelli tower"
27596254,https://ak.picdn.net/shutterstock/videos/27596254/preview/stock-footage--s-sporty-female-warms-up-and-starts-running-on-the-waterfront-girl-athlete-running-along-the.mp4,PT00H00M27S,194051_194100,20s sporty female warms up and starts running on the waterfront. girl athlete running along the seafront at the beach at sunset. the girl is jogging at sunset
1031904890,https://ak.picdn.net/shutterstock/videos/1031904890/preview/stock-footage-aerial-of-d-tzingen-germany-camera-pans-to-the-right-from-fields-to-the-town.mp4,PT00H00M35S,181001_181050,"Aerial of dätzingen, germany.  camera pans to the right from fields to the town"
28862863,https://ak.picdn.net/shutterstock/videos/28862863/preview/stock-footage-high-aerial-shot-over-green-hills-in-sicily.mp4,PT00H00M46S,184501_184550,High aerial shot over green hills in sicily
20631319,https://ak.picdn.net/shutterstock/videos/20631319/preview/stock-footage-coral-and-fish-in-the-red-sea-egypt-hd.mp4,PT00H00M13S,060851_060900,"Coral and fish in the red sea, egypt. hd"
17380912,https://ak.picdn.net/shutterstock/videos/17380912/preview/stock-footage-breakfast-food.mp4,PT00H00M22S,003151_003200,Breakfast food
1029248966,https://ak.picdn.net/shutterstock/videos/1029248966/preview/stock-footage-a-man-in-the-mountains-stands-and-holds-the-canadian-flag-on-the-background-of-mountains-and-sky.mp4,PT00H00M12S,195551_195600,A man in the mountains stands and holds the canadian flag on the background of mountains and sky. he is wearing bright yellow clothes and glasses. the flag of canada is developing in the wind.
1036792613,https://ak.picdn.net/shutterstock/videos/1036792613/preview/stock-footage-tainan-qigu-salt-pan-wetland-fan-test.mp4,PT00H00M45S,034151_034200,Tainan qigu salt pan wetland-fan test 
1009601507,https://ak.picdn.net/shutterstock/videos/1009601507/preview/stock-footage-view-to-downtown-from-embankment-of-dubai-creek-pier-with-yachts-sunset-time-lapse-dubai-uae.mp4,PT00H00M13S,192851_192900,"View to downtown from embankment of dubai creek, pier with yachts, sunset time lapse. dubai, uae - january, 2018"
1007066539,https://ak.picdn.net/shutterstock/videos/1007066539/preview/stock-footage-abstract-business-chart-stock-market-data-animation-with-generic-corporate-data.mp4,PT00H00M20S,020651_020700,Abstract business chart (stock market data) animation with generic corporate data
29465488,https://ak.picdn.net/shutterstock/videos/29465488/preview/stock-footage-group-of-scientists-showing-thumbs-up-sign-researchers-laboratory-presentation.mp4,PT00H00M13S,121951_122000,Group of scientists showing thumbs up sign researchers laboratory presentation
1034163278,https://ak.picdn.net/shutterstock/videos/1034163278/preview/stock-footage-sad-handsome-man-received-a-gift-and-began-to-dance-happily-on-an-orange-background-holiday.mp4,PT00H00M13S,062901_062950,"Sad handsome man received a gift and began to dance happily on an orange background. holiday concept, holiday discounts, gifts and sales."
1022976889,https://ak.picdn.net/shutterstock/videos/1022976889/preview/stock-footage-sunrise-time-lapse-of-kuala-lumpur-cityscape-skyline-from-afar-in-silhouette-malaysia-high.mp4,PT00H00M13S,015201_015250,"Sunrise time lapse of kuala lumpur cityscape skyline from afar in silhouette. malaysia. high quality, prores 1080p. pan down motion timelapse."
30711100,https://ak.picdn.net/shutterstock/videos/30711100/preview/stock-footage-new-york-city-circa-long-island-railroad-passenger-trains-pass-at-station-platform-during.mp4,PT00H00M23S,059401_059450,"New york city, circa 2017: long island railroad passenger trains pass at station platform during rush hour commute. slow motion hd stock video"
25925186,https://ak.picdn.net/shutterstock/videos/25925186/preview/stock-footage-a-beautiful-woman-enjoys-blossoming-snowdrops-in-a-spring-forest.mp4,PT00H00M13S,020151_020200,A beautiful woman enjoys blossoming snowdrops in a spring forest
1035389114,https://ak.picdn.net/shutterstock/videos/1035389114/preview/stock-footage-large-drops-of-clear-water-slowly-roll-down-the-wet-skin-of-ripe-red-juicy-apple-on-a-green.mp4,PT00H00M21S,061851_061900,"Large drops of clear water slowly roll down the wet skin of ripe, red, juicy apple. on a green background. macro mode"
8309989,https://ak.picdn.net/shutterstock/videos/8309989/preview/stock-footage-dog-thumbling-on-the-sand-seems-very-happy.mp4,PT00H00M18S,057001_057050,Dog thumbling on the sand seems very happy 
3825362,https://ak.picdn.net/shutterstock/videos/3825362/preview/stock-footage-old-lion-walk.mp4,PT00H00M20S,032601_032650,Old lion walk
31181755,https://ak.picdn.net/shutterstock/videos/31181755/preview/stock-footage-dark-forest-leaves-and-branches-with-bright-early-morning-light-coming-in-between-leaves.mp4,PT00H00M14S,033351_033400,Dark forest leaves and branches with bright early morning light coming in between leaves
1019976982,https://ak.picdn.net/shutterstock/videos/1019976982/preview/stock-footage--north-korea-animated-typography-country-name-reveal-with-blowing-red-dust-particles.mp4,PT00H00M10S,191301_191350,“north korea” animated typography. country name reveal with blowing red dust particles
1030808666,https://ak.picdn.net/shutterstock/videos/1030808666/preview/stock-footage-close-up-skateboarder-boy-riding-outdoor-a-young-guy-rides-a-longboard-in-the-park-wearing.mp4,PT00H00M06S,055351_055400,"Close-up skateboarder boy riding outdoor. a young guy rides a longboard in the park. wearing traveler boots. urban summer fun, active lifestyle."
1056737966,https://ak.picdn.net/shutterstock/videos/1056737966/preview/stock-footage-hand-of-middle-age-sliding-the-touch-screen-of-the-phone-or-tablet-use-smartphones-to-play-games.mp4,PT00H00M13S,197101_197150,"Hand of middle age, sliding the touch screen of the phone or tablet, use smartphones to play games, online shopping, chat with the internet, selective focus."
1024098407,https://ak.picdn.net/shutterstock/videos/1024098407/preview/stock-footage-two-hammocks-hanging-off-a-tree-in-the-wild-sardinian-countryside-with-the-sun-rising-behind-them.mp4,PT00H00M08S,033851_033900,"Two hammocks hanging off a tree in the wild, sardinian countryside with the sun rising behind them."
20618743,https://ak.picdn.net/shutterstock/videos/20618743/preview/stock-footage-collection-of-frames-of-mongolian-town-and-holiday-nadom-nadom-traditional-mongolian-match-also.mp4,PT00H00M16S,184451_184500,"Collection of frames of mongolian town and holiday nadom. nadom - traditional mongolian match, also referred to as ""three men's games"" - a mongolian wrestling, horse racing and archery. it held"
5156783,https://ak.picdn.net/shutterstock/videos/5156783/preview/stock-footage-photo-of-a-tropical-fish-on-a-coral-reef.mp4,PT00H00M31S,126951_127000,Photo of a tropical fish on a coral reef
31628014,https://ak.picdn.net/shutterstock/videos/31628014/preview/stock-footage-aerial-north-carolina-raleigh-july-night-k-inspire.mp4,PT00H00M30S,087001_087050,Aerial north carolina raleigh july 2017 night 4k inspire 2
1424941,https://ak.picdn.net/shutterstock/videos/1424941/preview/stock-footage-rider-following-as-another-hits-ramp.mp4,PT00H00M27S,051601_051650,Rider following as another hits ramp
10429718,https://ak.picdn.net/shutterstock/videos/10429718/preview/stock-footage-girl-hiker-tourist-walking-on-mountain-top-aerial-view.mp4,PT00H00M46S,053151_053200,Girl  hiker  tourist walking  on mountain  top . aerial view
1019919094,https://ak.picdn.net/shutterstock/videos/1019919094/preview/stock-footage-mountain-top-mountain-landscape-range-drone-footage-flying-above-clouds-flying-through-clouds.mp4,PT00H00M16S,122751_122800,Mountain top mountain landscape range drone footage flying above clouds flying through clouds jungle forest lake beautiful nature landscape malaysia foggy rain forest misty landscape rainforest
26931775,https://ak.picdn.net/shutterstock/videos/26931775/preview/stock-footage-water-surface-with-bright-sunbeams-in-blur.mp4,PT00H00M49S,172751_172800,Water surface with bright sunbeams in blur.
18085723,https://ak.picdn.net/shutterstock/videos/18085723/preview/stock-footage--k-shot-of-a-business-woman-in-studio-shouting-angry-and-holding-head.mp4,PT00H00M11S,011501_011550,4k shot of a business woman in studio shouting angry and holding head
1013877503,https://ak.picdn.net/shutterstock/videos/1013877503/preview/stock-footage-circa-s-in-the-united-kingdom-and-in-algeria-navy-seabees-construct-sprawling-bases-and.mp4,PT00H01M25S,002501_002550,Circa 1940s - in the united kingdom and in algeria navy seabees construct sprawling bases and harbors to host the invasion forces.
