videoid,contentUrl,duration,page_dir,name
1016818657,https://ak.picdn.net/shutterstock/videos/1016818657/preview/stock-footage-aerial-of-sandy-beach-umbrellas-and-sunbeds-in-sopot-poland.mp4,PT00H00M14S,147751_147800,Aerial of sandy beach umbrellas and sunbeds in sopot poland
17545129,https://ak.picdn.net/shutterstock/videos/17545129/preview/stock-footage-denver-colorado-usa-june-motorhome-driving-through-alpine-forest-on-mount-evans-pov.mp4,PT00H00M43S,054401_054450,"Denver, colorado, usa-june 21, 2016. motorhome driving through alpine forest on mount evans-pov point of view."
1010514059,https://ak.picdn.net/shutterstock/videos/1010514059/preview/stock-footage-close-up-of-electric-sander-working-with-wood-carpenter-in-workshop.mp4,PT00H00M24S,195301_195350,"Close up of electric sander working with wood, carpenter in workshop"
1011777806,https://ak.picdn.net/shutterstock/videos/1011777806/preview/stock-footage-sydney-australia-november-th-xd-look-on-the-old-building-of-the-sydney-harbour.mp4,PT00H00M20S,000951_001000,"Sydney, australia november 24th 2016 \xd0 look on the old building of the sydney harbour"
25724195,https://ak.picdn.net/shutterstock/videos/25724195/preview/stock-footage-jamaican-gazeba-at-a-beach.mp4,PT00H00M18S,037601_037650,Jamaican gazeba at a beach
2423516,https://ak.picdn.net/shutterstock/videos/2423516/preview/stock-footage-the-heavens-galaxies-form-in-deep-space.mp4,PT00H00M40S,039351_039400,The heavens 0509 - galaxies form in deep space.
1059943097,https://ak.picdn.net/shutterstock/videos/1059943097/preview/stock-footage-various-dry-italian-pasta-with-spinach-mushroom-and-lemon-flavor-the-hand-takes-pasta-high.mp4,PT00H00M14S,113451_113500,"Various dry italian pasta. with spinach, mushroom and lemon flavor. the hand takes pasta. high quality 4k footage"
1058168602,https://ak.picdn.net/shutterstock/videos/1058168602/preview/stock-footage-singapore-january-night-lighting-of-supertree-grove-at-gardens-by-the-bay-tourists.mp4,PT00H00M10S,041401_041450,"Singapore - january 10, 2020: night lighting of supertree grove at gardens by the bay. tourists enjoying breathtaking scenes from skyway observatory. impressive surreal scene"
1018703905,https://ak.picdn.net/shutterstock/videos/1018703905/preview/stock-footage-close-up-portrait-of-beautiful-woman-looking-to-camera-with-attractive-smile-girl-looking-to.mp4,PT00H00M14S,191001_191050,"Close-up portrait of beautiful woman looking to camera with attractive smile. girl looking to camera, beauty and skin care concept. isolated on a white background"
10390385,https://ak.picdn.net/shutterstock/videos/10390385/preview/stock-footage-multi-generation-family-sitting-on-sofa-in-lounge-talking-to-one-another-shot-on-canon-d-mkii-at.mp4,PT00H00M25S,030301_030350,Multi generation family sitting on sofa in lounge talking to one another.shot on canon 5d mkii at 25fps
16807438,https://ak.picdn.net/shutterstock/videos/16807438/preview/stock-footage-kiev-ukraine-mar-woman-female-artist-is-restoring-a-damaged-orthodox-icons-cracked.mp4,PT00H00M18S,098701_098750,"Kiev/ukraine - mar 23 2016: woman, female artist is restoring a damaged orthodox icons, cracked picture on an easel, cracked wooden frame is placed on a table, working attentively, painter is sitting"
1032270893,https://ak.picdn.net/shutterstock/videos/1032270893/preview/stock-footage-kew-fete-uk-jun-childrens-ride-on-the-carousel-at-the-amusement-park-in-uk.mp4,PT00H00M10S,185001_185050,"Kew fete, uk- jun 22, 2019: childrens ride on the carousel at the amusement park in uk
"
33733450,https://ak.picdn.net/shutterstock/videos/33733450/preview/stock-footage-cutie-young-girl-having-fun-and-listening-ti-the-music-with-headphones.mp4,PT00H00M15S,149151_149200,Cutie young girl having fun and listening ti the music with headphones
26806462,https://ak.picdn.net/shutterstock/videos/26806462/preview/stock-footage-tarimbang-beach-sumba-island-indonesia-aerial-footage-taken-with-drone.mp4,PT00H00M40S,050601_050650,"Tarimbang beach, sumba island, indonesia. aerial footage. taken with drone"
1011316259,https://ak.picdn.net/shutterstock/videos/1011316259/preview/stock-footage-animation-background-slow-motion-glowing-of-mosaic-tiles-moving-technologies-squares-with-shine.mp4,PT00H00M20S,011951_012000,Animation background slow motion glowing of mosaic tiles. moving technologies squares with shine light. animation of seamless loop.
1020143512,https://ak.picdn.net/shutterstock/videos/1020143512/preview/stock-footage-children-picking-pumpkins-from-a-farm-for-halloween.mp4,PT00H00M10S,179451_179500,Children picking pumpkins from a farm for halloween
1037379578,https://ak.picdn.net/shutterstock/videos/1037379578/preview/stock-footage-aerial-view-of-nice-sandy-kuta-beach-and-blue-ocean-in-the-morning-tourists-are-walking-along-the.mp4,PT00H00M09S,002651_002700,"Aerial view of nice sandy kuta beach and blue ocean in the morning. tourists are walking along the beach. bali, indonesia"
8200606,https://ak.picdn.net/shutterstock/videos/8200606/preview/stock-footage-five-children-playing-in-surf.mp4,PT00H00M09S,112701_112750,Five children playing in surf.
30950071,https://ak.picdn.net/shutterstock/videos/30950071/preview/stock-footage-underwater-footage-of-arctic-char-in-clear-water-river-greenland.mp4,PT00H00M18S,088451_088500,Underwater footage of arctic char in clear water river greenland
32698834,https://ak.picdn.net/shutterstock/videos/32698834/preview/stock-footage-fort-lauderdale-fl-usa-november-aerial-rising-ascent-shot-fort-lauderdale-fl-k.mp4,PT00H00M29S,035751_035800,"Fort lauderdale, fl, usa - november 4, 2017: aerial rising ascent shot fort lauderdale fl 4k"
1027520120,https://ak.picdn.net/shutterstock/videos/1027520120/preview/stock-footage-aerial-panorama-of-forest-on-island-on-lake-seliger-russia.mp4,PT00H00M12S,004851_004900,"Aerial panorama of forest on island on lake seliger, russia"
1028989334,https://ak.picdn.net/shutterstock/videos/1028989334/preview/stock-footage-bookshelfs-view-from-the-pavement-narrow-corridor-of-old-walls-people-walk-at-the-streets-of.mp4,PT00H00M07S,192401_192450,Bookshelfs. view from the pavement. narrow corridor of old walls. people walk at the streets  of  venice.
23230543,https://ak.picdn.net/shutterstock/videos/23230543/preview/stock-footage-young-man-says-something-close-up-of-mouth.mp4,PT00H00M09S,185301_185350,Young man says something. close-up of mouth
1032373757,https://ak.picdn.net/shutterstock/videos/1032373757/preview/stock-footage-happy-young-man-and-woman-dancing-in-spacious-living-room-at-home.mp4,PT00H00M56S,004251_004300,Happy young man and woman dancing in spacious living room at home
3316403,https://ak.picdn.net/shutterstock/videos/3316403/preview/stock-footage-girl-secretary-fills-in-the-questionnaire.mp4,PT00H00M14S,048951_049000,Girl secretary fills in the questionnaire
1047351430,https://ak.picdn.net/shutterstock/videos/1047351430/preview/stock-footage-video-of-meditating-young-man-with-beard.mp4,PT00H00M29S,183951_184000,Video of meditating young man with beard
24284999,https://ak.picdn.net/shutterstock/videos/24284999/preview/stock-footage-young-man-typing-on-a-laptop.mp4,PT00H00M08S,100401_100450,Young man typing on a laptop.
1032848072,https://ak.picdn.net/shutterstock/videos/1032848072/preview/stock-footage-newborn-baby-boy-under-phototherapy-lamp-getting-treated-for-jaundice.mp4,PT00H00M08S,124451_124500,Newborn baby boy under phototherapy lamp. getting treated for jaundice
13210112,https://ak.picdn.net/shutterstock/videos/13210112/preview/stock-footage-beautiful-sunrise-over-the-earth-the-transition-from-night-to-day-sunrise-from-space-earth-from.mp4,PT00H00M12S,186051_186100,Beautiful sunrise over the earth. the transition from night to day. sunrise from space. earth from space. v.2.
26732893,https://ak.picdn.net/shutterstock/videos/26732893/preview/stock-footage--d-cg-game-like-space-battle-robot-flying-at-high-speed.mp4,PT00H00M14S,050001_050050,"3d cg, game-like space battle robot flying at high speed."
34102783,https://ak.picdn.net/shutterstock/videos/34102783/preview/stock-footage-slow-motion-pretty-girl-smoking-cigarette.mp4,PT00H00M45S,016001_016050,Slow motion pretty girl smoking cigarette
1040735354,https://ak.picdn.net/shutterstock/videos/1040735354/preview/stock-footage-close-up-of-autumn-leaves-on-branch-at-a-park-with-tall-plane-trees-slow-motion-pov-shot-on-a.mp4,PT00H00M06S,106201_106250,Close up of autumn leaves on branch at a park with tall plane trees. slow motion pov shot on a gimbal.
5107346,https://ak.picdn.net/shutterstock/videos/5107346/preview/stock-footage-male-rock-climber-at-virgin-river-gorge-in-the-arizona-strip-between-st-george-ut-and-mesquite.mp4,PT00H00M24S,016651_016700,"Male rock climber at virgin river gorge in the arizona strip between st. george, ut and mesquite, nv.
"
18544205,https://ak.picdn.net/shutterstock/videos/18544205/preview/stock-footage-young-woman-writes-in-her-diary-in-the-park.mp4,PT00H00M12S,185151_185200,Young woman writes in her diary in the park
32692996,https://ak.picdn.net/shutterstock/videos/32692996/preview/stock-footage-close-up-of-many-different-turning-pills.mp4,PT00H00M18S,037251_037300,Close-up of many different turning pills
1053325874,https://ak.picdn.net/shutterstock/videos/1053325874/preview/stock-footage-astronaut-waves-on-a-green-background-high-detailed-d-animation-ultra-hd-k-x.mp4,PT00H00M08S,031501_031550,"Astronaut waves on a green background. high detailed 3d animation, ultra hd 4k 3840x2160"
33988489,https://ak.picdn.net/shutterstock/videos/33988489/preview/stock-footage-a-female-bumblebee-bombus-ignitus-smith-sucks-the-nectar-from-the-shrubby-sophora-flowers-sophora.mp4,PT00H00M08S,140901_140950,A female bumblebee(bombus ignitus smith) sucks the nectar from the shrubby sophora flowers(sophora flavescens aiton) (closeup)
1008688954,https://ak.picdn.net/shutterstock/videos/1008688954/preview/stock-footage-tibet-nepal-kathmandu-pashupatinath-temple.mp4,PT00H00M23S,130851_130900,Tibet nepal kathmandu pashupatinath temple
1032743504,https://ak.picdn.net/shutterstock/videos/1032743504/preview/stock-footage-boy-writing-on-chalkboard-math-equation-solving-exercise-education-reform.mp4,PT00H00M07S,145701_145750,"Boy writing on chalkboard math equation, solving exercise, education reform"
9157640,https://ak.picdn.net/shutterstock/videos/9157640/preview/stock-footage-zoom-out-of-flax-seeds-on-white-background-this-video-was-shoot-using-custom-light-set-up-with.mp4,PT00H00M08S,075001_075050,Zoom out of flax seeds on white background 3. this video was shoot using custom light set up with additional custom build underneath light system to eliminate shadows.
1029695798,https://ak.picdn.net/shutterstock/videos/1029695798/preview/stock-footage-quiet-beach-with-long-tail-boats-in-koh-tao-thailand.mp4,PT00H00M12S,195651_195700,"Quiet beach with long tail boats in koh tao, thailand"
24907391,https://ak.picdn.net/shutterstock/videos/24907391/preview/stock-footage-world-money-animation-white-background-in-loop-frames-created-in-k-alpha-matte.mp4,PT00H00M45S,176601_176650,"World money animation. white background, 2 in 1, loop (151-450 frames), created in 4k, alpha matte, 3d animation"
1013797244,https://ak.picdn.net/shutterstock/videos/1013797244/preview/stock-footage-cheerful-teen-girl-young-person-woman-in-the-city-closeup-sliding-digital-tablet.mp4,PT00H00M14S,021901_021950,Cheerful teen girl young person woman in the city closeup sliding digital tablet
1018457737,https://ak.picdn.net/shutterstock/videos/1018457737/preview/stock-footage-renewable-solar-energy-shot-on-drone.mp4,PT00H00M07S,024851_024900,Renewable solar energy. shot on drone
4887125,https://ak.picdn.net/shutterstock/videos/4887125/preview/stock-footage-amsterdam-the-netherlands-circa-amsterdam-canal-view.mp4,PT00H00M11S,042051_042100,"Amsterdam, the netherlands - circa 2012: amsterdam canal view"
32296039,https://ak.picdn.net/shutterstock/videos/32296039/preview/stock-footage-time-lapse-of-rotating-growing-and-blooming-red-hyacinth-christmas-flower-b-w-in-png-format-with.mp4,PT00H00M30S,129951_130000,"Time-lapse of rotating, growing and blooming red hyacinth christmas flower 1b1w in png+ format with alpha transparency channel isolated on white background
"
1882954,https://ak.picdn.net/shutterstock/videos/1882954/preview/stock-footage-beautiful-sunset-over-the-ocean-with-sun-rays.mp4,PT00H00M10S,135901_135950,Beautiful sunset over the ocean with sun rays
1011531782,https://ak.picdn.net/shutterstock/videos/1011531782/preview/stock-footage-young-happy-caucasian-woman-using-smartphone-at-brooklyn-bridge-new-york-female-businesswoman.mp4,PT00H00M14S,039051_039100,"Young happy caucasian woman using smartphone at brooklyn bridge, new york. female businesswoman uses shopping app 4k."
1011239480,https://ak.picdn.net/shutterstock/videos/1011239480/preview/stock-footage-traditional-mexican-enchiladas-with-chicken-meat-spicy-tomato-sauce-and-cheese-on-a-plate-mexican.mp4,PT00H00M10S,075201_075250,"Traditional mexican enchiladas with chicken meat, spicy tomato sauce and cheese on a plate. mexican cuisine."
32823487,https://ak.picdn.net/shutterstock/videos/32823487/preview/stock-footage-time-lapse-of-growing-albuca-plant.mp4,PT00H00M13S,069901_069950,Time-lapse of growing albuca plant 
1015283467,https://ak.picdn.net/shutterstock/videos/1015283467/preview/stock-footage-woman-in-a-black-hat-and-a-leather-jacket-walking-in-the-mountains.mp4,PT00H00M15S,002301_002350,Woman in a black hat and a leather jacket walking in the mountains
1027341242,https://ak.picdn.net/shutterstock/videos/1027341242/preview/stock-footage-voronezh-russia-august-guests-at-the-wedding-congratulate-the-bride-and-groom-at-the.mp4,PT00H00M10S,032701_032750,"Voronezh, russia - august 18, 2018: guests at the wedding congratulate the bride and groom at the wedding ceremony."
1007994082,https://ak.picdn.net/shutterstock/videos/1007994082/preview/stock-footage-professional-video-of-palm-tree-sunset-in-hawaii-in-k-slow-motion-fps.mp4,PT00H00M27S,020101_020150,Professional video of palm tree sunset in hawaii in 4k slow motion 60fps
1026029804,https://ak.picdn.net/shutterstock/videos/1026029804/preview/stock-footage-live-breathing-fish-with-a-cut-belly-and-caviar-nearby-lies-on-a-wooden-table.mp4,PT00H00M08S,088401_088450,Live breathing fish with a cut belly and caviar nearby lies on a wooden table
1809173,https://ak.picdn.net/shutterstock/videos/1809173/preview/stock-footage-light-dance-d-animation-clip-is-loopable-rendered-in-hd.mp4,PT00H00M06S,135601_135650,Light dance 3d animation. clip is loopable. rendered in hd.
35012566,https://ak.picdn.net/shutterstock/videos/35012566/preview/stock-footage-young-caucasian-woman-using-a-smartphone-in-winter-snowy-time.mp4,PT00H00M09S,052551_052600,Young caucasian woman using a smartphone in winter snowy time.
1012685264,https://ak.picdn.net/shutterstock/videos/1012685264/preview/stock-footage-warsaw-poland-wind-turbine-on-poland-field-aerial-view.mp4,PT00H00M32S,071501_071550,"Warsaw, poland : wind turbine on poland field. aerial view"
1010915249,https://ak.picdn.net/shutterstock/videos/1010915249/preview/stock-footage-holbox-island-sunset-beach-in-mexico-at-caribbean-sea.mp4,PT00H00M30S,038051_038100,Holbox island sunset beach in mexico at caribbean sea
14337364,https://ak.picdn.net/shutterstock/videos/14337364/preview/stock-footage-paris-may-tourists-in-front-of-the-grand-palais.mp4,PT00H00M07S,140701_140750,Paris - may 2015: tourists in front of the grand palais
1027489913,https://ak.picdn.net/shutterstock/videos/1027489913/preview/stock-footage-wing-of-the-plane-on-blue-sky-background-and-snowy-mountains-below-view-from-window-of-a-jet-plane.mp4,PT00H00M16S,027451_027500,"Wing of the plane on blue sky background and snowy mountains below, view from window of a jet plane wing with beautiful weather in the summer. video applied to tourism operators .traveling concept"
1062055660,https://ak.picdn.net/shutterstock/videos/1062055660/preview/stock-footage-italy-autumn-mountain-landscape-in-campania-southern-italy-november.mp4,PT00H00M26S,029601_029650,"Italy : autumn mountain landscape in campania,southern italy,november 8,2020."
1035625703,https://ak.picdn.net/shutterstock/videos/1035625703/preview/stock-footage-the-beach-and-rocks-with-seascape-and-white-cloud-and-blue-sky-background.mp4,PT00H00M15S,084901_084950,The beach and rocks with seascape and white cloud and blue sky background
1006671079,https://ak.picdn.net/shutterstock/videos/1006671079/preview/stock-footage-animation-of-flashing-light-bulbs-for-projectors-behind-a-metal-lattice-on-wall-for-stage-lights.mp4,PT00H00M20S,089151_089200,Animation of flashing light bulbs for projectors behind a metal lattice on wall for stage lights. animation of seamless loop.
1027438139,https://ak.picdn.net/shutterstock/videos/1027438139/preview/stock-footage-infographic-element-simple-bar-chart.mp4,PT00H00M05S,087801_087850,Infographic element - simple bar chart
1017639415,https://ak.picdn.net/shutterstock/videos/1017639415/preview/stock-footage-new-york-city-times-square-commercial-billboard-screens-timelapse-k-bright-flashy-ads.mp4,PT00H00M06S,145201_145250,New york city 18 08 2017 times square commercial billboard screens timelapse 4k bright flashy ads buildings. consumerism
7868218,https://ak.picdn.net/shutterstock/videos/7868218/preview/stock-footage-sunrise-over-the-river-near-the-houses.mp4,PT00H00M29S,021851_021900,Sunrise over the river near the houses.
1033035761,https://ak.picdn.net/shutterstock/videos/1033035761/preview/stock-footage-vilnius-lithuania-june-inside-the-church-of-st-casimir.mp4,PT00H00M10S,036101_036150,"Vilnius, lithuania,2019,june, inside the church of st. casimir"
1023734176,https://ak.picdn.net/shutterstock/videos/1023734176/preview/stock-footage-wild-snake-coronella-austriaca-attacks-the-camera.mp4,PT00H00M10S,104001_104050,Wild snake coronella austriaca attacks the camera
1038360647,https://ak.picdn.net/shutterstock/videos/1038360647/preview/stock-footage-technology-specialist-in-working-uniform-browsing-digital-app-on-tablet-checking-system-performance.mp4,PT00H00M39S,097851_097900,Technology specialist in working uniform browsing digital app on tablet checking system performance of modern alternative wind turbines. ecology concept.
3614717,https://ak.picdn.net/shutterstock/videos/3614717/preview/stock-footage-focus-on-brainstorm-in-the-dictionary.mp4,PT00H00M10S,091351_091400,Focus on brainstorm in the dictionary
1049608273,https://ak.picdn.net/shutterstock/videos/1049608273/preview/stock-footage-spring-melt-water-small-stream-in-the-snow-loop.mp4,PT00H00M09S,018901_018950,"Spring melt water, small stream in the snow, loop"
28573750,https://ak.picdn.net/shutterstock/videos/28573750/preview/stock-footage-young-man-in-hood-play-video-game-sitting-behind-big-monitor-his-eyes-browse-the-monitor.mp4,PT00H00M29S,020701_020750,Young man in hood play video game sitting behind big monitor. his eyes browse the monitor.
1023875677,https://ak.picdn.net/shutterstock/videos/1023875677/preview/stock-footage-tv-grainy-screen-specific-to-analog-television-zoom-in.mp4,PT00H00M21S,010401_010450,Tv grainy screen specific to analog television (zoom in)
28940863,https://ak.picdn.net/shutterstock/videos/28940863/preview/stock-footage-lesbian-couple-interacting-with-each-other-while-having-breakfast-at-home.mp4,PT00H00M14S,101351_101400,Lesbian couple interacting with each other while having breakfast at home
1061442424,https://ak.picdn.net/shutterstock/videos/1061442424/preview/stock-footage-zaporozhye-ukraine-october-girl-with-stroller-crosses-the-road-on-the-street-of-the.mp4,PT00H00M27S,177151_177200,"Zaporozhye, ukraine - october 28, 2020: girl with stroller crosses the road on the street of the city in the evening"
1026341234,https://ak.picdn.net/shutterstock/videos/1026341234/preview/stock-footage-beautiful-young-woman-do-eye-test-at-clinic-sitting-in-front-of-doctor-in-white-medical-coat.mp4,PT00H00M07S,087151_087200,Beautiful young woman do eye test at clinic sitting in front of doctor in white medical coat looking in eye test machine and smiling. mature optometrist examining patient in office. camera moves right
1019900500,https://ak.picdn.net/shutterstock/videos/1019900500/preview/stock-footage-sea-wave-slow-motion-close-up-bokeh.mp4,PT00H00M15S,093651_093700,"Sea wave, slow motion, close up, bokeh"
3055393,https://ak.picdn.net/shutterstock/videos/3055393/preview/stock-footage-water-lily-five-shots.mp4,PT00H00M29S,125751_125800,"Water lily,  five shots"
1035670787,https://ak.picdn.net/shutterstock/videos/1035670787/preview/stock-footage-tokyo-japan-april-tokyo-container-port-japan-time-lapse.mp4,PT00H00M06S,059551_059600,Tokyo / japan - april 29 2019: tokyo container port japan time lapse
1023222961,https://ak.picdn.net/shutterstock/videos/1023222961/preview/stock-footage-a-macro-shot-of-the-minute-hand-of-the-watch-turning-clockwise-slowly.mp4,PT00H00M27S,193001_193050,A macro shot of the minute hand of the watch turning clockwise slowly
18285514,https://ak.picdn.net/shutterstock/videos/18285514/preview/stock-footage-rent-a-car-video-animation.mp4,PT00H00M10S,124501_124550,"Rent-a-car,video animation"
24680543,https://ak.picdn.net/shutterstock/videos/24680543/preview/stock-footage-professional-makeup-model-blonde-in-a-beauty-salon.mp4,PT00H00M08S,068801_068850,"Professional makeup model , blonde in a beauty salon"
28238158,https://ak.picdn.net/shutterstock/videos/28238158/preview/stock-footage-palanga-lietuva-baltic-sea-seaside-aerial-drone-top-view-k-uhd-video-lithuania.mp4,PT00H00M52S,068951_069000,Palanga lietuva baltic sea seaside. aerial drone top view 4k uhd video lithuania
1012029941,https://ak.picdn.net/shutterstock/videos/1012029941/preview/stock-footage-macro-of-the-yellow-ladybug-psyllobora-vigintiduopunctata-with-black-spots-in-the-inflorescence-of.mp4,PT00H00M09S,076651_076700,Macro of the yellow ladybug psyllobora vigintiduopunctata with black spots in the inflorescence of clover in the foothills of the caucasus
1012867583,https://ak.picdn.net/shutterstock/videos/1012867583/preview/stock-footage-pov-boat-exits-trang-an-cave-in-ninh-binh-vietnam.mp4,PT00H00M22S,065801_065850,Pov boat exits trang an cave in ninh binh vietnam
1344007,https://ak.picdn.net/shutterstock/videos/1344007/preview/stock-footage-high-speed-camera-fire-wood-slow-motion-fps.mp4,PT00H00M30S,107051_107100,High speed camera fire wood 31 slow motion 210fps
1007333611,https://ak.picdn.net/shutterstock/videos/1007333611/preview/stock-footage-water-jets-in-contour-light-on-black-background.mp4,PT00H00M15S,120101_120150,Water jets in contour light on black background
1063500937,https://ak.picdn.net/shutterstock/videos/1063500937/preview/stock-footage-website-coding-coder-web-developer-working-writing-codes-conceptual-d-animation-video-clip.mp4,PT00H00M09S,023201_023250,"Website coding, coder, web developer working, writing codes - conceptual 2d animation video clip with character"
22419700,https://ak.picdn.net/shutterstock/videos/22419700/preview/stock-footage-vessel-cardan-shaft-close-up.mp4,PT00H00M20S,000101_000150,Vessel cardan shaft close up
2976970,https://ak.picdn.net/shutterstock/videos/2976970/preview/stock-footage-northern-green-frog-a-northern-green-frog-in-a-lily-pad-covered-marsh-area-of-the-heart-lake.mp4,PT00H00M10S,189901_189950,"Northern green frog 4. a northern green frog in a lily pad covered marsh area of the heart lake conservation area in ontario, canada."
21629332,https://ak.picdn.net/shutterstock/videos/21629332/preview/stock-footage-aerial-view-attractions-of-yaroslavl-yaroslavl-museum-reserve.mp4,PT00H00M17S,104401_104450,Aerial view attractions of yaroslavl. yaroslavl museum-reserve
1028013395,https://ak.picdn.net/shutterstock/videos/1028013395/preview/stock-footage-aerial-view-of-a-countryside-village-situated-near-hills-during-day-time.mp4,PT00H00M20S,187251_187300,Aerial view of a countryside village situated near hills during day time
8979088,https://ak.picdn.net/shutterstock/videos/8979088/preview/stock-footage-sunset-bright-sky-over-winter-river-shore-with-snowy-evergreen-trees-karelia-russia.mp4,PT00H00M17S,184251_184300,"Sunset bright sky over winter river shore with snowy evergreen trees. karelia, russia"
31294075,https://ak.picdn.net/shutterstock/videos/31294075/preview/stock-footage-welcome-to-delaware-sign-on-interstate-at-maryland-delaware-border.mp4,PT00H00M18S,170951_171000,Welcome to delaware sign on interstate 95 at maryland delaware border
1058647888,https://ak.picdn.net/shutterstock/videos/1058647888/preview/stock-footage-dark-oil-fluid-waving-in-super-slow-motion-abstract-black-fluid-dark-water-splashing-black-metal.mp4,PT00H00M18S,187501_187550,"Dark oil fluid waving in super slow motion. abstract black fluid. dark water splashing. black metal liquid with reflection. metallic fluid, oil surface, fluid, ferrofluid"
1043875531,https://ak.picdn.net/shutterstock/videos/1043875531/preview/stock-footage-portrait-of-a-cute-brunette-with-long-hair-and-a-gray-hat-on-the-background-of-city-houses-and-the.mp4,PT00H00M30S,124651_124700,"Portrait of a cute brunette with long hair and a gray hat on the background of city houses and the river. she checks her smartphone, moves her fingers across the screen"
15860146,https://ak.picdn.net/shutterstock/videos/15860146/preview/stock-footage-london-uk-june-famous-double-decker-red-buses-in-city-traffic-london-welcomes.mp4,PT00H00M17S,123051_123100,"London, uk – june 2015: famous double-decker red buses in city traffic. london welcomes 30 million people annually"
1049598511,https://ak.picdn.net/shutterstock/videos/1049598511/preview/stock-footage-moscow-russia-a-girl-in-black-leggings-runs-on-a-treadmill-in-sneakers-in-a-fitness.mp4,PT00H00M05S,176601_176650,"Moscow, russia, 12-16-2018 a girl in black leggings runs on a treadmill in sneakers in a fitness club."
