videoid,contentUrl,duration,page_dir,name
1033551842,https://ak.picdn.net/shutterstock/videos/1033551842/preview/stock-footage-tracking-shot-of-businesswoman-writing-in-notepad-at-office-desk-while-little-son-sitting-on-her.mp4,PT00H00M28S,092801_092850,Tracking shot of businesswoman writing in notepad at office desk while little son sitting on her knees and typing on laptop; multiethnic business people working in the background
20991718,https://ak.picdn.net/shutterstock/videos/20991718/preview/stock-footage-horrific-female-silhouette-with-knife-grinning-behind-glass-maniac-psychopath-cold-blooded.mp4,PT00H00M12S,193701_193750,"Horrific female silhouette with knife grinning behind glass, maniac, psychopath. cold-blooded killer behind the glass"
8359261,https://ak.picdn.net/shutterstock/videos/8359261/preview/stock-footage-ottawa-canada-november-people-shopping-at-street-vendors-in-the-world-famous-byward.mp4,PT00H00M05S,032451_032500,"Ottawa, canada - november 2014 - people shopping at street vendors in the world famous byward market in preparation for christmas"
965155,https://ak.picdn.net/shutterstock/videos/965155/preview/stock-footage-using-a-tv-remote.mp4,PT00H00M08S,078301_078350,Using a tv remote 
1010737712,https://ak.picdn.net/shutterstock/videos/1010737712/preview/stock-footage-happy-asian-family-baby-with-parent-make-fun-at-home-with-smile-face.mp4,PT00H00M14S,099551_099600,Happy asian family baby with parent make fun at home with smile face.
7024615,https://ak.picdn.net/shutterstock/videos/7024615/preview/stock-footage-water-flowers-natural-landscape.mp4,PT00H00M05S,129301_129350,Water flowers. natural landscape.
1013515838,https://ak.picdn.net/shutterstock/videos/1013515838/preview/stock-footage-young-nice-brunette-man-with-beard-is-watching-photos-on-smartphone-laughing-brick-background.mp4,PT00H00M10S,064751_064800,"Young nice brunette man with beard is watching photos on smartphone, laughing, brick background, communication concept"
1031242352,https://ak.picdn.net/shutterstock/videos/1031242352/preview/stock-footage-front-view-close-up-of-african-american-man-embracing-woman-near-pickup-truck-at-beach-they-are.mp4,PT00H00M07S,087451_087500,Front view close up of african american man embracing woman near pickup truck at beach. they are looking at camera
1014206549,https://ak.picdn.net/shutterstock/videos/1014206549/preview/stock-footage--k-red-circular-abstract-bokeh-particle-background-seamless-loop-check-my-page.mp4,PT00H00M29S,064801_064850,4k red circular abstract bokeh particle background. seamless loop. check my page
1016852959,https://ak.picdn.net/shutterstock/videos/1016852959/preview/stock-footage-video-of-some-long-grass-blowing-in-the-wind.mp4,PT00H00M14S,182801_182850,Video of some long grass blowing in the wind.
10546214,https://ak.picdn.net/shutterstock/videos/10546214/preview/stock-footage-head-horse-and-horsewoman-detail-with-slide.mp4,PT00H00M15S,083151_083200,Head horse and horsewoman detail with slide
32674918,https://ak.picdn.net/shutterstock/videos/32674918/preview/stock-footage-tattoo-artist-make-tattoo-in-studio-tattooing-on-the-body.mp4,PT00H00M14S,049301_049350,"Tattoo artist make tattoo in studio, tattooing on the body."
34709044,https://ak.picdn.net/shutterstock/videos/34709044/preview/stock-footage-bee-keeper-walks-into-frame-with-bees-buzzing-about-his-head-fps.mp4,PT00H00M20S,035451_035500,Bee keeper walks into frame with bees buzzing about his head 50 fps
1032856358,https://ak.picdn.net/shutterstock/videos/1032856358/preview/stock-footage-attractive-young-woman-with-light-brown-hair-uses-smartphone-and-drinks-coffee-in-the-city-center.mp4,PT00H00M29S,171351_171400,Attractive young woman with light brown hair uses smartphone and drinks coffee in the city center
14735806,https://ak.picdn.net/shutterstock/videos/14735806/preview/stock-footage--k-white-puffy-clouds-mass-rolling-over-tibet-mountaintop-valley-river-flowing-through-the.mp4,PT00H00M22S,005401_005450,"4k white puffy clouds mass rolling over tibet mountaintop & valley,river flowing through the prairie,cattle & sheep flocks,danggula(tanggula) mountains in xizang plateau,roof of the world gh2_09186_4k"
1011113525,https://ak.picdn.net/shutterstock/videos/1011113525/preview/stock-footage-luang-prabang-laos-circa-april-nang-songkarn-in-songkarn-festival-or-lao-new-year-at.mp4,PT00H00M11S,058551_058600,"Luang prabang, laos - circa april 2018 - nang songkarn in songkarn festival or lao new year at luang prabang heritage, lao.local people throw water on each other as part of the  new year festival.
"
1007366785,https://ak.picdn.net/shutterstock/videos/1007366785/preview/stock-footage-paraglider-flies-in-the-sky-over-the-cretaceous-mountains.mp4,PT00H00M10S,029601_029650,Paraglider flies in the sky over the cretaceous mountains
1034916890,https://ak.picdn.net/shutterstock/videos/1034916890/preview/stock-footage-white-occult-circle-with-mystical-symbols-with-blinking-old-fashion-retro-cinema-effect-in-seamless.mp4,PT00H00M06S,196351_196400,White occult circle with mystical symbols with blinking old fashion retro cinema effect in seamless loop
1030817021,https://ak.picdn.net/shutterstock/videos/1030817021/preview/stock-footage-photographer-arranges-plates-and-dishes-for-a-food-photography-shoot-shot-on-a-canon-c-in-k.mp4,PT00H00M15S,182051_182100,Photographer arranges plates and dishes for a food photography shoot.  shot on a canon c200 in 4k in 2019.
1015725265,https://ak.picdn.net/shutterstock/videos/1015725265/preview/stock-footage-buffalo-eating-grass-in-a-field-at-thailand.mp4,PT00H00M12S,119151_119200,Buffalo eating grass in a field at thailand.
1018400023,https://ak.picdn.net/shutterstock/videos/1018400023/preview/stock-footage-new-year-text-element-of-periodic-table-germanium-snow-falls-christmas-mood-looped-video-alpha.mp4,PT00H00M05S,084901_084950,"New year text element of periodic table germanium. snow falls. christmas mood, looped video. alpha channel premultiplied - matted with deep blue rgb(04:00:5b)"
1140691,https://ak.picdn.net/shutterstock/videos/1140691/preview/stock-footage-silhouettes-of-young-couple-dancing-on-board-ship-sailing-against-sky-at-night.mp4,PT00H00M17S,139701_139750,Silhouettes of young couple dancing on board ship sailing against sky at night
1042842217,https://ak.picdn.net/shutterstock/videos/1042842217/preview/stock-footage-sleeping-great-horned-owl-with-slow-pan-up.mp4,PT00H00M30S,019301_019350,Sleeping great horned owl with slow pan up
1025826815,https://ak.picdn.net/shutterstock/videos/1025826815/preview/stock-footage-seagulls-and-pelicans-tarpon-springs-fl.mp4,PT00H00M19S,022951_023000,Seagulls and pelicans tarpon springs fl 
14380696,https://ak.picdn.net/shutterstock/videos/14380696/preview/stock-footage-beijing-china-october-driving-through-traffic-in-the-center-of-beijing-on-a-smoggy-day.mp4,PT00H00M09S,021901_021950,"Beijing, china- october 4, 2015: driving through traffic in the center of beijing on a smoggy day"
1029294104,https://ak.picdn.net/shutterstock/videos/1029294104/preview/stock-footage-silhouette-people-a-group-of-offshore-crew-crossing-the-sea-from-barge-to-oil-and-gas-platform.mp4,PT00H00M15S,016901_016950,Silhouette people.a group of offshore crew crossing the sea from barge to oil and gas platform using transfer basket during sunrise.
21377164,https://ak.picdn.net/shutterstock/videos/21377164/preview/stock-footage-close-up-of-feet-of-a-young-beautiful-couple-newlyweds-standing-in-park.mp4,PT00H00M08S,131451_131500,Close-up of feet of a young beautiful couple newlyweds standing in park
1049018572,https://ak.picdn.net/shutterstock/videos/1049018572/preview/stock-footage-woman-using-hand-sanitizer-to-prevent-corona-virus.mp4,PT00H00M14S,178001_178050,Woman using hand sanitizer to prevent corona virus
25427861,https://ak.picdn.net/shutterstock/videos/25427861/preview/stock-footage-beautiful-rocky-coast-italy-waves-crash-into-rocks.mp4,PT00H00M31S,032751_032800,"Beautiful rocky coast, italy. waves crash into rocks. "
1025085956,https://ak.picdn.net/shutterstock/videos/1025085956/preview/stock-footage-the-grass-at-the-sunset.mp4,PT00H00M12S,050501_050550,The grass at the sunset
33249268,https://ak.picdn.net/shutterstock/videos/33249268/preview/stock-footage-coconut-in-dramatic-rotation-closeup-black-background-in-rotation.mp4,PT00H00M52S,142251_142300,"Coconut in dramatic rotation closeup, black background, in rotation"
11554739,https://ak.picdn.net/shutterstock/videos/11554739/preview/stock-footage-beautiful-horses-grazing-horse-grazing-outdoors-over-sunset-meadow-slow-motion-fps-high.mp4,PT00H00M32S,035151_035200,Beautiful horses grazing. horse grazing outdoors over sunset. meadow. slow motion 240 fps. high speed camera. hd 1080p 
28596466,https://ak.picdn.net/shutterstock/videos/28596466/preview/stock-footage-jun-ramenskoe-russia-pilot-performs-aerobatics-figures-with-passenger-in-small-yakovlev.mp4,PT00H00M10S,028851_028900,"Jun 30, 2017 ramenskoe, russia: pilot performs aerobatics figures with passenger in small yakovlev 52. yak-52 is a soviet primary trainer aircraft."
1049069899,https://ak.picdn.net/shutterstock/videos/1049069899/preview/stock-footage-cute-years-girl-wearing-dress-preparing-cake-at-the-white-modern-kitchen-adding-ingredients-for.mp4,PT00H00M28S,148051_148100,Cute 5 years girl wearing dress preparing cake at the white modern kitchen. adding ingredients for cake in glass bowl
1034214536,https://ak.picdn.net/shutterstock/videos/1034214536/preview/stock-footage-a-wheat-field-was-harvested-haystacks-lay-around-it-a-stack-of-hay-field-harvested-from-wheat-at.mp4,PT00H00M17S,146851_146900,A wheat field was harvested; haystacks lay around it. a stack of hay. field harvested from wheat at sunset. the span of the copter over a wheat field. good feed for cattle. beautiful field.
2726717,https://ak.picdn.net/shutterstock/videos/2726717/preview/stock-footage-mountain-range-on-the-frontier-of-chile.mp4,PT00H00M09S,176401_176450,Mountain range on the frontier of chile
1010447468,https://ak.picdn.net/shutterstock/videos/1010447468/preview/stock-footage-log-fire-close-up-to-flames.mp4,PT00H00M17S,191751_191800,Log fire - close up to flames
7004038,https://ak.picdn.net/shutterstock/videos/7004038/preview/stock-footage-young-teenager-doing-homework-drink-cocktail-in-cafe.mp4,PT00H00M14S,022601_022650,"Young teenager doing homework, drink cocktail in cafe
"
1023044653,https://ak.picdn.net/shutterstock/videos/1023044653/preview/stock-footage-toronto-ontario-canada-january-students-protest-government-cuts-to-education-tuition-loans.mp4,PT00H00M28S,068651_068700,"Toronto, ontario, canada january 2019 students protest government cuts to education tuition loans and financial aid"
1045740079,https://ak.picdn.net/shutterstock/videos/1045740079/preview/stock-footage-flowerbed-with-beautiful-flowers-pink-flowers-red-flowers-red-tulips-pink-tulips-yellow-flowers.mp4,PT00H00M09S,038851_038900,Flowerbed with beautiful flowers. pink flowers red flowers red tulips pink tulips yellow flowers red pink 
1061724376,https://ak.picdn.net/shutterstock/videos/1061724376/preview/stock-footage-circa-in-this-animated-film-people-use-chainsaws-and-machetes-to-attack-each-other-in-the.mp4,PT00H01M04S,184851_184900,"Circa 1979 - in this animated film, people use chainsaws and machetes to attack each other in the woods."
293185,https://ak.picdn.net/shutterstock/videos/293185/preview/stock-footage-boy-behind-table-reads-book-on-white-background.mp4,PT00H00M10S,181701_181750,Boy behind table reads book. on white background. 
11333252,https://ak.picdn.net/shutterstock/videos/11333252/preview/stock-footage-runners-feet-in-a-sneakers-close-up-realistic-three-dimensional-animation.mp4,PT00H00M06S,022051_022100,Runners feet in a sneakers close up. realistic three dimensional animation.
1036925195,https://ak.picdn.net/shutterstock/videos/1036925195/preview/stock-footage-young-attractive-woman-getting-spa-treatment-over-white-background.mp4,PT00H00M17S,178001_178050,Young attractive woman getting spa treatment over white background
19239688,https://ak.picdn.net/shutterstock/videos/19239688/preview/stock-footage-girl-tourist-walks-through-the-old-town.mp4,PT00H00M09S,069201_069250,Girl tourist walks through the old town
11452955,https://ak.picdn.net/shutterstock/videos/11452955/preview/stock-footage-chipmunk-taking-pine-nuts-from-hand-and-lays-them-in-the-cheek-pouches.mp4,PT00H00M24S,037551_037600,Chipmunk taking pine nuts from hand and lays them in the cheek pouches
7269085,https://ak.picdn.net/shutterstock/videos/7269085/preview/stock-footage-violin-and-music-notes-dancing-silhouette-on-white-background.mp4,PT00H00M14S,052451_052500,Violin and music notes dancing silhouette on white background 
33520675,https://ak.picdn.net/shutterstock/videos/33520675/preview/stock-footage-old-caucasian-woman-watches-television-in-living-room-and-she-is-sad.mp4,PT00H00M34S,180051_180100,Old caucasian woman watches television in living room and she is sad
34206340,https://ak.picdn.net/shutterstock/videos/34206340/preview/stock-footage-georgia-mestia-agu-nature-and-cultural-details.mp4,PT00H00M11S,186851_186900,Georgia mestia agu 2016: nature and cultural details
1040350334,https://ak.picdn.net/shutterstock/videos/1040350334/preview/stock-footage-motion-footage-of-a-bus-stop-platform-miami-dade-fl-usa.mp4,PT00H00M29S,008851_008900,Motion footage of a bus stop platform miami dade fl usa
1037339729,https://ak.picdn.net/shutterstock/videos/1037339729/preview/stock-footage-flying-over-the-marina-and-cargo-port-for-ships-in-the-sea-multi-colored-yachts-aerial-shot.mp4,PT00H00M22S,087101_087150,Flying over the marina and cargo port for ships in the sea. multi-colored yachts. aerial shot
7397593,https://ak.picdn.net/shutterstock/videos/7397593/preview/stock-footage-closeup-face-of-a-beautiful-expressive-girl-winks-of-one-eye-portrait-of-a-caucasian-woman-with.mp4,PT00H00M05S,103251_103300,Closeup face of a beautiful expressive girl winks of one eye. portrait of a caucasian woman with flirt behavior. full hd video clip.
1041160411,https://ak.picdn.net/shutterstock/videos/1041160411/preview/stock-footage-loop-d-rings-in-rainbow-colours-rotate-very-relaxing-k.mp4,PT00H00M10S,086901_086950,"Loop, 3d rings in rainbow colours rotate, very relaxing, 4k"
27014860,https://ak.picdn.net/shutterstock/videos/27014860/preview/stock-footage-teardrop-florarium-of-glass.mp4,PT00H00M51S,119051_119100,Teardrop florarium of glass
1018838194,https://ak.picdn.net/shutterstock/videos/1018838194/preview/stock-footage-alluring-asian-dancer-pirouettes-in-industrial-wood-and-brick-windowed-workshop-during-daytime.mp4,PT00H00M42S,028151_028200,Alluring asian dancer pirouettes in industrial wood and brick windowed workshop during daytime. wide to long shot on 4k red camera.
1014212258,https://ak.picdn.net/shutterstock/videos/1014212258/preview/stock-footage-the-camera-descends-down-over-the-forest-near-the-road-shevelev.mp4,PT00H00M11S,028951_029000,The camera descends down over the forest near the road. shevelev.
1050165916,https://ak.picdn.net/shutterstock/videos/1050165916/preview/stock-footage-adult-woman-disapproving-with-no-sign-make-negation-finger-gesture-denying-rejecting-disagree.mp4,PT00H00M12S,045351_045400,"Adult woman disapproving with no sign make negation finger gesture. denying, rejecting, disagree, portrait of beautiful mature lady."
20279860,https://ak.picdn.net/shutterstock/videos/20279860/preview/stock-footage-pan-down-to-a-band-shell-in-a-park-in-summer.mp4,PT00H00M08S,059801_059850,Pan down to a band shell in a park in summer
1035562346,https://ak.picdn.net/shutterstock/videos/1035562346/preview/stock-footage-robotic-human-hold-smartphone-with-cybernetic-prosthesis-bionic-robot-arm-prosthetic-hand-cyborg.mp4,PT00H00M06S,087201_087250,Robotic human hold smartphone with cybernetic prosthesis. bionic robot arm. prosthetic hand. cyborg concept with mobile phone. disabled guy with telephone. boy amputee without arms - cyborg close up.
20814730,https://ak.picdn.net/shutterstock/videos/20814730/preview/stock-footage-healthy-homemade-salad-of-boiled-beetroot-ready-to-eat-close-up-rotates-plate-with-boiled-red-beet.mp4,PT00H00M15S,096051_096100,"Healthy homemade salad of boiled beetroot ready to eat, close up. rotates plate with boiled red beet"
23347168,https://ak.picdn.net/shutterstock/videos/23347168/preview/stock-footage-cuban-bright-lizard-in-the-sand.mp4,PT00H00M14S,002051_002100,Cuban bright lizard in the sand
1019119369,https://ak.picdn.net/shutterstock/videos/1019119369/preview/stock-footage-athletic-man-shows-his-muscles-off-in-slow-motion.mp4,PT00H00M10S,181551_181600,Athletic man shows his muscles off in slow motion
18630674,https://ak.picdn.net/shutterstock/videos/18630674/preview/stock-footage-aerial-drone-view-of-peaceful-river-after-sunset-cinematic-nature-beauty.mp4,PT00H00M52S,123151_123200,Aerial drone view of peaceful river after sunset - cinematic nature beauty
12054803,https://ak.picdn.net/shutterstock/videos/12054803/preview/stock-footage-strasbourg-france-oct-demonstrators-protesting-against-turkish-president-recep-tayyip.mp4,PT00H00M17S,080501_080550,"Strasbourg, france - oct 4, 2015 demonstrators protesting against turkish president recep tayyip erdogan's visit to strasbourg - woman protesting from stage in german language against erdogan"
12401687,https://ak.picdn.net/shutterstock/videos/12401687/preview/stock-footage-shot-of-travelling-inside-barbwire-fence.mp4,PT00H00M08S,191751_191800,Shot of travelling inside barbwire fence
1020599941,https://ak.picdn.net/shutterstock/videos/1020599941/preview/stock-footage-man-in-knitted-sweater-hanging-christmas-wreath-above-stone-authentic-fireplace-decorated-with.mp4,PT00H00M10S,183751_183800,Man in knitted sweater hanging christmas wreath above stone authentic fireplace decorated with colorful flashing garland lights. new year holidays preparation and decoration. close view dolly shot.
28207774,https://ak.picdn.net/shutterstock/videos/28207774/preview/stock-footage-girl-on-the-beach.mp4,PT00H00M10S,122001_122050,Girl on the beach
1063318531,https://ak.picdn.net/shutterstock/videos/1063318531/preview/stock-footage-the-yellow-moon-moving-on-the-sky-at-night-time-with-the-shadow-of-the-tree-in-estonia.mp4,PT00H00M20S,056251_056300,The yellow moon moving on the sky at night time with the shadow of the tree in estonia
1021653562,https://ak.picdn.net/shutterstock/videos/1021653562/preview/stock-footage-vertical-video-flying-above-the-clouds-view-from-the-cockpit-aircraft.mp4,PT00H00M17S,120151_120200,Vertical video flying above the clouds view from the cockpit aircraft.
1012378982,https://ak.picdn.net/shutterstock/videos/1012378982/preview/stock-footage-flight-over-yellow-rapeseed-flowers-on-the-field-bird-s-eye-view.mp4,PT00H00M19S,001051_001100,Flight over yellow rapeseed flowers on the field. bird's eye view.
16337797,https://ak.picdn.net/shutterstock/videos/16337797/preview/stock-footage-preparation-of-food-in-the-hospital.mp4,PT00H00M10S,180301_180350,Preparation of food in the hospital.
1010639831,https://ak.picdn.net/shutterstock/videos/1010639831/preview/stock-footage-a-lot-of-drugs-and-cocaine-on-the-table-of-a-criminal-financial-organization-the-drug-dealer-sells.mp4,PT00H00M20S,066951_067000,A lot of drugs and cocaine on the table of a criminal financial organization. the drug dealer sells the goods to the client. criminal activity.
32212024,https://ak.picdn.net/shutterstock/videos/32212024/preview/stock-footage-little-boy-having-fun-with-snow-in-winter-day.mp4,PT00H00M08S,111251_111300,Little boy having fun with snow in winter day
28975114,https://ak.picdn.net/shutterstock/videos/28975114/preview/stock-footage-panoramic-view-of-the-islands-of-the-maldives-blue-green-water-and-mountains-covered-with-trees.mp4,PT00H00M11S,142551_142600,"Panoramic view of the islands of the maldives, blue-green water and mountains covered with trees, tourists raft on the water, wide angle action camera"
21380029,https://ak.picdn.net/shutterstock/videos/21380029/preview/stock-footage-vienna-austria-august-beautiful-architecture-and-people-of-the-city-vienna-austria.mp4,PT00H00M10S,141501_141550,"Vienna, austria. august 28 2016: beautiful architecture and people of the city vienna, austria"
1060761766,https://ak.picdn.net/shutterstock/videos/1060761766/preview/stock-footage-a-growing-sunflower-sways-in-the-wind.mp4,PT00H00M16S,171301_171350,A growing sunflower sways in the wind
27553009,https://ak.picdn.net/shutterstock/videos/27553009/preview/stock-footage-abu-dhabi-modern-city-skyline-and-marina-time-lapse-abu-dhabi-united-arab-emirates-uae.mp4,PT00H00M14S,057851_057900,"Abu dhabi. modern city skyline and marina time lapse, abu dhabi, united arab emirates, uae"
1035008819,https://ak.picdn.net/shutterstock/videos/1035008819/preview/stock-footage-washington-d-c-usa-april-people-at-the-atlantic-arch-of-the-world-war-ii-memorial.mp4,PT00H00M36S,141651_141700,"Washington, d.c. / usa - april 21, 2019:
people at the atlantic arch of the world war ii memorial by evening. washington, d.c., usa."
26793547,https://ak.picdn.net/shutterstock/videos/26793547/preview/stock-footage-dice-rolling-against-black-background-slow-motion-k.mp4,PT00H00M42S,136001_136050,"Dice rolling against black background, slow motion 4k"
1021391881,https://ak.picdn.net/shutterstock/videos/1021391881/preview/stock-footage-green-cheeked-parakeet-or-green-cheeked-conure-biting-a-syringe-on-the-tiled-floor.mp4,PT00H00M39S,045601_045650,Green-cheeked parakeet or green-cheeked conure biting a syringe on the tiled floor.
10774175,https://ak.picdn.net/shutterstock/videos/10774175/preview/stock-footage-bees-build-honeycombs-and-honey-close-to-them.mp4,PT00H00M19S,074101_074150,Bees build honeycombs and honey close to them.
3594983,https://ak.picdn.net/shutterstock/videos/3594983/preview/stock-footage-beautiful-woman-on-the-beach.mp4,PT00H00M18S,145351_145400,Beautiful woman on the beach.
4783772,https://ak.picdn.net/shutterstock/videos/4783772/preview/stock-footage-serious-black-couple.mp4,PT00H00M20S,006501_006550,Serious black couple
1030682687,https://ak.picdn.net/shutterstock/videos/1030682687/preview/stock-footage-girl-trekking-at-coco-de-mer-palm-trees-botanical-garden-fond-ferdinand-nature-reserve-near-anse.mp4,PT00H00M13S,143501_143550,"Girl trekking at coco de mer palm trees botanical garden. fond ferdinand nature reserve, near anse marie-louise, praslin, seychelles. lodoicea maldivica nut or sea coconut forest. third person view."
3699560,https://ak.picdn.net/shutterstock/videos/3699560/preview/stock-footage-winter-timelapse-baikal-lake-in-siberia-slider-shoot.mp4,PT00H00M09S,148601_148650,"Winter timelapse , baikal lake in siberia, slider shoot"
1018581163,https://ak.picdn.net/shutterstock/videos/1018581163/preview/stock-footage-blurred-city-street-view.mp4,PT00H00M10S,126201_126250,Blurred city street view
1044577363,https://ak.picdn.net/shutterstock/videos/1044577363/preview/stock-footage-beautiful-woman-online-store-owner-working-with-laptop-and-cardboard-while-talking-on-mobile-phone.mp4,PT00H00M14S,185001_185050,Beautiful woman online store owner working with laptop and cardboard while talking on mobile phone and lying on the carpet in the living room at home. start up concept. shot in 4k resolution
1046923288,https://ak.picdn.net/shutterstock/videos/1046923288/preview/stock-footage-fly-over-country-road-tracking-car.mp4,PT00H00M16S,184951_185000,Fly over country road tracking car
1016374219,https://ak.picdn.net/shutterstock/videos/1016374219/preview/stock-footage-smiling-girl-in-grass-and-wild-flowers.mp4,PT00H00M18S,082801_082850,Smiling girl in grass and wild flowers
233467,https://ak.picdn.net/shutterstock/videos/233467/preview/stock-footage-bubbles.mp4,PT00H00M10S,091851_091900,Bubbles
1060623514,https://ak.picdn.net/shutterstock/videos/1060623514/preview/stock-footage-aerial-view-of-neuschwanstein-castle-in-forest-mountains-summer-foggy-colourful.mp4,PT00H00M08S,149001_149050,"Aerial: view of neuschwanstein castle in forest,mountains, summer, foggy, colourful "
8961313,https://ak.picdn.net/shutterstock/videos/8961313/preview/stock-footage-brela-beach.mp4,PT00H00M15S,188201_188250,Brela beach
7822477,https://ak.picdn.net/shutterstock/videos/7822477/preview/stock-footage-ugandan-caretaker-giving-a-child-a-drink-of-water.mp4,PT00H00M23S,001501_001550,"Ugandan caretaker giving a child a drink of water,"
7981993,https://ak.picdn.net/shutterstock/videos/7981993/preview/stock-footage-slider-shot-of-the-trees-in-the-forest-on-a-sunny-autumn-day-forest-in-autumn.mp4,PT00H00M13S,067351_067400,Slider shot of the trees in the forest on a sunny autumn day / forest in autumn
25466591,https://ak.picdn.net/shutterstock/videos/25466591/preview/stock-footage-hong-kong-china-feb-the-streets-of-hong-kong.mp4,PT00H00M18S,187601_187650,"Hong kong ,china -  26 feb, 2017 : the streets of hong kong"
18628631,https://ak.picdn.net/shutterstock/videos/18628631/preview/stock-footage-national-flag-of-libya-flying-and-waving-on-the-wind-sate-symbol-of-libyan-nation-and-government.mp4,PT00H00M17S,032651_032700,National flag of libya flying and waving on the wind. sate symbol of libyan nation and government. computer generated animation.
1020969736,https://ak.picdn.net/shutterstock/videos/1020969736/preview/stock-footage-sparkling-glitter-in-the-shape-of-a-star-close-up-on-a-silver-background.mp4,PT00H00M17S,002701_002750,Sparkling glitter in the shape of a star. close-up on a silver background
1014640886,https://ak.picdn.net/shutterstock/videos/1014640886/preview/stock-footage-couple-traveling-in-the-mountains.mp4,PT00H00M21S,072751_072800,Couple traveling in the mountains
1538344,https://ak.picdn.net/shutterstock/videos/1538344/preview/stock-footage-cat-on-a-fence.mp4,PT00H00M13S,195551_195600,Cat on a fence
