videoid,contentUrl,duration,page_dir,name
15320815,https://ak.picdn.net/shutterstock/videos/15320815/preview/stock-footage-dubai-united-arab-emirates-may-culinary-competition-cooks-make-food-on-electric-stove.mp4,PT00H00M32S,002801_002850,"Dubai, united arab emirates - may 20, 2013: culinary competition, cooks make food on electric stove. desk crowded with pans and pots, people busy in cook process, contest judges walk and watch around"
1059421211,https://ak.picdn.net/shutterstock/videos/1059421211/preview/stock-footage-device-screen-pixels-fluctuate-with-video-motion.mp4,PT00H00M14S,136701_136750,Device screen pixels fluctuate with video motion
1027823927,https://ak.picdn.net/shutterstock/videos/1027823927/preview/stock-footage-young-asian-boy-playing-colorful-wooden-blocks-at-home.mp4,PT00H00M09S,023151_023200,Young asian boy playing colorful wooden blocks at home
1032135563,https://ak.picdn.net/shutterstock/videos/1032135563/preview/stock-footage--thailand-phuket-show-performance-with-a-monkey.mp4,PT00H00M12S,176201_176250,09.04.2019 thailand phuket show performance with a monkey
10672454,https://ak.picdn.net/shutterstock/videos/10672454/preview/stock-footage-beautiful-young-woman-in-bathroom-thinking-talking-to-herself.mp4,PT00H00M19S,172451_172500,Beautiful young woman in bathroom thinking talking to herself
22456447,https://ak.picdn.net/shutterstock/videos/22456447/preview/stock-footage-autumn-path-with-leaves-on-the-ground-many-green-trees-as-autumn-is-at-the-beginning.mp4,PT00H00M19S,115051_115100,"Autumn path with leaves on the ground, many green trees as autumn is at the beginning."
1008144532,https://ak.picdn.net/shutterstock/videos/1008144532/preview/stock-footage-abstract-light-particle-motion-loop.mp4,PT00H00M10S,190051_190100,Abstract light particle motion loop
1013057318,https://ak.picdn.net/shutterstock/videos/1013057318/preview/stock-footage-low-clouds-on-the-mountain-peaks.mp4,PT00H00M08S,025951_026000,Low clouds on the mountain peaks
1029889247,https://ak.picdn.net/shutterstock/videos/1029889247/preview/stock-footage-slow-motion-fooatage-of-multiple-seagulls-landing-in-water-near-building-structure.mp4,PT00H00M09S,107901_107950,Slow motion fooatage of multiple seagulls landing in water near building structure.
16969018,https://ak.picdn.net/shutterstock/videos/16969018/preview/stock-footage-colorado-potato-beetle.mp4,PT00H00M20S,001401_001450,Colorado potato beetle
1019673589,https://ak.picdn.net/shutterstock/videos/1019673589/preview/stock-footage-red-block-arrows-moving-upwards-in-front-of-a-corner-of-a-grey-room-with-horizontal-rows-of-dots.mp4,PT00H00M12S,177701_177750,Red block arrows moving upwards in front of a corner of a grey room with horizontal rows of dots
1009962209,https://ak.picdn.net/shutterstock/videos/1009962209/preview/stock-footage-berlin-germany-circa-january-european-city-of-berlin-city-center-pedestrians-crossing.mp4,PT00H00M22S,038751_038800,"Berlin, germany, circa january 2018 - european city of berlin city center pedestrians crossing street"
1049610907,https://ak.picdn.net/shutterstock/videos/1049610907/preview/stock-footage-a-close-up-of-a-starting-fire-in-the-forest-grass-and-nearby-small-trees-burn-careless-handling.mp4,PT00H00M16S,034301_034350,A close-up of a starting fire in the forest. grass and nearby small trees burn. careless handling of fire and summer fire hazard
19034644,https://ak.picdn.net/shutterstock/videos/19034644/preview/stock-footage-pretty-woman-dressed-in-long-red-dress-fan-blowing-on-hair.mp4,PT00H00M10S,132551_132600,"Pretty woman dressed in long red dress, fan blowing on hair"
4069324,https://ak.picdn.net/shutterstock/videos/4069324/preview/stock-footage-ntsc-motion-abstract-film-leader-forms-flicker-and-pulse-loop.mp4,PT00H00M15S,004701_004750,Ntsc - motion 901: abstract film leader forms flicker and pulse (loop).
6246113,https://ak.picdn.net/shutterstock/videos/6246113/preview/stock-footage-hollywood-los-angeles-usa-april-public-transportation-bus-passing-car-traffic-hollywood.mp4,PT00H00M18S,088951_089000,"Hollywood, los angeles, usa - april 3, 2013 public transportation bus passing car traffic hollywood boulevard los angeles la ( ultra high definition, ultra hd, uhd, 4k, 2160p, 4096x2160 )"
1023760807,https://ak.picdn.net/shutterstock/videos/1023760807/preview/stock-footage-beautiful-crystal-chandelier-on-the-ceiling.mp4,PT00H00M07S,094451_094500,Beautiful crystal chandelier on the ceiling
26307608,https://ak.picdn.net/shutterstock/videos/26307608/preview/stock-footage-india-circa-june-old-indian-woman-sells-bananas-outside-hear-salon-crowded-street-mumbai.mp4,PT00H00M10S,171251_171300,"India - circa june 2016 - old indian woman sells bananas outside hear salon, crowded street, mumbai"
23338417,https://ak.picdn.net/shutterstock/videos/23338417/preview/stock-footage-abstract-background-with-magic-lines-seamless-loop.mp4,PT00H00M10S,016701_016750,Abstract background with magic lines. seamless loop
21735064,https://ak.picdn.net/shutterstock/videos/21735064/preview/stock-footage-lake-with-clouds-dawn-landscape.mp4,PT00H00M26S,136851_136900,"Lake with clouds dawn landscape
"
12937964,https://ak.picdn.net/shutterstock/videos/12937964/preview/stock-footage-friends-are-riding-longboards-and-holding-rope-together.mp4,PT00H00M25S,016601_016650,Friends are riding longboards and holding rope together
1045838809,https://ak.picdn.net/shutterstock/videos/1045838809/preview/stock-footage-denver-colorado-the-car-is-going-very-fastly-in-the-roadside.mp4,PT00H00M05S,192451_192500,Denver colorado-1958: the car is going very fastly in the roadside
4573208,https://ak.picdn.net/shutterstock/videos/4573208/preview/stock-footage-smiling-laughing-girl-in-park-with-laptop-yellow-bench-female.mp4,PT00H00M30S,131301_131350,"Smiling laughing girl in park with laptop, yellow bench female"
1008727781,https://ak.picdn.net/shutterstock/videos/1008727781/preview/stock-footage-male-wigeon-duck-foraging-in-grass-for-food-in-snow-slow-motion.mp4,PT00H00M35S,138551_138600,"Male wigeon duck foraging in grass for food in snow slow motion
"
1043793286,https://ak.picdn.net/shutterstock/videos/1043793286/preview/stock-footage-circa-s-an-american-journalist-speaks-with-hungarian-freedom-fighters-street-scenes-show.mp4,PT00H01M41S,109401_109450,Circa 1950s - an american journalist speaks with hungarian freedom fighters. street scenes show revolt in budapest.
13010189,https://ak.picdn.net/shutterstock/videos/13010189/preview/stock-footage-slow-motion-pretty-young-cheerful-woman-playing-snowball-fight-in-winter-forest-standing-among.mp4,PT00H00M22S,044051_044100,Slow motion. pretty young cheerful woman playing snowball fight in winter forest standing among pine branches. 
1061472691,https://ak.picdn.net/shutterstock/videos/1061472691/preview/stock-footage-african-young-romantic-and-happy-couple-in-love-in-the-traditional-outfits-and-in-headphones.mp4,PT00H00M17S,062651_062700,African young romantic and happy couple in love in the traditional outfits and in headphones sitting on the steps in the town street and listening to the music.
31502731,https://ak.picdn.net/shutterstock/videos/31502731/preview/stock-footage-aerial-view-center-city-philadelphia-just-after-sunset.mp4,PT00H00M29S,138501_138550,Aerial view center city philadelphia just after sunset
1040461232,https://ak.picdn.net/shutterstock/videos/1040461232/preview/stock-footage-the-young-bodybuilder-female-student-in-the-gym.mp4,PT00H00M12S,171051_171100,The young bodybuilder female student in the gym
1027084526,https://ak.picdn.net/shutterstock/videos/1027084526/preview/stock-footage-rotating-shot-of-bitcoins-digital-cryptocurrency-bitcoin-litecoin.mp4,PT00H00M29S,000351_000400,Rotating shot of bitcoins digital cryptocurrency - bitcoin litecoin
31489051,https://ak.picdn.net/shutterstock/videos/31489051/preview/stock-footage-lay-out-the-stuffing-with-a-spoon-and-finger-on-the-dough.mp4,PT00H00M18S,015951_016000,Lay out the stuffing with a spoon and finger on the dough
1025948021,https://ak.picdn.net/shutterstock/videos/1025948021/preview/stock-footage-a-boy-eating-fast-food-in-a-restaurant-food-court-and-dipping-nuggets-in-a-plastic-disposable.mp4,PT00H00M13S,007501_007550,"A boy eating fast food in a restaurant, food court and dipping nuggets in a plastic disposable container with sauce, close up"
18428548,https://ak.picdn.net/shutterstock/videos/18428548/preview/stock-footage-at-a-plane-maintenance-base-people-work-developing-ideas-an-airplane-flies-above-clouds-and.mp4,PT00H01M20S,054951_055000,"At a plane maintenance base, people work developing ideas. an airplane flies above clouds and passengers have a good time on board in 1959. (1950s)"
13554875,https://ak.picdn.net/shutterstock/videos/13554875/preview/stock-footage-circa-s-a-new-air-force-jet-plane-takes-flight-in.mp4,PT00H00M45S,072201_072250,Circa 1930s - a new air force jet plane takes flight in 1939.
3529658,https://ak.picdn.net/shutterstock/videos/3529658/preview/stock-footage-tractor-rides-away-over-cobbled-road-in-rural-landscape-waterloo-battlefield-monument-at-horizon.mp4,PT00H00M09S,187251_187300,"Tractor rides away over cobbled road in rural landscape + waterloo battlefield  monument at horizon. the battle of waterloo was fought on june 18, 1815."
1063729420,https://ak.picdn.net/shutterstock/videos/1063729420/preview/stock-footage-martin-luther-king-day-animated-footage-with-american-flag.mp4,PT00H00M12S,077051_077100,Martin luther king day animated footage with american flag.
1010476607,https://ak.picdn.net/shutterstock/videos/1010476607/preview/stock-footage-assam-macaque-life-in-forest-monkey-footage.mp4,PT00H00M11S,127051_127100,"Assam macaque life in forest,monkey footage"
22887268,https://ak.picdn.net/shutterstock/videos/22887268/preview/stock-footage-metal-hi-tech-slant-squared-smoke-patterns-red-yellow-abstract-loopable-k.mp4,PT00H00M08S,029951_030000,"Metal hi-tech slant squared smoke patterns, red yellow, abstract, loopable, 4k"
1021838851,https://ak.picdn.net/shutterstock/videos/1021838851/preview/stock-footage-stunning-aerial-drone-shot-in-scottish-highlands-high-to-low-reveal-of-portnahaven-on-the-isle-of.mp4,PT00H00M27S,134701_134750,"Stunning aerial drone shot in scottish highlands, high to low reveal of portnahaven on the isle of islay"
11195345,https://ak.picdn.net/shutterstock/videos/11195345/preview/stock-footage-virginia-re-enactment-recreation-of-classic-old-west-s-western-cowboys-lawmen-and.mp4,PT00H00M10S,144751_144800,"Virginia - 2014. re-enactment recreation of classic old west, 1800s western cowboys & lawmen, and outlaws. walking tall, standing and walking with horses in west circa 1870-1890 western cow-town life."
1044877984,https://ak.picdn.net/shutterstock/videos/1044877984/preview/stock-footage-szentendre-hungary-january-winter-aerial-view-of-frosty-forest-in-the-visegrad.mp4,PT00H00M20S,024251_024300,"Szentendre, hungary - january 19, 2020: winter aerial view of frosty forest in the visegrad mountains."
1048356034,https://ak.picdn.net/shutterstock/videos/1048356034/preview/stock-footage-flat-lay-step-by-step-decorating-unicorn-sugar-cookies-with-royal-icing.mp4,PT00H00M40S,071901_071950,Flat lay. step by step. decorating unicorn sugar cookies with royal icing.
1041313039,https://ak.picdn.net/shutterstock/videos/1041313039/preview/stock-footage-cheerful-young-redhead-girl-dancing-and-looking-at-camera-on-white-background.mp4,PT00H00M11S,108251_108300,Cheerful young redhead girl dancing and looking at camera on white background.
10564655,https://ak.picdn.net/shutterstock/videos/10564655/preview/stock-footage-happy-carefree-friends-taking-selfies-outdoors.mp4,PT00H00M22S,115351_115400,Happy carefree friends taking selfies outdoors
1031477357,https://ak.picdn.net/shutterstock/videos/1031477357/preview/stock-footage-shooting-from-the-air-red-haired-sports-woman-enthusiastically-running-along-the-embankment-of-the.mp4,PT00H00M29S,107101_107150,Shooting from the air red-haired sports woman enthusiastically running along the embankment of the city river
1007756242,https://ak.picdn.net/shutterstock/videos/1007756242/preview/stock-footage-slow-motion-falling-soy-on-top-fried-rice.mp4,PT00H00M13S,199201_199250,Slow motion falling soy on top fried rice
7757989,https://ak.picdn.net/shutterstock/videos/7757989/preview/stock-footage-young-couple-smile-with-happiness-with-new-house-keys-for-their-new-apartment.mp4,PT00H00M13S,018101_018150,Young couple smile with happiness with new house keys for their new apartment. 
17452216,https://ak.picdn.net/shutterstock/videos/17452216/preview/stock-footage-field-of-wheat-in-the-beautiful-late-evening-sunshine-wheat-field.mp4,PT00H00M22S,023451_023500,Field of wheat in the beautiful late evening sunshine - wheat field
451198,https://ak.picdn.net/shutterstock/videos/451198/preview/stock-footage-hammock-background.mp4,PT00H00M24S,179601_179650,Hammock background
1025937530,https://ak.picdn.net/shutterstock/videos/1025937530/preview/stock-footage-aerial-shot-of-downhill-skiers-on-snowy-mountain-top-with-stunning-background.mp4,PT00H00M11S,095551_095600,Aerial shot of downhill skiers on snowy mountain top with stunning background
1055900123,https://ak.picdn.net/shutterstock/videos/1055900123/preview/stock-footage-wheat-fiel-in-summertime-with-wind.mp4,PT00H00M15S,054451_054500,Wheat fiel in summertime with wind
1026588893,https://ak.picdn.net/shutterstock/videos/1026588893/preview/stock-footage-falling-stars-spotlight.mp4,PT00H00M30S,036851_036900,Falling stars- spotlight
22763797,https://ak.picdn.net/shutterstock/videos/22763797/preview/stock-footage-altai-russia-june-car-forces-the-river-in-the-kurai-region.mp4,PT00H00M07S,113001_113050,"Altai, russia - june 10, 2016: car forces the river in the kurai region"
1029664484,https://ak.picdn.net/shutterstock/videos/1029664484/preview/stock-footage-portrait-of-relaxed-plus-size-long-haired-model-sitting-on-floor-having-a-voicecall-on-smartphone.mp4,PT00H00M42S,060851_060900,Portrait of relaxed plus size long-haired model sitting on floor having a voicecall on smartphone in cozy home atmosphere.
1009007804,https://ak.picdn.net/shutterstock/videos/1009007804/preview/stock-footage-a-wedding-dress-gloves-girlfriends-wearing-gloves-wedding-in-the-hands-of-the-bride.mp4,PT00H00M10S,006851_006900,"A wedding dress gloves,girlfriends wearing gloves wedding in the hands of the bride"
1028642357,https://ak.picdn.net/shutterstock/videos/1028642357/preview/stock-footage--k-abstract-glitch-technology-background-seamless-loop.mp4,PT00H00M06S,175301_175350,4k abstract glitch technology background. seamless loop.
35038834,https://ak.picdn.net/shutterstock/videos/35038834/preview/stock-footage-aerial-survey-kyiv-national-polytechnic-university-september-beautiful-old-architecture.mp4,PT00H00M17S,186201_186250,"Aerial survey. kyiv national polytechnic university 10. september. 2017. beautiful old architecture of the university. kiev, ukraine. city landscape, autumn day. taken from a bird's flight."
1038920582,https://ak.picdn.net/shutterstock/videos/1038920582/preview/stock-footage-flying-around-the-rocks-of-ai-petri-mountain-overlooking-yalta.mp4,PT00H00M26S,004001_004050,Flying around the rocks of ai petri mountain overlooking yalta
30277924,https://ak.picdn.net/shutterstock/videos/30277924/preview/stock-footage-two-happy-caucasian-couples-laughing-and-having-fun-sailing-on-the-sea-in-their-luxury-yacht-red.mp4,PT00H00M21S,010151_010200,Two happy caucasian couples laughing and having fun sailing on the sea in their luxury yacht red weapon
28991095,https://ak.picdn.net/shutterstock/videos/28991095/preview/stock-footage-full-length-portrait-of-a-boxer-jumping-with-skipping-rope-athletic-muscular-young-boxer.mp4,PT00H00M13S,149751_149800,"Full length portrait of a boxer jumping with skipping rope. athletic, muscular young boxer shirtless with jumping rope ready to jump. middle aged boxer warming up with jumping rope in a fight club"
15273850,https://ak.picdn.net/shutterstock/videos/15273850/preview/stock-footage-doctor-compliting-ultrasound.mp4,PT00H00M30S,193651_193700,Doctor compliting ultrasound
19894681,https://ak.picdn.net/shutterstock/videos/19894681/preview/stock-footage-the-redwood-empire-special-is-the-longest-heaviest-train-ever-taken-over-the-sierra-nevada.mp4,PT00H02M07S,194801_194850,"The redwood empire special is the longest, heaviest train ever taken over the sierra nevada mountain range in one block, at the time of its journey in the 1940s. (1910s)"
34889701,https://ak.picdn.net/shutterstock/videos/34889701/preview/stock-footage-walking-in-the-park.mp4,PT00H00M10S,049101_049150,Walking in the park
22346338,https://ak.picdn.net/shutterstock/videos/22346338/preview/stock-footage-girl-hand-caresses-the-lake-water.mp4,PT00H00M14S,129451_129500,Girl hand caresses the lake water
20894605,https://ak.picdn.net/shutterstock/videos/20894605/preview/stock-footage-wave-washes-up-to-the-shore-slow-motion.mp4,PT00H00M13S,048801_048850,Wave washes up to the shore slow motion
1025577137,https://ak.picdn.net/shutterstock/videos/1025577137/preview/stock-footage-young-saleswoman-insurer-advisor-consulting-old-female-client-looking-at-laptop-showing-business.mp4,PT00H00M14S,076501_076550,"Young saleswoman insurer advisor consulting old female client looking at laptop showing business presentation, broker manager having conversation convincing customer to take loan or buy bank services"
1029449618,https://ak.picdn.net/shutterstock/videos/1029449618/preview/stock-footage-amber-lights-k-abstract-background.mp4,PT00H00M01S,000551_000600,Amber lights 4k abstract background
1016633461,https://ak.picdn.net/shutterstock/videos/1016633461/preview/stock-footage-relax-on-a-yacht-a-sympathetic-girl-on-a-yacht-with-champagne-in-her-hands-the-wind-develops-a.mp4,PT00H00M14S,040551_040600,"Relax on a yacht, a sympathetic girl on a yacht, with champagne in her hands, the wind develops a handkerchief on her shoulders. slow motion, hd, 1920x1080"
25571591,https://ak.picdn.net/shutterstock/videos/25571591/preview/stock-footage-the-end-of-winter-a-forest-trickle-slow-motion.mp4,PT00H00M20S,078101_078150,"The end of winter, a forest trickle. slow motion"
1022367562,https://ak.picdn.net/shutterstock/videos/1022367562/preview/stock-footage-a-large-waterfall-with-a-height-of-meters-is-located-km-above-the-village-of-arslanbob-small.mp4,PT00H00M06S,105651_105700,A large waterfall with a height of 80 meters is located 8 km above the village of arslanbob. small (23 meters) is located near the walnut forest arslanbob (the largest walnut forest created by nature)
1821581,https://ak.picdn.net/shutterstock/videos/1821581/preview/stock-footage-japanese-flag-hd-looped.mp4,PT00H00M12S,026751_026800,Japanese flag hd. looped.
1034881895,https://ak.picdn.net/shutterstock/videos/1034881895/preview/stock-footage-closeup-back-view-portrait-of-adult-shirtless-caucasian-man-pulling-up-on-bars-in-the-gym-indoors.mp4,PT00H00M37S,140801_140850,Closeup back view portrait of adult shirtless caucasian man pulling up on bars in the gym indoors
1043585947,https://ak.picdn.net/shutterstock/videos/1043585947/preview/stock-footage-circa-s-viet-cong-men-set-up-weaponry-in-a-forest-and-fire-during-the-vietnam-war.mp4,PT00H01M09S,076951_077000,Circa 1960s - viet cong men set up weaponry in a forest and fire during the vietnam war.
1009811156,https://ak.picdn.net/shutterstock/videos/1009811156/preview/stock-footage-young-man-playing-vr-with-red-and-blue-light.mp4,PT00H00M22S,025351_025400,Young man playing vr with red and blue light
1026112541,https://ak.picdn.net/shutterstock/videos/1026112541/preview/stock-footage-young-water-buffalo-tethered-with-rope-walks-on-meadow-on-the-green-tropical-hills-background.mp4,PT00H00M07S,016151_016200,Young water buffalo tethered with rope walks on meadow on the green tropical hills background. closeup. 4k
1040945852,https://ak.picdn.net/shutterstock/videos/1040945852/preview/stock-footage-funny-little-baby-girl-wearing-parents-glasses-on-bed-shot-in-k-raw-on-a-cinema-camera.mp4,PT00H00M10S,127251_127300,Funny little baby girl wearing parents glasses on bed. shot in 4k raw on a cinema camera.
1030459049,https://ak.picdn.net/shutterstock/videos/1030459049/preview/stock-footage-frankfurt-germany-winter-excavator-arm-digging-soil-from-behind-wooden-fence.mp4,PT00H00M22S,049201_049250,"Frankfurt, germany. winter 2014. excavator arm digging soil from behind wooden fence."
1033156208,https://ak.picdn.net/shutterstock/videos/1033156208/preview/stock-footage--marvelous-view-of-splattering-waves-hitting-big-stones-of-alanya-beach-on-a-sunny-day-in-summer-in.mp4,PT00H00M31S,148751_148800, marvelous view of splattering waves hitting big stones of alanya beach on a sunny day in summer in slow motion. 
1009573316,https://ak.picdn.net/shutterstock/videos/1009573316/preview/stock-footage-ground-is-cracking-in-a-drought-in-time-lapse-close-up-shot.mp4,PT00H00M27S,032601_032650,Ground is cracking in a drought in time lapse close up shot
17409124,https://ak.picdn.net/shutterstock/videos/17409124/preview/stock-footage-animated-technological-sci-fi-hexagon-background-loop.mp4,PT00H00M10S,183101_183150,Animated technological sci-fi hexagon background loop
23718772,https://ak.picdn.net/shutterstock/videos/23718772/preview/stock-footage-coffee-cherries-beans-ripening-on-a-coffea-tree-branch.mp4,PT00H00M17S,125101_125150,Coffee cherries (beans) ripening on a coffea tree branch 
1032051866,https://ak.picdn.net/shutterstock/videos/1032051866/preview/stock-footage-beautiful-blue-sky-with-clouds-background.mp4,PT00H00M12S,054151_054200,Beautiful blue sky with clouds background. 
12171272,https://ak.picdn.net/shutterstock/videos/12171272/preview/stock-footage-a-church-building-with-scaffolding-a-great-piece-of-stock-footage-filmed-in-k-definition-perfect.mp4,PT00H00M22S,145451_145500,"A church building with scaffolding. a great piece of stock footage filmed in 4k definition, perfect for film, tv, documentaries, reality tv, trailers, infomercials and more!"
1007673748,https://ak.picdn.net/shutterstock/videos/1007673748/preview/stock-footage-the-chicken-is-placed-on-grill-grill.mp4,PT00H00M09S,106951_107000,The chicken is placed on grill grill.
1057044782,https://ak.picdn.net/shutterstock/videos/1057044782/preview/stock-footage--d-spiral-endless-tunnel-with-color-changing-lights-abstract-looped-background.mp4,PT00H00M05S,064751_064800,3d  spiral endless tunnel with color changing lights. abstract looped background.
1040971190,https://ak.picdn.net/shutterstock/videos/1040971190/preview/stock-footage-wooden-table-served-with-several-dishes-decorated-with-candles-and-flowers-pumpkin-soup-baked.mp4,PT00H00M19S,023151_023200,"Wooden table served with several dishes decorated with candles and flowers. pumpkin soup, baked pumpkin, and meat salad served on the table near the window in the modern restaurant"
16269376,https://ak.picdn.net/shutterstock/videos/16269376/preview/stock-footage-led-light-animation-background.mp4,PT00H00M12S,119201_119250,Led light animation background
1013688656,https://ak.picdn.net/shutterstock/videos/1013688656/preview/stock-footage-funny-infant-monkey-assam-macaque.mp4,PT00H00M08S,057451_057500,"Funny infant monkey, assam macaque"
15815341,https://ak.picdn.net/shutterstock/videos/15815341/preview/stock-footage-mixing-colorful-fluids-in-water-creating-abstract-shapes-and-visual-effects.mp4,PT00H00M10S,080601_080650,Mixing colorful fluids in water creating abstract shapes and visual effects
1014526121,https://ak.picdn.net/shutterstock/videos/1014526121/preview/stock-footage-bird-s-eye-drone-shot-of-a-team-of-horses-running-through-mountain-pastures-in-kyrgyzstan.mp4,PT00H00M16S,015051_015100,Bird’s eye drone shot of a team of horses running through mountain pastures in kyrgyzstan
26329691,https://ak.picdn.net/shutterstock/videos/26329691/preview/stock-footage-filling-wine-glass-with-red-wine-super-slow-motion-macro-shot-on-white-background.mp4,PT00H00M17S,082851_082900,Filling wine glass with red wine super slow motion macro shot on white background.
4066570,https://ak.picdn.net/shutterstock/videos/4066570/preview/stock-footage--s-a-texas-longhorn-cattle-drive.mp4,PT00H00M20S,070251_070300,1890s - a texas longhorn cattle drive.
1015065229,https://ak.picdn.net/shutterstock/videos/1015065229/preview/stock-footage-beautiful-house-in-tranquil-and-sunny-neighborhood-near-tree-pan-left-to-right.mp4,PT00H00M07S,080851_080900,Beautiful house in tranquil and sunny neighborhood near tree - pan - left to right
1027035659,https://ak.picdn.net/shutterstock/videos/1027035659/preview/stock-footage-glass-bottles-on-the-automatic-conveyor-line-at-the-champagne-or-wine-factory-plant-for-bottling.mp4,PT00H00M13S,193201_193250,Glass bottles on the automatic conveyor line at the champagne or wine factory. plant for bottling alcoholic beverages
1053518903,https://ak.picdn.net/shutterstock/videos/1053518903/preview/stock-footage-the-sisters-are-sitting-in-a-poppy-field-smiling-and-enjoying-a-sunny-day.mp4,PT00H00M08S,036551_036600,"The sisters are sitting in a poppy field, smiling and enjoying a sunny day"
802489,https://ak.picdn.net/shutterstock/videos/802489/preview/stock-footage-sexy-woman.mp4,PT00H00M17S,071901_071950,Sexy woman
21482794,https://ak.picdn.net/shutterstock/videos/21482794/preview/stock-footage-work-lacker-wall-people-varnishing-wall-brush.mp4,PT00H00M05S,107801_107850,Work lacker wall/people varnishing wall brush
33667225,https://ak.picdn.net/shutterstock/videos/33667225/preview/stock-footage-minsk-belarus-august-unrecognizable-person-drives-cadillac-escalade-v-drives-on-a.mp4,PT00H00M12S,133601_133650,"Minsk, belarus - august 20, 2017: unrecognizable person drives cadillac escalade 6.2 v8 drives on a road on sunny day. focus on a car's digital dashboard featuring high resolution display."
