videoid,contentUrl,duration,page_dir,name
1024873229,https://ak.picdn.net/shutterstock/videos/1024873229/preview/stock-footage-particles-indian-dancing.mp4,PT00H00M13S,030801_030850,Particles indian dancing 
27739867,https://ak.picdn.net/shutterstock/videos/27739867/preview/stock-footage-pack-shot-of-mediterranean-vegetables-on-black-background-panning-movement-shallow-depth-of-field.mp4,PT00H00M27S,008451_008500,"Pack-shot of mediterranean vegetables on black background, panning movement, shallow depth of field, focus on tomato"
20572759,https://ak.picdn.net/shutterstock/videos/20572759/preview/stock-footage-water-source-tornareccia-in-the-national-park-of-abruzzo-in-italy.mp4,PT00H00M10S,149201_149250,Water source tornareccia in the national park of abruzzo in italy
9323513,https://ak.picdn.net/shutterstock/videos/9323513/preview/stock-footage-entrance-to-the-subway-station-at-th-street-and-columbus-circle-in-manhattan-during-a-snowstorm.mp4,PT00H00M16S,198351_198400,Entrance to the subway station at 58th street and columbus circle in manhattan during a snowstorm
1060321826,https://ak.picdn.net/shutterstock/videos/1060321826/preview/stock-footage-lateral-tracking-shot-of-young-attractive-woman-jogging-on-the-bridge-at-sunrise-morning-aerobic.mp4,PT00H00M08S,069851_069900,Lateral tracking shot of young attractive woman jogging on the bridge at sunrise. morning aerobic training of female runner in open air. fitness and health benefits concept. slow motion cinematic
10158671,https://ak.picdn.net/shutterstock/videos/10158671/preview/stock-footage-budapest-parliament-at-dramatic-sunrise-time-lapse.mp4,PT00H00M09S,063351_063400,Budapest parliament at dramatic sunrise - time lapse
6366131,https://ak.picdn.net/shutterstock/videos/6366131/preview/stock-footage-water-and-debris-flow-in-sava-river-belgrade.mp4,PT00H00M26S,093001_093050,Water and debris flow in sava river belgrade
151372,https://ak.picdn.net/shutterstock/videos/151372/preview/stock-footage-colorful-anthias-reef-fish-on-a-coral-reef-in-the-philippines.mp4,PT00H00M24S,036801_036850,Colorful anthias reef fish on a coral reef in the philippines
34121290,https://ak.picdn.net/shutterstock/videos/34121290/preview/stock-footage-man-checking-time-and-starts-running-on-the-beach-steadycam-shot-slow-motion-shot-at-fps.mp4,PT00H00M19S,047401_047450,"Man checking time and starts running on the beach, steadycam shot, slow motion shot at 240fps
"
1043450848,https://ak.picdn.net/shutterstock/videos/1043450848/preview/stock-footage-dead-leaves-at-the-bottom-of-the-water-and-reflections-of-trees.mp4,PT00H00M15S,097101_097150,Dead leaves at the bottom of the water and reflections of trees
1020664297,https://ak.picdn.net/shutterstock/videos/1020664297/preview/stock-footage-harvester-at-wheat-harvest-agriculture-slow-motion.mp4,PT00H00M18S,070901_070950,"Harvester at wheat harvest, agriculture, slow motion"
1043178439,https://ak.picdn.net/shutterstock/videos/1043178439/preview/stock-footage-business-women-work-with-a-client-two-women-select-a-suitable-option-and-consider-possible.mp4,PT00H00M10S,149851_149900,Business women. work with a client. two women select a suitable option and consider possible options. 4k
33038323,https://ak.picdn.net/shutterstock/videos/33038323/preview/stock-footage-close-up-of-the-wind-flaps-of-a-garland-of-colorful-ribbons-copy-space-k.mp4,PT00H00M15S,083901_083950,Close-up of the wind flaps of a garland of colorful ribbons. copy space 4k
1060623154,https://ak.picdn.net/shutterstock/videos/1060623154/preview/stock-footage-designer-architect-engineer-works-with-blueprints-at-a-construction-site-tools-and-office-for.mp4,PT00H00M16S,075151_075200,"Designer, architect, engineer works with blueprints at a construction site. tools and office for the designer"
12792602,https://ak.picdn.net/shutterstock/videos/12792602/preview/stock-footage-autumn-yellow-trees-and-wind.mp4,PT00H00M37S,066551_066600,Autumn yellow trees and wind
25456265,https://ak.picdn.net/shutterstock/videos/25456265/preview/stock-footage-kaleidoscopic-vj-seamless-loop.mp4,PT00H00M20S,076351_076400,Kaleidoscopic vj seamless loop
1010505062,https://ak.picdn.net/shutterstock/videos/1010505062/preview/stock-footage-woman-brush-the-trees-against-pests-white-paint-color-tree-trunks.mp4,PT00H00M12S,022051_022100,Woman brush the trees against pests. white paint color tree trunks
1020245362,https://ak.picdn.net/shutterstock/videos/1020245362/preview/stock-footage-aerial-shooting-of-prague-main-station.mp4,PT00H00M10S,011101_011150,Aerial shooting of prague main station
1062805348,https://ak.picdn.net/shutterstock/videos/1062805348/preview/stock-footage-three-small-beach-umbrellas-made-of-paper-for-cocktail-stand-in-sand-on-sandy-beach-of-sea-or-ocean.mp4,PT00H00M29S,110001_110050,Three small beach umbrellas made of paper for cocktail stand in sand on sandy beach of sea or ocean shore with blurry sun reflection glare on surface of waves close-up. concept happiness joy relax
8855974,https://ak.picdn.net/shutterstock/videos/8855974/preview/stock-footage-kocani-macedonia-dec-conductor-and-musicians-at-new-year-concert-on-december.mp4,PT00H00M14S,012451_012500,"Kocani, macedonia - dec, 2014: conductor and musicians at new year concert on december 18, 2014, kocani, macedonia."
1017106183,https://ak.picdn.net/shutterstock/videos/1017106183/preview/stock-footage-compasses-draw-a-circle-on-a-piece-of-paper.mp4,PT00H00M08S,036701_036750,Compasses draw a circle on a piece of paper
1018700641,https://ak.picdn.net/shutterstock/videos/1018700641/preview/stock-footage-sitges-aerial-view-by-drone-barcelona-spain-k-video.mp4,PT00H00M40S,033901_033950,"Sitges. aerial view by drone. barcelona, spain. 4k video"
6771043,https://ak.picdn.net/shutterstock/videos/6771043/preview/stock-footage-moscow-mar-people-visit-stands-during-video-equipment-exhibition-in-expo-center-aerial.mp4,PT00H00M10S,127801_127850,"Moscow - mar 12, 2013: people visit stands during video equipment exhibition in expo center. aerial view"
1008998477,https://ak.picdn.net/shutterstock/videos/1008998477/preview/stock-footage-waterfall-in-iceland.mp4,PT00H00M14S,183151_183200,Waterfall in iceland
13342703,https://ak.picdn.net/shutterstock/videos/13342703/preview/stock-footage-circa-s-time-lapse-of-a-sunset-as-seen-on-the-planet-mars.mp4,PT00H00M28S,171151_171200,Circa 2010s - time lapse of a sunset as seen on the planet mars.
1012356725,https://ak.picdn.net/shutterstock/videos/1012356725/preview/stock-footage-manual-sharpening-of-a-knife-on-a-stone.mp4,PT00H00M22S,174201_174250,Manual sharpening of a knife on a stone
1045390780,https://ak.picdn.net/shutterstock/videos/1045390780/preview/stock-footage-sargasso-seaweed-floating-caribbean-beach-mexico-affecting-beaches-riviera-maya.mp4,PT00H00M27S,082001_082050,Sargasso seaweed floating caribbean beach mexico affecting beaches riviera maya
18737897,https://ak.picdn.net/shutterstock/videos/18737897/preview/stock-footage--asian-woman-getting-a-facial-treatment-at-the-health-spa.mp4,PT00H00M32S,196851_196900, asian woman getting a facial treatment at the health spa
1033232603,https://ak.picdn.net/shutterstock/videos/1033232603/preview/stock-footage-laser-lights-show-in-dark-background-you-can-use-it-just-like-overlay.mp4,PT00H00M05S,172401_172450,Laser lights show in dark background. you can use it just like overlay.
1032684416,https://ak.picdn.net/shutterstock/videos/1032684416/preview/stock-footage-fire-flames-igniting-and-burning.mp4,PT00H00M17S,077351_077400,Fire flames igniting and burning
1008283231,https://ak.picdn.net/shutterstock/videos/1008283231/preview/stock-footage-smoke-coming-from-the-right-side-against-black-background.mp4,PT00H00M28S,078501_078550,Smoke coming from the right side against black background
1014459341,https://ak.picdn.net/shutterstock/videos/1014459341/preview/stock-footage-teenage-girls-on-a-chain-swing-carousel-k.mp4,PT00H00M08S,068201_068250,Teenage girls on a chain swing carousel 4k
1063268500,https://ak.picdn.net/shutterstock/videos/1063268500/preview/stock-footage-vertical-video-electric-kettle-with-transparent-walls-water-boils-splashes-bubbles-rise-from-the.mp4,PT00H00M30S,078351_078400,"Vertical video electric kettle with transparent walls. water boils,splashes. bubbles rise from the bottom up. tea or coffee making. measuring scale. black and white teapot. on a white background. 4k"
1053530366,https://ak.picdn.net/shutterstock/videos/1053530366/preview/stock-footage-woman-mannequin-poses-for-video-k-fps.mp4,PT00H00M19S,011851_011900,Woman mannequin poses for video. 4k 59.94 fps
1020793735,https://ak.picdn.net/shutterstock/videos/1020793735/preview/stock-footage-blue-mountains-at-dawn.mp4,PT00H00M14S,115301_115350,Blue mountains at dawn
1044327961,https://ak.picdn.net/shutterstock/videos/1044327961/preview/stock-footage-battle-of-two-knights-in-armor-near-wooden-fortress-knights-are-fighting-against-blue-sky-with-sun.mp4,PT00H00M06S,174401_174450,Battle of two knights in armor near wooden fortress. knights are fighting against blue sky with sun and sea on the beach
1017171409,https://ak.picdn.net/shutterstock/videos/1017171409/preview/stock-footage-tsunami-in-k-resolution.mp4,PT00H00M20S,193201_193250,Tsunami in 4k resolution.
463327,https://ak.picdn.net/shutterstock/videos/463327/preview/stock-footage-beach.mp4,PT00H00M10S,023001_023050,Beach
1023093796,https://ak.picdn.net/shutterstock/videos/1023093796/preview/stock-footage-adult-funny-man-who-manually-counts-the-paper-hundred-dollar-bills-video-portrait-of-a-businessman.mp4,PT00H00M10S,064951_065000,Adult funny man who manually counts the paper hundred-dollar bills.video portrait of a businessman who counts money.
1040625590,https://ak.picdn.net/shutterstock/videos/1040625590/preview/stock-footage-woman-filming-creek-bridge-view-in-california-usa.mp4,PT00H00M08S,064701_064750,"Woman filming creek bridge view in california, usa."
1050144388,https://ak.picdn.net/shutterstock/videos/1050144388/preview/stock-footage-colorful-fireworks-explosion-light-in-the-night-sky-green-screen-animation-new-year-s-eve.mp4,PT00H00M14S,022351_022400,"Colorful fireworks explosion light in the night sky green screen animation. new year's eve fireworks display show. fireworks festival, fireworks celebration, happy new year"
32110465,https://ak.picdn.net/shutterstock/videos/32110465/preview/stock-footage-halloween-pumpkins-with-candle-light-in-the-background-beautiful-bokeh-lights.mp4,PT00H00M07S,021601_021650,Halloween pumpkins with candle light in the background beautiful bokeh lights
24708734,https://ak.picdn.net/shutterstock/videos/24708734/preview/stock-footage-bangkok-thailand-october-a-moment-of-the-erawan-shrine-in-bangkok-thailand.mp4,PT00H00M23S,061101_061150,"Bangkok, thailand - 2016, october 30 : a moment of the erawan shrine in bangkok, thailand. buddhists worship the erawan shrine."
1040104295,https://ak.picdn.net/shutterstock/videos/1040104295/preview/stock-footage-light-explosion-fireworks-with-speed.mp4,PT00H00M10S,030501_030550,Light explosion fireworks with speed
1024576889,https://ak.picdn.net/shutterstock/videos/1024576889/preview/stock-footage-whirlpools-of-the-maelstrom-of-saltstraumen-nordland-norway-aerial-view-beautiful-nature.mp4,PT00H00M15S,019251_019300,"Whirlpools of the maelstrom of saltstraumen, nordland, norway aerial view beautiful nature. saltstraumen is a small strait with one of the strongest tidal currents in the world."
1062918262,https://ak.picdn.net/shutterstock/videos/1062918262/preview/stock-footage-a-man-in-a-balaclava-runs-through-the-forest-and-shoots-a-pistol-the-video-contains-sound.mp4,PT00H00M09S,019301_019350,"A man in a balaclava runs through the forest and shoots a pistol. the video contains sound.
"
10532441,https://ak.picdn.net/shutterstock/videos/10532441/preview/stock-footage-moscow-russian-federation-may-gulf-air-airbus-taxiing-on-the-runway-after-landing.mp4,PT00H00M24S,040751_040800,"Moscow, russian federation - may 26, 2015: gulf air airbus 320 taxiing on the runway after landing, close-up. oficial spotting in domodedovo airport (dme) on may 26, moscow, russian federation"
22578712,https://ak.picdn.net/shutterstock/videos/22578712/preview/stock-footage-concept-oil-production-in-france-oil-pumps-and-french-flag-in-slow-motion-movement.mp4,PT00H00M51S,146201_146250,Concept oil production in france oil pumps and french flag in slow motion movement
1039427885,https://ak.picdn.net/shutterstock/videos/1039427885/preview/stock-footage-soft-gelatin-capsules-fish-oil-pharmaceutical-product-on-white-background.mp4,PT00H00M20S,186751_186800,Soft gelatin capsules fish oil. pharmaceutical product on white background
14403889,https://ak.picdn.net/shutterstock/videos/14403889/preview/stock-footage-cocktail-juice-decorated-with-flowers.mp4,PT00H00M16S,149051_149100,Cocktail juice decorated with flowers
1016471305,https://ak.picdn.net/shutterstock/videos/1016471305/preview/stock-footage-the-guy-is-playing-volleyball-on-the-beach.mp4,PT00H00M11S,063701_063750,The guy is playing volleyball on the beach.
34133593,https://ak.picdn.net/shutterstock/videos/34133593/preview/stock-footage-simmering-zucchini-noodels-in-garlic-butter.mp4,PT00H00M06S,101651_101700,"Simmering zucchini noodels in garlic butter
"
1041031589,https://ak.picdn.net/shutterstock/videos/1041031589/preview/stock-footage-bokeh-of-green-leaves-tropical-forest-trees-in-asia-thailand-sunlight-seen-through-leaves-and.mp4,PT00H00M24S,198351_198400,"Bokeh of green leaves tropical forest trees in asia, thailand.  sunlight seen through leaves and branches with beautiful lens flare in slow motion, background concept."
5039075,https://ak.picdn.net/shutterstock/videos/5039075/preview/stock-footage-barred-mudskippers-periophthalmus-argentilineatus-are-air-breathing-fish-ancient-relatives-of.mp4,PT00H00M32S,068101_068150,Barred mudskippers (periophthalmus argentilineatus) are air-breathing fish; ancient relatives of first terrestrial lifeforms. swimming along a flood plain looking for food in the jungles of borneo.
9653396,https://ak.picdn.net/shutterstock/videos/9653396/preview/stock-footage-paris-france-april-gare-de-l-est-train-station-facade-the-station-is-the-fifth-busiest.mp4,PT00H00M16S,147501_147550,"Paris, france - april 7, 2015: gare de l'est train station facade. the station is the fifth busiest station on the network of paris metro and was opened on 15 november 1907."
20175100,https://ak.picdn.net/shutterstock/videos/20175100/preview/stock-footage-purple-splash-in-the-air-slow-motion-dof-nectar.mp4,PT00H00M32S,038601_038650,Purple splash in the air. slow motion dof. nectar
1007596636,https://ak.picdn.net/shutterstock/videos/1007596636/preview/stock-footage-abstract-background-with-vj-fractal-purple-kaleidoscopic-d-rendering-digital-backdrop-k.mp4,PT00H00M20S,183401_183450,Abstract background with vj fractal purple kaleidoscopic. 3d rendering digital backdrop. 4k animation
1062039613,https://ak.picdn.net/shutterstock/videos/1062039613/preview/stock-footage-joyful-teenage-girl-animation-sliding-on-the-snowy-hill-with-snow-tubes-at-wintertime.mp4,PT00H00M08S,003701_003750,Joyful teenage girl animation sliding on the snowy hill with snow tubes at wintertime
1049681134,https://ak.picdn.net/shutterstock/videos/1049681134/preview/stock-footage-strasbourg-alsace-france-october-traditional-half-timbered-houses-of-petite-france.mp4,PT00H00M09S,191751_191800,"Strasbourg,alsace, france, october 2019:  traditional half timbered houses of petite france. traditional half-timbered houses. pcturesque canals in the medieval fairytale town of strasbourg, unesco wh"
1057407796,https://ak.picdn.net/shutterstock/videos/1057407796/preview/stock-footage-halloween-holiday-concept-background-with-pumpkins-d-rendering.mp4,PT00H00M10S,012101_012150,Halloween holiday concept. background with pumpkins. 3d rendering
1039158563,https://ak.picdn.net/shutterstock/videos/1039158563/preview/stock-footage-kuala-lumpur-malaysia-bored-asian-girls-at-a-night-club.mp4,PT00H00M11S,043051_043100,Kuala lumpur / malaysia - 09 20 2019: bored asian girls at a night club
1027776518,https://ak.picdn.net/shutterstock/videos/1027776518/preview/stock-footage-cinematic-shot-of-an-autumn-forest-by-a-lake-taken-during-the-golden-hour-sunset-hues-of-red.mp4,PT00H00M38S,084801_084850,"Cinematic shot of an autumn forest by a lake taken during the golden hour sunset. hues of red, scarlet and yellow can be seen"
1034129288,https://ak.picdn.net/shutterstock/videos/1034129288/preview/stock-footage-architect-talking-to-camera-on-a-green-screen-chroma-key.mp4,PT00H00M10S,195601_195650,"Architect talking to camera on a green screen, chroma key."
13565090,https://ak.picdn.net/shutterstock/videos/13565090/preview/stock-footage-hanged-man-on-gloomy-background.mp4,PT00H00M26S,058251_058300,Hanged man on gloomy background
25355288,https://ak.picdn.net/shutterstock/videos/25355288/preview/stock-footage-slow-motion-close-up-babe-asian-year-having-fun-on-the-bed-in-the-room-emotionally-expresses.mp4,PT00H00M17S,028351_028400,"Slow motion, close-up, babe asian 1 year,having fun on the bed in the room , emotionally expresses joy"
34294777,https://ak.picdn.net/shutterstock/videos/34294777/preview/stock-footage-close-up-pure-fresh-water-waterfall-in-forest-with-brown-rocks.mp4,PT00H00M14S,142451_142500,Close up.pure fresh water waterfall in forest  with brown rocks.
20446237,https://ak.picdn.net/shutterstock/videos/20446237/preview/stock-footage-moscow-aug-sportsmen-swim-near-piers-during-triathlon-tournament-in-krylatskoye-rowing.mp4,PT00H00M21S,108301_108350,"Moscow - aug 14, 2016: sportsmen swim near piers during triathlon tournament in krylatskoye rowing channel at summer day. timelapse"
16552747,https://ak.picdn.net/shutterstock/videos/16552747/preview/stock-footage-syringa-spring-purple-flowers-lilac-bokeh-purple-lilac.mp4,PT00H00M09S,172701_172750,Syringa. spring purple flowers. lilac bokeh. purple lilac.
24054964,https://ak.picdn.net/shutterstock/videos/24054964/preview/stock-footage-two-business-people-shaking-hands.mp4,PT00H00M05S,112801_112850,Two business people shaking hands 
6703958,https://ak.picdn.net/shutterstock/videos/6703958/preview/stock-footage-marrakech-morocco-may-a-moroccan-man-driving-a-motorcycle-in-the-outskirts-of-marrakech.mp4,PT00H00M26S,018951_019000,"Marrakech, morocco, may 13, 2014. a moroccan man driving a motorcycle in the outskirts of marrakech, morocco, on may 13th, 2014.
"
28329346,https://ak.picdn.net/shutterstock/videos/28329346/preview/stock-footage-southwest-white-home-angled-wide-rising-and-lowering-angled-shot-of-a-southwestern-white-home-in.mp4,PT00H00M30S,083801_083850,"Southwest white home angled wide rising and lowering. angled shot of a southwestern white home in suburban new mexico
"
1022793559,https://ak.picdn.net/shutterstock/videos/1022793559/preview/stock-footage-smoke-or-mist-on-black-background.mp4,PT00H00M20S,091351_091400,Smoke or mist on black background.
1028962070,https://ak.picdn.net/shutterstock/videos/1028962070/preview/stock-footage-turkey-october-a-woman-sitting-on-the-seafront-mediterranean-coast-of-turkey.mp4,PT00H00M33S,065251_065300,"Turkey - october 12, 2018: a woman sitting on the seafront. mediterranean coast of turkey."
10935398,https://ak.picdn.net/shutterstock/videos/10935398/preview/stock-footage-pirate-flag.mp4,PT00H00M08S,148801_148850,Pirate flag
11403866,https://ak.picdn.net/shutterstock/videos/11403866/preview/stock-footage-california-usa-s-a-man-stirs-a-large-pot-full-of-crabs-a-woman-with-a-fishing-pole-holds.mp4,PT00H00M16S,037951_038000,California usa 1940s – a man stirs a large pot full of crabs. a woman with a fishing pole holds up a large fish.
22891669,https://ak.picdn.net/shutterstock/videos/22891669/preview/stock-footage-milirary-airplanes-in-flight-formation-mikoyan-gurevich-mig-fulcrum-of-bulgarian-and-polish-air.mp4,PT00H00M18S,188351_188400,Milirary airplanes in flight formation. mikoyan gurevich mig-29 fulcrum of bulgarian and polish air force air to air 4k ultra high definition video. 
3641756,https://ak.picdn.net/shutterstock/videos/3641756/preview/stock-footage-hd-i-amsterdam-apr-air-france-airplanes-takes-off-at-schiphol-airport.mp4,PT00H00M20S,137251_137300,"Hd1080i amsterdam - apr 12, 2009: air france airplanes takes off at schiphol airport"
16082524,https://ak.picdn.net/shutterstock/videos/16082524/preview/stock-footage-grass-blurred-grass-background-is-closeup-nature-environment-concept-hd-video-footage-x.mp4,PT00H00M07S,074751_074800,Grass. blurred grass background is closeup. nature. environment concept. hd video footage 1920x1080 
1032418028,https://ak.picdn.net/shutterstock/videos/1032418028/preview/stock-footage-drone-video-footage-over-aylesbury-berryfields-new-build-housing-estate-buckinghamshire-england.mp4,PT00H00M15S,029951_030000,"Drone video footage over aylesbury berryfields, new build housing estate, buckinghamshire, england, uk"
1062030880,https://ak.picdn.net/shutterstock/videos/1062030880/preview/stock-footage-ripples-and-sun-glare-on-the-water-while-driving-a-motor-boat.mp4,PT00H00M09S,067201_067250,Ripples and sun glare on the water while driving a motor boat
28725322,https://ak.picdn.net/shutterstock/videos/28725322/preview/stock-footage-waterfall-behind-wooden-bridge-wonderful-shot-that-travels-past-a-wooden-bridge-to-reveal-a.mp4,PT00H00M11S,115551_115600,Waterfall behind wooden bridge - wonderful shot that travels past a wooden bridge to reveal a powerful waterfall in a mystical fairytale environment
40164,https://ak.picdn.net/shutterstock/videos/40164/preview/stock-footage-lake-in-tivoli-theme-park-copenhagen-denmark-no-sound-dv-sony-trv-e.mp4,PT00H00M13S,098201_098250,"Lake in tivoli theme park (copenhagen, denmark) - no sound, dv 4:3, sony trv 110 e"
12288707,https://ak.picdn.net/shutterstock/videos/12288707/preview/stock-footage-bench-in-autumn-park-a-woman-typing-on-a-laptop.mp4,PT00H00M16S,102301_102350,Bench in autumn park. a woman typing on a laptop.
1021171306,https://ak.picdn.net/shutterstock/videos/1021171306/preview/stock-footage-a-working-brewer-holds-a-wooden-container-with-light-beer-malt-in-the-hands-of-metal-beer-tanks.mp4,PT00H00M25S,028901_028950,A working brewer holds a wooden container with light beer malt in the hands of metal beer tanks
1008121936,https://ak.picdn.net/shutterstock/videos/1008121936/preview/stock-footage-animal-bird-two-green-parrots-playing-on-perch-senegal-parrot-poicephalus-senegalus-is-a.mp4,PT00H00M30S,124851_124900,Animal bird two green parrots playing on perch. senegal parrot (poicephalus senegalus) is a poicephalus parrot which is a resident breeder across a wide range of west africa. 
1505534,https://ak.picdn.net/shutterstock/videos/1505534/preview/stock-footage-clouds.mp4,PT00H00M15S,075251_075300,Clouds
1038714755,https://ak.picdn.net/shutterstock/videos/1038714755/preview/stock-footage-medicine-healthcare-and-pediatrics-concept-female-pediatrician-doctor-with-baby-girl-at-clinic.mp4,PT00H00M20S,188951_189000,"Medicine, healthcare and pediatrics concept - female pediatrician doctor with baby girl at clinic or hospital fastening bodysuit buttons"
23109580,https://ak.picdn.net/shutterstock/videos/23109580/preview/stock-footage-puerto-vallarta-traditional-houses-on-hillside.mp4,PT00H00M09S,040451_040500,Puerto vallarta traditional houses on hillside
1056582215,https://ak.picdn.net/shutterstock/videos/1056582215/preview/stock-footage-aerial-video-with-a-view-of-the-kama-river-and-the-village-of-golyany-udmurt-republic-russia-a.mp4,PT00H00M28S,077251_077300,"Aerial video with a view of the kama river and the village of golyany, udmurt republic, russia. a wonderful beach and summer vacation on the coast of a powerful deep river."
16823080,https://ak.picdn.net/shutterstock/videos/16823080/preview/stock-footage-bangkok-busy-street-traffic-k-stock-footage-clip.mp4,PT00H00M23S,177201_177250,Bangkok busy street traffic. 4k stock footage clip.
1008497038,https://ak.picdn.net/shutterstock/videos/1008497038/preview/stock-footage-yellow-flowering-crocuses-close-up-against-white-snow.mp4,PT00H00M14S,002001_002050,Yellow flowering crocuses close-up against white snow.
1024887425,https://ak.picdn.net/shutterstock/videos/1024887425/preview/stock-footage-weekday-in-a-busy-creative-office-trainees-standing-at-the-table-with-computer-and-discussing.mp4,PT00H00M31S,174251_174300,"Weekday in a busy creative office, trainees standing at the table with computer and discussing business ideas"
18439147,https://ak.picdn.net/shutterstock/videos/18439147/preview/stock-footage-soldiers-fight-in-battle-during-the-night-in-russia-in-s.mp4,PT00H00M30S,059701_059750,Soldiers fight in battle during the night in russia in 1975. (1970s)
1064421076,https://ak.picdn.net/shutterstock/videos/1064421076/preview/stock-footage-milan-italy-a-street-artist-playing-a-red-clarinet-in-the-milan-city-center-and-a-tram.mp4,PT00H00M07S,058601_058650,"Milan, italy - 9-15-2020
a street artist playing a red clarinet in the milan city center and a tram passing by"
1023096127,https://ak.picdn.net/shutterstock/videos/1023096127/preview/stock-footage-indian-macaques-robinia-pseudoacacia.mp4,PT00H00M10S,064251_064300,Indian macaques (robinia pseudoacacia)
1019210851,https://ak.picdn.net/shutterstock/videos/1019210851/preview/stock-footage-downtown-toronto-university-avenue-in-autumn.mp4,PT00H00M10S,041751_041800,Downtown toronto- university avenue in autumn
34979251,https://ak.picdn.net/shutterstock/videos/34979251/preview/stock-footage-video-flux-tv-screen-pixels-fluctuate-with-color-and-video-motion-loop.mp4,PT00H00M20S,115551_115600,Video flux 036: tv screen pixels fluctuate with color and video motion (loop).
