videoid,contentUrl,duration,page_dir,name
1015072420,https://ak.picdn.net/shutterstock/videos/1015072420/preview/stock-footage-pink-apron-collection-cooking-up-delicious-salmon-lined-with-sweet-potato-learn-asian-cuisine.mp4,PT00H00M14S,064951_065000,Pink apron collection. cooking up delicious salmon lined with sweet potato. learn asian cuisine.
1022741950,https://ak.picdn.net/shutterstock/videos/1022741950/preview/stock-footage-beautiful-woman-sitting-in-a-cafe.mp4,PT00H00M45S,029951_030000,Beautiful woman sitting in a cafe
1035576641,https://ak.picdn.net/shutterstock/videos/1035576641/preview/stock-footage-bride-s-morning-hands-of-a-bride-close-up-lie-on-a-white-wedding-dress-beautiful-bride-in-a.mp4,PT00H00M06S,064101_064150,Bride's morning. hands of a bride close-up lie on a white  wedding dress. beautiful bride in a white wedding dress.
1052836508,https://ak.picdn.net/shutterstock/videos/1052836508/preview/stock-footage-pile-of-green-plums-at-produce-market.mp4,PT00H00M14S,196951_197000,Pile of green plums at produce market. 
16574842,https://ak.picdn.net/shutterstock/videos/16574842/preview/stock-footage-slow-motion-shot-of-two-adult-men-and-little-boy-kicking-soccer-ball-on-the-beach-in-the-evening.mp4,PT00H00M46S,189201_189250,Slow motion shot of two adult men and little boy kicking soccer ball on the beach in the evening.
30693646,https://ak.picdn.net/shutterstock/videos/30693646/preview/stock-footage-wheels-of-the-steam-locomotive-starting-to-move.mp4,PT00H00M11S,112801_112850,Wheels of the steam locomotive starting to move
1028622980,https://ak.picdn.net/shutterstock/videos/1028622980/preview/stock-footage-real-albanian-flag-waving-in-the-wind.mp4,PT00H00M31S,147001_147050,Real albanian flag waving in the wind. 
15445567,https://ak.picdn.net/shutterstock/videos/15445567/preview/stock-footage-a-young-man-engaged-in-fitness-on-the-beach.mp4,PT00H00M11S,189951_190000,A young man engaged in fitness on the beach
1023170026,https://ak.picdn.net/shutterstock/videos/1023170026/preview/stock-footage-preparation-of-dough-for-baking-homemade-cookies.mp4,PT00H00M10S,130201_130250,Preparation of dough for baking homemade cookies
29741827,https://ak.picdn.net/shutterstock/videos/29741827/preview/stock-footage--k-aerial-drone-quadcopter-footage-of-young-woman-walking-on-beach-with-beach-bag-and-sun-hat-on.mp4,PT00H00M11S,148601_148650,4k aerial drone quadcopter footage of young woman walking on beach with beach bag and sun hat on white sand island in blue water tropical ocean bay on holiday. 
1039374596,https://ak.picdn.net/shutterstock/videos/1039374596/preview/stock-footage-sugar-depilation-of-the-feet-in-the-beauty-salon-rid-of-hair-on-the-legs-sugaring-master.mp4,PT00H00M08S,179201_179250,"Sugar depilation of the feet in the beauty salon. rid of hair on the legs. sugaring. master shugaring applies thick sugar paste on the legs of a young girl, removing hair on the legs. close-up"
12251780,https://ak.picdn.net/shutterstock/videos/12251780/preview/stock-footage-aerial-shot-of-green-field.mp4,PT00H00M10S,178151_178200,Aerial shot of green field
1011933356,https://ak.picdn.net/shutterstock/videos/1011933356/preview/stock-footage-conveyor-transports-tool-devices-in-plant-warehouse.mp4,PT00H00M23S,037751_037800,Conveyor transports tool devices in plant warehouse
1028835770,https://ak.picdn.net/shutterstock/videos/1028835770/preview/stock-footage-panning-the-cloudy-sunset-landscape-with-water-reflection-on-the-marina-at-antelope-island-utah.mp4,PT00H00M09S,027951_028000,"Panning the cloudy sunset landscape with water reflection on the marina at antelope island, utah."
26247737,https://ak.picdn.net/shutterstock/videos/26247737/preview/stock-footage-young-woman-raising-arms-in-victory-standing-on-rock-near-canyon.mp4,PT00H00M16S,004501_004550,"Young woman raising arms in victory standing on rock near canyon
"
31445116,https://ak.picdn.net/shutterstock/videos/31445116/preview/stock-footage-awac-plane-flying-over-head-towards-hurricane-in-ocean.mp4,PT00H00M17S,027901_027950,Awac plane flying over head towards hurricane in ocean
1016463301,https://ak.picdn.net/shutterstock/videos/1016463301/preview/stock-footage-christmas-new-year-holidays-illumination-near-the-moscow-kremlin-at-night-russia.mp4,PT00H00M12S,125651_125700,"Christmas (new year holidays) illumination  near the moscow kremlin at night, russia "
16396933,https://ak.picdn.net/shutterstock/videos/16396933/preview/stock-footage-toronto-canada-circa-april-toronto-police-fire-emergency-services-looking-onto-crime.mp4,PT00H00M05S,088851_088900,"Toronto, canada - circa april 2016: toronto police & fire emergency services, looking onto crime scene of car crash through a convenience store window from behind yellow police line do not cross tape."
4554293,https://ak.picdn.net/shutterstock/videos/4554293/preview/stock-footage-group-of-businesspeople-having-discussion.mp4,PT00H00M24S,029101_029150,Group of businesspeople having discussion
26479913,https://ak.picdn.net/shutterstock/videos/26479913/preview/stock-footage-home-delivery-prepared-meal-service-stocking-freezer-with-homemade-meals-meal-planning-plastic.mp4,PT00H00M22S,044751_044800,Home delivery prepared meal service. stocking freezer with homemade meals. meal planning. plastic freezer bags
1024434434,https://ak.picdn.net/shutterstock/videos/1024434434/preview/stock-footage-aerial-drone-k-birdseye-view-of-homes-in-torrey-pines-near-san-diego-california-during-sunset.mp4,PT00H00M07S,146201_146250,Aerial drone 4k birdseye view of homes in torrey pines near san diego california during sunset
1058273623,https://ak.picdn.net/shutterstock/videos/1058273623/preview/stock-footage-rice-fields-on-bali-island-in-the-indian-ocean.mp4,PT00H00M13S,056251_056300,Rice fields on bali island in the indian ocean 
1053569219,https://ak.picdn.net/shutterstock/videos/1053569219/preview/stock-footage-top-view-of-a-river-in-a-forest-in-eastern-europe-rivers-of-belarus-forest-river-in-belarus.mp4,PT00H00M26S,038351_038400,Top view of a river in a forest in eastern europe.rivers of belarus.forest river in belarus
1040117384,https://ak.picdn.net/shutterstock/videos/1040117384/preview/stock-footage-young-athletic-man-and-woman-in-sportswear-jogging-together-through-forest-while-having-run-workout.mp4,PT00H00M11S,111101_111150,Young athletic man and woman in sportswear jogging together through forest while having run workout in sunny morning
22650181,https://ak.picdn.net/shutterstock/videos/22650181/preview/stock-footage-roofers-nail-gun-tiles-to-house-repair-revere-massachusetts-usa-august.mp4,PT00H00M30S,183251_183300,"Roofers nail gun tiles to house repair - revere, massachusetts usa - august 15, 2013"
1035380771,https://ak.picdn.net/shutterstock/videos/1035380771/preview/stock-footage-aerial-bird-s-eye-view-one-section-of-superkilen-park-in-copenhagen-denmark.mp4,PT00H00M50S,029551_029600,"Aerial bird's-eye view: one section of superkilen park in copenhagen, denmark"
3466226,https://ak.picdn.net/shutterstock/videos/3466226/preview/stock-footage-wind-park-in-germany.mp4,PT00H00M30S,110151_110200,Wind park in germany
28186165,https://ak.picdn.net/shutterstock/videos/28186165/preview/stock-footage-hong-kong-april-pink-decorated-dinner-cruise-ship-sail-at-victoria-harbour-aerial-shot.mp4,PT00H00M11S,025101_025150,"Hong kong - april 18, 2017: pink decorated dinner cruise ship sail at victoria harbour, aerial shot. former roro vehicular ferry, converted to recreational watercraft, popular touristic attraction"
1031121869,https://ak.picdn.net/shutterstock/videos/1031121869/preview/stock-footage-student-hand-with-pen-in-a-class-room-th-may-hyderabad-india.mp4,PT00H00M10S,044101_044150,Student hand with pen in a class room 27th may 2019 hyderabad india
9325679,https://ak.picdn.net/shutterstock/videos/9325679/preview/stock-footage-beach-aegean-sea-marmaris-anatolia-turkey.mp4,PT00H00M16S,109451_109500,"Beach & aegean sea, marmaris, anatolia, turkey"
1035971378,https://ak.picdn.net/shutterstock/videos/1035971378/preview/stock-footage-close-up-of-girl-s-hand-holds-a-glass-with-an-alcoholic-cocktail-in-a-bar.mp4,PT00H00M10S,084751_084800,Close up of girl's hand holds a glass with an alcoholic cocktail in a bar.
24570530,https://ak.picdn.net/shutterstock/videos/24570530/preview/stock-footage-graceful-girl-training-ballet-poses-in-dance-studio-slowly.mp4,PT00H00M13S,179801_179850,Graceful girl training ballet poses in dance studio. slowly
13489787,https://ak.picdn.net/shutterstock/videos/13489787/preview/stock-footage-potter-craftsman-is-teaching-a-woman-how-to-work-on-pottery-wheel-holding-her-hands-showing-how.mp4,PT00H01M01S,022951_023000,"Potter, craftsman is teaching a woman how to work on pottery wheel, holding her hands, showing how to mould a clay pot, making a vessel, male and female hands close up, dirty hands, pottery workshop,"
12184868,https://ak.picdn.net/shutterstock/videos/12184868/preview/stock-footage-old-wooden-orthodox-church-in-ulucz-poland.mp4,PT00H00M27S,091851_091900,"Old wooden orthodox church in ulucz, poland"
1007075488,https://ak.picdn.net/shutterstock/videos/1007075488/preview/stock-footage-close-up-shot-of-a-baby-drinking-from-the-bottle-outdoor-in-bright-sun-light.mp4,PT00H00M06S,191501_191550,Close-up shot of a baby drinking from the bottle outdoor in bright sun light
1058547961,https://ak.picdn.net/shutterstock/videos/1058547961/preview/stock-footage-banana-tree-shoots-blowing-in-the-wind-banana-leaves-green.mp4,PT00H00M09S,128001_128050,"Banana tree shoots blowing in the wind, banana leaves green"
1029893765,https://ak.picdn.net/shutterstock/videos/1029893765/preview/stock-footage-a-young-female-moose-grazing-weeds-in-a-small-river-on-a-beautiful-autumn-fall-day-located-in-big.mp4,PT00H00M27S,076801_076850,"A young female moose grazing weeds in a small river on a beautiful autumn fall day. located in big cottonwood canyon in utah, usa."
26952157,https://ak.picdn.net/shutterstock/videos/26952157/preview/stock-footage-man-playing-with-soccer-ball-in-the-cityscape.mp4,PT00H00M16S,170551_170600,Man playing with soccer ball in the cityscape.
24245768,https://ak.picdn.net/shutterstock/videos/24245768/preview/stock-footage-man-roasts-barbecue-on-the-grill-in-the-winter-and-keeping-the-turns-from-one-side-of-the-handle-to.mp4,PT00H00M09S,013651_013700,Man roasts barbecue on the grill in the winter and keeping the turns from one side of the handle to the other
1018516249,https://ak.picdn.net/shutterstock/videos/1018516249/preview/stock-footage-black-white-abstract-kaleidoscope-background-d-rendering.mp4,PT00H00M24S,118401_118450,Black white abstract kaleidoscope background. 3d rendering
1010673092,https://ak.picdn.net/shutterstock/videos/1010673092/preview/stock-footage-view-seaside-in-sunny-day-of-a-long-tail-boat-floating-in-the-blue-green-sea-near-by-the-tree-on.mp4,PT00H00M19S,196551_196600,"View seaside in sunny day of a long-tail boat floating in the blue-green sea near by the tree on white sand beach with many cloud and blue sky background, adang island, stun, thailand"
29158576,https://ak.picdn.net/shutterstock/videos/29158576/preview/stock-footage-wet-in-the-rain-in-the-night-sad-middle-aged-woman-wet-hair-and-clothes-face-flowing-jet-of-water.mp4,PT00H00M30S,124701_124750,"Wet in the rain in the night sad, middle-aged woman. wet hair and clothes. face flowing jet of water"
14307232,https://ak.picdn.net/shutterstock/videos/14307232/preview/stock-footage-animation-moving-of-wooden-colored-pencil-on-white-background-animation-of-seamless-loop.mp4,PT00H00M10S,007201_007250,Animation moving of wooden colored pencil on white background. animation of seamless loop.
1019508220,https://ak.picdn.net/shutterstock/videos/1019508220/preview/stock-footage-mountain-landscapes-houses-and-green-fields-covered-with-grass-in-the-summer.mp4,PT00H00M21S,197001_197050,"Mountain landscapes, houses and green fields covered with grass in the summer "
1835824,https://ak.picdn.net/shutterstock/videos/1835824/preview/stock-footage-purple-flare-light-move-up-and-down.mp4,PT00H00M13S,067851_067900,Purple flare light move up and down
1041038735,https://ak.picdn.net/shutterstock/videos/1041038735/preview/stock-footage-qingdao-china-september-china-automotive-sector-drone-flight-of-parking-lot-at-car.mp4,PT00H00M16S,036901_036950,"Qingdao, china – september 2019: china automotive sector - drone flight of parking lot at car manufacturing plant in qingdao"
2002793,https://ak.picdn.net/shutterstock/videos/2002793/preview/stock-footage-couple-watches-television-of.mp4,PT00H00M13S,117701_117750,Couple watches television (2 of 2)
1024088237,https://ak.picdn.net/shutterstock/videos/1024088237/preview/stock-footage-energy-solar-energy-line-icon-motion-graphic-animation.mp4,PT00H00M06S,173301_173350,"Energy, solar, energy line icon motion graphic animation"
1022845201,https://ak.picdn.net/shutterstock/videos/1022845201/preview/stock-footage-asian-girls-are-playing-blowing-bubbles-with-pleasure.mp4,PT00H00M12S,129451_129500,Asian girls are playing blowing bubbles with pleasure.
1032815255,https://ak.picdn.net/shutterstock/videos/1032815255/preview/stock-footage-marseille-downtown-and-old-port-france-time-lapse.mp4,PT00H00M09S,043001_043050,"Marseille downtown and old port, france time lapse"
1043147275,https://ak.picdn.net/shutterstock/videos/1043147275/preview/stock-footage-sunset-scene-on-a-beach-overlooking-the-sea-and-island-of-langkawi-malaysia.mp4,PT00H00M07S,015701_015750,Sunset scene on a beach overlooking the sea and island of langkawi malaysia
29393089,https://ak.picdn.net/shutterstock/videos/29393089/preview/stock-footage-happy-schoolkids-hanging-on-monkey-bar-of-school-playground.mp4,PT00H00M06S,131601_131650,Happy schoolkids hanging on monkey bar of school playground
14588206,https://ak.picdn.net/shutterstock/videos/14588206/preview/stock-footage-blooming-hollyhock-flower-in-the-garden.mp4,PT00H00M11S,120601_120650,Blooming hollyhock flower in the garden
18952472,https://ak.picdn.net/shutterstock/videos/18952472/preview/stock-footage-traveling-by-foliage-behind-revealing-quiet-street-at-dawn.mp4,PT00H00M18S,032051_032100,Traveling by foliage behind revealing quiet street at dawn
34308307,https://ak.picdn.net/shutterstock/videos/34308307/preview/stock-footage-flag-of-pakistan-conformed-to-long-ratio-gentle-stylized-non-realistic-unhinged-waving.mp4,PT00H00M18S,119151_119200,"Flag of pakistan; conformed to long ratio (2:1); gentle, stylized, non-realistic, unhinged waving; seamless loop animation with alpha channel; nice textile pattern visible in 4k"
1029933521,https://ak.picdn.net/shutterstock/videos/1029933521/preview/stock-footage-pov-patient-sees-jesus-god-disappears-and-only-ceiling-of-hospital-remains.mp4,PT00H00M09S,070401_070450,"Pov patient sees jesus, god disappears and only ceiling of hospital remains"
33522094,https://ak.picdn.net/shutterstock/videos/33522094/preview/stock-footage-young-beautiful-woman-works-on-tablet-in-the-park-in-sunny-day.mp4,PT00H00M28S,133751_133800,Young beautiful woman works on tablet in the park in sunny day
1032782333,https://ak.picdn.net/shutterstock/videos/1032782333/preview/stock-footage-english-staffordshire-bullterrier-is-laying-between-some-plants-in-a-forest-the-cute-brindle-dog.mp4,PT00H00M17S,092251_092300,English staffordshire bullterrier is laying between some plants in a forest. the cute brindle dog is is panting because of the heat. 4k clip taken during a bright day outside. 
1014355907,https://ak.picdn.net/shutterstock/videos/1014355907/preview/stock-footage-a-middle-aged-blonde-woman-writes-in-a-mobile-phone-indoors.mp4,PT00H00M06S,018651_018700,A middle-aged blonde woman writes in a mobile phone indoors.
34943155,https://ak.picdn.net/shutterstock/videos/34943155/preview/stock-footage-ship-under-berthing-the-terminal-by-navigation-of-pilot-and-safety-circumstance-assist-pushing-by.mp4,PT00H00M21S,026651_026700,Ship under berthing the terminal by navigation of pilot and safety circumstance assist pushing by tugs boats
16332592,https://ak.picdn.net/shutterstock/videos/16332592/preview/stock-footage-car-driving-through-rural-roads-in-lanzarote-canary-islands-spain-high-speed-motio-lapse.mp4,PT00H00M30S,191951_192000,"Car driving through rural roads in lanzarote, canary islands, spain. high speed. motio lapse."
23958367,https://ak.picdn.net/shutterstock/videos/23958367/preview/stock-footage-closeup-hand-of-chef-baker-in-blue-uniform-making-pizza-at-kitchen-for-delivery.mp4,PT00H00M28S,195801_195850,Closeup hand of chef baker in blue uniform making pizza at kitchen for delivery
21935662,https://ak.picdn.net/shutterstock/videos/21935662/preview/stock-footage-walking-on-park-alley-in-autumn-sunny-day.mp4,PT00H00M20S,143601_143650,Walking on park alley in autumn sunny day
1039696259,https://ak.picdn.net/shutterstock/videos/1039696259/preview/stock-footage-silk-flag-animation-of-sapphire-blue-color-background-video-waving-in-wind-realistic-royal-blue.mp4,PT00H00M20S,068301_068350,Silk flag animation of sapphire blue color background video waving in wind. realistic royal blue flag background. sapphire blue color flag looping closeup 1080p full hd footage. power sapphire blue sa
14637178,https://ak.picdn.net/shutterstock/videos/14637178/preview/stock-footage-popcorn-on-a-blue-background.mp4,PT00H00M21S,071101_071150,"Popcorn on a blue background  
"
2093159,https://ak.picdn.net/shutterstock/videos/2093159/preview/stock-footage-cheese-platter-with-grapes-and-salted-sticks.mp4,PT00H00M31S,062501_062550,Cheese platter with grapes and salted sticks
1043004295,https://ak.picdn.net/shutterstock/videos/1043004295/preview/stock-footage-lviv-ukraine-december-street-artist-in-the-clothes-of-a-huge-polar-bear-entertain-the.mp4,PT00H00M44S,064651_064700,"Lviv, ukraine - december 15, 2019:  street artist in the clothes of a huge polar bear entertain the public in the square of the city."
31916182,https://ak.picdn.net/shutterstock/videos/31916182/preview/stock-footage-circa-s-the-accelerated-development-pattern-of-air-force-ballistic-missile-poses-new.mp4,PT00H01M51S,026001_026050,"Circa 1950s - the accelerated development pattern of air force ballistic missile poses new logistical problems, explained by major general ben i. funk in 1958."
1007006146,https://ak.picdn.net/shutterstock/videos/1007006146/preview/stock-footage-back-view-unrecognizable-woman-making-traditional-balinese-ceremony-in-front-of-the-ancient-altar.mp4,PT00H00M16S,021201_021250,"Back view unrecognizable woman making traditional balinese ceremony in front of the ancient altar, woman holding flower and splashing water slow motion smoke and water drops in air"
1033861535,https://ak.picdn.net/shutterstock/videos/1033861535/preview/stock-footage-small-propeller-plane-flying-low-above-unpaved-runway-making-maneuver-on-high-speed-slow-motion.mp4,PT00H00M09S,053301_053350,"Small propeller plane flying low above unpaved runway making maneuver on high speed slow motion close up shot, extreme touristic attraction"
1021510633,https://ak.picdn.net/shutterstock/videos/1021510633/preview/stock-footage-images-from-the-historical-center-of-the-kanis-kultepe-in-kocasinan-kayseri-turkey.mp4,PT00H00M13S,044401_044450,Images from the historical center of the kanis kultepe in kocasinan/kayseri-turkey 27.04.2017
1035679769,https://ak.picdn.net/shutterstock/videos/1035679769/preview/stock-footage-drone-footage-of-mt-iou-in-hokkaido-japan.mp4,PT00H00M21S,141201_141250,"Drone footage of mt. iou in hokkaido, japan"
4514534,https://ak.picdn.net/shutterstock/videos/4514534/preview/stock-footage-evil-man.mp4,PT00H00M11S,175851_175900,Evil man
1044835228,https://ak.picdn.net/shutterstock/videos/1044835228/preview/stock-footage-close-up-the-demon-statue-sculpture-in-bali-island.mp4,PT00H00M10S,108251_108300,Close up the demon statue sculpture in bali island
3168784,https://ak.picdn.net/shutterstock/videos/3168784/preview/stock-footage-spotted-toad-rhaebo-guttatus-on-the-rainforest-floor-ecuador.mp4,PT00H00M11S,065151_065200,"Spotted toad (rhaebo guttatus) on the rainforest floor, ecuador"
30465901,https://ak.picdn.net/shutterstock/videos/30465901/preview/stock-footage-closed-up-adult-blyth-s-frogmouth-batrachostomus-affinis-sit-on-the-branch-in-the-nature.mp4,PT00H00M20S,018001_018050,"Closed up adult blyth's frogmouth (batrachostomus affinis) sit on the branch in the nature, kaengkrachan np, the jungle of thailand"
1040426630,https://ak.picdn.net/shutterstock/videos/1040426630/preview/stock-footage-autumn-beech-leaves-in-the-wind.mp4,PT00H00M20S,086201_086250,Autumn beech leaves in the wind
8968060,https://ak.picdn.net/shutterstock/videos/8968060/preview/stock-footage-frozen-river-with-aerial-view.mp4,PT00H00M21S,029001_029050,Frozen river with aerial view.
4576859,https://ak.picdn.net/shutterstock/videos/4576859/preview/stock-footage-pet-animal-and-behavior-three-purebred-german-shepherd-dogs-lying-down-on-floor-studio-shot.mp4,PT00H00M21S,003601_003650,"Pet, animal and behavior, three purebred german shepherd dogs lying down on floor. studio shot, white background. part 3 of 14"
9411176,https://ak.picdn.net/shutterstock/videos/9411176/preview/stock-footage-kyoto-japan-march-cherry-blossom-on-river-side-in-kyoto.mp4,PT00H00M14S,081201_081250,"Kyoto, japan - march 28, 2015: cherry blossom on river side in kyoto.
"
11119040,https://ak.picdn.net/shutterstock/videos/11119040/preview/stock-footage-two-friends-on-a-ferris-wheel-at-night.mp4,PT00H00M10S,030651_030700,Two friends on a ferris wheel at night
11277686,https://ak.picdn.net/shutterstock/videos/11277686/preview/stock-footage-rain-spray-over-green-plants-in-tropical-jungle-forest.mp4,PT00H00M08S,037501_037550,Rain spray over green plants in tropical jungle forest
17922601,https://ak.picdn.net/shutterstock/videos/17922601/preview/stock-footage-dnipro-ukraine-june-swan-lake-ballet-performed-by-members-of-the-dnipropetrovsk-state.mp4,PT00H00M55S,142201_142250,"Dnipro, ukraine - june 12, 2016: swan lake ballet performed by members of the dnipropetrovsk state opera and ballet theatre."
1059163559,https://ak.picdn.net/shutterstock/videos/1059163559/preview/stock-footage-portrait-of-attractive-arab-businessman-using-digital-tablet.mp4,PT00H00M09S,015001_015050,Portrait of attractive arab businessman using digital tablet
31670722,https://ak.picdn.net/shutterstock/videos/31670722/preview/stock-footage-dramatic-clouds-above-the-sky-with-city-in-foreground-look-up-view-time-lapse.mp4,PT00H00M20S,062251_062300,"Dramatic clouds above the sky with city in foreground, look up view, time lapse."
12247547,https://ak.picdn.net/shutterstock/videos/12247547/preview/stock-footage-night-traffic-on-the-ring-road-of-bordeaux.mp4,PT00H00M08S,002351_002400,Night traffic on the ring road of bordeaux
34754113,https://ak.picdn.net/shutterstock/videos/34754113/preview/stock-footage-studio-shot-red-bell-peppers-in-water-splash-in-aquarium-on-white-background.mp4,PT00H00M08S,019751_019800,Studio shot red bell peppers in water splash in aquarium on white background
27201025,https://ak.picdn.net/shutterstock/videos/27201025/preview/stock-footage-manta-ray-in-search-of-food-on-clean-clear-seabed-underwater-sea-of-maldives-swimming-in-world-of.mp4,PT00H00M50S,002201_002250,Manta ray in search of food on clean clear seabed underwater sea of maldives. swimming in world of wildlife of reefs. beautiful background. abyssal relax diving.
1054050242,https://ak.picdn.net/shutterstock/videos/1054050242/preview/stock-footage-aerial-tilt-down-shot-of-green-plants-on-hill-near-road-and-lake-drone-flying-forward-over.mp4,PT00H00M09S,145201_145250,"Aerial tilt down shot of green plants on hill near road and lake, drone flying forward over landscape against sky on sunny day - lake pukaki, new zealand"
1057675210,https://ak.picdn.net/shutterstock/videos/1057675210/preview/stock-footage-young-man-and-woman-run-to-a-lake-water-happy-having-fun-on-a-beach-summer-day.mp4,PT00H00M09S,190501_190550,"Young man and woman run to a lake water happy having fun on a beach, summer day"
32621359,https://ak.picdn.net/shutterstock/videos/32621359/preview/stock-footage-animation-slow-moving-of-molecules-or-network-from-glass-and-crystal-animation-of-seamless-loop.mp4,PT00H00M20S,090251_090300,Animation slow moving of molecules or network from glass and crystal. animation of seamless loop.
1039730189,https://ak.picdn.net/shutterstock/videos/1039730189/preview/stock-footage-purple-nature-animated-bokeh-background.mp4,PT00H00M44S,024601_024650,Purple nature animated bokeh background
1016525215,https://ak.picdn.net/shutterstock/videos/1016525215/preview/stock-footage-brasov-romania-drone-pictures.mp4,PT00H00M43S,087701_087750,Brasov romania drone pictures
15246826,https://ak.picdn.net/shutterstock/videos/15246826/preview/stock-footage-fish-fry-wind.mp4,PT00H00M09S,004651_004700,Fish fry wind
1014235622,https://ak.picdn.net/shutterstock/videos/1014235622/preview/stock-footage-old-dirty-deserted-gas-station-u-s-route-crisis-road-fueling-slow-motion-video-closed.mp4,PT00H00M22S,174101_174150,Old dirty deserted gas station. u.s. route 66. crisis road 66 fueling slow motion video. closed supermarket store shop abandoned gas station oil end of fuel the world apocalypse petrol. main street of
1050561196,https://ak.picdn.net/shutterstock/videos/1050561196/preview/stock-footage-ascent-aerial-flight-over-palm-tree-plantation-at-sunset-located-in-the-negev-desert-israel.mp4,PT00H00M22S,088951_089000,"Ascent aerial flight over palm tree plantation at sunset, located in the negev desert, israel"
1055653115,https://ak.picdn.net/shutterstock/videos/1055653115/preview/stock-footage-young-woman-in-light-dress-with-long-hair-jogging-on-summer-meadow-at-warm-sunset.mp4,PT00H00M11S,171551_171600,Young woman in light dress with long hair jogging on summer meadow at warm sunset.
