videoid,contentUrl,duration,page_dir,name
27357472,https://ak.picdn.net/shutterstock/videos/27357472/preview/stock-footage-black-storm-cloud-moving-on-sky-time-lapse.mp4,PT00H00M13S,091801_091850,Black storm cloud moving on sky - time lapse 
25224371,https://ak.picdn.net/shutterstock/videos/25224371/preview/stock-footage-italian-easter-bread-with-blue-colored-egg-and-sprinkles.mp4,PT00H00M16S,087751_087800,Italian easter bread with blue colored egg and sprinkles.
26605913,https://ak.picdn.net/shutterstock/videos/26605913/preview/stock-footage--k-aerial-sun-rising-over-the-marsh-trees.mp4,PT00H00M11S,022051_022100,4k: aerial sun rising over the marsh trees
1062014221,https://ak.picdn.net/shutterstock/videos/1062014221/preview/stock-footage-young-asian-couple-shopping-online-via-tablet-computer-on-christmas-day.mp4,PT00H00M09S,132551_132600,Young asian couple shopping online via tablet computer on christmas day.
1027884971,https://ak.picdn.net/shutterstock/videos/1027884971/preview/stock-footage-boat-on-the-lake-at-sunset.mp4,PT00H00M21S,024351_024400,Boat on the lake at sunset
17722864,https://ak.picdn.net/shutterstock/videos/17722864/preview/stock-footage-young-man-works-on-the-tablet.mp4,PT00H00M20S,184801_184850,Young man works on the tablet
32927803,https://ak.picdn.net/shutterstock/videos/32927803/preview/stock-footage-milan-italy-november-the-cimitero-monumentale-monumental-cemetery.mp4,PT00H00M10S,078951_079000,"Milan, italy - november 2017; the cimitero monumentale (monumental cemetery)"
1019468230,https://ak.picdn.net/shutterstock/videos/1019468230/preview/stock-footage-bangkok-thailand-november-time-lapse-of-unidentified-tourist-walking-around-at-wat.mp4,PT00H00M08S,033751_033800,"Bangkok, thailand - november 12, 2018 : time lapse of unidentified tourist walking around at wat arun"
15643996,https://ak.picdn.net/shutterstock/videos/15643996/preview/stock-footage-broadcast-endless-hi-tech-tunnel-blue-industrial-loopable-k.mp4,PT00H00M08S,006751_006800,"Broadcast endless hi-tech tunnel, blue, industrial, loopable, 4k"
1014481853,https://ak.picdn.net/shutterstock/videos/1014481853/preview/stock-footage-morning-dawns-in-the-desert-on-desert-safari-near-dubai-dubai-united-arab-emirates-middle-east.mp4,PT00H00M31S,079801_079850,"Morning dawns in the desert on desert safari near dubai, dubai, united arab emirates, middle east, asia"
26685403,https://ak.picdn.net/shutterstock/videos/26685403/preview/stock-footage-lockdown-of-active-senior-man-walking-out-of-house-gate-standing-on-longboard-and-riding-in-slow.mp4,PT00H00M18S,065751_065800,"Lockdown of active senior man walking out of house gate, standing on longboard and riding in slow motion"
1026498281,https://ak.picdn.net/shutterstock/videos/1026498281/preview/stock-footage-slow-motion-close-up-falling-of-harvested-healthy-paddy-rice-rice-grains-seed-background-farmer.mp4,PT00H00M21S,135201_135250,"Slow motion close up falling of harvested healthy paddy rice. rice grains seed background. farmer feed concept. rice paddles are gradually falling to the wood cube, where rice has fallen.-dan"
1603999,https://ak.picdn.net/shutterstock/videos/1603999/preview/stock-footage-egg-falling-and-breaking-on-concrete-sidewalk-pavement-with-sound.mp4,PT00H00M15S,117251_117300,Egg falling and breaking on concrete sidewalk pavement with sound
1048312318,https://ak.picdn.net/shutterstock/videos/1048312318/preview/stock-footage-young-women-looking-at-smartphone-device-outdoors-candid-millennial-taking-selfie-with-phone.mp4,PT00H00M22S,119801_119850,"Young women looking at smartphone device outdoors, candid millennial taking selfie with phone"
1039248167,https://ak.picdn.net/shutterstock/videos/1039248167/preview/stock-footage-aerial-vision-of-cala-trebaluger-beach-with-sailboats-minorca-drone.mp4,PT00H00M09S,190501_190550,Aerial vision of cala trebaluger beach with sailboats minorca drone
4113610,https://ak.picdn.net/shutterstock/videos/4113610/preview/stock-footage-elderly-couple-using-digital-tablet-in-a-park.mp4,PT00H00M11S,059501_059550,Elderly couple using digital tablet in a park
1028790788,https://ak.picdn.net/shutterstock/videos/1028790788/preview/stock-footage-asian-young-mother-with-newborn-baby.mp4,PT00H00M17S,122001_122050,Asian young mother with newborn baby 
16198600,https://ak.picdn.net/shutterstock/videos/16198600/preview/stock-footage-aerial-of-the-sun-setting-over-the-everglades-national-park-in-south-florida.mp4,PT00H00M19S,123201_123250,Aerial of the sun setting over the everglades national park in south florida
8624845,https://ak.picdn.net/shutterstock/videos/8624845/preview/stock-footage-animation-skyscraper-of-the-international-business-center-city-moscow-russia.mp4,PT00H00M12S,177151_177200,"Animation: skyscraper of the international business center (city), moscow, russia  "
1033722284,https://ak.picdn.net/shutterstock/videos/1033722284/preview/stock-footage-angry-missile-and-battery-stars.mp4,PT00H00M13S,060651_060700,Angry missile and battery stars
1015354099,https://ak.picdn.net/shutterstock/videos/1015354099/preview/stock-footage-slow-motion-in-the-foreground-in-a-glass-with-drops-of-water-to-pour-vodka-and-on-a-background.mp4,PT00H00M22S,004651_004700,Slow motion in the foreground in a glass with drops of water to pour vodka and on a background blurred vodka in the misted glasses close-up.
1053048005,https://ak.picdn.net/shutterstock/videos/1053048005/preview/stock-footage-clouds-drift-over-the-peaceful-hills-and-valleys-of-the-east-bay-in-the-san-francisco-bay-region-of.mp4,PT00H00M22S,086701_086750,Clouds drift over the peaceful hills and valleys of the east bay in the san francisco bay region of california. this scenic area is green in the winter and spring and golden in the summer.
12124997,https://ak.picdn.net/shutterstock/videos/12124997/preview/stock-footage-loch-muick-landscape-scotland-feb.mp4,PT00H00M23S,088251_088300,Loch muick landscape 4 scotland. feb 2011.
1019881234,https://ak.picdn.net/shutterstock/videos/1019881234/preview/stock-footage-a-young-stag-red-deer-in-an-autumn-woodland.mp4,PT00H00M12S,030151_030200,A young stag red deer in an autumn woodland.
1048357378,https://ak.picdn.net/shutterstock/videos/1048357378/preview/stock-footage-waves-crash-into-the-stones-and-splashes-with-foam-on-the-seashore.mp4,PT00H00M18S,184751_184800,Waves crash into the stones and splashes with foam on the seashore
11194367,https://ak.picdn.net/shutterstock/videos/11194367/preview/stock-footage-cooking-of-mushroom-soup-recipe.mp4,PT00H00M21S,113551_113600,Cooking of mushroom soup. recipe
1034030636,https://ak.picdn.net/shutterstock/videos/1034030636/preview/stock-footage-village-landscape-a-church-with-dark-tops-suzdal-russia.mp4,PT00H00M10S,069251_069300,"Village landscape - a church with dark tops - suzdal, russia"
1046542027,https://ak.picdn.net/shutterstock/videos/1046542027/preview/stock-footage-abstract-patterns-of-ink-on-water.mp4,PT00H00M22S,072251_072300,Abstract patterns of ink on water 
21225532,https://ak.picdn.net/shutterstock/videos/21225532/preview/stock-footage-girl-with-christmas-presents.mp4,PT00H00M14S,008301_008350,Girl with christmas presents
1009815329,https://ak.picdn.net/shutterstock/videos/1009815329/preview/stock-footage-teamwork-of-the-businessman-the-businessman-who-dances.mp4,PT00H00M10S,125701_125750,"Teamwork of the businessman.the businessman who dances.
"
1036854062,https://ak.picdn.net/shutterstock/videos/1036854062/preview/stock-footage-kyoto-japan-circa-july-view-of-foreign-tourists-around-kyoto-train-station.mp4,PT00H00M20S,060451_060500,"Kyoto, japan - circa july 2019 : view of foreign tourists around kyoto train station."
27167542,https://ak.picdn.net/shutterstock/videos/27167542/preview/stock-footage-willemstad-netherlands-antilles-december-the-queen-emma-bridge-and-pretty-colourful.mp4,PT00H00M10S,075251_075300,Willemstad/netherlands antilles - 11 december 2010: the queen emma bridge and pretty colourful buildings in willemstad curacao. taken early morning with people walking across the bridge
1011186620,https://ak.picdn.net/shutterstock/videos/1011186620/preview/stock-footage-video-hemp-plant-cannabis-marijuana-american-flag.mp4,PT00H00M06S,060451_060500,Video hemp plant cannabis marijuana  american flag
14403580,https://ak.picdn.net/shutterstock/videos/14403580/preview/stock-footage-a-close-up-of-a-black-clarinet-lying-on-a-table-full-of-musical-notes.mp4,PT00H00M13S,051401_051450,A close up of a black clarinet lying on a table full of musical notes 
26871160,https://ak.picdn.net/shutterstock/videos/26871160/preview/stock-footage-yellow-rose.mp4,PT00H00M12S,143501_143550,"Yellow rose
"
1039236044,https://ak.picdn.net/shutterstock/videos/1039236044/preview/stock-footage-portrait-of-young-man-sitting-near-tree-and-thinking-in-warm-autimn-day-in-slow-motion.mp4,PT00H00M10S,043201_043250,"Portrait of young man sitting near tree and thinking in warm autimn day, in slow motion"
34270027,https://ak.picdn.net/shutterstock/videos/34270027/preview/stock-footage-amsterdam-netherlands-july-boeing-f-of-emirates-skycargo-airways-is-taxiing-to.mp4,PT00H00M22S,030551_030600,"Amsterdam, netherlands - july 29, 2017: boeing 777f of emirates skycargo airways is taxiing to runway before departure from schiphol airport"
1022251363,https://ak.picdn.net/shutterstock/videos/1022251363/preview/stock-footage-miscanthus-in-the-wind.mp4,PT00H00M11S,029501_029550,Miscanthus in the wind
546079,https://ak.picdn.net/shutterstock/videos/546079/preview/stock-footage-autumn-leaves-gently-sway-in-the-sunlight-on-a-sunny-afternoon.mp4,PT00H00M29S,173751_173800,Autumn leaves gently sway in the sunlight on a sunny afternoon. 
14007074,https://ak.picdn.net/shutterstock/videos/14007074/preview/stock-footage-friend-pouring-woman-wine-at-table.mp4,PT00H00M17S,128701_128750,Friend pouring woman wine at table
1043102404,https://ak.picdn.net/shutterstock/videos/1043102404/preview/stock-footage-red-lifeguard-tower-on-the-coastline-in-the-foreground-a-palm-tree-bright-footage-the-concept-of.mp4,PT00H00M11S,175751_175800,"Red lifeguard tower on the coastline in the foreground a palm tree. bright footage, the concept of relaxation on the sea coast. in the background a blue sea."
3221152,https://ak.picdn.net/shutterstock/videos/3221152/preview/stock-footage-gas-nozzle.mp4,PT00H00M35S,120601_120650,Gas nozzle 
1028825270,https://ak.picdn.net/shutterstock/videos/1028825270/preview/stock-footage-a-young-office-employee-walks-in-the-office-talks-on-the-phone-and-greets-employees-creative.mp4,PT00H00M15S,179751_179800,"A young office employee walks in the office, talks on the phone, and greets employees. creative business space in loft style. coworking. office life"
18303790,https://ak.picdn.net/shutterstock/videos/18303790/preview/stock-footage-ethnic-hispanic-female-in-white-swimsuit-and-sunhat-on-vacation-beach.mp4,PT00H00M21S,076651_076700,Ethnic hispanic female in white swimsuit and sunhat on vacation beach
1191166,https://ak.picdn.net/shutterstock/videos/1191166/preview/stock-footage-spring-flowers.mp4,PT00H00M30S,032401_032450,Spring flowers
18790145,https://ak.picdn.net/shutterstock/videos/18790145/preview/stock-footage-realistic-chile-flag.mp4,PT00H00M08S,026601_026650,Realistic chile flag
1039163408,https://ak.picdn.net/shutterstock/videos/1039163408/preview/stock-footage-hiroshima-japan-hiroshima-victims-memorial-cenotaph-atomic-bomb-memorial-which-is.mp4,PT00H00M13S,079601_079650,"Hiroshima / japan - 05 25 2019: hiroshima victims memorial cenotaph atomic bomb memorial, which is part of hiroshima peace memorial park in japan."
25467362,https://ak.picdn.net/shutterstock/videos/25467362/preview/stock-footage-beautiful-ocean-sunset-and-surf-at-the-lighthouse.mp4,PT00H00M22S,172151_172200,Beautiful ocean sunset and surf at the lighthouse.
1021807807,https://ak.picdn.net/shutterstock/videos/1021807807/preview/stock-footage-a-beamer-or-film-projector-goes-on-and-off-in-an-abandoned-cinema-or-theater.mp4,PT00H00M12S,132351_132400,A beamer or film projector goes on and off in an abandoned cinema or theater
1051269346,https://ak.picdn.net/shutterstock/videos/1051269346/preview/stock-footage-old-stump-in-the-cracks-macro-view.mp4,PT00H00M14S,147301_147350,"Old stump in the cracks, macro view."
1018245820,https://ak.picdn.net/shutterstock/videos/1018245820/preview/stock-footage-young-traveler-man-holding-a-map-on-green-chroma-doubting-and-confused-thinking-of-an-idea-or.mp4,PT00H00M12S,073051_073100,"Young traveler man holding a map on green chroma doubting and confused, thinking of an idea or worried about something"
26369726,https://ak.picdn.net/shutterstock/videos/26369726/preview/stock-footage-small-triangle-grid-ambient-loop.mp4,PT00H00M05S,057501_057550,Small triangle grid ambient loop
199027,https://ak.picdn.net/shutterstock/videos/199027/preview/stock-footage-musician-playing-guitar.mp4,PT00H00M06S,077001_077050,Musician playing guitar
1019678884,https://ak.picdn.net/shutterstock/videos/1019678884/preview/stock-footage-flag-of-the-country-akrotiri-and-dhekelia-flutters-on-green-background-d-rendering.mp4,PT00H00M05S,182951_183000,Flag of the country akrotiri and dhekelia flutters on green background. 3d rendering
1053528815,https://ak.picdn.net/shutterstock/videos/1053528815/preview/stock-footage-a-woman-glues-wallpaper-in-her-apartment-she-puts-glue-on-the-wall-and-smoothes-the-wallpaper.mp4,PT00H00M14S,145351_145400,"A woman glues wallpaper in her apartment, she puts glue on the wall and smoothes the wallpaper."
204739,https://ak.picdn.net/shutterstock/videos/204739/preview/stock-footage-blooming-summer-wildflowers-blueweed-echium-vulgare-on-the-island-of-gotland-in-sweden.mp4,PT00H00M20S,112801_112850,"Blooming summer wildflowers blueweed, echium vulgare on the island of gotland in sweden"
1034948837,https://ak.picdn.net/shutterstock/videos/1034948837/preview/stock-footage-blurred-viewers-having-fun-in-the-cinema.mp4,PT00H00M12S,052301_052350,Blurred viewers having fun in the cinema.
1736689,https://ak.picdn.net/shutterstock/videos/1736689/preview/stock-footage-cooperstown-ny-sept-people-compete-in-a-local-halloween-themed-water-race-on-september.mp4,PT00H00M55S,007651_007700,"Cooperstown, ny - sept 24, 2011: people compete in a local halloween-themed water race on september 24, 2011 in cooperstown."
2627696,https://ak.picdn.net/shutterstock/videos/2627696/preview/stock-footage-lahore-pakistan-december-lahore-fort-scenes.mp4,PT00H00M49S,176401_176450,"Lahore, pakistan - december 2007: lahore fort scenes"
1027717415,https://ak.picdn.net/shutterstock/videos/1027717415/preview/stock-footage-laptop-computer-with-the-loan-application-form-on-its-display-camera-turning-slowly-around-the.mp4,PT00H00M12S,143651_143700,Laptop computer with the loan application form on its display. camera turning slowly around the desk.
1016473723,https://ak.picdn.net/shutterstock/videos/1016473723/preview/stock-footage-crop-of-autumn-fresh-vegetables.mp4,PT00H00M12S,041901_041950,Crop of autumn fresh vegetables
1050009244,https://ak.picdn.net/shutterstock/videos/1050009244/preview/stock-footage-vertical-video-of-young-happy-woman-communicating-by-conference-call-speak-looking-at-computer-at.mp4,PT00H00M20S,071551_071600,Vertical video of young happy woman communicating by conference call speak looking at computer at the kitchen.
27754252,https://ak.picdn.net/shutterstock/videos/27754252/preview/stock-footage-nudibranch-flabellina-underwater-nudybranch.mp4,PT00H00M15S,135251_135300,Nudibranch flabellina underwater nudybranch
1013532347,https://ak.picdn.net/shutterstock/videos/1013532347/preview/stock-footage-sunset-over-the-pacific-ocean-an-santa-cruz-pleasure-point-california-usa.mp4,PT00H00M17S,050851_050900,"Sunset over the pacific ocean an santa cruz, pleasure point, california, usa"
3349010,https://ak.picdn.net/shutterstock/videos/3349010/preview/stock-footage-meat-food-roast-beef-garnished-with-green-lettuce-and-red-chili-hot-pepper-on-black-dish-hidef.mp4,PT00H00M15S,054451_054500,Meat food : roast beef garnished with green lettuce and red chili hot pepper on black dish  hidef intro slow motion
10825715,https://ak.picdn.net/shutterstock/videos/10825715/preview/stock-footage-amritsar-india-september-unidentified-sikhs-and-indian-people-visiting-the-golden.mp4,PT00H00M13S,082151_082200,"Amritsar, india - september 27, 2014: unidentified sikhs and indian people visiting the golden temple in amritsar, punjab, india. sikh pilgrims travel from all over india to pray at this holy site."
17161672,https://ak.picdn.net/shutterstock/videos/17161672/preview/stock-footage-los-angeles-usa-may-mann-s-chinese-theatre-in-california-one-of-the-most-famous-movie.mp4,PT00H00M06S,112601_112650,"Los angeles, usa - may 2016 - mann's chinese theatre in california, one of the most famous movie houses in america"
2210149,https://ak.picdn.net/shutterstock/videos/2210149/preview/stock-footage-following-an-ultralight-weight-shift-control-microlight-trike-flying-over-the-water.mp4,PT00H00M24S,026351_026400,Following an ultralight weight-shift control microlight trike flying over the water
1033487438,https://ak.picdn.net/shutterstock/videos/1033487438/preview/stock-footage-woman-spotting-hippopotamus-in-maasai-mara-kenya-africa.mp4,PT00H00M05S,178501_178550,Woman spotting hippopotamus in maasai mara kenya africa
4494032,https://ak.picdn.net/shutterstock/videos/4494032/preview/stock-footage-greenland-hvalsey-nordic-ruin.mp4,PT00H00M10S,079801_079850,Greenland hvalsey nordic ruin
12547703,https://ak.picdn.net/shutterstock/videos/12547703/preview/stock-footage-joey-kangaroo-wallaby-marsupial-animal-australia.mp4,PT00H00M17S,091001_091050,Joey kangaroo wallaby marsupial animal australia
1022639464,https://ak.picdn.net/shutterstock/videos/1022639464/preview/stock-footage-kids-drawing-white-screen-with-theme-of-travel-luggage-bag.mp4,PT00H00M06S,197601_197650,Kids drawing white screen with theme of travel luggage bag 
1007206354,https://ak.picdn.net/shutterstock/videos/1007206354/preview/stock-footage-woman-in-the-kitchen-is-cooking-meat.mp4,PT00H00M07S,129551_129600,Woman in the kitchen is cooking meat.
1020415285,https://ak.picdn.net/shutterstock/videos/1020415285/preview/stock-footage-lviv-ukraine-july-young-funny-girls-in-the-uniforms-having-fun-while-taking-selfie.mp4,PT00H00M12S,033001_033050,Lviv \ ukraine - july 7 2018: young funny girls in the uniforms having fun while taking selfie pictures on the smartphone at the school in classroom break happy education together schoolgirl pupil
7616671,https://ak.picdn.net/shutterstock/videos/7616671/preview/stock-footage-osaka-japan-circa-october-big-gyoza-sign-at-dotonbori.mp4,PT00H00M18S,149901_149950,"Osaka, japan - circa october 2014 :big gyoza sign at dotonbori"
9056869,https://ak.picdn.net/shutterstock/videos/9056869/preview/stock-footage-kathmandu-nepal-november-the-durbar-square-on-november-in-kathmandu-nepal.mp4,PT00H00M15S,053001_053050,"Kathmandu , nepal - november 3, 2013: the durbar square on november 3, 2013 in kathmandu, nepal. kathmandu durbar square is the plaza in front of the old royal palace of the then kathmandu kingdom."
1007647105,https://ak.picdn.net/shutterstock/videos/1007647105/preview/stock-footage-milan-italy-february-iron-head-of-medusa-head-with-hair-made-of-snakes-that-petrifies.mp4,PT00H00M19S,006901_006950,"Milan, italy - february 2018: iron head of medusa head with hair made of snakes that petrifies people staring"
26785033,https://ak.picdn.net/shutterstock/videos/26785033/preview/stock-footage-extreme-close-up-of-woman-s-hand-pouring-red-citrus-juice-from-a-juicer-into-a-small-white-jar.mp4,PT00H00M10S,061451_061500,Extreme close up of woman s hand pouring red citrus juice from a juicer into a small white jar. locked down real time close up shot
10736021,https://ak.picdn.net/shutterstock/videos/10736021/preview/stock-footage-man-cleaning-the-ripe-ears-of-maize-from-leaves.mp4,PT00H00M30S,089551_089600,Man cleaning the ripe ears of maize from leaves
1054092236,https://ak.picdn.net/shutterstock/videos/1054092236/preview/stock-footage-boxes-full-of-freshly-picked-organic-lemons-from-a-lemon-farm-while-an-unfocused-farmer-walks-by-in.mp4,PT00H00M07S,090301_090350,Boxes full of freshly picked organic lemons from a lemon farm while an unfocused farmer walks by in the background.
14921047,https://ak.picdn.net/shutterstock/videos/14921047/preview/stock-footage-adventurous-little-blonde-toddler-boy-walking-close-to-a-stream-holding-his-father-s-hand.mp4,PT00H00M09S,037351_037400,Adventurous little blonde toddler boy walking close to a stream holding his father's hand
1046678593,https://ak.picdn.net/shutterstock/videos/1046678593/preview/stock-footage-maximize-profit-abstract-text-display-title-animation.mp4,PT00H00M07S,182901_182950,"Maximize profit abstract text display. title animation.
"
1026801167,https://ak.picdn.net/shutterstock/videos/1026801167/preview/stock-footage-historical-museum-on-red-square-of-moscow.mp4,PT00H00M38S,007051_007100,Historical museum on red square of moscow.
1020973918,https://ak.picdn.net/shutterstock/videos/1020973918/preview/stock-footage-moon-set-in-the-sky.mp4,PT00H00M13S,015451_015500,Moon set in the sky
18099664,https://ak.picdn.net/shutterstock/videos/18099664/preview/stock-footage-industrial-washing-machines-in-a-public-laundromat.mp4,PT00H00M55S,010351_010400,Industrial washing machines in a public laundromat.
15591895,https://ak.picdn.net/shutterstock/videos/15591895/preview/stock-footage-melting-of-glass-stick.mp4,PT00H00M29S,195251_195300,Melting of glass stick
1022614549,https://ak.picdn.net/shutterstock/videos/1022614549/preview/stock-footage-happy-middle-aged-couple-using-smartphone-having-video-chat-waving-at-grandchildren-enjoying-online.mp4,PT00H00M16S,040351_040400,Happy middle aged couple using smartphone having video chat waving at grandchildren enjoying online communication relaxing retirement home
1044048112,https://ak.picdn.net/shutterstock/videos/1044048112/preview/stock-footage-black-and-gold-zigzag-number-two-on-green-screen-for-anniversary-celebration-or-happy-birthday.mp4,PT00H00M29S,118601_118650,Black and gold zigzag number 2 two on green screen for anniversary celebration or happy birthday
13371452,https://ak.picdn.net/shutterstock/videos/13371452/preview/stock-footage-woman-on-garden-put-on-gloves-and-start-work-k-attractive-female-gardener-starts-working-on.mp4,PT00H00M14S,072151_072200,"Woman on garden put on gloves and start work 4k. attractive female gardener starts working on vegetable garden, putting on protective gloves for safety purpose. sunny day with green background."
1009892903,https://ak.picdn.net/shutterstock/videos/1009892903/preview/stock-footage-hidden-scenic-places-around-nicomekl-river-in-south-surrey-bc-canada.mp4,PT00H00M15S,021001_021050,Hidden scenic places around nicomekl river in south surrey bc canada
4669256,https://ak.picdn.net/shutterstock/videos/4669256/preview/stock-footage-green-plant-in-mountain-forest-in-dzungarian-alatau-kazakhstan-central-asia.mp4,PT00H00M08S,191651_191700,"Green plant in mountain forest in dzungarian alatau,  kazakhstan, central asia
"
1057053776,https://ak.picdn.net/shutterstock/videos/1057053776/preview/stock-footage-the-family-works-on-a-honey-bee-farm.mp4,PT00H00M30S,090201_090250,The family works on a honey bee farm
1031231453,https://ak.picdn.net/shutterstock/videos/1031231453/preview/stock-footage-lightning-in-the-dark-night-sky-during-a-heavy-thunderstorm.mp4,PT00H00M11S,191251_191300,Lightning in the dark night sky during a heavy thunderstorm.
1023200761,https://ak.picdn.net/shutterstock/videos/1023200761/preview/stock-footage-paper-box-with-a-flag-of-israel-in-a-shopping-cart-on-a-laptop-keyboard-trade-at-an-international.mp4,PT00H00M11S,056801_056850,Paper box with a flag of israel in a shopping cart on a laptop keyboard. trade at an international level
1036552400,https://ak.picdn.net/shutterstock/videos/1036552400/preview/stock-footage-soft-waves-at-the-sea-stones-and-sand-close-up.mp4,PT00H00M10S,102901_102950,"Soft waves at the sea, stones and sand, close up"
11628293,https://ak.picdn.net/shutterstock/videos/11628293/preview/stock-footage-snowfall-on-blue-seamless-loop-christmas-background-k-x.mp4,PT00H00M05S,024401_024450,"Snowfall on blue. seamless loop christmas background. 4k (4096x2304)
"
1036364873,https://ak.picdn.net/shutterstock/videos/1036364873/preview/stock-footage-azerbaijan-national-flag-seamlessly-waving-on-realistic-satin-texture-fps.mp4,PT00H00M16S,181851_181900,Azerbaijan national flag seamlessly waving on realistic satin texture 29.97fps
34827490,https://ak.picdn.net/shutterstock/videos/34827490/preview/stock-footage-us-flags-and-soccer-ball-american-flag-and-soccer-ball-on-the-grass.mp4,PT00H00M15S,014001_014050,Us flags and soccer ball. american flag and soccer ball on the grass.
4862246,https://ak.picdn.net/shutterstock/videos/4862246/preview/stock-footage-gold-magic-shine.mp4,PT00H00M10S,002501_002550,Gold magic shine
9659765,https://ak.picdn.net/shutterstock/videos/9659765/preview/stock-footage-canada-lynx-adult-lone-grooming-winter-snow-licking-paw.mp4,PT00H00M21S,143851_143900,Canada lynx adult lone grooming winter snow licking paw
1026379343,https://ak.picdn.net/shutterstock/videos/1026379343/preview/stock-footage-aerial-view-of-kuala-lumpur-city-centre-during-dusk-and-foggy-day.mp4,PT00H00M17S,122501_122550,Aerial view of kuala lumpur city centre during dusk and foggy day
1016525221,https://ak.picdn.net/shutterstock/videos/1016525221/preview/stock-footage-brasov-romania-drone-pictures.mp4,PT00H00M10S,082601_082650,Brasov romania drone pictures
16235731,https://ak.picdn.net/shutterstock/videos/16235731/preview/stock-footage-trigger-fish-diving-on-the-reefs-of-the-maldives-archipelago.mp4,PT00H00M15S,091901_091950,Trigger fish. diving on the reefs of the maldives archipelago.
