videoid,contentUrl,duration,page_dir,name
1017009451,https://ak.picdn.net/shutterstock/videos/1017009451/preview/stock-footage-flying-over-the-empty-road-aerial-view-k.mp4,PT00H00M10S,126651_126700,Flying over the empty road. aerial view 4 k
1027113398,https://ak.picdn.net/shutterstock/videos/1027113398/preview/stock-footage-aerial-view-of-a-beautiful-wealthy-green-golf-course-next-the-valley-luxury-country-side-area-san.mp4,PT00H00M18S,139051_139100,"Aerial view of a beautiful wealthy green golf course next the valley, luxury country side area, san diego, california, usa, 03/13/2019"
1040938472,https://ak.picdn.net/shutterstock/videos/1040938472/preview/stock-footage-aerial-view-of-the-city-of-buenos-aires-puerto-madero-pink-house-background-buildings-argentina.mp4,PT00H00M44S,136001_136050,"Aerial view of the city of buenos aires, puerto madero, pink house, background buildings. argentina"
25151435,https://ak.picdn.net/shutterstock/videos/25151435/preview/stock-footage-beautiful-attractive-girl-student-drinking-coffee-or-tea-at-sunset.mp4,PT00H00M09S,023051_023100,Beautiful attractive girl student drinking coffee or tea at sunset
33047680,https://ak.picdn.net/shutterstock/videos/33047680/preview/stock-footage-cartoon-tennis-ball-pointer-left-bad-animation-with-alpha-channel.mp4,PT00H00M06S,121951_122000,Cartoon tennis ball pointer left bad animation with alpha channel
12992621,https://ak.picdn.net/shutterstock/videos/12992621/preview/stock-footage-pretty-young-woman-with-long-brown-hair-standing-decorating-her-white-and-silver-themed-christmas.mp4,PT00H00M17S,080701_080750,Pretty young woman with long brown hair standing decorating her white and silver themed christmas tree with a smile of pleasure
1009380224,https://ak.picdn.net/shutterstock/videos/1009380224/preview/stock-footage--k-aerial-view-of-navagio-beach-shipwreck-view-in-zakynthos-zante-island-in-greece-log.mp4,PT00H01M00S,007401_007450,"4k aerial  view of navagio beach shipwreck view in zakynthos (zante) island, in greece - log"
18252667,https://ak.picdn.net/shutterstock/videos/18252667/preview/stock-footage-mountain-peak-switzerland-schilthorn-time-laps.mp4,PT00H00M16S,124201_124250,Mountain peak switzerland schilthorn time-laps
26928808,https://ak.picdn.net/shutterstock/videos/26928808/preview/stock-footage-the-steam-clock-at-water-street-in-vancouver-by-night-vancouver-canada-april.mp4,PT00H00M08S,118151_118200,"The steam clock at water street in vancouver by night - vancouver / canada - april 12, 2017"
1007003830,https://ak.picdn.net/shutterstock/videos/1007003830/preview/stock-footage-cross-walk-bike-path.mp4,PT00H00M28S,148951_149000,Cross walk bike path
1014908638,https://ak.picdn.net/shutterstock/videos/1014908638/preview/stock-footage-yeji-ghana-a-fishing-village-with-huts-on-lake-volta.mp4,PT00H00M08S,038351_038400,"Yeji, ghana - 2018: a fishing village with huts on lake volta."
5925305,https://ak.picdn.net/shutterstock/videos/5925305/preview/stock-footage-sea-plane-taxiing-st-thomas-usvi-ocean-bay-port-used-for-ferry-and-aircraft-to-shuttle-passengers.mp4,PT00H00M14S,173351_173400,"Sea plane taxiing st thomas usvi ocean bay. port used for ferry and aircraft to shuttle passengers between caribbean islands. beautiful island, territory in the us virgin islands. tourism destination."
1055353049,https://ak.picdn.net/shutterstock/videos/1055353049/preview/stock-footage-pretty-contented-modern-aged-dark-haired-asian-girl-resting-on-asphalt-near-personal-electric.mp4,PT00H00M12S,044001_044050,Pretty contented modern 25-aged dark-haired asian girl resting on asphalt near personal electric scooter and revisioning private photos on mobile near beautiful building
1049271466,https://ak.picdn.net/shutterstock/videos/1049271466/preview/stock-footage-slow-motion-video-petanque-sport-training-for-athletes-from-school-representatives-to-participate.mp4,PT00H00M08S,068651_068700,Slow motion video petanque sport training for athletes from school representatives to participate in student sports competitions of thailand.
1006903390,https://ak.picdn.net/shutterstock/videos/1006903390/preview/stock-footage-snowboarder-sportsman-in-bright-green-clothes-is-riding-down-fastly-on-a-slope-of-the-mountain-at.mp4,PT00H00M15S,069251_069300,Snowboarder sportsman in bright green clothes is riding down fastly on a slope of the mountain at sunny winter day
1048673401,https://ak.picdn.net/shutterstock/videos/1048673401/preview/stock-footage-barcelona-spain-march-th-covid-coronavirus-in-spain-empty-glorias-area-in-barcelona.mp4,PT00H00M11S,014601_014650,"Barcelona, spain. march 19th 2020: covid 19. coronavirus in spain. empty glorias area in barcelona. goverment decree lock down the city limiting the movement of citizens"
25373264,https://ak.picdn.net/shutterstock/videos/25373264/preview/stock-footage-kitchen-restaurant-cooking-the-chef-puts-the-grilled-vegetables-on-a-plate.mp4,PT00H00M15S,087351_087400,Kitchen. restaurant. cooking. the chef puts the grilled vegetables on a plate.
1043494132,https://ak.picdn.net/shutterstock/videos/1043494132/preview/stock-footage-woman-standing-in-ocean-on-luxury-vacation-in-bali-a-girl-wearing-bikini-and-sunglasses.mp4,PT00H00M12S,101801_101850,"Woman standing in ocean on luxury vacation in bali, a girl wearing bikini and sunglasses"
1025199710,https://ak.picdn.net/shutterstock/videos/1025199710/preview/stock-footage-palu-indonesia-people-asist-to-their-loss.mp4,PT00H00M19S,137751_137800,"Palu, indonesia - 09 30 2018: people asist to their loss"
1023714169,https://ak.picdn.net/shutterstock/videos/1023714169/preview/stock-footage-aerial-shot-of-water-rapids-tad-lo-bolaven-plateau-laos.mp4,PT00H00M05S,063701_063750,"Aerial shot of water rapids, tad lo, bolaven plateau, laos."
1043957299,https://ak.picdn.net/shutterstock/videos/1043957299/preview/stock-footage-yurakucho-in-japan-tokyo-landscape.mp4,PT00H00M10S,027051_027100,"Yurakucho in japan, tokyo landscape"
1010086604,https://ak.picdn.net/shutterstock/videos/1010086604/preview/stock-footage-fresh-green-leaves-falling-on-black-background-loop-animation.mp4,PT00H00M15S,132951_133000,"Fresh green leaves falling on black background, loop animation,"
13212476,https://ak.picdn.net/shutterstock/videos/13212476/preview/stock-footage-doctor-using-laptop-discussing-with-patient-on-a-green-screen-chroma-key.mp4,PT00H00M30S,100051_100100,"Doctor using laptop discussing with patient on a green screen, chroma key"
1049254591,https://ak.picdn.net/shutterstock/videos/1049254591/preview/stock-footage--d-animation-a-gold-coin-falls-into-the-hole-of-a-moneybox-buisness-concept-isometric-scene.mp4,PT00H00M07S,023701_023750,3d animation. a gold coin falls into the hole of a moneybox. buisness concept.  isometric scene.
7834009,https://ak.picdn.net/shutterstock/videos/7834009/preview/stock-footage-amateur-making-pottery-and-failing.mp4,PT00H00M14S,197201_197250,Amateur making pottery and failing
1035098006,https://ak.picdn.net/shutterstock/videos/1035098006/preview/stock-footage-slow-motion-beautiful-teenager-girl-riding-from-a-snow-covered-slide-on-on-round-inflatable-wheels.mp4,PT00H00M36S,067101_067150,Slow motion beautiful teenager girl riding from a snow-covered slide on on round inflatable wheels.
23371639,https://ak.picdn.net/shutterstock/videos/23371639/preview/stock-footage-sushi-and-chopsticks-a-tasty-selection-of-japanese-food.mp4,PT00H00M13S,009901_009950,Sushi and chopsticks - a tasty selection of japanese food
1057769158,https://ak.picdn.net/shutterstock/videos/1057769158/preview/stock-footage-agribusiness-pivot-irrigation-used-to-water-plants-on-a-farm-smooth-motion-circular-pivot.mp4,PT00H00M12S,017101_017150,"Agribusiness - pivot irrigation used to water plants on a farm. smooth motion, circular pivot irrigation with drone - agriculture"
5612312,https://ak.picdn.net/shutterstock/videos/5612312/preview/stock-footage-elderly-woman-cutting-hay-in-mai-chau.mp4,PT00H00M20S,084501_084550,Elderly woman cutting hay in mai chau
1013494262,https://ak.picdn.net/shutterstock/videos/1013494262/preview/stock-footage-animated-background-of-colored-squares.mp4,PT00H00M10S,148801_148850,Animated background of colored squares.
5789447,https://ak.picdn.net/shutterstock/videos/5789447/preview/stock-footage-rosslyn-va-feb-arlington-als-fire-department-ambulance-responds-siren-blaring-lights.mp4,PT00H00M11S,081501_081550,"Rosslyn, va - feb. 21: arlington als fire department ambulance responds, siren blaring, lights, horn, dusk, rain.  ""advanced life support"" on side of truck. arlington county is been innovator in ems. "
15556390,https://ak.picdn.net/shutterstock/videos/15556390/preview/stock-footage-fountain-of-water-hd-format.mp4,PT00H00M11S,009851_009900,"Fountain of water, hd format"
1012182518,https://ak.picdn.net/shutterstock/videos/1012182518/preview/stock-footage-monaco-monaco-may-boats-anchored-in-a-port.mp4,PT00H00M15S,057401_057450,"Monaco, monaco - may, 2016: boats anchored in a port"
9829328,https://ak.picdn.net/shutterstock/videos/9829328/preview/stock-footage-airplane-window-view-at-sunset-zoom-shot.mp4,PT00H00M08S,092551_092600,"Airplane window view at sunset, zoom shot"
1041386257,https://ak.picdn.net/shutterstock/videos/1041386257/preview/stock-footage-a-top-down-aerial-view-of-a-paddy-field-with-farmers-at-work-located-in-kuching-sarawak-malaysia.mp4,PT00H00M21S,141451_141500,"A top down aerial view of a paddy field with farmers at work. located in kuching, sarawak, malaysia. general scenery of a paddy field, huts, trees and farmers."
1030392338,https://ak.picdn.net/shutterstock/videos/1030392338/preview/stock-footage-beautiful-waterfall-at-erawan-national-park-kanchanaburi-province-in-west-thailand-slow-motion.mp4,PT00H00M08S,170251_170300,"Beautiful waterfall at erawan national park, kanchanaburi province in west thailand. slow motion"
1054861913,https://ak.picdn.net/shutterstock/videos/1054861913/preview/stock-footage-man-wear-protective-mask-against-infectious-diseases-and-flu-close-up-portrait-handsome-red-head.mp4,PT00H00M23S,136651_136700,Man wear protective mask against infectious diseases and flu. close-up portrait handsome red head man with green eyes wearing protective face medical mask in prevention of coronavirus. outdoors. virus
1025355200,https://ak.picdn.net/shutterstock/videos/1025355200/preview/stock-footage-ink-in-water-blue-paint-with-shining-sparkles-reacting-in-water-creating-abstract-cloud-formations.mp4,PT00H00M30S,187701_187750,"Ink in water. blue paint with shining sparkles reacting in water creating abstract cloud formations.can be used as transitions,added to modern projects,art backgrounds, anything with creative twist"
1032388904,https://ak.picdn.net/shutterstock/videos/1032388904/preview/stock-footage-timelapse-of-caucasian-schoolgirl-and-african-american-schoolboy-cleaning-blackboard-in-classroom.mp4,PT00H00M17S,142701_142750,Timelapse of caucasian schoolgirl and african-american schoolboy cleaning blackboard in classroom
3479573,https://ak.picdn.net/shutterstock/videos/3479573/preview/stock-footage-natural-waterfalls.mp4,PT00H00M10S,097601_097650,Natural waterfalls
1051170922,https://ak.picdn.net/shutterstock/videos/1051170922/preview/stock-footage-cute-female-records-video-by-smartphone-attached-to-selfie-stick-blond-girl-filming-vlog-speaking.mp4,PT00H00M25S,008801_008850,"Cute female records video by smartphone attached to selfie stick. blond girl filming vlog speaking, smiling, chatting with followers, using cellphone on white background. beauty blogger recording blog"
1030573970,https://ak.picdn.net/shutterstock/videos/1030573970/preview/stock-footage-pre-teen-caucasian-girl-watering-flower-pots-in-a-garden-themes-of-waiting-impatience-gardener-care.mp4,PT00H00M15S,108251_108300,Pre teen caucasian girl watering flower pots in a garden themes of waiting impatience gardener care
6647189,https://ak.picdn.net/shutterstock/videos/6647189/preview/stock-footage-pan-tourist-business-man-online-on-tablet-walking-relaxed-in-railway-station.mp4,PT00H00M07S,135051_135100,Pan tourist business man online on tablet walking relaxed in railway station
1017761995,https://ak.picdn.net/shutterstock/videos/1017761995/preview/stock-footage-young-man-jogging-on-beach-during-sunset.mp4,PT00H00M14S,057301_057350,"Young man jogging on beach during sunset
"
1039611110,https://ak.picdn.net/shutterstock/videos/1039611110/preview/stock-footage-graphic-pattern-in-black-and-white-with-stroboscopic-and-hypnotic-effect-while-increasing-in-size.mp4,PT00H00M15S,108351_108400,"Graphic pattern in black and white with stroboscopic and hypnotic effect, while increasing in size and then reducing it."
11333357,https://ak.picdn.net/shutterstock/videos/11333357/preview/stock-footage-canned-banks-harvesting-tomatoes-in-winter.mp4,PT00H00M12S,020601_020650,Canned banks. harvesting tomatoes in winter
30475513,https://ak.picdn.net/shutterstock/videos/30475513/preview/stock-footage-bansko-bulgaria-dec-skier-at-mountains-ski-resort-bansko-bulgaria-at-season-opening.mp4,PT00H00M26S,189701_189750,"Bansko, bulgaria - 17 dec, 2016: skier at mountains ski resort bansko, bulgaria at season opening day - nature and sport background"
1023685702,https://ak.picdn.net/shutterstock/videos/1023685702/preview/stock-footage-view-from-the-shore-of-lake-bled-slovenia.mp4,PT00H00M21S,128251_128300,"View from the shore of lake bled, slovenia"
34048642,https://ak.picdn.net/shutterstock/videos/34048642/preview/stock-footage-woman-is-feeding-very-hungry-fish.mp4,PT00H00M10S,180401_180450,Woman is feeding very hungry fish
5307512,https://ak.picdn.net/shutterstock/videos/5307512/preview/stock-footage-soldering-wires-on-car-radio-module.mp4,PT00H00M11S,184601_184650,Soldering wires on car radio module
1018202746,https://ak.picdn.net/shutterstock/videos/1018202746/preview/stock-footage-animated-sketch-vector-drawing-doodle-call-to-action-empty-blue-sticker-button-icon-drawn-in-black.mp4,PT00H00M07S,149851_149900,Animated sketch vector drawing doodle call to action empty blue sticker button icon drawn in black changes to color illustration
21969610,https://ak.picdn.net/shutterstock/videos/21969610/preview/stock-footage-cozy-rural-house-decorated-for-christmas-with-christmas-lights-smoking-chimney-and-outdoor.mp4,PT00H00M14S,105301_105350,"Cozy rural house decorated for christmas with christmas lights, smoking chimney and outdoor christmas tree on foreground among snowy firs at winter night. decorative animation rendered in 4k"
28958725,https://ak.picdn.net/shutterstock/videos/28958725/preview/stock-footage-malacca-malaysia-july-tourists-taking-the-cruise-tour-boat-to-exploring-the-malacca.mp4,PT00H00M29S,004201_004250,"Malacca, malaysia - july 20,2017 : tourists taking the cruise tour boat to exploring the malacca river. malacca has been listed as a unesco world heritage site 2008. "
1040696876,https://ak.picdn.net/shutterstock/videos/1040696876/preview/stock-footage-tokyo-japan-sep-th-walking-in-odaiba-street-and-park.mp4,PT00H00M30S,132851_132900,"Tokyo, japan. 2019 sep 28th. walking in odaiba street and park"
29037385,https://ak.picdn.net/shutterstock/videos/29037385/preview/stock-footage-young-girl-with-phone-in-hands-in-electronics-store.mp4,PT00H00M22S,125401_125450,Young girl with phone in hands in electronics store
1011818765,https://ak.picdn.net/shutterstock/videos/1011818765/preview/stock-footage-a-crime-scene-investigator-checks-for-fingerprints-at-a-crime-scene.mp4,PT00H00M06S,005301_005350,A crime scene investigator checks for fingerprints at a crime scene.
1025125829,https://ak.picdn.net/shutterstock/videos/1025125829/preview/stock-footage-coins-fall-into-your-hand.mp4,PT00H00M44S,102701_102750,Coins fall into your hand
1024574072,https://ak.picdn.net/shutterstock/videos/1024574072/preview/stock-footage-high-fashion-model-in-the-image-of-an-alien-girl-in-a-black-mask-in-sparkling-rhinestones.mp4,PT00H00M10S,191801_191850,"High-fashion. model in the image of an alien girl in a black mask in sparkling rhinestones, sparkles, metal butterflies on a black and silver background posing in a model studio"
1051946062,https://ak.picdn.net/shutterstock/videos/1051946062/preview/stock-footage--k-background-footage-showing-a-blurred-rear-and-headlight-from-a-cars-and-traffic-environment-on.mp4,PT00H00M12S,176751_176800,4k background footage showing a blurred rear and headlight from a cars and traffic environment on the street during the heavy rain. traffic jam from heavy storm coming.
18610538,https://ak.picdn.net/shutterstock/videos/18610538/preview/stock-footage-young-beautiful-sportive-girl-resting-looking-at-watch-at-seaside-slow-motion.mp4,PT00H00M07S,069801_069850,"Young beautiful sportive girl resting, looking at watch at seaside. slow motion."
1035667373,https://ak.picdn.net/shutterstock/videos/1035667373/preview/stock-footage-christmas-gifts-on-the-table.mp4,PT00H00M09S,090651_090700,Christmas gifts on the table
1014391847,https://ak.picdn.net/shutterstock/videos/1014391847/preview/stock-footage-men-s-clothes-are-dried-on-rope-in-an-old-european-street.mp4,PT00H00M05S,195801_195850,Men's clothes are dried on rope in an old european street.
1040722724,https://ak.picdn.net/shutterstock/videos/1040722724/preview/stock-footage-young-bride-in-wedding-dress-holding-bouquet-flowers-in-a-park-white-luxury-gown-fashion-for-woman.mp4,PT00H00M06S,091651_091700,Young bride in wedding dress holding bouquet flowers in a park. white luxury gown fashion for woman
1040753087,https://ak.picdn.net/shutterstock/videos/1040753087/preview/stock-footage-neon-text-on-wall-and-snowfall-christmas-and-new-year-celebration-seamless-loop-d-render.mp4,PT00H00M10S,022701_022750,Neon text 2020 on wall and snowfall. christmas and new year celebration. seamless loop 3d render animation
1049095537,https://ak.picdn.net/shutterstock/videos/1049095537/preview/stock-footage-winter-mountains-panorama-with-ski-slopes-and-ski-lifts-on-a-sunny-day.mp4,PT00H00M25S,076951_077000,Winter mountains panorama with ski slopes and ski lifts on a sunny day.
7447825,https://ak.picdn.net/shutterstock/videos/7447825/preview/stock-footage-beautiful-natural-light-lilla-colored-scene-in-a-grass-with-grass-blades-bokeh.mp4,PT00H00M10S,024101_024150,"Beautiful natural light lilla colored scene in a grass with grass-blades, bokeh"
11648024,https://ak.picdn.net/shutterstock/videos/11648024/preview/stock-footage-aerial-view-of-wales-in-great-britain-shot-from-helicopter-towards-natural-mountain-ranges-rivers.mp4,PT00H00M26S,000851_000900,"Aerial view of wales in great britain. shot from helicopter towards natural mountain ranges, rivers and agricultural farms"
1020105760,https://ak.picdn.net/shutterstock/videos/1020105760/preview/stock-footage-tourist-woman-walk-along-high-castle-wall-enjoy-sea-and-historic-landmark-panorama-barcelona.mp4,PT00H00M16S,013901_013950,"Tourist woman walk along high castle wall, enjoy sea and historic landmark panorama, barcelona"
1025189801,https://ak.picdn.net/shutterstock/videos/1025189801/preview/stock-footage-half-dressed-bearded-man-in-glasses-with-light-hair-and-hot-body-driving-wheelbarrow-with-hay-in.mp4,PT00H00M11S,069601_069650,Half-dressed bearded man in glasses with light hair and hot body driving wheelbarrow with hay in the cold winter barn. farmer walking toward the camera. rancher works at his farm. slow motion
31490254,https://ak.picdn.net/shutterstock/videos/31490254/preview/stock-footage-jack-russell-terrier-puppies.mp4,PT00H00M11S,062051_062100,Jack russell terrier puppies
14539990,https://ak.picdn.net/shutterstock/videos/14539990/preview/stock-footage-high-quality-looping-animation-of-abstract-cyan-blue-background-with-square-bokeh-defocused-lights.mp4,PT00H00M15S,183651_183700,"High quality looping animation of abstract cyan blue background with square bokeh defocused lights (seamless loop, 4k)"
1013815079,https://ak.picdn.net/shutterstock/videos/1013815079/preview/stock-footage-background-with-an-animated-d-polygons.mp4,PT00H00M10S,092851_092900,Background with an animated 3d polygons.
6049154,https://ak.picdn.net/shutterstock/videos/6049154/preview/stock-footage-kumasi-ghana-africa-may-camera-pan-to-a-monument-wide-shot.mp4,PT00H00M09S,011201_011250,"Kumasi, ghana africa -may 2013,camera pan to a monument ,wide shot"
1036638860,https://ak.picdn.net/shutterstock/videos/1036638860/preview/stock-footage-home-gardening-picking-or-harvesting-sweet-cherry-tomato-and-inspecting-or-checking-it-with-bare.mp4,PT00H00M19S,183201_183250,Home gardening - picking or harvesting sweet cherry tomato and inspecting or checking it with bare hand.
1031287262,https://ak.picdn.net/shutterstock/videos/1031287262/preview/stock-footage-varden-the-molde-panorama-in-norway-in-the-spring.mp4,PT00H00M16S,175251_175300,Varden the molde panorama in norway in the spring
5921951,https://ak.picdn.net/shutterstock/videos/5921951/preview/stock-footage-sunset-view-of-turbines-from-wind-farm-on-the-shores-of-puttalam-lagoon-in-sri-lanka.mp4,PT00H00M41S,084351_084400,Sunset view of turbines from wind farm on the shores of puttalam lagoon in sri lanka
1765829,https://ak.picdn.net/shutterstock/videos/1765829/preview/stock-footage-background-from-rotate-chocolate-peanut-butter-closeup.mp4,PT00H00M30S,048651_048700,Background from rotate chocolate-peanut butter closeup
27849085,https://ak.picdn.net/shutterstock/videos/27849085/preview/stock-footage-video-footage-view-of-beautiful-medieval-spaso-preobrazenski-monastery-turned-cultural-protected.mp4,PT00H00M07S,111451_111500,"Video footage view of beautiful medieval spaso-preobrazenski monastery turned cultural protected reserve in central yaroslavl city in yaroslavl oblast area, 260 km north-east of moscow, central russia"
18185668,https://ak.picdn.net/shutterstock/videos/18185668/preview/stock-footage-construction-cranes-works-on-the-construction-site.mp4,PT00H00M20S,116151_116200,Construction cranes works on the construction site
1029448202,https://ak.picdn.net/shutterstock/videos/1029448202/preview/stock-footage-pink-cherry-blossoms-on-blurred-background.mp4,PT00H00M16S,060251_060300,Pink cherry blossoms on blurred background
1016529808,https://ak.picdn.net/shutterstock/videos/1016529808/preview/stock-footage-circa-women-working-in-the-air-traffic-control-tower-of-a-us-navy-air-station-help-an.mp4,PT00H01M17S,065001_065050,Circa -1953 - women working in the air traffic control tower of a us navy air station help an emergency evacuation plane land.
28438417,https://ak.picdn.net/shutterstock/videos/28438417/preview/stock-footage-a-passenger-plane-fly-up-over-take-off-runway-from-the-airport-long-shot.mp4,PT00H00M10S,012501_012550,A passenger plane fly up over take-off runway from the airport. long shot.
1025425511,https://ak.picdn.net/shutterstock/videos/1025425511/preview/stock-footage-nerd-boss-calls-on-his-mobile-phone.mp4,PT00H00M25S,014051_014100,Nerd boss calls on his mobile phone
1053912149,https://ak.picdn.net/shutterstock/videos/1053912149/preview/stock-footage-person-making-ketogenic-coffee-with-butter-and-mct-oil.mp4,PT00H00M15S,134401_134450,Person making ketogenic coffee with butter and mct oil
16600222,https://ak.picdn.net/shutterstock/videos/16600222/preview/stock-footage-girl-in-the-helmet-looks-at-sea-creatures-at-the-bermuda-helmet-diving-tour.mp4,PT00H00M14S,129801_129850,Girl in the helmet looks at sea creatures at the bermuda helmet diving tour. 
1031276489,https://ak.picdn.net/shutterstock/videos/1031276489/preview/stock-footage--s-united-states-hospital-secretary-types-notes-nun-gives-file-to-secretary.mp4,PT00H00M13S,013001_013050,1960s: united states: hospital secretary types notes. nun gives file to secretary
28251070,https://ak.picdn.net/shutterstock/videos/28251070/preview/stock-footage-green-eye-opens-and-shuts.mp4,PT00H00M09S,068451_068500,Green eye opens and shuts
1050764539,https://ak.picdn.net/shutterstock/videos/1050764539/preview/stock-footage--heavy-rain-makes-trees-susceptible.mp4,PT00H00M10S,070101_070150,"
heavy rain makes trees susceptible."
1037429585,https://ak.picdn.net/shutterstock/videos/1037429585/preview/stock-footage-florence-italy-people-walk-in-the-street.mp4,PT00H00M05S,103501_103550,"Florence, italy - 1967: people walk in the street"
4858136,https://ak.picdn.net/shutterstock/videos/4858136/preview/stock-footage-tuscan-hills.mp4,PT00H00M12S,170501_170550,Tuscan hills
1041235093,https://ak.picdn.net/shutterstock/videos/1041235093/preview/stock-footage-denmark-animated-flag-in-the-wind-with-blue-sky-in-the-background-green-screen-blue-screen-or.mp4,PT00H00M59S,127851_127900,"Denmark animated flag in the wind with blue sky in the background, green screen, blue screen or isolated background and the flag on the full background, all in one animated flag pack."
9404027,https://ak.picdn.net/shutterstock/videos/9404027/preview/stock-footage-sevastopol-crimea-russia-march-firefighter-exercises-firemen-work-on-the-retractable.mp4,PT00H00M42S,149401_149450,"Sevastopol, crimea, russia - march 26, 2015: firefighter exercises. firemen work on the retractable fire escape stairs"
16345450,https://ak.picdn.net/shutterstock/videos/16345450/preview/stock-footage-bergamo-is-a-city-in-lombardy-italy-the-foothills-of-the-bergamo-alps-begin-immediately-north-of.mp4,PT00H00M07S,128751_128800,"Bergamo is a city in lombardy, italy. the foothills of the bergamo alps begin immediately north of the town."
34830007,https://ak.picdn.net/shutterstock/videos/34830007/preview/stock-footage-north-carolina-the-united-states-august-naval-forces-arriving-to-the-beach-secret.mp4,PT00H00M20S,109451_109500,"North carolina, the united states - august 12, 2015: naval forces arriving to the beach; secret location"
