videoid,contentUrl,duration,page_dir,name
35027767,https://ak.picdn.net/shutterstock/videos/35027767/preview/stock-footage-close-up-of-hooded-hacker-initiating-cyber-attack-on-smartphone-launching-bomb.mp4,PT00H00M12S,001201_001250,"Close up of hooded hacker initiating cyber attack on smartphone, launching bomb"
11034758,https://ak.picdn.net/shutterstock/videos/11034758/preview/stock-footage-carpathian-storming-mourning-with-heavy-led-clouds-timelapse.mp4,PT00H00M28S,068701_068750,Carpathian storming mourning with heavy led clouds. timelapse.
371149,https://ak.picdn.net/shutterstock/videos/371149/preview/stock-footage-water-texture.mp4,PT00H00M30S,117101_117150,Water texture
1007903461,https://ak.picdn.net/shutterstock/videos/1007903461/preview/stock-footage-snow-falling-down-in-home-garden-winter-season-cold-temperature-scenic-setting.mp4,PT00H00M10S,018001_018050,"Snow falling down in home garden, winter season, cold temperature, scenic setting."
14979268,https://ak.picdn.net/shutterstock/videos/14979268/preview/stock-footage-static-scene-beautiful-landscape-with-sea-sunrise-in-sattahip-thailand.mp4,PT00H00M17S,019951_020000,"Static scene. beautiful landscape with sea sunrise in sattahip, thailand"
1035835817,https://ak.picdn.net/shutterstock/videos/1035835817/preview/stock-footage-seaside-holidays-day-shot-at-the-beach-black-sea-romania.mp4,PT00H00M14S,063551_063600,"Seaside holidays. day shot at the beach. black sea, romania"
1037750792,https://ak.picdn.net/shutterstock/videos/1037750792/preview/stock-footage-a-bouquet-of-white-and-yellow-chamomile-or-daisies-flowers-is-in-a-vase-by-the-window-slider-shot.mp4,PT00H00M07S,020701_020750,A bouquet of white and yellow chamomile or daisies flowers is in a vase by the window slider shot.
21222409,https://ak.picdn.net/shutterstock/videos/21222409/preview/stock-footage-digital-interface-healthcare.mp4,PT00H00M07S,119751_119800,Digital interface - healthcare 
13487489,https://ak.picdn.net/shutterstock/videos/13487489/preview/stock-footage-the-young-boxer-wrap-red-bandage-on-hands.mp4,PT00H00M12S,005001_005050,The young boxer wrap red bandage on hands
1018024957,https://ak.picdn.net/shutterstock/videos/1018024957/preview/stock-footage-time-lapse-on-the-river-zezere-with-forest-portugal.mp4,PT00H00M20S,052001_052050,Time lapse on the river zezere with forest. portugal
1065768412,https://ak.picdn.net/shutterstock/videos/1065768412/preview/stock-footage-fun-d-cartoon-business-man-dancing.mp4,PT00H00M32S,017051_017100,Fun 3d cartoon business man dancing
1034107304,https://ak.picdn.net/shutterstock/videos/1034107304/preview/stock-footage-young-man-celebrating-success-isolated-on-yellow-background.mp4,PT00H00M07S,108601_108650,Young man celebrating success isolated on yellow background
1063569733,https://ak.picdn.net/shutterstock/videos/1063569733/preview/stock-footage-young-woman-mouth-eating-cherry-tomato.mp4,PT00H00M09S,178401_178450,Young woman mouth eating cherry tomato
6699788,https://ak.picdn.net/shutterstock/videos/6699788/preview/stock-footage-camogli.mp4,PT00H00M20S,003651_003700,Camogli 
1035466826,https://ak.picdn.net/shutterstock/videos/1035466826/preview/stock-footage-namibia-circa-hot-air-balloons-launch-in-the-namib-desert-in-namibia.mp4,PT00H00M11S,184501_184550,Namibia - circa 2018 - hot air balloons launch in the namib desert in namibia.
1015968742,https://ak.picdn.net/shutterstock/videos/1015968742/preview/stock-footage-fly-over-residential-area-construction-zone-kharkiv-ukraine.mp4,PT00H00M17S,101651_101700,"Fly over residential area construction zone (kharkiv, ukraine)"
1025019950,https://ak.picdn.net/shutterstock/videos/1025019950/preview/stock-footage-nepal-aerial-view-of-kathmandu-circular-panorama-of-the-city-center-urban-waterway.mp4,PT00H00M49S,186101_186150,Nepal. aerial view of kathmandu. circular panorama of the city center. urban waterway
26146082,https://ak.picdn.net/shutterstock/videos/26146082/preview/stock-footage-united-states-s-pen-points-at-interior-design-picture-on-board-man-shows-lady-pictures.mp4,PT00H00M22S,172201_172250,United states: 1960s: pen points at interior design picture on board. man shows lady pictures.
1009438217,https://ak.picdn.net/shutterstock/videos/1009438217/preview/stock-footage-animation-of-audio-equalizer-seamless-loop.mp4,PT00H00M20S,103201_103250,Animation of audio equalizer. seamless loop.
1011906068,https://ak.picdn.net/shutterstock/videos/1011906068/preview/stock-footage-russia-moscow-russia-crowds-faces-crushed.mp4,PT00H00M10S,081151_081200,"Russia, 1999, moscow, russia, crowds, faces, crushed"
1048581946,https://ak.picdn.net/shutterstock/videos/1048581946/preview/stock-footage-fit-attractive-man-doing-yoga-on-the-beach-strength-and-spiritual-fitness-concept.mp4,PT00H00M20S,000351_000400,"Fit attractive man doing yoga on the beach, strength and spiritual fitness concept"
1013784308,https://ak.picdn.net/shutterstock/videos/1013784308/preview/stock-footage-happy-man-with-keys-from-new-car.mp4,PT00H00M13S,136851_136900,Happy man with keys from new car
1023470575,https://ak.picdn.net/shutterstock/videos/1023470575/preview/stock-footage-flag-of-the-country-lao-p-d-r-flutters-against-the-blue-sky-d-rendering.mp4,PT00H00M05S,122701_122750,Flag of the country  lao p.d.r  flutters against the blue sky. 3d rendering
1007161921,https://ak.picdn.net/shutterstock/videos/1007161921/preview/stock-footage-winter-steppe-landscape-with-grass-under-the-snow.mp4,PT00H00M27S,071451_071500,Winter steppe landscape with grass under the snow
31783798,https://ak.picdn.net/shutterstock/videos/31783798/preview/stock-footage-fly-over-tenderly-blue-ocean-surface-with-modern-boats-and-sea-scooters-on-island-maui-hawaii.mp4,PT00H00M26S,148201_148250,"Fly over tenderly blue ocean surface with modern boats and sea scooters on island maui,hawaii"
1010048609,https://ak.picdn.net/shutterstock/videos/1010048609/preview/stock-footage-aerial-overhead-view-of-tongass-national-coniferous-pine-tree-forest-alexander-archipelago-remote.mp4,PT00H00M29S,042251_042300,Aerial overhead view of tongass national coniferous pine tree forest alexander archipelago remote wilderness ketchikan southern alaska north pacific ocean usa
1011515534,https://ak.picdn.net/shutterstock/videos/1011515534/preview/stock-footage-taiwan-keelung-train-station-aerial-photography.mp4,PT00H00M11S,004801_004850,Taiwan keelung train station aerial photography
12881105,https://ak.picdn.net/shutterstock/videos/12881105/preview/stock-footage-aerial-flight-over-ocean-waves-at-sunset-amazing-sunset-aerial-shot-flying-low-over-ocean.mp4,PT00H00M28S,122801_122850,Aerial flight over ocean waves at sunset. amazing sunset aerial shot flying low over ocean
2549312,https://ak.picdn.net/shutterstock/videos/2549312/preview/stock-footage-high-angle-view-of-the-city-of-osaka-as-seen-during-the-evening.mp4,PT00H00M21S,018651_018700,High angle view of the city of osaka as seen during the evening
1021277209,https://ak.picdn.net/shutterstock/videos/1021277209/preview/stock-footage-aerial-top-down-view-of-the-group-of-body-boarders-surfing-at-makaha-surf-spot-oahu-hawaii.mp4,PT00H00M31S,183551_183600,"Aerial top down view of the group of body boarders surfing at makaha surf spot, oahu, hawaii"
23587582,https://ak.picdn.net/shutterstock/videos/23587582/preview/stock-footage--fps-slow-motion-of-cowtails-in-branford-connecticut.mp4,PT00H00M09S,080151_080200,120 fps slow motion of cowtails in branford connecticut.
20446204,https://ak.picdn.net/shutterstock/videos/20446204/preview/stock-footage-moscow-jul-man-and-woman-with-model-releases-dismantle-tent-near-dwelling-house-at.mp4,PT00H00M12S,034651_034700,"Moscow - jul 18, 2016: man and woman (with model releases) dismantle tent near dwelling house at summer sunny day. timelapse"
1006928917,https://ak.picdn.net/shutterstock/videos/1006928917/preview/stock-footage-newborn-baby-boy-crying.mp4,PT00H00M29S,197651_197700,Newborn baby boy crying
32082835,https://ak.picdn.net/shutterstock/videos/32082835/preview/stock-footage-luxurious-red-haired-retro-woman-with-expensive-jewelry-in-a-red-dress-and-fur-cape-posing-on-a.mp4,PT00H00M14S,124101_124150,Luxurious red-haired retro woman with expensive jewelry in a red dress and fur cape posing on a pink background. elegant girl paints her lips with red lipstick
20899897,https://ak.picdn.net/shutterstock/videos/20899897/preview/stock-footage-ottawa-canada-september-a-young-professional-scooter-rider-training-for-the-upcoming.mp4,PT00H00M09S,132451_132500,"Ottawa, canada - september 2016 - a young professional scooter rider training for the upcoming contest season at one of the nation's newest skateboard parks"
4873649,https://ak.picdn.net/shutterstock/videos/4873649/preview/stock-footage-ecological-woman-holding-recycling-bin-on-white-background.mp4,PT00H00M15S,008101_008150,Ecological woman holding recycling bin on white background
24465554,https://ak.picdn.net/shutterstock/videos/24465554/preview/stock-footage-ski-tracks-over-snowy-terrain.mp4,PT00H00M49S,080651_080700,Ski tracks over snowy terrain
1020940885,https://ak.picdn.net/shutterstock/videos/1020940885/preview/stock-footage-rapeseed-growing-on-big-farm-ecology-field-ascending-shot-hd-sliding-backwards-and-above-from.mp4,PT00H00M17S,128701_128750,Rapeseed growing on big farm ecology field ascending shot hd. sliding backwards and above from single rapeseed in focus to whole field wide shot. yellow flower endless farm field.
1039325717,https://ak.picdn.net/shutterstock/videos/1039325717/preview/stock-footage-close-up-of-a-male-physiotherapist-doing-finger-and-palm-massage-to-a-young-girl-in-a-massage-spa.mp4,PT00H00M06S,050901_050950,Close-up of a male physiotherapist doing finger and palm massage to a young girl in a massage spa salon. professional pampering and deep relaxation
5772365,https://ak.picdn.net/shutterstock/videos/5772365/preview/stock-footage-coron-philippines-february-boats-waiting-for-tourists-to-travel-between-the-islands.mp4,PT00H00M21S,135751_135800,"Coron, philippines - february 07, 2014 : boats waiting for tourists to travel between the islands. coron is one of the top tourist destinations in the world."
1039184558,https://ak.picdn.net/shutterstock/videos/1039184558/preview/stock-footage-hooded-young-african-man-looking-something-slow-motion.mp4,PT00H00M24S,027451_027500,Hooded young african man looking something- slow motion
17449162,https://ak.picdn.net/shutterstock/videos/17449162/preview/stock-footage-nenzing-austria-april-man-relaxing-at-camping-ground-several-travel-trailers-and-rv.mp4,PT00H00M08S,180051_180100,"Nenzing, austria - april 28, 2014: man relaxing at camping ground. several travel trailers and rv vehicles parked on the grass."
15565540,https://ak.picdn.net/shutterstock/videos/15565540/preview/stock-footage-old-city-of-jerusalem-landscape-as-viewed-from-olives-mount-jerusalem-israel.mp4,PT00H00M11S,052251_052300,Old city of jerusalem landscape as viewed from olives mount. jerusalem. israel
1026604424,https://ak.picdn.net/shutterstock/videos/1026604424/preview/stock-footage-russia-anapa-summer-gathering-of-young-athletes-in-table-tennis-competitions-in-between.mp4,PT00H00M09S,010251_010300,"Russia, anapa, 2018: summer gathering of young athletes in table tennis. competitions in between the children. preparation for competitions in table tennis"
1019492683,https://ak.picdn.net/shutterstock/videos/1019492683/preview/stock-footage-a-little-girl-with-her-parents-in-a-cafe-looking-at-the-smartphone.mp4,PT00H00M05S,039651_039700,"A little girl with her parents in a cafe, looking at the smartphone."
1015165957,https://ak.picdn.net/shutterstock/videos/1015165957/preview/stock-footage-composition-of-fresh-pastries-on-a-wooden-background-bread-bun-bakery-agriculture-and-bakery.mp4,PT00H00M21S,073601_073650,"Composition of fresh pastries on a wooden background. bread, bun, bakery. agriculture and bakery."
3863162,https://ak.picdn.net/shutterstock/videos/3863162/preview/stock-footage-spider-webs-swinging-in-the-wind-in-a-wasteland-at-sunset-early-spring-in-turku-finland-dried.mp4,PT00H00M46S,113601_113650,"Spider webs swinging in the wind in a wasteland at sunset. early spring in turku, finland.
dried woolly burdock (arctium tomentosum) stems."
1036753913,https://ak.picdn.net/shutterstock/videos/1036753913/preview/stock-footage-circa-s-a-biplane-pilot-takes-off-and-lands-his-plane.mp4,PT00H00M46S,057651_057700,Circa 1940s - a biplane pilot takes off and lands his plane
1023213838,https://ak.picdn.net/shutterstock/videos/1023213838/preview/stock-footage-hyper-lapse-in-the-hague-from-a-busy-crossing.mp4,PT00H00M06S,143601_143650,Hyper lapse in the hague from a busy crossing
9239894,https://ak.picdn.net/shutterstock/videos/9239894/preview/stock-footage-couple-greylag-gooses-standing-in-water.mp4,PT00H00M19S,188251_188300,Couple greylag gooses standing in water
1061748757,https://ak.picdn.net/shutterstock/videos/1061748757/preview/stock-footage-shanghai-china-oct-beautiful-sunset-with-silhouette-shanghai-landmarks-background.mp4,PT00H00M36S,132401_132450,"Shanghai, china - oct. 22, 2020: beautiful sunset with silhouette shanghai landmarks background, time lapse 4k footage."
9659132,https://ak.picdn.net/shutterstock/videos/9659132/preview/stock-footage-flag-o-saint-kits-and-navies-beautiful-d-animation-revealing-saint-kits-and-navies-flag-with.mp4,PT00H00M16S,016101_016150,"Flag o saint kits and navies
beautiful 3d animation revealing saint kits and navies flag with alpha channel
"
1043791540,https://ak.picdn.net/shutterstock/videos/1043791540/preview/stock-footage-circa-different-kinds-of-type-are-shown-in-a-printing-shop.mp4,PT00H01M24S,007751_007800,Circa 1958 - different kinds of type are shown in a printing shop.
1062329257,https://ak.picdn.net/shutterstock/videos/1062329257/preview/stock-footage-established-aerial-view-of-legok-jawa-sandy-beach-coastline-on-the-coast-of-the-java-south-sea.mp4,PT00H00M07S,181201_181250,Established aerial view of legok jawa sandy beach coastline on the coast of the java south sea
1017429493,https://ak.picdn.net/shutterstock/videos/1017429493/preview/stock-footage-rocky-bay-of-croatia.mp4,PT00H00M15S,035501_035550,Rocky bay of croatia
1056574505,https://ak.picdn.net/shutterstock/videos/1056574505/preview/stock-footage-czechia-flag-waving-in-the-blue-sky-realistic-k-video.mp4,PT00H00M20S,103901_103950,Czechia flag waving in the blue sky realistic 4k video.
1064195578,https://ak.picdn.net/shutterstock/videos/1064195578/preview/stock-footage-animation-of-wave-movements-of-blue-geometric-lines-seamless-k-loop-footage.mp4,PT00H00M24S,057851_057900,Animation of wave movements of blue geometric lines. seamless 4k loop footage
16000636,https://ak.picdn.net/shutterstock/videos/16000636/preview/stock-footage-house-drawn-icon-on-grass-green-background-real-estate-in-ecological-area-social-concept-the.mp4,PT00H00M16S,104751_104800,"House drawn icon on grass green background. real estate in ecological area. social concept. the property. lending for ecohouse construction. green buildings, nanotechnology in construction "
1009741682,https://ak.picdn.net/shutterstock/videos/1009741682/preview/stock-footage-stove-top-espresso-maker-boiling-grounded-coffee-for-two-espresso-shots-hd-slow-motion-on-black.mp4,PT00H00M16S,178651_178700,"Stove top espresso maker boiling grounded coffee for two espresso shots,hd slow motion on black background.
vintage espresso maker."
7778266,https://ak.picdn.net/shutterstock/videos/7778266/preview/stock-footage-asian-rice-paddy.mp4,PT00H00M08S,191801_191850,Asian rice paddy
1021960285,https://ak.picdn.net/shutterstock/videos/1021960285/preview/stock-footage-pink-flamingos-in-lefkas-greece.mp4,PT00H00M24S,145351_145400,Pink flamingos in lefkas greece
23025943,https://ak.picdn.net/shutterstock/videos/23025943/preview/stock-footage-the-decision-on-costs.mp4,PT00H00M12S,130701_130750,The decision on costs
5500160,https://ak.picdn.net/shutterstock/videos/5500160/preview/stock-footage-abstract-animated-background-with-fluid-elements.mp4,PT00H00M17S,074651_074700,Abstract animated background with fluid elements
1056783701,https://ak.picdn.net/shutterstock/videos/1056783701/preview/stock-footage--k-d-animation-of-a-over-weight-avatar-man-who-is-doing-push-up-exercises-to-lose-weight-watch.mp4,PT00H00M31S,071401_071450,"4k 3d animation of a over weight avatar man, who is doing push up exercises to lose weight , watch as he reduces his weight to become fit and speeds up in his exercising."
1046868112,https://ak.picdn.net/shutterstock/videos/1046868112/preview/stock-footage-aerial-vietnam-hanoi-ba-dinh-downtown-september-overcast-day-k-mavic-pro-aerial-video-of.mp4,PT00H00M27S,068201_068250,"Aerial vietnam hanoi ba dinh downtown september 2019 overcast day 4k mavic pro

aerial video of downtown hanoi, vietnam in ba dinh district on a hazy overcast cloudy day."
23812630,https://ak.picdn.net/shutterstock/videos/23812630/preview/stock-footage-abstract-composition-of-complex-molecular-structures-with-slow-moving-of-connections-k.mp4,PT00H00M15S,117301_117350,Abstract composition of complex molecular structures with slow moving of connections 4k.
1038419246,https://ak.picdn.net/shutterstock/videos/1038419246/preview/stock-footage-mediterranean-sea-october-large-black-cargo-ship-at-anchor-aerial-footage.mp4,PT00H00M08S,119001_119050,"Mediterranean sea - october 3, 2019: large black cargo ship at anchor, aerial footage."
1034559059,https://ak.picdn.net/shutterstock/videos/1034559059/preview/stock-footage-traffic-lights-night-traffic-that-blur.mp4,PT00H00M07S,092601_092650,"Traffic lights, night traffic that blur"
34176949,https://ak.picdn.net/shutterstock/videos/34176949/preview/stock-footage-boy-eating-pasta-with-sauce.mp4,PT00H00M09S,080601_080650,Boy eating pasta with sauce
1052964215,https://ak.picdn.net/shutterstock/videos/1052964215/preview/stock-footage-covid-ortakoy-square-pandemic-curfew-istanbul-bosphorus-and-bogazici-bridge.mp4,PT00H00M15S,019301_019350,Covid-19 ortakoy square pandemic curfew istanbul bosphorus and bogazici bridge. 
13653842,https://ak.picdn.net/shutterstock/videos/13653842/preview/stock-footage-blue-ink-dropped-into-water-in-fps.mp4,PT00H01M00S,186501_186550,"Blue ink dropped into water, in 50 fps."
33662104,https://ak.picdn.net/shutterstock/videos/33662104/preview/stock-footage-a-blond-woman-on-the-terrace-of-a-resort-hotel-with-a-view-of-the-lights-of-a-night-city-drinking.mp4,PT00H00M11S,056201_056250,"A blond woman on the terrace of a resort hotel with a view of the lights of a night city, drinking a hot drink from a mug. background blur, 4k."
1057788844,https://ak.picdn.net/shutterstock/videos/1057788844/preview/stock-footage-a-loving-father-carries-his-son-on-his-shoulders.mp4,PT00H00M17S,087751_087800,A loving father carries his son on his shoulders.
1023109669,https://ak.picdn.net/shutterstock/videos/1023109669/preview/stock-footage-man-proposing-to-beloved-lady-putting-precious-ring-on-finger-romantic-dinner.mp4,PT00H00M14S,121251_121300,"Man proposing to beloved lady, putting precious ring on finger, romantic dinner"
1027327130,https://ak.picdn.net/shutterstock/videos/1027327130/preview/stock-footage-kyiv-ukraine-september-professional-movie-camera-backstage-cinema-production-filming.mp4,PT00H00M16S,090501_090550,"Kyiv, ukraine - september 18, 2017. professional movie camera. backstage cinema production. filming and filmmaking. professional film equipment. camera on the set of the film. movie camera"
34005361,https://ak.picdn.net/shutterstock/videos/34005361/preview/stock-footage-russia-moscow-september-the-teenage-girl-is-rinsing-the-brush-in-the-can-while-drawing.mp4,PT00H00M21S,019301_019350,"Russia, moscow - september 2, 2017: the teenage girl is rinsing the brush in the can while drawing a picture in the studio.  "
1031585156,https://ak.picdn.net/shutterstock/videos/1031585156/preview/stock-footage-low-angle-view-from-boat-of-the-bridge-over-river-severn-in-shrewsbury-town-in-england.mp4,PT00H00M08S,013651_013700,Low angle view from boat of the bridge over river severn in shrewsbury town in england
1038444341,https://ak.picdn.net/shutterstock/videos/1038444341/preview/stock-footage-happy-business-people-with-conference-cards-holding-champagne-glasses-career.mp4,PT00H00M07S,199401_199450,"Happy business people with conference cards holding champagne glasses, career"
1019233201,https://ak.picdn.net/shutterstock/videos/1019233201/preview/stock-footage-gardens-of-monserrate-sintra-portugal.mp4,PT00H00M27S,062501_062550,"Gardens of monserrate, sintra, portugal."
1033166342,https://ak.picdn.net/shutterstock/videos/1033166342/preview/stock-footage-aerial-of-the-old-part-of-town-of-schw-bisch-gm-nd-in-germany-camera-rotates-left-around-the.mp4,PT00H00M16S,018901_018950,"Aerial of the old part of town of schwäbisch gmünd in germany.  camera rotates left around the city center, minster of the holy cross cathedral, marketplace and city hall."
1012118288,https://ak.picdn.net/shutterstock/videos/1012118288/preview/stock-footage-young-female-teacher-leaves-botanic-students-to-work-independently-with-plants-in-laboratory-boys.mp4,PT00H00M56S,176201_176250,Young female teacher leaves botanic students to work independently with plants in laboratory. boys and girls watering green plants and analyze chemical reactions.
1017228517,https://ak.picdn.net/shutterstock/videos/1017228517/preview/stock-footage-beach-scenes-at-st-martins-island-on-the-isles-of-scilly.mp4,PT00H00M11S,109401_109450,Beach scenes at st martins island on the isles of scilly.
1008762563,https://ak.picdn.net/shutterstock/videos/1008762563/preview/stock-footage-country-house-ponte-de-lima-casa-pomarch-o.mp4,PT00H00M16S,113701_113750,Country house - ponte de lima- casa pomarchão
12546377,https://ak.picdn.net/shutterstock/videos/12546377/preview/stock-footage-thessaloniki-greece-october-people-stroll-the-waterfront-of-thessaloniki-during-a-sunny.mp4,PT00H00M58S,191751_191800,"Thessaloniki, greece , october 28 2015: people stroll the waterfront of thessaloniki during a sunny day in october. aerial shot with drone"
21955237,https://ak.picdn.net/shutterstock/videos/21955237/preview/stock-footage-the-process-of-making-a-cocktail.mp4,PT00H00M19S,130751_130800,The process of making a cocktail
22794730,https://ak.picdn.net/shutterstock/videos/22794730/preview/stock-footage-heating-with-hot-fire-closeup-power-diversity.mp4,PT00H00M07S,055151_055200,"Heating with hot fire closeup, power diversity"
32963110,https://ak.picdn.net/shutterstock/videos/32963110/preview/stock-footage-scenic-view-of-mountains-fog-mist-viewpoint-at-doi-inthanon-doi-ang-khang-chiang-mai-thailand.mp4,PT00H00M46S,147801_147850,"Scenic view of mountains fog mist viewpoint at doi inthanon, doi ang khang, chiang mai, thailand"
32953927,https://ak.picdn.net/shutterstock/videos/32953927/preview/stock-footage-someone-draws-paint-on-a-white-sheet-close-up-of-a-tassel-k-slow-motion-draws-a-blue-sea-on-a.mp4,PT00H00M21S,083701_083750,"Someone draws paint on a white sheet. close-up of a tassel. 4k, slow motion, draws a blue sea on a white sheet"
1029663851,https://ak.picdn.net/shutterstock/videos/1029663851/preview/stock-footage-close-up-shot-blonde-housewife-in-pink-sweater-relaxing-on-sofa-surfing-in-smartphone-in-cozy-home.mp4,PT00H00M26S,089401_089450,Close-up shot blonde housewife in pink sweater relaxing on sofa surfing in smartphone in cozy home atmosphere.
28146256,https://ak.picdn.net/shutterstock/videos/28146256/preview/stock-footage-japanese-koi-fish-swimming-in-a-garden-pond.mp4,PT00H00M08S,046901_046950,"Japanese koi fish swimming in a garden pond
"
22823302,https://ak.picdn.net/shutterstock/videos/22823302/preview/stock-footage-animated-d-bouncing-red-rebajas-sign-rebajas-is-spanish-for-sale.mp4,PT00H00M06S,012201_012250,Animated 3d bouncing red rebajas sign.  rebajas is spanish for sale.
1027415426,https://ak.picdn.net/shutterstock/videos/1027415426/preview/stock-footage-entertainment-with-screen-touch-on-board-of-flying-air-plane-a-woman-looks-at-a-monitor-on-the.mp4,PT00H00M19S,127501_127550,"Entertainment with screen touch on board of flying air plane. a woman looks at a monitor on the aircraft seat. passengers on planes to use the touch display.
"
1007660839,https://ak.picdn.net/shutterstock/videos/1007660839/preview/stock-footage-a-small-girl-with-mother-and-grandmother-at-home.mp4,PT00H00M12S,016551_016600,A small girl with mother and grandmother at home.
15654907,https://ak.picdn.net/shutterstock/videos/15654907/preview/stock-footage-higashiyama-ku-district-view-from-kiyomizu-dera-temple-in-autumn-kyoto-japan.mp4,PT00H00M13S,100201_100250,"Higashiyama-ku district view from kiyomizu-dera temple in autumn kyoto, japan "
1051007368,https://ak.picdn.net/shutterstock/videos/1051007368/preview/stock-footage-wallpaper-background-white-bubbles-spheres-oil-drop-floating-on-liquid-abstract-smartphone-home.mp4,PT00H00M19S,078401_078450,"Wallpaper background white bubbles spheres. oil drop floating on liquid, abstract smartphone home screensaver, themes. science laboratory experiment progress, light effect 3d pure"
1059458777,https://ak.picdn.net/shutterstock/videos/1059458777/preview/stock-footage-medium-shot-of-three-young-diverse-volunteers-wearing-uniform-standing-on-lake-shore-holding.mp4,PT00H00M08S,053101_053150,"Medium shot of three young diverse volunteers wearing uniform standing on lake shore, holding rubbish bags in their hands and giving high five to each other"
31899955,https://ak.picdn.net/shutterstock/videos/31899955/preview/stock-footage-slowmo-of-little-girl-and-three-boys-chasing-and-bursting-large-soap-bubbles-at-sunny-day-in-the.mp4,PT00H00M10S,135701_135750,Slowmo of little girl and three boys chasing and bursting large soap bubbles at sunny day in the park
