videoid,contentUrl,duration,page_dir,name
511849,https://ak.picdn.net/shutterstock/videos/511849/preview/stock-footage-animated-phone.mp4,PT00H00M08S,056201_056250,Animated phone
34336021,https://ak.picdn.net/shutterstock/videos/34336021/preview/stock-footage-unique-design-abstract-digital-animation-pixel-noise-glitch-error-video-damage.mp4,PT00H00M15S,126651_126700,Unique design. abstract digital animation. pixel noise glitch error video damage
9949448,https://ak.picdn.net/shutterstock/videos/9949448/preview/stock-footage-mechanical-visual-wheel-backdrop.mp4,PT00H00M10S,098901_098950,Mechanical visual wheel backdrop
1019895589,https://ak.picdn.net/shutterstock/videos/1019895589/preview/stock-footage-a-colony-of-king-penguins-on-salisbury-plain-on-south-georgia-in-antarctica.mp4,PT00H00M18S,061101_061150,A colony of king penguins on salisbury plain on south georgia in antarctica
1024269782,https://ak.picdn.net/shutterstock/videos/1024269782/preview/stock-footage-airplane-take-off-imphal-during-a-wonderful-sunrise.mp4,PT00H00M08S,012301_012350,Airplane take off imphal during a wonderful sunrise
12953414,https://ak.picdn.net/shutterstock/videos/12953414/preview/stock-footage--k-blood-burst-slow-motion-with-alpha.mp4,PT00H00M10S,068751_068800,4k blood burst slow motion (with alpha) 31
1053106913,https://ak.picdn.net/shutterstock/videos/1053106913/preview/stock-footage-zoom-in-view-of-two-people-bathing-at-dusk-silhouette-of-a-couple-standing-knee-deep-on-the-waters.mp4,PT00H00M11S,018251_018300,"Zoom-in view of two people bathing at dusk. silhouette of a couple standing knee-deep on the waters, enjoying a romantic sunset view."
1048307107,https://ak.picdn.net/shutterstock/videos/1048307107/preview/stock-footage-rome-italy-march-th-trevi-fountain-is-a-fountain-in-the-trevi-district-in-rome-italy.mp4,PT00H00M14S,189201_189250,"Rome / italy - march 9th 2020: trevi fountain is a fountain in the trevi district in rome, italy,"
9580067,https://ak.picdn.net/shutterstock/videos/9580067/preview/stock-footage-the-metamorphic-stage-of-the-butterflies-which-is-the-pupa-stage-the-pupal-stage-is-found-only-in.mp4,PT00H00M09S,013701_013750,The metamorphic stage of the butterflies which is the pupa stage. the pupal stage is found only in holometabolous insects those that undergo a complete metamorphosis going through four life stages
1024950755,https://ak.picdn.net/shutterstock/videos/1024950755/preview/stock-footage-risk-management-with-digital-technology-concept.mp4,PT00H00M17S,142101_142150,Risk management with digital technology concept
1017185389,https://ak.picdn.net/shutterstock/videos/1017185389/preview/stock-footage-a-funny-chilean-flamingo-neck.mp4,PT00H00M08S,146551_146600,A funny chilean flamingo neck. 
1034396786,https://ak.picdn.net/shutterstock/videos/1034396786/preview/stock-footage-new-york-city-manhattan-midtown-buildings-skyline-at-night.mp4,PT00H00M16S,180051_180100,New york city manhattan midtown buildings skyline at night
5886071,https://ak.picdn.net/shutterstock/videos/5886071/preview/stock-footage-colombo-sri-lanka-mar-pedestrians-crossing-railway-tracks-and-commuter-train-arriving-at.mp4,PT00H00M57S,105351_105400,"Colombo, sri lanka - mar 17: pedestrians crossing railway tracks and commuter train arriving at fort railway station on march 17, 2014 in colombo, sri lanka"
1063253347,https://ak.picdn.net/shutterstock/videos/1063253347/preview/stock-footage-a-woman-sitting-by-the-yable-with-a-planner-and-a-red-pencil-and-tapping-fingers-while-thinking.mp4,PT00H00M11S,042251_042300,A woman sitting by the yable with a planner and a red pencil and tapping fingers while thinking.
1052200207,https://ak.picdn.net/shutterstock/videos/1052200207/preview/stock-footage-vezio-medieval-castle-with-view-of-lake-como-in-italy-from-a-drone.mp4,PT00H00M17S,080701_080750,"Vezio medieval castle, with view of lake como in italy, from a drone"
1007810233,https://ak.picdn.net/shutterstock/videos/1007810233/preview/stock-footage-romantic-couples-in-love-enjoying-countryside-trip-taking-selfies-with-smartphone-hugging-and.mp4,PT00H00M18S,024351_024400,Romantic couples in love enjoying countryside trip taking selfies with smartphone hugging and kissing with idyllic hillside and amazing rainbow in background
1008371761,https://ak.picdn.net/shutterstock/videos/1008371761/preview/stock-footage-young-girl-and-skiers-in-nature.mp4,PT00H00M17S,107501_107550,Young girl and skiers in nature
1033221800,https://ak.picdn.net/shutterstock/videos/1033221800/preview/stock-footage-flight-over-fields-with-ripe-rape-and-wheat.mp4,PT00H00M34S,078951_079000,Flight over fields with ripe rape and wheat.
26636530,https://ak.picdn.net/shutterstock/videos/26636530/preview/stock-footage--k-aerial-calm-sea-surface-in-the-setting-sun.mp4,PT00H00M30S,080701_080750,4k: aerial calm sea surface in the setting sun
1010819474,https://ak.picdn.net/shutterstock/videos/1010819474/preview/stock-footage-very-nice-footage-of-aerial-football.mp4,PT00H00M11S,075401_075450,Very nice footage of aerial football
15864691,https://ak.picdn.net/shutterstock/videos/15864691/preview/stock-footage-hairdresser-cuts-female-hair-by-means-of-scissors-video-full-hd.mp4,PT00H00M14S,172601_172650,Hairdresser cuts female hair by means of scissors. video full hd.
7670611,https://ak.picdn.net/shutterstock/videos/7670611/preview/stock-footage--happy-new-year.mp4,PT00H00M30S,067251_067300,(2015) happy new year
1051328818,https://ak.picdn.net/shutterstock/videos/1051328818/preview/stock-footage-moving-kaleidoscope-k-motion-graphics.mp4,PT00H00M10S,122851_122900,Moving kaleidoscope. 4k motion graphics.
1035862523,https://ak.picdn.net/shutterstock/videos/1035862523/preview/stock-footage-two-snacks-on-the-cooking-board-cook-adds-greens.mp4,PT00H00M13S,145651_145700,Two snacks on the cooking board. cook adds greens.
1364656,https://ak.picdn.net/shutterstock/videos/1364656/preview/stock-footage-frankfurt-sep-ford-evos-concept-car-shown-at-the-th-iaa-internationale-automobil.mp4,PT00H01M00S,024801_024850,"Frankfurt - sep 14: ford evos concept car shown at the 64th iaa (internationale automobil ausstellung) on september 14, 2011 in frankfurt, germany."
32404798,https://ak.picdn.net/shutterstock/videos/32404798/preview/stock-footage-beautiful-woman-in-a-beach-lounger-using-a-tablet.mp4,PT00H00M11S,062751_062800,Beautiful woman in a beach lounger using a tablet	
1026052199,https://ak.picdn.net/shutterstock/videos/1026052199/preview/stock-footage-lights-green-bokeh-background-elegant-gold-abstract-disco-background-with-circles-and-stars.mp4,PT00H00M12S,053701_053750,Lights green bokeh background. elegant gold abstract. disco background with circles and stars. christmas animated background. space background. seamless loop. green screen.
1022240935,https://ak.picdn.net/shutterstock/videos/1022240935/preview/stock-footage-red-small-tomatoes-or-cherry-tomato-roll-across-the-table-in-the-smoke-in-slowmo.mp4,PT00H00M15S,023951_024000,Red small tomatoes or cherry tomato roll across the table in the smoke in slowmo
1061443117,https://ak.picdn.net/shutterstock/videos/1061443117/preview/stock-footage-overhead-view-of-woman-with-mask-in-coffee-shop-fill-in-test-and-trace-contact-form-during-pandemic.mp4,PT00H00M11S,057551_057600,Overhead view of woman with mask in coffee shop fill in test and trace contact form during pandemic
1027730969,https://ak.picdn.net/shutterstock/videos/1027730969/preview/stock-footage-mans-hand-using-computer-mouse-extreme-closeup.mp4,PT00H00M06S,190151_190200,Mans hand using computer mouse - extreme closeup
1046540200,https://ak.picdn.net/shutterstock/videos/1046540200/preview/stock-footage-woman-hand-using-manicure-nippers-pink-background.mp4,PT00H00M07S,125301_125350,Woman hand using manicure nippers pink background
5057915,https://ak.picdn.net/shutterstock/videos/5057915/preview/stock-footage-streets-of-the-resort-town-in-italy.mp4,PT00H00M16S,171251_171300,Streets of the resort town in italy
7503028,https://ak.picdn.net/shutterstock/videos/7503028/preview/stock-footage-mostar-bridge.mp4,PT00H00M28S,107351_107400,Mostar bridge
1011153605,https://ak.picdn.net/shutterstock/videos/1011153605/preview/stock-footage-woman-hands-peeling-champignons-with-a-kitchen-knife-hands-peeling-champignons.mp4,PT00H00M16S,065201_065250,Woman hands peeling champignons with a kitchen knife. hands peeling champignons
28470094,https://ak.picdn.net/shutterstock/videos/28470094/preview/stock-footage-frankfurt-germany-june-coffee-fellows-cafe-cafeteria.mp4,PT00H00M20S,197001_197050,"Frankfurt, germany, june 2017 coffee fellows cafe cafeteria "
29350957,https://ak.picdn.net/shutterstock/videos/29350957/preview/stock-footage-hohenzollern-castle-germany-on-a-cloudy-day-aerial.mp4,PT00H00M10S,068851_068900,"Hohenzollern castle, germany on a cloudy day, aerial 43"
1015073725,https://ak.picdn.net/shutterstock/videos/1015073725/preview/stock-footage-beekeepers-inspect-a-beehive-slow-motion.mp4,PT00H00M19S,143501_143550,"Beekeepers inspect a beehive, slow motion"
1014683489,https://ak.picdn.net/shutterstock/videos/1014683489/preview/stock-footage-handsome-man-smiling-and-giving-handshake.mp4,PT00H00M07S,186401_186450,Handsome man smiling and giving handshake
1014646586,https://ak.picdn.net/shutterstock/videos/1014646586/preview/stock-footage-harbour-boat-in-lumbarda-korcula-island-dalmatia-croatia-europe.mp4,PT00H00M20S,194701_194750,"Harbour boat in lumbarda, korcula island, dalmatia, croatia, europe"
1029487133,https://ak.picdn.net/shutterstock/videos/1029487133/preview/stock-footage-puntarenas-costa-rica-crush-fresh-sugar-cane-in-machine-fresh-vegetables-and-produce-in-stalls.mp4,PT00H00M12S,107201_107250,"Puntarenas costa rica crush fresh sugar cane in machine. fresh vegetables and produce in stalls along streets, road and highway. mechanical drink maker."
13716329,https://ak.picdn.net/shutterstock/videos/13716329/preview/stock-footage--k-black-and-hispanic-couple-in-kitchen-sharing-breakfast-and-coffee.mp4,PT00H00M20S,137851_137900,4k black and hispanic couple in kitchen sharing breakfast and coffee
25764614,https://ak.picdn.net/shutterstock/videos/25764614/preview/stock-footage-female-hand-cut-a-piece-of-chicken-fillet-for-cooking-nuggets-close-to-a-brown-raw-egg-bay-leaves.mp4,PT00H00M11S,176101_176150,Female hand cut a piece of chicken fillet for cooking nuggets close to a brown raw egg bay leaves and black pepper
1015846102,https://ak.picdn.net/shutterstock/videos/1015846102/preview/stock-footage-economic-settlement-business-concept-men-s-hands-calculator-notebook-and-marker-on-a-wooden-table.mp4,PT00H00M48S,030051_030100,"Economic settlement-business concept.
men's hands,calculator,notebook and  marker on a wooden table.close-up.top view"
3658013,https://ak.picdn.net/shutterstock/videos/3658013/preview/stock-footage-hd-young-sexy-blond-woman-making-a-face-crazy-fun-portrait-part.mp4,PT00H02M03S,076101_076150,Hd1080 young sexy blond woman making a face. crazy&fun. portrait. part2
1015276195,https://ak.picdn.net/shutterstock/videos/1015276195/preview/stock-footage-loving-father-holds-his-little-daughter-in-arms-in-the-hospital.mp4,PT00H00M13S,182901_182950,Loving father holds his little daughter in arms in the hospital
15103921,https://ak.picdn.net/shutterstock/videos/15103921/preview/stock-footage-the-refugees-in-the-athenian-port-who-have-arrived-on-ferries-from-the-greek-islands-of-lesvos-and.mp4,PT00H00M17S,049801_049850,"The refugees in the athenian port who have arrived on ferries from the greek islands of lesvos and koss. greece. november, 2015"
11198216,https://ak.picdn.net/shutterstock/videos/11198216/preview/stock-footage-ouro-preto-minas-gerais-brazil-historic-city-world-heritage-unesco.mp4,PT00H00M40S,017551_017600,"Ouro preto, minas gerais / brazil - 2015: historic city world heritage unesco"
1022775604,https://ak.picdn.net/shutterstock/videos/1022775604/preview/stock-footage-a-night-view-of-songdo-city.mp4,PT00H00M42S,108201_108250,A night view of songdo city
1064632948,https://ak.picdn.net/shutterstock/videos/1064632948/preview/stock-footage-young-woman-portrait-shot-put-on-protective-mask-indoors-on-background-of-blurred-glass-windows.mp4,PT00H00M12S,101801_101850,"Young woman, portrait shot, put on protective mask, indoors on background of blurred glass windows. girl in brown shirt in medical protective mask portrait, in the business city mall"
22721077,https://ak.picdn.net/shutterstock/videos/22721077/preview/stock-footage-sparkling-wine-is-poured-into-glasses-in-the-background-bokeh-lights-and-garlands-of-christmas-fir.mp4,PT00H00M29S,189201_189250,"Sparkling wine is poured into glasses. in the background, bokeh lights and garlands of christmas fir"
1014447299,https://ak.picdn.net/shutterstock/videos/1014447299/preview/stock-footage-organic-arrange-of-multiples-geometric-shapes-moving-at-different-paces-and-distance-all-of-them.mp4,PT00H00M20S,044451_044500,"Organic arrange of multiples geometric shapes moving at different paces and distance. all of them create a choreography that moves endlessly and seamless. ideal for video projections, vj´s & mograph"
33734704,https://ak.picdn.net/shutterstock/videos/33734704/preview/stock-footage-stomach-with-small-intestine-zoom.mp4,PT00H00M12S,134751_134800,Stomach with small intestine zoom
1024917080,https://ak.picdn.net/shutterstock/videos/1024917080/preview/stock-footage-three-vintage-audio-cassettes-rotate-on-white-background-retro-tape-cassettes-with-a-blank-label.mp4,PT00H00M26S,146401_146450,Three vintage audio cassettes rotate on white background. retro tape cassettes with a blank label. close-up.
17517535,https://ak.picdn.net/shutterstock/videos/17517535/preview/stock-footage-man-playing-on-two-drums-with-thud-sound-near-brick-wall.mp4,PT00H00M08S,003501_003550,Man playing on two drums with thud sound near brick wall.
1021666261,https://ak.picdn.net/shutterstock/videos/1021666261/preview/stock-footage-circa-s-dutch-construction-workers-attend-to-formworks-and-concrete-rollers.mp4,PT00H00M42S,181551_181600,Circa 1920s - dutch construction workers attend to formworks and concrete rollers.
1008080008,https://ak.picdn.net/shutterstock/videos/1008080008/preview/stock-footage-team-of-security-personnel-man-the-stations-within-a-busy-system-control-room-weather-or-power.mp4,PT00H00M22S,002051_002100,Team of security personnel man the stations within a busy system control room. weather or power station or air traffic control.
26578073,https://ak.picdn.net/shutterstock/videos/26578073/preview/stock-footage-aloe-leaf-with-dripping-clear-juice-isolated.mp4,PT00H00M27S,020451_020500,Aloe leaf with dripping clear juice isolated
1025168021,https://ak.picdn.net/shutterstock/videos/1025168021/preview/stock-footage-aerial-view-on-ocean-waves-and-rocks-on-the-atlantic-coast-in-morocco-k.mp4,PT00H00M24S,123051_123100,"Aerial view on ocean waves and rocks on the atlantic coast in morocco, 4k"
8680528,https://ak.picdn.net/shutterstock/videos/8680528/preview/stock-footage-apartment-building-with-a-smoking-chimney-on-a-cold-winter-day.mp4,PT00H00M16S,006951_007000,Apartment building with a smoking chimney on a cold winter day
16056481,https://ak.picdn.net/shutterstock/videos/16056481/preview/stock-footage-flyby-grass-on-a-sunny-day.mp4,PT00H00M21S,136301_136350,Flyby grass on a sunny day.
32973205,https://ak.picdn.net/shutterstock/videos/32973205/preview/stock-footage-munich-germany-september-drunken-people-at-the-table-celebrate-oktoberfest-inside-a.mp4,PT00H00M16S,023301_023350,"Munich, germany, september 16, 2017: drunken people at the table celebrate oktoberfest inside a large beer tent. bavaria, germany. a crowd of drunken people in national costumes drink beer and have"
10361765,https://ak.picdn.net/shutterstock/videos/10361765/preview/stock-footage-wild-desert-landscape-of-makhtesh-ramon-ramon-crater-in-the-negev-desert-israel.mp4,PT00H00M11S,125101_125150,"Wild desert landscape of makhtesh ramon, ramon crater, in the negev desert , israel"
1053178754,https://ak.picdn.net/shutterstock/videos/1053178754/preview/stock-footage-beautiful-sea-panorama-with-crystal-clear-water-and-white-sand-on-the-coast-of-taranto-puglia.mp4,PT00H00M15S,081751_081800,"Beautiful sea panorama with crystal clear water and white sand on the coast of taranto, puglia, italy"
1054352624,https://ak.picdn.net/shutterstock/videos/1054352624/preview/stock-footage-beautiful-sunset-time-lapse-view-of-motion-blur-busy-public-entrance-of-masjid-sri-sendayan-in.mp4,PT00H00M16S,117251_117300,"Beautiful sunset time lapse view of motion blur busy public entrance of masjid sri sendayan in negeri sembilan, malaysia. pan up motion timelapse. prores uhd"
4906265,https://ak.picdn.net/shutterstock/videos/4906265/preview/stock-footage-yellow-maple-leaves-fall-from-the-trees-autumn-in-the-city.mp4,PT00H00M05S,038701_038750,Yellow maple leaves fall from the trees. autumn in the city
1033732247,https://ak.picdn.net/shutterstock/videos/1033732247/preview/stock-footage-sanya-china-october-city-famous-island-resort-night-time-car-side-window-road-trip-pov.mp4,PT00H00M19S,141301_141350,"Sanya, china - october 7 2018: city famous island resort night time car side window road trip pov panorama 4k circa october 7 2018 sanya, hainan, china."
1020732757,https://ak.picdn.net/shutterstock/videos/1020732757/preview/stock-footage-rain-falling-on-parked-bicycles-and-pavement.mp4,PT00H00M09S,133601_133650,Rain falling on parked bicycles and pavement
29609608,https://ak.picdn.net/shutterstock/videos/29609608/preview/stock-footage-cancer-hermit-crab-underwater-in-search-of-food-on-seabed-of-white-sea-unique-dramaturgy-pic-macro.mp4,PT00H00M25S,130001_130050,Cancer hermit crab underwater in search of food on seabed of white sea. unique dramaturgy pic macro video close up. predators of marine life on background of pure clear clean water stones.
31162606,https://ak.picdn.net/shutterstock/videos/31162606/preview/stock-footage-aerial-of-group-of-brown-horses-during-sundown-curious-animals-checking-out-the-drone-camera-drone.mp4,PT00H00M10S,050651_050700,Aerial of group of brown horses during sundown curious animals checking out the drone camera drone slowly moving towards the domesticated animals located at meadow pasture early evening sundown 4k
1011975740,https://ak.picdn.net/shutterstock/videos/1011975740/preview/stock-footage-many-blue-glittering-particles-in-space-slow-motion-computer-generated-abstract-background-d.mp4,PT00H00M18S,050101_050150,"Many blue glittering particles in space, slow motion, computer generated abstract background, 3d render"
13822925,https://ak.picdn.net/shutterstock/videos/13822925/preview/stock-footage-waves-crashing-on-the-shore-chiba-prefecture-japan.mp4,PT00H00M24S,009051_009100,"Waves crashing on the shore, chiba prefecture, japan"
1044254572,https://ak.picdn.net/shutterstock/videos/1044254572/preview/stock-footage-aerial-view-combine-harvester-gathers-the-wheat-crop-wheat-harvesting-shears-combines-in-the-field.mp4,PT00H00M16S,115601_115650,Aerial view combine harvester gathers the wheat crop wheat harvesting shears combines in the field food industry concept 4k
12321851,https://ak.picdn.net/shutterstock/videos/12321851/preview/stock-footage--k-clouds-moving-in-the-sky-time-lapse.mp4,PT00H00M14S,053001_053050,4k. clouds moving in the sky. time-lapse.
1032056021,https://ak.picdn.net/shutterstock/videos/1032056021/preview/stock-footage-man-was-toss-green-leaves-in-an-iron-skillet.mp4,PT00H00M06S,036951_037000,Man was toss green leaves in an iron skillet
1021912330,https://ak.picdn.net/shutterstock/videos/1021912330/preview/stock-footage-exotic-tropical-underwater-animal-world-dangerous-sea-urchins-in-corals-flora-and-fauna-of-the.mp4,PT00H00M25S,194251_194300,"Exotic tropical underwater animal world. dangerous sea urchins in corals. flora and fauna of the red sea. protection of ecology and environment, purity of the seas and oceans"
1055757314,https://ak.picdn.net/shutterstock/videos/1055757314/preview/stock-footage-girl-in-a-white-dress-runs-to-the-water.mp4,PT00H00M05S,057001_057050,Girl in a white dress runs to the water
1034165048,https://ak.picdn.net/shutterstock/videos/1034165048/preview/stock-footage-backlit-dust-particles-floating-around-k-prores-footage-more-elements-in-our-portfolio.mp4,PT00H00M15S,035151_035200,"Backlit dust particles floating around, 4k prores footage.more elements in our portfolio"
17421433,https://ak.picdn.net/shutterstock/videos/17421433/preview/stock-footage-world-in-analysis.mp4,PT00H00M10S,004051_004100,World in analysis
1047507076,https://ak.picdn.net/shutterstock/videos/1047507076/preview/stock-footage-closeup-blue-snowdrop-scilla-flower-in-a-forest-spring-outdoor-scene.mp4,PT00H00M23S,075301_075350,"Closeup blue snowdrop scilla flower in a forest, spring outdoor scene"
7391059,https://ak.picdn.net/shutterstock/videos/7391059/preview/stock-footage-hikkaduwa-sri-lanka-february-view-of-a-fishermen-working-on-hikkaduwa-beach-hikkaduwa-is.mp4,PT00H00M10S,121551_121600,"Hikkaduwa, sri lanka - february 2014: view of a fishermen working on hikkaduwa beach. hikkaduwa is famous for its beautiful beaches."
1021201306,https://ak.picdn.net/shutterstock/videos/1021201306/preview/stock-footage--dutch-flag-waving-in-the-wind.mp4,PT00H00M35S,030001_030050, dutch flag waving in the wind
30529660,https://ak.picdn.net/shutterstock/videos/30529660/preview/stock-footage-addis-ababa-ethiopia-two-men-push-and-pull-a-produce-cart-on-a-city-street-in-the-ethiopia.mp4,PT00H00M14S,056251_056300,"Addis ababa, ethiopia - two men push and pull a produce cart on a city street in the ethiopia capital, from the passenger seat of a taxi. june 24, 2017"
33980116,https://ak.picdn.net/shutterstock/videos/33980116/preview/stock-footage-man-is-cutting-a-tomato-in-the-kitchen.mp4,PT00H00M30S,138351_138400,Man is cutting a tomato in the kitchen
26964583,https://ak.picdn.net/shutterstock/videos/26964583/preview/stock-footage--x-fps-very-nice-landscape-blue-sea-video.mp4,PT00H00M20S,108851_108900,1920x1080 25 fps. very nice landscape blue sea video.
1026219230,https://ak.picdn.net/shutterstock/videos/1026219230/preview/stock-footage-aerial-view-of-chemical-factories-in-sunset-energy-power-stations-chemical-factories-and-wind.mp4,PT00H00M20S,121151_121200,"Aerial view of chemical factories in sunset. energy power stations, chemical factories and wind power stations. global pollution concept, energy consumption."
15360511,https://ak.picdn.net/shutterstock/videos/15360511/preview/stock-footage-monitor-analyzing-the-world.mp4,PT00H00M10S,109601_109650,Monitor analyzing the world  
15991414,https://ak.picdn.net/shutterstock/videos/15991414/preview/stock-footage-lagoa-caves-and-coast-and-beaches-views-algarve-portugal-k.mp4,PT00H00M22S,173851_173900,"Lagoa caves, and coast and beaches views, algarve, portugal (4k)"
31389796,https://ak.picdn.net/shutterstock/videos/31389796/preview/stock-footage--k-timelapse-stormy-clouds-in-mountains-alpine-view-on-cloudy-day-time-lapse.mp4,PT00H00M08S,065851_065900,"4k timelapse stormy clouds in mountains, alpine view on cloudy day time lapse"
1034278829,https://ak.picdn.net/shutterstock/videos/1034278829/preview/stock-footage-warsaw-poland-july-urban-street-at-night.mp4,PT00H00M17S,108551_108600,"Warsaw, poland. 30 july 2019. urban street at night."
1018716301,https://ak.picdn.net/shutterstock/videos/1018716301/preview/stock-footage-slow-motion-approach-around-tower-in-toulouse-with-foilage-in-the-foreground-on-a-cloudy-day.mp4,PT00H00M09S,134851_134900,Slow motion approach around tower in toulouse with foilage in the foreground on a cloudy day
1245148,https://ak.picdn.net/shutterstock/videos/1245148/preview/stock-footage-close-up-of-a-wind-turbine.mp4,PT00H00M14S,177201_177250,Close up of a wind turbine
15844828,https://ak.picdn.net/shutterstock/videos/15844828/preview/stock-footage-woman-in-her-late-s-working-in-an-office-santa-fe-nm-february.mp4,PT00H00M10S,173801_173850,"Woman in her late 20's working in an office. santa fe, nm : february, 2016"
1032361679,https://ak.picdn.net/shutterstock/videos/1032361679/preview/stock-footage-slow-motion-portrait-of-female-student-looking-at-camera-with-serious-face-then-smiling-standing.mp4,PT00H00M09S,107301_107350,Slow motion portrait of female student looking at camera with serious face then smiling standing outdoors in the street with brick wall in background.
17157799,https://ak.picdn.net/shutterstock/videos/17157799/preview/stock-footage-berdyansk-ukraine-june-family-holiday-day-of-a-family-day-on-june-in-berdyansk.mp4,PT00H00M28S,060201_060250,"Berdyansk, ukraine - june 5: family holiday day of a family day on june 5, 2016 in berdyansk."
3779927,https://ak.picdn.net/shutterstock/videos/3779927/preview/stock-footage-pouring-champagne-on-black-with-copy-space.mp4,PT00H00M29S,109601_109650,Pouring champagne - on black with copy space
1063547251,https://ak.picdn.net/shutterstock/videos/1063547251/preview/stock-footage-animation-fly-abstract-purple-and-blue-bokeh-and-particles-on-shiny-background-luxury-and-elegant.mp4,PT00H00M20S,088751_088800,Animation fly abstract purple and blue bokeh and particles on shiny background. luxury and elegant dynamic style template for winter holiday happy new year and merry christmas theme
30566965,https://ak.picdn.net/shutterstock/videos/30566965/preview/stock-footage-spoon-with-honey-in-backlighting.mp4,PT00H00M22S,084551_084600,Spoon with honey. in backlighting
1057411216,https://ak.picdn.net/shutterstock/videos/1057411216/preview/stock-footage-a-golden-orb-weaver-silk-spider-is-holding-a-dead-grasshopper.mp4,PT00H00M34S,173951_174000,A golden orb weaver silk spider is  holding a dead grasshopper
9857594,https://ak.picdn.net/shutterstock/videos/9857594/preview/stock-footage-sea-waves-breaking.mp4,PT00H00M32S,141701_141750,Sea waves breaking
