videoid,contentUrl,duration,page_dir,name
16763326,https://ak.picdn.net/shutterstock/videos/16763326/preview/stock-footage-a-strong-wind-shakes-the-trees-in-the-forest.mp4,PT00H00M16S,058301_058350,A strong wind shakes the trees in the forest
1012447166,https://ak.picdn.net/shutterstock/videos/1012447166/preview/stock-footage-slim-young-woman-and-long-hair.mp4,PT00H00M11S,014901_014950,Slim young woman and long hair 
1013036270,https://ak.picdn.net/shutterstock/videos/1013036270/preview/stock-footage--a-crowd-of-people-walk-the-stairs-warsaw-june-people-walk-up-the-steps-up-the-street.mp4,PT00H00M08S,192401_192450, a crowd of people walk the stairs warsaw - 25. june. 2018. people walk up the steps up the street. people go out and go into the metro station.
29206285,https://ak.picdn.net/shutterstock/videos/29206285/preview/stock-footage-sleepy-man-in-the-morning-in-kitchen-funny.mp4,PT00H00M26S,179201_179250,Sleepy man in the morning in kitchen funny
1291984,https://ak.picdn.net/shutterstock/videos/1291984/preview/stock-footage-a-tropical-fern-close-up-with-shallow-depth-of-field-shot-in-the-rain-forest-of-the-kilauea-volcano.mp4,PT00H00M20S,199001_199050,A tropical fern close-up with shallow depth of field shot in the rain forest of the kilauea volcano on the big island of hawaii.
1039216352,https://ak.picdn.net/shutterstock/videos/1039216352/preview/stock-footage-aerial-view-on-church-domes-in-kremlin-in-the-ancient-town-suzdal-at-sunset-golden-ring-russia-k.mp4,PT00H00M18S,119051_119100,"Aerial view on church domes in kremlin in the ancient town suzdal at sunset, golden ring, russia, 4k"
4860113,https://ak.picdn.net/shutterstock/videos/4860113/preview/stock-footage-video-p-woman-walks-down-at-the-forest-path-in-the-jungle.mp4,PT00H00M09S,175651_175700,Video 1080p - woman walks down at the forest path in the jungle
1019973079,https://ak.picdn.net/shutterstock/videos/1019973079/preview/stock-footage-coals-smolder-and-glow-residual-flame-from-smoldering-coals-in-cinder-closeup-view-flicker-of.mp4,PT00H00M27S,131401_131450,"Coals smolder and glow. residual flame from smoldering coals in cinder, closeup view. flicker of burning coals at night."
13976,https://ak.picdn.net/shutterstock/videos/13976/preview/stock-footage-motorboat-fixed-in-wharf.mp4,PT00H00M18S,171801_171850,Motorboat fixed in wharf
32387950,https://ak.picdn.net/shutterstock/videos/32387950/preview/stock-footage-clinician-doctor-man-looking-from-abdominal-ultrasound-results-in-cabinet-room.mp4,PT00H00M22S,094701_094750,Clinician doctor man looking from abdominal ultrasound results in cabinet room
1025675024,https://ak.picdn.net/shutterstock/videos/1025675024/preview/stock-footage-technologies-business-people-beauty-and-lifestyle-concept-stylish-female-in-cloak-walking-on.mp4,PT00H00M18S,011751_011800,"Technologies, business, people beauty and lifestyle concept - stylish female in cloak walking on the city street."
1009209395,https://ak.picdn.net/shutterstock/videos/1009209395/preview/stock-footage-enduro-professional-racer-in-motorcycle-protective-gear-riding-dirt-bike-racers-on-motorcycles.mp4,PT00H00M06S,009851_009900,"Enduro professional racer in motorcycle protective gear riding dirt bike. racers on motorcycles during competition, extreme sports off road."
1024940948,https://ak.picdn.net/shutterstock/videos/1024940948/preview/stock-footage-dna-the-genetic-material-frames-turntable-loop.mp4,PT00H00M14S,024401_024450,Dna the genetic material 360(frames) turntable loop
1028307083,https://ak.picdn.net/shutterstock/videos/1028307083/preview/stock-footage-bearded-sports-fan-waving-brazil-flag-in-bar-extremely-happy-about-team-victory.mp4,PT00H00M17S,142701_142750,"Bearded sports fan waving brazil flag in bar, extremely happy about team victory"
21695581,https://ak.picdn.net/shutterstock/videos/21695581/preview/stock-footage-butterfly-in-the-garden-are-the-flowers.mp4,PT00H00M30S,096101_096150,Butterfly in the garden are the flowers.
1034076074,https://ak.picdn.net/shutterstock/videos/1034076074/preview/stock-footage-focus-shift-mountain-section-of-a-wall-in-the-forest.mp4,PT00H00M05S,145051_145100,"Focus shift mountain section of a wall in the forest, "
1011970595,https://ak.picdn.net/shutterstock/videos/1011970595/preview/stock-footage-high-angle-view-tilt-down-to-reveal-the-ancient-arch-of-constantine-triumphal-arch-in-the-roman.mp4,PT00H00M21S,179301_179350,"High angle view tilt down to reveal the ancient arch of constantine triumphal arch in the roman forum in rome, italy. 4k uhd at 29.97fps"
19062805,https://ak.picdn.net/shutterstock/videos/19062805/preview/stock-footage-aerial-camera-tracks-the-east-tower-of-the-charles-bridge-in-prague-shot-on-a-beautiful-summer.mp4,PT00H00M20S,051101_051150,Aerial camera tracks the east tower of the charles bridge in prague. shot on a beautiful summer morning
5435630,https://ak.picdn.net/shutterstock/videos/5435630/preview/stock-footage-liquid-dripping-from-test-tube-into-flask.mp4,PT00H00M09S,007251_007300,Liquid dripping from test-tube into flask
1053252506,https://ak.picdn.net/shutterstock/videos/1053252506/preview/stock-footage-nurse-wearing-a-face-mask-to-protect-against-coronavirus-during-covid-pandemic-adjust-mask-on.mp4,PT00H00M18S,069551_069600,Nurse wearing a face mask to protect against coronavirus during covid-19 pandemic. adjust mask on the face. footage in 4k and hd.
1010873192,https://ak.picdn.net/shutterstock/videos/1010873192/preview/stock-footage-laughing-young-man-in-black-profile.mp4,PT00H00M16S,044651_044700,"Laughing young man in black, profile"
2154005,https://ak.picdn.net/shutterstock/videos/2154005/preview/stock-footage-meat-processing-plant-animation.mp4,PT00H00M13S,091851_091900,Meat processing plant animation
16893868,https://ak.picdn.net/shutterstock/videos/16893868/preview/stock-footage-athens-greece-th-october-greek-presidential-guard-on-ceremonial-duty-outside-the-tomb-to.mp4,PT00H00M17S,134651_134700,"Athens/greece - 10th october 2010: greek presidential guard on ceremonial duty outside the tomb to the unknown soldier in athens, greece."
1048053997,https://ak.picdn.net/shutterstock/videos/1048053997/preview/stock-footage-baby-infant-opening-cabinet-furniture-at-home.mp4,PT00H00M57S,056601_056650,Baby infant opening cabinet furniture at home
1020159685,https://ak.picdn.net/shutterstock/videos/1020159685/preview/stock-footage-girl-decorates-the-christmas-tree-toys.mp4,PT00H00M11S,052651_052700,Girl decorates the christmas tree toys
33421087,https://ak.picdn.net/shutterstock/videos/33421087/preview/stock-footage-a-group-of-manta-rays-being-cleaned-manta-alley-komodo-national-park-indonesia.mp4,PT00H00M21S,141651_141700,"A group of manta rays being cleaned, manta alley, komodo national park, indonesia"
1015000327,https://ak.picdn.net/shutterstock/videos/1015000327/preview/stock-footage-abstract-architectural-blueprint-professional-tools-and-equipment-for-architecture-design.mp4,PT00H00M10S,139051_139100,"Abstract architectural blueprint, professional tools and equipment for architecture & design"
31013686,https://ak.picdn.net/shutterstock/videos/31013686/preview/stock-footage-ice-cream-factory.mp4,PT00H00M06S,058601_058650,Ice cream factory
15606157,https://ak.picdn.net/shutterstock/videos/15606157/preview/stock-footage-montreal-canada-march-airport-pierre-elliott-trudeau-hallways-k-uhd.mp4,PT00H00M34S,138701_138750,"Montreal, canada - march 2016: airport pierre-elliott trudeau hallways (4k uhd)"
1015317160,https://ak.picdn.net/shutterstock/videos/1015317160/preview/stock-footage-preschool-education-children-are-learn-letters-and-numbers.mp4,PT00H00M16S,048101_048150,Preschool education. children are learn letters and numbers. 
19202620,https://ak.picdn.net/shutterstock/videos/19202620/preview/stock-footage-as-nazi-soldiers-are-rounded-up-in-belgium-outraged-belgians-threaten-and-shout-at-them-in.mp4,PT00H00M40S,149901_149950,"As nazi soldiers are rounded up in belgium, outraged belgians threaten and shout at them in 1944. (1940s)"
1056519095,https://ak.picdn.net/shutterstock/videos/1056519095/preview/stock-footage-night-view-of-kremlin-and-the-assumption-church-in-tula-russia.mp4,PT00H00M06S,127201_127250,"Night view of kremlin and the assumption church in tula, russia"
1014538868,https://ak.picdn.net/shutterstock/videos/1014538868/preview/stock-footage-for-the-romantic-campfire-the-man-sorts-the-wood-in-the-fire-basket-the-flames-and-sparks.mp4,PT00H00M23S,068401_068450,"For the romantic campfire, the man sorts the wood in the fire basket, the flames and sparks illuminate the scene"
5294303,https://ak.picdn.net/shutterstock/videos/5294303/preview/stock-footage-close-up-wheat-in-breeze-on-a-windy-day-agriculture-field-harvesting-farming.mp4,PT00H00M24S,047951_048000,"Close up wheat in breeze on a windy day, agriculture field, harvesting, farming"
30469186,https://ak.picdn.net/shutterstock/videos/30469186/preview/stock-footage-close-up-of-chef-hands-cooking-and-preparing-asian-thai-food-in-restaurant-kitchen-stir-the-meat-in.mp4,PT00H00M23S,033601_033650,Close-up of chef hands cooking and preparing asian thai food in restaurant kitchen stir the meat in a pan to taste the food.
13590122,https://ak.picdn.net/shutterstock/videos/13590122/preview/stock-footage-cctv-camera-monitoring-spliscreen-operating-on-construction-site-in-hong-kong.mp4,PT00H00M24S,171551_171600,Cctv camera monitoring spliscreen operating on construction site in hong kong.
15600544,https://ak.picdn.net/shutterstock/videos/15600544/preview/stock-footage-enamored-couple-sitting-on-a-yacht.mp4,PT00H00M28S,012601_012650,Enamored couple sitting on a yacht
1014242534,https://ak.picdn.net/shutterstock/videos/1014242534/preview/stock-footage-gdynia-poland-june-fireman-hiding-fire-hose-to-fire-engine.mp4,PT00H00M07S,053551_053600,"Gdynia, poland - june 2018: fireman hiding fire hose to fire engine"
1012379582,https://ak.picdn.net/shutterstock/videos/1012379582/preview/stock-footage-aerial-footage-coastline-forest-beach-reef-and-ocean.mp4,PT00H00M23S,098851_098900,"Aerial footage coastline. forest, beach, reef and ocean."
1027265912,https://ak.picdn.net/shutterstock/videos/1027265912/preview/stock-footage--s-seminole-indians-move-away-from-smoke-and-fire-near-village.mp4,PT00H00M28S,086501_086550,1930s: seminole indians move away from smoke and fire near village.
12770738,https://ak.picdn.net/shutterstock/videos/12770738/preview/stock-footage-the-river-rio-doce-early-in-the-morning-in-the-background-irrigation-systems-water-plantations.mp4,PT00H00M15S,086701_086750,The river rio doce early in the morning. in the background irrigation systems water plantations.
8829739,https://ak.picdn.net/shutterstock/videos/8829739/preview/stock-footage-two-girls-wearing-red-theatrical-costumes-are-dancing.mp4,PT00H00M04S,051551_051600,Two girls wearing red theatrical costumes are dancing
13590179,https://ak.picdn.net/shutterstock/videos/13590179/preview/stock-footage-fit-sports-girl-trying-to-surf-a-wave.mp4,PT00H00M13S,093301_093350,Fit sports girl trying to surf a wave.
1010977571,https://ak.picdn.net/shutterstock/videos/1010977571/preview/stock-footage-gourmet-plate-in-a-great-restaurant.mp4,PT00H00M17S,086401_086450,Gourmet plate in a great restaurant
1020529597,https://ak.picdn.net/shutterstock/videos/1020529597/preview/stock-footage-santa-croce-at-dusk-florence-aerial.mp4,PT00H00M51S,039901_039950,Santa croce at dusk - florence - aerial
26234123,https://ak.picdn.net/shutterstock/videos/26234123/preview/stock-footage-red-sea-coral-and-fish.mp4,PT00H00M09S,146951_147000,Red sea. coral and fish
1048532026,https://ak.picdn.net/shutterstock/videos/1048532026/preview/stock-footage-animation-of-numbers-counting-from-to-with-colorful-motion-shape-and-flash-effect-changing.mp4,PT00H00M22S,024351_024400,"Animation of numbers counting from 10 to 1, with colorful motion shape and flash effect changing with each number. perfect to modify and add to any project."
1031133860,https://ak.picdn.net/shutterstock/videos/1031133860/preview/stock-footage-majestic-golden-autumn-mountain-waterfall-stream-fast-foamy-pure-water-flow-wildlife-nature.mp4,PT00H00M13S,007601_007650,Majestic golden autumn mountain waterfall stream. fast foamy pure water flow wildlife nature habitat. highland creek soft sun beam rocky bank clean ecology concept drone flight footage 4k (uhd)
1020763159,https://ak.picdn.net/shutterstock/videos/1020763159/preview/stock-footage-on-december-suphan-buri-thailand-the-people-join-a-cycling-event-bike-un-i-rak.mp4,PT00H00M30S,118851_118900,"On december 9, 2018, suphan buri, thailand, the people join a cycling event ”bike un i rak”. his majesty king maha vajiralongkorn bodindradebayavarangkun had graciously initiated the organisation."
1762439,https://ak.picdn.net/shutterstock/videos/1762439/preview/stock-footage-nepal-circa-may-man-touches-shrine-as-he-passes-by.mp4,PT00H00M12S,043501_043550,"Nepal - circa may, 2011: man touches shrine as he passes by. "
1008209002,https://ak.picdn.net/shutterstock/videos/1008209002/preview/stock-footage-bangkok-thailand-january-tourists-at-temple-of-wat-traimit-where-the-golden-buddha.mp4,PT00H00M21S,094551_094600,"Bangkok, thailand - january 23, 2018: tourists at temple of wat traimit where the golden buddha statue resides"
33457210,https://ak.picdn.net/shutterstock/videos/33457210/preview/stock-footage-shattered-heart-on-a-black-background-d-illustration-render.mp4,PT00H00M06S,015201_015250,Shattered heart on a black background 3d illustration render
1012181774,https://ak.picdn.net/shutterstock/videos/1012181774/preview/stock-footage-little-happy-girl-bathes-in-the-bathroom-with-foam-he-plays-with-foam-emotionally-smiling.mp4,PT00H00M11S,193651_193700,Little happy girl bathes in the bathroom with foam. he plays with foam. emotionally smiling.
1023043957,https://ak.picdn.net/shutterstock/videos/1023043957/preview/stock-footage-khmelnik-ukraine-january-kids-on-ice.mp4,PT00H00M23S,121601_121650,"Khmelnik, ukraine, 21 january 2018: kids on ice"
1012103264,https://ak.picdn.net/shutterstock/videos/1012103264/preview/stock-footage-close-up-slow-motion-barnyard-lifestyle-black-sheeps-with-white-points-looking-to-left-side-at.mp4,PT00H00M17S,022201_022250,Close up. slow motion. barnyard lifestyle. black sheeps with white points looking to left side at farm
5013149,https://ak.picdn.net/shutterstock/videos/5013149/preview/stock-footage-viburnum-berries.mp4,PT00H00M24S,189401_189450,Viburnum berries
18538163,https://ak.picdn.net/shutterstock/videos/18538163/preview/stock-footage-royal-crescent-regency-terrace-in-the-city-of-bath.mp4,PT00H00M21S,198301_198350,Royal crescent: regency terrace in the city of bath
1020187375,https://ak.picdn.net/shutterstock/videos/1020187375/preview/stock-footage-wind-blows-to-the-top-of-bamboo-tree-when-sunset.mp4,PT00H00M05S,177101_177150,Wind blows to the top of bamboo tree when sunset.
1034679356,https://ak.picdn.net/shutterstock/videos/1034679356/preview/stock-footage-pretty-little-blonde-girls-play-with-soil-and-flower-boxes-in-house-backyard-garden-against-father.mp4,PT00H00M25S,050051_050100,Pretty little blonde girls play with soil and flower boxes in house backyard garden against father at bright sunlight close and medium view
16282762,https://ak.picdn.net/shutterstock/videos/16282762/preview/stock-footage-sunset-in-makarska-croatia-spring.mp4,PT00H00M21S,086801_086850,"Sunset in makarska, croatia spring 2016."
1061764300,https://ak.picdn.net/shutterstock/videos/1061764300/preview/stock-footage-hialeah-city-flag-city-of-florida-in-usa-or-united-states-of-america-loop.mp4,PT00H00M20S,142201_142250,"Hialeah city flag, city of florida in usa or united states of america - loop"
22244575,https://ak.picdn.net/shutterstock/videos/22244575/preview/stock-footage-aerial-sunny-isles-beach-p.mp4,PT00H00M29S,003401_003450,Aerial sunny isles beach 60p
9190244,https://ak.picdn.net/shutterstock/videos/9190244/preview/stock-footage-black-toddler-walking-on-the-beach-holding-hands-with-his-father.mp4,PT00H00M29S,122701_122750,Black toddler walking on the beach holding hands with his father.
1031610662,https://ak.picdn.net/shutterstock/videos/1031610662/preview/stock-footage-salmon-jumping-against-fast-flowing-water-at-dam-near-spawning-grounds.mp4,PT00H00M05S,124601_124650,Salmon jumping against fast flowing water at dam near spawning grounds
2941594,https://ak.picdn.net/shutterstock/videos/2941594/preview/stock-footage-driving-car-at-night-pov.mp4,PT00H00M15S,007951_008000,Driving car at night - pov
1039707584,https://ak.picdn.net/shutterstock/videos/1039707584/preview/stock-footage-tall-telecom-g-cell-tower-mast-in-a-residential-populated-area-cell-phone-or-gsm-cellular-mobile.mp4,PT00H00M09S,197051_197100,Tall telecom 5g cell tower mast in a residential populated area. cell phone or gsm cellular mobile network antenna mast in a small town. top down aerial drone view orbiting around 
1057348057,https://ak.picdn.net/shutterstock/videos/1057348057/preview/stock-footage-flying-many-clear-crystal-spheres-on-black-background-shine-transparent-colorful-glass-d.mp4,PT00H00M15S,020251_020300,"Flying many clear crystal spheres on black background. shine transparent, colorful glass. 3d animation of shiny ball rotating. loop animation."
1020002815,https://ak.picdn.net/shutterstock/videos/1020002815/preview/stock-footage-super-santa-claus-d-animation.mp4,PT00H00M12S,031051_031100,Super santa claus - 3d animation
17480512,https://ak.picdn.net/shutterstock/videos/17480512/preview/stock-footage-epic-green-kauai-mountains.mp4,PT00H00M33S,108701_108750,Epic green kauai mountains
27004399,https://ak.picdn.net/shutterstock/videos/27004399/preview/stock-footage-flocculation-experiment.mp4,PT00H00M16S,006551_006600,Flocculation experiment.
28321582,https://ak.picdn.net/shutterstock/videos/28321582/preview/stock-footage-handheld-footage-of-an-old-brick-wall-in-winchester-england.mp4,PT00H00M20S,136101_136150,Handheld footage of an old brick wall in winchester england
499825,https://ak.picdn.net/shutterstock/videos/499825/preview/stock-footage-light-rays-move-quickly-across-a-golden-wheat-field.mp4,PT00H00M10S,027951_028000,Light rays move quickly across a golden wheat field.
1029462854,https://ak.picdn.net/shutterstock/videos/1029462854/preview/stock-footage-symbol-sync-inflames-with-dark-fire-then-burns-in-out-loop-alpha-channel-premultiplied.mp4,PT00H00M09S,037051_037100,"Symbol sync inflames with dark fire, then burns. in - out loop. alpha channel premultiplied - matted with color white"
9776390,https://ak.picdn.net/shutterstock/videos/9776390/preview/stock-footage-tubing-on-a-mountain-river-northern-thailand-tubing-on-a-mountain-river-flint.mp4,PT00H00M07S,056151_056200,"Tubing on a mountain river, northern thailand/tubing on a mountain river6/flint5"
9426275,https://ak.picdn.net/shutterstock/videos/9426275/preview/stock-footage-cropped-video-of-african-american-legs-and-feet-sticking-out-of-car-window-on-road-trip.mp4,PT00H00M16S,031451_031500,Cropped video of african american legs and feet sticking out of car window on road trip
1024679390,https://ak.picdn.net/shutterstock/videos/1024679390/preview/stock-footage-frankfurt-germany-circa-winter-hotel-bedroom-interior-decor-with-pinball-machine-and-two.mp4,PT00H00M06S,049951_050000,"Frankfurt, germany. circa winter 2018. hotel bedroom interior decor with pinball machine and two double beds."
1012498403,https://ak.picdn.net/shutterstock/videos/1012498403/preview/stock-footage-top-view-of-filling-syringe-with-heroin-from-a-spoon.mp4,PT00H00M19S,054701_054750,Top view of filling syringe with heroin from a spoon
1630333,https://ak.picdn.net/shutterstock/videos/1630333/preview/stock-footage-successful-ethnic-businessman-with-smartphone-in-close-up.mp4,PT00H00M11S,003751_003800,Successful ethnic businessman with smartphone in close up
13341821,https://ak.picdn.net/shutterstock/videos/13341821/preview/stock-footage-clownfish-or-anemonefish-are-fishes-from-the-subfamily-amphiprioninae-in-the-family-pomacentridae.mp4,PT00H00M12S,133301_133350,"Clownfish or anemonefish are fishes from the subfamily amphiprioninae in the family pomacentridae. thirty species are recognized: one in the genus premnas, while remaining are in genus amphiprion."
1035658841,https://ak.picdn.net/shutterstock/videos/1035658841/preview/stock-footage-teamwork-industry-gas-production-station-concept-slow-motion-video-two-engineers-in-helmets-are.mp4,PT00H00M23S,109351_109400,Teamwork. industry gas production station concept. slow motion video. two engineers in helmets are studying working with lifestyle a digital tablet in factorygas supply business contract. two workers
7050502,https://ak.picdn.net/shutterstock/videos/7050502/preview/stock-footage-puffin.mp4,PT00H00M16S,018451_018500,Puffin
1034075330,https://ak.picdn.net/shutterstock/videos/1034075330/preview/stock-footage-super-slow-motion-shot-of-abstract-bokeh-light-moving-at-fps.mp4,PT00H00M23S,080301_080350,Super slow motion shot of abstract bokeh light moving at 1000fps.
23828941,https://ak.picdn.net/shutterstock/videos/23828941/preview/stock-footage-beautician-making-skin-remodeling-using-radiofrequency-needle-lift.mp4,PT00H00M08S,008351_008400,Beautician making skin remodeling using radiofrequency needle lift.
1024500635,https://ak.picdn.net/shutterstock/videos/1024500635/preview/stock-footage-cooking-biscuit-roll-stuffed-with-ricotta-and-mandarin-ready-roll-lies-on-a-platter-near-cut.mp4,PT00H00M09S,080401_080450,Cooking biscuit roll stuffed with ricotta and mandarin. ready roll lies on a platter. near cut piece of roll.
1058227084,https://ak.picdn.net/shutterstock/videos/1058227084/preview/stock-footage-beirut-airport-explosion-august-total-devastation-of-the-port-and-the-city.mp4,PT00H00M09S,030451_030500,"Beirut airport explosion , august 04, 2020. total devastation of the port and the city."
2674562,https://ak.picdn.net/shutterstock/videos/2674562/preview/stock-footage-torii-shrine.mp4,PT00H00M12S,180001_180050,Torii shrine
1066217740,https://ak.picdn.net/shutterstock/videos/1066217740/preview/stock-footage-aerial-view-of-english-houses-in-clapham-london-during-spring.mp4,PT00H00M23S,186451_186500,Aerial view of english houses in clapham london during spring
14215238,https://ak.picdn.net/shutterstock/videos/14215238/preview/stock-footage-fly-over-chongyen-thailand.mp4,PT00H01M06S,018251_018300,Fly over chongyen thailand 07
32578927,https://ak.picdn.net/shutterstock/videos/32578927/preview/stock-footage-st-petersburg-russia-august-neva-embankment-and-trinity-troitsky-bridge-in-the.mp4,PT00H00M17S,051551_051600,"St petersburg, russia - august 12, 2017: neva embankment and trinity (troitsky) bridge in the sunset "
1015175842,https://ak.picdn.net/shutterstock/videos/1015175842/preview/stock-footage-woman-taking-picture-of-tasty-dessert-in-k-slow-motion.mp4,PT00H00M08S,024851_024900,Woman taking picture of tasty dessert in 4k slow motion 
1036443041,https://ak.picdn.net/shutterstock/videos/1036443041/preview/stock-footage-leaf-beetle-chrysolina-graminis-flower-safer-rose-chafer-leaf-beetle-chrysolina-graminis-shiny.mp4,PT00H00M15S,023701_023750,"Leaf beetle chrysolina graminis, flower safer, rose chafer, leaf beetle, chrysolina graminis. shiny, emerald green metallic large beetle sitting on green leaves. close-up of tansy beetle. "
2651471,https://ak.picdn.net/shutterstock/videos/2651471/preview/stock-footage-beautiful-young-woman-with-shopping-bags-posing.mp4,PT00H00M21S,185351_185400,Beautiful young woman with shopping bags posing
1032932621,https://ak.picdn.net/shutterstock/videos/1032932621/preview/stock-footage-drone-shot-of-golden-field-with-trees-and-forest-summer-landscape-field-at-sunset.mp4,PT00H00M11S,044201_044250,Drone shot of golden field with trees and forest. summer landscape. field at sunset.
30192382,https://ak.picdn.net/shutterstock/videos/30192382/preview/stock-footage-the-lotus-flower.mp4,PT00H00M10S,018701_018750,The lotus flower 
287212,https://ak.picdn.net/shutterstock/videos/287212/preview/stock-footage-seamlessly-looping-heart-monitor.mp4,PT00H00M10S,145551_145600,Seamlessly looping heart monitor. 
1013949779,https://ak.picdn.net/shutterstock/videos/1013949779/preview/stock-footage--silhouette-of-a-boy-who-is-training-with-running-and-cardio-fitness-at-sunrise-on-the-beach-in.mp4,PT00H00M14S,078151_078200,"
silhouette of a boy who is training with running and cardio fitness at sunrise on the beach in front of the ocean"
30016171,https://ak.picdn.net/shutterstock/videos/30016171/preview/stock-footage-green-and-blue-neon-green-goniopora-zoanthids-corals-waving-or-flowing-inside-dark-blue-water.mp4,PT00H00M16S,026151_026200,Green and blue neon green goniopora zoanthids  corals waving or flowing inside dark blue water
1061493193,https://ak.picdn.net/shutterstock/videos/1061493193/preview/stock-footage-lonely-old-tower-in-the-forest.mp4,PT00H00M22S,194701_194750,Lonely old tower in the forest
3986887,https://ak.picdn.net/shutterstock/videos/3986887/preview/stock-footage-wide-angled-moving-vehicle-shot-driving-through-tunnel-in-downtown-los-angeles-california-at-night.mp4,PT00H00M12S,101901_101950,"Wide angled, moving vehicle shot driving through tunnel in downtown los angeles california at night. edited in fast motion and really captures the rapidly changing colorful lights along the tunnel."
24268769,https://ak.picdn.net/shutterstock/videos/24268769/preview/stock-footage-beautiful-serious-businesswoman-in-grey-dress-making-presentation-with-laser-pointer-isolated.mp4,PT00H00M10S,019051_019100,Beautiful serious businesswoman in grey dress making presentation with laser pointer. isolated white background
22271815,https://ak.picdn.net/shutterstock/videos/22271815/preview/stock-footage-slider-shot-of-a-pretty-young-woman-asleep-in-bed-being-woken-by-her-phone-ringing.mp4,PT00H00M10S,019501_019550,Slider shot of a pretty young woman asleep in bed being woken by her phone ringing.
