videoid,contentUrl,duration,page_dir,name
1014194531,https://ak.picdn.net/shutterstock/videos/1014194531/preview/stock-footage-close-up-shot-of-sieving-white-wheat-flour-trough-a-medium-sized-sieve-on-a-textured-dark-wood.mp4,PT00H00M15S,017601_017650,Close up shot of sieving white wheat flour trough a medium sized sieve on a textured dark wood table. pile of flour. dark background.
34888618,https://ak.picdn.net/shutterstock/videos/34888618/preview/stock-footage-multicopter-frame-arm-with-spinning-brushless-motor-when-a-brushless-motor-is-runing-it-not-only.mp4,PT00H00M19S,016101_016150,"Multicopter frame arm with spinning brushless motor. when a brushless motor is runing, it not only provides rotational energy also acts as generator. this back charge is why brushless motors efficient"
12583670,https://ak.picdn.net/shutterstock/videos/12583670/preview/stock-footage-gas-burning-from-a-kitchen-gas-stove.mp4,PT00H00M09S,084351_084400,"Gas burning from a kitchen gas stove,"
1018568356,https://ak.picdn.net/shutterstock/videos/1018568356/preview/stock-footage-big-spider-on-a-web-at-night-large-spider-on-a-web.mp4,PT00H00M14S,033951_034000,Big spider on a web at night. large spider on a web
1009308704,https://ak.picdn.net/shutterstock/videos/1009308704/preview/stock-footage-poor-man-gets-empty-box-as-holiday-gift-top-view.mp4,PT00H00M09S,186251_186300,"Poor man gets empty box as holiday gift, top view"
1056932570,https://ak.picdn.net/shutterstock/videos/1056932570/preview/stock-footage-young-barista-man-in-mask-and-apron-cleaning-and-preparing-bar-for-visitors-working-in-coffee-shop.mp4,PT00H00M15S,017051_017100,"Young barista man in mask and apron cleaning and preparing bar for visitors working in coffee shop, sanitizer desinfection during coronavirus covid 19 pandemic, reopen business, post covid"
21123196,https://ak.picdn.net/shutterstock/videos/21123196/preview/stock-footage-slow-tilt-staple-food-served-after-baking-k-p-fps-ultrahd-footage-dark-brown-tasty-bread.mp4,PT00H00M05S,017351_017400,Slow tilt staple food served after baking 4k 2160p 30fps ultrahd footage - dark brown tasty bread crust and inside made from full healthy grain and barley 3840x2160 uhd tilting video
1062670030,https://ak.picdn.net/shutterstock/videos/1062670030/preview/stock-footage-london-november-courier-drops-off-parcel-in-doorway-entrance-next-door-to-a-face-mask.mp4,PT00H00M10S,185501_185550,"London - november 3, 2020: courier drops off parcel in doorway entrance next door to a face mask store"
17253313,https://ak.picdn.net/shutterstock/videos/17253313/preview/stock-footage-heavy-rain-and-hail-and-lightning-in-the-city-of-kiev-ukraine.mp4,PT00H00M16S,181401_181450,"Heavy rain and hail and lightning in the city of kiev, ukraine"
27702889,https://ak.picdn.net/shutterstock/videos/27702889/preview/stock-footage-dolly-top-down-zoom-in-view-of-delicious-steamy-tortellini-in-bolognese-sauce-pasta.mp4,PT00H00M18S,144201_144250,Dolly top down zoom in view of delicious steamy tortellini in bolognese sauce (pasta)
8999977,https://ak.picdn.net/shutterstock/videos/8999977/preview/stock-footage-girl-watching-tv-in-bed.mp4,PT00H00M20S,020351_020400,Girl watching tv  in bed
32367421,https://ak.picdn.net/shutterstock/videos/32367421/preview/stock-footage-junior-funny-thin-santa-claus-dancing-and-having-fun.mp4,PT00H00M20S,173451_173500,Junior funny thin santa claus dancing and having fun.
31912816,https://ak.picdn.net/shutterstock/videos/31912816/preview/stock-footage-circa-s-royal-air-force-servicemen-load-rockets-onto-warplanes-and-set-up-a-camera-in-the.mp4,PT00H00M53S,083001_083050,"Circa 1940s - royal air force servicemen load rockets onto warplanes and set up a camera in the wing of a hawker typhoon aircraft, in europe, during world war 2, in 1944."
1022211976,https://ak.picdn.net/shutterstock/videos/1022211976/preview/stock-footage-circa-a-montage-shows-many-of-the-unsung-workers-who-keep-railroads-running.mp4,PT00H01M20S,196901_196950,Circa 1944 - a montage shows many of the unsung workers who keep railroads running.
1050064438,https://ak.picdn.net/shutterstock/videos/1050064438/preview/stock-footage-south-bend-indiana-two-children-in-lead-followed-by-a-crowd-walking.mp4,PT00H00M05S,041401_041450,South bend indiana-1958: two children in lead followed by a crowd walking
21174922,https://ak.picdn.net/shutterstock/videos/21174922/preview/stock-footage-christmas-and-new-year-animation-golden-christmas-snowflakes-on-black-background-large-snowflakes.mp4,PT00H00M25S,133901_133950,Christmas and new year animation. golden christmas snowflakes on black background. large snowflakes falling.
24105547,https://ak.picdn.net/shutterstock/videos/24105547/preview/stock-footage-young-couple-eating-cake-and-talking-in-cafe-man-feeding-his-girlfriend.mp4,PT00H00M18S,007651_007700,"Young couple eating cake and talking in cafe, man feeding his girlfriend
"
1022571064,https://ak.picdn.net/shutterstock/videos/1022571064/preview/stock-footage-close-up-of-the-patially-full-moon-in-the-dark-sky.mp4,PT00H00M29S,075251_075300,Close up of the patially full moon in the dark sky.
1032986588,https://ak.picdn.net/shutterstock/videos/1032986588/preview/stock-footage-channel-islands-california-circa-california-santa-cruz-channel-island-approaching-prisoners.mp4,PT00H00M17S,116551_116600,Channel islands california - circa 2018 -california santa cruz channel island approaching prisoners harbor pov from boat.
1045536295,https://ak.picdn.net/shutterstock/videos/1045536295/preview/stock-footage-handsome-man-listening-to-something-by-putting-hand-to-the-ear-isolated-on-white-background.mp4,PT00H00M08S,183851_183900,"Handsome man listening to something by putting hand to the ear. isolated, on white background"
12306965,https://ak.picdn.net/shutterstock/videos/12306965/preview/stock-footage-brilliant-nature-scene-with-closeup-of-maple-leaves-and-sparkles-after-heavy-snowfall-beautiful.mp4,PT00H00M35S,146851_146900,"Brilliant nature scene with closeup of maple leaves and sparkles after heavy snowfall. beautiful background with snow on colorful foliage and place for your text. slow motion hd footage. 1920x1080
"
13949807,https://ak.picdn.net/shutterstock/videos/13949807/preview/stock-footage-businessman-using-smart-watch-app-connecting-digital-device-in-modern-office.mp4,PT00H00M09S,011301_011350,Businessman using smart watch app connecting digital device in modern office
1060277858,https://ak.picdn.net/shutterstock/videos/1060277858/preview/stock-footage-car-washing-process-of-luxury-car-full-covered-with-white-foam-and-splashes-from-water-gun.mp4,PT00H00M09S,057201_057250,Car washing process of luxury car full covered with white foam and splashes from water gun. spreading of foam on shiny car exterior slow motion. carwash or car detailing prices.
1007623501,https://ak.picdn.net/shutterstock/videos/1007623501/preview/stock-footage-busan-south-korea-february-aerial-view-of-busan-city-skyline-at-night-in-south-korea.mp4,PT00H00M20S,145951_146000,"Busan,south korea - 15 february 2018 : aerial view of busan city skyline at night in south korea."
1040658869,https://ak.picdn.net/shutterstock/videos/1040658869/preview/stock-footage-symbol-users-burns-out-of-transparency-then-burns-again-alpha-channel-premultiplied-matted-with.mp4,PT00H00M15S,186751_186800,"Symbol users burns out of transparency, then burns again. alpha channel premultiplied - matted with color black"
1060909372,https://ak.picdn.net/shutterstock/videos/1060909372/preview/stock-footage-electricity-flowing-on-a-circuit-board-d-animation.mp4,PT00H00M13S,089701_089750,"Electricity flowing on a circuit board, 3d animation"
17620777,https://ak.picdn.net/shutterstock/videos/17620777/preview/stock-footage-sea-waves-splashing-at-sunset.mp4,PT00H00M07S,110201_110250,Sea waves splashing at sunset
1028890973,https://ak.picdn.net/shutterstock/videos/1028890973/preview/stock-footage-aerial-shot-of-medieval-castle-ruin-above-nograd-village-in-hungary.mp4,PT00H00M07S,192951_193000,Aerial shot of medieval castle ruin above nograd village in hungary
31101937,https://ak.picdn.net/shutterstock/videos/31101937/preview/stock-footage-gasoline-saw-sawing-a-thick-tree.mp4,PT00H00M10S,126151_126200,Gasoline saw sawing a thick tree
19436488,https://ak.picdn.net/shutterstock/videos/19436488/preview/stock-footage-in-world-war-ii-the-us-forces-bombed-defenses-in-the-japanese-hills-by-air-s.mp4,PT00H01M27S,063701_063750,"In world war ii, the us forces bombed defenses in the japanese hills by air. (1940s)"
29137993,https://ak.picdn.net/shutterstock/videos/29137993/preview/stock-footage-young-girl-training-her-horse-outdoors-on-lawn.mp4,PT00H00M16S,192401_192450,Young girl training her horse outdoors on lawn
1009865963,https://ak.picdn.net/shutterstock/videos/1009865963/preview/stock-footage-open-air-barbecue-juicy-meat-on-the-grill-hot-coals-and-fumes-k.mp4,PT00H00M21S,117051_117100,"Open-air barbecue, juicy meat on the grill. hot coals and fumes. 4k"
1045511992,https://ak.picdn.net/shutterstock/videos/1045511992/preview/stock-footage-high-angle-pedestal-shot-of-caucasian-male-carpenter-working-with-laptop-and-technical-drafts-and.mp4,PT00H00M18S,064301_064350,"High angle pedestal shot of caucasian male carpenter working with laptop and technical drafts, and unfinished furniture, components and woodworking tools lying on table beside"
27959005,https://ak.picdn.net/shutterstock/videos/27959005/preview/stock-footage-dentist-in-protective-mask-and-medical-gloves-works-with-the-patient-sitting-in-the-dental-chair.mp4,PT00H00M12S,063351_063400,"Dentist in protective mask and medical gloves works with the patient sitting in the dental chair,remove tartar with ultrasound"
1036593755,https://ak.picdn.net/shutterstock/videos/1036593755/preview/stock-footage-two-large-camels-lie-on-the-lawn.mp4,PT00H00M35S,125001_125050,Two large camels lie on the lawn
1050047815,https://ak.picdn.net/shutterstock/videos/1050047815/preview/stock-footage-oxen-hill-maryland-usa-march-a-capital-bikeshare-bike-parked-at-a-parking-dock-at.mp4,PT00H00M06S,174201_174250,"Oxen hill, maryland/usa- march 26 2020: a capital bikeshare bike parked at a parking dock at national harbor."
1023437323,https://ak.picdn.net/shutterstock/videos/1023437323/preview/stock-footage--year-old-boy-holds-newborn-infant-baby-brother-for-st-time.mp4,PT00H00M26S,176051_176100,1959 7 year old boy holds newborn infant baby brother for 1st time
29980777,https://ak.picdn.net/shutterstock/videos/29980777/preview/stock-footage-little-blond-boy-playing-with-a-board-game.mp4,PT00H00M31S,139351_139400,Little blond boy playing with a board game
1055365460,https://ak.picdn.net/shutterstock/videos/1055365460/preview/stock-footage-ocean-beach-with-rocks-pebbles-and-waves-in-slow-motion-at-summer-day-with-dramatic-clouds.mp4,PT00H00M31S,145101_145150,"Ocean beach with rocks, pebbles and waves in slow motion at summer day with dramatic clouds."
1031589992,https://ak.picdn.net/shutterstock/videos/1031589992/preview/stock-footage-the-girl-stands-back-on-the-beach-and-looks-at-the-water-in-sunny-weather.mp4,PT00H00M11S,063701_063750,The girl stands back on the beach and looks at the water in sunny weather.
1014801251,https://ak.picdn.net/shutterstock/videos/1014801251/preview/stock-footage-elephants-defense-line.mp4,PT00H00M26S,086051_086100,Elephants defense line
32698651,https://ak.picdn.net/shutterstock/videos/32698651/preview/stock-footage-fort-lauderdale-fl-usa-november-aerial-night-video-of-the-bank-of-america-downtown.mp4,PT00H00M20S,103151_103200,"Fort lauderdale, fl, usa - november 4, 2017: aerial night video of the bank of america downtown fort lauderdale fl with illuminated blue building top"
1025329823,https://ak.picdn.net/shutterstock/videos/1025329823/preview/stock-footage-time-lapse-of-seoul-city-skyline-at-twilight-south-korea.mp4,PT00H00M10S,148701_148750,"Time lapse of seoul city skyline at twilight ,south korea."
11329442,https://ak.picdn.net/shutterstock/videos/11329442/preview/stock-footage-lemon-tree-on-the-background-of-the-summer-sky.mp4,PT00H00M06S,043851_043900,Lemon tree on the background of the summer sky
1025662670,https://ak.picdn.net/shutterstock/videos/1025662670/preview/stock-footage-the-animation-of-sign-activation-consists-of-a-stream-of-numbers-and-symbols-in-the-digital-space.mp4,PT00H00M08S,087601_087650,The animation of sign activation. consists of a stream of numbers and symbols in the digital space
1009156694,https://ak.picdn.net/shutterstock/videos/1009156694/preview/stock-footage-an-original-macro-shot-of-a-syringe-with-a-metallic-needle-taking-red-blood-from-a-test-tube-in-the.mp4,PT00H00M46S,000651_000700,An original macro shot of a syringe with a metallic needle taking red blood from a test tube in the yellow background.
1056771650,https://ak.picdn.net/shutterstock/videos/1056771650/preview/stock-footage-likable-contented-stylish-aged-boy-resting-on-comfortable-sofa-in-contemporary-room-and-using.mp4,PT00H00M10S,008001_008050,Likable contented stylish 10-aged boy resting on comfortable sofa in contemporary room and using his smartphone to search modern music in smartphone apps
1043503252,https://ak.picdn.net/shutterstock/videos/1043503252/preview/stock-footage-forge-workshop-smithy-manual-production-gas-furnace-for-heating-metal-modern-melting-stove-for.mp4,PT00H00M12S,084951_085000,"Forge workshop. smithy manual production. gas furnace for heating metal. modern melting stove for iron steel. the blacksmith makes iron products for manufacture of fireplaces, stoves. cinematic look."
5784041,https://ak.picdn.net/shutterstock/videos/5784041/preview/stock-footage-st-moritz-february-the-grand-prix-of-the-trotters-during-white-turf-in-the.mp4,PT00H00M28S,026951_027000,"St. moritz - 23 february 2014: the grand prix of the trotters during “white turf” in the magnificent scenery of the upper engadine on february 23rd, 2014 in st. moritz (switzerland)"
1046517355,https://ak.picdn.net/shutterstock/videos/1046517355/preview/stock-footage-peacefull-girl-praying-looking-up-at-orange-sky-with-hope-close-up-silhouette-of-young-woman.mp4,PT00H00M10S,146401_146450,"Peacefull girl praying looking up at orange sky with hope, close-up. silhouette of young woman dreaming looking upwards sunset outdoors ocean background 4k."
20658013,https://ak.picdn.net/shutterstock/videos/20658013/preview/stock-footage-novosibirsk-russia-october-the-tournament-in-kickboxing-in-the-ring-free-admission.mp4,PT00H00M15S,057851_057900,"Novosibirsk, russia - october 15,2016: the tournament in kickboxing in the ring. free admission"
13615334,https://ak.picdn.net/shutterstock/videos/13615334/preview/stock-footage-juniper-bush-with-ice-on-the-needles-during-a-cold-winter-morning.mp4,PT00H00M20S,091701_091750,Juniper bush with ice on the needles during a cold winter morning
1028798426,https://ak.picdn.net/shutterstock/videos/1028798426/preview/stock-footage-sitting-and-lying-on-the-mother-the-child-watches-tv-and-rejoices-and-emotions.mp4,PT00H00M30S,199451_199500,Sitting and lying on the mother the child watches tv and rejoices and emotions
12095846,https://ak.picdn.net/shutterstock/videos/12095846/preview/stock-footage-medium-shot-dolly-shot-couple-flirting-in-forest-on-sunny-day.mp4,PT00H00M06S,193751_193800,"Medium shot dolly shot couple flirting in forest on sunny day
"
14392960,https://ak.picdn.net/shutterstock/videos/14392960/preview/stock-footage-snow-near-the-lake.mp4,PT00H00M06S,016101_016150,Snow near the lake
32413444,https://ak.picdn.net/shutterstock/videos/32413444/preview/stock-footage-orel-orlovskaya-oblast-russia-editorial-architecture-building-the-facades-of-the.mp4,PT00H00M09S,023801_023850,"Orel , orlovskaya oblast, russia, 08.10.2017, editorial: architecture building, the facades of the buildings"
14390887,https://ak.picdn.net/shutterstock/videos/14390887/preview/stock-footage-young-girl-playing-with-a-dog-in-winter-park-slow-motin.mp4,PT00H00M15S,131601_131650,Young girl playing with a dog in winter park. slow motin
32141362,https://ak.picdn.net/shutterstock/videos/32141362/preview/stock-footage-blurred-footage-bulldozers-backhoe-are-doing-ground-level-work-at-construction-sites-under.mp4,PT00H00M17S,193801_193850,Blurred footage: bulldozers (backhoe) are doing ground-level work at construction sites under supervision. (top view footage)
11319503,https://ak.picdn.net/shutterstock/videos/11319503/preview/stock-footage-man-exercising-using-gymnastic-rings-with-others-in-a-gym.mp4,PT00H00M21S,183301_183350,Man exercising using gymnastic rings with others in a gym
1057705960,https://ak.picdn.net/shutterstock/videos/1057705960/preview/stock-footage-mexico-city-mexico-august-over-the-shoulder-shot-of-a-latino-woman-documenting-the.mp4,PT00H00M14S,077101_077150,"Mexico city, mexico - august 16, 2020. over the shoulder shot of a latino woman documenting the monument to the revolution (closed during covid-19 pandemic)"
1015298362,https://ak.picdn.net/shutterstock/videos/1015298362/preview/stock-footage-polygonal-with-connecting-dots-and-lines-against-blue-background.mp4,PT00H00M10S,106401_106450,Polygonal with connecting dots and lines against blue background 
1021556173,https://ak.picdn.net/shutterstock/videos/1021556173/preview/stock-footage-abstract-three-dimensional-figure-rotates-on-a-white-background-d-rendering.mp4,PT00H00M20S,003701_003750,Abstract three-dimensional figure rotates on a white background. 3d rendering
8396839,https://ak.picdn.net/shutterstock/videos/8396839/preview/stock-footage-aerial-giraffes-in-the-middle-of-kenyan-savannah.mp4,PT00H00M15S,069801_069850,Aerial: giraffes in the middle of kenyan savannah
1049658007,https://ak.picdn.net/shutterstock/videos/1049658007/preview/stock-footage--d-animation-of-a-geometric-multicolored-background-of-many-hexagons-randomly-rotating-animation.mp4,PT00H00M08S,007701_007750,"3d animation of a geometric multicolored background of many hexagons randomly rotating. animation of a closed loop with the ability to repeat, continuous playback."
1059106094,https://ak.picdn.net/shutterstock/videos/1059106094/preview/stock-footage-ocean-blue-sky-over-water-horizon-sea-nature-summer-sunrise-palm-silhouette-and-water-surface.mp4,PT00H00M15S,127451_127500,Ocean blue sky over water horizon. sea nature summer sunrise. palm silhouette and water surface. atlantic dubai beach landscape. fantastic natural relaxing place.
1060323659,https://ak.picdn.net/shutterstock/videos/1060323659/preview/stock-footage-high-speed-train-tracking-on-the-viaduct-aerial-view.mp4,PT00H00M15S,063951_064000,"High speed train tracking on the viaduct, aerial view."
1020345124,https://ak.picdn.net/shutterstock/videos/1020345124/preview/stock-footage-kyiv-ukraine-september-make-up-impose-on-the-actress-before-shooting-a-film-slow.mp4,PT00H00M16S,195501_195550,"Kyiv, ukraine - september 26, 2018. make up impose on the actress before shooting a film. slow motion."
701578,https://ak.picdn.net/shutterstock/videos/701578/preview/stock-footage-business-word-breaking-into-pieces-slow-motion-d-animation-p.mp4,PT00H00M25S,032801_032850,"Business word breaking into pieces, slow motion 3d animation - 720p"
17325343,https://ak.picdn.net/shutterstock/videos/17325343/preview/stock-footage-herbal-tea.mp4,PT00H00M08S,043701_043750,Herbal tea
1039054970,https://ak.picdn.net/shutterstock/videos/1039054970/preview/stock-footage-alien-ufo-at-earth-in-jungle-at-sunset.mp4,PT00H00M30S,191701_191750,Alien ufo at earth in jungle at sunset
12397781,https://ak.picdn.net/shutterstock/videos/12397781/preview/stock-footage-st-peters-and-tiber-landscape-slow-zoom-rome-italy-september.mp4,PT00H00M20S,103351_103400,"St peters and tiber landscape slow zoom. rome, italy. september 2011"
28026499,https://ak.picdn.net/shutterstock/videos/28026499/preview/stock-footage-abstract-animation-depicting-growing-neon-tubes-k-uhd.mp4,PT00H00M10S,103851_103900,Abstract animation depicting growing neon tubes. 4k uhd.
18180757,https://ak.picdn.net/shutterstock/videos/18180757/preview/stock-footage-drone-shot-of-downtown-strip-in-a-small-town-in-kansas.mp4,PT00H00M13S,016851_016900,Drone shot of downtown strip in a small town in kansas
1019833651,https://ak.picdn.net/shutterstock/videos/1019833651/preview/stock-footage-time-lapse-sunset-landscape-bordeaux-wineyard-france.mp4,PT00H00M15S,126801_126850,Time lapse sunset landscape bordeaux wineyard france
4134706,https://ak.picdn.net/shutterstock/videos/4134706/preview/stock-footage-flame-confidential-word-fire-text.mp4,PT00H00M17S,023751_023800,"Flame confidential word,fire text."
1053100415,https://ak.picdn.net/shutterstock/videos/1053100415/preview/stock-footage-teen-girl-using-hose-to-wash-coat-of-roan-horse-against-wooden-wall-of-stall-after-horseback-riding.mp4,PT00H00M28S,176951_177000,Teen girl using hose to wash coat of roan horse against wooden wall of stall after horseback riding lesson in equestrian school
18365563,https://ak.picdn.net/shutterstock/videos/18365563/preview/stock-footage-bears-in-alaska.mp4,PT00H00M21S,139501_139550,Bears in alaska
3422072,https://ak.picdn.net/shutterstock/videos/3422072/preview/stock-footage-video-footage-of-a-forest-in-winter-with-snow-in-germany-europe.mp4,PT00H00M10S,111601_111650,"Video footage of a forest in winter with snow in germany, europe"
1020601291,https://ak.picdn.net/shutterstock/videos/1020601291/preview/stock-footage-shiny-red-surface-rotates-magic-bokeh-background.mp4,PT00H00M13S,064101_064150,Shiny red surface rotates. magic bokeh background
1025602511,https://ak.picdn.net/shutterstock/videos/1025602511/preview/stock-footage-purple-abstract-background-motion-light-and-particles-loop.mp4,PT00H00M20S,042401_042450,"Purple abstract background, motion light and particles, loop"
617668,https://ak.picdn.net/shutterstock/videos/617668/preview/stock-footage-frozen-branch.mp4,PT00H00M20S,112251_112300,Frozen branch.
4138684,https://ak.picdn.net/shutterstock/videos/4138684/preview/stock-footage-austin-skyline-and-congress-avenue-bridge-at-twilight-texas-usa.mp4,PT00H00M26S,036851_036900,"Austin skyline and congress avenue bridge at twilight, texas, usa"
1042595245,https://ak.picdn.net/shutterstock/videos/1042595245/preview/stock-footage-aerial-flying-over-carnegie-lake-alongside-princeton-university-princeton-new-jersey-usa.mp4,PT00H00M33S,059901_059950,"Aerial flying over carnegie lake alongside princeton university. princeton, new jersey, usa. 25 august 2019 "
1010220266,https://ak.picdn.net/shutterstock/videos/1010220266/preview/stock-footage-portrait-of-caucasian-woman-holding-stack-of-mail-while-at-local-post-office-female-with-letters.mp4,PT00H00M18S,022301_022350,Portrait of caucasian woman holding stack of mail while at local post office. female with letters in hand looking at camera by post office parcel lockers. 4k
1015751641,https://ak.picdn.net/shutterstock/videos/1015751641/preview/stock-footage-fish-bullhead-nerfling-in-city-river-seine-in-paris-suburbs-clear-water.mp4,PT00H00M11S,010451_010500,"Fish bullhead, nerfling in city river seine in paris suburbs, clear water"
1024139942,https://ak.picdn.net/shutterstock/videos/1024139942/preview/stock-footage-fire-charges-realistic-fire-slow-motion.mp4,PT00H00M06S,103051_103100,"Fire charges, realistic fire, slow motion"
1020914371,https://ak.picdn.net/shutterstock/videos/1020914371/preview/stock-footage-carpathians-romania-august-offroad-cars-parked-on-a-camp.mp4,PT00H00M12S,051601_051650,"Carpathians, romania - august, 2016: offroad cars parked on a camp"
1044733597,https://ak.picdn.net/shutterstock/videos/1044733597/preview/stock-footage-great-spotted-woodpecker-sits-on-the-trunk-of-a-pine-tree-in-winter.mp4,PT00H00M47S,127101_127150,Great spotted woodpecker sits on the trunk of a pine tree in winter
16260964,https://ak.picdn.net/shutterstock/videos/16260964/preview/stock-footage-berlin-germany-may-crowded-street-in-berlin-kreuzberg-on-labor-day-may-day-on-the.mp4,PT00H00M21S,093351_093400,"Berlin, germany - may 01, 2015: crowded street in berlin, kreuzberg on labor day / may day on the 1.may."
1041414235,https://ak.picdn.net/shutterstock/videos/1041414235/preview/stock-footage-woman-s-hands-with-a-cup-sat-by-the-fireplace-keep-warm-in-winter-concept.mp4,PT00H00M15S,106751_106800,Woman's hands with a cup sat by the fireplace. keep warm in winter concept
5453567,https://ak.picdn.net/shutterstock/videos/5453567/preview/stock-footage-attractive-girl-wearing-headset-sitting-by-window-using-touchpad-looking-at-camera-and-smiling.mp4,PT00H00M23S,145301_145350,Attractive girl wearing headset sitting by window using touchpad looking at camera and smiling. panning camera
27348853,https://ak.picdn.net/shutterstock/videos/27348853/preview/stock-footage-honey-flowing-against-black-background-slow-motion-k.mp4,PT00H00M10S,183101_183150,"Honey flowing against black background, slow motion 4k"
1044640420,https://ak.picdn.net/shutterstock/videos/1044640420/preview/stock-footage-to-cook-girl-fries-onions-in-a-pan-in-olive-oil-close-up-the-olive-oil-is-soon-heated-to-fry-the.mp4,PT00H00M19S,064551_064600,To cook girl fries onions in a pan in olive oil close-up. the olive oil is soon heated to fry the onions. natural and healthy dishes. vegan food. self-isolation cooking
22153381,https://ak.picdn.net/shutterstock/videos/22153381/preview/stock-footage-the-beautiful-sandy-beach-of-golden-sand-at-the-azure-sea-and-blue-sky-a-fisheye-look-at-the-surf.mp4,PT00H00M06S,045801_045850,The beautiful sandy beach of golden sand at the azure sea and blue sky. a fisheye look at the surf on a beach.
1025067272,https://ak.picdn.net/shutterstock/videos/1025067272/preview/stock-footage-drone-footage-of-pangkor-island-in-malaysia-asia.mp4,PT00H00M16S,055951_056000,Drone footage of pangkor island in malaysia asia
