videoid,contentUrl,duration,page_dir,name
2672285,https://ak.picdn.net/shutterstock/videos/2672285/preview/stock-footage-python-hatchlings.mp4,PT00H00M17S,130701_130750,Python hatchlings
1024797839,https://ak.picdn.net/shutterstock/videos/1024797839/preview/stock-footage-vinnitsa-ukraine-may-a-truck-tosses-over-bitumen-into-a-wide-paver-to-lay-a-new-roadway.mp4,PT00H00M12S,027751_027800,"Vinnitsa, ukraine - may 2018: a truck tosses over bitumen into a wide paver to lay a new roadway surrounded of repairmen. road construction equipment. aerial view."
1015485886,https://ak.picdn.net/shutterstock/videos/1015485886/preview/stock-footage-card-about-the-energy-value-of-passionfruit.mp4,PT00H00M10S,071451_071500,Card about the energy value of passionfruit
34506826,https://ak.picdn.net/shutterstock/videos/34506826/preview/stock-footage-aerial-view-of-winter-landscape-against-sun.mp4,PT00H00M15S,001051_001100,Aerial view of winter landscape against sun
1021428601,https://ak.picdn.net/shutterstock/videos/1021428601/preview/stock-footage-wife-trying-to-take-selfies-while-her-husband-is-cooking.mp4,PT00H00M29S,000751_000800,"Wife trying to take selfies, while her husband is cooking."
20161576,https://ak.picdn.net/shutterstock/videos/20161576/preview/stock-footage-european-perch-perca-fluviatilis-moves-against-the-background-of-the-stones-then-leaves-the.mp4,PT00H00M16S,067551_067600,"European perch (perca fluviatilis) moves against the background of the stones, then leaves the frame."
4110730,https://ak.picdn.net/shutterstock/videos/4110730/preview/stock-footage-cook-in-a-stone-oven.mp4,PT00H00M22S,128601_128650,Cook in a stone oven 
32512192,https://ak.picdn.net/shutterstock/videos/32512192/preview/stock-footage-isolated-moderate-snowfall-on-black-background-to-overlay-in-k-and-fps.mp4,PT00H00M10S,005051_005100,Isolated moderate snowfall on black background to overlay in 4k and 60fps
7063909,https://ak.picdn.net/shutterstock/videos/7063909/preview/stock-footage-venice-california-august-moving-editorial-time-lapse-on-los-angeles-s-popular-venice.mp4,PT00H00M16S,141401_141450,"Venice, california - august 12, 2014: moving editorial time lapse on los angeles's popular venice beach bike path."
1047898882,https://ak.picdn.net/shutterstock/videos/1047898882/preview/stock-footage-seoul-south-korea-april-modern-building-construction-time-lapse-of-formwork.mp4,PT00H00M23S,070751_070800,"Seoul, south korea - april 01, 2018: modern building construction, time lapse of formwork installation for concrete filling of floor. workers unload and hand set thin sheets on place at steel frame"
1015587607,https://ak.picdn.net/shutterstock/videos/1015587607/preview/stock-footage-tongpan-basalt-on-penghu-islands-taiwan.mp4,PT00H00M06S,050951_051000,"Tongpan basalt on penghu islands, taiwan."
30768910,https://ak.picdn.net/shutterstock/videos/30768910/preview/stock-footage-group-of-desert-elephants-on-a-hot-summer-day-ultra-hd-k-real-time.mp4,PT00H00M18S,182151_182200,"Group of desert elephants on a hot summer day, ultra hd 4k, real time"
2872798,https://ak.picdn.net/shutterstock/videos/2872798/preview/stock-footage-couple-lying-on-rug-in-countryside-enjoying-a-glass-of-white-wine-together.mp4,PT00H00M07S,102501_102550,Couple lying on rug in countryside enjoying a glass of white wine together.
1996343,https://ak.picdn.net/shutterstock/videos/1996343/preview/stock-footage-old-stone-city-walls-of-dubrovnik-pan-shot-over-the-roofs-witch-is-also-called-fifth-facade-of.mp4,PT00H00M21S,102051_102100,Old stone city walls of dubrovnik. pan shot over the roofs - witch is also called fifth facade of the town.
1031794712,https://ak.picdn.net/shutterstock/videos/1031794712/preview/stock-footage-happy-mother-spends-time-with-her-child-playing-in-colored-blocks.mp4,PT00H00M14S,112801_112850,Happy mother spends time with her child playing in colored blocks.
1038777179,https://ak.picdn.net/shutterstock/videos/1038777179/preview/stock-footage-beijing-china-oct-beijing-daxing-international-airport-located-km-south-of-downtown.mp4,PT00H00M12S,000651_000700,"Beijing,china-oct.2,2019:beijing daxing international airport, located 46 km south of downtown beijing, is likely to become the world's largest airport in passenger throughput."
1051530925,https://ak.picdn.net/shutterstock/videos/1051530925/preview/stock-footage-local-fisherman-labuan-bajo-preparing.mp4,PT00H00M49S,103251_103300,Local fisherman labuan bajo preparing
1153030,https://ak.picdn.net/shutterstock/videos/1153030/preview/stock-footage-crane-behind-crane.mp4,PT00H00M09S,081301_081350,Crane behind crane
15756220,https://ak.picdn.net/shutterstock/videos/15756220/preview/stock-footage-swan-on-the-manzanares-river-filmed-in-madrid-in-april.mp4,PT00H00M15S,019501_019550,Swan on the manzanares river.filmed in madrid in april 2016.
1022092567,https://ak.picdn.net/shutterstock/videos/1022092567/preview/stock-footage-office-going-young-girl-using-mobile-phone-laptop-on-road.mp4,PT00H00M13S,199401_199450,"Office going young girl using mobile phone, laptop on road."
1038719396,https://ak.picdn.net/shutterstock/videos/1038719396/preview/stock-footage-aerial-view-of-beautiful-white-cumulus-clouds-floating-over-the-peaks.mp4,PT00H00M24S,012901_012950,Aerial view of beautiful white cumulus clouds floating over the peaks
33386653,https://ak.picdn.net/shutterstock/videos/33386653/preview/stock-footage-business-team-meeting-involved-diverse-people-participating-in-creative-sustainable-ideas.mp4,PT00H00M07S,102101_102150,Business team meeting involved diverse people participating in creative sustainable ideas. steadicam shot across boardroom table shared work space
1041854326,https://ak.picdn.net/shutterstock/videos/1041854326/preview/stock-footage-view-from-ski-lift-with-orange-glass-cover.mp4,PT00H00M17S,077251_077300,View from ski lift with orange glass cover
1033244198,https://ak.picdn.net/shutterstock/videos/1033244198/preview/stock-footage-mountain-springs-and-waterfalls-in-emei-mountain.mp4,PT00H00M18S,187651_187700,Mountain springs and waterfalls in emei mountain
1023358930,https://ak.picdn.net/shutterstock/videos/1023358930/preview/stock-footage-scoop-of-ice-cream-in-slow-motion.mp4,PT00H00M17S,073001_073050,Scoop of ice cream in slow motion
28079266,https://ak.picdn.net/shutterstock/videos/28079266/preview/stock-footage-hands-typing-onk-computer-keyboard-in-startup-office.mp4,PT00H00M16S,064751_064800,Hands typing onk computer keyboard in startup office
22153216,https://ak.picdn.net/shutterstock/videos/22153216/preview/stock-footage-pepper-tree-in-the-wind.mp4,PT00H01M10S,072701_072750,Pepper tree in the wind.
25481279,https://ak.picdn.net/shutterstock/videos/25481279/preview/stock-footage-rocket-up-from-the-water.mp4,PT00H00M11S,054851_054900,Rocket up from the water
1009186718,https://ak.picdn.net/shutterstock/videos/1009186718/preview/stock-footage-winter-heavy-snowfall-on-the-forest.mp4,PT00H00M06S,029001_029050,Winter heavy snowfall on the forest
1031255600,https://ak.picdn.net/shutterstock/videos/1031255600/preview/stock-footage-good-looking-lady-with-a-large-smile-and-very-long-hair-moving-very-excited-in-front-of-the-camera.mp4,PT00H00M28S,000401_000450,Good looking lady with a large smile and very long hair moving very excited in front of the camera dancing charismatic she playing with the camera very professional. 4k
1032919544,https://ak.picdn.net/shutterstock/videos/1032919544/preview/stock-footage-man-hiker-cycling-in-nature-mountains-and-sea-shore-mountain-biking-down-hill-cyclist-riding.mp4,PT00H00M14S,081401_081450,"Man hiker cycling in nature, mountains and sea shore. mountain biking down hill, cyclist riding. sport and active life concept. mountain road bike cyclist man cycling,athlete on a race cycle."
2760104,https://ak.picdn.net/shutterstock/videos/2760104/preview/stock-footage-view-of-the-countryside-in-tuscany-and-of-the-vines-of-chianti-one-of-the-most-famous-wines-in-the.mp4,PT00H00M10S,073751_073800,"View of the countryside in tuscany and of the vines of chianti, one of the most famous wines in the world
"
1037625131,https://ak.picdn.net/shutterstock/videos/1037625131/preview/stock-footage-man-using-tablet-at-home-at-night.mp4,PT00H00M16S,042951_043000,Man using tablet at home at night
1023251365,https://ak.picdn.net/shutterstock/videos/1023251365/preview/stock-footage-footage-rain-storm-strong-wind-blowing-in-phuket-thailand.mp4,PT00H00M12S,013501_013550,"Footage rain, storm, strong wind blowing in phuket, thailand"
17727664,https://ak.picdn.net/shutterstock/videos/17727664/preview/stock-footage-valensole-france-circa-june-the-hand-of-a-woman-gently-touches-the-lavender-flowers-in-a.mp4,PT00H00M16S,199701_199750,"Valensole, france - circa june 2016:  the hand of a woman gently touches the lavender flowers in a field."
5932064,https://ak.picdn.net/shutterstock/videos/5932064/preview/stock-footage-young-multi-ethnic-students-studying-together-in-the-library-at-the-university.mp4,PT00H00M10S,039851_039900,Young multi-ethnic students studying together in the library at the university
1011634946,https://ak.picdn.net/shutterstock/videos/1011634946/preview/stock-footage-brown-throated-sloth-female-adult-young-family-baby-in-costa-rica.mp4,PT00H00M35S,177751_177800,Brown-throated sloth female adult young family baby in costa rica
33966547,https://ak.picdn.net/shutterstock/videos/33966547/preview/stock-footage-aerial-view-in-the-ural-mountains.mp4,PT00H00M52S,089901_089950,Aerial view in the ural mountains
1021344064,https://ak.picdn.net/shutterstock/videos/1021344064/preview/stock-footage-close-up-view-on-process-of-applying-fake-eyelashes-with-glue-and-tweezers-on-eyes-to-complete.mp4,PT00H00M20S,170401_170450,Close up view on process of applying fake eyelashes with glue and tweezers on eyes to complete party makeup look
4888238,https://ak.picdn.net/shutterstock/videos/4888238/preview/stock-footage-a-ladybird-beetle-unable-to-walk-on-the-edge-of-a-leaf-takes-off-and-flies-away.mp4,PT00H00M10S,013751_013800,"A ladybird beetle, unable to walk on the edge of a leaf, takes off and flies away."
1053889391,https://ak.picdn.net/shutterstock/videos/1053889391/preview/stock-footage-barber-drying-male-hair-in-hairdressing-salon-handheld-shot-k.mp4,PT00H00M05S,055451_055500,Barber drying male hair in hairdressing salon. handheld shot. 4k.
1013030561,https://ak.picdn.net/shutterstock/videos/1013030561/preview/stock-footage-a-view-from-below-as-a-brunette-under-a-dome-on-a-background-of-the-sky-is-circling-under-a-ring.mp4,PT00H00M11S,187101_187150,A view from below as a brunette under a dome on a background of the sky is circling under a ring for aerial acrobatics
17824657,https://ak.picdn.net/shutterstock/videos/17824657/preview/stock-footage-backwards-fireworks-th-of-july-independence-day-holiday.mp4,PT00H00M29S,143301_143350,Backwards fireworks 4th of july independence day holiday
1030935029,https://ak.picdn.net/shutterstock/videos/1030935029/preview/stock-footage-rain-affected-the-ground-the-video-a-slow.mp4,PT00H00M57S,005851_005900,Rain affected the ground. the video a slow.
34892182,https://ak.picdn.net/shutterstock/videos/34892182/preview/stock-footage-young-girl-holding-tray-home-baked-cookies.mp4,PT00H00M09S,102551_102600,Young girl holding tray home baked cookies
1062969256,https://ak.picdn.net/shutterstock/videos/1062969256/preview/stock-footage-set-of-sauce-ketchup-pesto-sauce-mayo.mp4,PT00H00M19S,001601_001650,"Set of sauce, ketchup, pesto sauce, mayo"
5141147,https://ak.picdn.net/shutterstock/videos/5141147/preview/stock-footage-iceland-skogafoss-waterfall.mp4,PT00H00M09S,091601_091650,Iceland skogafoss waterfall
1041198742,https://ak.picdn.net/shutterstock/videos/1041198742/preview/stock-footage-wild-goats-in-the-bulgarian-mountains-pirin-national-park.mp4,PT00H00M07S,145801_145850,"Wild goats in the bulgarian mountains, pirin national park	"
12280010,https://ak.picdn.net/shutterstock/videos/12280010/preview/stock-footage-toronto-ontario-canada-october-toronto-blue-jays-major-league-baseball-fans-during-the.mp4,PT00H00M14S,061701_061750,"Toronto, ontario, canada october 2015 toronto blue jays major league baseball fans during the playoffs
"
29145460,https://ak.picdn.net/shutterstock/videos/29145460/preview/stock-footage-the-ruins-of-historic-kilchurn-castle-and-jetty-on-loch-awe-argyll-scotland.mp4,PT00H00M08S,065301_065350,"The ruins of historic kilchurn castle and jetty on loch awe, argyll, scotland"
9603908,https://ak.picdn.net/shutterstock/videos/9603908/preview/stock-footage-beautiful-adult-common-iora-aegithina-tiphia-feeding-the-chicks-on-the-tree.mp4,PT00H00M16S,094051_094100,Beautiful adult common iora (aegithina tiphia) feeding the chicks on the tree
1030848797,https://ak.picdn.net/shutterstock/videos/1030848797/preview/stock-footage-sunderland-tyne-and-wear-united-kingdom-uk-workers-having-a-laugh-on-the-roker.mp4,PT00H00M05S,053251_053300,"Sunderland, tyne and wear / united kingdom (uk) - 11 23 2018: workers having a laugh on the roker beach lighthouse peir in the north east of england"
1039827470,https://ak.picdn.net/shutterstock/videos/1039827470/preview/stock-footage-abstract-background-of-a-heart-made-up-of-smaller-hearts-with-defocused-cubic-grid-gradient-pine.mp4,PT00H00M20S,048601_048650,Abstract background of a heart made up of smaller hearts with defocused cubic grid gradient.  pine green background.  3d animation.
1022692429,https://ak.picdn.net/shutterstock/videos/1022692429/preview/stock-footage-woman-with-natural-rose-lips-close-up-front-view-macro-smile-and-throw-kiss.mp4,PT00H00M11S,102551_102600,Woman with natural rose lips close up. front view macro smile and throw kiss
29054893,https://ak.picdn.net/shutterstock/videos/29054893/preview/stock-footage-grass-field-home-with-a-color-house-the-background-is-blurred.mp4,PT00H01M01S,110201_110250,"Grass field, home with a color house, the background is blurred."
7858405,https://ak.picdn.net/shutterstock/videos/7858405/preview/stock-footage-time-lapse-of-drying-orange-mandarin-mandarine-fruit-x-in-uhd-k-format.mp4,PT00H00M15S,117951_118000,"Time-lapse of drying orange mandarin (mandarine) fruit 1x3 in uhd 4k format
"
11014874,https://ak.picdn.net/shutterstock/videos/11014874/preview/stock-footage-aerial-flying-around-young-couple-doing-yoga-on-sup-boards.mp4,PT00H00M16S,006701_006750,Aerial: flying around young couple doing yoga on sup boards
1054987466,https://ak.picdn.net/shutterstock/videos/1054987466/preview/stock-footage-timelapse-of-gaggiano-with-cloudy-sky-reflecting-in-river-naviglio-grande-at-the-sunset.mp4,PT00H00M10S,084301_084350,Timelapse of gaggiano with cloudy sky reflecting in river naviglio grande at the sunset
1034603684,https://ak.picdn.net/shutterstock/videos/1034603684/preview/stock-footage-the-white-lipped-pit-viper-is-a-venomous-pit-viper-endemic-to-southeast-asia-and-is-often-found.mp4,PT00H00M15S,107201_107250,The white-lipped pit viper is a venomous pit viper endemic to southeast asia and is often found during the night waiting on a branch or limb of a tree near a body of water with plenty of food items.
1044406507,https://ak.picdn.net/shutterstock/videos/1044406507/preview/stock-footage-nicaragua-population-population-of-nicaragua-population-in-nicaragua-chart-graph-rating-total.mp4,PT00H00M55S,010001_010050,Nicaragua population. population of nicaragua. population in nicaragua. chart. graph. rating. total. pyramid. density. growth rate. 2019. 2018. 2017. 2015. 2014. 2011. 2010. 2000.
1008393556,https://ak.picdn.net/shutterstock/videos/1008393556/preview/stock-footage-motion-background-with-moving-geometric-shapes-full-hd-x-fps.mp4,PT00H00M12S,085201_085250,"Motion background with moving geometric shapes (full hd 1920x1080 29.97 fps).
"
29802217,https://ak.picdn.net/shutterstock/videos/29802217/preview/stock-footage-skyline-city-two-people-riding-a-bike-loop-cars-passing-behind-silhouette-on-a-bridge-sunset-red.mp4,PT00H00M06S,002701_002750,"Skyline city two people riding a bike, loop cars passing behind silhouette on a bridge, sunset red colors and warm oranges. loopable"
10123052,https://ak.picdn.net/shutterstock/videos/10123052/preview/stock-footage--k-compilation-montage-people-show-thumbs-on-agreement-street-park-and-office.mp4,PT00H00M12S,063551_063600,"4k compilation (montage) - people show thumbs on agreement - street, park and office"
7024102,https://ak.picdn.net/shutterstock/videos/7024102/preview/stock-footage-zrenjanin-serbia-july-market-place-lot-of-a-vegetables-and-fruits-vegetable-market.mp4,PT00H00M12S,020851_020900,"Zrenjanin,serbia - july 05 2014 :market place ,lot of a vegetables and fruits ,vegetable market multi screen  on july 05 2014 in zrenjanin, serbia."
1043581459,https://ak.picdn.net/shutterstock/videos/1043581459/preview/stock-footage-toronto-ontario-canada-december-warm-winter-weather-and-green-grass-on-ski-hill-due-to.mp4,PT00H00M30S,020251_020300,"Toronto, ontario, canada december 2019 warm winter weather and green grass on ski hill due to climate change"
32731906,https://ak.picdn.net/shutterstock/videos/32731906/preview/stock-footage-sportsman-doing-heavy-rope-training-at-the-gym.mp4,PT00H00M09S,074851_074900,Sportsman doing heavy rope training at the gym.
19611985,https://ak.picdn.net/shutterstock/videos/19611985/preview/stock-footage-tomatoes.mp4,PT00H00M31S,012351_012400,Tomatoes.
1025841668,https://ak.picdn.net/shutterstock/videos/1025841668/preview/stock-footage-pastry-cake-pastry-turkey.mp4,PT00H00M13S,136901_136950,Pastry cake pastry turkey
12048071,https://ak.picdn.net/shutterstock/videos/12048071/preview/stock-footage-italy-october-a-shot-of-a-people-conversing-in-an-alley-way-in-a-tuscan-village.mp4,PT00H00M12S,072951_073000,"Italy - october, 2012: a shot of a people conversing in an alley way in a tuscan village."
31454149,https://ak.picdn.net/shutterstock/videos/31454149/preview/stock-footage-aerial-view-of-blue-lagoon-in-oludeniz-fethiye.mp4,PT00H00M24S,073051_073100,"Aerial view of blue lagoon in oludeniz, fethiye"
26824066,https://ak.picdn.net/shutterstock/videos/26824066/preview/stock-footage-slow-motion-canadian-flag-with-maple-leaf-blowing-in-the-wind-closeup-detail-of-leaf.mp4,PT00H00M19S,040551_040600,"Slow motion canadian flag with maple leaf blowing in the wind. closeup. detail of leaf.
"
1059749021,https://ak.picdn.net/shutterstock/videos/1059749021/preview/stock-footage-family-with-children-sitting-at-christmas-dinner-cape-town-south-africa.mp4,PT00H00M13S,138601_138650,"Family with children (4-5, 10-11) sitting at christmas dinner / cape town, south africa"
1024543613,https://ak.picdn.net/shutterstock/videos/1024543613/preview/stock-footage-the-caldeira-on-the-island-faial.mp4,PT00H00M21S,133751_133800,The caldeira on the island faial
18398806,https://ak.picdn.net/shutterstock/videos/18398806/preview/stock-footage-berlin-skyline-aerial-view-of-spree-river-and-alexanderplatz.mp4,PT00H00M30S,137701_137750,Berlin skyline aerial view of spree river and alexanderplatz.
12947219,https://ak.picdn.net/shutterstock/videos/12947219/preview/stock-footage--k-blood-burst-motion-blur-with-alpha.mp4,PT00H00M05S,129651_129700,4k blood burst motion blur (with alpha) 195
9134048,https://ak.picdn.net/shutterstock/videos/9134048/preview/stock-footage-digital-animation-of-connecting-lines-on-black-background.mp4,PT00H00M15S,081601_081650,Digital animation of connecting lines on black background
6988777,https://ak.picdn.net/shutterstock/videos/6988777/preview/stock-footage-seamless-looping-stylistic-view-of-a-microscopic-universe.mp4,PT00H00M12S,046951_047000,Seamless looping stylistic view of a microscopic universe.
1010650820,https://ak.picdn.net/shutterstock/videos/1010650820/preview/stock-footage-young-sexy-woman-standing-in-pink-dress-next-to-sakura-tree-with-flowers.mp4,PT00H00M24S,106901_106950,Young sexy woman standing in pink dress next to sakura tree with flowers
1058492062,https://ak.picdn.net/shutterstock/videos/1058492062/preview/stock-footage-an-adult-man-is-typing-something-with-his-laptop-while-he-s-enjoying-the-fresh-air-in-a-green.mp4,PT00H00M12S,181951_182000,"An adult man is typing something with his laptop while he's enjoying the fresh air in a green forest - natural office, best working place."
34793332,https://ak.picdn.net/shutterstock/videos/34793332/preview/stock-footage-zagreb-croatia-december-busy-urban-city-scenery-tram-station-people-exit-and-enter.mp4,PT00H00M28S,053701_053750,"Zagreb, croatia - december 24, 2017: busy urban city scenery, tram station, people exit and enter the tramcar, ban jelacic square on christmas time "
3496961,https://ak.picdn.net/shutterstock/videos/3496961/preview/stock-footage-albatrosses-and-mollymawks.mp4,PT00H00M33S,120401_120450,Albatrosses and mollymawks
1039450514,https://ak.picdn.net/shutterstock/videos/1039450514/preview/stock-footage-qatar-doha-march-uhd-k-night-rooftop-cityscape-panorama-timelapse-of-financial-centre.mp4,PT00H00M10S,071501_071550,"Qatar, doha, march 20, 2018: uhd 4k night rooftop cityscape panorama timelapse of financial centre in doha - capital and most populous city in qatar, persian gulf, arabian peninsula, middle east"
1053110336,https://ak.picdn.net/shutterstock/videos/1053110336/preview/stock-footage-red-velvet-cupcakes-with-cream-cheese-frosting-and-decorates-with-heart-and-kiss-shaped-red.mp4,PT00H00M10S,188101_188150,Red velvet cupcakes with cream cheese frosting and decorates with heart and kiss shaped red chocolates.
1020421390,https://ak.picdn.net/shutterstock/videos/1020421390/preview/stock-footage-beautiful-rom-with-candy-bar-wedding-candy-buffet-rotate-camera.mp4,PT00H00M16S,126301_126350,"Beautiful rom with candy bar wedding, candy buffet. rotate camera"
25952564,https://ak.picdn.net/shutterstock/videos/25952564/preview/stock-footage-walking-across-the-street-with-paint-buckets.mp4,PT00H00M24S,126551_126600,Walking across the street with paint buckets
28128133,https://ak.picdn.net/shutterstock/videos/28128133/preview/stock-footage-bangkok-thailand-june-hands-holding-a-fuel-nozzle-on-view-of-the-business-area-around.mp4,PT00H00M14S,119701_119750,"Bangkok, thailand - june 18, 2017: hands holding a fuel nozzle on view of the business area around hua lamphong railway station, rama iv road. bangkok, thailand."
1016157973,https://ak.picdn.net/shutterstock/videos/1016157973/preview/stock-footage-grilling-healthy-dinner-with-organic-chicken-and-vegetables.mp4,PT00H00M11S,133001_133050,Grilling healthy dinner with organic chicken and vegetables.
1022409364,https://ak.picdn.net/shutterstock/videos/1022409364/preview/stock-footage-timelapse-thailand-phuket-beach.mp4,PT00H00M08S,057301_057350,Timelapse thailand phuket beach
1033002155,https://ak.picdn.net/shutterstock/videos/1033002155/preview/stock-footage-green-and-red-light-to-pedestrians-on-crosswalk-in-city-centre-famous-ampelmann-or-ampelm-nnchen.mp4,PT00H00M08S,048601_048650,"Green and red light to pedestrians on crosswalk in city centre. famous ampelmann or ampelmÃ¤nnchen in berlin, germany. little traffic light man for pedestrian. warning light. "
1060073138,https://ak.picdn.net/shutterstock/videos/1060073138/preview/stock-footage-thailand-loi-krathong-yi-peng-festival-hanging-colorful-paper-lanterns-over-entrance-at-night.mp4,PT00H00M07S,069801_069850,Thailand loi krathong yi peng festival hanging colorful paper lanterns over entrance at night
1016584393,https://ak.picdn.net/shutterstock/videos/1016584393/preview/stock-footage-the-girl-isleeps-on-the-mountain-top.mp4,PT00H00M32S,076501_076550,The girl isleeps on the mountain top
3829985,https://ak.picdn.net/shutterstock/videos/3829985/preview/stock-footage-total-of-several-cows-resting-on-a-tableland.mp4,PT00H00M08S,012051_012100,Total of several cows resting on a tableland
1024993970,https://ak.picdn.net/shutterstock/videos/1024993970/preview/stock-footage-beautiful-cityscape-aerial-view-of-seoul-city-south-korea.mp4,PT00H00M13S,133551_133600,"Beautiful cityscape aerial view of seoul city, south korea. "
1046817562,https://ak.picdn.net/shutterstock/videos/1046817562/preview/stock-footage-lifting-by-drone-aerial-shot-on-a-harbour-full-of-bats-and-ships-in-bay-of-sea-water-in-sunset-and.mp4,PT00H00M17S,054651_054700,Lifting by drone aerial shot on a harbour full of bats and ships in bay of sea water in sunset and mountain in front
1024358984,https://ak.picdn.net/shutterstock/videos/1024358984/preview/stock-footage-olomouc-czech-republic-february-carnival-masopust-celebration-masks-parade-festival.mp4,PT00H00M51S,068651_068700,"Olomouc, czech republic, february 29, 2019: carnival masopust celebration masks parade festival, traditional slavic ethnic celebration, winter associated with folk costumes mask death scythe"
16590607,https://ak.picdn.net/shutterstock/videos/16590607/preview/stock-footage-daytona-beach-absolutely-empty.mp4,PT00H00M08S,079501_079550,Daytona beach - absolutely empty
34082488,https://ak.picdn.net/shutterstock/videos/34082488/preview/stock-footage-cosmetologist-is-doing-procedure-for-young-girl-procedure-of-microdermabrasion-model-close-up.mp4,PT00H00M10S,149401_149450,"Cosmetologist is doing procedure for young girl. procedure of microdermabrasion. model, close-up. cosmetological clinic. healthcare"
20248045,https://ak.picdn.net/shutterstock/videos/20248045/preview/stock-footage--berlin-germany-october-visitors-inside-the-transparent-dome-on-the-roof-of-the.mp4,PT00H00M07S,088501_088550," berlin, germany, october 4, 2016. visitors inside the transparent dome on the roof of the reichstag building in berlin"
23575813,https://ak.picdn.net/shutterstock/videos/23575813/preview/stock-footage-walking-down-from-the-top-of-mammoth-hot-springs-in-yellowstone-national-park-in-wyoming-united.mp4,PT00H00M47S,146251_146300,"Walking down from the top of mammoth hot springs, in yellowstone national park, in wyoming, united states of america."
