videoid,contentUrl,duration,page_dir,name
5014721,https://ak.picdn.net/shutterstock/videos/5014721/preview/stock-footage-rainy-day-in-mountains-forest-rain-drops-on-fir-trees-landscape-tourism.mp4,PT00H00M25S,064351_064400,"Rainy day in mountains, forest, rain drops on fir trees, landscape, tourism"
9408104,https://ak.picdn.net/shutterstock/videos/9408104/preview/stock-footage-grope-of-woman-spinning-the-wool-under-the-tree-zooming-in-slow-motion-helicopter-footage-of-a.mp4,PT00H00M19S,106851_106900,Grope of woman spinning the wool under the tree. zooming in slow motion helicopter footage of a woman seating under the tree and making the cotton string on traditional way.
22112689,https://ak.picdn.net/shutterstock/videos/22112689/preview/stock-footage-wave-passed-on-colored-stones-on-the-beach-slow-motion.mp4,PT00H00M47S,065201_065250,Wave passed on colored stones on the beach - slow motion
31930015,https://ak.picdn.net/shutterstock/videos/31930015/preview/stock-footage-beautiful-business-woman-using-the-digital-tablet-pad-on-the-street-to-checking-email-financial.mp4,PT00H00M16S,197701_197750,"Beautiful business woman using the digital tablet pad on the street to checking email, financial center building on the background."
1058785609,https://ak.picdn.net/shutterstock/videos/1058785609/preview/stock-footage-side-view-of-fresh-red-tomato-with-water-drops-rotate-on-board-rop-time-healthy-and-organic.mp4,PT00H00M20S,197201_197250,Side view of fresh red tomato with water drops rotate on board. Ñrop time. healthy and organic vegetables concept. close up. food background
23213620,https://ak.picdn.net/shutterstock/videos/23213620/preview/stock-footage-ships-kunashir-island-ships-kunashir-island.mp4,PT00H00M58S,148201_148250,Ships kunashir island/ships kunashir island
1018309522,https://ak.picdn.net/shutterstock/videos/1018309522/preview/stock-footage-a-view-from-inside-a-car-driving-on-a-highway-at-night-in-norway.mp4,PT00H00M23S,072451_072500,A view from inside a car driving on a highway at night in norway.
1007440189,https://ak.picdn.net/shutterstock/videos/1007440189/preview/stock-footage-aerial-view-of-calabrian-coastline-in-italy-scilla-from-the-air.mp4,PT00H00M15S,139301_139350,Aerial view of calabrian coastline in italy. scilla from the air.
1009851713,https://ak.picdn.net/shutterstock/videos/1009851713/preview/stock-footage-christmas-and-new-year-holidays-illumination-light-gates-arches-installations-of-journey-to.mp4,PT00H00M12S,134151_134200,"Christmas and new year holidays illumination (light gates/arches installations of journey to christmas) in moscow city center (at night), russia  "
1024831349,https://ak.picdn.net/shutterstock/videos/1024831349/preview/stock-footage-feral-white-cat-cleaning-itself-under-a-huge-tree.mp4,PT00H00M19S,193701_193750,Feral white cat cleaning itself under a huge tree.
26718934,https://ak.picdn.net/shutterstock/videos/26718934/preview/stock-footage-spring-image-fresh-green-leaves-and-pink-flower-trees.mp4,PT00H00M19S,101251_101300,Spring image fresh green leaves and pink flower trees
18661076,https://ak.picdn.net/shutterstock/videos/18661076/preview/stock-footage-syrian-refugee-tents-near-an-urban-area-in-amman-jordan-amman-jordan-s.mp4,PT00H00M10S,021801_021850,"Syrian refugee tents near an urban area in amman jordan. (amman, jordan 2010s)"
1021517467,https://ak.picdn.net/shutterstock/videos/1021517467/preview/stock-footage-norwegian-rural-aerial-footage-lofoten-islands-aerial-footage-beautiful.mp4,PT00H00M58S,052801_052850,"Norwegian rural aerial footage, lofoten islands aerial footage.beautiful"
27132364,https://ak.picdn.net/shutterstock/videos/27132364/preview/stock-footage-a-cheerful-crowd-is-dancing-at-a-party.mp4,PT00H00M09S,127051_127100,A cheerful crowd is dancing at a party .
1010292419,https://ak.picdn.net/shutterstock/videos/1010292419/preview/stock-footage-going-up-arrow-rising-data.mp4,PT00H00M06S,143601_143650,Going up arrow rising data
1020239968,https://ak.picdn.net/shutterstock/videos/1020239968/preview/stock-footage-beautiful-tulip-flowers-bloomed-in-the-spring.mp4,PT00H00M16S,057601_057650,Beautiful tulip flowers bloomed in the spring.
5412857,https://ak.picdn.net/shutterstock/videos/5412857/preview/stock-footage-zhukovsky-moscow-region-russia-aug-six-mi-n-berkuts-aerobatic-team-fly-on-air.mp4,PT00H00M06S,180701_180750,"Zhukovsky, moscow region, russia - aug 12, 2012: six mi-28n (berkuts aerobatic team) fly on air show devoted to 100 anniversary of russian air forces."
10073057,https://ak.picdn.net/shutterstock/videos/10073057/preview/stock-footage-williamsburg-brooklyn-brownstone-silhouette-night.mp4,PT00H00M10S,062101_062150,"Williamsburg, brooklyn, brownstone silhouette night"
32319685,https://ak.picdn.net/shutterstock/videos/32319685/preview/stock-footage-a-young-man-walking-and-using-a-smartphone-outside-medium-dolly-shot.mp4,PT00H00M16S,023851_023900,A young man walking and using a smartphone outside. medium dolly shot
2999878,https://ak.picdn.net/shutterstock/videos/2999878/preview/stock-footage-american-flag-decoration-in-national-cemetery.mp4,PT00H00M22S,110801_110850,American flag decoration in national cemetery
1041345430,https://ak.picdn.net/shutterstock/videos/1041345430/preview/stock-footage-olive-tree-plantation-agriculture-plant.mp4,PT00H00M48S,146601_146650,Olive tree plantation agriculture plant
1019443060,https://ak.picdn.net/shutterstock/videos/1019443060/preview/stock-footage--k-slow-motion-close-up-of-charming-serious-african-american-woman-in-glasses-standing-before-a.mp4,PT00H00M21S,022301_022350,4k. slow motion. close-up of charming serious african american woman in glasses standing before a glass wall outside
15107773,https://ak.picdn.net/shutterstock/videos/15107773/preview/stock-footage-time-lapse-of-skull-desert-flower-super-bloom-in-death-valley.mp4,PT00H00M12S,078351_078400,Time lapse of skull & desert flower super bloom in death valley
33768103,https://ak.picdn.net/shutterstock/videos/33768103/preview/stock-footage-snow-covered-branches-from-below-against-a-sunny-blue-sky.mp4,PT00H00M16S,028101_028150,"Snow-covered branches from below, against a sunny blue sky."
1010965280,https://ak.picdn.net/shutterstock/videos/1010965280/preview/stock-footage-happy-young-woman-spraying-water-onto-houseplant-at-home.mp4,PT00H00M13S,018901_018950,"Happy young woman spraying water onto houseplant at home
"
1022838073,https://ak.picdn.net/shutterstock/videos/1022838073/preview/stock-footage-woman-shopping-inspecting-clothes-central-square-market-stalls-marrakesh-morocco.mp4,PT00H00M11S,035651_035700,Woman shopping inspecting clothes central square market stalls marrakesh morocco
1008939701,https://ak.picdn.net/shutterstock/videos/1008939701/preview/stock-footage-close-up-of-steaks-in-the-wok-slow-mo-x-hd-footage.mp4,PT00H00M15S,142601_142650,Close-up of steaks in the wok slow-mo 1920x1080 hd footage
1033340858,https://ak.picdn.net/shutterstock/videos/1033340858/preview/stock-footage--hd-high-quality-editorial-video-of-doha-hamad-international-airport-with-luxury-shops.mp4,PT00H00M19S,128451_128500,"14.10.18: hd high quality editorial video of doha hamad international airport with luxury shops, upmarket restaurants, airline offices, elevators, customs, lounges in state of qatar in persian gulf"
17090464,https://ak.picdn.net/shutterstock/videos/17090464/preview/stock-footage-massif-du-mont-blanc.mp4,PT00H00M38S,029651_029700,"Massif du mont blanc 10
"
1056610856,https://ak.picdn.net/shutterstock/videos/1056610856/preview/stock-footage-warehouse-granary-aluminum-containers-for-storing-loose-grain-against-blue-sky-and-voluminous.mp4,PT00H00M11S,134301_134350,Warehouse granary  aluminum containers for storing loose grain against blue sky and voluminous clouds. elevator. parked trucks. large granary in field on background of sunset aerial view drone turn
19485907,https://ak.picdn.net/shutterstock/videos/19485907/preview/stock-footage-muzzle-of-a-horse-against-the-sky-the-horse-in-harness-horseman-rider-in-the-saddle-on-the-horse.mp4,PT00H00M30S,117551_117600,"Muzzle of a horse against the sky. the horse in harness. horseman. rider in the saddle on the horse. summer sky. horse and rider, surrounded by trees. a horse stands still, the rider in the saddle."
1046689858,https://ak.picdn.net/shutterstock/videos/1046689858/preview/stock-footage-macro-man-portrait-male-attractiveness-concept-close-up-portrait-of-a-sexy-smiling-young-man.mp4,PT00H00M06S,051051_051100,Macro man portrait. male attractiveness concept. close up portrait of a sexy smiling young man isolated on black background. portrait of a beautiful smiling man looking into camera
1659667,https://ak.picdn.net/shutterstock/videos/1659667/preview/stock-footage-cu-of-dry-vegetation-on-rocky-steps.mp4,PT00H00M33S,056601_056650,Cu of dry vegetation on rocky steps
10495727,https://ak.picdn.net/shutterstock/videos/10495727/preview/stock-footage-female-hands-cutting-a-cucumber-on-a-green-board-close-up-view.mp4,PT00H00M18S,043351_043400,"Female hands cutting a cucumber on a green board, close up view"
19865731,https://ak.picdn.net/shutterstock/videos/19865731/preview/stock-footage-cottonwood-arizona-a-boy-cleaning-carrot.mp4,PT00H00M09S,149701_149750,"Cottonwood, arizona 1968: a boy cleaning carrot"
1059793352,https://ak.picdn.net/shutterstock/videos/1059793352/preview/stock-footage-hail-ice-start-falling-from-the-sky-on-footpath-and-green-grass-in-the-forest-beautiful-weather.mp4,PT00H00M44S,146601_146650,Hail ice start falling from the sky on footpath and green grass in the forest. beautiful weather backdrop. 4k uhd footage
1066450594,https://ak.picdn.net/shutterstock/videos/1066450594/preview/stock-footage-driving-a-car-along-the-lake-in-the-countryside-in-england.mp4,PT00H00M10S,011601_011650,Driving a car along the lake in the countryside in england
10367813,https://ak.picdn.net/shutterstock/videos/10367813/preview/stock-footage-nurse-standing-and-thinking-on-green-screen-background.mp4,PT00H00M15S,002901_002950,Nurse standing and thinking on green screen background
1031450681,https://ak.picdn.net/shutterstock/videos/1031450681/preview/stock-footage-many-yachts-and-ships-at-the-marina-view-from-the-top.mp4,PT00H00M35S,006451_006500,Many yachts and ships at the marina. view from the top. 
20535904,https://ak.picdn.net/shutterstock/videos/20535904/preview/stock-footage-sea-waves-in-slow-motion-from-above-of-sky.mp4,PT00H00M30S,128951_129000,Sea waves in slow motion. from above of sky.
1060022804,https://ak.picdn.net/shutterstock/videos/1060022804/preview/stock-footage-coral-reef-underwater-with-fishes-and-marine-life-coral-reef-and-tropical-fish-panglao-bohol.mp4,PT00H00M19S,134051_134100,"Coral reef underwater with fishes and marine life. coral reef and tropical fish. panglao, bohol, philippines."
1021760554,https://ak.picdn.net/shutterstock/videos/1021760554/preview/stock-footage-christian-eastern-orthodox-monastery-in-the-forest-in-winter-aerial-footage.mp4,PT00H00M32S,106501_106550,"Christian eastern orthodox monastery in the forest in winter, aerial footage."
1034247803,https://ak.picdn.net/shutterstock/videos/1034247803/preview/stock-footage-a-car-driving-down-a-rural-road-in-kwazulu-natal-midlands-south-africa.mp4,PT00H00M09S,043401_043450,"A car driving down a rural road in kwazulu-natal midlands, south africa"
1012506077,https://ak.picdn.net/shutterstock/videos/1012506077/preview/stock-footage-abandoned-algae-covered-rope-floating-on-green-muddy-water.mp4,PT00H00M30S,180251_180300,Abandoned algae covered rope floating on green muddy water
1010915981,https://ak.picdn.net/shutterstock/videos/1010915981/preview/stock-footage-top-view-close-up-hands-of-professional-chinese-massage-therapist-doing-massage-of-the-man-s-face.mp4,PT00H00M57S,011901_011950,Top view. close up hands of professional chinese massage therapist doing massage of the man's face
1016310622,https://ak.picdn.net/shutterstock/videos/1016310622/preview/stock-footage-plexus-of-abstract-aquamarine-geometrical-lines-with-moving-triangles-and-dots-on-a-light.mp4,PT00H00M15S,171951_172000,Plexus of abstract aquamarine geometrical lines with moving triangles and dots on a light background animations.
4005727,https://ak.picdn.net/shutterstock/videos/4005727/preview/stock-footage-social-network-connection.mp4,PT00H00M10S,057651_057700,Social network connection.
1019907412,https://ak.picdn.net/shutterstock/videos/1019907412/preview/stock-footage-eco-theme-wind-turbine-detailed-on-top-of-mountain-vegetation-and-granite-stones-and-four-wheel.mp4,PT00H00M05S,027651_027700,"Eco theme, wind turbine, detailed on top of mountain, vegetation and granite stones and four-wheel drive vehicle moving on the scene"
2298005,https://ak.picdn.net/shutterstock/videos/2298005/preview/stock-footage-river-and-trees.mp4,PT00H00M16S,125301_125350,River and trees
7012765,https://ak.picdn.net/shutterstock/videos/7012765/preview/stock-footage-hatchlings-of-sea-turtle.mp4,PT00H00M08S,079301_079350,Hatchlings of sea turtle
1026923834,https://ak.picdn.net/shutterstock/videos/1026923834/preview/stock-footage-olaine-latvia-winter-to-spring-of-on-the-ice-in-the-city-sports-center-young-people-train.mp4,PT00H00M17S,182051_182100,"Olaine, latvia - winter to spring of 2019. on the ice in the city sports center, young people train in hockey"
12747071,https://ak.picdn.net/shutterstock/videos/12747071/preview/stock-footage-aerial-view-on-thai-traditional-boats-in-thailand-samui-island-clear-water-and-snorkling.mp4,PT00H00M17S,046301_046350,Aerial view on thai traditional boats in thailand. samui island. clear water and snorkling.
1017122779,https://ak.picdn.net/shutterstock/videos/1017122779/preview/stock-footage-blurred-motion-of-colored-lights-video-full-hd.mp4,PT00H00M22S,108201_108250,Blurred motion of colored lights video full hd
1025773586,https://ak.picdn.net/shutterstock/videos/1025773586/preview/stock-footage-soccer-ball-with-flag-turks-and-caicos-colors-rotates-on-transparent-background-d-rendering-k.mp4,PT00H00M10S,073651_073700,"Soccer ball with flag turks and caicos colors rotates on transparent background, 3d rendering, 4k prores footage with alpha channel, loop"
1038358778,https://ak.picdn.net/shutterstock/videos/1038358778/preview/stock-footage-kiev-city-capital-of-ukraine-landscape.mp4,PT00H00M15S,020201_020250,Kiev city capital of ukraine landscape
1030521485,https://ak.picdn.net/shutterstock/videos/1030521485/preview/stock-footage-brown-lizard-on-white-background-screen.mp4,PT00H00M19S,004251_004300,Brown lizard on white background screen
1042591060,https://ak.picdn.net/shutterstock/videos/1042591060/preview/stock-footage-toronto-ontario-canada-december-busy-shopping-mall-parking-lot-full-of-cars.mp4,PT00H00M29S,082751_082800,"Toronto, ontario, canada december 2019 busy shopping mall parking lot full of cars "
31361650,https://ak.picdn.net/shutterstock/videos/31361650/preview/stock-footage-solar-panel-in-the-mountains.mp4,PT00H00M08S,052751_052800,Solar panel in the mountains
1021217110,https://ak.picdn.net/shutterstock/videos/1021217110/preview/stock-footage-toronto-ontario-canada-december-driving-plate-of-toronto-city-streets-with-stores-shops-and.mp4,PT00H00M30S,076351_076400,"Toronto, ontario, canada december 2018 driving plate of toronto city streets with stores shops and people "
1038015176,https://ak.picdn.net/shutterstock/videos/1038015176/preview/stock-footage-asian-teacher-teaching-children-in-the-classroom-at-school-little-boy-and-girl-raise-hands.mp4,PT00H00M19S,028851_028900,"Asian teacher teaching children in the classroom at school. little boy and girl raise hands together for accepting comments. concept of education, experience learning and skill development."
1020181795,https://ak.picdn.net/shutterstock/videos/1020181795/preview/stock-footage-silhouette-of-a-loving-couple-of-people-looking-at-the-fireworks.mp4,PT00H00M10S,095601_095650,Silhouette of a loving couple of people looking at the fireworks
1054607393,https://ak.picdn.net/shutterstock/videos/1054607393/preview/stock-footage-fresh-cherry-tomatoes-drop-into-a-bowl-with-salad-fresh-vegetables-tomatoes-salad-lettuce.mp4,PT00H00M11S,069901_069950,"Fresh cherry tomatoes drop into a bowl with salad. fresh vegetables, tomatoes, salad, lettuce. healthy food. view of the camera from the bottom."
5357255,https://ak.picdn.net/shutterstock/videos/5357255/preview/stock-footage-teddy-bear-boy-and-his-father-drinking-tea-at-night-and-speaking-zoom-in-boy-s-face.mp4,PT00H00M19S,049451_049500,"Teddy bear boy and his father drinking tea at night and speaking, zoom in boyâ€™s face"
1015027759,https://ak.picdn.net/shutterstock/videos/1015027759/preview/stock-footage-supplements-poured-out-onto-counter.mp4,PT00H00M23S,068601_068650,Supplements poured out onto counter
1023500332,https://ak.picdn.net/shutterstock/videos/1023500332/preview/stock-footage-abstract-background-with-animation-moving-of-dark-triangles-with-glowing-dots-on-their-corner-as.mp4,PT00H00M20S,050401_050450,Abstract background with animation moving of dark triangles with glowing dots on their corner as vertex. technologic backdrop with plastic surface with neon particles. animation of seamless loop.
1060253693,https://ak.picdn.net/shutterstock/videos/1060253693/preview/stock-footage-close-up-of-man-s-hand-holding-a-smart-phone-with-vertical-green-mock-up-chroma-key-screen-and.mp4,PT00H00M19S,173551_173600,Close up of man's hand holding a smart phone with vertical green mock up chroma key screen and doing gestures on touchscreen 4k template
1023884206,https://ak.picdn.net/shutterstock/videos/1023884206/preview/stock-footage-waves-on-the-beach-windy-day-iztuzu-beach-for-turtle-eggs.mp4,PT00H00M10S,042451_042500,Waves on the beach windy day iztuzu beach for turtle eggs
1031626514,https://ak.picdn.net/shutterstock/videos/1031626514/preview/stock-footage-circa-s-airborne-firefighters-practice-let-down-rope-procedures-for-parachute-landing-on-an.mp4,PT00H01M05S,043151_043200,Circa 1940s - airborne firefighters practice let down rope procedures for parachute landing on an overhead cable.
1016448106,https://ak.picdn.net/shutterstock/videos/1016448106/preview/stock-footage-wetland-of-of-laguna-nimez-nature-reserve-el-calafate-santa-cruz-province-patagonia-argentina.mp4,PT00H00M30S,046301_046350,"Wetland of of  laguna nimez nature reserve. el calafate, santa cruz province, patagonia, argentina"
1019499736,https://ak.picdn.net/shutterstock/videos/1019499736/preview/stock-footage-meat-is-fried-on-a-frying-pan.mp4,PT00H00M11S,068251_068300,Meat is fried on a frying pan.
1031447498,https://ak.picdn.net/shutterstock/videos/1031447498/preview/stock-footage-leeds-yorkshire-england-june-today-leeds-has-become-the-largest-legal-and-financial.mp4,PT00H00M22S,125351_125400,"Leeds, yorkshire / england - june 01 2019:today, leeds has become the largest legal and financial centre, outside london. people and transport in the city uk 4k."
1053649463,https://ak.picdn.net/shutterstock/videos/1053649463/preview/stock-footage-lovely-couple-lying-on-bed-in-bedroom-with-cute-welsh-corgi-dog-holding-smartphone-watching-photo.mp4,PT00H00M16S,170551_170600,"Lovely couple lying on bed in bedroom with cute welsh corgi dog, holding smartphone, watching photo or video online together. concept stay at home, friendship with pet, spending time together."
14816839,https://ak.picdn.net/shutterstock/videos/14816839/preview/stock-footage-girl-holding-coffee-and-phone.mp4,PT00H00M09S,061601_061650,Girl holding coffee and phone
1031320874,https://ak.picdn.net/shutterstock/videos/1031320874/preview/stock-footage-rich-businessman-in-trendy-clothing-is-throwing-money-laughing-having-fun-in-office-room-enjoying.mp4,PT00H00M09S,053951_054000,"Rich businessman in trendy clothing is throwing money laughing having fun in office room enjoying profit sitting at desk. people, wealth and cash concept."
33232720,https://ak.picdn.net/shutterstock/videos/33232720/preview/stock-footage-japanese-women-laugh-and-enjoy-talking-together-in-a-small-local-cafe-this-set-has-shots-with-some.mp4,PT00H00M11S,127101_127150,"Japanese women laugh and enjoy talking together in a small local cafe. this set has shots with some still, moving and sliders."
1036520012,https://ak.picdn.net/shutterstock/videos/1036520012/preview/stock-footage-city-speedlights-zoom-effect-deformation-neon-light-background-visual-effects-k.mp4,PT00H00M15S,175201_175250,"City, speedlights zoom effect deformation, neon light background, visual effects 4k"
1033444919,https://ak.picdn.net/shutterstock/videos/1033444919/preview/stock-footage--high-in-the-mountains-melting-glacier-global-warming-spring-sun-in-the-camera-sun-glare.mp4,PT00H00M16S,106801_106850,"
high in the mountains, melting glacier, global warming, spring, sun in the camera, sun glare, warming"
1038359798,https://ak.picdn.net/shutterstock/videos/1038359798/preview/stock-footage-tropical-coral-reef-seascape-with-fishes-hard-and-soft-corals-underwater-video-camiguin.mp4,PT00H00M11S,069351_069400,"Tropical coral reef seascape with fishes, hard and soft corals. underwater video. camiguin, philippines. healthy coral reef with variety of fish and underwater wildlife."
1049033020,https://ak.picdn.net/shutterstock/videos/1049033020/preview/stock-footage-skyline-view-of-a-city.mp4,PT00H00M25S,121651_121700,Skyline view of a city
1036792535,https://ak.picdn.net/shutterstock/videos/1036792535/preview/stock-footage-yellow-clouds-against-a-bright-blue-sky-in-motion-faster-video-recording-of-atmospheric-phenomena.mp4,PT00H00M40S,054551_054600,Yellow clouds against a bright blue sky in motion. faster video recording of atmospheric phenomena on a wide-angle lens.
1026406502,https://ak.picdn.net/shutterstock/videos/1026406502/preview/stock-footage-belgium-bruges-october-close-up-view-of-a-windmill-blade.mp4,PT00H00M15S,117701_117750,"Belgium, bruges - october, 2016: close up view of a windmill blade"
4349900,https://ak.picdn.net/shutterstock/videos/4349900/preview/stock-footage-asian-woman-choosing-dumbbell-in-health-club.mp4,PT00H00M21S,077001_077050,Asian woman choosing dumbbell in health club 
27458026,https://ak.picdn.net/shutterstock/videos/27458026/preview/stock-footage-hanover-germany-april-a-huge-car-skeleton-being-carried-by-a-machine-of-a-company.mp4,PT00H00M24S,122001_122050,Hanover germany april 26 2017: a huge car skeleton being carried by a machine of a company showcasing their products in the tech bazaar
23915398,https://ak.picdn.net/shutterstock/videos/23915398/preview/stock-footage-fort-lauderdale-florida-june-th-boats-and-yachts-on-the-intracoastal-waterway-in-fort.mp4,PT00H00M12S,123101_123150,"Fort lauderdale, florida - june 12th: boats and yachts on the intracoastal waterway in fort lauderdale, florida on june 12th, 2016."
1045021774,https://ak.picdn.net/shutterstock/videos/1045021774/preview/stock-footage-portrait-of-the-caucasian-young-good-looking-woman-police-worker-rising-her-eyes-up-and-looking-at.mp4,PT00H00M13S,084301_084350,Portrait of the caucasian young good looking woman police worker rising her eyes up and looking at the camera. close up.
1030026485,https://ak.picdn.net/shutterstock/videos/1030026485/preview/stock-footage-young-woman-with-eyes-tired-from-long-work-at-computer-shows-various-eye-exercises-approved-by.mp4,PT00H00M10S,014101_014150,Young woman with eyes tired from long work at computer shows various eye exercises approved by doctor. gymnastics against strabismus. therapeutic restorative exercises. ophthalmic allowance
1015445830,https://ak.picdn.net/shutterstock/videos/1015445830/preview/stock-footage--west-island-montreal-time-lapse-looking-north-from-cap-st-jacques-nature-park-s-beach-during.mp4,PT00H00M40S,119451_119500,[west island montreal] time-lapse looking north from cap st-jacques nature park's beach during twilight
20032846,https://ak.picdn.net/shutterstock/videos/20032846/preview/stock-footage-san-francisco-california-july-panning-shot-of-the-boats-at-the-marina.mp4,PT00H00M11S,087401_087450,"San francisco, california - july, 2016 - panning shot of the boats at the marina."
27022732,https://ak.picdn.net/shutterstock/videos/27022732/preview/stock-footage-the-hands-of-a-man-drive-a-bicycle-behind-the-wheel-on-a-background-of-a-green-meadow-on-a-sunny.mp4,PT00H00M22S,073451_073500,"The hands of a man drive a bicycle behind the wheel. on a background of a green meadow on a sunny day. ectotourism, healthy and active way of life"
1010236985,https://ak.picdn.net/shutterstock/videos/1010236985/preview/stock-footage-kyiv-ukraine-february-professional-model-on-the-catwalk-model-catwalk-during-fashion.mp4,PT00H00M26S,076551_076600,"Kyiv, ukraine â€“ february 6, 2017. professional model on the catwalk.model. catwalk during fashion show. model on the catwalk. models. trend, style. fashion industry "
16529128,https://ak.picdn.net/shutterstock/videos/16529128/preview/stock-footage-boat-with-dog-approaching-shore-boat-floats-on-the-lake-in-the-spring-towards-the-sun-in-the-boat.mp4,PT00H00M15S,029451_029500,"Boat with dog approaching shore. boat floats on the lake in the spring towards the sun. in the boat sits a dog looking at the sun 
"
24596603,https://ak.picdn.net/shutterstock/videos/24596603/preview/stock-footage-woman-a-phone-in-hand.mp4,PT00H00M21S,013951_014000,Woman a phone in hand.
3896243,https://ak.picdn.net/shutterstock/videos/3896243/preview/stock-footage-underwater-shot-of-a-cute-little-baby-boy-at-the-swimming-pool-with-his-family.mp4,PT00H00M07S,101451_101500,Underwater shot of a cute little baby boy at the swimming pool with his family.
15921157,https://ak.picdn.net/shutterstock/videos/15921157/preview/stock-footage-croupier-and-player-at-poker-table.mp4,PT00H00M20S,088101_088150,Croupier and player at poker table
