videoid,contentUrl,duration,page_dir,name
21650236,https://ak.picdn.net/shutterstock/videos/21650236/preview/stock-footage-backgrounds-textures-computer-generated-golden.mp4,PT00H00M10S,120351_120400,Backgrounds textures computer generated golden
24099526,https://ak.picdn.net/shutterstock/videos/24099526/preview/stock-footage-man-lays-out-cards-for-card-trick.mp4,PT00H00M17S,012301_012350,Man lays out cards for card trick
1009574180,https://ak.picdn.net/shutterstock/videos/1009574180/preview/stock-footage-kyiv-ukraine-february-presentation-of-clothes-on-the-catwalk-during-a-fashion-show.mp4,PT00H00M58S,015001_015050,"Kyiv, ukraine â€“ february 6, 2017. . presentation of clothes on the catwalk during a fashion show. model. models. demonstration of clothes on the catwalk during a fashion show. fashion show in action. "
1054993217,https://ak.picdn.net/shutterstock/videos/1054993217/preview/stock-footage-grooming-salon-caring-for-a-little-friend-high-quality-k-footage.mp4,PT00H00M06S,071851_071900,Grooming salon. caring for a little friend. high quality 4k footage
31823098,https://ak.picdn.net/shutterstock/videos/31823098/preview/stock-footage-dove-eating-food-in-the-lead-cage.mp4,PT00H00M18S,085101_085150,Dove eating food in the lead cage.
1008813689,https://ak.picdn.net/shutterstock/videos/1008813689/preview/stock-footage-brunette-dancing-girl-with-bared-shoulders.mp4,PT00H00M46S,118801_118850,Brunette dancing girl with bared shoulders
1024916990,https://ak.picdn.net/shutterstock/videos/1024916990/preview/stock-footage-realistic-d-animated-earth-showing-the-borders-of-the-country-iceland-and-the-capital-reykjavik-in.mp4,PT00H00M30S,074051_074100,Realistic 3d animated earth showing the borders of the country iceland and the capital reykjavik in 4k resolution at night
1028940515,https://ak.picdn.net/shutterstock/videos/1028940515/preview/stock-footage-desert-in-egypt-panoramic-view-of-the-desert-with-mountains-and-rocks-in-egypt-landscape-view-on.mp4,PT00H00M12S,029401_029450,Desert in egypt. panoramic view of the desert with mountains and rocks in egypt. landscape view on rocks and sand in the sahara desert.
33285421,https://ak.picdn.net/shutterstock/videos/33285421/preview/stock-footage-close-up-of-the-hands-of-the-cook-who-cuts-pieces-of-pickled-meat-on-the-board.mp4,PT00H00M16S,014551_014600,Close-up of the hands of the cook who cuts pieces of pickled meat on the board
1016556622,https://ak.picdn.net/shutterstock/videos/1016556622/preview/stock-footage-aerial-view-the-tops-of-green-beautiful-forest-trees-and-a-railway-stretching-into-the-distance.mp4,PT00H00M37S,097651_097700,Aerial view - the tops of green beautiful forest trees and a railway stretching into the distance. concept of travel and a long road. 4k
1053826268,https://ak.picdn.net/shutterstock/videos/1053826268/preview/stock-footage-a-man-burns-garbage-in-a-metal-barrel-dry-grass-and-organic-waste-burn-and-smoke-autumn-work-in.mp4,PT00H00M22S,061501_061550,A man burns garbage in a metal barrel. dry grass and organic waste burn and smoke. autumn work in the garden.
13103468,https://ak.picdn.net/shutterstock/videos/13103468/preview/stock-footage-drizzling-juices-onto-a-hot-pork-roast.mp4,PT00H00M08S,012551_012600,"Drizzling juices onto a hot pork roast
"
25852214,https://ak.picdn.net/shutterstock/videos/25852214/preview/stock-footage-delicious-golden-pancakes-with-fresh-blackberries-and-blackberry-jam.mp4,PT00H00M38S,129251_129300,Delicious golden pancakes with fresh blackberries and blackberry jam.
12648893,https://ak.picdn.net/shutterstock/videos/12648893/preview/stock-footage-rhinoceros-often-abbreviated-as-rhino-is-a-group-of-five-extant-species-of-odd-toed-ungulates-in.mp4,PT00H00M11S,055351_055400,"Rhinoceros, often abbreviated as rhino, is a group of five extant species of odd-toed ungulates in the family rhinocerotidae."
19130569,https://ak.picdn.net/shutterstock/videos/19130569/preview/stock-footage--k-new-born-plain-tiger-butterfly-emerge-from-pupa-on-black-background.mp4,PT00H00M11S,012051_012100,4k new born plain tiger butterfly emerge from pupa on black background
1032341285,https://ak.picdn.net/shutterstock/videos/1032341285/preview/stock-footage-slow-motion-gimbal-shot-tracking-along-fence-at-mackerel-cove-rhode-island-usa.mp4,PT00H00M09S,067551_067600,"Slow motion gimbal shot tracking along fence at mackerel cove, rhode island, usa"
1035433970,https://ak.picdn.net/shutterstock/videos/1035433970/preview/stock-footage-aerial-drone-flight-video-of-forest-planetarium-landscape-somewhere-in-a-center-of-russia.mp4,PT00H00M43S,175051_175100,Aerial drone flight video of forest planetarium landscape somewhere in a center of russia. beautiful 4k video
16067437,https://ak.picdn.net/shutterstock/videos/16067437/preview/stock-footage-unrecognizable-man-working-from-home-writing-into-personal-organizer.mp4,PT00H00M19S,189751_189800,"Unrecognizable man working from home, writing into personal organizer"
16987984,https://ak.picdn.net/shutterstock/videos/16987984/preview/stock-footage-kuala-lumpur-malaysia-january-sunset-storm-sky-klcc-central-park-downtown-panorama-circa.mp4,PT00H00M12S,143051_143100,"Kuala lumpur, malaysia - january 2016: sunset storm sky klcc central park downtown panorama circa january 2016 kuala lumpur, malaysia."
1028793617,https://ak.picdn.net/shutterstock/videos/1028793617/preview/stock-footage-aerial-footage-of-g-tele-and-radio-telecommunications-tower-sunny-summer-tracking-up-over-tower.mp4,PT00H00M41S,115801_115850,"Aerial footage of 5g tele and radio telecommunications tower sunny summer tracking up over tower
"
1040818265,https://ak.picdn.net/shutterstock/videos/1040818265/preview/stock-footage-man-skipping-stones-into-ocean-on-tropical-island-beach.mp4,PT00H00M12S,123651_123700,Man skipping stones into ocean on tropical island beach
1030727510,https://ak.picdn.net/shutterstock/videos/1030727510/preview/stock-footage-green-curry-leaf-close-out.mp4,PT00H00M13S,058801_058850,Green curry leaf close out
1054661618,https://ak.picdn.net/shutterstock/videos/1054661618/preview/stock-footage-employees-of-a-restaurant-in-protective-masks-after-quarantine-interaction-with-restaurant-manager.mp4,PT00H00M09S,178551_178600,Employees of a restaurant in protective masks after quarantine. interaction with restaurant manager and his staff on the terrace
5330543,https://ak.picdn.net/shutterstock/videos/5330543/preview/stock-footage-donkey-eats-the-grass.mp4,PT00H00M14S,120401_120450,Donkey eats the grass
1050221071,https://ak.picdn.net/shutterstock/videos/1050221071/preview/stock-footage-the-child-eats-and-looks-at-the-tablet-little-girl-is-having-breakfast-the-kid-watches-cartoons.mp4,PT00H00M19S,174801_174850,The child eats and looks at the tablet. little girl is having breakfast. the kid watches cartoons while having breakfast
4618661,https://ak.picdn.net/shutterstock/videos/4618661/preview/stock-footage-a-woman-expresses-happiness-over-her-victory.mp4,PT00H00M27S,112101_112150,A woman expresses happiness over her victory
16462978,https://ak.picdn.net/shutterstock/videos/16462978/preview/stock-footage-eating-spaghetti-pasta-carbonara-with-twisting-fork-closeup-on-the-dish-in-retro-restaurant-full-hd.mp4,PT00H00M07S,039901_039950,"Eating spaghetti pasta carbonara with twisting fork closeup on the dish in retro restaurant full hd  
"
10848575,https://ak.picdn.net/shutterstock/videos/10848575/preview/stock-footage-beautiful-tower-of-church-saint-pierre-located-in-lower-normandy-city-of-caen-by-the-day-k.mp4,PT00H00M09S,013151_013200,Beautiful tower of church saint-pierre located in lower normandy city of caen by the day 4k 3840x2160 ultrahd footage - saint-pierre cathedral by the day slow tilt 4k 2160p uhd video
1016273365,https://ak.picdn.net/shutterstock/videos/1016273365/preview/stock-footage-iceland-summer-aerial-view-of-a-two-waterfalls.mp4,PT00H00M12S,122151_122200,"Iceland summer aerial view of a two waterfalls
"
34195528,https://ak.picdn.net/shutterstock/videos/34195528/preview/stock-footage-happy-crazy-man-shaking-snow-trees-in-winter-forest.mp4,PT00H00M11S,075051_075100,Happy crazy man shaking snow trees in winter forest
17626441,https://ak.picdn.net/shutterstock/videos/17626441/preview/stock-footage-vietnamese-flag-waving-in-the-wind.mp4,PT00H00M09S,064901_064950,Vietnamese flag waving in the wind
1034093333,https://ak.picdn.net/shutterstock/videos/1034093333/preview/stock-footage-drought-dry-field-land-with-poppy-leaves-papaver-poppyhead-drying-up-soil-cracked-drying-up-the.mp4,PT00H00M08S,188901_188950,"Drought dry field land with poppy leaves papaver poppyhead, drying up soil cracked, drying up the soil cracked, climate change, environmental disaster and earth cracks, death for plants"
1034098934,https://ak.picdn.net/shutterstock/videos/1034098934/preview/stock-footage--k-abstract-speed-motion-blur.mp4,PT00H00M20S,062301_062350,4k abstract speed motion blur. 
8697082,https://ak.picdn.net/shutterstock/videos/8697082/preview/stock-footage-praying-for-israel-concept.mp4,PT00H00M09S,065951_066000,Praying for israel concept
27551620,https://ak.picdn.net/shutterstock/videos/27551620/preview/stock-footage-time-lapse-of-mountains-around-grindelwald-area-wetterhorn-schreckhorn-bernese-alps-switzerland.mp4,PT00H00M37S,012901_012950,"Time lapse of mountains around grindelwald area, wetterhorn, schreckhorn.(bernese alps, switzerland). on the way to bachalpsee. jungfraujoch, first station, switzerland, europe.
"
1010956451,https://ak.picdn.net/shutterstock/videos/1010956451/preview/stock-footage-time-lapse-walkthrough-night-market-in-mong-kok-kowloon-hong-kong-circa-september.mp4,PT00H00M12S,110651_110700,Time lapse walkthrough - night market in mong kok kowloon hong kong - circa september 2017
1029171926,https://ak.picdn.net/shutterstock/videos/1029171926/preview/stock-footage-time-lapse-traffic-light-with-long-haul-cars-is-a-line-around-the-big-circle-wongwian-yai-bangkok.mp4,PT00H00M30S,076201_076250,"Time lapse traffic light with long haul cars is a line around the big circle. wongwian yai, bangkok, thailand"
14319586,https://ak.picdn.net/shutterstock/videos/14319586/preview/stock-footage-businesswomen-counts-money-in-hands.mp4,PT00H00M14S,140351_140400,Businesswomen counts money in hands.
27392827,https://ak.picdn.net/shutterstock/videos/27392827/preview/stock-footage-close-up-video-view-of-lilac-flowers-during-sunny-day-in-moscow-central-russia.mp4,PT00H00M15S,149051_149100,"Close up video view of lilac flowers during sunny day in moscow, central russia"
1046616172,https://ak.picdn.net/shutterstock/videos/1046616172/preview/stock-footage-modern-wallpaper-production-plant-conveyor-line-of-wallpaper-production-wallpaper-production-plant.mp4,PT00H00M10S,085801_085850,"Modern wallpaper production plant. conveyor line of wallpaper production, wallpaper production plant"
5695271,https://ak.picdn.net/shutterstock/videos/5695271/preview/stock-footage-skiers-going-up-to-the-mountain-by-ski-lift-beautiful-sunny-day-in-the-snowy-mountain.mp4,PT00H00M20S,069151_069200,Skiers going up to the mountain by ski lift.beautiful sunny day in the snowy mountain.
22296202,https://ak.picdn.net/shutterstock/videos/22296202/preview/stock-footage-fresh-ripe-juicy-cherries-rotate-red-cherry-clockwise-rotation.mp4,PT00H00M15S,024451_024500,"Fresh, ripe, juicy cherries rotate. red cherry clockwise rotation"
1057815943,https://ak.picdn.net/shutterstock/videos/1057815943/preview/stock-footage-thanksgiving-linear-baked-turkey-art-video-illustration.mp4,PT00H00M06S,048301_048350,"Thanksgiving linear baked turkey, art video illustration."
17833828,https://ak.picdn.net/shutterstock/videos/17833828/preview/stock-footage-cute-brunette-woman-take-selfie-photo-via-smart-phone-swaying-on-swing-in-park.mp4,PT00H00M12S,126551_126600,Cute brunette woman take selfie photo via smart phone swaying on swing in park
1026118,https://ak.picdn.net/shutterstock/videos/1026118/preview/stock-footage-fire-from-jet-blows-hot-air-balloon.mp4,PT00H00M13S,092501_092550,Fire from jet blows hot air balloon
2293211,https://ak.picdn.net/shutterstock/videos/2293211/preview/stock-footage-water-drop.mp4,PT00H00M21S,036501_036550,Water drop
1039531190,https://ak.picdn.net/shutterstock/videos/1039531190/preview/stock-footage-father-and-son-together-child-small-boy-taking-a-nap-with-dad-outdoors.mp4,PT00H00M39S,012501_012550,Father and son together child small boy taking a nap with dad outdoors
23845660,https://ak.picdn.net/shutterstock/videos/23845660/preview/stock-footage-technological-background-with-changing-symbols-of-binary-code-from-digits-and-technological.mp4,PT00H00M20S,141351_141400,Technological background with changing symbols of binary code from digits 1 and 0. technological symbol with glowing glass surface. seamless loop.
1028936915,https://ak.picdn.net/shutterstock/videos/1028936915/preview/stock-footage-perak-malaysia-may-car-technician-repairing-the-car-in-garage-at-car-service-center-in.mp4,PT00H00M09S,005601_005650,"Perak, malaysia, may 5 2019 - car technician repairing the car in garage at car service center in malaysia."
3389162,https://ak.picdn.net/shutterstock/videos/3389162/preview/stock-footage-african-american-businessman-holding-arms-out-wide-and-looking-upward.mp4,PT00H00M24S,065051_065100,African american businessman holding arms out wide and looking upward
14962546,https://ak.picdn.net/shutterstock/videos/14962546/preview/stock-footage-papaya-is-a-fruit-of-a-height-of-meters-are-native-to-central-america-was-introduced-into.mp4,PT00H00M15S,000751_000800,"Papaya is a fruit of a height of 5-10 meters, are native to central america. was introduced into south east asia, in the ayutthaya period. the raw green
"
5560352,https://ak.picdn.net/shutterstock/videos/5560352/preview/stock-footage-shipping-on-amazon-river-southamerica-peru.mp4,PT00H00M11S,059101_059150,"Shipping on amazon river, southamerica. peru"
12847985,https://ak.picdn.net/shutterstock/videos/12847985/preview/stock-footage-downtown-los-angeles-ca-usa-set-left-front-view-angle-car-travels-w-on-th-st-then.mp4,PT00H01M30S,191101_191150,"Downtown: los angeles, ca usa set #78 - left front 3/4 view angle: car travels w on 11th st., then makes a u-turn to travel e on 11th st., on a clear day in light traffic. shot on red dragon."
1051710217,https://ak.picdn.net/shutterstock/videos/1051710217/preview/stock-footage-hand-mixing-chocolate-in-large-metal-bowl-close-up.mp4,PT00H00M20S,011001_011050,Hand mixing chocolate in large metal bowl close up.
1052107420,https://ak.picdn.net/shutterstock/videos/1052107420/preview/stock-footage-blonde-beautiful-woman-putting-make-up-on-face-looking-at-the-mirror-smiling.mp4,PT00H00M08S,088251_088300,Blonde beautiful woman putting make up on face looking at the mirror smiling
6010616,https://ak.picdn.net/shutterstock/videos/6010616/preview/stock-footage-laser-explosions-in-blue.mp4,PT00H00M08S,039001_039050,Laser explosions in blue
2672639,https://ak.picdn.net/shutterstock/videos/2672639/preview/stock-footage-male-latin-american-hospital-consultant-discussing-future-business-plan-female-banking-official.mp4,PT00H00M16S,108651_108700,Male latin american hospital consultant discussing future business plan female banking official
3172942,https://ak.picdn.net/shutterstock/videos/3172942/preview/stock-footage-wide-and-long-english-beach-at-perranporth-in-england.mp4,PT00H00M13S,192801_192850,Wide and long english beach at perranporth in england.
1026664373,https://ak.picdn.net/shutterstock/videos/1026664373/preview/stock-footage-new-york-usa-march-woman-s-life-top-view-cosmetics-and-jewelry-on-table-decorative-day.mp4,PT00H00M09S,048651_048700,"New york, usa - march, 5, 2019: woman's life top view cosmetics and jewelry on table decorative day shadow brush colored table colorful fashion eyeshadow foundation accessory glamour make-up blogger"
4737767,https://ak.picdn.net/shutterstock/videos/4737767/preview/stock-footage-attractive-blonde-woman-in-white-dress-walking-through-olive-trees-plantation-and-taking-pictures.mp4,PT00H00M27S,085301_085350,Attractive blonde woman in white dress walking through olive trees plantation and taking pictures with an old camera. shot on steadicam.
1041081043,https://ak.picdn.net/shutterstock/videos/1041081043/preview/stock-footage-forest-fire-fire-destroys-trees-and-forest-animals-australia-fires-in-the-forests-of-the-amazon.mp4,PT00H00M14S,067151_067200,Forest fire. fire destroys trees and forest animals. australia. fires in the forests of the amazon and siberia. catastrophe. green lungs of the planet. destroyed flora and fauna. global warming.
1055583017,https://ak.picdn.net/shutterstock/videos/1055583017/preview/stock-footage-cinematic-aerial-shot-of-ancient-native-american-petroglyphs-in-eastern-sierra-california.mp4,PT00H00M53S,183901_183950,"Cinematic aerial shot of ancient native american petroglyphs in eastern sierra, california"
1009536857,https://ak.picdn.net/shutterstock/videos/1009536857/preview/stock-footage-news-studio-silhouette-of-a-man-and-a-digital-video-camera-in-front-of-a-green-screen-out-of-focus.mp4,PT00H00M11S,138801_138850,News studio. silhouette of a man and a digital video camera in front of a green screen.out of focus. 
1043517316,https://ak.picdn.net/shutterstock/videos/1043517316/preview/stock-footage-tokyo-japan-november-the-clear-water-on-the-canal-under-the-bridge-in-tokyo-japan-with-the.mp4,PT00H00M15S,080701_080750,Tokyo japan 2019 november 13: the clear water on the canal under the bridge in tokyo japan with the vine grasses on the side of the wall
15791347,https://ak.picdn.net/shutterstock/videos/15791347/preview/stock-footage-mosque-against-the-blue-sky-green-tree-near-the-mosque.mp4,PT00H00M10S,137751_137800,Mosque against the blue sky. green tree near the mosque. 
10878089,https://ak.picdn.net/shutterstock/videos/10878089/preview/stock-footage-minnesota-lake-during-sunset.mp4,PT00H00M53S,128751_128800,Minnesota lake during sunset 007
15080023,https://ak.picdn.net/shutterstock/videos/15080023/preview/stock-footage-bologna-italy-november-twins-towers-in-bologna.mp4,PT00H00M14S,147751_147800,"Bologna, italy - 22 november, 2015: twins towers in bologna."
21524,https://ak.picdn.net/shutterstock/videos/21524/preview/stock-footage-airplane.mp4,PT00H00M09S,179851_179900,Airplane
22800193,https://ak.picdn.net/shutterstock/videos/22800193/preview/stock-footage-delicious-juicy-pear-on-a-black-background.mp4,PT00H00M09S,113751_113800,Delicious juicy pear on a black background
16347880,https://ak.picdn.net/shutterstock/videos/16347880/preview/stock-footage-dancer-dancing-merrily-on-dance-floor-dress-gold-skirt-with-colorful-stage-light-cg.mp4,PT00H00M17S,061451_061500,Dancer dancing merrily on dance floor.dress&gold skirt with colorful stage light. cg_01116
28690450,https://ak.picdn.net/shutterstock/videos/28690450/preview/stock-footage--d-animation-rotation-of-symbol-of-sports-games-fitness-yoga-and-sport-inventory-from-glass.mp4,PT00H00M10S,004101_004150,"3d animation rotation of symbol of sports games, fitness, yoga and sport inventory from glass. animation of seamless loop."
1035409355,https://ak.picdn.net/shutterstock/videos/1035409355/preview/stock-footage-girl-tidying-up-her-bed-in-the-morning-playing-and-jumping-into-the-bed-too.mp4,PT00H00M32S,134601_134650,"Girl tidying up her bed in the morning, playing and jumping into the bed too"
13661393,https://ak.picdn.net/shutterstock/videos/13661393/preview/stock-footage-atlanta-sunset-time-lapse-december.mp4,PT00H00M27S,118201_118250,Atlanta sunset time lapse december 2015
1044604555,https://ak.picdn.net/shutterstock/videos/1044604555/preview/stock-footage-aerial-drone-shot-of-parc-natural-de-la-serra-gelada-beautiful-coastline-in-spain.mp4,PT00H00M24S,183601_183650,"Aerial drone shot of parc natural de la serra gelada, beautiful coastline in spain"
1048946674,https://ak.picdn.net/shutterstock/videos/1048946674/preview/stock-footage-excited-unknown-african-man-is-ready-for-holiday-he-is-pulling-his-suitcase-to-the-airport-k.mp4,PT00H00M29S,108851_108900,Excited unknown african man is ready for holiday. he is pulling his suitcase to the airport. 4k. rear view.
1012806023,https://ak.picdn.net/shutterstock/videos/1012806023/preview/stock-footage-rear-view-of-muscular-man-pulled-up-on-horizontal-bar-outdoors-at-sunny-day.mp4,PT00H00M25S,102501_102550,Rear view of muscular man pulled-up on horizontal bar outdoors at sunny day
23625580,https://ak.picdn.net/shutterstock/videos/23625580/preview/stock-footage-church-of-the-ascension-in-kolomenskoye.mp4,PT00H00M10S,080901_080950,Church of the ascension in kolomenskoye
1033585304,https://ak.picdn.net/shutterstock/videos/1033585304/preview/stock-footage-view-of-night-alleyway-traffic-sign-near-the-road-steel-fence-and-street-lights-in-city-in-summer.mp4,PT00H00M06S,088651_088700,"View of night alleyway, traffic sign near the road, steel fence and street lights in city in summer. stock footage. quiet night street without people and cars"
1011254183,https://ak.picdn.net/shutterstock/videos/1011254183/preview/stock-footage-the-white-domestic-cat-looks-over-with-his-hind-legs-and-looks-into-the-camera-close-up.mp4,PT00H00M08S,178251_178300,"The white domestic cat looks over with his hind legs and looks into the camera, close-up"
1017812719,https://ak.picdn.net/shutterstock/videos/1017812719/preview/stock-footage-time-lapse-motion-movement-with-white-fluffy-clouds-on-blue-sky.mp4,PT00H00M10S,181951_182000,"Time lapse, motion movement with white fluffy clouds on blue sky."
1036298606,https://ak.picdn.net/shutterstock/videos/1036298606/preview/stock-footage-reeds-on-the-edge-of-the-lake-are-moving-in-the-wind.mp4,PT00H00M10S,048001_048050,Reeds on the edge of the lake are moving in the wind
24544304,https://ak.picdn.net/shutterstock/videos/24544304/preview/stock-footage--k-epic-aerial-flight-through-the-clouds-to-the-snowy-mountain-peaks-at-dusk.mp4,PT00H00M29S,127001_127050,4k epic aerial flight through the clouds to the snowy mountain peaks at dusk
21561466,https://ak.picdn.net/shutterstock/videos/21561466/preview/stock-footage-young-hacker-hooded-lights-a-cigarette-while-violating-a-computer.mp4,PT00H00M29S,114051_114100,Young hacker hooded lights a cigarette while violating a computer
13605767,https://ak.picdn.net/shutterstock/videos/13605767/preview/stock-footage-high-bean-legume-plants-bush-in-rural-village-house-yard-senior-woman-working-in-garden-greenhouse.mp4,PT00H00M08S,085401_085450,High bean legume plants bush in rural village house yard. senior woman working in garden greenhouse. static shot. 4k
21970144,https://ak.picdn.net/shutterstock/videos/21970144/preview/stock-footage-london-united-kingdom-january-trafalgar-square-fountain-at-evening-with-pedestrians.mp4,PT00H00M30S,083301_083350,"London, united kingdom - january 27, 2013: trafalgar square fountain at evening with pedestrians and traffic in london, uk."
7063462,https://ak.picdn.net/shutterstock/videos/7063462/preview/stock-footage-beautiful-beach-in-okinawa.mp4,PT00H00M13S,192101_192150,Beautiful beach in okinawa	
1025953433,https://ak.picdn.net/shutterstock/videos/1025953433/preview/stock-footage-saint-petersburg-russia-december-living-sculpture-performer-on-the-streets-of-st.mp4,PT00H00M30S,090801_090850,"Saint petersburg, russia, december 7, 2016: living sculpture performer on the streets of st. petersburg, russia."
3589094,https://ak.picdn.net/shutterstock/videos/3589094/preview/stock-footage-a-man-and-his-elephant.mp4,PT00H00M11S,080201_080250,A man and his elephant 
10845602,https://ak.picdn.net/shutterstock/videos/10845602/preview/stock-footage-a-couple-taking-selfies-in-front-of-a-ferris-wheel.mp4,PT00H00M21S,010401_010450,A couple taking selfies in front of a ferris wheel
23558245,https://ak.picdn.net/shutterstock/videos/23558245/preview/stock-footage-antarctica-king-penguins.mp4,PT00H00M05S,131251_131300,Antarctica king penguins
1010687297,https://ak.picdn.net/shutterstock/videos/1010687297/preview/stock-footage-slow-motion-of-white-birds-egretta-garzetta-nesting-in-spring-an-adult-little-egret-take-care-the.mp4,PT00H00M30S,017251_017300,Slow motion of white birds egretta garzetta nesting in spring. an adult little egret take care the nest with blue eggs on tree of the lake at daan forest park in taipei city. taiwan-dan
1025679524,https://ak.picdn.net/shutterstock/videos/1025679524/preview/stock-footage-seamlessly-rotating-a-metallic-gray-mineral-hematite-in-front-of-black-background.mp4,PT00H00M34S,091801_091850,Seamlessly rotating a metallic-gray mineral (hematite) in front of black background
1021347262,https://ak.picdn.net/shutterstock/videos/1021347262/preview/stock-footage-jet-of-dark-milk-chocolate-in-chocolate-tempering-machine-close-up-view.mp4,PT00H00M12S,020351_020400,Jet of dark milk chocolate in chocolate tempering machine. close-up view.
1022048932,https://ak.picdn.net/shutterstock/videos/1022048932/preview/stock-footage-various-molds-being-heated-in-workshop-fire-flame-on-molds.mp4,PT00H00M08S,043501_043550,Various molds being heated in workshop. fire flame on molds
1009095389,https://ak.picdn.net/shutterstock/videos/1009095389/preview/stock-footage-tool-for-replacing-glass-on-mobile-phones-and-tablets-oven-for-steaming-glass-with-gadgets-oven.mp4,PT00H00M13S,037351_037400,Tool for replacing glass on mobile phones and tablets. oven for steaming glass with gadgets. oven for smartphones. the iron round door opens and closes with a male hand. buttons and sensors on the box
18340249,https://ak.picdn.net/shutterstock/videos/18340249/preview/stock-footage-young-boy-reading-book-on-sofa-child-reading-book-kid-doing-homework.mp4,PT00H00M07S,117751_117800,Young boy reading book on sofa. child reading book. kid doing homework
20110036,https://ak.picdn.net/shutterstock/videos/20110036/preview/stock-footage-man-buying-fastfood-at-fast-food-restaurant.mp4,PT00H00M11S,023001_023050,Man buying fastfood at fast-food restaurant
