videoid,contentUrl,duration,page_dir,name
5010329,https://ak.picdn.net/shutterstock/videos/5010329/preview/stock-footage-alicante-spain-aerial-view-from-castle-santa-barbara.mp4,PT00H00M14S,035451_035500,Alicante spain aerial view from castle santa barbara
1043091121,https://ak.picdn.net/shutterstock/videos/1043091121/preview/stock-footage-florida-wilderness-drone-aerial-flying-over-a-river-and-palm-trees-on-the-land-near-the-water-in.mp4,PT00H00M11S,041451_041500,Florida wilderness drone - aerial flying over a river and palm trees on the land near the water in the middle of nowhere in the everglades swamp in summer. no man-made objects visible.
1064439865,https://ak.picdn.net/shutterstock/videos/1064439865/preview/stock-footage-beautiful-girl-walking-along-the-beach-aerial-footage-from-florian-polis-santa-catarina-brazil.mp4,PT00H00M12S,112401_112450,"Beautiful girl walking along the beach, aerial footage from florianÃ³polis santa catarina brazil"
4294169,https://ak.picdn.net/shutterstock/videos/4294169/preview/stock-footage-palms-at-sunset.mp4,PT00H00M10S,142651_142700,Palms at sunset
1055458202,https://ak.picdn.net/shutterstock/videos/1055458202/preview/stock-footage-many-black-and-white-cows-stand-side-by-side-in-a-cowshed-and-eat-feed.mp4,PT00H00M23S,113451_113500,Many black and white cows stand side by side in a cowshed and eat feed
2774816,https://ak.picdn.net/shutterstock/videos/2774816/preview/stock-footage-corals-and-clownfishes-in-the-red-sea.mp4,PT00H00M31S,179051_179100,Corals and clownfishes in the red sea
1052603870,https://ak.picdn.net/shutterstock/videos/1052603870/preview/stock-footage-applying-whipped-cream-to-pavlova-cake.mp4,PT00H00M25S,060051_060100,"Applying whipped cream to pavlova, cake"
1039249535,https://ak.picdn.net/shutterstock/videos/1039249535/preview/stock-footage-golden-autumn-kiev-cityscape-aerial-drone-view-of-city-skyline-and-forest-with-yellow-trees-and.mp4,PT00H00M10S,185451_185500,"Golden autumn kiev cityscape, aerial drone view of city skyline and forest with yellow trees and beautiful landscape from above"
1021023865,https://ak.picdn.net/shutterstock/videos/1021023865/preview/stock-footage-close-up-of-female-hands-are-cutting-a-knife-with-lemons-into-pieces-and-squeezing-for-making-tea.mp4,PT00H00M10S,007301_007350,Close-up of female hands are cutting a knife with lemons into pieces and squeezing for making tea on a wooden table of home cooking. home cooking tea
1010830058,https://ak.picdn.net/shutterstock/videos/1010830058/preview/stock-footage-jerusalem-israel-may-stabilized-shot-of-people-in-jerusalems-mahane-yehuda-market.mp4,PT00H00M17S,044301_044350,"Jerusalem, israel - may 7, 2018 : stabilized shot of people in jerusalems mahane yehuda market, popular with locals and tourists alike, the market's more than 300 shops. "
29747932,https://ak.picdn.net/shutterstock/videos/29747932/preview/stock-footage-aerial-view-of-auckland-city-skyline-and-harbour-port-with-cruise-chips-docked-new-zealand.mp4,PT00H00M17S,075801_075850,"Aerial view of auckland city skyline and harbour port with cruise chips docked, new zealand. 21 february 2017"
1063420501,https://ak.picdn.net/shutterstock/videos/1063420501/preview/stock-footage-animation-of-globe-of-network-of-connections-and-data-processing-against-team-of-medical.mp4,PT00H00M12S,075201_075250,Animation of globe of network of connections and data processing against team of medical professionals using tablet in corridor of hospital. medicine research science and global networking concept
24462830,https://ak.picdn.net/shutterstock/videos/24462830/preview/stock-footage-madrid-spain-september-timelapse-view-of-the-sunset-in-the-street-on-september-in.mp4,PT00H00M12S,135351_135400,"Madrid, spain - september 9: timelapse view of the sunset in the street on september 9, 2015 in madrid, spain.
"
1029621380,https://ak.picdn.net/shutterstock/videos/1029621380/preview/stock-footage-glasses-with-rose-wine-in-woman-s-and-man-s-hands-wine-glasses-with-red-wine-against-white.mp4,PT00H00M06S,172451_172500,Glasses with rose wine in woman's and man's hands. wine glasses with red wine against white background. cheers
1014443717,https://ak.picdn.net/shutterstock/videos/1014443717/preview/stock-footage-close-up-of-asian-tourist-couple-having-an-intimate-real-moment-on-tour-longtail-boat-with-heart.mp4,PT00H00M11S,074501_074550,"Close up of asian tourist couple having an intimate real moment on tour, longtail boat with heart shaped hands on the chao phraya river water way in bangkok, thailand. slow motion"
1062524365,https://ak.picdn.net/shutterstock/videos/1062524365/preview/stock-footage-rainfall-over-palm-trees-red-flowers-sea-and-mountain-on-a-tropical-island-slow-motion-video.mp4,PT00H00M59S,060851_060900,"Rainfall over palm trees, red flowers, sea and mountain on a tropical island. slow motion video."
1049521216,https://ak.picdn.net/shutterstock/videos/1049521216/preview/stock-footage-sa-pa-vietnam-circa-lake-vietnam-cloudy-sunrise-time-lapse.mp4,PT00H00M12S,145901_145950,"Sa pa, vietnam - circa 2020: lake vietnam cloudy sunrise time lapse"
1012598576,https://ak.picdn.net/shutterstock/videos/1012598576/preview/stock-footage-desert-near-dead-sea-aerial-footage-k-ungraded-flat.mp4,PT00H00M18S,038151_038200,Desert near dead sea aerial footage 4k ungraded flat
1024840592,https://ak.picdn.net/shutterstock/videos/1024840592/preview/stock-footage-cheery-portrait-of-a-slender-blond-woman-in-a-khaki-jacket-smiling-and-standing-in-a-nice-alley-on.mp4,PT00H00M23S,087301_087350,Cheery portrait of a slender blond woman in a khaki jacket smiling and standing in a nice alley on a sunny day in winter in slow motion
34310686,https://ak.picdn.net/shutterstock/videos/34310686/preview/stock-footage-aerial-view-drone-tropical-water-beach-sea-ocean-japan.mp4,PT00H00M17S,113101_113150,"Aerial view / drone tropical water beach, sea, ocean, japan"
1039709801,https://ak.picdn.net/shutterstock/videos/1039709801/preview/stock-footage-particular-abstract-animation-on-dark-background-technology-concept-animation.mp4,PT00H00M12S,078801_078850,"Particular abstract animation on dark background, technology concept animation"
1033797527,https://ak.picdn.net/shutterstock/videos/1033797527/preview/stock-footage-beautiful-view-of-the-medieval-gothic-church-in-the-city-of-merano-in-italy-medieval-architecture.mp4,PT00H00M14S,007951_008000,Beautiful view of the medieval gothic church in the city of merano in italy. medieval architecture. red green blue. italian mountain villages. atmosphere. slow motion
1047308455,https://ak.picdn.net/shutterstock/videos/1047308455/preview/stock-footage-outdoors-cute-girls-clink-glasses-with-cool-alcoholic-cocktails-slow-motion-summer-urban-cocktail.mp4,PT00H00M08S,077751_077800,"Outdoors, cute girls clink glasses with cool alcoholic cocktails. slow motion, summer urban cocktail"
1009425029,https://ak.picdn.net/shutterstock/videos/1009425029/preview/stock-footage-circa-the-saturn-is-recovered-from-its-ocean-landing-and-brought-aboard-an-aircraft.mp4,PT00H00M45S,176701_176750,Circa 1968 - the saturn 6 is recovered from its ocean landing and brought aboard an aircraft carrier.
1054879031,https://ak.picdn.net/shutterstock/videos/1054879031/preview/stock-footage-little-jellyfish-swims-in-the-blue-water-close-up-underwater-shot-pink-jellyfish-mauve-stinger.mp4,PT00H00M13S,170801_170850,"Little jellyfish swims in the blue water. close-up, underwater shot. pink jellyfish, mauve stinger or purple-striped jelly (pelagia noctiluca). mediterranean sea, europe."
1043750350,https://ak.picdn.net/shutterstock/videos/1043750350/preview/stock-footage-preparing-homemade-chocolate-fat-bombs.mp4,PT00H00M27S,034151_034200,Preparing homemade chocolate fat bombs
23503453,https://ak.picdn.net/shutterstock/videos/23503453/preview/stock-footage-machine-for-packaging-products-in-foil.mp4,PT00H00M17S,052401_052450,Machine for packaging products in foil 
17915986,https://ak.picdn.net/shutterstock/videos/17915986/preview/stock-footage-sea-waves-yellow-sand-sunny-day.mp4,PT00H00M10S,184551_184600,"Sea waves, yellow sand, sunny day"
1035756017,https://ak.picdn.net/shutterstock/videos/1035756017/preview/stock-footage-kyiv-ukraine-aerial-view-of-boats-from-water-at-kyiv-river-port.mp4,PT00H00M17S,067501_067550,Kyiv / ukraine - 06 19 2019: aerial view of boats from water at kyiv river port
7592767,https://ak.picdn.net/shutterstock/videos/7592767/preview/stock-footage-sailing-boats-and-yachts-in-sunny-marina-croatia-europe-beautiful-tourist-place-for-holidays.mp4,PT00H00M15S,046601_046650,"Sailing boats and yachts in sunny marina. croatia, europe. beautiful tourist place for holidays."
12503492,https://ak.picdn.net/shutterstock/videos/12503492/preview/stock-footage-details-of-natural-outdoor-butterfly.mp4,PT00H00M23S,020351_020400,Details of natural outdoor butterfly
31877194,https://ak.picdn.net/shutterstock/videos/31877194/preview/stock-footage-stained-in-a-dark-evening-lights-river-hangang-city-of-seoul-korea.mp4,PT00H00M16S,000351_000400,"Stained in a dark evening lights river, hangang , city of seoul, korea"
1018463785,https://ak.picdn.net/shutterstock/videos/1018463785/preview/stock-footage--k-time-lap-of-cloud-is-moving-at-daytime.mp4,PT00H00M20S,143751_143800,4k time lap of cloud is moving at daytime
1013140973,https://ak.picdn.net/shutterstock/videos/1013140973/preview/stock-footage-spiritual-experience-of-self-awareness-and-consciousness-through-meditation-in-an-abstracted.mp4,PT00H00M10S,077451_077500,Spiritual experience of self awareness and consciousness through meditation in an abstracted crystal ball in a dark background
1037230502,https://ak.picdn.net/shutterstock/videos/1037230502/preview/stock-footage-aerial-view-k-of-borobudur-temple-in-a-misty-surreal-morning.mp4,PT00H00M42S,058501_058550,Aerial view 4k of borobudur temple in a misty surreal morning 
20326672,https://ak.picdn.net/shutterstock/videos/20326672/preview/stock-footage-violent-ocean-storm-at-night-crashes-to-beach.mp4,PT00H00M19S,190351_190400,Violent ocean storm at night crashes to beach
1062219160,https://ak.picdn.net/shutterstock/videos/1062219160/preview/stock-footage-portrait-of-laughing-worker-in-a-helmet-with-a-chainsaw-in-the-forest.mp4,PT00H00M20S,187701_187750,Portrait of laughing worker in a helmet with a chainsaw in the forest
1008333577,https://ak.picdn.net/shutterstock/videos/1008333577/preview/stock-footage-happy-caucasian-businessman-sitting-smiling-talking-on-smartphone-with-partner-and-writing-down.mp4,PT00H00M18S,098051_098100,"Happy caucasian businessman sitting, smiling, talking on smartphone with partner and writing down information in notepad while looking at laptop in cafe"
8672872,https://ak.picdn.net/shutterstock/videos/8672872/preview/stock-footage-panorama-of-a-thermal-power-plant-from-a-great-height.mp4,PT00H00M16S,072551_072600,Panorama of a thermal power plant from a great height. 
26715559,https://ak.picdn.net/shutterstock/videos/26715559/preview/stock-footage-sierra-winter-sunrise-the-sun-rises-on-the-clouds-above-a-cold-snowy-sierra-nevada-mountain-ridge.mp4,PT00H00M07S,102051_102100,Sierra winter sunrise - the sun rises on the clouds above a cold snowy sierra nevada mountain ridge.
1066659172,https://ak.picdn.net/shutterstock/videos/1066659172/preview/stock-footage-tired-woman-crying-near-vacuum-cleaner.mp4,PT00H00M13S,000051_000100,Tired woman crying near vacuum cleaner
24563921,https://ak.picdn.net/shutterstock/videos/24563921/preview/stock-footage-flying-above-town-of-livigno-alps-ski-resort-in-winter-lombardy-italy.mp4,PT00H00M22S,048951_049000,"Flying above town of livigno, alps ski resort in winter, lombardy, italy"
9645062,https://ak.picdn.net/shutterstock/videos/9645062/preview/stock-footage-belarus-minsk-april-children-s-choir-concert-in-the-belarusian-philharmonic.mp4,PT00H00M23S,095551_095600,"Belarus, minsk - 8 april, 2015: children's choir concert in the belarusian philharmonic."
1006794136,https://ak.picdn.net/shutterstock/videos/1006794136/preview/stock-footage-rome-italy-october-aerial-shot-over-vatican-city-at-sunset-with-st-peter-s-basilica-and.mp4,PT00H00M23S,027351_027400,"Rome, italy â€“ october 2015 : aerial shot over vatican city at sunset with st peter's basilica and central rome cityscape in view"
1066286026,https://ak.picdn.net/shutterstock/videos/1066286026/preview/stock-footage-hyper-lapse-k-amazing-rainbow-after-the-rain-over-the-forest-clouds-time-lapse-mountain.mp4,PT00H00M10S,179201_179250,"Hyper lapse 4k amazing rainbow after the rain over the forest. clouds time lapse. mountain landscape, rainbow in the mountains and dramatic clouds."
16696360,https://ak.picdn.net/shutterstock/videos/16696360/preview/stock-footage-rotating-green-pannacotta-dessert-with-strawberry-k-macro-video.mp4,PT00H00M09S,026401_026450,Rotating green pannacotta dessert with strawberry 4k macro video
14112491,https://ak.picdn.net/shutterstock/videos/14112491/preview/stock-footage-red-growing-d-numbers-counting-up-to-including-luma-matte.mp4,PT00H00M30S,149301_149350,"Red growing 3d numbers, counting up to 54% including luma matte"
11065097,https://ak.picdn.net/shutterstock/videos/11065097/preview/stock-footage-the-wood-in-mountains.mp4,PT00H00M38S,188601_188650,The wood in mountains
1033851368,https://ak.picdn.net/shutterstock/videos/1033851368/preview/stock-footage-two-black-dice-bounce-and-rebound-in-slow-motion-on-a-white-background-before-resting-at-the.mp4,PT00H00M13S,190001_190050,"Two black dice bounce and rebound in slow motion on a white background before resting at the numbers three and six, a total of nine."
1033361462,https://ak.picdn.net/shutterstock/videos/1033361462/preview/stock-footage-gomel-belarus-clouds-float-over-the-lake-in-the-evening.mp4,PT00H00M11S,068751_068800,"Gomel, belarus clouds float over the lake in the evening"
1049028967,https://ak.picdn.net/shutterstock/videos/1049028967/preview/stock-footage-circa-a-blind-machinist-is-taught-to-oil-the-drill-in-his-press.mp4,PT00H00M57S,186951_187000,Circa 1944 - a blind machinist is taught to oil the drill in his press.
7278151,https://ak.picdn.net/shutterstock/videos/7278151/preview/stock-footage-bangladesh-aug-man-collecting-crops.mp4,PT00H00M29S,102001_102050,Bangladesh - aug 2010: man collecting crops
18154309,https://ak.picdn.net/shutterstock/videos/18154309/preview/stock-footage-crazy-horse-mountain-memorial-south-dakota-indian.mp4,PT00H00M25S,095101_095150,Crazy horse mountain memorial south dakota indian
1032267770,https://ak.picdn.net/shutterstock/videos/1032267770/preview/stock-footage-drone-shot-slowly-flying-over-train-tracks-towards-a-city-skyline-during-a-winter-day.mp4,PT00H00M37S,195551_195600,Drone shot slowly flying over train tracks towards a city skyline during a winter day.
21142225,https://ak.picdn.net/shutterstock/videos/21142225/preview/stock-footage-drinking-a-hot-cup-of-coffee-in-a-winter-mug-covered-in-red-woolen-fabric-and-steam-on-a-wooden.mp4,PT00H00M16S,024701_024750,Drinking a hot cup of coffee in a winter mug covered in red woolen fabric and steam on a wooden table close to a fireplace and a holly.
1059562571,https://ak.picdn.net/shutterstock/videos/1059562571/preview/stock-footage-a-winter-brook-slowly-flowing-among-the-snow.mp4,PT00H00M21S,038551_038600,A winter brook slowly flowing among the snow
1051760473,https://ak.picdn.net/shutterstock/videos/1051760473/preview/stock-footage-group-of-african-buffalo-standing-on-the-grass-field-while-eating-grass-during-a-windy-day-wide-shot.mp4,PT00H00M13S,183951_184000,Group of african buffalo standing on the grass field while eating grass during a windy day wide shot
26942914,https://ak.picdn.net/shutterstock/videos/26942914/preview/stock-footage--k-asian-spectator-using-smartphone-for-take-a-video-with-camera-phone-of-the-dancing-dragon-in.mp4,PT00H00M17S,048701_048750,4k asian spectator using smartphone for take a video with camera phone of the dancing dragon in chinese new year celebration at miaoli. festival of hakka dragon bombing dance in taiwan-dan
10869602,https://ak.picdn.net/shutterstock/videos/10869602/preview/stock-footage-against-the-backdrop-of-smoke-rail-cars-and-destroyed-building-at-the-metallurgical-plant.mp4,PT00H00M17S,010401_010450,Against the backdrop of smoke rail cars and destroyed building at the metallurgical plant
1043839159,https://ak.picdn.net/shutterstock/videos/1043839159/preview/stock-footage-rapid-color-changing-abstract-fractal-video-with-interconnected-stars-space-flowers-with-intricate.mp4,PT00H00M07S,071501_071550,"Rapid color changing abstract fractal video with interconnected stars, space flowers with intricate decorative geometric pattern surrounding and connecting them in bright vivid colors,4k,4096p,25fps"
1028600108,https://ak.picdn.net/shutterstock/videos/1028600108/preview/stock-footage-autumn-trees-line-path-in-beautiful-park-lots-of-colorful-leaves-are-falling-in-fall-autumn-and.mp4,PT00H00M16S,130201_130250,"Autumn trees line path in beautiful park , lots of colorful leaves are falling in fall, autumn and fall background, fresh forest and natural environment."
9822536,https://ak.picdn.net/shutterstock/videos/9822536/preview/stock-footage-asian-kids-thai-girl-eat-apple.mp4,PT00H00M38S,144101_144150,Asian kids - thai girl eat apple
4279523,https://ak.picdn.net/shutterstock/videos/4279523/preview/stock-footage-sailboat-sailing-bc.mp4,PT00H00M20S,059401_059450,Sailboat sailing bc
1037871500,https://ak.picdn.net/shutterstock/videos/1037871500/preview/stock-footage-tilt-up-shot-of-a-small-monastery-on-top-of-a-hill-k-video.mp4,PT00H00M06S,143601_143650,Tilt up shot of a small monastery on top of a hill 4k video
1037677283,https://ak.picdn.net/shutterstock/videos/1037677283/preview/stock-footage-aerial-drone-video-of-famous-full-working-plant-and-oil-refinery-in-corinth-area-greece.mp4,PT00H00M10S,170201_170250,"Aerial drone video of famous full working plant and oil refinery in corinth area, greece"
1007655148,https://ak.picdn.net/shutterstock/videos/1007655148/preview/stock-footage-nashville-tennessee-united-states-of-america-august-tourism-swells-as-visitors-from.mp4,PT00H00M14S,040801_040850,"Nashville, tennessee, united states of america - august 2017 - tourism swells as visitors from across the country flock to visit country music's home town to see the full eclipse"
1044426904,https://ak.picdn.net/shutterstock/videos/1044426904/preview/stock-footage-boiling-and-cooking-artichokes-in-saucepan-closeup-in-kitchen.mp4,PT00H00M21S,075251_075300,"Boiling and cooking artichokes in saucepan, closeup in kitchen"
1010552360,https://ak.picdn.net/shutterstock/videos/1010552360/preview/stock-footage-christmas-digital-glitter-sparks-golden-particles-bokeh-flowing-on-gold-background-holiday-xmas.mp4,PT00H00M20S,002001_002050,"Christmas digital glitter sparks golden particles bokeh flowing on gold background, holiday xmas festive happy new year event"
1028618978,https://ak.picdn.net/shutterstock/videos/1028618978/preview/stock-footage-aerial-view-of-a-lot-of-gas-ship-lpg-ship-at-the-sun-set.mp4,PT00H00M18S,124001_124050,Aerial view of a lot of gas ship lpg ship at the sun set.
19006471,https://ak.picdn.net/shutterstock/videos/19006471/preview/stock-footage-bee-collects-nectar-on-the-flowers-dianthus-superbus.mp4,PT00H00M11S,136151_136200,Bee collects nectar on the flowers dianthus superbus
66238,https://ak.picdn.net/shutterstock/videos/66238/preview/stock-footage-muslims-pray.mp4,PT00H00M06S,189151_189200,Muslims pray
1017724174,https://ak.picdn.net/shutterstock/videos/1017724174/preview/stock-footage-moody-child-does-not-want-to-eat-the-child-refuses-to-eat.mp4,PT00H00M18S,050901_050950,Moody child does not want to eat. the child refuses to eat.
20339449,https://ak.picdn.net/shutterstock/videos/20339449/preview/stock-footage-father-playing-with-his-daughter-in-the-autumn-park-however-they-smile-and-laugh-dad-throws.mp4,PT00H00M28S,126051_126100,"Father playing with his daughter in the autumn park. however, they smile and laugh. dad throws leaves on the head of a teenager."
1027838012,https://ak.picdn.net/shutterstock/videos/1027838012/preview/stock-footage-from-the-glitch-effect-arises-text-entry-then-the-tv-turns-off-alpha-channel-premultiplied.mp4,PT00H00M10S,127351_127400,From the glitch effect arises text entry. then the tv turns off. alpha channel premultiplied - matted with color black
27287998,https://ak.picdn.net/shutterstock/videos/27287998/preview/stock-footage-tailor-at-work-dynamic-camera-medium-shot.mp4,PT00H00M11S,034701_034750,Tailor at work dynamic camera medium shot
1058896868,https://ak.picdn.net/shutterstock/videos/1058896868/preview/stock-footage-ceiling-lights-lamps-animated-cartoon-icon-on-green-screen-background-three-home-lamps-on.mp4,PT00H00M10S,079351_079400,Ceiling lights - lamps animated cartoon icon on green screen background - three home lamps  on chroma key background
1007829601,https://ak.picdn.net/shutterstock/videos/1007829601/preview/stock-footage-teacher-tells-the-basics-of-science-in-the-class-of-biology-students-carefully-listen-to-the.mp4,PT00H00M33S,030151_030200,Teacher tells the basics of science in the class of biology. students carefully listen to the teacher
1006895269,https://ak.picdn.net/shutterstock/videos/1006895269/preview/stock-footage-construction-of-a-modern-factory-or-plant-industrial-area-in-winter-panoramic-view-from-the-air.mp4,PT00H00M14S,012401_012450,"Construction of a modern factory or plant, industrial area in winter, panoramic view from the air, modern plant on the snow-covered field, the structural steel structure of a new commercial building"
14141468,https://ak.picdn.net/shutterstock/videos/14141468/preview/stock-footage-raw-liver-in-the-white-plate-on-the-table-close-up.mp4,PT00H00M09S,075101_075150,Raw liver in the white plate on the table. close-up
1376593,https://ak.picdn.net/shutterstock/videos/1376593/preview/stock-footage-sunset-in-the-city.mp4,PT00H00M20S,068701_068750,Sunset in the city
1061969389,https://ak.picdn.net/shutterstock/videos/1061969389/preview/stock-footage-senior-lady-using-her-laptop-computer-for-video-chatting-mature-woman-talking-with-employees-or.mp4,PT00H00M13S,100051_100100,Senior lady using her laptop computer for video chatting. mature woman talking with employees or students during video conference 4k footage
32615593,https://ak.picdn.net/shutterstock/videos/32615593/preview/stock-footage-carefree-adult-cycling-road-bike-in-nature-at-sunset-with-lens-flare-young-man-spending-holidays.mp4,PT00H00M08S,089701_089750,Carefree adult cycling road bike in nature at sunset with lens flare. young man spending holidays in the countryside enjoying freedom and healthy lifestyle.
1016742439,https://ak.picdn.net/shutterstock/videos/1016742439/preview/stock-footage-japan-flag-waving-on-a-high-quality-blue-sky-d-rendering.mp4,PT00H00M20S,119351_119400,"Japan flag waving on a high quality blue sky, 3d rendering"
1039379387,https://ak.picdn.net/shutterstock/videos/1039379387/preview/stock-footage--k-video-of-aerial-view-of-caribbean-sea.mp4,PT00H00M15S,089301_089350,4k video of aerial view of caribbean sea
3370637,https://ak.picdn.net/shutterstock/videos/3370637/preview/stock-footage-snow-falling-in-the-forest.mp4,PT00H00M12S,026101_026150,Snow falling in the forest.
13168457,https://ak.picdn.net/shutterstock/videos/13168457/preview/stock-footage-a-man-using-the-toilet-in-his-home.mp4,PT00H00M15S,098451_098500,A man using the toilet in his home
1050017956,https://ak.picdn.net/shutterstock/videos/1050017956/preview/stock-footage-beautiful-panther-neon-video-animation.mp4,PT00H00M10S,036951_037000,Beautiful panther neon video animation
1057982308,https://ak.picdn.net/shutterstock/videos/1057982308/preview/stock-footage-avocado-reveal-on-a-furry-fabric-background-green-fruit-exotic.mp4,PT00H00M13S,185951_186000,Avocado reveal on a furry fabric background  green fruit exotic
1057108127,https://ak.picdn.net/shutterstock/videos/1057108127/preview/stock-footage-tidying-up-the-rubbish-form-the-beach-beautiful-lady-in-front-of-the-camera-showing-big-like-while.mp4,PT00H00M06S,179951_180000,Tidying up the rubbish form the beach beautiful lady in front of the camera showing big like while working together with her friends volunteers they picking up the rubbish
1036166168,https://ak.picdn.net/shutterstock/videos/1036166168/preview/stock-footage-aerial-view-of-a-man-in-a-protective-suit-who-collects-plastic-trash-on-the-banks-of-a-dry-and.mp4,PT00H00M41S,191301_191350,Aerial view of a man in a protective suit who collects plastic trash on the banks of a dry and polluted river. ecological catastrophy. anthropogenic influence. 4k drone footage.
12611819,https://ak.picdn.net/shutterstock/videos/12611819/preview/stock-footage-beautiful-abstract-loopable-background-video.mp4,PT00H00M27S,000701_000750,Beautiful abstract loopable background video
1025208707,https://ak.picdn.net/shutterstock/videos/1025208707/preview/stock-footage-kansas-city-skyline-with-wwi-monument.mp4,PT00H00M16S,062301_062350,Kansas city skyline with wwi monument
1052313610,https://ak.picdn.net/shutterstock/videos/1052313610/preview/stock-footage-close-up-of-a-person-cleaning-a-kitchen-stain-with-antibacterial-disinfectant-spray.mp4,PT00H00M28S,127301_127350,Close up of a person cleaning a kitchen stain with antibacterial disinfectant spray
12934277,https://ak.picdn.net/shutterstock/videos/12934277/preview/stock-footage--appetizing-sweet-cake-turns-into-a-plate-on-display.mp4,PT00H00M07S,196851_196900, appetizing sweet cake turns into a plate on display
1041666835,https://ak.picdn.net/shutterstock/videos/1041666835/preview/stock-footage-israel-flag-flag-of-israel-in-tel-aviv-city-waving-israel-flag-with-sky.mp4,PT00H00M28S,124751_124800,Israel flag. flag of israel in tel aviv city. waving israel flag with sky.
