videoid,contentUrl,duration,page_dir,name
1032143411,https://ak.picdn.net/shutterstock/videos/1032143411/preview/stock-footage-time-lapse-of-yosemite-national-park-el-capitan-and-half-dome-are-in-the-background.mp4,PT00H00M10S,174701_174750,Time lapse of yosemite national park. el capitan and half dome are in the background.
1051346995,https://ak.picdn.net/shutterstock/videos/1051346995/preview/stock-footage-tattoo-master-woman-sets-needle-in-tattoo-machine-light-background-overall-plan.mp4,PT00H00M19S,117551_117600,Tattoo master woman sets needle in tattoo machine light background overall plan
20064793,https://ak.picdn.net/shutterstock/videos/20064793/preview/stock-footage-flying-over-the-seacoast-in-the-rays-of-setting-sun-backlight.mp4,PT00H00M19S,082351_082400,Flying over the seacoast in the rays of setting sun. backlight.
23086792,https://ak.picdn.net/shutterstock/videos/23086792/preview/stock-footage-delivery-man-doing-victory-gesture.mp4,PT00H00M19S,122501_122550,"Delivery man doing victory gesture.
"
13504394,https://ak.picdn.net/shutterstock/videos/13504394/preview/stock-footage-beijing-china-august-chinese-man-cooking-oysters-in-the-wangfujing-street-market-in.mp4,PT00H00M12S,031601_031650,"Beijing, china - august 2008: chinese man cooking oysters in the wangfujing street market in beijing, china."
18325822,https://ak.picdn.net/shutterstock/videos/18325822/preview/stock-footage-young-woman-looking-at-camera-on-lake-and-grimacing.mp4,PT00H00M09S,140301_140350,Young woman looking at camera on lake and grimacing
34105075,https://ak.picdn.net/shutterstock/videos/34105075/preview/stock-footage-time-lapse-christmas-lights-in-seoul-city-night-seoul-korea-december.mp4,PT00H00M07S,093951_094000,"Time lapse,christmas lights in seoul city night, seoul korea,december 16, 2017"
1051677700,https://ak.picdn.net/shutterstock/videos/1051677700/preview/stock-footage-endless-abstract-animation-circles-appear-from-the-center-seamless-looping-k.mp4,PT00H00M16S,127451_127500,Endless abstract animation. circles appear from the center. seamless looping. 4k
12485231,https://ak.picdn.net/shutterstock/videos/12485231/preview/stock-footage-lifeguard-tower-at-venice-beach-california.mp4,PT00H00M13S,037351_037400,"Lifeguard tower at venice beach, california"
1024319567,https://ak.picdn.net/shutterstock/videos/1024319567/preview/stock-footage-this-is-a-shot-of-a-little-girl-playing-in-the-snow-and-eating-it-with-her-puppy-shot-on-a-gh.mp4,PT00H00M28S,187301_187350,This is a shot of a little girl playing in the snow and eating it with her puppy. shot on a gh5
32182975,https://ak.picdn.net/shutterstock/videos/32182975/preview/stock-footage-hornet-bee-macro-vespa-crabro.mp4,PT00H00M07S,030201_030250,"Hornet bee macro, vespa crabro
"
1056646058,https://ak.picdn.net/shutterstock/videos/1056646058/preview/stock-footage-aerial-view-of-glacial-general-carretera-lake-turquoise-water-and-green-coastline-amazing.mp4,PT00H00M05S,046751_046800,"Aerial view of glacial general carretera lake turquoise water and green coastline, amazing landscape on chile argentina borderline"
1016685967,https://ak.picdn.net/shutterstock/videos/1016685967/preview/stock-footage-happy-girl-sitting-by-the-river-using-the-phone.mp4,PT00H00M24S,020051_020100,"Happy girl sitting by the river, using the phone."
32829469,https://ak.picdn.net/shutterstock/videos/32829469/preview/stock-footage--k-time-lapse-view-of-the-clouds-from-the-base-of-a-silver-birch-tree-in-autumn.mp4,PT00H00M13S,080851_080900,4k time lapse view of the clouds from the base of a silver birch tree in autumn 
1051030762,https://ak.picdn.net/shutterstock/videos/1051030762/preview/stock-footage-flight-over-of-grundlsee-lake-in-salzkammergut-styria-austria.mp4,PT00H00M09S,112401_112450,"Flight over of grundlsee lake in salzkammergut, styria, austria"
1036063883,https://ak.picdn.net/shutterstock/videos/1036063883/preview/stock-footage-merry-christmas-text-with-christmas-tree-particle-animation-christmas-tree-forming-with-particle.mp4,PT00H00M07S,091301_091350,"Merry christmas text with christmas tree particle animation, christmas tree forming with particle on choma background. particle christmas tree animation, hd"
1014620117,https://ak.picdn.net/shutterstock/videos/1014620117/preview/stock-footage-creek-stream-nature.mp4,PT00H01M10S,055101_055150,Creek stream - nature
32907487,https://ak.picdn.net/shutterstock/videos/32907487/preview/stock-footage-sky-with-gray-and-black-clouds-the-sun-between-clouds.mp4,PT00H00M20S,109051_109100,Sky with gray and black clouds. the sun between clouds.
27216793,https://ak.picdn.net/shutterstock/videos/27216793/preview/stock-footage-caucasian-woman-indoor-modern-house-city-lifestyle-technology.mp4,PT00H00M15S,137751_137800,Caucasian woman indoor modern house city lifestyle technology
24615557,https://ak.picdn.net/shutterstock/videos/24615557/preview/stock-footage-title-plate-and-pistols-pirate-party-clay-animation-k.mp4,PT00H00M10S,119701_119750,Title plate and pistols. pirate party. clay animation. 4k
1049762503,https://ak.picdn.net/shutterstock/videos/1049762503/preview/stock-footage-male-hands-of-a-builder-lay-a-brick-on-fresh-wet-cement-a-row-of-white-brick-at-a-construction.mp4,PT00H00M19S,080651_080700,Male hands of a builder lay a brick on fresh wet cement. a row of white brick at a construction site close up view. wall.
1023352663,https://ak.picdn.net/shutterstock/videos/1023352663/preview/stock-footage-close-up-of-a-record-spinning.mp4,PT00H00M08S,185251_185300,Close up of a record spinning
17753836,https://ak.picdn.net/shutterstock/videos/17753836/preview/stock-footage-pompeii-italy-may-k-time-lapse-of-spectators-visit-historic-pompeii-landmark-and.mp4,PT00H00M12S,065101_065150,"Pompeii, italy : may 13, 2016: 4k time lapse of spectators visit historic pompeii landmark and ancient city destroyed by mount vesuvius near naples, italy."
12833996,https://ak.picdn.net/shutterstock/videos/12833996/preview/stock-footage-a-beautiful-autumn-view-of-the-pedestrian-bridge-over-the-river-ukraine.mp4,PT00H00M13S,018951_019000,A beautiful autumn view of the pedestrian bridge over the river ukraine
30175819,https://ak.picdn.net/shutterstock/videos/30175819/preview/stock-footage-prague-czech-republic-june-detail-of-logo-porsche-on-modern-white-car.mp4,PT00H00M12S,124351_124400,"Prague, czech republic - june 1, 2017: detail of logo porsche on modern white car"
1034861291,https://ak.picdn.net/shutterstock/videos/1034861291/preview/stock-footage-close-up-of-a-bartender-putting-ice-into-a-shaker.mp4,PT00H00M09S,068801_068850,Close-up of a bartender putting ice into a shaker
28548769,https://ak.picdn.net/shutterstock/videos/28548769/preview/stock-footage-aerial-birdseye-view-of-woodstown-salem-county-new-jersey-usa-k.mp4,PT00H00M29S,016601_016650,Aerial birdseye view of woodstown salem county new jersey usa 4k
22054897,https://ak.picdn.net/shutterstock/videos/22054897/preview/stock-footage-watercolor-background-grey-colors-black-and-white-splashes-animation-paint-spots.mp4,PT00H00M10S,124051_124100,Watercolor background. grey colors. black and white splashes animation. paint spots. 
1015427371,https://ak.picdn.net/shutterstock/videos/1015427371/preview/stock-footage--k-ultra-high-definition-video-of-realistic-wavy-flag-over-water-background-with-seamless-loops.mp4,PT00H00M10S,031001_031050,4k ultra high definition video of realistic wavy flag over water background with seamless loops
1028004425,https://ak.picdn.net/shutterstock/videos/1028004425/preview/stock-footage-ural-mountains-in-winter-frosty-day.mp4,PT00H01M00S,063551_063600,Ural mountains in winter. frosty day.
1021691581,https://ak.picdn.net/shutterstock/videos/1021691581/preview/stock-footage-woman-in-a-jacket-and-hat-in-slow-motion-looks-at-the-snow-and-catches-snowflakes-smiling.mp4,PT00H00M12S,173401_173450,Woman in a jacket and hat in slow motion looks at the snow and catches snowflakes smiling
1044805033,https://ak.picdn.net/shutterstock/videos/1044805033/preview/stock-footage-mara-tanzania-river-view-surrounded-by-trees-and-forest-with-some-animals-in-the-water.mp4,PT00H00M05S,142751_142800,Mara tanzania-1983: river view surrounded by trees and forest with some animals in the water
5115767,https://ak.picdn.net/shutterstock/videos/5115767/preview/stock-footage-peaceful-attractive-woman-sleeping-lying-in-her-bed-under-the-cover.mp4,PT00H00M12S,175951_176000,Peaceful attractive woman sleeping lying in her bed under the cover
1028914472,https://ak.picdn.net/shutterstock/videos/1028914472/preview/stock-footage-timisoara-romania-april-union-square-a-group-of-young-children-are-performing-a.mp4,PT00H00M30S,041951_042000,"Timisoara, romania - april 19, 2019: union square, a group of young children are performing a ballet dance at timfloralis international flower festival. slow motion footage"
12187187,https://ak.picdn.net/shutterstock/videos/12187187/preview/stock-footage-tilt-up-shot-of-female-professional-using-digital-tablet-midsection-of-businesswoman-is-scrolling.mp4,PT00H00M23S,112051_112100,Tilt up shot of female professional using digital tablet. midsection of businesswoman is scrolling and zooming. she is in brightly lit office.
24308732,https://ak.picdn.net/shutterstock/videos/24308732/preview/stock-footage-bangkok-thailand-feb-a-group-of-construction-workers-carry-a-cement-in-a-bucket-used-to.mp4,PT00H00M21S,129051_129100,"Bangkok,thailand - feb 25,2017: a group of construction workers carry a cement in a bucket used to pour cement across the floor of a reinforced concrete building while other workers spread wet cement."
24403160,https://ak.picdn.net/shutterstock/videos/24403160/preview/stock-footage-husky-in-winter-forest-slow-motion.mp4,PT00H00M05S,177501_177550,Husky in winter forest. slow motion
19086850,https://ak.picdn.net/shutterstock/videos/19086850/preview/stock-footage-fountain-water-drops.mp4,PT00H00M16S,048351_048400,Fountain water drops
1051928566,https://ak.picdn.net/shutterstock/videos/1051928566/preview/stock-footage-concept-of-scientific-research-microbiology-plasma-cells-benign-cells-laboratory.mp4,PT00H00M27S,007251_007300,"Concept of scientific research, microbiology, plasma, cells, benign cells, laboratory"
12240626,https://ak.picdn.net/shutterstock/videos/12240626/preview/stock-footage-carved-image-of-jesus-and-his-apostles-on-the-wall-of-the-notre-dame-cathedral-in-paris.mp4,PT00H00M13S,193001_193050,Carved image of jesus and his apostles on the wall of the notre dame cathedral in paris
23034208,https://ak.picdn.net/shutterstock/videos/23034208/preview/stock-footage-several-seagulls-floating-and-one-taking-off-from-a-river-surface-in-slow-motion-in-autumn.mp4,PT00H00M15S,076201_076250,Several seagulls floating and one taking off from a river surface in slow motion in autumn.
1030439828,https://ak.picdn.net/shutterstock/videos/1030439828/preview/stock-footage-hands-with-chopsticks-picks-piece-of-delicious-fried-pork-or-tonkatsu-dipped-sesame-sauce.mp4,PT00H00M12S,056651_056700,"Hands with chopsticks picks piece of delicious fried pork, or tonkatsu dipped sesame sauce. japanese traditional food with selective focus."
17156323,https://ak.picdn.net/shutterstock/videos/17156323/preview/stock-footage-storm-clouds-forming-over-a-field-in-southern-germany-shot-as-a-time-lapse-clip.mp4,PT00H00M07S,074351_074400,"Storm clouds forming over a field in southern germany, shot as a time lapse clip"
6180398,https://ak.picdn.net/shutterstock/videos/6180398/preview/stock-footage-forest-sun.mp4,PT00H00M16S,068101_068150,Forest sun
34545457,https://ak.picdn.net/shutterstock/videos/34545457/preview/stock-footage-hand-woman-washes-the-kitchen-hob.mp4,PT00H00M19S,176201_176250,Hand woman washes the kitchen hob
1028228762,https://ak.picdn.net/shutterstock/videos/1028228762/preview/stock-footage-montmartre-famous-hill-in-paris-on-april.mp4,PT00H00M10S,024701_024750,Montmartre famous hill in paris on 20 april 2019
32943529,https://ak.picdn.net/shutterstock/videos/32943529/preview/stock-footage-lashao-temple-or-la-shao-si-with-giant-meter-buddha-carved-into-rock-at-luomen-gansu-china.mp4,PT00H00M11S,032701_032750,"Lashao temple or la shao si with giant 30-meter buddha carved into rock at luomen, gansu, china, asia. chinese remote site with old buddhist statues, art, architecture, temple. monument with painting"
1013902649,https://ak.picdn.net/shutterstock/videos/1013902649/preview/stock-footage-cartoon-situation-tom-businessman-man-character-walks-in-tangled-labyrinth-wanders-animation.mp4,PT00H00M18S,087651_087700,"Cartoon situation tom businessman. man character walks in tangled labyrinth, wanders animation"
1715443,https://ak.picdn.net/shutterstock/videos/1715443/preview/stock-footage-colorful-flags-in-nepal.mp4,PT00H00M42S,009601_009650,Colorful flags in nepal
1022467063,https://ak.picdn.net/shutterstock/videos/1022467063/preview/stock-footage-italy-funes-aerial-k-raw-footage.mp4,PT00H00M08S,061651_061700,"Italy, funes, aerial 4k raw footage"
24724307,https://ak.picdn.net/shutterstock/videos/24724307/preview/stock-footage-madagascar-s-bible-on-fire-man-talks-to-woman-flames-and-fire.mp4,PT00H00M18S,078001_078050,Madagascar: 1970s: bible on fire. man talks to woman. flames and fire.
8966167,https://ak.picdn.net/shutterstock/videos/8966167/preview/stock-footage-ocean-waves-crashing-on-the-rocks.mp4,PT00H00M15S,057851_057900,Ocean waves crashing on the rocks
1009404860,https://ak.picdn.net/shutterstock/videos/1009404860/preview/stock-footage-sao-paulo-brazil-march-sao-paulo-time-lapse-with-clouds-during-day-in-truistic-place-of.mp4,PT00H00M23S,139951_140000,"Sao paulo, brazil, march 24, 2018. sao paulo time lapse with clouds during day in truistic place of downtown sao paulo"
1013883908,https://ak.picdn.net/shutterstock/videos/1013883908/preview/stock-footage-a-young-respectable-businessman-sent-to-an-office-building-in-his-hands-he-holds-a-briefcase.mp4,PT00H00M16S,125601_125650,"A young, respectable businessman sent to an office building. in his hands he holds a briefcase, looks through documents. 4k"
20760199,https://ak.picdn.net/shutterstock/videos/20760199/preview/stock-footage-abstract-background-flying-particles-motion-background-light-particles-abstract-background-with.mp4,PT00H00M26S,093051_093100,Abstract background. flying particles. motion background light particles. abstract background with shining bokeh sparkles. smooth animation in loop. with a place for your logo\text. 
1038935942,https://ak.picdn.net/shutterstock/videos/1038935942/preview/stock-footage-tortoise-turtle-looking-around-on-a-sunny-meadow.mp4,PT00H00M17S,091401_091450,Tortoise turtle looking around on a sunny meadow
22388008,https://ak.picdn.net/shutterstock/videos/22388008/preview/stock-footage-backlit-leaves-with-flare-shooting-of-backlit-leaves-with-flare.mp4,PT00H00M11S,050651_050700,"Backlit leaves with flare
shooting of backlit leaves with flare"
1030345778,https://ak.picdn.net/shutterstock/videos/1030345778/preview/stock-footage-burning-candles-on-altar-in-church.mp4,PT00H00M08S,052651_052700,Burning candles on altar in church.
1024035512,https://ak.picdn.net/shutterstock/videos/1024035512/preview/stock-footage-beautiful-christmas-tree-with-decorative-chritmas-toys.mp4,PT00H00M19S,117651_117700,Beautiful christmas tree with decorative chritmas toys
1016737156,https://ak.picdn.net/shutterstock/videos/1016737156/preview/stock-footage-people-silhouette-in-the-restaurant-nd-aug-prague-europe.mp4,PT00H00M11S,017651_017700,People silhouette in the restaurant 22nd aug 2018 prague europe
4510532,https://ak.picdn.net/shutterstock/videos/4510532/preview/stock-footage-success-text-in-book-with-blue-screen-loop.mp4,PT00H00M24S,018051_018100,"Success text in book, with blue screen, loop"
1055325932,https://ak.picdn.net/shutterstock/videos/1055325932/preview/stock-footage-hmm-suspicious-thoughtful-young-female-looking-up-keeping-hand-on-her-face-as-if-trying-hard-to.mp4,PT00H00M14S,000451_000500,"Hmm. suspicious thoughtful young female looking up, keeping hand on her face as if trying hard to remember something important. a confused woman at home on a room background"
1038535364,https://ak.picdn.net/shutterstock/videos/1038535364/preview/stock-footage-flying-over-poorly-treated-sunflower-field-with-grass-at-flowering-stage-drone-shot-of.mp4,PT00H00M14S,198251_198300,Flying over poorly treated sunflower field with grass at flowering stage. drone shot of agricultural work and concept of food industry
1057937314,https://ak.picdn.net/shutterstock/videos/1057937314/preview/stock-footage-drone-shot-of-a-small-town-by-the-sea.mp4,PT00H00M27S,118251_118300,Drone shot of a small town by the sea
1008419794,https://ak.picdn.net/shutterstock/videos/1008419794/preview/stock-footage-toshima-ku-ikebukuro-tokyo-japan-its-a-city-location-in-tokyo-k-time-lapse.mp4,PT00H00M13S,039001_039050,Toshima-ku ikebukuro tokyo / japan - 01.16.2018 : its a city location in tokyo. 4k & time lapse. camera : canon eos 7d
32270566,https://ak.picdn.net/shutterstock/videos/32270566/preview/stock-footage-circa-s-some-motorcyclists-wipe-out-in-a-race-in.mp4,PT00H00M50S,026701_026750,Circa 1930s - some motorcyclists wipe out in a race in 1934.
1016603056,https://ak.picdn.net/shutterstock/videos/1016603056/preview/stock-footage-the-cloud-flow-above-the-sky-evening-night-time.mp4,PT00H00M11S,097651_097700,The cloud flow above the sky. evening night time
1059775304,https://ak.picdn.net/shutterstock/videos/1059775304/preview/stock-footage-north-western-sri-lanka-province-map-outline-animation.mp4,PT00H00M07S,059201_059250,North western sri lanka province map outline animation
1043210839,https://ak.picdn.net/shutterstock/videos/1043210839/preview/stock-footage-young-beautiful-woman-with-fashionable-hair-styling.mp4,PT00H00M10S,130251_130300,Young beautiful woman with fashionable hair styling.
1056477062,https://ak.picdn.net/shutterstock/videos/1056477062/preview/stock-footage-fatih-istanbul-turkey-july-people-from-all-around-turkey-surged-into-istanbul-to.mp4,PT00H00M27S,134051_134100,"Fatih, istanbul / turkey - 25 july 2020 : people from all around turkey surged into istanbul to pray in hagia sophia after being reconverted into a mosque."
1006825804,https://ak.picdn.net/shutterstock/videos/1006825804/preview/stock-footage-apple-trees-with-red-apples.mp4,PT00H00M18S,071401_071450,Apple trees with red apples
1028509601,https://ak.picdn.net/shutterstock/videos/1028509601/preview/stock-footage-kuala-lumpur-malaysia-april-k-time-lapse-of-close-up-view-petronas-twin-towers-klcc.mp4,PT00H00M13S,148201_148250,"Kuala lumpur, malaysia - april 16, 2019: 4k time lapse of close up view, petronas twin towers klcc at cloudy night. zoom in"
1040893703,https://ak.picdn.net/shutterstock/videos/1040893703/preview/stock-footage-bullet-time-shot-of-clumsy-businessman-tripping-in-the-office.mp4,PT00H00M11S,015751_015800,Bullet time shot of clumsy businessman tripping in the office
1030539527,https://ak.picdn.net/shutterstock/videos/1030539527/preview/stock-footage-crabs-in-the-river-crab-fishing-in-a-mountain-river-fisherman-catches-crabs-fresh-seafood.mp4,PT00H00M13S,066001_066050,"Crabs in the river.crab fishing in a mountain river. fisherman catches crabs. fresh seafood.
"
1044129475,https://ak.picdn.net/shutterstock/videos/1044129475/preview/stock-footage-san-sebastian-spain-on-january-la-concha-beach-in-san-sebastian-resort-town-on-the-bay.mp4,PT00H00M24S,099501_099550,"San sebastian, spain on january 5, 2020: la concha beach in san sebastian. resort town on the bay of biscay in spain's basque country."
1017265879,https://ak.picdn.net/shutterstock/videos/1017265879/preview/stock-footage--swans-on-the-lake.mp4,PT00H00M28S,135551_135600, swans on the lake
1010850026,https://ak.picdn.net/shutterstock/videos/1010850026/preview/stock-footage-dolly-through-rapeseed-canola-crop-field-on-a-sunny-day-with-bright-blue-sky-and-white-clouds.mp4,PT00H00M44S,185151_185200,Dolly through rapeseed canola crop field on a sunny day with bright blue sky and white clouds. british farming fields. 
5390006,https://ak.picdn.net/shutterstock/videos/5390006/preview/stock-footage-wind-turbine-in-the-water.mp4,PT00H00M15S,065501_065550,Wind turbine in the water
30965605,https://ak.picdn.net/shutterstock/videos/30965605/preview/stock-footage-group-of-friends-are-enjoying-drinks-together-in-a-bar-courtyard.mp4,PT00H00M14S,194251_194300,Group of friends are enjoying drinks together in a bar courtyard.
20819581,https://ak.picdn.net/shutterstock/videos/20819581/preview/stock-footage-warsaw-poland-june-metro-in-warsaw-the-train-in-the-subway-poland-shot-in-k-ultra.mp4,PT00H00M36S,060801_060850,"Warsaw, poland - june 2016: metro in warsaw. the train in the subway. poland. shot in 4k (ultra-high definition (uhd))."
1027048559,https://ak.picdn.net/shutterstock/videos/1027048559/preview/stock-footage-trang-thailand-march-time-lapse-of-unidentified-passengers-passengers-checking-in-at-the.mp4,PT00H00M04S,103701_103750,"Trang-thailand:march 22, 2019:time lapse of unidentified passengers passengers checking in at the counter at trang airport after travel in south thailand to don mueang international airport in bangkok"
10055342,https://ak.picdn.net/shutterstock/videos/10055342/preview/stock-footage-aerial-germany-flying-up-the-river-isor.mp4,PT00H00M10S,050151_050200,Aerial germany-flying up the river isor 2007
32449240,https://ak.picdn.net/shutterstock/videos/32449240/preview/stock-footage-the-clouds-are-coming.mp4,PT00H00M42S,146001_146050,The clouds are coming
1021759207,https://ak.picdn.net/shutterstock/videos/1021759207/preview/stock-footage-various-sport-coats-on-shelf-apparel-store.mp4,PT00H00M08S,100951_101000,Various sport coats on shelf apparel store
1032835985,https://ak.picdn.net/shutterstock/videos/1032835985/preview/stock-footage-on-the-car-crash-traffic-accident-scene-paramedics-saving-life-of-a-female-victim-who-is-lying-on.mp4,PT00H00M15S,184901_184950,"On the car crash traffic accident scene: paramedics saving life of a female victim who is lying on stretchers. they apply oxygen mask, do cardiopulmonary resuscitation / cpr and perform first aid"
31732279,https://ak.picdn.net/shutterstock/videos/31732279/preview/stock-footage-big-fish-carp-is-catching-plankton-and-eating-it.mp4,PT00H00M40S,065051_065100,"Big fish, carp is catching plankton and eating it"
1057630246,https://ak.picdn.net/shutterstock/videos/1057630246/preview/stock-footage-overjoyed-excited-male-leader-and-carefree-business-team-dance-together-happy-staff-group-enjoy.mp4,PT00H00M19S,031751_031800,"Overjoyed excited male leader and carefree business team dance together, happy staff group enjoy fun celebrate success victory concept."
14714920,https://ak.picdn.net/shutterstock/videos/14714920/preview/stock-footage-hanoi-vietnam-november-a-girl-in-a-purple-dress-stands-out-in-between-young-men-wearing.mp4,PT00H00M12S,021851_021900,"Hanoi, vietnam - 29 november 2015: a girl in a purple dress stands out in between young men wearing black suits, vietnamese high school students graduation party in hanoi"
27814168,https://ak.picdn.net/shutterstock/videos/27814168/preview/stock-footage-aerial-view-flying-over-the-beautiful-mountain-aerial-camera-shot-landscape-panorama-ukraine.mp4,PT00H00M21S,007851_007900,"Aerial view. flying over the beautiful mountain. aerial camera shot. landscape panorama. ukraine, carpathians mountains. bukovel"
1051049599,https://ak.picdn.net/shutterstock/videos/1051049599/preview/stock-footage-ducks-flying-off-of-pond-water-into-air-after-taking-a-swim.mp4,PT00H00M27S,009301_009350,Ducks flying off of pond water into air after taking a swim
1060567183,https://ak.picdn.net/shutterstock/videos/1060567183/preview/stock-footage-panning-up-over-finished-carving-with-a-chainsaw-into-a-standing-pine-tree-of-a-bear-and-cub-going.mp4,PT00H00M15S,185101_185150,Panning up over finished carving with a chainsaw into a standing pine tree of a bear and cub going after a bee hive carving
1047121504,https://ak.picdn.net/shutterstock/videos/1047121504/preview/stock-footage-vertical-video-of-a-white-tulip-flower-blooming-on-black-background-timelapse.mp4,PT00H00M12S,046301_046350,"Vertical video of a white tulip flower blooming on black background, timelapse"
1016457982,https://ak.picdn.net/shutterstock/videos/1016457982/preview/stock-footage--k-fps-footage-aerial-view-of-harvest-fields-with-tractor.mp4,PT00H00M17S,115051_115100,4k 60fps footage aerial view of harvest fields with tractor 
34206544,https://ak.picdn.net/shutterstock/videos/34206544/preview/stock-footage-georgia-mestia-agu-nature-and-cultural-details.mp4,PT00H00M10S,142251_142300,Georgia mestia agu 2016: nature and cultural details 
1016946724,https://ak.picdn.net/shutterstock/videos/1016946724/preview/stock-footage-seascape-with-bird-island-near-town-of-tsarevo-burgas-region-bulgaria.mp4,PT00H00M46S,004701_004750,"Seascape with bird island near town of tsarevo, burgas region, bulgaria"
1025897795,https://ak.picdn.net/shutterstock/videos/1025897795/preview/stock-footage-milky-way-passes-over-a-dead-tree-in-sabah-borneo.mp4,PT00H00M05S,084551_084600,"Milky way passes over a dead tree in sabah, borneo"
1043882440,https://ak.picdn.net/shutterstock/videos/1043882440/preview/stock-footage-moving-metal-bar-abstract-vintage-background.mp4,PT00H00M30S,057651_057700,Moving metal bar abstract vintage background
5047709,https://ak.picdn.net/shutterstock/videos/5047709/preview/stock-footage-a-manta-ray-manta-alfredi-swims-over-a-cleaning-station-on-a-shallow-reef-in-raja-ampat.mp4,PT00H00M16S,070051_070100,"A manta ray (manta alfredi) swims over a cleaning station on a shallow reef in raja ampat, indonesia. this region is known for its incredible marine biological diversity and great scuba diving."
