videoid,contentUrl,duration,page_dir,name
1037951153,https://ak.picdn.net/shutterstock/videos/1037951153/preview/stock-footage-point-of-view-of-urban-city-traffic-at-dusk-through-bus-stop-windows.mp4,PT00H00M11S,144351_144400,"Point of view of urban city, traffic at dusk through bus stop windows"
1041459973,https://ak.picdn.net/shutterstock/videos/1041459973/preview/stock-footage-a-small-pier-on-the-pond-surrounded-by-nature-atmosphere-of-peace-and-serenity-a-boy-is-inspired.mp4,PT00H00M19S,089551_089600,A small pier on the pond surrounded by nature. atmosphere of peace and serenity. a boy is inspired by nature. 30fps
1043822608,https://ak.picdn.net/shutterstock/videos/1043822608/preview/stock-footage-a-man-inserts-new-cotton-wool-in-an-electronic-brown-cigarette.mp4,PT00H00M23S,042151_042200,A man inserts new cotton wool in an electronic brown cigarette
1063284481,https://ak.picdn.net/shutterstock/videos/1063284481/preview/stock-footage-man-on-books-animated-icon-k-animated-icon-to-improve-project-and-explainer-video.mp4,PT00H00M08S,115801_115850,Man on books animated icon. 4k animated icon to improve project and explainer video
18402925,https://ak.picdn.net/shutterstock/videos/18402925/preview/stock-footage-high-speed-camera-shot-of-shattering-glass-isolated-on-a-black-background-can-be-pre-matted-for.mp4,PT00H00M16S,083051_083100,"High speed camera shot of shattering glass, isolated on a black background. can be pre-matted for your video footage by using the command frame blending - multiply.
"
1030620746,https://ak.picdn.net/shutterstock/videos/1030620746/preview/stock-footage-intro-render-d-background-illustration-art-design.mp4,PT00H00M09S,178451_178500,Intro render 3d background illustration art design
1066706743,https://ak.picdn.net/shutterstock/videos/1066706743/preview/stock-footage-beautiful-caucasian-female-using-tablet-computer-in-stylish-living-room-while-sitting-on-a-cozy.mp4,PT00H00M15S,000001_000050,"Beautiful caucasian female using tablet computer in stylish living room while sitting on a cozy couch sofa. young woman resting at home, browsing internet, using social networks, having fun in flat."
1028917808,https://ak.picdn.net/shutterstock/videos/1028917808/preview/stock-footage-water-drops-on-car-glass.mp4,PT00H00M42S,134101_134150,Water drops on car glass.
1027227893,https://ak.picdn.net/shutterstock/videos/1027227893/preview/stock-footage-cute-toddler-baby-boy-playing-with-beach-toys-on-tropical-beach.mp4,PT00H00M30S,074151_074200,Cute toddler baby boy playing with beach toys on tropical beach
1039757684,https://ak.picdn.net/shutterstock/videos/1039757684/preview/stock-footage-squid-close-up-underwater-slow-motion-mediterranean-sea.mp4,PT00H00M35S,082851_082900,Squid close up underwater slow motion mediterranean sea
1055824727,https://ak.picdn.net/shutterstock/videos/1055824727/preview/stock-footage-aerial-view-of-a-beautiful-mosque-masjid-ubudiah-in-perak-malaysia.mp4,PT00H00M12S,188901_188950,"Aerial view of a beautiful mosque (masjid ubudiah) in perak, malaysia"
1011735836,https://ak.picdn.net/shutterstock/videos/1011735836/preview/stock-footage-white-and-black-horses-graze-in-a-clearing-near-a-wooden-pen-in-the-background-of-low-mountains.mp4,PT00H00M14S,016751_016800,"White and black horses graze in a clearing near a wooden pen in the background of low mountains under a picturesque cloudy sky. picture from mongolian life. summer sunny day.
"
2869579,https://ak.picdn.net/shutterstock/videos/2869579/preview/stock-footage-bangkok-thailand-april-night-market-near-near-taksim-pier-district-on-april-in.mp4,PT00H00M12S,147601_147650,"Bangkok, thailand- april 30: night market near near taksim pier district  on april 30, 2012 in bangkok. bangkok is one of the well know place for visit in thailand."
1061506912,https://ak.picdn.net/shutterstock/videos/1061506912/preview/stock-footage-waves-hit-the-rocks-close-up-shooting.mp4,PT00H00M15S,121001_121050,Waves hit the rocks. close-up shooting
21780301,https://ak.picdn.net/shutterstock/videos/21780301/preview/stock-footage-a-gorgeous-woman-lays-on-a-bed-of-roses-and-stares-into-the-lens-lovingly-she-nuzzles-into-the.mp4,PT00H00M25S,039801_039850,"A gorgeous woman lays on a bed of roses and stares into the lens, lovingly. she nuzzles into the petals as the camera pans over her face. slow motion. "
1022499526,https://ak.picdn.net/shutterstock/videos/1022499526/preview/stock-footage-adult-sexy-woman-dancing-dance-in-an-intimate-setting-silhouette-of-a-sexy-woman-dancing-on-red.mp4,PT00H00M09S,121351_121400,Adult sexy woman dancing dance in an intimate setting. silhouette of a sexy woman dancing on red background. pole dance. pole dance from an old woman
1027626905,https://ak.picdn.net/shutterstock/videos/1027626905/preview/stock-footage-close-up-on-sad-pensive-lonely-red-hair-woman-looking-up-in-the-park-thoughts-problems.mp4,PT00H00M25S,018301_018350,"Close up on sad pensive lonely red hair woman looking up in the park. thoughts,problems"
1023986573,https://ak.picdn.net/shutterstock/videos/1023986573/preview/stock-footage-photorealistic-animation-of-the-national-flag-of-india-waving-on-the-wind-seamless-loop-k-ultra.mp4,PT00H00M30S,137601_137650,"Photorealistic animation of the national flag of india waving on the wind. seamless loop. 4k, ultra hd resolution. chroma key green screen, rectangle flag style. 30sec video."
6283781,https://ak.picdn.net/shutterstock/videos/6283781/preview/stock-footage-aerial-video-of-ocean-terrace-in-miami-beach-florida.mp4,PT00H00M29S,175451_175500,Aerial video of ocean terrace in miami beach florida
8162086,https://ak.picdn.net/shutterstock/videos/8162086/preview/stock-footage-numbers-and-symbols-form-a-on-off-symbol-on-blue-background-more-icons-symbols-and-color.mp4,PT00H00M28S,006801_006850,"Numbers and symbols form a on/off symbol on blue background. more icons, symbols and color backgrounds available - check my portfolio."
32553367,https://ak.picdn.net/shutterstock/videos/32553367/preview/stock-footage-happy-women-tourist-on-map-to-railway-station-vacation-travel-concept-thailand.mp4,PT00H00M23S,037751_037800,"Happy women tourist on map to railway station vacation,travel concept, thailand"
1039866083,https://ak.picdn.net/shutterstock/videos/1039866083/preview/stock-footage-a-colorful-sunset-timelapse-in-a-pumkin-field.mp4,PT00H00M37S,133401_133450,A colorful sunset timelapse in a pumkin field
9328676,https://ak.picdn.net/shutterstock/videos/9328676/preview/stock-footage-view-of-european-highest-mountain-range-from-airplane-window-flying-above-alps.mp4,PT00H00M15S,082901_082950,View of european highest mountain range from airplane window flying above alps
1027145834,https://ak.picdn.net/shutterstock/videos/1027145834/preview/stock-footage-antelope-canyon-amazing-colors-of-the-sandstone-rocks.mp4,PT00H00M09S,023351_023400,Antelope canyon - amazing colors of the sandstone rocks 
1051760776,https://ak.picdn.net/shutterstock/videos/1051760776/preview/stock-footage-time-lapse-of-blossoming-branch-with-pink-cherry-blossom-flowers-time-lapse-spring-tree-branch.mp4,PT00H00M15S,170301_170350,"Time lapse of blossoming branch with pink cherry blossom flowers. time-lapse spring tree branch with flowers and buds, isolated on black background. stick tree branch springtime."
25705517,https://ak.picdn.net/shutterstock/videos/25705517/preview/stock-footage--k-little-neonatal-incubator-intensive-hospital-therapy-icu-ccu-icu-itu-tiny-baby-small.mp4,PT00H00M29S,133351_133400,"4k, little neonatal incubator, intensive hospital therapy: icu, ccu, icu, itu. tiny baby, small child, moving hands and fingers. panning camera, pan, closeup"
12123842,https://ak.picdn.net/shutterstock/videos/12123842/preview/stock-footage-morning-light-brightens-up-the-sky.mp4,PT00H00M14S,037201_037250,Morning light brightens up the sky
32205277,https://ak.picdn.net/shutterstock/videos/32205277/preview/stock-footage-boy-passes-the-obstacle-course-in-the-sports-club.mp4,PT00H00M08S,061551_061600,Boy passes the obstacle course in the sports club
1032206084,https://ak.picdn.net/shutterstock/videos/1032206084/preview/stock-footage-closeup-of-door-of-a-house.mp4,PT00H00M10S,177351_177400,Closeup of door of a house
25750577,https://ak.picdn.net/shutterstock/videos/25750577/preview/stock-footage-lone-sailboat-sailing-on-wide-open-ocean-blue-sky-summer.mp4,PT00H00M19S,014801_014850,Lone sailboat sailing on wide open ocean blue sky summer
1037170934,https://ak.picdn.net/shutterstock/videos/1037170934/preview/stock-footage-girl-carving-halloween-pumpkin-in-kitchen-at-home.mp4,PT00H00M19S,197051_197100,Girl carving halloween pumpkin in kitchen at home
4849628,https://ak.picdn.net/shutterstock/videos/4849628/preview/stock-footage-fisherman-pulls-net.mp4,PT00H00M30S,013401_013450,Fisherman pulls net 1
14043338,https://ak.picdn.net/shutterstock/videos/14043338/preview/stock-footage-seamless-looping-d-animation-of-a-green-and-red-bars-diagram-up-to-and-including-luma-matte.mp4,PT00H00M50S,056451_056500,Seamless looping 3d animation of a green and red bars diagram up to 97% and 3% including luma matte
1061359435,https://ak.picdn.net/shutterstock/videos/1061359435/preview/stock-footage-lathe-machine-drilling-bushing-operator-machining-mold-and-die-part-by-cnc-turning-machine-in.mp4,PT00H00M17S,043151_043200,"Lathe machine, drilling bushing. operator machining mold and die part by cnc turning machine in factory. milling metalworking process. coolant and lubrication."
1035770639,https://ak.picdn.net/shutterstock/videos/1035770639/preview/stock-footage-thumbs-up-by-casual-man-looking-at-camera.mp4,PT00H00M07S,035901_035950,Thumbs up by casual man looking at camera
8671552,https://ak.picdn.net/shutterstock/videos/8671552/preview/stock-footage-female-children-girls-caucasian-family-heterosexual-parents-casual-relaxation-home-garden-cooking.mp4,PT00H00M20S,031351_031400,Female children girls caucasian family heterosexual parents casual relaxation home garden cooking barbecue grill teamwork vacation red epic
1038160553,https://ak.picdn.net/shutterstock/videos/1038160553/preview/stock-footage-underwater-scenery-of-rock-splash-foam-and-waves-on-surface.mp4,PT00H00M15S,067101_067150,Underwater scenery of rock splash foam and waves on surface
32761648,https://ak.picdn.net/shutterstock/videos/32761648/preview/stock-footage-dollar-icon-on-the-screen-k-resolution-encoder-prores-great-quality-looping.mp4,PT00H00M07S,197001_197050,Dollar icon on the screen. 4k resolution. encoder prores 4444. great quality. looping.
26317472,https://ak.picdn.net/shutterstock/videos/26317472/preview/stock-footage-phan-nga-thailand-november-speedboat-approaches-the-beach-of-koh-miang-similan.mp4,PT00H00M28S,146751_146800,"Phan nga, thailand - november 23, 2016: speedboat approaches the beach of koh miang, similan islands, slow motion"
30946483,https://ak.picdn.net/shutterstock/videos/30946483/preview/stock-footage-reticulated-giraffe-grazing-samburu-kenya-africa.mp4,PT00H00M17S,044251_044300,Reticulated giraffe grazing; samburu kenya africa
11161976,https://ak.picdn.net/shutterstock/videos/11161976/preview/stock-footage-aerial-drone-footage-the-abandoned-city-of-pripyat-near-chernobyl-once-a-beautiful-town-by-soviet.mp4,PT00H00M22S,106201_106250,"Aerial drone footage. the abandoned city of pripyat near chernobyl. once a beautiful town by soviet standards, its 50,000 inhabitants were evacuated 36 hours after the accident. 4k."
1030657925,https://ak.picdn.net/shutterstock/videos/1030657925/preview/stock-footage-blue-sky-time-lapse-k.mp4,PT00H00M10S,020151_020200,Blue sky time lapse 4k
1032534023,https://ak.picdn.net/shutterstock/videos/1032534023/preview/stock-footage-santa-marta-lighthouse-in-cascais-portugal-k-aerial-drone-view.mp4,PT00H00M29S,137751_137800,"Santa marta lighthouse in cascais, portugal, 4k aerial drone view"
6746017,https://ak.picdn.net/shutterstock/videos/6746017/preview/stock-footage-barcelona-april-view-of-plaza-d-espanya-plaza-of-spain-from-the-les-arenes-bullring.mp4,PT00H00M43S,017501_017550,"Barcelona - april 30:
view of plaza d'espanya (plaza of spain) from the les arenes bullring.
april 30, 2014 in barcelona, catalonia, spain"
5909318,https://ak.picdn.net/shutterstock/videos/5909318/preview/stock-footage-portrait-of-three-generations-of-caucasians-women-having-a-picnic-on-a-sunny-day.mp4,PT00H00M10S,144551_144600,Portrait of three generations of caucasians women having a picnic on a sunny day
1052484178,https://ak.picdn.net/shutterstock/videos/1052484178/preview/stock-footage-a-glass-of-tea-stands-on-the-nature-by-the-river.mp4,PT00H00M29S,140201_140250,A glass of tea stands on the nature by the river
23491714,https://ak.picdn.net/shutterstock/videos/23491714/preview/stock-footage-counting-from-zero-to-one-million-in-numbers.mp4,PT00H00M16S,104001_104050,Counting from zero to one million in numbers.
1021301161,https://ak.picdn.net/shutterstock/videos/1021301161/preview/stock-footage-black-and-white-count-down-timer-from-ten-to-zero.mp4,PT00H00M11S,026001_026050,Black and white count down timer from ten to zero
1006577251,https://ak.picdn.net/shutterstock/videos/1006577251/preview/stock-footage-asian-hacker-using-laptop-and-computers-in-cafe.mp4,PT00H00M12S,181701_181750,Asian hacker using laptop and computers in cafe.
2010830,https://ak.picdn.net/shutterstock/videos/2010830/preview/stock-footage-irrigation-pump-engine-in-farm.mp4,PT00H00M11S,140551_140600,Irrigation pump engine in farm
3508283,https://ak.picdn.net/shutterstock/videos/3508283/preview/stock-footage-horses-running-amongst-the-beautiful-rocky-mountains-herded-by-wrangler.mp4,PT00H00M10S,012501_012550,Horses running amongst the beautiful rocky mountains herded by wrangler
24447863,https://ak.picdn.net/shutterstock/videos/24447863/preview/stock-footage-factory-worker-hands-are-connecting-electrical-wires.mp4,PT00H00M14S,082801_082850,Factory worker hands are connecting electrical wires
1036817471,https://ak.picdn.net/shutterstock/videos/1036817471/preview/stock-footage-vintage-reel-player-with-spinning-bobbins.mp4,PT00H00M16S,026401_026450,Vintage reel player with spinning bobbins.
12606725,https://ak.picdn.net/shutterstock/videos/12606725/preview/stock-footage-boston-usa-jul-at-evening-the-private-yachts-in-the-charles-river-boston-usa.mp4,PT00H00M10S,183551_183600,"Boston, usa-jul 3,2015: at evening,the private yachts in the charles river, boston, usa
"
4313873,https://ak.picdn.net/shutterstock/videos/4313873/preview/stock-footage-boat-off-st-lazaria.mp4,PT00H00M11S,136351_136400,Boat off st lazaria
1040188595,https://ak.picdn.net/shutterstock/videos/1040188595/preview/stock-footage-vertical-video-aerial-shot-of-a-woman-meditating-on-a-marvelous-rice-field-during-sunrise-sunset.mp4,PT00H00M22S,196301_196350,Vertical video. aerial shot of a woman meditating on a marvelous rice field during sunrise-sunset
1049537239,https://ak.picdn.net/shutterstock/videos/1049537239/preview/stock-footage-aerial-view-of-island-in-red-sea-egypt.mp4,PT00H00M15S,173601_173650,"Aerial view of island in red sea, egypt"
1024334039,https://ak.picdn.net/shutterstock/videos/1024334039/preview/stock-footage-loading-iron-ore-into-railway-wagons-aero.mp4,PT00H00M15S,020351_020400,Loading iron ore into railway wagons aero
1034492717,https://ak.picdn.net/shutterstock/videos/1034492717/preview/stock-footage-moving-red-color-sheet-and-metal-roller.mp4,PT00H00M08S,199051_199100,Moving red color sheet and metal roller
1050824326,https://ak.picdn.net/shutterstock/videos/1050824326/preview/stock-footage-hawks-bill-turtle-at-elphinestone.mp4,PT00H00M09S,052901_052950,Hawks bill turtle at elphinestone 
1028770862,https://ak.picdn.net/shutterstock/videos/1028770862/preview/stock-footage-cooking-thai-northern-chicken-curry-or-hang-lay-in-pan-chiangmai-thailand.mp4,PT00H00M24S,115351_115400,Cooking thai northern chicken curry or hang lay   in pan  chiangmai thailand
4171498,https://ak.picdn.net/shutterstock/videos/4171498/preview/stock-footage--s-the-first-nuclear-power-plant-opens-at-shippingport-pa-in.mp4,PT00H02M33S,042951_043000,"1950s - the first nuclear power plant opens at shippingport, pa in 1958."
9370625,https://ak.picdn.net/shutterstock/videos/9370625/preview/stock-footage-mexico-people-on-zocalo-mexico-day-of-the-dead-celebration.mp4,PT00H00M12S,115801_115850,Mexico - 2014. people on zocalo mexico. day of  the dead celebration. 
1029374198,https://ak.picdn.net/shutterstock/videos/1029374198/preview/stock-footage-frog-toad-green-on-white-background.mp4,PT00H00M11S,051801_051850,Frog toad green on white background
1034589389,https://ak.picdn.net/shutterstock/videos/1034589389/preview/stock-footage-flat-icon-business-animation-motion-graphics-elements.mp4,PT00H00M06S,061001_061050,Flat icon business animation motion graphics elements
1014270560,https://ak.picdn.net/shutterstock/videos/1014270560/preview/stock-footage-adult-engineer-uses-the-tablet-in-operation-checks-the-drawing-of-building.mp4,PT00H00M17S,004351_004400,Adult engineer uses the tablet in operation checks the drawing of building.
31211809,https://ak.picdn.net/shutterstock/videos/31211809/preview/stock-footage-taro-farm-and-elephant-ear-farm-plantation-are-watered-by-sprinkler-farmers-plant-for-sell-shoots.mp4,PT00H00M20S,047051_047100,"Taro farm and elephant ear farm plantation are watered by sprinkler.
farmers plant for sell shoots, heads and stems for food..
"
33449950,https://ak.picdn.net/shutterstock/videos/33449950/preview/stock-footage-fitness-women-squats-with-dumbbells-in-hands.mp4,PT00H00M11S,021901_021950,Fitness women squats with dumbbells in hands.
1041772690,https://ak.picdn.net/shutterstock/videos/1041772690/preview/stock-footage-virginia-october-patriotic-american-revolutionary-war-era-flag-yellow-silk-liberty.mp4,PT00H00M09S,043351_043400,"Virginia - october 16, 2018 - patriotic, american revolutionary war era flag. yellow silk ""liberty"" flag for soldiers, carried in battle with soldiers in line to fight. 13 colonies.  american flag."
1057606351,https://ak.picdn.net/shutterstock/videos/1057606351/preview/stock-footage-pneumonia-alert-stamp-on-the-paper-doctor-s-workplace.mp4,PT00H00M05S,076251_076300,"Pneumonia alert stamp on the paper, doctor's workplace"
3152032,https://ak.picdn.net/shutterstock/videos/3152032/preview/stock-footage-two-baker-kneading-bread-in-slow-motion-and-a-spotlight-you-will-find-even-more-german-bakery.mp4,PT00H00M10S,100051_100100,"Two baker kneading bread in slow motion and a spotlight. you will find even more german bakery clips in my portfolio! 10823 
"
19437283,https://ak.picdn.net/shutterstock/videos/19437283/preview/stock-footage-the-rise-of-the-trawl-with-fish-barents-sea-spring.mp4,PT00H00M22S,093301_093350,The rise of the trawl with fish.barents sea.spring.
1018235488,https://ak.picdn.net/shutterstock/videos/1018235488/preview/stock-footage--k-close-up-front-view-of-cramped-chickens-in-a-large-scale-egg-laying-production-farm.mp4,PT00H00M14S,079251_079300,4k close-up front view of cramped chickens in a large scale egg laying production farm
14858743,https://ak.picdn.net/shutterstock/videos/14858743/preview/stock-footage-profile-view-of-a-grizzled-man-looking-up-to-the-ceiling.mp4,PT00H00M12S,004551_004600,Profile view of a grizzled man looking up to the ceiling
1032205316,https://ak.picdn.net/shutterstock/videos/1032205316/preview/stock-footage-louisville-metro-hall-with-jefferson-county-clerk-louisville-kentucky-june.mp4,PT00H00M07S,074051_074100,"Louisville metro hall with jefferson county clerk - louisville, kentucky - june 15, 2019"
2184058,https://ak.picdn.net/shutterstock/videos/2184058/preview/stock-footage-motion-dynamic-speed-in-p-fullhd-timelapse-view-from-escalator-with-many-people-in-berlin.mp4,PT00H00M06S,136401_136450,"Motion dynamic speed in 1080p fullhd timelapse view from escalator with many people in berlin, germany"
15869473,https://ak.picdn.net/shutterstock/videos/15869473/preview/stock-footage-white-cherry-flowers-blooming-in-springtime-blue-sky-through-the-flowers.mp4,PT00H00M18S,060751_060800,"White cherry flowers blooming in springtime. blue sky through the flowers.
"
1035199829,https://ak.picdn.net/shutterstock/videos/1035199829/preview/stock-footage-drone-view-of-a-dried-lake-in-the-swiss-alps.mp4,PT00H00M12S,184501_184550,Drone view of a dried lake in the swiss alps
1047108037,https://ak.picdn.net/shutterstock/videos/1047108037/preview/stock-footage-hand-loop-animation-cinema-d-d-hand.mp4,PT00H00M06S,033201_033250,"Hand loop animation, cinema 4d, 3d hand "
1020461341,https://ak.picdn.net/shutterstock/videos/1020461341/preview/stock-footage-fireworks-lighting-up-the-sky-as-part-of-th-national-day-celebrations-in-abu-dhabi-uae.mp4,PT00H00M10S,071151_071200,"Fireworks lighting up the sky as part of 47th national day celebrations in abu dhabi, uae"
2502473,https://ak.picdn.net/shutterstock/videos/2502473/preview/stock-footage-bees-in-a-beehive.mp4,PT00H00M22S,100801_100850,Bees in a beehive
11111756,https://ak.picdn.net/shutterstock/videos/11111756/preview/stock-footage-garlic-chili-and-corn-garland-and-fresh-vegetables-assortment-in-rustic-wooden-box.mp4,PT00H00M10S,084801_084850,"Garlic, chili and corn garland and fresh vegetables assortment in rustic wooden box"
1046716000,https://ak.picdn.net/shutterstock/videos/1046716000/preview/stock-footage-attractive-lady-in-stylish-white-blouse-performs-emotions-of-surprise-under-bright-electric-light.mp4,PT00H00M05S,144001_144050,Attractive lady in stylish white blouse performs emotions of surprise under bright electric light at etude audition
17174812,https://ak.picdn.net/shutterstock/videos/17174812/preview/stock-footage-abstract-polygonal-space-low-polygon-futuristic-hud-background.mp4,PT00H00M20S,103451_103500,Abstract polygonal space low polygon futuristic hud background.
1032872585,https://ak.picdn.net/shutterstock/videos/1032872585/preview/stock-footage-buffalo-walking-in-the-walter-travelling-rural-landmarks-of-fisherman-village-at-pakpra.mp4,PT00H00M15S,143201_143250,"Buffalo walking in the walter, travelling rural landmarks of fisherman village at pakpra phatthalung thailand."
11197355,https://ak.picdn.net/shutterstock/videos/11197355/preview/stock-footage-girlfriend-showing-something-on-smartphone-to-her-friend-on-the-beach-super-slow-motion-shot-at.mp4,PT00H00M23S,057551_057600,"Girlfriend showing something on smartphone to her friend on the beach, super slow motion, shot at 240fps
"
18731867,https://ak.picdn.net/shutterstock/videos/18731867/preview/stock-footage-starry-night-sky-spinning-around-time-lapse-video.mp4,PT00H00M05S,189801_189850,Starry night sky spinning around. time lapse video
1057416601,https://ak.picdn.net/shutterstock/videos/1057416601/preview/stock-footage-endless-field-with-tall-blooming-sunflowers-beautiful-landscape-woman-walks-in-the-field-and.mp4,PT00H00M38S,061401_061450,"Endless field with tall blooming sunflowers, beautiful landscape. woman walks in the field and admires the flowers, a romantic walk. 4k, 10bit, prores"
1031741798,https://ak.picdn.net/shutterstock/videos/1031741798/preview/stock-footage-young-man-runs-up-hill-in-forest-with-punctured-tire.mp4,PT00H00M12S,093551_093600,Young man runs up hill in forest with punctured tire
2859838,https://ak.picdn.net/shutterstock/videos/2859838/preview/stock-footage-kiev-ukraine-march-nationalist-protestors-clash-with-police-on-march-in-kiev-ukraine.mp4,PT00H00M25S,024201_024250,"Kiev, ukraine - march 9: nationalist protestors clash with police on march 9, 2011 in kiev, ukraine."
1019983609,https://ak.picdn.net/shutterstock/videos/1019983609/preview/stock-footage-athens-greece-may-the-ancient-coliseum-in-the-acropolis-historical-site.mp4,PT00H00M11S,123951_124000,"Athens,greece - may 3,2018 - the ancient coliseum in the acropolis historical site"
1032574754,https://ak.picdn.net/shutterstock/videos/1032574754/preview/stock-footage-air-bubbles-floating-up-to-the-water-surface-numerous-small-air-bubbles-rising-up-in-turquoise.mp4,PT00H00M21S,119051_119100,Air bubbles floating up to the water surface. numerous small air bubbles rising up in turquoise pure sea. warm sunshine penetrating crystal clear ocean water on sunny summer day. slow motion close up
1054455626,https://ak.picdn.net/shutterstock/videos/1054455626/preview/stock-footage-young-lady-counting-coins-in-hand.mp4,PT00H00M09S,069901_069950,Young lady counting coins in hand
25765235,https://ak.picdn.net/shutterstock/videos/25765235/preview/stock-footage-abstract-surreal-loop-motion-background-variegated-kaleidoscope.mp4,PT00H00M15S,045651_045700,"Abstract surreal loop motion background, variegated kaleidoscope"
21483679,https://ak.picdn.net/shutterstock/videos/21483679/preview/stock-footage-young-pretty-woman-in-swimsuit-relaxing-by-pool-super-slow-motion-fps.mp4,PT00H00M17S,079651_079700,"Young, pretty woman in swimsuit relaxing by pool, super slow motion 120fps
"
22995007,https://ak.picdn.net/shutterstock/videos/22995007/preview/stock-footage--k-happy-group-of-student-friends-making-a-video-call-on-computer-dec-uk.mp4,PT00H00M30S,136401_136450,4k happy group of student friends making a video call on computer dec 2016-uk
5436875,https://ak.picdn.net/shutterstock/videos/5436875/preview/stock-footage-two-sunloungers-with-hat-and-coconut-standing-on-beautiful-tropical-beach-white-sand-and-turquoise.mp4,PT00H00M19S,068851_068900,"Two sunloungers with hat and coconut standing on beautiful tropical beach, white sand and turquoise water. concept of perfect vacation. "
1028009117,https://ak.picdn.net/shutterstock/videos/1028009117/preview/stock-footage-surya-namaskar-woman-in-black-bodysuit-doing-yoga-practice-in-yellow-studio-on-stairs-background.mp4,PT00H00M13S,114301_114350,"Surya namaskar. woman in black bodysuit doing yoga practice in yellow studio on stairs background. health, lifestyle, sports concept."
