videoid,contentUrl,duration,page_dir,name
1014963019,https://ak.picdn.net/shutterstock/videos/1014963019/preview/stock-footage-young-athlete-woman-in-comfortable-sport-outfit-jumping-rope-on-a-sports-field-in-the-park-girl.mp4,PT00H00M21S,190651_190700,Young athlete woman in comfortable sport outfit jumping rope on a sports field in the park. girl doing jump rope workout on stadium background. fitness female doing skipping workout outdoors.
1063432678,https://ak.picdn.net/shutterstock/videos/1063432678/preview/stock-footage-chef-places-the-ripe-tomatoes-next-to-the-pork-cooked-with-vegetables.mp4,PT00H00M08S,010001_010050,Chef places the ripe tomatoes next to the pork cooked with vegetables.
3153511,https://ak.picdn.net/shutterstock/videos/3153511/preview/stock-footage-homer-ak-circa-this-snow-blower-is-clearing-the-sidewalk-next-to-the-homer-bypass-sterling.mp4,PT00H00M13S,050701_050750,"Homer, ak - circa 2012: this snow blower is clearing the sidewalk next to the homer bypass/sterling highway."
7215454,https://ak.picdn.net/shutterstock/videos/7215454/preview/stock-footage-happy-man-typing-message-on-cellphone-next-to-the-wall-with-tools.mp4,PT00H00M12S,096201_096250,"Happy man typing message on cellphone next to the wall with tools
"
1023052783,https://ak.picdn.net/shutterstock/videos/1023052783/preview/stock-footage-flight-over-a-lonely-little-island-in-the-blue-ocean-near-the-shore-line.mp4,PT00H00M15S,019351_019400,Flight over a lonely little island in the blue ocean near the shore line
31714828,https://ak.picdn.net/shutterstock/videos/31714828/preview/stock-footage-aerial-view-flying-over-the-beautiful-autumn-trees-in-forest-aerial-camera-shot-autumn-fall.mp4,PT00H00M18S,057201_057250,Aerial view. flying over the beautiful autumn trees in forest. aerial camera shot. autumn / fall landscape.
11309909,https://ak.picdn.net/shutterstock/videos/11309909/preview/stock-footage-mixing-purple-color-with-a-drill.mp4,PT00H00M22S,092901_092950,"Mixing purple color with a drill
"
1028437937,https://ak.picdn.net/shutterstock/videos/1028437937/preview/stock-footage-cute-little-boy-sitting-in-the-cafe-watching-cartoons-on-phone-with-parent.mp4,PT00H00M17S,008551_008600,Cute little boy sitting in the cafe watching cartoons on phone with parent.
13370123,https://ak.picdn.net/shutterstock/videos/13370123/preview/stock-footage-walnuts.mp4,PT00H00M29S,039801_039850,Walnuts 
1007427289,https://ak.picdn.net/shutterstock/videos/1007427289/preview/stock-footage-homemade-potato-chips-fast-food-popular-junk-food-potato-tubers-and-chips-rotate-smoothly-on.mp4,PT00H00M12S,005551_005600,Homemade potato chips. fast food. popular junk food. potato tubers and chips rotate smoothly on bamboo napkin. diabetic diet.
1026011825,https://ak.picdn.net/shutterstock/videos/1026011825/preview/stock-footage-helsinki-finland-march-old-vintage-cameras-at-flea-market-collection-of-antique-retro.mp4,PT00H00M09S,087151_087200,"Helsinki, finland - march 16, 2019: old vintage cameras at flea market. collection of antique retro-film analog cameras and lens"
4433018,https://ak.picdn.net/shutterstock/videos/4433018/preview/stock-footage-moscow-september-the-honor-cavalry-escort-presentation-devoted-to-patriotic-war-of-on.mp4,PT00H00M55S,073701_073750,"Moscow - september 7: the honor cavalry escort presentation devoted to patriotic war of 1812 on international military music festival spasskaya tower on september 7, 2012 in moscow. 
"
25221008,https://ak.picdn.net/shutterstock/videos/25221008/preview/stock-footage-sailboat-near-the-old-town-of-kotor-bay-of-kotor-montenegro.mp4,PT00H00M05S,178751_178800,"Sailboat near the old town of kotor, bay of kotor, montenegro"
1016834128,https://ak.picdn.net/shutterstock/videos/1016834128/preview/stock-footage-daughter-teaching-her-father-computer-skills-in-living-room-asian-man-with-white-beard-and-young.mp4,PT00H00M27S,087051_087100,Daughter teaching her father computer skills in living room. asian man with white beard and young woman sitting in living room using laptop. senior lifestyle family concept.
6579734,https://ak.picdn.net/shutterstock/videos/6579734/preview/stock-footage-laacher-see-volcano-on-the-crater-rim-rising-carbon-dioxide-forms-bubbles-eifel-region-germany.mp4,PT00H00M09S,123701_123750,"Laacher see volcano. on the crater rim rising carbon dioxide forms bubbles. (eifel region, germany)
"
8457502,https://ak.picdn.net/shutterstock/videos/8457502/preview/stock-footage-pushkar-india-october-unidentified-indian-people-attended-the-annual-pushkar-camel.mp4,PT00H00M33S,065701_065750,"Pushkar, india - october 26, 2014: unidentified indian people attended the annual pushkar camel mela. this fair is the largest camel trading fair in the world."
1051519084,https://ak.picdn.net/shutterstock/videos/1051519084/preview/stock-footage-blooming-rapeseed-field-at-the-sunny-day.mp4,PT00H00M14S,061651_061700,"Blooming rapeseed field at the sunny day
"
29370160,https://ak.picdn.net/shutterstock/videos/29370160/preview/stock-footage-young-beautiful-girl-posing-against-a-wheat-field-background.mp4,PT00H00M15S,005301_005350,Young beautiful girl posing against a wheat field background
1030893947,https://ak.picdn.net/shutterstock/videos/1030893947/preview/stock-footage-diverse-father-and-daughter-using-soldering-iron-on-car-on-circuit-board-at-office-he-is-teaching.mp4,PT00H00M12S,191701_191750,Diverse father and daughter using soldering iron on car on circuit board at office. he is teaching her 
1018757473,https://ak.picdn.net/shutterstock/videos/1018757473/preview/stock-footage-a-sunrise-on-the-coast-from-inside-the-cave-shot-cave-view-of-sunrise-sky-beautiful-sunrise-from.mp4,PT00H00M09S,109401_109450,A sunrise on the coast from inside the cave. shot. cave view of sunrise sky. beautiful sunrise from the mountain cave. beautiful light from the cave
1027931630,https://ak.picdn.net/shutterstock/videos/1027931630/preview/stock-footage-beautiful-young-woman-talking-to-the-phone-outdoors-brick-wall-background-slow-motion-clip-with.mp4,PT00H00M23S,130301_130350,"Beautiful young woman talking to the phone,outdoors, brick wall background, slow motion clip with gimbal
"
1013079713,https://ak.picdn.net/shutterstock/videos/1013079713/preview/stock-footage-sad-depressed-attractive-young-woman-crying-thinking-her-died-father.mp4,PT00H00M23S,070551_070600,"Sad depressed attractive young woman crying,thinking her died father"
32657977,https://ak.picdn.net/shutterstock/videos/32657977/preview/stock-footage-flying-on-sea-by-drone.mp4,PT00H00M34S,008651_008700,Flying on sea by drone
4564937,https://ak.picdn.net/shutterstock/videos/4564937/preview/stock-footage-healthy-woman-eating-an-apple-close-up.mp4,PT00H00M14S,143051_143100,"Healthy woman eating an apple, close up "
1038592685,https://ak.picdn.net/shutterstock/videos/1038592685/preview/stock-footage-red-parrot-fish-underwater-mediterranean-parrotfish.mp4,PT00H00M23S,072801_072850,Red parrot fish underwater mediterranean parrotfish
6159599,https://ak.picdn.net/shutterstock/videos/6159599/preview/stock-footage-wide-shot-of-rural-mountain-valley-lauterbrunnan-switzerland.mp4,PT00H00M13S,182401_182450,"Wide shot of rural mountain valley / lauterbrunnan, switzerland"
1023792700,https://ak.picdn.net/shutterstock/videos/1023792700/preview/stock-footage-glowing-bluemonero-xmr-cryptocurrency-symbol-appearing-against-the-background-of-a-spinning-globe.mp4,PT00H00M05S,007301_007350,Glowing bluemonero (xmr) cryptocurrency symbol appearing against the background of a spinning globe and falling blue glowing binary code symbols
30926620,https://ak.picdn.net/shutterstock/videos/30926620/preview/stock-footage-silhouette-of-beautiful-young-woman-practicing-morning-yoga-in-lotus-pose-on-tropical-sea-beach.mp4,PT00H00M17S,115301_115350,Silhouette of beautiful young woman practicing morning yoga in lotus pose on tropical sea beach with tree palms. slow motion.
1051626253,https://ak.picdn.net/shutterstock/videos/1051626253/preview/stock-footage-drone-view-from-savin-kuk-mountain-peak-and-surrounding-beauty.mp4,PT00H00M10S,030301_030350,Drone view from savin kuk mountain peak and surrounding beauty
1034735669,https://ak.picdn.net/shutterstock/videos/1034735669/preview/stock-footage-yokohama-japan-august-th-street-view-of-yokohama-chinatown-japan.mp4,PT00H00M16S,186601_186650,"Yokohama / japan - august 7th 2019: street view of yokohama chinatown, japan "
1031420165,https://ak.picdn.net/shutterstock/videos/1031420165/preview/stock-footage-drone-flying-above-dried-up-sea-between-a-boat-and-a-wooden-swing-in-bali.mp4,PT00H00M22S,016851_016900,Drone flying above dried up sea between a boat and a wooden swing in bali
1020451996,https://ak.picdn.net/shutterstock/videos/1020451996/preview/stock-footage-blurred-light-background-raindrops-falling-on-car-windshield-motion-movement-with-traffic-in-the.mp4,PT00H00M12S,110551_110600,Blurred light background. raindrops falling on car windshield. motion movement with traffic in the city on a rainy day at night. colorful bokeh.  selective focus.
1021284049,https://ak.picdn.net/shutterstock/videos/1021284049/preview/stock-footage-an-african-american-couple-of-lovers-spends-their-day-black-people-fall-in-love-with-each-other.mp4,PT00H00M10S,034751_034800,"An african american couple of lovers spends their day, black people fall in love with each other, the romantic atmosphere of young progressive people, the guy gives the girl gifts, an awkward guy"
25184489,https://ak.picdn.net/shutterstock/videos/25184489/preview/stock-footage-bokeh-movement-background-texture.mp4,PT00H01M52S,002401_002450,Bokeh movement background texture.
20649145,https://ak.picdn.net/shutterstock/videos/20649145/preview/stock-footage-coffee-for-two-two-cups-of-coffee-barista-pouring-frothed-milk-in-coffee-mugs-order-at-the.mp4,PT00H00M20S,002801_002850,Coffee for two. two cups of coffee. barista pouring frothed milk in coffee mugs. order at the coffee shop. coffee for customers. job barista. barista makes two coffees in coffee bar.
14738179,https://ak.picdn.net/shutterstock/videos/14738179/preview/stock-footage-taipei-taiwan-october-departure-hall-of-taoyuan-international-airport-in-taipei-taiwan.mp4,PT00H00M17S,148701_148750,"Taipei, taiwan - 13 october 2015: departure hall of taoyuan international airport in taipei, taiwan"
1052694278,https://ak.picdn.net/shutterstock/videos/1052694278/preview/stock-footage-the-human-spinal-column-blue-metal-sacrum-d-model-animation-on-a-white-background.mp4,PT00H00M18S,052151_052200,The human spinal column -blue metal- sacrum - 3d model animation on a white background
1020250039,https://ak.picdn.net/shutterstock/videos/1020250039/preview/stock-footage-couple-of-cows-with-different-color-eating-grass-in-paddy-field-agriculture-industrial-beautiful.mp4,PT00H00M34S,059251_059300,Couple of cows with different color eating grass in paddy field. agriculture industrial. beautiful countryside in thailand. livestock farm for village.
9904253,https://ak.picdn.net/shutterstock/videos/9904253/preview/stock-footage-keyboard-work.mp4,PT00H00M16S,128751_128800,Keyboard work
20730511,https://ak.picdn.net/shutterstock/videos/20730511/preview/stock-footage-the-schoolboy-writes-the-text-using-a-mobile-phone.mp4,PT00H00M16S,020951_021000,The schoolboy writes the text using a mobile phone
22879996,https://ak.picdn.net/shutterstock/videos/22879996/preview/stock-footage-ukrainians-wearing-folk-dresses-carry-the-stars-of-bethlehem-and-sing-carols-as-they-attend.mp4,PT00H00M16S,136701_136750,"Ukrainians wearing folk dresses carry the stars of bethlehem and sing carols as they attend christmas procession during celebration the orthodox christmas day in kiev, ukraine, on 07 january 2017. "
1063163083,https://ak.picdn.net/shutterstock/videos/1063163083/preview/stock-footage-joyful-family-happy-woman-hugging-her-husband-and-male-children-enjoying-walking-together-in-park.mp4,PT00H00M18S,194901_194950,"Joyful family, happy woman hugging her husband and male children enjoying walking together in park near trailer outdoors"
34766392,https://ak.picdn.net/shutterstock/videos/34766392/preview/stock-footage-aerial-wiev-a-large-karst-fault-due-to-submerged-salt-mines-k.mp4,PT00H00M20S,148701_148750,"Aerial wiev: a large karst fault due to submerged salt mines, 4k"
1055849375,https://ak.picdn.net/shutterstock/videos/1055849375/preview/stock-footage-asian-girl-flirting-over-the-phone-with-shyness.mp4,PT00H00M12S,177451_177500,Asian girl flirting over the phone with shyness
12039242,https://ak.picdn.net/shutterstock/videos/12039242/preview/stock-footage-blind-man-needs-help-nyc-new-york-usa.mp4,PT00H00M42S,113001_113050,"Blind man needs help nyc. new york, usa. 2010"
1016770717,https://ak.picdn.net/shutterstock/videos/1016770717/preview/stock-footage-drone-footage-of-the-coast-of-south-west-sumbawa-around-maluk-with-hills-covered-in-tropical.mp4,PT00H00M12S,085501_085550,Drone footage of the coast of south-west sumbawa around maluk with hills covered in tropical vegetation and rice fields in between. the camera is going backward over the fields.
1024647989,https://ak.picdn.net/shutterstock/videos/1024647989/preview/stock-footage-abstract-alcoholism-concept-silhouette-of-a-man-standing-in-the-middle-of-the-road-on-a-misty.mp4,PT00H00M20S,141251_141300,Abstract alcoholism concept. silhouette of a man standing in the middle of the road on a misty night with giant glasses filled with alcoholic beverage. creative artwork decoration
24964589,https://ak.picdn.net/shutterstock/videos/24964589/preview/stock-footage-close-up-of-haroset-with-fresh-organic-apple-and-ginger-serve-in-a-jar-as-traditional-jewish.mp4,PT00H00M12S,128551_128600,Close up of haroset with fresh organic apple and ginger serve in a jar as traditional jewish passover dessert celebration
1045926067,https://ak.picdn.net/shutterstock/videos/1045926067/preview/stock-footage-couple-walking-together-on-the-beach-in-australia-red-k.mp4,PT00H00M20S,054501_054550,Couple walking together on the beach in australia. red 4k
1047081121,https://ak.picdn.net/shutterstock/videos/1047081121/preview/stock-footage-manhattan-new-york-september-skyline-cityscape-view-from-battery-park-of-the-office.mp4,PT00H00M22S,136551_136600,"Manhattan, new york - september 21, 2019:  skyline cityscape view from battery park of the office buildings and skyscrapers over the hudson river waterfront of new jersey usa"
1037285768,https://ak.picdn.net/shutterstock/videos/1037285768/preview/stock-footage-golden-dollar-tokens-falling-on-ground-forming-separate-stacks-rendered-with-compositing-mask-for.mp4,PT00H00M20S,125401_125450,Golden dollar tokens falling on ground forming separate stacks. rendered with compositing mask for background replacement
1027730300,https://ak.picdn.net/shutterstock/videos/1027730300/preview/stock-footage-dam-on-nature-reservoir-lake.mp4,PT00H00M22S,070751_070800,Dam on nature reservoir lake
1010335859,https://ak.picdn.net/shutterstock/videos/1010335859/preview/stock-footage-colored-wildflowers-beauty-in-springtime-northern-hemisphere-nature-in-katmai-national-park-and.mp4,PT00H00M14S,015901_015950,Colored wildflowers beauty in springtime northern hemisphere nature in katmai national park and reserve wilderness alaska usa
2217496,https://ak.picdn.net/shutterstock/videos/2217496/preview/stock-footage-happy-woman-raising-her-sarong-on-the-beach.mp4,PT00H00M15S,090501_090550,Happy woman raising her sarong on the beach
1027070993,https://ak.picdn.net/shutterstock/videos/1027070993/preview/stock-footage-green-line-of-transform-cylinder-loop.mp4,PT00H00M10S,086951_087000,Green line of transform cylinder loop
1051443481,https://ak.picdn.net/shutterstock/videos/1051443481/preview/stock-footage-minsk-belarus-young-beautiful-teenage-female-sitting-near-the-house-washing-hands.mp4,PT00H00M19S,004501_004550,"Minsk/belarus - 22.04.2020. young beautiful teenage female sitting near the house, washing hands with sanitizer and eating sandwich. self-isolation. stay at home. quarantine time. coronavirus, covid-1"
17689534,https://ak.picdn.net/shutterstock/videos/17689534/preview/stock-footage-two-attractive-smiling-and-laughing-young-brunette-women-in-light-summer-dresses-doing-selfies-on.mp4,PT00H00M15S,120451_120500,Two attractive smiling and laughing young brunette women in light summer dresses doing selfies on streets of european town.
4344728,https://ak.picdn.net/shutterstock/videos/4344728/preview/stock-footage-sunset-polluted-sky-with-chemical-plant-background.mp4,PT00H00M47S,003501_003550,Sunset polluted sky with chemical plant background
1041158611,https://ak.picdn.net/shutterstock/videos/1041158611/preview/stock-footage-city-life-cars-and-boats-traffic-in-vietnam-k-drone-shot.mp4,PT00H00M11S,193851_193900,"City life, cars and boats traffic in vietnam 4k drone shot"
1053411416,https://ak.picdn.net/shutterstock/videos/1053411416/preview/stock-footage-shooting-from-a-height-of-a-mountain-river-mountain-river-from-the-heights.mp4,PT00H00M46S,064251_064300,Shooting from a height of a mountain river. mountain river from the heights.
15136195,https://ak.picdn.net/shutterstock/videos/15136195/preview/stock-footage-young-man-dancing-breakdance-on-hands-white-silhouette-slow-motion.mp4,PT00H00M07S,028151_028200,"Young man dancing breakdance on hands, white, silhouette, slow motion"
1031662103,https://ak.picdn.net/shutterstock/videos/1031662103/preview/stock-footage-green-beetle-cetonia-aurata-on-flower-bloom-closeup-shot.mp4,PT00H00M10S,064651_064700,Green beetle cetonia aurata on flower bloom. closeup shot
1028191541,https://ak.picdn.net/shutterstock/videos/1028191541/preview/stock-footage-marked-the-eighth-day-of-a-month-in-the-calendar-transforms-into-save-the-date-text.mp4,PT00H00M05S,063101_063150,Marked the eighth 8 day of a month in the calendar transforms into save the date text
1043610220,https://ak.picdn.net/shutterstock/videos/1043610220/preview/stock-footage-closeup-of-male-hands-make-glass-crafts-by-melting-glass-on-a-burner.mp4,PT00H00M17S,127851_127900,Closeup of male hands. make glass crafts by melting glass on a burner.
1010307359,https://ak.picdn.net/shutterstock/videos/1010307359/preview/stock-footage-wild-brown-bear-river-fishing-near-waterfall-for-fish-remote-wilderness-katmai-national-park-and.mp4,PT00H00M18S,028651_028700,Wild brown bear river fishing near waterfall for fish remote wilderness katmai national park and reserve alaska usa
20541070,https://ak.picdn.net/shutterstock/videos/20541070/preview/stock-footage-young-homeless-sitting-on-the-ground-smoking-a-cigarette.mp4,PT00H00M15S,032151_032200,Young homeless sitting on the ground smoking a cigarette
1012836092,https://ak.picdn.net/shutterstock/videos/1012836092/preview/stock-footage-butterfly-on-flower.mp4,PT00H00M11S,057201_057250,Butterfly on flower
1020028579,https://ak.picdn.net/shutterstock/videos/1020028579/preview/stock-footage-timelapse-long-exposure-shot-with-zoom-out-motion-of-traffic-at-freeway-in-los-angeles-at-night.mp4,PT00H00M20S,142151_142200,Timelapse long exposure shot with zoom out motion of traffic at 110 freeway in los angeles at night
32383846,https://ak.picdn.net/shutterstock/videos/32383846/preview/stock-footage-the-doctor-the-dentist-checks-the-teeth-of-a-young-girl-patient.mp4,PT00H00M19S,036051_036100,"The doctor, the dentist checks the teeth of a young girl patient"
20831539,https://ak.picdn.net/shutterstock/videos/20831539/preview/stock-footage-happy-young-woman-with-tablet-pc.mp4,PT00H00M12S,088101_088150,Happy young woman with tablet pc
1016215576,https://ak.picdn.net/shutterstock/videos/1016215576/preview/stock-footage-mysore-india-aug-view-of-krishna-raja-sagara-dam-a-historic-dam-gates-were-open-due.mp4,PT00H00M14S,089301_089350,"Mysore, india - aug, 2018 - view of 
krishna raja sagara dam - a historic dam gates were open due to floods,  mysore, karnataka,  india on aug 24-2018"
1036788416,https://ak.picdn.net/shutterstock/videos/1036788416/preview/stock-footage-japanese-pattern-red-and-white-plum-blossoms-and-clouds-loop.mp4,PT00H00M07S,148301_148350,Japanese pattern red and white plum blossoms and clouds loop
1053931973,https://ak.picdn.net/shutterstock/videos/1053931973/preview/stock-footage-funny-dancing-girl-in-the-street-cheerful-and-happy-young-woman-actively-dancing-while-walking.mp4,PT00H00M32S,080801_080850,Funny dancing girl in the street. cheerful and happy young woman actively dancing while walking along the street. she's wearing a pink overall. slow motion
1031296682,https://ak.picdn.net/shutterstock/videos/1031296682/preview/stock-footage-toilet-bowl-lavatory-in-modern-bathroom-with-black-and-grey-tiles-k-uhd-low-angle-crane-shot.mp4,PT00H00M09S,111251_111300,"Toilet bowl, lavatory in modern bathroom with black and grey tiles, 4k uhd, low angle crane shot"
1021107271,https://ak.picdn.net/shutterstock/videos/1021107271/preview/stock-footage-young-man-caressing-womans-hair-while-lying-on-mans-lap-couple-romancing-on-beach-during-sunset-k.mp4,PT00H00M11S,186101_186150,Young man caressing womans hair while lying on mans lap. couple romancing on beach during sunset 4k
1010809928,https://ak.picdn.net/shutterstock/videos/1010809928/preview/stock-footage-ducks-family-on-the-water-in-sunlight.mp4,PT00H00M07S,174301_174350,Ducks family on the water in sunlight.
11311229,https://ak.picdn.net/shutterstock/videos/11311229/preview/stock-footage-panorama-of-the-ice-surface-the-beauty-of-the-structure-of-the-ice-of-lake-baikal.mp4,PT00H00M20S,196151_196200,"Panorama of the ice surface
the beauty of the structure of the ice of lake baikal "
1047797497,https://ak.picdn.net/shutterstock/videos/1047797497/preview/stock-footage--s-men-and-women-monitor-computers-and-equipment.mp4,PT00H00M17S,046051_046100,1970s: men and women monitor computers and equipment.
1023233116,https://ak.picdn.net/shutterstock/videos/1023233116/preview/stock-footage-man-silhouette-goes-up-the-stairs-through-the-camera-natural-strobe-light-k.mp4,PT00H00M11S,027801_027850,Man silhouette goes up the stairs through the camera. natural strobe light. 4k
1012501127,https://ak.picdn.net/shutterstock/videos/1012501127/preview/stock-footage-elderly-grandmother-and-adult-granddaughter-at-home-knitting.mp4,PT00H00M11S,014551_014600,"Elderly grandmother and adult granddaughter at home, knitting."
28103170,https://ak.picdn.net/shutterstock/videos/28103170/preview/stock-footage-crane-hook-in-big-construction-site-in-develop-city.mp4,PT00H00M11S,055151_055200,Crane hook in big construction site in develop city
6401216,https://ak.picdn.net/shutterstock/videos/6401216/preview/stock-footage-close-up-shot-of-businessman-talking-on-cell-phone.mp4,PT00H00M15S,018551_018600,Close up shot of businessman talking on cell phone 
10871891,https://ak.picdn.net/shutterstock/videos/10871891/preview/stock-footage-minsk-belarus-on-july-air-sports-festival-clean-sky-sports-balloons-preparing-for.mp4,PT00H00M19S,146601_146650,"Minsk, belarus on 18-19 july 2015. air sports festival ""clean sky"" sports balloons, preparing for takeoff, takeoff, and a few colored balloons against the blue sky."
1013951927,https://ak.picdn.net/shutterstock/videos/1013951927/preview/stock-footage-lone-tourist-on-the-stone-footpath-of-zhangjiajie-national-park-at-dancy-mist.mp4,PT00H00M27S,002601_002650,Lone tourist on the stone footpath of zhangjiajie national park at dancy mist. 
8016310,https://ak.picdn.net/shutterstock/videos/8016310/preview/stock-footage-malaga-spain-people-admire-cityscape-view-in-malaga-spain.mp4,PT00H00M14S,023001_023050,"Malaga, spain - 25.10.2014 : people admire cityscape view in malaga, spain - 25.10.2014"
3385667,https://ak.picdn.net/shutterstock/videos/3385667/preview/stock-footage-coral-reef.mp4,PT00H00M10S,040051_040100,Coral reef
10320278,https://ak.picdn.net/shutterstock/videos/10320278/preview/stock-footage-modern-cable-car-lifting-tourists-to-skiing-run-mountain-resort.mp4,PT00H00M18S,063451_063500,"Modern cable car lifting tourists to skiing run, mountain resort"
457312,https://ak.picdn.net/shutterstock/videos/457312/preview/stock-footage-time-lapse-of-new-york-city-contrasting-apartment-and-office-buildings-in-greenwich-village-and.mp4,PT00H00M12S,065001_065050,"Time lapse of new york city contrasting apartment and office buildings in greenwich village and clouds passing. twelve seconds, longer version available."
1054333082,https://ak.picdn.net/shutterstock/videos/1054333082/preview/stock-footage-wild-landscape-of-a-natural-park-in-madrid-spain-june.mp4,PT00H00M15S,076551_076600,"Wild landscape of a natural park in madrid, spain. june 14, 2020."
13624283,https://ak.picdn.net/shutterstock/videos/13624283/preview/stock-footage-rough-stream-of-forest-river-at-autumn-day.mp4,PT00H00M11S,000401_000450,Rough stream of forest river at autumn day
1064027824,https://ak.picdn.net/shutterstock/videos/1064027824/preview/stock-footage-a-young-romantic-couple-sitting-on-a-bench-in-an-autumn-park-by-the-river-back-view-man-and-woman.mp4,PT00H00M18S,045801_045850,A young romantic couple sitting on a bench in an autumn park by the river. back view. man and woman hugging each other. couple in love. beautiful autumn park with falling yellow foliage from the trees
1011140480,https://ak.picdn.net/shutterstock/videos/1011140480/preview/stock-footage-split-croatia-april-view-of-a-plane-flying-above-a-cruise-ship.mp4,PT00H00M15S,116001_116050,"Split, croatia - april, 2016: view of a plane flying above a cruise ship."
1043139025,https://ak.picdn.net/shutterstock/videos/1043139025/preview/stock-footage-male-contractor-uses-a-nail-gun-on-a-load-bearing-roof-truss.mp4,PT00H00M10S,194901_194950,Male contractor uses a nail gun on a load bearing roof truss.
10753151,https://ak.picdn.net/shutterstock/videos/10753151/preview/stock-footage-desert-landscape.mp4,PT00H00M13S,103201_103250,Desert landscape
