videoid,contentUrl,duration,page_dir,name
10018784,https://ak.picdn.net/shutterstock/videos/10018784/preview/stock-footage-ottawa-canada-may-protestors-gather-on-parliament-hill-for-march-for-life-the-nation-s.mp4,PT00H00M07S,179851_179900,"Ottawa, canada - may 2015 - protestors gather on parliament hill for march for life the nation's largest pro-life rally."
1055927138,https://ak.picdn.net/shutterstock/videos/1055927138/preview/stock-footage-goat-eating-grass-in-field.mp4,PT00H00M07S,193451_193500,Goat eating grass in field
1026913199,https://ak.picdn.net/shutterstock/videos/1026913199/preview/stock-footage-wild-ducks-floating-in-the-city-pond-and-swim-near-the-shore.mp4,PT00H00M24S,097201_097250,Wild ducks floating in the city pond and swim near the shore.
1027550138,https://ak.picdn.net/shutterstock/videos/1027550138/preview/stock-footage-watercolor-fuzzy-coral-brush-strokes-horizontal-transition-in-and-out.mp4,PT00H00M10S,107901_107950,Watercolor fuzzy coral brush strokes horizontal transition in and out
26357303,https://ak.picdn.net/shutterstock/videos/26357303/preview/stock-footage-israeli-mountain-gazelle-behind-bushes.mp4,PT00H00M12S,028851_028900,Israeli mountain gazelle behind bushes
1026402353,https://ak.picdn.net/shutterstock/videos/1026402353/preview/stock-footage-close-up-slow-motion-shot-details-of-motorcycle-at-sunset-on-the-street.mp4,PT00H00M19S,140701_140750,Close-up slow motion shot. details of motorcycle at sunset on the street 
1026839024,https://ak.picdn.net/shutterstock/videos/1026839024/preview/stock-footage-hannover-germany-april-a-robot-is-playing-against-people-at-the-hannover-fair-showing.mp4,PT00H00M08S,073801_073850,Hannover / germany - april 02 2019 : a robot is playing against people at the hannover fair showing artificial intelligence.
1007714107,https://ak.picdn.net/shutterstock/videos/1007714107/preview/stock-footage-pretty-woman-with-red-wavy-hair-is-posing-in-a-room-with-dark-wall-and-lights-she-is-putting-hands.mp4,PT00H00M09S,197201_197250,Pretty woman with red wavy hair is posing in a room with dark wall and lights. she is putting hands on a chair and turning her body
1042250983,https://ak.picdn.net/shutterstock/videos/1042250983/preview/stock-footage-hydra-is-a-genus-of-small-fresh-water-animals-of-the-phylum-cnidaria-and-class-hydrozoa-under-the.mp4,PT00H00M26S,065501_065550,"Hydra is a genus of small, fresh-water animals of the phylum cnidaria and class hydrozoa under the microscope for education.
"
1031706365,https://ak.picdn.net/shutterstock/videos/1031706365/preview/stock-footage-sunset-and-the-huge-bridge-and-building-group.mp4,PT00H00M19S,117051_117100,Sunset and the huge bridge and building group
32164000,https://ak.picdn.net/shutterstock/videos/32164000/preview/stock-footage-dog-eat-on-the-grass.mp4,PT00H00M24S,035301_035350,Dog eat on the grass
1033665572,https://ak.picdn.net/shutterstock/videos/1033665572/preview/stock-footage-male-mule-deer-grazing-in-north-american-shrubland.mp4,PT00H00M08S,181401_181450,Male mule deer grazing in north american shrubland 
3115783,https://ak.picdn.net/shutterstock/videos/3115783/preview/stock-footage-a-woman-decorates-a-small-christmas-tree-in-a-house.mp4,PT00H00M15S,107301_107350,A woman decorates a small christmas tree in a house
1037926919,https://ak.picdn.net/shutterstock/videos/1037926919/preview/stock-footage-ciudad-del-este-paraguay-aerial-view-drone-footage.mp4,PT00H00M19S,002351_002400,"Ciudad del este, paraguay (aerial view, drone footage)"
1008961493,https://ak.picdn.net/shutterstock/videos/1008961493/preview/stock-footage-moscow-russia-may-tired-yet-happy-joggers-crowd-relax-walking-after-marathon-finish.mp4,PT00H00M13S,006401_006450,"Moscow, russia - may 28, 2017: tired yet happy joggers crowd relax walking after marathon finish line at city road on cold summer day"
1026326021,https://ak.picdn.net/shutterstock/videos/1026326021/preview/stock-footage-aerial-drone-shot-of-a-river-and-mountains-in-highlands-of-iceland.mp4,PT00H00M13S,036701_036750,Aerial drone shot of a river and mountains in highlands of iceland
26684962,https://ak.picdn.net/shutterstock/videos/26684962/preview/stock-footage-young-male-professional-in-casual-suit-holds-documents-and-has-the-successful-talk-on-the-phone.mp4,PT00H00M43S,170651_170700,Young male professional in casual suit holds documents and has the successful talk on the phone with his partner or customer
34388005,https://ak.picdn.net/shutterstock/videos/34388005/preview/stock-footage-old-aspen-tree-trunk-roots-and-branches.mp4,PT00H00M28S,011451_011500,"Old aspen tree trunk, roots and branches"
1013630363,https://ak.picdn.net/shutterstock/videos/1013630363/preview/stock-footage-japan-tokyo-june-young-boy-sitting-in-cafe-use-phone-drink-juice-smile-feel-happy.mp4,PT00H00M20S,178151_178200,"Japan-tokyo, june. 30, 2012. young boy sitting in cafe use phone drink juice smile feel happy outdoor guy business fashion hand child sun man nature internet social smartphone teenager cell"
2500925,https://ak.picdn.net/shutterstock/videos/2500925/preview/stock-footage-woman-making-a-salad.mp4,PT00H00M14S,003151_003200,Woman making a salad
34766737,https://ak.picdn.net/shutterstock/videos/34766737/preview/stock-footage-beautiful-and-relaxed-woman-enjoys-her-coffee-in-the-kitchen.mp4,PT00H00M14S,049501_049550,Beautiful and relaxed woman enjoys her coffee in the kitchen
26649841,https://ak.picdn.net/shutterstock/videos/26649841/preview/stock-footage-boy-climb-a-hillside-using-equipment-steadicam-follow-shot.mp4,PT00H00M06S,053751_053800,Boy climb a hillside using equipment. steadicam follow shot
1023123004,https://ak.picdn.net/shutterstock/videos/1023123004/preview/stock-footage-the-bone-is-removed-from-the-date-and-placed-in-a-blender-with-crushed-almonds-blender-stay-on.mp4,PT00H00M09S,074351_074400,The bone is removed from the date and placed in a blender with crushed almonds. blender stay on wooden desk. 
1017055636,https://ak.picdn.net/shutterstock/videos/1017055636/preview/stock-footage-back-view-of-financier-businessman-works-on-the-financial-market-on-computer.mp4,PT00H00M19S,176501_176550,Back view of financier businessman works on the financial market on computer
31660573,https://ak.picdn.net/shutterstock/videos/31660573/preview/stock-footage-busy-online-video-chat-on-laptop-at-work-by-young-female.mp4,PT00H00M17S,171301_171350,Busy online video chat on laptop at work by young female
1014020834,https://ak.picdn.net/shutterstock/videos/1014020834/preview/stock-footage-hold-a-merchant-ship-repair-a-merchant-ship-workers-check-equipment-russia-murmansk.mp4,PT00H00M07S,186801_186850,"Hold a merchant ship. repair a merchant ship, workers check equipment. russia, murmansk, 20.06.2018"
24846746,https://ak.picdn.net/shutterstock/videos/24846746/preview/stock-footage-couple-taking-rest-together.mp4,PT00H00M30S,179101_179150,Couple taking rest together
14897563,https://ak.picdn.net/shutterstock/videos/14897563/preview/stock-footage-rolling-background-fresh-flowers-on-a-pink-background-raw-video-record.mp4,PT00H00M11S,001201_001250,Rolling background. fresh flowers on a pink background. raw video record.
4375328,https://ak.picdn.net/shutterstock/videos/4375328/preview/stock-footage-water-cascades-over-rocks-waterfall-in-forest.mp4,PT00H00M16S,033001_033050,Water cascades over rocks waterfall in forest
1045841080,https://ak.picdn.net/shutterstock/videos/1045841080/preview/stock-footage-ontario-canada-view-from-a-boat-sailing-in-a-small-town-bay-on-a-sunny-day-and-typical-summer.mp4,PT00H00M05S,070551_070600,Ontario canada-1958: view from a boat sailing in a small town bay on a sunny day and typical summer heat
1019184952,https://ak.picdn.net/shutterstock/videos/1019184952/preview/stock-footage-beauty-saloon-barbershop-the-stylist-paints-his-client-s-hair-the-girl-sits-in-a-chair-in-front.mp4,PT00H00M13S,122151_122200,Beauty saloon. barbershop. the stylist paints his client's hair. the girl sits in a chair in front of a mirror. close-up.
1028969303,https://ak.picdn.net/shutterstock/videos/1028969303/preview/stock-footage-beauty-glitter-glitter-background-art-video-illustration.mp4,PT00H00M06S,135151_135200,"Beauty glitter glitter background, art video illustration."
1014078800,https://ak.picdn.net/shutterstock/videos/1014078800/preview/stock-footage-toxic-green-algae-in-lake-ontario-at-toronto-during-summer-heatwave.mp4,PT00H00M15S,106301_106350,Toxic green algae in lake ontario at toronto during summer heatwave
11807249,https://ak.picdn.net/shutterstock/videos/11807249/preview/stock-footage-molten-metal-melted-in-furnace-at-metallurgical-plant.mp4,PT00H00M19S,170501_170550,Molten metal melted in furnace at metallurgical plant
13952693,https://ak.picdn.net/shutterstock/videos/13952693/preview/stock-footage--k-ultra-hd-version-interior-view-of-empty-office-work-stations-in-a-large-contemporary-city.mp4,PT00H00M24S,177251_177300,4k / ultra hd version interior view of empty office work stations in a large contemporary city office building. no people. shot on red epic
1012355537,https://ak.picdn.net/shutterstock/videos/1012355537/preview/stock-footage--s-man-walks-through-department-store-man-opens-doors-and-enters-department-store-man-walks.mp4,PT00H00M31S,109601_109650,1990s: man walks through department store. man opens doors and enters department store. man walks through department store.
1031383931,https://ak.picdn.net/shutterstock/videos/1031383931/preview/stock-footage-battle-for-technological-supremacy-digital-technology-hi-tech-concept.mp4,PT00H00M18S,189801_189850,Battle for technological supremacy digital technology hi-tech concept
1056192611,https://ak.picdn.net/shutterstock/videos/1056192611/preview/stock-footage-residential-area-in-the-suburbs-of-yokohama-at-dusk-yokohama-is-a-city-in-japan.mp4,PT00H00M16S,047801_047850,Residential area in the suburbs of yokohama at dusk/yokohama is a city in japan
1015266064,https://ak.picdn.net/shutterstock/videos/1015266064/preview/stock-footage-aerial-view-japan-ricefield.mp4,PT00H00M22S,132901_132950,Aerial view japan ricefield
1023391846,https://ak.picdn.net/shutterstock/videos/1023391846/preview/stock-footage-green-top-numbers-coundown-motion-graphic-background.mp4,PT00H00M53S,001751_001800,Green top 10 numbers coundown motion graphic background
8369782,https://ak.picdn.net/shutterstock/videos/8369782/preview/stock-footage-kitten-have-fun-playing-with-mouse-toy-attached-to-scratching-post-closeup.mp4,PT00H00M07S,144251_144300,Kitten have fun playing with mouse toy attached to scratching post closeup
1466167,https://ak.picdn.net/shutterstock/videos/1466167/preview/stock-footage-unusual-flower-astilbe.mp4,PT00H00M14S,147201_147250,"Unusual flower, astilbe "
1014125543,https://ak.picdn.net/shutterstock/videos/1014125543/preview/stock-footage-sunny-and-hot-afternoon-in-the-the-west-bund-park-along-the-waitan-river-and-the-bund-in-shanghai.mp4,PT00H00M20S,183701_183750,"Sunny and hot afternoon in the  the west bund park along the waitan river and the bund in shanghai, china. june 2018."
1042968475,https://ak.picdn.net/shutterstock/videos/1042968475/preview/stock-footage-bedford-virginia-usa-kids-at-a-park-with-an-adult.mp4,PT00H00M05S,176151_176200,Bedford virginia usa-1971: kids at a park with an adult
1026532217,https://ak.picdn.net/shutterstock/videos/1026532217/preview/stock-footage-toronto-ontario-canada-march-memorial-for-ethiopian-airlines-boeing-max-plane-crash.mp4,PT00H00M32S,079301_079350,"Toronto, ontario, canada march 2019 memorial for ethiopian airlines boeing 737 max 8 plane crash victims"
1026291386,https://ak.picdn.net/shutterstock/videos/1026291386/preview/stock-footage-romania-cluj-napoca-june-man-starting-to-run-on-a-blue-track.mp4,PT00H00M09S,080151_080200,"Romania, cluj-napoca - june 2018: man starting to run on a blue track."
11818022,https://ak.picdn.net/shutterstock/videos/11818022/preview/stock-footage-flying-through-palm-trees-in-miami-beach-aerial-video.mp4,PT00H00M29S,117051_117100,Flying through palm trees in miami beach aerial video
11502731,https://ak.picdn.net/shutterstock/videos/11502731/preview/stock-footage-aurangabad-india-january-tourists-passing-through-the-halls-of-aurangabad-caves.mp4,PT00H00M13S,140151_140200,"Aurangabad, india - 14 january 2015: tourists passing through the halls of aurangabad caves."
1048716151,https://ak.picdn.net/shutterstock/videos/1048716151/preview/stock-footage-sioux-falls-south-dakota-a-trip-to-south-dakota-sign-and-then-a-waterfall-with-rocks.mp4,PT00H00M05S,110301_110350,Sioux falls south dakota-1960: a trip to south dakota sign and then a waterfall with rocks
1036923749,https://ak.picdn.net/shutterstock/videos/1036923749/preview/stock-footage-close-up-a-girl-stands-at-the-mirror-examines-her-face-touches-the-skin-and-at-the-end-shows-the.mp4,PT00H00M33S,120101_120150,"Close-up, a girl stands at the mirror examines her face touches the skin, and at the end shows the tongue"
26024075,https://ak.picdn.net/shutterstock/videos/26024075/preview/stock-footage-poznan-poland-april-motor-show-international-car-fair-crowds-of-visitors-at.mp4,PT00H00M26S,097201_097250,"Poznan, poland, april 06-09, 2017: motor show, international car fair: crowds of visitors at mercedes booth"
4425938,https://ak.picdn.net/shutterstock/videos/4425938/preview/stock-footage-roasted-beef-meat-served-with-asparagus-on-plate-x-intro-motion-slow-hidef-hd.mp4,PT00H00M15S,171651_171700,Roasted beef meat served with asparagus on plate 1920x1080 intro motion slow hidef hd
1013112185,https://ak.picdn.net/shutterstock/videos/1013112185/preview/stock-footage-shaving-of-beard-barber-cutting-men-s-face-hair-with-beard-trimmer-at-barbershop-k.mp4,PT00H00M14S,108201_108250,Shaving of beard. barber cutting men's face hair with beard trimmer at barbershop. 4k
12475271,https://ak.picdn.net/shutterstock/videos/12475271/preview/stock-footage-malta-june-a-woman-sells-her-fresh-seafood-in-an-outdoor-market-in-malta-valletta-malta.mp4,PT00H00M04S,047351_047400,"Malta - june 2015: a woman sells her fresh seafood in an outdoor market in malta. valletta, malta - june, 2015"
1052452936,https://ak.picdn.net/shutterstock/videos/1052452936/preview/stock-footage-lot-of-white-maggots-in-transparent-container-for-catching-fish-or-pet-food-alternative-form-of.mp4,PT00H00M12S,121051_121100,Lot of white maggots in transparent container for catching fish or pet food. alternative form of life
1045679569,https://ak.picdn.net/shutterstock/videos/1045679569/preview/stock-footage-the-drawing-process-of-copper-wire-for-the-production-of-electric-cable.mp4,PT00H00M11S,118151_118200,The drawing process of copper wire for the production of electric cable.
5818595,https://ak.picdn.net/shutterstock/videos/5818595/preview/stock-footage-particle-space-red-colour.mp4,PT00H00M30S,022551_022600,Particle space red colour
1036033121,https://ak.picdn.net/shutterstock/videos/1036033121/preview/stock-footage-rain-drops-splashing-water-show-the-surface-of-puddle-on-the-wet-floor-nature-background-of-a.mp4,PT00H00M30S,072501_072550,"Rain drops splashing water show the surface of puddle on the wet floor, nature background of a rainy weather day with heavy rainfall, the camera close up and low angle. -video slow motion"
1010124998,https://ak.picdn.net/shutterstock/videos/1010124998/preview/stock-footage-hoi-an-hoian-vietnam-april-tourists-walking-along-a-cozy-street-decorated-with.mp4,PT00H00M15S,195301_195350,"Hoi an (hoian), vietnam - april 11, 2018: tourists walking along a cozy street decorated with colorful lanterns at hoi an ancient town in evening. scenic night view of souvenir shops."
1015801570,https://ak.picdn.net/shutterstock/videos/1015801570/preview/stock-footage-orange-background-with-rotating-discs-useful-for-many-different-applications-d-rendering-and.mp4,PT00H00M10S,014651_014700,"Orange background with rotating discs, useful for many different applications (3d rendering and loopable)"
17599804,https://ak.picdn.net/shutterstock/videos/17599804/preview/stock-footage-moscow-may-salvor-helps-children-with-their-boat-during-regatta-on-ostankinsky-pond-at.mp4,PT00H00M12S,052101_052150,"Moscow - may 09, 2016: salvor helps children with their boat during regatta on ostankinsky pond at spring sunny day. aerial view"
1048980265,https://ak.picdn.net/shutterstock/videos/1048980265/preview/stock-footage-nice-france-aerial-video-from-nice-in-the-french-riviera-taken-by-drone-camera-from-above.mp4,PT00H00M07S,070551_070600,"Nice / france    aerial video from nice in the french riviera   , taken by drone camera from above   "
1012180622,https://ak.picdn.net/shutterstock/videos/1012180622/preview/stock-footage-barcelona-spain-may-stabilized-walking-footage-along-la-rambla-famous-street-with.mp4,PT00H00M40S,051601_051650,"Barcelona, spain - may 16, 2018: stabilized walking footage along la rambla famous street with crowds of locals and tourists, on a sunny day"
1055459135,https://ak.picdn.net/shutterstock/videos/1055459135/preview/stock-footage-close-up-bubbles-in-green-colored-water-flowing-water-on-black-background-whirlpool-in-the-water.mp4,PT00H00M49S,149101_149150,Close up bubbles in green colored water. flowing water on black background. whirlpool in the water mixing by stirrer. circle flow background with reflections
1048270483,https://ak.picdn.net/shutterstock/videos/1048270483/preview/stock-footage-circa-civilians-are-seen-sweeping-up-debris-from-the-wreckage-of-a-large-building-in-postwar.mp4,PT00H01M02S,114301_114350,Circa 1946 - civilians are seen sweeping up debris from the wreckage of a large building in postwar hiroshima.
10829606,https://ak.picdn.net/shutterstock/videos/10829606/preview/stock-footage-toronto-ontario-canada-july-pleasure-boats-and-sailboats-on-sunny-summer-day-in-toronto.mp4,PT00H00M06S,032651_032700,"Toronto, ontario, canada july 2015 pleasure boats and sailboats on sunny summer day in toronto
"
9130031,https://ak.picdn.net/shutterstock/videos/9130031/preview/stock-footage--k-empty-wheelchair-on-hospital-ward-with-patients-staff-walking-in-background.mp4,PT00H00M19S,080001_080050,4k empty wheelchair on hospital ward with patients & staff walking in background
1036506986,https://ak.picdn.net/shutterstock/videos/1036506986/preview/stock-footage-nurse-bringing-senior-woman-flowers.mp4,PT00H00M08S,062551_062600,Nurse bringing senior woman flowers
32103754,https://ak.picdn.net/shutterstock/videos/32103754/preview/stock-footage-markham-ontario-canada-october-confused-canada-geese-not-migrating-due-to-warm-autumn-weather.mp4,PT00H00M31S,008751_008800,"Markham, ontario, canada october 2017 confused canada geese not migrating due to warm autumn weather"
1046956336,https://ak.picdn.net/shutterstock/videos/1046956336/preview/stock-footage-young-man-making-calm-down-gesture-body-language-concept-isolated-on-white-background.mp4,PT00H00M05S,086501_086550,"Young man making calm down gesture. body language concept. isolated, on white background"
1011330842,https://ak.picdn.net/shutterstock/videos/1011330842/preview/stock-footage-kuala-lumpur-malaysia-april-st-clear-blue-sky-time-lapse-of-kuala-lumpur-city-skyline.mp4,PT00H00M13S,130101_130150,"Kuala lumpur, malaysia - april 1st 2018 : clear blue sky time lapse of kuala lumpur city skyline with busy streets and rushing cars during weekdays morning. kuala lumpur is capital nation of malaysia"
8190022,https://ak.picdn.net/shutterstock/videos/8190022/preview/stock-footage-prague-czech-republic-november-business-buildings-offices-night-windows-with.mp4,PT00H00M46S,035401_035450,"Prague, czech republic - november 28, 2014: business buildings (offices) - night - windows with lights - city - leafless trees"
21064846,https://ak.picdn.net/shutterstock/videos/21064846/preview/stock-footage-aerial-view-of-jet-ski-rider.mp4,PT00H00M11S,170851_170900,Aerial view of jet ski rider
1064535940,https://ak.picdn.net/shutterstock/videos/1064535940/preview/stock-footage--s-toddler-in-jumpsuit-walks-on-grassy-lawn-explores-surroundings-walks-down-sidewalk.mp4,PT00H00M37S,147401_147450,"1950s: toddler in jumpsuit walks on grassy lawn, explores surroundings, walks down sidewalk."
1014697700,https://ak.picdn.net/shutterstock/videos/1014697700/preview/stock-footage--d-structure-red-wave-background-beautiful-organic-red-texture-seamless-looping-animation.mp4,PT00H00M15S,014451_014500,3d structure. red wave background. beautiful organic red texture. seamless looping animation. motion surface. ornate modern shape
1059501761,https://ak.picdn.net/shutterstock/videos/1059501761/preview/stock-footage-woman-pouring-milk-to-paper-cup-on-a-table-in-a-cafe.mp4,PT00H00M10S,071201_071250,Woman pouring milk to paper cup on a table in a cafe.
1029344891,https://ak.picdn.net/shutterstock/videos/1029344891/preview/stock-footage-chef-pouring-icing-sugar-over-a-piece-of-cake.mp4,PT00H00M07S,176801_176850,Chef pouring icing sugar over a piece of cake
1012362668,https://ak.picdn.net/shutterstock/videos/1012362668/preview/stock-footage-professional-video-of-happy-man-spinning-and-having-fun-in-tropical-resort-in-k-slow-motion-fps.mp4,PT00H00M21S,176401_176450,Professional video of happy man spinning and having fun in tropical resort in 4k slow motion 60fps
10022891,https://ak.picdn.net/shutterstock/videos/10022891/preview/stock-footage-sexual-girl-stripper-pole-dancer-warms-up-body-k-x.mp4,PT00H00M21S,030851_030900,"Sexual  girl stripper  pole dancer warms up  body. 4k 3840x2160
"
1043090014,https://ak.picdn.net/shutterstock/videos/1043090014/preview/stock-footage-close-up-of-glittering-balls-hanging-on-the-christmas-tree-handheld-shot.mp4,PT00H00M06S,046751_046800,Close-up of glittering balls hanging on the christmas tree. handheld shot
10105082,https://ak.picdn.net/shutterstock/videos/10105082/preview/stock-footage-jerusalem-israel-september-blood-bag.mp4,PT00H00M06S,185701_185750,"Jerusalem, israel - september 8 2014: blood bag"
26829013,https://ak.picdn.net/shutterstock/videos/26829013/preview/stock-footage-a-number-of-matches-ignited-from-one-another-creating-a-flower.mp4,PT00H00M29S,054751_054800,"A number of matches ignited from one another, creating a flower."
1042256890,https://ak.picdn.net/shutterstock/videos/1042256890/preview/stock-footage-celebrating-greeting-beautiful-fireworks-for-abstract-background-anniversary-celebration-new.mp4,PT00H00M20S,027351_027400,"Celebrating greeting beautiful fireworks for abstract background, anniversary, celebration, new year background."
1011023945,https://ak.picdn.net/shutterstock/videos/1011023945/preview/stock-footage-young-birch-poplar-windy-sunny-day-blue-sky.mp4,PT00H00M14S,026701_026750,"Young birch, poplar, windy, sunny day, blue sky"
1040984675,https://ak.picdn.net/shutterstock/videos/1040984675/preview/stock-footage-clothes-are-getting-put-into-the-suitcase-by-a-joyful-woman.mp4,PT00H00M14S,061401_061450,Clothes are getting put into the suitcase by a joyful woman
1015783294,https://ak.picdn.net/shutterstock/videos/1015783294/preview/stock-footage-smiling-couple-toasting-during-romantic-dinner-slow-motion.mp4,PT00H00M56S,069601_069650,Smiling couple toasting during romantic dinner - slow motion
1043101714,https://ak.picdn.net/shutterstock/videos/1043101714/preview/stock-footage-macau-zhuhai-border-earial-cityscape-night-timelapse-pan-up.mp4,PT00H00M08S,186051_186100,Macau – zhuhai border earial cityscape night timelapse pan up
20012341,https://ak.picdn.net/shutterstock/videos/20012341/preview/stock-footage-bad-ems-germany-a-beautiful-town-in-sunny-weather.mp4,PT00H00M08S,148101_148150,"Bad ems, germany a beautiful town in sunny weather"
1012929242,https://ak.picdn.net/shutterstock/videos/1012929242/preview/stock-footage-group-of-runners-jogging-exercising-together-running-competitive-race-training-workout-in-urban.mp4,PT00H00M05S,076601_076650,Group of runners jogging exercising together running competitive race training workout in urban city healthy fitness lifestyle
1056410282,https://ak.picdn.net/shutterstock/videos/1056410282/preview/stock-footage-woman-eat-shrimp-at-home.mp4,PT00H00M32S,182601_182650,Woman eat shrimp at home
6407009,https://ak.picdn.net/shutterstock/videos/6407009/preview/stock-footage-distant-view-young-caucasian-asian-chinese-people-vacation-enjoying-mainland-sightseeing-tour.mp4,PT00H00M22S,035401_035450,Distant view young caucasian asian chinese people vacation enjoying mainland sightseeing tour sailing aboard traditional designed chinese junk shot on red epic
3950429,https://ak.picdn.net/shutterstock/videos/3950429/preview/stock-footage-rooster-search-for-food.mp4,PT00H00M09S,072101_072150,Rooster search for food
14495470,https://ak.picdn.net/shutterstock/videos/14495470/preview/stock-footage-snowy-winter-park.mp4,PT00H00M53S,140351_140400,Snowy winter park
13875203,https://ak.picdn.net/shutterstock/videos/13875203/preview/stock-footage-water-leaking-from-hole-in-a-hose.mp4,PT00H00M18S,078801_078850,Water leaking from hole in a hose
5806151,https://ak.picdn.net/shutterstock/videos/5806151/preview/stock-footage-vietnam-river-landscape-and-rice-fields-panoramic-view-ninh-binh-asia-travel-landmark-destination.mp4,PT00H00M23S,040501_040550,Vietnam river landscape and rice fields panoramic view ninh binh. asia travel landmark destination hd video footage
1031504540,https://ak.picdn.net/shutterstock/videos/1031504540/preview/stock-footage-flying-above-farming-agricultural-tents-in-south-israel-kibbutz-k-aerial.mp4,PT00H00M31S,060601_060650,Flying above farming agricultural tents in south israel kibbutz 4k aerial
1021042081,https://ak.picdn.net/shutterstock/videos/1021042081/preview/stock-footage-waves-of-pink-fabric-from-the-blowing-wind-the-background-of-matter-motion-is-animated.mp4,PT00H00M09S,012351_012400,Waves of pink fabric from the blowing wind. the background of matter motion is animated. 
