videoid,contentUrl,duration,page_dir,name
1043328757,https://ak.picdn.net/shutterstock/videos/1043328757/preview/stock-footage-close-up-portrait-of-young-couple-standing-on-the-hill-kissing-and-hugging-each-other-beautiful.mp4,PT00H00M08S,091951_092000,Close up portrait of young couple standing on the hill kissing and hugging each other. beautiful woman touching her boyfriend. looking happy and satisfied. handsome man smiling
1050782755,https://ak.picdn.net/shutterstock/videos/1050782755/preview/stock-footage-young-man-massaging-her-painful-foot-from-exercise-health-problem-concept.mp4,PT00H00M15S,133901_133950,"Young man massaging her painful foot from exercise, health problem concept"
1044568978,https://ak.picdn.net/shutterstock/videos/1044568978/preview/stock-footage-wreck-underwater-with-fish-school-around-car-bus-wreck-with-wheels-tropical-water-scenery.mp4,PT00H00M33S,138951_139000,Wreck underwater with fish school around car bus wreck with wheels tropical water scenery
1024800131,https://ak.picdn.net/shutterstock/videos/1024800131/preview/stock-footage-blue-clear-sky-rolling-clouds-time-lapse-fast-motion-fluffy-puffy-building-formating-cloudscape.mp4,PT00H00M25S,128251_128300,"Blue clear sky, rolling clouds time lapse, fast motion fluffy, puffy building, formating cloudscape in horizon, summer sunny beautiful weather, big angry time. -uhd."
5788259,https://ak.picdn.net/shutterstock/videos/5788259/preview/stock-footage-alarm-clock.mp4,PT00H00M14S,001301_001350,Alarm clock
25457945,https://ak.picdn.net/shutterstock/videos/25457945/preview/stock-footage-slow-motion-of-young-abyssinian-cat-sitting-in-cardboard-box-k-fps-prores-footage.mp4,PT00H00M30S,180551_180600,"Slow motion of young abyssinian cat sitting in cardboard box, 4k 60fps prores footage"
1038641240,https://ak.picdn.net/shutterstock/videos/1038641240/preview/stock-footage-man-and-woman-happy-couple-are-having-fun-at-home-vacuuming-carpet-in-bedroom-dancing-singing.mp4,PT00H00M11S,179251_179300,"Man and woman happy couple are having fun at home vacuuming carpet in bedroom dancing singing enjoying music, girl is clapping hands. people and lifestyle concept."
1044488644,https://ak.picdn.net/shutterstock/videos/1044488644/preview/stock-footage-young-woman-shopping-in-trade-store-choosing-bra-and-takes-photo-of-underwear-on-hangers-girl.mp4,PT00H00M19S,082251_082300,"Young woman shopping in trade store, choosing bra and takes photo of underwear on hangers. girl looking for perfect lingerie"
1010048879,https://ak.picdn.net/shutterstock/videos/1010048879/preview/stock-footage-aerial-sunlight-view-of-scenic-cloudy-summits-of-tongass-national-forest-mountains-alexander.mp4,PT00H00M20S,089701_089750,Aerial sunlight view of scenic cloudy summits of tongass national forest mountains alexander archipelago wilderness ketchikan southern alaska north pacific ocean usa
1014228041,https://ak.picdn.net/shutterstock/videos/1014228041/preview/stock-footage-sparkling-graphic-particles.mp4,PT00H00M05S,149101_149150,Sparkling graphic particles
4994834,https://ak.picdn.net/shutterstock/videos/4994834/preview/stock-footage-car-scrapyard-crashing-a-car.mp4,PT00H00M29S,026801_026850,Car scrapyard - crashing a car
1031045444,https://ak.picdn.net/shutterstock/videos/1031045444/preview/stock-footage-dragon-fly-sitting-in-the-grass-near-the-pond.mp4,PT00H00M10S,056451_056500,"Dragon fly sitting in the grass near the pond
"
1047760639,https://ak.picdn.net/shutterstock/videos/1047760639/preview/stock-footage-beautiful-brown-horse-standing-in-the-wind-with-leaves-blowing-in-the-spring-time-young-brown.mp4,PT00H00M16S,140251_140300,"Beautiful brown horse standing in the wind with leaves blowing in the spring time, young brown horse standing behind a fence staring at the camera man."
32367109,https://ak.picdn.net/shutterstock/videos/32367109/preview/stock-footage-dynamic-network-connection-zoom-blue.mp4,PT00H00M30S,024401_024450,Dynamic network connection zoom blue
1022506627,https://ak.picdn.net/shutterstock/videos/1022506627/preview/stock-footage-sunset-over-the-winter-cathedral-in-saint-petersburg.mp4,PT00H00M19S,044001_044050,Sunset over the winter cathedral in saint-petersburg
1008756089,https://ak.picdn.net/shutterstock/videos/1008756089/preview/stock-footage-young-mother-with-child-swinging-on-swing-set-outdoor-in-winter-park-snow-falling-snowfall.mp4,PT00H00M16S,001951_002000,"Young mother with child swinging on swing set outdoor in winter park. snow falling, snowfall , winter time 4k"
26009177,https://ak.picdn.net/shutterstock/videos/26009177/preview/stock-footage-abstract-technology-and-engineering-background-with-original-organic-motion.mp4,PT00H00M14S,175251_175300,Abstract technology and engineering background with original organic motion 
31777576,https://ak.picdn.net/shutterstock/videos/31777576/preview/stock-footage-jackfish-underwater-jack-fish-patrolling-on-the-reef-ocean-scenery-scuba-divers-to-see.mp4,PT00H00M27S,081851_081900,Jackfish underwater jack fish patrolling on the reef ocean scenery scuba divers to see 
1022113081,https://ak.picdn.net/shutterstock/videos/1022113081/preview/stock-footage-aerial-traditional-balinese-temple-pura-ulun-danu-tamblingan-k-cinematic-travel-footage-bali.mp4,PT00H00M20S,062401_062450,"Aerial: traditional balinese temple - pura ulun danu tamblingan. 4k cinematic travel footage. bali, indonesia."
17802082,https://ak.picdn.net/shutterstock/videos/17802082/preview/stock-footage-large-scenic-waterfall-aerial-view.mp4,PT00H00M08S,177801_177850,Large scenic waterfall aerial view
20262229,https://ak.picdn.net/shutterstock/videos/20262229/preview/stock-footage-hicksville-new-york-three-women-talk-as-they-sit-in-chairs-at-a-gathering-in-a-yard.mp4,PT00H00M06S,133351_133400,"Hicksville, new york 1957: three women talk as they sit in chairs at a gathering in a yard"
17412334,https://ak.picdn.net/shutterstock/videos/17412334/preview/stock-footage--k-timelapse-wat-chiang-man-is-the-oldest-temple-in-chiangmai-thailand.mp4,PT00H00M12S,148251_148300,"4k timelapse wat chiang man is the oldest temple in chiangmai, thailand.
"
1058992229,https://ak.picdn.net/shutterstock/videos/1058992229/preview/stock-footage-particle-line-effect-which-creates-a-luxurious-effect-suitable-for-technology-videos.mp4,PT00H00M09S,187701_187750,"Particle line effect, which creates a luxurious effect, suitable for technology videos"
19826866,https://ak.picdn.net/shutterstock/videos/19826866/preview/stock-footage-multicoloured-footage-test.mp4,PT00H00M05S,002951_003000,Multicoloured footage- test
1035947216,https://ak.picdn.net/shutterstock/videos/1035947216/preview/stock-footage-male-worker-with-tools-fluorescent-vest-and-protective-helmet-at-construction-site-interior.mp4,PT00H00M12S,077401_077450,"Male worker with tools, fluorescent vest and protective helmet at construction site interior.
"
1024078697,https://ak.picdn.net/shutterstock/videos/1024078697/preview/stock-footage-mix-red-noodles-and-deep-fried-garlic-in-a-bowl.mp4,PT00H00M26S,180051_180100,Mix red noodles and deep fried garlic in a bowl. 
18612653,https://ak.picdn.net/shutterstock/videos/18612653/preview/stock-footage-herbs-battered-by-wind-lit-by-the-sun-goes-to-sleep.mp4,PT00H00M15S,198101_198150,"Herbs battered by wind lit by the sun goes to sleep 20
"
1046547832,https://ak.picdn.net/shutterstock/videos/1046547832/preview/stock-footage-happy-date-young-woman-smiling-at-the-camera-entering-in-cafeteria.mp4,PT00H00M07S,035101_035150,Happy date. young woman smiling at the camera entering in cafeteria
10640213,https://ak.picdn.net/shutterstock/videos/10640213/preview/stock-footage-ocean-wave-breaking-on-stony-tropical-beach-at-sunset-time-high-definition-full-hd-x.mp4,PT00H00M55S,125001_125050,"Ocean wave breaking on stony tropical beach at sunset time, high definition, full hd, 1920x1080"
1019835982,https://ak.picdn.net/shutterstock/videos/1019835982/preview/stock-footage-seaside-town-timeilapse-white-clouds-and-sea-and-islands-gocek.mp4,PT00H00M16S,045851_045900,Seaside town timeilapse white clouds and sea and islands gocek
19803058,https://ak.picdn.net/shutterstock/videos/19803058/preview/stock-footage-mischievous-squirrel-jumps-on-a-tree-and-waving-his-tail.mp4,PT00H00M18S,182901_182950,Mischievous squirrel jumps on a tree and waving his tail
1007212039,https://ak.picdn.net/shutterstock/videos/1007212039/preview/stock-footage-a-mother-with-a-child-and-a-dog-labrador-walks-through-the-woods-in-winter-all-in-white-snow.mp4,PT00H00M10S,027201_027250,"A mother with a child and a dog (labrador) walks through the woods, in winter, all in white snow and trees."
1278280,https://ak.picdn.net/shutterstock/videos/1278280/preview/stock-footage-pan-over-house-of-parliament-with-union-jack.mp4,PT00H00M15S,191851_191900,Pan over house of parliament with union jack
24474533,https://ak.picdn.net/shutterstock/videos/24474533/preview/stock-footage-man-and-woman-arguing-near-her-broken-down-car-out-of-focus.mp4,PT00H00M16S,025851_025900,Man and woman arguing near her broken down car. out of focus.
32005816,https://ak.picdn.net/shutterstock/videos/32005816/preview/stock-footage-barista-pouring-hot-water-for-drip-coffee.mp4,PT00H00M16S,059401_059450,Barista pouring hot water for drip coffee
1059754673,https://ak.picdn.net/shutterstock/videos/1059754673/preview/stock-footage-molecule-igg-family-model-d-antibody-immunology.mp4,PT00H00M18S,094551_094600,Molecule igg family - model 3d - antibody immunology.
1033487996,https://ak.picdn.net/shutterstock/videos/1033487996/preview/stock-footage-abstract-digital-glitch-art-animation-effect-retro-futurism-wave-style-video-signal-damage-with.mp4,PT00H00M07S,034651_034700,Abstract digital glitch art animation effect. retro futurism wave style. video signal damage with pixel noise and error interference
1014202388,https://ak.picdn.net/shutterstock/videos/1014202388/preview/stock-footage-unidentified-people-at-the-capitola-rod-and-custom-classic-car-show-in-capitola-by-the-sea.mp4,PT00H00M15S,122651_122700,"Unidentified people at the capitola rod and custom classic car show in capitola by the sea, california, usa, on the 9th of june, 2018"
1011808511,https://ak.picdn.net/shutterstock/videos/1011808511/preview/stock-footage-the-happy-daughter-and-a-mother-laying-on-the-bed.mp4,PT00H00M11S,106401_106450,The happy daughter and a mother laying on the bed
1017035341,https://ak.picdn.net/shutterstock/videos/1017035341/preview/stock-footage-sexual-man-dance-on-red-background.mp4,PT00H00M16S,027351_027400,Sexual man dance on red background
1011297926,https://ak.picdn.net/shutterstock/videos/1011297926/preview/stock-footage--fitness-man-in-the-gym.mp4,PT00H00M12S,111951_112000, fitness man in the gym. 
4581290,https://ak.picdn.net/shutterstock/videos/4581290/preview/stock-footage-khujand-tajikistan-june-local-shoppers-are-purchasing-fresh-fruits-and-vegetables-at.mp4,PT00H00M14S,188901_188950,"Khujand, tajikistan - 12 june 2013: local shoppers are purchasing fresh fruits and vegetables at the bazaar in khujand, tajikistan"
1013612384,https://ak.picdn.net/shutterstock/videos/1013612384/preview/stock-footage-a-young-man-spits-blood-after-a-street-fight-k.mp4,PT00H00M22S,043451_043500,A young man spits blood after a street fight. 4k
1057870183,https://ak.picdn.net/shutterstock/videos/1057870183/preview/stock-footage--d-tooth-scanning-in-modern-dentistry-dental-prosthetic-restoration-full-automatic-process-of.mp4,PT00H00M28S,135501_135550,3d tooth scanning in modern dentistry. dental prosthetic restoration. full automatic process of making 3d model for sculpted plastic denture with high tech digital scanning equipment. 4 k video
6989710,https://ak.picdn.net/shutterstock/videos/6989710/preview/stock-footage-buenos-aires-argentina-this-a-creation-of-julio-le-parc-at-the-malba-museum-in-buenos.mp4,PT00H00M14S,131051_131100,"Buenos aires, argentina 07/28/2014. this a creation of julio le parc at the malba museum in buenos aires, argentina"
25428626,https://ak.picdn.net/shutterstock/videos/25428626/preview/stock-footage-bangkok-thailand-circa-jan-interior-of-the-passenger-terminal-at-suvarnabhumi-airport-in.mp4,PT00H00M29S,057151_057200,"Bangkok, thailand - circa jan 2017: interior of the passenger terminal at suvarnabhumi airport in bangkok"
11202191,https://ak.picdn.net/shutterstock/videos/11202191/preview/stock-footage-paragliding-in-abant-bolu-turkey.mp4,PT00H00M10S,138051_138100,"Paragliding in abant bolu, turkey"
1017302194,https://ak.picdn.net/shutterstock/videos/1017302194/preview/stock-footage-medicated-plants-in-the-fields.mp4,PT00H00M10S,072401_072450,Medicated plants in the fields
5230904,https://ak.picdn.net/shutterstock/videos/5230904/preview/stock-footage-sunflowers-in-full-bloom-dancing-in-the-wind.mp4,PT00H00M16S,135701_135750,Sunflowers in full bloom dancing in the wind.
1035964778,https://ak.picdn.net/shutterstock/videos/1035964778/preview/stock-footage-man-driving-a-combine-and-harvesting-the-wheat.mp4,PT00H00M25S,018201_018250,Man driving a combine and harvesting the wheat.
1050827056,https://ak.picdn.net/shutterstock/videos/1050827056/preview/stock-footage-a-father-spends-time-with-his-young-daughter-playing-with-her-on-the-floor-creating-different.mp4,PT00H00M26S,065351_065400,"A father spends time with his young daughter, playing with her on the floor creating different fantastic creatures from the constructor."
10853078,https://ak.picdn.net/shutterstock/videos/10853078/preview/stock-footage--passengers-on-a-plane-sharing-an-electronic-device-ipad-tablet.mp4,PT00H00M26S,051401_051450,2 passengers on a plane sharing an electronic device/ipad/tablet
5974616,https://ak.picdn.net/shutterstock/videos/5974616/preview/stock-footage-little-african-american-girls-slicing-organic-vegetables-pizza-lunch-watched-by-grandparents-while.mp4,PT00H00M16S,180101_180150,Little african american girls slicing organic vegetables pizza lunch watched by grandparents while mom organizes work using laptop smart phone 
9847679,https://ak.picdn.net/shutterstock/videos/9847679/preview/stock-footage-tycho-brahe-castle-aerial-view.mp4,PT00H00M13S,089451_089500,Tycho brahe castle aerial view
1050471313,https://ak.picdn.net/shutterstock/videos/1050471313/preview/stock-footage-making-latte-at-home-italian-espresso-some-milk-and-homemade-latte-stay-home.mp4,PT00H00M18S,187301_187350,"Making latte at home. italian espresso, some milk and homemade latte. stay home."
1013166296,https://ak.picdn.net/shutterstock/videos/1013166296/preview/stock-footage-thies-region-animation-map-regions-of-senegal.mp4,PT00H00M15S,122351_122400,"Thies region - animation map
regions of senegal"
1033549550,https://ak.picdn.net/shutterstock/videos/1033549550/preview/stock-footage-the-old-city-of-porto-in-portugal-europe-k-aerial-skyline-drone-view-ungraded-raw.mp4,PT00H00M21S,101251_101300,"The old city of porto in portugal, europe, 4k aerial skyline drone view ungraded raw"
1048164688,https://ak.picdn.net/shutterstock/videos/1048164688/preview/stock-footage-a-snow-covered-hiking-trail-in-the-forest-with-a-stream-along-the-way-it-s-winter-and-you-can-see.mp4,PT00H00M19S,027851_027900,A snow-covered hiking trail in the forest with a stream along the way. it's winter and you can see footprints in the snow
1027728599,https://ak.picdn.net/shutterstock/videos/1027728599/preview/stock-footage-aerial-spain-barcelona-shipping-yard-june-sunny-day-mm-wide-angle-k-inspire-prores.mp4,PT00H00M21S,170251_170300,"Aerial spain barcelona shipping yard june 2018 sunny day 15mm wide angle 4k inspire 2 prores

aerial video of downtown barcelona and its shipping yards in spain on a beautiful sunny day with a wide an"
18755831,https://ak.picdn.net/shutterstock/videos/18755831/preview/stock-footage-aerial-view-of-a-large-transmission-tower.mp4,PT00H00M12S,066651_066700,Aerial view of a large transmission tower
1012111454,https://ak.picdn.net/shutterstock/videos/1012111454/preview/stock-footage-famous-waterfall-seljalandsfoss-in-iceland-from-a-aerial-birds-eye-perspective-isone-of-the-most.mp4,PT00H00M17S,141001_141050,Famous waterfall seljalandsfoss in iceland from a aerial birds eye perspective. isone of the most beautiful falls in the world in drone view shot
1051785298,https://ak.picdn.net/shutterstock/videos/1051785298/preview/stock-footage-childhood-leisure-and-people-concept-happy-teenage-having-pillows-fight-at-home.mp4,PT00H00M21S,181251_181300,"Childhood, leisure and people concept - happy teenage having pillows fight at home"
1030377641,https://ak.picdn.net/shutterstock/videos/1030377641/preview/stock-footage-sped-up-footage-of-yellow-bellied-slider-turtle-on-shore-in-green-grass-near-pond-moving-its-head.mp4,PT00H00M10S,068951_069000,"Sped up footage of yellow-bellied slider turtle on shore in green grass, near pond, moving its head around quickly. fixed angle, 4k dci, 200 mbps, light graded."
25715375,https://ak.picdn.net/shutterstock/videos/25715375/preview/stock-footage-abstract-background-with-animation-of-burning-wood-surface-with-shopping-symbol-on-surface.mp4,PT00H00M20S,038201_038250,Abstract background with animation of burning wood surface with shopping symbol on surface. animation of seamless loop.
28233931,https://ak.picdn.net/shutterstock/videos/28233931/preview/stock-footage-neptune-planet-zoom-in-on-solar-system-with-stars-an-fiery-sun-k-some-elements-furnished-by-nasa.mp4,PT00H00M15S,106951_107000,"Neptune planet zoom in on solar system with stars an fiery sun, 4k some elements furnished by nasa images"
1039271669,https://ak.picdn.net/shutterstock/videos/1039271669/preview/stock-footage-close-up-shot-of-juicy-ripe-oranges-hanging-on-branches-of-an-orange-tree-greece-k.mp4,PT00H00M14S,013901_013950,Close-up shot of juicy ripe oranges hanging on branches of an orange tree. greece. 4k
9217403,https://ak.picdn.net/shutterstock/videos/9217403/preview/stock-footage-farmer-examines-oats-slow-motion-full-hd-video-footage.mp4,PT00H00M24S,042301_042350,Farmer examines oats. slow motion. full hd 1080 video footage. 
22581247,https://ak.picdn.net/shutterstock/videos/22581247/preview/stock-footage-entertainment-animated-word-cloud.mp4,PT00H00M15S,149301_149350,Entertainment animated word cloud.
1016240620,https://ak.picdn.net/shutterstock/videos/1016240620/preview/stock-footage-beautiful-young-wedding-couple-outdoors-in-the-garden.mp4,PT00H00M12S,021301_021350,Beautiful young wedding couple outdoors in the garden
1059147188,https://ak.picdn.net/shutterstock/videos/1059147188/preview/stock-footage-download-green-screen-character-animation-for-your-next-project.mp4,PT00H00M19S,188401_188450,Download green screen character animation for your next project.
11046470,https://ak.picdn.net/shutterstock/videos/11046470/preview/stock-footage-pretty-young-red-haired-happy-girl-walking-in-sunny-park-smiling-laughing-steadicam-slow-motion.mp4,PT00H00M28S,010101_010150,"Pretty young red haired happy girl walking in sunny park smiling, laughing. steadicam, slow motion."
1030089824,https://ak.picdn.net/shutterstock/videos/1030089824/preview/stock-footage-pretty-candid-cute-woman-leaning-head-on-hands.mp4,PT00H00M10S,030151_030200,Pretty candid cute woman leaning head on hands
7317277,https://ak.picdn.net/shutterstock/videos/7317277/preview/stock-footage-father-and-son-walking-with-fish.mp4,PT00H00M09S,194501_194550,Father and son walking with fish
1057753192,https://ak.picdn.net/shutterstock/videos/1057753192/preview/stock-footage-portrait-of-senior-old-businessman-having-loss-on-smartphone.mp4,PT00H00M08S,005801_005850,Portrait of senior old businessman having loss on smartphone 
7492708,https://ak.picdn.net/shutterstock/videos/7492708/preview/stock-footage-ladore-falls-tallulah-gorge-state-park-georgia-cfs-aesthetic-water-release.mp4,PT00H00M32S,046701_046750,"Ladore falls, tallulah gorge state park, georgia.  200cfs aesthetic water release."
25548020,https://ak.picdn.net/shutterstock/videos/25548020/preview/stock-footage-maine-a-still-shot-of-the-colt-armory-in-hartford-ct-behind-trees-on-a-sunny-day.mp4,PT00H00M08S,091801_091850,"Maine 1971: a still shot of the colt armory in hartford ct, behind trees on a sunny day"
1031745293,https://ak.picdn.net/shutterstock/videos/1031745293/preview/stock-footage-close-up-professional-neck-and-shoulders-massage-healty-lifestyle-concept-and-treatment-pain-in.mp4,PT00H00M19S,010501_010550,Close-up professional neck and shoulders massage. healty lifestyle concept and treatment pain in joints spine
24288386,https://ak.picdn.net/shutterstock/videos/24288386/preview/stock-footage-nuclear-power-plant-ohu-near-landshut-bavaria-germany.mp4,PT00H00M15S,042651_042700,"Nuclear power plant ohu near landshut, bavaria, germany"
29943295,https://ak.picdn.net/shutterstock/videos/29943295/preview/stock-footage-abstract-animated-changing-kaleidoscope-mosaic-background-seamless-loop-video-retro-dark-purple.mp4,PT00H00M20S,004601_004650,"Abstract animated changing kaleidoscope mosaic background seamless loop video - retro dark purple and blue colors
"
1053588887,https://ak.picdn.net/shutterstock/videos/1053588887/preview/stock-footage-mountain-aerial-drone-footage-there-is-indonesian-flag-and-some-climbers-in-the-morning.mp4,PT00H00M50S,012301_012350,Mountain aerial drone footage. there is indonesian flag and some climbers in the morning
1022301448,https://ak.picdn.net/shutterstock/videos/1022301448/preview/stock-footage-sand-and-waves-splashing-the-beach-crystal-clear-water-phuket-beach.mp4,PT00H00M41S,054701_054750,"Sand and waves splashing the beach,crystal clear water phuket beach"
18710810,https://ak.picdn.net/shutterstock/videos/18710810/preview/stock-footage-bielsko-biala-poland-july-world-youth-days-with-papa-francesco-auschwitz.mp4,PT00H00M08S,078151_078200,"Bielsko-biala, poland - july 24, 2016: world youth days with papa francesco - auschwitz concentration camp - barracks and barbed wire"
16360111,https://ak.picdn.net/shutterstock/videos/16360111/preview/stock-footage-ants-are-eating-honey-dew-from-aphids-on-a-mulberry-tree.mp4,PT00H00M30S,102501_102550,Ants are eating honey dew from aphids on a mulberry tree. 
15952714,https://ak.picdn.net/shutterstock/videos/15952714/preview/stock-footage-two-women-throw-up-snow-tubes-outdoor-at-winter-day.mp4,PT00H00M06S,014451_014500,Two women throw up snow tubes outdoor at winter day
1019089342,https://ak.picdn.net/shutterstock/videos/1019089342/preview/stock-footage-lisbon-portugal-november-alfama-district-in-lisbon-alfama-is-one-of-the-oldest-districts.mp4,PT00H00M31S,089351_089400,"Lisbon portugal. 06 november 2018. alfama district in lisbon, alfama is one of the oldest districts in lisbon."
4383197,https://ak.picdn.net/shutterstock/videos/4383197/preview/stock-footage-customer-use-the-shopping-cart-in-the-parking-pov.mp4,PT00H00M16S,034351_034400,Customer use the shopping cart in the parking  pov
31374496,https://ak.picdn.net/shutterstock/videos/31374496/preview/stock-footage-close-up-of-smiling-sportswoman-knotting-hair-before-jogging.mp4,PT00H00M14S,076751_076800,Close up of smiling sportswoman knotting hair before jogging
2268914,https://ak.picdn.net/shutterstock/videos/2268914/preview/stock-footage-dandelions-in-the-weeds.mp4,PT00H00M20S,135501_135550,Dandelions in the weeds
1027387991,https://ak.picdn.net/shutterstock/videos/1027387991/preview/stock-footage-macro-water-drops-in-super-slow-motion-dripping-against-a-black-background-use-blending-mode.mp4,PT00H00M30S,061601_061650,"Macro water drops in super slow motion dripping against a black background, use blending mode (screen)  "
6190688,https://ak.picdn.net/shutterstock/videos/6190688/preview/stock-footage-view-modern-urban-high-rise-from-windows-beijing-business-financial-center-gh.mp4,PT00H00M05S,170151_170200,"View modern urban high-rise from windows,beijing business financial center. gh2_05090"
4521977,https://ak.picdn.net/shutterstock/videos/4521977/preview/stock-footage-man-and-leisure-activity-mid-adult-fisherman-on-holidays-on-river-relaxing-and-fishing-part-of.mp4,PT00H00M24S,039951_040000,"Man and leisure activity, mid adult fisherman on holidays on river, relaxing and fishing. part 5 of 8"
1017539584,https://ak.picdn.net/shutterstock/videos/1017539584/preview/stock-footage-two-tote-tanks-cubes-laying-half-submerged-in-asphalt-lake-curacao.mp4,PT00H00M15S,180751_180800,"Two tote tanks (cubes) laying half submerged in asphalt lake, curacao."
34765192,https://ak.picdn.net/shutterstock/videos/34765192/preview/stock-footage-american-dollars-banknote-president-benjamin-franklin-on-a-bill-several-banknotes-with-a.mp4,PT00H00M09S,144751_144800,"American dollars: banknote 100. president benjamin franklin on a bill. several banknotes with a face value of 100, ray of light is moving along them. bank and money. monetary system of the country."
1031112377,https://ak.picdn.net/shutterstock/videos/1031112377/preview/stock-footage-drone-aerial-shot-of-grand-canal-dock-in-dublin-city-ireland.mp4,PT00H00M14S,044401_044450,"Drone aerial shot of grand canal dock in dublin city, ireland. "
1053391247,https://ak.picdn.net/shutterstock/videos/1053391247/preview/stock-footage-book-title-on-boards-come-on-opened-book-stop-motion.mp4,PT00H00M06S,076851_076900,"Book title on boards come on opened book - stop motion	
"
24012847,https://ak.picdn.net/shutterstock/videos/24012847/preview/stock-footage-hairstylist-hairdresser-finishing-hairstyle-for-teen-girl-in-white-make-up-room-beauty-and.mp4,PT00H00M10S,031001_031050,"Hairstylist, hairdresser finishing hairstyle for teen girl in white make up room. beauty and haircare concept"
8848675,https://ak.picdn.net/shutterstock/videos/8848675/preview/stock-footage-novosibirsk-march-russian-premiere-musical-tristan-and-isolde-novosibirsk-theater-musical.mp4,PT00H00M30S,110001_110050,"Novosibirsk -march 15: russian premiere musical ""tristan and isolde"" novosibirsk theater musical comedy, composer alan simon steps theatrical scene. march 15, 2015 in novosibirsk."
