videoid,contentUrl,duration,page_dir,name
1031040968,https://ak.picdn.net/shutterstock/videos/1031040968/preview/stock-footage-stressed-young-bearded-man-doctor-pointing-up-and-giving-thumbs-down.mp4,PT00H00M16S,059951_060000,Stressed young bearded man doctor pointing up and giving thumbs down
1017209227,https://ak.picdn.net/shutterstock/videos/1017209227/preview/stock-footage-word-learn-from-multicolor-wooden-letters-on-wooden-table.mp4,PT00H00M16S,011751_011800,Word learn from multicolor wooden letters on wooden table.
1026690611,https://ak.picdn.net/shutterstock/videos/1026690611/preview/stock-footage-young-people-dancing-and-having-fun-in-kitchen.mp4,PT00H00M15S,058801_058850,Young people dancing and having fun in kitchen
1010825057,https://ak.picdn.net/shutterstock/videos/1010825057/preview/stock-footage-family-of-otters-play-fight-in-their-nest.mp4,PT00H00M20S,007451_007500,Family of otters play fight in their nest
1014728495,https://ak.picdn.net/shutterstock/videos/1014728495/preview/stock-footage-blurred-background-car-technician-repairing-the-car-in-garage.mp4,PT00H00M09S,030201_030250,Blurred background : car technician repairing the car in garage
1036224581,https://ak.picdn.net/shutterstock/videos/1036224581/preview/stock-footage-calm-morning-sunrise-over-the-sea-with-moored-boats-in-marina.mp4,PT00H00M25S,174451_174500,Calm morning sunrise over the sea with moored boats in marina.
23669557,https://ak.picdn.net/shutterstock/videos/23669557/preview/stock-footage-berlin-germany-july-k-people-march-anti-racist-manifestation-near-brandenburg-gate-for.mp4,PT00H00M29S,107001_107050,"Berlin - germany, july 3, 2014, 4k people march anti racist manifestation near brandenburg gate for human right, handheld camera"
22718815,https://ak.picdn.net/shutterstock/videos/22718815/preview/stock-footage-barn-owl-portrait.mp4,PT00H00M09S,054101_054150,Barn owl portrait
1058648164,https://ak.picdn.net/shutterstock/videos/1058648164/preview/stock-footage-parachutist-flies-over-mountains-near-water.mp4,PT00H00M54S,025801_025850,Parachutist flies over mountains near water
27185857,https://ak.picdn.net/shutterstock/videos/27185857/preview/stock-footage-baby-s-lying-on-a-white-linen-in-bed-at-home-long-shot.mp4,PT00H00M38S,186401_186450,Baby's lying on a white linen in bed at home. long shot
33240757,https://ak.picdn.net/shutterstock/videos/33240757/preview/stock-footage-bulgarian-town-of-belogradchik-slow-tilt-k-p-fps-ultrahd-footage-settlement-in-western.mp4,PT00H00M07S,186101_186150,Bulgarian town of belogradchik slow tilt 4k 2160p 30fps ultrahd footage - settlement in western bulgaria by the day 3840x2160 uhd tilting video
12287972,https://ak.picdn.net/shutterstock/videos/12287972/preview/stock-footage-bee-hive-smoker.mp4,PT00H00M24S,077451_077500,Bee hive smoker
15554461,https://ak.picdn.net/shutterstock/videos/15554461/preview/stock-footage-children-play-in-the-woods.mp4,PT00H00M14S,076251_076300,Children play in the woods
1041609871,https://ak.picdn.net/shutterstock/videos/1041609871/preview/stock-footage-scenic-view-at-taroko-national-park-in-hualien-taiwan.mp4,PT00H00M11S,065201_065250,"Scenic view at taroko national park in hualien, taiwan"
1039442999,https://ak.picdn.net/shutterstock/videos/1039442999/preview/stock-footage--mm-makarov-brass-bullet-stands-on-concrete.mp4,PT00H00M06S,138451_138500,9mm makarov brass bullet stands on concrete
1052331334,https://ak.picdn.net/shutterstock/videos/1052331334/preview/stock-footage-zen-garden-pyramids-of-white-and-gray-zen-stones-on-the-white-sand-with-abstract-wave-drawings.mp4,PT00H00M05S,086651_086700,"Zen garden. pyramids of white and gray zen stones on the white sand with abstract wave drawings. concept of harmony, balance and meditation, spa, massage, relax."
1027624325,https://ak.picdn.net/shutterstock/videos/1027624325/preview/stock-footage-portrait-of-happy-good-looking-guy-smiling-and-looking-at-camera-standing-at-home-alone-whearing.mp4,PT00H00M19S,104951_105000,Portrait of happy good-looking guy smiling and looking at camera standing at home alone whearing casual clothing. attractive people and positive emotions concept.
231703,https://ak.picdn.net/shutterstock/videos/231703/preview/stock-footage-men-pass-items-from-dock-in-peru.mp4,PT00H00M07S,089701_089750,Men pass items from dock in peru
1061877895,https://ak.picdn.net/shutterstock/videos/1061877895/preview/stock-footage--k-aerial-footage-circling-the-famous-great-saint-martin-chrurch-in-cologne-germany.mp4,PT00H00M16S,112201_112250,"4k aerial footage circling the famous great saint martin chrurch in cologne, germany."
4539974,https://ak.picdn.net/shutterstock/videos/4539974/preview/stock-footage-multi-clip-on-christmas-with-tree-and-decorations-with-candles.mp4,PT00H00M22S,032851_032900,Multi clip on christmas with tree and decorations with candles.
1041905296,https://ak.picdn.net/shutterstock/videos/1041905296/preview/stock-footage-abstract-green-laser-lights-laser-tunnel-strobe-lights-vj-loop.mp4,PT00H00M10S,107801_107850,Abstract green laser lights. laser tunnel. strobe lights. vj loop
1026647318,https://ak.picdn.net/shutterstock/videos/1026647318/preview/stock-footage-young-charming-girl-in-black-bikini-smiling-happily-at-camera-while-sitting-on-poolside-with-laptop.mp4,PT00H00M28S,054501_054550,Young charming girl in black bikini smiling happily at camera while sitting on poolside with laptop near and relaxing on vacation in tropical resort.
1011291593,https://ak.picdn.net/shutterstock/videos/1011291593/preview/stock-footage-argegno-italy-april-small-cable-car-ascends-and-descends-from-the-steep-slope-on-a.mp4,PT00H00M12S,005901_005950,"Argegno, italy - april 20,2018: small cable car ascends and descends from the steep slope on a mountain in the italian alps."
13901747,https://ak.picdn.net/shutterstock/videos/13901747/preview/stock-footage--k-american-flag-is-fluttering-in-wind-gh-k.mp4,PT00H00M16S,198201_198250,4k american flag is fluttering in wind. gh2_11153_4k
1038721997,https://ak.picdn.net/shutterstock/videos/1038721997/preview/stock-footage-backdoor-animated-word-cloud-kinetic-typography.mp4,PT00H00M19S,143301_143350,Backdoor animated word cloud. kinetic typography.
12103649,https://ak.picdn.net/shutterstock/videos/12103649/preview/stock-footage-young-woman-standing-on-the-rocky-shore-by-the-sea-at-sunset-her-dress-fluttering-in-the-wind.mp4,PT00H00M09S,194401_194450,"Young woman standing on the rocky shore by the sea at sunset, her dress fluttering in the wind"
1012189061,https://ak.picdn.net/shutterstock/videos/1012189061/preview/stock-footage-helsinki-cityscape-c-k-aerial-descending-tilt-view-of-the-helsinki-cathedral-and-the-city-on-a.mp4,PT00H00M16S,050051_050100,"Helsinki cityscape, c4k aerial descending tilt view of the helsinki cathedral and the city, on a sunny summer evening dusk, in helsingfors, uusimaa, finland "
23564995,https://ak.picdn.net/shutterstock/videos/23564995/preview/stock-footage-shallow-river-in-thickets-of-grass-and-trees-russia.mp4,PT00H00M10S,065251_065300,"Shallow river in thickets of grass and trees, russia"
1053247886,https://ak.picdn.net/shutterstock/videos/1053247886/preview/stock-footage-white-blooming-orchid-on-teal-background-and-drops-falling-on-it-in-slow-motion-from-fps.mp4,PT00H00M39S,106851_106900,White blooming orchid on teal background and drops falling on it in slow motion from 120 fps
13669415,https://ak.picdn.net/shutterstock/videos/13669415/preview/stock-footage-christmas-tree-at-night-stock-video.mp4,PT00H00M20S,005851_005900,Christmas tree at night stock video
28431310,https://ak.picdn.net/shutterstock/videos/28431310/preview/stock-footage-bouquet-with-peonies-on-a-table-decoration.mp4,PT00H00M05S,067301_067350,Bouquet with peonies on a table decoration
27797818,https://ak.picdn.net/shutterstock/videos/27797818/preview/stock-footage-a-man-cutting-curly-parsley-on-a-wood-cutting-board-with-a-large-old-knife.mp4,PT00H00M09S,133701_133750,A man cutting curly parsley on a wood cutting board with a large old knife.
1023309901,https://ak.picdn.net/shutterstock/videos/1023309901/preview/stock-footage-sexy-body-of-young-and-beautiful-woman-in-lingerie-over-vintage-background-beautiful-girl-lying-on.mp4,PT00H00M16S,195701_195750,Sexy body of young and beautiful woman in lingerie over vintage background. beautiful girl lying on the bed
1012675994,https://ak.picdn.net/shutterstock/videos/1012675994/preview/stock-footage-the-man-relaxing-at-the-table-on-the-green-background.mp4,PT00H00M29S,074051_074100,The man relaxing at the table on the green background
1013193794,https://ak.picdn.net/shutterstock/videos/1013193794/preview/stock-footage-light-leaks-dazzling-transition.mp4,PT00H00M11S,023501_023550,Light leaks - dazzling transition
1048875484,https://ak.picdn.net/shutterstock/videos/1048875484/preview/stock-footage-ripe-broccoli-and-cauliflower-slow-motion.mp4,PT00H00M19S,134551_134600,Ripe broccoli and cauliflower. slow motion.
13196741,https://ak.picdn.net/shutterstock/videos/13196741/preview/stock-footage-scene-of-modern-business-and-technology-the-modern-professional-needs-to-network-with-coworkers.mp4,PT00H00M09S,030201_030250,Scene of modern business and technology. the modern professional needs to network with coworkers and managers. telecommunication is critical for any business trying to remain competative.
1016425198,https://ak.picdn.net/shutterstock/videos/1016425198/preview/stock-footage-stockholm-s-city-hall-on-waterfront-magnificent-architectural-landmark.mp4,PT00H00M12S,142401_142450,Stockholm's city hall on waterfront. magnificent architectural landmark.
33871,https://ak.picdn.net/shutterstock/videos/33871/preview/stock-footage-the-church-of-trani-on-the-adriatic-sea.mp4,PT00H00M10S,134701_134750,The church of trani on the adriatic sea
4571996,https://ak.picdn.net/shutterstock/videos/4571996/preview/stock-footage-high-reed-against-sunset-sky-in-wind-day.mp4,PT00H00M17S,122151_122200,High reed against sunset sky in wind day
10449773,https://ak.picdn.net/shutterstock/videos/10449773/preview/stock-footage-little-blonde-girl-eats-licks-an-ice-cream-cone-on-a-park-bench-portrait.mp4,PT00H00M15S,110151_110200,Little blonde girl eats licks an ice cream cone on a park bench portrait
33139999,https://ak.picdn.net/shutterstock/videos/33139999/preview/stock-footage-paris-france-october-a-sculpture-of-the-trocadero-in-a-moving-camera-shot.mp4,PT00H00M09S,001751_001800,"Paris, france october 25, 2017: a sculpture of the trocadero in a moving camera shot."
1017771643,https://ak.picdn.net/shutterstock/videos/1017771643/preview/stock-footage-iceland-snow-mountains-far.mp4,PT00H00M11S,098951_099000,Iceland snow mountains far
1054697336,https://ak.picdn.net/shutterstock/videos/1054697336/preview/stock-footage-wasp-sitting-on-yellow-blooming-flower.mp4,PT00H00M08S,145301_145350,Wasp sitting on yellow blooming flower
28874038,https://ak.picdn.net/shutterstock/videos/28874038/preview/stock-footage-young-businessman-with-laptop-talking-on-cellphone-sitting-in-cafe.mp4,PT00H00M15S,192401_192450,"Young businessman with laptop talking on cellphone sitting in cafe
"
1059784382,https://ak.picdn.net/shutterstock/videos/1059784382/preview/stock-footage-aerial-forward-view-of-extra-urban-landscape-of-celje-city-in-slovenia.mp4,PT00H00M13S,060451_060500,Aerial forward view of extra-urban landscape of celje city in slovenia
1010743100,https://ak.picdn.net/shutterstock/videos/1010743100/preview/stock-footage-chernivtsi-ukraine-may-wsc-fim-world-sidecarcross-championship-super-slow-motion.mp4,PT00H00M22S,128051_128100,"Chernivtsi, ukraine - 5 may, 2018: wsc fim world sidecarcross championship. super slow motion."
1027282340,https://ak.picdn.net/shutterstock/videos/1027282340/preview/stock-footage-red-breasted-parakeet-or-betet-jawa-or-moustached-parakeet-or-psittacula-alexandri-indonesian.mp4,PT00H00M10S,175351_175400,"Red breasted parakeet, or betet jawa, or moustached parakeet, or psittacula alexandri, indonesian endemic bird"
6758653,https://ak.picdn.net/shutterstock/videos/6758653/preview/stock-footage-the-glacier-of-geant-and-the-dent-du-geant-peak-in-background-mont-blanc-massif-chamonix.mp4,PT00H00M10S,137801_137850,"The glacier of geant and the dent du geant peak (in background). mont blanc massif, chamonix, france, europe. 4k uhd in cinelike gamma (flatter profile suitable for editing) by panasonic gh-4."
1033408376,https://ak.picdn.net/shutterstock/videos/1033408376/preview/stock-footage-the-waves-beat-the-shore-bird-s-eye-view-laem-phak-bia-gulf-of-thailand-phetchaburi-thailand.mp4,PT00H00M30S,118701_118750,"The waves beat the shore, bird's eye view, laem phak bia, gulf of thailand, phetchaburi, thailand. drone shot."
1030182089,https://ak.picdn.net/shutterstock/videos/1030182089/preview/stock-footage-look-out-the-window-of-the-porthole-of-the-aircraft-the-girl-sees-in-the-porthole-wing-of-the.mp4,PT00H00M21S,002451_002500,Look out the window of the porthole of the aircraft. the girl sees in the porthole wing of the aircraft. traveling by air. fly above the clouds.
1012724165,https://ak.picdn.net/shutterstock/videos/1012724165/preview/stock-footage-ripe-golden-ears-of-wheat-in-the-wind-before-harvesting.mp4,PT00H00M08S,081151_081200,Ripe golden ears of wheat in the wind before harvesting
14107661,https://ak.picdn.net/shutterstock/videos/14107661/preview/stock-footage-worker-welds-metal-for-construction.mp4,PT00H00M06S,076101_076150,Worker welds metal for construction
11905967,https://ak.picdn.net/shutterstock/videos/11905967/preview/stock-footage-mountain-view-at-cwmystwyth-wales.mp4,PT00H00M12S,072351_072400,"Mountain view at cwmystwyth, wales"
1047297352,https://ak.picdn.net/shutterstock/videos/1047297352/preview/stock-footage-injection-of-fluorescent-ink-in-water-in-k-d-render-of-glow-particles-in-ink-flow-interaction.mp4,PT00H00M40S,013501_013550,Injection of fluorescent ink in water in 4k. 3d render of glow particles in ink flow. interaction of two colliding flows. luma matte. shiny ink effect advection. 
14326045,https://ak.picdn.net/shutterstock/videos/14326045/preview/stock-footage-young-beautiful-african-serious-girl-stand-in-woods-smiles-to-camera-and-shake-one-s-head.mp4,PT00H00M15S,012701_012750,"Young beautiful african serious girl stand in woods, smiles to camera and shake one's head"
1043658982,https://ak.picdn.net/shutterstock/videos/1043658982/preview/stock-footage-amsterdam-netherlands-july-day-time-amsterdam-city-center-luxury-stores-traffic-street.mp4,PT00H00M15S,085601_085650,"Amsterdam, netherlands - july 10 2019: day time amsterdam city center luxury stores traffic street slow motion panorama 4k circa july 10 2019 amsterdam, netherlands."
1053620930,https://ak.picdn.net/shutterstock/videos/1053620930/preview/stock-footage-chicago-il-united-states-may-damaged-police-cars-scrawled-with-graffiti-could-be.mp4,PT00H00M10S,183001_183050,"Chicago, il / united states - may 31, 2020: damaged police cars scrawled with graffiti could be spotted around downtown chicago during nationwide protests against the death of george floyd"
15584209,https://ak.picdn.net/shutterstock/videos/15584209/preview/stock-footage-blood-stained-knife-drops-to-floor-slow-motion.mp4,PT00H00M14S,120251_120300,"Blood stained knife drops to floor, slow motion"
1011775259,https://ak.picdn.net/shutterstock/videos/1011775259/preview/stock-footage-glasgow-united-kingdom-may-george-square-seen-from-behind-pillars-glasgow.mp4,PT00H00M12S,035101_035150,"Glasgow, united kingdom - may, 2016: george square seen from behind pillars, glasgow"
1020314872,https://ak.picdn.net/shutterstock/videos/1020314872/preview/stock-footage-sexy-orange-fruit-in-the-right-hands-aphrodisiac-visual-aids-and-wildlife-lesson-ripe-tangerine.mp4,PT00H00M12S,027151_027200,Sexy orange fruit in the right hands. aphrodisiac. visual aids and wildlife lesson. ripe tangerine with green leaf in beautiful hands.
22159975,https://ak.picdn.net/shutterstock/videos/22159975/preview/stock-footage-old-man-in-his-bedroom-while-sit-a-the-desk-reads-an-email-smoking-a-cigarette.mp4,PT00H00M28S,130751_130800,Old man in his bedroom while sit a the desk reads an email smoking a cigarette
1044715258,https://ak.picdn.net/shutterstock/videos/1044715258/preview/stock-footage-caught-flowers-cute-girl-in-glasses-with-yellow-chrysanthemums.mp4,PT00H00M12S,129351_129400,Caught flowers. cute girl in glasses with yellow chrysanthemums.
1023194965,https://ak.picdn.net/shutterstock/videos/1023194965/preview/stock-footage-medical-background-with-dna-strand-skull-and-human-body.mp4,PT00H00M15S,034451_034500,"Medical background with dna strand, skull and human body"
18254878,https://ak.picdn.net/shutterstock/videos/18254878/preview/stock-footage-palm-trees-in-the-city-waikiki-beach-honolulu.mp4,PT00H00M12S,020751_020800,Palm trees in the city. waikiki beach honolulu 
1040227454,https://ak.picdn.net/shutterstock/videos/1040227454/preview/stock-footage-little-girl-eating-a-baby-food-pouch-sitting-in-a-stroller-outdoors.mp4,PT00H00M13S,142551_142600,Little girl eating a baby food pouch sitting in a stroller outdoors.
1044457123,https://ak.picdn.net/shutterstock/videos/1044457123/preview/stock-footage-wild-bison-roaming-in-lamar-valley-in-yellowstone-national-park-wyoming.mp4,PT00H00M16S,021451_021500,Wild bison roaming in lamar valley in yellowstone national park (wyoming)
27211735,https://ak.picdn.net/shutterstock/videos/27211735/preview/stock-footage-turkmenistan-branch-on-the-river.mp4,PT00H00M12S,111401_111450,"Turkmenistan

branch on the river"
1043004343,https://ak.picdn.net/shutterstock/videos/1043004343/preview/stock-footage-new-year-s-decoration-of-the-city-street-out-of-focus.mp4,PT00H00M52S,051501_051550,New year 's decoration of the city street. out of focus.
1043827393,https://ak.picdn.net/shutterstock/videos/1043827393/preview/stock-footage-close-up-of-blue-and-yellow-macaw-cleaning-feathers.mp4,PT00H00M09S,067251_067300,Close up of blue and yellow macaw cleaning feathers
31999369,https://ak.picdn.net/shutterstock/videos/31999369/preview/stock-footage-fallen-autumn-leaves-in-an-oak-forest-shared-shooting-camera-movement.mp4,PT00H00M28S,117401_117450,Fallen autumn leaves in an oak forest. shared shooting. camera movement
28848874,https://ak.picdn.net/shutterstock/videos/28848874/preview/stock-footage-flying-over-the-palace-square-saint-petersburg-russia-in-the-sunny-day.mp4,PT00H00M25S,076001_076050,Flying over the palace square saint petersburg russia in the sunny day
33301609,https://ak.picdn.net/shutterstock/videos/33301609/preview/stock-footage-elderly-businessman-working-with-computer-in-modern-office.mp4,PT00H00M16S,108951_109000,Elderly businessman working with computer in modern office
1025744576,https://ak.picdn.net/shutterstock/videos/1025744576/preview/stock-footage-moscow-russia-october-multi-storey-building-under-construction-new-residential.mp4,PT00H00M20S,014801_014850,"Moscow, russia  october 17, 2018:   multi-storey building under construction (new residential complex) against the sky, moscow, russia  "
1021034947,https://ak.picdn.net/shutterstock/videos/1021034947/preview/stock-footage-santa-claus-animations-for-commercial-or-other-media-uses.mp4,PT00H00M12S,034051_034100,Santa claus animations for commercial or other media uses.
19555144,https://ak.picdn.net/shutterstock/videos/19555144/preview/stock-footage-upper-panorama-of-wide-town-with-small-houses-among-hills-and-greenhouses-against-mountains-and.mp4,PT00H00M17S,119201_119250,Upper panorama of wide town with small houses among hills and greenhouses against mountains and cloudy sky
9933335,https://ak.picdn.net/shutterstock/videos/9933335/preview/stock-footage-caucasian-boy-with-the-phone-on-the-nature-boy-teenager-with-a-smartphone-at-sunset-boy-with-phone.mp4,PT00H00M14S,183901_183950,"Caucasian boy with the phone on the nature.boy teenager with a smartphone at sunset.boy with phone photographs sunset. nature, people, and technology."
24001840,https://ak.picdn.net/shutterstock/videos/24001840/preview/stock-footage-prague-turistic-signs.mp4,PT00H00M14S,086651_086700,Prague turistic signs
6030383,https://ak.picdn.net/shutterstock/videos/6030383/preview/stock-footage-little-boy-is-swinging-on-playground.mp4,PT00H00M12S,079201_079250,Little boy is swinging on playground.
10360421,https://ak.picdn.net/shutterstock/videos/10360421/preview/stock-footage--k-beautiful-cows-eating-in-a-stall.mp4,PT00H00M15S,116701_116750,"4k, beautiful cows eating in a stall  9"
1055350184,https://ak.picdn.net/shutterstock/videos/1055350184/preview/stock-footage-animated-flamingo-icon-neon-elements-effect-light-neon-on-black-background-with-alpha-channel.mp4,PT00H00M06S,054801_054850,"Animated flamingo icon neon elements effect, light neon on black background with alpha channel"
1043481031,https://ak.picdn.net/shutterstock/videos/1043481031/preview/stock-footage-girl-in-dress-stands-on-hump-on-sky-background-in-day-rivne-ukraine-aerial-shooting.mp4,PT00H00M22S,017451_017500,Girl in dress stands on hump on sky background in day. rivne. ukraine. aerial shooting
1036008398,https://ak.picdn.net/shutterstock/videos/1036008398/preview/stock-footage-aerial-view-of-saxon-switzerland-bastei-bridge-bad-schandau-germany.mp4,PT00H00M15S,181551_181600,"Aerial view of saxon switzerland bastei bridge, bad schandau, germany"
12109793,https://ak.picdn.net/shutterstock/videos/12109793/preview/stock-footage-the-zittauer-h-tte-is-one-of-the-most-beautiful-high-alpine-hotels-in-the-alps-beside-the.mp4,PT00H00M10S,031401_031450,"The zittauer htte is one of the most beautiful high alpine hotels in the alps beside the wildgerlossee, lake, wildgerlostal valley, gerlos, tirol, austria in july 2015, 2015-07-05"
22603699,https://ak.picdn.net/shutterstock/videos/22603699/preview/stock-footage-maine-a-structure-juts-out-of-a-rock-face-on-a-cliff-in-the-woods.mp4,PT00H00M05S,101251_101300,Maine 1971: a structure juts out of a rock face on a cliff in the woods
29240590,https://ak.picdn.net/shutterstock/videos/29240590/preview/stock-footage-preparation-for-cooking-fresh-beef.mp4,PT00H00M11S,138601_138650,Preparation for cooking. fresh beef
1010754272,https://ak.picdn.net/shutterstock/videos/1010754272/preview/stock-footage-aerial-view-flying-over-the-high-mountains-in-beautiful-clouds-aerial-camera-shot.mp4,PT00H00M13S,008501_008550,Aerial view. flying over the high mountains in beautiful clouds . aerial camera shot
1032292739,https://ak.picdn.net/shutterstock/videos/1032292739/preview/stock-footage-male-hand-turning-boiler-temperature-knob-down-to-save-money-conserve-energy-pan-left-shot.mp4,PT00H00M12S,031651_031700,Male hand turning boiler temperature knob down to save money & conserve energy. pan left shot.
1029996446,https://ak.picdn.net/shutterstock/videos/1029996446/preview/stock-footage-aerial-view-of-rice-fields.mp4,PT00H00M16S,072451_072500,Aerial view of rice fields
1029926279,https://ak.picdn.net/shutterstock/videos/1029926279/preview/stock-footage-footage-of-trees-in-the-valley-of-glen-coe-in-the-highlands-of-scotland-on-a-cloudy-day-near-fort.mp4,PT00H00M19S,027351_027400,Footage of trees in the valley of glen coe in the highlands of scotland on a cloudy day near fort william showing moving branches and cloudy skies with scottish mountains and munros
1052797652,https://ak.picdn.net/shutterstock/videos/1052797652/preview/stock-footage-this-video-shows-the-cross-section-anatomy-of-the-human-tooth-with-all-his-parts-visible.mp4,PT00H00M14S,040201_040250,This video shows the  cross section anatomy of the human tooth with all his parts visible
1008064561,https://ak.picdn.net/shutterstock/videos/1008064561/preview/stock-footage-celje-slovenia-february-there-are-many-people-on-celjska-koca-resort-it-s-winter-time.mp4,PT00H00M29S,037451_037500,"Celje, slovenia - 20. february 2018 there are many people on celjska koca resort. it's winter time and families are skiing and children are sledding."
1021376305,https://ak.picdn.net/shutterstock/videos/1021376305/preview/stock-footage-redwing-turdus-iliacus-single-bird-on-hawthorn-berries-warwickshire.mp4,PT00H00M30S,147851_147900,"Redwing, turdus iliacus single bird on hawthorn berries, warwickshire"
16548094,https://ak.picdn.net/shutterstock/videos/16548094/preview/stock-footage-timelapse-of-clouds-over-the-bangkok-city-thailand.mp4,PT00H00M12S,018301_018350,"Timelapse of clouds over the bangkok city,thailand."
1019598667,https://ak.picdn.net/shutterstock/videos/1019598667/preview/stock-footage-girl-playing-with-a-kitten-red-ball-of-thread-christmas-gift-home-comfort.mp4,PT00H00M11S,199801_199850,Girl playing with a kitten. red ball of thread. christmas gift. home comfort.
1026189185,https://ak.picdn.net/shutterstock/videos/1026189185/preview/stock-footage-patient-in-ophthalmology-clinic-man-looks-inside-apparatus-for-magnetic-therapy-in-ophthalmologist.mp4,PT00H00M27S,079051_079100,Patient in ophthalmology clinic. man looks inside apparatus for magnetic therapy in ophthalmologist office
22740508,https://ak.picdn.net/shutterstock/videos/22740508/preview/stock-footage-birmingham-uk-december-tilting-aerial-view-of-villa-park-aston-villa-football-stadium.mp4,PT00H00M17S,010501_010550,"Birmingham, uk - december 2016 - tilting aerial view of villa park, aston villa football stadium, uk."
1035489947,https://ak.picdn.net/shutterstock/videos/1035489947/preview/stock-footage-girl-processes-branches-with-a-garden-shredder-in-the-garden-in-august.mp4,PT00H00M22S,173251_173300,Girl processes branches with a garden shredder in the garden in august
18039922,https://ak.picdn.net/shutterstock/videos/18039922/preview/stock-footage-rain-with-tree-foliage-in-the-background.mp4,PT00H00M20S,017251_017300,Rain with tree foliage in the background
