videoid,contentUrl,duration,page_dir,name
1061639698,https://ak.picdn.net/shutterstock/videos/1061639698/preview/stock-footage-woman-s-hands-gathering-ripe-wild-sloe-prunus-spinosa-blackthorn-berries-in-ukraine.mp4,PT00H00M13S,190301_190350,"Woman's hands gathering ripe wild sloe(prunus spinosa, blackthorn) berries in ukraine"
1033974044,https://ak.picdn.net/shutterstock/videos/1033974044/preview/stock-footage-feeder-fishing-gear-on-the-background-of-dried-fish-hung-in-the-sun-pier-near-a-small-fishing.mp4,PT00H00M10S,144001_144050,Feeder fishing gear on the background of dried fish hung in the sun. pier near a small fishing village on the banks of the volga river. focus in the background.
1053145001,https://ak.picdn.net/shutterstock/videos/1053145001/preview/stock-footage-puerto-plate-dominican-republic-may-people-of-dominican-republic-protesting.mp4,PT00H00M23S,032651_032700,"Puerto plate, dominican republic - may 6, 2015: people of dominican republic protesting "
1016696878,https://ak.picdn.net/shutterstock/videos/1016696878/preview/stock-footage-plexus-dynamic-digital-surface-movement-interconnected-particles-slowly-moving-white-background.mp4,PT00H00M20S,183001_183050,"Plexus dynamic digital surface movement. interconnected. particles slowly moving, white background"
2682539,https://ak.picdn.net/shutterstock/videos/2682539/preview/stock-footage-engineer-works-with-microscope-and-laser-in-lab-with-many-other-equipment.mp4,PT00H00M15S,021851_021900,Engineer works with microscope and laser in lab with many other equipment
1042634350,https://ak.picdn.net/shutterstock/videos/1042634350/preview/stock-footage-dawn-over-the-city-view-of-the-bridges-and-the-river-aerial-survey.mp4,PT00H00M08S,072301_072350,Dawn over the city.view of the bridges and the river. aerial survey
5899463,https://ak.picdn.net/shutterstock/videos/5899463/preview/stock-footage-cheerful-group-of-friends-in-business-dress-walk-together-through-a-busy-railway-station.mp4,PT00H00M17S,034401_034450,Cheerful group of friends in business dress walk together through a busy railway station.
18428641,https://ak.picdn.net/shutterstock/videos/18428641/preview/stock-footage-a-cart-containing-a-tank-of-radioactive-residue-is-handled-with-a-big-hook-by-scientists-in-a.mp4,PT00H00M36S,111101_111150,A cart containing a tank of radioactive residue is handled with a big hook by scientists in a laboratory in the 1950s. (1950s)
1051459327,https://ak.picdn.net/shutterstock/videos/1051459327/preview/stock-footage-water-flows-over-the-edge-of-niagara-falls-during-summertime-in-late-evening-hours-niagara-falls.mp4,PT00H00M18S,062601_062650,Water flows over the edge of niagara falls during summertime in late evening hours. niagara falls is a major tourist attraction between usa & canada border.
1033713230,https://ak.picdn.net/shutterstock/videos/1033713230/preview/stock-footage--united-states-postal-office-in-nyc-on-beautiful-new-york-city-street-with-iconic-yellow.mp4,PT00H00M23S,054851_054900,"22/07/19, united states postal office in nyc on beautiful new york city street with iconic yellow new york taxi cabs as people walk past on crossing, in america."
7912165,https://ak.picdn.net/shutterstock/videos/7912165/preview/stock-footage-manufacture-of-toilet-paper.mp4,PT00H00M09S,172451_172500,Manufacture of toilet paper 
1053895136,https://ak.picdn.net/shutterstock/videos/1053895136/preview/stock-footage-festive-blue-cocktail-in-a-glass-with-lemon-cooling-summer-drink-rotate-on-a-red-background-fresh.mp4,PT00H00M19S,057551_057600,"Festive blue cocktail in a glass with lemon. cooling summer drink rotate on a red background. fresh citrus cocktail, healthy drink concept."
1056773873,https://ak.picdn.net/shutterstock/videos/1056773873/preview/stock-footage-woman-lies-on-the-grass-and-covers-her-face-from-the-sun-with-a-straw-hat.mp4,PT00H00M05S,148251_148300,"Woman lies on the grass and covers her face from the sun with a straw hat
"
1015808380,https://ak.picdn.net/shutterstock/videos/1015808380/preview/stock-footage-aerial-flight-over-the-field-in-sunset-k-x-pixels.mp4,PT00H00M31S,068001_068050,Aerial: flight over the field in sunset 4k 4096 x 2160 pixels
34405828,https://ak.picdn.net/shutterstock/videos/34405828/preview/stock-footage-self-driving-cars-and-city-d-animation.mp4,PT00H00M16S,063301_063350,Self-driving cars and city - 3d animation
17405431,https://ak.picdn.net/shutterstock/videos/17405431/preview/stock-footage-boy-sitting-on-a-red-hill-playground-playing-with-the-phone-smartphone.mp4,PT00H00M29S,192051_192100,"Boy sitting on a red hill, playground, playing with the phone, smartphone"
5313926,https://ak.picdn.net/shutterstock/videos/5313926/preview/stock-footage-the-aftermath-of-a-serious-drunk-driving-accident-costs-a-man-his-legs-in-the-s.mp4,PT00H02M10S,058401_058450,The aftermath of a serious drunk driving accident costs a man his legs in the 1960s.
20638528,https://ak.picdn.net/shutterstock/videos/20638528/preview/stock-footage-pretty-girl-doing-selfies-on-smartphone-in-town-steadycam-shot-slow-motion-shot-at-fps.mp4,PT00H00M22S,006201_006250,"Pretty girl doing selfies on smartphone in town, steadycam shot, slow motion shot at 240fps
"
6219575,https://ak.picdn.net/shutterstock/videos/6219575/preview/stock-footage-belaz-career-goes-on-translation-refractories-refractory-sand-pittransportationtransportation.mp4,PT00H00M14S,122751_122800,"Belaz career goes on translation

 refractories refractory   sand pittransportationtransportation day truck truck trailer trucking "
1020014053,https://ak.picdn.net/shutterstock/videos/1020014053/preview/stock-footage-holland-papaya-tree.mp4,PT00H00M20S,131301_131350,Holland papaya tree.
1061157628,https://ak.picdn.net/shutterstock/videos/1061157628/preview/stock-footage-salt-lake-with-swamps-and-canals-the-water-reflect-the-colors-of-sunrise-birds-flying-on-the.mp4,PT00H00M22S,118901_118950,Salt lake with swamps and canals. the water reflect the colors of sunrise. birds flying on the morning sky with pink clouds. a big tree in the right. dolly shot.
17597053,https://ak.picdn.net/shutterstock/videos/17597053/preview/stock-footage-fresh-ripe-juicy-raspberries-rotate-red-raspberries-clockwise-rotation-close-up.mp4,PT00H00M16S,021351_021400,"Fresh, ripe, juicy raspberries rotate. red raspberries clockwise rotation . close up"
1045970995,https://ak.picdn.net/shutterstock/videos/1045970995/preview/stock-footage-beach-on-the-black-sea-volleyball-boys-and-girls-compete-on-the-sandy-ground-in-swimwear-and-swim.mp4,PT00H00M06S,018501_018550,"Beach on the black sea volleyball, boys and girls compete on the sandy ground. in swimwear and swim trunks"
1058074789,https://ak.picdn.net/shutterstock/videos/1058074789/preview/stock-footage-pouring-vegetable-soup-with-tofu-cheese-cubes-and-onion-carrot-into-a-plate-top-view-serving.mp4,PT00H00M06S,172751_172800,"Pouring vegetable soup with tofu cheese cubes and onion, carrot into a plate, top view. serving delicious healthy vegetarian soup. making tasty vegan food. cooking process."
1026579551,https://ak.picdn.net/shutterstock/videos/1026579551/preview/stock-footage-plump-computer-programmer-browsing-the-net-isolated-black-background-studio-shot.mp4,PT00H00M18S,078951_079000,Plump computer programmer browsing the net. isolated black background. studio shot.
1020016234,https://ak.picdn.net/shutterstock/videos/1020016234/preview/stock-footage-strong-muscular-fit-young-man-in-sport-outfit-doing-leg-and-balance-exercises-he-is-doing-a.mp4,PT00H00M07S,061801_061850,Strong muscular fit young man in sport outfit doing leg and balance exercises. he is doing a workout in a fenced outdoor basketball court. evening footage after rain in a residential neighborhood area
26367743,https://ak.picdn.net/shutterstock/videos/26367743/preview/stock-footage-flight-over-a-beautiful-lake-in-the-forest-on-a-sunny-day.mp4,PT00H00M15S,105951_106000,Flight over a beautiful lake in the forest on a sunny day
31255096,https://ak.picdn.net/shutterstock/videos/31255096/preview/stock-footage-scientist-testing-in-laboratory-for-analysis-or-researching.mp4,PT00H00M23S,064401_064450,Scientist testing in laboratory for analysis or researching
26175659,https://ak.picdn.net/shutterstock/videos/26175659/preview/stock-footage-vrindavana-india-april-inhabitants-of-india-go-by-train.mp4,PT00H00M12S,193801_193850,"Vrindavana, india. april 2017. inhabitants of india go by train"
1008073816,https://ak.picdn.net/shutterstock/videos/1008073816/preview/stock-footage-microscopic-view-of-organisms-in-the-fusty-water-rotifers.mp4,PT00H00M51S,065701_065750,Microscopic view of organisms in the fusty water. rotifers
1007247313,https://ak.picdn.net/shutterstock/videos/1007247313/preview/stock-footage-secretary-helps-his-boss-massaging-him-shoulders-and-neck-after-a-long-work.mp4,PT00H00M18S,123951_124000,Secretary helps his boss massaging him shoulders and neck after a long work
28944061,https://ak.picdn.net/shutterstock/videos/28944061/preview/stock-footage-carpenter-using-measuring-tape-to-mark-section-of-plywood.mp4,PT00H00M10S,075051_075100,Carpenter using measuring tape to mark section of plywood
7966003,https://ak.picdn.net/shutterstock/videos/7966003/preview/stock-footage-shenyang-china-october-kfc-billboards-in-a-hazy-weather-text-translated-into-english.mp4,PT00H00M39S,100001_100050,"Shenyang, china - october 31, 2014: kfc billboards in a hazy weather, text translated into english is ""6:00 breakfast served"". the background is a construction site. located in shenyang city, china."
23894530,https://ak.picdn.net/shutterstock/videos/23894530/preview/stock-footage-young-happy-girl-feeding-seagulls-on-the-beach-slow-motion.mp4,PT00H00M12S,117951_118000,"Young happy girl feeding seagulls on the beach, slow motion"
20236738,https://ak.picdn.net/shutterstock/videos/20236738/preview/stock-footage-aerial-view-buffalo-herd-at-riverside.mp4,PT00H00M13S,088001_088050,Aerial view buffalo herd at riverside
1037488088,https://ak.picdn.net/shutterstock/videos/1037488088/preview/stock-footage-katara-plaza-a-new-open-air-shopping-mall-concept.mp4,PT00H00M11S,127801_127850,"Katara plaza, a new open-air shopping mall concept"
1006676464,https://ak.picdn.net/shutterstock/videos/1006676464/preview/stock-footage-man-walking-in-a-field.mp4,PT00H00M11S,030901_030950,Man walking in a field
1056434582,https://ak.picdn.net/shutterstock/videos/1056434582/preview/stock-footage-close-up-of-hot-sticky-turkish-delight-batter-with-almonds-is-poured-into-a-tray-for-cooling.mp4,PT00H00M07S,034451_034500,Close-up of hot sticky turkish delight batter with almonds is poured into a tray for cooling.
30981610,https://ak.picdn.net/shutterstock/videos/30981610/preview/stock-footage-little-boy-wearing-pirate-costume-is-playing-in-toy-ship-of-pirates-of-caribbean-on-the-lawn-on.mp4,PT00H00M27S,139851_139900,Little boy wearing pirate costume is playing in toy ship of pirates of caribbean on the lawn on halloween
1013570369,https://ak.picdn.net/shutterstock/videos/1013570369/preview/stock-footage-trondheim-norway-ca-july-colorful-wooden-warehouses-at-waterfront.mp4,PT00H00M12S,084651_084700,Trondheimnorway-cajuly2018:colorful wooden warehouses at waterfront
1018026583,https://ak.picdn.net/shutterstock/videos/1018026583/preview/stock-footage-cute-happy-boy-decorating-his-christmas-tree-at-home-he-is-adjusting-christmas-baubles-and-smiling.mp4,PT00H00M17S,126051_126100,"Cute happy boy decorating his christmas tree at home, he is adjusting christmas baubles and smiling"
1008283879,https://ak.picdn.net/shutterstock/videos/1008283879/preview/stock-footage-old-vintage-ceiling-fan-from-low-angle-view.mp4,PT00H00M08S,090501_090550,Old vintage ceiling fan from low angle view.
21232948,https://ak.picdn.net/shutterstock/videos/21232948/preview/stock-footage-adult-woman-with-short-hair-earrings-tell-something-to-man-behind-camera-waggle-casting-brick.mp4,PT00H00M14S,121401_121450,"Adult woman with short hair, earrings tell something to man behind camera. waggle. casting. brick wall on background"
20168230,https://ak.picdn.net/shutterstock/videos/20168230/preview/stock-footage-ant-ants-on-nature-insects-the-earth-movement-works.mp4,PT00H00M32S,015751_015800,Ant ants on nature insects the earth movement works
1023509233,https://ak.picdn.net/shutterstock/videos/1023509233/preview/stock-footage-filmed-just-before-banksy-mural-was-applied-scott-street-bridge-kingston-upon-hull-east-riding.mp4,PT00H00M22S,135951_136000,"Filmed just before banksy mural was applied -  scott street bridge, kingston-upon-hull, east riding of yorkshire, england 8th of may 2017. the river hull industrial."
1026538295,https://ak.picdn.net/shutterstock/videos/1026538295/preview/stock-footage-the-automated-cnc-production-line-in-a-stone-factory.mp4,PT00H00M20S,021551_021600,The automated cnc production line in a stone factory.
13997603,https://ak.picdn.net/shutterstock/videos/13997603/preview/stock-footage--k-aerial-view-in-the-desert-sierra-alhamila-spain-native-version-straight-out-of-the-camera.mp4,PT00H00M31S,133651_133700,"4k aerial view in the desert, sierra alhamila, spain
(native version,  straight out of the camera, no recompression)"
16559416,https://ak.picdn.net/shutterstock/videos/16559416/preview/stock-footage--computer-main-board-motherboard-k-footage.mp4,PT00H00M10S,042401_042450," computer main board, motherboard 4k footage"
1016649931,https://ak.picdn.net/shutterstock/videos/1016649931/preview/stock-footage-aerial-shot-of-the-buildings-in-alanya.mp4,PT00H00M29S,065951_066000,Aerial shot of the buildings in alanya
1054872641,https://ak.picdn.net/shutterstock/videos/1054872641/preview/stock-footage-spring-cherry-garden-k-blossoming-cherry-tree-branch-trembling-in-the-wind-natural-spring.mp4,PT00H00M15S,030851_030900,Spring cherry garden. 4k. blossoming cherry tree branch trembling in the wind. natural spring background.
1028481371,https://ak.picdn.net/shutterstock/videos/1028481371/preview/stock-footage-river-water-flowing-in-nature-trees-spring-time.mp4,PT00H00M11S,077351_077400,River water flowing in nature trees spring time
5629928,https://ak.picdn.net/shutterstock/videos/5629928/preview/stock-footage-overlook-train-passing-intercity-traffic-in-china-gh.mp4,PT00H00M29S,051651_051700,"Overlook train passing,intercity traffic in china. gh2_06338"
1010378198,https://ak.picdn.net/shutterstock/videos/1010378198/preview/stock-footage-confetti-falling-on-football-fans-roaring-about-goal-scored-happy-for-victory.mp4,PT00H00M11S,028351_028400,"Confetti falling on football fans roaring about goal scored, happy for victory"
1006943659,https://ak.picdn.net/shutterstock/videos/1006943659/preview/stock-footage-time-lapse-step-by-step-mixing-dry-ingredients-for-double-batch-of-gingerbread-cookies.mp4,PT00H00M38S,111401_111450,Time lapse. step by step. mixing dry ingredients for double batch of gingerbread cookies.
3971347,https://ak.picdn.net/shutterstock/videos/3971347/preview/stock-footage-pentatomidae-macro-bug-beetle.mp4,PT00H00M20S,015201_015250,Pentatomidae macro bug beetle
29800276,https://ak.picdn.net/shutterstock/videos/29800276/preview/stock-footage-the-sexy-woman-in-bikini-by-the-swiming-pool.mp4,PT00H00M13S,062151_062200,The sexy woman in bikini by the swiming pool.
1008693517,https://ak.picdn.net/shutterstock/videos/1008693517/preview/stock-footage--k-aerial-footage-surfers-on-wave-portugal.mp4,PT00H00M16S,068251_068300,4k aerial footage surfers on wave portugal
28143301,https://ak.picdn.net/shutterstock/videos/28143301/preview/stock-footage-vaccination-against-influenza-vaccine.mp4,PT00H00M16S,065151_065200,Vaccination against influenza vaccine
1025511860,https://ak.picdn.net/shutterstock/videos/1025511860/preview/stock-footage-mossy-beach-at-sunset.mp4,PT00H00M17S,181751_181800,Mossy beach at sunset
1042060783,https://ak.picdn.net/shutterstock/videos/1042060783/preview/stock-footage-colorful-abstract-moving-stripe-lines-in-black-background.mp4,PT00H00M15S,186801_186850,Colorful abstract moving stripe lines in black background
1047092053,https://ak.picdn.net/shutterstock/videos/1047092053/preview/stock-footage-rotating-venezuelan-bolivar-banknote-with-jos-flix-ribas-on-turntable-top-view.mp4,PT00H00M08S,137251_137300,Rotating 5 venezuelan bolivar banknote with jos flix ribas 2018 on turntable top view
959986,https://ak.picdn.net/shutterstock/videos/959986/preview/stock-footage-dentist-chair.mp4,PT00H00M10S,131651_131700,Dentist chair
19053532,https://ak.picdn.net/shutterstock/videos/19053532/preview/stock-footage-san-leo-rimini-italy-medieval-village-the-most-beautiful-small-town-in-italy-the-unknown.mp4,PT00H00M11S,025351_025400,"San leo (rimini), italy. medieval village. the most beautiful small town in italy. the unknown italian charm, hidden and beauty. "
1012198595,https://ak.picdn.net/shutterstock/videos/1012198595/preview/stock-footage-a-man-packs-a-suitcase-on-vacation-slow-motion-video.mp4,PT00H00M07S,184851_184900,"A man packs a suitcase on vacation, slow motion video"
1010102984,https://ak.picdn.net/shutterstock/videos/1010102984/preview/stock-footage-detail-of-dragon-fruit-macro-dolly-shot-k-resolution.mp4,PT00H00M32S,093301_093350,Detail of dragon fruit. macro dolly shot. 4k resolution.
1016038987,https://ak.picdn.net/shutterstock/videos/1016038987/preview/stock-footage-munich-germany-september-drone-flies-over-a-castle-in-germany.mp4,PT00H00M18S,101601_101650,"Munich, germany - september 2, 2018: drone flies over a castle in germany"
1011539435,https://ak.picdn.net/shutterstock/videos/1011539435/preview/stock-footage-slow-motion-closeup-mixing-frillis-salad-leaves-with-caesar-sauce.mp4,PT00H00M16S,188751_188800,Slow motion closeup mixing frillis salad leaves with caesar sauce
1033769438,https://ak.picdn.net/shutterstock/videos/1033769438/preview/stock-footage-farmer-on-the-field-with-wheat-slow-motion.mp4,PT00H00M11S,027951_028000,Farmer on the field with wheat. slow motion.
3395756,https://ak.picdn.net/shutterstock/videos/3395756/preview/stock-footage-underwater-world.mp4,PT00H00M16S,005151_005200,Underwater world
1042876786,https://ak.picdn.net/shutterstock/videos/1042876786/preview/stock-footage-digital-generated-abstract-footage-holographic-bad-tv-imitation-cyberpunk-style.mp4,PT00H00M06S,074101_074150,"Digital generated abstract footage, holographic bad tv imitation. cyberpunk style."
34356922,https://ak.picdn.net/shutterstock/videos/34356922/preview/stock-footage-christmas-decorations-in-the-interior-gold-twig-and-cones.mp4,PT00H00M06S,063701_063750,Christmas decorations in the interior. gold twig and cones
17261545,https://ak.picdn.net/shutterstock/videos/17261545/preview/stock-footage-wanaka-new-zealand-may-facade-of-historic-cardrona-hotel-built-in-near-the-town-of.mp4,PT00H00M14S,021351_021400,"Wanaka,new zealand -may 7, 2016: facade of historic cardrona hotel. built in 1863 near the town of wanaka. it is one of the last remaining occupied buildings of the central otago gold rush days."
16326349,https://ak.picdn.net/shutterstock/videos/16326349/preview/stock-footage-river-japan.mp4,PT00H00M15S,180001_180050,"River,japan,"
14984629,https://ak.picdn.net/shutterstock/videos/14984629/preview/stock-footage-mom-and-two-kids-waiting-for-a-flight-children-use-smartphone-and-tablet.mp4,PT00H00M34S,105901_105950,"Mom and two kids waiting for a flight, children use smartphone and tablet"
15135985,https://ak.picdn.net/shutterstock/videos/15135985/preview/stock-footage-blonde-dancer-dancing-breakdance-on-his-hands-black-shadow-slow-motion.mp4,PT00H00M26S,057851_057900,"Blonde dancer dancing breakdance on his hands, black, shadow, slow motion"
20792485,https://ak.picdn.net/shutterstock/videos/20792485/preview/stock-footage-girl-and-boy-playing-with-the-dog-tourists-autumn-tent-ashore-forest-lake.mp4,PT00H00M19S,132401_132450,Girl and boy playing with the dog tourists. autumn tent ashore forest lake.
1034236649,https://ak.picdn.net/shutterstock/videos/1034236649/preview/stock-footage-bright-forest-greens-in-the-forest-background-with-unusual-plant-foliage-swaying-natural-texture.mp4,PT00H00M07S,133601_133650,Bright forest greens in the forest. background with unusual plant foliage swaying. natural texture with juicy leaves
7801921,https://ak.picdn.net/shutterstock/videos/7801921/preview/stock-footage-business-people-playing-rock-paper-scissors-in-the-workplace-a-laptop-with-green-screen-with-a.mp4,PT00H00M07S,107601_107650,"Business people playing - rock-paper-scissors in the workplace, a laptop with green screen.with a green screen background.chroma key."
30658363,https://ak.picdn.net/shutterstock/videos/30658363/preview/stock-footage-whole-bull-salted-oiled-and-herbed-then-slowly-spit-roasted-over-charcoal-for-hours.mp4,PT00H00M16S,186201_186250,"Whole bull salted, oiled and herbed then slowly spit roasted over charcoal for 7-9 hours"
6141767,https://ak.picdn.net/shutterstock/videos/6141767/preview/stock-footage-blood-count-fbc.mp4,PT00H00M52S,139101_139150,Blood count (fbc)
1028085401,https://ak.picdn.net/shutterstock/videos/1028085401/preview/stock-footage-young-girl-tourist-looks-at-the-ocean-in-hat-and-backpack.mp4,PT00H00M14S,120601_120650,Young girl tourist looks at the ocean. in hat and backpack
4758752,https://ak.picdn.net/shutterstock/videos/4758752/preview/stock-footage-portrait-of-surfer-costa-rica.mp4,PT00H00M28S,186101_186150,"Portrait of surfer, costa rica"
1051857859,https://ak.picdn.net/shutterstock/videos/1051857859/preview/stock-footage-free-women-travel-with-backpacks-wave-their-hands-and-enjoy-sunset-adventure-and-travel-concept.mp4,PT00H00M29S,006351_006400,Free women travel with backpacks wave their hands and enjoy sunset. adventure and travel concept. healthy mom and kids tourists. girls travel. hiker girl. mother with daughters travelers
1031020043,https://ak.picdn.net/shutterstock/videos/1031020043/preview/stock-footage-skopje-n-macedonia-may-girls-learning-and-practicing-pole-dance-in-the-city-park-speed.mp4,PT00H00M06S,028351_028400,"Skopje, n.macedonia - may 11 2019: girls learning and practicing pole dance in the city park. speed-up footage"
16272538,https://ak.picdn.net/shutterstock/videos/16272538/preview/stock-footage-selective-focus-of-the-proboscis-monkey-nasalis-larvatus-or-long-nosed-monkey-known-as-the.mp4,PT00H00M16S,014851_014900,"Selective focus of the proboscis monkey, nasalis larvatus or long-nosed monkey, known as the bekantan, is a reddish-brown arboreal old world monkey that is endemic to the southeast island of borneo.
"
16952095,https://ak.picdn.net/shutterstock/videos/16952095/preview/stock-footage-istanbul-turkey-april-istanbul-maiden-tower-kiz-kulesi-at-sunset.mp4,PT00H00M29S,082951_083000,"Istanbul, turkey - april 17, 2016:istanbul maiden tower (kiz kulesi) at sunset"
1017510184,https://ak.picdn.net/shutterstock/videos/1017510184/preview/stock-footage-a-happy-mother-and-daughter-are-playing-on-the-ukulele-family-in-a-city-park-on-a-picnic-on-a-warm.mp4,PT00H00M10S,043951_044000,A happy mother and daughter are playing on the ukulele. family in a city park on a picnic on a warm evening at sunset. 4k
1018218742,https://ak.picdn.net/shutterstock/videos/1018218742/preview/stock-footage-floating-particles-on-black-background-slow-motion.mp4,PT00H00M30S,068951_069000,Floating particles on black background. slow motion.
31571056,https://ak.picdn.net/shutterstock/videos/31571056/preview/stock-footage-pivot-irrigation-technology.mp4,PT00H00M36S,173401_173450,Pivot irrigation technology
1024809728,https://ak.picdn.net/shutterstock/videos/1024809728/preview/stock-footage-coniferous-winter-forest-with-snowy-trees-in-sunset-aerial-drone-view-spruce-and-pine-forest-on-a.mp4,PT00H00M08S,138701_138750,Coniferous winter forest with snowy trees in sunset. aerial drone view. spruce and pine forest on a winter sunny day in finland. very cold arctic weather.
1020438196,https://ak.picdn.net/shutterstock/videos/1020438196/preview/stock-footage-traveling-in-the-countryside.mp4,PT00H00M39S,079651_079700,Traveling in the countryside 
1053332291,https://ak.picdn.net/shutterstock/videos/1053332291/preview/stock-footage-close-up-of-an-indian-boy-making-a-video-call-to-the-friend-or-family-telling-about-his-quarantine.mp4,PT00H00M16S,187001_187050,"Close up of an indian boy making a video call to the friend or family telling about his quarantine days. pandemic,quarantine corona virus. spending days alone during epidemic"
19414390,https://ak.picdn.net/shutterstock/videos/19414390/preview/stock-footage-grizzly-bear-female-sow-adult-immature-cub-family-foraging-looking-for-food-fall-autumn-denali.mp4,PT00H00M15S,062201_062250,"Grizzly bear female sow adult immature cub family foraging looking for food fall autumn. denali national park, alaska, usa - 2015"
1024346933,https://ak.picdn.net/shutterstock/videos/1024346933/preview/stock-footage-large-old-brick-building-in-the-park.mp4,PT00H00M07S,083701_083750,Large old brick building in the park
8510533,https://ak.picdn.net/shutterstock/videos/8510533/preview/stock-footage-black-and-white-striped-nudibranch-with-orange-skirt-chromodoris-quadricolor-on-a-coral-reef-in.mp4,PT00H00M07S,055151_055200,"Black and white striped nudibranch with orange skirt (chromodoris quadricolor) on a coral reef in the indian ocean, zanzibar"
5294438,https://ak.picdn.net/shutterstock/videos/5294438/preview/stock-footage-fireworks-show.mp4,PT00H00M32S,120601_120650,Fireworks show
4313921,https://ak.picdn.net/shutterstock/videos/4313921/preview/stock-footage-dunluce-castle-cliffs.mp4,PT00H00M13S,066101_066150,Dunluce castle & cliffs
1014278504,https://ak.picdn.net/shutterstock/videos/1014278504/preview/stock-footage-aerial-view-of-laguna-beach-california-united-states-of-america-mov.mp4,PT00H00M17S,077851_077900,Aerial view of laguna beach california united states of america .mov
6225377,https://ak.picdn.net/shutterstock/videos/6225377/preview/stock-footage-time-lapse-sunset-over-sea.mp4,PT00H00M10S,007451_007500,Time lapse sunset over sea
