videoid,contentUrl,duration,page_dir,name
1035815930,https://ak.picdn.net/shutterstock/videos/1035815930/preview/stock-footage-island-on-the-saint-lawrence-river-panning-left.mp4,PT00H00M18S,190901_190950,Island on the saint lawrence river / panning left
1031445119,https://ak.picdn.net/shutterstock/videos/1031445119/preview/stock-footage-funny-overweight-man-on-beach-applying-suntan-lotion-on-body-smiling-excited-for-summer-day.mp4,PT00H00M29S,172551_172600,Funny overweight man on beach applying suntan lotion on body smiling excited for summer day sunscreen skincare protection 4k
1016143447,https://ak.picdn.net/shutterstock/videos/1016143447/preview/stock-footage--d-rendered-medically-accurate-illustration-of-the-longus-colli.mp4,PT00H00M12S,108751_108800,"3d rendered medically accurate illustration of the longus colli
"
24222967,https://ak.picdn.net/shutterstock/videos/24222967/preview/stock-footage-successful-silhouette-man-winner-waving-dominican-republic-flag-on-top-of-the-mountain-peak.mp4,PT00H00M06S,093901_093950,Successful silhouette man winner waving dominican republic flag on top of the mountain peak. cinemagraph loop background
11315678,https://ak.picdn.net/shutterstock/videos/11315678/preview/stock-footage-docks-and-cranes-seattle-harbor-wa.mp4,PT00H00M10S,126601_126650,"Docks and cranes, seattle harbor, wa"
1508765,https://ak.picdn.net/shutterstock/videos/1508765/preview/stock-footage-winter-waves-crashing-against-the-rocks-of-the-big-sur-coast-of-california.mp4,PT00H00M15S,008751_008800,Winter waves crashing against the rocks of the big sur coast of california.
28142860,https://ak.picdn.net/shutterstock/videos/28142860/preview/stock-footage-seattle-aerial-v-birdseye-closeup-shot-flying-around-space-needle-at-night.mp4,PT00H00M30S,144051_144100,Seattle aerial v105 birdseye closeup shot flying around space needle at night 4/17
1017417094,https://ak.picdn.net/shutterstock/videos/1017417094/preview/stock-footage-ukraine-on-blue-political-globe-orbiting-around-globe-and-zooming-to-the-country-d-illustration.mp4,PT00H00M20S,119151_119200,Ukraine on blue political globe. orbiting around globe and zooming to the country. 3d illustration.
1034367128,https://ak.picdn.net/shutterstock/videos/1034367128/preview/stock-footage-young-guy-in-a-restaurant-going-to-eat-a-sandwich-and-fries.mp4,PT00H00M42S,188501_188550,Young guy in a restaurant. going to eat a sandwich and fries
1028705201,https://ak.picdn.net/shutterstock/videos/1028705201/preview/stock-footage-vancouver-canada-april-people-are-enjoying-a-morning-walk-down-the-seawall-at-coal.mp4,PT00H00M25S,059601_059650,"Vancouver, canada - april 30, 2019 people are enjoying a morning walk down the seawall at coal harbour with the marina in the background. "
5743631,https://ak.picdn.net/shutterstock/videos/5743631/preview/stock-footage-sunrise-over-clouds.mp4,PT00H00M18S,091851_091900,Sunrise over clouds
6084212,https://ak.picdn.net/shutterstock/videos/6084212/preview/stock-footage-london-england-july-london-tourist-traffic-with-the-big-ben-clock-tower-in-the.mp4,PT00H00M11S,040051_040100,"London,england, july 27, 2013: london tourist traffic with the big ben clock tower in the background."
34125436,https://ak.picdn.net/shutterstock/videos/34125436/preview/stock-footage-church-of-holy-resurrection-of-christ-on-red-cliff-and-township-foros-on-black-sea-coast-crimea.mp4,PT00H00M12S,060401_060450,"Church of holy resurrection of christ on red cliff and township foros on black sea coast, crimea, russia"
1011505382,https://ak.picdn.net/shutterstock/videos/1011505382/preview/stock-footage--k-the-blurred-light-bokeh-on-water-abstract-background-concept-for-making-blur-light-background.mp4,PT00H00M42S,085551_085600,"4k : the blurred light bokeh on water abstract background, concept for making blur light background."
20061538,https://ak.picdn.net/shutterstock/videos/20061538/preview/stock-footage-charming-girl-sitting-by-wooden-table-and-reading-book.mp4,PT00H00M19S,010701_010750,Charming girl sitting by wooden table and reading book
1037304725,https://ak.picdn.net/shutterstock/videos/1037304725/preview/stock-footage-beautiful-young-woman-in-the-field-spins-with-flowers-and-spikelets-portrait-of-attractive-female.mp4,PT00H00M20S,172101_172150,Beautiful young woman in the field spins with flowers and spikelets. portrait of attractive female on grass at sunset or sunrise. slow motion
1039738568,https://ak.picdn.net/shutterstock/videos/1039738568/preview/stock-footage-cernobbio-july-tourist-spyglass-and-view-of-the-como-lake-from-cernobbio-camera-dolly.mp4,PT00H00M10S,195201_195250,"Cernobbio, july, 2019 - tourist spyglass and view of the como lake from cernobbio. camera dolly zoom out and view of the pier"
1025488274,https://ak.picdn.net/shutterstock/videos/1025488274/preview/stock-footage-grid-pattern-of-abstract-moving-soft-focus-shapes-lights-and-form.mp4,PT00H00M11S,051101_051150,Grid pattern of abstract moving soft focus shapes lights and form
1058073820,https://ak.picdn.net/shutterstock/videos/1058073820/preview/stock-footage-sidewalk-repair-of-the-footpath-new-asphalt-workers-pour-asphalt-with-a-shovel-loosening-and.mp4,PT00H00M12S,196701_196750,"Sidewalk repair of the footpath, new asphalt. workers pour asphalt with a shovel, loosening and leveling of heated bitumen. laying concrete blocks on the sidewalk. working outdoors,hard work 4k"
30127708,https://ak.picdn.net/shutterstock/videos/30127708/preview/stock-footage-soft-foam-cubes-playground.mp4,PT00H00M26S,032001_032050,Soft foam cubes playground
13231709,https://ak.picdn.net/shutterstock/videos/13231709/preview/stock-footage-big-black-keyboard-and-other-office-supply-on-the-desk-in-the-office.mp4,PT00H00M16S,183251_183300,Big black keyboard and other office supply on the desk in the office.
1033331138,https://ak.picdn.net/shutterstock/videos/1033331138/preview/stock-footage-coconut-cocos-nucifera-fruit-and-powder-exploding-against-black-background-slow-motion-k.mp4,PT00H00M32S,053201_053250,"Coconut, cocos nucifera, fruit and powder exploding against black background, slow motion 4k"
1018661263,https://ak.picdn.net/shutterstock/videos/1018661263/preview/stock-footage-london-united-kingdom-uk-establishing-shot-of-the-shakespeare-memorial-fountain-in.mp4,PT00H00M08S,024901_024950,"London, united kingdom (uk) - 08 04 2018: establishing shot of the shakespeare memorial fountain in leicester square, london, with fish sculptures and water sprays and out of focus people in the backg"
12788843,https://ak.picdn.net/shutterstock/videos/12788843/preview/stock-footage-lamayuru-india-june-tibetan-lamas-dressed-in-mystical-mask-dancing-tsam-mystery-dance.mp4,PT00H00M16S,112751_112800,"Lamayuru, india - june 13, 2015 : tibetan lamas dressed in mystical mask dancing tsam mystery dance in time of yuru kabgyat buddhist festival at lamayuru gompa, ladakh, north india"
1029415127,https://ak.picdn.net/shutterstock/videos/1029415127/preview/stock-footage-bhubaneswar-india-lingaraja-temple-k-aerial-drone-footage.mp4,PT00H00M40S,083501_083550,"Bhubaneswar, india, ""lingaraja"" temple, 4k aerial drone footage"
1010209754,https://ak.picdn.net/shutterstock/videos/1010209754/preview/stock-footage-lubeck-germany-april-kayak-paddling-at-springtime.mp4,PT00H00M13S,022951_023000,"Lubeck, germany - april 19, 2018: kayak-paddling at springtime"
15969706,https://ak.picdn.net/shutterstock/videos/15969706/preview/stock-footage-close-up-of-a-woman-s-hands-picking-grapes-off-a-vine.mp4,PT00H00M06S,014251_014300,Close up of a woman's hands picking grapes off a vine
15993523,https://ak.picdn.net/shutterstock/videos/15993523/preview/stock-footage-electric-screwdriver-in-use.mp4,PT00H00M10S,080751_080800,Electric screwdriver in use
8678473,https://ak.picdn.net/shutterstock/videos/8678473/preview/stock-footage-cannon-river-view-dam.mp4,PT00H00M06S,084401_084450,Cannon river view dam.
18197176,https://ak.picdn.net/shutterstock/videos/18197176/preview/stock-footage-son-congratulates-his-mother-giving-her-a-bundle-of-autumn-leaves.mp4,PT00H00M12S,084201_084250,Son congratulates his mother giving her a bundle of autumn leaves
1045147765,https://ak.picdn.net/shutterstock/videos/1045147765/preview/stock-footage--k-rione-terra-under-restoration-in-italian-city-of-pozzuoli-during-on-a-sunny-day-it-is-a.mp4,PT00H00M09S,194601_194650,4k rione terra under restoration in italian city of pozzuoli during on a sunny day. it is a beautiful coastal city and tourist destination next to naples italy december 2019
1032700856,https://ak.picdn.net/shutterstock/videos/1032700856/preview/stock-footage-national-arab-food-pilaf-cooked-in-a-large-cauldron-on-the-street-street-food-celebration-ramadan.mp4,PT00H00M16S,133301_133350,National arab food. pilaf cooked in a large cauldron on the street. street food. celebration ramadan
1061230246,https://ak.picdn.net/shutterstock/videos/1061230246/preview/stock-footage-joyful-men-and-women-of-different-races-in-supermarket-buying-food-multiscreen-on-happy.mp4,PT00H00M05S,084801_084850,Joyful men and women of different races in supermarket buying food. multiscreen on happy multinational people of diverse gender and age standing with shopping cart in good mood. grocery concept
1042385464,https://ak.picdn.net/shutterstock/videos/1042385464/preview/stock-footage-two-romantic-white-swans-swims-on-the-lake-near-shore-at-the-morning.mp4,PT00H00M12S,105651_105700,Two romantic white swans swims on the lake near shore at the morning.
1035568589,https://ak.picdn.net/shutterstock/videos/1035568589/preview/stock-footage-blue-bottom-of-a-swimming-pool-with-clear-and-cool-water.mp4,PT00H00M14S,002351_002400,Blue bottom of a swimming pool with clear and cool water
10519850,https://ak.picdn.net/shutterstock/videos/10519850/preview/stock-footage-downhill-mountain-biking-on-forest-trails-trees-rocks-and-other-obstacles-in-the-middle-of-a.mp4,PT00H00M08S,063751_063800,"Downhill mountain biking on forest trails - trees, rocks and other obstacles in the middle of a bicycle race"
1017148504,https://ak.picdn.net/shutterstock/videos/1017148504/preview/stock-footage-markham-ontario-canada-september-election-campaign-signs.mp4,PT00H00M24S,118501_118550,"Markham, ontario, canada september 2018 election campaign signs"
1018540696,https://ak.picdn.net/shutterstock/videos/1018540696/preview/stock-footage-vacation-concept-happy-young-man-at-swimming-pool.mp4,PT00H00M06S,171601_171650,Vacation concept. happy young man at swimming pool.
1041462160,https://ak.picdn.net/shutterstock/videos/1041462160/preview/stock-footage-close-up-of-beautiful-caucasian-woman-with-double-buns-smiling-on-the-bridge-old-fashioned-girl.mp4,PT00H00M06S,134101_134150,Close-up of beautiful caucasian woman with double buns smiling on the bridge. old fashioned girl posing in the autumn park as her stylish boyfriend in vest and bow tie standing at the background.
29352904,https://ak.picdn.net/shutterstock/videos/29352904/preview/stock-footage-close-up-of-a-woman-s-eye-with-her-pupil-slowly-retracting-slow-motion-footage.mp4,PT00H00M12S,101451_101500,Close up of a womans eye with her pupil slowly retracting. slow motion footage.
1013764799,https://ak.picdn.net/shutterstock/videos/1013764799/preview/stock-footage-a-man-in-red-leather-handcuffs-is-in-an-inadequate-condition.mp4,PT00H00M08S,073901_073950,A man in red leather handcuffs is in an inadequate condition.
1033574018,https://ak.picdn.net/shutterstock/videos/1033574018/preview/stock-footage-lisbon-portugal-july-people-enjoying-a-day-out-at-lisbon-zoo-with-moving-cable-car-at.mp4,PT00H00M13S,038151_038200,"Lisbon, portugal - july 18, 2019: people enjoying a day out at lisbon zoo with moving cable car at background"
1034017193,https://ak.picdn.net/shutterstock/videos/1034017193/preview/stock-footage-man-photographer-walking-behind-the-crime-tape-taking-pictures-of-car-accident-in-the-street.mp4,PT00H00M22S,103751_103800,Man photographer walking behind the crime tape taking pictures of car accident in the street. portrait of severe handsome police man looking around providing an investigation.
27599737,https://ak.picdn.net/shutterstock/videos/27599737/preview/stock-footage-sea-waves-landscape-at-pacific-ocean-power-of-the-sea-background.mp4,PT00H00M30S,024451_024500,"Sea waves landscape at pacific ocean,power of the sea background"
1040234165,https://ak.picdn.net/shutterstock/videos/1040234165/preview/stock-footage-lovely-lady-is-standing-near-the-waterside-and-sending-an-air-kiss.mp4,PT00H00M15S,185401_185450,Lovely lady is standing near the waterside and sending an air kiss
1039954955,https://ak.picdn.net/shutterstock/videos/1039954955/preview/stock-footage-bulldog-puppy-dressed-as-businessman-wearing-collar-and-tie-sitting-at-desk-looking-at-computer.mp4,PT00H00M11S,002151_002200,Bulldog puppy dressed as businessman wearing collar and tie sitting at desk looking at computer
1014775577,https://ak.picdn.net/shutterstock/videos/1014775577/preview/stock-footage-london-april-cars-and-people-entering-tower-bridge-tourists-crossing-traffic-in-ldn.mp4,PT00H00M14S,020601_020650,"London - april 28, 2018: cars and people entering tower bridge - tourists crossing traffic in ldn england uk. the famous bridge is both bascule and suspension in structure and is 213 feet tall."
1024864628,https://ak.picdn.net/shutterstock/videos/1024864628/preview/stock-footage-olive-oil-unloading.mp4,PT00H00M19S,147151_147200,"Olive oil unloading
"
33990598,https://ak.picdn.net/shutterstock/videos/33990598/preview/stock-footage-business-people-discuss-together-at-outdoor.mp4,PT00H00M21S,014351_014400,Business people discuss together at outdoor
34074676,https://ak.picdn.net/shutterstock/videos/34074676/preview/stock-footage-young-man-playing-video-games-and-holding-remote-controller.mp4,PT00H00M13S,140101_140150,Young man playing video games and holding remote controller
1022758750,https://ak.picdn.net/shutterstock/videos/1022758750/preview/stock-footage-panamic-porkfish-anisotremus-taeniatus-colorful-yellow-fish-in-a-school-baitball-or-tornado-the.mp4,PT00H00M24S,128701_128750,"Panamic porkfish (anisotremus taeniatus),colorful yellow fish in a school, baitball or tornado, the sea of cortez. cabo pulmo, baja california sur, mexico."
10367987,https://ak.picdn.net/shutterstock/videos/10367987/preview/stock-footage-aerial-video-of-the-new-bridge-construction.mp4,PT00H00M27S,074001_074050,Aerial video of the new bridge construction.
22975075,https://ak.picdn.net/shutterstock/videos/22975075/preview/stock-footage-attractive-african-american-woman-calling-on-the-phone-at-the-shopping-pretty-brunette-female.mp4,PT00H00M06S,068601_068650,Attractive african american woman calling on the phone at the shopping. pretty brunette female shopper holding smartphone in her hand. close up of beautiful young girl standing with cellphone and
9553832,https://ak.picdn.net/shutterstock/videos/9553832/preview/stock-footage-intercity-train-passing-on-an-elevated-railroad-track-in-the-country-side-at-the-end-of-the-day.mp4,PT00H00M10S,013151_013200,Intercity train passing on an elevated railroad track in the country side at the end of the day.
9957356,https://ak.picdn.net/shutterstock/videos/9957356/preview/stock-footage-disco-spectrum-lights-concert-spot-bulb-abstract-motion-background-in-violet-colors-shining.mp4,PT00H00M11S,008401_008450,"Disco spectrum lights concert spot bulb. abstract motion background in violet colors, shining lights, energy waves and sparkling particles. seamless loop. more sets footage in my portfolio. "
1019720578,https://ak.picdn.net/shutterstock/videos/1019720578/preview/stock-footage-driving-a-car-through-grand-teton-park-sunny-point-of-view-mounted-k-ultra-hd-footage.mp4,PT00H00M10S,035101_035150,"Driving a car through grand teton park, sunny, point of view - mounted 2.7k ultra hd footage"
21666499,https://ak.picdn.net/shutterstock/videos/21666499/preview/stock-footage-estoril-portugal-july-surfers-riding-waves-on-july-in-estoril-portugal.mp4,PT00H00M17S,077951_078000,"Estoril, portugal - july 15, 2016: surfers riding waves on july 15, 2016 in estoril, portugal. powerful nature, active lifestyle and people"
1049214919,https://ak.picdn.net/shutterstock/videos/1049214919/preview/stock-footage-green-arugula-and-red-chili-peppers-with-cherry-tomatoes-appear-and-fall-down-on-black-background.mp4,PT00H00M07S,130301_130350,Green arugula and red chili peppers with cherry tomatoes appear and fall down on black background extreme close view
1023165136,https://ak.picdn.net/shutterstock/videos/1023165136/preview/stock-footage-aerial-flight-view-over-the-magnificient-stone-called-la-piedra-del-penol-in-the-guatape.mp4,PT00H00M36S,139651_139700,"Aerial flight view over the magnificient stone called ""la piedra del penol"" in the guatape reservoir near medellin, antioquia department, colombia."
1020538372,https://ak.picdn.net/shutterstock/videos/1020538372/preview/stock-footage-closeup-of-meat-cooking-on-a-skewer-on-coals.mp4,PT00H00M06S,067151_067200,Closeup of meat cooking on a skewer on coals
15595510,https://ak.picdn.net/shutterstock/videos/15595510/preview/stock-footage-june-puerto-rico-the-puerto-rican-flag-hangs-on-top-of-a-building-in-old-san-juan-the-flag.mp4,PT00H00M16S,077101_077150,"June 2015, puerto rico: the puerto rican flag hangs on top of a building in old san juan. the flag represents and symbolizes the island and its people. the origin of the flag can be traced to 1868."
7122844,https://ak.picdn.net/shutterstock/videos/7122844/preview/stock-footage-autumn-season-rainy-day-outdoors-beautiful-rainbow-seen-over-the-city-cloudscape.mp4,PT00H00M21S,076451_076500,Autumn season rainy day outdoors beautiful rainbow seen over the city cloudscape
17407102,https://ak.picdn.net/shutterstock/videos/17407102/preview/stock-footage-pyrite-and-calcite-crystal-with-a-green-background-variant.mp4,PT00H00M13S,079151_079200,Pyrite and calcite crystal with a green background variant 7
1021645927,https://ak.picdn.net/shutterstock/videos/1021645927/preview/stock-footage-ungraded-wheat-grass-green-ears-in-a-wheat-field-swaying-in-the-wind-in-the-middle-of-summer.mp4,PT00H00M29S,071851_071900,Ungraded: wheat grass. green ears in a wheat field swaying in the wind in the middle of summer. ungraded h.264 from camera without re-encoding.
22019497,https://ak.picdn.net/shutterstock/videos/22019497/preview/stock-footage-lion-wild-dangerous-mammal-africa-savannah-kenya.mp4,PT00H00M13S,018851_018900,Lion wild dangerous mammal africa savannah kenya
6350981,https://ak.picdn.net/shutterstock/videos/6350981/preview/stock-footage-slo-mo-medium-shot-young-couple-walking-along-canal-and-ascending-footbridge-venice-italy.mp4,PT00H00M14S,050501_050550,"Slo mo medium shot young couple walking along canal and ascending footbridge / venice, italy"
30701290,https://ak.picdn.net/shutterstock/videos/30701290/preview/stock-footage-woman-hands-cooking-boiling-and-preparing-food-at-camping-morning-light-in-campsite.mp4,PT00H00M09S,194801_194850,"Woman hands cooking, boiling and preparing food at camping. morning light in campsite."
1011057839,https://ak.picdn.net/shutterstock/videos/1011057839/preview/stock-footage-container-ship-in-export-and-import-business-and-logistics-in-thailand-shipping-cargo-to-harbor-by.mp4,PT00H00M35S,053001_053050,"Container ship in export and import business and logistics in thailand. shipping cargo to harbor by crane. water transport international. aerial view
"
1014727439,https://ak.picdn.net/shutterstock/videos/1014727439/preview/stock-footage-happy-beautiful-blond-woman-in-sunglasses-driving-a-car-k-slow-motion.mp4,PT00H00M13S,125601_125650,"Happy beautiful blond woman in sunglasses driving a car. 4k, slow motion."
7950556,https://ak.picdn.net/shutterstock/videos/7950556/preview/stock-footage--k-supermoon-full-moon-aura-timelapse-k-x.mp4,PT00H00M23S,118401_118450,"4k supermoon full moon aura timelapse
4k 4096x2304"
1061993281,https://ak.picdn.net/shutterstock/videos/1061993281/preview/stock-footage-top-view-of-almond-nuts-on-man-s-hand.mp4,PT00H00M10S,021851_021900,Top view of almond nuts on man's hand 
24816695,https://ak.picdn.net/shutterstock/videos/24816695/preview/stock-footage-rome-italy-countries-flag-flying-high-with-fire-in-the-background-on-a-sunny-day.mp4,PT00H00M09S,076251_076300,Rome italy 1960: countries flag flying high with fire in the background on a sunny day
34138606,https://ak.picdn.net/shutterstock/videos/34138606/preview/stock-footage-step-by-step-decorating-mousse-pink-mirror-glaze-cake-with-fresh-berries.mp4,PT00H00M54S,110601_110650,Step by step. decorating mousse pink mirror glaze cake with fresh berries.
13229756,https://ak.picdn.net/shutterstock/videos/13229756/preview/stock-footage-beautiful-chuysky-trakt-and-snow-caps-of-the-north-chuya-ridge.mp4,PT00H00M29S,113001_113050,Beautiful chuysky trakt and snow caps of the north chuya ridge.
3526169,https://ak.picdn.net/shutterstock/videos/3526169/preview/stock-footage-redstart-phoenicurus-ochruros.mp4,PT00H00M13S,090751_090800,Redstart (phoenicurus ochruros)
3243166,https://ak.picdn.net/shutterstock/videos/3243166/preview/stock-footage-attempting-to-brush-teeth-but-the-water-has-been-cut-off.mp4,PT00H00M13S,053751_053800,"Attempting to brush teeth, but the water has been cut off."
1021284694,https://ak.picdn.net/shutterstock/videos/1021284694/preview/stock-footage-mother-breastfeeds-the-baby-close-up.mp4,PT00H00M20S,127051_127100,"Mother breastfeeds the baby, close up."
1038299639,https://ak.picdn.net/shutterstock/videos/1038299639/preview/stock-footage-camera-slowly-pushes-in-to-reveal-a-grinder-vaporizer-and-ground-pot-lying-on-a-white-table-k.mp4,PT00H00M10S,010651_010700,"Camera slowly pushes in to reveal a grinder,vaporizer, and ground pot lying on a white table. 4k uhd."
1023459574,https://ak.picdn.net/shutterstock/videos/1023459574/preview/stock-footage-stacks-of-blue-and-dark-jeans-multi-colored-sweaters-and-warm-gray-scarf-background.mp4,PT00H00M23S,082601_082650,"Stacks of blue and dark jeans, multi-colored sweaters and warm gray scarf, background"
15125485,https://ak.picdn.net/shutterstock/videos/15125485/preview/stock-footage--k-happy-affectionate-father-and-son-spending-time-together-outdoors.mp4,PT00H00M18S,085701_085750,4k happy affectionate father and son spending time together outdoors
1014370628,https://ak.picdn.net/shutterstock/videos/1014370628/preview/stock-footage-moon-pass-by-slow.mp4,PT00H00M52S,117951_118000,Moon pass by slow
1013357267,https://ak.picdn.net/shutterstock/videos/1013357267/preview/stock-footage-driving-on-off-road-tracks-in-the-puntas-de-calnegre-natural-park-on-the-coast-in-murcia-spain.mp4,PT00H00M22S,148251_148300,"Driving on off road tracks in the puntas de calnegre natural park on the coast in murcia, spain"
8260978,https://ak.picdn.net/shutterstock/videos/8260978/preview/stock-footage--flower.mp4,PT00H00M21S,115451_115500, flower
20294863,https://ak.picdn.net/shutterstock/videos/20294863/preview/stock-footage-huizhou-china-may-beachside-in-china-with-people-sunny-summer-day-panorama-movement.mp4,PT00H00M26S,082601_082650,"Huizhou, china - 14 may 2016 - beachside in china with people, sunny summer day. panorama movement. "
1438261,https://ak.picdn.net/shutterstock/videos/1438261/preview/stock-footage-detail-of-the-top-of-the-boudhanath-stupa-temple-in-kathmandu-nepal.mp4,PT00H00M22S,103951_104000,"Detail of the top of the boudhanath stupa temple in kathmandu, nepal"
1036012370,https://ak.picdn.net/shutterstock/videos/1036012370/preview/stock-footage-aerial-view-of-toronto-skyline-flying-over-chinatown-dolly-in.mp4,PT00H00M11S,120201_120250,Aerial view of toronto skyline flying over chinatown. dolly in
1022122621,https://ak.picdn.net/shutterstock/videos/1022122621/preview/stock-footage-young-asian-maid-wearing-rubber-gloves-cleaning-glass-table-at-home-cleanness-is-in-trend-pretty.mp4,PT00H00M09S,124301_124350,Young asian maid wearing rubber gloves cleaning glass table at home. cleanness is in trend. pretty frowning woman wiping with blue cloth detergent cleaner and special means of washing.
1019017105,https://ak.picdn.net/shutterstock/videos/1019017105/preview/stock-footage-model-posing-in-the-studio-charming-sexy-woman-in-a-sparkling-dress-poses-in-the-white-studio.mp4,PT00H00M09S,124751_124800,Model posing in the studio. charming sexy woman in a sparkling dress poses in the white studio while wind blows her long brunette hair
27709636,https://ak.picdn.net/shutterstock/videos/27709636/preview/stock-footage-animation-rotation-of-symbol-about-technology-computers-and-programs-developing-animation-of.mp4,PT00H00M10S,180201_180250,"Animation rotation of symbol about technology, computers and programs developing. animation of seamless loop."
1024134653,https://ak.picdn.net/shutterstock/videos/1024134653/preview/stock-footage-a-young-attractive-businessman-with-glasses-hears-a-call-and-answers-by-mobile-phone-talking-on.mp4,PT00H00M16S,052401_052450,A young attractive businessman with glasses hears a call and answers by mobile phone. talking on the phone and smiling
1047540319,https://ak.picdn.net/shutterstock/videos/1047540319/preview/stock-footage-calm-river-way-under-wooden-bridge.mp4,PT00H00M30S,119451_119500,Calm river way under wooden bridge
33182389,https://ak.picdn.net/shutterstock/videos/33182389/preview/stock-footage-view-of-the-mangroves-and-town-from-air.mp4,PT00H00M19S,056901_056950,View of the mangroves and town from air
30116503,https://ak.picdn.net/shutterstock/videos/30116503/preview/stock-footage-insect-macro-black-matt-beetle-hides-on-ground-in-summer-field.mp4,PT00H00M23S,046301_046350,Insect macro black matt beetle hides on ground in summer field
15701944,https://ak.picdn.net/shutterstock/videos/15701944/preview/stock-footage-mom-puts-the-little-girl-in-the-bath.mp4,PT00H00M13S,096701_096750,Mom puts the little girl in the bath
