videoid,contentUrl,duration,page_dir,name
5620418,https://ak.picdn.net/shutterstock/videos/5620418/preview/stock-footage-couple-walking-at-beach-together-shot-on-red-epic-for-high-quality-k-uhd-ultra-hd-resolution.mp4,PT00H00M29S,142501_142550,"Couple walking at beach together. shot on red epic for high quality 4k, uhd, ultra hd resolution."
19920337,https://ak.picdn.net/shutterstock/videos/19920337/preview/stock-footage-three-colleagues-met-in-the-office-and-discuss-the-work.mp4,PT00H00M13S,115051_115100,Three colleagues met in the office and discuss the work
32822293,https://ak.picdn.net/shutterstock/videos/32822293/preview/stock-footage-lady-swing-on-hammock-in-beautiful-house.mp4,PT00H00M10S,107551_107600,Lady swing on hammock in beautiful house.
1020498409,https://ak.picdn.net/shutterstock/videos/1020498409/preview/stock-footage-toxic-fog-or-smoke-isolated-transparent-special-effect-animation-cloudiness-mist-smog-background.mp4,PT00H00M08S,048701_048750,"Toxic fog or smoke isolated transparent special effect. animation cloudiness, mist smog background. animation"
26768092,https://ak.picdn.net/shutterstock/videos/26768092/preview/stock-footage-sausages-cooked-on-the-nature.mp4,PT00H00M18S,127001_127050,Sausages cooked on the nature
1023126619,https://ak.picdn.net/shutterstock/videos/1023126619/preview/stock-footage-black-abstraction-three-dimensional-mesh-slowly-deformed-on-a-white-background-animated-background.mp4,PT00H00M20S,056801_056850,Black abstraction three-dimensional mesh slowly deformed on a white background. animated background. 3d render
31415170,https://ak.picdn.net/shutterstock/videos/31415170/preview/stock-footage-lemon-splashing-in-slow-motion.mp4,PT00H00M17S,179901_179950,Lemon splashing in slow motion
33800098,https://ak.picdn.net/shutterstock/videos/33800098/preview/stock-footage-italian-christmas-cakes.mp4,PT00H00M10S,032201_032250,Italian christmas cakes 30
1062303961,https://ak.picdn.net/shutterstock/videos/1062303961/preview/stock-footage-wide-white-waters-of-warren-falls-in-autumn-vermont-usa.mp4,PT00H00M24S,181401_181450,"Wide, white waters of warren falls in autumn, vermont, usa"
1006922782,https://ak.picdn.net/shutterstock/videos/1006922782/preview/stock-footage-abstract-blocks-lights-digital-d-rendering-background-seamless-loop.mp4,PT00H00M14S,025551_025600,Abstract blocks lights. digital 3d rendering background. seamless loop
1011313541,https://ak.picdn.net/shutterstock/videos/1011313541/preview/stock-footage--k-slow-motion-shooting-a-flower-bed-of-pink-roses-rose-garden.mp4,PT00H00M12S,026051_026100,"4k, slow-motion shooting, a flower bed of pink roses. rose garden"
23410993,https://ak.picdn.net/shutterstock/videos/23410993/preview/stock-footage-fish-and-coral-reef-tropical-fish-on-a-coral-reef-wonderful-and-beautiful-underwater-world-with.mp4,PT00H00M08S,004101_004150,Fish and coral reef. tropical fish on a coral reef. wonderful and beautiful underwater world with corals and tropical fish. hard and soft corals. diving and snorkeling in the tropical sea. 4k video.
1013211899,https://ak.picdn.net/shutterstock/videos/1013211899/preview/stock-footage-family-in-background-at-park-on-fall-day-k.mp4,PT00H00M19S,028301_028350,Family in background at park on fall day 4k
22173343,https://ak.picdn.net/shutterstock/videos/22173343/preview/stock-footage-the-woman-prepares-for-pies-with-a-mincemeat-on-a-wooden-board.mp4,PT00H00M16S,123151_123200,The woman prepares for pies with a mincemeat on a wooden board
19383637,https://ak.picdn.net/shutterstock/videos/19383637/preview/stock-footage-a-slow-motion-shot-of-a-praying-mantis-capturing-a-cricket-to-eat-this-shot-is-times-slower-than.mp4,PT00H00M10S,075501_075550,A slow motion shot of a praying mantis capturing a cricket to eat. this shot is 5 times slower than real time.
1042243063,https://ak.picdn.net/shutterstock/videos/1042243063/preview/stock-footage-stock-k-traffic-in-ho-chi-minh-city-or-saigon-vietnam-high-quality-free-stock-video-footage-of.mp4,PT00H00M22S,031751_031800,"Stock 4k: traffic in ho chi minh city or saigon, vietnam. high-quality free stock video footage of slow moving traffic with lots of motorbike, bus, motorcycles, car... transport on the road in night"
1014342665,https://ak.picdn.net/shutterstock/videos/1014342665/preview/stock-footage-shymkent-kazakhstan-july-garbage-truck-stuck-in-garbage-dump.mp4,PT00H00M13S,063251_063300,"Shymkent, kazakhstan - 28 july 2018: garbage truck stuck in garbage dump"
24291824,https://ak.picdn.net/shutterstock/videos/24291824/preview/stock-footage-structure-of-the-cosmos.mp4,PT00H00M59S,003001_003050,Structure of the cosmos 2/5
34250560,https://ak.picdn.net/shutterstock/videos/34250560/preview/stock-footage-flying-through-digital-hud-sci-fi-cyber-space-technological-background-blue-futuristic-interface.mp4,PT00H00M10S,143201_143250,Flying through digital hud sci fi cyber space.technological background.blue futuristic interface.
27090694,https://ak.picdn.net/shutterstock/videos/27090694/preview/stock-footage-shibuya-japan-november-city-pedestrian-traffic-of-people-crossing-the-famous-shibuya.mp4,PT00H00M10S,000301_000350,"Shibuya, japan, november 2016 -:city pedestrian traffic of people crossing the famous shibuya intersection in tokyo"
18042433,https://ak.picdn.net/shutterstock/videos/18042433/preview/stock-footage-one-young-businessman-sitting-alone-near-wall.mp4,PT00H00M07S,198501_198550,One young businessman sitting alone near wall
20801128,https://ak.picdn.net/shutterstock/videos/20801128/preview/stock-footage-aerial-view-of-wooden-architecture-of-the-arkhangelsk-orthodox-church.mp4,PT00H00M43S,142151_142200,Aerial view of wooden architecture of the arkhangelsk orthodox church
1018142740,https://ak.picdn.net/shutterstock/videos/1018142740/preview/stock-footage-sochi-russia-circa-august-young-blond-in-red-clothes-and-glasses-of-virtual-reality.mp4,PT00H00M16S,048701_048750,"Sochi, russia - circa august, 2018: young blond in red clothes and glasses of virtual reality throws up her hands against the background of a green wooded mountain valley. presses invisible key"
1024519982,https://ak.picdn.net/shutterstock/videos/1024519982/preview/stock-footage-berlin-germany-april-fish-eye-time-lapse-tourists-and-traffic-at-brandenburger-tor.mp4,PT00H00M07S,033751_033800,"Berlin, germany - april 21, 2018: fish-eye time lapse: tourists and traffic at brandenburger tor, brandenburg gate, in berlin, germany"
1038317375,https://ak.picdn.net/shutterstock/videos/1038317375/preview/stock-footage-selective-focus-of-woman-hand-holding-chopsticks-of-fresh-sliced-pork-raw-with-vegetables-for.mp4,PT00H00M10S,020051_020100,"Selective focus of woman hand holding chopsticks of fresh sliced pork raw with vegetables for cooking or shabu shabu and sukiyaki, japanese food"
1033457750,https://ak.picdn.net/shutterstock/videos/1033457750/preview/stock-footage-miniature-pigs-on-the-farm-during-the-day-time.mp4,PT00H00M16S,062251_062300,Miniature pigs on the farm during the day time
1059931229,https://ak.picdn.net/shutterstock/videos/1059931229/preview/stock-footage-angle-grinder-working-process-the-angle-grinder-cuts-the-metal-pin-work-on-a-rack-for-a-grinder.mp4,PT00H00M09S,140251_140300,Angle grinder working process. the angle grinder cuts the metal pin. work on a rack for a grinder. fiery sparks fly from under the disk.
1034377805,https://ak.picdn.net/shutterstock/videos/1034377805/preview/stock-footage-teenage-girl-with-phone-in-hand-and-headphones-children-and-modern-technology.mp4,PT00H00M09S,141901_141950,"Teenage girl with phone in hand and headphones, children and modern technology."
1017894295,https://ak.picdn.net/shutterstock/videos/1017894295/preview/stock-footage-a-young-beautiful-woman-in-a-retro-dress-smells-a-red-rose-in-a-public-garden-on-a-sunny-day.mp4,PT00H00M16S,127351_127400,A young beautiful woman in a retro dress smells a red rose in a public garden on a sunny day - closeup
6539294,https://ak.picdn.net/shutterstock/videos/6539294/preview/stock-footage-aerial-view-descending-of-landscape-and-teide-peak-canary-islands-spain.mp4,PT00H00M20S,115001_115050,"Aerial view descending of landscape and teide peak, canary islands, spain
"
27183712,https://ak.picdn.net/shutterstock/videos/27183712/preview/stock-footage-cup-of-coffee-or-tea-on-rainy-or-frozen-window-background.mp4,PT00H00M32S,028451_028500,Cup of coffee or tea on rainy or frozen window background
20172775,https://ak.picdn.net/shutterstock/videos/20172775/preview/stock-footage-architecture-drawing-on-architectural-project-teamwork-concept-s-k.mp4,PT00H00M11S,084901_084950,"Architecture drawing on architectural project, teamwork concept. 20s. 4k."
1009470107,https://ak.picdn.net/shutterstock/videos/1009470107/preview/stock-footage-kyiv-ukraine-february-demonstration-of-clothes-on-the-catwalk-during-a-fashion-show.mp4,PT00H00M58S,030751_030800,"Kyiv, ukraine - february 5, 2017. demonstration of clothes on the catwalk during a fashion show. fashion show in action. catwalk models. catwalk during fashion show. model on the catwalk. models. "
1190908,https://ak.picdn.net/shutterstock/videos/1190908/preview/stock-footage-color-box-disco-fashion.mp4,PT00H00M24S,178451_178500,Color box disco fashion
1015347610,https://ak.picdn.net/shutterstock/videos/1015347610/preview/stock-footage-san-francisco-united-states-september-high-angle-of-the-san-francisco-carousel-at-pier.mp4,PT00H00M14S,170101_170150,"San francisco, united states - september, 2017: high angle of the san francisco carousel at pier 39"
3295373,https://ak.picdn.net/shutterstock/videos/3295373/preview/stock-footage-potters-wheel.mp4,PT00H00M10S,011901_011950,Potters wheel
1052260477,https://ak.picdn.net/shutterstock/videos/1052260477/preview/stock-footage-taos-new-mexico-usa-aerial-over-countryside-farms-and-country-road-on-the-outskirts-of-taos.mp4,PT00H00M05S,010101_010150,"Taos, new mexico, usa. aerial over countryside, farms and country road on the outskirts of taos. "
1007240017,https://ak.picdn.net/shutterstock/videos/1007240017/preview/stock-footage-driving-on-a-winter-country-road-in-a-snow-storm-back-view.mp4,PT00H00M59S,114951_115000,Driving on a winter country road in a snow storm. back view
1042671142,https://ak.picdn.net/shutterstock/videos/1042671142/preview/stock-footage-nature-mountains-and-beautiful-skies.mp4,PT00H00M31S,175601_175650,"Nature, mountains and beautiful skies"
1009389992,https://ak.picdn.net/shutterstock/videos/1009389992/preview/stock-footage-kazan-tatarstan-russia-march-closeup-stylish-girl-in-jeans-has-fun-and-tries-on-bright.mp4,PT00H00M13S,195451_195500,"Kazan, tatarstan/russia - march 06 2017: closeup stylish girl in jeans has fun and tries on bright orange children skirt and colorful t-shirt on march 06 in kazan"
1029919046,https://ak.picdn.net/shutterstock/videos/1029919046/preview/stock-footage-dolly-shot-of-client-looking-at-the-pictures-the-photographer-is-taking-on-the-set-tethering.mp4,PT00H00M12S,088151_088200,Dolly shot of client looking at the pictures the photographer is taking on the set tethering
1054133885,https://ak.picdn.net/shutterstock/videos/1054133885/preview/stock-footage-ukraine-kiev-june-a-large-boat-walks-on-the-lake-k-video-from-a-drone.mp4,PT00H00M12S,107301_107350,"Ukraine, kiev, june 10, 2020, a large boat walks on the lake, 4k video from a drone."
12289091,https://ak.picdn.net/shutterstock/videos/12289091/preview/stock-footage-businessman-touching-idea-light-bulb-creative-communication-technology-concept.mp4,PT00H00M08S,019551_019600,"Businessman touching idea light bulb,creative communication technology concept"
29650225,https://ak.picdn.net/shutterstock/videos/29650225/preview/stock-footage-silhouette-of-wheat-at-sunset.mp4,PT00H00M12S,190751_190800,Silhouette of wheat at sunset
30253903,https://ak.picdn.net/shutterstock/videos/30253903/preview/stock-footage-abstract-background-with-neuron-network-seamless-loop.mp4,PT00H00M10S,193051_193100,Abstract background with neuron network. seamless loop
1010882348,https://ak.picdn.net/shutterstock/videos/1010882348/preview/stock-footage-tiny-little-planet-degree-a-lake-and-flooded-land-in-the-spring-landscape-panorama.mp4,PT00H00M22S,197001_197050,"Tiny little planet 360 degree - a lake and flooded land in the spring. landscape panorama.
"
35043451,https://ak.picdn.net/shutterstock/videos/35043451/preview/stock-footage-mexican-aster-plant-in-natural-environment-close-up-pink-autumn-flower-cosmos-bipinnatus-in-the.mp4,PT00H00M16S,060951_061000,Mexican aster plant in natural environment close-up pink autumn flower cosmos bipinnatus in the garden on sunset
14652079,https://ak.picdn.net/shutterstock/videos/14652079/preview/stock-footage-orange-plastic-forks-twisted-on-a-white-lacy-napkin-kitchen-cutlery.mp4,PT00H00M10S,148651_148700,Orange plastic forks twisted on a white lacy napkin kitchen cutlery
30056047,https://ak.picdn.net/shutterstock/videos/30056047/preview/stock-footage-young-girl-drinking-coffee-in-a-cafe.mp4,PT00H00M23S,176251_176300,Young girl drinking coffee in a cafe
1044063376,https://ak.picdn.net/shutterstock/videos/1044063376/preview/stock-footage-osaka-japan-circa-september-view-of-osaka-castle-osaka-jo-at-osaka-castle-park-one-of.mp4,PT00H00M11S,026601_026650,"Osaka, japan - circa september 2019 : view of osaka castle (osaka-jo) at osaka castle park. one of the most famous historical landmarks in japan."
1017607177,https://ak.picdn.net/shutterstock/videos/1017607177/preview/stock-footage-drivelapse-from-side-of-fast-car-moving-on-a-night-avenue-in-city-timelapse-hyperlapse-road-with.mp4,PT00H00M05S,054601_054650,"Drivelapse from side of fast car moving on a night avenue in city timelapse hyperlapse, road with lights reflected on car on high speed. rapid rhythm of a modern city."
21337489,https://ak.picdn.net/shutterstock/videos/21337489/preview/stock-footage-note-flowing-clover-pattern-dark-background.mp4,PT00H00M20S,057301_057350,Note flowing clover 2 pattern dark background
1037185379,https://ak.picdn.net/shutterstock/videos/1037185379/preview/stock-footage-beautiful-young-dapple-gray-horse-is-looking-from-the-fence-or-the-stable-farm-feeding-the.mp4,PT00H00M12S,086001_086050,Beautiful young dapple gray horse is looking from the fence or the stable. farm feeding. the concept of human-nature relations. animal care. holsteiner horse.	
5494184,https://ak.picdn.net/shutterstock/videos/5494184/preview/stock-footage-waikiki-hawaii-circa-january-waikiki-beach-in-honolulu-hawaii.mp4,PT00H00M18S,187601_187650,"Waikiki, hawaii - circa, january 2014: waikiki beach in honolulu hawaii"
30246130,https://ak.picdn.net/shutterstock/videos/30246130/preview/stock-footage-cycling-on-the-road.mp4,PT00H00M14S,027351_027400,Cycling on the road
21863329,https://ak.picdn.net/shutterstock/videos/21863329/preview/stock-footage-marina-bay-singapore-november-time-lapse-of-marina-bay-singapore-as-view-from.mp4,PT00H00M11S,194001_194050,"Marina bay, singapore - november 19, 2016: time lapse of marina bay singapore as view from singapore flyers"
1032418,https://ak.picdn.net/shutterstock/videos/1032418/preview/stock-footage-ashtray-from-underneath.mp4,PT00H00M11S,105651_105700,Ashtray from underneath
595789,https://ak.picdn.net/shutterstock/videos/595789/preview/stock-footage-sight-seeing-from-a-boat-in-new-york.mp4,PT00H00M23S,132801_132850,Sight seeing from a boat in new york
1021756645,https://ak.picdn.net/shutterstock/videos/1021756645/preview/stock-footage-tokyo-japan-january-st-pedestrian-crossing-the-famous-shibuya-scramble-crosswalk-in-a.mp4,PT00H00M18S,060851_060900,"Tokyo, japan - january 1st, 2019. pedestrian crossing the famous  shibuya scramble crosswalk in a early winter morning. selective focus."
1030195766,https://ak.picdn.net/shutterstock/videos/1030195766/preview/stock-footage-young-woman-working-at-laptop-in-office-sitting-in-front-of-fan.mp4,PT00H00M15S,083151_083200,Young woman working at laptop in office sitting in front of fan
32080882,https://ak.picdn.net/shutterstock/videos/32080882/preview/stock-footage-point-of-view-shot-running-through-mountain-forest.mp4,PT00H00M15S,050551_050600,Point of view shot running through mountain forest
32743894,https://ak.picdn.net/shutterstock/videos/32743894/preview/stock-footage-tall-trees-in-woodland-forest-with-strong-vertical-lines-and-sunlight.mp4,PT00H00M21S,134701_134750,Tall trees in woodland forest with strong vertical lines and sunlight
1022709313,https://ak.picdn.net/shutterstock/videos/1022709313/preview/stock-footage-woman-cuddling-a-beautiful-cat-on-her-lap-pets-and-lifestyle-concept.mp4,PT00H00M18S,088201_088250,"Woman cuddling a beautiful cat on her lap, pets and lifestyle concept"
30478834,https://ak.picdn.net/shutterstock/videos/30478834/preview/stock-footage-positive-farmer-person-holding-organic-cucumber-pile-show-ok-sign-ecology-garden.mp4,PT00H00M09S,104251_104300,Positive farmer person holding organic cucumber pile show ok sign ecology garden
20051404,https://ak.picdn.net/shutterstock/videos/20051404/preview/stock-footage-beautiful-female-posing-in-bed-slow-motion.mp4,PT00H00M11S,004901_004950,Beautiful female posing in bed slow motion
1052059744,https://ak.picdn.net/shutterstock/videos/1052059744/preview/stock-footage-construction-site-with-cranes-and-the-workers-working-with-metal.mp4,PT00H00M18S,124451_124500,Construction site with cranes and the workers working with metal
24411500,https://ak.picdn.net/shutterstock/videos/24411500/preview/stock-footage-unrecognizable-man-and-woman-working-on-a-project-at-the-table.mp4,PT00H00M06S,041301_041350,Unrecognizable man and woman working on a project at the table  
1053183182,https://ak.picdn.net/shutterstock/videos/1053183182/preview/stock-footage-high-angle-top-view-of-vehicles-driving-on-city-road.mp4,PT00H00M23S,069051_069100,High angle top view of vehicles driving on city road
1043378404,https://ak.picdn.net/shutterstock/videos/1043378404/preview/stock-footage-the-illuminator-s-hand-sets-up-the-mixing-light-console-and-prescribes-programs-in-multi-colored.mp4,PT00H00M07S,177801_177850,The illuminator's hand sets up the mixing light console and prescribes programs in multi-colored lighting
33525655,https://ak.picdn.net/shutterstock/videos/33525655/preview/stock-footage-samara-russia-november-the-girl-is-reading-a-book-of-fairy-tales-near-christmas-tree.mp4,PT00H00M37S,192301_192350,"Samara, russia - november  16,2017 ; the girl is reading a book of fairy tales near christmas tree."
1031503484,https://ak.picdn.net/shutterstock/videos/1031503484/preview/stock-footage-kanazawa-ishikawa-japan-october-stone-lantern-with-pines-in-kenroku-en-garden-one.mp4,PT00H00M39S,187201_187250,"Kanazawa, ishikawa / japan - october 25, 2018:
stone lantern with pines in kenroku-en garden (one of the three japanese great gardens)."
1024835471,https://ak.picdn.net/shutterstock/videos/1024835471/preview/stock-footage-salt-flat-springs-of-extremely-cold-salt-water-uyuni-potosi-bolivia.mp4,PT00H00M20S,062801_062850,"Salt flat springs of extremely cold salt water. uyuni, potosi, bolivia"
20205574,https://ak.picdn.net/shutterstock/videos/20205574/preview/stock-footage-a-mud-volcano-in-the-natural-reserve-of-salse-of-nirano-emilia-romagna-italy-the-volcanoes-are.mp4,PT00H00M09S,007901_007950,"A mud volcano in the natural reserve of salse of nirano, emilia romagna, italy.   the volcanoes are the product of mainly gaseous and partly liquid hydrocarbons."
1025869793,https://ak.picdn.net/shutterstock/videos/1025869793/preview/stock-footage-organ-or-brain-sits-in-a-translucent-wet-package-odd-blue-glowing-container.mp4,PT00H00M11S,006901_006950,"Organ or brain sits in a translucent wet package, odd blue, glowing container"
32834422,https://ak.picdn.net/shutterstock/videos/32834422/preview/stock-footage-reliable-partner-animated-word-cloud-text-design-animation.mp4,PT00H00M15S,199301_199350,"Reliable partner animated word cloud, text design animation."
1025944829,https://ak.picdn.net/shutterstock/videos/1025944829/preview/stock-footage-german-shepherd-trots-into-close-up-against-beach-backdrop.mp4,PT00H00M08S,190651_190700,German shepherd trots into close up against beach backdrop
16728712,https://ak.picdn.net/shutterstock/videos/16728712/preview/stock-footage-rome-italy-aprile-rome-italy-flower-market-on-the-old-town-square.mp4,PT00H00M07S,128301_128350,"Rome, italy - aprile 28, 2016: rome, italy. flower market on the old town square"
19578793,https://ak.picdn.net/shutterstock/videos/19578793/preview/stock-footage-multicoloured-footage-gallery.mp4,PT00H00M06S,001301_001350,Multicoloured footage-  gallery
23831221,https://ak.picdn.net/shutterstock/videos/23831221/preview/stock-footage-bucharest-romania-february-more-than-romanians-demonstrated-sunday-in-the.mp4,PT00H00M20S,095601_095650,"Bucharest, romania - february 5, 2017: more than 250,000 romanians demonstrated sunday in the biggest anti-corruption protest since 1989."
1038800021,https://ak.picdn.net/shutterstock/videos/1038800021/preview/stock-footage-aerial-view-of-blooming-rhododendrons-among-firs-and-pastures-from-which-snow-has-just-melted.mp4,PT00H00M35S,008851_008900,"Aerial view of blooming rhododendrons among firs and pastures from which snow has just melted. spring in nepal, near ghorepani and poon hill."
1035135647,https://ak.picdn.net/shutterstock/videos/1035135647/preview/stock-footage-beautiful-of-asian-women-are-buying-online-with-a-credit-card-and-smile-woman-are-using-laptop-and.mp4,PT00H00M11S,057751_057800,"Beautiful of asian women are buying online with a credit card and smile. woman are using laptop and doing online transactions, past the internet"
24127156,https://ak.picdn.net/shutterstock/videos/24127156/preview/stock-footage-black-businessman-with-phone-smiling-happy-guy-on-street-background-flirting-tips-for-guys.mp4,PT00H00M14S,062101_062150,Black businessman with phone smiling. happy guy on street background. flirting tips for guys.
5599979,https://ak.picdn.net/shutterstock/videos/5599979/preview/stock-footage-timelapse-night-to-day-new-uork-city-building.mp4,PT00H00M38S,184801_184850,"Timelapse, night to day new uork city building"
1012160264,https://ak.picdn.net/shutterstock/videos/1012160264/preview/stock-footage-caucasian-male-lying-on-the-grass-with-his-cute-funny-months-old-beagle-puppy-in-summer-k-uhd.mp4,PT00H00M09S,061901_061950,Caucasian male lying on the grass with his cute funny 3 months old beagle puppy in summer. 4k uhd 60 fps slo 
22583992,https://ak.picdn.net/shutterstock/videos/22583992/preview/stock-footage-getting-a-tattoo-close-up-toned-image.mp4,PT00H00M15S,083051_083100,"Getting a tattoo. close-up, toned image"
1058847223,https://ak.picdn.net/shutterstock/videos/1058847223/preview/stock-footage-melbourne-victoria-australia-st-kilda-sea-baths-signage.mp4,PT00H00M09S,105051_105100,"Melbourne , victoria / australia - 03 12 2012: st kilda sea baths signage"
5328200,https://ak.picdn.net/shutterstock/videos/5328200/preview/stock-footage-the-charles-bridge-crossing-the-vltava-river-in-prague-with-st-vitus-cathedral-in-the-background.mp4,PT00H00M13S,072651_072700,The charles bridge crossing the vltava river in prague with st. vitus cathedral in the background
1025035997,https://ak.picdn.net/shutterstock/videos/1025035997/preview/stock-footage-kelantan-malaysia-february-working-at-height-unidentified-abseiler-wearing-personal.mp4,PT00H00M17S,031751_031800,"Kelantan, malaysia -  february 27 2019 : working at height. unidentified abseiler wearing personal protective equipment (ppe) hanging under pipeline for power tooling activities."
1031918639,https://ak.picdn.net/shutterstock/videos/1031918639/preview/stock-footage-mwanza-flat-headed-rock-agama-maasai-mara-kenya-africa.mp4,PT00H00M19S,025451_025500,Mwanza flat-headed rock agama; maasai mara kenya africa
1038603062,https://ak.picdn.net/shutterstock/videos/1038603062/preview/stock-footage-cones-on-the-branches-of-a-large-spruce-beautiful-pine-tree-swaying-in-the-wind.mp4,PT00H00M11S,015501_015550,Cones on the branches of a large spruce. beautiful pine tree swaying in the wind.
31016461,https://ak.picdn.net/shutterstock/videos/31016461/preview/stock-footage-a-happy-baby-eating-an-orange.mp4,PT00H00M51S,129651_129700,A happy baby eating an orange
1028095196,https://ak.picdn.net/shutterstock/videos/1028095196/preview/stock-footage-cars-drive-past-a-huge-wildfire-burning-near-a-road-and-highway-as-people-evacuate-ahead-of-the.mp4,PT00H00M19S,083701_083750,Cars drive past a huge wildfire burning near a road and highway as people evacuate ahead of the flames and disaster.
15263020,https://ak.picdn.net/shutterstock/videos/15263020/preview/stock-footage--k-empty-interior-of-modern-office-bldng-focus-on-architect-engineer-workspace.mp4,PT00H00M14S,030551_030600,"4k empty interior of modern office bldng, focus on architect/engineer workspace"
20647714,https://ak.picdn.net/shutterstock/videos/20647714/preview/stock-footage-rough-legged-buzzard-beautiful-shot-of-rough-legged-buzzard-flies-in-the-sky.mp4,PT00H00M17S,123351_123400,"Rough legged buzzard
beautiful shot of rough legged buzzard flies in the sky
"
15849988,https://ak.picdn.net/shutterstock/videos/15849988/preview/stock-footage-traditional-holi-celebrations-at-vrindavan-march-busy-crowded-streets-of-vrindavan.mp4,PT00H00M20S,128401_128450,"Traditional holi celebrations at vrindavan - march 19, 2016: busy crowded streets of vrindavan during holi celebrations, march 19, 2016, vrindavan, uttar, pradesh, india."
9212183,https://ak.picdn.net/shutterstock/videos/9212183/preview/stock-footage-hands-making-a-sandwich.mp4,PT00H00M17S,022901_022950,Hands making a sandwich
