videoid,contentUrl,duration,page_dir,name
21709417,https://ak.picdn.net/shutterstock/videos/21709417/preview/stock-footage-haifa-israel-november-th-trees-catch-fire-near-gas-station-houses-and-residential-urban.mp4,PT00H00M09S,016001_016050,"Haifa, israel, november 24th, 2016: trees catch fire near gas station, houses and residential urban buildings."
1047408265,https://ak.picdn.net/shutterstock/videos/1047408265/preview/stock-footage-huge-turtle-lying-on-a-grass.mp4,PT00H00M07S,076351_076400,Huge turtle lying on a grass.
26159381,https://ak.picdn.net/shutterstock/videos/26159381/preview/stock-footage-cute-blonde-in-fashional-glasses-grimacing-on-green-background-in-studio-closeup-portrait-of-young.mp4,PT00H00M13S,093701_093750,Cute blonde in fashional glasses grimacing on green background in studio. closeup portrait of young surprised woman with red sensual lips.
1042928488,https://ak.picdn.net/shutterstock/videos/1042928488/preview/stock-footage-aerial-view-on-the-port-side-of-the-city-kusadasi-turkey-at-summer.mp4,PT00H00M10S,031801_031850,"Aerial view on the port side of the city kusadasi, turkey at summer"
1038262709,https://ak.picdn.net/shutterstock/videos/1038262709/preview/stock-footage-sweet-corn-rotation-on-white-background-healthy-food-concept.mp4,PT00H00M20S,125101_125150,"Sweet corn rotation on white background,   healthy food concept."
1051408234,https://ak.picdn.net/shutterstock/videos/1051408234/preview/stock-footage-middle-aged-caucasian-woman-sitting-on-the-floor-beside-sofa-in-living-room-working-on-laptop-and.mp4,PT00H00M28S,141701_141750,"Middle aged caucasian woman sitting on the floor beside sofa in living room, working on laptop and listening to music with wireless headphones"
11022233,https://ak.picdn.net/shutterstock/videos/11022233/preview/stock-footage-roger-icon-on-a-pixel-screen-seamless.mp4,PT00H00M06S,020051_020100,Roger icon on a pixel screen. seamless.
1015277491,https://ak.picdn.net/shutterstock/videos/1015277491/preview/stock-footage-view-from-above-in-the-frame-only-hands-and-an-object-the-process-of-washing-the-vegetables-with.mp4,PT00H00M13S,065451_065500,"View from above, in the frame only hands and an object. the process of washing the vegetables with a brush. pepper in water and women's hands. white brush and red pepper. man washes vegetables in the "
20807518,https://ak.picdn.net/shutterstock/videos/20807518/preview/stock-footage-oranges-falling-realistic-animation-isolate-green-screen.mp4,PT00H00M15S,068601_068650,Oranges falling . realistic animation.isolate green screen
1059416054,https://ak.picdn.net/shutterstock/videos/1059416054/preview/stock-footage-a-mother-and-her-year-old-daughter-practice-yoga-at-home-meditation-and-health.mp4,PT00H00M20S,054901_054950,A mother and her 5-year-old daughter practice yoga at home. meditation and health
1053037640,https://ak.picdn.net/shutterstock/videos/1053037640/preview/stock-footage-offshore-jack-up-drilling-rig-leg-during-jacking-up-general-view-of-welded-steel-lattice-leg.mp4,PT00H00M20S,112151_112200,"Offshore jack up drilling rig leg during jacking up. general view of welded steel lattice leg structure.
"
1009830560,https://ak.picdn.net/shutterstock/videos/1009830560/preview/stock-footage-close-up-of-tree-in-pink-blossom-kerkyra-town-corfu-island-greece.mp4,PT00H00M14S,094601_094650,"Close-up of tree in pink blossom, kerkyra town, corfu island, greece."
23911006,https://ak.picdn.net/shutterstock/videos/23911006/preview/stock-footage-manicure-master-filing-gel-nails.mp4,PT00H00M26S,004101_004150,Manicure master filing gel nails
4290782,https://ak.picdn.net/shutterstock/videos/4290782/preview/stock-footage-zion-driving-lm-vehicle-shot-by-slr.mp4,PT00H00M30S,177801_177850,Zion driving lm24 vehicle shot by slr
1014672608,https://ak.picdn.net/shutterstock/videos/1014672608/preview/stock-footage-two-girls-with-fireworks-in-their-hands-on-the-background-of-a-ferris-wheel-slow-motion.mp4,PT00H00M19S,183651_183700,Two girls with fireworks in their hands on the background of a ferris wheel. slow motion.
1053580838,https://ak.picdn.net/shutterstock/videos/1053580838/preview/stock-footage-ubonrachatani-thailand-may-group-of-friends-playing-in-water-at-the-river.mp4,PT00H00M15S,083451_083500,"Ubonrachatani ,thailand - may 16 ,2020:  group of friends playing in water at the river ."
1009907996,https://ak.picdn.net/shutterstock/videos/1009907996/preview/stock-footage-beautiful-sunset-over-the-ocean-sunrise-in-the-sea-busan-south-korea.mp4,PT00H00M10S,009851_009900,Beautiful sunset over the ocean. sunrise in the sea. busan south korea
1030143491,https://ak.picdn.net/shutterstock/videos/1030143491/preview/stock-footage-palm-treeed-by-the-wind-with-a-cloudy-blue-sky.mp4,PT00H00M15S,079301_079350,Palm treeed by the wind with a cloudy blue sky
32225266,https://ak.picdn.net/shutterstock/videos/32225266/preview/stock-footage-natural-meat-sausages-from-turkey-sprinkle-dry-pepper-and-frying-in-pan.mp4,PT00H00M15S,112251_112300,Natural meat sausages from turkey sprinkle dry pepper and frying in pan
1022987851,https://ak.picdn.net/shutterstock/videos/1022987851/preview/stock-footage-drone-footage-of-the-west-coast-of-nusa-penida-indonesia-near-the-yyy-temple-with-vertical-cliffs.mp4,PT00H00M13S,045901_045950,"Drone footage of the west coast of nusa penida, indonesia near the yyy temple with vertical cliffs scattered with small trees and bushes. the camera is facing the cliffs and is going backward along th"
2131667,https://ak.picdn.net/shutterstock/videos/2131667/preview/stock-footage-deir-hanna-israel-march-haneen-zoabi-also-hanin-zoubi-a-muslim-woman-elected-to-the.mp4,PT00H00M06S,198251_198300,"Deir hanna, israel - march 30: haneen zoabi, also hanin zoubi, a muslim woman elected to the israeli knesset speaks during the 36th commemoration of land day on march 30, 2012 in deir hanna, israel"
14275721,https://ak.picdn.net/shutterstock/videos/14275721/preview/stock-footage-reflection-of-trees-in-the-water.mp4,PT00H00M20S,048101_048150,Reflection of trees in the water
34739878,https://ak.picdn.net/shutterstock/videos/34739878/preview/stock-footage-happy-young-man-swimming-and-playing-with-a-black-rubber-donut-ring-in-the-river.mp4,PT00H00M12S,180351_180400,Happy young man swimming and playing with a black rubber donut ring in the river
1063358170,https://ak.picdn.net/shutterstock/videos/1063358170/preview/stock-footage-photo-realistic-d-earth-planet-earth-from-space-animation-of-earth-seen-from-space-the-globe.mp4,PT00H00M12S,037201_037250,"Photo realistic 3d earth. planet earth from space. animation of earth seen from space, the globe spinning on satellite view on space background"
8434990,https://ak.picdn.net/shutterstock/videos/8434990/preview/stock-footage-drinker-takes-the-car-keys-from-the-table-real-time.mp4,PT00H00M17S,051651_051700,"Drinker takes the car keys from the table,real time"
34703056,https://ak.picdn.net/shutterstock/videos/34703056/preview/stock-footage-pad-thai-cooking.mp4,PT00H00M16S,189351_189400,Pad thai cooking 1
1052008231,https://ak.picdn.net/shutterstock/videos/1052008231/preview/stock-footage-worker-preparing-steel-poles-and-bundle-wire-on-steel-rod-at-construction-site.mp4,PT00H00M15S,199051_199100,Worker preparing steel poles and bundle wire on steel rod at construction site.
1022922043,https://ak.picdn.net/shutterstock/videos/1022922043/preview/stock-footage-sunset-over-the-sea-small-waves-the-camera-is-very-high-aerial-photography-cyprus.mp4,PT00H00M20S,003051_003100,Sunset over the sea. small waves the camera is very high. aerial photography. cyprus
1056779567,https://ak.picdn.net/shutterstock/videos/1056779567/preview/stock-footage-blond-haired-girl-dressed-in-a-jean-jacked-caressed-her-cavalier-dog-during-the-walking-in-the-park.mp4,PT00H00M08S,075251_075300,Blond haired girl dressed in a jean jacked caressed her cavalier dog during the walking in the park at sunset
8993233,https://ak.picdn.net/shutterstock/videos/8993233/preview/stock-footage-unhappy-couple-argues-black-man-and-asian-woman-urban-street-with-cars-city.mp4,PT00H00M19S,189201_189250,Unhappy couple argues - black man and asian woman - urban street with cars - city
31114765,https://ak.picdn.net/shutterstock/videos/31114765/preview/stock-footage-flight-in-mountains-near-gewont-peak.mp4,PT00H00M18S,052901_052950,Flight in mountains near gewont peak
1019570200,https://ak.picdn.net/shutterstock/videos/1019570200/preview/stock-footage-beautiful-aerial-video-wonderful-abandoned-constructions-of-ancient-lemonareum-with-the-green-ivy.mp4,PT00H00M11S,093301_093350,Beautiful aerial video: wonderful abandoned constructions of ancient lemonareum with the green ivy plants on them. the hanging gardens concept. 
6875476,https://ak.picdn.net/shutterstock/videos/6875476/preview/stock-footage-aerial-flight-in-sunset-over-meadow.mp4,PT00H00M15S,079301_079350,Aerial flight in sunset over meadow 3
18752525,https://ak.picdn.net/shutterstock/videos/18752525/preview/stock-footage-celebratory-animated-background-of-flag-of-uganda-appear-from-fireworks.mp4,PT00H00M15S,082201_082250,"Celebratory animated background of flag of uganda appear from fireworks
"
1049099299,https://ak.picdn.net/shutterstock/videos/1049099299/preview/stock-footage-aerial-of-flying-over-the-volcano-chinyero-into-a-nice-landscape-tenerife-canary-island-spain.mp4,PT00H00M59S,191451_191500,"Aerial of flying over the volcano chinyero into a nice landscape tenerife, canary island, spain"
21165484,https://ak.picdn.net/shutterstock/videos/21165484/preview/stock-footage-mother-hold-son-on-hand-cuddle-him-and-they-smile-in-park-on-sunny-day.mp4,PT00H00M08S,128151_128200,"Mother hold son on hand, cuddle him and they smile in park on sunny day."
1013382197,https://ak.picdn.net/shutterstock/videos/1013382197/preview/stock-footage-young-african-girl-and-young-scandinavian-man-using-laptop-together.mp4,PT00H00M10S,172151_172200,Young african girl and young scandinavian man using laptop together
3529871,https://ak.picdn.net/shutterstock/videos/3529871/preview/stock-footage-grass-with-drops-of-water-in-the-sun.mp4,PT00H00M10S,021801_021850,Grass with drops of water in the sun
32147587,https://ak.picdn.net/shutterstock/videos/32147587/preview/stock-footage--k-seamless-loopable-flag-of-bulgaria.mp4,PT00H00M16S,193451_193500,4k seamless loopable flag of bulgaria
1018916857,https://ak.picdn.net/shutterstock/videos/1018916857/preview/stock-footage-sunrise-sunset-of-sun-through-straw-over-beautiful-sea-water-slow-motion.mp4,PT00H00M11S,092051_092100,"Sunrise sunset of sun through straw over beautiful sea water, slow motion"
1040208488,https://ak.picdn.net/shutterstock/videos/1040208488/preview/stock-footage-fhd-sport-man-running-at-new-asphalt-road-outdoor-sunrise-or-sunset-in-rural-city-park-green-tree.mp4,PT00H00M15S,146951_147000,Fhd sport man running at new asphalt road outdoor. sunrise or sunset in rural city park. green tree forest and sun rays on horizon.
1038486629,https://ak.picdn.net/shutterstock/videos/1038486629/preview/stock-footage-wheat-field-ears-of-wheat-harvest-field-of-golden-wheat-swaying-in-slow-motion-nature-landscape.mp4,PT00H00M17S,174551_174600,Wheat field. ears of wheat. harvest. field of golden wheat swaying in slow motion. nature landscape. 
30154003,https://ak.picdn.net/shutterstock/videos/30154003/preview/stock-footage-delicious-food-ready-for-eat.mp4,PT00H00M06S,115101_115150,Delicious food ready for eat
30367960,https://ak.picdn.net/shutterstock/videos/30367960/preview/stock-footage-sunflowers-field-unripe-agriculture-cultivated-farm-countryside-vegetables.mp4,PT00H00M18S,013901_013950,Sunflowers field unripe agriculture cultivated farm countryside vegetables
24477122,https://ak.picdn.net/shutterstock/videos/24477122/preview/stock-footage-wroclaw-poland-feb-people-shopping-walking-in-a-hall-of-big-store-with-household.mp4,PT00H00M09S,141401_141450,"Wroclaw, poland - feb 21, 2017: people shopping walking in a hall of big store with household products"
1141705,https://ak.picdn.net/shutterstock/videos/1141705/preview/stock-footage-panoramic-in-the-trees.mp4,PT00H00M11S,015951_016000,Panoramic in the trees.
1009589384,https://ak.picdn.net/shutterstock/videos/1009589384/preview/stock-footage-blue-abstract-background-kaleidoscope-light-x.mp4,PT00H00M17S,125651_125700,"Blue abstract background, kaleidoscope light, 1920x1080"
22354450,https://ak.picdn.net/shutterstock/videos/22354450/preview/stock-footage-pov-point-of-view-driving-through-rocky-mountain-national-park-in-the-winter.mp4,PT00H00M29S,090451_090500,Pov point of view - driving through rocky mountain national park in the winter.
32837338,https://ak.picdn.net/shutterstock/videos/32837338/preview/stock-footage-moscow-sep-selfie-of-man-with-model-release-in-crowd-of-people-walking-on-start-of.mp4,PT00H00M05S,129051_129100,"Moscow - sep, 25, 2016: selfie of man (with model release) in crowd of people walking on start of moscow marathon. today moscow marathon is event of global scale."
1005600853,https://ak.picdn.net/shutterstock/videos/1005600853/preview/stock-footage-loop-d-animation-of-glow-particles-form-d-red-heart-with-depth-of-field-and-bokeh-use-for.mp4,PT00H00M10S,090251_090300,Loop 3d animation of glow particles form 3d red heart with depth of field and bokeh. use for valentines day or wedding background as seamless background with space for text and light rays. v14
1044187441,https://ak.picdn.net/shutterstock/videos/1044187441/preview/stock-footage-footage-of-muslim-couple-crossing-the-road-at-budapest-citytown-in-a-day.mp4,PT00H00M09S,085901_085950,Footage of muslim couple crossing the road at budapest citytown in a day
1010103602,https://ak.picdn.net/shutterstock/videos/1010103602/preview/stock-footage-eurasian-hoopoe-upupa-epops-nesting.mp4,PT00H00M08S,116901_116950,Eurasian hoopoe (upupa epops) nesting
11691719,https://ak.picdn.net/shutterstock/videos/11691719/preview/stock-footage-dental-tool-equipment-in-stomatology-clinic.mp4,PT00H00M10S,144351_144400,Dental tool equipment in stomatology clinic
26759392,https://ak.picdn.net/shutterstock/videos/26759392/preview/stock-footage-vivid-brushstrokes.mp4,PT00H00M20S,189151_189200,Vivid brushstrokes
34697389,https://ak.picdn.net/shutterstock/videos/34697389/preview/stock-footage-sunset-is-time-lapse.mp4,PT00H00M10S,062001_062050,Sunset is time lapse
4863185,https://ak.picdn.net/shutterstock/videos/4863185/preview/stock-footage-city-of-toronto-ontario-canada-at-night-shot-starts-close-and-zooms-out-to-reveal-skyline.mp4,PT00H00M20S,173901_173950,"City of toronto, ontario, canada, at night.  shot starts close and zooms out to reveal skyline."
24627107,https://ak.picdn.net/shutterstock/videos/24627107/preview/stock-footage-water-flows-through-a-gorge-from-kermit-s-pool-to-regan-s-pool-in-karijini-national-park.mp4,PT00H00M25S,087901_087950,"Water flows through a gorge - from kermit's pool to regan's pool - in karijini national park, western australia, australia."
1034394179,https://ak.picdn.net/shutterstock/videos/1034394179/preview/stock-footage-wild-flowers-silene-dioica-close-to.mp4,PT00H00M09S,183351_183400,Wild flowers silene dioica close to
1018558093,https://ak.picdn.net/shutterstock/videos/1018558093/preview/stock-footage-paris-france-circa-heno-de-pravia-deodorant-bottle-produced-by-perfumeria-gal-vintage.mp4,PT00H00M09S,082001_082050,"Paris, france - circa 2018: heno de pravia deodorant bottle produced by perfumeria gal - vintage vhs effect over the rotation of the object"
30892714,https://ak.picdn.net/shutterstock/videos/30892714/preview/stock-footage-sea-view-in-tree.mp4,PT00H00M12S,031151_031200,Sea view in tree.
1047496291,https://ak.picdn.net/shutterstock/videos/1047496291/preview/stock-footage-saint-petersburg-russia-february-old-posters-of-video-games.mp4,PT00H00M07S,199851_199900,"Saint-petersburg, russia - february 29, 2020: old posters of video games."
3020092,https://ak.picdn.net/shutterstock/videos/3020092/preview/stock-footage-glass-artists-work-on-vase-together-one-rolls-piece-on-blowpipe-across-workbench-while-the-other.mp4,PT00H00M10S,120601_120650,"Glass artists work on vase together.  one rolls piece on blowpipe across workbench while the other blows air into puffer to shape mouth.
"
22179892,https://ak.picdn.net/shutterstock/videos/22179892/preview/stock-footage-white-lock-icon-form-white-binary-tunnel-on-black-background-computer-security-concept-seamless.mp4,PT00H00M13S,006051_006100,White lock icon form white binary tunnel on black background. computer security concept. seamless loop. more icons and color options available in my portfolio.
1042873696,https://ak.picdn.net/shutterstock/videos/1042873696/preview/stock-footage-spacious-sandy-empty-beach-and-sea-with-waves-on-beautiful-sunny-day-aerial-drone-footage.mp4,PT00H00M14S,101701_101750,Spacious sandy empty beach and sea with waves on beautiful sunny day - aerial drone footage
1007880769,https://ak.picdn.net/shutterstock/videos/1007880769/preview/stock-footage-time-lapse-of-flowers-is-blooming-in-the-morning.mp4,PT00H00M23S,134701_134750,Time lapse of flowers is blooming in the morning.
1007998447,https://ak.picdn.net/shutterstock/videos/1007998447/preview/stock-footage-shot-of-lonely-woman-walking-in-autumn-forest-recreation-and-healthy-lifestyle-in-nature.mp4,PT00H00M19S,070451_070500,"Shot of lonely woman walking in autumn forest.recreation and healthy lifestyle in nature
"
7792192,https://ak.picdn.net/shutterstock/videos/7792192/preview/stock-footage-thai-dessert-roti-saimai-made-by-hand.mp4,PT00H00M18S,141401_141450,"Thai dessert, roti saimai, made by hand"
26195096,https://ak.picdn.net/shutterstock/videos/26195096/preview/stock-footage-drug-doctor-working-on-holographic-interface-motion-graphics.mp4,PT00H00M14S,188601_188650,"Drug, doctor working on holographic interface, motion graphics"
24329666,https://ak.picdn.net/shutterstock/videos/24329666/preview/stock-footage-ostracods-or-ostracodes-are-a-class-of-the-crustacea-class-ostracoda-sometimes-known-as-seed.mp4,PT00H00M24S,196551_196600,"Ostracods, or ostracodes, are a class of the crustacea (class ostracoda), sometimes known as seed shrimp"
1021152118,https://ak.picdn.net/shutterstock/videos/1021152118/preview/stock-footage-autobahn-hyperlapse-on-sunset.mp4,PT00H00M09S,095401_095450,Autobahn hyperlapse on sunset
1023644353,https://ak.picdn.net/shutterstock/videos/1023644353/preview/stock-footage-hud-interface-technology-concept-motion-blue-background.mp4,PT00H00M16S,003601_003650,"Hud interface,technology concept motion blue background"
8522659,https://ak.picdn.net/shutterstock/videos/8522659/preview/stock-footage-man-draws-with-a-pencil.mp4,PT00H00M48S,115901_115950,Man draws with a pencil
1008678247,https://ak.picdn.net/shutterstock/videos/1008678247/preview/stock-footage-seamless-looping-animation-of-wind-turbines-spinning.mp4,PT00H00M18S,123351_123400,Seamless looping animation of wind turbines spinning
23004481,https://ak.picdn.net/shutterstock/videos/23004481/preview/stock-footage-black-tea-in-the-cup-holder-of-gold-in-a-dark-room.mp4,PT00H00M16S,130901_130950,Black tea in the cup holder of gold in a dark room
1011517790,https://ak.picdn.net/shutterstock/videos/1011517790/preview/stock-footage-close-up-of-a-child-s-human-eye-the-girl-looks-closely-at-the-tv-screen-while-watching-the-video.mp4,PT00H00M07S,011251_011300,"Close-up of a child's human eye. the girl looks closely at the tv screen while watching the video. 4k, slow motion"
4118992,https://ak.picdn.net/shutterstock/videos/4118992/preview/stock-footage-smoke.mp4,PT00H00M33S,192151_192200,Smoke
22151716,https://ak.picdn.net/shutterstock/videos/22151716/preview/stock-footage-old-woman-s-face-with-tired-expression-of-face-close-up.mp4,PT00H00M13S,012701_012750,Old woman's face with tired expression of face. close up
1016140471,https://ak.picdn.net/shutterstock/videos/1016140471/preview/stock-footage-sassetta-livorno-tuscany-italy-june-veranda-in-the-summer-cafe-with-beautiful-view-on.mp4,PT00H00M06S,134951_135000,"Sassetta, livorno, tuscany, italy - 25 june 2018. veranda in the summer cafe with beautiful view on the valley and mountains"
1017445891,https://ak.picdn.net/shutterstock/videos/1017445891/preview/stock-footage-north-district-israel-september-aerial-footage-of-a-large-john-deere-six-row-baler.mp4,PT00H00M29S,143251_143300,"North district, israel - september 22, 2018: aerial footage of a large john deere six row baler cotton picker working in a field."
1051349974,https://ak.picdn.net/shutterstock/videos/1051349974/preview/stock-footage-hand-sprinkling-oregano-or-herb-into-garlic-butter-bread-in-slow-motion.mp4,PT00H00M17S,174651_174700,Hand sprinkling oregano or herb into garlic butter bread in slow motion
1024958735,https://ak.picdn.net/shutterstock/videos/1024958735/preview/stock-footage-beech-in-lakeside.mp4,PT00H00M20S,035151_035200,Beech in lakeside
1011852878,https://ak.picdn.net/shutterstock/videos/1011852878/preview/stock-footage-detail-of-assault-rifle-weapon-held-by-a-swat-team-officer.mp4,PT00H00M12S,013101_013150,Detail of assault rifle weapon held by a swat team officer.
1049432596,https://ak.picdn.net/shutterstock/videos/1049432596/preview/stock-footage-caduceus-sign-with-snakes-on-a-medical-star-d-map-of-argentina-map-of-argentina-land-border-with.mp4,PT00H00M10S,199651_199700,Caduceus sign with snakes on a medical star. 3d map of argentina. map of argentina land border with flag. 3d rendering
14703427,https://ak.picdn.net/shutterstock/videos/14703427/preview/stock-footage-woman-admire-view-while-standing-on-bridge-super-slow-motion-fps.mp4,PT00H00M28S,198251_198300,"Woman admire view while standing on bridge, super slow motion 240fps
"
32450491,https://ak.picdn.net/shutterstock/videos/32450491/preview/stock-footage-clear-sea-wave-cliff-k.mp4,PT00H00M24S,073851_073900,Clear sea wave cliff 4k
20046982,https://ak.picdn.net/shutterstock/videos/20046982/preview/stock-footage-animation-on-green-screen.mp4,PT00H00M09S,188551_188600,Animation on green screen 
1061796655,https://ak.picdn.net/shutterstock/videos/1061796655/preview/stock-footage-donate-great-for-your-charity-drive-to-help-raise-funds-for-those-in-need-charity-charity-day.mp4,PT00H00M06S,081151_081200,Donate. great for your charity drive to help raise funds for those in need. charity. charity day. donate animation. donate please
1019322115,https://ak.picdn.net/shutterstock/videos/1019322115/preview/stock-footage-old-fashioned-television-antenna-on-house.mp4,PT00H00M36S,087901_087950,Old fashioned television antenna on house
1018709074,https://ak.picdn.net/shutterstock/videos/1018709074/preview/stock-footage-yellow-tent-sunrise-selective-focus.mp4,PT00H00M11S,098101_098150,Yellow tent sunrise.selective focus.
1052673035,https://ak.picdn.net/shutterstock/videos/1052673035/preview/stock-footage-aerial-view-of-schwaebisch-hall-close-to-the-stiftskirche-church-in-germany.mp4,PT00H00M20S,045001_045050,Aerial view of schwaebisch hall close to the stiftskirche church in germany
1032733820,https://ak.picdn.net/shutterstock/videos/1032733820/preview/stock-footage-waterproofing-the-bathroom-with-insulation-with-roller-or-trowel.mp4,PT00H00M29S,112651_112700,Waterproofing the bathroom with insulation with roller or trowel
1036871810,https://ak.picdn.net/shutterstock/videos/1036871810/preview/stock-footage-london-united-kingdom-circa-low-angle-over-red-buses-and-pedestrians-crossing-street.mp4,PT00H00M05S,054751_054800,"London, united kingdom - circa 2019: low angle over red buses and pedestrians crossing street people crossing street oxford circus interchange between bakerloo central victoria time lapse"
9616097,https://ak.picdn.net/shutterstock/videos/9616097/preview/stock-footage-muslim-business-woman-working-with-laptop-taking-note-and-smiling-at-camera-in-office.mp4,PT00H00M26S,065801_065850,"Muslim business woman working with laptop, taking note and smiling at camera in office"
1014650504,https://ak.picdn.net/shutterstock/videos/1014650504/preview/stock-footage-orlando-united-states-may-springing-fountain-in-lake-eola-orlando-florida-usa.mp4,PT00H00M13S,094551_094600,"Orlando, united states - may, 2017: springing fountain in lake eola, orlando, florida, usa."
21724144,https://ak.picdn.net/shutterstock/videos/21724144/preview/stock-footage-new-year-christmas-tree-fancy-a-christmas-tree-with-toys-lights-gifts-large-medium-shot.mp4,PT00H00M09S,119001_119050,"New year. christmas. tree. fancy a christmas tree with toys,  lights,  gifts. large,  medium shot,  camera movement.
"
31463050,https://ak.picdn.net/shutterstock/videos/31463050/preview/stock-footage-fun-chef-d-animation.mp4,PT00H00M19S,016101_016150,Fun chef - 3d animation
1023095014,https://ak.picdn.net/shutterstock/videos/1023095014/preview/stock-footage-aerial-view-of-carpathian-mountains-countryside-in-autumn-morning-romania.mp4,PT00H00M36S,029101_029150,"Aerial view of carpathian mountains countryside in autumn morning, romania"
1043031535,https://ak.picdn.net/shutterstock/videos/1043031535/preview/stock-footage-the-robot-shows-emotions-artificial-intelligence-modern-robotics-the-robot-looks-and-smiles-at.mp4,PT00H00M31S,173751_173800,The robot shows emotions. artificial intelligence. modern robotics. the robot looks and smiles at people. eyes of the robot. cyborg. the robot is looking at the camera at a person. smart computer
26785411,https://ak.picdn.net/shutterstock/videos/26785411/preview/stock-footage-rear-view-mom-and-daughter-run-in-a-picturesque-place-at-sunset-active-lifestyle-and-healthy.mp4,PT00H00M21S,054901_054950,Rear view: mom and daughter run in a picturesque place at sunset. active lifestyle and healthy family. 4k slow motion video
1010341730,https://ak.picdn.net/shutterstock/videos/1010341730/preview/stock-footage-stylish-mom-with-daughter-in-autumn-park.mp4,PT00H00M13S,170001_170050,Stylish mom with daughter in autumn park
