videoid,contentUrl,duration,page_dir,name
21541972,https://ak.picdn.net/shutterstock/videos/21541972/preview/stock-footage-side-view-of-hispanic-man-with-cool-undercut-standing-with-white-background-profile-close-up.mp4,PT00H00M15S,128801_128850,Side view of hispanic man with cool undercut standing with white background. profile close up portrait of latino millennial. 4k
35037949,https://ak.picdn.net/shutterstock/videos/35037949/preview/stock-footage-port-of-rotterdam-the-netherlands-september-cargo-ships-on-the-nieuwe-maas-channel-of.mp4,PT00H00M15S,179601_179650,"Port of rotterdam, the netherlands - september 12, 2017: cargo ships on the nieuwe maas channel of the port of rotterdam, busiest cargo hub of europe"
15224956,https://ak.picdn.net/shutterstock/videos/15224956/preview/stock-footage-yerkopru-elalesi-konya.mp4,PT00H00M11S,012701_012750,"Yerkopru ?elalesi, konya"
18395878,https://ak.picdn.net/shutterstock/videos/18395878/preview/stock-footage-russia-saint-petersburg-july-festival-outdoors-laser-battle-in-park-july-in.mp4,PT00H00M12S,064251_064300,"Russia, saint petersburg, july 16, 2016: festival outdoors. laser battle in park, july 16 2016 in st petersburg russian federation"
17109694,https://ak.picdn.net/shutterstock/videos/17109694/preview/stock-footage-street-traffic-after-a-football-match-in-atlanta-atlanta-georgia-april.mp4,PT00H00M07S,143851_143900,"Street traffic after a football match in atlanta - atlanta / georgia - april 20, 2016"
8022355,https://ak.picdn.net/shutterstock/videos/8022355/preview/stock-footage-abstract-light-effects-lens.mp4,PT00H00M25S,046301_046350,Abstract light effects lens
1054194098,https://ak.picdn.net/shutterstock/videos/1054194098/preview/stock-footage-a-timelapse-of-traffic-jam-at-the-busy-town-high-angle-long-shot-ho-chi-minh-vietnam.mp4,PT00H00M15S,142951_143000,A timelapse of traffic jam at the busy town high angle long shot. ho chi minh / vietnam - 02.25.2020
24406415,https://ak.picdn.net/shutterstock/videos/24406415/preview/stock-footage-drone-video-view-of-namibian-atlantic-coastline-road-from-swakopmund-to-walvis-bay-along-the-coast.mp4,PT00H00M23S,087051_087100,"Drone video view of namibian atlantic coastline, road from swakopmund to walvis bay along the coast, surf break point and landscape of ocean background and sand dunes at namibia's west coast"
1038078326,https://ak.picdn.net/shutterstock/videos/1038078326/preview/stock-footage-woman-in-black-plays-on-cello-black-background.mp4,PT00H00M29S,133101_133150,"Woman in black plays on cello, black background"
3868583,https://ak.picdn.net/shutterstock/videos/3868583/preview/stock-footage-bucharest-romania-april-crowds-of-people-and-politicians-take-advantage-of-world-book.mp4,PT00H00M18S,131201_131250,"Bucharest, romania – april 23: crowds of people and politicians take advantage of world book night give away of more than 3000 books. april 23, 2013,  bucharest, romania
"
33351784,https://ak.picdn.net/shutterstock/videos/33351784/preview/stock-footage-crypto-currency-bitcoin-with-the-processor-of-the-computing-algorithms-on-the-motherboard.mp4,PT00H00M11S,029801_029850,"Crypto-currency bitcoin,with the processor of the computing algorithms on the motherboard"
1061378644,https://ak.picdn.net/shutterstock/videos/1061378644/preview/stock-footage-sea-wave-and-reflection-slow-motion-close-up.mp4,PT00H00M24S,007051_007100,Sea wave and reflection slow motion close up
1021153825,https://ak.picdn.net/shutterstock/videos/1021153825/preview/stock-footage-venice-italy-venice-italy.mp4,PT00H00M08S,080151_080200,Venice/italy - 19.11.2018: venice - italy
1017664951,https://ak.picdn.net/shutterstock/videos/1017664951/preview/stock-footage-kiev-ukraine-october-street-artist-paints-pictures-in-the-center-of-kiev-with-spray.mp4,PT00H00M27S,109201_109250,"Kiev, ukraine - october 01, 2018 : street artist paints pictures in the center of kiev with spray paints"
1034361293,https://ak.picdn.net/shutterstock/videos/1034361293/preview/stock-footage-day-time-kuala-lumpur-city-famous-batu-caves-traffic-road-aerial-panorama-k-malaysia.mp4,PT00H00M28S,024051_024100,Day time kuala lumpur city famous batu caves traffic road aerial panorama 4k malaysia
1016880412,https://ak.picdn.net/shutterstock/videos/1016880412/preview/stock-footage--text-in-light-big-bang-explosion-rainbow-colors-shiny-animation-loop-on-black-background-new.mp4,PT00H00M15S,125301_125350,2019 text in light big bang explosion rainbow colors shiny animation loop on black background new quality cool nice motion joyful holiday video footage loop design
1008052726,https://ak.picdn.net/shutterstock/videos/1008052726/preview/stock-footage-agaete-gran-canaria-spain-jan-puerto-de-las-nieves-beach.mp4,PT00H00M26S,062551_062600,Agaete gran canaria spain 07 jan 2018: puerto de las nieves beach
1807949,https://ak.picdn.net/shutterstock/videos/1807949/preview/stock-footage-venice-beach-circa-woman-hula-hoops-on-the-beach.mp4,PT00H00M13S,043551_043600,Venice beach - circa 2011: woman hula-hoops on the beach.
1043919091,https://ak.picdn.net/shutterstock/videos/1043919091/preview/stock-footage-visual-effect-of-atmosphere-around-a-planet-with-haze.mp4,PT00H00M10S,147051_147100,Visual effect of atmosphere around a planet with haze
1023232867,https://ak.picdn.net/shutterstock/videos/1023232867/preview/stock-footage-sanderling-wading-birds-searching-for-food-shorebird-running-walking-on-sand-during-sunset-in-santa.mp4,PT00H00M27S,003701_003750,"Sanderling wading birds searching for food shorebird running walking on sand during sunset in santa rosa beach, florida with ocean gulf of mexico waves shore"
32794093,https://ak.picdn.net/shutterstock/videos/32794093/preview/stock-footage-a-man-and-a-woman-raise-glasses-of-sparkling-champagne-toasting-and-clinking-at-a-celebration-at.mp4,PT00H00M10S,139851_139900,"A man and a woman raise glasses of sparkling champagne, toasting and clinking at a celebration at the dinner table with a toasted bird against the background of yellow electric lights."
1028218400,https://ak.picdn.net/shutterstock/videos/1028218400/preview/stock-footage-close-up-hands-man-uses-laptop-with-a-green-screen-while-sitting-at-the-kitchen-table-technology.mp4,PT00H00M16S,042551_042600,Close up hands man uses laptop with a green screen while sitting at the kitchen table technology person notebook internet apartment gadget wireless house lifestyle male touching typing slow motion
1011775529,https://ak.picdn.net/shutterstock/videos/1011775529/preview/stock-footage-grandparents-bring-two-little-boys-to-the-hospital-to-see-their-mother-and-newborn-sister.mp4,PT00H00M20S,035851_035900,Grandparents bring two little boys to the hospital to see their mother and newborn sister
1041887197,https://ak.picdn.net/shutterstock/videos/1041887197/preview/stock-footage-view-of-a-farmer-on-farmland-in-a-modern-red-tractor-with-tillage-unit-lots-of-small-birds-white.mp4,PT00H00M11S,104551_104600,"View of a farmer on farmland in a modern red tractor with tillage unit, lots of small birds, white storks and cars in the foreground. the machine operator turns the ploughshares when plowing the soil"
1029100550,https://ak.picdn.net/shutterstock/videos/1029100550/preview/stock-footage-men-on-a-water-scooter-in-sri-lanka.mp4,PT00H00M18S,006001_006050,Men on a water scooter in sri lanka
1025233913,https://ak.picdn.net/shutterstock/videos/1025233913/preview/stock-footage-digital-composite-of-security-camera-with-road-traffic-on-background.mp4,PT00H00M12S,051951_052000,Digital composite of security camera with road traffic on background
1055770418,https://ak.picdn.net/shutterstock/videos/1055770418/preview/stock-footage-climber-on-ledge-assisting-fellow-climber-scale-ice-cascade-ascending-aerial-k.mp4,PT00H00M17S,080251_080300,Climber on ledge assisting fellow climber scale ice cascade ascending aerial 4k
28837942,https://ak.picdn.net/shutterstock/videos/28837942/preview/stock-footage-washing-machine-in-laundry-industry.mp4,PT00H00M17S,190401_190450,Washing machine in laundry industry
31811716,https://ak.picdn.net/shutterstock/videos/31811716/preview/stock-footage-flight-over-forest-in-mountains.mp4,PT00H00M20S,043151_043200,Flight over forest in mountains
1008311299,https://ak.picdn.net/shutterstock/videos/1008311299/preview/stock-footage-roman-city-landscape-italy-fruit-and-nature-breathtaking-view-of-town-panorama-young-handsome.mp4,PT00H00M08S,105401_105450,"Roman city landscape,italy. fruit and nature, breathtaking view of town panorama. young handsome businessman with wistful gaze holding tablet and appetizing orange and posing in front of camera"
28909858,https://ak.picdn.net/shutterstock/videos/28909858/preview/stock-footage-school-topic-books-are-falling-into-a-pile-in-alpha-channel.mp4,PT00H00M06S,170951_171000,School topic books are falling into a pile in alpha channel
1033739852,https://ak.picdn.net/shutterstock/videos/1033739852/preview/stock-footage-slow-motion-pov-of-young-man-sitting-by-the-swimming-pool-and-kicking-his-feet-in-the-water-with.mp4,PT00H00M20S,030201_030250,Slow motion pov of young man sitting by the swimming pool and kicking his feet in the water with flip flops. water ripples and splash. relaxing.
21347146,https://ak.picdn.net/shutterstock/videos/21347146/preview/stock-footage--k-panoramic-of-dark-altocumulus-clouds-smoke-slowly-flying-in-cloudy-sun-ray-sky-timelapse-high.mp4,PT00H00M28S,000651_000700,"4k panoramic of dark altocumulus clouds smoke slowly flying in cloudy sun ray sky timelapse.high cumulus cloud,mackerel sky. gh2_08564_4k"
1013426189,https://ak.picdn.net/shutterstock/videos/1013426189/preview/stock-footage-blurred-animated-color-background.mp4,PT00H00M10S,027101_027150,Blurred animated color background.
3120433,https://ak.picdn.net/shutterstock/videos/3120433/preview/stock-footage-baby.mp4,PT00H00M07S,016351_016400,Baby
1014473789,https://ak.picdn.net/shutterstock/videos/1014473789/preview/stock-footage-rain-drops-dripping-in-a-puddle.mp4,PT00H00M26S,135951_136000,Rain drops dripping in a puddle
21464461,https://ak.picdn.net/shutterstock/videos/21464461/preview/stock-footage-havana-cuba-september-young-elderly-happy-woman-and-man-people-tourists-local-are.mp4,PT00H00M06S,060501_060550,"Havana, cuba - september 17, 2016: young elderly happy woman and man, people, tourists, local are walking along central bright sun street of havana to the capitol at summer sunny day"
1021475365,https://ak.picdn.net/shutterstock/videos/1021475365/preview/stock-footage-follow-shot-of-young-girl-in-white-dress-walking-jungle-forest-path-and-looking-around-calm-and.mp4,PT00H00M18S,061951_062000,"Follow shot of young girl in white dress walking jungle forest path and looking around. calm and carefree lifestyle travel 4k slowmotion footage. bali, indonesia."
1027029779,https://ak.picdn.net/shutterstock/videos/1027029779/preview/stock-footage-american-akita-inu-slow-motion.mp4,PT00H00M09S,027901_027950,"American akita inu, slow motion"
13513349,https://ak.picdn.net/shutterstock/videos/13513349/preview/stock-footage-tropical-rain-set-of-clips.mp4,PT00H00M30S,006301_006350,Tropical rain. set of clips
1014998638,https://ak.picdn.net/shutterstock/videos/1014998638/preview/stock-footage-malaga-spain-april-boats-floating-on-the-sea.mp4,PT00H00M14S,139601_139650,"Malaga, spain - april, 2017: boats floating on the sea"
7446460,https://ak.picdn.net/shutterstock/videos/7446460/preview/stock-footage-good-paint-drip-for-transitions-as-matte-nice-drip-to-cover-entire-screen.mp4,PT00H00M15S,103251_103300,Good paint drip for transitions as matte. nice drip to cover entire screen.
66334,https://ak.picdn.net/shutterstock/videos/66334/preview/stock-footage-police-on-scene-of-car-accident.mp4,PT00H00M11S,181051_181100,Police on scene of car accident 1
27105547,https://ak.picdn.net/shutterstock/videos/27105547/preview/stock-footage--s-ms-carr-compiled-all-of-the-superstitions-and-statements-made-individual-charts-for-each.mp4,PT00H01M29S,003451_003500,"1940s: ms. carr compiled all of the superstitions and statements, made individual charts for each student, and made a survey of how many people believed each statement."
2147810,https://ak.picdn.net/shutterstock/videos/2147810/preview/stock-footage-confident-serious-thoughtful-senior-man-listening-and-talking-isolated-on-white-background-close.mp4,PT00H01M00S,186251_186300,Confident serious thoughtful senior man listening and talking isolated on white background. close up studio portrait.
1043827324,https://ak.picdn.net/shutterstock/videos/1043827324/preview/stock-footage-sedge-carex-flower-kopacki-rit.mp4,PT00H00M10S,074401_074450,"Sedge (carex) flower, kopacki rit"
1027344374,https://ak.picdn.net/shutterstock/videos/1027344374/preview/stock-footage-drone-perspective-of-a-small-river-cutting-through-the-dense-trees-of-a-coniferous-forest.mp4,PT00H00M18S,138701_138750,Drone perspective of a small river. cutting through the dense trees of a coniferous forest wilderness in ukraine.
20618347,https://ak.picdn.net/shutterstock/videos/20618347/preview/stock-footage-curlicue-of-paints.mp4,PT00H00M20S,195751_195800,Curlicue of paints
10901186,https://ak.picdn.net/shutterstock/videos/10901186/preview/stock-footage-young-couple-on-game-drive-vehicle-on-safari-in-botswana-africa.mp4,PT00H00M09S,106401_106450,"Young couple on game drive vehicle on safari in botswana,africa"
1026623615,https://ak.picdn.net/shutterstock/videos/1026623615/preview/stock-footage-islamic-interior-mosque-window-or-door-with-beam-of-ray-light-coming-inside-ramadan-kareem.mp4,PT00H00M20S,056101_056150,Islamic interior mosque window or door with beam of ray light coming inside . ramadan kareem islamic motion background. 3d animation.
7667344,https://ak.picdn.net/shutterstock/videos/7667344/preview/stock-footage--woman-having-ayurvedic-massage-with-pouch-of-rice.mp4,PT00H00M08S,105651_105700,	woman having ayurvedic massage with pouch of rice.
1011172673,https://ak.picdn.net/shutterstock/videos/1011172673/preview/stock-footage-delicious-snack-of-whipped-puree-or-paste-with-brown-bread-piece-with-caramelized-sugar-candy.mp4,PT00H00M15S,187651_187700,"Delicious snack of whipped puree or paste with brown bread piece, with caramelized sugar candy, salad, vegetables on plate on white background. modern molecular gastronomy."
9839972,https://ak.picdn.net/shutterstock/videos/9839972/preview/stock-footage--k-k-complex-precision-industry-machines-in-operation-working-bearing-axis-lubricants-help-the.mp4,PT00H00M21S,105351_105400,"4k 4k complex precision industry machines in operation,working bearing & axis,lubricants help the machine running. gh2_10295_4k"
1042348909,https://ak.picdn.net/shutterstock/videos/1042348909/preview/stock-footage-snowfall-in-birch-and-aspen-forest-snow-falls-in-large-flakes-beautiful-snowfall-on-the.mp4,PT00H00M13S,091701_091750,Snowfall in birch and aspen forest. snow falls in large flakes. beautiful snowfall on the background of trees.
31945159,https://ak.picdn.net/shutterstock/videos/31945159/preview/stock-footage-massage-oil-in-hands-on-palms-warm-up-warm-orange-look-grade.mp4,PT00H00M06S,198301_198350,"Massage oil in hands on palms warm up, warm orange look grade"
1041344938,https://ak.picdn.net/shutterstock/videos/1041344938/preview/stock-footage-lynx-walking-on-stones-close.mp4,PT00H00M13S,038401_038450,Lynx walking on stones close
1016795614,https://ak.picdn.net/shutterstock/videos/1016795614/preview/stock-footage-three-female-coffee-shop-owners-at-their-cafe-close-up.mp4,PT00H00M07S,013001_013050,"Three female coffee shop owners at their cafe, close up"
28581214,https://ak.picdn.net/shutterstock/videos/28581214/preview/stock-footage-aporia-crataegi-black-veined-white-butterfly-in-wild-on-flower-of-jasmine.mp4,PT00H00M13S,037201_037250,"Aporia crataegi, black veined white butterfly in wild, on flower of jasmine."
1949263,https://ak.picdn.net/shutterstock/videos/1949263/preview/stock-footage-moscow-oct-timelapse-view-people-walk-on-red-square-in-night-on-festival-circle-of-light.mp4,PT00H00M13S,115701_115750,"Moscow - oct 21: (timelapse view) people walk on red square in night on festival circle of light, on oct 21, 2011 in moscow, russia"
1026210878,https://ak.picdn.net/shutterstock/videos/1026210878/preview/stock-footage-smiling-woman-with-thoughtful-expression-beautiful-middle-aged-thinking-woman-on-gray-background.mp4,PT00H00M08S,107251_107300,Smiling woman with thoughtful expression. beautiful middle-aged thinking woman on gray background. positive facial expression.
31549321,https://ak.picdn.net/shutterstock/videos/31549321/preview/stock-footage-people-in-rubber-boat-near-coast-of-arctic-ocean-on-new-earth-vaigach-island-beautiful-landscape.mp4,PT00H00M26S,138951_139000,People in rubber boat near coast of arctic ocean on new earth vaigach island. beautiful landscape of wild nature. quiet and calm ecotourism in russia. panorama of way to cold wilderness.
1285597,https://ak.picdn.net/shutterstock/videos/1285597/preview/stock-footage-close-up-of-shaking-hands.mp4,PT00H00M20S,115051_115100,Close up of shaking hands
14320684,https://ak.picdn.net/shutterstock/videos/14320684/preview/stock-footage-girl-paint-brush.mp4,PT00H00M07S,108401_108450,Girl paint brush
33460198,https://ak.picdn.net/shutterstock/videos/33460198/preview/stock-footage--s-pan-across-hills-scenery.mp4,PT00H00M19S,036551_036600,"1940s: pan across hills, scenery."
1015497460,https://ak.picdn.net/shutterstock/videos/1015497460/preview/stock-footage-smoke-from-wildfire-nature-burning.mp4,PT00H00M20S,132701_132750,Smoke  from  wildfire nature burning
24634766,https://ak.picdn.net/shutterstock/videos/24634766/preview/stock-footage-bridge-river-sky-transport-city-fly-drone-aircraft.mp4,PT00H00M17S,075801_075850,"Bridge, river, sky, transport, 
city, fly, drone, aircraft"
853723,https://ak.picdn.net/shutterstock/videos/853723/preview/stock-footage-crazy-disco-kaleidoscope-vj-loop.mp4,PT00H00M20S,194251_194300,Crazy disco kaleidoscope vj loop
17416168,https://ak.picdn.net/shutterstock/videos/17416168/preview/stock-footage-moscow-russia-june-the-annual-festival-in-kolomenskoye-reconstruction-of-ancient-rus.mp4,PT00H00M21S,193351_193400,"Moscow, russia - june 2016: the annual festival in kolomenskoye. reconstruction of ancient rus. street musicians play traditional musical instruments"
1039933331,https://ak.picdn.net/shutterstock/videos/1039933331/preview/stock-footage-happy-attractive-stylish-caucasian-modern-woman-wearing-flower-dress-black-jacket-and-red-hair.mp4,PT00H00M12S,044801_044850,"Happy attractive stylish caucasian modern woman wearing flower dress, black jacket and red hair walking through the street and writing a text message on her smartphone by night. paris 4k uhd."
1060178933,https://ak.picdn.net/shutterstock/videos/1060178933/preview/stock-footage-a-young-attractive-guy-smiles-and-shakes-his-head-in-the-affirmative-slow-motion-portrait-of-a.mp4,PT00H00M12S,003801_003850,A young attractive guy smiles and shakes his head in the affirmative. slow motion portrait of a young guy who smiles broadly says yes and nods his head in the affirmative.
1019871943,https://ak.picdn.net/shutterstock/videos/1019871943/preview/stock-footage-sunset-with-snow-covering-crops-on-farm-field-as-cold-winter-weather-arrives.mp4,PT00H00M35S,084851_084900,Sunset with snow covering crops on farm field as cold winter weather arrives
20473030,https://ak.picdn.net/shutterstock/videos/20473030/preview/stock-footage-roses-heads-on-a-vintage-background.mp4,PT00H00M08S,184001_184050,Roses heads on a vintage background
1013424578,https://ak.picdn.net/shutterstock/videos/1013424578/preview/stock-footage-citadelle-laferriere-in-milot-haiti-k.mp4,PT00H00M24S,013401_013450,"Citadelle laferriere in milot, haiti 4k"
1043923453,https://ak.picdn.net/shutterstock/videos/1043923453/preview/stock-footage-dad-hold-carrying-and-lift-up-laughing-baby-boy-while-travel-in-outdoor-nature-sunset-light.mp4,PT00H00M14S,002551_002600,Dad hold carrying and lift up laughing baby boy while travel in outdoor nature sunset light
21609733,https://ak.picdn.net/shutterstock/videos/21609733/preview/stock-footage-philadelphia-pennsylvania-woman-and-young-boy-in-a-pool.mp4,PT00H00M14S,031351_031400,Philadelphia pennsylvania 1972: woman and young boy in a pool
1025450870,https://ak.picdn.net/shutterstock/videos/1025450870/preview/stock-footage-close-up-purple-lupine-in-bloom-at-the-sunrise.mp4,PT00H00M23S,078951_079000,Close-up purple lupine in bloom at the sunrise 
10200968,https://ak.picdn.net/shutterstock/videos/10200968/preview/stock-footage-filling-tube-ice-into-glass-for-soft-drink-at-restaurant.mp4,PT00H00M10S,133951_134000,Filling tube ice into glass for soft drink at restaurant
1020248800,https://ak.picdn.net/shutterstock/videos/1020248800/preview/stock-footage-the-natural-phenomenon-of-magnetism-ferrofluidic-substances-under-the-action-of-a-neodymium-magnet.mp4,PT00H00M19S,015451_015500,The natural phenomenon of magnetism ferrofluidic substances under the action of a neodymium magnet can create really impressive visual effects if examined under appropriate conditions.
18100933,https://ak.picdn.net/shutterstock/videos/18100933/preview/stock-footage-beautiful-baby-crawling-on-the-bed-the-child-makes-his-first-move-girl-learns-to-crawl-happy.mp4,PT00H00M08S,037051_037100,Beautiful baby crawling on the bed. the child makes his first move. girl learns to crawl. happy child at home. girl with beautiful rim on the head.
1011867620,https://ak.picdn.net/shutterstock/videos/1011867620/preview/stock-footage-tick-crawling-on-human-skin.mp4,PT00H00M05S,190901_190950,Tick crawling on human skin
21857899,https://ak.picdn.net/shutterstock/videos/21857899/preview/stock-footage-stop-the-stress-signs-anxiety-reduce-lower-d-animation.mp4,PT00H00M10S,021751_021800,Stop the stress signs anxiety reduce lower 3d animation
2578856,https://ak.picdn.net/shutterstock/videos/2578856/preview/stock-footage-shanghai-china-circa-may-circular-pedestrian-walkway-above-a-traffic-roundabout.mp4,PT00H00M16S,187901_187950,"Shanghai, china - circa may 2011: circular pedestrian walkway above a traffic roundabout"
1023287083,https://ak.picdn.net/shutterstock/videos/1023287083/preview/stock-footage-business-lady-texting-message-while-walking-on-white-background.mp4,PT00H00M10S,027051_027100,Business lady texting message while walking on white background.
1056011945,https://ak.picdn.net/shutterstock/videos/1056011945/preview/stock-footage-farm-near-beach-and-mountain.mp4,PT00H00M18S,093251_093300,Farm near beach and mountain 
5693321,https://ak.picdn.net/shutterstock/videos/5693321/preview/stock-footage-pretty-girl-sitting-on-floor-using-touchpad-looking-at-camera-and-smiling-panning-camera.mp4,PT00H00M23S,024101_024150,Pretty girl sitting on floor using touchpad looking at camera and smiling. panning camera
1042531288,https://ak.picdn.net/shutterstock/videos/1042531288/preview/stock-footage-frying-sunny-side-up-eggs-in-skillet-on-hot-oil-in-kitchen-making-breakfast-close-up.mp4,PT00H00M13S,192751_192800,Frying sunny-side up eggs in skillet on hot oil in kitchen. making breakfast close up
1042964386,https://ak.picdn.net/shutterstock/videos/1042964386/preview/stock-footage-rockaway-beach-new-york-usa-meeting-friends-for-a-lively-conversation-about-drinks-and-food.mp4,PT00H00M05S,033901_033950,Rockaway beach new york usa-1967: meeting friends for a lively conversation about drinks and food in the living room
1024390196,https://ak.picdn.net/shutterstock/videos/1024390196/preview/stock-footage-rat-on-grass-field.mp4,PT00H00M26S,024851_024900,Rat on grass field
33914341,https://ak.picdn.net/shutterstock/videos/33914341/preview/stock-footage-closeup-cropped-video-of-a-man-playing-electric-guitar-in-studio.mp4,PT00H00M29S,019301_019350,Closeup cropped video of a man playing electric guitar in studio
1018784623,https://ak.picdn.net/shutterstock/videos/1018784623/preview/stock-footage-blue-terry-cloth-light-movement-the-background-screen-saver-for-your-movie-lifestyle-concept.mp4,PT00H00M30S,069851_069900,Blue terry cloth light movement the background screen saver for your movie lifestyle concept
1033260521,https://ak.picdn.net/shutterstock/videos/1033260521/preview/stock-footage-combine-harvester-working-on-a-wheat-crop.mp4,PT00H00M18S,003301_003350,Combine harvester working on a wheat crop
1024931960,https://ak.picdn.net/shutterstock/videos/1024931960/preview/stock-footage-green-frog-sits-in-the-swamp.mp4,PT00H00M12S,060051_060100,Green frog sits in the swamp
1017706360,https://ak.picdn.net/shutterstock/videos/1017706360/preview/stock-footage-a-group-of-canadian-geese-and-baby-goslings-walk-and-eat.mp4,PT00H00M08S,041601_041650,A group of canadian geese and baby goslings walk and eat.
1020788266,https://ak.picdn.net/shutterstock/videos/1020788266/preview/stock-footage-tree-branch-with-the-sky.mp4,PT00H00M11S,190551_190600,Tree branch with  the sky.
10867385,https://ak.picdn.net/shutterstock/videos/10867385/preview/stock-footage-couple-sitting-next-to-the-brick-wall-and-doing-selfie-on-smartphone.mp4,PT00H00M28S,037001_037050,"Couple sitting next to the brick wall and doing selfie on smartphone
"
1050661615,https://ak.picdn.net/shutterstock/videos/1050661615/preview/stock-footage-happy-teachers-day-celebration-with-schoolbag-and-supplies-k-video-animated.mp4,PT00H00M12S,125451_125500,"Happy teachers day celebration with schoolbag and supplies ,4k video animated"
1066586398,https://ak.picdn.net/shutterstock/videos/1066586398/preview/stock-footage-side-view-motivated-millennial-young-female-employee-working-on-online-project-on-computer-sitting.mp4,PT00H00M24S,031451_031500,"Side view motivated millennial young female employee working on online project on computer, sitting at shared table in modern office kitchen, analyzing electronic documents, web surfing information."
