videoid,contentUrl,duration,page_dir,name
18763796,https://ak.picdn.net/shutterstock/videos/18763796/preview/stock-footage-sunset-sun-shining-through-beautiful-blooming-lavender-flowers-slow-motion-fps-close-up-dolly.mp4,PT00H00M35S,064801_064850,"Sunset sun shining through beautiful blooming lavender flowers. slow motion 120 fps. close up dolly shot. plateau du valensole, provence, south france, europe. cinematic nature background. lens flare."
1009009418,https://ak.picdn.net/shutterstock/videos/1009009418/preview/stock-footage-breakwater-on-the-river.mp4,PT00H00M28S,177151_177200,Breakwater on the river
14158241,https://ak.picdn.net/shutterstock/videos/14158241/preview/stock-footage-white-swan.mp4,PT00H00M08S,009351_009400,White swan
1035074378,https://ak.picdn.net/shutterstock/videos/1035074378/preview/stock-footage-military-air-force-helicopter-squadron-deep-fly-by-over-grassland-military-air-force-helicopter.mp4,PT00H00M15S,191701_191750,Military air force helicopter squadron deep fly by over grassland / military air force helicopter squadron deep fly by over grassland 
7803934,https://ak.picdn.net/shutterstock/videos/7803934/preview/stock-footage-golden-beach-k-a-high-speed-image-of-waves-flowing-in-on-a-california-coast.mp4,PT00H00M30S,059601_059650,Golden beach (4k) - a high speed image of waves flowing in on a california coast.
32287663,https://ak.picdn.net/shutterstock/videos/32287663/preview/stock-footage-the-great-naga-at-the-middle-part-the-great-serpent-nag-songkhla-lake-samila-beach-songkhla.mp4,PT00H00M12S,028601_028650,"The great naga at the middle part, the great serpent nag, songkhla lake, samila beach, songkhla, singgora, thailand  24 sep 2017. about 1000km from bangkok and 1600km from chiangmai"
7054708,https://ak.picdn.net/shutterstock/videos/7054708/preview/stock-footage-istanbul-june-crowded-people-are-walking-in-istiklal-street-istanbul-turkey.mp4,PT00H00M15S,182801_182850,"Istanbul-june- 2014-crowded people are walking in istiklal street, istanbul, turkey."
714859,https://ak.picdn.net/shutterstock/videos/714859/preview/stock-footage-background-animation.mp4,PT00H00M15S,116351_116400,Background animation
1025713982,https://ak.picdn.net/shutterstock/videos/1025713982/preview/stock-footage-animals-in-the-sea-phuket-thailand-diving-trip.mp4,PT00H00M08S,124651_124700,"Animals in the sea phuket,thailand diving trip"
1053772163,https://ak.picdn.net/shutterstock/videos/1053772163/preview/stock-footage-night-sky-full-of-stars-sirius-and-orion-over-the-church-of-maria-gern-berchtesgaden-bavaria.mp4,PT00H00M19S,034451_034500,"Night sky full of stars, sirius and orion over the church of maria gern, berchtesgaden, bavaria, germany"
1016905570,https://ak.picdn.net/shutterstock/videos/1016905570/preview/stock-footage-dramatic-drone-shot-of-charles-bridge-in-prague.mp4,PT00H00M07S,059801_059850,Dramatic drone shot of charles bridge in prague
1036432496,https://ak.picdn.net/shutterstock/videos/1036432496/preview/stock-footage-church-catherine-in-zamosc-poland-baroque-church-in-old-town-town-hall-mannerist-baroque-the.mp4,PT00H00M21S,002601_002650,"Church catherine in zamosc, poland - baroque church in old town. town hall - mannerist-baroque, the main building in zamosc."
1049596807,https://ak.picdn.net/shutterstock/videos/1049596807/preview/stock-footage-caucasian-male-doctor-wearing-blue-shirt-and-stethoscope-working-in-his-surgery-at-a-retirement.mp4,PT00H00M15S,103501_103550,"Caucasian male doctor wearing blue shirt and stethoscope, working in his surgery at a retirement home, examining a senior african american male patient, during coronavirus covid19 pandemic."
1052245153,https://ak.picdn.net/shutterstock/videos/1052245153/preview/stock-footage-cleaning-of-garbage-and-fallen-leaves-in-the-spring-in-the-city-square.mp4,PT00H00M22S,037351_037400,Cleaning of garbage and fallen leaves in the spring in the city square.
1031809274,https://ak.picdn.net/shutterstock/videos/1031809274/preview/stock-footage--s-united-states-shock-waves-off-solid-rocket-booster-first-stage-of-launch-solid-rocket.mp4,PT00H00M17S,071851_071900,1980s: united states: shock waves off solid rocket booster. first stage of launch. solid rocket boosters jettisoned
18707114,https://ak.picdn.net/shutterstock/videos/18707114/preview/stock-footage-online-shopping.mp4,PT00H00M12S,185201_185250,Online shopping
4233814,https://ak.picdn.net/shutterstock/videos/4233814/preview/stock-footage-eggs-being-beaten.mp4,PT00H00M08S,140251_140300,Eggs being beaten
5568227,https://ak.picdn.net/shutterstock/videos/5568227/preview/stock-footage-attractive-woman-texting-with-her-phone-in-the-mountains.mp4,PT00H00M14S,148651_148700,Attractive woman texting with her phone in the mountains
7441894,https://ak.picdn.net/shutterstock/videos/7441894/preview/stock-footage-a-rock-climber-starts-to-climb-up-a-steep-rock-and-three-of-his-friends-are-ready-to-catch-him.mp4,PT00H00M05S,119451_119500,"A rock climber starts to climb up a steep rock and three of his friends are ready to catch him, view from above"
10595057,https://ak.picdn.net/shutterstock/videos/10595057/preview/stock-footage-raspberries-falling-into-melted-chocolate-shoot-on-digital-cinema-camera-in-slow-motion-prores.mp4,PT00H00M22S,136851_136900,Raspberries falling into melted chocolate. shoot on digital cinema camera in slow motion prores 422 codec.
1007348716,https://ak.picdn.net/shutterstock/videos/1007348716/preview/stock-footage--s-mountain-roads-from-hood-of-car-cliff-s-edges-trees-and-grass.mp4,PT00H00M21S,009101_009150,"1940s: mountain roads from hood of car, cliff's edges, trees and grass."
1034828945,https://ak.picdn.net/shutterstock/videos/1034828945/preview/stock-footage-save-the-date-text-alpha-channel.mp4,PT00H00M10S,188801_188850,Save the date text + alpha channel
20382430,https://ak.picdn.net/shutterstock/videos/20382430/preview/stock-footage-positive-business-male-talking-smart-telephone-and-checking-time-park-bench-area-ultra-high.mp4,PT00H00M26S,174851_174900,"Positive business male talking smart telephone and checking time park bench area. ultra high definition, ultrahd, ultra hd, uhd, 4k, 2160p, 4096x2160"
11830328,https://ak.picdn.net/shutterstock/videos/11830328/preview/stock-footage-madrid-spain-mars-ultra-hd-k-aerial-view-of-regional-train-arrive-in-station-by-day.mp4,PT00H00M18S,197201_197250,"Madrid - spain, mars 30, 2015, ultra hd 4k aerial view of regional train arrive in station by day"
1016252353,https://ak.picdn.net/shutterstock/videos/1016252353/preview/stock-footage-young-sporty-woman-runner-with-earphones-walking-on-the-beach-outside.mp4,PT00H00M09S,022401_022450,Young sporty woman runner with earphones walking on the beach outside.
133609,https://ak.picdn.net/shutterstock/videos/133609/preview/stock-footage-two-views-of-a-cute-toy-frog-doing-a-flip.mp4,PT00H00M06S,199701_199750,Two views of a cute toy frog doing a flip.
1016572006,https://ak.picdn.net/shutterstock/videos/1016572006/preview/stock-footage-blueprints-rolls-of-architectural-drawings-smoothly-rotate-on-the-surface-of-the-architectural.mp4,PT00H00M23S,016551_016600,Blueprints - rolls of architectural drawings smoothly rotate on the surface of the architectural plan of a modern house / seamless looping	
1009896041,https://ak.picdn.net/shutterstock/videos/1009896041/preview/stock-footage-view-of-asphalt-yard-descending-crane-shot.mp4,PT00H00M25S,041551_041600,View of asphalt yard - descending crane shot
23545501,https://ak.picdn.net/shutterstock/videos/23545501/preview/stock-footage-little-brown-meerkat-alert-watch-out-for-danger-k-ungraded-flat-profile-log-file-out-of-camera.mp4,PT00H00M32S,199951_200000,Little brown meerkat alert watch out for danger : 4k ungraded flat profile log file out of camera
24431396,https://ak.picdn.net/shutterstock/videos/24431396/preview/stock-footage-beautiful-gray-feather-pigeons-sitting-on-the-fence-in-the-park.mp4,PT00H00M21S,004601_004650,Beautiful gray feather pigeons sitting on the fence in the park
3324284,https://ak.picdn.net/shutterstock/videos/3324284/preview/stock-footage-woman-presses-buttons-on-switchboard.mp4,PT00H00M19S,170651_170700,Woman presses buttons on switchboard
1019741383,https://ak.picdn.net/shutterstock/videos/1019741383/preview/stock-footage-large-turnip-with-green-leaves.mp4,PT00H00M29S,072901_072950,Large turnip with green leaves
20968654,https://ak.picdn.net/shutterstock/videos/20968654/preview/stock-footage-little-blonde-girl-with-her-mommy-collect-leaves-in-fall-park-close-up.mp4,PT00H00M10S,044751_044800,"Little blonde girl with her mommy collect leaves in fall park, close up"
19585078,https://ak.picdn.net/shutterstock/videos/19585078/preview/stock-footage-ontario-canada-september-pov-driving-towards-big-thunder-storm-at-night-under-tornado-warning.mp4,PT00H00M32S,035951_036000,"Ontario, canada september 2016 pov driving towards big thunder storm at night under tornado warning"
1041925462,https://ak.picdn.net/shutterstock/videos/1041925462/preview/stock-footage-flying-in-a-canyon-gorge-of-colorado-river-near-the-red-rocks-of-brick-sandstone-formation.mp4,PT00H00M13S,103301_103350,"Flying in a canyon gorge of colorado river near the red rocks of brick sandstone formation. picturesque landscape, amazing breathtaking view in desert , arches park. aerial view, drone flight forward"
18993148,https://ak.picdn.net/shutterstock/videos/18993148/preview/stock-footage-the-young-beautiful-girl-and-shadow-walks-on-a-thin-ruined-rusty-metal-bridge-over-the-dirty-old.mp4,PT00H00M10S,119401_119450,The young beautiful girl and shadow walks on a thin ruined rusty metal bridge over the dirty old water. small green plants on the surface of the water. unusual fantastic flora. close silhouette shot
23090095,https://ak.picdn.net/shutterstock/videos/23090095/preview/stock-footage-abandoned-building-near-the-lake-in-the-village-aerial-shooting.mp4,PT00H00M15S,177801_177850,Abandoned building near the lake in the village. aerial shooting
1009839092,https://ak.picdn.net/shutterstock/videos/1009839092/preview/stock-footage-fir-forest-the-top-of-a-tree-with-cones-against-a-blue-sky.mp4,PT00H00M10S,127301_127350,Fir forest: the top of a tree with cones against a blue sky.
1043414578,https://ak.picdn.net/shutterstock/videos/1043414578/preview/stock-footage-berdichev-ukraine-december-listening-to-records-at-the-old-gramophone.mp4,PT00H00M21S,131001_131050,"Berdichev, ukraine - december 24, 2019. listening to records at the old gramophone."
10887965,https://ak.picdn.net/shutterstock/videos/10887965/preview/stock-footage-cute-little-kids-playing-on-playground-on-a-sunny-day-shoot-on-digital-cinema.mp4,PT00H00M28S,128901_128950,Cute little kids playing on playground on a sunny day. shoot on digital cinema 
1054502339,https://ak.picdn.net/shutterstock/videos/1054502339/preview/stock-footage-ripe-strawberry-in-the-basket.mp4,PT00H01M00S,136001_136050,Ripe strawberry in the basket.
1030302596,https://ak.picdn.net/shutterstock/videos/1030302596/preview/stock-footage-california-wildflowers-exploding-in-the-springtime-then-cars-traveling-through-pretty-ranchland.mp4,PT00H00M26S,034801_034850,California wildflowers exploding in the springtime then cars traveling through pretty ranchland landscape
24871952,https://ak.picdn.net/shutterstock/videos/24871952/preview/stock-footage-light-from-a-quad-bikes-headlights-straight-into-the-camera.mp4,PT00H00M04S,035751_035800,Light from a quad bikes headlights straight into the camera
1017176482,https://ak.picdn.net/shutterstock/videos/1017176482/preview/stock-footage-young-afro-american-student-woman-on-a-green-chroma-screen-doubting-and-confused-thinking-of-an.mp4,PT00H00M12S,078151_078200,"Young afro american student woman on a green chroma screen doubting and confused, thinking of an idea or worried about something"
1025978549,https://ak.picdn.net/shutterstock/videos/1025978549/preview/stock-footage-male-engineer-measures-a-scheme-using-a-metal-divider.mp4,PT00H00M09S,134851_134900,"Male engineer measures a scheme, using a metal divider."
35042293,https://ak.picdn.net/shutterstock/videos/35042293/preview/stock-footage-circa-s-soldiers-march-and-drive-towards-saint-mihiel-under-general-pershing-s-command-to.mp4,PT00H01M27S,146951_147000,Circa - 1910s - soldiers march and drive towards saint mihiel under general pershing's command to fight the german army during wwi.
1028854868,https://ak.picdn.net/shutterstock/videos/1028854868/preview/stock-footage-flowing-water-in-mountains.mp4,PT00H00M18S,123051_123100,Flowing water in mountains .
3376334,https://ak.picdn.net/shutterstock/videos/3376334/preview/stock-footage-candles-in-orthodox-church.mp4,PT00H00M15S,137051_137100,Candles in orthodox church
16045048,https://ak.picdn.net/shutterstock/videos/16045048/preview/stock-footage-inscription-of-euros-inscription-on-the-beach.mp4,PT00H00M15S,123701_123750,Inscription of 200 euros.	inscription on the beach.
1033121771,https://ak.picdn.net/shutterstock/videos/1033121771/preview/stock-footage-vienna-austria-front-of-hotel-sacher-in-vienna-on-a-rainy-day.mp4,PT00H00M11S,084101_084150,"Vienna, austria - 01 05 2019: front of hotel sacher in vienna on a rainy day"
1016847082,https://ak.picdn.net/shutterstock/videos/1016847082/preview/stock-footage-man-jogging-on-a-big-bridge-in-urban-surroundings.mp4,PT00H00M10S,044851_044900,Man jogging on a big bridge in urban surroundings.
1052902394,https://ak.picdn.net/shutterstock/videos/1052902394/preview/stock-footage-perfect-summer-day-with-sunny-blue-sky-and-sun-shine-nature-background-with-colorful-butterfly.mp4,PT00H00M33S,062551_062600,Perfect summer day with sunny blue sky and sun shine.  nature background with colorful butterfly flying on camera. beautiful colours in horizon. perfect for summer background.
1044757420,https://ak.picdn.net/shutterstock/videos/1044757420/preview/stock-footage-abstract-holographic-gradient-animation-in-purple-and-pink-trendy-vibrant-texture-fashion-textile.mp4,PT00H00M15S,122601_122650,"Abstract holographic gradient animation in purple and pink. trendy vibrant texture, fashion textile, ambient graphic design"
1016404504,https://ak.picdn.net/shutterstock/videos/1016404504/preview/stock-footage-happy-thanksgiving-cute-style-animation.mp4,PT00H00M10S,126051_126100,Happy thanksgiving cute style animation
721294,https://ak.picdn.net/shutterstock/videos/721294/preview/stock-footage-explorer-with-binoculars.mp4,PT00H00M20S,043751_043800,Explorer with binoculars
7072765,https://ak.picdn.net/shutterstock/videos/7072765/preview/stock-footage-aerial-view-of-vancouver.mp4,PT00H00M16S,054051_054100,Aerial view of vancouver
2844052,https://ak.picdn.net/shutterstock/videos/2844052/preview/stock-footage-a-sexy-gogo-dancer-shot-in-a-studio-dancing-and-posing-with-a-spinning-discoball.mp4,PT00H00M27S,075701_075750,A sexy gogo dancer shot in a studio dancing and posing with a spinning discoball
23637085,https://ak.picdn.net/shutterstock/videos/23637085/preview/stock-footage-join-us-inviting-man-with-red-hairs.mp4,PT00H00M09S,186751_186800,"Join us, inviting man with red hairs"
1022609038,https://ak.picdn.net/shutterstock/videos/1022609038/preview/stock-footage-happy-young-beautiful-woman-wearing-stylish-coat-walking-in-the-park-holding-package-of-products.mp4,PT00H00M18S,123751_123800,"Happy young beautiful woman wearing stylish coat walking in the park holding package of products and using smartphone. she looking into the camera. shopping, healthy eating, internet-shop concept"
1050856288,https://ak.picdn.net/shutterstock/videos/1050856288/preview/stock-footage-toddler-happily-steps-in-river-and-starts-to-splash-at-sunset-in-slow-motion.mp4,PT00H00M10S,056551_056600,Toddler happily steps in river and starts to splash at sunset in slow motion
1066294375,https://ak.picdn.net/shutterstock/videos/1066294375/preview/stock-footage--k-loop-seamless-of-real-fireworks-background-abstract-blur-of-real-golden-shining-fireworks-with.mp4,PT00H00M08S,021401_021450,4k. loop seamless of real fireworks background. abstract blur of real golden shining fireworks with bokeh lights in the night sky. glowing fireworks show. new year's eve fireworks celebration.
13633418,https://ak.picdn.net/shutterstock/videos/13633418/preview/stock-footage-young-businessman-working-with-documents-while-lying-on-hammock.mp4,PT00H00M15S,087651_087700,"Young businessman working with documents while lying on hammock
"
32022235,https://ak.picdn.net/shutterstock/videos/32022235/preview/stock-footage-baseball-bats-production-element.mp4,PT00H00M10S,062251_062300,Baseball bats production element
1018383388,https://ak.picdn.net/shutterstock/videos/1018383388/preview/stock-footage-funny-caucasian-grandfather-is-laughing-with-teeth-bush-white-hair-and-long-beard-modern-standing.mp4,PT00H00M17S,199201_199250,"Funny caucasian grandfather is laughing with teeth, bush white hair and long beard, modern standing male, brick wall illustration"
1012174052,https://ak.picdn.net/shutterstock/videos/1012174052/preview/stock-footage-abu-dhabi-united-arab-emirates-july-man-riding-a-quad-in-the-desert.mp4,PT00H00M11S,023001_023050,"Abu dhabi, united arab emirates - july, 2016: man riding a quad in the desert"
1007205025,https://ak.picdn.net/shutterstock/videos/1007205025/preview/stock-footage-cowgirl-takes-out-a-revolver-and-makes-a-shot-black-smoke-background-slow-motion-side-view.mp4,PT00H00M15S,091601_091650,Cowgirl takes out a revolver and makes a shot. black smoke background. slow motion. side view
1023475507,https://ak.picdn.net/shutterstock/videos/1023475507/preview/stock-footage-cambodia-realistic-closeup-flag-animation-perfect-for-background-seamless-looping.mp4,PT00H00M10S,108201_108250,Cambodia realistic closeup flag animation. perfect for background. seamless looping.
1028157680,https://ak.picdn.net/shutterstock/videos/1028157680/preview/stock-footage-yishun-singapore-april-rd-an-elderly-man-is-sweeping-the-floor-at-the-walk-way.mp4,PT00H00M49S,052301_052350,Yishun / singapore - april 23rd 2019: an elderly man is sweeping the floor at the walk way.
1053209708,https://ak.picdn.net/shutterstock/videos/1053209708/preview/stock-footage-it-is-modern-digital-web-d-fractal.mp4,PT00H00M09S,017301_017350,It is modern digital web 3d fractal.
1039201841,https://ak.picdn.net/shutterstock/videos/1039201841/preview/stock-footage-lake-landscape-with-mountains-in-the-background-and-plants-and-metal-fence-in-the-foreground-on-a.mp4,PT00H00M10S,064801_064850,Lake landscape with mountains in the background and plants and metal fence in the foreground on a sunny day
1025344286,https://ak.picdn.net/shutterstock/videos/1025344286/preview/stock-footage-modern-huge-southern-port-city-with-beaches-beachfront-harbor-with-pierses-aerial-view-mountain.mp4,PT00H00M07S,092401_092450,Modern huge southern port city with beaches. beachfront harbor with pierses. aerial view. mountain landscape with clear sky. city coast with contemporary architecture
1032221969,https://ak.picdn.net/shutterstock/videos/1032221969/preview/stock-footage--s-united-states-water-marks-across-lawn-garden-flooded-mist-over-home.mp4,PT00H00M18S,192051_192100,1970s: united states: water marks across lawn. garden flooded. mist over home
17011525,https://ak.picdn.net/shutterstock/videos/17011525/preview/stock-footage-clouds-in-the-sky.mp4,PT00H00M56S,198501_198550,Clouds in the sky.
8901028,https://ak.picdn.net/shutterstock/videos/8901028/preview/stock-footage--k-universal-countdown-leader-purple.mp4,PT00H00M12S,170701_170750,4k universal countdown leader purple
26308370,https://ak.picdn.net/shutterstock/videos/26308370/preview/stock-footage-young-pretty-caucasian-brunette-girl-get-surprised-and-falls-backward-in-living-room-close-up-slow.mp4,PT00H00M09S,142101_142150,"Young pretty caucasian brunette girl get surprised and falls backward in living room, close up slow motion"
1045205575,https://ak.picdn.net/shutterstock/videos/1045205575/preview/stock-footage-closeup-shot-of-a-young-man-wearing-a-helmet-with-a-snowboard-in-a-mountain-resort-winter-holidays.mp4,PT00H00M07S,056101_056150,Closeup shot of a young man wearing a helmet with a snowboard in a mountain resort. winter holidays concept. slowmotion shot
1059704657,https://ak.picdn.net/shutterstock/videos/1059704657/preview/stock-footage-young-man-washes-out-of-hose-solar-panels.mp4,PT00H00M14S,070351_070400,Young man washes out of hose solar panels
19957783,https://ak.picdn.net/shutterstock/videos/19957783/preview/stock-footage-president-john-fitzgerald-kennedy-answers-questions-about-general-edwin-anderson-walker-at-a-news.mp4,PT00H02M17S,056151_056200,"President john fitzgerald kennedy answers questions about general edwin anderson walker at a news conference on april 21, 1961. (1960s)"
7675381,https://ak.picdn.net/shutterstock/videos/7675381/preview/stock-footage-forest-trail-on-kraljevica-park-in-eastern-seriban-city-of-zajecar-k-p-uhd-video-autumn-in.mp4,PT00H00M14S,048151_048200,Forest trail on kraljevica park in eastern seriban city of zajecar 4k 2160p uhd video - autumn in city park kraljevica 4k 3840x2160 uhd footage
7580911,https://ak.picdn.net/shutterstock/videos/7580911/preview/stock-footage-yekaterinburg-russia-spring-and-summer-build-prisoners-in-the-prison-yard-the-prison.mp4,PT00H00M08S,054601_054650,"Yekaterinburg, russia - spring and summer, 2011: build prisoners in the prison yard. the prison yard."
14704978,https://ak.picdn.net/shutterstock/videos/14704978/preview/stock-footage-boy-running-on-the-peaceful-beach-and-enjoying-it-steadycam-shot.mp4,PT00H00M11S,053551_053600,"Boy running on the peaceful beach and enjoying it, steadycam shot
"
1021702693,https://ak.picdn.net/shutterstock/videos/1021702693/preview/stock-footage-white-inversion-trace-airplane-on-a-clear-blue-sky.mp4,PT00H00M11S,029151_029200,White inversion trace airplane on a clear blue sky
1025486144,https://ak.picdn.net/shutterstock/videos/1025486144/preview/stock-footage-abandoned-ark-oil-pumps-left-in-an-open-frozen-field-camera-tracks-and-zooms-at-the-same-time.mp4,PT00H00M12S,175001_175050,"Abandoned ark oil pumps left in an open, frozen field. camera tracks and zooms at the same time."
1028037614,https://ak.picdn.net/shutterstock/videos/1028037614/preview/stock-footage-serene-resort-narrow-pathway-to-the-coast-beach-of-santinho-amidst-lush-greenery-drone-shot.mp4,PT00H00M41S,063801_063850,"Serene resort narrow pathway to the coast beach of santinho amidst lush greenery
(drone shot)"
25308170,https://ak.picdn.net/shutterstock/videos/25308170/preview/stock-footage-the-sea-of-okhotsk-of-the-drift-ice.mp4,PT00H00M21S,171901_171950,The sea of okhotsk of the drift ice
26060834,https://ak.picdn.net/shutterstock/videos/26060834/preview/stock-footage-sunset-at-the-beach-in-abu-dhabi-uae.mp4,PT00H00M12S,179401_179450,"Sunset at the beach in abu dhabi, uae"
23488651,https://ak.picdn.net/shutterstock/videos/23488651/preview/stock-footage-bright-warm-spring-sunshine-into-the-camera-lens-through-the-trees-and-melting-icicles.mp4,PT00H00M13S,026001_026050,Bright warm spring sunshine into the camera lens through the trees and melting icicles
33969688,https://ak.picdn.net/shutterstock/videos/33969688/preview/stock-footage-herceg-novi-montenegro-december-construction-of-marina-for-yachts-in-the-sea.mp4,PT00H01M00S,171851_171900,"Herceg novi, montenegro - december, 2017: construction of marina for yachts in the sea"
19129168,https://ak.picdn.net/shutterstock/videos/19129168/preview/stock-footage-natural-walkway-leading-to-sea-beach-with-pines-and-other-vegetation-slow-mo-x-hd-footage.mp4,PT00H00M28S,002651_002700,Natural walkway leading to sea beach with pines and other vegetation slow-mo 1920x1080 hd footage - wooden plank fence next to atlantic ocean and blue sky slow motion 1080p fullhd video
1014595517,https://ak.picdn.net/shutterstock/videos/1014595517/preview/stock-footage-old-and-rusty-water-pump-motor-with-pulley-wheel-and-belt-with-water-or-oil-leak.mp4,PT00H00M10S,184251_184300,Old and rusty water pump motor with pulley wheel and belt with water or oil leak
11211371,https://ak.picdn.net/shutterstock/videos/11211371/preview/stock-footage-animation-of-flicker-and-slow-motion-particles-in-digital-world-map-abstract-background-of.mp4,PT00H00M20S,059801_059850,Animation of flicker and slow motion particles in digital world map. abstract background of technology. animation of seamless loop.
1051285051,https://ak.picdn.net/shutterstock/videos/1051285051/preview/stock-footage-hail-storm-clouds-forming-cloud-time-lapse-very-ominous-and-scary-before-heavy-rainfall-and.mp4,PT00H00M10S,110601_110650,"Hail storm clouds forming cloud time lapse, very ominous and scary before heavy rainfall and destructive hail stones rain down"
1017906673,https://ak.picdn.net/shutterstock/videos/1017906673/preview/stock-footage-young-overweight-african-american-woman-running-difficult-endurance-challenge-weight-loss.mp4,PT00H00M13S,011351_011400,Young overweight african american woman running difficult endurance challenge weight loss exercising commited black female runner jogging in evening urban city at night tough gritty
1017093487,https://ak.picdn.net/shutterstock/videos/1017093487/preview/stock-footage-fexofenadine-hydrochloride-male-doctor-with-mobile-phone-opens-and-touches-hologram-active.mp4,PT00H00M13S,180051_180100,Fexofenadine hydrochloride - male doctor with mobile phone opens and touches hologram active ingrident of medicine
1060766380,https://ak.picdn.net/shutterstock/videos/1060766380/preview/stock-footage-raw-beef-steak-with-flames-and-smoke-is-roasting-in-frying-pan-in-slow-motion.mp4,PT00H00M25S,004351_004400,"Raw beef steak with flames and smoke is roasting in frying pan, in slow motion."
23957944,https://ak.picdn.net/shutterstock/videos/23957944/preview/stock-footage-assembling-desks.mp4,PT00H00M19S,075851_075900,Assembling desks
