videoid,contentUrl,duration,page_dir,name
1038603986,https://ak.picdn.net/shutterstock/videos/1038603986/preview/stock-footage-fern-in-park-in-autumn-brunch-with-yellow-green-leaves.mp4,PT00H00M14S,087351_087400,"Fern in park in autumn, brunch with yellow green leaves"
1036941575,https://ak.picdn.net/shutterstock/videos/1036941575/preview/stock-footage--d-rendering-loop-footage-dynamic-background-looped-animation-abstract-motion-background-endless.mp4,PT00H00M05S,123301_123350,3d rendering loop footage. dynamic background. looped animation abstract motion background. endless space abstract technology tunnel
29000050,https://ak.picdn.net/shutterstock/videos/29000050/preview/stock-footage-vietnam-circa-november-emirates-plane-interior-passengers-board-stewardesses-talk.mp4,PT00H00M10S,189751_189800,"Vietnam - circa november 2016 - emirates plane interior, passengers board, stewardesses talk, screens, seats"
1024665074,https://ak.picdn.net/shutterstock/videos/1024665074/preview/stock-footage-a-large-pelican-standing-on-a-rock-in-the-sea-close-up.mp4,PT00H00M24S,032301_032350,"A large pelican standing on a rock in the sea, close up."
1019541562,https://ak.picdn.net/shutterstock/videos/1019541562/preview/stock-footage-sunset-time-in-nature-yellow-orange-horizon-sun-rays-dancing-time-lapse-clouds-slow-moving-very.mp4,PT00H00M06S,183101_183150,"Sunset time in nature yellow, orange horizon, sun rays dancing, time lapse clouds slow moving. very nice colourful cloudscape with clear skies weather."
1019710435,https://ak.picdn.net/shutterstock/videos/1019710435/preview/stock-footage-traveler-in-black-suit-admiring-the-beauty-of-the-beach-as-the-snow-covers-everything.mp4,PT00H00M15S,181801_181850,Traveler in black suit admiring the beauty of the beach as the snow covers everything.
1022475484,https://ak.picdn.net/shutterstock/videos/1022475484/preview/stock-footage-colleagues-and-friends-chat-talk-and-share-and-whisper-in-an-animated-happy-discussion-with-joy.mp4,PT00H00M22S,014501_014550,"Colleagues and friends chat, talk and share and whisper in an animated happy discussion with joy, stabilized handheld "
340291,https://ak.picdn.net/shutterstock/videos/340291/preview/stock-footage-close-up-of-soda-or-beer-can-opening.mp4,PT00H00M16S,149351_149400,Close up of soda or beer can opening
1046850691,https://ak.picdn.net/shutterstock/videos/1046850691/preview/stock-footage-busan-south-korea-october-tourist-visits-haedong-yonggung-temple-is-a-buddhist-temple.mp4,PT00H00M14S,087151_087200,"Busan, south korea - october 14, 2019: tourist visits haedong yonggung temple is a buddhist temple and large one and temple sits upon a cliff overlooking the east sea in busan, south korea."
1027315997,https://ak.picdn.net/shutterstock/videos/1027315997/preview/stock-footage-low-angle-view-of-gas-flare-tip-burning-with-huge-fire-on-the-oil-rig-platform-in-the-middle-of-the.mp4,PT00H00M15S,045201_045250,Low angle view of gas flare tip burning with huge fire on the oil rig platform in the middle of the sea at night.
19887868,https://ak.picdn.net/shutterstock/videos/19887868/preview/stock-footage-student-in-biology-using-microscope-in-training-class.mp4,PT00H00M21S,197301_197350,Student in biology using microscope in training class
22220017,https://ak.picdn.net/shutterstock/videos/22220017/preview/stock-footage-horn.mp4,PT00H00M14S,032201_032250,Horn
1028443742,https://ak.picdn.net/shutterstock/videos/1028443742/preview/stock-footage-close-up-surgeons-hands-make-abdominal-surgery-to-patient-with-special-instruments-low-light-scene.mp4,PT00H00M15S,039401_039450,"Close-up surgeons hands make abdominal surgery to patient with special instruments, low light scene. concept hospital"
12255086,https://ak.picdn.net/shutterstock/videos/12255086/preview/stock-footage-seagulls-make-takeoff-from-the-ocean-beach-slow-motion.mp4,PT00H00M19S,021501_021550,"Seagulls make takeoff from the ocean beach, slow motion"
29181601,https://ak.picdn.net/shutterstock/videos/29181601/preview/stock-footage-view-from-villa-monastero-in-varenna-at-lake-como-in-lombardy-italy.mp4,PT00H00M10S,054351_054400,View from villa monastero in varenna at lake como in lombardy italy
1024232051,https://ak.picdn.net/shutterstock/videos/1024232051/preview/stock-footage-airplane-landing-the-entrance.mp4,PT00H00M08S,036101_036150,Airplane landing the entrance
25639949,https://ak.picdn.net/shutterstock/videos/25639949/preview/stock-footage-elegant-businesswoman-smelling-tulip-and-sitting-in-the-cafe-steadycam-shot.mp4,PT00H00M17S,030251_030300,"Elegant businesswoman smelling tulip and sitting in the cafe, steadycam shot
"
17405350,https://ak.picdn.net/shutterstock/videos/17405350/preview/stock-footage-water-quarry.mp4,PT00H00M53S,026951_027000,Water quarry
1028860,https://ak.picdn.net/shutterstock/videos/1028860/preview/stock-footage-australia-map-flag-with-fleet-of-container-ships-animation.mp4,PT00H00M11S,021401_021450,Australia map flag with fleet of container ships animation
5035391,https://ak.picdn.net/shutterstock/videos/5035391/preview/stock-footage-carp-harvesting-pond.mp4,PT00H00M36S,116151_116200,Carp harvesting pond 5
10850708,https://ak.picdn.net/shutterstock/videos/10850708/preview/stock-footage-abstract-rotating-sphere-animation-loop-golden.mp4,PT00H00M20S,048651_048700,Abstract rotating sphere animation - loop golden
1035630371,https://ak.picdn.net/shutterstock/videos/1035630371/preview/stock-footage-business-technology-and-people-concept-young-smiling-businessman-with-tablet-computer-backpack.mp4,PT00H00M28S,125951_126000,"Business, technology and people concept - young smiling businessman with tablet computer, backpack and electric scooter sitting on street bench in city"
26920156,https://ak.picdn.net/shutterstock/videos/26920156/preview/stock-footage-footage-colorful-burning-candles-set-on-black-background-k-video.mp4,PT00H00M08S,048451_048500,Footage colorful burning candles set on black background. 4k video
1027711103,https://ak.picdn.net/shutterstock/videos/1027711103/preview/stock-footage-south-goa-india-march-ride-on-bike-on-the-beach-sport-and-active-life-concept.mp4,PT00H00M07S,176351_176400,"South goa, india - march, 2019: ride on bike on the beach. sport and active life concept. "
1024480847,https://ak.picdn.net/shutterstock/videos/1024480847/preview/stock-footage-man-on-the-bed-looks-virtual-reality-headset-hotel-or-home-bedroom.mp4,PT00H00M19S,070751_070800,Man on the bed looks virtual reality headset. hotel or home bedroom
1020936151,https://ak.picdn.net/shutterstock/videos/1020936151/preview/stock-footage--white-lazy-dog-under-yellow-blanket-on-the-bed-cozy-and-staying-safe-from-the-cold-on-times-of.mp4,PT00H00M24S,107701_107750," white lazy dog under yellow blanket on the bed cozy and staying safe  from the cold, on times of quarantine isolated"
1007326042,https://ak.picdn.net/shutterstock/videos/1007326042/preview/stock-footage-close-up-of-modern-glasses-which-are-lying-on-the-office-table-two-colleagues-are-working-at-the.mp4,PT00H00M19S,054451_054500,Close up of modern glasses which are lying on the office table. two colleagues are working at the background sitting at the desk with laptop on. male and female businesspeople are writing reports with
1010297591,https://ak.picdn.net/shutterstock/videos/1010297591/preview/stock-footage--k-green-grass-on-field.mp4,PT00H00M18S,080651_080700,4k green grass on field
1038680777,https://ak.picdn.net/shutterstock/videos/1038680777/preview/stock-footage-a-woman-walks-through-an-autumn-forest-and-admires-nature-on-a-sunny-day.mp4,PT00H00M13S,087651_087700,A woman walks through an autumn forest and admires nature on a sunny day.
1055737460,https://ak.picdn.net/shutterstock/videos/1055737460/preview/stock-footage-the-french-colorado-rustrel-vaucluse-provence-france.mp4,PT00H00M10S,019301_019350,"The french colorado, rustrel, vaucluse, provence,france"
1044591850,https://ak.picdn.net/shutterstock/videos/1044591850/preview/stock-footage-organic-farm-agriculture-salad-vegetable-plant.mp4,PT00H00M08S,008751_008800,Organic farm agriculture salad vegetable plant 
30809806,https://ak.picdn.net/shutterstock/videos/30809806/preview/stock-footage-silhouette-of-tree-and-stairs-to-ocean-at-sunset-vertical-movement.mp4,PT00H00M06S,109201_109250,Silhouette of tree and stairs to ocean at sunset - vertical movement
1022105464,https://ak.picdn.net/shutterstock/videos/1022105464/preview/stock-footage-a-perfect-neighbourhood-houses-in-suburb-at-summer-in-the-north-america-luxury-houses-with-nice.mp4,PT00H00M18S,033451_033500,A perfect neighbourhood. houses in suburb at summer in the north america. luxury houses with nice landscape. aerial drone view.
1032717536,https://ak.picdn.net/shutterstock/videos/1032717536/preview/stock-footage-creative-nail-art-with-passion.mp4,PT00H00M19S,108401_108450,Creative nail art with passion
1043599663,https://ak.picdn.net/shutterstock/videos/1043599663/preview/stock-footage-salzburg-austria-july-city-center-day-time-famous-crowded-pedestrian-square-slow-motion.mp4,PT00H00M15S,107401_107450,"Salzburg, austria - july 7 2019: city center day time famous crowded pedestrian square slow motion panorama 4k circa july 7 2019 salzburg, austria."
21186805,https://ak.picdn.net/shutterstock/videos/21186805/preview/stock-footage-bangkok-thailand-july-unidentified-people-and-laundry-cart-working-for-clean-on.mp4,PT00H00M08S,146501_146550,"Bangkok, thailand - july 19, 2015 : unidentified people and laundry cart working for clean on hallway in hospital"
1040376785,https://ak.picdn.net/shutterstock/videos/1040376785/preview/stock-footage-aerial-flight-over-a-small-sawmill-in-russia-timber-works-make-boards-from-logs-and-store-them-on.mp4,PT00H00M17S,198001_198050,Aerial flight over a small sawmill in russia. timber-works make boards from logs and store them on the outdoor. aerial shot taken by drone
2835010,https://ak.picdn.net/shutterstock/videos/2835010/preview/stock-footage-majestic-iguassu-falls-and-rainbow.mp4,PT00H00M07S,005901_005950,Majestic iguassu falls and rainbow 
11330219,https://ak.picdn.net/shutterstock/videos/11330219/preview/stock-footage-raccoon-standing-and-looking.mp4,PT00H00M07S,121801_121850,Raccoon standing and looking
1066766335,https://ak.picdn.net/shutterstock/videos/1066766335/preview/stock-footage-sulamani-temple-pagoda-in-bagan-myanmar-burma.mp4,PT00H00M18S,127101_127150,"Sulamani temple pagoda in bagan, myanmar, burma"
1029030254,https://ak.picdn.net/shutterstock/videos/1029030254/preview/stock-footage-financial-indicators-on-a-moving-charts-table-of-stock-exchange-market-indices.mp4,PT00H00M15S,020001_020050,Financial indicators on a moving charts. table of stock exchange market indices
1014830338,https://ak.picdn.net/shutterstock/videos/1014830338/preview/stock-footage-halloween-costume-devil-in-red-wig-with-horns-funny-afro-america-man-in-fancy-dress-of-devil.mp4,PT00H00M30S,104601_104650,"Halloween costume: devil in red wig with horns.   funny afro america man  in fancy dress of devil is dancing and rapping. carnival, dance, humor"
1028764796,https://ak.picdn.net/shutterstock/videos/1028764796/preview/stock-footage-close-up-two-pieces-of-raw-meat-cooking-in-the-restaurant-kitchen-the-chef-preparing-tasty-food.mp4,PT00H00M06S,122701_122750,Close-up two pieces of raw meat cooking in the restaurant kitchen. the chef preparing tasty food.
1037289539,https://ak.picdn.net/shutterstock/videos/1037289539/preview/stock-footage-cgi-d-animation-of-terrain-plexus.mp4,PT00H00M05S,195351_195400,Cgi 3d animation of terrain plexus
33675409,https://ak.picdn.net/shutterstock/videos/33675409/preview/stock-footage-bubbles-of-champagne-rises-to-the-surface-glass-close-up.mp4,PT00H00M26S,044651_044700,Bubbles of champagne rises to the surface glass . close up
1050426241,https://ak.picdn.net/shutterstock/videos/1050426241/preview/stock-footage-new-york-ny-united-states-feb-glass-reflections-of-the-shed-building-in-nyc-hudson.mp4,PT00H00M18S,182501_182550,"New york, ny / united states - feb 10 2020: glass reflections of the shed building in nyc hudson yards lowering aerial"
1038132494,https://ak.picdn.net/shutterstock/videos/1038132494/preview/stock-footage-bocce-at-the-beach-at-hampon-nh.mp4,PT00H00M12S,034951_035000,"Bocce at the beach at hampon, nh"
1014804770,https://ak.picdn.net/shutterstock/videos/1014804770/preview/stock-footage-isolated-hotel-near-the-beautiful-sea-aerial-view.mp4,PT00H00M33S,186901_186950,Isolated hotel near the beautiful sea. aerial view
1016833570,https://ak.picdn.net/shutterstock/videos/1016833570/preview/stock-footage-two-charming-girls-sitting-in-mall-with-coffee-talking-and-laughing-after-shopping.mp4,PT00H00M30S,190801_190850,"Two charming girls sitting in mall with coffee, talking and laughing after shopping."
1056403691,https://ak.picdn.net/shutterstock/videos/1056403691/preview/stock-footage-close-up-of-a-purple-bell-shaped-wildflowers-on-a-green-background-the-flower-are-in-sharp-focus.mp4,PT00H00M30S,149801_149850,Close-up of a purple bell-shaped wildflowers on a green background.  the flower are in sharp focus and are moving slowly in the wind.
1028591240,https://ak.picdn.net/shutterstock/videos/1028591240/preview/stock-footage-vltava-river-nautical-school-path-nature-clear-sky-sunny-day.mp4,PT00H00M33S,055701_055750,Vltava river nautical school path nature clear sky sunny day
11331638,https://ak.picdn.net/shutterstock/videos/11331638/preview/stock-footage-above-shot-of-a-sportive-woman-holding-healthy-breakfast-including-almond-milk-bananas-and.mp4,PT00H00M06S,004801_004850,"Above shot of a sportive woman holding healthy breakfast, including almond milk, bananas and berries. "
16176631,https://ak.picdn.net/shutterstock/videos/16176631/preview/stock-footage-agriculture-manufacture-industry-and-farming-concept-vintage-machine-conveyor-rolls-spinning-at.mp4,PT00H00M12S,178401_178450,"Agriculture, manufacture, industry and farming concept - vintage machine conveyor rolls spinning at factory"
33910630,https://ak.picdn.net/shutterstock/videos/33910630/preview/stock-footage--s-united-states-close-up-of-hands-blurred-vision-of-child-lady-talks-to-child-child-frowns.mp4,PT00H00M24S,125851_125900,1970s: united states: close up of hands. blurred vision of child. lady talks to child. child frowns
7629574,https://ak.picdn.net/shutterstock/videos/7629574/preview/stock-footage-time-lapse-of-a-trash-collectors-cycle-in-nizamuddin.mp4,PT00H00M13S,129601_129650,Time lapse of a trash collectors cycle in nizamuddin.
2034244,https://ak.picdn.net/shutterstock/videos/2034244/preview/stock-footage-glimmering-sea.mp4,PT00H00M18S,180701_180750,Glimmering sea
1031967242,https://ak.picdn.net/shutterstock/videos/1031967242/preview/stock-footage-diagonal-moving-lens-flare-effect-on-black-background-k-animation.mp4,PT00H00M11S,070251_070300,Diagonal moving lens flare effect on black background. 4k animation.
1010107733,https://ak.picdn.net/shutterstock/videos/1010107733/preview/stock-footage-view-of-spring-snow-storm-from-residential-back-porch.mp4,PT00H00M10S,067401_067450,View of spring snow storm from residential back porch.
1064328091,https://ak.picdn.net/shutterstock/videos/1064328091/preview/stock-footage-very-slow-snow-falling-over-winter-night-sky-animation-k-on-black-background-and-green-screen-k.mp4,PT00H00M40S,171351_171400,Very slow snow falling over winter night sky animation 4k on black background and green screen 4k.
1040383520,https://ak.picdn.net/shutterstock/videos/1040383520/preview/stock-footage-firefly-flying-in-green-forest.mp4,PT00H00M10S,039451_039500,Firefly flying in green forest
1034655200,https://ak.picdn.net/shutterstock/videos/1034655200/preview/stock-footage-close-up-portrait-of-a-small-fluffy-dog.mp4,PT00H00M11S,062901_062950,Close-up portrait of a small fluffy dog
1014907684,https://ak.picdn.net/shutterstock/videos/1014907684/preview/stock-footage-motion-circles-abstract-background-elegant-and-luxury-dynamic-geometric-style-template-in-k.mp4,PT00H00M10S,104401_104450,Motion circles abstract background. elegant and luxury dynamic geometric style template in 4k footage. video format 3840x2160
1024488824,https://ak.picdn.net/shutterstock/videos/1024488824/preview/stock-footage-close-up-of-a-man-holding-his-vr-googles-and-looking-slowly-the-d-space-in-green-screen.mp4,PT00H00M54S,060701_060750,Close up of a man holding his vr googles and looking slowly the 3d space in green screen
27791011,https://ak.picdn.net/shutterstock/videos/27791011/preview/stock-footage-charging-battery-complete-battery-charger-led-indicator-light-blinking.mp4,PT00H00M05S,142451_142500,"Charging battery complete, battery charger led indicator light, blinking"
18219826,https://ak.picdn.net/shutterstock/videos/18219826/preview/stock-footage-russia-saint-petersburg-july-time-lapse-of-return-the-cruiser-the-aurora-to-the-place-of.mp4,PT00H00M30S,129501_129550,"Russia, saint-petersburg, 16 july 2016: time-lapse of return the cruiser the aurora to the place of eternal parking at the nakhimov naval sea school after the reconstruction, a lot of observing people"
16697596,https://ak.picdn.net/shutterstock/videos/16697596/preview/stock-footage-red-leaves.mp4,PT00H00M10S,027701_027750,Red leaves 
13566344,https://ak.picdn.net/shutterstock/videos/13566344/preview/stock-footage-moscow-jan-master-class-of-make-up-at-retro-beauty-day-in-beverly-hills-diner.mp4,PT00H00M10S,190651_190700,"Moscow - jan 18, 2015: master class of make up at retro beauty day in beverly hills diner"
6566837,https://ak.picdn.net/shutterstock/videos/6566837/preview/stock-footage-mittenwald-germany-august-bozner-markt.mp4,PT00H00M10S,066301_066350,"Mittenwald, germany - august 2012: bozner markt 2012"
32286523,https://ak.picdn.net/shutterstock/videos/32286523/preview/stock-footage-sad-girl-sitting-by-the-window-listening-music-on-headphones-and-using-a-laptop.mp4,PT00H00M14S,011451_011500,Sad girl sitting by the window listening music on headphones and using a laptop
22192537,https://ak.picdn.net/shutterstock/videos/22192537/preview/stock-footage--k-cloud-lightning-gas-background-k.mp4,PT00H00M23S,074151_074200,4k cloud lightning gas background. 6608_4k
1023020785,https://ak.picdn.net/shutterstock/videos/1023020785/preview/stock-footage-guilin-china-circa-november-people-on-electric-scooter-motorbike-motorcycle-and-bicycle.mp4,PT00H00M25S,095001_095050,"Guilin, china - circa november 2018 : people on electric scooter, motorbike, motorcycle and bicycle."
25628798,https://ak.picdn.net/shutterstock/videos/25628798/preview/stock-footage-many-hands-putting-lot-of-used-batteries-in-the-recycling-box-top-view-slow-motion-close-up.mp4,PT00H00M19S,004751_004800,Many hands putting lot of used batteries in the recycling box. top view. slow motion. close up
1022953015,https://ak.picdn.net/shutterstock/videos/1022953015/preview/stock-footage-little-blue-heron-walking-slowly-in-swampy-field-on-overcast-day.mp4,PT00H00M09S,029951_030000,Little blue heron walking slowly in swampy field on overcast day
1010592062,https://ak.picdn.net/shutterstock/videos/1010592062/preview/stock-footage-yorkshire-terrier-walking-on-floor.mp4,PT00H00M06S,196101_196150,Yorkshire terrier walking on floor
1040190092,https://ak.picdn.net/shutterstock/videos/1040190092/preview/stock-footage-business-people-are-using-tablet-to-make-business-contacts.mp4,PT00H00M12S,093951_094000,Business people are using tablet to make business contacts
1059351455,https://ak.picdn.net/shutterstock/videos/1059351455/preview/stock-footage-pile-of-colorful-d-televisions-with-no-signal-and-blank-green-screen-monitor-move-in-and-out-shot.mp4,PT00H00M10S,068751_068800,"Pile of colorful 3d televisions with no signal and blank green screen monitor, move in and out shot, abstract realistic mock up of cartoon vintage tv monitors."
4330517,https://ak.picdn.net/shutterstock/videos/4330517/preview/stock-footage--s-various-central-american-leaders-speak-out-about-the-nicaraguan-revolution-in-the-s.mp4,PT00H01M43S,138351_138400,1980s - various central american leaders speak out about the nicaraguan revolution in the 1980s.
14642956,https://ak.picdn.net/shutterstock/videos/14642956/preview/stock-footage-lights-flashing-on-movie-theater-marquee-for-d-film-k.mp4,PT00H00M14S,087201_087250,Lights flashing on movie theater marquee for 3d film 4k
1010188703,https://ak.picdn.net/shutterstock/videos/1010188703/preview/stock-footage-paide-closeup-flag-city-of-estonia-realistic-animation-seamless-loop-seconds-long.mp4,PT00H00M10S,039051_039100,"Paide closeup flag, city of estonia, realistic animation seamless loop - 10 seconds long"
1014201464,https://ak.picdn.net/shutterstock/videos/1014201464/preview/stock-footage-portrait-shot-of-the-cute-little-girl-trying-to-cook-croissants-putting-a-red-jam-on-the-dough-and.mp4,PT00H00M14S,018251_018300,"Portrait shot of the cute little girl trying to cook croissants, putting a red jam on the dough and rolling it in the cozy kitchen. close up. indoors"
24653999,https://ak.picdn.net/shutterstock/videos/24653999/preview/stock-footage-honeybee-bumblebee-organic-honey-pollen-sunflower-blue-sky-slow-motion-close-up-macro.mp4,PT00H00M30S,015851_015900,Honeybee bumblebee organic honey pollen sunflower blue sky slow motion close up macro
13018352,https://ak.picdn.net/shutterstock/videos/13018352/preview/stock-footage-aerial-shot-of-autumn-landscape-in-southern-germany.mp4,PT00H00M22S,002251_002300,Aerial shot of autumn landscape in southern germany
1037577632,https://ak.picdn.net/shutterstock/videos/1037577632/preview/stock-footage-green-forest-trees-leaves-on-the-ground-ending-with-the-sky-image.mp4,PT00H00M23S,063201_063250,"Green forest, trees, leaves on the ground ending with the sky image"
1018340053,https://ak.picdn.net/shutterstock/videos/1018340053/preview/stock-footage-ventura-california-united-states-a-boy-runs-past-games-and-concession-stands-at.mp4,PT00H00M05S,136151_136200,"Ventura, california / united states - 08 07 2018: a boy runs past games and concession stands at the 2018 ventura county fair."
1020152287,https://ak.picdn.net/shutterstock/videos/1020152287/preview/stock-footage-metrology-calibration-system-of-weights-and-measures-balance-slow-motion.mp4,PT00H00M10S,174651_174700,Metrology calibration system of weights and measures balance slow motion
6374666,https://ak.picdn.net/shutterstock/videos/6374666/preview/stock-footage-beautiful-girl-smelling-a-bouquet-of-yellow-flowers.mp4,PT00H00M13S,108301_108350,Beautiful girl smelling a bouquet of yellow flowers
1029970640,https://ak.picdn.net/shutterstock/videos/1029970640/preview/stock-footage-bitcoin-cryptocurrency-rotating-seamless-loop-golden-crypto-coin-macro-shot.mp4,PT00H00M09S,048801_048850,"Bitcoin cryptocurrency rotating seamless loop. golden crypto coin, macro shot."
1055879033,https://ak.picdn.net/shutterstock/videos/1055879033/preview/stock-footage-slomo-young-athletic-woman-streching-her-muscular-back-on-the-beach.mp4,PT00H00M12S,018101_018150,Slomo: young athletic woman streching her muscular back on the beach
32770579,https://ak.picdn.net/shutterstock/videos/32770579/preview/stock-footage-jakarta-indonesia-november-female-passenger-in-hurry-running-on-a-moving-walkway-in.mp4,PT00H00M10S,170451_170500,"Jakarta, indonesia. november 13, 2017: female passenger in hurry, running on a moving walkway in airport terminal at soekarno-hatta airport, jakarta, indonesia."
6739132,https://ak.picdn.net/shutterstock/videos/6739132/preview/stock-footage-giraffe-eating.mp4,PT00H00M05S,025801_025850,Giraffe eating
1039806326,https://ak.picdn.net/shutterstock/videos/1039806326/preview/stock-footage-feet-of-people-walking-on-a-city-street-slow-motion.mp4,PT00H00M24S,098801_098850,Feet of people walking on a city street. slow motion
8174782,https://ak.picdn.net/shutterstock/videos/8174782/preview/stock-footage-mid-aged-couple-dancing-in-town.mp4,PT00H00M07S,077751_077800,Mid-aged couple dancing in town
1055254859,https://ak.picdn.net/shutterstock/videos/1055254859/preview/stock-footage-super-slow-motion-chef-grilling-fresh-meat-cutlets-for-burgers-on-brazier-with-hot-flame-at-summer.mp4,PT00H00M22S,180751_180800,"Super slow motion: chef grilling fresh meat cutlets for burgers on brazier with hot flame at summer local food market - close up. outdoor cooking, gastronomy, barbecue, cookery, street food concept"
1016276413,https://ak.picdn.net/shutterstock/videos/1016276413/preview/stock-footage-circa-the-apollo-lifts-off.mp4,PT00H01M45S,027701_027750,Circa 1969 - the apollo 9 lifts off.
1059498584,https://ak.picdn.net/shutterstock/videos/1059498584/preview/stock-footage-white-line-location-fishing-icon-isolated-on-black-background-fishing-place-k-video-motion.mp4,PT00H00M10S,083651_083700,White line location fishing icon isolated on black background. fishing place. 4k video motion graphic animation
1060239179,https://ak.picdn.net/shutterstock/videos/1060239179/preview/stock-footage-girl-drinking-coffee-and-using-phone-at-night.mp4,PT00H00M12S,005901_005950,Girl drinking coffee and using phone at night
1022110582,https://ak.picdn.net/shutterstock/videos/1022110582/preview/stock-footage-animation-growth-of-abstract-charts-with-changing-values-of-check-points-on-dark-background.mp4,PT00H00M20S,035151_035200,Animation growth of abstract charts with changing values of check points on dark background. animation of seamless loop.
1013445959,https://ak.picdn.net/shutterstock/videos/1013445959/preview/stock-footage-kyiv-ukraine-february-work-model-on-the-catwalk-during-a-fashion-show-models.mp4,PT00H00M51S,055701_055750,"Kyiv, ukraine – february 5, 2017.  work model on the catwalk during a fashion show. models. fashionable clothing is shown on the catwalk during a fashion show. model. models. slow motion"
