videoid,contentUrl,duration,page_dir,name
1006716490,https://ak.picdn.net/shutterstock/videos/1006716490/preview/stock-footage-aerial-view-of-gwangan-bridge-and-haeundae-beach-with-sunrise-in-the-morning-in-busan-south-korea.mp4,PT00H00M19S,133501_133550,"Aerial view of gwangan bridge and haeundae beach with sunrise in the morning in busan, south korea"
1038475262,https://ak.picdn.net/shutterstock/videos/1038475262/preview/stock-footage-brewery-glass-bottles-of-dark-color-filled-with-beer-with-a-sticker-attached-are-moved-from-the.mp4,PT00H00M09S,176651_176700,"Brewery.  glass bottles of dark color, filled with beer, with a sticker attached are moved from the labeling machine along the conveyor belt. shymkent / kazakhstan - september 21 2019."
1029664898,https://ak.picdn.net/shutterstock/videos/1029664898/preview/stock-footage-portrait-of-young-businesswoman-with-chestnut-hair-gestures-ok-sign-being-satisfied-and-happy-on.mp4,PT00H00M05S,037201_037250,Portrait of young businesswoman with chestnut hair gestures ok sign being satisfied and happy on green background.
1053716060,https://ak.picdn.net/shutterstock/videos/1053716060/preview/stock-footage--k-a-serious-handsome-man-talking-on-his-phone-while-working-on-his-laptop.mp4,PT00H00M29S,039501_039550,4k a serious handsome man talking on his phone while working on his laptop
10043852,https://ak.picdn.net/shutterstock/videos/10043852/preview/stock-footage-aerial-france-mountains-and-low-clouds-strange-low-cloud-below-mountains-in-alpes-maritimes.mp4,PT00H00M14S,126501_126550,Aerial france-mountains and low clouds 2006: strange low cloud below mountains in alpes maritimes
1035516881,https://ak.picdn.net/shutterstock/videos/1035516881/preview/stock-footage-aerial-drone-view-of-a-path-surrounded-by-rice-fields-and-nature.mp4,PT00H00M27S,114701_114750,Aerial drone view of a path surrounded by rice fields and nature
15427636,https://ak.picdn.net/shutterstock/videos/15427636/preview/stock-footage-a-senior-couple-falls-down-on-bed-and-a-man-touches-his-wife-s-beard-they-look-happy-and-relaxed.mp4,PT00H00M25S,063251_063300,A senior couple falls down on bed and a man touches his wife's beard. they look happy and relaxed. close-up shot.
5484005,https://ak.picdn.net/shutterstock/videos/5484005/preview/stock-footage-woman-lies-on-a-couch-in-a-living-room-and-using-digital-tablet.mp4,PT00H00M15S,101751_101800,Woman lies on a couch in a living room and using digital tablet
1053407078,https://ak.picdn.net/shutterstock/videos/1053407078/preview/stock-footage-new-york-may-aerial-moving-toward-highway-at-golden-sunset-in-brooklyn-new-york-city.mp4,PT00H00M23S,030801_030850,"New york - may 28, 2020: aerial moving toward highway at golden sunset in brooklyn new york city nyc."
1047838108,https://ak.picdn.net/shutterstock/videos/1047838108/preview/stock-footage-ella-rock-and-little-adam-s-peak-in-sri-lanka-at-sunrise.mp4,PT00H00M12S,075401_075450,Ella rock and little adam's peak in sri lanka at sunrise
29216674,https://ak.picdn.net/shutterstock/videos/29216674/preview/stock-footage-little-girl-in-yellow-clothes-stands-in-the-water-against-the-background-of-reeds-and-hands-creates.mp4,PT00H00M19S,173251_173300,Little girl in yellow clothes stands in the water against the background of reeds and hands creates water splashes. slow motion.
4870874,https://ak.picdn.net/shutterstock/videos/4870874/preview/stock-footage-the-viviparous-lizard-or-common-lizard-zootoca-vivipara-formerly-lacerta-vivipara-is-a-eurasian.mp4,PT00H00M14S,034651_034700,"The viviparous lizard or common lizard, zootoca vivipara (formerly lacerta vivipara), is a eurasian lizard. "
13665425,https://ak.picdn.net/shutterstock/videos/13665425/preview/stock-footage-paris-france-circa-ice-skating-and-having-fun-time-on-ice-rink-at-paris-christmas-market.mp4,PT00H00M10S,074151_074200,"Paris, france - circa 2015: ice skating and having fun time on ice rink at paris christmas market on famous champs-elysees"
1044825592,https://ak.picdn.net/shutterstock/videos/1044825592/preview/stock-footage-sarajevo-bih-dec-priest-gives-holy-communion-to-resident-during-christmas-midnight-mass.mp4,PT00H00M10S,021101_021150,"Sarajevo, bih, 24 dec 2019: priest gives holy communion to resident during christmas midnight mass in cathedral. altar bread received on the tongue in church. eucharist. communion bread. religion."
1021513627,https://ak.picdn.net/shutterstock/videos/1021513627/preview/stock-footage-attractive-girl-using-laptop-and-talking-by-smartphone-beautiful-smiling-young-woman-talking-by.mp4,PT00H00M19S,020151_020200,Attractive girl using laptop and talking by smartphone. beautiful smiling young woman talking by smartphone and using laptop computer at home. communication concept
3298793,https://ak.picdn.net/shutterstock/videos/3298793/preview/stock-footage-hippos-in-a-sparring-match-of-male-dominance-using-just-their-heads-and-mouths-taken-in-tanzania.mp4,PT00H00M10S,186851_186900,Hippos in a sparring match of male dominance using just their heads and mouths. taken in tanzania africa. video shot with an old camera.
15877657,https://ak.picdn.net/shutterstock/videos/15877657/preview/stock-footage-bali-indonesia-april-tegenungan-waterfall-is-a-beautiful-waterfall-located-in-plateau.mp4,PT00H00M10S,114851_114900,"Bali, indonesia, april, 07, 2016 : tegenungan waterfall is a beautiful waterfall located in plateau area and it is one of places of interest of bali "
1423120,https://ak.picdn.net/shutterstock/videos/1423120/preview/stock-footage-red-amaryllis.mp4,PT00H00M10S,063551_063600,Red amaryllis
1049028463,https://ak.picdn.net/shutterstock/videos/1049028463/preview/stock-footage-mature-businessman-in-formal-wear-sitting-in-modern-dark-office-working-on-computer-and-checking.mp4,PT00H00M27S,026901_026950,Mature businessman in formal wear sitting in modern dark office working on computer and checking email. senior male executive overworking in night office developing project on computer
1066700131,https://ak.picdn.net/shutterstock/videos/1066700131/preview/stock-footage-cinematic-shot-of-master-artisan-luthier-working-on-creation-of-handmade-fine-quality-wood-violin.mp4,PT00H00M21S,000001_000050,"Cinematic shot of master artisan luthier working on creation of handmade fine quality wood violin in creative workshop. concept of spiritual instrument, handmade, art, orchestra, artisan, music."
6862150,https://ak.picdn.net/shutterstock/videos/6862150/preview/stock-footage-koyasan-japan-march-fire-ceremony-in-ekoin-temple-on-march-in-koyasan-japan-mt.mp4,PT00H00M31S,136951_137000,"Koyasan, japan - march 30: fire ceremony in ekoin temple on march 30, 2014 in koyasan, japan. mt. koya is primarily known as the world headquarters of the koyasan shingon sect of japanese buddhism."
26061851,https://ak.picdn.net/shutterstock/videos/26061851/preview/stock-footage-woman-working-with-phone.mp4,PT00H01M00S,072201_072250,Woman working with phone
4616276,https://ak.picdn.net/shutterstock/videos/4616276/preview/stock-footage-sunrise-over-the-ptitsegradsky-pond-sergiev-posad-moscow-region-russia.mp4,PT00H00M48S,109151_109200,Sunrise over the ptitsegradsky pond. sergiev posad. moscow region. russia.
1053838925,https://ak.picdn.net/shutterstock/videos/1053838925/preview/stock-footage-phuket-thailand-november-qatar-airways-boeing-departure-from-phuket-airport-view.mp4,PT00H00M16S,105201_105250,"Phuket, thailand - november 27, 2019: qatar airways boeing 777 departure from phuket airport. view from the top floor of the hotel near airport"
1024961765,https://ak.picdn.net/shutterstock/videos/1024961765/preview/stock-footage-happy-time-while-paining-easter-eggs.mp4,PT00H00M17S,048601_048650,Happy time while paining easter eggs
1988647,https://ak.picdn.net/shutterstock/videos/1988647/preview/stock-footage-novosibirsk-russia-may-the-customs-officer-examines-the-car-behind-a-sign-that-reads-zone.mp4,PT00H00M20S,148501_148550,"Novosibirsk, russia - may 16: the customs officer examines the car behind a sign that reads ""zone of customs control"" on may 16, 2010 in novosibirsk, russia."
13206209,https://ak.picdn.net/shutterstock/videos/13206209/preview/stock-footage-computer-ready-matrix-concept.mp4,PT00H00M12S,007051_007100,Computer ready matrix concept 
1046394871,https://ak.picdn.net/shutterstock/videos/1046394871/preview/stock-footage-portrait-of-beautiful-girl-in-a-swimsuit-is-very-surprised-and-rejoicing-saying-wow-green-screen.mp4,PT00H00M09S,080801_080850,Portrait of beautiful girl in a swimsuit is very surprised and rejoicing saying wow. green screen
12716681,https://ak.picdn.net/shutterstock/videos/12716681/preview/stock-footage-screwing-wooden-parts-while-cat-observing-putting-together-white-sleeping-bed-frame-on-floor-at.mp4,PT00H00M26S,183701_183750,Screwing wooden parts while cat observing. putting together white sleeping bed frame on floor at home. kitten laying beside.
18079339,https://ak.picdn.net/shutterstock/videos/18079339/preview/stock-footage-time-lapse-zoom-busy-casino-traffic-on-the-las-vegas-strip-circa-july.mp4,PT00H00M12S,029551_029600,Time lapse zoom - busy casino & traffic on the las vegas strip - circa july 2016
6784570,https://ak.picdn.net/shutterstock/videos/6784570/preview/stock-footage-a-portrait-of-a-happy-woman-with-white-hat-yellow-rape-field.mp4,PT00H00M29S,003901_003950,"A portrait of a happy woman with white hat, yellow rape field"
4186310,https://ak.picdn.net/shutterstock/videos/4186310/preview/stock-footage-relax-swimming-pool-seaside-of-luxury-hotel.mp4,PT00H00M20S,089151_089200,Relax swimming pool seaside of luxury hotel 
7636687,https://ak.picdn.net/shutterstock/videos/7636687/preview/stock-footage-young-businessman-on-a-rock-overlooking-autumn-forest.mp4,PT00H00M09S,073701_073750,Young businessman on a rock overlooking autumn forest 
1054571318,https://ak.picdn.net/shutterstock/videos/1054571318/preview/stock-footage--k-analog-video-art-multicolor-abstract-shapes-signal-noise-feedback-manipulation.mp4,PT00H00M20S,020151_020200,4k analog video art multicolor abstract shapes & signal noise feedback manipulation
11640269,https://ak.picdn.net/shutterstock/videos/11640269/preview/stock-footage-man-buying-organic-produce.mp4,PT00H00M15S,030151_030200,Man buying organic produce
1053001685,https://ak.picdn.net/shutterstock/videos/1053001685/preview/stock-footage-the-disc-trimming-male-worker-saws-off-a-board-in-the-size.mp4,PT00H00M13S,023751_023800,The disc trimming male worker saws off a board in the size
1010285438,https://ak.picdn.net/shutterstock/videos/1010285438/preview/stock-footage-landscape-of-karatsu-city-in-japan.mp4,PT00H00M18S,174301_174350,Landscape of karatsu city in japan
1009351088,https://ak.picdn.net/shutterstock/videos/1009351088/preview/stock-footage-portrait-of-elderly-woman-looking-at-camera-feeling-tired-sleepy-old-age-fatigue.mp4,PT00H00M24S,113401_113450,Portrait of elderly woman looking at camera feeling tired sleepy old age fatigue
1027483004,https://ak.picdn.net/shutterstock/videos/1027483004/preview/stock-footage-master-is-applying-cream-on-hair-of-brows-of-young-woman-close-up.mp4,PT00H00M15S,052101_052150,"Master is applying cream on hair of brows of young woman, close-up"
1041207814,https://ak.picdn.net/shutterstock/videos/1041207814/preview/stock-footage-montalegre-portugal-pensioner-washing-up.mp4,PT00H00M20S,149651_149700,Montalegre / portugal - 10 12 2018: pensioner washing up
9744203,https://ak.picdn.net/shutterstock/videos/9744203/preview/stock-footage-funny-diving-mask-cartoon-advertising-space-placeholder.mp4,PT00H00M10S,008551_008600,Funny diving mask cartoon advertising space placeholder
26547809,https://ak.picdn.net/shutterstock/videos/26547809/preview/stock-footage-shiny-blue-water-background-pool-water-surface-sparkles-on-the-water-water-in-swimming-pool-with.mp4,PT00H00M16S,147151_147200,"Shiny blue water background, pool water surface, sparkles on the water. water in swimming pool with sunny reflections. glistening aqua loops seamlessly. glistening aqua loops seamlessly. "
1028126924,https://ak.picdn.net/shutterstock/videos/1028126924/preview/stock-footage-angled-wide-shot-of-some-police-tape-outside-a-crime-scene.mp4,PT00H00M21S,056901_056950,"Angled, wide shot of some police tape outside a crime scene."
1050886549,https://ak.picdn.net/shutterstock/videos/1050886549/preview/stock-footage-aerial-day-to-night-drone-hyper-lapse-motion-time-lapse-over-berlin-with-alexanderplatz-tv-tower.mp4,PT00H00M11S,146251_146300,"Aerial: day to night drone hyper lapse, motion time lapse over berlin with alexanderplatz tv tower view and beautiful city lights"
1013840306,https://ak.picdn.net/shutterstock/videos/1013840306/preview/stock-footage-gdynia-poland-july-coast-port-polish-great-attraction-museum-on-the-water-people-walk.mp4,PT00H00M13S,174651_174700,"Gdynia / poland - july 2018: coast port. polish great attraction. museum on the water. people walk on the pier. 4k, uhd, 50p,panning,wide.						"
1017249256,https://ak.picdn.net/shutterstock/videos/1017249256/preview/stock-footage-wedding-flower-decorations-k-video.mp4,PT00H00M08S,141501_141550,Wedding flower decorations / 4k video
1031674460,https://ak.picdn.net/shutterstock/videos/1031674460/preview/stock-footage-mature-businesswoman-enjoying-using-virtual-reality-headset-at-her-workplace.mp4,PT00H00M14S,002801_002850,Mature businesswoman enjoying using virtual reality headset at her workplace
23398384,https://ak.picdn.net/shutterstock/videos/23398384/preview/stock-footage-drone-footage-of-two-people-swimming-on-supboards-in-slowmotion.mp4,PT00H00M20S,177151_177200,Drone footage of two people swimming on supboards in slowmotion
1010816486,https://ak.picdn.net/shutterstock/videos/1010816486/preview/stock-footage--k-timelapse-sequence-of-san-francisco-usa-the-san-francisco-bay-during-the-day.mp4,PT00H00M11S,106051_106100,"4k timelapse sequence of san francisco, usa - the san francisco bay during the day"
1013020568,https://ak.picdn.net/shutterstock/videos/1013020568/preview/stock-footage-frankfurt-am-main-germany-july-air-china-cargo-boeing-b-approaching-before.mp4,PT00H00M16S,179101_179150,"Frankfurt am main, germany - july 20, 2017: air china cargo boeing 777 b-2095 approaching before landing at 25l. fraport, frankfurt, germany"
1007348902,https://ak.picdn.net/shutterstock/videos/1007348902/preview/stock-footage-cosmos-is-genus-with-same-common-name-of-cosmos-consisting-of-flowering-plants-in-sunflower.mp4,PT00H00M08S,000901_000950,"Cosmos is genus, with same common name of cosmos, consisting of flowering plants in sunflower family."
1043675083,https://ak.picdn.net/shutterstock/videos/1043675083/preview/stock-footage-aerial-view-top-copter-drone-shooting-of-a-winter-forest-with-snow-and-green-coniferous-trees.mp4,PT00H00M15S,004001_004050,"Aerial view top copter drone shooting of a winter forest with snow and green coniferous trees, russia"
1038743156,https://ak.picdn.net/shutterstock/videos/1038743156/preview/stock-footage-woman-use-of-mobile-phone-at-sunset-time.mp4,PT00H00M18S,050851_050900,Woman use of mobile phone at sunset time
4073215,https://ak.picdn.net/shutterstock/videos/4073215/preview/stock-footage-defocused-night-traffic-lights-bangkok.mp4,PT00H00M18S,011551_011600,Defocused night traffic lights-bangkok
22391635,https://ak.picdn.net/shutterstock/videos/22391635/preview/stock-footage-man-holding-book-and-doing-serios-look-to-the-camera-in-the-park-steadycam-shot.mp4,PT00H00M16S,187951_188000,"Man holding book and doing serios look to the camera in the park, steadycam shot
"
1056914252,https://ak.picdn.net/shutterstock/videos/1056914252/preview/stock-footage-unidentified-people-at-the-harry-bridges-plaza-in-front-of-the-famous-ferry-building-san-francisco.mp4,PT00H00M13S,020801_020850,"Unidentified people at the harry bridges plaza in front of the famous ferry building, san francisco, california, usa, 2018"
1048634635,https://ak.picdn.net/shutterstock/videos/1048634635/preview/stock-footage-very-high-drone-shot-of-a-small-village-covered-in-snow-in-the-north-of-sweden-during-winter.mp4,PT00H00M15S,011051_011100,Very high drone shot of a small village covered in snow in the north of sweden during winter.
1051559041,https://ak.picdn.net/shutterstock/videos/1051559041/preview/stock-footage-girl-in-sports-clothes-sitting-in-the-lotus-position-and-making-the-head-tilts.mp4,PT00H00M09S,149551_149600,Girl in sports clothes sitting in the lotus position and making the head tilts
1046649424,https://ak.picdn.net/shutterstock/videos/1046649424/preview/stock-footage-cheerful-woman-funny-dancing-in-the-kitchen-and-smiling-carefree.mp4,PT00H00M11S,089601_089650,Cheerful woman funny dancing in the kitchen and smiling carefree
7762060,https://ak.picdn.net/shutterstock/videos/7762060/preview/stock-footage-minor-stables-street-saint-petersburg-time-lapse.mp4,PT00H00M09S,137751_137800,Minor stables street saint petersburg time lapse
11436797,https://ak.picdn.net/shutterstock/videos/11436797/preview/stock-footage-artistic-background.mp4,PT00H00M20S,025551_025600,Artistic background
29118298,https://ak.picdn.net/shutterstock/videos/29118298/preview/stock-footage-clouds-time-lapse.mp4,PT00H00M12S,030851_030900,Clouds time lapse 
1045765765,https://ak.picdn.net/shutterstock/videos/1045765765/preview/stock-footage-a-baby-in-a-bib-is-being-fed-by-it-s-mother-with-a-spoon-the-newborn-is-having-a-meal-in-a-chair.mp4,PT00H00M16S,037751_037800,A baby in a bib is being fed by it’s mother with a spoon. the newborn is having a meal in a chair for feeding with food remains on it’s mouth. the older sister is helping mother to feed the sister.
25197584,https://ak.picdn.net/shutterstock/videos/25197584/preview/stock-footage-water-flowing-through-the-ground-etreme-close-up-cross-cut-glass-view.mp4,PT00H00M05S,196251_196300,Water flowing through the ground etreme close up cross-cut glass view
199795,https://ak.picdn.net/shutterstock/videos/199795/preview/stock-footage-green-meadow-under-clouds.mp4,PT00H00M08S,090101_090150,Green meadow under clouds
1032043484,https://ak.picdn.net/shutterstock/videos/1032043484/preview/stock-footage-kuala-lumpur-malaysia-may-timelapse-shot-of-the-kuala-lumpur-downtown-area-with-a-big.mp4,PT00H00M29S,189951_190000,"Kuala lumpur, malaysia 2 may 2018 :timelapse shot of the kuala lumpur downtown area with a big construction site"
4626446,https://ak.picdn.net/shutterstock/videos/4626446/preview/stock-footage-money-bill-euro-diagonal-spinning-d-particle-loop-alpha-channel.mp4,PT00H00M12S,137051_137100,Money bill - 50 euro - diagonal spinning - 3d particle loop - alpha channel
14825620,https://ak.picdn.net/shutterstock/videos/14825620/preview/stock-footage-old-orthodox-monastery-on-mountain-peak-misty-stone-building-standing-on-hill.mp4,PT00H00M11S,068751_068800,Old orthodox monastery on mountain peak. misty stone building standing on hill
1013515013,https://ak.picdn.net/shutterstock/videos/1013515013/preview/stock-footage-drinking-red-wine-from-table-shallow-depth-of-field.mp4,PT00H00M11S,172551_172600,Drinking red wine from table shallow depth of field
9211889,https://ak.picdn.net/shutterstock/videos/9211889/preview/stock-footage-finger-pressing-internet-www-key-on-retro-style-beige-keyboard-close-up-panning-k-x-uhd.mp4,PT00H00M07S,058301_058350,Finger pressing internet www key on retro style beige keyboard close up panning 4k 3840x2160 uhd footage - pressing www key on old beige white keyboard close-up 4k 2160p uhd video
14090288,https://ak.picdn.net/shutterstock/videos/14090288/preview/stock-footage-polar-bear-scratching-his-belly.mp4,PT00H00M09S,184751_184800,Polar bear scratching his belly
1026908189,https://ak.picdn.net/shutterstock/videos/1026908189/preview/stock-footage-reticulated-python-python-reticulatus-snake-on-vet-table-veterinary-service-for-wildlife-animals.mp4,PT00H00M10S,079401_079450,Reticulated python (python reticulatus) snake on vet table. veterinary service for wildlife animals
24910835,https://ak.picdn.net/shutterstock/videos/24910835/preview/stock-footage-point-of-view-shot-of-woman-doing-laundry-in-home-interior-closeup-of-female-hands-yellow-plastic.mp4,PT00H01M01S,025451_025500,"Point of view shot of woman doing laundry in home interior. closeup of female hands, yellow plastic basin and t-shirt. water becomes bright red color because of paint from clothes of bad quality."
1048398031,https://ak.picdn.net/shutterstock/videos/1048398031/preview/stock-footage-zebra-standing-in-savanna-clearing-in-kruger-national-park-south-africa.mp4,PT00H00M08S,063301_063350,Zebra standing in savanna clearing in kruger national park south africa
7631626,https://ak.picdn.net/shutterstock/videos/7631626/preview/stock-footage-retro-dots-background-loop.mp4,PT00H00M08S,192051_192100,Retro dots background loop
1020382633,https://ak.picdn.net/shutterstock/videos/1020382633/preview/stock-footage-wickede-germany-czech-republic-january-video-of-a-forklift-moving-a-large.mp4,PT00H00M08S,102151_102200,"Wickede, germany - 01 23 2017: czech republic, january 2017 - video of a forklift moving a large pile of metal beds in a factory"
1042094752,https://ak.picdn.net/shutterstock/videos/1042094752/preview/stock-footage-aerial-view-on-ocean-coast-near-palm-cove-early-in-the-morning-before-sunrise-in-cairns-queensland.mp4,PT00H00M15S,036051_036100,"Aerial view on ocean coast near palm cove early in the morning before sunrise in cairns, queensland, australia"
1018943692,https://ak.picdn.net/shutterstock/videos/1018943692/preview/stock-footage-panorama-wawel-castle-is-the-main-attraction-of-krakow-poland.mp4,PT00H00M14S,045401_045450,"Panorama wawel castle is the main attraction of krakow, poland"
1037957708,https://ak.picdn.net/shutterstock/videos/1037957708/preview/stock-footage-animation-of-a-metallic-d-brain-revolving-with-a-computer-circuit-board-with-green-light-trails.mp4,PT00H00M09S,088401_088450,Animation of a metallic 3d brain revolving with a computer circuit board with green light trails moving through it in the background
1027367597,https://ak.picdn.net/shutterstock/videos/1027367597/preview/stock-footage-torres-vedras-lisbon-portugal-guy-passing-with-bicycles-in-the-nature.mp4,PT00H00M10S,198751_198800,Torres vedras/lisbon/portugal - 02/02/2019: guy passing with bicycles in the nature
1047557029,https://ak.picdn.net/shutterstock/videos/1047557029/preview/stock-footage-wooden-rural-balcony-of-a-modern-countryside-house-brown-facade-with-windows.mp4,PT00H00M19S,135951_136000,Wooden rural balcony of a modern countryside house. brown facade with windows.
4790897,https://ak.picdn.net/shutterstock/videos/4790897/preview/stock-footage-muscular-man-in-the-lights.mp4,PT00H00M12S,067651_067700,Muscular man in the lights
1006847146,https://ak.picdn.net/shutterstock/videos/1006847146/preview/stock-footage-bangkok-january-view-of-chao-phraya-river-with-boats-leaving-and-arriving-at-pier-k.mp4,PT00H00M24S,049351_049400,Bangkok - january 2018: view of chao phraya river with boats leaving and arriving at pier. 4k resolution
3786185,https://ak.picdn.net/shutterstock/videos/3786185/preview/stock-footage-young-man-doing-weightlifting-at-home-close-up-of-his-muscles-while-lifting-high-quality.mp4,PT00H00M17S,070851_070900,Young man doing weightlifting at home. close-up of his muscles while lifting. high quality.
22599118,https://ak.picdn.net/shutterstock/videos/22599118/preview/stock-footage-photography-blog-animated-word-cloud.mp4,PT00H00M15S,188201_188250,Photography blog animated word cloud.
31636918,https://ak.picdn.net/shutterstock/videos/31636918/preview/stock-footage-black-winged-stilt-himantopus-himantopus-ungraded-footage.mp4,PT00H00M37S,149701_149750,Black-winged stilt (himantopus himantopus) - ungraded footage
1909480,https://ak.picdn.net/shutterstock/videos/1909480/preview/stock-footage-barbados.mp4,PT00H00M20S,108751_108800,Barbados
12509219,https://ak.picdn.net/shutterstock/videos/12509219/preview/stock-footage-ignition-of-the-gas-stove-burner.mp4,PT00H00M10S,108551_108600,Ignition of the gas stove burner
1013704301,https://ak.picdn.net/shutterstock/videos/1013704301/preview/stock-footage-taro-was-cutting-on-wood-surface.mp4,PT00H00M32S,197701_197750,Taro was cutting on wood surface 
24487478,https://ak.picdn.net/shutterstock/videos/24487478/preview/stock-footage-explosion-with-flaming-comets-spinning-toward-camera.mp4,PT00H00M11S,005651_005700,Explosion with flaming comets spinning toward camera
1029199712,https://ak.picdn.net/shutterstock/videos/1029199712/preview/stock-footage-west-loop-chicago-may-day-time-lapse-of-city-skyline-and-elevated-train-traffic-on-lake.mp4,PT00H00M10S,016501_016550,"West loop, chicago-may 5, 2019: day time lapse of city skyline and elevated train traffic on lake street and interstate 90/94. urban architecture and transportation with motion."
24342500,https://ak.picdn.net/shutterstock/videos/24342500/preview/stock-footage-back-view-of-a-blondie-talking-to-boyfriend-in-romantic-atmosphere.mp4,PT00H00M27S,017551_017600,Back view of a blondie talking to boyfriend in romantic atmosphere
21642868,https://ak.picdn.net/shutterstock/videos/21642868/preview/stock-footage-welder-at-work-in-factory.mp4,PT00H00M18S,139251_139300,Welder at work in factory
1040318981,https://ak.picdn.net/shutterstock/videos/1040318981/preview/stock-footage-butterfly-nectar-from-flowers-in-the-garden-nature-concept.mp4,PT00H00M21S,059501_059550,"Butterfly nectar from flowers in the garden, nature concept."
17249932,https://ak.picdn.net/shutterstock/videos/17249932/preview/stock-footage-istanbul-turkey-june-industrial-museum-rahmi-koc-istanbul-presents-a-collection-of.mp4,PT00H00M16S,012901_012950,"Istanbul, turkey - 5  june , 2016: industrial museum rahmi koc istanbul presents a collection of achievements of the world industry"
