videoid,contentUrl,duration,page_dir,name
1048693204,https://ak.picdn.net/shutterstock/videos/1048693204/preview/stock-footage-zinnia-flowers-and-butterflies-butterflies-perch-on-pink-zinnia-flowers-in-a-sunny-summer-garden.mp4,PT00H00M08S,058051_058100,"Zinnia flowers and butterflies, butterflies perch on pink zinnia flowers in a sunny summer garden. the life of a butterfly in finding honey. these beautiful brown butterflies forage in zinnia flowers."
1035104633,https://ak.picdn.net/shutterstock/videos/1035104633/preview/stock-footage-aerial-view-of-sunrise-on-beyoglu-taksim-galata-tower-and-galata-bridge-in-istanbul-city.mp4,PT00H00M10S,044701_044750,"Aerial view of sunrise on beyoglu, taksim, galata tower and galata bridge in istanbul city. historic peninsula and istanbul bosphorus landscape. 4k footage in turkey. "
13734911,https://ak.picdn.net/shutterstock/videos/13734911/preview/stock-footage-many-black-crows-flies-over-head.mp4,PT00H00M24S,080601_080650,Many black crows flies over head
1015672075,https://ak.picdn.net/shutterstock/videos/1015672075/preview/stock-footage-women-s-hands-clinging-to-the-forged-head-of-the-bed-forged-beds-details-k-slow-motion.mp4,PT00H00M16S,107451_107500,"Women's hands clinging to the forged head of the bed. forged beds, details. 4k, slow motion."
1028263010,https://ak.picdn.net/shutterstock/videos/1028263010/preview/stock-footage-beautiful-eight-month-old-baby-girl-with-red-hair-who-looks-directly-into-the-camera-and-smiles.mp4,PT00H00M08S,193051_193100,Beautiful eight-month-old baby girl with red hair who looks directly into the camera and smiles
1026945044,https://ak.picdn.net/shutterstock/videos/1026945044/preview/stock-footage-flying-over-a-small-tree-plantation.mp4,PT00H00M43S,069151_069200,Flying over a small tree plantation 
10326761,https://ak.picdn.net/shutterstock/videos/10326761/preview/stock-footage-little-young-girl-walk-at-pond-slow-motion.mp4,PT00H00M27S,064701_064750,"Little young girl walk at pond, slow motion"
18730064,https://ak.picdn.net/shutterstock/videos/18730064/preview/stock-footage-static-big-leafy-tree-in-the-wind.mp4,PT00H00M05S,122851_122900,Static big leafy tree in the wind.
25607291,https://ak.picdn.net/shutterstock/videos/25607291/preview/stock-footage-young-athlete-running-around-the-lake-colorful-autumn-nature.mp4,PT00H00M17S,110601_110650,"Young athlete running around the lake, colorful autumn nature"
1051220497,https://ak.picdn.net/shutterstock/videos/1051220497/preview/stock-footage-miami-beach-fl-march-th-drone-flying-over-empty-beach-with-cruise-ships-idled-by-covid.mp4,PT00H00M16S,054501_054550,"Miami beach, fl march 27th 2020 - drone flying over empty beach with 6 cruise ships idled by covid-19 crisis parked offshore."
13255046,https://ak.picdn.net/shutterstock/videos/13255046/preview/stock-footage-young-couple-eating-chinese-meal-next-to-cardboard-box.mp4,PT00H00M12S,082051_082100,Young couple eating chinese meal next to cardboard box
1053080309,https://ak.picdn.net/shutterstock/videos/1053080309/preview/stock-footage-unique-design-of-abstract-colorful-moving-striped-surface.mp4,PT00H00M17S,064651_064700,Unique design of abstract colorful moving striped surface
5191373,https://ak.picdn.net/shutterstock/videos/5191373/preview/stock-footage-falling-of-the-coin.mp4,PT00H00M16S,071951_072000,Falling of the coin
1044314416,https://ak.picdn.net/shutterstock/videos/1044314416/preview/stock-footage-naughty-little-girl-running-through-park-tree-alley-in-front-of-camera-handheld-steadycam-flycam.mp4,PT00H00M12S,032351_032400,Naughty little girl running through park tree alley in front of camera. handheld steadycam flycam movement front shot
9235046,https://ak.picdn.net/shutterstock/videos/9235046/preview/stock-footage-cute-little-baby-girl-standing-on-the-bed-and-laughing-fullhd-video.mp4,PT00H00M11S,190401_190450,Cute little baby girl standing on the bed and laughing. fullhd video
2051723,https://ak.picdn.net/shutterstock/videos/2051723/preview/stock-footage-water-drops-flow-down-quickly.mp4,PT00H00M13S,052201_052250,Water drops flow down quickly
3799361,https://ak.picdn.net/shutterstock/videos/3799361/preview/stock-footage-medical-monitor.mp4,PT00H00M23S,027751_027800,Medical monitor
1010423726,https://ak.picdn.net/shutterstock/videos/1010423726/preview/stock-footage-water-flow-at-the-beach.mp4,PT00H00M32S,009101_009150,Water flow at the beach
1015860916,https://ak.picdn.net/shutterstock/videos/1015860916/preview/stock-footage-white-particles-move-slowly-against-a-black-background-d-rendering.mp4,PT00H00M30S,033501_033550,White particles move slowly against a black background. 3d rendering
1021722835,https://ak.picdn.net/shutterstock/videos/1021722835/preview/stock-footage-half-length-portrait-of-caucasian-male-basketball-player-posing-with-a-ball-indoors-k-uhd.mp4,PT00H00M10S,032851_032900,Half length portrait of caucasian male basketball player posing with a ball indoors. 4k uhd
1009215824,https://ak.picdn.net/shutterstock/videos/1009215824/preview/stock-footage-pier-in-naples-by-aerial-drone.mp4,PT00H00M13S,196801_196850,Pier in naples by aerial drone
26295290,https://ak.picdn.net/shutterstock/videos/26295290/preview/stock-footage-kiev-ukraine-october-kickboxing-the-boys-kick-boxers-fight-in-the-ring-slow-motion.mp4,PT00H00M47S,049151_049200,"Kiev, ukraine - october 5, 2015. kickboxing. the boys kick boxers fight in the ring . slow motion"
1025671826,https://ak.picdn.net/shutterstock/videos/1025671826/preview/stock-footage-slow-motion-scene-of-the-waves-in-the-river-with-the-glittering-sunshine-on-the-surface-of-river.mp4,PT00H00M11S,043701_043750,Slow motion scene of the waves in the river with the glittering sunshine on the surface of river
1042074004,https://ak.picdn.net/shutterstock/videos/1042074004/preview/stock-footage-cu-professional-designer-pours-eyelet-details-on-hand-against-green-cutting-board-in-workshop.mp4,PT00H00M06S,147051_147100,Cu: professional designer pours eyelet details on hand against green cutting board in workshop extreme close view
15265279,https://ak.picdn.net/shutterstock/videos/15265279/preview/stock-footage-manual-coffee-bean-processing-beans-drying-in-costa-rica.mp4,PT00H00M07S,107351_107400,Manual coffee bean processing; beans drying in costa rica
1017013684,https://ak.picdn.net/shutterstock/videos/1017013684/preview/stock-footage-blue-rhinoceros-beetle-lifting-a-shoe-in-french-guiana-amazonian-forest.mp4,PT00H00M15S,188851_188900,Blue rhinoceros beetle lifting a shoe in french guiana amazonian forest
19588237,https://ak.picdn.net/shutterstock/videos/19588237/preview/stock-footage-grey-liquid-flows-from-above-and-fills-the-screen-colored-paint.mp4,PT00H00M21S,194901_194950,Grey liquid flows from above and fills the screen. colored paint
7817734,https://ak.picdn.net/shutterstock/videos/7817734/preview/stock-footage-yacht-sails-on-the-sea.mp4,PT00H00M07S,059201_059250,Yacht sails on the sea
1063150918,https://ak.picdn.net/shutterstock/videos/1063150918/preview/stock-footage-tight-shot-of-snow-on-a-pine-tree.mp4,PT00H00M08S,122951_123000,Tight shot of snow on a pine tree
1026573101,https://ak.picdn.net/shutterstock/videos/1026573101/preview/stock-footage-sunset-and-rape-blossom-field-iiyama-city-nagano-prefecture-japan.mp4,PT00H00M15S,122051_122100,"Sunset and rape blossom field, iiyama city, nagano prefecture, japan
"
1012117313,https://ak.picdn.net/shutterstock/videos/1012117313/preview/stock-footage-athens-aerial-downtown-buildings-apartment-blocks-rooftops-tight-overly-populated-concrete.mp4,PT00H00M34S,067801_067850,"Athens aerial, downtown buildings,apartment blocks,rooftops.tight overly populated concrete building blocks, of typical downtown neighbourhoods streets and traffic near the center of athens greece."
1022321200,https://ak.picdn.net/shutterstock/videos/1022321200/preview/stock-footage-drone-fly-through-of-winter-wonderland-stillness-covered-in-fresh-snow.mp4,PT00H00M40S,195801_195850,"Drone fly through of winter wonderland stillness covered in fresh snow.
"
1023151630,https://ak.picdn.net/shutterstock/videos/1023151630/preview/stock-footage-portrait-of-asian-farmer-woman-holding-flower-petals-on-a-field-balinese-people-using-colorful.mp4,PT00H00M06S,130901_130950,"Portrait of asian farmer woman holding flower petals on a field. balinese people using colorful petals for traditional hindu offering ceremony. 4k. 26 jan 2019 - bali, indonesia."
1040819924,https://ak.picdn.net/shutterstock/videos/1040819924/preview/stock-footage-grapes-a-lot-of-ripe-grapes-close-up-the-texture-of-the-berries-as-a-background-winery-italy.mp4,PT00H00M09S,198851_198900,Grapes a lot of ripe grapes close-up. the texture of the berries as a background. winery italy grape variety wine production. grape sort.
24170323,https://ak.picdn.net/shutterstock/videos/24170323/preview/stock-footage-budapest-beautiful-view-of-the-buda-part-of-the-city-in-a-bright-winter-day.mp4,PT00H00M19S,031351_031400,Budapest. beautiful view of the buda part of the city in a bright winter day
22479808,https://ak.picdn.net/shutterstock/videos/22479808/preview/stock-footage-finished-milk-product-at-production-line.mp4,PT00H00M18S,031801_031850,Finished milk product at production line
1045539523,https://ak.picdn.net/shutterstock/videos/1045539523/preview/stock-footage-dry-plant-on-a-meadow-is-covered-by-frosty-hoarfrost-snow-falling-weather-in-winter-frozen-ice.mp4,PT00H00M10S,181451_181500,Dry plant on a meadow is covered by frosty hoarfrost. snow falling weather in winter. frozen ice crystals
1010469938,https://ak.picdn.net/shutterstock/videos/1010469938/preview/stock-footage-game-over-words-from-retro-computer-arcade-with-hand-holding-a-joystick-in-the-foreground.mp4,PT00H00M07S,095151_095200,Game over words from retro computer arcade with hand holding a joystick in the foreground
13896512,https://ak.picdn.net/shutterstock/videos/13896512/preview/stock-footage-england-united-kingdom-august-despite-steam-trains-officially-ceasing-to-be-used-for.mp4,PT00H00M10S,026101_026150,"England, united kingdom august 16, 2015. despite steam trains officially ceasing to be used for commuter passengers in the 1960’s. over quarter of a million people a year use them in the uk."
1034399360,https://ak.picdn.net/shutterstock/videos/1034399360/preview/stock-footage-bilecik-turkey-september-two-rock-climbers-hiking-in-the-forest.mp4,PT00H00M05S,062551_062600,"Bilecik / turkey - september 25, 2016: two rock climbers hiking in the forest"
18087325,https://ak.picdn.net/shutterstock/videos/18087325/preview/stock-footage-oatmeal-on-a-green-background-slow-motion-close-up-horizontal-pan-shots.mp4,PT00H00M29S,080801_080850,Oatmeal on a green background. slow motion. close-up. horizontal pan. 2 shots
10638926,https://ak.picdn.net/shutterstock/videos/10638926/preview/stock-footage-great-barracuda-in-blue-water-with-surgeonfish.mp4,PT00H00M12S,108651_108700,Great barracuda in blue water with surgeonfish
8928787,https://ak.picdn.net/shutterstock/videos/8928787/preview/stock-footage-little-girl-with-enthusiasm-reading-book.mp4,PT00H00M22S,129851_129900,Little girl with enthusiasm reading book
1027460519,https://ak.picdn.net/shutterstock/videos/1027460519/preview/stock-footage-aerial-view-on-a-fortress-in-russia-oreshek-old-historic-castle-on-an-island-in-saint-petersburg.mp4,PT00H00M38S,174851_174900,"Aerial view on a fortress in russia, oreshek, old historic castle on an island in saint-petersburg"
1046886400,https://ak.picdn.net/shutterstock/videos/1046886400/preview/stock-footage-side-view-of-a-mixed-race-businesswoman-working-late-in-a-modern-office-sitting-at-her-desk.mp4,PT00H00M09S,175451_175500,"Side view of a mixed race businesswoman working late in a modern office, sitting at her desk looking at computer screen, eating takeaway food social distancing"
1062484249,https://ak.picdn.net/shutterstock/videos/1062484249/preview/stock-footage-continuous-line-drawing-of-guitar.mp4,PT00H00M12S,024551_024600,Continuous line drawing of guitar
32353120,https://ak.picdn.net/shutterstock/videos/32353120/preview/stock-footage-particle-background-loop-animation.mp4,PT00H00M10S,015801_015850,Particle background. loop animation
5310134,https://ak.picdn.net/shutterstock/videos/5310134/preview/stock-footage-timecode-rewind-work-of-director.mp4,PT00H00M40S,171751_171800,Timecode (rewind). work of director
16649428,https://ak.picdn.net/shutterstock/videos/16649428/preview/stock-footage-warsaw-poland-september-timelapse-castle-square-in-warsaw-is-a-historic-square-in.mp4,PT00H00M16S,144551_144600,"Warsaw, poland - september 29 2015: timelapse: castle square in warsaw is a historic square in front of royal castle â?? the former official residence of polish monarchs â?? located in warsaw, poland."
1013418125,https://ak.picdn.net/shutterstock/videos/1013418125/preview/stock-footage-montreal-canada-july-downtown-skyline-during-summer-night-from-the-south.mp4,PT00H00M38S,176901_176950,"Montreal, canada - july 2018: downtown skyline during summer night from the south"
1055715596,https://ak.picdn.net/shutterstock/videos/1055715596/preview/stock-footage-a-cloud-of-pink-and-blue-particles-moving-on-black-background-vj-tech-vlogger-and-abstract-motion.mp4,PT00H00M35S,174701_174750,"A cloud of pink and blue particles moving on black background. vj, tech vlogger and abstract motion art concepts."
24495092,https://ak.picdn.net/shutterstock/videos/24495092/preview/stock-footage-young-beautiful-woman-student-posing-and-smiling-read-book-at-cafe-indoors.mp4,PT00H00M19S,198501_198550,Young beautiful woman student posing and smiling read book at cafe indoors
1041740557,https://ak.picdn.net/shutterstock/videos/1041740557/preview/stock-footage-steam-smoke-on-black-background-white-steam-rises-smoke-cloud-close-up-of-steam-smoke-on-black.mp4,PT00H00M30S,035901_035950,"Steam smoke on black background. white steam rises  smoke cloud. close up of steam smoke on black background. white steam rises. fog clouds, smoky mist and realistic cloudy effect. "
23957722,https://ak.picdn.net/shutterstock/videos/23957722/preview/stock-footage-bulbul-on-branch-in-nature.mp4,PT00H00M22S,192601_192650,Bulbul on branch in nature
1017197425,https://ak.picdn.net/shutterstock/videos/1017197425/preview/stock-footage-businessman-walking-towards-camera-with-friend-country-flags-pin-russia-tanzania.mp4,PT00H00M10S,024501_024550,Businessman walking towards camera with friend country flags pin russia - tanzania
3088783,https://ak.picdn.net/shutterstock/videos/3088783/preview/stock-footage-cutting-craft-description-hair-stylist-cutting-woman-s-hair.mp4,PT00H00M13S,183901_183950,"Cutting craft

description: hair stylist cutting woman`s hair. 

"
5892062,https://ak.picdn.net/shutterstock/videos/5892062/preview/stock-footage-bride-and-groom-standing-near-coast.mp4,PT00H00M06S,102501_102550,Bride and groom standing near coast
1059849113,https://ak.picdn.net/shutterstock/videos/1059849113/preview/stock-footage-caucasian-woman-spending-time-at-home-sitting-in-kitchen-with-birthday-cake-social-distancing.mp4,PT00H00M14S,034401_034450,"Caucasian woman spending time at home, sitting in kitchen with birthday cake. social distancing
during covid 19 coronavirus quarantine, slow motion."
24594944,https://ak.picdn.net/shutterstock/videos/24594944/preview/stock-footage-dolly-close-up-push-out-view-of-an-assortment-of-french-and-british-cheese.mp4,PT00H00M18S,172301_172350,Dolly close up push out view of an assortment of french and british cheese
24895082,https://ak.picdn.net/shutterstock/videos/24895082/preview/stock-footage-north-slope-aibga-ridge-of-the-western-caucasus-at-rosa-khutor-alpine-resort-stock-footage-video.mp4,PT00H00M18S,142301_142350,North slope aibga ridge of the western caucasus at rosa khutor alpine resort stock footage video
1044802354,https://ak.picdn.net/shutterstock/videos/1044802354/preview/stock-footage-kenya-monkeys-are-doing-something-in-a-grassland-area-and-a-bird-is-on-a-tree.mp4,PT00H00M05S,070301_070350,Kenya-1983: monkeys are doing something in a grassland area and a bird is on a tree
1037196230,https://ak.picdn.net/shutterstock/videos/1037196230/preview/stock-footage-old-building-with-large-windows-in-the-old-courtyard.mp4,PT00H00M08S,197201_197250,Old building with large windows in the old courtyard.
1015651969,https://ak.picdn.net/shutterstock/videos/1015651969/preview/stock-footage-concrete-walkway-in-forest.mp4,PT00H00M14S,019901_019950,Concrete walkway in forest 
1030257368,https://ak.picdn.net/shutterstock/videos/1030257368/preview/stock-footage-beautiful-young-woman-taking-a-picture-of-her-breakfast-on-smartphone.mp4,PT00H00M13S,031851_031900,Beautiful young woman taking a picture of her breakfast on smartphone
10346915,https://ak.picdn.net/shutterstock/videos/10346915/preview/stock-footage-industrial-robotic-laser-cutter-cuts-metal-parts-with-great-precision.mp4,PT00H00M06S,172651_172700,Industrial robotic laser cutter cuts metal parts with great precision
1028229977,https://ak.picdn.net/shutterstock/videos/1028229977/preview/stock-footage-bicycles-on-the-bridge-in-front-of-the-main-cathedral-of-berlin.mp4,PT00H00M14S,182351_182400,Bicycles on the bridge in front of the main cathedral of berlin.
16868380,https://ak.picdn.net/shutterstock/videos/16868380/preview/stock-footage-engineers-working-on-project-in-metallurgy-manufacture.mp4,PT00H00M16S,046301_046350,Engineers working on project in metallurgy manufacture
1055731205,https://ak.picdn.net/shutterstock/videos/1055731205/preview/stock-footage-portrait-of-young-smiling-woman-sitting-on-bike-with-flowers-in-basket-and-looking-away-charming.mp4,PT00H00M06S,148551_148600,"Portrait of young smiling woman sitting on bike with flowers in basket and looking away. charming caucasian girl resting in park or forest on sunny summer day at sunset. lifestyle, leisure, joy."
1028167895,https://ak.picdn.net/shutterstock/videos/1028167895/preview/stock-footage-directly-above-view-of-young-male-face-having-professional-massage.mp4,PT00H00M21S,066001_066050,Directly above view of young male face having professional massage
6545195,https://ak.picdn.net/shutterstock/videos/6545195/preview/stock-footage-gaming-console-hand-detail-pushing-the-eject-button-putting-disk-in-tray-side.mp4,PT00H00M09S,133201_133250,"Gaming console hand detail pushing the eject button putting disk in tray, side"
1023310750,https://ak.picdn.net/shutterstock/videos/1023310750/preview/stock-footage-happy-couple-taking-a-picture-of-themselves.mp4,PT00H00M36S,107351_107400,Happy couple taking a picture of themselves
5244863,https://ak.picdn.net/shutterstock/videos/5244863/preview/stock-footage-glass-blowing-the-process-of-fine-art.mp4,PT00H00M14S,180601_180650,Glass blowing the process of fine art 8
1023975710,https://ak.picdn.net/shutterstock/videos/1023975710/preview/stock-footage-close-up-of-man-playing-the-tabla-drum.mp4,PT00H00M13S,182251_182300,Close-up of man playing the tabla drum
1045011550,https://ak.picdn.net/shutterstock/videos/1045011550/preview/stock-footage-aerial-rising-drone-shot-towards-the-snowy-rukatunturi-fell-overlooking-people-skiing-on-the.mp4,PT00H00M27S,144451_144500,"Aerial, rising, drone shot, towards the snowy rukatunturi fell, overlooking people skiing on the slopes, on a winter evening, in ruka, lapland, finland"
1054702679,https://ak.picdn.net/shutterstock/videos/1054702679/preview/stock-footage--mature-woman-in-a-gray-sweater-in-a-mask-works-at-home-in-quarantine-portrait-of-quarantined.mp4,PT00H00M17S,128201_128250, mature woman in a gray sweater in a mask works at home in quarantine. portrait of quarantined adult woman in mask working on laptop at home. stay at home. quarantine. close-up.
1057714987,https://ak.picdn.net/shutterstock/videos/1057714987/preview/stock-footage-golden-sunrise-early-morning-in-countryside-summer-meadow-beautiful-moody-rural-natural-k-video.mp4,PT00H00M11S,096451_096500,Golden sunrise early morning in countryside summer meadow. beautiful moody rural natural 4k video background. wild grass and flowers covered with morning dew drops sparkling in soft magic sunlight.
2656748,https://ak.picdn.net/shutterstock/videos/2656748/preview/stock-footage-vinnitsa-ukraine-september-people-walk-on-the-embankment-at-opening-of-the-fountain.mp4,PT00H00M10S,013951_014000,"Vinnitsa, ukraine - september 9, 2011: 
people walk on the embankment  at opening of the fountain in vinnitsa 5,09,2011"
1037561240,https://ak.picdn.net/shutterstock/videos/1037561240/preview/stock-footage-aerial-view-of-genoa-skyline-italy-lantern-landmark-liguria-old-town-cityscape-hyperlapse.mp4,PT00H00M05S,006301_006350,"Aerial view of genoa skyline, italy, lantern landmark, liguria, old town cityscape hyperlapse"
22714126,https://ak.picdn.net/shutterstock/videos/22714126/preview/stock-footage-cincinnati-ohio-circa-skyline-chili-sign-located-in-cincinnati-ohio-which-is-the.mp4,PT00H00M16S,062251_062300,"Cincinnati, ohio - circa 2014: skyline chili sign located in cincinnati, ohio, which is the originating location of the fast food/sit down restaurant."
3606623,https://ak.picdn.net/shutterstock/videos/3606623/preview/stock-footage-istanbul-march-shopping-arcade-with-spices-and-oriental-stuffs-in-spice-bazaar-on-march.mp4,PT00H00M11S,114801_114850,"Istanbul-march 17: shopping arcade with spices and oriental stuffs in spice bazaar on march 17, 2013 in istanbul, turkey. spice bazaar is the oldest bazaar in istanbul."
1021987999,https://ak.picdn.net/shutterstock/videos/1021987999/preview/stock-footage-vj-d-dark-pattern.mp4,PT00H00M08S,191901_191950,Vj 3d dark pattern
1039362818,https://ak.picdn.net/shutterstock/videos/1039362818/preview/stock-footage-confectioner-makes-a-layers-cake-in-a-pastry-ring.mp4,PT00H00M12S,068801_068850,Confectioner makes a layers cake in a pastry ring.
1050246772,https://ak.picdn.net/shutterstock/videos/1050246772/preview/stock-footage-distinct-imprint-of-snowmobile-endless-track-pattern-path-into-the-distance-on-clean-snow-field.mp4,PT00H00M40S,019001_019050,Distinct imprint of snowmobile / endless track pattern path into the distance on clean snow field on small mount at winter sunny frozen day - aerial top down view
18998251,https://ak.picdn.net/shutterstock/videos/18998251/preview/stock-footage-small-children-with-mother-pet-a-puppy.mp4,PT00H00M21S,022851_022900,Small children with mother pet a puppy
1011616043,https://ak.picdn.net/shutterstock/videos/1011616043/preview/stock-footage-lockdown-wide-lisbon-city-view-from-old-castle.mp4,PT00H00M08S,186501_186550,Lockdown: wide lisbon city view from old castle
1043856091,https://ak.picdn.net/shutterstock/videos/1043856091/preview/stock-footage-upset-girl-crying-and-walking-on-snow-covered-street-sad-teenage-girl-in-knitted-hat-scarf-and.mp4,PT00H00M14S,196651_196700,"Upset girl crying and walking on snow-covered street. sad teenage girl in knitted hat, scarf and winter jacket crying and walking on pathway in city at wintertime"
28601566,https://ak.picdn.net/shutterstock/videos/28601566/preview/stock-footage-tokyo-japan-december-crossing-the-road-at-famous-crossroad-in-shibuya-a-special-ward.mp4,PT00H00M09S,003001_003050,"Tokyo, japan - december 12, 2016: crossing the road at famous crossroad in shibuya, a special ward in tokyo. in 2014 tokyo was ranked first in the ""best overall experience"" category of tripadvisor"
25812704,https://ak.picdn.net/shutterstock/videos/25812704/preview/stock-footage-high-angle-view-of-cubicles-with-chairs-and-computers-in-modern-office.mp4,PT00H00M10S,189401_189450,High angle view of cubicles with chairs and computers in modern office
30105388,https://ak.picdn.net/shutterstock/videos/30105388/preview/stock-footage-aerial-footage-chicago-sunset-k.mp4,PT00H00M29S,126351_126400,Aerial footage chicago sunset 4k
1890193,https://ak.picdn.net/shutterstock/videos/1890193/preview/stock-footage-shot-of-statues.mp4,PT00H00M08S,186101_186150,Shot of statues
11908250,https://ak.picdn.net/shutterstock/videos/11908250/preview/stock-footage-children-have-fun-on-spinning-carousel-in-tel-aviv-port-boardwalk.mp4,PT00H00M19S,139101_139150,Children have fun on spinning carousel in tel-aviv port boardwalk
1015111705,https://ak.picdn.net/shutterstock/videos/1015111705/preview/stock-footage-rubbish-plastic-material-contained-in-a-dumping-site-for-futher-recycling-k.mp4,PT00H00M13S,143501_143550,Rubbish plastic material contained in a dumping site for futher recycling. 4k.
1056430571,https://ak.picdn.net/shutterstock/videos/1056430571/preview/stock-footage-comet-circulating-in-space-d-animation.mp4,PT00H00M10S,123801_123850,Comet circulating in space. 3d animation
1008515161,https://ak.picdn.net/shutterstock/videos/1008515161/preview/stock-footage-exhausted-woman-taking-break-while-jogging-k.mp4,PT00H00M09S,130251_130300,Exhausted woman taking break while jogging 4k
1039778795,https://ak.picdn.net/shutterstock/videos/1039778795/preview/stock-footage-street-scene-in-the-glen-park-neighborhood-in-san-francisco-california-circa-october.mp4,PT00H00M05S,102451_102500,"Street scene in the glen park neighborhood in san francisco, california, circa october 2018"
3270647,https://ak.picdn.net/shutterstock/videos/3270647/preview/stock-footage-close-up-isolated-shot-of-father-holding-newborn-son-father-and-son-moment-dad-and-new-son.mp4,PT00H00M27S,057251_057300,Close up isolated shot of father holding newborn son. father and son moment. dad and new son together. fatherhood and newborn baby in hands
11521445,https://ak.picdn.net/shutterstock/videos/11521445/preview/stock-footage-senior-man-eating-healthy-food.mp4,PT00H00M15S,058601_058650,Senior man eating healthy food
1024374500,https://ak.picdn.net/shutterstock/videos/1024374500/preview/stock-footage-loop-cycle-background-abstract-background-with-animation.mp4,PT00H00M29S,035151_035200,"Loop cycle background,abstract background with animation"
