videoid,contentUrl,duration,page_dir,name
30760228,https://ak.picdn.net/shutterstock/videos/30760228/preview/stock-footage-young-attractive-girl-makes-a-selfie-in-the-spa.mp4,PT00H00M13S,129001_129050,Young attractive girl makes a selfie in the spa.
1006837963,https://ak.picdn.net/shutterstock/videos/1006837963/preview/stock-footage-smart-couple-of-hipster-students-with-digital-tablet-pc-and-books-researching-in-campus-library.mp4,PT00H00M24S,086001_086050,Smart couple of hipster students with digital tablet pc and books researching in campus library over bookshelf background. two attractive c students studying together using tablet and books in library
1017485914,https://ak.picdn.net/shutterstock/videos/1017485914/preview/stock-footage-drone-view-of-car-driving-on-a-dirt-road-shot-in-colorado.mp4,PT00H00M24S,120201_120250,Drone view of car driving on a dirt road. shot in colorado.
10456541,https://ak.picdn.net/shutterstock/videos/10456541/preview/stock-footage-man-firing-a-gun-at-a-shooting-range.mp4,PT00H00M04S,073951_074000,Man firing a gun at a shooting range
1025245352,https://ak.picdn.net/shutterstock/videos/1025245352/preview/stock-footage-french-fries-shot-in-high-dynamic-range.mp4,PT00H00M35S,175151_175200,French fries - shot in high dynamic range
1037854043,https://ak.picdn.net/shutterstock/videos/1037854043/preview/stock-footage-head-and-shoulders-studio-shot-of-unhappy-man-looking-at-camera-with-sad-expression-in-slow-motion.mp4,PT00H00M15S,120951_121000,Head and shoulders studio shot of unhappy man looking at camera with sad expression in slow motion
1448707,https://ak.picdn.net/shutterstock/videos/1448707/preview/stock-footage-stack-of-american-currency-on-grid.mp4,PT00H00M07S,097651_097700,Stack of american currency on grid
6972577,https://ak.picdn.net/shutterstock/videos/6972577/preview/stock-footage-male-silhouette-makes-a-phone-call-behind-a-frozen-glass.mp4,PT00H00M30S,026751_026800,"Male silhouette makes a phone call,behind a frozen glass.
"
1016213758,https://ak.picdn.net/shutterstock/videos/1016213758/preview/stock-footage-cookstown-ontario-canada-august-old-heavy-industrial-machinery-and-manufacturing-equipment.mp4,PT00H00M15S,003151_003200,"Cookstown, ontario, canada august 2018 old heavy industrial machinery and manufacturing equipment"
19217824,https://ak.picdn.net/shutterstock/videos/19217824/preview/stock-footage-traditional-cooking-hot-waffles-using-old-fashioned-waffles-iron-and-keeping-fire-with-charcoal.mp4,PT00H00M36S,114501_114550,Traditional cooking hot waffles using old fashioned waffles iron and keeping fire with charcoal ( close up )
1045483006,https://ak.picdn.net/shutterstock/videos/1045483006/preview/stock-footage-thick-ice-icicles-on-pier-catwalk-with-scenic-lake-michigan-lighthouse-aerial-view.mp4,PT00H00M27S,113151_113200,"Thick ice, icicles on pier catwalk with scenic lake michigan lighthouse, aerial view.
"
1027656143,https://ak.picdn.net/shutterstock/videos/1027656143/preview/stock-footage-a-rocky-area-inside-elephantine-island.mp4,PT00H00M09S,144351_144400,A rocky area inside elephantine island
426115,https://ak.picdn.net/shutterstock/videos/426115/preview/stock-footage-motion-travelator.mp4,PT00H00M07S,196851_196900,Motion travelator 
26073212,https://ak.picdn.net/shutterstock/videos/26073212/preview/stock-footage-icicles-on-a-spring-tree-with-blossoming-buds-frost-in-the-spring-spring-tree-covered-with-ice.mp4,PT00H00M12S,103651_103700,Icicles on a spring tree with blossoming buds. frost in the spring. spring tree covered with ice.
1043940325,https://ak.picdn.net/shutterstock/videos/1043940325/preview/stock-footage-unhappy-elderly-man-looking-in-window-feeling-lonely-in-city-sad-memories.mp4,PT00H00M17S,110001_110050,"Unhappy elderly man looking in window, feeling lonely in city, sad memories"
1013821535,https://ak.picdn.net/shutterstock/videos/1013821535/preview/stock-footage-young-sexy-blonda-lady-in-lingerie-is-jumping-in-front-of-mirror-taking-off-shirt-stretching.mp4,PT00H00M18S,197101_197150,"Young sexy blonda lady in lingerie is jumping in front of mirror, taking off shirt, stretching"
1042817821,https://ak.picdn.net/shutterstock/videos/1042817821/preview/stock-footage-alder-trees-in-summer-time.mp4,PT00H00M08S,177051_177100,Alder trees in summer time
1025013851,https://ak.picdn.net/shutterstock/videos/1025013851/preview/stock-footage-tooth-looping-footage-has-k-resolution-prores-d-illustration.mp4,PT00H00M15S,180301_180350,Tooth. looping footage has 4k resolution. prores 4444. 3d illustration.
1057573675,https://ak.picdn.net/shutterstock/videos/1057573675/preview/stock-footage-man-in-mask-standing-in-a-green-field-outside-aerial-shot-from-drone-view-from-above.mp4,PT00H00M28S,002751_002800,"Man in mask standing in a green field outside, aerial shot from drone, view from above"
1029498128,https://ak.picdn.net/shutterstock/videos/1029498128/preview/stock-footage-intro-background-texture-render-animation-colors-abstract-decorative-for-creative-graphics-style.mp4,PT00H00M08S,128601_128650,Intro background texture render animation colors abstract decorative for creative graphics style video with unique motion editing logo illustration design banner wallpaper 4k ultra hd uhd illustration
1041522382,https://ak.picdn.net/shutterstock/videos/1041522382/preview/stock-footage-beautiful-church-in-zagreb-croatia.mp4,PT00H00M19S,015551_015600,"Beautiful church in zagreb, croatia"
1059028295,https://ak.picdn.net/shutterstock/videos/1059028295/preview/stock-footage--k-d-log-mavic-pro-aerial-view-of-the-gulf-of-morbihan-in-french-brittany.mp4,PT00H00M29S,133701_133750,4k d-log mavic 2 pro aerial view of the gulf of morbihan in french brittany
2943805,https://ak.picdn.net/shutterstock/videos/2943805/preview/stock-footage-reef.mp4,PT00H00M11S,117351_117400,Reef
1064401423,https://ak.picdn.net/shutterstock/videos/1064401423/preview/stock-footage-asian-beautiful-young-and-healthy-woman-in-spa-salon-massage-treatment-spa-room-traditional.mp4,PT00H00M11S,183101_183150,"Asian beautiful, young and healthy woman in spa salon. massage treatment spa room  . traditional medicine and healing concept."
9688685,https://ak.picdn.net/shutterstock/videos/9688685/preview/stock-footage-two-beautiful-girlfriends-found-on-a-bench-in-the-store-and-begin-to-show-who-bought.mp4,PT00H00M29S,061351_061400,Two beautiful girlfriends found on a bench in the store and begin to show who bought
14020220,https://ak.picdn.net/shutterstock/videos/14020220/preview/stock-footage-san-pablo-city-laguna-philippines-january-girl-had-her-face-painted-during-fun-party.mp4,PT00H00M13S,125501_125550,"San pablo city, laguna, philippines - january 13, 2016: girl had her face painted during fun party giving added fun and gimmick to the occasion"
33739273,https://ak.picdn.net/shutterstock/videos/33739273/preview/stock-footage-lawn-flowerbed-on-a-pedestrian-street-in-the-center-of-the-city-palm-avenue-k-slow-motion.mp4,PT00H00M11S,134551_134600,"Lawn, flowerbed on a pedestrian street in the center of the city, palm avenue. 4k, slow-motion. blur background"
23885695,https://ak.picdn.net/shutterstock/videos/23885695/preview/stock-footage-colorful-confetti-particles-square.mp4,PT00H00M20S,048101_048150,Colorful confetti particles. square.
23982808,https://ak.picdn.net/shutterstock/videos/23982808/preview/stock-footage--k-female-hands-touch-smartphone-gh-k.mp4,PT00H00M20S,055251_055300,4k female hands touch smartphone. gh2_11928_4k
23719750,https://ak.picdn.net/shutterstock/videos/23719750/preview/stock-footage-young-man-using-cell-phone-with-green-isolated-touch-screen-k-fps-prores-hq.mp4,PT00H00M28S,023051_023100,Young man using cell phone with green isolated touch screen. 4k 30fps prores (hq)
1013309972,https://ak.picdn.net/shutterstock/videos/1013309972/preview/stock-footage-hard-working-young-athlete-trains-on-spinning-exercise-bike.mp4,PT00H00M28S,118701_118750,Hard working young athlete trains on spinning exercise bike
12124493,https://ak.picdn.net/shutterstock/videos/12124493/preview/stock-footage-young-boy-is-playing-with-a-tablet-on-an-airplane-while-mother-is-sleeping-and-father-sits-next-to.mp4,PT00H00M10S,057801_057850,Young boy is playing with a tablet on an airplane while mother is sleeping and father sits next to a window. shot on red cinema camera in 4k (uhd).
1023089227,https://ak.picdn.net/shutterstock/videos/1023089227/preview/stock-footage-marathi-calligraphy-shree-ganesh-meaning-lord-ganesh-vector.mp4,PT00H00M17S,195801_195850,Marathi calligraphy “shree ganesh” meaning lord ganesh – vector
1028942096,https://ak.picdn.net/shutterstock/videos/1028942096/preview/stock-footage-drones-flight-and-aerial-view-over-a-rape-field.mp4,PT00H00M28S,191251_191300,Drones flight and aerial view over a rape field
1029261998,https://ak.picdn.net/shutterstock/videos/1029261998/preview/stock-footage-toronto-ontario-canada-may-driving-plate-pov-in-heavy-rain-storm-on-highway.mp4,PT00H00M30S,055401_055450,"Toronto, ontario, canada may 2019 driving plate pov in heavy rain storm on highway"
1026889307,https://ak.picdn.net/shutterstock/videos/1026889307/preview/stock-footage-yellow-bokeh-shimmering.mp4,PT00H00M06S,104951_105000,Yellow bokeh shimmering.
16016344,https://ak.picdn.net/shutterstock/videos/16016344/preview/stock-footage-mother-and-child-on-a-river-bank-outdoors.mp4,PT00H00M17S,039951_040000,Mother and child on a river bank outdoors
1043593363,https://ak.picdn.net/shutterstock/videos/1043593363/preview/stock-footage-circa-ford-conducts-various-safety-tests-by-crashing-their-vehicles.mp4,PT00H00M42S,035001_035050,Circa 1969 - ford conducts various safety tests by crashing their vehicles.
1029734939,https://ak.picdn.net/shutterstock/videos/1029734939/preview/stock-footage-green-d-animation-abstract-loop-futuristic-triangle-tunnel.mp4,PT00H00M16S,096701_096750,Green 3d animation abstract loop futuristic triangle tunnel
34350580,https://ak.picdn.net/shutterstock/videos/34350580/preview/stock-footage-moscow-russia-december-townspeople-and-tourists-walk-by-manezhnaya-square-decorated.mp4,PT00H00M10S,085401_085450,"Moscow, russia - december 22 , 2017: townspeople and tourists walk by manezhnaya square decorated for the holiday of new year and christmas in moscow. russia. time lapse"
8251735,https://ak.picdn.net/shutterstock/videos/8251735/preview/stock-footage-a-group-of-cyclists-riding-their-bicycles-through-a-tunnel-passes-by-various-vehicles-pov.mp4,PT00H00M45S,034351_034400,"A group of cyclists riding their bicycles through a tunnel, passes by various vehicles, pov"
23698483,https://ak.picdn.net/shutterstock/videos/23698483/preview/stock-footage-young-woman-reading-newspaper-on-sofa-at-home.mp4,PT00H00M15S,065001_065050,"Young woman reading newspaper on sofa at home
"
3115231,https://ak.picdn.net/shutterstock/videos/3115231/preview/stock-footage-person-with-shopping-bags.mp4,PT00H00M16S,056651_056700,Person with shopping bags
19399069,https://ak.picdn.net/shutterstock/videos/19399069/preview/stock-footage-motion-background-animation-hd-diagonal-orange-stripes.mp4,PT00H00M19S,058401_058450,Motion background animation hd - diagonal orange stripes
1022921149,https://ak.picdn.net/shutterstock/videos/1022921149/preview/stock-footage-slow-motion-of-business-asian-woman-use-smart-phone.mp4,PT00H00M19S,186501_186550,Slow motion of business asian woman use smart phone
5189993,https://ak.picdn.net/shutterstock/videos/5189993/preview/stock-footage-aerial-shot-alps.mp4,PT00H00M30S,065551_065600,Aerial shot alps 010
1014793877,https://ak.picdn.net/shutterstock/videos/1014793877/preview/stock-footage-view-on-a-path-in-the-nature.mp4,PT00H00M16S,056651_056700,View on a path in the nature
594670,https://ak.picdn.net/shutterstock/videos/594670/preview/stock-footage-row-of-d-cartoon-firs-passing-in-front-of-the-camera-hd.mp4,PT00H00M08S,139401_139450,"Row of 3d cartoon firs passing in front of the camera, hd"
23566006,https://ak.picdn.net/shutterstock/videos/23566006/preview/stock-footage-tomograph-patient-on-magnetic-resonance-medical-examination.mp4,PT00H00M10S,143901_143950,Tomograph. patient on magnetic resonance medical examination.
1014758642,https://ak.picdn.net/shutterstock/videos/1014758642/preview/stock-footage-man-and-woman-dancing-in-skull-masks.mp4,PT00H00M33S,070551_070600,Man and woman dancing in skull masks
1046447602,https://ak.picdn.net/shutterstock/videos/1046447602/preview/stock-footage-handheld-and-rotating-fresh-green-lime-on-the-tree-after-the-rain-from-below.mp4,PT00H00M10S,071401_071450,Handheld and rotating fresh green lime on the tree after the rain from below
16389484,https://ak.picdn.net/shutterstock/videos/16389484/preview/stock-footage-laughing-bird-caye-belize-march-panning-shot-of-the-southern-end-of-laughing-bird-caye.mp4,PT00H00M14S,011901_011950,"Laughing bird caye, belize - march, 2016 - panning shot of the southern end of laughing bird caye national park in belize at dawn."
1037422244,https://ak.picdn.net/shutterstock/videos/1037422244/preview/stock-footage-aerial-time-lapse-view-of-singapore-city-skyline-district-with-blue-sky-and-fast-clouds-overlooking.mp4,PT00H00M16S,097851_097900,Aerial time lapse view of singapore city skyline district with blue sky and fast clouds overlooking a busy streets. full hd. 4k available.
1018583122,https://ak.picdn.net/shutterstock/videos/1018583122/preview/stock-footage-port-of-french-luxury-resort-of-antibes-yachts-are-floating-on-water-airplane-coming-down-in-the.mp4,PT00H00M23S,097801_097850,Port of french luxury resort of antibes. yachts are floating on water. airplane coming down in the background. locked down real time medium shot
5431535,https://ak.picdn.net/shutterstock/videos/5431535/preview/stock-footage-brazilian-mountains.mp4,PT00H00M05S,144951_145000,Brazilian mountains
12399473,https://ak.picdn.net/shutterstock/videos/12399473/preview/stock-footage-wide-angle-pan-of-river-and-road.mp4,PT00H00M04S,125201_125250,Wide angle pan of river and road
17365462,https://ak.picdn.net/shutterstock/videos/17365462/preview/stock-footage-young-father-and-his-little-son-have-fun-playing.mp4,PT00H00M16S,093651_093700,Young father and his little son have fun playing
13990925,https://ak.picdn.net/shutterstock/videos/13990925/preview/stock-footage-frying-pig-intestine.mp4,PT00H00M18S,107651_107700,Frying pig intestine
1009922120,https://ak.picdn.net/shutterstock/videos/1009922120/preview/stock-footage-woman-using-smartphone-relaxes-on-the-bench-in-beautiful-park-young-woman-in-making-gestures-on.mp4,PT00H00M11S,075101_075150,Woman using smartphone relaxes on the bench in beautiful park. young woman in making gestures on phone display. technology outdoors 4k
1013531978,https://ak.picdn.net/shutterstock/videos/1013531978/preview/stock-footage-little-girl-with-teddy-bear-at-sunset-silhouette-girl-holding-a-bear-doll-bear-watching-the-sunset.mp4,PT00H00M16S,124701_124750,Little girl with teddy bear at sunset. silhouette girl holding a bear doll bear watching the sunset. concept big dream.
18548297,https://ak.picdn.net/shutterstock/videos/18548297/preview/stock-footage-stars-color-sky.mp4,PT00H00M17S,113101_113150,Stars color sky
24692000,https://ak.picdn.net/shutterstock/videos/24692000/preview/stock-footage-a-red-footed-booby-sula-sula-sits-with-its-young-chick-on-a-nest-in-a-breeding-colony-on-half.mp4,PT00H00M22S,006201_006250,A red-footed booby (sula sula) sits with its young chick on a nest in a breeding colony on half moon caye natural monument off the coast of belize. 
1057605190,https://ak.picdn.net/shutterstock/videos/1057605190/preview/stock-footage-dehradun-uttarakhand-india-august-people-stands-in-long-que-to-purchase-wine-liquor-as.mp4,PT00H00M12S,117451_117500,"Dehradun, uttarakhand/india- august 01 2020: people stands in long que to purchase wine liquor as wine shops reopens after four months long due to corona virus lockdown. pandemic covid 19 . "
2082308,https://ak.picdn.net/shutterstock/videos/2082308/preview/stock-footage-flowing-light-christmas-tree-hd-computer-animated-christmas-tree-that-builds-in-a-spiral-and.mp4,PT00H00M23S,133751_133800,Flowing light christmas tree (hd). computer animated christmas tree that builds in a spiral and incorporates a star at the top. built from over 500k light particle sources. alpha channel included.
1051102525,https://ak.picdn.net/shutterstock/videos/1051102525/preview/stock-footage-medicinal-weed-icon-inside-blue-badge-with-geometric-pattern-rotary-fashion-conceptual-draw-loop.mp4,PT00H00M30S,104201_104250,"Medicinal weed icon inside blue badge with geometric pattern. rotary fashion, conceptual draw, loop animation continues"
6895168,https://ak.picdn.net/shutterstock/videos/6895168/preview/stock-footage-new-york-july-washington-square-park-arch-in-greenwich-village-manhattan-new-york.mp4,PT00H00M10S,141951_142000,"New york - july 18, 2014: washington square park arch in greenwich village, manhattan, new york. washington square park is one of the best-known of new york city's 1,900 public parks."
1021194298,https://ak.picdn.net/shutterstock/videos/1021194298/preview/stock-footage-vj-fractal-gold-kaleidoscopic-background-background-motion-with-fractal-design-disco-spectrum.mp4,PT00H00M11S,125101_125150,Vj fractal gold kaleidoscopic background. background motion with fractal design. disco spectrum lights concert spot bulb. more sets footage in my portfolio.
2337242,https://ak.picdn.net/shutterstock/videos/2337242/preview/stock-footage-couple-looking-at-bad-news-on-their-computer.mp4,PT00H00M37S,087151_087200,Couple looking at bad news on their computer
12887279,https://ak.picdn.net/shutterstock/videos/12887279/preview/stock-footage-golden-drops-floating-in-oil-and-water-over-a-colorful-underground-with-oil-painting-effect-shot.mp4,PT00H00M26S,003601_003650,Golden drops floating in oil and water over a colorful underground with oil painting effect. shot on red
13991753,https://ak.picdn.net/shutterstock/videos/13991753/preview/stock-footage--k-pink-flamingos-in-the-lake-k-ultra-hd-x-video-clip.mp4,PT00H00M20S,119151_119200,4k pink flamingos in the lake. 4k ultra hd 3840x2160 video clip
1043800009,https://ak.picdn.net/shutterstock/videos/1043800009/preview/stock-footage-smiling-blonde-lady-sitting-on-couch-and-having-video-chat-on-laptop-christmas-congratulations.mp4,PT00H00M20S,128701_128750,"Smiling blonde lady sitting on couch and having video chat on laptop, christmas congratulations"
1034267174,https://ak.picdn.net/shutterstock/videos/1034267174/preview/stock-footage-june-morning-at-funan-digitalife-mall-outlet-feature-wall-singapore.mp4,PT00H00M10S,029301_029350,"June 30/2019 morning at funan digitalife mall outlet feature wall , singapore"
24215674,https://ak.picdn.net/shutterstock/videos/24215674/preview/stock-footage-united-states-s-man-paddles-canoe-on-flat-calm-waterway.mp4,PT00H00M21S,146351_146400,"United states: 1970s: man paddles canoe on flat, calm waterway."
16674847,https://ak.picdn.net/shutterstock/videos/16674847/preview/stock-footage-maine-august-waves-crashing-on-the-rocky-terrain.mp4,PT00H00M09S,045051_045100,Maine - august 2015: waves crashing on the rocky terrain
1022476090,https://ak.picdn.net/shutterstock/videos/1022476090/preview/stock-footage--d-render-background-made-of-repetitive-square-patterns-technology-theme-concept-with-random.mp4,PT00H00M10S,187851_187900,"3d render background made of repetitive square patterns. technology theme concept with random square forms.

"
9250889,https://ak.picdn.net/shutterstock/videos/9250889/preview/stock-footage-shooting-white-mushrooms-on-rotating-table.mp4,PT00H00M24S,068151_068200,Shooting white mushrooms on rotating table
1035004394,https://ak.picdn.net/shutterstock/videos/1035004394/preview/stock-footage-beautiful-spring-landscape-with-mountains-pine-woods-forest-mountain-valley-green-nature-scape.mp4,PT00H00M10S,033051_033100,"Beautiful spring landscape with mountains, pine woods forest mountain valley green nature scape"
20074525,https://ak.picdn.net/shutterstock/videos/20074525/preview/stock-footage-old-senior-man-shows-thumbs-up-on-agreement-green-screen-studio.mp4,PT00H00M28S,027551_027600,Old senior man shows thumbs up on agreement - green screen - studio
15174529,https://ak.picdn.net/shutterstock/videos/15174529/preview/stock-footage-boho-style-girl-is-relaxing-during-a-summer-road-trip-with-her-boyfriend.mp4,PT00H00M14S,016901_016950,Boho style girl is relaxing during a summer road trip with her boyfriend
6756190,https://ak.picdn.net/shutterstock/videos/6756190/preview/stock-footage-woman-in-garden.mp4,PT00H00M12S,114651_114700,Woman in garden 
1022414206,https://ak.picdn.net/shutterstock/videos/1022414206/preview/stock-footage-berlin-germany-the-berlin-s-bahn-is-a-rapid-transit-railway-system-in-and-around-berlin.mp4,PT00H00M12S,048801_048850,"Berlin germany 01 05 2018 the berlin s-bahn is a rapid transit railway system in and around berlin, the capital city of germany."
16962511,https://ak.picdn.net/shutterstock/videos/16962511/preview/stock-footage-gathered-hair-hairstyle-for-long-white-hair-white-close-up.mp4,PT00H00M29S,075801_075850,Gathered hair. hairstyle for long white hair. white. close up
23324740,https://ak.picdn.net/shutterstock/videos/23324740/preview/stock-footage-green-banana-leaf.mp4,PT00H00M14S,059101_059150,Green banana leaf
1032192386,https://ak.picdn.net/shutterstock/videos/1032192386/preview/stock-footage-a-woman-with-a-hat-goes-along-the-shore.mp4,PT00H00M11S,011401_011450,A woman with a hat goes along the shore.
21945115,https://ak.picdn.net/shutterstock/videos/21945115/preview/stock-footage-piece-of-pizza-rotating-on-wooden-plate-on-white-background.mp4,PT00H00M23S,129901_129950,Piece of pizza rotating on wooden plate on white background
1013181479,https://ak.picdn.net/shutterstock/videos/1013181479/preview/stock-footage-new-york-usa-may-commuters-at-the-world-trade-center-transportation-hub-also-known-as.mp4,PT00H00M30S,123501_123550,"New york, usa - may 10, 2018: commuters at the world trade center transportation hub, also known as ""the oculus"""
1010453429,https://ak.picdn.net/shutterstock/videos/1010453429/preview/stock-footage--k-footage-colorful-bubbles-fantastic-structure-of-colorful-bubbles-chaotic-motion.mp4,PT00H00M26S,086601_086650,4k footage. colorful bubbles. fantastic structure of colorful bubbles. chaotic motion. 
14907526,https://ak.picdn.net/shutterstock/videos/14907526/preview/stock-footage-driving-car-in-raining-time.mp4,PT00H00M21S,025951_026000,Driving car in raining time
15932869,https://ak.picdn.net/shutterstock/videos/15932869/preview/stock-footage-road-view-through-car-window-with-raindrops.mp4,PT00H00M15S,053501_053550,Road view through car window with raindrops
9461672,https://ak.picdn.net/shutterstock/videos/9461672/preview/stock-footage-chennai-india-november-people-attend-a-yoga-class-on-the-beach-at-sunrise-in-chennai.mp4,PT00H00M27S,052651_052700,"Chennai, india - 26 november 2014: people attend a yoga class on the beach at sunrise, in chennai."
8653396,https://ak.picdn.net/shutterstock/videos/8653396/preview/stock-footage-ultra-hd-k-pov-point-of-view-of-train-pass-near-ploughing-land-at-countryside-in-winter-snow.mp4,PT00H00M23S,142751_142800,Ultra hd 4k pov point of view of train pass near ploughing land at countryside in winter snow
1055060927,https://ak.picdn.net/shutterstock/videos/1055060927/preview/stock-footage-pushkin-russia-circa-april-pov-walking-along-fence-of-sophia-ascension-cathedral-in.mp4,PT00H00M21S,189451_189500,"Pushkin, russia - circa april 2020: pov walking along fence of sophia ascension cathedral in pushkin, saint petersburg, russia."
1017713998,https://ak.picdn.net/shutterstock/videos/1017713998/preview/stock-footage-man-in-beauty-salon-manicure-procedure-massage-hands-put-hand-cream.mp4,PT00H00M52S,092551_092600,Man in beauty salon manicure procedure. massage hands put hand cream.
6757852,https://ak.picdn.net/shutterstock/videos/6757852/preview/stock-footage-attractive-young-caucasian-parents-enjoying-time-playing-baby-son-with-inflatable-toy-outdoor.mp4,PT00H00M16S,054901_054950,Attractive young caucasian parents enjoying time playing baby son with inflatable toy outdoor swimming pool vacation rental shot on red epic
1020737230,https://ak.picdn.net/shutterstock/videos/1020737230/preview/stock-footage-redwoods-national-park-coastline-view.mp4,PT00H00M15S,041851_041900,Redwoods national park coastline view
1041240547,https://ak.picdn.net/shutterstock/videos/1041240547/preview/stock-footage-direction-signs-at-park-of-nations-in-lisbon-lisbon-portugal-november.mp4,PT00H00M07S,079851_079900,"Direction signs at park of nations in lisbon - lisbon, portugal - november 5, 2019"
1018324891,https://ak.picdn.net/shutterstock/videos/1018324891/preview/stock-footage-portrait-beautiful-asian-young-woman-sitting-on-couch-using-laptop-computer-at-home-leisure-and.mp4,PT00H00M17S,026801_026850,"Portrait beautiful asian young woman sitting on couch using laptop computer at home leisure and relax, freelance with girl on sofa working notebook, communication and lifestyle concept, slow motion"
26681590,https://ak.picdn.net/shutterstock/videos/26681590/preview/stock-footage-swan-hatching.mp4,PT00H00M10S,105401_105450,Swan hatching
23383471,https://ak.picdn.net/shutterstock/videos/23383471/preview/stock-footage-love-calligraphy-female-writing-thin-cursive-inside-white-heart-on-tablet.mp4,PT00H00M13S,075401_075450,Love calligraphy. female writing thin cursive inside white heart on tablet
1019750839,https://ak.picdn.net/shutterstock/videos/1019750839/preview/stock-footage-very-close-up-hd-video-of-the-grass-near-the-beach-beautiful-sunny-day-with-wind-peaceful-and.mp4,PT00H00M12S,113901_113950,"Very close-up hd video of the grass near the beach. beautiful sunny day with wind, peaceful and relaxation holiday, in the background  the coastline and the blue sky,  the sea and wave breaks."
