videoid,contentUrl,duration,page_dir,name
1054874339,https://ak.picdn.net/shutterstock/videos/1054874339/preview/stock-footage-markham-ontario-canada-june-closed-restaurant-and-patio-during-covid-pandemic-lockdown-in.mp4,PT00H00M31S,188601_188650,"Markham, ontario, canada june 2020 closed restaurant and patio during covid 19 pandemic lockdown in canada"
1020682498,https://ak.picdn.net/shutterstock/videos/1020682498/preview/stock-footage-sea-landscape-beach-arrifes-albufeira-in-summer-in-good-weather.mp4,PT00H00M29S,064351_064400,"Sea landscape beach arrifes, albufeira, in summer in good weather."
30648826,https://ak.picdn.net/shutterstock/videos/30648826/preview/stock-footage-drone-flying-over-sea-at-sunset-straight-towards-a-modern-pier-italian-coastline-of-tuscany.mp4,PT00H00M10S,122001_122050,"Drone flying over sea at sunset, straight towards a modern pier, italian coastline of tuscany, viareggio"
1040944952,https://ak.picdn.net/shutterstock/videos/1040944952/preview/stock-footage-dubai-uae-november-helipad-at-burj-al-arab-the-most-luxurious-hotel-in-the-world.mp4,PT00H00M10S,074851_074900,"Dubai, uae, november 02 2019: helipad at burj al arab  the most luxurious hotel in the world located in dubai, uae."
1020784396,https://ak.picdn.net/shutterstock/videos/1020784396/preview/stock-footage-little-pretty-girl-giving-high-five-to-grandmother-and-hugging-her-happy-family.mp4,PT00H00M06S,109751_109800,"Little pretty girl giving high five to grandmother and hugging her, happy family"
30572182,https://ak.picdn.net/shutterstock/videos/30572182/preview/stock-footage-flow-of-sweet-green-liquid-like-oil-fly-in-air-stream-of-sugar-liquid-like-syrop-move-in-slow.mp4,PT00H01M00S,124101_124150,Flow of sweet green liquid like oil fly in air. stream of sugar liquid like syrop move in slow motion with alpha channel as luma matte. ver4
23468719,https://ak.picdn.net/shutterstock/videos/23468719/preview/stock-footage-moscow-dec-three-workers-with-spades-clean-roof-of-house-at-winter-day-aerial-view.mp4,PT00H00M11S,114951_115000,"Moscow - dec 16, 2016: three workers with spades clean roof of house at winter day. aerial view"
9879158,https://ak.picdn.net/shutterstock/videos/9879158/preview/stock-footage-keyboard.mp4,PT00H00M13S,195051_195100,Keyboard 
18323071,https://ak.picdn.net/shutterstock/videos/18323071/preview/stock-footage-dinner-cruise-waikiki.mp4,PT00H00M36S,111101_111150,Dinner cruise waikiki 
1061630311,https://ak.picdn.net/shutterstock/videos/1061630311/preview/stock-footage-beautiful-young-asian-woman-short-hair-with-clean-fresh-skin-face-care-facial-treatment.mp4,PT00H00M11S,061251_061300,"Beautiful young asian woman short hair  with clean fresh skin. face care, facial treatment, cosmetology, beauty and healthy skin and cosmetic ideas concept.pretty woman holding half of orange .
"
4237970,https://ak.picdn.net/shutterstock/videos/4237970/preview/stock-footage-barren-wilderness-of-steam-and-smoke-produced-by-molten-lava-flows-cooled-by-ocean-waters-kilauea.mp4,PT00H00M23S,189651_189700,Barren wilderness of steam and smoke produced by molten lava flows cooled by ocean waters kilauea hawaii shot on red epic
16352191,https://ak.picdn.net/shutterstock/videos/16352191/preview/stock-footage-south-sudan-flag-waving-in-slow-motion-against-clean-blue-sky-seamlessly-looped-close-up.mp4,PT00H00M27S,093701_093750,"South sudan flag waving in slow motion against clean blue sky, seamlessly looped, close up, isolated on alpha channel with black and white luminance matte, perfect for film, news, digital composition"
1009783163,https://ak.picdn.net/shutterstock/videos/1009783163/preview/stock-footage-needlework-christmas-tree-of-pine-cones-and-balls.mp4,PT00H00M29S,198601_198650,Needlework christmas tree of pine cones and balls
1011865556,https://ak.picdn.net/shutterstock/videos/1011865556/preview/stock-footage-view-of-the-giant-waves-foaming-and-splashing-in-the-ocean-sunny-day.mp4,PT00H00M07S,107701_107750,"View of the giant waves, foaming and splashing in the ocean, sunny day,"
13506680,https://ak.picdn.net/shutterstock/videos/13506680/preview/stock-footage-crowded-street-outside-business-office-sales-man-web-browsing-tablet-data-base.mp4,PT00H00M15S,115051_115100,Crowded street outside business office sales man web browsing tablet data base 
22618279,https://ak.picdn.net/shutterstock/videos/22618279/preview/stock-footage-greece-mount-athos-holy-monastery-simonopetra-rainy-evening-september.mp4,PT00H00M15S,196401_196450,"Greece, mount athos, holy monastery simonopetra, rainy evening, september 2, 2014. 
"
1020248050,https://ak.picdn.net/shutterstock/videos/1020248050/preview/stock-footage-young-manager-giving-narcotics-to-co-worker-drug-dealer-cctv-camera-effect.mp4,PT00H00M27S,109201_109250,"Young manager giving narcotics to co-worker, drug dealer, cctv camera effect"
1030556306,https://ak.picdn.net/shutterstock/videos/1030556306/preview/stock-footage-clear-water-of-azusa-river-flowing-in-kamikochi-japan.mp4,PT00H00M20S,118801_118850,"Clear water of azusa river flowing in kamikochi, japan."
24414704,https://ak.picdn.net/shutterstock/videos/24414704/preview/stock-footage-jelly-fish-jellyfish-scenery-in-underwater-cave-and-photographers-outside-under-water.mp4,PT00H00M19S,078751_078800,Jelly fish jellyfish scenery in underwater cave and photographers outside  under water
1422175,https://ak.picdn.net/shutterstock/videos/1422175/preview/stock-footage-clouds-drift-over-the-sierra-nevada-mountains.mp4,PT00H00M08S,078551_078600,Clouds drift over the sierra nevada mountains.
1016090677,https://ak.picdn.net/shutterstock/videos/1016090677/preview/stock-footage-athletic-woman-working-out.mp4,PT00H00M08S,082801_082850,Athletic woman working out.
28964608,https://ak.picdn.net/shutterstock/videos/28964608/preview/stock-footage-move-forward-into-the-cloud-to-telecommunication-towers-at-the-top-of-the-mountain.mp4,PT00H00M17S,084751_084800,Move forward into the cloud to telecommunication towers at the top of the mountain.
6606965,https://ak.picdn.net/shutterstock/videos/6606965/preview/stock-footage-malmo-sweden-jun-turning-torso-skyscraper-on-jun-in-malmo-sweden-designed-by.mp4,PT00H00M14S,009501_009550,"Malmo, sweden - jun 12: turning torso skyscraper on jun 07, 2014 in malmo, sweden. designed by santiago calatrava, it is the most recognized landmark of malmo today"
1012933820,https://ak.picdn.net/shutterstock/videos/1012933820/preview/stock-footage-young-couple-with-backpacks-hiking-together-along-a-river.mp4,PT00H00M06S,000701_000750,Young couple with backpacks hiking together along a river
1053990920,https://ak.picdn.net/shutterstock/videos/1053990920/preview/stock-footage-a-middle-aged-woman-masked-by-coronavirus-allergies-talking-on-the-phone-near-the-hotel-pool.mp4,PT00H00M10S,022601_022650,"A middle-aged woman, masked by coronavirus, allergies, talking on the phone near the hotel pool. close-up."
7026100,https://ak.picdn.net/shutterstock/videos/7026100/preview/stock-footage-a-canyoneer-abseils-next-to-a-waterfall-into-a-river.mp4,PT00H00M06S,149501_149550,A canyoneer abseils next to a waterfall into a river
26743504,https://ak.picdn.net/shutterstock/videos/26743504/preview/stock-footage-schiphol-amsterdam-the-netherlands-may-cargolux-boeing-cargo-plane-taxiing-to-the-runway.mp4,PT00H00M12S,116901_116950,"Schiphol, amsterdam, the netherlands - may 5: cargolux boeing 747 cargo plane taxiing to the runway on may 5, 2017 in schiphol, amsterdam, the netherlands."
1011715139,https://ak.picdn.net/shutterstock/videos/1011715139/preview/stock-footage-sea-waves-with-bubbles-over-sand-beach-background.mp4,PT00H00M18S,062701_062750,Sea waves with bubbles over sand beach background
1034191616,https://ak.picdn.net/shutterstock/videos/1034191616/preview/stock-footage-playa-la-boca-chile-this-clip-is-available-in-different-gradings-this-is-the-neutral-grade.mp4,PT00H00M30S,053951_054000,"Playa la boca, chile. this clip is available in different gradings - this is the neutral grade."
1026655046,https://ak.picdn.net/shutterstock/videos/1026655046/preview/stock-footage-abstract-paint-brush-strokes-animation.mp4,PT00H00M12S,057351_057400,Abstract paint brush strokes animation
34014625,https://ak.picdn.net/shutterstock/videos/34014625/preview/stock-footage-varanasi-india-january-morning-view-at-holy-ghats-architecture-pray-people-and.mp4,PT00H00M13S,104251_104300,"Varanasi, india - january 28, 2017 : morning view at holy ghats, architecture, pray people and wooden boats at the river ganges of varanasi, india"
1037635187,https://ak.picdn.net/shutterstock/videos/1037635187/preview/stock-footage-waves-at-the-seashore-slow-motion.mp4,PT00H00M26S,010701_010750,Waves at the seashore. slow motion.
1013318660,https://ak.picdn.net/shutterstock/videos/1013318660/preview/stock-footage-markham-ontario-canada-july-cruise-night-with-performance-race-and-luxury-cars-and-crowds-of.mp4,PT00H00M25S,018151_018200,"Markham, ontario, canada july 2018 cruise night with performance race and luxury cars and crowds of people"
32791420,https://ak.picdn.net/shutterstock/videos/32791420/preview/stock-footage-this-is-spectacular-aerial-k-footage-at-the-sierra-mountain-foothills-of-northern-california-in.mp4,PT00H00M15S,174951_175000,This is spectacular aerial 4k footage at the sierra mountain foothills of northern california in early november.
25722851,https://ak.picdn.net/shutterstock/videos/25722851/preview/stock-footage-beautiful-brunette-woman-taking-selfie-indoor-pretty-young-woman-taking-photos-of-herself-at-home.mp4,PT00H00M15S,051051_051100,Beautiful brunette woman taking selfie indoor. pretty young woman taking photos of herself at home. highlighted face
1014009869,https://ak.picdn.net/shutterstock/videos/1014009869/preview/stock-footage-chinese-medicine-dry-mushroom-in-rotation.mp4,PT00H00M44S,067801_067850,Chinese medicine dry mushroom in rotation
1007384968,https://ak.picdn.net/shutterstock/videos/1007384968/preview/stock-footage-genoa-italy-december-old-port-of-genova-and-boats-from-sea-view-in-italy-at-sunny-day.mp4,PT00H00M07S,106551_106600,"Genoa, italy - december 04, 2017:  old port of genova and boats from sea view in italy at sunny day"
1056756380,https://ak.picdn.net/shutterstock/videos/1056756380/preview/stock-footage-central-hong-kong-july-top-down-view-of-hong-kong-city.mp4,PT00H00M19S,029951_030000,"Central, hong kong 20 july 2020: top down view of hong kong city"
28142659,https://ak.picdn.net/shutterstock/videos/28142659/preview/stock-footage-the-green-leaves-of-terminalia-ivoriensis-which-are-shifting-with-light-winds-with-a-calm-blue-sky.mp4,PT00H00M20S,170051_170100,"The green leaves of terminalia ivoriensis, which are shifting with light winds. with a calm blue sky"
14537098,https://ak.picdn.net/shutterstock/videos/14537098/preview/stock-footage-alien-grey-heads-faces-creepy-extraterrestrial-gray-abduction-creature-ufo-k.mp4,PT00H00M13S,061201_061250,Alien grey heads faces creepy extraterrestrial gray abduction creature ufo 4k
35032315,https://ak.picdn.net/shutterstock/videos/35032315/preview/stock-footage-busy-businessman-accountant-indoor-workplace-ask-help-businesswoman-listen-music.mp4,PT00H00M14S,129551_129600,Busy businessman accountant indoor workplace ask help businesswoman listen music
27034642,https://ak.picdn.net/shutterstock/videos/27034642/preview/stock-footage--very-nice-swans-swimming-and-eating-on-the-sea-water-video.mp4,PT00H00M14S,012901_012950, very nice swans swimming and eating on the sea water video.
1011411887,https://ak.picdn.net/shutterstock/videos/1011411887/preview/stock-footage-close-up-k-view-on-caryatid-in-niche-with-tropical-plant.mp4,PT00H00M25S,073451_073500,Close up 4k view on caryatid in niche with tropical plant
1037291873,https://ak.picdn.net/shutterstock/videos/1037291873/preview/stock-footage-durres-albania-august-people-in-durres-city-center-near-great-mosque-summer-day-albania.mp4,PT00H00M11S,123201_123250,"Durres, albania,august 20 2019: people in durres city center, near great mosque,summer day.albania"
20264266,https://ak.picdn.net/shutterstock/videos/20264266/preview/stock-footage-cheers-for-happy-new-year.mp4,PT00H00M16S,069051_069100,Cheers for happy new year
1022340721,https://ak.picdn.net/shutterstock/videos/1022340721/preview/stock-footage-bangkok-thailand-dec-twilight-view-of-bangkok-along-the-chao-phraya-river-side-opposite.mp4,PT00H00M30S,035501_035550,"Bangkok, thailand - dec 17, 2018.twilight view of bangkok along the chao phraya river side opposite to iconsiam with tourists boats and passenger boat in chao phraya river on the december 17, 2018 "
2039711,https://ak.picdn.net/shutterstock/videos/2039711/preview/stock-footage-kona-golf-clubhouse-zoom.mp4,PT00H00M05S,001051_001100,Kona golf clubhouse zoom
10836728,https://ak.picdn.net/shutterstock/videos/10836728/preview/stock-footage--k-many-bait-worm-in-motion-in-a-bag-fishing-lure-insect-maggot-for-fish-meal-by-day.mp4,PT00H00M15S,028801_028850,"4k many bait worm in motion in a bag, fishing lure, insect maggot for fish meal by day"
32457853,https://ak.picdn.net/shutterstock/videos/32457853/preview/stock-footage-autumn-colors-line-the-boise-river-with-the-city-skyline.mp4,PT00H00M29S,041501_041550,Autumn colors line the boise river with the city skyline
1023673876,https://ak.picdn.net/shutterstock/videos/1023673876/preview/stock-footage-water-flows-continuously-over-rocks-and-boulders-and-amongst-trees-in-this-natural-stream-in-the.mp4,PT00H00M28S,195801_195850,Water flows continuously over rocks and boulders and amongst trees in this natural stream in the carpathian mountains. 4k ultra hd video with sound.
1020845143,https://ak.picdn.net/shutterstock/videos/1020845143/preview/stock-footage-paris-france-circa-black-friday-sale-sign-in-the-showcase-store-window-of-a-modern.mp4,PT00H00M07S,175301_175350,"Paris, france - circa 2018: black friday sale sign in the showcase store window of a modern shopping facade on a pedestrian street with reflection of customers people"
6002846,https://ak.picdn.net/shutterstock/videos/6002846/preview/stock-footage-flowers-at-the-eternal-flame-close-up.mp4,PT00H00M18S,049351_049400,Flowers at the eternal flame close-up
29360788,https://ak.picdn.net/shutterstock/videos/29360788/preview/stock-footage-amazing-calm-landscape-at-sundown-in-countryside-the-spikelets-of-wheat-croak-in-the-wind-field.mp4,PT00H00M59S,096351_096400,Amazing calm landscape at sundown in countryside. the spikelets of wheat croak in the wind. field with young green agriculture
1065395530,https://ak.picdn.net/shutterstock/videos/1065395530/preview/stock-footage-the-tungsten-filament-in-a-classic-incandescent-glass-lamp-heats-up-and-cools-down-smoothly.mp4,PT00H00M20S,028001_028050,The tungsten filament in a classic incandescent glass lamp heats up and cools down smoothly. classic bulb burns in inert gas. extreme close-up. soft natural yellow vintage light. super macro.
1065866431,https://ak.picdn.net/shutterstock/videos/1065866431/preview/stock-footage-cinematic-close-up-shot-of-an-young-male-farmer-is-caressing-with-love-and-care-an-ecologically.mp4,PT00H00M19S,137801_137850,Cinematic close up shot of an young male farmer is caressing with love and care an ecologically grown white hen while laying egg on a hay ball and taking it in a barn of countryside agricultural farm.
1035401711,https://ak.picdn.net/shutterstock/videos/1035401711/preview/stock-footage--wild-ducks-on-the-banks-of-a-river-or-lake-brush-their-feathers-and-swim-in-the-water-in-search-of.mp4,PT00H00M10S,048351_048400, wild ducks on the banks of a river or lake brush their feathers and swim in the water in search of food. the concept of respect for the wildlife.
1018068421,https://ak.picdn.net/shutterstock/videos/1018068421/preview/stock-footage-close-up-view-of-happy-smiling-young-european-romantic-couple-stand-close-together-and-talking.mp4,PT00H00M09S,087901_087950,Close-up view of happy smiling young european romantic couple stand close together and talking outside on a cold day.
7056397,https://ak.picdn.net/shutterstock/videos/7056397/preview/stock-footage-naval-parade-a-russian-warship-july-sevastopol-crimea.mp4,PT00H00M14S,135801_135850,"Naval parade - a russian warship - july, 2014, sevastopol, crimea"
1007570278,https://ak.picdn.net/shutterstock/videos/1007570278/preview/stock-footage-kaleidoscope-seamless-loop-sequence-mandala-patterns-abstract-multicolored-motion-graphics.mp4,PT00H00M10S,095151_095200,"Kaleidoscope seamless loop sequence mandala patterns abstract multicolored motion graphics background. ideal for yoga, clubs, shows"
19842718,https://ak.picdn.net/shutterstock/videos/19842718/preview/stock-footage-close-up-view-of-banquet-table-served-for-celebration.mp4,PT00H00M09S,027051_027100,Close up view of banquet table served for celebration.
1035448700,https://ak.picdn.net/shutterstock/videos/1035448700/preview/stock-footage-a-plasticine-roll-girl-s-hand-makes-butterfly-wing-from-plasticine-on-the-table.mp4,PT00H00M17S,170201_170250,A plasticine roll. girl`s hand makes butterfly wing from plasticine on the table.
9970241,https://ak.picdn.net/shutterstock/videos/9970241/preview/stock-footage-girl-wants-to-get-out-young-girl-seats-on-a-chair-tied-up-and-a-she-looking-around-the-room-to.mp4,PT00H00M28S,097951_098000,"Girl wants to get out. young girl seats on a chair tied up and a she looking around the room to find an exit, footage in slow motion."
1055420723,https://ak.picdn.net/shutterstock/videos/1055420723/preview/stock-footage-scientist-in-a-protective-suit-and-a-respirator-examining-a-substance-in-a-test-tube.mp4,PT00H00M13S,101451_101500,Scientist in a protective suit and a respirator examining a substance in a test tube
1064229454,https://ak.picdn.net/shutterstock/videos/1064229454/preview/stock-footage-home-improvement-a-man-dismantles-a-drywall-arch-in-a-room.mp4,PT00H00M16S,001701_001750,Home improvement. a man dismantles a drywall arch in a room.
1015594483,https://ak.picdn.net/shutterstock/videos/1015594483/preview/stock-footage-boy-clown-and-make-faces-in-front-of-the-mirror.mp4,PT00H00M09S,114351_114400,Boy clown and make faces in front of the mirror
12159137,https://ak.picdn.net/shutterstock/videos/12159137/preview/stock-footage-budapest-hungary-summer-ancient-castle-in-budapest-hungary-shot-in-k-ultra-high.mp4,PT00H00M21S,010651_010700,"Budapest, hungary - summer, 2015: ancient castle in budapest. hungary. shot in 4k (ultra-high definition (uhd))."
1057433350,https://ak.picdn.net/shutterstock/videos/1057433350/preview/stock-footage-beautiful-yellow-sunflower-flower-close-up.mp4,PT00H00M10S,128051_128100,Beautiful yellow sunflower flower close-up
12267866,https://ak.picdn.net/shutterstock/videos/12267866/preview/stock-footage-vilnius-lithuania-may-street-dancers-perform-lindy-hop-dance-in-pairs-with-strangers-in.mp4,PT00H00M09S,039351_039400,"Vilnius, lithuania - may 16: street dancers perform lindy hop dance in pairs with strangers in front of public audience on may 16, 2015 in vilnius, lithuania. street music day. static shot. 4k"
1032194900,https://ak.picdn.net/shutterstock/videos/1032194900/preview/stock-footage-abstract-background-with-beautiful-color.mp4,PT00H00M07S,144901_144950,Abstract background with beautiful color
1032178121,https://ak.picdn.net/shutterstock/videos/1032178121/preview/stock-footage-shinjuku-tokyo-japan-circa-june-view-of-crowd-of-people-walking-down-the-street-in-busy.mp4,PT00H00M30S,069751_069800,"Shinjuku, tokyo, japan - circa june 2019 : view of crowd of people walking down the street in busy rush hour. many commuter walking to the train station after work. slow motion shot in early evening."
1009437644,https://ak.picdn.net/shutterstock/videos/1009437644/preview/stock-footage-background-with-animation-of-floating-rescue-buoy-on-the-water-surface-a-floating-lifebuoy.mp4,PT00H00M20S,031901_031950,Background with animation of floating rescue buoy on the water surface. a floating lifebuoy. animation of seamless loop.
1045840165,https://ak.picdn.net/shutterstock/videos/1045840165/preview/stock-footage-little-boy-with-a-bag-on-his-head-dancing-with-happy-smiling-face-on-yellow-background.mp4,PT00H00M13S,002151_002200,Little boy with a bag on his head dancing with happy smiling face on yellow background
1006671688,https://ak.picdn.net/shutterstock/videos/1006671688/preview/stock-footage-aerial-view-center-city-philadelphia-surrounding-area-at-night.mp4,PT00H00M31S,060851_060900,Aerial view center city philadelphia & surrounding area at night
20641027,https://ak.picdn.net/shutterstock/videos/20641027/preview/stock-footage-a-panoramic-view-of-vineyards-in-the-langhe-wine-area-of-piedmont-italy-and-in-the-background-the.mp4,PT00H00M14S,094701_094750,"A panoramic view of vineyards in the langhe wine area of piedmont, italy and in the background the village of barolo."
1048126042,https://ak.picdn.net/shutterstock/videos/1048126042/preview/stock-footage-johannesburg-south-africa-october-south-african-young-people-dancing-at-south-african.mp4,PT00H00M06S,143401_143450,"Johannesburg, south africa - october 2019: south african young people dancing at south african johannesburg gay pride march"
1039464323,https://ak.picdn.net/shutterstock/videos/1039464323/preview/stock-footage-london-united-kingdom-uk-an-armed-police-officer-stands-with-n-mp-assault-rifle.mp4,PT00H00M15S,119701_119750,London / united kingdom (uk) - 10 14 2019: an armed police officer stands with n mp5 assault rifle
1024218446,https://ak.picdn.net/shutterstock/videos/1024218446/preview/stock-footage-camping-fireplace-made-out-of-rocks.mp4,PT00H00M06S,040701_040750,Camping fireplace made out of rocks
1053639737,https://ak.picdn.net/shutterstock/videos/1053639737/preview/stock-footage-covid-prevention-things-sanitizer-in-bottles-rubber-gloves-mask-and-respirator-on-table.mp4,PT00H00M13S,018251_018300,"Covid-19 prevention things - sanitizer in bottles , rubber gloves, mask and respirator on table against white wall background. infection and pandemic concept."
1036757705,https://ak.picdn.net/shutterstock/videos/1036757705/preview/stock-footage-munich-tourists-passing-in-front-of-the-residenz-and-bavarian-national-theater-located-on-max.mp4,PT00H00M09S,178851_178900,Munich 2019. tourists passing in front of the residenz and bavarian national theater located on max-joseph-platz. we are in the afternoon of a warm and sunny summer day. august 2019 in munich.
26636332,https://ak.picdn.net/shutterstock/videos/26636332/preview/stock-footage-factory-production-equipment-filling-sunflower-oil-in-to-the-bottles-k.mp4,PT00H00M14S,072601_072650,Factory production equipment filling sunflower oil in to the bottles. 4k.
1022041324,https://ak.picdn.net/shutterstock/videos/1022041324/preview/stock-footage-kid-boy-training-with-a-soccer-ball-on-a-field-k-slow-motion.mp4,PT00H00M27S,026401_026450,"Kid boy training with a soccer ball on a field, 4k slow motion"
5677643,https://ak.picdn.net/shutterstock/videos/5677643/preview/stock-footage-red-carpet-white-background.mp4,PT00H00M05S,096201_096250,Red carpet. white background
1034273795,https://ak.picdn.net/shutterstock/videos/1034273795/preview/stock-footage-united-kingdom-hereford-zooming-from-space-to-earth.mp4,PT00H00M08S,105901_105950,United kingdom - hereford - zooming from space to earth
9301358,https://ak.picdn.net/shutterstock/videos/9301358/preview/stock-footage-photo-shoot-dslr-camera-k-uhd-video-professional-dslr-camera-low-key-footage-in-k-uhd-p.mp4,PT00H00M26S,173851_173900,"Photo shoot dslr camera. 4k uhd video.
professional dslr camera low key footage in 4k uhd 2160p 
"
1056005093,https://ak.picdn.net/shutterstock/videos/1056005093/preview/stock-footage-lifestyle-portrait-of-a-young-attractive-sexy-and-stylish-girl-in-a-black-leather-jacket.mp4,PT00H00M21S,030501_030550,Lifestyle. portrait of a young attractive sexy and stylish girl in a black leather jacket sunglasses with black hair in the wind. happy rejoices smiling and spinning around. background of the sea
31286188,https://ak.picdn.net/shutterstock/videos/31286188/preview/stock-footage-closeup-pour-fish-soup-with-salmon-into-bowl.mp4,PT00H00M26S,178501_178550,Closeup pour fish soup with salmon into bowl
1042230685,https://ak.picdn.net/shutterstock/videos/1042230685/preview/stock-footage-girl-picks-mushrooms-in-the-forest-brown-boletus-the-black-headed-grows-in-a-mixed-forest-young.mp4,PT00H00M18S,198501_198550,"Girl picks mushrooms in the forest. brown boletus, the black-headed, grows in a mixed forest. young forest, in russia, a lot of moss, lingonberries, blueberries. the mushroom must be carefully cut and"
6732283,https://ak.picdn.net/shutterstock/videos/6732283/preview/stock-footage-atlantic-ocean-in-madeira-portugal.mp4,PT00H00M07S,147601_147650,"Atlantic ocean in madeira,portugal"
14598040,https://ak.picdn.net/shutterstock/videos/14598040/preview/stock-footage-needles-in-snow-sways-in-the-wind.mp4,PT00H00M09S,078851_078900,Needles in snow sways in the wind
1026883088,https://ak.picdn.net/shutterstock/videos/1026883088/preview/stock-footage-close-up-for-big-hooks-of-the-metallurgical-chute-at-the-factory-heavy-industry-concept.mp4,PT00H00M05S,138351_138400,"Close up for big hooks of the metallurgical chute at the factory, heavy industry concept. mechanisms of metallurgical plant."
1029480635,https://ak.picdn.net/shutterstock/videos/1029480635/preview/stock-footage-russia-moscow-a-street-artist-in-prague-manipulating-a-puppet.mp4,PT00H00M08S,084551_084600,Russia. moscow.2019. a street artist in prague manipulating a puppet
1038203030,https://ak.picdn.net/shutterstock/videos/1038203030/preview/stock-footage-side-view-of-adult-red-kangaroo-macropus-rufus-standing-on-the-red-sand-of-outback-central.mp4,PT00H00M08S,106901_106950,"Side view of adult red kangaroo, macropus rufus, standing on the red sand of outback central australia. australian marsupial in northern territory, red center. desert landscape at twilight."
