videoid,contentUrl,duration,page_dir,name
2872075,https://ak.picdn.net/shutterstock/videos/2872075/preview/stock-footage-color-smoke-on-a-black-background.mp4,PT00H00M30S,072951_073000,Color smoke on a black background
1018783279,https://ak.picdn.net/shutterstock/videos/1018783279/preview/stock-footage-sail-rock-thailand-free-diver-in-bikini.mp4,PT00H00M35S,187701_187750,Sail rock/thailand/ 16.10.2018 free diver in bikini
16355446,https://ak.picdn.net/shutterstock/videos/16355446/preview/stock-footage-man-using-laptop-with-green-screen-in-cafe-k-fps-prores-hq.mp4,PT00H00M14S,081701_081750,Man using laptop with green screen in cafe. 4k 30fps prores (hq)
31548604,https://ak.picdn.net/shutterstock/videos/31548604/preview/stock-footage-kalk-bay-harbour-light-with-rusting-metal-at-entrance-to-fishing-harbour-on-end-of-pier-with.mp4,PT00H00M15S,031551_031600,Kalk bay harbour light with rusting metal at entrance to fishing harbour on end of pier with breaking waves onto sea wall with restaurant with people & houses on hillside behind.
34663144,https://ak.picdn.net/shutterstock/videos/34663144/preview/stock-footage-wind-through-high-grass.mp4,PT00H00M17S,145151_145200,Wind through high grass
1043792677,https://ak.picdn.net/shutterstock/videos/1043792677/preview/stock-footage-circa-a-living-snowman-sees-a-calendar-discovers-the-month-of-july-climbs-into-a.mp4,PT00H00M40S,003001_003050,"Circa 1944, - a living snowman sees a calendar, discovers the month of july, climbs into a refrigerator and waits for spring."
1027809071,https://ak.picdn.net/shutterstock/videos/1027809071/preview/stock-footage-a-man-a-fisherman-cuts-a-fish-of-a-lively-big-fish-just-caught-into-pieces-cleaning-freshwater.mp4,PT00H00M12S,062301_062350,A man a fisherman cuts a fish of a lively big fish just caught into pieces. cleaning freshwater fish for further cooking
7869895,https://ak.picdn.net/shutterstock/videos/7869895/preview/stock-footage-erskine-river-running-through-the-otways-national-park-along-the-great-ocean-road-australia.mp4,PT00H00M10S,184151_184200,"Erskine river running through the otways national park along the great ocean road, australia"
11425751,https://ak.picdn.net/shutterstock/videos/11425751/preview/stock-footage-disappointed-businessman-browse-internet-mail-tablet-receive-message-bad-news-ultra-high.mp4,PT00H00M26S,102551_102600,"Disappointed businessman browse internet mail tablet receive message bad news ( ultra high definition, ultrahd, ultra hd, uhd, 4k, 2160p, 4096x2160 )"
24158950,https://ak.picdn.net/shutterstock/videos/24158950/preview/stock-footage-aerial-shot-of-a-lighthouse-in-holland.mp4,PT00H00M14S,028601_028650,Aerial shot of a lighthouse in holland
1052972543,https://ak.picdn.net/shutterstock/videos/1052972543/preview/stock-footage-happy-cheerful-family-having-fun-in-park-active-young-children-enjoy-playing-funny-activity.mp4,PT00H00M15S,132951_133000,Happy cheerful family having fun in park.active young children enjoy playing funny activity together with father.little girl blowing soap bubbles.playful cute preschool kid leisure outdoor soap bubble
1024354472,https://ak.picdn.net/shutterstock/videos/1024354472/preview/stock-footage-the-rocks-los-gigantos-from-top-point-of-view.mp4,PT00H00M10S,062251_062300,The rocks los gigantos from top point of view
1014854836,https://ak.picdn.net/shutterstock/videos/1014854836/preview/stock-footage-red-haired-dog-runs-along-foliage-in-an-autumn-park-slow-motion.mp4,PT00H00M07S,066351_066400,Red haired dog runs along foliage in an autumn park. slow motion
1050922675,https://ak.picdn.net/shutterstock/videos/1050922675/preview/stock-footage-miyajima-japan-nov-establishing-shot-of-visitors-are-seen-relaxing-near-seaside-area.mp4,PT00H00M10S,174851_174900,"Miyajima, japan - nov. 1, 2019: establishing shot of visitors are seen relaxing near seaside area in miyajima"
1031736482,https://ak.picdn.net/shutterstock/videos/1031736482/preview/stock-footage-bait-ball-in-coral-reef-of-caribbean-sea-around-curacao-at-dive-site-playa-grandi.mp4,PT00H00M20S,125251_125300,Bait ball in coral reef of caribbean sea around curacao at dive site playa grandi
7961791,https://ak.picdn.net/shutterstock/videos/7961791/preview/stock-footage-sunset-time-lapse-at-baltimore-inner-harbor-with-thick-cloud-cover.mp4,PT00H00M12S,185001_185050,Sunset time-lapse at baltimore inner harbor with thick cloud cover
1014613364,https://ak.picdn.net/shutterstock/videos/1014613364/preview/stock-footage-abstract-animated-background-with-waves-and-glare-on-the-surface-of-an-amorphous-liquid.mp4,PT00H00M20S,192901_192950,Abstract animated background with waves and glare on the surface of an amorphous liquid. multicolored 3d-film with different gradients. a brilliant surface with a rainbow reflection.
1029951995,https://ak.picdn.net/shutterstock/videos/1029951995/preview/stock-footage-moscow-russia-may-spring-bike-festival-parade-of-cyclists-men-women-and-children-ride.mp4,PT00H00M20S,059251_059300,"Moscow, russia, 19 may 2019. spring bike festival. parade of cyclists. men, women and children ride a bicycle.

"
1036919921,https://ak.picdn.net/shutterstock/videos/1036919921/preview/stock-footage-young-beautiful-woman-in-a-red-swimsuit-sits-in-tall-green-grass-pretty-girl-straightens-her-hair.mp4,PT00H00M09S,084951_085000,Young beautiful woman in a red swimsuit sits in tall green grass. pretty girl straightens her hair. concept of freedom and enjoying life. portrait of attractive city hipster woman on vacation.
10693823,https://ak.picdn.net/shutterstock/videos/10693823/preview/stock-footage-cu-help-wanted-signboard-frozen-in-ice-block.mp4,PT00H00M12S,187101_187150,"Cu ""help wanted"" signboard frozen in ice block."
28738858,https://ak.picdn.net/shutterstock/videos/28738858/preview/stock-footage-insect-macro-mimela-is-genus-of-shining-leaf-chafer-belonging-to-family-scarabeidae-eat-burdock.mp4,PT00H00M24S,060451_060500,Insect macro mimela is genus of shining leaf chafer belonging to family scarabeidae eat burdock leaves
4451687,https://ak.picdn.net/shutterstock/videos/4451687/preview/stock-footage-baking-a-homemade-pizza-in-a-hot-oven.mp4,PT00H00M11S,078401_078450,Baking a homemade pizza in a hot oven
30005896,https://ak.picdn.net/shutterstock/videos/30005896/preview/stock-footage-showroom-dining-table-for-typical-house-in-north-america.mp4,PT00H00M16S,042751_042800,Showroom dining table for typical  house in north america.
24956114,https://ak.picdn.net/shutterstock/videos/24956114/preview/stock-footage-aerial-view-of-salt-lakes-on-ria-formosa-in-tavira.mp4,PT00H00M30S,000451_000500,Aerial. view of salt lakes on ria formosa in tavira
1016957941,https://ak.picdn.net/shutterstock/videos/1016957941/preview/stock-footage--s-executives-in-suits-speak-around-a-table.mp4,PT00H00M19S,149951_150000,1930s: executives in suits speak around a table.
1008094090,https://ak.picdn.net/shutterstock/videos/1008094090/preview/stock-footage-shrimp-soup-is-a-thai-dish-with-a-sour-and-spicy-taste-the-man-is-eating-tom-yam-at-a-table-by-the.mp4,PT00H00M24S,003651_003700,"Shrimp soup is a thai dish with a sour and spicy taste. the man is eating tom yam at a table by the pool. 4k, slow motion, close-up. concept of tourism"
5516759,https://ak.picdn.net/shutterstock/videos/5516759/preview/stock-footage-crispy-fried-insects.mp4,PT00H00M20S,109751_109800,Crispy fried insects
1027643777,https://ak.picdn.net/shutterstock/videos/1027643777/preview/stock-footage-digital-composite-of-female-walking-by-the-shore-during-sunset-background-shows-holy-bible-and.mp4,PT00H00M12S,098801_098850,Digital composite of female walking by the shore during sunset. background shows holy bible and crucifix
29727979,https://ak.picdn.net/shutterstock/videos/29727979/preview/stock-footage-bathroom-digital-scale-close-up-with-digits-running-up.mp4,PT00H00M10S,015451_015500,Bathroom digital scale close up with digits running up.
1021906951,https://ak.picdn.net/shutterstock/videos/1021906951/preview/stock-footage-the-doctor-applies-a-special-gel-to-the-patient-anti-acne-phototherapy-with-professional-equipment.mp4,PT00H00M10S,122351_122400,The doctor applies a special gel to the patient. anti acne phototherapy with professional equipment. beautiful woman during photo rejuvenation procedure. face skin treatment at cosmetic clinic.
1019364274,https://ak.picdn.net/shutterstock/videos/1019364274/preview/stock-footage-famous-pura-ulun-danu-bratan-temple-on-beratan-lake-in-bali-island-indonesia-at-foggy-sunrise.mp4,PT00H00M04S,077101_077150,"Famous pura ulun danu bratan temple on beratan lake in bali island, indonesia at foggy sunrise. iconic image of bali and southeast asia. balinese culture and religion concept."
26342546,https://ak.picdn.net/shutterstock/videos/26342546/preview/stock-footage-volgograd-russia-august-sentry-guard-of-honor.mp4,PT00H00M07S,186351_186400,"Volgograd russia, august 28, 2013 sentry guard of honor "
34671721,https://ak.picdn.net/shutterstock/videos/34671721/preview/stock-footage-this-is-a-time-lapse-video-of-some-morning-glory-flowers-closing-after-the-sun-starts-setting.mp4,PT00H00M11S,022651_022700,This is a time lapse video of some morning glory flowers closing after the sun starts setting.  
11635712,https://ak.picdn.net/shutterstock/videos/11635712/preview/stock-footage-jack-hammer-demolishing-full-k-hd.mp4,PT00H00M12S,028851_028900,Jack hammer demolishing (full 4k hd)
32803852,https://ak.picdn.net/shutterstock/videos/32803852/preview/stock-footage-streets-and-buildings-in-downtown-tulsa-tulsa-oklahoma-october.mp4,PT00H00M11S,064951_065000,"Streets and buildings in downtown tulsa - tulsa / oklahoma - october 15, 2017"
1052155117,https://ak.picdn.net/shutterstock/videos/1052155117/preview/stock-footage-slow-motion-man-hands-check-bottom-of-blue-ceramic-glass.mp4,PT00H00M22S,076051_076100,Slow motion man hands check bottom of blue ceramic glass
16547668,https://ak.picdn.net/shutterstock/videos/16547668/preview/stock-footage-wild-flowers-purple.mp4,PT00H00M36S,050051_050100,Wild flowers purple
1010852144,https://ak.picdn.net/shutterstock/videos/1010852144/preview/stock-footage-six-burner-outdoor-gas-grill-with-open-lid-on-back-patio.mp4,PT00H00M18S,060501_060550,Six burner outdoor gas grill with open lid on back patio.
1021953952,https://ak.picdn.net/shutterstock/videos/1021953952/preview/stock-footage-motor-boat-sailing-away-on-the-waves-of-the-sea.mp4,PT00H00M11S,073551_073600,Motor boat sailing away on the waves of the sea
1010700644,https://ak.picdn.net/shutterstock/videos/1010700644/preview/stock-footage-raspberry-jam-on-biscuit-waffles-on-a-rotating-white-background-k.mp4,PT00H00M17S,147851_147900,Raspberry jam on biscuit waffles. on a rotating white background. 4k 
5591084,https://ak.picdn.net/shutterstock/videos/5591084/preview/stock-footage-rain-in-the-mountains-crimea-ukraine-plateau-baba-dag-cave-city-mangup-kale-xiv-xviii.mp4,PT00H00M10S,117851_117900,"Rain in the mountains. crimea. ukraine. plateau baba-dag. cave city mangup-kale. xiv-xviii centuries
"
1038031931,https://ak.picdn.net/shutterstock/videos/1038031931/preview/stock-footage-adler-russia-april-signing-fountain-in-olympic-park-of-sochi-people-watch-a-musical.mp4,PT00H00M16S,054651_054700,"Adler, russia - april 10, 2019: signing fountain in olympic park of sochi. people watch a musical light show near the singing fountains in the olympic park."
6855445,https://ak.picdn.net/shutterstock/videos/6855445/preview/stock-footage-looped-seamless-footage-for-your-event-concert-title-presentation-site-dvd-music-videos.mp4,PT00H00M13S,183651_183700,"Looped seamless footage for your event, concert, title, presentation, site, dvd, music videos, video art, holiday show, party, etc… also useful for motion designers, editors and vj s for led screens."
19667572,https://ak.picdn.net/shutterstock/videos/19667572/preview/stock-footage-marine-pollution-a-tyre-partially-submerged-next-to-stones.mp4,PT00H00M34S,112751_112800,"Marine pollution, a tyre partially submerged next to stones"
1010566016,https://ak.picdn.net/shutterstock/videos/1010566016/preview/stock-footage-beautiful-woman-relaxing-near-the-swimming-pool-in-countryside.mp4,PT00H00M39S,142951_143000,Beautiful woman relaxing near the swimming pool in countryside
1020104167,https://ak.picdn.net/shutterstock/videos/1020104167/preview/stock-footage-cologne-germany-june-outside-view-of-cologne-cathedral-in-downtown-of-the-city-taken-from.mp4,PT00H00M16S,001401_001450,"Cologne, germany - june 4: outside view of cologne cathedral in downtown of the city, taken from the intersection nearby with busy traffic going by in germany, june 4, 2010."
1016318896,https://ak.picdn.net/shutterstock/videos/1016318896/preview/stock-footage-attractive-young-fashion-man-in-a-suit-walks-in-the-garden-next-to-the-villa-slow-motion.mp4,PT00H00M18S,124051_124100,"Attractive young fashion man in a suit walks in the garden next to the villa. slow motion 
"
1054259543,https://ak.picdn.net/shutterstock/videos/1054259543/preview/stock-footage-above-view-of-a-woman-sewing-diy-facemasks-out-of-old-clothes-during-the-coronavirus-outbreak.mp4,PT00H00M44S,080151_080200,Above view of a woman sewing diy facemasks out of old clothes during the coronavirus outbreak - slow motion
1029877532,https://ak.picdn.net/shutterstock/videos/1029877532/preview/stock-footage-gomel-belarus-may-palace-and-park-ensemble-paskevichi-a-man-mows-a-lawn-lawnmower.mp4,PT00H00M27S,121501_121550,"Gomel, belarus - may 15, 2019: palace and park ensemble paskevichi. a man mows a lawn lawnmower."
1045043350,https://ak.picdn.net/shutterstock/videos/1045043350/preview/stock-footage-realistic-planet-moon-luna-lunar-rotating-k-perfect-for-your-own-background-using-green-screen.mp4,PT00H00M40S,044301_044350,"Realistic planet moon, luna, lunar rotating, 4k. perfect for your own background using green screen. high detailed texture"
8091121,https://ak.picdn.net/shutterstock/videos/8091121/preview/stock-footage-bucharest-romania-december-police-cars-for-intervention-drive-in-town-military-ceremony.mp4,PT00H00M05S,193301_193350,"Bucharest, romania - december 1, 2014 police cars for intervention drive in town, military ceremony for national day"
1049856289,https://ak.picdn.net/shutterstock/videos/1049856289/preview/stock-footage-woman-housewife-is-putting-pasta-in-pan-on-stove-at-home-kitchen-spbdfemale-hands-add-ingredient.mp4,PT00H00M21S,195851_195900,Woman housewife is putting pasta in pan on stove at home kitchen. spbdfemale hands add ingredient in saucepan with fried tomatoes and stir while cooking hot dish at house interior. person is in
30044980,https://ak.picdn.net/shutterstock/videos/30044980/preview/stock-footage-thailand-august-beautiful-aerial-view-from-yon-bay-phuket.mp4,PT00H00M19S,199601_199650,"Thailand , 18 august 2017 ::beautiful aerial view from yon bay phuket"
1016152696,https://ak.picdn.net/shutterstock/videos/1016152696/preview/stock-footage-attractive-young-woman-wearing-a-towel-on-bed.mp4,PT00H00M08S,149051_149100,Attractive young woman wearing a towel on bed
1017917080,https://ak.picdn.net/shutterstock/videos/1017917080/preview/stock-footage-particles-blue-bokeh-dust-abstract-light-motion-titles-cinematic-background-loop.mp4,PT00H00M12S,072351_072400,Particles blue bokeh dust abstract light motion titles cinematic background loop
5401262,https://ak.picdn.net/shutterstock/videos/5401262/preview/stock-footage-stop-motion-of-a-flip-clock-this-is-a-super-high-quality-k-version-at-x-pixels.mp4,PT00H00M24S,120501_120550,Stop motion of a flip clock. this is a super high quality 4k version at 4096x2304 pixels
1016895907,https://ak.picdn.net/shutterstock/videos/1016895907/preview/stock-footage-roccia-dell-elefante-telti.mp4,PT00H00M20S,042801_042850,"Roccia dell'elefante, telti"
1040947997,https://ak.picdn.net/shutterstock/videos/1040947997/preview/stock-footage-young-cute-woman-walking-on-meadow.mp4,PT00H00M20S,013301_013350,Young cute woman walking on meadow.
1030969196,https://ak.picdn.net/shutterstock/videos/1030969196/preview/stock-footage-intro-render-d-background-illustration-art-design-effects-abstract-texture-k.mp4,PT00H00M07S,088151_088200,Intro render 3d background illustration art design effects abstract texture 4k
1015123417,https://ak.picdn.net/shutterstock/videos/1015123417/preview/stock-footage-a-man-with-a-beard-brushing-his-teeth.mp4,PT00H00M27S,066001_066050,A man with a beard brushing his teeth
1027243007,https://ak.picdn.net/shutterstock/videos/1027243007/preview/stock-footage-hummingbird-male-feeding.mp4,PT00H00M33S,138001_138050,Hummingbird male feeding 
1027860818,https://ak.picdn.net/shutterstock/videos/1027860818/preview/stock-footage-dried-dates-fruit-with-clock-showing-time-to-break-fasting-on-wooden-table-selective-focus.mp4,PT00H00M15S,017601_017650,Dried dates fruit with clock showing time to break fasting on wooden table. selective focus.
29789776,https://ak.picdn.net/shutterstock/videos/29789776/preview/stock-footage-kid-running-down-the-sidewalk-from-dad-video.mp4,PT00H00M14S,089151_089200,"Kid running down the sidewalk from dad, video"
1015181773,https://ak.picdn.net/shutterstock/videos/1015181773/preview/stock-footage-woman-show-makeup-brush-in-live-at-home.mp4,PT00H00M17S,007801_007850,Woman show makeup brush in live at home
1024865996,https://ak.picdn.net/shutterstock/videos/1024865996/preview/stock-footage-salmon-fry-in-a-pan-cooking-fish-steak-sprinkle-seasoning.mp4,PT00H00M16S,179251_179300,"Salmon fry in a pan. cooking fish steak, sprinkle seasoning."
1057559791,https://ak.picdn.net/shutterstock/videos/1057559791/preview/stock-footage-back-view-sportswoman-doing-morning-warming-up-on-beach-at-dramatic-sun-and-sky-background.mp4,PT00H00M25S,117401_117450,Back view sportswoman doing morning warming up on beach at dramatic sun and sky background. silhouette of athletic girl exercising outdoor at seaside. shot on red raven 4k cinema camera
1057265026,https://ak.picdn.net/shutterstock/videos/1057265026/preview/stock-footage-vineyard-with-young-green-unripe-grapes-grape-corridor-two-rows-of-grape-bushes-with-bunches-grow.mp4,PT00H00M09S,192051_192100,Vineyard with young green unripe grapes. grape corridor. two rows of grape bushes with bunches grow in vineyard farm. view to grape lines with bunches.
1042903117,https://ak.picdn.net/shutterstock/videos/1042903117/preview/stock-footage-happy-young-family-mother-holding-baby-her-new-born-son-high-happy-family-concept.mp4,PT00H00M18S,106851_106900,"Happy young family - mother holding baby, her new born son high. happy family concept."
1053982151,https://ak.picdn.net/shutterstock/videos/1053982151/preview/stock-footage-asian-woman-in-jewerly-and-red-swimsuit-in-swimming-pool-with-coconut.mp4,PT00H00M08S,014101_014150,Asian woman in jewerly and red swimsuit in swimming pool with coconut
1039637963,https://ak.picdn.net/shutterstock/videos/1039637963/preview/stock-footage-garut-indonesia-october-one-of-the-view-on-the-beach-jetty-in-garut.mp4,PT00H00M13S,125151_125200,"Garut, indonesia - 21 october 2019: one of the view on the beach jetty in garut"
6472088,https://ak.picdn.net/shutterstock/videos/6472088/preview/stock-footage-beige-female-flip-flops-flip-flops-shoes-boots-on-the-sandy-beach-summer-vacation-full-hd-with.mp4,PT00H00M10S,048601_048650,Beige female flip-flops flip flops shoes boots on the sandy beach. summer vacation. full hd with motorized slider. 1080p.
30834919,https://ak.picdn.net/shutterstock/videos/30834919/preview/stock-footage-wheat-field-in-the-village-yellow-golden-wheat-swayed-in-the-wind.mp4,PT00H00M17S,138151_138200,Wheat field in the village. yellow golden wheat swayed in the wind.
1040063819,https://ak.picdn.net/shutterstock/videos/1040063819/preview/stock-footage-vertical-video-attractive-young-man-use-phone-on-the-forest-smile-look-around-vertical-screen-video.mp4,PT00H00M14S,137051_137100,Vertical video attractive young man use phone on the forest smile look around vertical screen video handsome internet lifestyle apartment call chatting communication slow motion
9120803,https://ak.picdn.net/shutterstock/videos/9120803/preview/stock-footage-close-up-of-a-child-painting-with-pastels-at-school-k.mp4,PT00H00M21S,101551_101600,"Close up  of a child painting with pastels at school, 4k"
1037374760,https://ak.picdn.net/shutterstock/videos/1037374760/preview/stock-footage-bosphorus-bridge-of-istanbul-city-from-a-ferryboat.mp4,PT00H00M29S,086101_086150,Bosphorus bridge of istanbul city from a ferryboat.
1007425690,https://ak.picdn.net/shutterstock/videos/1007425690/preview/stock-footage-male-hands-pouring-hot-water-into-bowl-for-brewing-tea-man-hand-taking-tea-cup.mp4,PT00H00M21S,171401_171450,Male hands pouring hot water into bowl for brewing tea. man hand taking tea cup
1006645624,https://ak.picdn.net/shutterstock/videos/1006645624/preview/stock-footage-circa-air-force-planes-drop-bombs-on-german-industrial-targets-in-mulhouse-france-at-the.mp4,PT00H00M55S,061301_061350,"Circa 1944 - air force planes drop bombs on german industrial targets in mulhouse, france at the end of may, during wwii."
22900141,https://ak.picdn.net/shutterstock/videos/22900141/preview/stock-footage-advent-white-candles-over-that-revolve-decorations-made-of-plywood-depicting-angels-or-christmas.mp4,PT00H00M16S,110251_110300,Advent white candles over that revolve decorations made of plywood depicting angels or christmas trees 
1010925263,https://ak.picdn.net/shutterstock/videos/1010925263/preview/stock-footage-aerial-view-of-rhyl-in-wales-united-kingdom.mp4,PT00H00M47S,143251_143300,Aerial view of rhyl in wales - united kingdom
5435960,https://ak.picdn.net/shutterstock/videos/5435960/preview/stock-footage-attractive-young-woman-sitting-at-cafe-with-cup-of-tea-using-touchpad-looking-at-camera-and-smiling.mp4,PT00H00M21S,013201_013250,Attractive young woman sitting at cafe with cup of tea using touchpad looking at camera and smiling. panning camera
14571640,https://ak.picdn.net/shutterstock/videos/14571640/preview/stock-footage-vote-ballot-box-election-democracy-pick-favorite-animation-k.mp4,PT00H00M08S,135151_135200,Vote ballot box election democracy pick favorite animation 4k
1060145267,https://ak.picdn.net/shutterstock/videos/1060145267/preview/stock-footage-a-drone-flies-around-a-fishing-vessel-drifting-near-an-island-in-the-indian-ocean-sunset.mp4,PT00H00M22S,065901_065950,A drone flies around a fishing vessel drifting near an island in the indian ocean. sunset
32175370,https://ak.picdn.net/shutterstock/videos/32175370/preview/stock-footage--d-animation-flying-over-an-abstract-geometric-light-structure-of-mountains.mp4,PT00H00M12S,108351_108400,3d animation - flying over an abstract geometric light structure of mountains
5324132,https://ak.picdn.net/shutterstock/videos/5324132/preview/stock-footage-groups-of-seagulls-on-the-beach.mp4,PT00H00M06S,047651_047700,Groups of seagulls on the beach.
17265667,https://ak.picdn.net/shutterstock/videos/17265667/preview/stock-footage-blur-in-italy-abstract-background-of-cereal-plant-move-by-the-wind.mp4,PT00H00M11S,185651_185700,"Blur in italy  abstract background of cereal plant   move by the wind 
"
1048731328,https://ak.picdn.net/shutterstock/videos/1048731328/preview/stock-footage-india-new-delhi-november-two-indian-men-are-discussing-a-passing-conference-gesturing.mp4,PT00H00M05S,042401_042450,"India, new delhi - november 15, 2019: two indian men are discussing a passing conference, gesturing to the stage. against the background lot of people in the hall. people wear national hats - dastar"
29843587,https://ak.picdn.net/shutterstock/videos/29843587/preview/stock-footage-on-air-sign-on-air-wooden-concept-on-a-brick-wall.mp4,PT00H00M19S,179201_179250,On air sign / on air wooden concept on a brick wall 
33683164,https://ak.picdn.net/shutterstock/videos/33683164/preview/stock-footage-belly-of-pregnant-woman-and-hands-sharpen-kitchen-knife-on-table-static-closeup-shot-k-uhd.mp4,PT00H00M15S,148351_148400,Belly of pregnant woman and hands sharpen kitchen knife on table. static closeup shot. 4k uhd
15347716,https://ak.picdn.net/shutterstock/videos/15347716/preview/stock-footage-aerial-bird-eye-backwards-muider-castle-in-dutch-muiderslot-located-in-muiden-at-mouth-of-vecht.mp4,PT00H00M11S,033151_033200,Aerial bird-eye backwards muider castle in dutch muiderslot located in muiden at mouth of vecht some 15 kilometers southeast of amsterdam this middle ages defensive stone keep great tourist visit 4k
7204186,https://ak.picdn.net/shutterstock/videos/7204186/preview/stock-footage-large-pile-of-rocks-and-dirt.mp4,PT00H00M07S,123401_123450,Large pile of rocks and dirt
1008431080,https://ak.picdn.net/shutterstock/videos/1008431080/preview/stock-footage-cheerful-pregnant-woman-walking-in-mountains.mp4,PT00H00M10S,054751_054800,Cheerful pregnant woman walking in mountains
1025190566,https://ak.picdn.net/shutterstock/videos/1025190566/preview/stock-footage-process-of-laying-of-parquet-floor-handyman-at-work-gluing-of-herringbone-parquet.mp4,PT00H00M17S,004351_004400,Process of laying of parquet floor. handyman at work. gluing of herringbone parquet
23116684,https://ak.picdn.net/shutterstock/videos/23116684/preview/stock-footage-beautiful-tree-covered-with-snow-close-up-view-in-the-frosty-winter-the-christmas-forest.mp4,PT00H00M09S,031851_031900,"Beautiful tree covered with snow, close-up view, in the frosty winter, the christmas forest"
1045037632,https://ak.picdn.net/shutterstock/videos/1045037632/preview/stock-footage-detifoss-waterfall-in-iceland-close-shot-cloudy-day.mp4,PT00H00M07S,050301_050350,Detifoss waterfall in iceland close shot cloudy day
