videoid,contentUrl,duration,page_dir,name
10466771,https://ak.picdn.net/shutterstock/videos/10466771/preview/stock-footage-moscow-jun-model-of-aircrafts-in-museum-of-aircraft-design-company-of-tupolev-more.mp4,PT00H00M09S,046801_046850,"Moscow - jun, 21 2014: model of aircrafts in museum of aircraft design company of tupolev. more than 18 thousand aircrafts of aircraft design company of tupolev are release"
10580105,https://ak.picdn.net/shutterstock/videos/10580105/preview/stock-footage-woman-standing-in-the-water-shaking-her-hair-spray-flying-in-all-directions.mp4,PT00H00M02S,035801_035850,"Woman standing in the water shaking her hair, spray flying in all directions"
1024933964,https://ak.picdn.net/shutterstock/videos/1024933964/preview/stock-footage-young-woman-reads-through-what-she-wrote-in-journal-slow-motion-shot.mp4,PT00H00M12S,098351_098400,"Young woman reads through what she wrote in journal, slow motion shot"
1013196650,https://ak.picdn.net/shutterstock/videos/1013196650/preview/stock-footage-jerusalem-israel-december-two-people-walking-on-a-dark-alley.mp4,PT00H00M13S,087151_087200,"Jerusalem, israel - december, 2017: two people walking on a dark alley."
1038865004,https://ak.picdn.net/shutterstock/videos/1038865004/preview/stock-footage-woman-visits-young-cosmetologist-doctor-the-doctor-consults-with-the-patient.mp4,PT00H00M09S,181501_181550,Woman visits young cosmetologist doctor. the doctor consults with the patient
20446495,https://ak.picdn.net/shutterstock/videos/20446495/preview/stock-footage-clouds-above-landscape-with-mountains-and-small-towns-during-flight-timelapse.mp4,PT00H00M18S,044251_044300,Clouds above landscape with mountains and small towns during flight. timelapse
1064067742,https://ak.picdn.net/shutterstock/videos/1064067742/preview/stock-footage-artist-mixing-colors-in-the-palette-with-the-brush.mp4,PT00H00M15S,188001_188050,Artist mixing colors in the palette with the brush
29759062,https://ak.picdn.net/shutterstock/videos/29759062/preview/stock-footage--d-animation-rotation-of-symbol-of-transport-transportation-delivery-transport-for-travel-sport.mp4,PT00H00M20S,032651_032700,"3d animation rotation of symbol of transport, transportation, delivery, transport for travel, sport cars, mechanisms, machinery and transport technology from glass. animation of seamless loop."
31347484,https://ak.picdn.net/shutterstock/videos/31347484/preview/stock-footage-rock-building-ruins-near-trees-pan-right-to-left.mp4,PT00H00M06S,181251_181300,Rock building ruins near trees - pan - right to left
14307742,https://ak.picdn.net/shutterstock/videos/14307742/preview/stock-footage-timelapse-of-single-lonely-coconut-tree-and-beautiful-formation-of-moving-cloud-at-the-beach-with.mp4,PT00H00M14S,127951_128000,Timelapse of single lonely coconut tree and beautiful formation of moving cloud at the beach with copy space area.
1014288323,https://ak.picdn.net/shutterstock/videos/1014288323/preview/stock-footage-pouring-corn-grain-after-harvest-close-up-falling-yellow-wheat.mp4,PT00H00M10S,190351_190400,"Pouring corn grain after harvest, close up. falling yellow wheat."
1040343623,https://ak.picdn.net/shutterstock/videos/1040343623/preview/stock-footage-high-metal-cranes-operate-on-construction-site-of-building-skyscraper-in-new-city-dwelling-complex.mp4,PT00H00M12S,064051_064100,High metal cranes operate on construction site of building skyscraper in new city dwelling complex aerial panorama
9693260,https://ak.picdn.net/shutterstock/videos/9693260/preview/stock-footage-bang-pa-in-thailand-circa-nov-local-artisan-weaving-a-beautiful-colorful-mat-with.mp4,PT00H00M28S,036101_036150,Bang pa-in. thailand - circa nov 2013: local artisan weaving a beautiful. colorful mat with intricate patterns by hand on a traditional. wooden loom.
34650475,https://ak.picdn.net/shutterstock/videos/34650475/preview/stock-footage-slow-motion-footage-of-cheerful-young-mother-holding-her-toddler-son-and-spinning-on-grass-at-park.mp4,PT00H00M22S,136001_136050,Slow motion footage of cheerful young mother holding her toddler son and spinning on grass at park
1024472609,https://ak.picdn.net/shutterstock/videos/1024472609/preview/stock-footage-aerial-flyover-view-of-shadows-of-clouds-in-canyon-landscape-mexican-hat-utah-united-states.mp4,PT00H00M20S,019951_020000,"Aerial flyover view of shadows of clouds in canyon landscape / mexican hat, utah, united states"
1058866348,https://ak.picdn.net/shutterstock/videos/1058866348/preview/stock-footage-rally-car-driving-fast-in-cross-country-road-fast-car-is-going-with-dust-speed-off-road-riding-on.mp4,PT00H00M06S,035801_035850,Rally car driving fast in cross-country road. fast car is going with dust. speed off-road riding on dusty road.
1020351613,https://ak.picdn.net/shutterstock/videos/1020351613/preview/stock-footage-feet-of-woman-goes-on-snow-winter-and-ice-slow-motion.mp4,PT00H00M06S,138151_138200,"Feet of woman goes on snow winter and ice, slow motion"
32093689,https://ak.picdn.net/shutterstock/videos/32093689/preview/stock-footage-close-up-on-bubbles-rising-in-champagne-flute-slow-motion-sparkling-wine.mp4,PT00H00M17S,029451_029500,Close up on bubbles rising in champagne flute slow motion sparkling wine
1029148262,https://ak.picdn.net/shutterstock/videos/1029148262/preview/stock-footage-balikpapan-indonesia-mei-landscape-time-lapse-with-other-houses.mp4,PT00H00M51S,113201_113250,"Balikpapan, indonesia - 08 mei 2019: landscape time lapse with other houses."
8728702,https://ak.picdn.net/shutterstock/videos/8728702/preview/stock-footage-spirit-lake-british-columbia-environmental-scenic-landscape-travel-location-extreme-island-clear.mp4,PT00H00M29S,056351_056400,Spirit lake british columbia environmental scenic landscape travel location extreme island clear blue water reflections
1025223548,https://ak.picdn.net/shutterstock/videos/1025223548/preview/stock-footage-masai-mara-kenya-may-maasai-lion-yawning-africa.mp4,PT00H00M16S,058901_058950,"Masai mara, kenya - may 2016: maasai lion yawning, africa."
1059967691,https://ak.picdn.net/shutterstock/videos/1059967691/preview/stock-footage-young-father-and-little-girl-play-soccer-ball-on-green-lawn-in-summer-park-father-plays-with-child.mp4,PT00H00M14S,125851_125900,Young father and little girl play soccer ball on green lawn in summer park. father plays with child outdoors in nature. happy family holiday weekend concept
1036310240,https://ak.picdn.net/shutterstock/videos/1036310240/preview/stock-footage-walking-on-a-paved-road-in-the-garden-italy-slow-motion-fps.mp4,PT00H00M10S,038451_038500,"Walking on a paved road in the garden, italy, slow motion, 60 fps"
1024656773,https://ak.picdn.net/shutterstock/videos/1024656773/preview/stock-footage-baby-boy-on-the-potty-at-home.mp4,PT00H00M23S,014901_014950,Baby boy on the potty at home.
32788957,https://ak.picdn.net/shutterstock/videos/32788957/preview/stock-footage-manager-in-workplace-using-his-smartphone-with-to-scroll-a-facebook-account-feed-scrolling-news.mp4,PT00H00M11S,127701_127750,"Manager in workplace using his smartphone with to scroll a facebook account feed, scrolling news, tapping on screen. hands top view. businessman at the table. kaliningrad - november 2017 russian"
25290188,https://ak.picdn.net/shutterstock/videos/25290188/preview/stock-footage-businessman-touching-invisible-screen-against-green-screen.mp4,PT00H00M16S,065901_065950,Businessman touching invisible screen against green screen
3393593,https://ak.picdn.net/shutterstock/videos/3393593/preview/stock-footage-flower.mp4,PT00H00M09S,190001_190050,Flower
20202553,https://ak.picdn.net/shutterstock/videos/20202553/preview/stock-footage-closeup-of-customer-service-manager-standing-in-call-center.mp4,PT00H00M11S,042251_042300,Closeup of customer service manager standing in call center 
1033540868,https://ak.picdn.net/shutterstock/videos/1033540868/preview/stock-footage-roadside-scenery-on-a-cloudy-summer-day-in-tokyo-japan.mp4,PT00H00M10S,003451_003500,"Roadside scenery on a cloudy summer day in tokyo, japan"
1032379400,https://ak.picdn.net/shutterstock/videos/1032379400/preview/stock-footage-view-of-rainy-foggy-road-with-picturesque-nature-from-driving-car-along-roadside-during-journey.mp4,PT00H00M45S,006801_006850,View of rainy foggy road with picturesque nature from driving car along roadside during journey. cyprus. slow motion.
17544667,https://ak.picdn.net/shutterstock/videos/17544667/preview/stock-footage-young-fit-sports-woman-jogging-on-the-beach-k-slow-motion-stabilizer-shot.mp4,PT00H00M10S,139951_140000,Young fit sports woman jogging on the beach. 4k slow motion stabilizer shot.
1032904523,https://ak.picdn.net/shutterstock/videos/1032904523/preview/stock-footage-macro-view-of-male-s-hand-holding-small-brown-round-shaped-pod-with-white-stripes-of-compact-modern.mp4,PT00H00M05S,111401_111450,Macro view of male's hand holding small brown round-shaped pod with white stripes of compact modern automatic coffee machine.
1025363924,https://ak.picdn.net/shutterstock/videos/1025363924/preview/stock-footage-cathedral-candles-in-the-philippines-it-feels-peace-religious-warm.mp4,PT00H00M05S,116401_116450,"Cathedral candles in the philippines. it feels peace, religious, warm."
14943802,https://ak.picdn.net/shutterstock/videos/14943802/preview/stock-footage-wedding-dress-with-turquoise-belt.mp4,PT00H00M13S,033751_033800,Wedding dress with turquoise belt
1044261982,https://ak.picdn.net/shutterstock/videos/1044261982/preview/stock-footage-portrait-young-woman-with-glasses-look-at-camera-poses-in-city-center-beautiful-hair-attractive.mp4,PT00H00M12S,033351_033400,"Portrait young woman with glasses look at camera poses in city center beautiful hair attractive smile girl. close shot on hands using phone during winter time. technology, winter and holiday concept."
11238866,https://ak.picdn.net/shutterstock/videos/11238866/preview/stock-footage-fresh-cup-coffee.mp4,PT00H00M22S,172451_172500,Fresh cup coffee
1060351118,https://ak.picdn.net/shutterstock/videos/1060351118/preview/stock-footage-white-tailed-eagle-haliaeetus-albicilla.mp4,PT00H00M58S,113251_113300,White tailed eagle ( haliaeetus albicilla )
1016191720,https://ak.picdn.net/shutterstock/videos/1016191720/preview/stock-footage-helsinki-finland-february-people-swim-in-open-air-sea-pool-in-the-center-of-helsinki.mp4,PT00H00M07S,033151_033200,"Helsinki, finland - february 24, 2018: people swim in open air sea pool in the center of helsinki in winter. allas sea pool is a sauna and a saltwater pool open all year round."
1011437030,https://ak.picdn.net/shutterstock/videos/1011437030/preview/stock-footage-bartender-twisting-orange-peel.mp4,PT00H00M05S,034351_034400,Bartender twisting orange peel
1008947579,https://ak.picdn.net/shutterstock/videos/1008947579/preview/stock-footage-cornetfish-fistularia-commersonii-in-coral-of-red-sea-sudan-shaab-rumi.mp4,PT00H00M10S,032601_032650,Cornetfish (fistularia commersonii) in coral of red sea sudan shaab rumi 
1023480811,https://ak.picdn.net/shutterstock/videos/1023480811/preview/stock-footage--k-quality-footage-a-beautiful-ocean-of-clouds-moves-past-the-tops-of-the-mountains-scenic-view.mp4,PT00H00M10S,108351_108400,"4k quality footage. a beautiful ocean of clouds moves past the tops of the mountains. scenic view above the clouds, above the sky. on the horizon is the caucasian ridge and the highest mountain "
32375845,https://ak.picdn.net/shutterstock/videos/32375845/preview/stock-footage-unique-design-abstract-digital-animation-pixel-noise-glitch-error-video-damage.mp4,PT00H00M15S,118901_118950,Unique design abstract digital animation pixel noise glitch error video damage
9575903,https://ak.picdn.net/shutterstock/videos/9575903/preview/stock-footage--k-montage-compilation-christmas-tree-in-night-and-other-shining-decorations-trdelnik-chimney.mp4,PT00H00M15S,131301_131350,4k montage (compilation) - christmas tree in night and other shining decorations. trdelnik (chimney cake or stove cake) in shop (in night)
1013896280,https://ak.picdn.net/shutterstock/videos/1013896280/preview/stock-footage-nature-of-altai-mountain-landscape.mp4,PT00H00M14S,014201_014250,"Nature of altai, mountain landscape"
5110124,https://ak.picdn.net/shutterstock/videos/5110124/preview/stock-footage-cheerful-businessman-and-businesswoman-having-an-informal-meeting-on-office-rooftop-terrace-on-a.mp4,PT00H00M15S,121601_121650,Cheerful businessman and businesswoman having an informal meeting on office rooftop terrace on a sunny day. other workers and views of the city skyline can be seen behind them. in slow motion.
1031517197,https://ak.picdn.net/shutterstock/videos/1031517197/preview/stock-footage-unripe-apricots-on-an-apricot-tree-in-a-windy-summer-day-organic-fruits-in-an-orchard-cibne-lens.mp4,PT00H00M11S,142251_142300,Unripe apricots on an apricot tree in a windy summer day. organic fruits in an orchard. cibne lens.
1020940198,https://ak.picdn.net/shutterstock/videos/1020940198/preview/stock-footage-circles-gather-in-symbol-box-open-after-it-crumbles-in-a-line-and-moves-to-the-camera-alpha.mp4,PT00H00M10S,079951_080000,Circles gather in symbol box open. after it crumbles in a line and moves to the camera. alpha channel black
1044450907,https://ak.picdn.net/shutterstock/videos/1044450907/preview/stock-footage-a-man-walks-with-a-dog-along-the-beach-a-man-is-playing-with-a-dog-beautiful-beach-waves-at-sea.mp4,PT00H00M58S,045701_045750,A man walks with a dog along the beach. a man is playing with a dog.beautiful beach. waves at sea. autumn on the shore. rainy weather at sea. gloomy sky. beautiful ocean.
1042013359,https://ak.picdn.net/shutterstock/videos/1042013359/preview/stock-footage-wild-small-flower-shoot-close-up-in-field-nature-footage.mp4,PT00H00M13S,012551_012600,Wild small flower shoot close-up in field. nature footage.
1021736092,https://ak.picdn.net/shutterstock/videos/1021736092/preview/stock-footage-hiking-in-the-death-valley-national-park-zabriskie-point.mp4,PT00H00M10S,052801_052850,Hiking in the death valley national park (zabriskie point)
26565329,https://ak.picdn.net/shutterstock/videos/26565329/preview/stock-footage-shaw-s-cowfish-swims-toward-camera-aracana-aurita.mp4,PT00H00M16S,004701_004750,"Shaw's cowfish swims toward camera, (aracana aurita)."
30622819,https://ak.picdn.net/shutterstock/videos/30622819/preview/stock-footage-man-jumping-up-and-down-on-bouncing-trampoline-in-garden-k.mp4,PT00H00M12S,086301_086350,Man jumping up and down on bouncing trampoline in garden 4k
14480158,https://ak.picdn.net/shutterstock/videos/14480158/preview/stock-footage-the-girl-with-the-tablet-works-in-the-office.mp4,PT00H00M19S,141201_141250,The girl with the tablet works in the office
1055053952,https://ak.picdn.net/shutterstock/videos/1055053952/preview/stock-footage-battaglia-terme-province-of-padua-italy-june-ruin-of-ancient-farm-house-in-background.mp4,PT00H00M15S,128301_128350,"Battaglia terme, province of padua, italy - june 20, 2020 ruin of ancient farm house in background medieval villa called selvatico sartori"
29951692,https://ak.picdn.net/shutterstock/videos/29951692/preview/stock-footage-portrait-of-a-young-girl-sitting-in-a-wheat-field.mp4,PT00H00M09S,082301_082350,Portrait of a young girl sitting in a wheat field
1062668917,https://ak.picdn.net/shutterstock/videos/1062668917/preview/stock-footage-adorable-kid-in-purple-hoodie-and-jeans-on-seashore-during-summer-holiday-tilt-up-shot.mp4,PT00H00M07S,012451_012500,Adorable kid in purple hoodie and jeans on seashore during summer holiday. - tilt-up shot
1045483036,https://ak.picdn.net/shutterstock/videos/1045483036/preview/stock-footage-toronto-ontario-canada-december-memorial-for-korean-kpop-superstar-kim-jognhyun-of-the.mp4,PT00H00M11S,032201_032250,"Toronto, ontario, canada december 20 2017 memorial for korean kpop superstar kim jognhyun  of the band shinee who died by suicide "
1047474682,https://ak.picdn.net/shutterstock/videos/1047474682/preview/stock-footage-stockholm-sweden-february-aerial-view-of-stockholm-city-centre-gamla-stan-flying-over.mp4,PT00H00M05S,084101_084150,"Stockholm, sweden - february, 2020: aerial view of stockholm city centre gamla stan. flying over buildings in old town."
1040909228,https://ak.picdn.net/shutterstock/videos/1040909228/preview/stock-footage-threadfin-acara-albino-swims-in-an-aquarium-shanghai-aquarium.mp4,PT00H00M10S,194501_194550,Threadfin acara albino swims in an aquarium. shanghai aquarium.
33517441,https://ak.picdn.net/shutterstock/videos/33517441/preview/stock-footage-beautiful-panoramic-view-of-monaco-monte-carlo-with-prince-s-palace-panorama-video-k.mp4,PT00H00M21S,184451_184500,Beautiful panoramic view of monaco monte-carlo with prince's palace - panorama video 4k
1016360668,https://ak.picdn.net/shutterstock/videos/1016360668/preview/stock-footage-buriram-thailand-june-nonidentical-students-and-cheer-leader-having-contest-for-cheer.mp4,PT00H00M41S,110051_110100,"Buriram,thailand - june 15 2018 : nonidentical students and cheer leader having contest for cheer leader at buriram sport day, at buriram,thailand."
1027295147,https://ak.picdn.net/shutterstock/videos/1027295147/preview/stock-footage-turkey-or-meleagris-ocellata-bandung-indonesia-asia.mp4,PT00H00M26S,060201_060250,"Turkey or meleagris ocellata, bandung, indonesia, asia"
1019934898,https://ak.picdn.net/shutterstock/videos/1019934898/preview/stock-footage-digital-nomad-working-on-the-go-in-the-city-searching-the-web-on-computer-device.mp4,PT00H00M19S,109801_109850,Digital nomad working on the go in the city searching the web on computer device
18403006,https://ak.picdn.net/shutterstock/videos/18403006/preview/stock-footage-high-speed-camera-shot-of-shattering-glass-isolated-on-a-black-background-can-be-pre-matted-for.mp4,PT00H00M29S,114701_114750,"High speed camera shot of shattering glass, isolated on a black background. can be pre-matted for your video footage by using the command frame blending - multiply.
"
29316625,https://ak.picdn.net/shutterstock/videos/29316625/preview/stock-footage-modern-lcd-monitor-display-on-wood-table-with-nature-display.mp4,PT00H00M06S,057101_057150,Modern lcd monitor display on wood table with nature display
365443,https://ak.picdn.net/shutterstock/videos/365443/preview/stock-footage-matrix-effect.mp4,PT00H00M17S,025201_025250,Matrix effect
1018812307,https://ak.picdn.net/shutterstock/videos/1018812307/preview/stock-footage-beautiful-colored-bubbles-in-a-liquid-on-a-black-background-close-up-k.mp4,PT00H01M00S,128201_128250,Beautiful colored bubbles in a liquid on a black background. close-up. 4k
12089534,https://ak.picdn.net/shutterstock/videos/12089534/preview/stock-footage-a-husband-pour-wine-to-his-wife-during-lunch-on-rural-tourism-which-is-in-a-beautiful-nature-on.mp4,PT00H00M23S,039301_039350,A husband pour wine to his wife during lunch on rural tourism which is in a beautiful nature on countryside.
34970896,https://ak.picdn.net/shutterstock/videos/34970896/preview/stock-footage-peaks-of-mountains-above-the-clouds-winter-landscape.mp4,PT00H00M14S,197551_197600,"Peaks of mountains above the clouds. winter landscape
"
17597356,https://ak.picdn.net/shutterstock/videos/17597356/preview/stock-footage-moscow-may-toy-vessels-sail-by-ostankinsky-pond-not-far-from-tv-center-and-tower-at.mp4,PT00H00M30S,080701_080750,"Moscow - may 08, 2016: toy vessels sail by ostankinsky pond not far from tv center and tower at spring day. aerial view"
23699086,https://ak.picdn.net/shutterstock/videos/23699086/preview/stock-footage-a-few-pieces-of-cement-fly-leaving-trail-of-dust-with-alpha-mask-ready-for-compositing-hd.mp4,PT00H00M40S,187501_187550,"A few pieces of cement fly leaving trail of dust, with alpha mask, ready for compositing (hd, 1920x1080, high definition) high detailed dust"
1059647072,https://ak.picdn.net/shutterstock/videos/1059647072/preview/stock-footage--s-man-speaks-and-looks-at-golf-ball-man-pretends-to-hurl-golf-ball-boy-hands-man-something.mp4,PT00H00M27S,065701_065750,1950s: man speaks and looks at golf ball. man pretends to hurl golf ball. boy hands man something from pocket. man ties string onto grapefruit and speaks.
29256667,https://ak.picdn.net/shutterstock/videos/29256667/preview/stock-footage-former-wwii-deep-sea-rescue-tug-zuni-tamaroa-baltimore-maryland-circa-view-of-two-wwii.mp4,PT00H00M14S,022601_022650,"Former wwii deep sea rescue tug zuni tamaroa baltimore maryland – circa: 2011. view of two wwii veterans reminiscing on retired coast guard cutter at the inner harbor in baltimore, maryland usa "
1023616357,https://ak.picdn.net/shutterstock/videos/1023616357/preview/stock-footage-stone-balance-closeup-female-hand-making-pebbles-tower-from-sea-stones-macro-of-pyramid-of.mp4,PT00H00M19S,133151_133200,Stone balance closeup. female hand making pebbles tower from sea stones. macro of pyramid of pebbles on beach. stack of stones on seashore. meditation and relax on summer vacations concept
4917704,https://ak.picdn.net/shutterstock/videos/4917704/preview/stock-footage-timelapse-view-of-paris-from-montmartre.mp4,PT00H00M14S,051951_052000,"Timelapse view of paris from montmartre
"
4195144,https://ak.picdn.net/shutterstock/videos/4195144/preview/stock-footage-bryce-canyon-dolly-lm-inspiration-point-sunset.mp4,PT00H00M20S,026251_026300,Bryce canyon dolly lm02 inspiration point sunset
9485633,https://ak.picdn.net/shutterstock/videos/9485633/preview/stock-footage-dhaka-bangladesh-december-an-unidentified-cycle-rickshaw-rider-makes-his-way-through.mp4,PT00H00M09S,063701_063750,"Dhaka, bangladesh - 18 december 2014: an unidentified cycle rickshaw rider makes his way through the busy streets of dhaka."
1028599115,https://ak.picdn.net/shutterstock/videos/1028599115/preview/stock-footage-young-juvenile-cheetah-cubs-looking-around-and-searching-for-a-mother.mp4,PT00H00M09S,076501_076550,Young juvenile cheetah cubs looking around and searching for a mother
1048054075,https://ak.picdn.net/shutterstock/videos/1048054075/preview/stock-footage-food-origan-rosemary-curry-powder-spices-herbs-salt-tabletop-hands-selecting.mp4,PT00H00M22S,137201_137250,Food origan rosemary curry powder spices herbs salt tabletop hands selecting
15416608,https://ak.picdn.net/shutterstock/videos/15416608/preview/stock-footage-longyearbyen-svalbard-the-snowmobiles-which-are-swept-up-by-snow-at-strong-wind-a-sunny-day-in.mp4,PT00H00M15S,069701_069750,"Longyearbyen, svalbard. the snowmobiles which are swept up by snow at strong wind. a sunny day in march."
19413022,https://ak.picdn.net/shutterstock/videos/19413022/preview/stock-footage-short-beaked-echidna-adult-lone-eating-feeding-mound-tongue-adaptation-australia-march.mp4,PT00H00M23S,074151_074200,"Short-beaked echidna adult lone eating feeding mound tongue adaptation. australia - march, 2016"
1036208294,https://ak.picdn.net/shutterstock/videos/1036208294/preview/stock-footage-aerial-descending-drone-shot-towards-the-surface-of-the-ice-field-at-aletsch-glacier-on-a.mp4,PT00H00M06S,025301_025350,"Aerial, descending, drone shot, towards the surface, of the ice field, at aletsch glacier, on a partly sunny day, in the swiss alps of valais, switzerland"
1035549920,https://ak.picdn.net/shutterstock/videos/1035549920/preview/stock-footage-melitopol-ukraine-august-holiday-in-a-small-provincial-town-evening-performance-of-musical.mp4,PT00H00M08S,130351_130400,"Melitopol, ukraine, august 2019. holiday in a small provincial town. evening performance of musical groups in the central square of a small city, a large crowd of people, the general festive mood"
1042694317,https://ak.picdn.net/shutterstock/videos/1042694317/preview/stock-footage-happy-little-girl-drawing-with-markers-at-home-studio-video-shot-of-people-in-the-action-in-k.mp4,PT00H00M08S,067751_067800,Happy little girl drawing with markers at home. studio video shot of people in the action in 4k definition.
594748,https://ak.picdn.net/shutterstock/videos/594748/preview/stock-footage-musical-group-of-five-persons-playing-in-recording-studio.mp4,PT00H00M17S,125201_125250,Musical group of five persons playing in recording studio 
1492078,https://ak.picdn.net/shutterstock/videos/1492078/preview/stock-footage-blue-flowing-light-loopable-animation-seconds.mp4,PT00H00M20S,197451_197500,"Blue flowing light  - loopable animation, 20 seconds"
1029313568,https://ak.picdn.net/shutterstock/videos/1029313568/preview/stock-footage-nature-scene-with-blossoming-apple-flowers-on-a-natural-background-soft-focus-shallow-depth-of.mp4,PT00H00M39S,078251_078300,"Nature scene with blossoming apple flowers on a natural background. soft focus, shallow depth of field. spring background. sunny day. spring flowers. slow pan"
1018304614,https://ak.picdn.net/shutterstock/videos/1018304614/preview/stock-footage-timelapse-at-sunset-with-boats-moving-around-in-a-cloudy-day.mp4,PT00H00M14S,113451_113500,Timelapse at sunset with boats moving around in a cloudy day
1059558566,https://ak.picdn.net/shutterstock/videos/1059558566/preview/stock-footage-massage-therapist-uses-a-herbal-compress-to-do-treatment-to-woman-lying-on-spa-bed-in-a-luxury-spa.mp4,PT00H00M10S,036351_036400,"Massage therapist uses a herbal compress to do treatment to woman lying on spa bed in a luxury spa resort. wellness, stress relief and rejuvenation concept."
1013172752,https://ak.picdn.net/shutterstock/videos/1013172752/preview/stock-footage-pretty-young-woman-turns-spindle-and-spinning-wheel-track-out-from-bobbin-to-woman-and-aerial-view.mp4,PT00H01M00S,073651_073700,"Pretty young woman turns spindle and spinning wheel, track out from bobbin to woman and aerial view of wheel.  wheel slows to stop. 2x slow motion. bengal, india"
20452282,https://ak.picdn.net/shutterstock/videos/20452282/preview/stock-footage-red-paint-splashes-filling-a-container-dyed-oil.mp4,PT00H00M36S,080251_080300,Red paint splashes filling a container. dyed oil
