videoid,contentUrl,duration,page_dir,name
1024104029,https://ak.picdn.net/shutterstock/videos/1024104029/preview/stock-footage-forming-after-rain-dark-clouds-time-lapse-nice-dark-thunderstorm-fast-rotatin-building-big.mp4,PT00H00M26S,138801_138850,"Forming after rain dark clouds time lapse, nice dark thunderstorm fast rotatin, building big cloudscape, aerial view nature soft weather. /fhd."
11163749,https://ak.picdn.net/shutterstock/videos/11163749/preview/stock-footage-swans-in-the-park.mp4,PT00H00M23S,131151_131200,Swans in the park
1024069298,https://ak.picdn.net/shutterstock/videos/1024069298/preview/stock-footage-madison-river-montana.mp4,PT00H00M19S,174201_174250,Madison river montana
33520927,https://ak.picdn.net/shutterstock/videos/33520927/preview/stock-footage-young-black-couple-in-love-watch-television-in-living-room-man-switches-program.mp4,PT00H00M36S,134801_134850,Young black couple in love watch television in living room- man switches program
1051990267,https://ak.picdn.net/shutterstock/videos/1051990267/preview/stock-footage-hands-cut-baking-bag-with-cooked-fish-inside.mp4,PT00H00M16S,129801_129850,Hands cut baking bag with cooked fish inside.
1057112366,https://ak.picdn.net/shutterstock/videos/1057112366/preview/stock-footage-woman-holding-credit-card-and-using-laptop-sitting-on-sofa-at-home-young-female-customer-shopping.mp4,PT00H00M12S,022651_022700,"Woman holding credit card and using laptop, sitting on sofa at home, young female customer shopping online in internet store"
21645850,https://ak.picdn.net/shutterstock/videos/21645850/preview/stock-footage--k-lush-flower-leaves-crops-shrubs-bushes-plant-grass-growing-k.mp4,PT00H00M23S,143601_143650,4k lush flower leaves crops shrubs bushes plant grass growing. 6066_4k
1037624654,https://ak.picdn.net/shutterstock/videos/1037624654/preview/stock-footage-long-curve-into-bright-sun.mp4,PT00H00M22S,095151_095200,Long curve into bright sun
1026159029,https://ak.picdn.net/shutterstock/videos/1026159029/preview/stock-footage-portrait-of-pretty-african-american-woman-putting-moisturizing-facial-mask-on-her-face-on-the-coach.mp4,PT00H00M19S,071901_071950,Portrait of pretty african american woman putting moisturizing facial mask on her face on the coach in modern living room
1023211336,https://ak.picdn.net/shutterstock/videos/1023211336/preview/stock-footage-technology-concept-motion-background.mp4,PT00H00M15S,145601_145650,Technology concept motion background
1036879664,https://ak.picdn.net/shutterstock/videos/1036879664/preview/stock-footage-pharma-industry-medicine-and-automated-technology-equipment-concept-automatic-inspection-machine.mp4,PT00H00M10S,118601_118650,"Pharma industry, medicine and automated technology equipment concept. automatic inspection machine equipment for quality control of medical ampoules and vials at pharmacy factory or medical exhibition"
1006665937,https://ak.picdn.net/shutterstock/videos/1006665937/preview/stock-footage-long-beach-pan-down-and-tracking-of-parkers-lighthouse.mp4,PT00H00M22S,032651_032700,Long beach - pan down and tracking of parkers’ lighthouse
1007962825,https://ak.picdn.net/shutterstock/videos/1007962825/preview/stock-footage-the-riverbank-is-covered-with-root-tree-and-green-grass-the-water-flows-through-the-brown-rocks.mp4,PT00H00M22S,188001_188050,"The riverbank is covered with root tree and green grass ,the water flows through the brown rocks."
1022837077,https://ak.picdn.net/shutterstock/videos/1022837077/preview/stock-footage-french-flag-with-fabric-structure-in-the-wind-with-an-alpha-channel-loopable.mp4,PT00H00M40S,070051_070100,"French flag with fabric structure in the wind, with an alpha channel (loopable)"
12048119,https://ak.picdn.net/shutterstock/videos/12048119/preview/stock-footage--movement-of-flare-or-bokeh-of-fire-car-on-the-freeway-road.mp4,PT00H00M29S,025801_025850, movement of flare or bokeh of fire car on the freeway road
22911445,https://ak.picdn.net/shutterstock/videos/22911445/preview/stock-footage-abstract-technologic-background-with-animation-of-flickering-dots-animation-of-seamless-loop.mp4,PT00H00M20S,116901_116950,Abstract technologic background with animation of flickering dots. animation of seamless loop.
1047975133,https://ak.picdn.net/shutterstock/videos/1047975133/preview/stock-footage-city-of-botucatu-district-of-jardim-paraiso-and-vila-carmelo-state-of-sao-paulo-brazil-south.mp4,PT00H00M22S,063651_063700,"City of botucatu, district of jardim paraiso and vila carmelo, state of sao paulo, brazil south america.
02/08/2020
small cities of brazil. "
1034943560,https://ak.picdn.net/shutterstock/videos/1034943560/preview/stock-footage-positive-young-arabian-family-charming-woman-and-a-man-in-traditional-clothes.mp4,PT00H00M14S,196801_196850,Positive young arabian family charming woman and a man in traditional clothes
1007678860,https://ak.picdn.net/shutterstock/videos/1007678860/preview/stock-footage-woman-smoking-electric-cigarette.mp4,PT00H00M06S,011401_011450,Woman smoking electric cigarette
25201103,https://ak.picdn.net/shutterstock/videos/25201103/preview/stock-footage-cute-year-old-girl-s-birthday.mp4,PT00H00M10S,142901_142950,Cute 2 year old girl's birthday
1018370500,https://ak.picdn.net/shutterstock/videos/1018370500/preview/stock-footage-pastel-kaleidoscope-sequence-patterns-abstract-multicolored-motion-graphics-background-or-for.mp4,PT00H00M18S,028301_028350,"Pastel kaleidoscope sequence patterns. abstract multicolored motion graphics background. or for yoga, clubs, shows, mandala, fractal animation. beautiful bright ornament. seamless loop."
11377415,https://ak.picdn.net/shutterstock/videos/11377415/preview/stock-footage-wild-flower-against-a-background-of-passing-cars-on-the-highway.mp4,PT00H00M16S,042151_042200,Wild flower against a background of passing cars on the highway
16494262,https://ak.picdn.net/shutterstock/videos/16494262/preview/stock-footage-small-yachts-navigating-on-the-lake-sunny-day.mp4,PT00H00M25S,005151_005200,"Small yachts navigating on the lake,sunny day"
27390580,https://ak.picdn.net/shutterstock/videos/27390580/preview/stock-footage-make-a-cake.mp4,PT00H00M57S,004701_004750,Make a cake
1047593998,https://ak.picdn.net/shutterstock/videos/1047593998/preview/stock-footage-thumbs-down-by-young-woman-using-laptop-in-cafe.mp4,PT00H00M10S,025601_025650,Thumbs down by young woman using laptop in cafe 
7349491,https://ak.picdn.net/shutterstock/videos/7349491/preview/stock-footage-detail-of-wheel-windmill.mp4,PT00H00M16S,061101_061150,Detail of wheel windmill 
8959387,https://ak.picdn.net/shutterstock/videos/8959387/preview/stock-footage--loopable-flag-of-north-korea-north-korean-official-flag-gently-waving-in-the-wind-highly.mp4,PT00H00M15S,122801_122850,[loopable] flag of north korea. north korean official flag gently waving in the wind. highly detailed fabric texture for 4k resolution. 15 seconds loop. source: cgi rendering. clip id: ax687c
1040134112,https://ak.picdn.net/shutterstock/videos/1040134112/preview/stock-footage-many-jet-skis-ride-in-a-circle-in-one-place-crazy-fun-on-the-water-extreme-jet-skiing-the-view.mp4,PT00H00M09S,125201_125250,Many jet skis ride in a circle in one place. crazy fun on the water. extreme jet skiing. the view from the top down. aerial shot 4k
1792745,https://ak.picdn.net/shutterstock/videos/1792745/preview/stock-footage-blue-cliffs-in-early-morning-light.mp4,PT00H00M08S,118051_118100,Blue cliffs in early morning light
1036508072,https://ak.picdn.net/shutterstock/videos/1036508072/preview/stock-footage-low-angle-oriental-red-monument-in-imperial-city-hue-famous-red-gallery-behind-tall-grassing-by.mp4,PT00H00M12S,060551_060600,"Low angle, oriental red monument in imperial city, hue. famous red gallery behind tall grassing by wind breeze."
30593338,https://ak.picdn.net/shutterstock/videos/30593338/preview/stock-footage-two-girls-visit-london-and-enjoy-the-trip-and-sightseeing.mp4,PT00H00M13S,032351_032400,Two girls visit london and enjoy the trip and sightseeing
1026588134,https://ak.picdn.net/shutterstock/videos/1026588134/preview/stock-footage-aerial-drone-shot-over-a-large-church-tower-of-the-sacred-heart-church-and-the-many-buildings-and.mp4,PT00H00M14S,197001_197050,"Aerial drone shot over a large church tower of the sacred heart church and the many buildings and homes of trenton, new jersey."
5505365,https://ak.picdn.net/shutterstock/videos/5505365/preview/stock-footage-japanese-chef-preparing-a-meal-in-a-restaurant.mp4,PT00H00M14S,028251_028300,Japanese chef preparing a meal in a restaurant
20091631,https://ak.picdn.net/shutterstock/videos/20091631/preview/stock-footage-metalwork-students-training-in-workshop.mp4,PT00H00M20S,064151_064200,Metalwork students training in workshop
1032439538,https://ak.picdn.net/shutterstock/videos/1032439538/preview/stock-footage-tokyo-japan-june-shibuya-district-in-tokyo-city-at-night.mp4,PT00H00M45S,118301_118350,"Tokyo, japan, 28 june 2019: shibuya district in tokyo city at night"
1039402355,https://ak.picdn.net/shutterstock/videos/1039402355/preview/stock-footage-a-close-up-shot-of-a-woman-mixing-milk-into-the-challah-bread-dough-she-prepares-in-the-kitchen-at.mp4,PT00H00M19S,088151_088200,A close up shot of a woman mixing milk into the challah bread dough she prepares in the kitchen at night.
1027647278,https://ak.picdn.net/shutterstock/videos/1027647278/preview/stock-footage-mountains-and-clouds.mp4,PT00H00M20S,108151_108200,Mountains and clouds
1066052611,https://ak.picdn.net/shutterstock/videos/1066052611/preview/stock-footage-multicoloured-pieces-of-confetti-falling-seamlessly-on-a-black-background-celebration-colour.mp4,PT00H00M15S,112451_112500,"Multicoloured pieces of confetti falling seamlessly on a black background. celebration, colour, energy and movement concept, digitally generated video."
30936028,https://ak.picdn.net/shutterstock/videos/30936028/preview/stock-footage-jakarta-indonesia-september-stacks-of-containers-in-sunda-kelapa-old-harbor.mp4,PT00H00M15S,007051_007100,"Jakarta, indonesia. september 19, 2017: stacks of containers in sunda kelapa old harbor"
1011923966,https://ak.picdn.net/shutterstock/videos/1011923966/preview/stock-footage-bride-signs-her-wedding-vow-k.mp4,PT00H00M06S,177501_177550,Bride signs her wedding vow 4k
1007301769,https://ak.picdn.net/shutterstock/videos/1007301769/preview/stock-footage-barber-sips-talc-on-a-brush-the-video-has-a-brown-tint.mp4,PT00H00M07S,068901_068950,Barber sips talc on a brush. the video has a brown tint.
1006750588,https://ak.picdn.net/shutterstock/videos/1006750588/preview/stock-footage-kyiv-ukraine-february-ukrainian-fashion-week-catwalk-the-guy-man-male-on-the.mp4,PT00H00M22S,185201_185250,"Kyiv, ukraine - february 7, 2017.
ukrainian fashion week.  catwalk. the guy (man, male) on the catwalk fashion show. slow motion."
27152137,https://ak.picdn.net/shutterstock/videos/27152137/preview/stock-footage-mother-feeds-the-child-happy-family.mp4,PT00H00M06S,190451_190500,Mother feeds the child. happy family.
1037861729,https://ak.picdn.net/shutterstock/videos/1037861729/preview/stock-footage-sphere-of-fire-ring-sparks-and-spinning-over-black-background-d-cg-animation-k-ultra-hd.mp4,PT00H00M16S,182351_182400,"Sphere of fire ring sparks and spinning over black background, 3d cg animation 4k ultra hd 3840x2160."
22097335,https://ak.picdn.net/shutterstock/videos/22097335/preview/stock-footage-latin-american-girl-father-together-leisure-time-summer-holiday-fun-playful-beach-flare-light-red.mp4,PT00H00M21S,011651_011700,Latin american girl father together leisure time summer holiday fun playful beach flare light red dragon
1047071947,https://ak.picdn.net/shutterstock/videos/1047071947/preview/stock-footage-unidentified-people-on-the-jemaa-el-fna-square-in-marrakesh-morocco.mp4,PT00H00M20S,044251_044300,"Unidentified people on the jemaa el fna square in marrakesh, morocco, 2018"
1050454771,https://ak.picdn.net/shutterstock/videos/1050454771/preview/stock-footage-young-beautiful-woman-working-in-front-of-a-computer-at-home-nice-girl-conducts-home-lessons.mp4,PT00H00M11S,110451_110500,"Young, beautiful woman working in front of a computer at home. nice girl conducts home lessons online. conducting a business video call from home. online lectures for the isolated."
13893800,https://ak.picdn.net/shutterstock/videos/13893800/preview/stock-footage-woman-typing-a-message-on-a-green-background-in-the-winter.mp4,PT00H00M16S,079601_079650,Woman typing a message on a green background in the winter
33517891,https://ak.picdn.net/shutterstock/videos/33517891/preview/stock-footage-person-pushing-the-snooze-button-on-an-alarm-clock.mp4,PT00H00M06S,088501_088550,Person pushing the snooze button on an alarm clock.
1009742123,https://ak.picdn.net/shutterstock/videos/1009742123/preview/stock-footage-flight-over-st-petersburg-aerial-flight-over-saint-petersburg-center-downtown-view-of.mp4,PT00H00M39S,195101_195150,Flight over st. petersburg. aerial flight over saint petersburg center downtown. view of sightseeing from above. unique footage. rooftops and road traffic. roofs of st. petersburg
1026702134,https://ak.picdn.net/shutterstock/videos/1026702134/preview/stock-footage-maersk-eindhoven-ultra-large-container-vessel-ulcv-meters-long-loaded-with-various-container.mp4,PT00H00M31S,105351_105400,"Maersk eindhoven ultra large container vessel (ulcv 366 meters long) loaded with various container brands, at sea - aerial footage."
23607067,https://ak.picdn.net/shutterstock/videos/23607067/preview/stock-footage-technological-background-with-changing-words-about-technologies-social-nets-business-and-money.mp4,PT00H00M20S,029101_029150,"Technological background with changing words about technologies, social nets, business and money, communication and social marketing. symbol of earth globe with glowing glass surface. seamless loop."
1018923646,https://ak.picdn.net/shutterstock/videos/1018923646/preview/stock-footage-blurred-city-street-view-city-traffic-light.mp4,PT00H00M10S,125101_125150,Blurred city street view. city traffic light
1043499643,https://ak.picdn.net/shutterstock/videos/1043499643/preview/stock-footage-viaduct-harbour-auckland-new-zealand-december-the-iconic-skytower-landmark-of.mp4,PT00H00M29S,171901_171950,"Viaduct harbour, auckland / new zealand - december 25, 2019: the iconic skytower landmark of auckland city and its surrounding buildings"
23284456,https://ak.picdn.net/shutterstock/videos/23284456/preview/stock-footage-swans-in-a-public-park-in-the-winter-istanbul-on-january.mp4,PT00H00M10S,001951_002000,"Swans in a public park in the winter, istanbul, on january 7, 2017"
1042251328,https://ak.picdn.net/shutterstock/videos/1042251328/preview/stock-footage-in-the-mountains-of-the-caucasus-in-the-territory-of-abkhazia-kun-iashta-pass-over-the-clouds.mp4,PT00H00M24S,011851_011900,In the mountains of the caucasus in the territory of abkhazia. kun-iashta pass over the clouds.
1060573108,https://ak.picdn.net/shutterstock/videos/1060573108/preview/stock-footage-suzhou-jiangsu-china-october-close-up-view-of-hands-building-model-from-roller.mp4,PT00H00M20S,022051_022100,"Suzhou, jiangsu / china - october 01 2020: close-up view of hands building model from 10261 roller coaster, wearing lego tshirt, spending time at home with benefits; interesting indoor activity."
1012883381,https://ak.picdn.net/shutterstock/videos/1012883381/preview/stock-footage--d-rendering-red-alphabet-split-spin-rotate-on-blue-background-letter-star.mp4,PT00H00M08S,180051_180100,"3d rendering red alphabet split spin rotate on blue background,letter * star"
16786393,https://ak.picdn.net/shutterstock/videos/16786393/preview/stock-footage-manama-circa-march-on-board-camera-on-a-car-in-adliya-neighborhood-bahrain.mp4,PT00H00M15S,130551_130600,"Manama, circa march 2016: on board camera on a car in adliya neighborhood. 03 bahrain"
2374244,https://ak.picdn.net/shutterstock/videos/2374244/preview/stock-footage-pura-uluwatu-temple-on-bali-island-in-indonesia.mp4,PT00H00M16S,096751_096800,Pura uluwatu temple on bali island in indonesia
1008642244,https://ak.picdn.net/shutterstock/videos/1008642244/preview/stock-footage-the-happy-groom-is-spinning-the-beautiful-bride-round-and-kissing.mp4,PT00H00M14S,182101_182150,The happy groom is spinning the beautiful bride round and kissing. 
1016627212,https://ak.picdn.net/shutterstock/videos/1016627212/preview/stock-footage-a-cyclist-with-a-gadget-freelancer-with-a-bicycle-is-working-in-nature.mp4,PT00H00M19S,038101_038150,A cyclist with a gadget. freelancer with a bicycle is working in nature.
1042147696,https://ak.picdn.net/shutterstock/videos/1042147696/preview/stock-footage-gift-box-and-christmas-decoration.mp4,PT00H00M12S,059101_059150,Gift box and christmas decoration
1009570784,https://ak.picdn.net/shutterstock/videos/1009570784/preview/stock-footage-aerial-descent-top-view-over-winter-fir-forest.mp4,PT00H00M12S,094601_094650,Aerial descent top view over winter fir forest
28926973,https://ak.picdn.net/shutterstock/videos/28926973/preview/stock-footage-two-women-friends-people-enjoy-relaxing-by-pruning-bonsai-tree-indoor-in-modern-industrial-house.mp4,PT00H00M29S,007851_007900,Two women friends people enjoy relaxing by pruning bonsai tree indoor in modern industrial house. 4k handheld slow motion close up video shot
1044587806,https://ak.picdn.net/shutterstock/videos/1044587806/preview/stock-footage-volmer-yucaipa-california-usa-old-style-film-of-a-plane-taking-off.mp4,PT00H00M05S,115551_115600,Volmer yucaipa california usa-1959: old style film of a plane taking-off
1012786349,https://ak.picdn.net/shutterstock/videos/1012786349/preview/stock-footage-aerial-view-of-mountains-cascade-biker-riding-on-a-trail.mp4,PT00H00M20S,025801_025850,Aerial view of mountains cascade. biker riding on a trail
1010831990,https://ak.picdn.net/shutterstock/videos/1010831990/preview/stock-footage-ship-sailing-into-stormy-ocean-close-up-of-side-of-the-ship-cloudy-sky.mp4,PT00H00M24S,032951_033000,Ship sailing into stormy ocean. close up of side of the ship. cloudy sky
11501768,https://ak.picdn.net/shutterstock/videos/11501768/preview/stock-footage-algarve-coast-near-carvoeiro-lagoa-algarve-portugal.mp4,PT00H00M41S,182401_182450,"Algarve coast near carvoeiro, lagoa, algarve, portugal"
1058294263,https://ak.picdn.net/shutterstock/videos/1058294263/preview/stock-footage-man-and-two-women-architects-or-engineers-talking-at-construction-site-against-background-of-metal.mp4,PT00H00M17S,102401_102450,Man and two women architects or engineers talking at construction site against background of metal structure of road bridge.
7440283,https://ak.picdn.net/shutterstock/videos/7440283/preview/stock-footage--k-black-abstract-motion-background-dancing-lines-fps-suitable-as-use-in-a-music-video.mp4,PT00H00M20S,195801_195850,"4k black abstract motion background dancing lines 50 fps, suitable as use in a music video"
1020029980,https://ak.picdn.net/shutterstock/videos/1020029980/preview/stock-footage-small-white-flowers-template-floral-background-hd-vedio.mp4,PT00H00M24S,000551_000600,Small white flowers. template floral background.hd vedio.
15672040,https://ak.picdn.net/shutterstock/videos/15672040/preview/stock-footage-blueprint-scanned-by-software.mp4,PT00H00M10S,177051_177100,Blueprint scanned by software
1008213745,https://ak.picdn.net/shutterstock/videos/1008213745/preview/stock-footage-happy-team-of-gardener-men-presentation-farmer-holding-bio-brown-potatoes-pile.mp4,PT00H00M09S,023001_023050,Happy team of gardener men presentation farmer holding bio brown potatoes pile
23462707,https://ak.picdn.net/shutterstock/videos/23462707/preview/stock-footage-observation-animated-word-cloud-text-design-animation-kinetic-typography.mp4,PT00H00M20S,098601_098650,"Observation animated word cloud, text design animation. kinetic typography."
13706009,https://ak.picdn.net/shutterstock/videos/13706009/preview/stock-footage-time-lapse-of-a-full-moon-and-moving-clouds-at-night.mp4,PT00H00M15S,080351_080400,Time-lapse of a full moon and moving clouds at night
1048639405,https://ak.picdn.net/shutterstock/videos/1048639405/preview/stock-footage-confident-businessman-in-suit-using-smartphone-at-modern-street-handsome-male-entrepreneur-texting.mp4,PT00H00M10S,133151_133200,Confident businessman in suit using smartphone at modern street. handsome male entrepreneur texting on mobile phone outdoors. closeup serious business man walking on street in slow motion
994968403,https://ak.picdn.net/shutterstock/videos/994968403/preview/stock-footage-colorful-autumn-flowers-in-the-wind.mp4,PT00H00M27S,065651_065700,Colorful autumn flowers in the wind
1030166201,https://ak.picdn.net/shutterstock/videos/1030166201/preview/stock-footage-aerial-of-h-fen-an-der-enz-in-the-black-forest-in-germany-baden-w-rttemberg-flying-into-town.mp4,PT00H00M43S,066551_066600,Aerial of höfen an der enz in the black forest in germany baden-württemberg. flying into town from the south side.
1008285925,https://ak.picdn.net/shutterstock/videos/1008285925/preview/stock-footage--dec-handsome-man-try-to-talk-and-take-selfie-with-his-phone.mp4,PT00H00M19S,126301_126350,25 dec 2017: handsome man try to talk and take selfie with his phone
22307752,https://ak.picdn.net/shutterstock/videos/22307752/preview/stock-footage-timelapse-video-of-christmas-streets-of-tallin-estonia-december.mp4,PT00H00M25S,184101_184150,"Timelapse video of christmas streets of tallin, estonia, december 15, 2016"
1034831621,https://ak.picdn.net/shutterstock/videos/1034831621/preview/stock-footage-close-up-half-ripe-pomegranate-hanging-on-tree-slight-wind-moving-tree-branches-beautiful-evening.mp4,PT00H00M07S,084801_084850,Close up: half-ripe pomegranate hanging on tree slight wind moving tree branches beautiful evening sun sunset light
1012017881,https://ak.picdn.net/shutterstock/videos/1012017881/preview/stock-footage-footage-from-above-of-a-young-blonde-haired-woman-standing-near-the-sea-or-ocean-in-morning-dusk.mp4,PT00H00M10S,113651_113700,"Footage from above of a young, blonde haired woman standing near the sea or ocean in morning dusk. wearing red swimsuit and red gown. perfect fit body"
1040856116,https://ak.picdn.net/shutterstock/videos/1040856116/preview/stock-footage-crossing-omo-river-in-hollowed-dugout-canoe-in-south-ethiopia.mp4,PT00H00M16S,062151_062200,"Crossing omo river in hollowed dugout canoe in south ethiopia
"
1045353868,https://ak.picdn.net/shutterstock/videos/1045353868/preview/stock-footage-smiling-bald-man-just-woke-up-after-the-holiday-is-having-a-hangover-and-drinking-mineral-water.mp4,PT00H00M18S,126801_126850,"Smiling bald man just woke up after the holiday, is having a hangover and drinking mineral water"
33884494,https://ak.picdn.net/shutterstock/videos/33884494/preview/stock-footage-decoration-of-christmas-gift-bouquets.mp4,PT00H00M08S,078551_078600,Decoration of christmas gift bouquets
1009589558,https://ak.picdn.net/shutterstock/videos/1009589558/preview/stock-footage-red-cat-lies-on-a-bed-pulling-paws-legs-stretched-forward-tabby-cat-pet-beast-of-prey-on-a.mp4,PT00H00M18S,044651_044700,"Red cat lies on a bed pulling paws, legs stretched forward, tabby cat, pet, beast of prey, on a pink blanket, sleepy, cat's mouth, falling asleep in bed, thick red cat close-up"
1024975319,https://ak.picdn.net/shutterstock/videos/1024975319/preview/stock-footage-young-couple-walking-up-exterior-stairs-with-their-suitcase-and-boston-terrier-dog-to-enter-their.mp4,PT00H00M15S,085401_085450,Young couple walking up exterior stairs with their suitcase and boston terrier dog to enter their pet friendly vacation rental
3369536,https://ak.picdn.net/shutterstock/videos/3369536/preview/stock-footage-bartender-pours-pink-martini-bartender-pours-pink-martini.mp4,PT00H00M18S,191451_191500,Bartender pours pink martini/ bartender pours pink martini
29874040,https://ak.picdn.net/shutterstock/videos/29874040/preview/stock-footage-two-athletes-running-on-stairs-in-sunny-autumn-nature.mp4,PT00H00M10S,099651_099700,Two athletes running on stairs in sunny autumn nature.
22406830,https://ak.picdn.net/shutterstock/videos/22406830/preview/stock-footage-moored-feluccas-passenger-ferries-river-nile-luxor-egypt.mp4,PT00H00M23S,107001_107050,Moored feluccas & passenger ferries; river nile luxor egypt
1024898948,https://ak.picdn.net/shutterstock/videos/1024898948/preview/stock-footage-istanbul-november-cook-man-quickly-put-fillings-into-baked-jacket-potato-traditional.mp4,PT00H00M17S,015901_015950,"Istanbul - november 05, 2017: cook man quickly put fillings into baked jacket potato, traditional turkish fastfood named kumpir, served at street food cafe in ortakoy area of istanbul"
21732346,https://ak.picdn.net/shutterstock/videos/21732346/preview/stock-footage-aerial-view-of-a-bikini-woman-walking-out-to-snorkel-st-john-united-states-virgin-islands.mp4,PT00H00M21S,083251_083300,"Aerial view of a bikini woman walking out to snorkel, st john, united states virgin islands"
3623393,https://ak.picdn.net/shutterstock/videos/3623393/preview/stock-footage-connected-cables-on-switch.mp4,PT00H00M17S,121001_121050,Connected cables on switch.
9344306,https://ak.picdn.net/shutterstock/videos/9344306/preview/stock-footage-ronda-town-tourist-walk-famous-puento-nuevo-bridge-view-k-spain.mp4,PT00H00M17S,122551_122600,Ronda town tourist walk famous puento nuevo bridge view 4k spain
1040367104,https://ak.picdn.net/shutterstock/videos/1040367104/preview/stock-footage-young-woman-checks-list-document-for-working-at-warehouse.mp4,PT00H00M12S,063201_063250,Young woman checks list document for working at warehouse
1031847224,https://ak.picdn.net/shutterstock/videos/1031847224/preview/stock-footage-pregnant-woman-doing-yoga-in-the-park-on-the-rug-sitting-with-legs-extended-and-midit-rest-and.mp4,PT00H00M13S,111051_111100,"Pregnant woman doing yoga in the park on the rug, sitting with legs extended and midit. rest and stay in asana."
