videoid,contentUrl,duration,page_dir,name
1034245331,https://ak.picdn.net/shutterstock/videos/1034245331/preview/stock-footage-aerial-view-of-a-beautiful-sandy-beach-with-sand-dunes-in-australia-at-sunset.mp4,PT00H00M13S,113601_113650,Aerial view of a beautiful sandy beach with sand dunes in australia at sunset
1013539364,https://ak.picdn.net/shutterstock/videos/1013539364/preview/stock-footage-lotus-flower-in-lake.mp4,PT00H00M34S,148101_148150,Lotus flower in lake
20528953,https://ak.picdn.net/shutterstock/videos/20528953/preview/stock-footage-teacher-helping-kids-with-their-homework-in-library-at-school.mp4,PT00H00M14S,033551_033600,Teacher helping kids with their homework in library at school
15944929,https://ak.picdn.net/shutterstock/videos/15944929/preview/stock-footage-giraffe.mp4,PT00H00M30S,067551_067600,Giraffe
9554036,https://ak.picdn.net/shutterstock/videos/9554036/preview/stock-footage-cattle-herd-going-through-amazing-sunset-landscape-with-ancient-buddhist-pagodas-at-bagan-myanmar.mp4,PT00H00M15S,048651_048700,"Cattle herd going through amazing sunset landscape with ancient buddhist pagodas at bagan. myanmar (burma), travel destinations"
10553648,https://ak.picdn.net/shutterstock/videos/10553648/preview/stock-footage-cream-cake-with-tea-and-grapes-on-wood-x-intro-motion-slow-hidef-hd.mp4,PT00H00M15S,117101_117150,Cream cake with tea and grapes on wood 1920x1080 intro motion slow hidef hd
1054503449,https://ak.picdn.net/shutterstock/videos/1054503449/preview/stock-footage-green-tree-moved-by-the-air-in-the-poqueira-river.mp4,PT00H00M30S,041751_041800,Green tree moved by the air in the poqueira river
1022167477,https://ak.picdn.net/shutterstock/videos/1022167477/preview/stock-footage-aerial-view-of-the-forest-at-winter-the-trees-are-covered-with-snow.mp4,PT00H00M18S,117751_117800,Aerial view of the forest at winter. the trees are covered with snow.
1033510634,https://ak.picdn.net/shutterstock/videos/1033510634/preview/stock-footage-rotation-macro-wild-strawberry-background.mp4,PT00H00M30S,027901_027950,Rotation macro wild strawberry background
1018340563,https://ak.picdn.net/shutterstock/videos/1018340563/preview/stock-footage-joyous-father-and-mother-opening-christmas-present-with-little-girl-while-sitting-together-in-the.mp4,PT00H00M22S,086551_086600,Joyous father and mother opening christmas present with little girl while sitting together in the living room decorated with lights and fir tree
1055619107,https://ak.picdn.net/shutterstock/videos/1055619107/preview/stock-footage-adorable-and-interested-girl-is-taking-photoes-crop-copy-space-action-motion-k.mp4,PT00H00M06S,190051_190100,Adorable and interested girl is taking photoes. crop. copy space. action. motion. 4k.
22184527,https://ak.picdn.net/shutterstock/videos/22184527/preview/stock-footage-jerusalem-israel-september-wide-view-of-the-dome-of-the-chain-mihrab-that-indicates.mp4,PT00H00M07S,110901_110950,"Jerusalem, israel- september, 21, 2016: wide view of the dome of the chain mihrab, that indicates the direction of mecca, in jerusalem, israel"
22758733,https://ak.picdn.net/shutterstock/videos/22758733/preview/stock-footage-woman-puts-pies-in-the-oven-for-baking-close-up.mp4,PT00H00M11S,123601_123650,Woman puts pies in the oven for baking. close-up
1032286244,https://ak.picdn.net/shutterstock/videos/1032286244/preview/stock-footage--october-portugal-faro-jumbo-the-girl-in-the-supermarket-chooses-citrus-lemons-to-buy.mp4,PT00H00M11S,175901_175950,"27 october 2017 portugal faro, jumbo. the girl in the supermarket chooses citrus lemons to buy."
28694776,https://ak.picdn.net/shutterstock/videos/28694776/preview/stock-footage-fat-sportswoman-browsing-home-workout-exercises-on-smartphone-using-mobile-app.mp4,PT00H00M09S,038301_038350,"Fat sportswoman browsing home workout exercises on smartphone, using mobile app"
18904319,https://ak.picdn.net/shutterstock/videos/18904319/preview/stock-footage--k-house-on-the-dollar-bills-background-business-investment-real-estate.mp4,PT00H00M15S,129751_129800,"4k house on the 100 dollar bills background,business investment,real-estate. "
17587528,https://ak.picdn.net/shutterstock/videos/17587528/preview/stock-footage-poppy-seed-cake-on-wooden-table.mp4,PT00H00M16S,127901_127950,"Poppy seed cake on wooden table 
"
18274270,https://ak.picdn.net/shutterstock/videos/18274270/preview/stock-footage-peaceful-small-intimate-waterfall-with-gentle-water.mp4,PT00H00M30S,129451_129500,"Peaceful, small, intimate waterfall with gentle water. "
1041098200,https://ak.picdn.net/shutterstock/videos/1041098200/preview/stock-footage-shanghai-china-september-beautiful-aerial-view-flying-over-container-terminal-in-deep.mp4,PT00H00M16S,079951_080000,"Shanghai, china – september 2019: beautiful aerial view flying over container terminal in deep-water port of shanghai, overseas trade and globalization in china asia"
1007997427,https://ak.picdn.net/shutterstock/videos/1007997427/preview/stock-footage-porto-pim-beach-on-a-volcanic-island-faial-azores-portugal-slow-motion-k.mp4,PT00H00M12S,092751_092800,Porto pim beach on a volcanic island faial azores portugal slow motion 4k
26912875,https://ak.picdn.net/shutterstock/videos/26912875/preview/stock-footage-friends-drink-coffee-standing-on-the-roof-business-woman-during-lunch-break-slow-motion.mp4,PT00H00M12S,053751_053800,Friends drink coffee standing on the roof. business woman during lunch break. slow motion
1024921202,https://ak.picdn.net/shutterstock/videos/1024921202/preview/stock-footage-aerial-view-of-moscow-landscape-at-summer.mp4,PT00H00M37S,071101_071150,Aerial view of moscow landscape at summer.
1028776880,https://ak.picdn.net/shutterstock/videos/1028776880/preview/stock-footage-adult-duck-mallard-competing-to-mate-with-a-female-wildlife-courting-rivalry-springtime-hd.mp4,PT00H00M13S,044851_044900,"Adult duck, mallard competing to mate with a female, wildlife courting, rivalry, springtime, hd handeheld"
1066781773,https://ak.picdn.net/shutterstock/videos/1066781773/preview/stock-footage-climate-change-close-up-portrait-of-an-old-farmer-wearing-a-hat-looking-at-the-sky-waiting-for.mp4,PT00H00M13S,088801_088850,Climate change. close-up portrait of an old farmer wearing a hat looking at the sky waiting for rain to relieve a drought
19493662,https://ak.picdn.net/shutterstock/videos/19493662/preview/stock-footage-pretty-girl-checking-her-appearance-and-smiling-to-the-camera-in-the-outdoor-cafe.mp4,PT00H00M14S,141601_141650,"Pretty girl checking her appearance and smiling to the camera in the outdoor cafe
"
1009545563,https://ak.picdn.net/shutterstock/videos/1009545563/preview/stock-footage--k-young-asian-woman-using-smartphone-on-active-subway-platform-as-a-train-passes-girl-checks.mp4,PT00H00M13S,022601_022650,"4k young asian woman using smartphone on active subway platform. as a train passes, girl checks social network and write text done on her phone device, osaka train station platform japan-dan"
1016821453,https://ak.picdn.net/shutterstock/videos/1016821453/preview/stock-footage-front-view-close-up-of-african-american-couple-discussing-while-having-coffee-in-balcony-at-home.mp4,PT00H00M20S,114101_114150,"Front view close up of african american couple discussing while having coffee in balcony at home, social distancing and self isolation in quarantine lockdown for coronavirus covid19"
1049634880,https://ak.picdn.net/shutterstock/videos/1049634880/preview/stock-footage-top-view-of-asian-man-sleep-well-with-smile-at-night.mp4,PT00H00M13S,193551_193600,Top view of asian man sleep well with smile at night
5128520,https://ak.picdn.net/shutterstock/videos/5128520/preview/stock-footage-ocean-waves-hitting-the-shore.mp4,PT00H00M12S,188251_188300,"Ocean waves hitting the shore
"
21204244,https://ak.picdn.net/shutterstock/videos/21204244/preview/stock-footage-female-runner-with-nordic-walking-poles-and-backpack-running-mountain-marathon.mp4,PT00H00M13S,189701_189750,Female runner with nordic walking poles and backpack running mountain marathon
1047435823,https://ak.picdn.net/shutterstock/videos/1047435823/preview/stock-footage-seville-spain-january-k-house-under-construction-with-industrial-tower-cranes.mp4,PT00H00M29S,142851_142900,"Seville, spain-03 january, 2019: 4k, house under construction with industrial tower cranes. construction crane working of a house at city. new building under construction activity in sunny day-dan"
2245612,https://ak.picdn.net/shutterstock/videos/2245612/preview/stock-footage-cherry-blossom.mp4,PT00H00M15S,089651_089700,"Cherry blossom
"
28567570,https://ak.picdn.net/shutterstock/videos/28567570/preview/stock-footage-czech-azerbaijani-japanese-ukrainian-kazakh-german-chinese-flags-on-fortress-wall.mp4,PT00H00M06S,000101_000150,Czech azerbaijani japanese ukrainian kazakh german chinese flags on fortress wall
1030830158,https://ak.picdn.net/shutterstock/videos/1030830158/preview/stock-footage-business-countdown-from-seconds-to.mp4,PT00H01M00S,052001_052050,Business countdown from 60 seconds to 0
1014760586,https://ak.picdn.net/shutterstock/videos/1014760586/preview/stock-footage-city-beach-sunset-atlantic-coast-bathed-in-golden-light-orange-air-and-calmness.mp4,PT00H00M13S,009301_009350,"City beach sunset, atlantic coast bathed in golden light, orange air and calmness"
27100858,https://ak.picdn.net/shutterstock/videos/27100858/preview/stock-footage-virtual-reality-experience-on-a-beach.mp4,PT00H00M33S,138851_138900,Virtual reality experience on a beach
1062002950,https://ak.picdn.net/shutterstock/videos/1062002950/preview/stock-footage-field-of-ripening-wheat-wheat-before-harvest-agriculture-industry-environmentally-friendly-wheat.mp4,PT00H00M17S,013801_013850,Field of ripening wheat. wheat before harvest. agriculture industry. environmentally friendly wheat.
1012511393,https://ak.picdn.net/shutterstock/videos/1012511393/preview/stock-footage-dnipro-ukraine-june-four-seasons-chamber-orchestra-main-conductor-dmitry-logvin.mp4,PT00H00M56S,059851_059900,"Dnipro, ukraine - june 18, 2018: four seasons chamber orchestra - main conductor dmitry logvin perform  melody by astor piazzolla at the state drama theatre.
"
1016764120,https://ak.picdn.net/shutterstock/videos/1016764120/preview/stock-footage-aerial-beautiful-young-woman-in-a-white-dress-walking-through-famous-lavender-field-near.mp4,PT00H00M28S,074201_074250,Aerial - beautiful young woman in a white dress walking through famous lavender field near valensole in provence and touching flower heads at sunset
17988964,https://ak.picdn.net/shutterstock/videos/17988964/preview/stock-footage-six-rotor-drone-with-camera-on-gimbal-flying-in-the-sky-shot-in-slow-motion.mp4,PT00H00M14S,012301_012350,Six rotor drone with camera on gimbal flying in the sky. shot in slow motion. 
1034001848,https://ak.picdn.net/shutterstock/videos/1034001848/preview/stock-footage-online-news-article-on-tablet-screen-electronic-newspaper-or-magazine-latest-daily-press-and.mp4,PT00H00M21S,100251_100300,Online news article on tablet screen. electronic newspaper or magazine. latest daily press and media. mockup of digital portal and website. happy person using web service in the morning. reading text.
1036281920,https://ak.picdn.net/shutterstock/videos/1036281920/preview/stock-footage-step-by-step-flat-lay-royal-icing-in-plastic-piping-bags-to-decorate-easter-cookies.mp4,PT00H00M18S,013001_013050,Step by step. flat lay. royal icing in plastic piping bags to decorate easter cookies.
1035332300,https://ak.picdn.net/shutterstock/videos/1035332300/preview/stock-footage-coffee-beans-pour-in-from-a-cup-close-up-slow-motion.mp4,PT00H00M21S,112601_112650,Coffee beans pour in from a cup close up slow motion
1014877663,https://ak.picdn.net/shutterstock/videos/1014877663/preview/stock-footage-red-tomatos-on-the-plant-in-the-garden.mp4,PT00H00M20S,017651_017700,Red tomatos on the plant in the garden 
24142087,https://ak.picdn.net/shutterstock/videos/24142087/preview/stock-footage-metal-raw-materials-for-stamping.mp4,PT00H00M18S,052351_052400,Metal raw materials for stamping
1025578895,https://ak.picdn.net/shutterstock/videos/1025578895/preview/stock-footage-time-lapse-seoul-city-downtown-skyline-in-seoul-south-korea.mp4,PT00H00M13S,198601_198650,"Time lapse-seoul city downtown skyline in seoul, south korea. "
24563975,https://ak.picdn.net/shutterstock/videos/24563975/preview/stock-footage-abstract-technology-animation-background-rendering-loop-k.mp4,PT00H00M20S,047451_047500,"Abstract technology animation, background, rendering, loop, 4k
"
1014828370,https://ak.picdn.net/shutterstock/videos/1014828370/preview/stock-footage-aerial-drone-footage-flying-over-the-mediterrannean-sea-with-boats-and-beautiful-mountains-near.mp4,PT00H00M14S,120351_120400,Aerial drone footage flying over the mediterrannean sea with boats and beautiful mountains near marseille
1038013223,https://ak.picdn.net/shutterstock/videos/1038013223/preview/stock-footage-billiards-close-up-man-hand-with-cue-and-white-ball-on-a-green-pool-table-copy-space.mp4,PT00H00M12S,193901_193950,Billiards. close-up. man hand with cue and white ball on a green pool table. copy space
13014032,https://ak.picdn.net/shutterstock/videos/13014032/preview/stock-footage-view-from-moored-boat-at-landscape-of-egypt.mp4,PT00H00M08S,025351_025400,View from moored boat at landscape of egypt
1047493237,https://ak.picdn.net/shutterstock/videos/1047493237/preview/stock-footage-heraclion-greece-october-shop-accessories-decorations-and-christmas-presents-point-of.mp4,PT00H00M10S,026501_026550,"Heraclion, greece, october,13,2019. shop accessories, decorations and christmas presents. point of view of the buyer who chooses gifts for the new year or christmas."
7608838,https://ak.picdn.net/shutterstock/videos/7608838/preview/stock-footage-saint-petersburg-russia-september-orders-and-medals-on-his-chest-veteran-shot-in-k.mp4,PT00H00M10S,051851_051900,"Saint-petersburg, russia - september 12, 2014: orders and medals on his chest veteran. shot in 4k (ultra-high definition (uhd)), so you can easily crop, rotate and zoom, without losing quality!"
19287070,https://ak.picdn.net/shutterstock/videos/19287070/preview/stock-footage-fantastic-views-of-the-coastline-with-black-sand-and-surf-waves-of-the-sea.mp4,PT00H00M12S,109651_109700,Fantastic views of the coastline with black sand and surf waves of the sea
22340602,https://ak.picdn.net/shutterstock/videos/22340602/preview/stock-footage-cuba-november-central-alley-of-the-colon-cemetery-cementerio-cristobal-colon-november.mp4,PT00H00M27S,174001_174050,"Cuba, - november 02:
central alley  of the colon cemetery (cementerio cristobal colon).
november 02, 2016 in havana, cuba
"
5400134,https://ak.picdn.net/shutterstock/videos/5400134/preview/stock-footage-dome-of-the-rock-and-the-western-wall-in-jerusalem.mp4,PT00H00M10S,027251_027300,Dome of the rock and the western wall in jerusalem
1029897329,https://ak.picdn.net/shutterstock/videos/1029897329/preview/stock-footage-downward-aerial-view-of-kerosene-creek-and-surrounding-forest-new-zealand.mp4,PT00H00M08S,092951_093000,Downward aerial view of kerosene creek and surrounding forest - new zealand.
1025162564,https://ak.picdn.net/shutterstock/videos/1025162564/preview/stock-footage-asian-woman-greedily-eating-pizza-in-front-of-her-friend-who-keeping-diet.mp4,PT00H00M13S,147851_147900,Asian woman greedily eating pizza in front of her friend who keeping diet
1063353859,https://ak.picdn.net/shutterstock/videos/1063353859/preview/stock-footage-lauterbrunnen-switzerland-july-beautiful-plump-brown-cow-appetizingly-chewing-grass-in.mp4,PT00H00M10S,089601_089650,"Lauterbrunnen, switzerland, july 2020: beautiful plump brown cow appetizingly chewing grass in green pasture, juicy grass in alpine meadow, concept of animal husbandry, milk, cheese production	"
24421781,https://ak.picdn.net/shutterstock/videos/24421781/preview/stock-footage-long-island-new-york-the-beautiful-scenery-of-nature.mp4,PT00H00M11S,030901_030950,Long island new york 1948: the beautiful scenery of nature
1033465790,https://ak.picdn.net/shutterstock/videos/1033465790/preview/stock-footage-aerial-young-man-in-his-sea-kayak-paddling-towards-the-sunset.mp4,PT00H00M14S,170651_170700,Aerial: young man in his sea kayak paddling towards the sunset
1013011115,https://ak.picdn.net/shutterstock/videos/1013011115/preview/stock-footage-saint-petersburg-russia-june-multicultural-football-fans-from-all-over-the-world-with.mp4,PT00H00M16S,195351_195400,"Saint petersburg, russia, 16 june 2018: multicultural football fans from all over the world with different ethnicity race and color lying down on ground in street watching a world cup game together"
9568244,https://ak.picdn.net/shutterstock/videos/9568244/preview/stock-footage-real-light-bulb-turning-on-flickering-and-turning-off-incandescence-thread-close-up-k-uhd.mp4,PT00H00M25S,008201_008250,"Real light bulb turning on, flickering and turning off. incandescence thread, close up. 4k uhd video."
4667105,https://ak.picdn.net/shutterstock/videos/4667105/preview/stock-footage-sport-all-terrain-vehicle-climb-high-mountain-trail-pov-point-of-view-driving-top-of-high.mp4,PT00H00M30S,014451_014500,Sport all terrain vehicle climb high mountain trail 1 pov point of view. driving top of high wasatch rocky mountains with atv. central utah. late summer recreation ride on all terrain vehicle atv. 
7137280,https://ak.picdn.net/shutterstock/videos/7137280/preview/stock-footage-teenage-students-reading-at-desks-then-raise-their-hands-and-look-to-front-of-class-in-a-school.mp4,PT00H00M12S,049651_049700,"Teenage students reading at desks, then raise their hands and look to front of class in a school classroom.  medium shot with dolly movement."
1032702104,https://ak.picdn.net/shutterstock/videos/1032702104/preview/stock-footage-aerial-of-a-large-industrial-area-with-a-chimney-power-plant-pollution-in-the-background.mp4,PT00H00M19S,143801_143850,Aerial of a large industrial area with a chimney power plant pollution in the background
1019956039,https://ak.picdn.net/shutterstock/videos/1019956039/preview/stock-footage-stream-of-water.mp4,PT00H00M11S,093301_093350,Stream of water
5701670,https://ak.picdn.net/shutterstock/videos/5701670/preview/stock-footage-diver-is-pumping-cylinders.mp4,PT00H00M21S,034851_034900,Diver is pumping cylinders
2687189,https://ak.picdn.net/shutterstock/videos/2687189/preview/stock-footage-dairy-cows-in-the-stable.mp4,PT00H00M17S,056551_056600,Dairy cows in the stable
1051702210,https://ak.picdn.net/shutterstock/videos/1051702210/preview/stock-footage-horizontal-panoramic-view-of-a-dolomiti-sightsee-with-lots-of-peaks-and-mountains-in-northern-italy.mp4,PT00H00M51S,085901_085950,Horizontal panoramic view of a dolomiti sightsee with lots of peaks and mountains in northern italy with snow and blue sky
1012851971,https://ak.picdn.net/shutterstock/videos/1012851971/preview/stock-footage-abstract-bokeh-light-celebrate-decoration-light-bulb-bokeh-christmas-light-glitter-glowing-bokeh.mp4,PT00H00M21S,186701_186750,"Abstract bokeh light, celebrate decoration light bulb bokeh, christmas light glitter glowing, bokeh and particle blur effect."
1047998893,https://ak.picdn.net/shutterstock/videos/1047998893/preview/stock-footage-finnish-sauna-interior-wooden-interior-of-the-sauna.mp4,PT00H00M09S,087501_087550,Finnish sauna interior. wooden interior of the sauna
1033807778,https://ak.picdn.net/shutterstock/videos/1033807778/preview/stock-footage-london-london-united-kingdom-uk-car-parking-rules-in-london.mp4,PT00H00M31S,145251_145300,"London, london / united kingdom (uk) - 06 12 2019: car parking rules in london"
1033373048,https://ak.picdn.net/shutterstock/videos/1033373048/preview/stock-footage-hanoi-hanoi-vietnam-riding-scooters-vespa-s-in-nah-trang-hanoi-vietnam.mp4,PT00H00M15S,070501_070550,"Hanoi, hanoi / vietnam - 12 28 2012: riding scooters vespa's in nah trang hanoi vietnam"
1052382991,https://ak.picdn.net/shutterstock/videos/1052382991/preview/stock-footage-sunny-day-nanjing-city-famous-modern-architecture-complex-aerial-panorama-k-china.mp4,PT00H00M38S,062301_062350,Sunny day nanjing city famous modern architecture complex aerial panorama 4k china
18677486,https://ak.picdn.net/shutterstock/videos/18677486/preview/stock-footage-exotic-sable-antelope-in-the-zoo.mp4,PT00H00M15S,110851_110900,Exotic sable antelope in the zoo
28796458,https://ak.picdn.net/shutterstock/videos/28796458/preview/stock-footage-little-girl-with-binoculars-walking-in-a-wheat-field-in-italian-countryside.mp4,PT00H00M22S,069951_070000,Little girl with binoculars walking in a wheat field in italian countryside
12975065,https://ak.picdn.net/shutterstock/videos/12975065/preview/stock-footage-black-ear-catfish-in-sakae-krang-river-area-thasung-temple-uthaithani-thailand.mp4,PT00H00M15S,097051_097100,"Black ear catfish in sakae krang river area thasung temple, uthaithani, thailand."
1039622306,https://ak.picdn.net/shutterstock/videos/1039622306/preview/stock-footage-nashville-tennessee-june-colorful-neon-store-signs-hang-along-the-bars-restaurants-and.mp4,PT00H00M17S,033951_034000,"Nashville, tennessee - june 20, 2019: colorful neon store signs hang along the bars restaurants and record stores along broadway street in downtown nashville tennessee usa"
5956805,https://ak.picdn.net/shutterstock/videos/5956805/preview/stock-footage-moscow-russia-march-traffic-of-cars-in-moscow-city-center-tverskaya-street-near-the.mp4,PT00H00M17S,001251_001300,"Moscow, russia- march 25, 2014: traffic of cars in moscow city center (tverskaya street near the kremlin), russia"
1039192145,https://ak.picdn.net/shutterstock/videos/1039192145/preview/stock-footage-beautiful-aerial-view-of-grey-old-european-city-near-the-sand-riverside-in-summer-against-grey.mp4,PT00H00M08S,170351_170400,Beautiful aerial view of grey old european city near the sand riverside in summer against grey cloudy sky. action. gorgeous european architecture
1034647268,https://ak.picdn.net/shutterstock/videos/1034647268/preview/stock-footage-the-beautiful-house-facades-in-the-city-of-paris.mp4,PT00H00M10S,019201_019250,The beautiful house facades in the city of paris
30841369,https://ak.picdn.net/shutterstock/videos/30841369/preview/stock-footage-portrait-of-a-blood-red-fire-shrimp.mp4,PT00H00M12S,009951_010000,Portrait of a blood red fire shrimp. 
2123543,https://ak.picdn.net/shutterstock/videos/2123543/preview/stock-footage-walnut-tree.mp4,PT00H00M23S,127951_128000,Walnut tree
3980233,https://ak.picdn.net/shutterstock/videos/3980233/preview/stock-footage-glasgow-scotland-march-scaffolders-errecting-a-scaffold.mp4,PT00H00M11S,043601_043650,"Glasgow, scotland - march 2012: scaffolders errecting a scaffold."
1014328880,https://ak.picdn.net/shutterstock/videos/1014328880/preview/stock-footage-hands-of-the-bride-on-the-wedding-dress.mp4,PT00H00M08S,171851_171900,Hands of the bride on the wedding dress.
1032486857,https://ak.picdn.net/shutterstock/videos/1032486857/preview/stock-footage-fields-of-blooming-poppy-fields-and-hills-are-covered-with-a-carpet-of-wild-flowers-summer.mp4,PT00H00M23S,110601_110650,"Fields of blooming poppy. fields and hills are covered with a carpet of wild flowers. summer 2019, eastern georgia, near the town of gori. sunset"
21945886,https://ak.picdn.net/shutterstock/videos/21945886/preview/stock-footage-burning-sambuka-and-a-candle.mp4,PT00H00M25S,180651_180700,Burning sambuka and a candle
9608249,https://ak.picdn.net/shutterstock/videos/9608249/preview/stock-footage-businesswomen-meeting-agreement-sign-document-sign.mp4,PT00H00M26S,002401_002450,"Businesswomen meeting: agreement sign, document sign"
1015211167,https://ak.picdn.net/shutterstock/videos/1015211167/preview/stock-footage-orlando-florida-united-states-august-aerial-of-the-villages-an-age-restricted.mp4,PT00H00M30S,022251_022300,"Orlando, florida / united states - august 1 2018 : aerial of the villages, an age restricted community in central florida."
2732561,https://ak.picdn.net/shutterstock/videos/2732561/preview/stock-footage-plitvice-waterfall.mp4,PT00H00M15S,078901_078950,Plitvice waterfall
1011738623,https://ak.picdn.net/shutterstock/videos/1011738623/preview/stock-footage-sacred-rope-between-couple-camphor-laurel-trees-tokyo-japan.mp4,PT00H00M12S,180451_180500,"Sacred rope between couple camphor laurel trees  tokyo, japan"
12256565,https://ak.picdn.net/shutterstock/videos/12256565/preview/stock-footage-colorful-green-and-yellow-leaves-on-tree-branch-wind-blows-softly-shallow-field-of-view.mp4,PT00H00M19S,072701_072750,"Colorful green and yellow leaves on tree branch, wind blows softly. shallow field of view."
1056131036,https://ak.picdn.net/shutterstock/videos/1056131036/preview/stock-footage-home-gardening-man-in-glasses-and-ponytail-wearing-jeans-and-boots-brings-a-ball-of-hay-to-be.mp4,PT00H00M39S,110551_110600,Home gardening - man in glasses and ponytail wearing jeans and boots brings a ball of hay to be used as top cover layer in vegetable garden.
1049625160,https://ak.picdn.net/shutterstock/videos/1049625160/preview/stock-footage-rome-italy-january-cd-and-artwork-of-spanish-singer-songwriter-actor-and-record.mp4,PT00H00M09S,116051_116100,"Rome, italy - january 03, 2020: cd and artwork of  spanish singer, songwriter, actor and record producer enrique iglesias. he is one of the most successful artists in latin america"
23437969,https://ak.picdn.net/shutterstock/videos/23437969/preview/stock-footage-fresh-vegetable-salad-isolated.mp4,PT00H00M13S,180551_180600,Fresh vegetable salad isolated
1052947580,https://ak.picdn.net/shutterstock/videos/1052947580/preview/stock-footage-dispensary-worker-carefully-checks-quality-of-medical-marijuana-buds.mp4,PT00H00M22S,052001_052050,Dispensary worker carefully checks quality of medical marijuana buds
5322890,https://ak.picdn.net/shutterstock/videos/5322890/preview/stock-footage-printer-in-action.mp4,PT00H00M10S,171901_171950,Printer in action
