videoid,contentUrl,duration,page_dir,name
4663793,https://ak.picdn.net/shutterstock/videos/4663793/preview/stock-footage-aerial-shot-of-palm-springs-california-golf-course.mp4,PT00H00M29S,199501_199550,"Aerial shot of palm springs, california golf course"
30032452,https://ak.picdn.net/shutterstock/videos/30032452/preview/stock-footage-middle-aged-adult-business-woman-using-tablet-device-on-green-screen-on-green-screen-to-be-keyed.mp4,PT00H00M19S,148801_148850,Middle aged adult business woman using tablet device on green screen. on green screen to be keyed or composited.
16025335,https://ak.picdn.net/shutterstock/videos/16025335/preview/stock-footage-chennai-india-july-th-indian-man-walking-down-a-village-street-outside-chennai-india.mp4,PT00H00M08S,111101_111150,"Chennai, india - july 05th, 2014: indian man walking down a village street outside chennai,india."
27237535,https://ak.picdn.net/shutterstock/videos/27237535/preview/stock-footage-backwards-inline-skating-and-braking-on-the-asphalt-close-up-view-to-move-man-legs-and-slow-down.mp4,PT00H00M46S,086651_086700,Backwards inline skating and braking on the asphalt. close up view to move man legs and slow down. easy backwards ride and slowing down.
28776667,https://ak.picdn.net/shutterstock/videos/28776667/preview/stock-footage-water-droplet-effect.mp4,PT00H00M30S,064301_064350,Water droplet effect
1038879077,https://ak.picdn.net/shutterstock/videos/1038879077/preview/stock-footage-an-early-evening-reverse-aerial-establishing-shot-of-an-upscale-residential-neighborhood-in-the.mp4,PT00H00M29S,185451_185500,An early evening reverse aerial establishing shot of an upscale residential neighborhood in the pennsylvania hills. pittsburgh suburbs. ohio river in the far distance.  	
6132464,https://ak.picdn.net/shutterstock/videos/6132464/preview/stock-footage-grass-on-white-background-loop-ready-clip-of-grass-weaving-under-a-light-breeze.mp4,PT00H00M30S,144501_144550,Grass on white background. loop-ready clip of grass weaving under a light breeze.
18703844,https://ak.picdn.net/shutterstock/videos/18703844/preview/stock-footage-marsh-harrier-on-a-meadow.mp4,PT00H00M10S,105251_105300,Marsh harrier on a meadow
19673857,https://ak.picdn.net/shutterstock/videos/19673857/preview/stock-footage-close-up-of-barman-pours-syrup-in-cocktail-glass.mp4,PT00H00M24S,192201_192250,Close-up of barman pours syrup in cocktail glass
1017440884,https://ak.picdn.net/shutterstock/videos/1017440884/preview/stock-footage-businessman-walking-towards-camera-with-friend-country-flags-pin-ireland-slovakia.mp4,PT00H00M10S,117851_117900,Businessman walking towards camera with friend country flags pin ireland - slovakia
1024062212,https://ak.picdn.net/shutterstock/videos/1024062212/preview/stock-footage--young-spiny-lobster-in-the-aquarium-coral-reef-tank.mp4,PT00H00M22S,072201_072250,?young spiny lobster in the aquarium coral reef tank
1036108553,https://ak.picdn.net/shutterstock/videos/1036108553/preview/stock-footage-time-lapse-of-opening-red-rival-amaryllis-flower-c-isolated-on-black-background.mp4,PT00H00M15S,087851_087900,"Time-lapse of opening red rival amaryllis flower 1c2 isolated on black background
"
32985973,https://ak.picdn.net/shutterstock/videos/32985973/preview/stock-footage--march-an-old-television-in-an-exhibition-there-are-several-objects-and-an-old-telephone.mp4,PT00H00M09S,055901_055950,"04 march, 2016: an old television in an exhibition, there are several objects and an old telephone on the television, there is also a typewriter on top of a wooden chest of drawers."
1021456570,https://ak.picdn.net/shutterstock/videos/1021456570/preview/stock-footage-question-mark-on-wet-glass-with-graphics.mp4,PT00H00M07S,029701_029750,Question mark on wet glass with graphics
5303630,https://ak.picdn.net/shutterstock/videos/5303630/preview/stock-footage-customer-looking-for-smartphone-in-a-cell-phone-shop.mp4,PT00H00M19S,076601_076650,Customer looking for smartphone in a cell phone shop
1066333264,https://ak.picdn.net/shutterstock/videos/1066333264/preview/stock-footage-asian-businesswoman-wearing-mask-working-in-a-cafe.mp4,PT00H00M14S,194801_194850,Asian businesswoman wearing mask working in a cafe
1038846041,https://ak.picdn.net/shutterstock/videos/1038846041/preview/stock-footage-baby-robins-sitting-in-nest-in-round-hole-in-tree.mp4,PT00H00M27S,068601_068650,Baby robins sitting in nest in round hole in tree
34426009,https://ak.picdn.net/shutterstock/videos/34426009/preview/stock-footage-three-beautiful-muslim-siblings-or-friend-smiling-on-the-camera-isolated-on-white-background.mp4,PT00H00M11S,085951_086000,Three beautiful muslim siblings or friend smiling on the camera isolated on white background
1034900816,https://ak.picdn.net/shutterstock/videos/1034900816/preview/stock-footage-japanese-businessman-having-a-meeting-at-the-company.mp4,PT00H00M29S,069451_069500,Japanese businessman having a meeting at the company
2574317,https://ak.picdn.net/shutterstock/videos/2574317/preview/stock-footage-v-ttern-lake-sveden.mp4,PT00H00M11S,197951_198000,Vättern-lake sveden
16184680,https://ak.picdn.net/shutterstock/videos/16184680/preview/stock-footage-doctor-explaining-medical-procedure-to-senior-couple.mp4,PT00H00M19S,083801_083850,Doctor explaining medical procedure to senior couple
1742272,https://ak.picdn.net/shutterstock/videos/1742272/preview/stock-footage-loop-rotating-fasteners.mp4,PT00H00M14S,086251_086300,Loop rotating fasteners
1057978894,https://ak.picdn.net/shutterstock/videos/1057978894/preview/stock-footage-green-parrot-on-the-tree-in-k-slow-motion-fps.mp4,PT00H00M25S,127251_127300,Green parrot on the tree in 4k slow motion 60fps
16051129,https://ak.picdn.net/shutterstock/videos/16051129/preview/stock-footage-stirring-boiling-pasta-in-a-pot.mp4,PT00H00M16S,036851_036900,Stirring boiling pasta in a pot
10558742,https://ak.picdn.net/shutterstock/videos/10558742/preview/stock-footage-disco-spectrum-lights-concert-spot-bulb-abstract-motion-background-inred-colors-shining-lights.mp4,PT00H00M11S,079501_079550,"Disco spectrum lights concert spot bulb. abstract motion background inred colors, shining lights. bright flood lights flashing. seamless loop. more sets footage in my portfolio."
1044355714,https://ak.picdn.net/shutterstock/videos/1044355714/preview/stock-footage-a-man-holds-a-cross-in-his-hand-reveals-palm-with-a-mascot-religion-faith-in-god-and-prayer.mp4,PT00H00M12S,105301_105350,"A man holds a cross in his hand. reveals palm with a mascot. religion, faith in god and prayer."
13672277,https://ak.picdn.net/shutterstock/videos/13672277/preview/stock-footage-waves-on-the-beach.mp4,PT00H00M09S,195951_196000,Waves on the beach.
1037898530,https://ak.picdn.net/shutterstock/videos/1037898530/preview/stock-footage-indigenous-old-woman-applying-natural-medicine-to-the-eyes-of-a-young-indigenous-woman-in-the.mp4,PT00H00M19S,018101_018150,Indigenous old woman applying natural medicine to the eyes of a young indigenous woman in the amazon rainforest
1021020700,https://ak.picdn.net/shutterstock/videos/1021020700/preview/stock-footage-ants-formica-rufa-on-tree-bark-close-up-in-siberia-on-baikal-by-an-organized-work-team-overcomes.mp4,PT00H00M16S,121501_121550,Ants formica rufa on tree bark close-up in siberia on baikal by an organized work team overcomes difficulties complexities of wildlife in taiga. concept of insect life in wild nature and teamwork.
1006958470,https://ak.picdn.net/shutterstock/videos/1006958470/preview/stock-footage-child-building-castle-on-beach-at-sunset-girl-playing-sands-on-seaside-sea-k.mp4,PT00H00M17S,143951_144000,"Child building castle on beach at sunset, girl playing sands on seaside, sea 4k"
27021466,https://ak.picdn.net/shutterstock/videos/27021466/preview/stock-footage-field-of-wheat-barley-rye-harvesting-of-cereals-using-by-modern-agricultural-harvester-august.mp4,PT00H00M16S,194851_194900,"Field of wheat, barley, rye. harvesting of cereals using by modern agricultural harvester. august 2016. russia. hd"
1038906137,https://ak.picdn.net/shutterstock/videos/1038906137/preview/stock-footage-abstract-colorful-geometric-background-seamless-loop-liquid-gradient-shape-with-halftone-and-bokeh.mp4,PT00H00M16S,015801_015850,"Abstract colorful geometric background seamless loop. liquid gradient shape with halftone and bokeh effects. bright colour. 3d animation seamless loop. cute bright colors, perfect for presentation."
9018214,https://ak.picdn.net/shutterstock/videos/9018214/preview/stock-footage-couple-in-love-in-the-winter-on-the-beach-during-sunset-closeup.mp4,PT00H00M25S,075701_075750,Couple in love in the winter on the beach during sunset closeup
1011767270,https://ak.picdn.net/shutterstock/videos/1011767270/preview/stock-footage-oregon-circa-aerial-view-of-redmond-oregon-shot-from-helicopter-with-cineflex-gimbal-and.mp4,PT00H00M29S,192651_192700,"Oregon circa-2018. aerial view of redmond, oregon. shot from helicopter with cineflex gimbal and red epic-w camera."
1046984221,https://ak.picdn.net/shutterstock/videos/1046984221/preview/stock-footage-russia-moscow-september-interior-room-apartment-modern-bright-cozy-atmosphere-general.mp4,PT00H00M10S,181001_181050,"Russia, moscow- september 15, 2019: interior room apartment modern bright cozy atmosphere. general cleaning, home decoration, modern bathroom, sink, decoration elements, toilet"
1009763285,https://ak.picdn.net/shutterstock/videos/1009763285/preview/stock-footage-cat-playing-on-a-cushion-and-looking-up-and-down-beautiful-cat-looking-at-the-camera-very-funny.mp4,PT00H00M35S,022451_022500,Cat playing on a cushion and looking up and down. beautiful cat looking at the camera. very funny gray cat
1057373797,https://ak.picdn.net/shutterstock/videos/1057373797/preview/stock-footage-animated-cartoon-design-of-male-manager-falling-with-declining-arrows-on-the-blue-sky-shot-in-k.mp4,PT00H00M10S,196301_196350,Animated cartoon design of male manager falling with declining arrows on the blue sky. shot in 4k resolution
7192477,https://ak.picdn.net/shutterstock/videos/7192477/preview/stock-footage-heavenly-clouds-transition-background-religious-concept-backgrounds.mp4,PT00H00M20S,086101_086150,Heavenly clouds transition background - religious concept backgrounds
19384729,https://ak.picdn.net/shutterstock/videos/19384729/preview/stock-footage-hummingbird-feeding-in-slow-motion-shot-with-a-high-speed-camera.mp4,PT00H00M16S,131351_131400,Hummingbird feeding in slow motion. shot with a high speed camera.
1056596672,https://ak.picdn.net/shutterstock/videos/1056596672/preview/stock-footage--close-up-video-of-flowers-in-the-wind.mp4,PT00H00M13S,063201_063250,"
close-up video of flowers in the wind"
29533474,https://ak.picdn.net/shutterstock/videos/29533474/preview/stock-footage-black-and-white-monitor-screen-with-moving-lines.mp4,PT00H00M28S,192251_192300,Black and white  monitor screen with moving lines.
1035154886,https://ak.picdn.net/shutterstock/videos/1035154886/preview/stock-footage-double-exposure-business-man-using-tablet-over-business-district-business-man-using-a-tablet-over.mp4,PT00H00M14S,197301_197350,Double exposure business man using tablet over business district. business man using a tablet over a business district background with crowd. double exposure effect
14137295,https://ak.picdn.net/shutterstock/videos/14137295/preview/stock-footage-moscow-russia-january-marvel-studios-kids-department-store-marvel-studios-is-an.mp4,PT00H00M16S,193501_193550,"Moscow, russia - january 22, 2016: marvel studios kids department store. marvel studios is an american motion picture studio based at the walt disney studios. "
15220630,https://ak.picdn.net/shutterstock/videos/15220630/preview/stock-footage-fresh-quail-eggs-in-a-bowl-rotating.mp4,PT00H00M10S,190251_190300,Fresh quail eggs in a bowl rotating
8112406,https://ak.picdn.net/shutterstock/videos/8112406/preview/stock-footage-charlotte-north-carolina-usa-october-commerce-statue-of-prospector-in-independence.mp4,PT00H00M11S,028251_028300,"Charlotte, north carolina/usa - october 18, 2014: commerce statue of prospector in independence square. commerce is a sculpture representing the hope of successful continuation and growth for the city"
13185011,https://ak.picdn.net/shutterstock/videos/13185011/preview/stock-footage-circa-s-governor-scrugman-takes-an-aerial-trolley-over-the-hoover-dam-project.mp4,PT00H00M30S,184451_184500,Circa 1920s - governor scrugman takes an aerial trolley over the hoover dam project.
13589474,https://ak.picdn.net/shutterstock/videos/13589474/preview/stock-footage-grilled-burger-not-loopable.mp4,PT00H00M59S,044001_044050,Grilled burger (not loopable)
11471486,https://ak.picdn.net/shutterstock/videos/11471486/preview/stock-footage-time-lapse-footage-panorama-of-mountain-peak-with-fast-moving-clouds-in-the-sky-bulgarian-s.mp4,PT00H00M14S,002351_002400,"Time lapse footage. panorama of mountain peak with fast moving clouds in the sky. bulgarian`s sacred place - shipka peak. europe, balkan peninsula, central balkan range, bulgaria."
6336809,https://ak.picdn.net/shutterstock/videos/6336809/preview/stock-footage-spoon-stirring-tea-in-a-glass-in-slow-motion.mp4,PT00H00M15S,000351_000400,Spoon stirring tea in a glass in slow motion
1012623146,https://ak.picdn.net/shutterstock/videos/1012623146/preview/stock-footage-aerial-view-of-yacht-and-sailboat-on-paradise-bay-with-turquoise-crystal-clear-water-by-drone.mp4,PT00H00M06S,050501_050550,"Aerial view of yacht and sailboat on paradise bay with turquoise crystal clear water, by drone 2"
1050028930,https://ak.picdn.net/shutterstock/videos/1050028930/preview/stock-footage-kyiv-ukraine-march-medical-team-operating-in-surgery-room-medical-team-performing.mp4,PT00H00M17S,011551_011600,"Kyiv, ukraine - march 2020: medical team operating in surgery room. medical team performing surgical operation in modern operating room"
1023603040,https://ak.picdn.net/shutterstock/videos/1023603040/preview/stock-footage-pov-k-video-through-passenger-window-of-plane-taking-off-in-the-snow-at-denver.mp4,PT00H00M44S,074101_074150,Pov 4k video through passenger window of plane taking off in the snow at denver
18100999,https://ak.picdn.net/shutterstock/videos/18100999/preview/stock-footage-performing-laboratory-test-in-laboratory.mp4,PT00H00M16S,031801_031850,Performing laboratory test in laboratory
8709178,https://ak.picdn.net/shutterstock/videos/8709178/preview/stock-footage-woman-putting-spinach-into-bowl-in-kitchen-at-home-slow-motion-shot-at-fps.mp4,PT00H00M27S,122601_122650,"Woman putting spinach into bowl in kitchen at home, slow motion shot at 120fps
"
10974359,https://ak.picdn.net/shutterstock/videos/10974359/preview/stock-footage-strasbourg-france-march-the-main-square-of-strasbourg-france-on-march-place.mp4,PT00H00M17S,140001_140050,"Strasbourg, france - march 19, 2015: the main square of strasbourg, france on march 19. place kleber is famous for the cathedral and for its old houses.ultra hd 4k, real time"
32852626,https://ak.picdn.net/shutterstock/videos/32852626/preview/stock-footage-makeup-artist-making-make-up-for-a-beautiful-young-woman-at-home.mp4,PT00H00M05S,173601_173650,Makeup artist making make-up for a beautiful young woman at home 
1013548838,https://ak.picdn.net/shutterstock/videos/1013548838/preview/stock-footage-circa-alan-shepard-climbs-into-a-the-freedom-and-talks-about-his-confidence-in-the-mission.mp4,PT00H01M07S,066401_066450,Circa 1961 - alan shepard climbs into a the freedom 7 and talks about his confidence in the mission.
1062126484,https://ak.picdn.net/shutterstock/videos/1062126484/preview/stock-footage-.mp4,PT00H00M12S,108751_108800, 
1007495824,https://ak.picdn.net/shutterstock/videos/1007495824/preview/stock-footage-carpathians-romania-predeal-january-go-pro-shot-of-a-professional-snowboarder-on-the-ski.mp4,PT00H00M08S,050601_050650,"Carpathians, romania, predeal - january 2018 go pro shot of a professional snowboarder on the ski slope. foggy day in winter"
1031674490,https://ak.picdn.net/shutterstock/videos/1031674490/preview/stock-footage-close-up-of-a-beautiful-bouquet-of-flowers-beautiful-decoration-wonderful-light.mp4,PT00H00M08S,123801_123850,Close-up of a beautiful bouquet of flowers. beautiful decoration. wonderful light.
1046342554,https://ak.picdn.net/shutterstock/videos/1046342554/preview/stock-footage-bruges-belgium-slow-motion-push-in-of-busy-chocolate-store-in-bruges-belgium.mp4,PT00H00M09S,136001_136050,"Bruges / belgium - 12 17 2018: slow motion push in of busy chocolate store in bruges, belgium"
24849626,https://ak.picdn.net/shutterstock/videos/24849626/preview/stock-footage-crane-lifts-the-blades-to-wind-generator-aerial-view.mp4,PT00H00M08S,178101_178150,Crane lifts the blades to wind generator. aerial view.
1018010059,https://ak.picdn.net/shutterstock/videos/1018010059/preview/stock-footage-slow-motion-footage-of-wild-river-waterfall-going-into-lake.mp4,PT00H00M26S,060201_060250,Slow motion footage of wild river waterfall going into lake.
1023909475,https://ak.picdn.net/shutterstock/videos/1023909475/preview/stock-footage-video-shooting-process-an-operator-with-a-steadicam-shoots-a-story-about-a-family-mom-and-dad.mp4,PT00H00M11S,073801_073850,"Video shooting process. an operator with a steadicam shoots a story about a family, mom and dad with a little girl on a cozy home sofa, who chat among themselves"
1012983734,https://ak.picdn.net/shutterstock/videos/1012983734/preview/stock-footage-fancy-carp-or-koi-fish-swimming-and-beautiful-dancing-while-chinese-people-feeding-food-at-water.mp4,PT00H00M07S,019801_019850,"Fancy carp or koi fish swimming and beautiful dancing while chinese people feeding food at water pond in the garden of zhongshan park in shantou, china"
2517650,https://ak.picdn.net/shutterstock/videos/2517650/preview/stock-footage-women-kayaking-on-a-mountain-lake-at-sunrise-as-steam-rises-from-the-surface-of-the-water.mp4,PT00H00M11S,081001_081050,Women kayaking on a mountain lake at sunrise as steam rises from the surface of the water
5593304,https://ak.picdn.net/shutterstock/videos/5593304/preview/stock-footage-man-gardener-worker-cut-lawn-with-grass-cutter-mower-on-sunny-day.mp4,PT00H00M09S,042601_042650,Man gardener worker cut lawn with grass cutter mower on sunny day.
39027,https://ak.picdn.net/shutterstock/videos/39027/preview/stock-footage-coconut-palm-trees-under-a-clear-deep-blue-sky-in-the-philippines.mp4,PT00H00M16S,117601_117650,Coconut palm trees under a clear deep blue sky in the philippines
1033927178,https://ak.picdn.net/shutterstock/videos/1033927178/preview/stock-footage-machine-for-gluing-laminated-floor-panels-gluing-laminate-to-a-wooden-base-under-pressure-and-heat.mp4,PT00H00M07S,146001_146050,Machine for gluing laminated floor panels. gluing laminate to a wooden base under pressure and heat.
24121588,https://ak.picdn.net/shutterstock/videos/24121588/preview/stock-footage-sea-through-the-window-of-a-cave.mp4,PT00H00M26S,014651_014700,Sea through the window of a cave
1045349707,https://ak.picdn.net/shutterstock/videos/1045349707/preview/stock-footage-close-up-airplane-turbine-in-working-condition-before-takeoff-airport-jet.mp4,PT00H00M12S,061551_061600,Close-up airplane turbine in working condition before takeoff.airport. jet
27586546,https://ak.picdn.net/shutterstock/videos/27586546/preview/stock-footage-woman-hand-plug-wires-into-electricity-switch-and-money-banknotes-fall-on-floor-high-energy-needs.mp4,PT00H00M22S,139951_140000,Woman hand plug wires into electricity switch and money banknotes fall on floor. high energy needs and consumption concept.
2463407,https://ak.picdn.net/shutterstock/videos/2463407/preview/stock-footage-south-georgia-and-the-south-sandwich-islands-crowd-of-thousands-of-king-penguins-on-seashore.mp4,PT00H00M11S,038451_038500,"South georgia and the south sandwich islands: crowd of thousands of king penguins on seashore.
"
32302168,https://ak.picdn.net/shutterstock/videos/32302168/preview/stock-footage-the-runner-puts-on-the-hood-and-proceeds-to-run-the-girl-buttoned-up-on-the-jacket-put-the-hood.mp4,PT00H00M07S,039551_039600,"The runner puts on the hood and proceeds to run. the girl buttoned up on the jacket, put the hood on her head and started running."
1015745962,https://ak.picdn.net/shutterstock/videos/1015745962/preview/stock-footage-dubai-united-arab-emirates-may-pan-right-of-a-white-yacht-sailing-in-dubai-marina.mp4,PT00H00M09S,089601_089650,"Dubai, united arab emirates - may, 2016: pan right of a white yacht sailing in dubai marina"
16652863,https://ak.picdn.net/shutterstock/videos/16652863/preview/stock-footage-brunette-girl-in-black-business-clothing-stands-back-view-clip-with-transparent-background-file.mp4,PT00H00M30S,080951_081000,"Brunette girl in black business clothing stands. back view. clip with transparent background. file format - .mov, codec png+alpha"
12754511,https://ak.picdn.net/shutterstock/videos/12754511/preview/stock-footage-caucasian-blonde-female-woman-strokes-beautiful-hair-slow-motion.mp4,PT00H00M15S,116851_116900,"Caucasian blonde female woman strokes beautiful hair, slow motion "
1044807265,https://ak.picdn.net/shutterstock/videos/1044807265/preview/stock-footage-abstract-green-cyan-futuristic-sci-fi-plasma-circular-form-d-animation-of-shining-energy-force.mp4,PT00H00M18S,012501_012550,Abstract green cyan futuristic sci fi plasma circular form 3d animation of shining energy force field light strokes waving on a ring motion path for logo or text seamless 4k loop with alpha matte
32972218,https://ak.picdn.net/shutterstock/videos/32972218/preview/stock-footage-tracking-shot-of-senior-patient-talking-to-doctor-while-nurse-covering-his-legs-with-soft-blanket.mp4,PT00H00M18S,020201_020250,Tracking shot of senior patient talking to doctor while nurse covering his legs with soft blanket on hospital bed
1054765031,https://ak.picdn.net/shutterstock/videos/1054765031/preview/stock-footage-aerial-ws-landscape-with-pilgrimage-church-of-maria-hilf-and-village-speiden-near-eisenberg.mp4,PT00H00M21S,081251_081300,"Aerial ws landscape with pilgrimage church of maria hilf and village / speiden near eisenberg, allgaeu, upper bavaria, germany"
1025113238,https://ak.picdn.net/shutterstock/videos/1025113238/preview/stock-footage-from-the-glitch-effect-arises-text-small-then-the-tv-turns-off-alpha-channel-premultiplied.mp4,PT00H00M10S,095351_095400,From the glitch effect arises text small. then the tv turns off. alpha channel premultiplied - matted with color black
1030686743,https://ak.picdn.net/shutterstock/videos/1030686743/preview/stock-footage-aspen-united-states-april-drone-shot-of-scenic-landscape-of-the-rocky-mountains.mp4,PT00H00M22S,006551_006600,"Aspen, united states - april 19, 2019: drone shot of scenic landscape of the rocky mountains, forests and snowy back roads near aspen colorado"
31498231,https://ak.picdn.net/shutterstock/videos/31498231/preview/stock-footage-avocado-on-a-wooden-board.mp4,PT00H00M16S,094001_094050,Avocado on a wooden board.
21625657,https://ak.picdn.net/shutterstock/videos/21625657/preview/stock-footage-high-angle-of-hands-of-mother-touching-and-rubbing-feet-of-infant-baby-boy-lying-on-her-laps.mp4,PT00H00M26S,076151_076200,High angle of hands of mother touching and rubbing feet of infant baby boy lying on her laps
1052857649,https://ak.picdn.net/shutterstock/videos/1052857649/preview/stock-footage-manicurist-master-is-covering-painting-client-s-nails-shellac-hands-closeup-professional-manicure.mp4,PT00H00M11S,111601_111650,"Manicurist master is covering painting client's nails shellac, hands closeup. professional manicure in beauty salon. hygiene and care for hands. beauty industry concept"
1053776534,https://ak.picdn.net/shutterstock/videos/1053776534/preview/stock-footage-african-american-man-hold-banner-in-hand-black-lives-matter-justice-in-usa-revolution-in-city.mp4,PT00H00M07S,102551_102600,African american man hold banner in hand. black lives matter. justice in usa. revolution in city street. political rally.
1016469298,https://ak.picdn.net/shutterstock/videos/1016469298/preview/stock-footage-england-circa-pan-dongon-jail-hallway.mp4,PT00H00M13S,086901_086950,England - circa 2011: pan dongon jail hallway.
1033768679,https://ak.picdn.net/shutterstock/videos/1033768679/preview/stock-footage-super-slow-motion-of-coloured-powder-explosion-isolated-on-black-background-filmed-on-high-speed.mp4,PT00H00M17S,009651_009700,"Super slow motion of coloured powder explosion isolated on black background. filmed on high speed cinema camera, 1000fps."
7164958,https://ak.picdn.net/shutterstock/videos/7164958/preview/stock-footage-waterfall-in-mountains-in-slow-motion-high-speed-reel-super-slow-motion-dolly-shot.mp4,PT00H00M30S,031051_031100,"Waterfall in mountains in slow motion, high speed reel. super slow motion dolly shot."
1063737778,https://ak.picdn.net/shutterstock/videos/1063737778/preview/stock-footage-beautiful-cliff-at-phang-nga-bay.mp4,PT00H00M11S,035551_035600,Beautiful cliff at phang nga bay.
21970678,https://ak.picdn.net/shutterstock/videos/21970678/preview/stock-footage-depressed-looking-pill-bottle-and-pills.mp4,PT00H00M11S,041551_041600,Depressed looking pill bottle and pills 
1035840641,https://ak.picdn.net/shutterstock/videos/1035840641/preview/stock-footage-animation-of-boy-silhouette-holding-balloons-which-lift-him-up-into-a-beautiful-sky-with-sun-rays.mp4,PT00H00M30S,015251_015300,Animation of boy silhouette holding balloons which lift him up into a beautiful sky with sun-rays shining through the clouds.
1017669505,https://ak.picdn.net/shutterstock/videos/1017669505/preview/stock-footage-little-girl-standing-by-the-sea.mp4,PT00H00M18S,114251_114300,Little girl standing by the sea
13214606,https://ak.picdn.net/shutterstock/videos/13214606/preview/stock-footage-a-female-hiker-admires-the-dramatic-arches-national-park.mp4,PT00H00M18S,043351_043400,A female hiker admires the dramatic arches national park
