videoid,contentUrl,duration,page_dir,name
1024728701,https://ak.picdn.net/shutterstock/videos/1024728701/preview/stock-footage-trout-swims-in-the-pond-in-summer.mp4,PT00H00M18S,140551_140600,Trout swims in the pond in summer
25320245,https://ak.picdn.net/shutterstock/videos/25320245/preview/stock-footage-home-radiator-heating-system-for-home-plastic-pipes-fps.mp4,PT00H00M19S,101051_101100,"Home radiator. heating system for home, plastic pipes. 60fps. 
"
14769280,https://ak.picdn.net/shutterstock/videos/14769280/preview/stock-footage-iceland-nature-lake-myvatn-icelandic-landscape-northern-iceland-beautiful-calm-scenery-from.mp4,PT00H00M10S,107151_107200,"Iceland nature, lake myvatn icelandic landscape, northern iceland. beautiful calm scenery from famous landmark and tourist destination on north iceland."
1022499514,https://ak.picdn.net/shutterstock/videos/1022499514/preview/stock-footage-adult-sexy-woman-dancing-dance-in-an-intimate-setting-silhouette-of-a-sexy-woman-dancing-on-red.mp4,PT00H00M09S,112551_112600,Adult sexy woman dancing dance in an intimate setting. silhouette of a sexy woman dancing on red background. pole dance. pole dance from an old woman
1022998294,https://ak.picdn.net/shutterstock/videos/1022998294/preview/stock-footage-aerial-view-of-tropical-scenery-in-alyui-bay-raja-ampat-indonesia-this-biodiverse-remote-region.mp4,PT00H00M22S,179901_179950,"Aerial view of tropical scenery in alyui bay, raja ampat, indonesia. this biodiverse, remote region is known as the ""heart of the coral triangle"" due to its amazing marine life."
1026482783,https://ak.picdn.net/shutterstock/videos/1026482783/preview/stock-footage-young-couple-at-a-reception-with-a-psychologist.mp4,PT00H00M20S,121451_121500,Young couple at a reception with a psychologist.
7188880,https://ak.picdn.net/shutterstock/videos/7188880/preview/stock-footage-squirrel-looking-at-camera-and-wags-its-tail-animal-suited-to-the-girl-and-takes-from-her-nuts.mp4,PT00H00M17S,080101_080150,Squirrel looking at camera and wags its tail. animal suited to the girl and takes from her nuts
1041123499,https://ak.picdn.net/shutterstock/videos/1041123499/preview/stock-footage-a-teenage-girl-a-schoolgirl-in-a-knitted-hat-in-a-dark-turquoise-coat-with-glasses-and-a-school.mp4,PT00H00M38S,135751_135800,"A teenage girl, a schoolgirl in a knitted hat, in a dark turquoise coat, with glasses and a school bag in her hands, is walking home from school in the square on an autumn cloudy day. slow motion."
1013104115,https://ak.picdn.net/shutterstock/videos/1013104115/preview/stock-footage-tired-young-woman-trying-to-relax-body-by-stretching.mp4,PT00H00M17S,040301_040350,Tired young woman trying to relax body by stretching
1011709373,https://ak.picdn.net/shutterstock/videos/1011709373/preview/stock-footage-two-young-woman-artist-painting-at-home-studio-creative-tools-k.mp4,PT00H00M11S,086301_086350,Two young woman artist painting at home studio creative tools 4k
20292601,https://ak.picdn.net/shutterstock/videos/20292601/preview/stock-footage-couple-hugging-on-the-street-life-style-happy-love.mp4,PT00H00M37S,054401_054450,Couple hugging on the street. life style. happy love
6730477,https://ak.picdn.net/shutterstock/videos/6730477/preview/stock-footage-the-word-travel-and-a-turning-globe-in-front-of-a-blue-sky-with-tooth-pick-and-a-small-paper-flag.mp4,PT00H00M07S,193601_193650,The word travel and a turning globe  in front of a blue sky with tooth pick and a small paper flag of armenia
1022452861,https://ak.picdn.net/shutterstock/videos/1022452861/preview/stock-footage-looped-animation-on-a-green-background-animated-cup.mp4,PT00H00M05S,075801_075850,Looped animation on a green background. animated cup.
1047817801,https://ak.picdn.net/shutterstock/videos/1047817801/preview/stock-footage-loop-animation-of-photo-realistic-fabric-waving-flag-of-ghana-ultra-hd-k-ghana-national-flag.mp4,PT00H00M08S,115801_115850,Loop animation of photo realistic fabric waving flag of ghana ultra hd 4k ghana national flag
1024785161,https://ak.picdn.net/shutterstock/videos/1024785161/preview/stock-footage-euro-coins-in-human-hands-economy-concept.mp4,PT00H00M09S,111851_111900,Euro coins in human hands. economy concept.
1021466620,https://ak.picdn.net/shutterstock/videos/1021466620/preview/stock-footage-young-vegan-woman-choosing-carrots-in-grocery-store-organic-fruits-and-veggies-shopping-k-bali.mp4,PT00H00M07S,186151_186200,"Young vegan woman choosing carrots in grocery store. organic fruits and veggies shopping. 4k. bali, indonesia."
1035265715,https://ak.picdn.net/shutterstock/videos/1035265715/preview/stock-footage-barra-do-pira-rio-de-janeiro-brazil-people-browsing-and-shopping-at-an-open-air.mp4,PT00H00M29S,085651_085700,"Barra do piraí , rio de janeiro / brazil - 03 24 2019: people browsing and shopping at an open air market."
29260435,https://ak.picdn.net/shutterstock/videos/29260435/preview/stock-footage-aeiral-scene-samui-sea-thailand.mp4,PT00H00M19S,198551_198600,"Aeiral scene samui sea, thailand"
1018267789,https://ak.picdn.net/shutterstock/videos/1018267789/preview/stock-footage-a-white-swing-is-swinging-without-anybody-loneliness-moment-in-the-garden-there-s-some-shadow.mp4,PT00H00M06S,103501_103550,A white swing is swinging without anybody. loneliness moment in the garden. there's some shadow shade on the ground.
23056108,https://ak.picdn.net/shutterstock/videos/23056108/preview/stock-footage-three-female-designers-discussing-scetches-in-the-office.mp4,PT00H00M25S,058801_058850,Three female designers discussing scetches in the office
5138273,https://ak.picdn.net/shutterstock/videos/5138273/preview/stock-footage-students-food-is-falling-into-glass.mp4,PT00H00M30S,059501_059550,Students food is falling into glass
21125878,https://ak.picdn.net/shutterstock/videos/21125878/preview/stock-footage-ice-and-snow-lumps-on-the-irtysh-river-grey-autumn-landscape-sky-reflections-in-the-water.mp4,PT00H00M36S,109301_109350,Ice and snow lumps on the irtysh river. grey autumn landscape. sky reflections in the water. november 2016 omsk russia
1045176463,https://ak.picdn.net/shutterstock/videos/1045176463/preview/stock-footage-bucharest-romania-tracking-shot-of-airplane-performing-aerobatics-on-the-sky-at.mp4,PT00H00M12S,121201_121250,"Bucharest, romania - 08.15.2019: tracking shot of airplane performing aerobatics on the sky at airshow demonstration competition"
1036672325,https://ak.picdn.net/shutterstock/videos/1036672325/preview/stock-footage-wroclaw-poland-aug-couple-man-and-woman-clean-wash-their-dirty-pet-dog-animal-pouring.mp4,PT00H00M12S,195851_195900,"Wroclaw, poland - aug 15, 2019: couple man and woman clean wash their dirty pet dog animal pouring a water from bucket during walk in city park"
1052446243,https://ak.picdn.net/shutterstock/videos/1052446243/preview/stock-footage-slow-motion-panning-shot-of-heron-flying-over-plants-by-flamingos-in-sea-on-sunny-day-camargue.mp4,PT00H00M15S,185601_185650,"Slow motion panning shot of heron flying over plants by flamingos in sea on sunny day - camargue, france"
1055946665,https://ak.picdn.net/shutterstock/videos/1055946665/preview/stock-footage-omchak-russia-july-career-dump-truck-komatsu-e-goes-in-a-gold-mine.mp4,PT00H00M12S,184101_184150,"Omchak, russia - july 14, 2019. career dump truck komatsu 730e goes in a gold mine."
29249713,https://ak.picdn.net/shutterstock/videos/29249713/preview/stock-footage-easter-procession-in-quito-ecuador.mp4,PT00H00M17S,110101_110150,"Easter procession in quito, ecuador"
1036380971,https://ak.picdn.net/shutterstock/videos/1036380971/preview/stock-footage-someone-puts-a-branch-of-marcgravia-sintenisii-living-vine-on-the-table-the-leaves-of-the-plant.mp4,PT00H00M09S,175601_175650,"Someone puts a branch of marcgravia sintenisii living vine on the table. the leaves of the plant are colored red, yellow and green pigment from below too. human hand in the frame, real time, close-up."
17318743,https://ak.picdn.net/shutterstock/videos/17318743/preview/stock-footage-a-healthy-coral-reef-grows-in-the-clear-waters-of-raja-ampat-indonesia-this-remote-region-is-home.mp4,PT00H00M18S,019751_019800,"A healthy coral reef grows in the clear waters of raja ampat, indonesia. this remote region is home to a wide array of marine life and is a popular destination for adventurous divers and snorkelers."
1007742595,https://ak.picdn.net/shutterstock/videos/1007742595/preview/stock-footage-nervous-man-in-white-shirt-drinking-alcohol-working-at-computer-in-home-office-stress-fhd.mp4,PT00H00M15S,123501_123550,"Nervous man in white shirt drinking alcohol, working at computer in home office, stress fhd"
1038135521,https://ak.picdn.net/shutterstock/videos/1038135521/preview/stock-footage-drive-along-wonderful-wild-nature.mp4,PT00H00M18S,123801_123850,Drive along wonderful wild nature
32991292,https://ak.picdn.net/shutterstock/videos/32991292/preview/stock-footage-the-moon-at-night-apple-prores-hq.mp4,PT00H00M26S,127351_127400,The moon at night. apple prores 422 hq
25564640,https://ak.picdn.net/shutterstock/videos/25564640/preview/stock-footage-african-giant-snails-achatina-eat-green-cucumber.mp4,PT00H00M21S,020801_020850,African giant snails achatina eat green cucumber
34021687,https://ak.picdn.net/shutterstock/videos/34021687/preview/stock-footage-rain-drops-and-water-splashes-on-clean-white-background.mp4,PT00H00M30S,081901_081950,Rain drops and water splashes on clean white background
9908462,https://ak.picdn.net/shutterstock/videos/9908462/preview/stock-footage-doctor-doing-skin-test-to-her-patient-in-medical-office-healthcare-workers-in-the-coronavirus.mp4,PT00H00M13S,195651_195700,"Doctor doing skin test to her patient in medical office , healthcare workers in the coronavirus covid19 pandemic"
9706457,https://ak.picdn.net/shutterstock/videos/9706457/preview/stock-footage-beautiful-asian-girl-using-tablet-while-lying-on-bed.mp4,PT00H00M24S,006551_006600,Beautiful asian girl using tablet while lying on bed
8567137,https://ak.picdn.net/shutterstock/videos/8567137/preview/stock-footage-dubai-united-arab-emirates-december-dubai-shopping-festival-there-are-lots-of-people.mp4,PT00H00M17S,106501_106550,Dubai united arab emirates - 29 december 2014:  dubai shopping festival. there are lots of people walking around going to stores mall of emirates.
1007648053,https://ak.picdn.net/shutterstock/videos/1007648053/preview/stock-footage-olive-turtle-pacific-coast-of-guanacaste-on-the-ostional-beach-during-the-ocean-sunset.mp4,PT00H00M15S,199351_199400,Olive turtle (pacific coast of guanacaste) on the ostional beach during the ocean sunset
18956165,https://ak.picdn.net/shutterstock/videos/18956165/preview/stock-footage-china-hong-kong-october-shoppers-with-umbrellas-at-street-market-wan-chai-hong-kong-china.mp4,PT00H00M15S,198551_198600,"China, hong kong - october 2015: shoppers with umbrellas at street market; wan chai hong kong china"
1026900038,https://ak.picdn.net/shutterstock/videos/1026900038/preview/stock-footage-group-of-students-studying-in-classroom-of-college-university-people-listening-to-lecture-seminar.mp4,PT00H00M15S,118551_118600,"Group of students studying in classroom of college university, people listening to lecture seminar of teacher coach audience press conference presentation business seminar meeting training speaker 4 k"
7029574,https://ak.picdn.net/shutterstock/videos/7029574/preview/stock-footage-zombie-man-in-destroyed-ruined-house.mp4,PT00H00M16S,192901_192950,Zombie  man in  destroyed  ruined house
1065246151,https://ak.picdn.net/shutterstock/videos/1065246151/preview/stock-footage--s-office-man-sits-at-desks-and-speaks-to-young-man-hands-page-through-booklet-hand-takes.mp4,PT00H00M40S,079851_079900,1970s: office. man sits at desks and speaks to young man. hands page through booklet. hand takes notes.
1014454127,https://ak.picdn.net/shutterstock/videos/1014454127/preview/stock-footage-background-from-animated-paper-loop-animation.mp4,PT00H00M05S,081251_081300,Background from animated paper. loop animation.
33618415,https://ak.picdn.net/shutterstock/videos/33618415/preview/stock-footage-close-up-shot-of-sealing-up-tied-paper-bag-with-wax-vintage-style-package.mp4,PT00H00M18S,078801_078850,Close-up shot of sealing up tied paper bag with wax. vintage style package
12380045,https://ak.picdn.net/shutterstock/videos/12380045/preview/stock-footage-looped-tunnel-abstract-vj-creative-background-for-different-events-and-projects.mp4,PT00H00M10S,054201_054250,"Looped tunnel abstract vj creative background for different events and projects!!!
"
24281651,https://ak.picdn.net/shutterstock/videos/24281651/preview/stock-footage-closeup-camera-shows-large-blue-customs-building-with-clean-glass-modern-windows.mp4,PT00H00M11S,026001_026050,Closeup camera shows large blue customs building with clean glass modern windows
30928009,https://ak.picdn.net/shutterstock/videos/30928009/preview/stock-footage-ripe-fruits-of-rowan-on-tree.mp4,PT00H00M18S,001701_001750,Ripe fruits of rowan on tree
22529560,https://ak.picdn.net/shutterstock/videos/22529560/preview/stock-footage-italy-venice-july-saint-mary-of-the-rosary-boats-venice-italy.mp4,PT00H00M15S,121001_121050,"Italy, venice - july 2012: saint mary of the rosary & boats; venice italy"
1016029057,https://ak.picdn.net/shutterstock/videos/1016029057/preview/stock-footage-aerial-drone-footage-of-flooded-salt-marsh-this-salt-marsh-is-at-mersea-island-in-the-uk.mp4,PT00H00M29S,051201_051250,Aerial drone footage of flooded salt marsh. this salt marsh is at mersea island in the uk.
14471596,https://ak.picdn.net/shutterstock/videos/14471596/preview/stock-footage-lumberjack-stands-and-sharpens-his-ax-in-the-woods-light-leakage-surround-him.mp4,PT00H00M37S,025351_025400,"Lumberjack stands and sharpens his ax in the woods, light leakage surround him"
25429892,https://ak.picdn.net/shutterstock/videos/25429892/preview/stock-footage--k-aerial-shot-of-freeway-street-in-malaysia-with-people-cycling-and-car-traveling-and-mountain.mp4,PT00H00M19S,148001_148050,4k aerial shot of freeway street in malaysia with people cycling and car traveling and mountain forest view.
31977052,https://ak.picdn.net/shutterstock/videos/31977052/preview/stock-footage-tricolored-heron-turns-head.mp4,PT00H00M12S,174151_174200,Tricolored heron turns head
9159311,https://ak.picdn.net/shutterstock/videos/9159311/preview/stock-footage-funny-little-girl-flattening-the-dough-and-cooking-dumplings-with-meat.mp4,PT00H00M29S,118301_118350,Funny little girl flattening the dough and cooking dumplings with meat.
1059071411,https://ak.picdn.net/shutterstock/videos/1059071411/preview/stock-footage--the-barista-was-pouring-fresh-milk-into-a-cup-of-ice-and-coffee-on-a-wooden-table-in-the-coffee.mp4,PT00H00M25S,032001_032050,"
the barista was pouring fresh milk into a cup of ice and coffee on a wooden table in the coffee shop."
24282536,https://ak.picdn.net/shutterstock/videos/24282536/preview/stock-footage-ukraine-waving-flag-d-man-holding-and-waving-ukrainian-flag-loop-png-alpha-channel.mp4,PT00H00M12S,107651_107700,Ukraine waving flag. 3d man holding and waving ukrainian flag. loop. png alpha channel.
29913748,https://ak.picdn.net/shutterstock/videos/29913748/preview/stock-footage-church-of-holy-spirit-peter-and-paul-church-greek-catholic-church-in-minsk-belarus-built-in.mp4,PT00H00M05S,105101_105150,"Church of holy spirit (peter and paul church) - greek catholic church in minsk, belarus, built in xvii century. was in high market."
1015651801,https://ak.picdn.net/shutterstock/videos/1015651801/preview/stock-footage-abu-dhabi-united-arab-emirates-april-traffic-in-abu-dhabi.mp4,PT00H00M23S,087151_087200,"Abu dhabi, united arab emirates - april, 2016: traffic in abu dhabi"
1040813684,https://ak.picdn.net/shutterstock/videos/1040813684/preview/stock-footage-medan-zoo-indonesia-november-the-black-crowned-night-heron.mp4,PT00H00M10S,088551_088600,"Medan zoo, indonesia - november 03, 2019. the black-crowned night heron."
1034156723,https://ak.picdn.net/shutterstock/videos/1034156723/preview/stock-footage-the-creek-among-the-rocks-in-the-center-of-tbilisi.mp4,PT00H00M12S,026351_026400,The creek among the rocks in the center of tbilisi.
4490453,https://ak.picdn.net/shutterstock/videos/4490453/preview/stock-footage-romantic-young-people-holding-hands-walking-out-in-the-fields.mp4,PT00H00M25S,149701_149750,Romantic young people holding hands walking out in the fields
32133286,https://ak.picdn.net/shutterstock/videos/32133286/preview/stock-footage-happ-child-riding-a-bike-on-the-road-on-a-sunny-day-mountains-background.mp4,PT00H00M14S,000101_000150,"Happ child riding a bike on the road on a sunny day, mountains background"
1011556223,https://ak.picdn.net/shutterstock/videos/1011556223/preview/stock-footage-a-team-of-young-asian-adults-running-on-top-of-stadium-stand.mp4,PT00H00M09S,060051_060100,A team of young asian adults running on top of stadium stand.
1481968,https://ak.picdn.net/shutterstock/videos/1481968/preview/stock-footage-giraffes-stick-their-heads-into-the-windows-of-an-old-mansion-in-africa-and-eat-off-the-dining-room.mp4,PT00H00M06S,115051_115100,Giraffes stick their heads into the windows of an old mansion in africa and eat off the dining room table.
1362448,https://ak.picdn.net/shutterstock/videos/1362448/preview/stock-footage-timelapse-footage-of-highway-in-chicago.mp4,PT00H00M10S,077251_077300,Timelapse footage of highway in chicago
16015492,https://ak.picdn.net/shutterstock/videos/16015492/preview/stock-footage-man-fixing-the-drawer-in-the-kitchen.mp4,PT00H00M13S,087351_087400,Man fixing the drawer in the kitchen
1020013372,https://ak.picdn.net/shutterstock/videos/1020013372/preview/stock-footage-cityscape-of-wellington-new-zealand-at-night-bright-city-lights-shining-light-on-low-flying.mp4,PT00H00M21S,004601_004650,"Cityscape of wellington, new zealand, at night. bright city lights shining light on low flying clouds. timelapse video."
21613441,https://ak.picdn.net/shutterstock/videos/21613441/preview/stock-footage-black-sport-car-on-road-highway-very-fast-driving-wonderful-sunrise-super-realistic-k.mp4,PT00H00M19S,057201_057250,"Black sport car on road, highway. very fast driving. wonderful sunrise. super realistic 4k animation."
1040734220,https://ak.picdn.net/shutterstock/videos/1040734220/preview/stock-footage-sacramento-ca-usa-housewife-buying-a-box-of-cheerios-brand-whole-grain-oats-cereals-at.mp4,PT00H00M06S,025151_025200,"Sacramento, ca/usa 11/4/2019 housewife buying a box of cheerios brand whole grain oats  cereals at a supermarket aisle"
10184063,https://ak.picdn.net/shutterstock/videos/10184063/preview/stock-footage-tourist-schooner-anchored-at-lagoa-verde-angra-dos-reis-rio-de-janeiro-brazil.mp4,PT00H00M06S,060101_060150,"Tourist schooner anchored at lagoa verde, angra dos reis, rio de janeiro, brazil."
31102654,https://ak.picdn.net/shutterstock/videos/31102654/preview/stock-footage-cooked-couscous-with-vegetables-tasty-north-african-moroccan-semolina.mp4,PT00H00M30S,173601_173650,Cooked couscous with vegetables tasty north african moroccan semolina
1599946,https://ak.picdn.net/shutterstock/videos/1599946/preview/stock-footage-autumn-leaf-in-the-water-the-style-of-oil-painting.mp4,PT00H00M20S,196701_196750,Autumn leaf in the water. the style of oil painting
1024447610,https://ak.picdn.net/shutterstock/videos/1024447610/preview/stock-footage-young-women-with-pedicure.mp4,PT00H00M21S,009701_009750,Young women with pedicure
23205403,https://ak.picdn.net/shutterstock/videos/23205403/preview/stock-footage-kiev-jan-car-security-near-multifunctional-complex-gulliver-on-january-in-kiev.mp4,PT00H00M07S,149451_149500,"Kiev - jan 14: car security near multifunctional complex gulliver on january 14,2017 in kiev,ukraine.it was build during august 2003-november 2013 and has 35 floors with total floor area 150,000sq.m. "
16855027,https://ak.picdn.net/shutterstock/videos/16855027/preview/stock-footage-two-hands-working-with-a-sewing-machine-sewing-machine.mp4,PT00H00M16S,001151_001200,Two hands working with a sewing machine./sewing machine
12776834,https://ak.picdn.net/shutterstock/videos/12776834/preview/stock-footage-female-listening-to-music-in-headphones-and-male-using-a-tablet-in-bed.mp4,PT00H00M08S,144101_144150,Female listening to music in headphones and male using a tablet in bed
2997559,https://ak.picdn.net/shutterstock/videos/2997559/preview/stock-footage-pal-motion-abstract-film-leader-forms-flicker-and-pulse-loop.mp4,PT00H00M18S,174201_174250,Pal - motion 458: abstract film leader forms flicker and pulse (loop).
1010530100,https://ak.picdn.net/shutterstock/videos/1010530100/preview/stock-footage-businessmen-or-politicians-shake-hands-against-flags-of-united-nations-and-qatar-official-meeting.mp4,PT00H00M05S,035501_035550,Businessmen or politicians shake hands against flags of united nations and qatar. official meeting or cooperation related editorial animation
1018768105,https://ak.picdn.net/shutterstock/videos/1018768105/preview/stock-footage-paging-through-burmese-passport-myanmar.mp4,PT00H00M16S,050551_050600,"Paging through burmese passport, myanmar "
1037055932,https://ak.picdn.net/shutterstock/videos/1037055932/preview/stock-footage-multicolored-kaleidoscope-sequence-patterns-for-exhibition-led-screens-projection-mapping.mp4,PT00H00M19S,103101_103150,"Multicolored kaleidoscope sequence patterns for exhibition, led screens, projection mapping, concert, night club, music video, events, and show."
1059662018,https://ak.picdn.net/shutterstock/videos/1059662018/preview/stock-footage-abstract-dark-grey-green-low-poly-motion-background-with-added-blur-looping-k-technology.mp4,PT00H00M19S,125201_125250,"Abstract dark grey green low poly motion background with added blur. looping, 4k technology background animation."
1062061933,https://ak.picdn.net/shutterstock/videos/1062061933/preview/stock-footage-circa-s-after-lessons-learned-during-previous-operations-parachute-infantry-take-part-in-a.mp4,PT00H00M30S,072651_072700,Circa 1940s - after lessons learned during previous operations parachute infantry take part in a highly successful landing.
1024337534,https://ak.picdn.net/shutterstock/videos/1024337534/preview/stock-footage-a-big-dog-sitting-and-looking-down-the-mountain.mp4,PT00H00M23S,020801_020850,A big dog sitting and looking down the mountain
31098214,https://ak.picdn.net/shutterstock/videos/31098214/preview/stock-footage-flowers-in-the-snow.mp4,PT00H00M29S,170351_170400,Flowers in the snow
1048871116,https://ak.picdn.net/shutterstock/videos/1048871116/preview/stock-footage-slow-motion-raindrops-falling-on-leaves.mp4,PT00H00M30S,068851_068900,Slow motion raindrops falling on leaves
1053099428,https://ak.picdn.net/shutterstock/videos/1053099428/preview/stock-footage-hens-of-gray-and-yellow-brick-color-sit-on-rubber-and-walk-around-the-yard.mp4,PT00H00M23S,030301_030350,Hens of gray and yellow brick color sit on rubber and walk around the yard
4675040,https://ak.picdn.net/shutterstock/videos/4675040/preview/stock-footage--d-dracula-animation.mp4,PT00H00M10S,021351_021400,3d dracula animation
1022720686,https://ak.picdn.net/shutterstock/videos/1022720686/preview/stock-footage-wooden-sunbed-on-tropical-beach-in-the-maldives-at-summer-day.mp4,PT00H00M12S,070101_070150,Wooden sunbed on tropical beach in the maldives at summer day
1023677683,https://ak.picdn.net/shutterstock/videos/1023677683/preview/stock-footage-user-interface-elements-hud-elements-radial-shape-animation-technology-elements.mp4,PT00H00M20S,120651_120700,User interface elements....hud elements ..radial shape animation..technology elements
1035637694,https://ak.picdn.net/shutterstock/videos/1035637694/preview/stock-footage-small-waterfall-found-in-the-forest.mp4,PT00H00M16S,122251_122300,Small waterfall found in the forest.
22616005,https://ak.picdn.net/shutterstock/videos/22616005/preview/stock-footage-close-up-of-two-cocktail-glasses-in-the-bar.mp4,PT00H00M17S,040301_040350,Close up of two cocktail glasses  in the bar
1058953763,https://ak.picdn.net/shutterstock/videos/1058953763/preview/stock-footage-girl-in-airport-pandemic-and-travel-woman-in-mask-waiting-in-airport.mp4,PT00H00M10S,124101_124150,Girl in airport. pandemic and travel. woman in mask waiting in airport.
14692144,https://ak.picdn.net/shutterstock/videos/14692144/preview/stock-footage-caabiya-israel-february-firefighter-from-northern-israel-fire-brigade-detach-a-door.mp4,PT00H00M13S,112751_112800,"Caabiya, israel - february 10, 2016: firefighter from northern israel fire brigade detach a door from a crashed car during drill, to increase awareness of arab kids to risks of fire"
1043334775,https://ak.picdn.net/shutterstock/videos/1043334775/preview/stock-footage-paradise-island-aerial-view-of-beautiful-mala-mala-island-fiji-pacific-ocean-drone-shot.mp4,PT00H00M31S,146301_146350,"Paradise island. aerial view of beautiful mala mala island, fiji, pacific ocean. drone shot."
10733984,https://ak.picdn.net/shutterstock/videos/10733984/preview/stock-footage-sad-old-people-portrait-with-emotions-and-feelings-worried-white-senior-woman-looking-at-camera.mp4,PT00H00M10S,057151_057200,"Sad old people portrait with emotions and feelings. worried white senior woman looking at camera with depressed expression on face. active retired elderly grandmother. cropped view, copy space"
1023809776,https://ak.picdn.net/shutterstock/videos/1023809776/preview/stock-footage-animation-icon-or-emblem-of-japanese-yen-logo-background-made-of-glow-particles-as-vitrtual.mp4,PT00H00M10S,190801_190850,"Animation icon or emblem of japanese yen logo. background made of glow particles as vitrtual hologram. shiny 3d loop animation with depth of field, bokeh and copy space. violet 6"
